aiter/configs/a8w8_blockscale_tuned_gemm.csv
cu_num,M,N,K,libtype,kernelId,splitK,us,kernelName,tflops,bw,errRatio
256,1,256,2048,ck,8,3,4.2912,a8w8_blockscale_1x128x128_256x16x64x256_16x16_16x16_1x1_16x16x1_16x16x1_1x16x1x16_4_1x1_intrawave_v1,0.24,122.77,0.0
256,2,256,2048,ck,8,2,4.4461,a8w8_blockscale_1x128x128_256x16x64x256_16x16_16x16_1x1_16x16x1_16x16x1_1x16x1x16_4_1x1_intrawave_v1,0.47,119.07,0.0
256,4,256,2048,ck,8,3,4.3112,a8w8_blockscale_1x128x128_256x16x64x256_16x16_16x16_1x1_16x16x1_16x16x1_1x16x1x16_4_1x1_intrawave_v1,0.97,123.99,0.0
256,8,256,2048,ck,13,3,3.6215,a8w8_blockscale_1x128x128_256x32x64x256_16x16_16x16_2x1_16x16x1_16x16x1_1x32x1x8_8_2x1_intrawave_v1,2.32,150.43,0.0
256,16,256,2048,ck,6,3,4.6459,a8w8_blockscale_1x128x128_256x16x64x128_8x16_16x16_1x1_16x16x1_8x32x1_1x16x1x16_4_1x1_intrawave_v1,3.61,121.67,0.0
256,32,256,2048,ck,6,3,4.7597,a8w8_blockscale_1x128x128_256x16x64x128_8x16_16x16_1x1_16x16x1_8x32x1_1x16x1x16_4_1x1_intrawave_v1,7.05,127.36,0.0
256,48,256,2048,ck,8,3,5.2388,a8w8_blockscale_1x128x128_256x16x64x256_16x16_16x16_1x1_16x16x1_16x16x1_1x16x1x16_4_1x1_intrawave_v1,9.61,123.53,0.0
256,64,256,2048,ck,8,3,4.9754,a8w8_blockscale_1x128x128_256x16x64x256_16x16_16x16_1x1_16x16x1_16x16x1_1x16x1x16_4_1x1_intrawave_v1,13.49,138.31,0.0
256,80,256,2048,ck,6,3,5.2009,a8w8_blockscale_1x128x128_256x16x64x128_8x16_16x16_1x1_16x16x1_8x32x1_1x16x1x16_4_1x1_intrawave_v1,16.13,140.18,0.0
256,96,256,2048,ck,8,2,5.2268,a8w8_blockscale_1x128x128_256x16x64x256_16x16_16x16_1x1_16x16x1_16x16x1_1x16x1x16_4_1x1_intrawave_v1,19.26,147.33,0.0
256,112,256,2048,ck,8,2,5.1404,a8w8_blockscale_1x128x128_256x16x64x256_16x16_16x16_1x1_16x16x1_16x16x1_1x16x1x16_4_1x1_intrawave_v1,22.85,157.77,0.0
256,128,256,2048,ck,8,2,5.048,a8w8_blockscale_1x128x128_256x16x64x256_16x16_16x16_1x1_16x16x1_16x16x1_1x16x1x16_4_1x1_intrawave_v1,26.59,168.77,0.0
256,256,256,2048,ck,6,2,6.3181,a8w8_blockscale_1x128x128_256x16x64x128_8x16_16x16_1x1_16x16x1_8x32x1_1x16x1x16_4_1x1_intrawave_v1,42.49,186.71,0.0
256,512,256,2048,ck,8,2,7.148,a8w8_blockscale_1x128x128_256x16x64x256_16x16_16x16_1x1_16x16x1_16x16x1_1x16x1x16_4_1x1_intrawave_v1,75.11,256.72,0.0
256,588,256,2048,ck,8,2,7.3466,a8w8_blockscale_1x128x128_256x16x64x256_16x16_16x16_1x1_16x16x1_16x16x1_1x16x1x16_4_1x1_intrawave_v1,83.92,276.26,0.0
256,773,256,2048,ck,8,0,7.685,a8w8_blockscale_1x128x128_256x16x64x256_16x16_16x16_1x1_16x16x1_16x16x1_1x16x1x16_4_1x1_intrawave_v1,105.47,325.72,0.0
256,822,256,2048,ck,8,0,7.8964,a8w8_blockscale_1x128x128_256x16x64x256_16x16_16x16_1x1_16x16x1_16x16x1_1x16x1x16_4_1x1_intrawave_v1,109.15,332.89,0.0
256,1024,256,2048,ck,8,0,8.3751,a8w8_blockscale_1x128x128_256x16x64x256_16x16_16x16_1x1_16x16x1_16x16x1_1x16x1x16_4_1x1_intrawave_v1,128.21,375.6,0.0
256,1025,256,2048,ck,8,2,9.4456,a8w8_blockscale_1x128x128_256x16x64x256_16x16_16x16_1x1_16x16x1_16x16x1_1x16x1x16_4_1x1_intrawave_v1,113.79,333.31,0.0
256,1027,256,2048,ck,8,2,8.7894,a8w8_blockscale_1x128x128_256x16x64x256_16x16_16x16_1x1_16x16x1_16x16x1_1x16x1x16_4_1x1_intrawave_v1,122.52,358.77,0.0
256,1042,256,2048,ck,8,2,8.6262,a8w8_blockscale_1x128x128_256x16x64x256_16x16_16x16_1x1_16x16x1_16x16x1_1x16x1x16_4_1x1_intrawave_v1,126.66,370.01,0.0
256,1051,256,2048,ck,8,2,8.9785,a8w8_blockscale_1x128x128_256x16x64x256_16x16_16x16_1x1_16x16x1_16x16x1_1x16x1x16_4_1x1_intrawave_v1,122.74,358.06,0.0
256,1055,256,2048,ck,8,2,8.7007,a8w8_blockscale_1x128x128_256x16x64x256_16x16_16x16_1x1_16x16x1_16x16x1_1x16x1x16_4_1x1_intrawave_v1,127.14,370.67,0.0
256,1057,256,2048,ck,8,2,8.9108,a8w8_blockscale_1x128x128_256x16x64x256_16x16_16x16_1x1_16x16x1_16x16x1_1x16x1x16_4_1x1_intrawave_v1,124.38,362.5,0.0
256,1069,256,2048,ck,7,0,9.5141,a8w8_blockscale_1x128x128_256x16x128x256_16x16_16x16_1x2_16x16x1_16x16x1_1x16x1x16_8_1x2_intrawave_v1,117.82,342.75,0.0
256,1072,256,2048,ck,7,0,9.3341,a8w8_blockscale_1x128x128_256x16x128x256_16x16_16x16_1x2_16x16x1_16x16x1_1x16x1x16_8_1x2_intrawave_v1,120.43,350.18,0.0
256,1074,256,2048,ck,7,0,9.3587,a8w8_blockscale_1x128x128_256x16x128x256_16x16_16x16_1x2_16x16x1_16x16x1_1x16x1x16_8_1x2_intrawave_v1,120.33,349.81,0.0
256,1091,256,2048,ck,7,0,10.0154,a8w8_blockscale_1x128x128_256x16x128x256_16x16_16x16_1x2_16x16x1_16x16x1_1x16x1x16_8_1x2_intrawave_v1,114.22,331.21,0.0
256,1128,256,2048,ck,13,0,10.0337,a8w8_blockscale_1x128x128_256x32x64x256_16x16_16x16_2x1_16x16x1_16x16x1_1x32x1x8_8_2x1_intrawave_v1,117.88,340.05,0.0
256,1136,256,2048,ck,13,0,9.5907,a8w8_blockscale_1x128x128_256x32x64x256_16x16_16x16_2x1_16x16x1_16x16x1_1x32x1x8_8_2x1_intrawave_v1,124.2,357.89,0.0
256,1514,256,2048,ck,7,0,9.6138,a8w8_blockscale_1x128x128_256x16x128x256_16x16_16x16_1x2_16x16x1_16x16x1_1x16x1x16_8_1x2_intrawave_v1,165.13,457.69,0.0
256,2017,256,2048,ck,7,0,9.9389,a8w8_blockscale_1x128x128_256x16x128x256_16x16_16x16_1x2_16x16x1_16x16x1_1x16x1x16_8_1x2_intrawave_v1,212.8,572.28,0.0
256,2048,256,2048,ck,7,0,10.1773,a8w8_blockscale_1x128x128_256x16x128x256_16x16_16x16_1x2_16x16x1_16x16x1_1x16x1x16_8_1x2_intrawave_v1,211.01,566.67,0.0
256,2151,256,2048,ck,18,0,11.0807,a8w8_blockscale_1x128x128_256x64x64x256_16x16_32x32_1x1_16x16x1_16x16x1_1x32x1x8_8_1x1_intrawave_v1,203.55,544.27,0.0
256,2332,256,2048,ck,18,0,11.0366,a8w8_blockscale_1x128x128_256x64x64x256_16x16_32x32_1x1_16x16x1_16x16x1_1x32x1x8_8_1x1_intrawave_v1,221.56,588.42,0.0
256,2341,256,2048,ck,18,0,11.8786,a8w8_blockscale_1x128x128_256x64x64x256_16x16_32x32_1x1_16x16x1_16x16x1_1x32x1x8_8_1x1_intrawave_v1,206.65,548.65,0.0
256,3072,256,2048,ck,18,0,10.3863,a8w8_blockscale_1x128x128_256x64x64x256_16x16_32x32_1x1_16x16x1_16x16x1_1x32x1x8_8_1x1_intrawave_v1,310.14,807.66,0.0
256,3073,256,2048,ck,18,0,11.4779,a8w8_blockscale_1x128x128_256x64x64x256_16x16_32x32_1x1_16x16x1_16x16x1_1x32x1x8_8_1x1_intrawave_v1,280.74,731.07,0.0
256,3089,256,2048,ck,18,0,11.4011,a8w8_blockscale_1x128x128_256x64x64x256_16x16_32x32_1x1_16x16x1_16x16x1_1x32x1x8_8_1x1_intrawave_v1,284.1,739.59,0.0
256,3110,256,2048,ck,18,0,11.6787,a8w8_blockscale_1x128x128_256x64x64x256_16x16_32x32_1x1_16x16x1_16x16x1_1x32x1x8_8_1x1_intrawave_v1,279.23,726.61,0.0
256,3137,256,2048,ck,18,0,11.4133,a8w8_blockscale_1x128x128_256x64x64x256_16x16_32x32_1x1_16x16x1_16x16x1_1x32x1x8_8_1x1_intrawave_v1,288.21,749.56,0.0
256,3613,256,2048,ck,18,0,12.5871,a8w8_blockscale_1x128x128_256x64x64x256_16x16_32x32_1x1_16x16x1_16x16x1_1x32x1x8_8_1x1_intrawave_v1,300.98,776.47,0.0
256,4096,256,2048,ck,18,0,11.0141,a8w8_blockscale_1x128x128_256x64x64x256_16x16_32x32_1x1_16x16x1_16x16x1_1x32x1x8_8_1x1_intrawave_v1,389.95,999.63,0.0
256,4097,256,2048,ck,2,0,15.4549,a8w8_blockscale_1x128x128_256x64x128x128_16x16_32x32_1x2_8x32x1_8x32x1_1x32x1x8_8_1x1_intrawave_v3,277.97,712.56,0.0
256,4109,256,2048,ck,3,0,15.4093,a8w8_blockscale_1x128x128_256x64x64x128_16x16_32x32_1x1_8x32x1_8x32x1_1x32x1x8_8_1x1_intrawave_v3,279.61,716.67,0.0
256,4143,256,2048,ck,3,0,15.4366,a8w8_blockscale_1x128x128_256x64x64x128_16x16_32x32_1x1_8x32x1_8x32x1_1x32x1x8_8_1x1_intrawave_v3,281.43,721.04,0.0
256,4345,256,2048,ck,2,0,15.3698,a8w8_blockscale_1x128x128_256x64x128x128_16x16_32x32_1x2_8x32x1_8x32x1_1x32x1x8_8_1x1_intrawave_v3,296.43,757.82,0.0
256,4413,256,2048,ck,2,0,15.5044,a8w8_blockscale_1x128x128_256x64x128x128_16x16_32x32_1x2_8x32x1_8x32x1_1x32x1x8_8_1x1_intrawave_v3,298.46,762.47,0.0
256,5121,256,2048,ck,2,0,15.4334,a8w8_blockscale_1x128x128_256x64x128x128_16x16_32x32_1x2_8x32x1_8x32x1_1x32x1x8_8_1x1_intrawave_v3,347.93,883.41,0.0
256,5123,256,2048,ck,2,0,15.3734,a8w8_blockscale_1x128x128_256x64x128x128_16x16_32x32_1x2_8x32x1_8x32x1_1x32x1x8_8_1x1_intrawave_v3,349.43,887.19,0.0
256,5133,256,2048,ck,2,0,15.4131,a8w8_blockscale_1x128x128_256x64x128x128_16x16_32x32_1x2_8x32x1_8x32x1_1x32x1x8_8_1x1_intrawave_v3,349.21,886.57,0.0
256,5185,256,2048,ck,2,0,15.3502,a8w8_blockscale_1x128x128_256x64x128x128_16x16_32x32_1x2_8x32x1_8x32x1_1x32x1x8_8_1x1_intrawave_v3,354.19,898.87,0.0
256,5191,256,2048,ck,2,0,15.8115,a8w8_blockscale_1x128x128_256x64x128x128_16x16_32x32_1x2_8x32x1_8x32x1_1x32x1x8_8_1x1_intrawave_v3,344.25,873.62,0.0
256,6146,256,2048,ck,2,0,15.4309,a8w8_blockscale_1x128x128_256x64x128x128_16x16_32x32_1x2_8x32x1_8x32x1_1x32x1x8_8_1x1_intrawave_v3,417.64,1053.6,0.0
256,6147,256,2048,ck,2,0,16.1616,a8w8_blockscale_1x128x128_256x64x128x128_16x16_32x32_1x2_8x32x1_8x32x1_1x32x1x8_8_1x1_intrawave_v3,398.82,1006.13,0.0
256,6155,256,2048,ck,2,0,16.3284,a8w8_blockscale_1x128x128_256x64x128x128_16x16_32x32_1x2_8x32x1_8x32x1_1x32x1x8_8_1x1_intrawave_v3,395.26,997.1,0.0
256,6377,256,2048,ck,2,0,15.685,a8w8_blockscale_1x128x128_256x64x128x128_16x16_32x32_1x2_8x32x1_8x32x1_1x32x1x8_8_1x1_intrawave_v3,426.32,1074.24,0.0
256,6401,256,2048,ck,2,0,15.4599,a8w8_blockscale_1x128x128_256x64x128x128_16x16_32x32_1x2_8x32x1_8x32x1_1x32x1x8_8_1x1_intrawave_v3,434.15,1093.85,0.0
256,7121,256,2048,ck,2,0,15.7582,a8w8_blockscale_1x128x128_256x64x128x128_16x16_32x32_1x2_8x32x1_8x32x1_1x32x1x8_8_1x1_intrawave_v3,473.84,1190.11,0.0
256,7169,256,2048,ck,2,0,15.602,a8w8_blockscale_1x128x128_256x64x128x128_16x16_32x32_1x2_8x32x1_8x32x1_1x32x1x8_8_1x1_intrawave_v3,481.81,1209.9,0.0
256,7170,256,2048,ck,2,0,16.5936,a8w8_blockscale_1x128x128_256x64x128x128_16x16_32x32_1x2_8x32x1_8x32x1_1x32x1x8_8_1x1_intrawave_v3,453.08,1137.76,0.0
256,7176,256,2048,ck,2,0,15.7668,a8w8_blockscale_1x128x128_256x64x128x128_16x16_32x32_1x2_8x32x1_8x32x1_1x32x1x8_8_1x1_intrawave_v3,477.24,1198.39,0.0
256,7177,256,2048,ck,2,0,15.7667,a8w8_blockscale_1x128x128_256x64x128x128_16x16_32x32_1x2_8x32x1_8x32x1_1x32x1x8_8_1x1_intrawave_v3,477.31,1198.56,0.0
256,7185,256,2048,ck,2,0,16.444,a8w8_blockscale_1x128x128_256x64x128x128_16x16_32x32_1x2_8x32x1_8x32x1_1x32x1x8_8_1x1_intrawave_v3,458.16,1150.44,0.0
256,7206,256,2048,ck,2,0,16.5581,a8w8_blockscale_1x128x128_256x64x128x128_16x16_32x32_1x2_8x32x1_8x32x1_1x32x1x8_8_1x1_intrawave_v3,456.33,1145.76,0.0
256,7217,256,2048,ck,2,0,15.7829,a8w8_blockscale_1x128x128_256x64x128x128_16x16_32x32_1x2_8x32x1_8x32x1_1x32x1x8_8_1x1_intrawave_v3,479.48,1203.82,0.0
256,7257,256,2048,ck,2,0,16.2097,a8w8_blockscale_1x128x128_256x64x128x128_16x16_32x32_1x2_8x32x1_8x32x1_1x32x1x8_8_1x1_intrawave_v3,469.44,1178.44,0.0
256,7265,256,2048,ck,2,0,15.7343,a8w8_blockscale_1x128x128_256x64x128x128_16x16_32x32_1x2_8x32x1_8x32x1_1x32x1x8_8_1x1_intrawave_v3,484.16,1215.35,0.0
256,7393,256,2048,ck,2,0,16.3039,a8w8_blockscale_1x128x128_256x64x128x128_16x16_32x32_1x2_8x32x1_8x32x1_1x32x1x8_8_1x1_intrawave_v3,475.48,1192.99,0.0
256,7461,256,2048,ck,2,0,15.7482,a8w8_blockscale_1x128x128_256x64x128x128_16x16_32x32_1x2_8x32x1_8x32x1_1x32x1x8_8_1x1_intrawave_v3,496.78,1246.14,0.0
256,7634,256,2048,ck,2,0,15.8199,a8w8_blockscale_1x128x128_256x64x128x128_16x16_32x32_1x2_8x32x1_8x32x1_1x32x1x8_8_1x1_intrawave_v3,506.0,1268.49,0.0
256,8129,256,2048,ck,2,0,15.79,a8w8_blockscale_1x128x128_256x64x128x128_16x16_32x32_1x2_8x32x1_8x32x1_1x32x1x8_8_1x1_intrawave_v3,539.83,1351.14,0.0
256,8192,256,2048,ck,2,0,15.4044,a8w8_blockscale_1x128x128_256x64x128x128_16x16_32x32_1x2_8x32x1_8x32x1_1x32x1x8_8_1x1_intrawave_v3,557.63,1395.43,0.0
256,1,1024,2048,ck,8,3,4.5221,a8w8_blockscale_1x128x128_256x16x64x256_16x16_16x16_1x1_16x16x1_16x16x1_1x16x1x16_4_1x1_intrawave_v1,0.93,464.66,0.0
256,2,1024,2048,ck,8,3,4.4756,a8w8_blockscale_1x128x128_256x16x64x256_16x16_16x16_1x1_16x16x1_16x16x1_1x16x1x16_4_1x1_intrawave_v1,1.87,470.4,0.0
256,4,1024,2048,ck,8,2,4.7576,a8w8_blockscale_1x128x128_256x16x64x256_16x16_16x16_1x1_16x16x1_16x16x1_1x16x1x16_4_1x1_intrawave_v1,3.53,444.24,0.0
256,8,1024,2048,ck,6,2,4.3433,a8w8_blockscale_1x128x128_256x16x64x128_8x16_16x16_1x1_16x16x1_8x32x1_1x16x1x16_4_1x1_intrawave_v1,7.73,490.39,0.0
256,16,1024,2048,ck,8,2,5.0033,a8w8_blockscale_1x128x128_256x16x64x256_16x16_16x16_1x1_16x16x1_16x16x1_1x16x1x16_4_1x1_intrawave_v1,13.41,432.25,0.0
256,32,1024,2048,ck,8,2,5.2157,a8w8_blockscale_1x128x128_256x16x64x256_16x16_16x16_1x1_16x16x1_16x16x1_1x16x1x16_4_1x1_intrawave_v1,25.73,427.21,0.0
256,48,1024,2048,ck,8,2,5.469,a8w8_blockscale_1x128x128_256x16x64x256_16x16_16x16_1x1_16x16x1_16x16x1_1x16x1x16_4_1x1_intrawave_v1,36.81,419.41,0.0
256,64,1024,2048,ck,8,2,5.4599,a8w8_blockscale_1x128x128_256x16x64x256_16x16_16x16_1x1_16x16x1_16x16x1_1x16x1x16_4_1x1_intrawave_v1,49.16,432.11,0.0
256,80,1024,2048,ck,6,2,6.8141,a8w8_blockscale_1x128x128_256x16x64x128_8x16_16x16_1x1_16x16x1_8x32x1_1x16x1x16_4_1x1_intrawave_v1,49.24,355.86,0.0
256,96,1024,2048,ck,8,3,6.9429,a8w8_blockscale_1x128x128_256x16x64x256_16x16_16x16_1x1_16x16x1_16x16x1_1x16x1x16_4_1x1_intrawave_v1,57.99,358.69,0.0
256,112,1024,2048,ck,8,3,7.2946,a8w8_blockscale_1x128x128_256x16x64x256_16x16_16x16_1x1_16x16x1_16x16x1_1x16x1x16_4_1x1_intrawave_v1,64.4,350.38,0.0
256,128,1024,2048,ck,8,2,6.5782,a8w8_blockscale_1x128x128_256x16x64x256_16x16_16x16_1x1_16x16x1_16x16x1_1x16x1x16_4_1x1_intrawave_v1,81.61,398.5,0.0
256,256,1024,2048,ck,8,0,7.7908,a8w8_blockscale_1x128x128_256x16x64x256_16x16_16x16_1x1_16x16x1_16x16x1_1x16x1x16_4_1x1_intrawave_v1,137.82,403.77,0.0
256,512,1024,2048,ck,7,0,9.7272,a8w8_blockscale_1x128x128_256x16x128x256_16x16_16x16_1x2_16x16x1_16x16x1_1x16x1x16_8_1x2_intrawave_v1,220.77,431.19,0.0
256,667,1024,2048,ck,18,0,10.5223,a8w8_blockscale_1x128x128_256x64x64x256_16x16_32x32_1x1_16x16x1_16x16x1_1x32x1x8_8_1x1_intrawave_v1,265.87,458.95,0.0
256,671,1024,2048,ck,18,0,11.0557,a8w8_blockscale_1x128x128_256x64x64x256_16x16_32x32_1x1_16x16x1_16x16x1_1x32x1x8_8_1x1_intrawave_v1,254.56,438.29,0.0
256,931,1024,2048,ck,18,0,11.9141,a8w8_blockscale_1x128x128_256x64x64x256_16x16_32x32_1x1_16x16x1_16x16x1_1x32x1x8_8_1x1_intrawave_v1,327.75,496.1,0.0
256,1024,1024,2048,ck,18,0,10.967,a8w8_blockscale_1x128x128_256x64x64x256_16x16_32x32_1x1_16x16x1_16x16x1_1x32x1x8_8_1x1_intrawave_v1,391.63,573.67,0.0
256,1025,1024,2048,ck,2,0,14.9492,a8w8_blockscale_1x128x128_256x64x128x128_16x16_32x32_1x2_8x32x1_8x32x1_1x32x1x8_8_1x1_intrawave_v3,287.58,421.13,0.0
256,1027,1024,2048,ck,2,0,15.216,a8w8_blockscale_1x128x128_256x64x128x128_16x16_32x32_1x2_8x32x1_8x32x1_1x32x1x8_8_1x1_intrawave_v3,283.09,414.28,0.0
256,1031,1024,2048,ck,3,0,15.3704,a8w8_blockscale_1x128x128_256x64x64x128_16x16_32x32_1x1_8x32x1_8x32x1_1x32x1x8_8_1x1_intrawave_v3,281.34,411.19,0.0
256,1039,1024,2048,ck,3,0,15.0702,a8w8_blockscale_1x128x128_256x64x64x128_16x16_32x32_1x1_8x32x1_8x32x1_1x32x1x8_8_1x1_intrawave_v3,289.17,421.55,0.0
256,1040,1024,2048,ck,3,0,15.3257,a8w8_blockscale_1x128x128_256x64x64x128_16x16_32x32_1x1_8x32x1_8x32x1_1x32x1x8_8_1x1_intrawave_v3,284.62,414.79,0.0
256,1041,1024,2048,ck,2,0,15.3875,a8w8_blockscale_1x128x128_256x64x128x128_16x16_32x32_1x2_8x32x1_8x32x1_1x32x1x8_8_1x1_intrawave_v3,283.75,413.39,0.0
256,1072,1024,2048,ck,3,0,15.3695,a8w8_blockscale_1x128x128_256x64x64x128_16x16_32x32_1x1_8x32x1_8x32x1_1x32x1x8_8_1x1_intrawave_v3,292.55,422.14,0.0
256,1073,1024,2048,ck,2,0,15.2123,a8w8_blockscale_1x128x128_256x64x128x128_16x16_32x32_1x2_8x32x1_8x32x1_1x32x1x8_8_1x1_intrawave_v3,295.85,426.77,0.0
256,1077,1024,2048,ck,2,0,15.6658,a8w8_blockscale_1x128x128_256x64x128x128_16x16_32x32_1x2_8x32x1_8x32x1_1x32x1x8_8_1x1_intrawave_v3,288.35,415.46,0.0
256,1091,1024,2048,ck,2,0,15.0839,a8w8_blockscale_1x128x128_256x64x128x128_16x16_32x32_1x2_8x32x1_8x32x1_1x32x1x8_8_1x1_intrawave_v3,303.37,435.29,0.0
256,1343,1024,2048,ck,2,0,15.4135,a8w8_blockscale_1x128x128_256x64x128x128_16x16_32x32_1x2_8x32x1_8x32x1_1x32x1x8_8_1x1_intrawave_v3,365.46,492.95,0.0
256,1688,1024,2048,ck,2,0,15.383,a8w8_blockscale_1x128x128_256x64x128x128_16x16_32x32_1x2_8x32x1_8x32x1_1x32x1x8_8_1x1_intrawave_v3,460.25,585.79,0.0
256,2017,1024,2048,ck,2,0,16.1675,a8w8_blockscale_1x128x128_256x64x128x128_16x16_32x32_1x2_8x32x1_8x32x1_1x32x1x8_8_1x1_intrawave_v3,523.27,640.72,0.0
256,2048,1024,2048,ck,2,0,15.9431,a8w8_blockscale_1x128x128_256x64x128x128_16x16_32x32_1x2_8x32x1_8x32x1_1x32x1x8_8_1x1_intrawave_v3,538.79,657.7,0.0
256,2050,1024,2048,ck,3,0,18.9779,a8w8_blockscale_1x128x128_256x64x64x128_16x16_32x32_1x1_8x32x1_8x32x1_1x32x1x8_8_1x1_intrawave_v3,453.07,552.96,0.0
256,2063,1024,2048,ck,3,0,18.9575,a8w8_blockscale_1x128x128_256x64x64x128_16x16_32x32_1x1_8x32x1_8x32x1_1x32x1x8_8_1x1_intrawave_v3,456.43,556.36,0.0
256,2064,1024,2048,ck,3,0,18.8977,a8w8_blockscale_1x128x128_256x64x64x128_16x16_32x32_1x1_8x32x1_8x32x1_1x32x1x8_8_1x1_intrawave_v3,458.1,558.34,0.0
256,2099,1024,2048,ck,3,0,18.9498,a8w8_blockscale_1x128x128_256x64x64x128_16x16_32x32_1x1_8x32x1_8x32x1_1x32x1x8_8_1x1_intrawave_v3,464.59,564.37,0.0
256,2159,1024,2048,ck,3,0,19.1678,a8w8_blockscale_1x128x128_256x64x64x128_16x16_32x32_1x1_8x32x1_8x32x1_1x32x1x8_8_1x1_intrawave_v3,472.43,570.77,0.0
256,2160,1024,2048,ck,3,0,19.1364,a8w8_blockscale_1x128x128_256x64x64x128_16x16_32x32_1x1_8x32x1_8x32x1_1x32x1x8_8_1x1_intrawave_v3,473.43,571.92,0.0
256,2313,1024,2048,ck,3,0,19.4543,a8w8_blockscale_1x128x128_256x64x64x128_16x16_32x32_1x1_8x32x1_8x32x1_1x32x1x8_8_1x1_intrawave_v3,498.68,594.79,0.0
256,2325,1024,2048,ck,3,0,19.4911,a8w8_blockscale_1x128x128_256x64x64x128_16x16_32x32_1x1_8x32x1_8x32x1_1x32x1x8_8_1x1_intrawave_v3,500.32,596.19,0.0
256,3072,1024,2048,ck,0,0,19.6416,a8w8_blockscale_1x128x128_256x128x128x128_16x16_32x32_2x2_8x32x1_8x32x1_1x32x1x8_8_1x1_intrawave_v3,656.0,747.4,0.0
256,3073,1024,2048,ck,0,0,20.1673,a8w8_blockscale_1x128x128_256x128x128x128_16x16_32x32_2x2_8x32x1_8x32x1_1x32x1x8_8_1x1_intrawave_v3,639.11,728.12,0.0
256,3182,1024,2048,ck,0,0,20.5323,a8w8_blockscale_1x128x128_256x128x128x128_16x16_32x32_2x2_8x32x1_8x32x1_1x32x1x8_8_1x1_intrawave_v3,650.01,736.92,0.0
256,3183,1024,2048,ck,0,0,20.5868,a8w8_blockscale_1x128x128_256x128x128x128_16x16_32x32_2x2_8x32x1_8x32x1_1x32x1x8_8_1x1_intrawave_v3,648.5,735.17,0.0
256,3847,1024,2048,ck,0,0,20.9669,a8w8_blockscale_1x128x128_256x128x128x128_16x16_32x32_2x2_8x32x1_8x32x1_1x32x1x8_8_1x1_intrawave_v3,769.57,851.55,0.0
256,4096,1024,2048,ck,0,0,20.3124,a8w8_blockscale_1x128x128_256x128x128x128_16x16_32x32_2x2_8x32x1_8x32x1_1x32x1x8_8_1x1_intrawave_v3,845.78,929.2,0.0
256,4111,1024,2048,ck,2,0,27.9967,a8w8_blockscale_1x128x128_256x64x128x128_16x16_32x32_1x2_8x32x1_8x32x1_1x32x1x8_8_1x1_intrawave_v3,615.89,676.36,0.0
256,4141,1024,2048,ck,2,0,28.1251,a8w8_blockscale_1x128x128_256x64x128x128_16x16_32x32_1x2_8x32x1_8x32x1_1x32x1x8_8_1x1_intrawave_v3,617.55,677.64,0.0
256,4142,1024,2048,ck,2,0,27.9038,a8w8_blockscale_1x128x128_256x64x128x128_16x16_32x32_1x2_8x32x1_8x32x1_1x32x1x8_8_1x1_intrawave_v3,622.6,683.16,0.0
256,4345,1024,2048,ck,2,0,28.4719,a8w8_blockscale_1x128x128_256x64x128x128_16x16_32x32_1x2_8x32x1_8x32x1_1x32x1x8_8_1x1_intrawave_v3,640.08,698.73,0.0
256,5105,1024,2048,ck,2,0,29.3964,a8w8_blockscale_1x128x128_256x64x128x128_16x16_32x32_1x2_8x32x1_8x32x1_1x32x1x8_8_1x1_intrawave_v3,728.39,782.65,0.0
256,5121,1024,2048,ck,2,0,28.8372,a8w8_blockscale_1x128x128_256x64x128x128_16x16_32x32_1x2_8x32x1_8x32x1_1x32x1x8_8_1x1_intrawave_v3,744.84,800.1,0.0
256,5123,1024,2048,ck,2,0,29.1132,a8w8_blockscale_1x128x128_256x64x128x128_16x16_32x32_1x2_8x32x1_8x32x1_1x32x1x8_8_1x1_intrawave_v3,738.06,792.8,0.0
256,5131,1024,2048,ck,2,0,28.8927,a8w8_blockscale_1x128x128_256x64x128x128_16x16_32x32_1x2_8x32x1_8x32x1_1x32x1x8_8_1x1_intrawave_v3,744.86,799.99,0.0
256,5427,1024,2048,ck,2,0,29.7224,a8w8_blockscale_1x128x128_256x64x128x128_16x16_32x32_1x2_8x32x1_8x32x1_1x32x1x8_8_1x1_intrawave_v3,765.84,818.44,0.0
256,6113,1024,2048,ck,2,0,31.5356,a8w8_blockscale_1x128x128_256x64x128x128_16x16_32x32_1x2_8x32x1_8x32x1_1x32x1x8_8_1x1_intrawave_v3,813.04,860.49,0.0
256,6197,1024,2048,ck,0,0,31.5213,a8w8_blockscale_1x128x128_256x128x128x128_16x16_32x32_2x2_8x32x1_8x32x1_1x32x1x8_8_1x1_intrawave_v3,824.59,871.79,0.0
256,6409,1024,2048,ck,0,0,31.6145,a8w8_blockscale_1x128x128_256x128x128x128_16x16_32x32_2x2_8x32x1_8x32x1_1x32x1x8_8_1x1_intrawave_v3,850.28,896.69,0.0
256,7121,1024,2048,ck,0,0,33.1719,a8w8_blockscale_1x128x128_256x128x128x128_16x16_32x32_2x2_8x32x1_8x32x1_1x32x1x8_8_1x1_intrawave_v3,900.39,942.51,0.0
256,7168,1024,2048,ck,0,0,32.0156,a8w8_blockscale_1x128x128_256x128x128x128_16x16_32x32_2x2_8x32x1_8x32x1_1x32x1x8_8_1x1_intrawave_v3,939.07,982.56,0.0
256,7169,1024,2048,ck,0,0,33.2237,a8w8_blockscale_1x128x128_256x128x128x128_16x16_32x32_2x2_8x32x1_8x32x1_1x32x1x8_8_1x1_intrawave_v3,905.05,946.96,0.0
256,7172,1024,2048,ck,0,0,33.0791,a8w8_blockscale_1x128x128_256x128x128x128_16x16_32x32_2x2_8x32x1_8x32x1_1x32x1x8_8_1x1_intrawave_v3,909.38,951.47,0.0
256,7176,1024,2048,ck,0,0,33.3166,a8w8_blockscale_1x128x128_256x128x128x128_16x16_32x32_2x2_8x32x1_8x32x1_1x32x1x8_8_1x1_intrawave_v3,903.4,945.18,0.0
256,7177,1024,2048,ck,0,0,33.6791,a8w8_blockscale_1x128x128_256x128x128x128_16x16_32x32_2x2_8x32x1_8x32x1_1x32x1x8_8_1x1_intrawave_v3,893.8,935.12,0.0
256,7178,1024,2048,ck,0,0,33.4027,a8w8_blockscale_1x128x128_256x128x128x128_16x16_32x32_2x2_8x32x1_8x32x1_1x32x1x8_8_1x1_intrawave_v3,901.33,942.98,0.0
256,7179,1024,2048,ck,0,0,33.6173,a8w8_blockscale_1x128x128_256x128x128x128_16x16_32x32_2x2_8x32x1_8x32x1_1x32x1x8_8_1x1_intrawave_v3,895.7,937.09,0.0
256,7183,1024,2048,ck,0,0,33.3927,a8w8_blockscale_1x128x128_256x128x128x128_16x16_32x32_2x2_8x32x1_8x32x1_1x32x1x8_8_1x1_intrawave_v3,902.22,943.88,0.0
256,7184,1024,2048,ck,0,0,33.1839,a8w8_blockscale_1x128x128_256x128x128x128_16x16_32x32_2x2_8x32x1_8x32x1_1x32x1x8_8_1x1_intrawave_v3,908.03,949.94,0.0
256,7209,1024,2048,ck,0,0,33.5415,a8w8_blockscale_1x128x128_256x128x128x128_16x16_32x32_2x2_8x32x1_8x32x1_1x32x1x8_8_1x1_intrawave_v3,901.47,942.87,0.0
256,7210,1024,2048,ck,0,0,32.7071,a8w8_blockscale_1x128x128_256x128x128x128_16x16_32x32_2x2_8x32x1_8x32x1_1x32x1x8_8_1x1_intrawave_v3,924.6,967.05,0.0
256,7211,1024,2048,ck,0,0,33.1006,a8w8_blockscale_1x128x128_256x128x128x128_16x16_32x32_2x2_8x32x1_8x32x1_1x32x1x8_8_1x1_intrawave_v3,913.73,955.67,0.0
256,7217,1024,2048,ck,0,0,33.7385,a8w8_blockscale_1x128x128_256x128x128x128_16x16_32x32_2x2_8x32x1_8x32x1_1x32x1x8_8_1x1_intrawave_v3,897.2,938.33,0.0
256,7273,1024,2048,ck,0,0,33.4552,a8w8_blockscale_1x128x128_256x128x128x128_16x16_32x32_2x2_8x32x1_8x32x1_1x32x1x8_8_1x1_intrawave_v3,911.82,953.14,0.0
256,7274,1024,2048,ck,0,0,33.5631,a8w8_blockscale_1x128x128_256x128x128x128_16x16_32x32_2x2_8x32x1_8x32x1_1x32x1x8_8_1x1_intrawave_v3,909.02,950.19,0.0
256,7391,1024,2048,ck,0,0,33.1578,a8w8_blockscale_1x128x128_256x128x128x128_16x16_32x32_2x2_8x32x1_8x32x1_1x32x1x8_8_1x1_intrawave_v3,934.93,976.26,0.0
256,7393,1024,2048,ck,0,0,33.5802,a8w8_blockscale_1x128x128_256x128x128x128_16x16_32x32_2x2_8x32x1_8x32x1_1x32x1x8_8_1x1_intrawave_v3,923.42,964.23,0.0
256,7715,1024,2048,ck,0,0,33.8583,a8w8_blockscale_1x128x128_256x128x128x128_16x16_32x32_2x2_8x32x1_8x32x1_1x32x1x8_8_1x1_intrawave_v3,955.72,995.26,0.0
256,7753,1024,2048,ck,0,0,34.0602,a8w8_blockscale_1x128x128_256x128x128x128_16x16_32x32_2x2_8x32x1_8x32x1_1x32x1x8_8_1x1_intrawave_v3,954.73,993.93,0.0
256,7819,1024,2048,ck,0,0,34.5195,a8w8_blockscale_1x128x128_256x128x128x128_16x16_32x32_2x2_8x32x1_8x32x1_1x32x1x8_8_1x1_intrawave_v3,950.05,988.54,0.0
256,8099,1024,2048,ck,0,0,35.1802,a8w8_blockscale_1x128x128_256x128x128x128_16x16_32x32_2x2_8x32x1_8x32x1_1x32x1x8_8_1x1_intrawave_v3,965.59,1002.57,0.0
256,8129,1024,2048,ck,0,0,34.9778,a8w8_blockscale_1x128x128_256x128x128x128_16x16_32x32_2x2_8x32x1_8x32x1_1x32x1x8_8_1x1_intrawave_v3,974.78,1011.89,0.0
256,8188,1024,2048,ck,0,0,34.3518,a8w8_blockscale_1x128x128_256x128x128x128_16x16_32x32_2x2_8x32x1_8x32x1_1x32x1x8_8_1x1_intrawave_v3,999.74,1037.36,0.0
256,8192,1024,2048,ck,0,0,34.445,a8w8_blockscale_1x128x128_256x128x128x128_16x16_32x32_2x2_8x32x1_8x32x1_1x32x1x8_8_1x1_intrawave_v3,997.52,1035.03,0.0
256,1,2048,128,ck,11,0,3.0614,a8w8_blockscale_1x128x128_256x32x64x128_16x16_16x16_2x1_8x32x1_8x32x1_1x32x1x8_8_2x1_intrawave_v1,0.17,87.01,0.0
256,1,2048,512,ck,8,0,3.2512,a8w8_blockscale_1x128x128_256x16x64x256_16x16_16x16_1x1_16x16x1_16x16x1_1x16x1x16_4_1x1_intrawave_v1,0.65,323.94,0.0
256,1,2048,1024,ck,8,1,4.4724,a8w8_blockscale_1x128x128_256x16x64x256_16x16_16x16_1x1_16x16x1_16x16x1_1x16x1x16_4_1x1_intrawave_v1,0.94,470.05,0.0
256,1,2048,2048,ck,8,2,5.0932,a8w8_blockscale_1x128x128_256x16x64x256_16x16_16x16_1x1_16x16x1_16x16x1_1x16x1x16_4_1x1_intrawave_v1,1.65,824.72,0.0
256,1,2048,4096,ck,7,3,6.5896,a8w8_blockscale_1x128x128_256x16x128x256_16x16_16x16_1x2_16x16x1_16x16x1_1x16x1x16_8_1x2_intrawave_v1,2.55,1274.25,0.0
256,2,2048,128,ck,11,0,3.1321,a8w8_blockscale_1x128x128_256x32x64x128_16x16_16x16_2x1_8x32x1_8x32x1_1x32x1x8_8_2x1_intrawave_v1,0.33,86.39,0.0
256,2,2048,512,ck,8,0,3.3098,a8w8_blockscale_1x128x128_256x16x64x256_16x16_16x16_1x1_16x16x1_16x16x1_1x16x1x16_4_1x1_intrawave_v1,1.27,319.59,0.0
256,2,2048,1024,ck,8,2,4.4396,a8w8_blockscale_1x128x128_256x16x64x256_16x16_16x16_1x1_16x16x1_16x16x1_1x16x1x16_4_1x1_intrawave_v1,1.89,474.68,0.0
256,2,2048,2048,ck,6,3,5.2164,a8w8_blockscale_1x128x128_256x16x64x128_8x16_16x16_1x1_16x16x1_8x32x1_1x16x1x16_4_1x1_intrawave_v1,3.22,806.42,0.0
256,2,2048,4096,ck,8,3,6.0106,a8w8_blockscale_1x128x128_256x16x64x256_16x16_16x16_1x1_16x16x1_16x16x1_1x16x1x16_4_1x1_intrawave_v1,5.58,1398.36,0.0
256,4,2048,128,ck,5,0,3.0843,a8w8_blockscale_1x128x128_256x16x128x128_8x16_16x16_1x2_16x16x1_8x32x1_1x16x1x16_8_1x2_intrawave_v1,0.68,90.47,0.0
256,4,2048,512,ck,8,0,3.677,a8w8_blockscale_1x128x128_256x16x64x256_16x16_16x16_1x1_16x16x1_16x16x1_1x16x1x16_4_1x1_intrawave_v1,2.28,290.18,0.0
256,4,2048,1024,ck,6,3,4.8176,a8w8_blockscale_1x128x128_256x16x64x128_8x16_16x16_1x1_16x16x1_8x32x1_1x16x1x16_4_1x1_intrawave_v1,3.48,439.56,0.0
256,4,2048,2048,ck,8,2,5.3216,a8w8_blockscale_1x128x128_256x16x64x256_16x16_16x16_1x1_16x16x1_16x16x1_1x16x1x16_4_1x1_intrawave_v1,6.31,792.78,0.0
256,4,2048,4096,ck,8,3,6.7131,a8w8_blockscale_1x128x128_256x16x64x256_16x16_16x16_1x1_16x16x1_16x16x1_1x16x1x16_4_1x1_intrawave_v1,10.0,1254.47,0.0
256,8,2048,128,ck,6,0,3.3703,a8w8_blockscale_1x128x128_256x16x64x128_8x16_16x16_1x1_16x16x1_8x32x1_1x16x1x16_4_1x1_intrawave_v1,1.24,87.81,0.0
256,8,2048,512,ck,13,0,3.6786,a8w8_blockscale_1x128x128_256x32x64x256_16x16_16x16_2x1_16x16x1_16x16x1_1x32x1x8_8_2x1_intrawave_v1,4.56,295.07,0.0
256,8,2048,1024,ck,6,3,4.7661,a8w8_blockscale_1x128x128_256x16x64x128_8x16_16x16_1x1_16x16x1_8x32x1_1x16x1x16_4_1x1_intrawave_v1,7.04,448.61,0.0
256,8,2048,2048,ck,6,3,5.3476,a8w8_blockscale_1x128x128_256x16x64x128_8x16_16x16_1x1_16x16x1_8x32x1_1x16x1x16_4_1x1_intrawave_v1,12.55,793.53,0.0
256,8,2048,4096,ck,8,3,6.1815,a8w8_blockscale_1x128x128_256x16x64x256_16x16_16x16_1x1_16x16x1_16x16x1_1x16x1x16_4_1x1_intrawave_v1,21.71,1367.65,0.0
256,16,2048,128,ck,11,0,3.0646,a8w8_blockscale_1x128x128_256x32x64x128_16x16_16x16_2x1_8x32x1_8x32x1_1x32x1x8_8_2x1_intrawave_v1,2.74,107.59,0.0
256,16,2048,512,ck,8,0,3.3278,a8w8_blockscale_1x128x128_256x16x64x256_16x16_16x16_1x1_16x16x1_16x16x1_1x16x1x16_4_1x1_intrawave_v1,10.08,337.25,0.0
256,16,2048,1024,ck,8,0,4.4827,a8w8_blockscale_1x128x128_256x16x64x256_16x16_16x16_1x1_16x16x1_16x16x1_1x16x1x16_4_1x1_intrawave_v1,14.97,486.11,0.0
256,16,2048,2048,ck,6,3,5.8298,a8w8_blockscale_1x128x128_256x16x64x128_8x16_16x16_1x1_16x16x1_8x32x1_1x16x1x16_4_1x1_intrawave_v1,23.02,736.32,0.0
256,16,2048,4096,ck,8,3,6.2968,a8w8_blockscale_1x128x128_256x16x64x256_16x16_16x16_1x1_16x16x1_16x16x1_1x16x1x16_4_1x1_intrawave_v1,42.63,1353.02,0.0
256,24,2048,2048,ck,8,3,6.4001,a8w8_blockscale_1x128x128_256x16x64x256_16x16_16x16_1x1_16x16x1_16x16x1_1x16x1x16_4_1x1_intrawave_v1,31.46,678.39,0.0
256,32,2048,128,ck,13,0,3.2613,a8w8_blockscale_1x128x128_256x32x64x256_16x16_16x16_2x1_16x16x1_16x16x1_1x32x1x8_8_2x1_intrawave_v1,5.14,121.83,0.0
256,32,2048,512,ck,7,0,4.1022,a8w8_blockscale_1x128x128_256x16x128x256_16x16_16x16_1x2_16x16x1_16x16x1_1x16x1x16_8_1x2_intrawave_v1,16.36,291.56,0.0
256,32,2048,1024,ck,8,0,4.6976,a8w8_blockscale_1x128x128_256x16x64x256_16x16_16x16_1x1_16x16x1_16x16x1_1x16x1x16_4_1x1_intrawave_v1,28.57,481.31,0.0
256,32,2048,2048,ck,8,2,6.3609,a8w8_blockscale_1x128x128_256x16x64x256_16x16_16x16_1x1_16x16x1_16x16x1_1x16x1x16_4_1x1_intrawave_v1,42.2,690.3,0.0
256,32,2048,4096,ck,8,3,8.4914,a8w8_blockscale_1x128x128_256x16x64x256_16x16_16x16_1x1_16x16x1_16x16x1_1x16x1x16_4_1x1_intrawave_v1,63.23,1018.77,0.0
256,40,2048,2048,ck,8,2,6.7087,a8w8_blockscale_1x128x128_256x16x64x256_16x16_16x16_1x1_16x16x1_16x16x1_1x16x1x16_4_1x1_intrawave_v1,50.02,661.84,0.0
256,48,2048,128,ck,6,0,3.1788,a8w8_blockscale_1x128x128_256x16x64x128_8x16_16x16_1x1_16x16x1_8x32x1_1x16x1x16_4_1x1_intrawave_v1,7.92,146.25,0.0
256,48,2048,512,ck,8,0,3.6596,a8w8_blockscale_1x128x128_256x16x64x256_16x16_16x16_1x1_16x16x1_16x16x1_1x16x1x16_4_1x1_intrawave_v1,27.51,346.97,0.0
256,48,2048,1024,ck,8,0,5.3926,a8w8_blockscale_1x128x128_256x16x64x256_16x16_16x16_1x1_16x16x1_16x16x1_1x16x1x16_4_1x1_intrawave_v1,37.33,434.47,0.0
256,48,2048,2048,ck,8,2,6.7474,a8w8_blockscale_1x128x128_256x16x64x256_16x16_16x16_1x1_16x16x1_16x16x1_1x16x1x16_4_1x1_intrawave_v1,59.68,665.33,0.0
256,48,2048,4096,ck,8,3,8.175,a8w8_blockscale_1x128x128_256x16x64x256_16x16_16x16_1x1_16x16x1_16x16x1_1x16x1x16_4_1x1_intrawave_v1,98.51,1074.23,0.0
256,56,2048,2048,ck,8,2,6.5029,a8w8_blockscale_1x128x128_256x16x64x256_16x16_16x16_1x1_16x16x1_16x16x1_1x16x1x16_4_1x1_intrawave_v1,72.24,697.9,0.0
256,64,2048,128,ck,6,0,3.1854,a8w8_blockscale_1x128x128_256x16x64x128_8x16_16x16_1x1_16x16x1_8x32x1_1x16x1x16_4_1x1_intrawave_v1,10.53,167.16,0.0
256,64,2048,512,ck,8,0,3.6126,a8w8_blockscale_1x128x128_256x16x64x256_16x16_16x16_1x1_16x16x1_16x16x1_1x16x1x16_4_1x1_intrawave_v1,37.15,371.89,0.0
256,64,2048,1024,ck,8,0,5.4803,a8w8_blockscale_1x128x128_256x16x64x256_16x16_16x16_1x1_16x16x1_16x16x1_1x16x1x16_4_1x1_intrawave_v1,48.98,442.46,0.0
256,64,2048,2048,ck,8,2,6.7102,a8w8_blockscale_1x128x128_256x16x64x256_16x16_16x16_1x1_16x16x1_16x16x1_1x16x1x16_4_1x1_intrawave_v1,80.01,683.66,0.0
256,64,2048,4096,ck,8,2,9.8582,a8w8_blockscale_1x128x128_256x16x64x256_16x16_16x16_1x1_16x16x1_16x16x1_1x16x1x16_4_1x1_intrawave_v1,108.92,904.11,0.0
256,72,2048,2048,ck,8,2,7.5985,a8w8_blockscale_1x128x128_256x16x64x256_16x16_16x16_1x1_16x16x1_16x16x1_1x16x1x16_4_1x1_intrawave_v1,79.49,610.21,0.0
256,80,2048,128,ck,11,0,3.3376,a8w8_blockscale_1x128x128_256x32x64x128_16x16_16x16_2x1_8x32x1_8x32x1_1x32x1x8_8_2x1_intrawave_v1,12.57,179.79,0.0
256,80,2048,512,ck,8,0,4.3362,a8w8_blockscale_1x128x128_256x16x64x256_16x16_16x16_1x1_16x16x1_16x16x1_1x16x1x16_4_1x1_intrawave_v1,38.69,326.83,0.0
256,80,2048,1024,ck,8,0,4.8839,a8w8_blockscale_1x128x128_256x16x64x256_16x16_16x16_1x1_16x16x1_16x16x1_1x16x1x16_4_1x1_intrawave_v1,68.7,513.27,0.0
256,80,2048,2048,ck,8,2,7.5521,a8w8_blockscale_1x128x128_256x16x64x256_16x16_16x16_1x1_16x16x1_16x16x1_1x16x1x16_4_1x1_intrawave_v1,88.86,620.47,0.0
256,80,2048,4096,ck,8,3,10.0954,a8w8_blockscale_1x128x128_256x16x64x256_16x16_16x16_1x1_16x16x1_16x16x1_1x16x1x16_4_1x1_intrawave_v1,132.95,895.85,0.0
256,88,2048,2048,ck,8,2,7.5631,a8w8_blockscale_1x128x128_256x16x64x256_16x16_16x16_1x1_16x16x1_16x16x1_1x16x1x16_4_1x1_intrawave_v1,97.61,626.06,0.0
256,96,2048,128,ck,8,0,3.2675,a8w8_blockscale_1x128x128_256x16x64x256_16x16_16x16_1x1_16x16x1_16x16x1_1x16x1x16_4_1x1_intrawave_v1,15.4,204.33,0.0
256,96,2048,512,ck,13,0,3.8214,a8w8_blockscale_1x128x128_256x32x64x256_16x16_16x16_2x1_16x16x1_16x16x1_1x32x1x8_8_2x1_intrawave_v1,52.68,390.16,0.0
256,96,2048,1024,ck,8,0,4.9958,a8w8_blockscale_1x128x128_256x16x64x256_16x16_16x16_1x1_16x16x1_16x16x1_1x16x1x16_4_1x1_intrawave_v1,80.6,518.17,0.0
256,96,2048,2048,ck,8,2,7.634,a8w8_blockscale_1x128x128_256x16x64x256_16x16_16x16_1x1_16x16x1_16x16x1_1x16x1x16_4_1x1_intrawave_v1,105.49,626.69,0.0
256,96,2048,4096,ck,8,3,10.4744,a8w8_blockscale_1x128x128_256x16x64x256_16x16_16x16_1x1_16x16x1_16x16x1_1x16x1x16_4_1x1_intrawave_v1,153.77,875.95,0.0
256,104,2048,2048,ck,8,2,8.074,a8w8_blockscale_1x128x128_256x16x64x256_16x16_16x16_1x1_16x16x1_16x16x1_1x16x1x16_4_1x1_intrawave_v1,108.05,598.62,0.0
256,112,2048,128,ck,6,0,3.2835,a8w8_blockscale_1x128x128_256x16x64x128_8x16_16x16_1x1_16x16x1_8x32x1_1x16x1x16_4_1x1_intrawave_v1,17.88,223.92,0.0
256,112,2048,512,ck,8,0,4.2135,a8w8_blockscale_1x128x128_256x16x64x256_16x16_16x16_1x1_16x16x1_16x16x1_1x16x1x16_4_1x1_intrawave_v1,55.74,371.35,0.0
256,112,2048,1024,ck,8,0,4.9574,a8w8_blockscale_1x128x128_256x16x64x256_16x16_16x16_1x1_16x16x1_16x16x1_1x16x1x16_4_1x1_intrawave_v1,94.76,538.71,0.0
256,112,2048,2048,ck,8,0,7.8331,a8w8_blockscale_1x128x128_256x16x64x256_16x16_16x16_1x1_16x16x1_16x16x1_1x16x1x16_4_1x1_intrawave_v1,119.94,623.31,0.0
256,112,2048,4096,ck,8,3,11.3435,a8w8_blockscale_1x128x128_256x16x64x256_16x16_16x16_1x1_16x16x1_16x16x1_1x16x1x16_4_1x1_intrawave_v1,165.65,820.39,0.0
256,120,2048,2048,ck,8,0,8.0584,a8w8_blockscale_1x128x128_256x16x64x256_16x16_16x16_1x1_16x16x1_16x16x1_1x16x1x16_4_1x1_intrawave_v1,124.92,611.98,0.0
256,128,2048,128,ck,6,0,3.276,a8w8_blockscale_1x128x128_256x16x64x128_8x16_16x16_1x1_16x16x1_8x32x1_1x16x1x16_4_1x1_intrawave_v1,20.49,245.06,0.0
256,128,2048,512,ck,13,0,3.8663,a8w8_blockscale_1x128x128_256x32x64x256_16x16_16x16_2x1_16x16x1_16x16x1_1x32x1x8_8_2x1_intrawave_v1,69.43,423.76,0.0
256,128,2048,1024,ck,8,0,5.1821,a8w8_blockscale_1x128x128_256x16x64x256_16x16_16x16_1x1_16x16x1_16x16x1_1x16x1x16_4_1x1_intrawave_v1,103.6,531.16,0.0
256,128,2048,2048,ck,8,0,7.7586,a8w8_blockscale_1x128x128_256x16x64x256_16x16_16x16_1x1_16x16x1_16x16x1_1x16x1x16_4_1x1_intrawave_v1,138.39,641.96,0.0
256,128,2048,4096,ck,8,3,12.2285,a8w8_blockscale_1x128x128_256x16x64x256_16x16_16x16_1x1_16x16x1_16x16x1_1x16x1x16_4_1x1_intrawave_v1,175.61,771.74,0.0
256,136,2048,2048,ck,7,0,9.5676,a8w8_blockscale_1x128x128_256x16x128x256_16x16_16x16_1x2_16x16x1_16x16x1_1x16x1x16_8_1x2_intrawave_v1,119.24,525.72,0.0
256,144,2048,2048,ck,8,2,9.1119,a8w8_blockscale_1x128x128_256x16x64x256_16x16_16x16_1x1_16x16x1_16x16x1_1x16x1x16_4_1x1_intrawave_v1,132.57,557.41,0.0
256,152,2048,2048,ck,8,2,9.2129,a8w8_blockscale_1x128x128_256x16x64x256_16x16_16x16_1x1_16x16x1_16x16x1_1x16x1x16_4_1x1_intrawave_v1,138.4,556.63,0.0
256,160,2048,2048,ck,8,2,9.5003,a8w8_blockscale_1x128x128_256x16x64x256_16x16_16x16_1x1_16x16x1_16x16x1_1x16x1x16_4_1x1_intrawave_v1,141.28,544.97,0.0
256,168,2048,2048,ck,8,2,9.6183,a8w8_blockscale_1x128x128_256x16x64x256_16x16_16x16_1x1_16x16x1_16x16x1_1x16x1x16_4_1x1_intrawave_v1,146.52,543.39,0.0
256,176,2048,2048,ck,7,0,9.8969,a8w8_blockscale_1x128x128_256x16x128x256_16x16_16x16_1x2_16x16x1_16x16x1_1x16x1x16_8_1x2_intrawave_v1,149.18,533.06,0.0
256,184,2048,2048,ck,13,0,10.0756,a8w8_blockscale_1x128x128_256x32x64x256_16x16_16x16_2x1_16x16x1_16x16x1_1x32x1x8_8_2x1_intrawave_v1,153.19,528.48,0.0
256,192,2048,2048,ck,7,0,9.5237,a8w8_blockscale_1x128x128_256x16x128x256_16x16_16x16_1x2_16x16x1_16x16x1_1x16x1x16_8_1x2_intrawave_v1,169.12,564.27,0.0
256,200,2048,2048,ck,7,0,9.892,a8w8_blockscale_1x128x128_256x16x128x256_16x16_16x16_1x2_16x16x1_16x16x1_1x16x1x16_8_1x2_intrawave_v1,169.6,548.23,0.0
256,208,2048,2048,ck,13,0,9.9735,a8w8_blockscale_1x128x128_256x32x64x256_16x16_16x16_2x1_16x16x1_16x16x1_1x32x1x8_8_2x1_intrawave_v1,174.95,548.68,0.0
256,216,2048,2048,ck,7,0,9.9032,a8w8_blockscale_1x128x128_256x16x128x256_16x16_16x16_1x2_16x16x1_16x16x1_1x16x1x16_8_1x2_intrawave_v1,182.97,557.54,0.0
256,224,2048,2048,ck,13,0,9.6174,a8w8_blockscale_1x128x128_256x32x64x256_16x16_16x16_2x1_16x16x1_16x16x1_1x32x1x8_8_2x1_intrawave_v1,195.38,579.22,0.0
256,232,2048,2048,ck,13,0,9.6438,a8w8_blockscale_1x128x128_256x32x64x256_16x16_16x16_2x1_16x16x1_16x16x1_1x32x1x8_8_2x1_intrawave_v1,201.8,582.73,0.0
256,240,2048,2048,ck,13,0,10.0039,a8w8_blockscale_1x128x128_256x32x64x256_16x16_16x16_2x1_16x16x1_16x16x1_1x32x1x8_8_2x1_intrawave_v1,201.25,566.67,0.0
256,248,2048,2048,ck,13,0,10.1525,a8w8_blockscale_1x128x128_256x32x64x256_16x16_16x16_2x1_16x16x1_16x16x1_1x32x1x8_8_2x1_intrawave_v1,204.91,563.21,0.0
256,256,2048,128,ck,11,0,3.5344,a8w8_blockscale_1x128x128_256x32x64x128_16x16_16x16_2x1_8x32x1_8x32x1_1x32x1x8_8_2x1_intrawave_v1,37.97,380.12,0.0
256,256,2048,512,ck,13,0,4.5374,a8w8_blockscale_1x128x128_256x32x64x256_16x16_16x16_2x1_16x16x1_16x16x1_1x32x1x8_8_2x1_intrawave_v1,118.32,491.08,0.0
256,256,2048,1024,ck,13,0,6.1034,a8w8_blockscale_1x128x128_256x32x64x256_16x16_16x16_2x1_16x16x1_16x16x1_1x32x1x8_8_2x1_intrawave_v1,175.93,558.36,0.0
256,256,2048,2048,ck,7,0,9.949,a8w8_blockscale_1x128x128_256x16x128x256_16x16_16x16_1x2_16x16x1_16x16x1_1x16x1x16_8_1x2_intrawave_v1,215.85,579.67,0.0
256,256,2048,4096,ck,18,0,16.7377,a8w8_blockscale_1x128x128_256x64x64x256_16x16_32x32_1x1_16x16x1_16x16x1_1x32x1x8_8_1x1_intrawave_v1,256.6,626.48,0.0
256,272,2048,2048,ck,18,0,11.2691,a8w8_blockscale_1x128x128_256x64x64x256_16x16_32x32_1x1_16x16x1_16x16x1_1x32x1x8_8_1x1_intrawave_v1,202.47,520.49,0.0
256,288,2048,2048,ck,18,0,11.1612,a8w8_blockscale_1x128x128_256x64x64x256_16x16_32x32_1x1_16x16x1_16x16x1_1x32x1x8_8_1x1_intrawave_v1,216.46,534.33,0.0
256,304,2048,2048,ck,18,0,11.0395,a8w8_blockscale_1x128x128_256x64x64x256_16x16_32x32_1x1_16x16x1_16x16x1_1x32x1x8_8_1x1_intrawave_v1,231.0,549.13,0.0
256,320,2048,2048,ck,18,0,10.5195,a8w8_blockscale_1x128x128_256x64x64x256_16x16_32x32_1x1_16x16x1_16x16x1_1x32x1x8_8_1x1_intrawave_v1,255.18,585.62,0.0
256,336,2048,2048,ck,18,0,11.6524,a8w8_blockscale_1x128x128_256x64x64x256_16x16_32x32_1x1_16x16x1_16x16x1_1x32x1x8_8_1x1_intrawave_v1,241.89,537.12,0.0
256,352,2048,2048,ck,12,0,10.8391,a8w8_blockscale_1x128x128_256x32x128x256_16x16_32x32_1x1_16x16x1_16x16x1_1x32x1x8_8_1x1_intrawave_v1,272.42,586.49,0.0
256,368,2048,2048,ck,18,0,11.4178,a8w8_blockscale_1x128x128_256x64x64x256_16x16_32x32_1x1_16x16x1_16x16x1_1x32x1x8_8_1x1_intrawave_v1,270.37,565.37,0.0
256,384,2048,2048,ck,18,0,10.0035,a8w8_blockscale_1x128x128_256x64x64x256_16x16_32x32_1x1_16x16x1_16x16x1_1x32x1x8_8_1x1_intrawave_v1,322.01,655.13,0.0
256,400,2048,2048,ck,18,0,11.4583,a8w8_blockscale_1x128x128_256x64x64x256_16x16_32x32_1x1_16x16x1_16x16x1_1x32x1x8_8_1x1_intrawave_v1,292.84,580.53,0.0
256,416,2048,2048,ck,18,0,11.3991,a8w8_blockscale_1x128x128_256x64x64x256_16x16_32x32_1x1_16x16x1_16x16x1_1x32x1x8_8_1x1_intrawave_v1,306.13,592.17,0.0
256,432,2048,2048,ck,18,0,12.0323,a8w8_blockscale_1x128x128_256x64x64x256_16x16_32x32_1x1_16x16x1_16x16x1_1x32x1x8_8_1x1_intrawave_v1,301.18,569.18,0.0
256,448,2048,2048,ck,18,0,10.1027,a8w8_blockscale_1x128x128_256x64x64x256_16x16_32x32_1x1_16x16x1_16x16x1_1x32x1x8_8_1x1_intrawave_v1,371.99,687.62,0.0
256,464,2048,2048,ck,12,0,12.0844,a8w8_blockscale_1x128x128_256x32x128x256_16x16_32x32_1x1_16x16x1_16x16x1_1x32x1x8_8_1x1_intrawave_v1,322.09,582.99,0.0
256,480,2048,2048,ck,12,0,11.1852,a8w8_blockscale_1x128x128_256x32x128x256_16x16_32x32_1x1_16x16x1_16x16x1_1x32x1x8_8_1x1_intrawave_v1,359.99,638.65,0.0
256,496,2048,2048,ck,18,0,11.5912,a8w8_blockscale_1x128x128_256x64x64x256_16x16_32x32_1x1_16x16x1_16x16x1_1x32x1x8_8_1x1_intrawave_v1,358.96,624.76,0.0
256,512,2048,128,ck,6,0,4.3362,a8w8_blockscale_1x128x128_256x16x64x128_8x16_16x16_1x1_16x16x1_8x32x1_1x16x1x16_4_1x1_intrawave_v1,61.91,559.21,0.0
256,512,2048,512,ck,13,0,5.3958,a8w8_blockscale_1x128x128_256x32x64x256_16x16_16x16_2x1_16x16x1_16x16x1_1x32x1x8_8_2x1_intrawave_v1,199.0,631.58,0.0
256,512,2048,1024,ck,18,0,7.3782,a8w8_blockscale_1x128x128_256x64x64x256_16x16_32x32_1x1_16x16x1_16x16x1_1x32x1x8_8_1x1_intrawave_v1,291.06,639.53,0.0
256,512,2048,2048,ck,18,0,10.1354,a8w8_blockscale_1x128x128_256x64x64x256_16x16_32x32_1x1_16x16x1_16x16x1_1x32x1x8_8_1x1_intrawave_v1,423.76,724.2,0.0
256,512,2048,4096,ck,18,0,16.8262,a8w8_blockscale_1x128x128_256x64x64x256_16x16_32x32_1x1_16x16x1_16x16x1_1x32x1x8_8_1x1_intrawave_v1,510.51,747.82,0.0
256,588,2048,128,ck,11,0,5.2348,a8w8_blockscale_1x128x128_256x32x64x128_16x16_16x16_2x1_8x32x1_8x32x1_1x32x1x8_8_2x1_intrawave_v1,58.89,524.54,0.0
256,588,2048,1024,ck,2,0,9.8111,a8w8_blockscale_1x128x128_256x64x128x128_16x16_32x32_1x2_8x32x1_8x32x1_1x32x1x8_8_1x1_intrawave_v3,251.37,520.61,0.0
256,664,2048,2048,ck,2,0,15.1391,a8w8_blockscale_1x128x128_256x64x128x128_16x16_32x32_1x2_8x32x1_8x32x1_1x32x1x8_8_1x1_intrawave_v3,367.92,546.53,0.0
256,667,2048,512,ck,13,0,6.8887,a8w8_blockscale_1x128x128_256x32x64x256_16x16_16x16_2x1_16x16x1_16x16x1_1x32x1x8_8_2x1_intrawave_v1,203.06,598.39,0.0
256,667,2048,4096,ck,2,0,25.3632,a8w8_blockscale_1x128x128_256x64x128x128_16x16_32x32_1x2_8x32x1_8x32x1_1x32x1x8_8_1x1_intrawave_v3,441.21,546.17,0.0
256,671,2048,512,ck,18,0,6.7028,a8w8_blockscale_1x128x128_256x64x64x256_16x16_32x32_1x1_16x16x1_16x16x1_1x32x1x8_8_1x1_intrawave_v1,209.94,617.73,0.0
256,671,2048,4096,ck,2,0,25.3875,a8w8_blockscale_1x128x128_256x64x128x128_16x16_32x32_1x2_8x32x1_8x32x1_1x32x1x8_8_1x1_intrawave_v3,443.43,546.94,0.0
256,762,2048,2048,ck,2,0,15.5765,a8w8_blockscale_1x128x128_256x64x128x128_16x16_32x32_1x2_8x32x1_8x32x1_1x32x1x8_8_1x1_intrawave_v3,410.37,569.83,0.0
256,773,2048,128,ck,16,0,5.2386,a8w8_blockscale_1x128x128_256x64x64x128_16x16_32x32_1x1_8x32x1_8x32x1_1x32x1x8_8_1x1_intrawave_v1,77.36,673.33,0.0
256,773,2048,1024,ck,2,0,10.154,a8w8_blockscale_1x128x128_256x64x128x128_16x16_32x32_1x2_8x32x1_8x32x1_1x32x1x8_8_1x1_intrawave_v3,319.3,596.31,0.0
256,822,2048,128,ck,16,0,5.2085,a8w8_blockscale_1x128x128_256x64x64x128_16x16_32x32_1x1_8x32x1_8x32x1_1x32x1x8_8_1x1_intrawave_v1,82.74,716.96,0.0
256,822,2048,1024,ck,18,0,10.0778,a8w8_blockscale_1x128x128_256x64x64x256_16x16_32x32_1x1_16x16x1_16x16x1_1x32x1x8_8_1x1_intrawave_v1,342.11,625.71,0.0
256,902,2048,2048,ck,2,0,16.0185,a8w8_blockscale_1x128x128_256x64x128x128_16x16_32x32_1x2_8x32x1_8x32x1_1x32x1x8_8_1x1_intrawave_v3,472.36,607.81,0.0
256,931,2048,512,ck,18,0,7.1825,a8w8_blockscale_1x128x128_256x64x64x256_16x16_32x32_1x1_16x16x1_16x16x1_1x32x1x8_8_1x1_intrawave_v1,271.83,743.28,0.0
256,931,2048,4096,ck,2,0,26.4051,a8w8_blockscale_1x128x128_256x64x128x128_16x16_32x32_1x2_8x32x1_8x32x1_1x32x1x8_8_1x1_intrawave_v3,591.54,606.53,0.0
256,961,2048,2048,ck,2,0,15.8303,a8w8_blockscale_1x128x128_256x64x128x128_16x16_32x32_1x2_8x32x1_8x32x1_1x32x1x8_8_1x1_intrawave_v3,509.24,637.93,0.0
256,1000,2048,2048,ck,2,0,15.6937,a8w8_blockscale_1x128x128_256x64x128x128_16x16_32x32_1x2_8x32x1_8x32x1_1x32x1x8_8_1x1_intrawave_v3,534.52,658.76,0.0
256,1001,2048,2048,ck,2,0,15.6873,a8w8_blockscale_1x128x128_256x64x128x128_16x16_32x32_1x2_8x32x1_8x32x1_1x32x1x8_8_1x1_intrawave_v3,535.27,659.42,0.0
256,1002,2048,2048,ck,2,0,15.997,a8w8_blockscale_1x128x128_256x64x128x128_16x16_32x32_1x2_8x32x1_8x32x1_1x32x1x8_8_1x1_intrawave_v3,525.44,647.03,0.0
256,1003,2048,2048,ck,2,0,16.5103,a8w8_blockscale_1x128x128_256x64x128x128_16x16_32x32_1x2_8x32x1_8x32x1_1x32x1x8_8_1x1_intrawave_v3,509.61,627.29,0.0
256,1015,2048,2048,ck,2,0,15.8891,a8w8_blockscale_1x128x128_256x64x128x128_16x16_32x32_1x2_8x32x1_8x32x1_1x32x1x8_8_1x1_intrawave_v3,535.87,656.45,0.0
256,1023,2048,2048,ck,2,0,16.3042,a8w8_blockscale_1x128x128_256x64x128x128_16x16_32x32_1x2_8x32x1_8x32x1_1x32x1x8_8_1x1_intrawave_v3,526.34,642.76,0.0
256,1024,2048,128,ck,16,0,5.3569,a8w8_blockscale_1x128x128_256x64x64x128_16x16_32x32_1x1_8x32x1_8x32x1_1x32x1x8_8_1x1_intrawave_v1,100.22,856.38,0.0
256,1024,2048,512,ck,18,0,7.1297,a8w8_blockscale_1x128x128_256x64x64x256_16x16_32x32_1x1_16x16x1_16x16x1_1x32x1x8_8_1x1_intrawave_v1,301.2,808.89,0.0
256,1024,2048,1024,ck,2,0,10.0189,a8w8_blockscale_1x128x128_256x64x128x128_16x16_32x32_1x2_8x32x1_8x32x1_1x32x1x8_8_1x1_intrawave_v3,428.69,732.62,0.0
256,1024,2048,2048,ck,2,0,15.9494,a8w8_blockscale_1x128x128_256x64x128x128_16x16_32x32_1x2_8x32x1_8x32x1_1x32x1x8_8_1x1_intrawave_v3,538.57,657.44,0.0
256,1024,2048,4096,ck,2,0,25.9619,a8w8_blockscale_1x128x128_256x64x128x128_16x16_32x32_1x2_8x32x1_8x32x1_1x32x1x8_8_1x1_intrawave_v3,661.73,646.22,0.0
256,1025,2048,128,ck,6,0,6.0545,a8w8_blockscale_1x128x128_256x16x64x128_8x16_16x16_1x1_16x16x1_8x32x1_1x16x1x16_4_1x1_intrawave_v1,88.76,758.4,0.0
256,1025,2048,512,ck,18,0,8.5232,a8w8_blockscale_1x128x128_256x64x64x256_16x16_32x32_1x1_16x16x1_16x16x1_1x32x1x8_8_1x1_intrawave_v1,252.2,677.18,0.0
256,1025,2048,1024,ck,3,0,12.6115,a8w8_blockscale_1x128x128_256x64x64x128_16x16_32x32_1x1_8x32x1_8x32x1_1x32x1x8_8_1x1_intrawave_v3,340.89,582.42,0.0
256,1025,2048,2048,ck,3,0,19.1042,a8w8_blockscale_1x128x128_256x64x64x128_16x16_32x32_1x1_8x32x1_8x32x1_1x32x1x8_8_1x1_intrawave_v3,450.08,549.19,0.0
256,1025,2048,4096,ck,0,0,32.0708,a8w8_blockscale_1x128x128_256x128x128x128_16x16_32x32_2x2_8x32x1_8x32x1_1x32x1x8_8_1x1_intrawave_v3,536.21,523.39,0.0
256,1027,2048,128,ck,11,0,6.1528,a8w8_blockscale_1x128x128_256x32x64x128_16x16_16x16_2x1_8x32x1_8x32x1_1x32x1x8_8_2x1_intrawave_v1,87.51,747.66,0.0
256,1027,2048,512,ck,18,0,8.524,a8w8_blockscale_1x128x128_256x64x64x256_16x16_32x32_1x1_16x16x1_16x16x1_1x32x1x8_8_1x1_intrawave_v1,252.67,678.2,0.0
256,1027,2048,1024,ck,3,0,11.9871,a8w8_blockscale_1x128x128_256x64x64x128_16x16_32x32_1x1_8x32x1_8x32x1_1x32x1x8_8_1x1_intrawave_v3,359.35,613.61,0.0
256,1027,2048,4096,ck,0,0,32.0309,a8w8_blockscale_1x128x128_256x128x128x128_16x16_32x32_2x2_8x32x1_8x32x1_1x32x1x8_8_1x1_intrawave_v3,537.92,524.55,0.0
256,1031,2048,512,ck,8,0,8.7199,a8w8_blockscale_1x128x128_256x16x64x256_16x16_16x16_1x1_16x16x1_16x16x1_1x16x1x16_4_1x1_intrawave_v1,247.96,665.08,0.0
256,1031,2048,4096,ck,0,0,32.1926,a8w8_blockscale_1x128x128_256x128x128x128_16x16_32x32_2x2_8x32x1_8x32x1_1x32x1x8_8_1x1_intrawave_v3,537.31,522.93,0.0
256,1032,2048,2048,ck,3,0,19.1954,a8w8_blockscale_1x128x128_256x64x64x128_16x16_32x32_1x1_8x32x1_8x32x1_1x32x1x8_8_1x1_intrawave_v3,451.0,548.82,0.0
256,1038,2048,2048,ck,3,0,19.1726,a8w8_blockscale_1x128x128_256x64x64x128_16x16_32x32_1x1_8x32x1_8x32x1_1x32x1x8_8_1x1_intrawave_v3,454.16,551.4,0.0
256,1039,2048,512,ck,13,0,8.4045,a8w8_blockscale_1x128x128_256x32x64x256_16x16_16x16_2x1_16x16x1_16x16x1_1x32x1x8_8_2x1_intrawave_v1,259.26,694.42,0.0
256,1039,2048,4096,ck,0,0,32.2145,a8w8_blockscale_1x128x128_256x128x128x128_16x16_32x32_2x2_8x32x1_8x32x1_1x32x1x8_8_1x1_intrawave_v3,541.11,524.61,0.0
256,1040,2048,512,ck,13,0,9.0454,a8w8_blockscale_1x128x128_256x32x64x256_16x16_16x16_2x1_16x16x1_16x16x1_1x32x1x8_8_2x1_intrawave_v1,241.12,645.73,0.0
256,1040,2048,4096,ck,0,0,32.1695,a8w8_blockscale_1x128x128_256x128x128x128_16x16_32x32_2x2_8x32x1_8x32x1_1x32x1x8_8_1x1_intrawave_v3,542.39,525.6,0.0
256,1041,2048,512,ck,13,0,8.4391,a8w8_blockscale_1x128x128_256x32x64x256_16x16_16x16_2x1_16x16x1_16x16x1_1x32x1x8_8_2x1_intrawave_v1,258.69,692.67,0.0
256,1041,2048,4096,ck,2,0,32.2466,a8w8_blockscale_1x128x128_256x64x128x128_16x16_32x32_1x2_8x32x1_8x32x1_1x32x1x8_8_1x1_intrawave_v3,541.61,524.6,0.0
256,1042,2048,128,ck,8,0,6.5263,a8w8_blockscale_1x128x128_256x16x64x256_16x16_16x16_1x1_16x16x1_16x16x1_1x16x1x16_4_1x1_intrawave_v1,83.71,714.58,0.0
256,1042,2048,1024,ck,3,0,12.2121,a8w8_blockscale_1x128x128_256x64x64x128_16x16_32x32_1x1_8x32x1_8x32x1_1x32x1x8_8_1x1_intrawave_v3,357.88,608.59,0.0
256,1051,2048,128,ck,6,0,6.0702,a8w8_blockscale_1x128x128_256x16x64x128_8x16_16x16_1x1_16x16x1_8x32x1_1x16x1x16_4_1x1_intrawave_v1,90.78,774.53,0.0
256,1051,2048,1024,ck,3,0,12.2735,a8w8_blockscale_1x128x128_256x64x64x128_16x16_32x32_1x1_8x32x1_8x32x1_1x32x1x8_8_1x1_intrawave_v3,359.17,609.3,0.0
256,1055,2048,128,ck,6,0,6.0109,a8w8_blockscale_1x128x128_256x16x64x128_8x16_16x16_1x1_16x16x1_8x32x1_1x16x1x16_4_1x1_intrawave_v1,92.02,784.98,0.0
256,1055,2048,1024,ck,3,0,12.1464,a8w8_blockscale_1x128x128_256x64x64x128_16x16_32x32_1x1_8x32x1_8x32x1_1x32x1x8_8_1x1_intrawave_v3,364.3,617.36,0.0
256,1057,2048,128,ck,6,0,6.1261,a8w8_blockscale_1x128x128_256x16x64x128_8x16_16x16_1x1_16x16x1_8x32x1_1x16x1x16_4_1x1_intrawave_v1,90.46,771.6,0.0
256,1057,2048,1024,ck,3,0,11.6766,a8w8_blockscale_1x128x128_256x64x64x128_16x16_32x32_1x1_8x32x1_8x32x1_1x32x1x8_8_1x1_intrawave_v3,379.68,643.08,0.0
256,1069,2048,128,ck,6,0,6.037,a8w8_blockscale_1x128x128_256x16x64x128_8x16_16x16_1x1_16x16x1_8x32x1_1x16x1x16_4_1x1_intrawave_v1,92.84,791.39,0.0
256,1069,2048,1024,ck,3,0,12.4064,a8w8_blockscale_1x128x128_256x64x64x128_16x16_32x32_1x1_8x32x1_8x32x1_1x32x1x8_8_1x1_intrawave_v3,361.4,610.2,0.0
256,1072,2048,128,ck,11,0,6.1938,a8w8_blockscale_1x128x128_256x32x64x128_16x16_16x16_2x1_8x32x1_8x32x1_1x32x1x8_8_2x1_intrawave_v1,90.74,773.4,0.0
256,1072,2048,512,ck,18,0,8.5123,a8w8_blockscale_1x128x128_256x64x64x256_16x16_32x32_1x1_16x16x1_16x16x1_1x32x1x8_8_1x1_intrawave_v1,264.11,703.49,0.0
256,1072,2048,1024,ck,3,0,12.5427,a8w8_blockscale_1x128x128_256x64x64x128_16x16_32x32_1x1_8x32x1_8x32x1_1x32x1x8_8_1x1_intrawave_v3,358.48,604.8,0.0
256,1072,2048,4096,ck,2,0,32.4638,a8w8_blockscale_1x128x128_256x64x128x128_16x16_32x32_1x2_8x32x1_8x32x1_1x32x1x8_8_1x1_intrawave_v3,554.01,528.91,0.0
256,1073,2048,512,ck,8,0,8.862,a8w8_blockscale_1x128x128_256x16x64x256_16x16_16x16_1x1_16x16x1_16x16x1_1x16x1x16_4_1x1_intrawave_v1,253.92,676.25,0.0
256,1073,2048,4096,ck,2,0,32.3754,a8w8_blockscale_1x128x128_256x64x128x128_16x16_32x32_1x2_8x32x1_8x32x1_1x32x1x8_8_1x1_intrawave_v3,556.04,530.61,0.0
256,1074,2048,128,ck,8,0,6.6595,a8w8_blockscale_1x128x128_256x16x64x256_16x16_16x16_1x1_16x16x1_16x16x1_1x16x1x16_4_1x1_intrawave_v1,84.55,720.58,0.0
256,1074,2048,1024,ck,3,0,12.4999,a8w8_blockscale_1x128x128_256x64x64x128_16x16_32x32_1x1_8x32x1_8x32x1_1x32x1x8_8_1x1_intrawave_v3,360.38,607.69,0.0
256,1077,2048,512,ck,13,0,8.4863,a8w8_blockscale_1x128x128_256x32x64x256_16x16_16x16_2x1_16x16x1_16x16x1_1x32x1x8_8_2x1_intrawave_v1,266.15,708.36,0.0
256,1077,2048,4096,ck,2,0,32.3005,a8w8_blockscale_1x128x128_256x64x128x128_16x16_32x32_1x2_8x32x1_8x32x1_1x32x1x8_8_1x1_intrawave_v3,559.41,532.85,0.0
256,1087,2048,2048,ck,3,0,19.34,a8w8_blockscale_1x128x128_256x64x64x128_16x16_32x32_1x1_8x32x1_8x32x1_1x32x1x8_8_1x1_intrawave_v3,471.48,562.19,0.0
256,1091,2048,128,ck,5,0,6.4714,a8w8_blockscale_1x128x128_256x16x128x128_8x16_16x16_1x2_16x16x1_8x32x1_1x16x1x16_8_1x2_intrawave_v1,88.39,752.62,0.0
256,1091,2048,512,ck,18,0,8.6408,a8w8_blockscale_1x128x128_256x64x64x256_16x16_32x32_1x1_16x16x1_16x16x1_1x32x1x8_8_1x1_intrawave_v1,264.79,703.16,0.0
256,1091,2048,1024,ck,3,0,12.4411,a8w8_blockscale_1x128x128_256x64x64x128_16x16_32x32_1x1_8x32x1_8x32x1_1x32x1x8_8_1x1_intrawave_v3,367.81,617.56,0.0
256,1091,2048,4096,ck,0,0,32.5627,a8w8_blockscale_1x128x128_256x128x128x128_16x16_32x32_2x2_8x32x1_8x32x1_1x32x1x8_8_1x1_intrawave_v3,562.11,532.08,0.0
256,1128,2048,128,ck,16,0,6.4107,a8w8_blockscale_1x128x128_256x64x64x128_16x16_32x32_1x1_8x32x1_8x32x1_1x32x1x8_8_1x1_intrawave_v1,92.25,784.13,0.0
256,1128,2048,1024,ck,3,0,12.5056,a8w8_blockscale_1x128x128_256x64x64x128_16x16_32x32_1x1_8x32x1_8x32x1_1x32x1x8_8_1x1_intrawave_v3,378.32,629.52,0.0
256,1136,2048,128,ck,6,0,6.237,a8w8_blockscale_1x128x128_256x16x64x128_8x16_16x16_1x1_16x16x1_8x32x1_1x16x1x16_4_1x1_intrawave_v1,95.49,811.38,0.0
256,1136,2048,1024,ck,3,0,12.212,a8w8_blockscale_1x128x128_256x64x64x128_16x16_32x32_1x1_8x32x1_8x32x1_1x32x1x8_8_1x1_intrawave_v3,390.17,648.01,0.0
256,1255,2048,2048,ck,3,0,19.4981,a8w8_blockscale_1x128x128_256x64x64x128_16x16_32x32_1x1_8x32x1_8x32x1_1x32x1x8_8_1x1_intrawave_v3,539.93,610.57,0.0
256,1343,2048,512,ck,3,0,9.2404,a8w8_blockscale_1x128x128_256x64x64x128_16x16_32x32_1x1_8x32x1_8x32x1_1x32x1x8_8_1x1_intrawave_v3,304.8,783.2,0.0
256,1343,2048,4096,ck,0,0,33.1555,a8w8_blockscale_1x128x128_256x128x128x128_16x16_32x32_2x2_8x32x1_8x32x1_1x32x1x8_8_1x1_intrawave_v3,679.58,584.83,0.0
256,1351,2048,2048,ck,0,0,20.1369,a8w8_blockscale_1x128x128_256x128x128x128_16x16_32x32_2x2_8x32x1_8x32x1_1x32x1x8_8_1x1_intrawave_v3,562.8,620.5,0.0
256,1376,2048,2048,ck,0,0,20.0813,a8w8_blockscale_1x128x128_256x128x128x128_16x16_32x32_2x2_8x32x1_8x32x1_1x32x1x8_8_1x1_intrawave_v3,574.8,629.86,0.0
256,1380,2048,2048,ck,0,0,20.1657,a8w8_blockscale_1x128x128_256x128x128x128_16x16_32x32_2x2_8x32x1_8x32x1_1x32x1x8_8_1x1_intrawave_v3,574.06,628.44,0.0
256,1391,2048,2048,ck,0,0,20.0721,a8w8_blockscale_1x128x128_256x128x128x128_16x16_32x32_2x2_8x32x1_8x32x1_1x32x1x8_8_1x1_intrawave_v3,581.33,634.74,0.0
256,1514,2048,128,ck,16,0,7.1696,a8w8_blockscale_1x128x128_256x64x64x128_16x16_32x32_1x1_8x32x1_8x32x1_1x32x1x8_8_1x1_intrawave_v1,110.71,928.54,0.0
256,1514,2048,1024,ck,2,0,13.8856,a8w8_blockscale_1x128x128_256x64x128x128_16x16_32x32_1x2_8x32x1_8x32x1_1x32x1x8_8_1x1_intrawave_v3,457.32,709.28,0.0
256,1688,2048,512,ck,18,0,10.1138,a8w8_blockscale_1x128x128_256x64x64x256_16x16_32x32_1x1_16x16x1_16x16x1_1x32x1x8_8_1x1_intrawave_v1,350.02,872.76,0.0
256,1688,2048,4096,ck,0,0,33.8937,a8w8_blockscale_1x128x128_256x128x128x128_16x16_32x32_2x2_8x32x1_8x32x1_1x32x1x8_8_1x1_intrawave_v3,835.55,655.48,0.0
256,1710,2048,2048,ck,0,0,20.5402,a8w8_blockscale_1x128x128_256x128x128x128_16x16_32x32_2x2_8x32x1_8x32x1_1x32x1x8_8_1x1_intrawave_v3,698.36,715.7,0.0
256,1808,2048,2048,ck,0,0,20.6549,a8w8_blockscale_1x128x128_256x128x128x128_16x16_32x32_2x2_8x32x1_8x32x1_1x32x1x8_8_1x1_intrawave_v3,734.29,740.87,0.0
256,1809,2048,2048,ck,0,0,20.6638,a8w8_blockscale_1x128x128_256x128x128x128_16x16_32x32_2x2_8x32x1_8x32x1_1x32x1x8_8_1x1_intrawave_v3,734.38,740.85,0.0
256,1870,2048,2048,ck,0,0,20.7512,a8w8_blockscale_1x128x128_256x128x128x128_16x16_32x32_2x2_8x32x1_8x32x1_1x32x1x8_8_1x1_intrawave_v3,755.94,755.79,0.0
256,1967,2048,2048,ck,0,0,21.017,a8w8_blockscale_1x128x128_256x128x128x128_16x16_32x32_2x2_8x32x1_8x32x1_1x32x1x8_8_1x1_intrawave_v3,785.1,774.59,0.0
256,1970,2048,2048,ck,0,0,20.9873,a8w8_blockscale_1x128x128_256x128x128x128_16x16_32x32_2x2_8x32x1_8x32x1_1x32x1x8_8_1x1_intrawave_v3,787.41,776.56,0.0
256,2000,2048,2048,ck,0,0,20.9511,a8w8_blockscale_1x128x128_256x128x128x128_16x16_32x32_2x2_8x32x1_8x32x1_1x32x1x8_8_1x1_intrawave_v3,800.78,786.7,0.0
256,2001,2048,2048,ck,0,0,21.0646,a8w8_blockscale_1x128x128_256x128x128x128_16x16_32x32_2x2_8x32x1_8x32x1_1x32x1x8_8_1x1_intrawave_v3,796.86,782.76,0.0
256,2016,2048,2048,ck,0,0,21.229,a8w8_blockscale_1x128x128_256x128x128x128_16x16_32x32_2x2_8x32x1_8x32x1_1x32x1x8_8_1x1_intrawave_v3,796.62,781.04,0.0
256,2017,2048,128,ck,16,0,8.1303,a8w8_blockscale_1x128x128_256x64x64x128_16x16_32x32_1x1_8x32x1_8x32x1_1x32x1x8_8_1x1_intrawave_v1,130.07,1080.15,0.0
256,2017,2048,512,ck,2,0,11.0715,a8w8_blockscale_1x128x128_256x64x128x128_16x16_32x32_1x2_8x32x1_8x32x1_1x32x1x8_8_1x1_intrawave_v3,382.06,934.19,0.0
256,2017,2048,1024,ck,0,0,14.1468,a8w8_blockscale_1x128x128_256x128x128x128_16x16_32x32_2x2_8x32x1_8x32x1_1x32x1x8_8_1x1_intrawave_v3,598.01,878.23,0.0
256,2017,2048,2048,ck,0,0,21.1876,a8w8_blockscale_1x128x128_256x128x128x128_16x16_32x32_2x2_8x32x1_8x32x1_1x32x1x8_8_1x1_intrawave_v3,798.57,782.85,0.0
256,2017,2048,4096,ck,0,0,35.7304,a8w8_blockscale_1x128x128_256x128x128x128_16x16_32x32_2x2_8x32x1_8x32x1_1x32x1x8_8_1x1_intrawave_v3,947.08,697.22,0.0
256,2046,2048,2048,ck,0,0,21.141,a8w8_blockscale_1x128x128_256x128x128x128_16x16_32x32_2x2_8x32x1_8x32x1_1x32x1x8_8_1x1_intrawave_v3,811.84,793.01,0.0
256,2048,2048,128,ck,16,0,7.8257,a8w8_blockscale_1x128x128_256x64x64x128_16x16_32x32_1x1_8x32x1_8x32x1_1x32x1x8_8_1x1_intrawave_v1,137.21,1138.93,0.0
256,2048,2048,512,ck,0,0,10.4623,a8w8_blockscale_1x128x128_256x128x128x128_16x16_32x32_2x2_8x32x1_8x32x1_1x32x1x8_8_1x1_intrawave_v3,410.52,1002.24,0.0
256,2048,2048,1024,ck,2,0,14.5769,a8w8_blockscale_1x128x128_256x64x128x128_16x16_32x32_1x2_8x32x1_8x32x1_1x32x1x8_8_1x1_intrawave_v3,589.28,863.21,0.0
256,2048,2048,2048,ck,0,0,20.3678,a8w8_blockscale_1x128x128_256x128x128x128_16x16_32x32_2x2_8x32x1_8x32x1_1x32x1x8_8_1x1_intrawave_v3,843.48,823.71,0.0
256,2048,2048,4096,ck,0,0,35.2309,a8w8_blockscale_1x128x128_256x128x128x128_16x16_32x32_2x2_8x32x1_8x32x1_1x32x1x8_8_1x1_intrawave_v3,975.27,714.31,0.0
256,2050,2048,512,ck,13,0,11.9914,a8w8_blockscale_1x128x128_256x32x64x256_16x16_16x16_2x1_16x16x1_16x16x1_1x32x1x8_8_2x1_intrawave_v1,358.52,875.21,0.0
256,2050,2048,2048,ck,2,0,28.1295,a8w8_blockscale_1x128x128_256x64x128x128_16x16_32x32_1x2_8x32x1_8x32x1_1x32x1x8_8_1x1_intrawave_v3,611.34,596.86,0.0
256,2050,2048,4096,ck,2,0,48.7506,a8w8_blockscale_1x128x128_256x64x128x128_16x16_32x32_1x2_8x32x1_8x32x1_1x32x1x8_8_1x1_intrawave_v3,705.49,516.55,0.0
256,2063,2048,512,ck,18,0,12.6799,a8w8_blockscale_1x128x128_256x64x64x256_16x16_32x32_1x1_16x16x1_16x16x1_1x32x1x8_8_1x1_intrawave_v1,341.2,832.41,0.0
256,2063,2048,4096,ck,2,0,48.6006,a8w8_blockscale_1x128x128_256x64x128x128_16x16_32x32_1x2_8x32x1_8x32x1_1x32x1x8_8_1x1_intrawave_v3,712.16,520.34,0.0
256,2064,2048,512,ck,18,0,11.8224,a8w8_blockscale_1x128x128_256x64x64x256_16x16_32x32_1x1_16x16x1_16x16x1_1x32x1x8_8_1x1_intrawave_v1,366.13,893.18,0.0
256,2064,2048,4096,ck,2,0,48.5534,a8w8_blockscale_1x128x128_256x64x128x128_16x16_32x32_1x2_8x32x1_8x32x1_1x32x1x8_8_1x1_intrawave_v3,713.2,521.01,0.0
256,2081,2048,2048,ck,2,0,27.9971,a8w8_blockscale_1x128x128_256x64x128x128_16x16_32x32_1x2_8x32x1_8x32x1_1x32x1x8_8_1x1_intrawave_v3,623.52,606.49,0.0
256,2095,2048,2048,ck,2,0,28.1786,a8w8_blockscale_1x128x128_256x64x128x128_16x16_32x32_1x2_8x32x1_8x32x1_1x32x1x8_8_1x1_intrawave_v3,623.67,605.64,0.0
256,2099,2048,512,ck,18,0,12.077,a8w8_blockscale_1x128x128_256x64x64x256_16x16_32x32_1x1_16x16x1_16x16x1_1x32x1x8_8_1x1_intrawave_v1,364.49,887.7,0.0
256,2099,2048,4096,ck,2,0,48.3957,a8w8_blockscale_1x128x128_256x64x128x128_16x16_32x32_1x2_8x32x1_8x32x1_1x32x1x8_8_1x1_intrawave_v3,727.66,528.63,0.0
256,2151,2048,128,ck,5,0,9.3961,a8w8_blockscale_1x128x128_256x16x128x128_8x16_16x16_1x2_16x16x1_8x32x1_1x16x1x16_8_1x2_intrawave_v1,120.02,994.88,0.0
256,2151,2048,1024,ck,2,0,18.6107,a8w8_blockscale_1x128x128_256x64x128x128_16x16_32x32_1x2_8x32x1_8x32x1_1x32x1x8_8_1x1_intrawave_v3,484.77,704.45,0.0
256,2154,2048,2048,ck,2,0,28.6466,a8w8_blockscale_1x128x128_256x64x128x128_16x16_32x32_1x2_8x32x1_8x32x1_1x32x1x8_8_1x1_intrawave_v3,630.76,608.4,0.0
256,2159,2048,512,ck,18,0,12.303,a8w8_blockscale_1x128x128_256x64x64x256_16x16_32x32_1x1_16x16x1_16x16x1_1x32x1x8_8_1x1_intrawave_v1,368.02,893.87,0.0
256,2159,2048,2048,ck,2,0,28.5996,a8w8_blockscale_1x128x128_256x64x128x128_16x16_32x32_1x2_8x32x1_8x32x1_1x32x1x8_8_1x1_intrawave_v3,633.26,610.47,0.0
256,2159,2048,4096,ck,0,0,49.2696,a8w8_blockscale_1x128x128_256x128x128x128_16x16_32x32_2x2_8x32x1_8x32x1_1x32x1x8_8_1x1_intrawave_v3,735.18,529.23,0.0
256,2160,2048,512,ck,18,0,12.4899,a8w8_blockscale_1x128x128_256x64x64x256_16x16_32x32_1x1_16x16x1_16x16x1_1x32x1x8_8_1x1_intrawave_v1,362.68,880.86,0.0
256,2160,2048,4096,ck,0,0,49.6471,a8w8_blockscale_1x128x128_256x128x128x128_16x16_32x32_2x2_8x32x1_8x32x1_1x32x1x8_8_1x1_intrawave_v3,729.93,525.37,0.0
256,2162,2048,2048,ck,2,0,28.8194,a8w8_blockscale_1x128x128_256x64x128x128_16x16_32x32_1x2_8x32x1_8x32x1_1x32x1x8_8_1x1_intrawave_v3,629.3,606.45,0.0
256,2165,2048,2048,ck,2,0,28.7112,a8w8_blockscale_1x128x128_256x64x128x128_16x16_32x32_1x2_8x32x1_8x32x1_1x32x1x8_8_1x1_intrawave_v3,632.55,609.38,0.0
256,2251,2048,2048,ck,2,0,28.5854,a8w8_blockscale_1x128x128_256x64x128x128_16x16_32x32_1x2_8x32x1_8x32x1_1x32x1x8_8_1x1_intrawave_v3,660.57,630.55,0.0
256,2252,2048,2048,ck,2,0,28.2136,a8w8_blockscale_1x128x128_256x64x128x128_16x16_32x32_1x2_8x32x1_8x32x1_1x32x1x8_8_1x1_intrawave_v3,669.58,639.07,0.0
256,2255,2048,2048,ck,2,0,28.2851,a8w8_blockscale_1x128x128_256x64x128x128_16x16_32x32_1x2_8x32x1_8x32x1_1x32x1x8_8_1x1_intrawave_v3,668.77,638.11,0.0
256,2313,2048,512,ck,18,0,13.0584,a8w8_blockscale_1x128x128_256x64x64x256_16x16_32x32_1x1_16x16x1_16x16x1_1x32x1x8_8_1x1_intrawave_v1,371.46,896.5,0.0
256,2313,2048,4096,ck,2,0,49.6006,a8w8_blockscale_1x128x128_256x64x128x128_16x16_32x32_1x2_8x32x1_8x32x1_1x32x1x8_8_1x1_intrawave_v3,782.36,551.14,0.0
256,2317,2048,2048,ck,2,0,28.4101,a8w8_blockscale_1x128x128_256x64x128x128_16x16_32x32_1x2_8x32x1_8x32x1_1x32x1x8_8_1x1_intrawave_v3,684.14,648.71,0.0
256,2325,2048,512,ck,18,0,12.9159,a8w8_blockscale_1x128x128_256x64x64x256_16x16_32x32_1x1_16x16x1_16x16x1_1x32x1x8_8_1x1_intrawave_v1,377.51,910.67,0.0
256,2325,2048,4096,ck,2,0,49.2873,a8w8_blockscale_1x128x128_256x64x128x128_16x16_32x32_1x2_8x32x1_8x32x1_1x32x1x8_8_1x1_intrawave_v3,791.42,556.63,0.0
256,2332,2048,128,ck,16,0,9.2266,a8w8_blockscale_1x128x128_256x64x64x128_16x16_32x32_1x1_8x32x1_8x32x1_1x32x1x8_8_1x1_intrawave_v1,132.51,1096.02,0.0
256,2332,2048,1024,ck,2,0,18.6191,a8w8_blockscale_1x128x128_256x64x128x128_16x16_32x32_1x2_8x32x1_8x32x1_1x32x1x8_8_1x1_intrawave_v3,525.33,753.9,0.0
256,2341,2048,128,ck,16,0,9.2815,a8w8_blockscale_1x128x128_256x64x64x128_16x16_32x32_1x1_8x32x1_8x32x1_1x32x1x8_8_1x1_intrawave_v1,132.24,1093.63,0.0
256,2341,2048,1024,ck,2,0,18.7498,a8w8_blockscale_1x128x128_256x64x128x128_16x16_32x32_1x2_8x32x1_8x32x1_1x32x1x8_8_1x1_intrawave_v3,523.68,751.11,0.0
256,2694,2048,2048,ck,2,0,29.8708,a8w8_blockscale_1x128x128_256x64x128x128_16x16_32x32_1x2_8x32x1_8x32x1_1x32x1x8_8_1x1_intrawave_v3,756.56,694.53,0.0
256,2715,2048,2048,ck,2,0,29.576,a8w8_blockscale_1x128x128_256x64x128x128_16x16_32x32_1x2_8x32x1_8x32x1_1x32x1x8_8_1x1_intrawave_v3,770.05,705.82,0.0
256,2819,2048,2048,ck,2,0,29.544,a8w8_blockscale_1x128x128_256x64x128x128_16x16_32x32_1x2_8x32x1_8x32x1_1x32x1x8_8_1x1_intrawave_v3,800.42,728.21,0.0
256,2853,2048,2048,ck,2,0,30.5168,a8w8_blockscale_1x128x128_256x64x128x128_16x16_32x32_1x2_8x32x1_8x32x1_1x32x1x8_8_1x1_intrawave_v3,784.25,711.84,0.0
256,2914,2048,2048,ck,2,0,30.3952,a8w8_blockscale_1x128x128_256x64x128x128_16x16_32x32_1x2_8x32x1_8x32x1_1x32x1x8_8_1x1_intrawave_v3,804.22,727.02,0.0
256,2974,2048,2048,ck,2,0,30.244,a8w8_blockscale_1x128x128_256x64x128x128_16x16_32x32_1x2_8x32x1_8x32x1_1x32x1x8_8_1x1_intrawave_v3,824.88,742.84,0.0
256,3000,2048,2048,ck,2,0,30.2172,a8w8_blockscale_1x128x128_256x64x128x128_16x16_32x32_1x2_8x32x1_8x32x1_1x32x1x8_8_1x1_intrawave_v3,832.83,748.79,0.0
256,3001,2048,2048,ck,2,0,30.0076,a8w8_blockscale_1x128x128_256x64x128x128_16x16_32x32_1x2_8x32x1_8x32x1_1x32x1x8_8_1x1_intrawave_v3,838.93,754.22,0.0
256,3072,2048,128,ck,16,0,10.2691,a8w8_blockscale_1x128x128_256x64x64x128_16x16_32x32_1x1_8x32x1_8x32x1_1x32x1x8_8_1x1_intrawave_v1,156.84,1289.14,0.0
256,3072,2048,512,ck,18,0,13.7328,a8w8_blockscale_1x128x128_256x64x64x256_16x16_32x32_1x1_16x16x1_16x16x1_1x32x1x8_8_1x1_intrawave_v1,469.13,1107.16,0.0
256,3072,2048,1024,ck,2,0,19.8343,a8w8_blockscale_1x128x128_256x64x128x128_16x16_32x32_1x2_8x32x1_8x32x1_1x32x1x8_8_1x1_intrawave_v3,649.63,898.74,0.0
256,3072,2048,2048,ck,0,0,30.0182,a8w8_blockscale_1x128x128_256x128x128x128_16x16_32x32_2x2_8x32x1_8x32x1_1x32x1x8_8_1x1_intrawave_v3,858.47,768.49,0.0
256,3072,2048,4096,ck,0,0,51.947,a8w8_blockscale_1x128x128_256x128x128x128_16x16_32x32_2x2_8x32x1_8x32x1_1x32x1x8_8_1x1_intrawave_v3,992.16,645.94,0.0
256,3073,2048,128,ck,16,0,11.0895,a8w8_blockscale_1x128x128_256x64x64x128_16x16_32x32_1x1_8x32x1_8x32x1_1x32x1x8_8_1x1_intrawave_v1,145.28,1194.15,0.0
256,3073,2048,512,ck,18,0,15.9842,a8w8_blockscale_1x128x128_256x64x64x256_16x16_32x32_1x1_16x16x1_16x16x1_1x32x1x8_8_1x1_intrawave_v1,403.18,951.5,0.0
256,3073,2048,1024,ck,0,0,21.2577,a8w8_blockscale_1x128x128_256x128x128x128_16x16_32x32_2x2_8x32x1_8x32x1_1x32x1x8_8_1x1_intrawave_v3,606.33,838.8,0.0
256,3073,2048,2048,ck,0,0,31.1087,a8w8_blockscale_1x128x128_256x128x128x128_16x16_32x32_2x2_8x32x1_8x32x1_1x32x1x8_8_1x1_intrawave_v3,828.65,741.75,0.0
256,3073,2048,4096,ck,0,0,52.9766,a8w8_blockscale_1x128x128_256x128x128x128_16x16_32x32_2x2_8x32x1_8x32x1_1x32x1x8_8_1x1_intrawave_v3,973.19,633.54,0.0
256,3077,2048,2048,ck,0,0,31.1558,a8w8_blockscale_1x128x128_256x128x128x128_16x16_32x32_2x2_8x32x1_8x32x1_1x32x1x8_8_1x1_intrawave_v3,828.47,741.42,0.0
256,3078,2048,2048,ck,0,0,31.3455,a8w8_blockscale_1x128x128_256x128x128x128_16x16_32x32_2x2_8x32x1_8x32x1_1x32x1x8_8_1x1_intrawave_v3,823.73,737.12,0.0
256,3086,2048,2048,ck,0,0,30.8836,a8w8_blockscale_1x128x128_256x128x128x128_16x16_32x32_2x2_8x32x1_8x32x1_1x32x1x8_8_1x1_intrawave_v3,838.22,749.74,0.0
256,3089,2048,128,ck,16,0,11.0483,a8w8_blockscale_1x128x128_256x64x64x128_16x16_32x32_1x1_8x32x1_8x32x1_1x32x1x8_8_1x1_intrawave_v1,146.59,1204.72,0.0
256,3089,2048,1024,ck,0,0,21.1753,a8w8_blockscale_1x128x128_256x128x128x128_16x16_32x32_2x2_8x32x1_8x32x1_1x32x1x8_8_1x1_intrawave_v3,611.85,845.93,0.0
256,3089,2048,2048,ck,0,0,30.9546,a8w8_blockscale_1x128x128_256x128x128x128_16x16_32x32_2x2_8x32x1_8x32x1_1x32x1x8_8_1x1_intrawave_v3,837.11,748.62,0.0
256,3110,2048,128,ck,11,0,11.6787,a8w8_blockscale_1x128x128_256x32x64x128_16x16_16x16_2x1_8x32x1_8x32x1_1x32x1x8_8_2x1_intrawave_v1,139.62,1147.28,0.0
256,3110,2048,1024,ck,0,0,21.1494,a8w8_blockscale_1x128x128_256x128x128x128_16x16_32x32_2x2_8x32x1_8x32x1_1x32x1x8_8_1x1_intrawave_v3,616.77,852.05,0.0
256,3118,2048,2048,ck,0,0,31.2359,a8w8_blockscale_1x128x128_256x128x128x128_16x16_32x32_2x2_8x32x1_8x32x1_1x32x1x8_8_1x1_intrawave_v3,837.36,747.58,0.0
256,3137,2048,128,ck,16,0,11.6089,a8w8_blockscale_1x128x128_256x64x64x128_16x16_32x32_1x1_8x32x1_8x32x1_1x32x1x8_8_1x1_intrawave_v1,141.68,1164.01,0.0
256,3137,2048,1024,ck,0,0,21.237,a8w8_blockscale_1x128x128_256x128x128x128_16x16_32x32_2x2_8x32x1_8x32x1_1x32x1x8_8_1x1_intrawave_v3,619.56,855.05,0.0
256,3138,2048,2048,ck,0,0,31.0792,a8w8_blockscale_1x128x128_256x128x128x128_16x16_32x32_2x2_8x32x1_8x32x1_1x32x1x8_8_1x1_intrawave_v3,846.98,755.3,0.0
256,3154,2048,2048,ck,0,0,30.9923,a8w8_blockscale_1x128x128_256x128x128x128_16x16_32x32_2x2_8x32x1_8x32x1_1x32x1x8_8_1x1_intrawave_v3,853.69,760.59,0.0
256,3182,2048,512,ck,18,0,15.3393,a8w8_blockscale_1x128x128_256x64x64x256_16x16_32x32_1x1_16x16x1_16x16x1_1x32x1x8_8_1x1_intrawave_v1,435.04,1024.25,0.0
256,3182,2048,4096,ck,0,0,53.883,a8w8_blockscale_1x128x128_256x128x128x128_16x16_32x32_2x2_8x32x1_8x32x1_1x32x1x8_8_1x1_intrawave_v3,990.76,639.45,0.0
256,3183,2048,512,ck,18,0,15.1777,a8w8_blockscale_1x128x128_256x64x64x256_16x16_32x32_1x1_16x16x1_16x16x1_1x32x1x8_8_1x1_intrawave_v1,439.81,1035.46,0.0
256,3183,2048,4096,ck,0,0,53.667,a8w8_blockscale_1x128x128_256x128x128x128_16x16_32x32_2x2_8x32x1_8x32x1_1x32x1x8_8_1x1_intrawave_v3,995.06,642.18,0.0
256,3289,2048,2048,ck,0,0,31.3011,a8w8_blockscale_1x128x128_256x128x128x128_16x16_32x32_2x2_8x32x1_8x32x1_1x32x1x8_8_1x1_intrawave_v3,881.44,779.59,0.0
256,3437,2048,2048,ck,0,0,31.2905,a8w8_blockscale_1x128x128_256x128x128x128_16x16_32x32_2x2_8x32x1_8x32x1_1x32x1x8_8_1x1_intrawave_v3,921.42,808.91,0.0
256,3613,2048,128,ck,16,0,12.6731,a8w8_blockscale_1x128x128_256x64x64x128_16x16_32x32_1x1_8x32x1_8x32x1_1x32x1x8_8_1x1_intrawave_v1,149.47,1224.91,0.0
256,3613,2048,1024,ck,0,0,21.9296,a8w8_blockscale_1x128x128_256x128x128x128_16x16_32x32_2x2_8x32x1_8x32x1_1x32x1x8_8_1x1_intrawave_v3,691.03,939.17,0.0
256,3617,2048,2048,ck,0,0,32.9807,a8w8_blockscale_1x128x128_256x128x128x128_16x16_32x32_2x2_8x32x1_8x32x1_1x32x1x8_8_1x1_intrawave_v3,919.98,800.99,0.0
256,3620,2048,2048,ck,0,0,32.4376,a8w8_blockscale_1x128x128_256x128x128x128_16x16_32x32_2x2_8x32x1_8x32x1_1x32x1x8_8_1x1_intrawave_v3,936.16,814.97,0.0
256,3669,2048,2048,ck,0,0,33.1621,a8w8_blockscale_1x128x128_256x128x128x128_16x16_32x32_2x2_8x32x1_8x32x1_1x32x1x8_8_1x1_intrawave_v3,928.1,806.24,0.0
256,3824,2048,2048,ck,0,0,33.5336,a8w8_blockscale_1x128x128_256x128x128x128_16x16_32x32_2x2_8x32x1_8x32x1_1x32x1x8_8_1x1_intrawave_v3,956.59,825.71,0.0
256,3847,2048,512,ck,0,0,16.7698,a8w8_blockscale_1x128x128_256x128x128x128_16x16_32x32_2x2_8x32x1_8x32x1_1x32x1x8_8_1x1_intrawave_v3,481.09,1119.61,0.0
256,3847,2048,4096,ck,0,0,58.625,a8w8_blockscale_1x128x128_256x128x128x128_16x16_32x32_2x2_8x32x1_8x32x1_1x32x1x8_8_1x1_intrawave_v3,1100.93,680.65,0.0
256,3858,2048,2048,ck,0,0,33.5025,a8w8_blockscale_1x128x128_256x128x128x128_16x16_32x32_2x2_8x32x1_8x32x1_1x32x1x8_8_1x1_intrawave_v3,966.0,832.71,0.0
256,3906,2048,2048,ck,0,0,33.4505,a8w8_blockscale_1x128x128_256x128x128x128_16x16_32x32_2x2_8x32x1_8x32x1_1x32x1x8_8_1x1_intrawave_v3,979.53,842.82,0.0
256,4000,2048,2048,ck,0,0,33.8209,a8w8_blockscale_1x128x128_256x128x128x128_16x16_32x32_2x2_8x32x1_8x32x1_1x32x1x8_8_1x1_intrawave_v3,992.12,850.67,0.0
256,4004,2048,2048,ck,0,0,34.0221,a8w8_blockscale_1x128x128_256x128x128x128_16x16_32x32_2x2_8x32x1_8x32x1_1x32x1x8_8_1x1_intrawave_v3,987.24,846.36,0.0
256,4096,2048,128,ck,16,0,12.9239,a8w8_blockscale_1x128x128_256x64x64x128_16x16_32x32_1x1_8x32x1_8x32x1_1x32x1x8_8_1x1_intrawave_v1,166.16,1359.01,0.0
256,4096,2048,512,ck,18,0,16.9892,a8w8_blockscale_1x128x128_256x64x64x256_16x16_32x32_1x1_16x16x1_16x16x1_1x32x1x8_8_1x1_intrawave_v1,505.61,1172.68,0.0
256,4096,2048,1024,ck,0,0,22.5433,a8w8_blockscale_1x128x128_256x128x128x128_16x16_32x32_2x2_8x32x1_8x32x1_1x32x1x8_8_1x1_intrawave_v3,762.08,1023.31,0.0
256,4096,2048,4096,ck,0,0,58.1098,a8w8_blockscale_1x128x128_256x128x128x128_16x16_32x32_2x2_8x32x1_8x32x1_1x32x1x8_8_1x1_intrawave_v3,1182.58,721.79,0.0
256,4097,2048,128,ck,16,0,13.533,a8w8_blockscale_1x128x128_256x64x64x128_16x16_32x32_1x1_8x32x1_8x32x1_1x32x1x8_8_1x1_intrawave_v1,158.72,1298.15,0.0
256,4097,2048,1024,ck,2,0,28.1801,a8w8_blockscale_1x128x128_256x64x128x128_16x16_32x32_1x2_8x32x1_8x32x1_1x32x1x8_8_1x1_intrawave_v3,609.79,818.8,0.0
256,4100,2048,2048,ck,2,0,45.3245,a8w8_blockscale_1x128x128_256x64x128x128_16x16_32x32_1x2_8x32x1_8x32x1_1x32x1x8_8_1x1_intrawave_v3,758.82,648.32,0.0
256,4108,2048,2048,ck,2,0,44.8449,a8w8_blockscale_1x128x128_256x64x128x128_16x16_32x32_1x2_8x32x1_8x32x1_1x32x1x8_8_1x1_intrawave_v3,768.44,656.35,0.0
256,4109,2048,128,ck,11,0,14.4791,a8w8_blockscale_1x128x128_256x32x64x128_16x16_16x16_2x1_8x32x1_8x32x1_1x32x1x8_8_2x1_intrawave_v1,148.79,1216.83,0.0
256,4109,2048,1024,ck,2,0,28.3396,a8w8_blockscale_1x128x128_256x64x128x128_16x16_32x32_1x2_8x32x1_8x32x1_1x32x1x8_8_1x1_intrawave_v3,608.14,816.36,0.0
256,4111,2048,512,ck,18,0,18.3068,a8w8_blockscale_1x128x128_256x64x64x256_16x16_32x32_1x1_16x16x1_16x16x1_1x32x1x8_8_1x1_intrawave_v1,470.94,1092.06,0.0
256,4111,2048,4096,ck,0,0,77.9515,a8w8_blockscale_1x128x128_256x128x128x128_16x16_32x32_2x2_8x32x1_8x32x1_1x32x1x8_8_1x1_intrawave_v3,884.8,539.64,0.0
256,4121,2048,2048,ck,0,0,45.4363,a8w8_blockscale_1x128x128_256x128x128x128_16x16_32x32_2x2_8x32x1_8x32x1_1x32x1x8_8_1x1_intrawave_v3,760.83,649.56,0.0
256,4123,2048,2048,ck,0,0,45.3404,a8w8_blockscale_1x128x128_256x128x128x128_16x16_32x32_2x2_8x32x1_8x32x1_1x32x1x8_8_1x1_intrawave_v3,762.81,651.21,0.0
256,4141,2048,512,ck,18,0,18.3492,a8w8_blockscale_1x128x128_256x64x64x256_16x16_32x32_1x1_16x16x1_16x16x1_1x32x1x8_8_1x1_intrawave_v1,473.28,1097.07,0.0
256,4141,2048,4096,ck,0,0,77.5376,a8w8_blockscale_1x128x128_256x128x128x128_16x16_32x32_2x2_8x32x1_8x32x1_1x32x1x8_8_1x1_intrawave_v3,896.01,545.69,0.0
256,4142,2048,512,ck,18,0,18.235,a8w8_blockscale_1x128x128_256x64x64x256_16x16_32x32_1x1_16x16x1_16x16x1_1x32x1x8_8_1x1_intrawave_v1,476.36,1104.19,0.0
256,4142,2048,4096,ck,0,0,77.22,a8w8_blockscale_1x128x128_256x128x128x128_16x16_32x32_2x2_8x32x1_8x32x1_1x32x1x8_8_1x1_intrawave_v3,899.91,548.04,0.0
256,4143,2048,128,ck,16,0,14.1884,a8w8_blockscale_1x128x128_256x64x64x128_16x16_32x32_1x1_8x32x1_8x32x1_1x32x1x8_8_1x1_intrawave_v1,153.09,1251.88,0.0
256,4143,2048,1024,ck,2,0,28.2994,a8w8_blockscale_1x128x128_256x64x128x128_16x16_32x32_1x2_8x32x1_8x32x1_1x32x1x8_8_1x1_intrawave_v3,614.04,823.67,0.0
256,4149,2048,2048,ck,2,0,44.5756,a8w8_blockscale_1x128x128_256x64x128x128_16x16_32x32_1x2_8x32x1_8x32x1_1x32x1x8_8_1x1_intrawave_v3,780.79,665.96,0.0
256,4204,2048,2048,ck,2,0,44.9481,a8w8_blockscale_1x128x128_256x64x128x128_16x16_32x32_1x2_8x32x1_8x32x1_1x32x1x8_8_1x1_intrawave_v3,784.59,667.96,0.0
256,4223,2048,2048,ck,2,0,45.1541,a8w8_blockscale_1x128x128_256x64x128x128_16x16_32x32_1x2_8x32x1_8x32x1_1x32x1x8_8_1x1_intrawave_v3,784.54,667.5,0.0
256,4229,2048,2048,ck,0,0,45.2015,a8w8_blockscale_1x128x128_256x128x128x128_16x16_32x32_2x2_8x32x1_8x32x1_1x32x1x8_8_1x1_intrawave_v3,784.83,667.62,0.0
256,4345,2048,128,ck,16,0,14.4041,a8w8_blockscale_1x128x128_256x64x64x128_16x16_32x32_1x1_8x32x1_8x32x1_1x32x1x8_8_1x1_intrawave_v1,158.15,1292.37,0.0
256,4345,2048,512,ck,18,0,18.5209,a8w8_blockscale_1x128x128_256x64x64x256_16x16_32x32_1x1_16x16x1_16x16x1_1x32x1x8_8_1x1_intrawave_v1,491.99,1137.65,0.0
256,4345,2048,1024,ck,2,0,28.6615,a8w8_blockscale_1x128x128_256x64x128x128_16x16_32x32_1x2_8x32x1_8x32x1_1x32x1x8_8_1x1_intrawave_v3,635.84,849.35,0.0
256,4345,2048,4096,ck,0,0,78.0216,a8w8_blockscale_1x128x128_256x128x128x128_16x16_32x32_2x2_8x32x1_8x32x1_1x32x1x8_8_1x1_intrawave_v3,934.32,563.73,0.0
256,4379,2048,2048,ck,0,0,44.9717,a8w8_blockscale_1x128x128_256x128x128x128_16x16_32x32_2x2_8x32x1_8x32x1_1x32x1x8_8_1x1_intrawave_v3,816.82,691.52,0.0
256,4410,2048,2048,ck,0,0,45.4919,a8w8_blockscale_1x128x128_256x128x128x128_16x16_32x32_2x2_8x32x1_8x32x1_1x32x1x8_8_1x1_intrawave_v3,813.19,687.8,0.0
256,4413,2048,128,ck,11,0,14.1877,a8w8_blockscale_1x128x128_256x32x64x128_16x16_16x16_2x1_8x32x1_8x32x1_1x32x1x8_8_2x1_intrawave_v1,163.08,1332.33,0.0
256,4413,2048,1024,ck,2,0,28.6523,a8w8_blockscale_1x128x128_256x64x128x128_16x16_32x32_1x2_8x32x1_8x32x1_1x32x1x8_8_1x1_intrawave_v3,646.0,861.77,0.0
256,4498,2048,2048,ck,0,0,45.6707,a8w8_blockscale_1x128x128_256x128x128x128_16x16_32x32_2x2_8x32x1_8x32x1_1x32x1x8_8_1x1_intrawave_v3,826.17,696.95,0.0
256,4585,2048,2048,ck,0,0,45.7295,a8w8_blockscale_1x128x128_256x128x128x128_16x16_32x32_2x2_8x32x1_8x32x1_1x32x1x8_8_1x1_intrawave_v3,841.07,707.74,0.0
256,4586,2048,2048,ck,0,0,46.1346,a8w8_blockscale_1x128x128_256x128x128x128_16x16_32x32_2x2_8x32x1_8x32x1_1x32x1x8_8_1x1_intrawave_v3,833.87,701.66,0.0
256,4723,2048,2048,ck,0,0,45.9727,a8w8_blockscale_1x128x128_256x128x128x128_16x16_32x32_2x2_8x32x1_8x32x1_1x32x1x8_8_1x1_intrawave_v3,861.8,722.44,0.0
256,4743,2048,2048,ck,0,0,45.5354,a8w8_blockscale_1x128x128_256x128x128x128_16x16_32x32_2x2_8x32x1_8x32x1_1x32x1x8_8_1x1_intrawave_v3,873.76,732.07,0.0
256,4822,2048,2048,ck,0,0,46.0802,a8w8_blockscale_1x128x128_256x128x128x128_16x16_32x32_2x2_8x32x1_8x32x1_1x32x1x8_8_1x1_intrawave_v3,877.81,733.95,0.0
256,4898,2048,2048,ck,0,0,46.8506,a8w8_blockscale_1x128x128_256x128x128x128_16x16_32x32_2x2_8x32x1_8x32x1_1x32x1x8_8_1x1_intrawave_v3,876.99,731.85,0.0
256,4936,2048,2048,ck,0,0,45.9677,a8w8_blockscale_1x128x128_256x128x128x128_16x16_32x32_2x2_8x32x1_8x32x1_1x32x1x8_8_1x1_intrawave_v3,900.77,750.99,0.0
256,4992,2048,2048,ck,0,0,44.5126,a8w8_blockscale_1x128x128_256x128x128x128_16x16_32x32_2x2_8x32x1_8x32x1_1x32x1x8_8_1x1_intrawave_v3,940.77,783.26,0.0
256,5000,2048,2048,ck,0,0,46.263,a8w8_blockscale_1x128x128_256x128x128x128_16x16_32x32_2x2_8x32x1_8x32x1_1x32x1x8_8_1x1_intrawave_v3,906.62,754.69,0.0
256,5001,2048,2048,ck,0,0,46.5486,a8w8_blockscale_1x128x128_256x128x128x128_16x16_32x32_2x2_8x32x1_8x32x1_1x32x1x8_8_1x1_intrawave_v3,901.24,750.19,0.0
256,5002,2048,2048,ck,0,0,46.6638,a8w8_blockscale_1x128x128_256x128x128x128_16x16_32x32_2x2_8x32x1_8x32x1_1x32x1x8_8_1x1_intrawave_v3,899.19,748.47,0.0
256,5003,2048,2048,ck,0,0,46.1866,a8w8_blockscale_1x128x128_256x128x128x128_16x16_32x32_2x2_8x32x1_8x32x1_1x32x1x8_8_1x1_intrawave_v3,908.67,756.34,0.0
256,5004,2048,2048,ck,0,0,46.3308,a8w8_blockscale_1x128x128_256x128x128x128_16x16_32x32_2x2_8x32x1_8x32x1_1x32x1x8_8_1x1_intrawave_v3,906.02,754.12,0.0
256,5005,2048,2048,ck,0,0,46.2758,a8w8_blockscale_1x128x128_256x128x128x128_16x16_32x32_2x2_8x32x1_8x32x1_1x32x1x8_8_1x1_intrawave_v3,907.28,755.15,0.0
256,5006,2048,2048,ck,0,0,47.235,a8w8_blockscale_1x128x128_256x128x128x128_16x16_32x32_2x2_8x32x1_8x32x1_1x32x1x8_8_1x1_intrawave_v3,889.03,739.94,0.0
256,5010,2048,2048,ck,0,0,46.0258,a8w8_blockscale_1x128x128_256x128x128x128_16x16_32x32_2x2_8x32x1_8x32x1_1x32x1x8_8_1x1_intrawave_v3,913.12,759.92,0.0
256,5011,2048,2048,ck,0,0,46.6006,a8w8_blockscale_1x128x128_256x128x128x128_16x16_32x32_2x2_8x32x1_8x32x1_1x32x1x8_8_1x1_intrawave_v3,902.03,750.67,0.0
256,5012,2048,2048,ck,0,0,46.3334,a8w8_blockscale_1x128x128_256x128x128x128_16x16_32x32_2x2_8x32x1_8x32x1_1x32x1x8_8_1x1_intrawave_v3,907.42,755.14,0.0
256,5026,2048,2048,ck,0,0,46.1458,a8w8_blockscale_1x128x128_256x128x128x128_16x16_32x32_2x2_8x32x1_8x32x1_1x32x1x8_8_1x1_intrawave_v3,913.65,760.07,0.0
256,5028,2048,2048,ck,0,0,46.8798,a8w8_blockscale_1x128x128_256x128x128x128_16x16_32x32_2x2_8x32x1_8x32x1_1x32x1x8_8_1x1_intrawave_v3,899.7,748.43,0.0
256,5030,2048,2048,ck,0,0,46.0703,a8w8_blockscale_1x128x128_256x128x128x128_16x16_32x32_2x2_8x32x1_8x32x1_1x32x1x8_8_1x1_intrawave_v3,915.88,761.85,0.0
256,5031,2048,2048,ck,0,0,47.4854,a8w8_blockscale_1x128x128_256x128x128x128_16x16_32x32_2x2_8x32x1_8x32x1_1x32x1x8_8_1x1_intrawave_v3,888.76,739.27,0.0
256,5060,2048,2048,ck,0,0,45.9957,a8w8_blockscale_1x128x128_256x128x128x128_16x16_32x32_2x2_8x32x1_8x32x1_1x32x1x8_8_1x1_intrawave_v3,922.83,767.09,0.0
256,5062,2048,2048,ck,0,0,46.407,a8w8_blockscale_1x128x128_256x128x128x128_16x16_32x32_2x2_8x32x1_8x32x1_1x32x1x8_8_1x1_intrawave_v3,915.02,760.56,0.0
256,5063,2048,2048,ck,0,0,46.5102,a8w8_blockscale_1x128x128_256x128x128x128_16x16_32x32_2x2_8x32x1_8x32x1_1x32x1x8_8_1x1_intrawave_v3,913.17,759.0,0.0
256,5091,2048,2048,ck,0,0,46.6518,a8w8_blockscale_1x128x128_256x128x128x128_16x16_32x32_2x2_8x32x1_8x32x1_1x32x1x8_8_1x1_intrawave_v3,915.43,760.39,0.0
256,5105,2048,512,ck,18,0,20.5931,a8w8_blockscale_1x128x128_256x64x64x256_16x16_32x32_1x1_16x16x1_16x16x1_1x32x1x8_8_1x1_intrawave_v1,519.88,1193.24,0.0
256,5105,2048,2048,ck,0,0,47.0534,a8w8_blockscale_1x128x128_256x128x128x128_16x16_32x32_2x2_8x32x1_8x32x1_1x32x1x8_8_1x1_intrawave_v3,910.11,755.72,0.0
256,5105,2048,4096,ck,0,0,80.6444,a8w8_blockscale_1x128x128_256x128x128x128_16x16_32x32_2x2_8x32x1_8x32x1_1x32x1x8_8_1x1_intrawave_v3,1062.04,622.59,0.0
256,5120,2048,2048,ck,0,0,45.2483,a8w8_blockscale_1x128x128_256x128x128x128_16x16_32x32_2x2_8x32x1_8x32x1_1x32x1x8_8_1x1_intrawave_v3,949.2,787.91,0.0
256,5121,2048,128,ck,16,0,15.5727,a8w8_blockscale_1x128x128_256x64x64x128_16x16_32x32_1x1_8x32x1_8x32x1_1x32x1x8_8_1x1_intrawave_v1,172.41,1405.87,0.0
256,5121,2048,512,ck,18,0,21.6654,a8w8_blockscale_1x128x128_256x64x64x256_16x16_32x32_1x1_16x16x1_16x16x1_1x32x1x8_8_1x1_intrawave_v1,495.7,1137.58,0.0
256,5121,2048,1024,ck,0,0,30.7138,a8w8_blockscale_1x128x128_256x128x128x128_16x16_32x32_2x2_8x32x1_8x32x1_1x32x1x8_8_1x1_intrawave_v3,699.33,921.95,0.0
256,5121,2048,4096,ck,0,0,80.7664,a8w8_blockscale_1x128x128_256x128x128x128_16x16_32x32_2x2_8x32x1_8x32x1_1x32x1x8_8_1x1_intrawave_v3,1063.76,623.28,0.0
256,5122,2048,2048,ck,0,0,47.0282,a8w8_blockscale_1x128x128_256x128x128x128_16x16_32x32_2x2_8x32x1_8x32x1_1x32x1x8_8_1x1_intrawave_v3,913.63,758.35,0.0
256,5123,2048,128,ck,16,0,15.6203,a8w8_blockscale_1x128x128_256x64x64x128_16x16_32x32_1x1_8x32x1_8x32x1_1x32x1x8_8_1x1_intrawave_v1,171.95,1402.13,0.0
256,5123,2048,512,ck,18,0,21.4931,a8w8_blockscale_1x128x128_256x64x64x256_16x16_32x32_1x1_16x16x1_16x16x1_1x32x1x8_8_1x1_intrawave_v1,499.87,1147.13,0.0
256,5123,2048,1024,ck,0,0,30.7343,a8w8_blockscale_1x128x128_256x128x128x128_16x16_32x32_2x2_8x32x1_8x32x1_1x32x1x8_8_1x1_intrawave_v3,699.13,921.67,0.0
256,5123,2048,2048,ck,0,0,46.4706,a8w8_blockscale_1x128x128_256x128x128x128_16x16_32x32_2x2_8x32x1_8x32x1_1x32x1x8_8_1x1_intrawave_v3,924.77,767.58,0.0
256,5123,2048,4096,ck,0,0,81.1052,a8w8_blockscale_1x128x128_256x128x128x128_16x16_32x32_2x2_8x32x1_8x32x1_1x32x1x8_8_1x1_intrawave_v3,1059.73,620.88,0.0
256,5124,2048,2048,ck,0,0,46.0337,a8w8_blockscale_1x128x128_256x128x128x128_16x16_32x32_2x2_8x32x1_8x32x1_1x32x1x8_8_1x1_intrawave_v3,933.73,775.0,0.0
256,5127,2048,2048,ck,0,0,46.7682,a8w8_blockscale_1x128x128_256x128x128x128_16x16_32x32_2x2_8x32x1_8x32x1_1x32x1x8_8_1x1_intrawave_v3,919.61,763.22,0.0
256,5131,2048,512,ck,18,0,21.538,a8w8_blockscale_1x128x128_256x64x64x256_16x16_32x32_1x1_16x16x1_16x16x1_1x32x1x8_8_1x1_intrawave_v1,499.6,1146.45,0.0
256,5131,2048,4096,ck,0,0,81.356,a8w8_blockscale_1x128x128_256x128x128x128_16x16_32x32_2x2_8x32x1_8x32x1_1x32x1x8_8_1x1_intrawave_v3,1058.11,619.77,0.0
256,5133,2048,128,ck,16,0,15.7563,a8w8_blockscale_1x128x128_256x64x64x128_16x16_32x32_1x1_8x32x1_8x32x1_1x32x1x8_8_1x1_intrawave_v1,170.8,1392.71,0.0
256,5133,2048,1024,ck,0,0,30.6409,a8w8_blockscale_1x128x128_256x128x128x128_16x16_32x32_2x2_8x32x1_8x32x1_1x32x1x8_8_1x1_intrawave_v3,702.63,926.15,0.0
256,5177,2048,2048,ck,0,0,46.8475,a8w8_blockscale_1x128x128_256x128x128x128_16x16_32x32_2x2_8x32x1_8x32x1_1x32x1x8_8_1x1_intrawave_v3,927.0,768.49,0.0
256,5183,2048,2048,ck,0,0,46.8277,a8w8_blockscale_1x128x128_256x128x128x128_16x16_32x32_2x2_8x32x1_8x32x1_1x32x1x8_8_1x1_intrawave_v3,928.47,769.6,0.0
256,5185,2048,128,ck,16,0,16.1579,a8w8_blockscale_1x128x128_256x64x64x128_16x16_32x32_1x1_8x32x1_8x32x1_1x32x1x8_8_1x1_intrawave_v1,168.24,1371.69,0.0
256,5185,2048,1024,ck,0,0,30.6805,a8w8_blockscale_1x128x128_256x128x128x128_16x16_32x32_2x2_8x32x1_8x32x1_1x32x1x8_8_1x1_intrawave_v3,708.84,933.63,0.0
256,5191,2048,128,ck,16,0,15.742,a8w8_blockscale_1x128x128_256x64x64x128_16x16_32x32_1x1_8x32x1_8x32x1_1x32x1x8_8_1x1_intrawave_v1,172.89,1409.54,0.0
256,5191,2048,1024,ck,0,0,30.627,a8w8_blockscale_1x128x128_256x128x128x128_16x16_32x32_2x2_8x32x1_8x32x1_1x32x1x8_8_1x1_intrawave_v3,710.9,936.27,0.0
256,5252,2048,2048,ck,0,0,47.5769,a8w8_blockscale_1x128x128_256x128x128x128_16x16_32x32_2x2_8x32x1_8x32x1_1x32x1x8_8_1x1_intrawave_v3,926.02,766.39,0.0
256,5255,2048,2048,ck,0,0,47.1483,a8w8_blockscale_1x128x128_256x128x128x128_16x16_32x32_2x2_8x32x1_8x32x1_1x32x1x8_8_1x1_intrawave_v3,934.97,773.75,0.0
256,5361,2048,2048,ck,0,0,47.589,a8w8_blockscale_1x128x128_256x128x128x128_16x16_32x32_2x2_8x32x1_8x32x1_1x32x1x8_8_1x1_intrawave_v3,944.99,780.27,0.0
256,5427,2048,512,ck,18,0,21.96,a8w8_blockscale_1x128x128_256x64x64x256_16x16_32x32_1x1_16x16x1_16x16x1_1x32x1x8_8_1x1_intrawave_v1,518.27,1186.53,0.0
256,5427,2048,2048,ck,0,0,47.9842,a8w8_blockscale_1x128x128_256x128x128x128_16x16_32x32_2x2_8x32x1_8x32x1_1x32x1x8_8_1x1_intrawave_v3,948.75,782.29,0.0
256,5427,2048,4096,ck,0,0,82.7704,a8w8_blockscale_1x128x128_256x128x128x128_16x16_32x32_2x2_8x32x1_8x32x1_1x32x1x8_8_1x1_intrawave_v3,1100.03,638.47,0.0
256,5471,2048,2048,ck,0,0,47.117,a8w8_blockscale_1x128x128_256x128x128x128_16x16_32x32_2x2_8x32x1_8x32x1_1x32x1x8_8_1x1_intrawave_v3,974.04,802.43,0.0
256,5534,2048,2048,ck,0,0,48.2054,a8w8_blockscale_1x128x128_256x128x128x128_16x16_32x32_2x2_8x32x1_8x32x1_1x32x1x8_8_1x1_intrawave_v3,963.02,792.34,0.0
256,5564,2048,2048,ck,0,0,49.0438,a8w8_blockscale_1x128x128_256x128x128x128_16x16_32x32_2x2_8x32x1_8x32x1_1x32x1x8_8_1x1_intrawave_v3,951.68,782.56,0.0
256,5671,2048,2048,ck,0,0,48.2658,a8w8_blockscale_1x128x128_256x128x128x128_16x16_32x32_2x2_8x32x1_8x32x1_1x32x1x8_8_1x1_intrawave_v3,985.62,808.79,0.0
256,5927,2048,2048,ck,0,0,48.8266,a8w8_blockscale_1x128x128_256x128x128x128_16x16_32x32_2x2_8x32x1_8x32x1_1x32x1x8_8_1x1_intrawave_v3,1018.28,831.71,0.0
256,5954,2048,2048,ck,0,0,49.1682,a8w8_blockscale_1x128x128_256x128x128x128_16x16_32x32_2x2_8x32x1_8x32x1_1x32x1x8_8_1x1_intrawave_v3,1015.81,829.31,0.0
256,6000,2048,2048,ck,0,0,49.1654,a8w8_blockscale_1x128x128_256x128x128x128_16x16_32x32_2x2_8x32x1_8x32x1_1x32x1x8_8_1x1_intrawave_v3,1023.72,835.11,0.0
256,6002,2048,2048,ck,0,0,49.7698,a8w8_blockscale_1x128x128_256x128x128x128_16x16_32x32_2x2_8x32x1_8x32x1_1x32x1x8_8_1x1_intrawave_v3,1011.63,825.21,0.0
256,6113,2048,512,ck,0,0,23.0285,a8w8_blockscale_1x128x128_256x128x128x128_16x16_32x32_2x2_8x32x1_8x32x1_1x32x1x8_8_1x1_intrawave_v3,556.7,1268.74,0.0
256,6113,2048,4096,ck,0,0,88.8171,a8w8_blockscale_1x128x128_256x128x128x128_16x16_32x32_2x2_8x32x1_8x32x1_1x32x1x8_8_1x1_intrawave_v3,1154.72,658.28,0.0
256,6146,2048,128,ck,16,0,17.8421,a8w8_blockscale_1x128x128_256x64x64x128_16x16_32x32_1x1_8x32x1_8x32x1_1x32x1x8_8_1x1_intrawave_v1,180.6,1469.72,0.0
256,6146,2048,1024,ck,0,0,37.4759,a8w8_blockscale_1x128x128_256x128x128x128_16x16_32x32_2x2_8x32x1_8x32x1_1x32x1x8_8_1x1_intrawave_v3,687.86,895.63,0.0
256,6146,2048,2048,ck,0,0,58.9607,a8w8_blockscale_1x128x128_256x128x128x128_16x16_32x32_2x2_8x32x1_8x32x1_1x32x1x8_8_1x1_intrawave_v3,874.42,711.58,0.0
256,6147,2048,128,ck,16,0,17.7796,a8w8_blockscale_1x128x128_256x64x64x128_16x16_32x32_1x1_8x32x1_8x32x1_1x32x1x8_8_1x1_intrawave_v1,181.26,1475.12,0.0
256,6147,2048,1024,ck,0,0,37.5733,a8w8_blockscale_1x128x128_256x128x128x128_16x16_32x32_2x2_8x32x1_8x32x1_1x32x1x8_8_1x1_intrawave_v3,686.19,893.45,0.0
256,6155,2048,128,ck,16,0,17.8948,a8w8_blockscale_1x128x128_256x64x64x128_16x16_32x32_1x1_8x32x1_8x32x1_1x32x1x8_8_1x1_intrawave_v1,180.33,1467.51,0.0
256,6155,2048,1024,ck,0,0,37.8711,a8w8_blockscale_1x128x128_256x128x128x128_16x16_32x32_2x2_8x32x1_8x32x1_1x32x1x8_8_1x1_intrawave_v3,681.68,887.5,0.0
256,6194,2048,2048,ck,0,0,57.3195,a8w8_blockscale_1x128x128_256x128x128x128_16x16_32x32_2x2_8x32x1_8x32x1_1x32x1x8_8_1x1_intrawave_v3,906.48,737.1,0.0
256,6197,2048,512,ck,18,0,24.4945,a8w8_blockscale_1x128x128_256x64x64x256_16x16_32x32_1x1_16x16x1_16x16x1_1x32x1x8_8_1x1_intrawave_v1,530.57,1208.61,0.0
256,6197,2048,4096,ck,0,0,99.1901,a8w8_blockscale_1x128x128_256x128x128x128_16x16_32x32_2x2_8x32x1_8x32x1_1x32x1x8_8_1x1_intrawave_v3,1048.17,596.37,0.0
256,6227,2048,2048,ck,0,0,57.7833,a8w8_blockscale_1x128x128_256x128x128x128_16x16_32x32_2x2_8x32x1_8x32x1_1x32x1x8_8_1x1_intrawave_v3,904.0,734.69,0.0
256,6229,2048,2048,ck,0,0,58.2726,a8w8_blockscale_1x128x128_256x128x128x128_16x16_32x32_2x2_8x32x1_8x32x1_1x32x1x8_8_1x1_intrawave_v3,896.69,728.73,0.0
256,6234,2048,2048,ck,0,0,57.3077,a8w8_blockscale_1x128x128_256x128x128x128_16x16_32x32_2x2_8x32x1_8x32x1_1x32x1x8_8_1x1_intrawave_v3,912.52,741.54,0.0
256,6246,2048,2048,ck,0,0,57.3033,a8w8_blockscale_1x128x128_256x128x128x128_16x16_32x32_2x2_8x32x1_8x32x1_1x32x1x8_8_1x1_intrawave_v3,914.35,742.88,0.0
256,6304,2048,2048,ck,0,0,57.7858,a8w8_blockscale_1x128x128_256x128x128x128_16x16_32x32_2x2_8x32x1_8x32x1_1x32x1x8_8_1x1_intrawave_v3,915.13,742.85,0.0
256,6314,2048,2048,ck,0,0,58.4798,a8w8_blockscale_1x128x128_256x128x128x128_16x16_32x32_2x2_8x32x1_8x32x1_1x32x1x8_8_1x1_intrawave_v3,905.71,735.08,0.0
256,6318,2048,2048,ck,0,0,57.8394,a8w8_blockscale_1x128x128_256x128x128x128_16x16_32x32_2x2_8x32x1_8x32x1_1x32x1x8_8_1x1_intrawave_v3,916.32,743.65,0.0
256,6341,2048,2048,ck,0,0,58.161,a8w8_blockscale_1x128x128_256x128x128x128_16x16_32x32_2x2_8x32x1_8x32x1_1x32x1x8_8_1x1_intrawave_v3,914.57,741.96,0.0
256,6377,2048,128,ck,16,0,17.861,a8w8_blockscale_1x128x128_256x64x64x128_16x16_32x32_1x1_8x32x1_8x32x1_1x32x1x8_8_1x1_intrawave_v1,187.19,1522.79,0.0
256,6377,2048,1024,ck,0,0,37.8419,a8w8_blockscale_1x128x128_256x128x128x128_16x16_32x32_2x2_8x32x1_8x32x1_1x32x1x8_8_1x1_intrawave_v3,706.81,918.23,0.0
256,6377,2048,2048,ck,0,0,58.0558,a8w8_blockscale_1x128x128_256x128x128x128_16x16_32x32_2x2_8x32x1_8x32x1_1x32x1x8_8_1x1_intrawave_v3,921.43,747.12,0.0
256,6401,2048,128,ck,16,0,17.9718,a8w8_blockscale_1x128x128_256x64x64x128_16x16_32x32_1x1_8x32x1_8x32x1_1x32x1x8_8_1x1_intrawave_v1,186.74,1519.04,0.0
256,6401,2048,1024,ck,0,0,37.6678,a8w8_blockscale_1x128x128_256x128x128x128_16x16_32x32_2x2_8x32x1_8x32x1_1x32x1x8_8_1x1_intrawave_v3,712.75,925.73,0.0
256,6409,2048,512,ck,18,0,24.7592,a8w8_blockscale_1x128x128_256x64x64x256_16x16_32x32_1x1_16x16x1_16x16x1_1x32x1x8_8_1x1_intrawave_v1,542.85,1235.15,0.0
256,6409,2048,4096,ck,0,0,100.3826,a8w8_blockscale_1x128x128_256x128x128x128_16x16_32x32_2x2_8x32x1_8x32x1_1x32x1x8_8_1x1_intrawave_v3,1071.15,606.59,0.0
256,6476,2048,2048,ck,0,0,57.9712,a8w8_blockscale_1x128x128_256x128x128x128_16x16_32x32_2x2_8x32x1_8x32x1_1x32x1x8_8_1x1_intrawave_v3,937.1,758.7,0.0
256,6483,2048,2048,ck,0,0,57.8366,a8w8_blockscale_1x128x128_256x128x128x128_16x16_32x32_2x2_8x32x1_8x32x1_1x32x1x8_8_1x1_intrawave_v3,940.29,761.21,0.0
256,6492,2048,2048,ck,0,0,59.0026,a8w8_blockscale_1x128x128_256x128x128x128_16x16_32x32_2x2_8x32x1_8x32x1_1x32x1x8_8_1x1_intrawave_v3,922.99,747.11,0.0
256,6519,2048,2048,ck,0,0,58.2994,a8w8_blockscale_1x128x128_256x128x128x128_16x16_32x32_2x2_8x32x1_8x32x1_1x32x1x8_8_1x1_intrawave_v3,938.01,758.96,0.0
256,6609,2048,2048,ck,0,0,59.0331,a8w8_blockscale_1x128x128_256x128x128x128_16x16_32x32_2x2_8x32x1_8x32x1_1x32x1x8_8_1x1_intrawave_v3,939.14,758.9,0.0
256,6811,2048,2048,ck,0,0,60.6443,a8w8_blockscale_1x128x128_256x128x128x128_16x16_32x32_2x2_8x32x1_8x32x1_1x32x1x8_8_1x1_intrawave_v3,942.13,759.2,0.0
256,6813,2048,2048,ck,0,0,59.2338,a8w8_blockscale_1x128x128_256x128x128x128_16x16_32x32_2x2_8x32x1_8x32x1_1x32x1x8_8_1x1_intrawave_v3,964.85,777.48,0.0
256,6818,2048,2048,ck,0,0,59.315,a8w8_blockscale_1x128x128_256x128x128x128_16x16_32x32_2x2_8x32x1_8x32x1_1x32x1x8_8_1x1_intrawave_v3,964.23,776.94,0.0
256,6830,2048,2048,ck,0,0,59.4201,a8w8_blockscale_1x128x128_256x128x128x128_16x16_32x32_2x2_8x32x1_8x32x1_1x32x1x8_8_1x1_intrawave_v3,964.22,776.8,0.0
256,7001,2048,2048,ck,0,0,58.8087,a8w8_blockscale_1x128x128_256x128x128x128_16x16_32x32_2x2_8x32x1_8x32x1_1x32x1x8_8_1x1_intrawave_v3,998.64,802.75,0.0
256,7025,2048,2048,ck,0,0,59.5467,a8w8_blockscale_1x128x128_256x128x128x128_16x16_32x32_2x2_8x32x1_8x32x1_1x32x1x8_8_1x1_intrawave_v3,989.64,795.27,0.0
256,7121,2048,128,ck,16,0,18.9701,a8w8_blockscale_1x128x128_256x64x64x128_16x16_32x32_1x1_8x32x1_8x32x1_1x32x1x8_8_1x1_intrawave_v1,196.81,1599.42,0.0
256,7121,2048,512,ck,18,0,26.9673,a8w8_blockscale_1x128x128_256x64x64x256_16x16_32x32_1x1_16x16x1_16x16x1_1x32x1x8_8_1x1_intrawave_v1,553.78,1255.67,0.0
256,7121,2048,1024,ck,0,0,38.8854,a8w8_blockscale_1x128x128_256x128x128x128_16x16_32x32_2x2_8x32x1_8x32x1_1x32x1x8_8_1x1_intrawave_v3,768.09,991.55,0.0
256,7121,2048,2048,ck,0,0,60.2923,a8w8_blockscale_1x128x128_256x128x128x128_16x16_32x32_2x2_8x32x1_8x32x1_1x32x1x8_8_1x1_intrawave_v3,990.76,795.22,0.0
256,7121,2048,4096,ck,0,0,105.5154,a8w8_blockscale_1x128x128_256x128x128x128_16x16_32x32_2x2_8x32x1_8x32x1_1x32x1x8_8_1x1_intrawave_v3,1132.26,632.36,0.0
256,7168,2048,512,ck,18,0,26.7605,a8w8_blockscale_1x128x128_256x64x64x256_16x16_32x32_1x1_16x16x1_16x16x1_1x32x1x8_8_1x1_intrawave_v1,561.74,1273.47,0.0
256,7168,2048,4096,ck,0,0,101.7522,a8w8_blockscale_1x128x128_256x128x128x128_16x16_32x32_2x2_8x32x1_8x32x1_1x32x1x8_8_1x1_intrawave_v3,1181.88,659.53,0.0
256,7169,2048,128,ck,16,0,19.6755,a8w8_blockscale_1x128x128_256x64x64x128_16x16_32x32_1x1_8x32x1_8x32x1_1x32x1x8_8_1x1_intrawave_v1,191.03,1552.39,0.0
256,7169,2048,512,ck,18,0,27.603,a8w8_blockscale_1x128x128_256x64x64x256_16x16_32x32_1x1_16x16x1_16x16x1_1x32x1x8_8_1x1_intrawave_v1,544.67,1234.77,0.0
256,7169,2048,1024,ck,0,0,38.493,a8w8_blockscale_1x128x128_256x128x128x128_16x16_32x32_2x2_8x32x1_8x32x1_1x32x1x8_8_1x1_intrawave_v3,781.15,1008.04,0.0
256,7169,2048,2048,ck,0,0,61.0206,a8w8_blockscale_1x128x128_256x128x128x128_16x16_32x32_2x2_8x32x1_8x32x1_1x32x1x8_8_1x1_intrawave_v3,985.53,790.56,0.0
256,7169,2048,4096,ck,0,0,104.9705,a8w8_blockscale_1x128x128_256x128x128x128_16x16_32x32_2x2_8x32x1_8x32x1_1x32x1x8_8_1x1_intrawave_v3,1145.81,639.39,0.0
256,7170,2048,128,ck,16,0,20.0062,a8w8_blockscale_1x128x128_256x64x64x128_16x16_32x32_1x1_8x32x1_8x32x1_1x32x1x8_8_1x1_intrawave_v1,187.9,1526.94,0.0
256,7170,2048,1024,ck,0,0,38.9948,a8w8_blockscale_1x128x128_256x128x128x128_16x16_32x32_2x2_8x32x1_8x32x1_1x32x1x8_8_1x1_intrawave_v3,771.21,995.2,0.0
256,7172,2048,512,ck,18,0,28.115,a8w8_blockscale_1x128x128_256x64x64x256_16x16_32x32_1x1_16x16x1_16x16x1_1x32x1x8_8_1x1_intrawave_v1,534.97,1212.77,0.0
256,7172,2048,4096,ck,0,0,104.6565,a8w8_blockscale_1x128x128_256x128x128x128_16x16_32x32_2x2_8x32x1_8x32x1_1x32x1x8_8_1x1_intrawave_v3,1149.72,641.54,0.0
256,7176,2048,128,ck,16,0,19.8159,a8w8_blockscale_1x128x128_256x64x64x128_16x16_32x32_1x1_8x32x1_8x32x1_1x32x1x8_8_1x1_intrawave_v1,189.86,1542.88,0.0
256,7176,2048,512,ck,18,0,27.559,a8w8_blockscale_1x128x128_256x64x64x256_16x16_32x32_1x1_16x16x1_16x16x1_1x32x1x8_8_1x1_intrawave_v1,546.07,1237.91,0.0
256,7176,2048,1024,ck,0,0,38.9046,a8w8_blockscale_1x128x128_256x128x128x128_16x16_32x32_2x2_8x32x1_8x32x1_1x32x1x8_8_1x1_intrawave_v3,773.64,998.3,0.0
256,7176,2048,4096,ck,0,0,105.2549,a8w8_blockscale_1x128x128_256x128x128x128_16x16_32x32_2x2_8x32x1_8x32x1_1x32x1x8_8_1x1_intrawave_v3,1143.83,638.21,0.0
256,7177,2048,128,ck,16,0,19.8001,a8w8_blockscale_1x128x128_256x64x64x128_16x16_32x32_1x1_8x32x1_8x32x1_1x32x1x8_8_1x1_intrawave_v1,190.04,1544.33,0.0
256,7177,2048,512,ck,18,0,27.8099,a8w8_blockscale_1x128x128_256x64x64x256_16x16_32x32_1x1_16x16x1_16x16x1_1x32x1x8_8_1x1_intrawave_v1,541.22,1226.91,0.0
256,7177,2048,1024,ck,0,0,39.5183,a8w8_blockscale_1x128x128_256x128x128x128_16x16_32x32_2x2_8x32x1_8x32x1_1x32x1x8_8_1x1_intrawave_v3,761.74,982.92,0.0
256,7177,2048,2048,ck,0,0,60.1571,a8w8_blockscale_1x128x128_256x128x128x128_16x16_32x32_2x2_8x32x1_8x32x1_1x32x1x8_8_1x1_intrawave_v3,1000.8,802.73,0.0
256,7177,2048,4096,ck,0,0,104.7037,a8w8_blockscale_1x128x128_256x128x128x128_16x16_32x32_2x2_8x32x1_8x32x1_1x32x1x8_8_1x1_intrawave_v3,1150.01,641.64,0.0
256,7178,2048,512,ck,0,0,28.0703,a8w8_blockscale_1x128x128_256x128x128x128_16x16_32x32_2x2_8x32x1_8x32x1_1x32x1x8_8_1x1_intrawave_v3,536.27,1215.69,0.0
256,7178,2048,4096,ck,0,0,105.7329,a8w8_blockscale_1x128x128_256x128x128x128_16x16_32x32_2x2_8x32x1_8x32x1_1x32x1x8_8_1x1_intrawave_v3,1138.97,635.48,0.0
256,7179,2048,512,ck,18,0,27.7969,a8w8_blockscale_1x128x128_256x64x64x256_16x16_32x32_1x1_16x16x1_16x16x1_1x32x1x8_8_1x1_intrawave_v1,541.62,1227.81,0.0
256,7179,2048,4096,ck,0,0,105.9041,a8w8_blockscale_1x128x128_256x128x128x128_16x16_32x32_2x2_8x32x1_8x32x1_1x32x1x8_8_1x1_intrawave_v3,1137.29,634.53,0.0
256,7183,2048,512,ck,18,0,27.8087,a8w8_blockscale_1x128x128_256x64x64x256_16x16_32x32_1x1_16x16x1_16x16x1_1x32x1x8_8_1x1_intrawave_v1,541.7,1227.96,0.0
256,7183,2048,4096,ck,0,0,105.3173,a8w8_blockscale_1x128x128_256x128x128x128_16x16_32x32_2x2_8x32x1_8x32x1_1x32x1x8_8_1x1_intrawave_v3,1144.26,638.37,0.0
256,7184,2048,512,ck,0,0,28.0361,a8w8_blockscale_1x128x128_256x128x128x128_16x16_32x32_2x2_8x32x1_8x32x1_1x32x1x8_8_1x1_intrawave_v3,537.38,1218.16,0.0
256,7184,2048,4096,ck,0,0,105.6273,a8w8_blockscale_1x128x128_256x128x128x128_16x16_32x32_2x2_8x32x1_8x32x1_1x32x1x8_8_1x1_intrawave_v3,1141.06,636.58,0.0
256,7185,2048,128,ck,16,0,19.9139,a8w8_blockscale_1x128x128_256x64x64x128_16x16_32x32_1x1_8x32x1_8x32x1_1x32x1x8_8_1x1_intrawave_v1,189.16,1537.2,0.0
256,7185,2048,1024,ck,0,0,38.9628,a8w8_blockscale_1x128x128_256x128x128x128_16x16_32x32_2x2_8x32x1_8x32x1_1x32x1x8_8_1x1_intrawave_v3,773.46,997.99,0.0
256,7206,2048,128,ck,16,0,19.9443,a8w8_blockscale_1x128x128_256x64x64x128_16x16_32x32_1x1_8x32x1_8x32x1_1x32x1x8_8_1x1_intrawave_v1,189.43,1539.3,0.0
256,7206,2048,1024,ck,0,0,39.5656,a8w8_blockscale_1x128x128_256x128x128x128_16x16_32x32_2x2_8x32x1_8x32x1_1x32x1x8_8_1x1_intrawave_v3,763.9,985.5,0.0
256,7209,2048,512,ck,18,0,27.9694,a8w8_blockscale_1x128x128_256x64x64x256_16x16_32x32_1x1_16x16x1_16x16x1_1x32x1x8_8_1x1_intrawave_v1,540.53,1225.18,0.0
256,7209,2048,4096,ck,0,0,104.9349,a8w8_blockscale_1x128x128_256x128x128x128_16x16_32x32_2x2_8x32x1_8x32x1_1x32x1x8_8_1x1_intrawave_v3,1152.59,642.73,0.0
256,7210,2048,512,ck,18,0,27.9356,a8w8_blockscale_1x128x128_256x64x64x256_16x16_32x32_1x1_16x16x1_16x16x1_1x32x1x8_8_1x1_intrawave_v1,541.26,1226.83,0.0
256,7210,2048,4096,ck,0,0,104.5165,a8w8_blockscale_1x128x128_256x128x128x128_16x16_32x32_2x2_8x32x1_8x32x1_1x32x1x8_8_1x1_intrawave_v3,1157.36,645.38,0.0
256,7211,2048,512,ck,18,0,28.1578,a8w8_blockscale_1x128x128_256x64x64x256_16x16_32x32_1x1_16x16x1_16x16x1_1x32x1x8_8_1x1_intrawave_v1,537.06,1217.31,0.0
256,7211,2048,4096,ck,0,0,105.6793,a8w8_blockscale_1x128x128_256x128x128x128_16x16_32x32_2x2_8x32x1_8x32x1_1x32x1x8_8_1x1_intrawave_v3,1144.79,638.36,0.0
256,7217,2048,128,ck,16,0,20.0418,a8w8_blockscale_1x128x128_256x64x64x128_16x16_32x32_1x1_8x32x1_8x32x1_1x32x1x8_8_1x1_intrawave_v1,188.79,1534.13,0.0
256,7217,2048,512,ck,18,0,27.7,a8w8_blockscale_1x128x128_256x64x64x256_16x16_32x32_1x1_16x16x1_16x16x1_1x32x1x8_8_1x1_intrawave_v1,546.4,1238.43,0.0
256,7217,2048,1024,ck,0,0,38.8602,a8w8_blockscale_1x128x128_256x128x128x128_16x16_32x32_2x2_8x32x1_8x32x1_1x32x1x8_8_1x1_intrawave_v3,778.95,1004.84,0.0
256,7217,2048,2048,ck,0,0,59.8987,a8w8_blockscale_1x128x128_256x128x128x128_16x16_32x32_2x2_8x32x1_8x32x1_1x32x1x8_8_1x1_intrawave_v3,1010.72,810.29,0.0
256,7217,2048,4096,ck,0,0,105.0781,a8w8_blockscale_1x128x128_256x128x128x128_16x16_32x32_2x2_8x32x1_8x32x1_1x32x1x8_8_1x1_intrawave_v3,1152.3,642.48,0.0
256,7223,2048,2048,ck,0,0,60.6114,a8w8_blockscale_1x128x128_256x128x128x128_16x16_32x32_2x2_8x32x1_8x32x1_1x32x1x8_8_1x1_intrawave_v3,999.66,801.37,0.0
256,7238,2048,2048,ck,0,0,60.3974,a8w8_blockscale_1x128x128_256x128x128x128_16x16_32x32_2x2_8x32x1_8x32x1_1x32x1x8_8_1x1_intrawave_v3,1005.29,805.74,0.0
256,7246,2048,2048,ck,0,0,60.4394,a8w8_blockscale_1x128x128_256x128x128x128_16x16_32x32_2x2_8x32x1_8x32x1_1x32x1x8_8_1x1_intrawave_v3,1005.7,805.99,0.0
256,7249,2048,2048,ck,0,0,60.2196,a8w8_blockscale_1x128x128_256x128x128x128_16x16_32x32_2x2_8x32x1_8x32x1_1x32x1x8_8_1x1_intrawave_v3,1009.79,809.24,0.0
256,7257,2048,128,ck,16,0,19.9793,a8w8_blockscale_1x128x128_256x64x64x128_16x16_32x32_1x1_8x32x1_8x32x1_1x32x1x8_8_1x1_intrawave_v1,190.44,1547.39,0.0
256,7257,2048,1024,ck,0,0,39.0674,a8w8_blockscale_1x128x128_256x128x128x128_16x16_32x32_2x2_8x32x1_8x32x1_1x32x1x8_8_1x1_intrawave_v3,779.12,1004.75,0.0
256,7265,2048,128,ck,16,0,20.034,a8w8_blockscale_1x128x128_256x64x64x128_16x16_32x32_1x1_8x32x1_8x32x1_1x32x1x8_8_1x1_intrawave_v1,190.12,1544.85,0.0
256,7265,2048,1024,ck,0,0,39.1808,a8w8_blockscale_1x128x128_256x128x128x128_16x16_32x32_2x2_8x32x1_8x32x1_1x32x1x8_8_1x1_intrawave_v3,777.72,1002.89,0.0
256,7273,2048,512,ck,18,0,27.9326,a8w8_blockscale_1x128x128_256x64x64x256_16x16_32x32_1x1_16x16x1_16x16x1_1x32x1x8_8_1x1_intrawave_v1,546.05,1237.36,0.0
256,7273,2048,4096,ck,0,0,105.4328,a8w8_blockscale_1x128x128_256x128x128x128_16x16_32x32_2x2_8x32x1_8x32x1_1x32x1x8_8_1x1_intrawave_v3,1157.33,644.67,0.0
256,7274,2048,512,ck,18,0,28.0138,a8w8_blockscale_1x128x128_256x64x64x256_16x16_32x32_1x1_16x16x1_16x16x1_1x32x1x8_8_1x1_intrawave_v1,544.54,1233.93,0.0
256,7274,2048,4096,ck,0,0,105.7716,a8w8_blockscale_1x128x128_256x128x128x128_16x16_32x32_2x2_8x32x1_8x32x1_1x32x1x8_8_1x1_intrawave_v3,1153.78,642.68,0.0
256,7316,2048,2048,ck,0,0,61.0854,a8w8_blockscale_1x128x128_256x128x128x128_16x16_32x32_2x2_8x32x1_8x32x1_1x32x1x8_8_1x1_intrawave_v3,1004.68,804.51,0.0
256,7391,2048,512,ck,18,0,28.2439,a8w8_blockscale_1x128x128_256x64x64x256_16x16_32x32_1x1_16x16x1_16x16x1_1x32x1x8_8_1x1_intrawave_v1,548.79,1242.97,0.0
256,7391,2048,4096,ck,0,0,105.4252,a8w8_blockscale_1x128x128_256x128x128x128_16x16_32x32_2x2_8x32x1_8x32x1_1x32x1x8_8_1x1_intrawave_v3,1176.19,653.88,0.0
256,7393,2048,128,ck,16,0,19.9371,a8w8_blockscale_1x128x128_256x64x64x128_16x16_32x32_1x1_8x32x1_8x32x1_1x32x1x8_8_1x1_intrawave_v1,194.41,1579.48,0.0
256,7393,2048,512,ck,18,0,28.227,a8w8_blockscale_1x128x128_256x64x64x256_16x16_32x32_1x1_16x16x1_16x16x1_1x32x1x8_8_1x1_intrawave_v1,549.27,1244.04,0.0
256,7393,2048,1024,ck,0,0,39.0886,a8w8_blockscale_1x128x128_256x128x128x128_16x16_32x32_2x2_8x32x1_8x32x1_1x32x1x8_8_1x1_intrawave_v3,793.29,1022.02,0.0
256,7393,2048,2048,ck,0,0,60.8974,a8w8_blockscale_1x128x128_256x128x128x128_16x16_32x32_2x2_8x32x1_8x32x1_1x32x1x8_8_1x1_intrawave_v3,1018.38,814.76,0.0
256,7393,2048,4096,ck,0,0,108.5461,a8w8_blockscale_1x128x128_256x128x128x128_16x16_32x32_2x2_8x32x1_8x32x1_1x32x1x8_8_1x1_intrawave_v3,1142.68,635.23,0.0
256,7461,2048,128,ck,16,0,20.0126,a8w8_blockscale_1x128x128_256x64x64x128_16x16_32x32_1x1_8x32x1_8x32x1_1x32x1x8_8_1x1_intrawave_v1,195.46,1587.87,0.0
256,7461,2048,1024,ck,0,0,38.9757,a8w8_blockscale_1x128x128_256x128x128x128_16x16_32x32_2x2_8x32x1_8x32x1_1x32x1x8_8_1x1_intrawave_v3,802.9,1033.91,0.0
256,7491,2048,2048,ck,0,0,61.7494,a8w8_blockscale_1x128x128_256x128x128x128_16x16_32x32_2x2_8x32x1_8x32x1_1x32x1x8_8_1x1_intrawave_v3,1017.65,813.27,0.0
256,7558,2048,2048,ck,0,0,61.6394,a8w8_blockscale_1x128x128_256x128x128x128_16x16_32x32_2x2_8x32x1_8x32x1_1x32x1x8_8_1x1_intrawave_v3,1028.58,821.4,0.0
256,7634,2048,128,ck,16,0,19.8552,a8w8_blockscale_1x128x128_256x64x64x128_16x16_32x32_1x1_8x32x1_8x32x1_1x32x1x8_8_1x1_intrawave_v1,201.58,1637.26,0.0
256,7634,2048,1024,ck,0,0,40.1175,a8w8_blockscale_1x128x128_256x128x128x128_16x16_32x32_2x2_8x32x1_8x32x1_1x32x1x8_8_1x1_intrawave_v3,798.14,1026.57,0.0
256,7650,2048,2048,ck,0,0,61.5122,a8w8_blockscale_1x128x128_256x128x128x128_16x16_32x32_2x2_8x32x1_8x32x1_1x32x1x8_8_1x1_intrawave_v3,1043.25,832.29,0.0
256,7715,2048,512,ck,0,0,28.3829,a8w8_blockscale_1x128x128_256x128x128x128_16x16_32x32_2x2_8x32x1_8x32x1_1x32x1x8_8_1x1_intrawave_v3,570.04,1289.48,0.0
256,7715,2048,4096,ck,0,0,107.8192,a8w8_blockscale_1x128x128_256x128x128x128_16x16_32x32_2x2_8x32x1_8x32x1_1x32x1x8_8_1x1_intrawave_v3,1200.49,663.98,0.0
256,7753,2048,512,ck,0,0,28.2865,a8w8_blockscale_1x128x128_256x128x128x128_16x16_32x32_2x2_8x32x1_8x32x1_1x32x1x8_8_1x1_intrawave_v3,574.8,1300.07,0.0
256,7753,2048,2048,ck,0,0,62.811,a8w8_blockscale_1x128x128_256x128x128x128_16x16_32x32_2x2_8x32x1_8x32x1_1x32x1x8_8_1x1_intrawave_v3,1035.44,825.15,0.0
256,7753,2048,4096,ck,0,0,110.7637,a8w8_blockscale_1x128x128_256x128x128x128_16x16_32x32_2x2_8x32x1_8x32x1_1x32x1x8_8_1x1_intrawave_v3,1174.34,649.14,0.0
256,7774,2048,2048,ck,0,0,63.0578,a8w8_blockscale_1x128x128_256x128x128x128_16x16_32x32_2x2_8x32x1_8x32x1_1x32x1x8_8_1x1_intrawave_v3,1034.18,823.97,0.0
256,7815,2048,2048,ck,0,0,61.7134,a8w8_blockscale_1x128x128_256x128x128x128_16x16_32x32_2x2_8x32x1_8x32x1_1x32x1x8_8_1x1_intrawave_v3,1062.28,846.0,0.0
256,7819,2048,512,ck,0,0,28.5198,a8w8_blockscale_1x128x128_256x128x128x128_16x16_32x32_2x2_8x32x1_8x32x1_1x32x1x8_8_1x1_intrawave_v3,574.96,1300.1,0.0
256,7819,2048,4096,ck,0,0,108.188,a8w8_blockscale_1x128x128_256x128x128x128_16x16_32x32_2x2_8x32x1_8x32x1_1x32x1x8_8_1x1_intrawave_v3,1212.53,669.59,0.0
256,7834,2048,2048,ck,0,0,61.7398,a8w8_blockscale_1x128x128_256x128x128x128_16x16_32x32_2x2_8x32x1_8x32x1_1x32x1x8_8_1x1_intrawave_v3,1064.41,847.53,0.0
256,7836,2048,2048,ck,0,0,62.2417,a8w8_blockscale_1x128x128_256x128x128x128_16x16_32x32_2x2_8x32x1_8x32x1_1x32x1x8_8_1x1_intrawave_v3,1056.09,840.89,0.0
256,7871,2048,2048,ck,0,0,61.7645,a8w8_blockscale_1x128x128_256x128x128x128_16x16_32x32_2x2_8x32x1_8x32x1_1x32x1x8_8_1x1_intrawave_v3,1069.01,850.87,0.0
256,7899,2048,2048,ck,0,0,61.8173,a8w8_blockscale_1x128x128_256x128x128x128_16x16_32x32_2x2_8x32x1_8x32x1_1x32x1x8_8_1x1_intrawave_v3,1071.89,852.93,0.0
256,7913,2048,2048,ck,0,0,63.1385,a8w8_blockscale_1x128x128_256x128x128x128_16x16_32x32_2x2_8x32x1_8x32x1_1x32x1x8_8_1x1_intrawave_v3,1051.32,836.44,0.0
256,7930,2048,2048,ck,0,0,62.8265,a8w8_blockscale_1x128x128_256x128x128x128_16x16_32x32_2x2_8x32x1_8x32x1_1x32x1x8_8_1x1_intrawave_v3,1058.82,842.26,0.0
256,7961,2048,2048,ck,0,0,62.9225,a8w8_blockscale_1x128x128_256x128x128x128_16x16_32x32_2x2_8x32x1_8x32x1_1x32x1x8_8_1x1_intrawave_v3,1061.33,844.0,0.0
256,7963,2048,2048,ck,0,0,63.2653,a8w8_blockscale_1x128x128_256x128x128x128_16x16_32x32_2x2_8x32x1_8x32x1_1x32x1x8_8_1x1_intrawave_v3,1055.85,839.62,0.0
256,7974,2048,2048,ck,0,0,63.5113,a8w8_blockscale_1x128x128_256x128x128x128_16x16_32x32_2x2_8x32x1_8x32x1_1x32x1x8_8_1x1_intrawave_v3,1053.21,837.43,0.0
256,8016,2048,2048,ck,0,0,64.0161,a8w8_blockscale_1x128x128_256x128x128x128_16x16_32x32_2x2_8x32x1_8x32x1_1x32x1x8_8_1x1_intrawave_v3,1050.41,834.86,0.0
256,8017,2048,2048,ck,0,0,63.8933,a8w8_blockscale_1x128x128_256x128x128x128_16x16_32x32_2x2_8x32x1_8x32x1_1x32x1x8_8_1x1_intrawave_v3,1052.56,836.56,0.0
256,8099,2048,512,ck,0,0,29.6878,a8w8_blockscale_1x128x128_256x128x128x128_16x16_32x32_2x2_8x32x1_8x32x1_1x32x1x8_8_1x1_intrawave_v3,572.11,1292.41,0.0
256,8099,2048,4096,ck,0,0,112.3067,a8w8_blockscale_1x128x128_256x128x128x128_16x16_32x32_2x2_8x32x1_8x32x1_1x32x1x8_8_1x1_intrawave_v3,1209.89,665.46,0.0
256,8103,2048,2048,ck,0,0,64.8946,a8w8_blockscale_1x128x128_256x128x128x128_16x16_32x32_2x2_8x32x1_8x32x1_1x32x1x8_8_1x1_intrawave_v3,1047.44,831.8,0.0
256,8128,2048,2048,ck,0,0,64.3673,a8w8_blockscale_1x128x128_256x128x128x128_16x16_32x32_2x2_8x32x1_8x32x1_1x32x1x8_8_1x1_intrawave_v3,1059.27,841.0,0.0
256,8129,2048,128,ck,16,0,21.014,a8w8_blockscale_1x128x128_256x64x64x128_16x16_32x32_1x1_8x32x1_8x32x1_1x32x1x8_8_1x1_intrawave_v1,202.81,1646.48,0.0
256,8129,2048,512,ck,0,0,29.3779,a8w8_blockscale_1x128x128_256x128x128x128_16x16_32x32_2x2_8x32x1_8x32x1_1x32x1x8_8_1x1_intrawave_v3,580.29,1310.75,0.0
256,8129,2048,1024,ck,0,0,41.7958,a8w8_blockscale_1x128x128_256x128x128x128_16x16_32x32_2x2_8x32x1_8x32x1_1x32x1x8_8_1x1_intrawave_v3,815.76,1045.98,0.0
256,8129,2048,2048,ck,0,0,63.9545,a8w8_blockscale_1x128x128_256x128x128x128_16x16_32x32_2x2_8x32x1_8x32x1_1x32x1x8_8_1x1_intrawave_v3,1066.24,846.52,0.0
256,8129,2048,4096,ck,0,0,110.8599,a8w8_blockscale_1x128x128_256x128x128x128_16x16_32x32_2x2_8x32x1_8x32x1_1x32x1x8_8_1x1_intrawave_v3,1230.22,676.36,0.0
256,8150,2048,2048,ck,0,0,64.535,a8w8_blockscale_1x128x128_256x128x128x128_16x16_32x32_2x2_8x32x1_8x32x1_1x32x1x8_8_1x1_intrawave_v3,1059.38,840.91,0.0
256,8184,2048,2048,ck,0,0,64.5657,a8w8_blockscale_1x128x128_256x128x128x128_16x16_32x32_2x2_8x32x1_8x32x1_1x32x1x8_8_1x1_intrawave_v3,1063.29,843.74,0.0
256,8185,2048,2048,ck,0,0,64.9389,a8w8_blockscale_1x128x128_256x128x128x128_16x16_32x32_2x2_8x32x1_8x32x1_1x32x1x8_8_1x1_intrawave_v3,1057.31,838.99,0.0
256,8188,2048,512,ck,0,0,29.4953,a8w8_blockscale_1x128x128_256x128x128x128_16x16_32x32_2x2_8x32x1_8x32x1_1x32x1x8_8_1x1_intrawave_v3,582.18,1314.75,0.0
256,8188,2048,4096,ck,0,0,112.3095,a8w8_blockscale_1x128x128_256x128x128x128_16x16_32x32_2x2_8x32x1_8x32x1_1x32x1x8_8_1x1_intrawave_v3,1223.15,671.94,0.0
256,8192,2048,128,ck,16,0,21.004,a8w8_blockscale_1x128x128_256x64x64x128_16x16_32x32_1x1_8x32x1_8x32x1_1x32x1x8_8_1x1_intrawave_v1,204.48,1659.93,0.0
256,8192,2048,512,ck,0,0,28.9667,a8w8_blockscale_1x128x128_256x128x128x128_16x16_32x32_2x2_8x32x1_8x32x1_1x32x1x8_8_1x1_intrawave_v3,593.09,1339.38,0.0
256,8192,2048,1024,ck,0,0,40.8064,a8w8_blockscale_1x128x128_256x128x128x128_16x16_32x32_2x2_8x32x1_8x32x1_1x32x1x8_8_1x1_intrawave_v3,842.02,1079.25,0.0
256,8192,2048,2048,ck,0,0,62.5737,a8w8_blockscale_1x128x128_256x128x128x128_16x16_32x32_2x2_8x32x1_8x32x1_1x32x1x8_8_1x1_intrawave_v3,1098.22,871.39,0.0
256,8192,2048,4096,ck,0,0,109.6159,a8w8_blockscale_1x128x128_256x128x128x128_16x16_32x32_2x2_8x32x1_8x32x1_1x32x1x8_8_1x1_intrawave_v3,1253.82,688.75,0.0
256,1,2560,2048,ck,8,3,5.367,a8w8_blockscale_1x128x128_256x16x64x256_16x16_16x16_1x1_16x16x1_16x16x1_1x16x1x16_4_1x1_intrawave_v1,1.95,978.21,0.0
256,2,2560,2048,ck,8,3,5.5185,a8w8_blockscale_1x128x128_256x16x64x256_16x16_16x16_1x1_16x16x1_16x16x1_1x16x1x16_4_1x1_intrawave_v1,3.8,952.65,0.0
256,4,2560,2048,ck,8,3,5.8605,a8w8_blockscale_1x128x128_256x16x64x256_16x16_16x16_1x1_16x16x1_16x16x1_1x16x1x16_4_1x1_intrawave_v1,7.16,899.51,0.0
256,8,2560,2048,ck,8,3,5.7487,a8w8_blockscale_1x128x128_256x16x64x256_16x16_16x16_1x1_16x16x1_16x16x1_1x16x1x16_4_1x1_intrawave_v1,14.59,921.99,0.0
256,16,2560,2048,ck,8,2,5.716,a8w8_blockscale_1x128x128_256x16x64x256_16x16_16x16_1x1_16x16x1_16x16x1_1x16x1x16_4_1x1_intrawave_v1,29.35,937.29,0.0
256,32,2560,2048,ck,8,2,6.7866,a8w8_blockscale_1x128x128_256x16x64x256_16x16_16x16_1x1_16x16x1_16x16x1_1x16x1x16_4_1x1_intrawave_v1,49.44,806.33,0.0
256,48,2560,2048,ck,8,2,7.0805,a8w8_blockscale_1x128x128_256x16x64x256_16x16_16x16_1x1_16x16x1_16x16x1_1x16x1x16_4_1x1_intrawave_v1,71.08,789.06,0.0
256,64,2560,2048,ck,8,0,8.1433,a8w8_blockscale_1x128x128_256x16x64x256_16x16_16x16_1x1_16x16x1_16x16x1_1x16x1x16_4_1x1_intrawave_v1,82.41,700.16,0.0
256,80,2560,2048,ck,8,0,8.0362,a8w8_blockscale_1x128x128_256x16x64x256_16x16_16x16_1x1_16x16x1_16x16x1_1x16x1x16_4_1x1_intrawave_v1,104.39,723.76,0.0
256,96,2560,2048,ck,8,0,8.1011,a8w8_blockscale_1x128x128_256x16x64x256_16x16_16x16_1x1_16x16x1_16x16x1_1x16x1x16_4_1x1_intrawave_v1,124.26,732.12,0.0
256,112,2560,2048,ck,8,2,9.0881,a8w8_blockscale_1x128x128_256x16x64x256_16x16_16x16_1x1_16x16x1_16x16x1_1x16x1x16_4_1x1_intrawave_v1,129.22,665.23,0.0
256,128,2560,2048,ck,7,0,9.4037,a8w8_blockscale_1x128x128_256x16x128x256_16x16_16x16_1x2_16x16x1_16x16x1_1x16x1x16_8_1x2_intrawave_v1,142.73,655.1,0.0
256,256,2560,2048,ck,18,0,10.7262,a8w8_blockscale_1x128x128_256x64x64x256_16x16_32x32_1x1_16x16x1_16x16x1_1x32x1x8_8_1x1_intrawave_v1,250.26,659.87,0.0
256,512,2560,2048,ck,2,0,15.4815,a8w8_blockscale_1x128x128_256x64x128x128_16x16_32x32_1x2_8x32x1_8x32x1_1x32x1x8_8_1x1_intrawave_v3,346.78,575.71,0.0
256,588,2560,2048,ck,2,0,15.5874,a8w8_blockscale_1x128x128_256x64x128x128_16x16_32x32_1x2_8x32x1_8x32x1_1x32x1x8_8_1x1_intrawave_v3,395.55,606.75,0.0
256,773,2560,2048,ck,3,0,18.6104,a8w8_blockscale_1x128x128_256x64x64x128_16x16_32x32_1x1_8x32x1_8x32x1_1x32x1x8_8_1x1_intrawave_v3,435.54,579.45,0.0
256,822,2560,2048,ck,3,0,18.8581,a8w8_blockscale_1x128x128_256x64x64x128_16x16_32x32_1x1_8x32x1_8x32x1_1x32x1x8_8_1x1_intrawave_v3,457.06,590.46,0.0
256,1024,2560,2048,ck,0,0,19.3105,a8w8_blockscale_1x128x128_256x128x128x128_16x16_32x32_2x2_8x32x1_8x32x1_1x32x1x8_8_1x1_intrawave_v3,556.04,651.61,0.0
256,1025,2560,2048,ck,0,0,19.9539,a8w8_blockscale_1x128x128_256x128x128x128_16x16_32x32_2x2_8x32x1_8x32x1_1x32x1x8_8_1x1_intrawave_v3,538.64,630.96,0.0
256,1027,2560,2048,ck,0,0,19.9661,a8w8_blockscale_1x128x128_256x128x128x128_16x16_32x32_2x2_8x32x1_8x32x1_1x32x1x8_8_1x1_intrawave_v3,539.36,631.29,0.0
256,1042,2560,2048,ck,0,0,20.1339,a8w8_blockscale_1x128x128_256x128x128x128_16x16_32x32_2x2_8x32x1_8x32x1_1x32x1x8_8_1x1_intrawave_v3,542.67,631.37,0.0
256,1051,2560,2048,ck,0,0,20.0294,a8w8_blockscale_1x128x128_256x128x128x128_16x16_32x32_2x2_8x32x1_8x32x1_1x32x1x8_8_1x1_intrawave_v3,550.22,637.88,0.0
256,1055,2560,2048,ck,3,0,20.1046,a8w8_blockscale_1x128x128_256x64x64x128_16x16_32x32_1x1_8x32x1_8x32x1_1x32x1x8_8_1x1_intrawave_v3,550.25,636.92,0.0
256,1057,2560,2048,ck,0,0,20.0766,a8w8_blockscale_1x128x128_256x128x128x128_16x16_32x32_2x2_8x32x1_8x32x1_1x32x1x8_8_1x1_intrawave_v3,552.06,638.53,0.0
256,1069,2560,2048,ck,0,0,20.1383,a8w8_blockscale_1x128x128_256x128x128x128_16x16_32x32_2x2_8x32x1_8x32x1_1x32x1x8_8_1x1_intrawave_v3,556.61,640.84,0.0
256,1072,2560,2048,ck,3,0,20.1533,a8w8_blockscale_1x128x128_256x64x64x128_16x16_32x32_1x1_8x32x1_8x32x1_1x32x1x8_8_1x1_intrawave_v3,557.76,641.43,0.0
256,1074,2560,2048,ck,0,0,20.0754,a8w8_blockscale_1x128x128_256x128x128x128_16x16_32x32_2x2_8x32x1_8x32x1_1x32x1x8_8_1x1_intrawave_v3,560.97,644.64,0.0
256,1091,2560,2048,ck,0,0,20.1682,a8w8_blockscale_1x128x128_256x128x128x128_16x16_32x32_2x2_8x32x1_8x32x1_1x32x1x8_8_1x1_intrawave_v3,567.23,647.71,0.0
256,1128,2560,2048,ck,0,0,20.34,a8w8_blockscale_1x128x128_256x128x128x128_16x16_32x32_2x2_8x32x1_8x32x1_1x32x1x8_8_1x1_intrawave_v3,581.51,655.28,0.0
256,1136,2560,2048,ck,0,0,20.3183,a8w8_blockscale_1x128x128_256x128x128x128_16x16_32x32_2x2_8x32x1_8x32x1_1x32x1x8_8_1x1_intrawave_v3,586.26,658.8,0.0
256,1514,2560,2048,ck,0,0,20.9175,a8w8_blockscale_1x128x128_256x128x128x128_16x16_32x32_2x2_8x32x1_8x32x1_1x32x1x8_8_1x1_intrawave_v3,758.95,769.46,0.0
256,2017,2560,2048,ck,2,0,29.8467,a8w8_blockscale_1x128x128_256x64x128x128_16x16_32x32_1x2_8x32x1_8x32x1_1x32x1x8_8_1x1_intrawave_v3,708.61,660.06,0.0
256,2048,2560,2048,ck,2,0,29.5721,a8w8_blockscale_1x128x128_256x64x128x128_16x16_32x32_1x2_8x32x1_8x32x1_1x32x1x8_8_1x1_intrawave_v3,726.19,673.71,0.0
256,2151,2560,2048,ck,2,0,29.8237,a8w8_blockscale_1x128x128_256x64x128x128_16x16_32x32_1x2_8x32x1_8x32x1_1x32x1x8_8_1x1_intrawave_v3,756.27,692.78,0.0
256,2332,2560,2048,ck,2,0,30.0644,a8w8_blockscale_1x128x128_256x64x128x128_16x16_32x32_1x2_8x32x1_8x32x1_1x32x1x8_8_1x1_intrawave_v3,813.35,730.39,0.0
256,2341,2560,2048,ck,2,0,30.1464,a8w8_blockscale_1x128x128_256x64x128x128_16x16_32x32_1x2_8x32x1_8x32x1_1x32x1x8_8_1x1_intrawave_v3,814.27,730.54,0.0
256,3072,2560,2048,ck,0,0,32.4917,a8w8_blockscale_1x128x128_256x128x128x128_16x16_32x32_2x2_8x32x1_8x32x1_1x32x1x8_8_1x1_intrawave_v3,991.4,839.08,0.0
256,3073,2560,2048,ck,0,0,33.7685,a8w8_blockscale_1x128x128_256x128x128x128_16x16_32x32_2x2_8x32x1_8x32x1_1x32x1x8_8_1x1_intrawave_v3,954.22,807.56,0.0
256,3089,2560,2048,ck,0,0,33.7545,a8w8_blockscale_1x128x128_256x128x128x128_16x16_32x32_2x2_8x32x1_8x32x1_1x32x1x8_8_1x1_intrawave_v3,959.59,811.29,0.0
256,3110,2560,2048,ck,0,0,34.2817,a8w8_blockscale_1x128x128_256x128x128x128_16x16_32x32_2x2_8x32x1_8x32x1_1x32x1x8_8_1x1_intrawave_v3,951.26,803.21,0.0
256,3137,2560,2048,ck,0,0,33.4607,a8w8_blockscale_1x128x128_256x128x128x128_16x16_32x32_2x2_8x32x1_8x32x1_1x32x1x8_8_1x1_intrawave_v3,983.06,828.7,0.0
256,3613,2560,2048,ck,0,0,45.1127,a8w8_blockscale_1x128x128_256x128x128x128_16x16_32x32_2x2_8x32x1_8x32x1_1x32x1x8_8_1x1_intrawave_v3,839.79,690.29,0.0
256,4096,2560,2048,ck,0,0,46.6844,a8w8_blockscale_1x128x128_256x128x128x128_16x16_32x32_2x2_8x32x1_8x32x1_1x32x1x8_8_1x1_intrawave_v3,920.0,741.21,0.0
256,4097,2560,2048,ck,0,0,46.7846,a8w8_blockscale_1x128x128_256x128x128x128_16x16_32x32_2x2_8x32x1_8x32x1_1x32x1x8_8_1x1_intrawave_v3,918.25,739.78,0.0
256,4109,2560,2048,ck,0,0,47.1202,a8w8_blockscale_1x128x128_256x128x128x128_16x16_32x32_2x2_8x32x1_8x32x1_1x32x1x8_8_1x1_intrawave_v3,914.38,736.33,0.0
256,4143,2560,2048,ck,0,0,46.7679,a8w8_blockscale_1x128x128_256x128x128x128_16x16_32x32_2x2_8x32x1_8x32x1_1x32x1x8_8_1x1_intrawave_v3,928.9,747.09,0.0
256,4345,2560,2048,ck,0,0,48.0906,a8w8_blockscale_1x128x128_256x128x128x128_16x16_32x32_2x2_8x32x1_8x32x1_1x32x1x8_8_1x1_intrawave_v3,947.39,756.65,0.0
256,4413,2560,2048,ck,0,0,48.6758,a8w8_blockscale_1x128x128_256x128x128x128_16x16_32x32_2x2_8x32x1_8x32x1_1x32x1x8_8_1x1_intrawave_v3,950.65,757.57,0.0
256,5121,2560,2048,ck,0,0,58.4379,a8w8_blockscale_1x128x128_256x128x128x128_16x16_32x32_2x2_8x32x1_8x32x1_1x32x1x8_8_1x1_intrawave_v3,918.88,717.86,0.0
256,5123,2560,2048,ck,0,0,58.0567,a8w8_blockscale_1x128x128_256x128x128x128_16x16_32x32_2x2_8x32x1_8x32x1_1x32x1x8_8_1x1_intrawave_v3,925.28,722.82,0.0
256,5133,2560,2048,ck,0,0,58.2175,a8w8_blockscale_1x128x128_256x128x128x128_16x16_32x32_2x2_8x32x1_8x32x1_1x32x1x8_8_1x1_intrawave_v3,924.52,722.05,0.0
256,5185,2560,2048,ck,0,0,57.9094,a8w8_blockscale_1x128x128_256x128x128x128_16x16_32x32_2x2_8x32x1_8x32x1_1x32x1x8_8_1x1_intrawave_v3,938.86,732.33,0.0
256,5191,2560,2048,ck,0,0,58.4027,a8w8_blockscale_1x128x128_256x128x128x128_16x16_32x32_2x2_8x32x1_8x32x1_1x32x1x8_8_1x1_intrawave_v3,932.0,726.88,0.0
256,6146,2560,2048,ck,0,0,62.4835,a8w8_blockscale_1x128x128_256x128x128x128_16x16_32x32_2x2_8x32x1_8x32x1_1x32x1x8_8_1x1_intrawave_v3,1031.4,788.97,0.0
256,6147,2560,2048,ck,0,0,62.7399,a8w8_blockscale_1x128x128_256x128x128x128_16x16_32x32_2x2_8x32x1_8x32x1_1x32x1x8_8_1x1_intrawave_v3,1027.35,785.86,0.0
256,6155,2560,2048,ck,0,0,62.7987,a8w8_blockscale_1x128x128_256x128x128x128_16x16_32x32_2x2_8x32x1_8x32x1_1x32x1x8_8_1x1_intrawave_v3,1027.73,786.03,0.0
256,6377,2560,2048,ck,0,0,63.0003,a8w8_blockscale_1x128x128_256x128x128x128_16x16_32x32_2x2_8x32x1_8x32x1_1x32x1x8_8_1x1_intrawave_v3,1061.39,808.78,0.0
256,6401,2560,2048,ck,0,0,63.4323,a8w8_blockscale_1x128x128_256x128x128x128_16x16_32x32_2x2_8x32x1_8x32x1_1x32x1x8_8_1x1_intrawave_v3,1058.13,805.98,0.0
256,7121,2560,2048,ck,0,0,73.1416,a8w8_blockscale_1x128x128_256x128x128x128_16x16_32x32_2x2_8x32x1_8x32x1_1x32x1x8_8_1x1_intrawave_v3,1020.88,769.55,0.0
256,7169,2560,2048,ck,0,0,75.462,a8w8_blockscale_1x128x128_256x128x128x128_16x16_32x32_2x2_8x32x1_8x32x1_1x32x1x8_8_1x1_intrawave_v3,996.16,750.45,0.0
256,7170,2560,2048,ck,0,0,74.0148,a8w8_blockscale_1x128x128_256x128x128x128_16x16_32x32_2x2_8x32x1_8x32x1_1x32x1x8_8_1x1_intrawave_v3,1015.78,765.22,0.0
256,7176,2560,2048,ck,0,0,73.9588,a8w8_blockscale_1x128x128_256x128x128x128_16x16_32x32_2x2_8x32x1_8x32x1_1x32x1x8_8_1x1_intrawave_v3,1017.4,766.38,0.0
256,7177,2560,2048,ck,0,0,73.7636,a8w8_blockscale_1x128x128_256x128x128x128_16x16_32x32_2x2_8x32x1_8x32x1_1x32x1x8_8_1x1_intrawave_v3,1020.24,768.5,0.0
256,7185,2560,2048,ck,0,0,73.5133,a8w8_blockscale_1x128x128_256x128x128x128_16x16_32x32_2x2_8x32x1_8x32x1_1x32x1x8_8_1x1_intrawave_v3,1024.85,771.9,0.0
256,7206,2560,2048,ck,0,0,74.1069,a8w8_blockscale_1x128x128_256x128x128x128_16x16_32x32_2x2_8x32x1_8x32x1_1x32x1x8_8_1x1_intrawave_v3,1019.61,767.75,0.0
256,7217,2560,2048,ck,0,0,74.4117,a8w8_blockscale_1x128x128_256x128x128x128_16x16_32x32_2x2_8x32x1_8x32x1_1x32x1x8_8_1x1_intrawave_v3,1016.99,765.66,0.0
256,7257,2560,2048,ck,0,0,74.668,a8w8_blockscale_1x128x128_256x128x128x128_16x16_32x32_2x2_8x32x1_8x32x1_1x32x1x8_8_1x1_intrawave_v3,1019.11,766.88,0.0
256,7265,2560,2048,ck,0,0,73.9996,a8w8_blockscale_1x128x128_256x128x128x128_16x16_32x32_2x2_8x32x1_8x32x1_1x32x1x8_8_1x1_intrawave_v3,1029.45,774.58,0.0
256,7393,2560,2048,ck,0,0,73.266,a8w8_blockscale_1x128x128_256x128x128x128_16x16_32x32_2x2_8x32x1_8x32x1_1x32x1x8_8_1x1_intrawave_v3,1058.08,794.86,0.0
256,7461,2560,2048,ck,0,0,74.3364,a8w8_blockscale_1x128x128_256x128x128x128_16x16_32x32_2x2_8x32x1_8x32x1_1x32x1x8_8_1x1_intrawave_v3,1052.44,789.97,0.0
256,7634,2560,2048,ck,0,0,77.1108,a8w8_blockscale_1x128x128_256x128x128x128_16x16_32x32_2x2_8x32x1_8x32x1_1x32x1x8_8_1x1_intrawave_v3,1038.09,777.63,0.0
256,8129,2560,2048,ck,0,0,78.1535,a8w8_blockscale_1x128x128_256x128x128x128_16x16_32x32_2x2_8x32x1_8x32x1_1x32x1x8_8_1x1_intrawave_v3,1090.66,812.65,0.0
256,8192,2560,2048,ck,0,0,76.6231,a8w8_blockscale_1x128x128_256x128x128x128_16x16_32x32_2x2_8x32x1_8x32x1_1x32x1x8_8_1x1_intrawave_v3,1121.06,834.78,0.0
256,1,3072,2048,ck,8,3,5.6291,a8w8_blockscale_1x128x128_256x16x64x256_16x16_16x16_1x1_16x16x1_16x16x1_1x16x1x16_4_1x1_intrawave_v1,2.24,1119.12,0.0
256,2,3072,2048,ck,8,2,5.4405,a8w8_blockscale_1x128x128_256x16x64x256_16x16_16x16_1x1_16x16x1_16x16x1_1x16x1x16_4_1x1_intrawave_v1,4.63,1159.42,0.0
256,4,3072,2048,ck,8,3,6.2817,a8w8_blockscale_1x128x128_256x16x64x256_16x16_16x16_1x1_16x16x1_16x16x1_1x16x1x16_4_1x1_intrawave_v1,8.01,1006.77,0.0
256,8,3072,2048,ck,8,3,5.824,a8w8_blockscale_1x128x128_256x16x64x256_16x16_16x16_1x1_16x16x1_16x16x1_1x16x1x16_4_1x1_intrawave_v1,17.28,1091.52,0.0
256,16,3072,2048,ck,8,3,6.3531,a8w8_blockscale_1x128x128_256x16x64x256_16x16_16x16_1x1_16x16x1_16x16x1_1x16x1x16_4_1x1_intrawave_v1,31.69,1010.93,0.0
256,32,3072,2048,ck,8,2,6.9424,a8w8_blockscale_1x128x128_256x16x64x256_16x16_16x16_1x1_16x16x1_16x16x1_1x16x1x16_4_1x1_intrawave_v1,58.0,944.0,0.0
256,48,3072,2048,ck,8,2,7.6575,a8w8_blockscale_1x128x128_256x16x64x256_16x16_16x16_1x1_16x16x1_16x16x1_1x16x1x16_4_1x1_intrawave_v1,78.87,872.96,0.0
256,64,3072,2048,ck,8,2,7.7815,a8w8_blockscale_1x128x128_256x16x64x256_16x16_16x16_1x1_16x16x1_16x16x1_1x16x1x16_4_1x1_intrawave_v1,103.49,875.89,0.0
256,80,3072,2048,ck,8,0,8.2469,a8w8_blockscale_1x128x128_256x16x64x256_16x16_16x16_1x1_16x16x1_16x16x1_1x16x1x16_4_1x1_intrawave_v1,122.06,842.35,0.0
256,96,3072,2048,ck,7,0,9.5772,a8w8_blockscale_1x128x128_256x16x128x256_16x16_16x16_1x2_16x16x1_16x16x1_1x16x1x16_8_1x2_intrawave_v1,126.13,739.04,0.0
256,112,3072,2048,ck,8,2,9.7496,a8w8_blockscale_1x128x128_256x16x64x256_16x16_16x16_1x1_16x16x1_16x16x1_1x16x1x16_4_1x1_intrawave_v1,144.55,739.41,0.0
256,128,3072,2048,ck,7,0,9.5057,a8w8_blockscale_1x128x128_256x16x128x256_16x16_16x16_1x2_16x16x1_16x16x1_1x16x1x16_8_1x2_intrawave_v1,169.44,772.17,0.0
256,256,3072,2048,ck,18,0,9.797,a8w8_blockscale_1x128x128_256x64x64x256_16x16_32x32_1x1_16x16x1_16x16x1_1x32x1x8_8_1x1_intrawave_v1,328.8,856.24,0.0
256,512,3072,2048,ck,2,0,15.1595,a8w8_blockscale_1x128x128_256x64x128x128_16x16_32x32_1x2_8x32x1_8x32x1_1x32x1x8_8_1x1_intrawave_v3,424.98,691.7,0.0
256,588,3072,2048,ck,2,0,15.6224,a8w8_blockscale_1x128x128_256x64x128x128_16x16_32x32_1x2_8x32x1_8x32x1_1x32x1x8_8_1x1_intrawave_v3,473.6,711.05,0.0
256,773,3072,2048,ck,0,0,19.847,a8w8_blockscale_1x128x128_256x128x128x128_16x16_32x32_2x2_8x32x1_8x32x1_1x32x1x8_8_1x1_intrawave_v3,490.08,636.06,0.0
256,822,3072,2048,ck,2,0,19.9979,a8w8_blockscale_1x128x128_256x64x128x128_16x16_32x32_1x2_8x32x1_8x32x1_1x32x1x8_8_1x1_intrawave_v3,517.21,651.33,0.0
256,1024,3072,2048,ck,0,0,19.6228,a8w8_blockscale_1x128x128_256x128x128x128_16x16_32x32_2x2_8x32x1_8x32x1_1x32x1x8_8_1x1_intrawave_v3,656.63,748.11,0.0
256,1025,3072,2048,ck,0,0,20.3225,a8w8_blockscale_1x128x128_256x128x128x128_16x16_32x32_2x2_8x32x1_8x32x1_1x32x1x8_8_1x1_intrawave_v3,634.64,722.76,0.0
256,1027,3072,2048,ck,0,0,20.4404,a8w8_blockscale_1x128x128_256x128x128x128_16x16_32x32_2x2_8x32x1_8x32x1_1x32x1x8_8_1x1_intrawave_v3,632.21,719.39,0.0
256,1042,3072,2048,ck,0,0,20.3467,a8w8_blockscale_1x128x128_256x128x128x128_16x16_32x32_2x2_8x32x1_8x32x1_1x32x1x8_8_1x1_intrawave_v3,644.4,728.74,0.0
256,1051,3072,2048,ck,0,0,20.4327,a8w8_blockscale_1x128x128_256x128x128x128_16x16_32x32_2x2_8x32x1_8x32x1_1x32x1x8_8_1x1_intrawave_v3,647.23,729.28,0.0
256,1055,3072,2048,ck,0,0,20.5867,a8w8_blockscale_1x128x128_256x128x128x128_16x16_32x32_2x2_8x32x1_8x32x1_1x32x1x8_8_1x1_intrawave_v3,644.83,725.42,0.0
256,1057,3072,2048,ck,0,0,20.4243,a8w8_blockscale_1x128x128_256x128x128x128_16x16_32x32_2x2_8x32x1_8x32x1_1x32x1x8_8_1x1_intrawave_v3,651.19,731.99,0.0
256,1069,3072,2048,ck,0,0,20.7518,a8w8_blockscale_1x128x128_256x128x128x128_16x16_32x32_2x2_8x32x1_8x32x1_1x32x1x8_8_1x1_intrawave_v3,648.19,725.18,0.0
256,1072,3072,2048,ck,0,0,20.6671,a8w8_blockscale_1x128x128_256x128x128x128_16x16_32x32_2x2_8x32x1_8x32x1_1x32x1x8_8_1x1_intrawave_v3,652.67,729.34,0.0
256,1074,3072,2048,ck,0,0,20.6713,a8w8_blockscale_1x128x128_256x128x128x128_16x16_32x32_2x2_8x32x1_8x32x1_1x32x1x8_8_1x1_intrawave_v3,653.76,729.98,0.0
256,1091,3072,2048,ck,0,0,20.6187,a8w8_blockscale_1x128x128_256x128x128x128_16x16_32x32_2x2_8x32x1_8x32x1_1x32x1x8_8_1x1_intrawave_v3,665.8,738.6,0.0
256,1128,3072,2048,ck,0,0,20.7257,a8w8_blockscale_1x128x128_256x128x128x128_16x16_32x32_2x2_8x32x1_8x32x1_1x32x1x8_8_1x1_intrawave_v3,684.83,749.41,0.0
256,1136,3072,2048,ck,0,0,20.7294,a8w8_blockscale_1x128x128_256x128x128x128_16x16_32x32_2x2_8x32x1_8x32x1_1x32x1x8_8_1x1_intrawave_v3,689.56,752.44,0.0
256,1514,3072,2048,ck,2,0,28.1362,a8w8_blockscale_1x128x128_256x64x128x128_16x16_32x32_1x2_8x32x1_8x32x1_1x32x1x8_8_1x1_intrawave_v3,677.08,664.42,0.0
256,2017,3072,2048,ck,2,0,31.148,a8w8_blockscale_1x128x128_256x64x128x128_16x16_32x32_1x2_8x32x1_8x32x1_1x32x1x8_8_1x1_intrawave_v3,814.81,732.46,0.0
256,2048,3072,2048,ck,2,0,30.6352,a8w8_blockscale_1x128x128_256x64x128x128_16x16_32x32_1x2_8x32x1_8x32x1_1x32x1x8_8_1x1_intrawave_v3,841.18,753.01,0.0
256,2151,3072,2048,ck,0,0,31.9273,a8w8_blockscale_1x128x128_256x128x128x128_16x16_32x32_2x2_8x32x1_8x32x1_1x32x1x8_8_1x1_intrawave_v3,847.73,748.97,0.0
256,2332,3072,2048,ck,0,0,33.0033,a8w8_blockscale_1x128x128_256x128x128x128_16x16_32x32_2x2_8x32x1_8x32x1_1x32x1x8_8_1x1_intrawave_v3,889.1,769.47,0.0
256,2341,3072,2048,ck,0,0,32.8252,a8w8_blockscale_1x128x128_256x128x128x128_16x16_32x32_2x2_8x32x1_8x32x1_1x32x1x8_8_1x1_intrawave_v3,897.38,775.9,0.0
256,3072,3072,2048,ck,0,0,44.3226,a8w8_blockscale_1x128x128_256x128x128x128_16x16_32x32_2x2_8x32x1_8x32x1_1x32x1x8_8_1x1_intrawave_v3,872.12,709.73,0.0
256,3073,3072,2048,ck,0,0,45.9242,a8w8_blockscale_1x128x128_256x128x128x128_16x16_32x32_2x2_8x32x1_8x32x1_1x32x1x8_8_1x1_intrawave_v3,841.98,685.16,0.0
256,3089,3072,2048,ck,0,0,45.6044,a8w8_blockscale_1x128x128_256x128x128x128_16x16_32x32_2x2_8x32x1_8x32x1_1x32x1x8_8_1x1_intrawave_v3,852.3,692.84,0.0
256,3110,3072,2048,ck,0,0,46.1586,a8w8_blockscale_1x128x128_256x128x128x128_16x16_32x32_2x2_8x32x1_8x32x1_1x32x1x8_8_1x1_intrawave_v3,847.79,688.25,0.0
256,3137,3072,2048,ck,0,0,46.6586,a8w8_blockscale_1x128x128_256x128x128x128_16x16_32x32_2x2_8x32x1_8x32x1_1x32x1x8_8_1x1_intrawave_v3,845.99,685.61,0.0
256,3613,3072,2048,ck,0,0,48.339,a8w8_blockscale_1x128x128_256x128x128x128_16x16_32x32_2x2_8x32x1_8x32x1_1x32x1x8_8_1x1_intrawave_v3,940.48,742.45,0.0
256,4096,3072,2048,ck,0,0,49.1022,a8w8_blockscale_1x128x128_256x128x128x128_16x16_32x32_2x2_8x32x1_8x32x1_1x32x1x8_8_1x1_intrawave_v3,1049.64,811.49,0.0
256,4097,3072,2048,ck,0,0,58.0774,a8w8_blockscale_1x128x128_256x128x128x128_16x16_32x32_2x2_8x32x1_8x32x1_1x32x1x8_8_1x1_intrawave_v3,887.65,686.22,0.0
256,4109,3072,2048,ck,0,0,57.9058,a8w8_blockscale_1x128x128_256x128x128x128_16x16_32x32_2x2_8x32x1_8x32x1_1x32x1x8_8_1x1_intrawave_v3,892.88,689.95,0.0
256,4143,3072,2048,ck,0,0,58.0635,a8w8_blockscale_1x128x128_256x128x128x128_16x16_32x32_2x2_8x32x1_8x32x1_1x32x1x8_8_1x1_intrawave_v3,897.83,692.88,0.0
256,4345,3072,2048,ck,0,0,58.4118,a8w8_blockscale_1x128x128_256x128x128x128_16x16_32x32_2x2_8x32x1_8x32x1_1x32x1x8_8_1x1_intrawave_v3,935.99,717.08,0.0
256,4413,3072,2048,ck,0,0,59.117,a8w8_blockscale_1x128x128_256x128x128x128_16x16_32x32_2x2_8x32x1_8x32x1_1x32x1x8_8_1x1_intrawave_v3,939.3,717.94,0.0
256,5121,3072,2048,ck,0,0,62.3415,a8w8_blockscale_1x128x128_256x128x128x128_16x16_32x32_2x2_8x32x1_8x32x1_1x32x1x8_8_1x1_intrawave_v3,1033.61,773.85,0.0
256,5123,3072,2048,ck,0,0,62.6535,a8w8_blockscale_1x128x128_256x128x128x128_16x16_32x32_2x2_8x32x1_8x32x1_1x32x1x8_8_1x1_intrawave_v3,1028.87,770.25,0.0
256,5133,3072,2048,ck,0,0,62.1035,a8w8_blockscale_1x128x128_256x128x128x128_16x16_32x32_2x2_8x32x1_8x32x1_1x32x1x8_8_1x1_intrawave_v3,1040.01,778.39,0.0
256,5185,3072,2048,ck,0,0,62.6095,a8w8_blockscale_1x128x128_256x128x128x128_16x16_32x32_2x2_8x32x1_8x32x1_1x32x1x8_8_1x1_intrawave_v3,1042.05,778.91,0.0
256,5191,3072,2048,ck,0,0,61.2399,a8w8_blockscale_1x128x128_256x128x128x128_16x16_32x32_2x2_8x32x1_8x32x1_1x32x1x8_8_1x1_intrawave_v3,1066.59,797.13,0.0
256,6146,3072,2048,ck,0,0,74.6216,a8w8_blockscale_1x128x128_256x128x128x128_16x16_32x32_2x2_8x32x1_8x32x1_1x32x1x8_8_1x1_intrawave_v3,1036.36,759.02,0.0
256,6147,3072,2048,ck,0,0,73.9452,a8w8_blockscale_1x128x128_256x128x128x128_16x16_32x32_2x2_8x32x1_8x32x1_1x32x1x8_8_1x1_intrawave_v3,1046.01,766.08,0.0
256,6155,3072,2048,ck,0,0,76.7184,a8w8_blockscale_1x128x128_256x128x128x128_16x16_32x32_2x2_8x32x1_8x32x1_1x32x1x8_8_1x1_intrawave_v3,1009.51,739.24,0.0
256,6377,3072,2048,ck,0,0,74.5048,a8w8_blockscale_1x128x128_256x128x128x128_16x16_32x32_2x2_8x32x1_8x32x1_1x32x1x8_8_1x1_intrawave_v3,1076.99,785.61,0.0
256,6401,3072,2048,ck,0,0,75.3308,a8w8_blockscale_1x128x128_256x128x128x128_16x16_32x32_2x2_8x32x1_8x32x1_1x32x1x8_8_1x1_intrawave_v3,1069.19,779.61,0.0
256,7121,3072,2048,ck,0,0,86.0913,a8w8_blockscale_1x128x128_256x128x128x128_16x16_32x32_2x2_8x32x1_8x32x1_1x32x1x8_8_1x1_intrawave_v3,1040.79,750.68,0.0
256,7169,3072,2048,ck,0,0,87.3018,a8w8_blockscale_1x128x128_256x128x128x128_16x16_32x32_2x2_8x32x1_8x32x1_1x32x1x8_8_1x1_intrawave_v3,1033.28,744.77,0.0
256,7170,3072,2048,ck,0,0,86.4142,a8w8_blockscale_1x128x128_256x128x128x128_16x16_32x32_2x2_8x32x1_8x32x1_1x32x1x8_8_1x1_intrawave_v3,1044.04,752.52,0.0
256,7176,3072,2048,ck,0,0,87.681,a8w8_blockscale_1x128x128_256x128x128x128_16x16_32x32_2x2_8x32x1_8x32x1_1x32x1x8_8_1x1_intrawave_v3,1029.81,742.2,0.0
256,7177,3072,2048,ck,0,0,87.207,a8w8_blockscale_1x128x128_256x128x128x128_16x16_32x32_2x2_8x32x1_8x32x1_1x32x1x8_8_1x1_intrawave_v3,1035.55,746.33,0.0
256,7185,3072,2048,ck,0,0,86.471,a8w8_blockscale_1x128x128_256x128x128x128_16x16_32x32_2x2_8x32x1_8x32x1_1x32x1x8_8_1x1_intrawave_v3,1045.53,753.44,0.0
256,7206,3072,2048,ck,0,0,86.5754,a8w8_blockscale_1x128x128_256x128x128x128_16x16_32x32_2x2_8x32x1_8x32x1_1x32x1x8_8_1x1_intrawave_v3,1047.32,754.52,0.0
256,7217,3072,2048,ck,0,0,87.1775,a8w8_blockscale_1x128x128_256x128x128x128_16x16_32x32_2x2_8x32x1_8x32x1_1x32x1x8_8_1x1_intrawave_v3,1041.68,750.34,0.0
256,7257,3072,2048,ck,0,0,87.0138,a8w8_blockscale_1x128x128_256x128x128x128_16x16_32x32_2x2_8x32x1_8x32x1_1x32x1x8_8_1x1_intrawave_v3,1049.42,755.52,0.0
256,7265,3072,2048,ck,0,0,87.849,a8w8_blockscale_1x128x128_256x128x128x128_16x16_32x32_2x2_8x32x1_8x32x1_1x32x1x8_8_1x1_intrawave_v3,1040.59,749.08,0.0
256,7393,3072,2048,ck,0,0,86.5526,a8w8_blockscale_1x128x128_256x128x128x128_16x16_32x32_2x2_8x32x1_8x32x1_1x32x1x8_8_1x1_intrawave_v3,1074.79,772.42,0.0
256,7461,3072,2048,ck,0,0,89.0722,a8w8_blockscale_1x128x128_256x128x128x128_16x16_32x32_2x2_8x32x1_8x32x1_1x32x1x8_8_1x1_intrawave_v3,1053.99,756.82,0.0
256,7634,3072,2048,ck,0,0,87.5518,a8w8_blockscale_1x128x128_256x128x128x128_16x16_32x32_2x2_8x32x1_8x32x1_1x32x1x8_8_1x1_intrawave_v3,1097.16,786.15,0.0
256,8129,3072,2048,ck,0,0,90.6372,a8w8_blockscale_1x128x128_256x128x128x128_16x16_32x32_2x2_8x32x1_8x32x1_1x32x1x8_8_1x1_intrawave_v3,1128.53,804.13,0.0
256,8192,3072,2048,ck,0,0,89.8612,a8w8_blockscale_1x128x128_256x128x128x128_16x16_32x32_2x2_8x32x1_8x32x1_1x32x1x8_8_1x1_intrawave_v3,1147.09,816.82,0.0
256,1,4608,2048,ck,8,3,6.3015,a8w8_blockscale_1x128x128_256x16x64x256_16x16_16x16_1x1_16x16x1_16x16x1_1x16x1x16_4_1x1_intrawave_v1,3.0,1499.4,0.0
256,2,4608,2048,ck,6,2,7.34,a8w8_blockscale_1x128x128_256x16x64x128_8x16_16x16_1x1_16x16x1_8x32x1_1x16x1x16_4_1x1_intrawave_v1,5.14,1288.79,0.0
256,4,4608,2048,ck,7,2,6.8556,a8w8_blockscale_1x128x128_256x16x128x256_16x16_16x16_1x2_16x16x1_16x16x1_1x16x1x16_8_1x2_intrawave_v1,11.01,1383.14,0.0
256,8,4608,2048,ck,8,2,6.5081,a8w8_blockscale_1x128x128_256x16x64x256_16x16_16x16_1x1_16x16x1_16x16x1_1x16x1x16_4_1x1_intrawave_v1,23.2,1463.91,0.0
256,16,4608,2048,ck,8,2,7.3104,a8w8_blockscale_1x128x128_256x16x64x256_16x16_16x16_1x1_16x16x1_16x16x1_1x16x1x16_4_1x1_intrawave_v1,41.31,1315.58,0.0
256,24,4608,2048,ck,8,2,7.8657,a8w8_blockscale_1x128x128_256x16x64x256_16x16_16x16_1x1_16x16x1_16x16x1_1x16x1x16_4_1x1_intrawave_v1,57.59,1234.16,0.0
256,32,4608,2048,ck,8,2,7.7108,a8w8_blockscale_1x128x128_256x16x64x256_16x16_16x16_1x1_16x16x1_16x16x1_1x16x1x16_4_1x1_intrawave_v1,78.33,1270.64,0.0
256,40,4608,2048,ck,8,0,8.3599,a8w8_blockscale_1x128x128_256x16x64x256_16x16_16x16_1x1_16x16x1_16x16x1_1x16x1x16_4_1x1_intrawave_v1,90.31,1182.76,0.0
256,48,4608,2048,ck,8,0,8.2597,a8w8_blockscale_1x128x128_256x16x64x256_16x16_16x16_1x1_16x16x1_16x16x1_1x16x1x16_4_1x1_intrawave_v1,109.69,1208.02,0.0
256,56,4608,2048,ck,7,0,10.4145,a8w8_blockscale_1x128x128_256x16x128x256_16x16_16x16_1x2_16x16x1_16x16x1_1x16x1x16_8_1x2_intrawave_v1,101.49,966.73,0.0
256,64,4608,2048,ck,7,0,9.3776,a8w8_blockscale_1x128x128_256x16x128x256_16x16_16x16_1x2_16x16x1_16x16x1_1x16x1x16_8_1x2_intrawave_v1,128.81,1083.23,0.0
256,72,4608,2048,ck,7,0,9.8637,a8w8_blockscale_1x128x128_256x16x128x256_16x16_16x16_1x2_16x16x1_16x16x1_1x16x1x16_8_1x2_intrawave_v1,137.77,1038.98,0.0
256,80,4608,2048,ck,7,0,9.6361,a8w8_blockscale_1x128x128_256x16x128x256_16x16_16x16_1x2_16x16x1_16x16x1_1x16x1x16_8_1x2_intrawave_v1,156.7,1072.87,0.0
256,88,4608,2048,ck,7,0,9.7595,a8w8_blockscale_1x128x128_256x16x128x256_16x16_16x16_1x2_16x16x1_16x16x1_1x16x1x16_8_1x2_intrawave_v1,170.19,1068.54,0.0
256,96,4608,2048,ck,7,0,9.6529,a8w8_blockscale_1x128x128_256x16x128x256_16x16_16x16_1x2_16x16x1_16x16x1_1x16x1x16_8_1x2_intrawave_v1,187.71,1089.68,0.0
256,104,4608,2048,ck,7,0,9.6967,a8w8_blockscale_1x128x128_256x16x128x256_16x16_16x16_1x2_16x16x1_16x16x1_1x16x1x16_8_1x2_intrawave_v1,202.43,1094.05,0.0
256,112,4608,2048,ck,7,0,9.5441,a8w8_blockscale_1x128x128_256x16x128x256_16x16_16x16_1x2_16x16x1_16x16x1_1x16x1x16_8_1x2_intrawave_v1,221.49,1120.98,0.0
256,120,4608,2048,ck,18,0,11.0659,a8w8_blockscale_1x128x128_256x64x64x256_16x16_32x32_1x1_16x16x1_16x16x1_1x32x1x8_8_1x1_intrawave_v1,204.68,974.96,0.0
256,128,4608,2048,ck,18,0,10.2451,a8w8_blockscale_1x128x128_256x64x64x256_16x16_32x32_1x1_16x16x1_16x16x1_1x32x1x8_8_1x1_intrawave_v1,235.81,1061.87,0.0
256,136,4608,2048,ck,18,0,11.0099,a8w8_blockscale_1x128x128_256x64x64x256_16x16_32x32_1x1_16x16x1_16x16x1_1x32x1x8_8_1x1_intrawave_v1,233.15,996.29,0.0
256,144,4608,2048,ck,18,0,10.8605,a8w8_blockscale_1x128x128_256x64x64x256_16x16_32x32_1x1_16x16x1_16x16x1_1x32x1x8_8_1x1_intrawave_v1,250.26,1018.3,0.0
256,152,4608,2048,ck,18,0,11.5401,a8w8_blockscale_1x128x128_256x64x64x256_16x16_32x32_1x1_16x16x1_16x16x1_1x32x1x8_8_1x1_intrawave_v1,248.6,966.14,0.0
256,160,4608,2048,ck,18,0,11.5142,a8w8_blockscale_1x128x128_256x64x64x256_16x16_32x32_1x1_16x16x1_16x16x1_1x32x1x8_8_1x1_intrawave_v1,262.28,976.14,0.0
256,168,4608,2048,ck,18,0,11.3613,a8w8_blockscale_1x128x128_256x64x64x256_16x16_32x32_1x1_16x16x1_16x16x1_1x32x1x8_8_1x1_intrawave_v1,279.1,997.2,0.0
256,176,4608,2048,ck,18,0,11.7599,a8w8_blockscale_1x128x128_256x64x64x256_16x16_32x32_1x1_16x16x1_16x16x1_1x32x1x8_8_1x1_intrawave_v1,282.48,971.07,0.0
256,184,4608,2048,ck,18,0,11.8726,a8w8_blockscale_1x128x128_256x64x64x256_16x16_32x32_1x1_16x16x1_16x16x1_1x32x1x8_8_1x1_intrawave_v1,292.51,969.44,0.0
256,192,4608,2048,ck,18,0,10.5199,a8w8_blockscale_1x128x128_256x64x64x256_16x16_32x32_1x1_16x16x1_16x16x1_1x32x1x8_8_1x1_intrawave_v1,344.48,1102.66,0.0
256,200,4608,2048,ck,12,0,13.2726,a8w8_blockscale_1x128x128_256x32x128x256_16x16_32x32_1x1_16x16x1_16x16x1_1x32x1x8_8_1x1_intrawave_v1,284.41,880.76,0.0
256,208,4608,2048,ck,12,0,12.0221,a8w8_blockscale_1x128x128_256x32x128x256_16x16_32x32_1x1_16x16x1_16x16x1_1x32x1x8_8_1x1_intrawave_v1,326.55,979.87,0.0
256,216,4608,2048,ck,12,0,13.1631,a8w8_blockscale_1x128x128_256x32x128x256_16x16_32x32_1x1_16x16x1_16x16x1_1x32x1x8_8_1x1_intrawave_v1,309.72,901.78,0.0
256,224,4608,2048,ck,12,0,12.0959,a8w8_blockscale_1x128x128_256x32x128x256_16x16_32x32_1x1_16x16x1_16x16x1_1x32x1x8_8_1x1_intrawave_v1,349.53,988.79,0.0
256,232,4608,2048,ck,2,0,15.2955,a8w8_blockscale_1x128x128_256x64x128x128_16x16_32x32_1x2_8x32x1_8x32x1_1x32x1x8_8_1x1_intrawave_v3,286.28,787.84,0.0
256,240,4608,2048,ck,2,0,15.4066,a8w8_blockscale_1x128x128_256x64x128x128_16x16_32x32_1x2_8x32x1_8x32x1_1x32x1x8_8_1x1_intrawave_v3,294.02,788.01,0.0
256,248,4608,2048,ck,2,0,15.2761,a8w8_blockscale_1x128x128_256x64x128x128_16x16_32x32_1x2_8x32x1_8x32x1_1x32x1x8_8_1x1_intrawave_v3,306.42,800.64,0.0
256,256,4608,2048,ck,2,0,15.7304,a8w8_blockscale_1x128x128_256x64x128x128_16x16_32x32_1x2_8x32x1_8x32x1_1x32x1x8_8_1x1_intrawave_v3,307.17,783.25,0.0
256,272,4608,2048,ck,2,0,15.4025,a8w8_blockscale_1x128x128_256x64x128x128_16x16_32x32_1x2_8x32x1_8x32x1_1x32x1x8_8_1x1_intrawave_v3,333.31,811.62,0.0
256,288,4608,2048,ck,2,0,15.3091,a8w8_blockscale_1x128x128_256x64x128x128_16x16_32x32_1x2_8x32x1_8x32x1_1x32x1x8_8_1x1_intrawave_v3,355.07,828.34,0.0
256,304,4608,2048,ck,2,0,15.5119,a8w8_blockscale_1x128x128_256x64x128x128_16x16_32x32_1x2_8x32x1_8x32x1_1x32x1x8_8_1x1_intrawave_v3,369.9,829.13,0.0
256,320,4608,2048,ck,2,0,15.2781,a8w8_blockscale_1x128x128_256x64x128x128_16x16_32x32_1x2_8x32x1_8x32x1_1x32x1x8_8_1x1_intrawave_v3,395.32,853.62,0.0
256,336,4608,2048,ck,2,0,15.6378,a8w8_blockscale_1x128x128_256x64x128x128_16x16_32x32_1x2_8x32x1_8x32x1_1x32x1x8_8_1x1_intrawave_v3,405.54,845.51,0.0
256,352,4608,2048,ck,2,0,15.7441,a8w8_blockscale_1x128x128_256x64x128x128_16x16_32x32_1x2_8x32x1_8x32x1_1x32x1x8_8_1x1_intrawave_v3,421.99,851.25,0.0
256,368,4608,2048,ck,2,0,15.8969,a8w8_blockscale_1x128x128_256x64x128x128_16x16_32x32_1x2_8x32x1_8x32x1_1x32x1x8_8_1x1_intrawave_v3,436.93,854.4,0.0
256,384,4608,2048,ck,2,0,15.9959,a8w8_blockscale_1x128x128_256x64x128x128_16x16_32x32_1x2_8x32x1_8x32x1_1x32x1x8_8_1x1_intrawave_v3,453.1,860.38,0.0
256,400,4608,2048,ck,2,0,15.8646,a8w8_blockscale_1x128x128_256x64x128x128_16x16_32x32_1x2_8x32x1_8x32x1_1x32x1x8_8_1x1_intrawave_v3,475.89,878.86,0.0
256,416,4608,2048,ck,2,0,15.4007,a8w8_blockscale_1x128x128_256x64x128x128_16x16_32x32_1x2_8x32x1_8x32x1_1x32x1x8_8_1x1_intrawave_v3,509.83,917.04,0.0
256,432,4608,2048,ck,2,0,15.7055,a8w8_blockscale_1x128x128_256x64x128x128_16x16_32x32_1x2_8x32x1_8x32x1_1x32x1x8_8_1x1_intrawave_v3,519.16,910.71,0.0
256,448,4608,2048,ck,2,0,15.3483,a8w8_blockscale_1x128x128_256x64x128x128_16x16_32x32_1x2_8x32x1_8x32x1_1x32x1x8_8_1x1_intrawave_v3,550.92,943.65,0.0
256,464,4608,2048,ck,3,0,19.356,a8w8_blockscale_1x128x128_256x64x64x128_16x16_32x32_1x1_8x32x1_8x32x1_1x32x1x8_8_1x1_intrawave_v3,452.45,757.58,0.0
256,480,4608,2048,ck,3,0,19.7339,a8w8_blockscale_1x128x128_256x64x64x128_16x16_32x32_1x1_8x32x1_8x32x1_1x32x1x8_8_1x1_intrawave_v3,459.09,752.2,0.0
256,496,4608,2048,ck,0,0,20.203,a8w8_blockscale_1x128x128_256x128x128x128_16x16_32x32_2x2_8x32x1_8x32x1_1x32x1x8_8_1x1_intrawave_v3,463.38,743.66,0.0
256,512,4608,2048,ck,0,0,19.2814,a8w8_blockscale_1x128x128_256x128x128x128_16x16_32x32_2x2_8x32x1_8x32x1_1x32x1x8_8_1x1_intrawave_v3,501.19,788.55,0.0
256,664,4608,2048,ck,0,0,20.2362,a8w8_blockscale_1x128x128_256x128x128x128_16x16_32x32_2x2_8x32x1_8x32x1_1x32x1x8_8_1x1_intrawave_v3,619.31,835.95,0.0
256,762,4608,2048,ck,0,0,20.7062,a8w8_blockscale_1x128x128_256x128x128x128_16x16_32x32_2x2_8x32x1_8x32x1_1x32x1x8_8_1x1_intrawave_v3,694.59,870.29,0.0
256,902,4608,2048,ck,2,0,28.9549,a8w8_blockscale_1x128x128_256x64x128x128_16x16_32x32_1x2_8x32x1_8x32x1_1x32x1x8_8_1x1_intrawave_v3,587.97,676.82,0.0
256,961,4608,2048,ck,2,0,28.8805,a8w8_blockscale_1x128x128_256x64x128x128_16x16_32x32_1x2_8x32x1_8x32x1_1x32x1x8_8_1x1_intrawave_v3,628.05,701.58,0.0
256,1000,4608,2048,ck,2,0,29.4001,a8w8_blockscale_1x128x128_256x64x128x128_16x16_32x32_1x2_8x32x1_8x32x1_1x32x1x8_8_1x1_intrawave_v3,641.98,704.12,0.0
256,1001,4608,2048,ck,2,0,29.2846,a8w8_blockscale_1x128x128_256x64x128x128_16x16_32x32_1x2_8x32x1_8x32x1_1x32x1x8_8_1x1_intrawave_v3,645.16,707.28,0.0
256,1002,4608,2048,ck,2,0,29.0173,a8w8_blockscale_1x128x128_256x64x128x128_16x16_32x32_1x2_8x32x1_8x32x1_1x32x1x8_8_1x1_intrawave_v3,651.75,714.18,0.0
256,1003,4608,2048,ck,2,0,29.1636,a8w8_blockscale_1x128x128_256x64x128x128_16x16_32x32_1x2_8x32x1_8x32x1_1x32x1x8_8_1x1_intrawave_v3,649.13,710.99,0.0
256,1015,4608,2048,ck,2,0,29.5629,a8w8_blockscale_1x128x128_256x64x128x128_16x16_32x32_1x2_8x32x1_8x32x1_1x32x1x8_8_1x1_intrawave_v3,648.02,705.96,0.0
256,1023,4608,2048,ck,2,0,29.5655,a8w8_blockscale_1x128x128_256x64x128x128_16x16_32x32_1x2_8x32x1_8x32x1_1x32x1x8_8_1x1_intrawave_v3,653.07,708.94,0.0
256,1024,4608,2048,ck,2,0,29.1583,a8w8_blockscale_1x128x128_256x64x128x128_16x16_32x32_1x2_8x32x1_8x32x1_1x32x1x8_8_1x1_intrawave_v3,662.84,719.23,0.0
256,1025,4608,2048,ck,2,0,29.2145,a8w8_blockscale_1x128x128_256x64x128x128_16x16_32x32_1x2_8x32x1_8x32x1_1x32x1x8_8_1x1_intrawave_v3,662.21,718.23,0.0
256,1032,4608,2048,ck,2,0,29.2666,a8w8_blockscale_1x128x128_256x64x128x128_16x16_32x32_1x2_8x32x1_8x32x1_1x32x1x8_8_1x1_intrawave_v3,665.55,719.65,0.0
256,1038,4608,2048,ck,2,0,29.3487,a8w8_blockscale_1x128x128_256x64x128x128_16x16_32x32_1x2_8x32x1_8x32x1_1x32x1x8_8_1x1_intrawave_v3,667.55,719.94,0.0
256,1087,4608,2048,ck,2,0,29.5349,a8w8_blockscale_1x128x128_256x64x128x128_16x16_32x32_1x2_8x32x1_8x32x1_1x32x1x8_8_1x1_intrawave_v3,694.65,734.09,0.0
256,1255,4608,2048,ck,2,0,30.4185,a8w8_blockscale_1x128x128_256x64x128x128_16x16_32x32_1x2_8x32x1_8x32x1_1x32x1x8_8_1x1_intrawave_v3,778.71,774.97,0.0
256,1351,4608,2048,ck,0,0,32.0854,a8w8_blockscale_1x128x128_256x128x128x128_16x16_32x32_2x2_8x32x1_8x32x1_1x32x1x8_8_1x1_intrawave_v3,794.73,768.41,0.0
256,1376,4608,2048,ck,0,0,31.6522,a8w8_blockscale_1x128x128_256x128x128x128_16x16_32x32_2x2_8x32x1_8x32x1_1x32x1x8_8_1x1_intrawave_v3,820.52,787.83,0.0
256,1380,4608,2048,ck,0,0,31.8138,a8w8_blockscale_1x128x128_256x128x128x128_16x16_32x32_2x2_8x32x1_8x32x1_1x32x1x8_8_1x1_intrawave_v3,818.72,785.24,0.0
256,1391,4608,2048,ck,0,0,31.9876,a8w8_blockscale_1x128x128_256x128x128x128_16x16_32x32_2x2_8x32x1_8x32x1_1x32x1x8_8_1x1_intrawave_v3,820.76,784.85,0.0
256,1710,4608,2048,ck,0,0,34.0849,a8w8_blockscale_1x128x128_256x128x128x128_16x16_32x32_2x2_8x32x1_8x32x1_1x32x1x8_8_1x1_intrawave_v3,946.91,841.97,0.0
256,1808,4608,2048,ck,0,0,44.8021,a8w8_blockscale_1x128x128_256x128x128x128_16x16_32x32_2x2_8x32x1_8x32x1_1x32x1x8_8_1x1_intrawave_v3,761.68,665.2,0.0
256,1809,4608,2048,ck,0,0,45.1387,a8w8_blockscale_1x128x128_256x128x128x128_16x16_32x32_2x2_8x32x1_8x32x1_1x32x1x8_8_1x1_intrawave_v3,756.42,660.49,0.0
256,1870,4608,2048,ck,0,0,45.211,a8w8_blockscale_1x128x128_256x128x128x128_16x16_32x32_2x2_8x32x1_8x32x1_1x32x1x8_8_1x1_intrawave_v3,780.67,674.63,0.0
256,1967,4608,2048,ck,0,0,46.4086,a8w8_blockscale_1x128x128_256x128x128x128_16x16_32x32_2x2_8x32x1_8x32x1_1x32x1x8_8_1x1_intrawave_v3,799.98,680.77,0.0
256,1970,4608,2048,ck,0,0,45.9685,a8w8_blockscale_1x128x128_256x128x128x128_16x16_32x32_2x2_8x32x1_8x32x1_1x32x1x8_8_1x1_intrawave_v3,808.87,688.02,0.0
256,2000,4608,2048,ck,0,0,46.8181,a8w8_blockscale_1x128x128_256x128x128x128_16x16_32x32_2x2_8x32x1_8x32x1_1x32x1x8_8_1x1_intrawave_v3,806.29,682.75,0.0
256,2001,4608,2048,ck,0,0,46.6411,a8w8_blockscale_1x128x128_256x128x128x128_16x16_32x32_2x2_8x32x1_8x32x1_1x32x1x8_8_1x1_intrawave_v3,809.75,685.59,0.0
256,2016,4608,2048,ck,0,0,46.8819,a8w8_blockscale_1x128x128_256x128x128x128_16x16_32x32_2x2_8x32x1_8x32x1_1x32x1x8_8_1x1_intrawave_v3,811.63,685.67,0.0
256,2017,4608,2048,ck,0,0,46.9276,a8w8_blockscale_1x128x128_256x128x128x128_16x16_32x32_2x2_8x32x1_8x32x1_1x32x1x8_8_1x1_intrawave_v3,811.24,685.24,0.0
256,2046,4608,2048,ck,0,0,47.5077,a8w8_blockscale_1x128x128_256x128x128x128_16x16_32x32_2x2_8x32x1_8x32x1_1x32x1x8_8_1x1_intrawave_v3,812.86,683.75,0.0
256,2048,4608,2048,ck,0,0,45.6368,a8w8_blockscale_1x128x128_256x128x128x128_16x16_32x32_2x2_8x32x1_8x32x1_1x32x1x8_8_1x1_intrawave_v3,847.01,712.27,0.0
256,2050,4608,2048,ck,0,0,45.5116,a8w8_blockscale_1x128x128_256x128x128x128_16x16_32x32_2x2_8x32x1_8x32x1_1x32x1x8_8_1x1_intrawave_v3,850.17,714.73,0.0
256,2081,4608,2048,ck,0,0,46.6934,a8w8_blockscale_1x128x128_256x128x128x128_16x16_32x32_2x2_8x32x1_8x32x1_1x32x1x8_8_1x1_intrawave_v3,841.18,704.12,0.0
256,2095,4608,2048,ck,0,0,46.0538,a8w8_blockscale_1x128x128_256x128x128x128_16x16_32x32_2x2_8x32x1_8x32x1_1x32x1x8_8_1x1_intrawave_v3,858.6,717.32,0.0
256,2154,4608,2048,ck,0,0,46.421,a8w8_blockscale_1x128x128_256x128x128x128_16x16_32x32_2x2_8x32x1_8x32x1_1x32x1x8_8_1x1_intrawave_v3,875.8,725.96,0.0
256,2159,4608,2048,ck,0,0,46.049,a8w8_blockscale_1x128x128_256x128x128x128_16x16_32x32_2x2_8x32x1_8x32x1_1x32x1x8_8_1x1_intrawave_v3,884.92,733.05,0.0
256,2162,4608,2048,ck,0,0,46.3246,a8w8_blockscale_1x128x128_256x128x128x128_16x16_32x32_2x2_8x32x1_8x32x1_1x32x1x8_8_1x1_intrawave_v3,880.88,729.42,0.0
256,2165,4608,2048,ck,0,0,45.9989,a8w8_blockscale_1x128x128_256x128x128x128_16x16_32x32_2x2_8x32x1_8x32x1_1x32x1x8_8_1x1_intrawave_v3,888.35,735.32,0.0
256,2251,4608,2048,ck,0,0,46.9838,a8w8_blockscale_1x128x128_256x128x128x128_16x16_32x32_2x2_8x32x1_8x32x1_1x32x1x8_8_1x1_intrawave_v3,904.27,740.52,0.0
256,2252,4608,2048,ck,0,0,46.5692,a8w8_blockscale_1x128x128_256x128x128x128_16x16_32x32_2x2_8x32x1_8x32x1_1x32x1x8_8_1x1_intrawave_v3,912.73,747.35,0.0
256,2255,4608,2048,ck,0,0,46.142,a8w8_blockscale_1x128x128_256x128x128x128_16x16_32x32_2x2_8x32x1_8x32x1_1x32x1x8_8_1x1_intrawave_v3,922.41,755.01,0.0
256,2317,4608,2048,ck,0,0,47.8534,a8w8_blockscale_1x128x128_256x128x128x128_16x16_32x32_2x2_8x32x1_8x32x1_1x32x1x8_8_1x1_intrawave_v3,913.87,742.6,0.0
256,2694,4608,2048,ck,0,0,57.6682,a8w8_blockscale_1x128x128_256x128x128x128_16x16_32x32_2x2_8x32x1_8x32x1_1x32x1x8_8_1x1_intrawave_v3,881.73,689.85,0.0
256,2715,4608,2048,ck,0,0,57.5759,a8w8_blockscale_1x128x128_256x128x128x128_16x16_32x32_2x2_8x32x1_8x32x1_1x32x1x8_8_1x1_intrawave_v3,890.02,695.06,0.0
256,2819,4608,2048,ck,0,0,58.9107,a8w8_blockscale_1x128x128_256x128x128x128_16x16_32x32_2x2_8x32x1_8x32x1_1x32x1x8_8_1x1_intrawave_v3,903.18,699.2,0.0
256,2853,4608,2048,ck,0,0,58.1539,a8w8_blockscale_1x128x128_256x128x128x128_16x16_32x32_2x2_8x32x1_8x32x1_1x32x1x8_8_1x1_intrawave_v3,925.97,714.89,0.0
256,2914,4608,2048,ck,0,0,58.2172,a8w8_blockscale_1x128x128_256x128x128x128_16x16_32x32_2x2_8x32x1_8x32x1_1x32x1x8_8_1x1_intrawave_v3,944.74,725.91,0.0
256,2974,4608,2048,ck,0,0,58.3259,a8w8_blockscale_1x128x128_256x128x128x128_16x16_32x32_2x2_8x32x1_8x32x1_1x32x1x8_8_1x1_intrawave_v3,962.39,736.15,0.0
256,3000,4608,2048,ck,0,0,58.273,a8w8_blockscale_1x128x128_256x128x128x128_16x16_32x32_2x2_8x32x1_8x32x1_1x32x1x8_8_1x1_intrawave_v3,971.69,741.84,0.0
256,3001,4608,2048,ck,0,0,59.1107,a8w8_blockscale_1x128x128_256x128x128x128_16x16_32x32_2x2_8x32x1_8x32x1_1x32x1x8_8_1x1_intrawave_v3,958.24,731.52,0.0
256,3072,4608,2048,ck,0,0,57.8306,a8w8_blockscale_1x128x128_256x128x128x128_16x16_32x32_2x2_8x32x1_8x32x1_1x32x1x8_8_1x1_intrawave_v3,1002.62,761.54,0.0
256,3073,4608,2048,ck,0,0,59.2238,a8w8_blockscale_1x128x128_256x128x128x128_16x16_32x32_2x2_8x32x1_8x32x1_1x32x1x8_8_1x1_intrawave_v3,979.35,743.81,0.0
256,3077,4608,2048,ck,0,0,60.3535,a8w8_blockscale_1x128x128_256x128x128x128_16x16_32x32_2x2_8x32x1_8x32x1_1x32x1x8_8_1x1_intrawave_v3,962.27,730.64,0.0
256,3078,4608,2048,ck,0,0,59.4271,a8w8_blockscale_1x128x128_256x128x128x128_16x16_32x32_2x2_8x32x1_8x32x1_1x32x1x8_8_1x1_intrawave_v3,977.59,742.22,0.0
256,3086,4608,2048,ck,0,0,59.9875,a8w8_blockscale_1x128x128_256x128x128x128_16x16_32x32_2x2_8x32x1_8x32x1_1x32x1x8_8_1x1_intrawave_v3,970.97,736.78,0.0
256,3089,4608,2048,ck,0,0,59.1698,a8w8_blockscale_1x128x128_256x128x128x128_16x16_32x32_2x2_8x32x1_8x32x1_1x32x1x8_8_1x1_intrawave_v3,985.35,747.54,0.0
256,3118,4608,2048,ck,0,0,59.9174,a8w8_blockscale_1x128x128_256x128x128x128_16x16_32x32_2x2_8x32x1_8x32x1_1x32x1x8_8_1x1_intrawave_v3,982.19,743.66,0.0
256,3138,4608,2048,ck,0,0,60.3251,a8w8_blockscale_1x128x128_256x128x128x128_16x16_32x32_2x2_8x32x1_8x32x1_1x32x1x8_8_1x1_intrawave_v3,981.81,742.37,0.0
256,3154,4608,2048,ck,0,0,61.0479,a8w8_blockscale_1x128x128_256x128x128x128_16x16_32x32_2x2_8x32x1_8x32x1_1x32x1x8_8_1x1_intrawave_v3,975.13,736.53,0.0
256,3289,4608,2048,ck,0,0,61.1079,a8w8_blockscale_1x128x128_256x128x128x128_16x16_32x32_2x2_8x32x1_8x32x1_1x32x1x8_8_1x1_intrawave_v3,1015.87,760.7,0.0
256,3437,4608,2048,ck,0,0,61.6691,a8w8_blockscale_1x128x128_256x128x128x128_16x16_32x32_2x2_8x32x1_8x32x1_1x32x1x8_8_1x1_intrawave_v3,1051.92,780.81,0.0
256,3617,4608,2048,ck,0,0,73.18,a8w8_blockscale_1x128x128_256x128x128x128_16x16_32x32_2x2_8x32x1_8x32x1_1x32x1x8_8_1x1_intrawave_v3,932.89,685.69,0.0
256,3620,4608,2048,ck,0,0,72.4596,a8w8_blockscale_1x128x128_256x128x128x128_16x16_32x32_2x2_8x32x1_8x32x1_1x32x1x8_8_1x1_intrawave_v3,942.94,692.98,0.0
256,3669,4608,2048,ck,0,0,71.9516,a8w8_blockscale_1x128x128_256x128x128x128_16x16_32x32_2x2_8x32x1_8x32x1_1x32x1x8_8_1x1_intrawave_v3,962.45,705.54,0.0
256,3824,4608,2048,ck,0,0,72.5052,a8w8_blockscale_1x128x128_256x128x128x128_16x16_32x32_2x2_8x32x1_8x32x1_1x32x1x8_8_1x1_intrawave_v3,995.45,724.23,0.0
256,3858,4608,2048,ck,0,0,73.6328,a8w8_blockscale_1x128x128_256x128x128x128_16x16_32x32_2x2_8x32x1_8x32x1_1x32x1x8_8_1x1_intrawave_v3,988.92,718.34,0.0
256,3906,4608,2048,ck,0,0,73.9032,a8w8_blockscale_1x128x128_256x128x128x128_16x16_32x32_2x2_8x32x1_8x32x1_1x32x1x8_8_1x1_intrawave_v3,997.57,723.03,0.0
256,4000,4608,2048,ck,0,0,75.1868,a8w8_blockscale_1x128x128_256x128x128x128_16x16_32x32_2x2_8x32x1_8x32x1_1x32x1x8_8_1x1_intrawave_v3,1004.13,724.77,0.0
256,4004,4608,2048,ck,0,0,74.854,a8w8_blockscale_1x128x128_256x128x128x128_16x16_32x32_2x2_8x32x1_8x32x1_1x32x1x8_8_1x1_intrawave_v3,1009.6,728.59,0.0
256,4100,4608,2048,ck,0,0,74.7668,a8w8_blockscale_1x128x128_256x128x128x128_16x16_32x32_2x2_8x32x1_8x32x1_1x32x1x8_8_1x1_intrawave_v3,1035.02,743.91,0.0
256,4108,4608,2048,ck,0,0,75.0388,a8w8_blockscale_1x128x128_256x128x128x128_16x16_32x32_2x2_8x32x1_8x32x1_1x32x1x8_8_1x1_intrawave_v3,1033.28,742.41,0.0
256,4121,4608,2048,ck,0,0,75.2148,a8w8_blockscale_1x128x128_256x128x128x128_16x16_32x32_2x2_8x32x1_8x32x1_1x32x1x8_8_1x1_intrawave_v3,1034.12,742.62,0.0
256,4123,4608,2048,ck,0,0,75.3348,a8w8_blockscale_1x128x128_256x128x128x128_16x16_32x32_2x2_8x32x1_8x32x1_1x32x1x8_8_1x1_intrawave_v3,1032.98,741.74,0.0
256,4149,4608,2048,ck,0,0,74.3308,a8w8_blockscale_1x128x128_256x128x128x128_16x16_32x32_2x2_8x32x1_8x32x1_1x32x1x8_8_1x1_intrawave_v3,1053.53,755.7,0.0
256,4204,4608,2048,ck,0,0,75.0256,a8w8_blockscale_1x128x128_256x128x128x128_16x16_32x32_2x2_8x32x1_8x32x1_1x32x1x8_8_1x1_intrawave_v3,1057.61,756.96,0.0
256,4223,4608,2048,ck,0,0,75.8892,a8w8_blockscale_1x128x128_256x128x128x128_16x16_32x32_2x2_8x32x1_8x32x1_1x32x1x8_8_1x1_intrawave_v3,1050.3,751.16,0.0
256,4229,4608,2048,ck,0,0,77.7152,a8w8_blockscale_1x128x128_256x128x128x128_16x16_32x32_2x2_8x32x1_8x32x1_1x32x1x8_8_1x1_intrawave_v3,1027.08,734.38,0.0
256,4379,4608,2048,ck,0,0,76.3032,a8w8_blockscale_1x128x128_256x128x128x128_16x16_32x32_2x2_8x32x1_8x32x1_1x32x1x8_8_1x1_intrawave_v3,1083.19,770.12,0.0
256,4410,4608,2048,ck,0,0,78.464,a8w8_blockscale_1x128x128_256x128x128x128_16x16_32x32_2x2_8x32x1_8x32x1_1x32x1x8_8_1x1_intrawave_v3,1060.82,753.36,0.0
256,4498,4608,2048,ck,0,0,85.1157,a8w8_blockscale_1x128x128_256x128x128x128_16x16_32x32_2x2_8x32x1_8x32x1_1x32x1x8_8_1x1_intrawave_v3,997.43,706.13,0.0
256,4585,4608,2048,ck,0,0,84.0852,a8w8_blockscale_1x128x128_256x128x128x128_16x16_32x32_2x2_8x32x1_8x32x1_1x32x1x8_8_1x1_intrawave_v3,1029.18,726.44,0.0
256,4586,4608,2048,ck,0,0,84.8545,a8w8_blockscale_1x128x128_256x128x128x128_16x16_32x32_2x2_8x32x1_8x32x1_1x32x1x8_8_1x1_intrawave_v3,1020.07,719.98,0.0
256,4723,4608,2048,ck,0,0,85.3537,a8w8_blockscale_1x128x128_256x128x128x128_16x16_32x32_2x2_8x32x1_8x32x1_1x32x1x8_8_1x1_intrawave_v3,1044.4,733.85,0.0
256,4743,4608,2048,ck,0,0,85.276,a8w8_blockscale_1x128x128_256x128x128x128_16x16_32x32_2x2_8x32x1_8x32x1_1x32x1x8_8_1x1_intrawave_v3,1049.78,737.16,0.0
256,4822,4608,2048,ck,0,0,86.4665,a8w8_blockscale_1x128x128_256x128x128x128_16x16_32x32_2x2_8x32x1_8x32x1_1x32x1x8_8_1x1_intrawave_v3,1052.57,737.31,0.0
256,4898,4608,2048,ck,0,0,86.7329,a8w8_blockscale_1x128x128_256x128x128x128_16x16_32x32_2x2_8x32x1_8x32x1_1x32x1x8_8_1x1_intrawave_v3,1065.88,744.91,0.0
256,4936,4608,2048,ck,0,0,87.3421,a8w8_blockscale_1x128x128_256x128x128x128_16x16_32x32_2x2_8x32x1_8x32x1_1x32x1x8_8_1x1_intrawave_v3,1066.65,744.62,0.0
256,4992,4608,2048,ck,0,0,84.4497,a8w8_blockscale_1x128x128_256x128x128x128_16x16_32x32_2x2_8x32x1_8x32x1_1x32x1x8_8_1x1_intrawave_v3,1115.7,777.59,0.0
256,5000,4608,2048,ck,0,0,87.8833,a8w8_blockscale_1x128x128_256x128x128x128_16x16_32x32_2x2_8x32x1_8x32x1_1x32x1x8_8_1x1_intrawave_v3,1073.83,748.23,0.0
256,5001,4608,2048,ck,0,0,87.2037,a8w8_blockscale_1x128x128_256x128x128x128_16x16_32x32_2x2_8x32x1_8x32x1_1x32x1x8_8_1x1_intrawave_v3,1082.42,754.19,0.0
256,5002,4608,2048,ck,0,0,86.5053,a8w8_blockscale_1x128x128_256x128x128x128_16x16_32x32_2x2_8x32x1_8x32x1_1x32x1x8_8_1x1_intrawave_v3,1091.37,760.41,0.0
256,5003,4608,2048,ck,0,0,85.8573,a8w8_blockscale_1x128x128_256x128x128x128_16x16_32x32_2x2_8x32x1_8x32x1_1x32x1x8_8_1x1_intrawave_v3,1099.83,766.28,0.0
256,5004,4608,2048,ck,0,0,86.8865,a8w8_blockscale_1x128x128_256x128x128x128_16x16_32x32_2x2_8x32x1_8x32x1_1x32x1x8_8_1x1_intrawave_v3,1087.02,757.34,0.0
256,5005,4608,2048,ck,0,0,87.8005,a8w8_blockscale_1x128x128_256x128x128x128_16x16_32x32_2x2_8x32x1_8x32x1_1x32x1x8_8_1x1_intrawave_v3,1075.92,749.58,0.0
256,5006,4608,2048,ck,0,0,88.2897,a8w8_blockscale_1x128x128_256x128x128x128_16x16_32x32_2x2_8x32x1_8x32x1_1x32x1x8_8_1x1_intrawave_v3,1070.17,745.55,0.0
256,5010,4608,2048,ck,0,0,86.1297,a8w8_blockscale_1x128x128_256x128x128x128_16x16_32x32_2x2_8x32x1_8x32x1_1x32x1x8_8_1x1_intrawave_v3,1097.89,764.77,0.0
256,5011,4608,2048,ck,0,0,87.2101,a8w8_blockscale_1x128x128_256x128x128x128_16x16_32x32_2x2_8x32x1_8x32x1_1x32x1x8_8_1x1_intrawave_v3,1084.5,755.43,0.0
256,5012,4608,2048,ck,0,0,87.2449,a8w8_blockscale_1x128x128_256x128x128x128_16x16_32x32_2x2_8x32x1_8x32x1_1x32x1x8_8_1x1_intrawave_v3,1084.28,755.26,0.0
256,5026,4608,2048,ck,0,0,86.2065,a8w8_blockscale_1x128x128_256x128x128x128_16x16_32x32_2x2_8x32x1_8x32x1_1x32x1x8_8_1x1_intrawave_v3,1100.41,766.18,0.0
256,5028,4608,2048,ck,0,0,89.3813,a8w8_blockscale_1x128x128_256x128x128x128_16x16_32x32_2x2_8x32x1_8x32x1_1x32x1x8_8_1x1_intrawave_v3,1061.75,739.22,0.0
256,5030,4608,2048,ck,0,0,88.7369,a8w8_blockscale_1x128x128_256x128x128x128_16x16_32x32_2x2_8x32x1_8x32x1_1x32x1x8_8_1x1_intrawave_v3,1069.88,744.84,0.0
256,5031,4608,2048,ck,0,0,86.8361,a8w8_blockscale_1x128x128_256x128x128x128_16x16_32x32_2x2_8x32x1_8x32x1_1x32x1x8_8_1x1_intrawave_v3,1093.52,761.28,0.0
256,5060,4608,2048,ck,0,0,86.9405,a8w8_blockscale_1x128x128_256x128x128x128_16x16_32x32_2x2_8x32x1_8x32x1_1x32x1x8_8_1x1_intrawave_v3,1098.5,764.12,0.0
256,5062,4608,2048,ck,0,0,87.2681,a8w8_blockscale_1x128x128_256x128x128x128_16x16_32x32_2x2_8x32x1_8x32x1_1x32x1x8_8_1x1_intrawave_v3,1094.81,761.51,0.0
256,5063,4608,2048,ck,0,0,87.4085,a8w8_blockscale_1x128x128_256x128x128x128_16x16_32x32_2x2_8x32x1_8x32x1_1x32x1x8_8_1x1_intrawave_v3,1093.27,760.42,0.0
256,5091,4608,2048,ck,0,0,87.7889,a8w8_blockscale_1x128x128_256x128x128x128_16x16_32x32_2x2_8x32x1_8x32x1_1x32x1x8_8_1x1_intrawave_v3,1094.55,760.71,0.0
256,5105,4608,2048,ck,0,0,87.3169,a8w8_blockscale_1x128x128_256x128x128x128_16x16_32x32_2x2_8x32x1_8x32x1_1x32x1x8_8_1x1_intrawave_v3,1103.49,766.63,0.0
256,5120,4608,2048,ck,0,0,85.7089,a8w8_blockscale_1x128x128_256x128x128x128_16x16_32x32_2x2_8x32x1_8x32x1_1x32x1x8_8_1x1_intrawave_v3,1127.5,782.99,0.0
256,5122,4608,2048,ck,0,0,88.6645,a8w8_blockscale_1x128x128_256x128x128x128_16x16_32x32_2x2_8x32x1_8x32x1_1x32x1x8_8_1x1_intrawave_v3,1090.34,757.14,0.0
256,5123,4608,2048,ck,0,0,87.2425,a8w8_blockscale_1x128x128_256x128x128x128_16x16_32x32_2x2_8x32x1_8x32x1_1x32x1x8_8_1x1_intrawave_v3,1108.33,769.61,0.0
256,5124,4608,2048,ck,0,0,88.5597,a8w8_blockscale_1x128x128_256x128x128x128_16x16_32x32_2x2_8x32x1_8x32x1_1x32x1x8_8_1x1_intrawave_v3,1092.06,758.29,0.0
256,5127,4608,2048,ck,0,0,88.4109,a8w8_blockscale_1x128x128_256x128x128x128_16x16_32x32_2x2_8x32x1_8x32x1_1x32x1x8_8_1x1_intrawave_v3,1094.54,759.95,0.0
256,5177,4608,2048,ck,0,0,87.5409,a8w8_blockscale_1x128x128_256x128x128x128_16x16_32x32_2x2_8x32x1_8x32x1_1x32x1x8_8_1x1_intrawave_v3,1116.19,773.93,0.0
256,5183,4608,2048,ck,0,0,88.5401,a8w8_blockscale_1x128x128_256x128x128x128_16x16_32x32_2x2_8x32x1_8x32x1_1x32x1x8_8_1x1_intrawave_v3,1104.88,765.96,0.0
256,5252,4608,2048,ck,0,0,89.8581,a8w8_blockscale_1x128x128_256x128x128x128_16x16_32x32_2x2_8x32x1_8x32x1_1x32x1x8_8_1x1_intrawave_v3,1103.16,763.38,0.0
256,5255,4608,2048,ck,0,0,89.7577,a8w8_blockscale_1x128x128_256x128x128x128_16x16_32x32_2x2_8x32x1_8x32x1_1x32x1x8_8_1x1_intrawave_v3,1105.03,764.61,0.0
256,5361,4608,2048,ck,0,0,89.2753,a8w8_blockscale_1x128x128_256x128x128x128_16x16_32x32_2x2_8x32x1_8x32x1_1x32x1x8_8_1x1_intrawave_v3,1133.41,782.11,0.0
256,5427,4608,2048,ck,0,0,96.9326,a8w8_blockscale_1x128x128_256x128x128x128_16x16_32x32_2x2_8x32x1_8x32x1_1x32x1x8_8_1x1_intrawave_v3,1056.73,728.0,0.0
256,5471,4608,2048,ck,0,0,98.2826,a8w8_blockscale_1x128x128_256x128x128x128_16x16_32x32_2x2_8x32x1_8x32x1_1x32x1x8_8_1x1_intrawave_v3,1050.66,723.04,0.0
256,5534,4608,2048,ck,0,0,98.3658,a8w8_blockscale_1x128x128_256x128x128x128_16x16_32x32_2x2_8x32x1_8x32x1_1x32x1x8_8_1x1_intrawave_v3,1061.86,729.65,0.0
256,5564,4608,2048,ck,0,0,98.7098,a8w8_blockscale_1x128x128_256x128x128x128_16x16_32x32_2x2_8x32x1_8x32x1_1x32x1x8_8_1x1_intrawave_v3,1063.9,730.53,0.0
256,5671,4608,2048,ck,0,0,100.797,a8w8_blockscale_1x128x128_256x128x128x128_16x16_32x32_2x2_8x32x1_8x32x1_1x32x1x8_8_1x1_intrawave_v3,1061.9,727.36,0.0
256,5927,4608,2048,ck,0,0,100.8834,a8w8_blockscale_1x128x128_256x128x128x128_16x16_32x32_2x2_8x32x1_8x32x1_1x32x1x8_8_1x1_intrawave_v3,1108.89,755.32,0.0
256,5954,4608,2048,ck,0,0,100.6354,a8w8_blockscale_1x128x128_256x128x128x128_16x16_32x32_2x2_8x32x1_8x32x1_1x32x1x8_8_1x1_intrawave_v3,1116.68,760.2,0.0
256,6000,4608,2048,ck,0,0,101.467,a8w8_blockscale_1x128x128_256x128x128x128_16x16_32x32_2x2_8x32x1_8x32x1_1x32x1x8_8_1x1_intrawave_v3,1116.09,759.08,0.0
256,6002,4608,2048,ck,0,0,102.2542,a8w8_blockscale_1x128x128_256x128x128x128_16x16_32x32_2x2_8x32x1_8x32x1_1x32x1x8_8_1x1_intrawave_v3,1107.87,753.45,0.0
256,6146,4608,2048,ck,0,0,103.1086,a8w8_blockscale_1x128x128_256x128x128x128_16x16_32x32_2x2_8x32x1_8x32x1_1x32x1x8_8_1x1_intrawave_v3,1125.05,762.94,0.0
256,6194,4608,2048,ck,0,0,103.6946,a8w8_blockscale_1x128x128_256x128x128x128_16x16_32x32_2x2_8x32x1_8x32x1_1x32x1x8_8_1x1_intrawave_v3,1127.42,763.84,0.0
256,6227,4608,2048,ck,0,0,104.737,a8w8_blockscale_1x128x128_256x128x128x128_16x16_32x32_2x2_8x32x1_8x32x1_1x32x1x8_8_1x1_intrawave_v3,1122.15,759.79,0.0
256,6229,4608,2048,ck,0,0,103.0758,a8w8_blockscale_1x128x128_256x128x128x128_16x16_32x32_2x2_8x32x1_8x32x1_1x32x1x8_8_1x1_intrawave_v3,1140.6,772.25,0.0
256,6234,4608,2048,ck,0,0,103.037,a8w8_blockscale_1x128x128_256x128x128x128_16x16_32x32_2x2_8x32x1_8x32x1_1x32x1x8_8_1x1_intrawave_v3,1141.95,773.09,0.0
256,6246,4608,2048,ck,0,0,102.719,a8w8_blockscale_1x128x128_256x128x128x128_16x16_32x32_2x2_8x32x1_8x32x1_1x32x1x8_8_1x1_intrawave_v3,1147.69,776.8,0.0
256,6304,4608,2048,ck,0,0,109.6982,a8w8_blockscale_1x128x128_256x128x128x128_16x16_32x32_2x2_8x32x1_8x32x1_1x32x1x8_8_1x1_intrawave_v3,1084.65,733.33,0.0
256,6314,4608,2048,ck,0,0,110.2886,a8w8_blockscale_1x128x128_256x128x128x128_16x16_32x32_2x2_8x32x1_8x32x1_1x32x1x8_8_1x1_intrawave_v3,1080.55,730.43,0.0
256,6318,4608,2048,ck,0,0,110.8438,a8w8_blockscale_1x128x128_256x128x128x128_16x16_32x32_2x2_8x32x1_8x32x1_1x32x1x8_8_1x1_intrawave_v3,1075.82,727.18,0.0
256,6341,4608,2048,ck,0,0,109.925,a8w8_blockscale_1x128x128_256x128x128x128_16x16_32x32_2x2_8x32x1_8x32x1_1x32x1x8_8_1x1_intrawave_v3,1088.76,735.61,0.0
256,6377,4608,2048,ck,0,0,112.2154,a8w8_blockscale_1x128x128_256x128x128x128_16x16_32x32_2x2_8x32x1_8x32x1_1x32x1x8_8_1x1_intrawave_v3,1072.6,724.21,0.0
256,6476,4608,2048,ck,0,0,110.0826,a8w8_blockscale_1x128x128_256x128x128x128_16x16_32x32_2x2_8x32x1_8x32x1_1x32x1x8_8_1x1_intrawave_v3,1110.35,748.37,0.0
256,6483,4608,2048,ck,0,0,112.1391,a8w8_blockscale_1x128x128_256x128x128x128_16x16_32x32_2x2_8x32x1_8x32x1_1x32x1x8_8_1x1_intrawave_v3,1091.17,735.35,0.0
256,6492,4608,2048,ck,0,0,110.5174,a8w8_blockscale_1x128x128_256x128x128x128_16x16_32x32_2x2_8x32x1_8x32x1_1x32x1x8_8_1x1_intrawave_v3,1108.72,747.06,0.0
256,6519,4608,2048,ck,0,0,111.5667,a8w8_blockscale_1x128x128_256x128x128x128_16x16_32x32_2x2_8x32x1_8x32x1_1x32x1x8_8_1x1_intrawave_v3,1102.86,742.76,0.0
256,6609,4608,2048,ck,0,0,111.2354,a8w8_blockscale_1x128x128_256x128x128x128_16x16_32x32_2x2_8x32x1_8x32x1_1x32x1x8_8_1x1_intrawave_v3,1121.41,754.09,0.0
256,6811,4608,2048,ck,0,0,114.5891,a8w8_blockscale_1x128x128_256x128x128x128_16x16_32x32_2x2_8x32x1_8x32x1_1x32x1x8_8_1x1_intrawave_v3,1121.86,751.87,0.0
256,6813,4608,2048,ck,0,0,114.0283,a8w8_blockscale_1x128x128_256x128x128x128_16x16_32x32_2x2_8x32x1_8x32x1_1x32x1x8_8_1x1_intrawave_v3,1127.71,755.77,0.0
256,6818,4608,2048,ck,0,0,115.5167,a8w8_blockscale_1x128x128_256x128x128x128_16x16_32x32_2x2_8x32x1_8x32x1_1x32x1x8_8_1x1_intrawave_v3,1114.0,746.52,0.0
256,6830,4608,2048,ck,0,0,112.6727,a8w8_blockscale_1x128x128_256x128x128x128_16x16_32x32_2x2_8x32x1_8x32x1_1x32x1x8_8_1x1_intrawave_v3,1144.13,766.56,0.0
256,7001,4608,2048,ck,0,0,116.3715,a8w8_blockscale_1x128x128_256x128x128x128_16x16_32x32_2x2_8x32x1_8x32x1_1x32x1x8_8_1x1_intrawave_v3,1135.5,758.75,0.0
256,7025,4608,2048,ck,0,0,114.7267,a8w8_blockscale_1x128x128_256x128x128x128_16x16_32x32_2x2_8x32x1_8x32x1_1x32x1x8_8_1x1_intrawave_v3,1155.72,771.98,0.0
256,7121,4608,2048,ck,0,0,115.4883,a8w8_blockscale_1x128x128_256x128x128x128_16x16_32x32_2x2_8x32x1_8x32x1_1x32x1x8_8_1x1_intrawave_v3,1163.79,776.25,0.0
256,7169,4608,2048,ck,0,0,123.6559,a8w8_blockscale_1x128x128_256x128x128x128_16x16_32x32_2x2_8x32x1_8x32x1_1x32x1x8_8_1x1_intrawave_v3,1094.25,729.35,0.0
256,7177,4608,2048,ck,0,0,121.9302,a8w8_blockscale_1x128x128_256x128x128x128_16x16_32x32_2x2_8x32x1_8x32x1_1x32x1x8_8_1x1_intrawave_v3,1110.97,740.41,0.0
256,7217,4608,2048,ck,0,0,122.4844,a8w8_blockscale_1x128x128_256x128x128x128_16x16_32x32_2x2_8x32x1_8x32x1_1x32x1x8_8_1x1_intrawave_v3,1112.11,740.74,0.0
256,7223,4608,2048,ck,0,0,123.3783,a8w8_blockscale_1x128x128_256x128x128x128_16x16_32x32_2x2_8x32x1_8x32x1_1x32x1x8_8_1x1_intrawave_v3,1104.97,735.92,0.0
256,7238,4608,2048,ck,0,0,124.0177,a8w8_blockscale_1x128x128_256x128x128x128_16x16_32x32_2x2_8x32x1_8x32x1_1x32x1x8_8_1x1_intrawave_v3,1101.56,733.49,0.0
256,7246,4608,2048,ck,0,0,123.1163,a8w8_blockscale_1x128x128_256x128x128x128_16x16_32x32_2x2_8x32x1_8x32x1_1x32x1x8_8_1x1_intrawave_v3,1110.85,739.59,0.0
256,7249,4608,2048,ck,0,0,121.4783,a8w8_blockscale_1x128x128_256x128x128x128_16x16_32x32_2x2_8x32x1_8x32x1_1x32x1x8_8_1x1_intrawave_v3,1126.29,749.85,0.0
256,7316,4608,2048,ck,0,0,124.0683,a8w8_blockscale_1x128x128_256x128x128x128_16x16_32x32_2x2_8x32x1_8x32x1_1x32x1x8_8_1x1_intrawave_v3,1112.97,740.27,0.0
256,7393,4608,2048,ck,0,0,122.6394,a8w8_blockscale_1x128x128_256x128x128x128_16x16_32x32_2x2_8x32x1_8x32x1_1x32x1x8_8_1x1_intrawave_v3,1137.79,755.97,0.0
256,7491,4608,2048,ck,0,0,124.5423,a8w8_blockscale_1x128x128_256x128x128x128_16x16_32x32_2x2_8x32x1_8x32x1_1x32x1x8_8_1x1_intrawave_v3,1135.26,753.28,0.0
256,7558,4608,2048,ck,0,0,127.4443,a8w8_blockscale_1x128x128_256x128x128x128_16x16_32x32_2x2_8x32x1_8x32x1_1x32x1x8_8_1x1_intrawave_v3,1119.33,742.05,0.0
256,7650,4608,2048,ck,0,0,125.3907,a8w8_blockscale_1x128x128_256x128x128x128_16x16_32x32_2x2_8x32x1_8x32x1_1x32x1x8_8_1x1_intrawave_v3,1151.51,762.47,0.0
256,7753,4608,2048,ck,0,0,128.2071,a8w8_blockscale_1x128x128_256x128x128x128_16x16_32x32_2x2_8x32x1_8x32x1_1x32x1x8_8_1x1_intrawave_v3,1141.38,754.77,0.0
256,7774,4608,2048,ck,0,0,128.6747,a8w8_blockscale_1x128x128_256x128x128x128_16x16_32x32_2x2_8x32x1_8x32x1_1x32x1x8_8_1x1_intrawave_v3,1140.31,753.87,0.0
256,7815,4608,2048,ck,0,0,126.6555,a8w8_blockscale_1x128x128_256x128x128x128_16x16_32x32_2x2_8x32x1_8x32x1_1x32x1x8_8_1x1_intrawave_v3,1164.6,769.53,0.0
256,7834,4608,2048,ck,0,0,127.2179,a8w8_blockscale_1x128x128_256x128x128x128_16x16_32x32_2x2_8x32x1_8x32x1_1x32x1x8_8_1x1_intrawave_v3,1162.27,767.81,0.0
256,7836,4608,2048,ck,0,0,125.6945,a8w8_blockscale_1x128x128_256x128x128x128_16x16_32x32_2x2_8x32x1_8x32x1_1x32x1x8_8_1x1_intrawave_v3,1176.66,777.3,0.0
256,7871,4608,2048,ck,0,0,126.4657,a8w8_blockscale_1x128x128_256x128x128x128_16x16_32x32_2x2_8x32x1_8x32x1_1x32x1x8_8_1x1_intrawave_v3,1174.71,775.67,0.0
256,7899,4608,2048,ck,0,0,126.4969,a8w8_blockscale_1x128x128_256x128x128x128_16x16_32x32_2x2_8x32x1_8x32x1_1x32x1x8_8_1x1_intrawave_v3,1178.6,777.98,0.0
256,7913,4608,2048,ck,0,0,127.7389,a8w8_blockscale_1x128x128_256x128x128x128_16x16_32x32_2x2_8x32x1_8x32x1_1x32x1x8_8_1x1_intrawave_v3,1169.2,771.65,0.0
256,7930,4608,2048,ck,0,0,127.6253,a8w8_blockscale_1x128x128_256x128x128x128_16x16_32x32_2x2_8x32x1_8x32x1_1x32x1x8_8_1x1_intrawave_v3,1172.76,773.83,0.0
256,7961,4608,2048,ck,0,0,127.5537,a8w8_blockscale_1x128x128_256x128x128x128_16x16_32x32_2x2_8x32x1_8x32x1_1x32x1x8_8_1x1_intrawave_v3,1178.0,777.01,0.0
256,7963,4608,2048,ck,0,0,128.7225,a8w8_blockscale_1x128x128_256x128x128x128_16x16_32x32_2x2_8x32x1_8x32x1_1x32x1x8_8_1x1_intrawave_v3,1167.6,770.13,0.0
256,7974,4608,2048,ck,0,0,129.0689,a8w8_blockscale_1x128x128_256x128x128x128_16x16_32x32_2x2_8x32x1_8x32x1_1x32x1x8_8_1x1_intrawave_v3,1166.08,769.02,0.0
256,8016,4608,2048,ck,0,0,128.1593,a8w8_blockscale_1x128x128_256x128x128x128_16x16_32x32_2x2_8x32x1_8x32x1_1x32x1x8_8_1x1_intrawave_v3,1180.54,778.17,0.0
256,8017,4608,2048,ck,0,0,126.7773,a8w8_blockscale_1x128x128_256x128x128x128_16x16_32x32_2x2_8x32x1_8x32x1_1x32x1x8_8_1x1_intrawave_v3,1193.56,786.74,0.0
256,8103,4608,2048,ck,0,0,129.3805,a8w8_blockscale_1x128x128_256x128x128x128_16x16_32x32_2x2_8x32x1_8x32x1_1x32x1x8_8_1x1_intrawave_v3,1182.09,778.4,0.0
256,8128,4608,2048,ck,0,0,130.9153,a8w8_blockscale_1x128x128_256x128x128x128_16x16_32x32_2x2_8x32x1_8x32x1_1x32x1x8_8_1x1_intrawave_v3,1171.83,771.42,0.0
256,8129,4608,2048,ck,0,0,130.1741,a8w8_blockscale_1x128x128_256x128x128x128_16x16_32x32_2x2_8x32x1_8x32x1_1x32x1x8_8_1x1_intrawave_v3,1178.65,775.9,0.0
256,8150,4608,2048,ck,0,0,130.5249,a8w8_blockscale_1x128x128_256x128x128x128_16x16_32x32_2x2_8x32x1_8x32x1_1x32x1x8_8_1x1_intrawave_v3,1178.52,775.63,0.0
256,8184,4608,2048,ck,0,0,132.6477,a8w8_blockscale_1x128x128_256x128x128x128_16x16_32x32_2x2_8x32x1_8x32x1_1x32x1x8_8_1x1_intrawave_v3,1164.5,766.1,0.0
256,8185,4608,2048,ck,0,0,131.5317,a8w8_blockscale_1x128x128_256x128x128x128_16x16_32x32_2x2_8x32x1_8x32x1_1x32x1x8_8_1x1_intrawave_v3,1174.52,772.69,0.0
256,8192,4608,2048,ck,0,0,128.4029,a8w8_blockscale_1x128x128_256x128x128x128_16x16_32x32_2x2_8x32x1_8x32x1_1x32x1x8_8_1x1_intrawave_v3,1204.17,792.13,0.0
256,1,6144,2048,ck,8,2,6.2657,a8w8_blockscale_1x128x128_256x16x64x256_16x16_16x16_1x1_16x16x1_16x16x1_1x16x1x16_4_1x1_intrawave_v1,4.02,2010.51,0.0
256,2,6144,2048,ck,13,2,7.14,a8w8_blockscale_1x128x128_256x32x64x256_16x16_16x16_2x1_16x16x1_16x16x1_1x32x1x8_8_2x1_intrawave_v1,7.05,1766.33,0.0
256,4,6144,2048,ck,8,2,6.6687,a8w8_blockscale_1x128x128_256x16x64x256_16x16_16x16_1x1_16x16x1_16x16x1_1x16x1x16_4_1x1_intrawave_v1,15.09,1895.46,0.0
256,8,6144,2048,ck,6,3,6.8978,a8w8_blockscale_1x128x128_256x16x64x128_8x16_16x16_1x1_16x16x1_8x32x1_1x16x1x16_4_1x1_intrawave_v1,29.19,1840.82,0.0
256,16,6144,2048,ck,6,2,7.6501,a8w8_blockscale_1x128x128_256x16x64x128_8x16_16x16_1x1_16x16x1_8x32x1_1x16x1x16_4_1x1_intrawave_v1,52.63,1674.79,0.0
256,24,6144,2048,ck,8,2,7.6335,a8w8_blockscale_1x128x128_256x16x64x256_16x16_16x16_1x1_16x16x1_16x16x1_1x16x1x16_4_1x1_intrawave_v1,79.12,1693.45,0.0
256,32,6144,2048,ck,8,0,7.9668,a8w8_blockscale_1x128x128_256x16x64x256_16x16_16x16_1x1_16x16x1_16x16x1_1x16x1x16_4_1x1_intrawave_v1,101.08,1637.0,0.0
256,40,6144,2048,ck,8,2,9.1963,a8w8_blockscale_1x128x128_256x16x64x256_16x16_16x16_1x1_16x16x1_16x16x1_1x16x1x16_4_1x1_intrawave_v1,109.46,1430.61,0.0
256,48,6144,2048,ck,8,2,9.4307,a8w8_blockscale_1x128x128_256x16x64x256_16x16_16x16_1x1_16x16x1_16x16x1_1x16x1x16_4_1x1_intrawave_v1,128.09,1407.22,0.0
256,56,6144,2048,ck,7,0,9.8268,a8w8_blockscale_1x128x128_256x16x128x256_16x16_16x16_1x2_16x16x1_16x16x1_1x16x1x16_8_1x2_intrawave_v1,143.41,1362.17,0.0
256,64,6144,2048,ck,18,0,9.7249,a8w8_blockscale_1x128x128_256x64x64x256_16x16_32x32_1x1_16x16x1_16x16x1_1x32x1x8_8_1x1_intrawave_v1,165.62,1388.23,0.0
256,72,6144,2048,ck,7,0,10.6604,a8w8_blockscale_1x128x128_256x16x128x256_16x16_16x16_1x2_16x16x1_16x16x1_1x16x1x16_8_1x2_intrawave_v1,169.97,1277.17,0.0
256,80,6144,2048,ck,7,0,10.0574,a8w8_blockscale_1x128x128_256x16x128x256_16x16_16x16_1x2_16x16x1_16x16x1_1x16x1x16_8_1x2_intrawave_v1,200.18,1365.14,0.0
256,88,6144,2048,ck,18,0,10.8689,a8w8_blockscale_1x128x128_256x64x64x256_16x16_32x32_1x1_16x16x1_16x16x1_1x32x1x8_8_1x1_intrawave_v1,203.75,1273.77,0.0
256,96,6144,2048,ck,18,0,10.8571,a8w8_blockscale_1x128x128_256x64x64x256_16x16_32x32_1x1_16x16x1_16x16x1_1x32x1x8_8_1x1_intrawave_v1,222.52,1285.72,0.0
256,104,6144,2048,ck,18,0,10.8997,a8w8_blockscale_1x128x128_256x64x64x256_16x16_32x32_1x1_16x16x1_16x16x1_1x32x1x8_8_1x1_intrawave_v1,240.12,1291.21,0.0
256,112,6144,2048,ck,18,0,12.0298,a8w8_blockscale_1x128x128_256x64x64x256_16x16_32x32_1x1_16x16x1_16x16x1_1x32x1x8_8_1x1_intrawave_v1,234.3,1179.45,0.0
256,120,6144,2048,ck,18,0,11.1775,a8w8_blockscale_1x128x128_256x64x64x256_16x16_32x32_1x1_16x16x1_16x16x1_1x32x1x8_8_1x1_intrawave_v1,270.18,1279.65,0.0
256,128,6144,2048,ck,18,0,10.293,a8w8_blockscale_1x128x128_256x64x64x256_16x16_32x32_1x1_16x16x1_16x16x1_1x32x1x8_8_1x1_intrawave_v1,312.95,1400.75,0.0
256,136,6144,2048,ck,12,0,12.2787,a8w8_blockscale_1x128x128_256x32x128x256_16x16_32x32_1x1_16x16x1_16x16x1_1x32x1x8_8_1x1_intrawave_v1,278.74,1183.56,0.0
256,144,6144,2048,ck,12,0,13.3761,a8w8_blockscale_1x128x128_256x32x128x256_16x16_32x32_1x1_16x16x1_16x16x1_1x32x1x8_8_1x1_intrawave_v1,270.92,1095.03,0.0
256,152,6144,2048,ck,12,0,13.4315,a8w8_blockscale_1x128x128_256x32x128x256_16x16_32x32_1x1_16x16x1_16x16x1_1x32x1x8_8_1x1_intrawave_v1,284.79,1099.06,0.0
256,160,6144,2048,ck,12,0,11.9308,a8w8_blockscale_1x128x128_256x32x128x256_16x16_32x32_1x1_16x16x1_16x16x1_1x32x1x8_8_1x1_intrawave_v1,337.49,1246.91,0.0
256,168,6144,2048,ck,2,0,15.8799,a8w8_blockscale_1x128x128_256x64x128x128_16x16_32x32_1x2_8x32x1_8x32x1_1x32x1x8_8_1x1_intrawave_v3,266.24,944.05,0.0
256,176,6144,2048,ck,3,0,16.2366,a8w8_blockscale_1x128x128_256x64x64x128_16x16_32x32_1x1_8x32x1_8x32x1_1x32x1x8_8_1x1_intrawave_v3,272.79,930.37,0.0
256,184,6144,2048,ck,3,0,16.3324,a8w8_blockscale_1x128x128_256x64x64x128_16x16_32x32_1x1_8x32x1_8x32x1_1x32x1x8_8_1x1_intrawave_v3,283.52,931.94,0.0
256,192,6144,2048,ck,2,0,15.6704,a8w8_blockscale_1x128x128_256x64x128x128_16x16_32x32_1x2_8x32x1_8x32x1_1x32x1x8_8_1x1_intrawave_v3,308.34,978.62,0.0
256,200,6144,2048,ck,2,0,15.9275,a8w8_blockscale_1x128x128_256x64x128x128_16x16_32x32_1x2_8x32x1_8x32x1_1x32x1x8_8_1x1_intrawave_v3,316.0,970.03,0.0
256,208,6144,2048,ck,2,0,16.008,a8w8_blockscale_1x128x128_256x64x128x128_16x16_32x32_1x2_8x32x1_8x32x1_1x32x1x8_8_1x1_intrawave_v3,326.99,972.31,0.0
256,216,6144,2048,ck,2,0,16.0698,a8w8_blockscale_1x128x128_256x64x128x128_16x16_32x32_1x2_8x32x1_8x32x1_1x32x1x8_8_1x1_intrawave_v3,338.26,975.71,0.0
256,224,6144,2048,ck,2,0,15.7352,a8w8_blockscale_1x128x128_256x64x128x128_16x16_32x32_1x2_8x32x1_8x32x1_1x32x1x8_8_1x1_intrawave_v3,358.25,1003.75,0.0
256,232,6144,2048,ck,2,0,15.4116,a8w8_blockscale_1x128x128_256x64x128x128_16x16_32x32_1x2_8x32x1_8x32x1_1x32x1x8_8_1x1_intrawave_v3,378.84,1032.27,0.0
256,240,6144,2048,ck,2,0,15.4772,a8w8_blockscale_1x128x128_256x64x128x128_16x16_32x32_1x2_8x32x1_8x32x1_1x32x1x8_8_1x1_intrawave_v3,390.24,1035.3,0.0
256,248,6144,2048,ck,2,0,15.5241,a8w8_blockscale_1x128x128_256x64x128x128_16x16_32x32_1x2_8x32x1_8x32x1_1x32x1x8_8_1x1_intrawave_v3,402.03,1039.56,0.0
256,256,6144,2048,ck,2,0,15.3148,a8w8_blockscale_1x128x128_256x64x128x128_16x16_32x32_1x2_8x32x1_8x32x1_1x32x1x8_8_1x1_intrawave_v3,420.67,1061.26,0.0
256,272,6144,2048,ck,2,0,15.6108,a8w8_blockscale_1x128x128_256x64x128x128_16x16_32x32_1x2_8x32x1_8x32x1_1x32x1x8_8_1x1_intrawave_v3,438.49,1055.83,0.0
256,288,6144,2048,ck,2,0,15.7075,a8w8_blockscale_1x128x128_256x64x128x128_16x16_32x32_1x2_8x32x1_8x32x1_1x32x1x8_8_1x1_intrawave_v3,461.42,1063.93,0.0
256,304,6144,2048,ck,2,0,15.7815,a8w8_blockscale_1x128x128_256x64x128x128_16x16_32x32_1x2_8x32x1_8x32x1_1x32x1x8_8_1x1_intrawave_v3,484.77,1073.48,0.0
256,320,6144,2048,ck,2,0,16.286,a8w8_blockscale_1x128x128_256x64x128x128_16x16_32x32_1x2_8x32x1_8x32x1_1x32x1x8_8_1x1_intrawave_v3,494.48,1054.31,0.0
256,336,6144,2048,ck,3,0,19.0411,a8w8_blockscale_1x128x128_256x64x64x128_16x16_32x32_1x1_8x32x1_8x32x1_1x32x1x8_8_1x1_intrawave_v3,444.08,913.8,0.0
256,352,6144,2048,ck,3,0,19.2617,a8w8_blockscale_1x128x128_256x64x64x128_16x16_32x32_1x1_8x32x1_8x32x1_1x32x1x8_8_1x1_intrawave_v3,459.9,915.25,0.0
256,368,6144,2048,ck,3,0,19.5111,a8w8_blockscale_1x128x128_256x64x64x128_16x16_32x32_1x1_8x32x1_8x32x1_1x32x1x8_8_1x1_intrawave_v3,474.65,915.3,0.0
256,384,6144,2048,ck,0,0,19.1977,a8w8_blockscale_1x128x128_256x128x128x128_16x16_32x32_2x2_8x32x1_8x32x1_1x32x1x8_8_1x1_intrawave_v3,503.38,942.19,0.0
256,400,6144,2048,ck,0,0,19.709,a8w8_blockscale_1x128x128_256x128x128x128_16x16_32x32_2x2_8x32x1_8x32x1_1x32x1x8_8_1x1_intrawave_v3,510.75,929.39,0.0
256,416,6144,2048,ck,0,0,19.9072,a8w8_blockscale_1x128x128_256x128x128x128_16x16_32x32_2x2_8x32x1_8x32x1_1x32x1x8_8_1x1_intrawave_v3,525.89,931.66,0.0
256,432,6144,2048,ck,0,0,20.006,a8w8_blockscale_1x128x128_256x128x128x128_16x16_32x32_2x2_8x32x1_8x32x1_1x32x1x8_8_1x1_intrawave_v3,543.42,938.52,0.0
256,448,6144,2048,ck,0,0,20.1987,a8w8_blockscale_1x128x128_256x128x128x128_16x16_32x32_2x2_8x32x1_8x32x1_1x32x1x8_8_1x1_intrawave_v3,558.17,940.92,0.0
256,464,6144,2048,ck,3,0,20.2011,a8w8_blockscale_1x128x128_256x64x64x128_16x16_32x32_1x1_8x32x1_8x32x1_1x32x1x8_8_1x1_intrawave_v3,578.03,952.17,0.0
256,480,6144,2048,ck,0,0,20.3996,a8w8_blockscale_1x128x128_256x128x128x128_16x16_32x32_2x2_8x32x1_8x32x1_1x32x1x8_8_1x1_intrawave_v3,592.15,954.15,0.0
256,496,6144,2048,ck,0,0,20.4633,a8w8_blockscale_1x128x128_256x128x128x128_16x16_32x32_2x2_8x32x1_8x32x1_1x32x1x8_8_1x1_intrawave_v3,609.98,962.38,0.0
256,512,6144,2048,ck,0,0,19.6765,a8w8_blockscale_1x128x128_256x128x128x128_16x16_32x32_2x2_8x32x1_8x32x1_1x32x1x8_8_1x1_intrawave_v3,654.84,1012.52,0.0
256,664,6144,2048,ck,2,0,28.6902,a8w8_blockscale_1x128x128_256x64x128x128_16x16_32x32_1x2_8x32x1_8x32x1_1x32x1x8_8_1x1_intrawave_v3,582.43,770.37,0.0
256,762,6144,2048,ck,2,0,28.249,a8w8_blockscale_1x128x128_256x64x128x128_16x16_32x32_1x2_8x32x1_8x32x1_1x32x1x8_8_1x1_intrawave_v3,678.83,832.13,0.0
256,902,6144,2048,ck,2,0,30.5059,a8w8_blockscale_1x128x128_256x64x128x128_16x16_32x32_1x2_8x32x1_8x32x1_1x32x1x8_8_1x1_intrawave_v3,744.1,836.36,0.0
256,961,6144,2048,ck,2,0,30.0045,a8w8_blockscale_1x128x128_256x64x128x128_16x16_32x32_1x2_8x32x1_8x32x1_1x32x1x8_8_1x1_intrawave_v3,806.02,878.53,0.0
256,1000,6144,2048,ck,2,0,30.6104,a8w8_blockscale_1x128x128_256x64x128x128_16x16_32x32_1x2_8x32x1_8x32x1_1x32x1x8_8_1x1_intrawave_v3,822.13,879.4,0.0
256,1001,6144,2048,ck,2,0,31.1132,a8w8_blockscale_1x128x128_256x64x128x128_16x16_32x32_1x2_8x32x1_8x32x1_1x32x1x8_8_1x1_intrawave_v3,809.66,865.65,0.0
256,1002,6144,2048,ck,2,0,30.5416,a8w8_blockscale_1x128x128_256x64x128x128_16x16_32x32_1x2_8x32x1_8x32x1_1x32x1x8_8_1x1_intrawave_v3,825.63,882.32,0.0
256,1003,6144,2048,ck,2,0,30.6748,a8w8_blockscale_1x128x128_256x64x128x128_16x16_32x32_1x2_8x32x1_8x32x1_1x32x1x8_8_1x1_intrawave_v3,822.87,878.96,0.0
256,1015,6144,2048,ck,2,0,30.9084,a8w8_blockscale_1x128x128_256x64x128x128_16x16_32x32_1x2_8x32x1_8x32x1_1x32x1x8_8_1x1_intrawave_v3,826.42,877.88,0.0
256,1023,6144,2048,ck,2,0,31.4576,a8w8_blockscale_1x128x128_256x64x128x128_16x16_32x32_1x2_8x32x1_8x32x1_1x32x1x8_8_1x1_intrawave_v3,818.39,866.2,0.0
256,1024,6144,2048,ck,2,0,30.421,a8w8_blockscale_1x128x128_256x64x128x128_16x16_32x32_1x2_8x32x1_8x32x1_1x32x1x8_8_1x1_intrawave_v3,847.11,896.19,0.0
256,1025,6144,2048,ck,0,0,32.6562,a8w8_blockscale_1x128x128_256x128x128x128_16x16_32x32_2x2_8x32x1_8x32x1_1x32x1x8_8_1x1_intrawave_v3,789.9,835.29,0.0
256,1032,6144,2048,ck,0,0,32.7676,a8w8_blockscale_1x128x128_256x128x128x128_16x16_32x32_2x2_8x32x1_8x32x1_1x32x1x8_8_1x1_intrawave_v3,792.59,835.51,0.0
256,1038,6144,2048,ck,0,0,32.1579,a8w8_blockscale_1x128x128_256x128x128x128_16x16_32x32_2x2_8x32x1_8x32x1_1x32x1x8_8_1x1_intrawave_v3,812.31,854.03,0.0
256,1087,6144,2048,ck,0,0,32.1759,a8w8_blockscale_1x128x128_256x128x128x128_16x16_32x32_2x2_8x32x1_8x32x1_1x32x1x8_8_1x1_intrawave_v3,850.18,875.38,0.0
256,1255,6144,2048,ck,0,0,33.9662,a8w8_blockscale_1x128x128_256x128x128x128_16x16_32x32_2x2_8x32x1_8x32x1_1x32x1x8_8_1x1_intrawave_v3,929.84,900.15,0.0
256,1351,6144,2048,ck,2,0,44.9158,a8w8_blockscale_1x128x128_256x64x128x128_16x16_32x32_1x2_8x32x1_8x32x1_1x32x1x8_8_1x1_intrawave_v3,756.95,711.35,0.0
256,1376,6144,2048,ck,0,0,45.338,a8w8_blockscale_1x128x128_256x128x128x128_16x16_32x32_2x2_8x32x1_8x32x1_1x32x1x8_8_1x1_intrawave_v3,763.78,712.63,0.0
256,1380,6144,2048,ck,0,0,45.204,a8w8_blockscale_1x128x128_256x128x128x128_16x16_32x32_2x2_8x32x1_8x32x1_1x32x1x8_8_1x1_intrawave_v3,768.27,716.01,0.0
256,1391,6144,2048,ck,2,0,45.2935,a8w8_blockscale_1x128x128_256x64x128x128_16x16_32x32_1x2_8x32x1_8x32x1_1x32x1x8_8_1x1_intrawave_v3,772.86,718.08,0.0
256,1710,6144,2048,ck,0,0,47.4309,a8w8_blockscale_1x128x128_256x128x128x128_16x16_32x32_2x2_8x32x1_8x32x1_1x32x1x8_8_1x1_intrawave_v3,907.29,782.14,0.0
256,1808,6144,2048,ck,0,0,48.6302,a8w8_blockscale_1x128x128_256x128x128x128_16x16_32x32_2x2_8x32x1_8x32x1_1x32x1x8_8_1x1_intrawave_v3,935.63,791.74,0.0
256,1809,6144,2048,ck,0,0,48.141,a8w8_blockscale_1x128x128_256x128x128x128_16x16_32x32_2x2_8x32x1_8x32x1_1x32x1x8_8_1x1_intrawave_v3,945.66,800.08,0.0
256,1870,6144,2048,ck,0,0,48.5998,a8w8_blockscale_1x128x128_256x128x128x128_16x16_32x32_2x2_8x32x1_8x32x1_1x32x1x8_8_1x1_intrawave_v3,968.32,810.52,0.0
256,1967,6144,2048,ck,0,0,49.549,a8w8_blockscale_1x128x128_256x128x128x128_16x16_32x32_2x2_8x32x1_8x32x1_1x32x1x8_8_1x1_intrawave_v3,999.03,823.06,0.0
256,1970,6144,2048,ck,0,0,50.5134,a8w8_blockscale_1x128x128_256x128x128x128_16x16_32x32_2x2_8x32x1_8x32x1_1x32x1x8_8_1x1_intrawave_v3,981.46,808.2,0.0
256,2000,6144,2048,ck,0,0,50.1802,a8w8_blockscale_1x128x128_256x128x128x128_16x16_32x32_2x2_8x32x1_8x32x1_1x32x1x8_8_1x1_intrawave_v3,1003.02,822.14,0.0
256,2001,6144,2048,ck,0,0,50.0104,a8w8_blockscale_1x128x128_256x128x128x128_16x16_32x32_2x2_8x32x1_8x32x1_1x32x1x8_8_1x1_intrawave_v3,1006.93,825.21,0.0
256,2016,6144,2048,ck,0,0,50.2314,a8w8_blockscale_1x128x128_256x128x128x128_16x16_32x32_2x2_8x32x1_8x32x1_1x32x1x8_8_1x1_intrawave_v3,1010.01,825.86,0.0
256,2017,6144,2048,ck,0,0,51.6274,a8w8_blockscale_1x128x128_256x128x128x128_16x16_32x32_2x2_8x32x1_8x32x1_1x32x1x8_8_1x1_intrawave_v3,983.19,803.81,0.0
256,2046,6144,2048,ck,0,0,50.6798,a8w8_blockscale_1x128x128_256x128x128x128_16x16_32x32_2x2_8x32x1_8x32x1_1x32x1x8_8_1x1_intrawave_v3,1015.97,827.04,0.0
256,2048,6144,2048,ck,0,0,50.4118,a8w8_blockscale_1x128x128_256x128x128x128_16x16_32x32_2x2_8x32x1_8x32x1_1x32x1x8_8_1x1_intrawave_v3,1022.37,832.01,0.0
256,2050,6144,2048,ck,0,0,58.2899,a8w8_blockscale_1x128x128_256x128x128x128_16x16_32x32_2x2_8x32x1_8x32x1_1x32x1x8_8_1x1_intrawave_v3,885.06,720.05,0.0
256,2081,6144,2048,ck,0,0,58.2839,a8w8_blockscale_1x128x128_256x128x128x128_16x16_32x32_2x2_8x32x1_8x32x1_1x32x1x8_8_1x1_intrawave_v3,898.53,727.75,0.0
256,2095,6144,2048,ck,0,0,59.0299,a8w8_blockscale_1x128x128_256x128x128x128_16x16_32x32_2x2_8x32x1_8x32x1_1x32x1x8_8_1x1_intrawave_v3,893.15,721.95,0.0
256,2154,6144,2048,ck,0,0,58.0779,a8w8_blockscale_1x128x128_256x128x128x128_16x16_32x32_2x2_8x32x1_8x32x1_1x32x1x8_8_1x1_intrawave_v3,933.35,748.35,0.0
256,2159,6144,2048,ck,0,0,58.4362,a8w8_blockscale_1x128x128_256x128x128x128_16x16_32x32_2x2_8x32x1_8x32x1_1x32x1x8_8_1x1_intrawave_v3,929.78,744.99,0.0
256,2162,6144,2048,ck,0,0,58.4431,a8w8_blockscale_1x128x128_256x128x128x128_16x16_32x32_2x2_8x32x1_8x32x1_1x32x1x8_8_1x1_intrawave_v3,930.97,745.64,0.0
256,2165,6144,2048,ck,0,0,58.7027,a8w8_blockscale_1x128x128_256x128x128x128_16x16_32x32_2x2_8x32x1_8x32x1_1x32x1x8_8_1x1_intrawave_v3,928.13,743.07,0.0
256,2251,6144,2048,ck,0,0,58.9735,a8w8_blockscale_1x128x128_256x128x128x128_16x16_32x32_2x2_8x32x1_8x32x1_1x32x1x8_8_1x1_intrawave_v3,960.57,760.57,0.0
256,2252,6144,2048,ck,0,0,58.6787,a8w8_blockscale_1x128x128_256x128x128x128_16x16_32x32_2x2_8x32x1_8x32x1_1x32x1x8_8_1x1_intrawave_v3,965.83,764.63,0.0
256,2255,6144,2048,ck,0,0,58.6183,a8w8_blockscale_1x128x128_256x128x128x128_16x16_32x32_2x2_8x32x1_8x32x1_1x32x1x8_8_1x1_intrawave_v3,968.11,766.15,0.0
256,2317,6144,2048,ck,0,0,60.0511,a8w8_blockscale_1x128x128_256x128x128x128_16x16_32x32_2x2_8x32x1_8x32x1_1x32x1x8_8_1x1_intrawave_v3,970.99,762.67,0.0
256,2694,6144,2048,ck,0,0,72.41,a8w8_blockscale_1x128x128_256x128x128x128_16x16_32x32_2x2_8x32x1_8x32x1_1x32x1x8_8_1x1_intrawave_v3,936.29,707.14,0.0
256,2715,6144,2048,ck,0,0,72.3828,a8w8_blockscale_1x128x128_256x128x128x128_16x16_32x32_2x2_8x32x1_8x32x1_1x32x1x8_8_1x1_intrawave_v3,943.94,711.57,0.0
256,2819,6144,2048,ck,0,0,73.53,a8w8_blockscale_1x128x128_256x128x128x128_16x16_32x32_2x2_8x32x1_8x32x1_1x32x1x8_8_1x1_intrawave_v3,964.81,720.74,0.0
256,2853,6144,2048,ck,0,0,72.284,a8w8_blockscale_1x128x128_256x128x128x128_16x16_32x32_2x2_8x32x1_8x32x1_1x32x1x8_8_1x1_intrawave_v3,993.28,739.91,0.0
256,2914,6144,2048,ck,0,0,73.0196,a8w8_blockscale_1x128x128_256x128x128x128_16x16_32x32_2x2_8x32x1_8x32x1_1x32x1x8_8_1x1_intrawave_v3,1004.29,744.43,0.0
256,2974,6144,2048,ck,0,0,72.1244,a8w8_blockscale_1x128x128_256x128x128x128_16x16_32x32_2x2_8x32x1_8x32x1_1x32x1x8_8_1x1_intrawave_v3,1037.7,765.6,0.0
256,3000,6144,2048,ck,0,0,73.4356,a8w8_blockscale_1x128x128_256x128x128x128_16x16_32x32_2x2_8x32x1_8x32x1_1x32x1x8_8_1x1_intrawave_v3,1028.08,757.0,0.0
256,3001,6144,2048,ck,0,0,73.292,a8w8_blockscale_1x128x128_256x128x128x128_16x16_32x32_2x2_8x32x1_8x32x1_1x32x1x8_8_1x1_intrawave_v3,1030.43,758.68,0.0
256,3072,6144,2048,ck,0,0,72.5628,a8w8_blockscale_1x128x128_256x128x128x128_16x16_32x32_2x2_8x32x1_8x32x1_1x32x1x8_8_1x1_intrawave_v3,1065.41,780.33,0.0
256,3073,6144,2048,ck,0,0,74.9864,a8w8_blockscale_1x128x128_256x128x128x128_16x16_32x32_2x2_8x32x1_8x32x1_1x32x1x8_8_1x1_intrawave_v3,1031.31,755.3,0.0
256,3077,6144,2048,ck,0,0,74.8184,a8w8_blockscale_1x128x128_256x128x128x128_16x16_32x32_2x2_8x32x1_8x32x1_1x32x1x8_8_1x1_intrawave_v3,1034.98,757.77,0.0
256,3078,6144,2048,ck,0,0,76.5956,a8w8_blockscale_1x128x128_256x128x128x128_16x16_32x32_2x2_8x32x1_8x32x1_1x32x1x8_8_1x1_intrawave_v3,1011.29,740.37,0.0
256,3086,6144,2048,ck,0,0,73.5444,a8w8_blockscale_1x128x128_256x128x128x128_16x16_32x32_2x2_8x32x1_8x32x1_1x32x1x8_8_1x1_intrawave_v3,1055.98,772.65,0.0
256,3089,6144,2048,ck,0,0,73.9136,a8w8_blockscale_1x128x128_256x128x128x128_16x16_32x32_2x2_8x32x1_8x32x1_1x32x1x8_8_1x1_intrawave_v3,1051.73,769.37,0.0
256,3118,6144,2048,ck,0,0,75.2992,a8w8_blockscale_1x128x128_256x128x128x128_16x16_32x32_2x2_8x32x1_8x32x1_1x32x1x8_8_1x1_intrawave_v3,1042.07,760.73,0.0
256,3138,6144,2048,ck,0,0,73.4504,a8w8_blockscale_1x128x128_256x128x128x128_16x16_32x32_2x2_8x32x1_8x32x1_1x32x1x8_8_1x1_intrawave_v3,1075.15,783.78,0.0
256,3154,6144,2048,ck,0,0,74.178,a8w8_blockscale_1x128x128_256x128x128x128_16x16_32x32_2x2_8x32x1_8x32x1_1x32x1x8_8_1x1_intrawave_v3,1070.03,779.19,0.0
256,3289,6144,2048,ck,0,0,75.5276,a8w8_blockscale_1x128x128_256x128x128x128_16x16_32x32_2x2_8x32x1_8x32x1_1x32x1x8_8_1x1_intrawave_v3,1095.9,790.89,0.0
256,3437,6144,2048,ck,0,0,83.9008,a8w8_blockscale_1x128x128_256x128x128x128_16x16_32x32_2x2_8x32x1_8x32x1_1x32x1x8_8_1x1_intrawave_v3,1030.92,737.25,0.0
256,3617,6144,2048,ck,0,0,86.7381,a8w8_blockscale_1x128x128_256x128x128x128_16x16_32x32_2x2_8x32x1_8x32x1_1x32x1x8_8_1x1_intrawave_v3,1049.42,742.88,0.0
256,3620,6144,2048,ck,0,0,88.5665,a8w8_blockscale_1x128x128_256x128x128x128_16x16_32x32_2x2_8x32x1_8x32x1_1x32x1x8_8_1x1_intrawave_v3,1028.61,728.03,0.0
256,3669,6144,2048,ck,0,0,86.4089,a8w8_blockscale_1x128x128_256x128x128x128_16x16_32x32_2x2_8x32x1_8x32x1_1x32x1x8_8_1x1_intrawave_v3,1068.56,754.34,0.0
256,3824,6144,2048,ck,0,0,89.2181,a8w8_blockscale_1x128x128_256x128x128x128_16x16_32x32_2x2_8x32x1_8x32x1_1x32x1x8_8_1x1_intrawave_v3,1078.64,755.49,0.0
256,3858,6144,2048,ck,0,0,90.4641,a8w8_blockscale_1x128x128_256x128x128x128_16x16_32x32_2x2_8x32x1_8x32x1_1x32x1x8_8_1x1_intrawave_v3,1073.24,750.48,0.0
256,3906,6144,2048,ck,0,0,89.4309,a8w8_blockscale_1x128x128_256x128x128x128_16x16_32x32_2x2_8x32x1_8x32x1_1x32x1x8_8_1x1_intrawave_v3,1099.15,766.84,0.0
256,4000,6144,2048,ck,0,0,92.7297,a8w8_blockscale_1x128x128_256x128x128x128_16x16_32x32_2x2_8x32x1_8x32x1_1x32x1x8_8_1x1_intrawave_v3,1085.56,754.09,0.0
256,4004,6144,2048,ck,0,0,92.4049,a8w8_blockscale_1x128x128_256x128x128x128_16x16_32x32_2x2_8x32x1_8x32x1_1x32x1x8_8_1x1_intrawave_v3,1090.46,757.37,0.0
256,4100,6144,2048,ck,0,0,97.0989,a8w8_blockscale_1x128x128_256x128x128x128_16x16_32x32_2x2_8x32x1_8x32x1_1x32x1x8_8_1x1_intrawave_v3,1062.63,734.93,0.0
256,4108,6144,2048,ck,0,0,98.4965,a8w8_blockscale_1x128x128_256x128x128x128_16x16_32x32_2x2_8x32x1_8x32x1_1x32x1x8_8_1x1_intrawave_v3,1049.59,725.66,0.0
256,4121,6144,2048,ck,0,0,98.8425,a8w8_blockscale_1x128x128_256x128x128x128_16x16_32x32_2x2_8x32x1_8x32x1_1x32x1x8_8_1x1_intrawave_v3,1049.23,725.01,0.0
256,4123,6144,2048,ck,0,0,98.6665,a8w8_blockscale_1x128x128_256x128x128x128_16x16_32x32_2x2_8x32x1_8x32x1_1x32x1x8_8_1x1_intrawave_v3,1051.61,726.59,0.0
256,4149,6144,2048,ck,0,0,98.6625,a8w8_blockscale_1x128x128_256x128x128x128_16x16_32x32_2x2_8x32x1_8x32x1_1x32x1x8_8_1x1_intrawave_v3,1058.28,730.4,0.0
256,4204,6144,2048,ck,0,0,97.9118,a8w8_blockscale_1x128x128_256x128x128x128_16x16_32x32_2x2_8x32x1_8x32x1_1x32x1x8_8_1x1_intrawave_v3,1080.53,744.05,0.0
256,4223,6144,2048,ck,0,0,99.6155,a8w8_blockscale_1x128x128_256x128x128x128_16x16_32x32_2x2_8x32x1_8x32x1_1x32x1x8_8_1x1_intrawave_v3,1066.85,734.06,0.0
256,4229,6144,2048,ck,0,0,98.9985,a8w8_blockscale_1x128x128_256x128x128x128_16x16_32x32_2x2_8x32x1_8x32x1_1x32x1x8_8_1x1_intrawave_v3,1075.03,739.5,0.0
256,4379,6144,2048,ck,0,0,99.1038,a8w8_blockscale_1x128x128_256x128x128x128_16x16_32x32_2x2_8x32x1_8x32x1_1x32x1x8_8_1x1_intrawave_v3,1111.98,760.42,0.0
256,4410,6144,2048,ck,0,0,101.8042,a8w8_blockscale_1x128x128_256x128x128x128_16x16_32x32_2x2_8x32x1_8x32x1_1x32x1x8_8_1x1_intrawave_v3,1090.14,744.61,0.0
256,4498,6144,2048,ck,0,0,101.8498,a8w8_blockscale_1x128x128_256x128x128x128_16x16_32x32_2x2_8x32x1_8x32x1_1x32x1x8_8_1x1_intrawave_v3,1111.4,756.67,0.0
256,4585,6144,2048,ck,0,0,101.7846,a8w8_blockscale_1x128x128_256x128x128x128_16x16_32x32_2x2_8x32x1_8x32x1_1x32x1x8_8_1x1_intrawave_v3,1133.62,769.4,0.0
256,4586,6144,2048,ck,0,0,101.6474,a8w8_blockscale_1x128x128_256x128x128x128_16x16_32x32_2x2_8x32x1_8x32x1_1x32x1x8_8_1x1_intrawave_v3,1135.4,770.58,0.0
256,4723,6144,2048,ck,0,0,102.4674,a8w8_blockscale_1x128x128_256x128x128x128_16x16_32x32_2x2_8x32x1_8x32x1_1x32x1x8_8_1x1_intrawave_v3,1159.96,783.58,0.0
256,4743,6144,2048,ck,0,0,111.4991,a8w8_blockscale_1x128x128_256x128x128x128_16x16_32x32_2x2_8x32x1_8x32x1_1x32x1x8_8_1x1_intrawave_v3,1070.52,722.68,0.0
256,4822,6144,2048,ck,0,0,112.7819,a8w8_blockscale_1x128x128_256x128x128x128_16x16_32x32_2x2_8x32x1_8x32x1_1x32x1x8_8_1x1_intrawave_v3,1075.97,724.51,0.0
256,4898,6144,2048,ck,0,0,111.5255,a8w8_blockscale_1x128x128_256x128x128x128_16x16_32x32_2x2_8x32x1_8x32x1_1x32x1x8_8_1x1_intrawave_v3,1105.24,742.44,0.0
256,4936,6144,2048,ck,0,0,111.3083,a8w8_blockscale_1x128x128_256x128x128x128_16x16_32x32_2x2_8x32x1_8x32x1_1x32x1x8_8_1x1_intrawave_v3,1115.99,748.78,0.0
256,4992,6144,2048,ck,0,0,109.8263,a8w8_blockscale_1x128x128_256x128x128x128_16x16_32x32_2x2_8x32x1_8x32x1_1x32x1x8_8_1x1_intrawave_v3,1143.88,766.19,0.0
256,5000,6144,2048,ck,0,0,112.4279,a8w8_blockscale_1x128x128_256x128x128x128_16x16_32x32_2x2_8x32x1_8x32x1_1x32x1x8_8_1x1_intrawave_v3,1119.2,749.48,0.0
256,5001,6144,2048,ck,0,0,110.9855,a8w8_blockscale_1x128x128_256x128x128x128_16x16_32x32_2x2_8x32x1_8x32x1_1x32x1x8_8_1x1_intrawave_v3,1133.97,759.35,0.0
256,5002,6144,2048,ck,0,0,111.7875,a8w8_blockscale_1x128x128_256x128x128x128_16x16_32x32_2x2_8x32x1_8x32x1_1x32x1x8_8_1x1_intrawave_v3,1126.06,754.03,0.0
256,5003,6144,2048,ck,0,0,113.0363,a8w8_blockscale_1x128x128_256x128x128x128_16x16_32x32_2x2_8x32x1_8x32x1_1x32x1x8_8_1x1_intrawave_v3,1113.84,745.83,0.0
256,5004,6144,2048,ck,0,0,115.1256,a8w8_blockscale_1x128x128_256x128x128x128_16x16_32x32_2x2_8x32x1_8x32x1_1x32x1x8_8_1x1_intrawave_v3,1093.85,732.42,0.0
256,5005,6144,2048,ck,0,0,113.1651,a8w8_blockscale_1x128x128_256x128x128x128_16x16_32x32_2x2_8x32x1_8x32x1_1x32x1x8_8_1x1_intrawave_v3,1113.02,745.23,0.0
256,5006,6144,2048,ck,0,0,111.3671,a8w8_blockscale_1x128x128_256x128x128x128_16x16_32x32_2x2_8x32x1_8x32x1_1x32x1x8_8_1x1_intrawave_v3,1131.21,757.4,0.0
256,5010,6144,2048,ck,0,0,111.2195,a8w8_blockscale_1x128x128_256x128x128x128_16x16_32x32_2x2_8x32x1_8x32x1_1x32x1x8_8_1x1_intrawave_v3,1133.62,758.92,0.0
256,5011,6144,2048,ck,0,0,112.1595,a8w8_blockscale_1x128x128_256x128x128x128_16x16_32x32_2x2_8x32x1_8x32x1_1x32x1x8_8_1x1_intrawave_v3,1124.34,752.68,0.0
256,5012,6144,2048,ck,0,0,110.8591,a8w8_blockscale_1x128x128_256x128x128x128_16x16_32x32_2x2_8x32x1_8x32x1_1x32x1x8_8_1x1_intrawave_v3,1137.76,761.64,0.0
256,5026,6144,2048,ck,0,0,114.9943,a8w8_blockscale_1x128x128_256x128x128x128_16x16_32x32_2x2_8x32x1_8x32x1_1x32x1x8_8_1x1_intrawave_v3,1099.91,736.0,0.0
256,5028,6144,2048,ck,0,0,111.2711,a8w8_blockscale_1x128x128_256x128x128x128_16x16_32x32_2x2_8x32x1_8x32x1_1x32x1x8_8_1x1_intrawave_v3,1137.17,760.88,0.0
256,5030,6144,2048,ck,0,0,111.2747,a8w8_blockscale_1x128x128_256x128x128x128_16x16_32x32_2x2_8x32x1_8x32x1_1x32x1x8_8_1x1_intrawave_v3,1137.58,761.12,0.0
256,5031,6144,2048,ck,0,0,112.9627,a8w8_blockscale_1x128x128_256x128x128x128_16x16_32x32_2x2_8x32x1_8x32x1_1x32x1x8_8_1x1_intrawave_v3,1120.81,749.87,0.0
256,5060,6144,2048,ck,0,0,111.5727,a8w8_blockscale_1x128x128_256x128x128x128_16x16_32x32_2x2_8x32x1_8x32x1_1x32x1x8_8_1x1_intrawave_v3,1141.31,762.94,0.0
256,5062,6144,2048,ck,0,0,112.5303,a8w8_blockscale_1x128x128_256x128x128x128_16x16_32x32_2x2_8x32x1_8x32x1_1x32x1x8_8_1x1_intrawave_v3,1132.05,756.7,0.0
256,5063,6144,2048,ck,0,0,112.4855,a8w8_blockscale_1x128x128_256x128x128x128_16x16_32x32_2x2_8x32x1_8x32x1_1x32x1x8_8_1x1_intrawave_v3,1132.72,757.13,0.0
256,5091,6144,2048,ck,0,0,112.9755,a8w8_blockscale_1x128x128_256x128x128x128_16x16_32x32_2x2_8x32x1_8x32x1_1x32x1x8_8_1x1_intrawave_v3,1134.04,757.4,0.0
256,5105,6144,2048,ck,0,0,112.6659,a8w8_blockscale_1x128x128_256x128x128x128_16x16_32x32_2x2_8x32x1_8x32x1_1x32x1x8_8_1x1_intrawave_v3,1140.29,761.26,0.0
256,5120,6144,2048,ck,0,0,109.8742,a8w8_blockscale_1x128x128_256x128x128x128_16x16_32x32_2x2_8x32x1_8x32x1_1x32x1x8_8_1x1_intrawave_v3,1172.7,782.56,0.0
256,5122,6144,2048,ck,0,0,113.5367,a8w8_blockscale_1x128x128_256x128x128x128_16x16_32x32_2x2_8x32x1_8x32x1_1x32x1x8_8_1x1_intrawave_v3,1135.31,757.57,0.0
256,5123,6144,2048,ck,0,0,112.6607,a8w8_blockscale_1x128x128_256x128x128x128_16x16_32x32_2x2_8x32x1_8x32x1_1x32x1x8_8_1x1_intrawave_v3,1144.36,763.59,0.0
256,5124,6144,2048,ck,0,0,114.2847,a8w8_blockscale_1x128x128_256x128x128x128_16x16_32x32_2x2_8x32x1_8x32x1_1x32x1x8_8_1x1_intrawave_v3,1128.32,752.86,0.0
256,5127,6144,2048,ck,0,0,114.7087,a8w8_blockscale_1x128x128_256x128x128x128_16x16_32x32_2x2_8x32x1_8x32x1_1x32x1x8_8_1x1_intrawave_v3,1124.81,750.45,0.0
256,5177,6144,2048,ck,0,0,114.2475,a8w8_blockscale_1x128x128_256x128x128x128_16x16_32x32_2x2_8x32x1_8x32x1_1x32x1x8_8_1x1_intrawave_v3,1140.36,759.76,0.0
256,5183,6144,2048,ck,0,0,114.0199,a8w8_blockscale_1x128x128_256x128x128x128_16x16_32x32_2x2_8x32x1_8x32x1_1x32x1x8_8_1x1_intrawave_v3,1143.96,762.03,0.0
256,5252,6144,2048,ck,0,0,118.9979,a8w8_blockscale_1x128x128_256x128x128x128_16x16_32x32_2x2_8x32x1_8x32x1_1x32x1x8_8_1x1_intrawave_v3,1110.7,738.46,0.0
256,5255,6144,2048,ck,0,0,116.9383,a8w8_blockscale_1x128x128_256x128x128x128_16x16_32x32_2x2_8x32x1_8x32x1_1x32x1x8_8_1x1_intrawave_v3,1130.91,751.84,0.0
256,5361,6144,2048,ck,0,0,115.3295,a8w8_blockscale_1x128x128_256x128x128x128_16x16_32x32_2x2_8x32x1_8x32x1_1x32x1x8_8_1x1_intrawave_v3,1169.81,775.5,0.0
256,5427,6144,2048,ck,0,0,123.9004,a8w8_blockscale_1x128x128_256x128x128x128_16x16_32x32_2x2_8x32x1_8x32x1_1x32x1x8_8_1x1_intrawave_v3,1102.3,729.49,0.0
256,5471,6144,2048,ck,0,0,123.6444,a8w8_blockscale_1x128x128_256x128x128x128_16x16_32x32_2x2_8x32x1_8x32x1_1x32x1x8_8_1x1_intrawave_v3,1113.53,736.1,0.0
256,5534,6144,2048,ck,0,0,123.3568,a8w8_blockscale_1x128x128_256x128x128x128_16x16_32x32_2x2_8x32x1_8x32x1_1x32x1x8_8_1x1_intrawave_v3,1128.98,745.14,0.0
256,5564,6144,2048,ck,0,0,126.2568,a8w8_blockscale_1x128x128_256x128x128x128_16x16_32x32_2x2_8x32x1_8x32x1_1x32x1x8_8_1x1_intrawave_v3,1109.03,731.43,0.0
256,5671,6144,2048,ck,0,0,125.1812,a8w8_blockscale_1x128x128_256x128x128x128_16x16_32x32_2x2_8x32x1_8x32x1_1x32x1x8_8_1x1_intrawave_v3,1140.07,749.97,0.0
256,5927,6144,2048,ck,0,0,127.3308,a8w8_blockscale_1x128x128_256x128x128x128_16x16_32x32_2x2_8x32x1_8x32x1_1x32x1x8_8_1x1_intrawave_v3,1171.42,766.13,0.0
256,5954,6144,2048,ck,0,0,127.0892,a8w8_blockscale_1x128x128_256x128x128x128_16x16_32x32_2x2_8x32x1_8x32x1_1x32x1x8_8_1x1_intrawave_v3,1178.99,770.64,0.0
256,6000,6144,2048,ck,0,0,127.4384,a8w8_blockscale_1x128x128_256x128x128x128_16x16_32x32_2x2_8x32x1_8x32x1_1x32x1x8_8_1x1_intrawave_v3,1184.85,773.7,0.0
256,6002,6144,2048,ck,0,0,128.1124,a8w8_blockscale_1x128x128_256x128x128x128_16x16_32x32_2x2_8x32x1_8x32x1_1x32x1x8_8_1x1_intrawave_v3,1179.01,769.85,0.0
256,6146,6144,2048,ck,0,0,138.3829,a8w8_blockscale_1x128x128_256x128x128x128_16x16_32x32_2x2_8x32x1_8x32x1_1x32x1x8_8_1x1_intrawave_v3,1117.69,727.63,0.0
256,6194,6144,2048,ck,0,0,135.0733,a8w8_blockscale_1x128x128_256x128x128x128_16x16_32x32_2x2_8x32x1_8x32x1_1x32x1x8_8_1x1_intrawave_v3,1154.02,750.56,0.0
256,6227,6144,2048,ck,0,0,135.6417,a8w8_blockscale_1x128x128_256x128x128x128_16x16_32x32_2x2_8x32x1_8x32x1_1x32x1x8_8_1x1_intrawave_v3,1155.31,750.9,0.0
256,6229,6144,2048,ck,0,0,138.04,a8w8_blockscale_1x128x128_256x128x128x128_16x16_32x32_2x2_8x32x1_8x32x1_1x32x1x8_8_1x1_intrawave_v3,1135.6,738.06,0.0
256,6234,6144,2048,ck,0,0,136.6684,a8w8_blockscale_1x128x128_256x128x128x128_16x16_32x32_2x2_8x32x1_8x32x1_1x32x1x8_8_1x1_intrawave_v3,1147.92,745.99,0.0
256,6246,6144,2048,ck,0,0,136.1276,a8w8_blockscale_1x128x128_256x128x128x128_16x16_32x32_2x2_8x32x1_8x32x1_1x32x1x8_8_1x1_intrawave_v3,1154.69,750.22,0.0
256,6304,6144,2048,ck,0,0,139.9457,a8w8_blockscale_1x128x128_256x128x128x128_16x16_32x32_2x2_8x32x1_8x32x1_1x32x1x8_8_1x1_intrawave_v3,1133.62,735.69,0.0
256,6314,6144,2048,ck,0,0,137.9104,a8w8_blockscale_1x128x128_256x128x128x128_16x16_32x32_2x2_8x32x1_8x32x1_1x32x1x8_8_1x1_intrawave_v3,1152.18,747.59,0.0
256,6318,6144,2048,ck,0,0,136.49,a8w8_blockscale_1x128x128_256x128x128x128_16x16_32x32_2x2_8x32x1_8x32x1_1x32x1x8_8_1x1_intrawave_v3,1164.9,755.79,0.0
256,6341,6144,2048,ck,0,0,136.586,a8w8_blockscale_1x128x128_256x128x128x128_16x16_32x32_2x2_8x32x1_8x32x1_1x32x1x8_8_1x1_intrawave_v3,1168.32,757.67,0.0
256,6377,6144,2048,ck,0,0,138.2757,a8w8_blockscale_1x128x128_256x128x128x128_16x16_32x32_2x2_8x32x1_8x32x1_1x32x1x8_8_1x1_intrawave_v3,1160.6,752.15,0.0
256,6476,6144,2048,ck,0,0,141.4249,a8w8_blockscale_1x128x128_256x128x128x128_16x16_32x32_2x2_8x32x1_8x32x1_1x32x1x8_8_1x1_intrawave_v3,1152.37,745.43,0.0
256,6483,6144,2048,ck,0,0,141.8253,a8w8_blockscale_1x128x128_256x128x128x128_16x16_32x32_2x2_8x32x1_8x32x1_1x32x1x8_8_1x1_intrawave_v3,1150.36,744.04,0.0
256,6492,6144,2048,ck,0,0,138.9377,a8w8_blockscale_1x128x128_256x128x128x128_16x16_32x32_2x2_8x32x1_8x32x1_1x32x1x8_8_1x1_intrawave_v3,1175.9,760.43,0.0
256,6519,6144,2048,ck,0,0,138.2177,a8w8_blockscale_1x128x128_256x128x128x128_16x16_32x32_2x2_8x32x1_8x32x1_1x32x1x8_8_1x1_intrawave_v3,1186.94,767.19,0.0
256,6609,6144,2048,ck,0,0,140.4593,a8w8_blockscale_1x128x128_256x128x128x128_16x16_32x32_2x2_8x32x1_8x32x1_1x32x1x8_8_1x1_intrawave_v3,1184.12,764.13,0.0
256,6811,6144,2048,ck,0,0,147.9205,a8w8_blockscale_1x128x128_256x128x128x128_16x16_32x32_2x2_8x32x1_8x32x1_1x32x1x8_8_1x1_intrawave_v3,1158.76,745.17,0.0
256,6813,6144,2048,ck,0,0,148.9429,a8w8_blockscale_1x128x128_256x128x128x128_16x16_32x32_2x2_8x32x1_8x32x1_1x32x1x8_8_1x1_intrawave_v3,1151.14,740.24,0.0
256,6818,6144,2048,ck,0,0,145.7373,a8w8_blockscale_1x128x128_256x128x128x128_16x16_32x32_2x2_8x32x1_8x32x1_1x32x1x8_8_1x1_intrawave_v3,1177.33,757.02,0.0
256,6830,6144,2048,ck,0,0,148.5693,a8w8_blockscale_1x128x128_256x128x128x128_16x16_32x32_2x2_8x32x1_8x32x1_1x32x1x8_8_1x1_intrawave_v3,1156.92,743.75,0.0
256,7001,6144,2048,ck,0,0,148.1705,a8w8_blockscale_1x128x128_256x128x128x128_16x16_32x32_2x2_8x32x1_8x32x1_1x32x1x8_8_1x1_intrawave_v3,1189.08,762.29,0.0
256,7025,6144,2048,ck,0,0,148.747,a8w8_blockscale_1x128x128_256x128x128x128_16x16_32x32_2x2_8x32x1_8x32x1_1x32x1x8_8_1x1_intrawave_v3,1188.53,761.65,0.0
256,7121,6144,2048,ck,0,0,149.4881,a8w8_blockscale_1x128x128_256x128x128x128_16x16_32x32_2x2_8x32x1_8x32x1_1x32x1x8_8_1x1_intrawave_v3,1198.8,767.08,0.0
256,7169,6144,2048,ck,0,0,151.3859,a8w8_blockscale_1x128x128_256x128x128x128_16x16_32x32_2x2_8x32x1_8x32x1_1x32x1x8_8_1x1_intrawave_v3,1191.75,762.01,0.0
256,7177,6144,2048,ck,0,0,150.7807,a8w8_blockscale_1x128x128_256x128x128x128_16x16_32x32_2x2_8x32x1_8x32x1_1x32x1x8_8_1x1_intrawave_v3,1197.87,765.83,0.0
256,7217,6144,2048,ck,0,0,152.6876,a8w8_blockscale_1x128x128_256x128x128x128_16x16_32x32_2x2_8x32x1_8x32x1_1x32x1x8_8_1x1_intrawave_v3,1189.5,760.02,0.0
256,7223,6144,2048,ck,0,0,151.6715,a8w8_blockscale_1x128x128_256x128x128x128_16x16_32x32_2x2_8x32x1_8x32x1_1x32x1x8_8_1x1_intrawave_v3,1198.46,765.68,0.0
256,7238,6144,2048,ck,0,0,150.6751,a8w8_blockscale_1x128x128_256x128x128x128_16x16_32x32_2x2_8x32x1_8x32x1_1x32x1x8_8_1x1_intrawave_v3,1208.89,772.17,0.0
256,7246,6144,2048,ck,0,0,149.419,a8w8_blockscale_1x128x128_256x128x128x128_16x16_32x32_2x2_8x32x1_8x32x1_1x32x1x8_8_1x1_intrawave_v3,1220.4,779.43,0.0
256,7249,6144,2048,ck,0,0,150.6281,a8w8_blockscale_1x128x128_256x128x128x128_16x16_32x32_2x2_8x32x1_8x32x1_1x32x1x8_8_1x1_intrawave_v3,1211.11,773.46,0.0
256,7316,6144,2048,ck,0,0,151.4982,a8w8_blockscale_1x128x128_256x128x128x128_16x16_32x32_2x2_8x32x1_8x32x1_1x32x1x8_8_1x1_intrawave_v3,1215.28,775.36,0.0
256,7393,6144,2048,ck,0,0,152.4907,a8w8_blockscale_1x128x128_256x128x128x128_16x16_32x32_2x2_8x32x1_8x32x1_1x32x1x8_8_1x1_intrawave_v3,1220.08,777.55,0.0
256,7491,6144,2048,ck,0,0,159.1513,a8w8_blockscale_1x128x128_256x128x128x128_16x16_32x32_2x2_8x32x1_8x32x1_1x32x1x8_8_1x1_intrawave_v3,1184.52,753.84,0.0
256,7558,6144,2048,ck,0,0,159.7911,a8w8_blockscale_1x128x128_256x128x128x128_16x16_32x32_2x2_8x32x1_8x32x1_1x32x1x8_8_1x1_intrawave_v3,1190.32,756.83,0.0
256,7650,6144,2048,ck,0,0,160.3427,a8w8_blockscale_1x128x128_256x128x128x128_16x16_32x32_2x2_8x32x1_8x32x1_1x32x1x8_8_1x1_intrawave_v3,1200.67,762.45,0.0
256,7753,6144,2048,ck,0,0,159.7502,a8w8_blockscale_1x128x128_256x128x128x128_16x16_32x32_2x2_8x32x1_8x32x1_1x32x1x8_8_1x1_intrawave_v3,1221.35,774.52,0.0
256,7774,6144,2048,ck,0,0,161.1867,a8w8_blockscale_1x128x128_256x128x128x128_16x16_32x32_2x2_8x32x1_8x32x1_1x32x1x8_8_1x1_intrawave_v3,1213.74,769.49,0.0
256,7815,6144,2048,ck,0,0,165.2188,a8w8_blockscale_1x128x128_256x128x128x128_16x16_32x32_2x2_8x32x1_8x32x1_1x32x1x8_8_1x1_intrawave_v3,1190.37,754.26,0.0
256,7834,6144,2048,ck,0,0,164.6018,a8w8_blockscale_1x128x128_256x128x128x128_16x16_32x32_2x2_8x32x1_8x32x1_1x32x1x8_8_1x1_intrawave_v3,1197.73,758.75,0.0
256,7836,6144,2048,ck,0,0,165.3321,a8w8_blockscale_1x128x128_256x128x128x128_16x16_32x32_2x2_8x32x1_8x32x1_1x32x1x8_8_1x1_intrawave_v3,1192.75,755.57,0.0
256,7871,6144,2048,ck,0,0,163.0956,a8w8_blockscale_1x128x128_256x128x128x128_16x16_32x32_2x2_8x32x1_8x32x1_1x32x1x8_8_1x1_intrawave_v3,1214.5,769.01,0.0
256,7899,6144,2048,ck,0,0,162.5142,a8w8_blockscale_1x128x128_256x128x128x128_16x16_32x32_2x2_8x32x1_8x32x1_1x32x1x8_8_1x1_intrawave_v3,1223.18,774.23,0.0
256,7913,6144,2048,ck,0,0,163.8342,a8w8_blockscale_1x128x128_256x128x128x128_16x16_32x32_2x2_8x32x1_8x32x1_1x32x1x8_8_1x1_intrawave_v3,1215.48,769.21,0.0
256,7930,6144,2048,ck,0,0,164.5881,a8w8_blockscale_1x128x128_256x128x128x128_16x16_32x32_2x2_8x32x1_8x32x1_1x32x1x8_8_1x1_intrawave_v3,1212.51,767.17,0.0
256,7961,6144,2048,ck,0,0,164.4769,a8w8_blockscale_1x128x128_256x128x128x128_16x16_32x32_2x2_8x32x1_8x32x1_1x32x1x8_8_1x1_intrawave_v3,1218.07,770.39,0.0
256,7963,6144,2048,ck,0,0,162.6022,a8w8_blockscale_1x128x128_256x128x128x128_16x16_32x32_2x2_8x32x1_8x32x1_1x32x1x8_8_1x1_intrawave_v3,1232.43,779.45,0.0
256,7974,6144,2048,ck,0,0,163.193,a8w8_blockscale_1x128x128_256x128x128x128_16x16_32x32_2x2_8x32x1_8x32x1_1x32x1x8_8_1x1_intrawave_v3,1229.66,777.6,0.0
256,8016,6144,2048,ck,0,0,164.0596,a8w8_blockscale_1x128x128_256x128x128x128_16x16_32x32_2x2_8x32x1_8x32x1_1x32x1x8_8_1x1_intrawave_v3,1229.61,777.16,0.0
256,8017,6144,2048,ck,0,0,165.0607,a8w8_blockscale_1x128x128_256x128x128x128_16x16_32x32_2x2_8x32x1_8x32x1_1x32x1x8_8_1x1_intrawave_v3,1222.3,772.53,0.0
256,8103,6144,2048,ck,0,0,166.3697,a8w8_blockscale_1x128x128_256x128x128x128_16x16_32x32_2x2_8x32x1_8x32x1_1x32x1x8_8_1x1_intrawave_v3,1225.7,773.86,0.0
256,8128,6144,2048,ck,0,0,167.2688,a8w8_blockscale_1x128x128_256x128x128x128_16x16_32x32_2x2_8x32x1_8x32x1_1x32x1x8_8_1x1_intrawave_v3,1222.87,771.85,0.0
256,8129,6144,2048,ck,0,0,167.0944,a8w8_blockscale_1x128x128_256x128x128x128_16x16_32x32_2x2_8x32x1_8x32x1_1x32x1x8_8_1x1_intrawave_v3,1224.3,772.74,0.0
256,8150,6144,2048,ck,0,0,168.8665,a8w8_blockscale_1x128x128_256x128x128x128_16x16_32x32_2x2_8x32x1_8x32x1_1x32x1x8_8_1x1_intrawave_v3,1214.58,766.41,0.0
256,8184,6144,2048,ck,0,0,166.8938,a8w8_blockscale_1x128x128_256x128x128x128_16x16_32x32_2x2_8x32x1_8x32x1_1x32x1x8_8_1x1_intrawave_v3,1234.06,778.39,0.0
256,8185,6144,2048,ck,0,0,169.7521,a8w8_blockscale_1x128x128_256x128x128x128_16x16_32x32_2x2_8x32x1_8x32x1_1x32x1x8_8_1x1_intrawave_v3,1213.43,765.37,0.0
256,8192,6144,2048,ck,0,0,164.4257,a8w8_blockscale_1x128x128_256x128x128x128_16x16_32x32_2x2_8x32x1_8x32x1_1x32x1x8_8_1x1_intrawave_v3,1253.81,790.77,0.0
256,1,9216,2048,ck,8,3,7.7418,a8w8_blockscale_1x128x128_256x16x64x256_16x16_16x16_1x1_16x16x1_16x16x1_1x16x1x16_4_1x1_intrawave_v1,4.88,2440.63,0.0
256,2,9216,2048,ck,6,3,8.0159,a8w8_blockscale_1x128x128_256x16x64x128_8x16_16x16_1x1_16x16x1_8x32x1_1x16x1x16_4_1x1_intrawave_v1,9.42,2359.73,0.0
256,4,9216,2048,ck,8,3,7.6137,a8w8_blockscale_1x128x128_256x16x64x256_16x16_16x16_1x1_16x16x1_16x16x1_1x16x1x16_4_1x1_intrawave_v1,19.83,2489.76,0.0
256,8,9216,2048,ck,8,0,8.1256,a8w8_blockscale_1x128x128_256x16x64x256_16x16_16x16_1x1_16x16x1_16x16x1_1x16x1x16_4_1x1_intrawave_v1,37.17,2342.99,0.0
256,16,9216,2048,ck,6,2,8.5778,a8w8_blockscale_1x128x128_256x16x64x128_8x16_16x16_1x1_16x16x1_8x32x1_1x16x1x16_4_1x1_intrawave_v1,70.41,2238.57,0.0
256,32,9216,2048,ck,7,0,9.7676,a8w8_blockscale_1x128x128_256x16x128x256_16x16_16x16_1x2_16x16x1_16x16x1_1x16x1x16_8_1x2_intrawave_v1,123.67,1999.44,0.0
256,48,9216,2048,ck,7,0,9.9036,a8w8_blockscale_1x128x128_256x16x128x256_16x16_16x16_1x2_16x16x1_16x16x1_1x16x1x16_8_1x2_intrawave_v1,182.96,2005.07,0.0
256,64,9216,2048,ck,18,0,10.1043,a8w8_blockscale_1x128x128_256x64x64x256_16x16_32x32_1x1_16x16x1_16x16x1_1x32x1x8_8_1x1_intrawave_v1,239.1,1997.67,0.0
256,80,9216,2048,ck,12,0,12.2217,a8w8_blockscale_1x128x128_256x32x128x256_16x16_32x32_1x1_16x16x1_16x16x1_1x32x1x8_8_1x1_intrawave_v1,247.09,1678.39,0.0
256,96,9216,2048,ck,12,0,12.2104,a8w8_blockscale_1x128x128_256x32x128x256_16x16_32x32_1x1_16x16x1_16x16x1_1x32x1x8_8_1x1_intrawave_v1,296.79,1706.78,0.0
256,112,9216,2048,ck,5,0,15.1272,a8w8_blockscale_1x128x128_256x16x128x128_8x16_16x16_1x2_16x16x1_8x32x1_1x16x1x16_8_1x2_intrawave_v1,279.49,1399.34,0.0
256,128,9216,2048,ck,2,0,15.5563,a8w8_blockscale_1x128x128_256x64x128x128_16x16_32x32_1x2_8x32x1_8x32x1_1x32x1x8_8_1x1_intrawave_v3,310.6,1381.81,0.0
256,256,9216,2048,ck,0,0,19.3439,a8w8_blockscale_1x128x128_256x128x128x128_16x16_32x32_2x2_8x32x1_8x32x1_1x32x1x8_8_1x1_intrawave_v3,499.57,1246.76,0.0
256,512,9216,2048,ck,2,0,29.6006,a8w8_blockscale_1x128x128_256x64x128x128_16x16_32x32_1x2_8x32x1_8x32x1_1x32x1x8_8_1x1_intrawave_v3,652.94,991.88,0.0
256,667,9216,2048,ck,0,0,32.2503,a8w8_blockscale_1x128x128_256x128x128x128_16x16_32x32_2x2_8x32x1_8x32x1_1x32x1x8_8_1x1_intrawave_v3,780.72,1008.81,0.0
256,671,9216,2048,ck,0,0,32.6182,a8w8_blockscale_1x128x128_256x128x128x128_16x16_32x32_2x2_8x32x1_8x32x1_1x32x1x8_8_1x1_intrawave_v3,776.54,999.95,0.0
256,931,9216,2048,ck,2,0,45.9137,a8w8_blockscale_1x128x128_256x64x128x128_16x16_32x32_1x2_8x32x1_8x32x1_1x32x1x8_8_1x1_intrawave_v3,765.44,826.36,0.0
256,1024,9216,2048,ck,0,0,45.9371,a8w8_blockscale_1x128x128_256x128x128x128_16x16_32x32_2x2_8x32x1_8x32x1_1x32x1x8_8_1x1_intrawave_v3,841.47,867.4,0.0
256,1025,9216,2048,ck,0,0,46.5125,a8w8_blockscale_1x128x128_256x128x128x128_16x16_32x32_2x2_8x32x1_8x32x1_1x32x1x8_8_1x1_intrawave_v3,831.87,857.11,0.0
256,1027,9216,2048,ck,0,0,46.5837,a8w8_blockscale_1x128x128_256x128x128x128_16x16_32x32_2x2_8x32x1_8x32x1_1x32x1x8_8_1x1_intrawave_v3,832.22,856.68,0.0
256,1031,9216,2048,ck,0,0,46.3442,a8w8_blockscale_1x128x128_256x128x128x128_16x16_32x32_2x2_8x32x1_8x32x1_1x32x1x8_8_1x1_intrawave_v3,839.78,862.87,0.0
256,1039,9216,2048,ck,0,0,46.8653,a8w8_blockscale_1x128x128_256x128x128x128_16x16_32x32_2x2_8x32x1_8x32x1_1x32x1x8_8_1x1_intrawave_v3,836.89,856.78,0.0
256,1040,9216,2048,ck,0,0,46.7814,a8w8_blockscale_1x128x128_256x128x128x128_16x16_32x32_2x2_8x32x1_8x32x1_1x32x1x8_8_1x1_intrawave_v3,839.19,858.75,0.0
256,1041,9216,2048,ck,0,0,47.3703,a8w8_blockscale_1x128x128_256x128x128x128_16x16_32x32_2x2_8x32x1_8x32x1_1x32x1x8_8_1x1_intrawave_v3,829.56,848.51,0.0
256,1072,9216,2048,ck,0,0,47.085,a8w8_blockscale_1x128x128_256x128x128x128_16x16_32x32_2x2_8x32x1_8x32x1_1x32x1x8_8_1x1_intrawave_v3,859.44,867.13,0.0
256,1073,9216,2048,ck,0,0,46.3058,a8w8_blockscale_1x128x128_256x128x128x128_16x16_32x32_2x2_8x32x1_8x32x1_1x32x1x8_8_1x1_intrawave_v3,874.72,882.17,0.0
256,1077,9216,2048,ck,0,0,46.5578,a8w8_blockscale_1x128x128_256x128x128x128_16x16_32x32_2x2_8x32x1_8x32x1_1x32x1x8_8_1x1_intrawave_v3,873.22,879.15,0.0
256,1091,9216,2048,ck,0,0,46.6994,a8w8_blockscale_1x128x128_256x128x128x128_16x16_32x32_2x2_8x32x1_8x32x1_1x32x1x8_8_1x1_intrawave_v3,881.89,882.62,0.0
256,1343,9216,2048,ck,0,0,57.6088,a8w8_blockscale_1x128x128_256x128x128x128_16x16_32x32_2x2_8x32x1_8x32x1_1x32x1x8_8_1x1_intrawave_v3,880.01,805.07,0.0
256,1688,9216,2048,ck,0,0,61.0067,a8w8_blockscale_1x128x128_256x128x128x128_16x16_32x32_2x2_8x32x1_8x32x1_1x32x1x8_8_1x1_intrawave_v3,1044.47,876.04,0.0
256,2017,9216,2048,ck,0,0,75.2712,a8w8_blockscale_1x128x128_256x128x128x128_16x16_32x32_2x2_8x32x1_8x32x1_1x32x1x8_8_1x1_intrawave_v3,1011.53,799.54,0.0
256,2048,9216,2048,ck,0,0,75.1132,a8w8_blockscale_1x128x128_256x128x128x128_16x16_32x32_2x2_8x32x1_8x32x1_1x32x1x8_8_1x1_intrawave_v3,1029.24,809.68,0.0
256,2050,9216,2048,ck,0,0,76.0956,a8w8_blockscale_1x128x128_256x128x128x128_16x16_32x32_2x2_8x32x1_8x32x1_1x32x1x8_8_1x1_intrawave_v3,1016.94,799.76,0.0
256,2063,9216,2048,ck,0,0,76.3728,a8w8_blockscale_1x128x128_256x128x128x128_16x16_32x32_2x2_8x32x1_8x32x1_1x32x1x8_8_1x1_intrawave_v3,1019.68,800.35,0.0
256,2064,9216,2048,ck,0,0,77.1988,a8w8_blockscale_1x128x128_256x128x128x128_16x16_32x32_2x2_8x32x1_8x32x1_1x32x1x8_8_1x1_intrawave_v3,1009.26,792.05,0.0
256,2099,9216,2048,ck,0,0,76.27,a8w8_blockscale_1x128x128_256x128x128x128_16x16_32x32_2x2_8x32x1_8x32x1_1x32x1x8_8_1x1_intrawave_v3,1038.87,811.09,0.0
256,2159,9216,2048,ck,0,0,75.8068,a8w8_blockscale_1x128x128_256x128x128x128_16x16_32x32_2x2_8x32x1_8x32x1_1x32x1x8_8_1x1_intrawave_v3,1075.1,832.26,0.0
256,2160,9216,2048,ck,0,0,77.3328,a8w8_blockscale_1x128x128_256x128x128x128_16x16_32x32_2x2_8x32x1_8x32x1_1x32x1x8_8_1x1_intrawave_v3,1054.37,816.1,0.0
256,2313,9216,2048,ck,0,0,86.7801,a8w8_blockscale_1x128x128_256x128x128x128_16x16_32x32_2x2_8x32x1_8x32x1_1x32x1x8_8_1x1_intrawave_v3,1006.14,763.36,0.0
256,2325,9216,2048,ck,0,0,86.7697,a8w8_blockscale_1x128x128_256x128x128x128_16x16_32x32_2x2_8x32x1_8x32x1_1x32x1x8_8_1x1_intrawave_v3,1011.48,766.29,0.0
256,3072,9216,2048,ck,0,0,101.8322,a8w8_blockscale_1x128x128_256x128x128x128_16x16_32x32_2x2_8x32x1_8x32x1_1x32x1x8_8_1x1_intrawave_v3,1138.78,803.17,0.0
256,3073,9216,2048,ck,0,0,110.1818,a8w8_blockscale_1x128x128_256x128x128x128_16x16_32x32_2x2_8x32x1_8x32x1_1x32x1x8_8_1x1_intrawave_v3,1052.82,742.49,0.0
256,3182,9216,2048,ck,0,0,109.7659,a8w8_blockscale_1x128x128_256x128x128x128_16x16_32x32_2x2_8x32x1_8x32x1_1x32x1x8_8_1x1_intrawave_v3,1094.3,765.65,0.0
256,3183,9216,2048,ck,0,0,110.4782,a8w8_blockscale_1x128x128_256x128x128x128_16x16_32x32_2x2_8x32x1_8x32x1_1x32x1x8_8_1x1_intrawave_v3,1087.58,760.89,0.0
256,3847,9216,2048,ck,0,0,130.2142,a8w8_blockscale_1x128x128_256x128x128x128_16x16_32x32_2x2_8x32x1_8x32x1_1x32x1x8_8_1x1_intrawave_v3,1115.23,750.0,0.0
256,4096,9216,2048,ck,0,0,132.5416,a8w8_blockscale_1x128x128_256x128x128x128_16x16_32x32_2x2_8x32x1_8x32x1_1x32x1x8_8_1x1_intrawave_v3,1166.57,775.31,0.0
256,4111,9216,2048,ck,0,0,137.722,a8w8_blockscale_1x128x128_256x128x128x128_16x16_32x32_2x2_8x32x1_8x32x1_1x32x1x8_8_1x1_intrawave_v3,1126.8,748.37,0.0
256,4141,9216,2048,ck,0,0,139.1948,a8w8_blockscale_1x128x128_256x128x128x128_16x16_32x32_2x2_8x32x1_8x32x1_1x32x1x8_8_1x1_intrawave_v3,1123.01,744.87,0.0
256,4142,9216,2048,ck,0,0,138.8844,a8w8_blockscale_1x128x128_256x128x128x128_16x16_32x32_2x2_8x32x1_8x32x1_1x32x1x8_8_1x1_intrawave_v3,1125.79,746.68,0.0
256,4345,9216,2048,ck,0,0,142.2189,a8w8_blockscale_1x128x128_256x128x128x128_16x16_32x32_2x2_8x32x1_8x32x1_1x32x1x8_8_1x1_intrawave_v3,1153.28,758.41,0.0
256,5105,9216,2048,ck,0,0,162.1699,a8w8_blockscale_1x128x128_256x128x128x128_16x16_32x32_2x2_8x32x1_8x32x1_1x32x1x8_8_1x1_intrawave_v3,1188.3,761.08,0.0
256,5121,9216,2048,ck,0,0,159.9062,a8w8_blockscale_1x128x128_256x128x128x128_16x16_32x32_2x2_8x32x1_8x32x1_1x32x1x8_8_1x1_intrawave_v3,1208.9,773.91,0.0
256,5123,9216,2048,ck,0,0,159.1698,a8w8_blockscale_1x128x128_256x128x128x128_16x16_32x32_2x2_8x32x1_8x32x1_1x32x1x8_8_1x1_intrawave_v3,1214.97,777.74,0.0
256,5131,9216,2048,ck,0,0,160.5458,a8w8_blockscale_1x128x128_256x128x128x128_16x16_32x32_2x2_8x32x1_8x32x1_1x32x1x8_8_1x1_intrawave_v3,1206.44,772.1,0.0
256,5427,9216,2048,ck,0,0,171.9312,a8w8_blockscale_1x128x128_256x128x128x128_16x16_32x32_2x2_8x32x1_8x32x1_1x32x1x8_8_1x1_intrawave_v3,1191.54,756.23,0.0
256,6113,9216,2048,ck,0,0,188.0653,a8w8_blockscale_1x128x128_256x128x128x128_16x16_32x32_2x2_8x32x1_8x32x1_1x32x1x8_8_1x1_intrawave_v3,1227.01,766.06,0.0
256,6197,9216,2048,ck,0,0,187.1686,a8w8_blockscale_1x128x128_256x128x128x128_16x16_32x32_2x2_8x32x1_8x32x1_1x32x1x8_8_1x1_intrawave_v3,1249.83,778.92,0.0
256,6409,9216,2048,ck,0,0,193.8349,a8w8_blockscale_1x128x128_256x128x128x128_16x16_32x32_2x2_8x32x1_8x32x1_1x32x1x8_8_1x1_intrawave_v3,1248.13,774.53,0.0
256,7121,9216,2048,ck,0,0,211.3574,a8w8_blockscale_1x128x128_256x128x128x128_16x16_32x32_2x2_8x32x1_8x32x1_1x32x1x8_8_1x1_intrawave_v3,1271.82,779.31,0.0
256,7168,9216,2048,ck,0,0,206.0126,a8w8_blockscale_1x128x128_256x128x128x128_16x16_32x32_2x2_8x32x1_8x32x1_1x32x1x8_8_1x1_intrawave_v3,1313.43,804.2,0.0
256,7169,9216,2048,ck,0,0,216.312,a8w8_blockscale_1x128x128_256x128x128x128_16x16_32x32_2x2_8x32x1_8x32x1_1x32x1x8_8_1x1_intrawave_v3,1251.07,766.0,0.0
256,7172,9216,2048,ck,0,0,220.8748,a8w8_blockscale_1x128x128_256x128x128x128_16x16_32x32_2x2_8x32x1_8x32x1_1x32x1x8_8_1x1_intrawave_v3,1225.73,750.46,0.0
256,7176,9216,2048,ck,0,0,215.3385,a8w8_blockscale_1x128x128_256x128x128x128_16x16_32x32_2x2_8x32x1_8x32x1_1x32x1x8_8_1x1_intrawave_v3,1257.95,770.13,0.0
256,7177,9216,2048,ck,0,0,217.4065,a8w8_blockscale_1x128x128_256x128x128x128_16x16_32x32_2x2_8x32x1_8x32x1_1x32x1x8_8_1x1_intrawave_v3,1246.16,762.9,0.0
256,7178,9216,2048,ck,0,0,215.1629,a8w8_blockscale_1x128x128_256x128x128x128_16x16_32x32_2x2_8x32x1_8x32x1_1x32x1x8_8_1x1_intrawave_v3,1259.33,770.95,0.0
256,7179,9216,2048,ck,0,0,218.4937,a8w8_blockscale_1x128x128_256x128x128x128_16x16_32x32_2x2_8x32x1_8x32x1_1x32x1x8_8_1x1_intrawave_v3,1240.3,759.29,0.0
256,7183,9216,2048,ck,0,0,222.8568,a8w8_blockscale_1x128x128_256x128x128x128_16x16_32x32_2x2_8x32x1_8x32x1_1x32x1x8_8_1x1_intrawave_v3,1216.7,744.79,0.0
256,7184,9216,2048,ck,0,0,218.0821,a8w8_blockscale_1x128x128_256x128x128x128_16x16_32x32_2x2_8x32x1_8x32x1_1x32x1x8_8_1x1_intrawave_v3,1243.51,761.19,0.0
256,7209,9216,2048,ck,0,0,216.0045,a8w8_blockscale_1x128x128_256x128x128x128_16x16_32x32_2x2_8x32x1_8x32x1_1x32x1x8_8_1x1_intrawave_v3,1259.84,770.89,0.0
256,7210,9216,2048,ck,0,0,217.5382,a8w8_blockscale_1x128x128_256x128x128x128_16x16_32x32_2x2_8x32x1_8x32x1_1x32x1x8_8_1x1_intrawave_v3,1251.13,765.54,0.0
256,7211,9216,2048,ck,0,0,216.743,a8w8_blockscale_1x128x128_256x128x128x128_16x16_32x32_2x2_8x32x1_8x32x1_1x32x1x8_8_1x1_intrawave_v3,1255.89,768.45,0.0
256,7217,9216,2048,ck,0,0,222.7889,a8w8_blockscale_1x128x128_256x128x128x128_16x16_32x32_2x2_8x32x1_8x32x1_1x32x1x8_8_1x1_intrawave_v3,1222.83,748.15,0.0
256,7273,9216,2048,ck,0,0,217.9988,a8w8_blockscale_1x128x128_256x128x128x128_16x16_32x32_2x2_8x32x1_8x32x1_1x32x1x8_8_1x1_intrawave_v3,1259.39,769.85,0.0
256,7274,9216,2048,ck,0,0,218.3607,a8w8_blockscale_1x128x128_256x128x128x128_16x16_32x32_2x2_8x32x1_8x32x1_1x32x1x8_8_1x1_intrawave_v3,1257.48,768.66,0.0
256,7391,9216,2048,ck,0,0,222.7022,a8w8_blockscale_1x128x128_256x128x128x128_16x16_32x32_2x2_8x32x1_8x32x1_1x32x1x8_8_1x1_intrawave_v3,1252.8,764.44,0.0
256,7393,9216,2048,ck,0,0,218.0248,a8w8_blockscale_1x128x128_256x128x128x128_16x16_32x32_2x2_8x32x1_8x32x1_1x32x1x8_8_1x1_intrawave_v3,1280.02,781.03,0.0
256,7715,9216,2048,ck,0,0,228.6884,a8w8_blockscale_1x128x128_256x128x128x128_16x16_32x32_2x2_8x32x1_8x32x1_1x32x1x8_8_1x1_intrawave_v3,1273.49,773.44,0.0
256,7753,9216,2048,ck,0,0,230.0795,a8w8_blockscale_1x128x128_256x128x128x128_16x16_32x32_2x2_8x32x1_8x32x1_1x32x1x8_8_1x1_intrawave_v3,1272.02,772.15,0.0
256,7819,9216,2048,ck,0,0,231.7737,a8w8_blockscale_1x128x128_256x128x128x128_16x16_32x32_2x2_8x32x1_8x32x1_1x32x1x8_8_1x1_intrawave_v3,1273.47,772.34,0.0
256,8099,9216,2048,ck,0,0,238.3338,a8w8_blockscale_1x128x128_256x128x128x128_16x16_32x32_2x2_8x32x1_8x32x1_1x32x1x8_8_1x1_intrawave_v3,1282.77,775.14,0.0
256,8129,9216,2048,ck,0,0,242.1076,a8w8_blockscale_1x128x128_256x128x128x128_16x16_32x32_2x2_8x32x1_8x32x1_1x32x1x8_8_1x1_intrawave_v3,1267.45,765.59,0.0
256,8188,9216,2048,ck,0,0,240.815,a8w8_blockscale_1x128x128_256x128x128x128_16x16_32x32_2x2_8x32x1_8x32x1_1x32x1x8_8_1x1_intrawave_v3,1283.5,774.72,0.0
256,8192,9216,2048,ck,0,0,234.5889,a8w8_blockscale_1x128x128_256x128x128x128_16x16_32x32_2x2_8x32x1_8x32x1_1x32x1x8_8_1x1_intrawave_v3,1318.21,795.63,0.0
256,1,12288,2048,ck,8,0,8.5851,a8w8_blockscale_1x128x128_256x16x64x256_16x16_16x16_1x1_16x16x1_16x16x1_1x16x1x16_4_1x1_intrawave_v1,5.86,2934.44,0.0
256,2,12288,2048,ck,6,3,8.7498,a8w8_blockscale_1x128x128_256x16x64x128_8x16_16x16_1x1_16x16x1_8x32x1_1x16x1x16_4_1x1_intrawave_v1,11.5,2882.25,0.0
256,4,12288,2048,ck,8,2,8.2867,a8w8_blockscale_1x128x128_256x16x64x256_16x16_16x16_1x1_16x16x1_16x16x1_1x16x1x16_4_1x1_intrawave_v1,24.3,3049.74,0.0
256,8,12288,2048,ck,8,0,8.5399,a8w8_blockscale_1x128x128_256x16x64x256_16x16_16x16_1x1_16x16x1_16x16x1_1x16x1x16_4_1x1_intrawave_v1,47.15,2971.79,0.0
256,16,12288,2048,ck,8,0,8.9505,a8w8_blockscale_1x128x128_256x16x64x256_16x16_16x16_1x1_16x16x1_16x16x1_1x16x1x16_4_1x1_intrawave_v1,89.97,2859.26,0.0
256,32,12288,2048,ck,13,0,10.6618,a8w8_blockscale_1x128x128_256x32x64x256_16x16_16x16_2x1_16x16x1_16x16x1_1x32x1x8_8_2x1_intrawave_v1,151.06,2440.28,0.0
256,48,12288,2048,ck,18,0,11.7062,a8w8_blockscale_1x128x128_256x64x64x256_16x16_32x32_1x1_16x16x1_16x16x1_1x32x1x8_8_1x1_intrawave_v1,206.38,2258.95,0.0
256,64,12288,2048,ck,18,0,9.916,a8w8_blockscale_1x128x128_256x64x64x256_16x16_32x32_1x1_16x16x1_16x16x1_1x32x1x8_8_1x1_intrawave_v1,324.85,2709.74,0.0
256,80,12288,2048,ck,4,0,15.7428,a8w8_blockscale_1x128x128_256x16x256x128_8x16_16x16_1x4_16x16x1_8x32x1_1x16x1x16_8_1x2_intrawave_v1,255.77,1733.86,0.0
256,96,12288,2048,ck,2,0,15.8573,a8w8_blockscale_1x128x128_256x64x128x128_16x16_32x32_1x2_8x32x1_8x32x1_1x32x1x8_8_1x1_intrawave_v3,304.71,1748.2,0.0
256,112,12288,2048,ck,2,0,16.4329,a8w8_blockscale_1x128x128_256x64x128x128_16x16_32x32_1x2_8x32x1_8x32x1_1x32x1x8_8_1x1_intrawave_v3,343.04,1712.89,0.0
256,128,12288,2048,ck,2,0,15.7716,a8w8_blockscale_1x128x128_256x64x128x128_16x16_32x32_1x2_8x32x1_8x32x1_1x32x1x8_8_1x1_intrawave_v3,408.48,1811.72,0.0
256,256,12288,2048,ck,0,0,19.7819,a8w8_blockscale_1x128x128_256x128x128x128_16x16_32x32_2x2_8x32x1_8x32x1_1x32x1x8_8_1x1_intrawave_v3,651.35,1616.71,0.0
256,512,12288,2048,ck,2,0,31.3196,a8w8_blockscale_1x128x128_256x64x128x128_16x16_32x32_1x2_8x32x1_8x32x1_1x32x1x8_8_1x1_intrawave_v3,822.8,1238.76,0.0
256,667,12288,2048,ck,0,0,45.3117,a8w8_blockscale_1x128x128_256x128x128x128_16x16_32x32_2x2_8x32x1_8x32x1_1x32x1x8_8_1x1_intrawave_v3,740.89,947.31,0.0
256,671,12288,2048,ck,0,0,44.7189,a8w8_blockscale_1x128x128_256x128x128x128_16x16_32x32_2x2_8x32x1_8x32x1_1x32x1x8_8_1x1_intrawave_v3,755.22,962.24,0.0
256,931,12288,2048,ck,0,0,49.6185,a8w8_blockscale_1x128x128_256x128x128x128_16x16_32x32_2x2_8x32x1_8x32x1_1x32x1x8_8_1x1_intrawave_v3,944.38,1006.74,0.0
256,1024,12288,2048,ck,0,0,50.1853,a8w8_blockscale_1x128x128_256x128x128x128_16x16_32x32_2x2_8x32x1_8x32x1_1x32x1x8_8_1x1_intrawave_v3,1026.99,1044.7,0.0
256,1025,12288,2048,ck,0,0,58.8422,a8w8_blockscale_1x128x128_256x128x128x128_16x16_32x32_2x2_8x32x1_8x32x1_1x32x1x8_8_1x1_intrawave_v3,876.75,891.46,0.0
256,1027,12288,2048,ck,0,0,59.3258,a8w8_blockscale_1x128x128_256x128x128x128_16x16_32x32_2x2_8x32x1_8x32x1_1x32x1x8_8_1x1_intrawave_v3,871.3,885.09,0.0
256,1031,12288,2048,ck,0,0,59.0054,a8w8_blockscale_1x128x128_256x128x128x128_16x16_32x32_2x2_8x32x1_8x32x1_1x32x1x8_8_1x1_intrawave_v3,879.44,891.7,0.0
256,1039,12288,2048,ck,0,0,58.6319,a8w8_blockscale_1x128x128_256x128x128x128_16x16_32x32_2x2_8x32x1_8x32x1_1x32x1x8_8_1x1_intrawave_v3,891.91,901.01,0.0
256,1040,12288,2048,ck,0,0,59.2467,a8w8_blockscale_1x128x128_256x128x128x128_16x16_32x32_2x2_8x32x1_8x32x1_1x32x1x8_8_1x1_intrawave_v3,883.51,892.11,0.0
256,1041,12288,2048,ck,0,0,59.1683,a8w8_blockscale_1x128x128_256x128x128x128_16x16_32x32_2x2_8x32x1_8x32x1_1x32x1x8_8_1x1_intrawave_v3,885.53,893.75,0.0
256,1072,12288,2048,ck,0,0,59.1098,a8w8_blockscale_1x128x128_256x128x128x128_16x16_32x32_2x2_8x32x1_8x32x1_1x32x1x8_8_1x1_intrawave_v3,912.8,908.59,0.0
256,1073,12288,2048,ck,0,0,58.8068,a8w8_blockscale_1x128x128_256x128x128x128_16x16_32x32_2x2_8x32x1_8x32x1_1x32x1x8_8_1x1_intrawave_v3,918.36,913.73,0.0
256,1077,12288,2048,ck,0,0,59.6463,a8w8_blockscale_1x128x128_256x128x128x128_16x16_32x32_2x2_8x32x1_8x32x1_1x32x1x8_8_1x1_intrawave_v3,908.81,902.65,0.0
256,1091,12288,2048,ck,0,0,59.2419,a8w8_blockscale_1x128x128_256x128x128x128_16x16_32x32_2x2_8x32x1_8x32x1_1x32x1x8_8_1x1_intrawave_v3,926.91,915.11,0.0
256,1343,12288,2048,ck,0,0,72.3056,a8w8_blockscale_1x128x128_256x128x128x128_16x16_32x32_2x2_8x32x1_8x32x1_1x32x1x8_8_1x1_intrawave_v3,934.86,842.56,0.0
256,1688,12288,2048,ck,0,0,85.2381,a8w8_blockscale_1x128x128_256x128x128x128_16x16_32x32_2x2_8x32x1_8x32x1_1x32x1x8_8_1x1_intrawave_v3,996.74,822.49,0.0
256,2017,12288,2048,ck,0,0,91.8925,a8w8_blockscale_1x128x128_256x128x128x128_16x16_32x32_2x2_8x32x1_8x32x1_1x32x1x8_8_1x1_intrawave_v3,1104.76,858.25,0.0
256,2048,12288,2048,ck,0,0,91.2881,a8w8_blockscale_1x128x128_256x128x128x128_16x16_32x32_2x2_8x32x1_8x32x1_1x32x1x8_8_1x1_intrawave_v3,1129.16,872.97,0.0
256,2050,12288,2048,ck,0,0,100.933,a8w8_blockscale_1x128x128_256x128x128x128_16x16_32x32_2x2_8x32x1_8x32x1_1x32x1x8_8_1x1_intrawave_v3,1022.26,790.08,0.0
256,2063,12288,2048,ck,0,0,100.795,a8w8_blockscale_1x128x128_256x128x128x128_16x16_32x32_2x2_8x32x1_8x32x1_1x32x1x8_8_1x1_intrawave_v3,1030.15,794.59,0.0
256,2064,12288,2048,ck,0,0,100.867,a8w8_blockscale_1x128x128_256x128x128x128_16x16_32x32_2x2_8x32x1_8x32x1_1x32x1x8_8_1x1_intrawave_v3,1029.92,794.29,0.0
256,2099,12288,2048,ck,0,0,99.6402,a8w8_blockscale_1x128x128_256x128x128x128_16x16_32x32_2x2_8x32x1_8x32x1_1x32x1x8_8_1x1_intrawave_v3,1060.28,813.42,0.0
256,2159,12288,2048,ck,0,0,99.1094,a8w8_blockscale_1x128x128_256x128x128x128_16x16_32x32_2x2_8x32x1_8x32x1_1x32x1x8_8_1x1_intrawave_v3,1096.43,833.9,0.0
256,2160,12288,2048,ck,0,0,99.1099,a8w8_blockscale_1x128x128_256x128x128x128_16x16_32x32_2x2_8x32x1_8x32x1_1x32x1x8_8_1x1_intrawave_v3,1096.93,834.16,0.0
256,2313,12288,2048,ck,0,0,109.3643,a8w8_blockscale_1x128x128_256x128x128x128_16x16_32x32_2x2_8x32x1_8x32x1_1x32x1x8_8_1x1_intrawave_v3,1064.49,793.19,0.0
256,2325,12288,2048,ck,0,0,110.6391,a8w8_blockscale_1x128x128_256x128x128x128_16x16_32x32_2x2_8x32x1_8x32x1_1x32x1x8_8_1x1_intrawave_v3,1057.68,786.94,0.0
256,3072,12288,2048,ck,0,0,125.9676,a8w8_blockscale_1x128x128_256x128x128x128_16x16_32x32_2x2_8x32x1_8x32x1_1x32x1x8_8_1x1_intrawave_v3,1227.45,849.07,0.0
256,3073,12288,2048,ck,0,0,136.8356,a8w8_blockscale_1x128x128_256x128x128x128_16x16_32x32_2x2_8x32x1_8x32x1_1x32x1x8_8_1x1_intrawave_v3,1130.33,781.82,0.0
256,3182,12288,2048,ck,0,0,137.8141,a8w8_blockscale_1x128x128_256x128x128x128_16x16_32x32_2x2_8x32x1_8x32x1_1x32x1x8_8_1x1_intrawave_v3,1162.11,797.33,0.0
256,3183,12288,2048,ck,0,0,140.6281,a8w8_blockscale_1x128x128_256x128x128x128_16x16_32x32_2x2_8x32x1_8x32x1_1x32x1x8_8_1x1_intrawave_v3,1139.21,781.57,0.0
256,3847,12288,2048,ck,0,0,167.2556,a8w8_blockscale_1x128x128_256x128x128x128_16x16_32x32_2x2_8x32x1_8x32x1_1x32x1x8_8_1x1_intrawave_v3,1157.66,762.83,0.0
256,4096,12288,2048,ck,0,0,169.9075,a8w8_blockscale_1x128x128_256x128x128x128_16x16_32x32_2x2_8x32x1_8x32x1_1x32x1x8_8_1x1_intrawave_v3,1213.36,789.95,0.0
256,4111,12288,2048,ck,0,0,175.3315,a8w8_blockscale_1x128x128_256x128x128x128_16x16_32x32_2x2_8x32x1_8x32x1_1x32x1x8_8_1x1_intrawave_v3,1180.13,767.79,0.0
256,4141,12288,2048,ck,0,0,177.976,a8w8_blockscale_1x128x128_256x128x128x128_16x16_32x32_2x2_8x32x1_8x32x1_1x32x1x8_8_1x1_intrawave_v3,1171.08,760.87,0.0
256,4142,12288,2048,ck,0,0,176.6771,a8w8_blockscale_1x128x128_256x128x128x128_16x16_32x32_2x2_8x32x1_8x32x1_1x32x1x8_8_1x1_intrawave_v3,1179.97,766.61,0.0
256,4345,12288,2048,ck,0,0,179.3268,a8w8_blockscale_1x128x128_256x128x128x128_16x16_32x32_2x2_8x32x1_8x32x1_1x32x1x8_8_1x1_intrawave_v3,1219.51,785.42,0.0
256,5105,12288,2048,ck,0,0,200.2134,a8w8_blockscale_1x128x128_256x128x128x128_16x16_32x32_2x2_8x32x1_8x32x1_1x32x1x8_8_1x1_intrawave_v3,1283.35,804.55,0.0
256,5121,12288,2048,ck,0,0,205.3106,a8w8_blockscale_1x128x128_256x128x128x128_16x16_32x32_2x2_8x32x1_8x32x1_1x32x1x8_8_1x1_intrawave_v3,1255.41,786.65,0.0
256,5123,12288,2048,ck,0,0,210.1267,a8w8_blockscale_1x128x128_256x128x128x128_16x16_32x32_2x2_8x32x1_8x32x1_1x32x1x8_8_1x1_intrawave_v3,1227.11,768.87,0.0
256,5131,12288,2048,ck,0,0,206.4542,a8w8_blockscale_1x128x128_256x128x128x128_16x16_32x32_2x2_8x32x1_8x32x1_1x32x1x8_8_1x1_intrawave_v3,1250.89,783.58,0.0
256,5427,12288,2048,ck,0,0,222.0916,a8w8_blockscale_1x128x128_256x128x128x128_16x16_32x32_2x2_8x32x1_8x32x1_1x32x1x8_8_1x1_intrawave_v3,1229.9,763.89,0.0
256,6113,12288,2048,ck,0,0,239.4677,a8w8_blockscale_1x128x128_256x128x128x128_16x16_32x32_2x2_8x32x1_8x32x1_1x32x1x8_8_1x1_intrawave_v3,1284.84,784.73,0.0
256,6197,12288,2048,ck,0,0,243.4668,a8w8_blockscale_1x128x128_256x128x128x128_16x16_32x32_2x2_8x32x1_8x32x1_1x32x1x8_8_1x1_intrawave_v3,1281.1,781.03,0.0
256,6409,12288,2048,ck,0,0,252.7609,a8w8_blockscale_1x128x128_256x128x128x128_16x16_32x32_2x2_8x32x1_8x32x1_1x32x1x8_8_1x1_intrawave_v3,1276.21,774.64,0.0
256,7121,12288,2048,ck,0,0,270.0988,a8w8_blockscale_1x128x128_256x128x128x128_16x16_32x32_2x2_8x32x1_8x32x1_1x32x1x8_8_1x1_intrawave_v3,1326.97,795.1,0.0
256,7168,12288,2048,ck,0,0,264.3142,a8w8_blockscale_1x128x128_256x128x128x128_16x16_32x32_2x2_8x32x1_8x32x1_1x32x1x8_8_1x1_intrawave_v3,1364.96,817.23,0.0
256,7169,12288,2048,ck,0,0,278.1357,a8w8_blockscale_1x128x128_256x128x128x128_16x16_32x32_2x2_8x32x1_8x32x1_1x32x1x8_8_1x1_intrawave_v3,1297.31,776.72,0.0
256,7172,12288,2048,ck,0,0,281.6246,a8w8_blockscale_1x128x128_256x128x128x128_16x16_32x32_2x2_8x32x1_8x32x1_1x32x1x8_8_1x1_intrawave_v3,1281.77,767.38,0.0
256,7176,12288,2048,ck,0,0,279.8543,a8w8_blockscale_1x128x128_256x128x128x128_16x16_32x32_2x2_8x32x1_8x32x1_1x32x1x8_8_1x1_intrawave_v3,1290.6,772.62,0.0
256,7177,12288,2048,ck,0,0,276.2474,a8w8_blockscale_1x128x128_256x128x128x128_16x16_32x32_2x2_8x32x1_8x32x1_1x32x1x8_8_1x1_intrawave_v3,1307.63,782.8,0.0
256,7178,12288,2048,ck,0,0,278.4302,a8w8_blockscale_1x128x128_256x128x128x128_16x16_32x32_2x2_8x32x1_8x32x1_1x32x1x8_8_1x1_intrawave_v3,1297.56,776.76,0.0
256,7179,12288,2048,ck,0,0,278.1042,a8w8_blockscale_1x128x128_256x128x128x128_16x16_32x32_2x2_8x32x1_8x32x1_1x32x1x8_8_1x1_intrawave_v3,1299.26,777.76,0.0
256,7183,12288,2048,ck,0,0,277.3646,a8w8_blockscale_1x128x128_256x128x128x128_16x16_32x32_2x2_8x32x1_8x32x1_1x32x1x8_8_1x1_intrawave_v3,1303.45,780.22,0.0
256,7184,12288,2048,ck,0,0,278.2262,a8w8_blockscale_1x128x128_256x128x128x128_16x16_32x32_2x2_8x32x1_8x32x1_1x32x1x8_8_1x1_intrawave_v3,1299.6,777.9,0.0
256,7209,12288,2048,ck,0,0,278.2876,a8w8_blockscale_1x128x128_256x128x128x128_16x16_32x32_2x2_8x32x1_8x32x1_1x32x1x8_8_1x1_intrawave_v3,1303.83,780.12,0.0
256,7210,12288,2048,ck,0,0,281.2835,a8w8_blockscale_1x128x128_256x128x128x128_16x16_32x32_2x2_8x32x1_8x32x1_1x32x1x8_8_1x1_intrawave_v3,1290.13,771.91,0.0
256,7211,12288,2048,ck,0,0,275.7986,a8w8_blockscale_1x128x128_256x128x128x128_16x16_32x32_2x2_8x32x1_8x32x1_1x32x1x8_8_1x1_intrawave_v3,1315.97,787.36,0.0
256,7217,12288,2048,ck,0,0,273.9477,a8w8_blockscale_1x128x128_256x128x128x128_16x16_32x32_2x2_8x32x1_8x32x1_1x32x1x8_8_1x1_intrawave_v3,1325.96,793.26,0.0
256,7273,12288,2048,ck,0,0,278.3488,a8w8_blockscale_1x128x128_256x128x128x128_16x16_32x32_2x2_8x32x1_8x32x1_1x32x1x8_8_1x1_intrawave_v3,1315.12,786.07,0.0
256,7274,12288,2048,ck,0,0,276.4527,a8w8_blockscale_1x128x128_256x128x128x128_16x16_32x32_2x2_8x32x1_8x32x1_1x32x1x8_8_1x1_intrawave_v3,1324.32,791.56,0.0
256,7391,12288,2048,ck,0,0,285.842,a8w8_blockscale_1x128x128_256x128x128x128_16x16_32x32_2x2_8x32x1_8x32x1_1x32x1x8_8_1x1_intrawave_v3,1301.42,776.46,0.0
256,7393,12288,2048,ck,0,0,278.5627,a8w8_blockscale_1x128x128_256x128x128x128_16x16_32x32_2x2_8x32x1_8x32x1_1x32x1x8_8_1x1_intrawave_v3,1335.79,796.94,0.0
256,7715,12288,2048,ck,0,0,294.3573,a8w8_blockscale_1x128x128_256x128x128x128_16x16_32x32_2x2_8x32x1_8x32x1_1x32x1x8_8_1x1_intrawave_v3,1319.17,783.3,0.0
256,7753,12288,2048,ck,0,0,297.4753,a8w8_blockscale_1x128x128_256x128x128x128_16x16_32x32_2x2_8x32x1_8x32x1_1x32x1x8_8_1x1_intrawave_v3,1311.78,778.49,0.0
256,7819,12288,2048,ck,0,0,303.957,a8w8_blockscale_1x128x128_256x128x128x128_16x16_32x32_2x2_8x32x1_8x32x1_1x32x1x8_8_1x1_intrawave_v3,1294.73,767.67,0.0
256,8099,12288,2048,ck,0,0,318.3934,a8w8_blockscale_1x128x128_256x128x128x128_16x16_32x32_2x2_8x32x1_8x32x1_1x32x1x8_8_1x1_intrawave_v3,1280.29,756.28,0.0
256,8129,12288,2048,ck,0,0,318.2782,a8w8_blockscale_1x128x128_256x128x128x128_16x16_32x32_2x2_8x32x1_8x32x1_1x32x1x8_8_1x1_intrawave_v3,1285.5,759.06,0.0
256,8188,12288,2048,ck,0,0,312.8341,a8w8_blockscale_1x128x128_256x128x128x128_16x16_32x32_2x2_8x32x1_8x32x1_1x32x1x8_8_1x1_intrawave_v3,1317.36,777.29,0.0
256,8192,12288,2048,ck,0,0,308.0838,a8w8_blockscale_1x128x128_256x128x128x128_16x16_32x32_2x2_8x32x1_8x32x1_1x32x1x8_8_1x1_intrawave_v3,1338.33,789.62,0.0
