aiter/configs/a8w8_blockscale_tuned_gemm.csv
gfx,cu_num,M,N,K,libtype,kernelId,splitK,us,kernelName,tflops,bw,errRatio
gfx950,256,1,256,2048,ck,8,0,6.3851,a8w8_blockscale_1x128x128_256x16x64x256_16x16_16x16_1x1_16x16x1_16x16x1_1x16x1x16_4_1x1_intrawave_v1,0.16,82.51,0.0
gfx950,256,2,256,2048,ck,8,0,6.3404,a8w8_blockscale_1x128x128_256x16x64x256_16x16_16x16_1x1_16x16x1_16x16x1_1x16x1x16_4_1x1_intrawave_v1,0.33,83.5,0.0
gfx950,256,4,256,2048,ck,8,0,6.4051,a8w8_blockscale_1x128x128_256x16x64x256_16x16_16x16_1x1_16x16x1_16x16x1_1x16x1x16_4_1x1_intrawave_v1,0.65,83.45,0.0
gfx950,256,8,256,2048,ck,8,0,6.3893,a8w8_blockscale_1x128x128_256x16x64x256_16x16_16x16_1x1_16x16x1_16x16x1_1x16x1x16_4_1x1_intrawave_v1,1.31,85.26,0.0
gfx950,256,16,256,2048,ck,8,0,6.2938,a8w8_blockscale_1x128x128_256x16x64x256_16x16_16x16_1x1_16x16x1_16x16x1_1x16x1x16_4_1x1_intrawave_v1,2.67,89.81,0.0
gfx950,256,32,256,2048,ck,8,0,7.0084,a8w8_blockscale_1x128x128_256x16x64x256_16x16_16x16_1x1_16x16x1_16x16x1_1x16x1x16_4_1x1_intrawave_v1,4.79,86.5,0.0
gfx950,256,48,256,2048,ck,8,0,6.9743,a8w8_blockscale_1x128x128_256x16x64x256_16x16_16x16_1x1_16x16x1_16x16x1_1x16x1x16_4_1x1_intrawave_v1,7.22,92.79,0.0
gfx950,256,64,256,2048,ck,8,0,7.1113,a8w8_blockscale_1x128x128_256x16x64x256_16x16_16x16_1x1_16x16x1_16x16x1_1x16x1x16_4_1x1_intrawave_v1,9.44,96.77,0.0
gfx950,256,80,256,2048,ck,8,0,7.0043,a8w8_blockscale_1x128x128_256x16x64x256_16x16_16x16_1x1_16x16x1_16x16x1_1x16x1x16_4_1x1_intrawave_v1,11.98,104.09,0.0
gfx950,256,96,256,2048,ck,8,0,7.0362,a8w8_blockscale_1x128x128_256x16x64x256_16x16_16x16_1x1_16x16x1_16x16x1_1x16x1x16_4_1x1_intrawave_v1,14.31,109.44,0.0
gfx950,256,112,256,2048,ck,8,0,7.0542,a8w8_blockscale_1x128x128_256x16x64x256_16x16_16x16_1x1_16x16x1_16x16x1_1x16x1x16_4_1x1_intrawave_v1,16.65,114.97,0.0
gfx950,256,128,256,2048,ck,8,0,7.1067,a8w8_blockscale_1x128x128_256x16x64x256_16x16_16x16_1x1_16x16x1_16x16x1_1x16x1x16_4_1x1_intrawave_v1,18.89,119.88,0.0
gfx950,256,256,256,2048,ck,8,0,7.1602,a8w8_blockscale_1x128x128_256x16x64x256_16x16_16x16_1x1_16x16x1_16x16x1_1x16x1x16_4_1x1_intrawave_v1,37.49,164.75,0.0
gfx950,256,512,256,2048,ck,8,0,7.2546,a8w8_blockscale_1x128x128_256x16x64x256_16x16_16x16_1x1_16x16x1_16x16x1_1x16x1x16_4_1x1_intrawave_v1,74.0,252.94,0.0
gfx950,256,588,256,2048,ck,8,0,7.4906,a8w8_blockscale_1x128x128_256x16x64x256_16x16_16x16_1x1_16x16x1_16x16x1_1x16x1x16_4_1x1_intrawave_v1,82.31,270.95,0.0
gfx950,256,773,256,2048,ck,8,0,7.6717,a8w8_blockscale_1x128x128_256x16x64x256_16x16_16x16_1x1_16x16x1_16x16x1_1x16x1x16_4_1x1_intrawave_v1,105.65,326.29,0.0
gfx950,256,822,256,2048,ck,8,0,7.8333,a8w8_blockscale_1x128x128_256x16x64x256_16x16_16x16_1x1_16x16x1_16x16x1_1x16x1x16_4_1x1_intrawave_v1,110.03,335.57,0.0
gfx950,256,1024,256,2048,ck,8,0,7.7813,a8w8_blockscale_1x128x128_256x16x64x256_16x16_16x16_1x1_16x16x1_16x16x1_1x16x1x16_4_1x1_intrawave_v1,137.99,404.27,0.0
gfx950,256,1025,256,2048,ck,7,0,9.3921,a8w8_blockscale_1x128x128_256x16x128x256_16x16_16x16_1x2_16x16x1_16x16x1_1x16x1x16_8_1x2_intrawave_v1,114.44,335.21,0.0
gfx950,256,1027,256,2048,ck,7,0,9.4727,a8w8_blockscale_1x128x128_256x16x128x256_16x16_16x16_1x2_16x16x1_16x16x1_1x16x1x16_8_1x2_intrawave_v1,113.68,332.89,0.0
gfx950,256,1042,256,2048,ck,7,0,9.4206,a8w8_blockscale_1x128x128_256x16x128x256_16x16_16x16_1x2_16x16x1_16x16x1_1x16x1x16_8_1x2_intrawave_v1,115.98,338.81,0.0
gfx950,256,1051,256,2048,ck,7,0,9.3666,a8w8_blockscale_1x128x128_256x16x128x256_16x16_16x16_1x2_16x16x1_16x16x1_1x16x1x16_8_1x2_intrawave_v1,117.66,343.22,0.0
gfx950,256,1055,256,2048,ck,7,0,9.4382,a8w8_blockscale_1x128x128_256x16x128x256_16x16_16x16_1x2_16x16x1_16x16x1_1x16x1x16_8_1x2_intrawave_v1,117.21,341.71,0.0
gfx950,256,1057,256,2048,ck,7,0,9.4271,a8w8_blockscale_1x128x128_256x16x128x256_16x16_16x16_1x2_16x16x1_16x16x1_1x16x1x16_8_1x2_intrawave_v1,117.57,342.65,0.0
gfx950,256,1069,256,2048,ck,7,0,9.4817,a8w8_blockscale_1x128x128_256x16x128x256_16x16_16x16_1x2_16x16x1_16x16x1_1x16x1x16_8_1x2_intrawave_v1,118.22,343.92,0.0
gfx950,256,1072,256,2048,ck,7,0,9.336,a8w8_blockscale_1x128x128_256x16x128x256_16x16_16x16_1x2_16x16x1_16x16x1_1x16x1x16_8_1x2_intrawave_v1,120.4,350.11,0.0
gfx950,256,1074,256,2048,ck,7,0,9.3791,a8w8_blockscale_1x128x128_256x16x128x256_16x16_16x16_1x2_16x16x1_16x16x1_1x16x1x16_8_1x2_intrawave_v1,120.07,349.05,0.0
gfx950,256,1091,256,2048,ck,7,0,9.4659,a8w8_blockscale_1x128x128_256x16x128x256_16x16_16x16_1x2_16x16x1_16x16x1_1x16x1x16_8_1x2_intrawave_v1,120.85,350.44,0.0
gfx950,256,1128,256,2048,ck,7,0,9.5567,a8w8_blockscale_1x128x128_256x16x128x256_16x16_16x16_1x2_16x16x1_16x16x1_1x16x1x16_8_1x2_intrawave_v1,123.77,357.02,0.0
gfx950,256,1136,256,2048,ck,7,0,9.4191,a8w8_blockscale_1x128x128_256x16x128x256_16x16_16x16_1x2_16x16x1_16x16x1_1x16x1x16_8_1x2_intrawave_v1,126.46,364.41,0.0
gfx950,256,1514,256,2048,ck,7,0,9.4355,a8w8_blockscale_1x128x128_256x16x128x256_16x16_16x16_1x2_16x16x1_16x16x1_1x16x1x16_8_1x2_intrawave_v1,168.25,466.34,0.0
gfx950,256,2017,256,2048,ck,7,0,9.5431,a8w8_blockscale_1x128x128_256x16x128x256_16x16_16x16_1x2_16x16x1_16x16x1_1x16x1x16_8_1x2_intrawave_v1,221.62,596.01,0.0
gfx950,256,2048,256,2048,ck,7,0,10.4453,a8w8_blockscale_1x128x128_256x16x128x256_16x16_16x16_1x2_16x16x1_16x16x1_1x16x1x16_8_1x2_intrawave_v1,205.59,552.13,0.0
gfx950,256,2151,256,2048,ck,18,0,11.4318,a8w8_blockscale_1x128x128_256x64x64x256_16x16_32x32_1x1_16x16x1_16x16x1_1x32x1x8_8_1x1_intrawave_v1,197.3,527.55,0.0
gfx950,256,2332,256,2048,ck,18,0,11.4671,a8w8_blockscale_1x128x128_256x64x64x256_16x16_32x32_1x1_16x16x1_16x16x1_1x32x1x8_8_1x1_intrawave_v1,213.24,566.33,0.0
gfx950,256,2341,256,2048,ck,18,0,11.1554,a8w8_blockscale_1x128x128_256x64x64x256_16x16_32x32_1x1_16x16x1_16x16x1_1x32x1x8_8_1x1_intrawave_v1,220.05,584.22,0.0
gfx950,256,3072,256,2048,ck,18,0,9.652,a8w8_blockscale_1x128x128_256x64x64x256_16x16_32x32_1x1_16x16x1_16x16x1_1x32x1x8_8_1x1_intrawave_v1,333.74,869.11,0.0
gfx950,256,3073,256,2048,ck,18,0,11.4985,a8w8_blockscale_1x128x128_256x64x64x256_16x16_32x32_1x1_16x16x1_16x16x1_1x32x1x8_8_1x1_intrawave_v1,280.23,729.76,0.0
gfx950,256,3089,256,2048,ck,18,0,11.212,a8w8_blockscale_1x128x128_256x64x64x256_16x16_32x32_1x1_16x16x1_16x16x1_1x32x1x8_8_1x1_intrawave_v1,288.89,752.06,0.0
gfx950,256,3110,256,2048,ck,18,0,11.2543,a8w8_blockscale_1x128x128_256x64x64x256_16x16_32x32_1x1_16x16x1_16x16x1_1x32x1x8_8_1x1_intrawave_v1,289.76,754.01,0.0
gfx950,256,3137,256,2048,ck,18,0,11.4852,a8w8_blockscale_1x128x128_256x64x64x256_16x16_32x32_1x1_16x16x1_16x16x1_1x32x1x8_8_1x1_intrawave_v1,286.4,744.87,0.0
gfx950,256,3613,256,2048,ck,18,0,12.0271,a8w8_blockscale_1x128x128_256x64x64x256_16x16_32x32_1x1_16x16x1_16x16x1_1x32x1x8_8_1x1_intrawave_v1,315.0,812.63,0.0
gfx950,256,4096,256,2048,ck,18,0,10.0619,a8w8_blockscale_1x128x128_256x64x64x256_16x16_32x32_1x1_16x16x1_16x16x1_1x32x1x8_8_1x1_intrawave_v1,426.85,1094.23,0.0
gfx950,256,4097,256,2048,ck,3,0,15.4714,a8w8_blockscale_1x128x128_256x64x64x128_16x16_32x32_1x1_8x32x1_8x32x1_1x32x1x8_8_1x1_intrawave_v3,277.67,711.8,0.0
gfx950,256,4109,256,2048,ck,2,0,15.5101,a8w8_blockscale_1x128x128_256x64x128x128_16x16_32x32_1x2_8x32x1_8x32x1_1x32x1x8_8_1x1_intrawave_v3,277.79,712.01,0.0
gfx950,256,4143,256,2048,ck,3,0,15.3615,a8w8_blockscale_1x128x128_256x64x64x128_16x16_32x32_1x1_8x32x1_8x32x1_1x32x1x8_8_1x1_intrawave_v3,282.8,724.56,0.0
gfx950,256,4345,256,2048,ck,2,0,15.6519,a8w8_blockscale_1x128x128_256x64x128x128_16x16_32x32_1x2_8x32x1_8x32x1_1x32x1x8_8_1x1_intrawave_v3,291.09,744.16,0.0
gfx950,256,4413,256,2048,ck,2,0,15.605,a8w8_blockscale_1x128x128_256x64x128x128_16x16_32x32_1x2_8x32x1_8x32x1_1x32x1x8_8_1x1_intrawave_v3,296.53,757.55,0.0
gfx950,256,5121,256,2048,ck,2,0,15.5437,a8w8_blockscale_1x128x128_256x64x128x128_16x16_32x32_1x2_8x32x1_8x32x1_1x32x1x8_8_1x1_intrawave_v3,345.46,877.14,0.0
gfx950,256,5123,256,2048,ck,2,0,15.4309,a8w8_blockscale_1x128x128_256x64x128x128_16x16_32x32_1x2_8x32x1_8x32x1_1x32x1x8_8_1x1_intrawave_v3,348.12,883.89,0.0
gfx950,256,5133,256,2048,ck,2,0,15.3972,a8w8_blockscale_1x128x128_256x64x128x128_16x16_32x32_1x2_8x32x1_8x32x1_1x32x1x8_8_1x1_intrawave_v3,349.57,887.48,0.0
gfx950,256,5185,256,2048,ck,2,0,15.3801,a8w8_blockscale_1x128x128_256x64x128x128_16x16_32x32_1x2_8x32x1_8x32x1_1x32x1x8_8_1x1_intrawave_v3,353.5,897.13,0.0
gfx950,256,5191,256,2048,ck,2,0,15.4557,a8w8_blockscale_1x128x128_256x64x128x128_16x16_32x32_1x2_8x32x1_8x32x1_1x32x1x8_8_1x1_intrawave_v3,352.18,893.73,0.0
gfx950,256,6146,256,2048,ck,2,0,15.8883,a8w8_blockscale_1x128x128_256x64x128x128_16x16_32x32_1x2_8x32x1_8x32x1_1x32x1x8_8_1x1_intrawave_v3,405.62,1023.27,0.0
gfx950,256,6147,256,2048,ck,2,0,15.5581,a8w8_blockscale_1x128x128_256x64x128x128_16x16_32x32_1x2_8x32x1_8x32x1_1x32x1x8_8_1x1_intrawave_v3,414.29,1045.15,0.0
gfx950,256,6155,256,2048,ck,2,0,15.5431,a8w8_blockscale_1x128x128_256x64x128x128_16x16_32x32_1x2_8x32x1_8x32x1_1x32x1x8_8_1x1_intrawave_v3,415.23,1047.48,0.0
gfx950,256,6377,256,2048,ck,2,0,15.5382,a8w8_blockscale_1x128x128_256x64x128x128_16x16_32x32_1x2_8x32x1_8x32x1_1x32x1x8_8_1x1_intrawave_v3,430.34,1084.39,0.0
gfx950,256,6401,256,2048,ck,2,0,15.6271,a8w8_blockscale_1x128x128_256x64x128x128_16x16_32x32_1x2_8x32x1_8x32x1_1x32x1x8_8_1x1_intrawave_v3,429.51,1082.15,0.0
gfx950,256,7121,256,2048,ck,2,0,15.7944,a8w8_blockscale_1x128x128_256x64x128x128_16x16_32x32_1x2_8x32x1_8x32x1_1x32x1x8_8_1x1_intrawave_v3,472.76,1187.39,0.0
gfx950,256,7169,256,2048,ck,2,0,15.7605,a8w8_blockscale_1x128x128_256x64x128x128_16x16_32x32_1x2_8x32x1_8x32x1_1x32x1x8_8_1x1_intrawave_v3,476.97,1197.74,0.0
gfx950,256,7170,256,2048,ck,2,0,15.8005,a8w8_blockscale_1x128x128_256x64x128x128_16x16_32x32_1x2_8x32x1_8x32x1_1x32x1x8_8_1x1_intrawave_v3,475.83,1194.87,0.0
gfx950,256,7176,256,2048,ck,2,0,15.8585,a8w8_blockscale_1x128x128_256x64x128x128_16x16_32x32_1x2_8x32x1_8x32x1_1x32x1x8_8_1x1_intrawave_v3,474.48,1191.47,0.0
gfx950,256,7177,256,2048,ck,2,0,15.7132,a8w8_blockscale_1x128x128_256x64x128x128_16x16_32x32_1x2_8x32x1_8x32x1_1x32x1x8_8_1x1_intrawave_v3,478.94,1202.65,0.0
gfx950,256,7185,256,2048,ck,2,0,15.8029,a8w8_blockscale_1x128x128_256x64x128x128_16x16_32x32_1x2_8x32x1_8x32x1_1x32x1x8_8_1x1_intrawave_v3,476.75,1197.11,0.0
gfx950,256,7206,256,2048,ck,2,0,15.864,a8w8_blockscale_1x128x128_256x64x128x128_16x16_32x32_1x2_8x32x1_8x32x1_1x32x1x8_8_1x1_intrawave_v3,476.3,1195.89,0.0
gfx950,256,7217,256,2048,ck,2,0,15.7447,a8w8_blockscale_1x128x128_256x64x128x128_16x16_32x32_1x2_8x32x1_8x32x1_1x32x1x8_8_1x1_intrawave_v3,480.64,1206.74,0.0
gfx950,256,7257,256,2048,ck,2,0,15.7962,a8w8_blockscale_1x128x128_256x64x128x128_16x16_32x32_1x2_8x32x1_8x32x1_1x32x1x8_8_1x1_intrawave_v3,481.73,1209.29,0.0
gfx950,256,7265,256,2048,ck,2,0,15.8123,a8w8_blockscale_1x128x128_256x64x128x128_16x16_32x32_1x2_8x32x1_8x32x1_1x32x1x8_8_1x1_intrawave_v3,481.77,1209.36,0.0
gfx950,256,7393,256,2048,ck,2,0,15.7708,a8w8_blockscale_1x128x128_256x64x128x128_16x16_32x32_1x2_8x32x1_8x32x1_1x32x1x8_8_1x1_intrawave_v3,491.55,1233.32,0.0
gfx950,256,7461,256,2048,ck,2,0,16.3591,a8w8_blockscale_1x128x128_256x64x128x128_16x16_32x32_1x2_8x32x1_8x32x1_1x32x1x8_8_1x1_intrawave_v3,478.23,1199.6,0.0
gfx950,256,7634,256,2048,ck,2,0,16.2234,a8w8_blockscale_1x128x128_256x64x128x128_16x16_32x32_1x2_8x32x1_8x32x1_1x32x1x8_8_1x1_intrawave_v3,493.41,1236.94,0.0
gfx950,256,8129,256,2048,ck,2,0,15.88,a8w8_blockscale_1x128x128_256x64x128x128_16x16_32x32_1x2_8x32x1_8x32x1_1x32x1x8_8_1x1_intrawave_v3,536.77,1343.48,0.0
gfx950,256,8192,256,2048,ck,2,0,16.1094,a8w8_blockscale_1x128x128_256x64x128x128_16x16_32x32_1x2_8x32x1_8x32x1_1x32x1x8_8_1x1_intrawave_v3,533.22,1334.36,0.0
gfx950,256,1,1024,2048,ck,8,0,6.884,a8w8_blockscale_1x128x128_256x16x64x256_16x16_16x16_1x1_16x16x1_16x16x1_1x16x1x16_4_1x1_intrawave_v1,0.61,305.24,0.0
gfx950,256,2,1024,2048,ck,8,0,6.9309,a8w8_blockscale_1x128x128_256x16x64x256_16x16_16x16_1x1_16x16x1_16x16x1_1x16x1x16_4_1x1_intrawave_v1,1.21,303.76,0.0
gfx950,256,4,1024,2048,ck,8,0,6.9336,a8w8_blockscale_1x128x128_256x16x64x256_16x16_16x16_1x1_16x16x1_16x16x1_1x16x1x16_4_1x1_intrawave_v1,2.42,304.83,0.0
gfx950,256,8,1024,2048,ck,8,0,6.9865,a8w8_blockscale_1x128x128_256x16x64x256_16x16_16x16_1x1_16x16x1_16x16x1_1x16x1x16_4_1x1_intrawave_v1,4.8,304.86,0.0
gfx950,256,16,1024,2048,ck,8,0,6.87,a8w8_blockscale_1x128x128_256x16x64x256_16x16_16x16_1x1_16x16x1_16x16x1_1x16x1x16_4_1x1_intrawave_v1,9.77,314.8,0.0
gfx950,256,32,1024,2048,ck,8,0,7.0824,a8w8_blockscale_1x128x128_256x16x64x256_16x16_16x16_1x1_16x16x1_16x16x1_1x16x1x16_4_1x1_intrawave_v1,18.95,314.61,0.0
gfx950,256,48,1024,2048,ck,8,0,7.126,a8w8_blockscale_1x128x128_256x16x64x256_16x16_16x16_1x1_16x16x1_16x16x1_1x16x1x16_4_1x1_intrawave_v1,28.25,321.89,0.0
gfx950,256,64,1024,2048,ck,8,0,7.1532,a8w8_blockscale_1x128x128_256x16x64x256_16x16_16x16_1x1_16x16x1_16x16x1_1x16x1x16_4_1x1_intrawave_v1,37.53,329.82,0.0
gfx950,256,80,1024,2048,ck,8,0,7.1677,a8w8_blockscale_1x128x128_256x16x64x256_16x16_16x16_1x1_16x16x1_16x16x1_1x16x1x16_4_1x1_intrawave_v1,46.81,338.3,0.0
gfx950,256,96,1024,2048,ck,8,0,7.2995,a8w8_blockscale_1x128x128_256x16x64x256_16x16_16x16_1x1_16x16x1_16x16x1_1x16x1x16_4_1x1_intrawave_v1,55.16,341.17,0.0
gfx950,256,112,1024,2048,ck,8,0,7.3435,a8w8_blockscale_1x128x128_256x16x64x256_16x16_16x16_1x1_16x16x1_16x16x1_1x16x1x16_4_1x1_intrawave_v1,63.97,348.05,0.0
gfx950,256,128,1024,2048,ck,8,0,7.2932,a8w8_blockscale_1x128x128_256x16x64x256_16x16_16x16_1x1_16x16x1_16x16x1_1x16x1x16_4_1x1_intrawave_v1,73.61,359.44,0.0
gfx950,256,256,1024,2048,ck,8,0,7.6121,a8w8_blockscale_1x128x128_256x16x64x256_16x16_16x16_1x1_16x16x1_16x16x1_1x16x1x16_4_1x1_intrawave_v1,141.06,413.25,0.0
gfx950,256,512,1024,2048,ck,7,0,9.1482,a8w8_blockscale_1x128x128_256x16x128x256_16x16_16x16_1x2_16x16x1_16x16x1_1x16x1x16_8_1x2_intrawave_v1,234.74,458.48,0.0
gfx950,256,667,1024,2048,ck,18,0,10.9075,a8w8_blockscale_1x128x128_256x64x64x256_16x16_32x32_1x1_16x16x1_16x16x1_1x32x1x8_8_1x1_intrawave_v1,256.48,442.74,0.0
gfx950,256,671,1024,2048,ck,18,0,10.9203,a8w8_blockscale_1x128x128_256x64x64x256_16x16_32x32_1x1_16x16x1_16x16x1_1x32x1x8_8_1x1_intrawave_v1,257.72,443.72,0.0
gfx950,256,931,1024,2048,ck,18,0,11.6158,a8w8_blockscale_1x128x128_256x64x64x256_16x16_32x32_1x1_16x16x1_16x16x1_1x32x1x8_8_1x1_intrawave_v1,336.17,508.84,0.0
gfx950,256,1024,1024,2048,ck,18,0,9.9827,a8w8_blockscale_1x128x128_256x64x64x256_16x16_32x32_1x1_16x16x1_16x16x1_1x32x1x8_8_1x1_intrawave_v1,430.24,630.24,0.0
gfx950,256,1025,1024,2048,ck,2,0,15.1175,a8w8_blockscale_1x128x128_256x64x128x128_16x16_32x32_1x2_8x32x1_8x32x1_1x32x1x8_8_1x1_intrawave_v3,284.38,416.44,0.0
gfx950,256,1027,1024,2048,ck,2,0,15.1123,a8w8_blockscale_1x128x128_256x64x128x128_16x16_32x32_1x2_8x32x1_8x32x1_1x32x1x8_8_1x1_intrawave_v3,285.04,417.13,0.0
gfx950,256,1031,1024,2048,ck,2,0,15.1293,a8w8_blockscale_1x128x128_256x64x128x128_16x16_32x32_1x2_8x32x1_8x32x1_1x32x1x8_8_1x1_intrawave_v3,285.82,417.74,0.0
gfx950,256,1039,1024,2048,ck,2,0,15.1367,a8w8_blockscale_1x128x128_256x64x128x128_16x16_32x32_1x2_8x32x1_8x32x1_1x32x1x8_8_1x1_intrawave_v3,287.9,419.7,0.0
gfx950,256,1040,1024,2048,ck,2,0,15.2651,a8w8_blockscale_1x128x128_256x64x128x128_16x16_32x32_1x2_8x32x1_8x32x1_1x32x1x8_8_1x1_intrawave_v3,285.75,416.44,0.0
gfx950,256,1041,1024,2048,ck,2,0,15.224,a8w8_blockscale_1x128x128_256x64x128x128_16x16_32x32_1x2_8x32x1_8x32x1_1x32x1x8_8_1x1_intrawave_v3,286.8,417.83,0.0
gfx950,256,1072,1024,2048,ck,2,0,15.2189,a8w8_blockscale_1x128x128_256x64x128x128_16x16_32x32_1x2_8x32x1_8x32x1_1x32x1x8_8_1x1_intrawave_v3,295.44,426.32,0.0
gfx950,256,1073,1024,2048,ck,2,0,15.3456,a8w8_blockscale_1x128x128_256x64x128x128_16x16_32x32_1x2_8x32x1_8x32x1_1x32x1x8_8_1x1_intrawave_v3,293.28,423.06,0.0
gfx950,256,1077,1024,2048,ck,2,0,15.2493,a8w8_blockscale_1x128x128_256x64x128x128_16x16_32x32_1x2_8x32x1_8x32x1_1x32x1x8_8_1x1_intrawave_v3,296.23,426.81,0.0
gfx950,256,1091,1024,2048,ck,2,0,15.2656,a8w8_blockscale_1x128x128_256x64x128x128_16x16_32x32_1x2_8x32x1_8x32x1_1x32x1x8_8_1x1_intrawave_v3,299.76,430.11,0.0
gfx950,256,1343,1024,2048,ck,2,0,15.4197,a8w8_blockscale_1x128x128_256x64x128x128_16x16_32x32_1x2_8x32x1_8x32x1_1x32x1x8_8_1x1_intrawave_v3,365.31,492.75,0.0
gfx950,256,1688,1024,2048,ck,2,0,15.6958,a8w8_blockscale_1x128x128_256x64x128x128_16x16_32x32_1x2_8x32x1_8x32x1_1x32x1x8_8_1x1_intrawave_v3,451.08,574.12,0.0
gfx950,256,2017,1024,2048,ck,2,0,15.8206,a8w8_blockscale_1x128x128_256x64x128x128_16x16_32x32_1x2_8x32x1_8x32x1_1x32x1x8_8_1x1_intrawave_v3,534.74,654.77,0.0
gfx950,256,2048,1024,2048,ck,2,0,16.132,a8w8_blockscale_1x128x128_256x64x128x128_16x16_32x32_1x2_8x32x1_8x32x1_1x32x1x8_8_1x1_intrawave_v3,532.48,650.0,0.0
gfx950,256,2050,1024,2048,ck,3,0,19.1733,a8w8_blockscale_1x128x128_256x64x64x128_16x16_32x32_1x1_8x32x1_8x32x1_1x32x1x8_8_1x1_intrawave_v3,448.45,547.32,0.0
gfx950,256,2063,1024,2048,ck,3,0,18.9574,a8w8_blockscale_1x128x128_256x64x64x128_16x16_32x32_1x1_8x32x1_8x32x1_1x32x1x8_8_1x1_intrawave_v3,456.44,556.36,0.0
gfx950,256,2064,1024,2048,ck,3,0,19.0681,a8w8_blockscale_1x128x128_256x64x64x128_16x16_32x32_1x1_8x32x1_8x32x1_1x32x1x8_8_1x1_intrawave_v3,454.01,553.35,0.0
gfx950,256,2099,1024,2048,ck,3,0,19.1575,a8w8_blockscale_1x128x128_256x64x64x128_16x16_32x32_1x1_8x32x1_8x32x1_1x32x1x8_8_1x1_intrawave_v3,459.55,558.25,0.0
gfx950,256,2159,1024,2048,ck,3,0,19.3583,a8w8_blockscale_1x128x128_256x64x64x128_16x16_32x32_1x1_8x32x1_8x32x1_1x32x1x8_8_1x1_intrawave_v3,467.78,565.15,0.0
gfx950,256,2160,1024,2048,ck,3,0,19.2486,a8w8_blockscale_1x128x128_256x64x64x128_16x16_32x32_1x1_8x32x1_8x32x1_1x32x1x8_8_1x1_intrawave_v3,470.67,568.59,0.0
gfx950,256,2313,1024,2048,ck,3,0,19.4989,a8w8_blockscale_1x128x128_256x64x64x128_16x16_32x32_1x1_8x32x1_8x32x1_1x32x1x8_8_1x1_intrawave_v3,497.54,593.43,0.0
gfx950,256,2325,1024,2048,ck,3,0,19.3919,a8w8_blockscale_1x128x128_256x64x64x128_16x16_32x32_1x1_8x32x1_8x32x1_1x32x1x8_8_1x1_intrawave_v3,502.88,599.24,0.0
gfx950,256,3072,1024,2048,ck,0,0,19.7485,a8w8_blockscale_1x128x128_256x128x128x128_16x16_32x32_2x2_8x32x1_8x32x1_1x32x1x8_8_1x1_intrawave_v3,652.45,743.35,0.0
gfx950,256,3073,1024,2048,ck,0,0,20.5536,a8w8_blockscale_1x128x128_256x128x128x128_16x16_32x32_2x2_8x32x1_8x32x1_1x32x1x8_8_1x1_intrawave_v3,627.1,714.43,0.0
gfx950,256,3182,1024,2048,ck,0,0,20.701,a8w8_blockscale_1x128x128_256x128x128x128_16x16_32x32_2x2_8x32x1_8x32x1_1x32x1x8_8_1x1_intrawave_v3,644.72,730.91,0.0
gfx950,256,3183,1024,2048,ck,0,0,20.6856,a8w8_blockscale_1x128x128_256x128x128x128_16x16_32x32_2x2_8x32x1_8x32x1_1x32x1x8_8_1x1_intrawave_v3,645.4,731.65,0.0
gfx950,256,3847,1024,2048,ck,0,0,21.0898,a8w8_blockscale_1x128x128_256x128x128x128_16x16_32x32_2x2_8x32x1_8x32x1_1x32x1x8_8_1x1_intrawave_v3,765.08,846.59,0.0
gfx950,256,4096,1024,2048,ck,0,0,20.472,a8w8_blockscale_1x128x128_256x128x128x128_16x16_32x32_2x2_8x32x1_8x32x1_1x32x1x8_8_1x1_intrawave_v3,839.19,921.96,0.0
gfx950,256,4111,1024,2048,ck,2,0,27.7365,a8w8_blockscale_1x128x128_256x64x128x128_16x16_32x32_1x2_8x32x1_8x32x1_1x32x1x8_8_1x1_intrawave_v3,621.66,682.7,0.0
gfx950,256,4141,1024,2048,ck,2,0,28.083,a8w8_blockscale_1x128x128_256x64x128x128_16x16_32x32_1x2_8x32x1_8x32x1_1x32x1x8_8_1x1_intrawave_v3,618.47,678.66,0.0
gfx950,256,4142,1024,2048,ck,2,0,28.2149,a8w8_blockscale_1x128x128_256x64x128x128_16x16_32x32_1x2_8x32x1_8x32x1_1x32x1x8_8_1x1_intrawave_v3,615.73,675.63,0.0
gfx950,256,4345,1024,2048,ck,2,0,28.5133,a8w8_blockscale_1x128x128_256x64x128x128_16x16_32x32_1x2_8x32x1_8x32x1_1x32x1x8_8_1x1_intrawave_v3,639.15,697.72,0.0
gfx950,256,5105,1024,2048,ck,2,0,29.3576,a8w8_blockscale_1x128x128_256x64x128x128_16x16_32x32_1x2_8x32x1_8x32x1_1x32x1x8_8_1x1_intrawave_v3,729.35,783.69,0.0
gfx950,256,5121,1024,2048,ck,2,0,29.3782,a8w8_blockscale_1x128x128_256x64x128x128_16x16_32x32_1x2_8x32x1_8x32x1_1x32x1x8_8_1x1_intrawave_v3,731.12,785.37,0.0
gfx950,256,5123,1024,2048,ck,2,0,29.6788,a8w8_blockscale_1x128x128_256x64x128x128_16x16_32x32_1x2_8x32x1_8x32x1_1x32x1x8_8_1x1_intrawave_v3,724.0,777.69,0.0
gfx950,256,5131,1024,2048,ck,2,0,29.3782,a8w8_blockscale_1x128x128_256x64x128x128_16x16_32x32_1x2_8x32x1_8x32x1_1x32x1x8_8_1x1_intrawave_v3,732.55,786.76,0.0
gfx950,256,5427,1024,2048,ck,2,0,30.1996,a8w8_blockscale_1x128x128_256x64x128x128_16x16_32x32_1x2_8x32x1_8x32x1_1x32x1x8_8_1x1_intrawave_v3,753.73,805.51,0.0
gfx950,256,6113,1024,2048,ck,2,0,31.2522,a8w8_blockscale_1x128x128_256x64x128x128_16x16_32x32_1x2_8x32x1_8x32x1_1x32x1x8_8_1x1_intrawave_v3,820.42,868.29,0.0
gfx950,256,6197,1024,2048,ck,0,0,31.7618,a8w8_blockscale_1x128x128_256x128x128x128_16x16_32x32_2x2_8x32x1_8x32x1_1x32x1x8_8_1x1_intrawave_v3,818.34,865.19,0.0
gfx950,256,6409,1024,2048,ck,0,0,32.0759,a8w8_blockscale_1x128x128_256x128x128x128_16x16_32x32_2x2_8x32x1_8x32x1_1x32x1x8_8_1x1_intrawave_v3,838.05,883.79,0.0
gfx950,256,7121,1024,2048,ck,0,0,33.2833,a8w8_blockscale_1x128x128_256x128x128x128_16x16_32x32_2x2_8x32x1_8x32x1_1x32x1x8_8_1x1_intrawave_v3,897.38,939.35,0.0
gfx950,256,7168,1024,2048,ck,0,0,32.5043,a8w8_blockscale_1x128x128_256x128x128x128_16x16_32x32_2x2_8x32x1_8x32x1_1x32x1x8_8_1x1_intrawave_v3,924.95,967.79,0.0
gfx950,256,7169,1024,2048,ck,0,0,33.3849,a8w8_blockscale_1x128x128_256x128x128x128_16x16_32x32_2x2_8x32x1_8x32x1_1x32x1x8_8_1x1_intrawave_v3,900.68,942.38,0.0
gfx950,256,7172,1024,2048,ck,0,0,32.9561,a8w8_blockscale_1x128x128_256x128x128x128_16x16_32x32_2x2_8x32x1_8x32x1_1x32x1x8_8_1x1_intrawave_v3,912.78,955.02,0.0
gfx950,256,7176,1024,2048,ck,0,0,33.6889,a8w8_blockscale_1x128x128_256x128x128x128_16x16_32x32_2x2_8x32x1_8x32x1_1x32x1x8_8_1x1_intrawave_v3,893.42,934.73,0.0
gfx950,256,7177,1024,2048,ck,0,0,33.4074,a8w8_blockscale_1x128x128_256x128x128x128_16x16_32x32_2x2_8x32x1_8x32x1_1x32x1x8_8_1x1_intrawave_v3,901.07,942.73,0.0
gfx950,256,7178,1024,2048,ck,0,0,33.2151,a8w8_blockscale_1x128x128_256x128x128x128_16x16_32x32_2x2_8x32x1_8x32x1_1x32x1x8_8_1x1_intrawave_v3,906.42,948.31,0.0
gfx950,256,7179,1024,2048,ck,0,0,33.5431,a8w8_blockscale_1x128x128_256x128x128x128_16x16_32x32_2x2_8x32x1_8x32x1_1x32x1x8_8_1x1_intrawave_v3,897.68,939.16,0.0
gfx950,256,7183,1024,2048,ck,0,0,33.3395,a8w8_blockscale_1x128x128_256x128x128x128_16x16_32x32_2x2_8x32x1_8x32x1_1x32x1x8_8_1x1_intrawave_v3,903.66,945.39,0.0
gfx950,256,7184,1024,2048,ck,0,0,33.0809,a8w8_blockscale_1x128x128_256x128x128x128_16x16_32x32_2x2_8x32x1_8x32x1_1x32x1x8_8_1x1_intrawave_v3,910.85,952.9,0.0
gfx950,256,7209,1024,2048,ck,0,0,33.3733,a8w8_blockscale_1x128x128_256x128x128x128_16x16_32x32_2x2_8x32x1_8x32x1_1x32x1x8_8_1x1_intrawave_v3,906.02,947.62,0.0
gfx950,256,7210,1024,2048,ck,0,0,33.1005,a8w8_blockscale_1x128x128_256x128x128x128_16x16_32x32_2x2_8x32x1_8x32x1_1x32x1x8_8_1x1_intrawave_v3,913.61,955.55,0.0
gfx950,256,7211,1024,2048,ck,0,0,33.5695,a8w8_blockscale_1x128x128_256x128x128x128_16x16_32x32_2x2_8x32x1_8x32x1_1x32x1x8_8_1x1_intrawave_v3,900.97,942.33,0.0
gfx950,256,7217,1024,2048,ck,0,0,33.9101,a8w8_blockscale_1x128x128_256x128x128x128_16x16_32x32_2x2_8x32x1_8x32x1_1x32x1x8_8_1x1_intrawave_v3,892.66,933.59,0.0
gfx950,256,7273,1024,2048,ck,0,0,33.1722,a8w8_blockscale_1x128x128_256x128x128x128_16x16_32x32_2x2_8x32x1_8x32x1_1x32x1x8_8_1x1_intrawave_v3,919.6,961.27,0.0
gfx950,256,7274,1024,2048,ck,0,0,33.4217,a8w8_blockscale_1x128x128_256x128x128x128_16x16_32x32_2x2_8x32x1_8x32x1_1x32x1x8_8_1x1_intrawave_v3,912.86,954.21,0.0
gfx950,256,7391,1024,2048,ck,0,0,34.0422,a8w8_blockscale_1x128x128_256x128x128x128_16x16_32x32_2x2_8x32x1_8x32x1_1x32x1x8_8_1x1_intrawave_v3,910.64,950.9,0.0
gfx950,256,7393,1024,2048,ck,0,0,34.043,a8w8_blockscale_1x128x128_256x128x128x128_16x16_32x32_2x2_8x32x1_8x32x1_1x32x1x8_8_1x1_intrawave_v3,910.86,951.12,0.0
gfx950,256,7715,1024,2048,ck,0,0,34.2875,a8w8_blockscale_1x128x128_256x128x128x128_16x16_32x32_2x2_8x32x1_8x32x1_1x32x1x8_8_1x1_intrawave_v3,943.76,982.8,0.0
gfx950,256,7753,1024,2048,ck,0,0,34.1334,a8w8_blockscale_1x128x128_256x128x128x128_16x16_32x32_2x2_8x32x1_8x32x1_1x32x1x8_8_1x1_intrawave_v3,952.69,991.8,0.0
gfx950,256,7819,1024,2048,ck,0,0,34.3245,a8w8_blockscale_1x128x128_256x128x128x128_16x16_32x32_2x2_8x32x1_8x32x1_1x32x1x8_8_1x1_intrawave_v3,955.45,994.15,0.0
gfx950,256,8099,1024,2048,ck,0,0,34.7473,a8w8_blockscale_1x128x128_256x128x128x128_16x16_32x32_2x2_8x32x1_8x32x1_1x32x1x8_8_1x1_intrawave_v3,977.62,1015.06,0.0
gfx950,256,8129,1024,2048,ck,0,0,34.9537,a8w8_blockscale_1x128x128_256x128x128x128_16x16_32x32_2x2_8x32x1_8x32x1_1x32x1x8_8_1x1_intrawave_v3,975.45,1012.58,0.0
gfx950,256,8188,1024,2048,ck,0,0,34.6001,a8w8_blockscale_1x128x128_256x128x128x128_16x16_32x32_2x2_8x32x1_8x32x1_1x32x1x8_8_1x1_intrawave_v3,992.57,1029.92,0.0
gfx950,256,8192,1024,2048,ck,0,0,33.9377,a8w8_blockscale_1x128x128_256x128x128x128_16x16_32x32_2x2_8x32x1_8x32x1_1x32x1x8_8_1x1_intrawave_v3,1012.44,1050.5,0.0
gfx950,256,1,2048,128,ck,6,0,2.6562,a8w8_blockscale_1x128x128_256x16x64x128_8x16_16x16_1x1_16x16x1_8x32x1_1x16x1x16_4_1x1_intrawave_v1,0.2,100.28,0.0
gfx950,256,1,2048,512,ck,8,0,3.2862,a8w8_blockscale_1x128x128_256x16x64x256_16x16_16x16_1x1_16x16x1_16x16x1_1x16x1x16_4_1x1_intrawave_v1,0.64,320.49,0.0
gfx950,256,1,2048,1024,ck,8,0,4.4819,a8w8_blockscale_1x128x128_256x16x64x256_16x16_16x16_1x1_16x16x1_16x16x1_1x16x1x16_4_1x1_intrawave_v1,0.94,469.06,0.0
gfx950,256,1,2048,2048,ck,8,0,7.8555,a8w8_blockscale_1x128x128_256x16x64x256_16x16_16x16_1x1_16x16x1_16x16x1_1x16x1x16_4_1x1_intrawave_v1,1.07,534.71,0.0
gfx950,256,1,2048,4096,ck,8,0,13.8232,a8w8_blockscale_1x128x128_256x16x64x256_16x16_16x16_1x1_16x16x1_16x16x1_1x16x1x16_4_1x1_intrawave_v1,1.21,607.44,0.0
gfx950,256,2,2048,128,ck,6,0,2.7821,a8w8_blockscale_1x128x128_256x16x64x128_8x16_16x16_1x1_16x16x1_8x32x1_1x16x1x16_4_1x1_intrawave_v1,0.38,97.26,0.0
gfx950,256,2,2048,512,ck,8,0,3.2884,a8w8_blockscale_1x128x128_256x16x64x256_16x16_16x16_1x1_16x16x1_16x16x1_1x16x1x16_4_1x1_intrawave_v1,1.28,321.67,0.0
gfx950,256,2,2048,1024,ck,8,0,4.5278,a8w8_blockscale_1x128x128_256x16x64x256_16x16_16x16_1x1_16x16x1_16x16x1_1x16x1x16_4_1x1_intrawave_v1,1.85,465.43,0.0
gfx950,256,2,2048,2048,ck,8,0,7.7936,a8w8_blockscale_1x128x128_256x16x64x256_16x16_16x16_1x1_16x16x1_16x16x1_1x16x1x16_4_1x1_intrawave_v1,2.15,539.75,0.0
gfx950,256,2,2048,4096,ck,8,0,13.766,a8w8_blockscale_1x128x128_256x16x64x256_16x16_16x16_1x1_16x16x1_16x16x1_1x16x1x16_4_1x1_intrawave_v1,2.44,610.56,0.0
gfx950,256,4,2048,128,ck,6,0,2.7218,a8w8_blockscale_1x128x128_256x16x64x128_8x16_16x16_1x1_16x16x1_8x32x1_1x16x1x16_4_1x1_intrawave_v1,0.77,102.52,0.0
gfx950,256,4,2048,512,ck,8,0,3.286,a8w8_blockscale_1x128x128_256x16x64x256_16x16_16x16_1x1_16x16x1_16x16x1_1x16x1x16_4_1x1_intrawave_v1,2.55,324.71,0.0
gfx950,256,4,2048,1024,ck,8,0,4.5256,a8w8_blockscale_1x128x128_256x16x64x256_16x16_16x16_1x1_16x16x1_16x16x1_1x16x1x16_4_1x1_intrawave_v1,3.71,467.92,0.0
gfx950,256,4,2048,2048,ck,8,0,7.7966,a8w8_blockscale_1x128x128_256x16x64x256_16x16_16x16_1x1_16x16x1_16x16x1_1x16x1x16_4_1x1_intrawave_v1,4.3,541.12,0.0
gfx950,256,4,2048,4096,ck,8,0,13.7663,a8w8_blockscale_1x128x128_256x16x64x256_16x16_16x16_1x1_16x16x1_16x16x1_1x16x1x16_4_1x1_intrawave_v1,4.87,611.74,0.0
gfx950,256,8,2048,128,ck,6,0,2.7252,a8w8_blockscale_1x128x128_256x16x64x128_8x16_16x16_1x1_16x16x1_8x32x1_1x16x1x16_4_1x1_intrawave_v1,1.54,108.59,0.0
gfx950,256,8,2048,512,ck,8,0,3.3277,a8w8_blockscale_1x128x128_256x16x64x256_16x16_16x16_1x1_16x16x1_16x16x1_1x16x1x16_4_1x1_intrawave_v1,5.04,326.18,0.0
gfx950,256,8,2048,1024,ck,8,0,4.5305,a8w8_blockscale_1x128x128_256x16x64x256_16x16_16x16_1x1_16x16x1_16x16x1_1x16x1x16_4_1x1_intrawave_v1,7.41,471.94,0.0
gfx950,256,8,2048,2048,ck,8,0,7.8745,a8w8_blockscale_1x128x128_256x16x64x256_16x16_16x16_1x1_16x16x1_16x16x1_1x16x1x16_4_1x1_intrawave_v1,8.52,538.89,0.0
gfx950,256,8,2048,4096,ck,8,0,13.6891,a8w8_blockscale_1x128x128_256x16x64x256_16x16_16x16_1x1_16x16x1_16x16x1_1x16x1x16_4_1x1_intrawave_v1,9.8,617.58,0.0
gfx950,256,16,2048,128,ck,6,0,2.801,a8w8_blockscale_1x128x128_256x16x64x128_8x16_16x16_1x1_16x16x1_8x32x1_1x16x1x16_4_1x1_intrawave_v1,2.99,117.72,0.0
gfx950,256,16,2048,512,ck,8,0,3.2922,a8w8_blockscale_1x128x128_256x16x64x256_16x16_16x16_1x1_16x16x1_16x16x1_1x16x1x16_4_1x1_intrawave_v1,10.19,340.9,0.0
gfx950,256,16,2048,1024,ck,8,0,4.479,a8w8_blockscale_1x128x128_256x16x64x256_16x16_16x16_1x1_16x16x1_16x16x1_1x16x1x16_4_1x1_intrawave_v1,14.98,486.51,0.0
gfx950,256,16,2048,2048,ck,8,0,7.708,a8w8_blockscale_1x128x128_256x16x64x256_16x16_16x16_1x1_16x16x1_16x16x1_1x16x1x16_4_1x1_intrawave_v1,17.41,556.9,0.0
gfx950,256,16,2048,4096,ck,8,0,13.9167,a8w8_blockscale_1x128x128_256x16x64x256_16x16_16x16_1x1_16x16x1_16x16x1_1x16x1x16_4_1x1_intrawave_v1,19.29,612.19,0.0
gfx950,256,24,2048,2048,ck,8,0,8.0911,a8w8_blockscale_1x128x128_256x16x64x256_16x16_16x16_1x1_16x16x1_16x16x1_1x16x1x16_4_1x1_intrawave_v1,24.88,536.61,0.0
gfx950,256,32,2048,128,ck,6,0,3.0022,a8w8_blockscale_1x128x128_256x16x64x128_8x16_16x16_1x1_16x16x1_8x32x1_1x16x1x16_4_1x1_intrawave_v1,5.59,132.34,0.0
gfx950,256,32,2048,512,ck,8,0,3.5433,a8w8_blockscale_1x128x128_256x16x64x256_16x16_16x16_1x1_16x16x1_16x16x1_1x16x1x16_4_1x1_intrawave_v1,18.94,337.55,0.0
gfx950,256,32,2048,1024,ck,8,0,4.7747,a8w8_blockscale_1x128x128_256x16x64x256_16x16_16x16_1x1_16x16x1_16x16x1_1x16x1x16_4_1x1_intrawave_v1,28.11,473.54,0.0
gfx950,256,32,2048,2048,ck,8,0,7.9044,a8w8_blockscale_1x128x128_256x16x64x256_16x16_16x16_1x1_16x16x1_16x16x1_1x16x1x16_4_1x1_intrawave_v1,33.96,555.5,0.0
gfx950,256,32,2048,4096,ck,8,0,13.6197,a8w8_blockscale_1x128x128_256x16x64x256_16x16_16x16_1x1_16x16x1_16x16x1_1x16x1x16_4_1x1_intrawave_v1,39.42,635.16,0.0
gfx950,256,40,2048,2048,ck,8,0,8.0904,a8w8_blockscale_1x128x128_256x16x64x256_16x16_16x16_1x1_16x16x1_16x16x1_1x16x1x16_4_1x1_intrawave_v1,41.47,548.81,0.0
gfx950,256,48,2048,128,ck,6,0,2.9744,a8w8_blockscale_1x128x128_256x16x64x128_8x16_16x16_1x1_16x16x1_8x32x1_1x16x1x16_4_1x1_intrawave_v1,8.46,156.3,0.0
gfx950,256,48,2048,512,ck,8,0,3.5548,a8w8_blockscale_1x128x128_256x16x64x256_16x16_16x16_1x1_16x16x1_16x16x1_1x16x1x16_4_1x1_intrawave_v1,28.32,357.2,0.0
gfx950,256,48,2048,1024,ck,8,0,4.7485,a8w8_blockscale_1x128x128_256x16x64x256_16x16_16x16_1x1_16x16x1_16x16x1_1x16x1x16_4_1x1_intrawave_v1,42.4,493.4,0.0
gfx950,256,48,2048,2048,ck,8,0,7.9442,a8w8_blockscale_1x128x128_256x16x64x256_16x16_16x16_1x1_16x16x1_16x16x1_1x16x1x16_4_1x1_intrawave_v1,50.69,565.09,0.0
gfx950,256,48,2048,4096,ck,8,0,13.5315,a8w8_blockscale_1x128x128_256x16x64x256_16x16_16x16_1x1_16x16x1_16x16x1_1x16x1x16_4_1x1_intrawave_v1,59.51,648.99,0.0
gfx950,256,56,2048,2048,ck,8,0,8.1324,a8w8_blockscale_1x128x128_256x16x64x256_16x16_16x16_1x1_16x16x1_16x16x1_1x16x1x16_4_1x1_intrawave_v1,57.76,558.06,0.0
gfx950,256,64,2048,128,ck,6,0,2.999,a8w8_blockscale_1x128x128_256x16x64x128_8x16_16x16_1x1_16x16x1_8x32x1_1x16x1x16_4_1x1_intrawave_v1,11.19,177.55,0.0
gfx950,256,64,2048,512,ck,8,0,3.5558,a8w8_blockscale_1x128x128_256x16x64x256_16x16_16x16_1x1_16x16x1_16x16x1_1x16x1x16_4_1x1_intrawave_v1,37.75,377.83,0.0
gfx950,256,64,2048,1024,ck,8,0,4.7716,a8w8_blockscale_1x128x128_256x16x64x256_16x16_16x16_1x1_16x16x1_16x16x1_1x16x1x16_4_1x1_intrawave_v1,56.26,508.18,0.0
gfx950,256,64,2048,2048,ck,8,0,7.9346,a8w8_blockscale_1x128x128_256x16x64x256_16x16_16x16_1x1_16x16x1_16x16x1_1x16x1x16_4_1x1_intrawave_v1,67.66,578.17,0.0
gfx950,256,64,2048,4096,ck,8,0,13.3256,a8w8_blockscale_1x128x128_256x16x64x256_16x16_16x16_1x1_16x16x1_16x16x1_1x16x1x16_4_1x1_intrawave_v1,80.58,668.86,0.0
gfx950,256,72,2048,2048,ck,8,0,8.0556,a8w8_blockscale_1x128x128_256x16x64x256_16x16_16x16_1x1_16x16x1_16x16x1_1x16x1x16_4_1x1_intrawave_v1,74.98,575.58,0.0
gfx950,256,80,2048,128,ck,6,0,3.0048,a8w8_blockscale_1x128x128_256x16x64x128_8x16_16x16_1x1_16x16x1_8x32x1_1x16x1x16_4_1x1_intrawave_v1,13.96,199.7,0.0
gfx950,256,80,2048,512,ck,8,0,3.5898,a8w8_blockscale_1x128x128_256x16x64x256_16x16_16x16_1x1_16x16x1_16x16x1_1x16x1x16_4_1x1_intrawave_v1,46.74,394.79,0.0
gfx950,256,80,2048,1024,ck,8,0,4.877,a8w8_blockscale_1x128x128_256x16x64x256_16x16_16x16_1x1_16x16x1_16x16x1_1x16x1x16_4_1x1_intrawave_v1,68.8,513.99,0.0
gfx950,256,80,2048,2048,ck,8,0,7.8627,a8w8_blockscale_1x128x128_256x16x64x256_16x16_16x16_1x1_16x16x1_16x16x1_1x16x1x16_4_1x1_intrawave_v1,85.35,595.96,0.0
gfx950,256,80,2048,4096,ck,8,0,13.2349,a8w8_blockscale_1x128x128_256x16x64x256_16x16_16x16_1x1_16x16x1_16x16x1_1x16x1x16_4_1x1_intrawave_v1,101.41,683.34,0.0
gfx950,256,88,2048,2048,ck,8,0,8.0019,a8w8_blockscale_1x128x128_256x16x64x256_16x16_16x16_1x1_16x16x1_16x16x1_1x16x1x16_4_1x1_intrawave_v1,92.25,591.73,0.0
gfx950,256,96,2048,128,ck,6,0,3.0549,a8w8_blockscale_1x128x128_256x16x64x128_8x16_16x16_1x1_16x16x1_8x32x1_1x16x1x16_4_1x1_intrawave_v1,16.48,218.55,0.0
gfx950,256,96,2048,512,ck,8,0,3.619,a8w8_blockscale_1x128x128_256x16x64x256_16x16_16x16_1x1_16x16x1_16x16x1_1x16x1x16_4_1x1_intrawave_v1,55.63,411.98,0.0
gfx950,256,96,2048,1024,ck,8,0,4.9734,a8w8_blockscale_1x128x128_256x16x64x256_16x16_16x16_1x1_16x16x1_16x16x1_1x16x1x16_4_1x1_intrawave_v1,80.96,520.5,0.0
gfx950,256,96,2048,2048,ck,8,0,7.7816,a8w8_blockscale_1x128x128_256x16x64x256_16x16_16x16_1x1_16x16x1_16x16x1_1x16x1x16_4_1x1_intrawave_v1,103.49,614.8,0.0
gfx950,256,96,2048,4096,ck,8,0,13.4601,a8w8_blockscale_1x128x128_256x16x64x256_16x16_16x16_1x1_16x16x1_16x16x1_1x16x1x16_4_1x1_intrawave_v1,119.66,681.65,0.0
gfx950,256,104,2048,2048,ck,8,0,8.0076,a8w8_blockscale_1x128x128_256x16x64x256_16x16_16x16_1x1_16x16x1_16x16x1_1x16x1x16_4_1x1_intrawave_v1,108.95,603.59,0.0
gfx950,256,112,2048,128,ck,6,0,3.0374,a8w8_blockscale_1x128x128_256x16x64x128_8x16_16x16_1x1_16x16x1_8x32x1_1x16x1x16_4_1x1_intrawave_v1,19.33,242.06,0.0
gfx950,256,112,2048,512,ck,8,0,3.6694,a8w8_blockscale_1x128x128_256x16x64x256_16x16_16x16_1x1_16x16x1_16x16x1_1x16x1x16_4_1x1_intrawave_v1,64.01,426.41,0.0
gfx950,256,112,2048,1024,ck,8,0,4.9876,a8w8_blockscale_1x128x128_256x16x64x256_16x16_16x16_1x1_16x16x1_16x16x1_1x16x1x16_4_1x1_intrawave_v1,94.19,535.45,0.0
gfx950,256,112,2048,2048,ck,8,0,7.7665,a8w8_blockscale_1x128x128_256x16x64x256_16x16_16x16_1x1_16x16x1_16x16x1_1x16x1x16_4_1x1_intrawave_v1,120.97,628.65,0.0
gfx950,256,112,2048,4096,ck,8,0,13.7739,a8w8_blockscale_1x128x128_256x16x64x256_16x16_16x16_1x1_16x16x1_16x16x1_1x16x1x16_4_1x1_intrawave_v1,136.42,675.63,0.0
gfx950,256,120,2048,2048,ck,8,0,7.9763,a8w8_blockscale_1x128x128_256x16x64x256_16x16_16x16_1x1_16x16x1_16x16x1_1x16x1x16_4_1x1_intrawave_v1,126.2,618.28,0.0
gfx950,256,128,2048,128,ck,6,0,3.0859,a8w8_blockscale_1x128x128_256x16x64x128_8x16_16x16_1x1_16x16x1_8x32x1_1x16x1x16_4_1x1_intrawave_v1,21.75,260.16,0.0
gfx950,256,128,2048,512,ck,8,0,3.6949,a8w8_blockscale_1x128x128_256x16x64x256_16x16_16x16_1x1_16x16x1_16x16x1_1x16x1x16_4_1x1_intrawave_v1,72.65,443.42,0.0
gfx950,256,128,2048,1024,ck,8,0,5.0172,a8w8_blockscale_1x128x128_256x16x64x256_16x16_16x16_1x1_16x16x1_16x16x1_1x16x1x16_4_1x1_intrawave_v1,107.01,548.62,0.0
gfx950,256,128,2048,2048,ck,8,0,7.7072,a8w8_blockscale_1x128x128_256x16x64x256_16x16_16x16_1x1_16x16x1_16x16x1_1x16x1x16_4_1x1_intrawave_v1,139.32,646.24,0.0
gfx950,256,128,2048,4096,ck,8,0,13.5823,a8w8_blockscale_1x128x128_256x16x64x256_16x16_16x16_1x1_16x16x1_16x16x1_1x16x1x16_4_1x1_intrawave_v1,158.11,694.81,0.0
gfx950,256,136,2048,2048,ck,7,0,9.3053,a8w8_blockscale_1x128x128_256x16x128x256_16x16_16x16_1x2_16x16x1_16x16x1_1x16x1x16_8_1x2_intrawave_v1,122.6,540.54,0.0
gfx950,256,144,2048,2048,ck,7,0,9.3382,a8w8_blockscale_1x128x128_256x16x128x256_16x16_16x16_1x2_16x16x1_16x16x1_1x16x1x16_8_1x2_intrawave_v1,129.36,543.9,0.0
gfx950,256,152,2048,2048,ck,7,0,9.3999,a8w8_blockscale_1x128x128_256x16x128x256_16x16_16x16_1x2_16x16x1_16x16x1_1x16x1x16_8_1x2_intrawave_v1,135.65,545.56,0.0
gfx950,256,160,2048,2048,ck,7,0,9.3474,a8w8_blockscale_1x128x128_256x16x128x256_16x16_16x16_1x2_16x16x1_16x16x1_1x16x1x16_8_1x2_intrawave_v1,143.59,553.88,0.0
gfx950,256,168,2048,2048,ck,13,0,9.6055,a8w8_blockscale_1x128x128_256x32x64x256_16x16_16x16_2x1_16x16x1_16x16x1_1x32x1x8_8_2x1_intrawave_v1,146.72,544.11,0.0
gfx950,256,176,2048,2048,ck,7,0,9.5426,a8w8_blockscale_1x128x128_256x16x128x256_16x16_16x16_1x2_16x16x1_16x16x1_1x16x1x16_8_1x2_intrawave_v1,154.72,552.85,0.0
gfx950,256,184,2048,2048,ck,7,0,9.6791,a8w8_blockscale_1x128x128_256x16x128x256_16x16_16x16_1x2_16x16x1_16x16x1_1x16x1x16_8_1x2_intrawave_v1,159.47,550.13,0.0
gfx950,256,192,2048,2048,ck,7,0,9.3407,a8w8_blockscale_1x128x128_256x16x128x256_16x16_16x16_1x2_16x16x1_16x16x1_1x16x1x16_8_1x2_intrawave_v1,172.43,575.33,0.0
gfx950,256,200,2048,2048,ck,7,0,9.7786,a8w8_blockscale_1x128x128_256x16x128x256_16x16_16x16_1x2_16x16x1_16x16x1_1x16x1x16_8_1x2_intrawave_v1,171.57,554.59,0.0
gfx950,256,208,2048,2048,ck,13,0,9.5157,a8w8_blockscale_1x128x128_256x32x64x256_16x16_16x16_2x1_16x16x1_16x16x1_1x32x1x8_8_2x1_intrawave_v1,183.36,575.08,0.0
gfx950,256,216,2048,2048,ck,13,0,9.5745,a8w8_blockscale_1x128x128_256x32x64x256_16x16_16x16_2x1_16x16x1_16x16x1_1x32x1x8_8_2x1_intrawave_v1,189.25,576.68,0.0
gfx950,256,224,2048,2048,ck,13,0,9.5869,a8w8_blockscale_1x128x128_256x32x64x256_16x16_16x16_2x1_16x16x1_16x16x1_1x32x1x8_8_2x1_intrawave_v1,196.0,581.06,0.0
gfx950,256,232,2048,2048,ck,7,0,9.177,a8w8_blockscale_1x128x128_256x16x128x256_16x16_16x16_1x2_16x16x1_16x16x1_1x16x1x16_8_1x2_intrawave_v1,212.07,612.37,0.0
gfx950,256,240,2048,2048,ck,7,0,9.3456,a8w8_blockscale_1x128x128_256x16x128x256_16x16_16x16_1x2_16x16x1_16x16x1_1x16x1x16_8_1x2_intrawave_v1,215.42,606.58,0.0
gfx950,256,248,2048,2048,ck,7,0,9.5001,a8w8_blockscale_1x128x128_256x16x128x256_16x16_16x16_1x2_16x16x1_16x16x1_1x16x1x16_8_1x2_intrawave_v1,218.98,601.89,0.0
gfx950,256,256,2048,128,ck,11,0,3.3223,a8w8_blockscale_1x128x128_256x32x64x128_16x16_16x16_2x1_8x32x1_8x32x1_1x32x1x8_8_2x1_intrawave_v1,40.4,404.38,0.0
gfx950,256,256,2048,512,ck,13,0,3.9386,a8w8_blockscale_1x128x128_256x32x64x256_16x16_16x16_2x1_16x16x1_16x16x1_1x32x1x8_8_2x1_intrawave_v1,136.31,565.74,0.0
gfx950,256,256,2048,1024,ck,13,0,6.0532,a8w8_blockscale_1x128x128_256x32x64x256_16x16_16x16_2x1_16x16x1_16x16x1_1x32x1x8_8_2x1_intrawave_v1,177.38,562.99,0.0
gfx950,256,256,2048,2048,ck,7,0,9.2431,a8w8_blockscale_1x128x128_256x16x128x256_16x16_16x16_1x2_16x16x1_16x16x1_1x16x1x16_8_1x2_intrawave_v1,232.33,623.94,0.0
gfx950,256,256,2048,4096,ck,18,0,16.2145,a8w8_blockscale_1x128x128_256x64x64x256_16x16_32x32_1x1_16x16x1_16x16x1_1x32x1x8_8_1x1_intrawave_v1,264.88,646.69,0.0
gfx950,256,272,2048,2048,ck,18,0,10.5507,a8w8_blockscale_1x128x128_256x64x64x256_16x16_32x32_1x1_16x16x1_16x16x1_1x32x1x8_8_1x1_intrawave_v1,216.26,555.93,0.0
gfx950,256,288,2048,2048,ck,12,0,10.6455,a8w8_blockscale_1x128x128_256x32x128x256_16x16_32x32_1x1_16x16x1_16x16x1_1x32x1x8_8_1x1_intrawave_v1,226.94,560.22,0.0
gfx950,256,304,2048,2048,ck,18,0,11.1767,a8w8_blockscale_1x128x128_256x64x64x256_16x16_32x32_1x1_16x16x1_16x16x1_1x32x1x8_8_1x1_intrawave_v1,228.17,542.39,0.0
gfx950,256,320,2048,2048,ck,18,0,9.8555,a8w8_blockscale_1x128x128_256x64x64x256_16x16_32x32_1x1_16x16x1_16x16x1_1x32x1x8_8_1x1_intrawave_v1,272.37,625.07,0.0
gfx950,256,336,2048,2048,ck,18,0,11.0599,a8w8_blockscale_1x128x128_256x64x64x256_16x16_32x32_1x1_16x16x1_16x16x1_1x32x1x8_8_1x1_intrawave_v1,254.85,565.89,0.0
gfx950,256,352,2048,2048,ck,18,0,10.7116,a8w8_blockscale_1x128x128_256x64x64x256_16x16_32x32_1x1_16x16x1_16x16x1_1x32x1x8_8_1x1_intrawave_v1,275.66,593.47,0.0
gfx950,256,368,2048,2048,ck,18,0,11.075,a8w8_blockscale_1x128x128_256x64x64x256_16x16_32x32_1x1_16x16x1_16x16x1_1x32x1x8_8_1x1_intrawave_v1,278.74,582.87,0.0
gfx950,256,384,2048,2048,ck,18,0,9.5889,a8w8_blockscale_1x128x128_256x64x64x256_16x16_32x32_1x1_16x16x1_16x16x1_1x32x1x8_8_1x1_intrawave_v1,335.93,683.46,0.0
gfx950,256,400,2048,2048,ck,18,0,11.3435,a8w8_blockscale_1x128x128_256x64x64x256_16x16_32x32_1x1_16x16x1_16x16x1_1x32x1x8_8_1x1_intrawave_v1,295.8,586.41,0.0
gfx950,256,416,2048,2048,ck,18,0,11.1725,a8w8_blockscale_1x128x128_256x64x64x256_16x16_32x32_1x1_16x16x1_16x16x1_1x32x1x8_8_1x1_intrawave_v1,312.34,604.18,0.0
gfx950,256,432,2048,2048,ck,18,0,11.7935,a8w8_blockscale_1x128x128_256x64x64x256_16x16_32x32_1x1_16x16x1_16x16x1_1x32x1x8_8_1x1_intrawave_v1,307.28,580.7,0.0
gfx950,256,448,2048,2048,ck,18,0,9.3816,a8w8_blockscale_1x128x128_256x64x64x256_16x16_32x32_1x1_16x16x1_16x16x1_1x32x1x8_8_1x1_intrawave_v1,400.58,740.47,0.0
gfx950,256,464,2048,2048,ck,18,0,11.6492,a8w8_blockscale_1x128x128_256x64x64x256_16x16_32x32_1x1_16x16x1_16x16x1_1x32x1x8_8_1x1_intrawave_v1,334.13,604.77,0.0
gfx950,256,480,2048,2048,ck,12,0,11.4743,a8w8_blockscale_1x128x128_256x32x128x256_16x16_32x32_1x1_16x16x1_16x16x1_1x32x1x8_8_1x1_intrawave_v1,350.92,622.56,0.0
gfx950,256,496,2048,2048,ck,18,0,11.9259,a8w8_blockscale_1x128x128_256x64x64x256_16x16_32x32_1x1_16x16x1_16x16x1_1x32x1x8_8_1x1_intrawave_v1,348.88,607.23,0.0
gfx950,256,512,2048,128,ck,16,0,3.9615,a8w8_blockscale_1x128x128_256x64x64x128_16x16_32x32_1x1_8x32x1_8x32x1_1x32x1x8_8_1x1_intrawave_v1,67.76,612.1,0.0
gfx950,256,512,2048,512,ck,18,0,5.0758,a8w8_blockscale_1x128x128_256x64x64x256_16x16_32x32_1x1_16x16x1_16x16x1_1x32x1x8_8_1x1_intrawave_v1,211.54,671.4,0.0
gfx950,256,512,2048,1024,ck,18,0,6.9558,a8w8_blockscale_1x128x128_256x64x64x256_16x16_32x32_1x1_16x16x1_16x16x1_1x32x1x8_8_1x1_intrawave_v1,308.73,678.37,0.0
gfx950,256,512,2048,2048,ck,18,0,9.5281,a8w8_blockscale_1x128x128_256x64x64x256_16x16_32x32_1x1_16x16x1_16x16x1_1x32x1x8_8_1x1_intrawave_v1,450.77,770.36,0.0
gfx950,256,512,2048,4096,ck,18,0,16.8741,a8w8_blockscale_1x128x128_256x64x64x256_16x16_32x32_1x1_16x16x1_16x16x1_1x32x1x8_8_1x1_intrawave_v1,509.06,745.69,0.0
gfx950,256,588,2048,128,ck,6,0,4.5888,a8w8_blockscale_1x128x128_256x16x64x128_8x16_16x16_1x1_16x16x1_8x32x1_1x16x1x16_4_1x1_intrawave_v1,67.18,598.38,0.0
gfx950,256,588,2048,1024,ck,3,0,9.7171,a8w8_blockscale_1x128x128_256x64x64x128_16x16_32x32_1x1_8x32x1_8x32x1_1x32x1x8_8_1x1_intrawave_v3,253.81,525.64,0.0
gfx950,256,664,2048,2048,ck,2,0,15.3123,a8w8_blockscale_1x128x128_256x64x128x128_16x16_32x32_1x2_8x32x1_8x32x1_1x32x1x8_8_1x1_intrawave_v3,363.76,540.34,0.0
gfx950,256,667,2048,512,ck,13,0,6.465,a8w8_blockscale_1x128x128_256x32x64x256_16x16_16x16_2x1_16x16x1_16x16x1_1x32x1x8_8_2x1_intrawave_v1,216.37,637.6,0.0
gfx950,256,667,2048,4096,ck,2,0,25.8383,a8w8_blockscale_1x128x128_256x64x128x128_16x16_32x32_1x2_8x32x1_8x32x1_1x32x1x8_8_1x1_intrawave_v3,433.09,536.13,0.0
gfx950,256,671,2048,512,ck,13,0,6.4864,a8w8_blockscale_1x128x128_256x32x64x256_16x16_16x16_2x1_16x16x1_16x16x1_1x32x1x8_8_2x1_intrawave_v1,216.94,638.34,0.0
gfx950,256,671,2048,4096,ck,2,0,25.8194,a8w8_blockscale_1x128x128_256x64x128x128_16x16_32x32_1x2_8x32x1_8x32x1_1x32x1x8_8_1x1_intrawave_v3,436.01,537.79,0.0
gfx950,256,762,2048,2048,ck,2,0,15.5623,a8w8_blockscale_1x128x128_256x64x128x128_16x16_32x32_1x2_8x32x1_8x32x1_1x32x1x8_8_1x1_intrawave_v3,410.74,570.35,0.0
gfx950,256,773,2048,128,ck,16,0,5.2283,a8w8_blockscale_1x128x128_256x64x64x128_16x16_32x32_1x1_8x32x1_8x32x1_1x32x1x8_8_1x1_intrawave_v1,77.52,674.65,0.0
gfx950,256,773,2048,1024,ck,2,0,9.7509,a8w8_blockscale_1x128x128_256x64x128x128_16x16_32x32_1x2_8x32x1_8x32x1_1x32x1x8_8_1x1_intrawave_v3,332.5,620.96,0.0
gfx950,256,822,2048,128,ck,16,0,5.2122,a8w8_blockscale_1x128x128_256x64x64x128_16x16_32x32_1x1_8x32x1_8x32x1_1x32x1x8_8_1x1_intrawave_v1,82.68,716.45,0.0
gfx950,256,822,2048,1024,ck,18,0,9.9161,a8w8_blockscale_1x128x128_256x64x64x256_16x16_32x32_1x1_16x16x1_16x16x1_1x32x1x8_8_1x1_intrawave_v1,347.69,635.91,0.0
gfx950,256,902,2048,2048,ck,2,0,15.7632,a8w8_blockscale_1x128x128_256x64x128x128_16x16_32x32_1x2_8x32x1_8x32x1_1x32x1x8_8_1x1_intrawave_v3,480.01,617.65,0.0
gfx950,256,931,2048,512,ck,18,0,7.2387,a8w8_blockscale_1x128x128_256x64x64x256_16x16_32x32_1x1_16x16x1_16x16x1_1x32x1x8_8_1x1_intrawave_v1,269.72,737.51,0.0
gfx950,256,931,2048,4096,ck,2,0,26.273,a8w8_blockscale_1x128x128_256x64x128x128_16x16_32x32_1x2_8x32x1_8x32x1_1x32x1x8_8_1x1_intrawave_v3,594.51,609.57,0.0
gfx950,256,961,2048,2048,ck,2,0,15.775,a8w8_blockscale_1x128x128_256x64x128x128_16x16_32x32_1x2_8x32x1_8x32x1_1x32x1x8_8_1x1_intrawave_v3,511.03,640.17,0.0
gfx950,256,1000,2048,2048,ck,2,0,15.7877,a8w8_blockscale_1x128x128_256x64x128x128_16x16_32x32_1x2_8x32x1_8x32x1_1x32x1x8_8_1x1_intrawave_v3,531.34,654.83,0.0
gfx950,256,1001,2048,2048,ck,2,0,15.8108,a8w8_blockscale_1x128x128_256x64x128x128_16x16_32x32_1x2_8x32x1_8x32x1_1x32x1x8_8_1x1_intrawave_v3,531.09,654.26,0.0
gfx950,256,1002,2048,2048,ck,2,0,15.7983,a8w8_blockscale_1x128x128_256x64x128x128_16x16_32x32_1x2_8x32x1_8x32x1_1x32x1x8_8_1x1_intrawave_v3,532.04,655.17,0.0
gfx950,256,1003,2048,2048,ck,2,0,15.7034,a8w8_blockscale_1x128x128_256x64x128x128_16x16_32x32_1x2_8x32x1_8x32x1_1x32x1x8_8_1x1_intrawave_v3,535.79,659.52,0.0
gfx950,256,1015,2048,2048,ck,2,0,15.7813,a8w8_blockscale_1x128x128_256x64x128x128_16x16_32x32_1x2_8x32x1_8x32x1_1x32x1x8_8_1x1_intrawave_v3,539.53,660.94,0.0
gfx950,256,1023,2048,2048,ck,2,0,15.8497,a8w8_blockscale_1x128x128_256x64x128x128_16x16_32x32_1x2_8x32x1_8x32x1_1x32x1x8_8_1x1_intrawave_v3,541.43,661.19,0.0
gfx950,256,1024,2048,128,ck,16,0,5.3844,a8w8_blockscale_1x128x128_256x64x64x128_16x16_32x32_1x1_8x32x1_8x32x1_1x32x1x8_8_1x1_intrawave_v1,99.71,852.0,0.0
gfx950,256,1024,2048,512,ck,18,0,7.1916,a8w8_blockscale_1x128x128_256x64x64x256_16x16_32x32_1x1_16x16x1_16x16x1_1x32x1x8_8_1x1_intrawave_v1,298.61,801.93,0.0
gfx950,256,1024,2048,1024,ck,18,0,10.0059,a8w8_blockscale_1x128x128_256x64x64x256_16x16_32x32_1x1_16x16x1_16x16x1_1x32x1x8_8_1x1_intrawave_v1,429.24,733.57,0.0
gfx950,256,1024,2048,2048,ck,2,0,15.5236,a8w8_blockscale_1x128x128_256x64x128x128_16x16_32x32_1x2_8x32x1_8x32x1_1x32x1x8_8_1x1_intrawave_v3,553.35,675.47,0.0
gfx950,256,1024,2048,4096,ck,2,0,26.011,a8w8_blockscale_1x128x128_256x64x128x128_16x16_32x32_1x2_8x32x1_8x32x1_1x32x1x8_8_1x1_intrawave_v3,660.48,645.0,0.0
gfx950,256,1025,2048,128,ck,6,0,6.0056,a8w8_blockscale_1x128x128_256x16x64x128_8x16_16x16_1x1_16x16x1_8x32x1_1x16x1x16_4_1x1_intrawave_v1,89.48,764.58,0.0
gfx950,256,1025,2048,512,ck,13,0,8.4956,a8w8_blockscale_1x128x128_256x32x64x256_16x16_16x16_2x1_16x16x1_16x16x1_1x32x1x8_8_2x1_intrawave_v1,253.02,679.38,0.0
gfx950,256,1025,2048,1024,ck,3,0,12.4981,a8w8_blockscale_1x128x128_256x64x64x128_16x16_32x32_1x1_8x32x1_8x32x1_1x32x1x8_8_1x1_intrawave_v3,343.99,587.7,0.0
gfx950,256,1025,2048,2048,ck,3,0,19.225,a8w8_blockscale_1x128x128_256x64x64x128_16x16_32x32_1x1_8x32x1_8x32x1_1x32x1x8_8_1x1_intrawave_v3,447.25,545.74,0.0
gfx950,256,1025,2048,4096,ck,2,0,32.4305,a8w8_blockscale_1x128x128_256x64x128x128_16x16_32x32_1x2_8x32x1_8x32x1_1x32x1x8_8_1x1_intrawave_v3,530.26,517.58,0.0
gfx950,256,1027,2048,128,ck,6,0,6.0201,a8w8_blockscale_1x128x128_256x16x64x128_8x16_16x16_1x1_16x16x1_8x32x1_1x16x1x16_4_1x1_intrawave_v1,89.44,764.14,0.0
gfx950,256,1027,2048,512,ck,13,0,8.461,a8w8_blockscale_1x128x128_256x32x64x256_16x16_16x16_2x1_16x16x1_16x16x1_1x32x1x8_8_2x1_intrawave_v1,254.55,683.25,0.0
gfx950,256,1027,2048,1024,ck,3,0,12.187,a8w8_blockscale_1x128x128_256x64x64x128_16x16_32x32_1x1_8x32x1_8x32x1_1x32x1x8_8_1x1_intrawave_v3,353.45,603.54,0.0
gfx950,256,1027,2048,4096,ck,2,0,32.1814,a8w8_blockscale_1x128x128_256x64x128x128_16x16_32x32_1x2_8x32x1_8x32x1_1x32x1x8_8_1x1_intrawave_v3,535.41,522.1,0.0
gfx950,256,1031,2048,512,ck,13,0,8.4589,a8w8_blockscale_1x128x128_256x32x64x256_16x16_16x16_2x1_16x16x1_16x16x1_1x32x1x8_8_2x1_intrawave_v1,255.61,685.6,0.0
gfx950,256,1031,2048,4096,ck,0,0,32.2002,a8w8_blockscale_1x128x128_256x128x128x128_16x16_32x32_2x2_8x32x1_8x32x1_1x32x1x8_8_1x1_intrawave_v3,537.18,522.81,0.0
gfx950,256,1032,2048,2048,ck,3,0,19.2359,a8w8_blockscale_1x128x128_256x64x64x128_16x16_32x32_1x1_8x32x1_8x32x1_1x32x1x8_8_1x1_intrawave_v3,450.05,547.67,0.0
gfx950,256,1038,2048,2048,ck,3,0,19.2579,a8w8_blockscale_1x128x128_256x64x64x128_16x16_32x32_1x1_8x32x1_8x32x1_1x32x1x8_8_1x1_intrawave_v3,452.15,548.96,0.0
gfx950,256,1039,2048,512,ck,13,0,8.5295,a8w8_blockscale_1x128x128_256x32x64x256_16x16_16x16_2x1_16x16x1_16x16x1_1x32x1x8_8_2x1_intrawave_v1,255.46,684.25,0.0
gfx950,256,1039,2048,4096,ck,0,0,32.275,a8w8_blockscale_1x128x128_256x128x128x128_16x16_32x32_2x2_8x32x1_8x32x1_1x32x1x8_8_1x1_intrawave_v3,540.09,523.63,0.0
gfx950,256,1040,2048,512,ck,13,0,8.465,a8w8_blockscale_1x128x128_256x32x64x256_16x16_16x16_2x1_16x16x1_16x16x1_1x32x1x8_8_2x1_intrawave_v1,257.65,690.01,0.0
gfx950,256,1040,2048,4096,ck,0,0,32.2824,a8w8_blockscale_1x128x128_256x128x128x128_16x16_32x32_2x2_8x32x1_8x32x1_1x32x1x8_8_1x1_intrawave_v3,540.49,523.76,0.0
gfx950,256,1041,2048,512,ck,13,0,8.4597,a8w8_blockscale_1x128x128_256x32x64x256_16x16_16x16_2x1_16x16x1_16x16x1_1x32x1x8_8_2x1_intrawave_v1,258.06,690.98,0.0
gfx950,256,1041,2048,4096,ck,0,0,32.3155,a8w8_blockscale_1x128x128_256x128x128x128_16x16_32x32_2x2_8x32x1_8x32x1_1x32x1x8_8_1x1_intrawave_v3,540.46,523.48,0.0
gfx950,256,1042,2048,128,ck,6,0,6.0692,a8w8_blockscale_1x128x128_256x16x64x128_8x16_16x16_1x1_16x16x1_8x32x1_1x16x1x16_4_1x1_intrawave_v1,90.01,768.4,0.0
gfx950,256,1042,2048,1024,ck,3,0,12.4779,a8w8_blockscale_1x128x128_256x64x64x128_16x16_32x32_1x1_8x32x1_8x32x1_1x32x1x8_8_1x1_intrawave_v3,350.26,595.63,0.0
gfx950,256,1051,2048,128,ck,6,0,6.0303,a8w8_blockscale_1x128x128_256x16x64x128_8x16_16x16_1x1_16x16x1_8x32x1_1x16x1x16_4_1x1_intrawave_v1,91.38,779.66,0.0
gfx950,256,1051,2048,1024,ck,3,0,12.5357,a8w8_blockscale_1x128x128_256x64x64x128_16x16_32x32_1x1_8x32x1_8x32x1_1x32x1x8_8_1x1_intrawave_v3,351.65,596.56,0.0
gfx950,256,1055,2048,128,ck,6,0,6.0861,a8w8_blockscale_1x128x128_256x16x64x128_8x16_16x16_1x1_16x16x1_8x32x1_1x16x1x16_4_1x1_intrawave_v1,90.88,775.29,0.0
gfx950,256,1055,2048,1024,ck,3,0,12.5319,a8w8_blockscale_1x128x128_256x64x64x128_16x16_32x32_1x1_8x32x1_8x32x1_1x32x1x8_8_1x1_intrawave_v3,353.1,598.37,0.0
gfx950,256,1057,2048,128,ck,6,0,6.045,a8w8_blockscale_1x128x128_256x16x64x128_8x16_16x16_1x1_16x16x1_8x32x1_1x16x1x16_4_1x1_intrawave_v1,91.67,781.95,0.0
gfx950,256,1057,2048,1024,ck,3,0,12.6283,a8w8_blockscale_1x128x128_256x64x64x128_16x16_32x32_1x1_8x32x1_8x32x1_1x32x1x8_8_1x1_intrawave_v3,351.07,594.62,0.0
gfx950,256,1069,2048,128,ck,6,0,6.092,a8w8_blockscale_1x128x128_256x16x64x128_8x16_16x16_1x1_16x16x1_8x32x1_1x16x1x16_4_1x1_intrawave_v1,92.0,784.24,0.0
gfx950,256,1069,2048,1024,ck,3,0,12.6419,a8w8_blockscale_1x128x128_256x64x64x128_16x16_32x32_1x1_8x32x1_8x32x1_1x32x1x8_8_1x1_intrawave_v3,354.67,598.84,0.0
gfx950,256,1072,2048,128,ck,6,0,6.0844,a8w8_blockscale_1x128x128_256x16x64x128_8x16_16x16_1x1_16x16x1_8x32x1_1x16x1x16_4_1x1_intrawave_v1,92.37,787.3,0.0
gfx950,256,1072,2048,512,ck,13,0,8.5435,a8w8_blockscale_1x128x128_256x32x64x256_16x16_16x16_2x1_16x16x1_16x16x1_1x32x1x8_8_2x1_intrawave_v1,263.14,700.92,0.0
gfx950,256,1072,2048,1024,ck,3,0,12.5547,a8w8_blockscale_1x128x128_256x64x64x128_16x16_32x32_1x1_8x32x1_8x32x1_1x32x1x8_8_1x1_intrawave_v3,358.14,604.22,0.0
gfx950,256,1072,2048,4096,ck,0,0,32.4632,a8w8_blockscale_1x128x128_256x128x128x128_16x16_32x32_2x2_8x32x1_8x32x1_1x32x1x8_8_1x1_intrawave_v3,554.02,528.92,0.0
gfx950,256,1073,2048,512,ck,13,0,8.5481,a8w8_blockscale_1x128x128_256x32x64x256_16x16_16x16_2x1_16x16x1_16x16x1_1x32x1x8_8_2x1_intrawave_v1,263.24,701.09,0.0
gfx950,256,1073,2048,4096,ck,2,0,32.4685,a8w8_blockscale_1x128x128_256x64x128x128_16x16_32x32_1x2_8x32x1_8x32x1_1x32x1x8_8_1x1_intrawave_v3,554.44,529.09,0.0
gfx950,256,1074,2048,128,ck,6,0,6.0872,a8w8_blockscale_1x128x128_256x16x64x128_8x16_16x16_1x1_16x16x1_8x32x1_1x16x1x16_4_1x1_intrawave_v1,92.5,788.33,0.0
gfx950,256,1074,2048,1024,ck,3,0,12.3122,a8w8_blockscale_1x128x128_256x64x64x128_16x16_32x32_1x1_8x32x1_8x32x1_1x32x1x8_8_1x1_intrawave_v3,365.87,616.95,0.0
gfx950,256,1077,2048,512,ck,13,0,8.5648,a8w8_blockscale_1x128x128_256x32x64x256_16x16_16x16_2x1_16x16x1_16x16x1_1x32x1x8_8_2x1_intrawave_v1,263.71,701.87,0.0
gfx950,256,1077,2048,4096,ck,2,0,32.4329,a8w8_blockscale_1x128x128_256x64x128x128_16x16_32x32_1x2_8x32x1_8x32x1_1x32x1x8_8_1x1_intrawave_v3,557.12,530.68,0.0
gfx950,256,1087,2048,2048,ck,3,0,19.2461,a8w8_blockscale_1x128x128_256x64x64x128_16x16_32x32_1x1_8x32x1_8x32x1_1x32x1x8_8_1x1_intrawave_v3,473.78,564.94,0.0
gfx950,256,1091,2048,128,ck,6,0,6.1603,a8w8_blockscale_1x128x128_256x16x64x128_8x16_16x16_1x1_16x16x1_8x32x1_1x16x1x16_4_1x1_intrawave_v1,92.85,790.63,0.0
gfx950,256,1091,2048,512,ck,13,0,8.6461,a8w8_blockscale_1x128x128_256x32x64x256_16x16_16x16_2x1_16x16x1_16x16x1_1x32x1x8_8_2x1_intrawave_v1,264.63,702.73,0.0
gfx950,256,1091,2048,1024,ck,3,0,12.6563,a8w8_blockscale_1x128x128_256x64x64x128_16x16_32x32_1x1_8x32x1_8x32x1_1x32x1x8_8_1x1_intrawave_v3,361.56,607.06,0.0
gfx950,256,1091,2048,4096,ck,2,0,32.6829,a8w8_blockscale_1x128x128_256x64x128x128_16x16_32x32_1x2_8x32x1_8x32x1_1x32x1x8_8_1x1_intrawave_v3,560.05,530.13,0.0
gfx950,256,1128,2048,128,ck,11,0,6.2364,a8w8_blockscale_1x128x128_256x32x64x128_16x16_16x16_2x1_8x32x1_8x32x1_1x32x1x8_8_2x1_intrawave_v1,94.83,806.04,0.0
gfx950,256,1128,2048,1024,ck,3,0,12.2255,a8w8_blockscale_1x128x128_256x64x64x128_16x16_32x32_1x1_8x32x1_8x32x1_1x32x1x8_8_1x1_intrawave_v3,386.99,643.94,0.0
gfx950,256,1136,2048,128,ck,6,0,6.2778,a8w8_blockscale_1x128x128_256x16x64x128_8x16_16x16_1x1_16x16x1_8x32x1_1x16x1x16_4_1x1_intrawave_v1,94.87,806.11,0.0
gfx950,256,1136,2048,1024,ck,3,0,12.2413,a8w8_blockscale_1x128x128_256x64x64x128_16x16_32x32_1x1_8x32x1_8x32x1_1x32x1x8_8_1x1_intrawave_v3,389.23,646.46,0.0
gfx950,256,1255,2048,2048,ck,3,0,19.5158,a8w8_blockscale_1x128x128_256x64x64x128_16x16_32x32_1x1_8x32x1_8x32x1_1x32x1x8_8_1x1_intrawave_v3,539.45,610.02,0.0
gfx950,256,1343,2048,512,ck,18,0,8.902,a8w8_blockscale_1x128x128_256x64x64x256_16x16_32x32_1x1_16x16x1_16x16x1_1x32x1x8_8_1x1_intrawave_v1,316.39,812.98,0.0
gfx950,256,1343,2048,4096,ck,0,0,33.3188,a8w8_blockscale_1x128x128_256x128x128x128_16x16_32x32_2x2_8x32x1_8x32x1_1x32x1x8_8_1x1_intrawave_v3,676.25,581.97,0.0
gfx950,256,1351,2048,2048,ck,0,0,20.0531,a8w8_blockscale_1x128x128_256x128x128x128_16x16_32x32_2x2_8x32x1_8x32x1_1x32x1x8_8_1x1_intrawave_v3,565.15,623.09,0.0
gfx950,256,1376,2048,2048,ck,0,0,20.1519,a8w8_blockscale_1x128x128_256x128x128x128_16x16_32x32_2x2_8x32x1_8x32x1_1x32x1x8_8_1x1_intrawave_v3,572.79,627.66,0.0
gfx950,256,1380,2048,2048,ck,0,0,20.2596,a8w8_blockscale_1x128x128_256x128x128x128_16x16_32x32_2x2_8x32x1_8x32x1_1x32x1x8_8_1x1_intrawave_v3,571.4,625.53,0.0
gfx950,256,1391,2048,2048,ck,0,0,20.2283,a8w8_blockscale_1x128x128_256x128x128x128_16x16_32x32_2x2_8x32x1_8x32x1_1x32x1x8_8_1x1_intrawave_v3,576.84,629.84,0.0
gfx950,256,1514,2048,128,ck,16,0,6.7558,a8w8_blockscale_1x128x128_256x64x64x128_16x16_32x32_1x1_8x32x1_8x32x1_1x32x1x8_8_1x1_intrawave_v1,117.49,985.42,0.0
gfx950,256,1514,2048,1024,ck,3,0,13.1035,a8w8_blockscale_1x128x128_256x64x64x128_16x16_32x32_1x1_8x32x1_8x32x1_1x32x1x8_8_1x1_intrawave_v3,484.62,751.62,0.0
gfx950,256,1688,2048,512,ck,0,0,9.8671,a8w8_blockscale_1x128x128_256x128x128x128_16x16_32x32_2x2_8x32x1_8x32x1_1x32x1x8_8_1x1_intrawave_v3,358.77,894.58,0.0
gfx950,256,1688,2048,4096,ck,0,0,34.1503,a8w8_blockscale_1x128x128_256x128x128x128_16x16_32x32_2x2_8x32x1_8x32x1_1x32x1x8_8_1x1_intrawave_v3,829.27,650.56,0.0
gfx950,256,1710,2048,2048,ck,0,0,20.6005,a8w8_blockscale_1x128x128_256x128x128x128_16x16_32x32_2x2_8x32x1_8x32x1_1x32x1x8_8_1x1_intrawave_v3,696.32,713.6,0.0
gfx950,256,1808,2048,2048,ck,0,0,20.7894,a8w8_blockscale_1x128x128_256x128x128x128_16x16_32x32_2x2_8x32x1_8x32x1_1x32x1x8_8_1x1_intrawave_v3,729.54,736.08,0.0
gfx950,256,1809,2048,2048,ck,0,0,20.7445,a8w8_blockscale_1x128x128_256x128x128x128_16x16_32x32_2x2_8x32x1_8x32x1_1x32x1x8_8_1x1_intrawave_v3,731.52,737.97,0.0
gfx950,256,1870,2048,2048,ck,0,0,20.8867,a8w8_blockscale_1x128x128_256x128x128x128_16x16_32x32_2x2_8x32x1_8x32x1_1x32x1x8_8_1x1_intrawave_v3,751.04,750.89,0.0
gfx950,256,1967,2048,2048,ck,0,0,21.1633,a8w8_blockscale_1x128x128_256x128x128x128_16x16_32x32_2x2_8x32x1_8x32x1_1x32x1x8_8_1x1_intrawave_v3,779.67,769.24,0.0
gfx950,256,1970,2048,2048,ck,0,0,21.1192,a8w8_blockscale_1x128x128_256x128x128x128_16x16_32x32_2x2_8x32x1_8x32x1_1x32x1x8_8_1x1_intrawave_v3,782.49,771.71,0.0
gfx950,256,2000,2048,2048,ck,0,0,21.1733,a8w8_blockscale_1x128x128_256x128x128x128_16x16_32x32_2x2_8x32x1_8x32x1_1x32x1x8_8_1x1_intrawave_v3,792.38,778.45,0.0
gfx950,256,2001,2048,2048,ck,0,0,21.2556,a8w8_blockscale_1x128x128_256x128x128x128_16x16_32x32_2x2_8x32x1_8x32x1_1x32x1x8_8_1x1_intrawave_v3,789.7,775.72,0.0
gfx950,256,2016,2048,2048,ck,0,0,21.2171,a8w8_blockscale_1x128x128_256x128x128x128_16x16_32x32_2x2_8x32x1_8x32x1_1x32x1x8_8_1x1_intrawave_v3,797.07,781.47,0.0
gfx950,256,2017,2048,128,ck,16,0,8.0544,a8w8_blockscale_1x128x128_256x64x64x128_16x16_32x32_1x1_8x32x1_8x32x1_1x32x1x8_8_1x1_intrawave_v1,131.29,1090.33,0.0
gfx950,256,2017,2048,512,ck,0,0,10.018,a8w8_blockscale_1x128x128_256x128x128x128_16x16_32x32_2x2_8x32x1_8x32x1_1x32x1x8_8_1x1_intrawave_v3,422.24,1032.43,0.0
gfx950,256,2017,2048,1024,ck,0,0,14.2439,a8w8_blockscale_1x128x128_256x128x128x128_16x16_32x32_2x2_8x32x1_8x32x1_1x32x1x8_8_1x1_intrawave_v3,593.93,872.25,0.0
gfx950,256,2017,2048,2048,ck,0,0,21.1681,a8w8_blockscale_1x128x128_256x128x128x128_16x16_32x32_2x2_8x32x1_8x32x1_1x32x1x8_8_1x1_intrawave_v3,799.31,783.57,0.0
gfx950,256,2017,2048,4096,ck,0,0,35.3193,a8w8_blockscale_1x128x128_256x128x128x128_16x16_32x32_2x2_8x32x1_8x32x1_1x32x1x8_8_1x1_intrawave_v3,958.11,705.33,0.0
gfx950,256,2046,2048,2048,ck,0,0,21.1641,a8w8_blockscale_1x128x128_256x128x128x128_16x16_32x32_2x2_8x32x1_8x32x1_1x32x1x8_8_1x1_intrawave_v3,810.95,792.14,0.0
gfx950,256,2048,2048,128,ck,16,0,8.5853,a8w8_blockscale_1x128x128_256x64x64x128_16x16_32x32_1x1_8x32x1_8x32x1_1x32x1x8_8_1x1_intrawave_v1,125.07,1038.16,0.0
gfx950,256,2048,2048,512,ck,0,0,11.2562,a8w8_blockscale_1x128x128_256x128x128x128_16x16_32x32_2x2_8x32x1_8x32x1_1x32x1x8_8_1x1_intrawave_v3,381.56,931.55,0.0
gfx950,256,2048,2048,1024,ck,0,0,14.484,a8w8_blockscale_1x128x128_256x128x128x128_16x16_32x32_2x2_8x32x1_8x32x1_1x32x1x8_8_1x1_intrawave_v3,593.06,868.75,0.0
gfx950,256,2048,2048,2048,ck,0,0,20.5,a8w8_blockscale_1x128x128_256x128x128x128_16x16_32x32_2x2_8x32x1_8x32x1_1x32x1x8_8_1x1_intrawave_v3,838.04,818.4,0.0
gfx950,256,2048,2048,4096,ck,0,0,34.7401,a8w8_blockscale_1x128x128_256x128x128x128_16x16_32x32_2x2_8x32x1_8x32x1_1x32x1x8_8_1x1_intrawave_v3,989.05,724.4,0.0
gfx950,256,2050,2048,512,ck,18,0,12.3117,a8w8_blockscale_1x128x128_256x64x64x256_16x16_32x32_1x1_16x16x1_16x16x1_1x32x1x8_8_1x1_intrawave_v1,349.19,852.44,0.0
gfx950,256,2050,2048,2048,ck,2,0,28.0362,a8w8_blockscale_1x128x128_256x64x128x128_16x16_32x32_1x2_8x32x1_8x32x1_1x32x1x8_8_1x1_intrawave_v3,613.37,598.85,0.0
gfx950,256,2050,2048,4096,ck,2,0,48.1419,a8w8_blockscale_1x128x128_256x64x128x128_16x16_32x32_1x2_8x32x1_8x32x1_1x32x1x8_8_1x1_intrawave_v3,714.41,523.08,0.0
gfx950,256,2063,2048,512,ck,18,0,12.2549,a8w8_blockscale_1x128x128_256x64x64x256_16x16_32x32_1x1_16x16x1_16x16x1_1x32x1x8_8_1x1_intrawave_v1,353.04,861.28,0.0
gfx950,256,2063,2048,4096,ck,2,0,47.7904,a8w8_blockscale_1x128x128_256x64x128x128_16x16_32x32_1x2_8x32x1_8x32x1_1x32x1x8_8_1x1_intrawave_v3,724.23,529.16,0.0
gfx950,256,2064,2048,512,ck,18,0,12.7047,a8w8_blockscale_1x128x128_256x64x64x256_16x16_32x32_1x1_16x16x1_16x16x1_1x32x1x8_8_1x1_intrawave_v1,340.7,831.15,0.0
gfx950,256,2064,2048,4096,ck,2,0,48.11,a8w8_blockscale_1x128x128_256x64x128x128_16x16_32x32_1x2_8x32x1_8x32x1_1x32x1x8_8_1x1_intrawave_v3,719.77,525.81,0.0
gfx950,256,2081,2048,2048,ck,2,0,28.2158,a8w8_blockscale_1x128x128_256x64x128x128_16x16_32x32_1x2_8x32x1_8x32x1_1x32x1x8_8_1x1_intrawave_v3,618.69,601.79,0.0
gfx950,256,2095,2048,2048,ck,2,0,28.3613,a8w8_blockscale_1x128x128_256x64x128x128_16x16_32x32_1x2_8x32x1_8x32x1_1x32x1x8_8_1x1_intrawave_v3,619.65,601.73,0.0
gfx950,256,2099,2048,512,ck,18,0,12.7824,a8w8_blockscale_1x128x128_256x64x64x256_16x16_32x32_1x1_16x16x1_16x16x1_1x32x1x8_8_1x1_intrawave_v1,344.37,838.71,0.0
gfx950,256,2099,2048,4096,ck,2,0,48.1699,a8w8_blockscale_1x128x128_256x64x128x128_16x16_32x32_1x2_8x32x1_8x32x1_1x32x1x8_8_1x1_intrawave_v3,731.07,531.11,0.0
gfx950,256,2151,2048,128,ck,11,0,9.0166,a8w8_blockscale_1x128x128_256x32x64x128_16x16_16x16_2x1_8x32x1_8x32x1_1x32x1x8_8_2x1_intrawave_v1,125.07,1036.75,0.0
gfx950,256,2151,2048,1024,ck,2,0,18.7746,a8w8_blockscale_1x128x128_256x64x128x128_16x16_32x32_1x2_8x32x1_8x32x1_1x32x1x8_8_1x1_intrawave_v3,480.54,698.3,0.0
gfx950,256,2154,2048,2048,ck,2,0,28.6186,a8w8_blockscale_1x128x128_256x64x128x128_16x16_32x32_1x2_8x32x1_8x32x1_1x32x1x8_8_1x1_intrawave_v3,631.37,608.99,0.0
gfx950,256,2159,2048,512,ck,18,0,12.2651,a8w8_blockscale_1x128x128_256x64x64x256_16x16_32x32_1x1_16x16x1_16x16x1_1x32x1x8_8_1x1_intrawave_v1,369.16,896.63,0.0
gfx950,256,2159,2048,2048,ck,2,0,28.6646,a8w8_blockscale_1x128x128_256x64x128x128_16x16_32x32_1x2_8x32x1_8x32x1_1x32x1x8_8_1x1_intrawave_v3,631.82,609.09,0.0
gfx950,256,2159,2048,4096,ck,0,0,49.8039,a8w8_blockscale_1x128x128_256x128x128x128_16x16_32x32_2x2_8x32x1_8x32x1_1x32x1x8_8_1x1_intrawave_v3,727.29,523.56,0.0
gfx950,256,2160,2048,512,ck,18,0,12.2915,a8w8_blockscale_1x128x128_256x64x64x256_16x16_32x32_1x1_16x16x1_16x16x1_1x32x1x8_8_1x1_intrawave_v1,368.54,895.08,0.0
gfx950,256,2160,2048,4096,ck,0,0,49.9798,a8w8_blockscale_1x128x128_256x128x128x128_16x16_32x32_2x2_8x32x1_8x32x1_1x32x1x8_8_1x1_intrawave_v3,725.07,521.88,0.0
gfx950,256,2162,2048,2048,ck,2,0,28.6493,a8w8_blockscale_1x128x128_256x64x128x128_16x16_32x32_1x2_8x32x1_8x32x1_1x32x1x8_8_1x1_intrawave_v3,633.04,610.05,0.0
gfx950,256,2165,2048,2048,ck,2,0,28.8868,a8w8_blockscale_1x128x128_256x64x128x128_16x16_32x32_1x2_8x32x1_8x32x1_1x32x1x8_8_1x1_intrawave_v3,628.71,605.68,0.0
gfx950,256,2251,2048,2048,ck,2,0,28.5667,a8w8_blockscale_1x128x128_256x64x128x128_16x16_32x32_1x2_8x32x1_8x32x1_1x32x1x8_8_1x1_intrawave_v3,661.01,630.96,0.0
gfx950,256,2252,2048,2048,ck,2,0,28.488,a8w8_blockscale_1x128x128_256x64x128x128_16x16_32x32_1x2_8x32x1_8x32x1_1x32x1x8_8_1x1_intrawave_v3,663.13,632.92,0.0
gfx950,256,2255,2048,2048,ck,2,0,28.6321,a8w8_blockscale_1x128x128_256x64x128x128_16x16_32x32_1x2_8x32x1_8x32x1_1x32x1x8_8_1x1_intrawave_v3,660.67,630.38,0.0
gfx950,256,2313,2048,512,ck,18,0,12.6715,a8w8_blockscale_1x128x128_256x64x64x256_16x16_32x32_1x1_16x16x1_16x16x1_1x32x1x8_8_1x1_intrawave_v1,382.8,923.87,0.0
gfx950,256,2313,2048,4096,ck,2,0,49.8718,a8w8_blockscale_1x128x128_256x64x128x128_16x16_32x32_1x2_8x32x1_8x32x1_1x32x1x8_8_1x1_intrawave_v3,778.11,548.14,0.0
gfx950,256,2317,2048,2048,ck,2,0,28.4926,a8w8_blockscale_1x128x128_256x64x128x128_16x16_32x32_1x2_8x32x1_8x32x1_1x32x1x8_8_1x1_intrawave_v3,682.16,646.83,0.0
gfx950,256,2325,2048,512,ck,18,0,12.6207,a8w8_blockscale_1x128x128_256x64x64x256_16x16_32x32_1x1_16x16x1_16x16x1_1x32x1x8_8_1x1_intrawave_v1,386.34,931.97,0.0
gfx950,256,2325,2048,4096,ck,2,0,49.4858,a8w8_blockscale_1x128x128_256x64x128x128_16x16_32x32_1x2_8x32x1_8x32x1_1x32x1x8_8_1x1_intrawave_v3,788.25,554.4,0.0
gfx950,256,2332,2048,128,ck,16,0,9.2202,a8w8_blockscale_1x128x128_256x64x64x128_16x16_32x32_1x1_8x32x1_8x32x1_1x32x1x8_8_1x1_intrawave_v1,132.6,1096.78,0.0
gfx950,256,2332,2048,1024,ck,2,0,18.7157,a8w8_blockscale_1x128x128_256x64x128x128_16x16_32x32_1x2_8x32x1_8x32x1_1x32x1x8_8_1x1_intrawave_v3,522.62,750.01,0.0
gfx950,256,2341,2048,128,ck,16,0,9.1699,a8w8_blockscale_1x128x128_256x64x64x128_16x16_32x32_1x1_8x32x1_8x32x1_1x32x1x8_8_1x1_intrawave_v1,133.85,1106.94,0.0
gfx950,256,2341,2048,1024,ck,2,0,18.7624,a8w8_blockscale_1x128x128_256x64x128x128_16x16_32x32_1x2_8x32x1_8x32x1_1x32x1x8_8_1x1_intrawave_v3,523.33,750.6,0.0
gfx950,256,2694,2048,2048,ck,2,0,29.7576,a8w8_blockscale_1x128x128_256x64x128x128_16x16_32x32_1x2_8x32x1_8x32x1_1x32x1x8_8_1x1_intrawave_v3,759.43,697.17,0.0
gfx950,256,2715,2048,2048,ck,2,0,29.6672,a8w8_blockscale_1x128x128_256x64x128x128_16x16_32x32_1x2_8x32x1_8x32x1_1x32x1x8_8_1x1_intrawave_v3,767.69,703.65,0.0
gfx950,256,2819,2048,2048,ck,2,0,29.9876,a8w8_blockscale_1x128x128_256x64x128x128_16x16_32x32_1x2_8x32x1_8x32x1_1x32x1x8_8_1x1_intrawave_v3,788.58,717.44,0.0
gfx950,256,2853,2048,2048,ck,2,0,30.1148,a8w8_blockscale_1x128x128_256x64x128x128_16x16_32x32_1x2_8x32x1_8x32x1_1x32x1x8_8_1x1_intrawave_v3,794.72,721.34,0.0
gfx950,256,2914,2048,2048,ck,2,0,30.0364,a8w8_blockscale_1x128x128_256x64x128x128_16x16_32x32_1x2_8x32x1_8x32x1_1x32x1x8_8_1x1_intrawave_v3,813.83,735.7,0.0
gfx950,256,2974,2048,2048,ck,2,0,30.7876,a8w8_blockscale_1x128x128_256x64x128x128_16x16_32x32_1x2_8x32x1_8x32x1_1x32x1x8_8_1x1_intrawave_v3,810.32,729.73,0.0
gfx950,256,3000,2048,2048,ck,2,0,30.49,a8w8_blockscale_1x128x128_256x64x128x128_16x16_32x32_1x2_8x32x1_8x32x1_1x32x1x8_8_1x1_intrawave_v3,825.38,742.09,0.0
gfx950,256,3001,2048,2048,ck,2,0,30.8104,a8w8_blockscale_1x128x128_256x64x128x128_16x16_32x32_1x2_8x32x1_8x32x1_1x32x1x8_8_1x1_intrawave_v3,817.07,734.57,0.0
gfx950,256,3072,2048,128,ck,16,0,10.2159,a8w8_blockscale_1x128x128_256x64x64x128_16x16_32x32_1x1_8x32x1_8x32x1_1x32x1x8_8_1x1_intrawave_v1,157.66,1295.85,0.0
gfx950,256,3072,2048,512,ck,18,0,13.7411,a8w8_blockscale_1x128x128_256x64x64x256_16x16_32x32_1x1_16x16x1_16x16x1_1x32x1x8_8_1x1_intrawave_v1,468.85,1106.49,0.0
gfx950,256,3072,2048,1024,ck,2,0,19.5761,a8w8_blockscale_1x128x128_256x64x128x128_16x16_32x32_1x2_8x32x1_8x32x1_1x32x1x8_8_1x1_intrawave_v3,658.2,910.59,0.0
gfx950,256,3072,2048,2048,ck,0,0,30.2152,a8w8_blockscale_1x128x128_256x128x128x128_16x16_32x32_2x2_8x32x1_8x32x1_1x32x1x8_8_1x1_intrawave_v3,852.88,763.48,0.0
gfx950,256,3072,2048,4096,ck,0,0,50.4634,a8w8_blockscale_1x128x128_256x128x128x128_16x16_32x32_2x2_8x32x1_8x32x1_1x32x1x8_8_1x1_intrawave_v3,1021.33,664.93,0.0
gfx950,256,3073,2048,128,ck,16,0,10.8652,a8w8_blockscale_1x128x128_256x64x64x128_16x16_32x32_1x1_8x32x1_8x32x1_1x32x1x8_8_1x1_intrawave_v1,148.28,1218.8,0.0
gfx950,256,3073,2048,512,ck,18,0,15.2704,a8w8_blockscale_1x128x128_256x64x64x256_16x16_32x32_1x1_16x16x1_16x16x1_1x32x1x8_8_1x1_intrawave_v1,422.03,995.98,0.0
gfx950,256,3073,2048,1024,ck,0,0,21.3187,a8w8_blockscale_1x128x128_256x128x128x128_16x16_32x32_2x2_8x32x1_8x32x1_1x32x1x8_8_1x1_intrawave_v3,604.59,836.4,0.0
gfx950,256,3073,2048,2048,ck,0,0,31.1301,a8w8_blockscale_1x128x128_256x128x128x128_16x16_32x32_2x2_8x32x1_8x32x1_1x32x1x8_8_1x1_intrawave_v3,828.08,741.24,0.0
gfx950,256,3073,2048,4096,ck,0,0,53.275,a8w8_blockscale_1x128x128_256x128x128x128_16x16_32x32_2x2_8x32x1_8x32x1_1x32x1x8_8_1x1_intrawave_v3,967.74,629.99,0.0
gfx950,256,3077,2048,2048,ck,0,0,31.0614,a8w8_blockscale_1x128x128_256x128x128x128_16x16_32x32_2x2_8x32x1_8x32x1_1x32x1x8_8_1x1_intrawave_v3,830.99,743.67,0.0
gfx950,256,3078,2048,2048,ck,0,0,31.0698,a8w8_blockscale_1x128x128_256x128x128x128_16x16_32x32_2x2_8x32x1_8x32x1_1x32x1x8_8_1x1_intrawave_v3,831.04,743.67,0.0
gfx950,256,3086,2048,2048,ck,0,0,31.4838,a8w8_blockscale_1x128x128_256x128x128x128_16x16_32x32_2x2_8x32x1_8x32x1_1x32x1x8_8_1x1_intrawave_v3,822.24,735.45,0.0
gfx950,256,3089,2048,128,ck,11,0,10.9699,a8w8_blockscale_1x128x128_256x32x64x128_16x16_16x16_2x1_8x32x1_8x32x1_1x32x1x8_8_2x1_intrawave_v1,147.63,1213.33,0.0
gfx950,256,3089,2048,1024,ck,0,0,21.4111,a8w8_blockscale_1x128x128_256x128x128x128_16x16_32x32_2x2_8x32x1_8x32x1_1x32x1x8_8_1x1_intrawave_v3,605.12,836.61,0.0
gfx950,256,3089,2048,2048,ck,0,0,31.5684,a8w8_blockscale_1x128x128_256x128x128x128_16x16_32x32_2x2_8x32x1_8x32x1_1x32x1x8_8_1x1_intrawave_v3,820.83,734.06,0.0
gfx950,256,3110,2048,128,ck,11,0,10.8572,a8w8_blockscale_1x128x128_256x32x64x128_16x16_16x16_2x1_8x32x1_8x32x1_1x32x1x8_8_2x1_intrawave_v1,150.18,1234.09,0.0
gfx950,256,3110,2048,1024,ck,0,0,21.2447,a8w8_blockscale_1x128x128_256x128x128x128_16x16_32x32_2x2_8x32x1_8x32x1_1x32x1x8_8_1x1_intrawave_v3,614.0,848.23,0.0
gfx950,256,3118,2048,2048,ck,0,0,31.2026,a8w8_blockscale_1x128x128_256x128x128x128_16x16_32x32_2x2_8x32x1_8x32x1_1x32x1x8_8_1x1_intrawave_v3,838.25,748.38,0.0
gfx950,256,3137,2048,128,ck,11,0,11.0605,a8w8_blockscale_1x128x128_256x32x64x128_16x16_16x16_2x1_8x32x1_8x32x1_1x32x1x8_8_2x1_intrawave_v1,148.7,1221.72,0.0
gfx950,256,3137,2048,1024,ck,0,0,21.3435,a8w8_blockscale_1x128x128_256x128x128x128_16x16_32x32_2x2_8x32x1_8x32x1_1x32x1x8_8_1x1_intrawave_v3,616.47,850.78,0.0
gfx950,256,3138,2048,2048,ck,0,0,31.1188,a8w8_blockscale_1x128x128_256x128x128x128_16x16_32x32_2x2_8x32x1_8x32x1_1x32x1x8_8_1x1_intrawave_v3,845.9,754.34,0.0
gfx950,256,3154,2048,2048,ck,0,0,31.3539,a8w8_blockscale_1x128x128_256x128x128x128_16x16_32x32_2x2_8x32x1_8x32x1_1x32x1x8_8_1x1_intrawave_v3,843.84,751.82,0.0
gfx950,256,3182,2048,512,ck,18,0,15.3271,a8w8_blockscale_1x128x128_256x64x64x256_16x16_32x32_1x1_16x16x1_16x16x1_1x32x1x8_8_1x1_intrawave_v1,435.38,1025.06,0.0
gfx950,256,3182,2048,4096,ck,0,0,53.769,a8w8_blockscale_1x128x128_256x128x128x128_16x16_32x32_2x2_8x32x1_8x32x1_1x32x1x8_8_1x1_intrawave_v3,992.86,640.81,0.0
gfx950,256,3183,2048,512,ck,18,0,15.2461,a8w8_blockscale_1x128x128_256x64x64x256_16x16_32x32_1x1_16x16x1_16x16x1_1x32x1x8_8_1x1_intrawave_v1,437.83,1030.81,0.0
gfx950,256,3183,2048,4096,ck,0,0,53.3279,a8w8_blockscale_1x128x128_256x128x128x128_16x16_32x32_2x2_8x32x1_8x32x1_1x32x1x8_8_1x1_intrawave_v3,1001.39,646.26,0.0
gfx950,256,3289,2048,2048,ck,0,0,31.3217,a8w8_blockscale_1x128x128_256x128x128x128_16x16_32x32_2x2_8x32x1_8x32x1_1x32x1x8_8_1x1_intrawave_v3,880.86,779.07,0.0
gfx950,256,3437,2048,2048,ck,0,0,31.7258,a8w8_blockscale_1x128x128_256x128x128x128_16x16_32x32_2x2_8x32x1_8x32x1_1x32x1x8_8_1x1_intrawave_v3,908.78,797.81,0.0
gfx950,256,3613,2048,128,ck,16,0,13.0011,a8w8_blockscale_1x128x128_256x64x64x128_16x16_32x32_1x1_8x32x1_8x32x1_1x32x1x8_8_1x1_intrawave_v1,145.7,1194.01,0.0
gfx950,256,3613,2048,1024,ck,0,0,22.0192,a8w8_blockscale_1x128x128_256x128x128x128_16x16_32x32_2x2_8x32x1_8x32x1_1x32x1x8_8_1x1_intrawave_v3,688.22,935.35,0.0
gfx950,256,3617,2048,2048,ck,0,0,32.1876,a8w8_blockscale_1x128x128_256x128x128x128_16x16_32x32_2x2_8x32x1_8x32x1_1x32x1x8_8_1x1_intrawave_v3,942.65,820.72,0.0
gfx950,256,3620,2048,2048,ck,0,0,33.2028,a8w8_blockscale_1x128x128_256x128x128x128_16x16_32x32_2x2_8x32x1_8x32x1_1x32x1x8_8_1x1_intrawave_v3,914.58,796.19,0.0
gfx950,256,3669,2048,2048,ck,0,0,32.6675,a8w8_blockscale_1x128x128_256x128x128x128_16x16_32x32_2x2_8x32x1_8x32x1_1x32x1x8_8_1x1_intrawave_v3,942.15,818.45,0.0
gfx950,256,3824,2048,2048,ck,0,0,33.3804,a8w8_blockscale_1x128x128_256x128x128x128_16x16_32x32_2x2_8x32x1_8x32x1_1x32x1x8_8_1x1_intrawave_v3,960.98,829.5,0.0
gfx950,256,3847,2048,512,ck,0,0,16.8131,a8w8_blockscale_1x128x128_256x128x128x128_16x16_32x32_2x2_8x32x1_8x32x1_1x32x1x8_8_1x1_intrawave_v3,479.85,1116.72,0.0
gfx950,256,3847,2048,4096,ck,0,0,59.0754,a8w8_blockscale_1x128x128_256x128x128x128_16x16_32x32_2x2_8x32x1_8x32x1_1x32x1x8_8_1x1_intrawave_v3,1092.54,675.46,0.0
gfx950,256,3858,2048,2048,ck,0,0,34.0909,a8w8_blockscale_1x128x128_256x128x128x128_16x16_32x32_2x2_8x32x1_8x32x1_1x32x1x8_8_1x1_intrawave_v3,949.32,818.34,0.0
gfx950,256,3906,2048,2048,ck,0,0,34.1613,a8w8_blockscale_1x128x128_256x128x128x128_16x16_32x32_2x2_8x32x1_8x32x1_1x32x1x8_8_1x1_intrawave_v3,959.15,825.28,0.0
gfx950,256,4000,2048,2048,ck,0,0,33.9709,a8w8_blockscale_1x128x128_256x128x128x128_16x16_32x32_2x2_8x32x1_8x32x1_1x32x1x8_8_1x1_intrawave_v3,987.74,846.91,0.0
gfx950,256,4004,2048,2048,ck,0,0,34.0476,a8w8_blockscale_1x128x128_256x128x128x128_16x16_32x32_2x2_8x32x1_8x32x1_1x32x1x8_8_1x1_intrawave_v3,986.5,845.72,0.0
gfx950,256,4096,2048,128,ck,16,0,12.9539,a8w8_blockscale_1x128x128_256x64x64x128_16x16_32x32_1x1_8x32x1_8x32x1_1x32x1x8_8_1x1_intrawave_v1,165.78,1355.86,0.0
gfx950,256,4096,2048,512,ck,0,0,17.005,a8w8_blockscale_1x128x128_256x128x128x128_16x16_32x32_2x2_8x32x1_8x32x1_1x32x1x8_8_1x1_intrawave_v3,505.14,1171.59,0.0
gfx950,256,4096,2048,1024,ck,0,0,22.7575,a8w8_blockscale_1x128x128_256x128x128x128_16x16_32x32_2x2_8x32x1_8x32x1_1x32x1x8_8_1x1_intrawave_v3,754.91,1013.67,0.0
gfx950,256,4096,2048,4096,ck,0,0,58.4382,a8w8_blockscale_1x128x128_256x128x128x128_16x16_32x32_2x2_8x32x1_8x32x1_1x32x1x8_8_1x1_intrawave_v3,1175.93,717.73,0.0
gfx950,256,4097,2048,128,ck,16,0,13.5481,a8w8_blockscale_1x128x128_256x64x64x128_16x16_32x32_1x1_8x32x1_8x32x1_1x32x1x8_8_1x1_intrawave_v1,158.55,1296.7,0.0
gfx950,256,4097,2048,1024,ck,2,0,28.4833,a8w8_blockscale_1x128x128_256x64x128x128_16x16_32x32_1x2_8x32x1_8x32x1_1x32x1x8_8_1x1_intrawave_v3,603.3,810.08,0.0
gfx950,256,4100,2048,2048,ck,2,0,45.4495,a8w8_blockscale_1x128x128_256x64x128x128_16x16_32x32_1x2_8x32x1_8x32x1_1x32x1x8_8_1x1_intrawave_v3,756.74,646.54,0.0
gfx950,256,4108,2048,2048,ck,2,0,45.7355,a8w8_blockscale_1x128x128_256x64x128x128_16x16_32x32_1x2_8x32x1_8x32x1_1x32x1x8_8_1x1_intrawave_v3,753.47,643.57,0.0
gfx950,256,4109,2048,128,ck,16,0,13.9726,a8w8_blockscale_1x128x128_256x64x64x128_16x16_32x32_1x1_8x32x1_8x32x1_1x32x1x8_8_1x1_intrawave_v1,154.18,1260.94,0.0
gfx950,256,4109,2048,1024,ck,2,0,28.5751,a8w8_blockscale_1x128x128_256x64x128x128_16x16_32x32_1x2_8x32x1_8x32x1_1x32x1x8_8_1x1_intrawave_v3,603.13,809.63,0.0
gfx950,256,4111,2048,512,ck,18,0,18.449,a8w8_blockscale_1x128x128_256x64x64x256_16x16_32x32_1x1_16x16x1_16x16x1_1x32x1x8_8_1x1_intrawave_v1,467.31,1083.64,0.0
gfx950,256,4111,2048,4096,ck,0,0,77.6133,a8w8_blockscale_1x128x128_256x128x128x128_16x16_32x32_2x2_8x32x1_8x32x1_1x32x1x8_8_1x1_intrawave_v3,888.65,541.99,0.0
gfx950,256,4121,2048,2048,ck,2,0,45.2958,a8w8_blockscale_1x128x128_256x64x128x128_16x16_32x32_1x2_8x32x1_8x32x1_1x32x1x8_8_1x1_intrawave_v3,763.19,651.58,0.0
gfx950,256,4123,2048,2048,ck,2,0,45.4874,a8w8_blockscale_1x128x128_256x64x128x128_16x16_32x32_1x2_8x32x1_8x32x1_1x32x1x8_8_1x1_intrawave_v3,760.35,649.1,0.0
gfx950,256,4141,2048,512,ck,18,0,18.2933,a8w8_blockscale_1x128x128_256x64x64x256_16x16_32x32_1x1_16x16x1_16x16x1_1x32x1x8_8_1x1_intrawave_v1,474.73,1100.42,0.0
gfx950,256,4141,2048,4096,ck,0,0,78.0646,a8w8_blockscale_1x128x128_256x128x128x128_16x16_32x32_2x2_8x32x1_8x32x1_1x32x1x8_8_1x1_intrawave_v3,889.96,542.01,0.0
gfx950,256,4142,2048,512,ck,18,0,18.4633,a8w8_blockscale_1x128x128_256x64x64x256_16x16_32x32_1x1_16x16x1_16x16x1_1x32x1x8_8_1x1_intrawave_v1,470.47,1090.54,0.0
gfx950,256,4142,2048,4096,ck,0,0,77.9359,a8w8_blockscale_1x128x128_256x128x128x128_16x16_32x32_2x2_8x32x1_8x32x1_1x32x1x8_8_1x1_intrawave_v3,891.65,543.01,0.0
gfx950,256,4143,2048,128,ck,11,0,13.7295,a8w8_blockscale_1x128x128_256x32x64x128_16x16_16x16_2x1_8x32x1_8x32x1_1x32x1x8_8_2x1_intrawave_v1,158.21,1293.72,0.0
gfx950,256,4143,2048,1024,ck,2,0,28.7817,a8w8_blockscale_1x128x128_256x64x128x128_16x16_32x32_1x2_8x32x1_8x32x1_1x32x1x8_8_1x1_intrawave_v3,603.75,809.87,0.0
gfx950,256,4149,2048,2048,ck,0,0,45.7952,a8w8_blockscale_1x128x128_256x128x128x128_16x16_32x32_2x2_8x32x1_8x32x1_1x32x1x8_8_1x1_intrawave_v3,760.0,648.23,0.0
gfx950,256,4204,2048,2048,ck,2,0,45.4941,a8w8_blockscale_1x128x128_256x64x128x128_16x16_32x32_1x2_8x32x1_8x32x1_1x32x1x8_8_1x1_intrawave_v3,775.17,659.95,0.0
gfx950,256,4223,2048,2048,ck,2,0,45.5538,a8w8_blockscale_1x128x128_256x64x128x128_16x16_32x32_1x2_8x32x1_8x32x1_1x32x1x8_8_1x1_intrawave_v3,777.65,661.64,0.0
gfx950,256,4229,2048,2048,ck,0,0,45.6338,a8w8_blockscale_1x128x128_256x128x128x128_16x16_32x32_2x2_8x32x1_8x32x1_1x32x1x8_8_1x1_intrawave_v3,777.39,661.29,0.0
gfx950,256,4345,2048,128,ck,16,0,13.6302,a8w8_blockscale_1x128x128_256x64x64x128_16x16_32x32_1x1_8x32x1_8x32x1_1x32x1x8_8_1x1_intrawave_v1,167.13,1365.75,0.0
gfx950,256,4345,2048,512,ck,18,0,18.5996,a8w8_blockscale_1x128x128_256x64x64x256_16x16_32x32_1x1_16x16x1_16x16x1_1x32x1x8_8_1x1_intrawave_v1,489.91,1132.84,0.0
gfx950,256,4345,2048,1024,ck,2,0,28.6124,a8w8_blockscale_1x128x128_256x64x128x128_16x16_32x32_1x2_8x32x1_8x32x1_1x32x1x8_8_1x1_intrawave_v3,636.94,850.8,0.0
gfx950,256,4345,2048,4096,ck,0,0,77.5944,a8w8_blockscale_1x128x128_256x128x128x128_16x16_32x32_2x2_8x32x1_8x32x1_1x32x1x8_8_1x1_intrawave_v3,939.46,566.83,0.0
gfx950,256,4379,2048,2048,ck,0,0,45.2665,a8w8_blockscale_1x128x128_256x128x128x128_16x16_32x32_2x2_8x32x1_8x32x1_1x32x1x8_8_1x1_intrawave_v3,811.5,687.02,0.0
gfx950,256,4410,2048,2048,ck,0,0,45.473,a8w8_blockscale_1x128x128_256x128x128x128_16x16_32x32_2x2_8x32x1_8x32x1_1x32x1x8_8_1x1_intrawave_v3,813.53,688.09,0.0
gfx950,256,4413,2048,128,ck,16,0,13.8615,a8w8_blockscale_1x128x128_256x64x64x128_16x16_32x32_1x1_8x32x1_8x32x1_1x32x1x8_8_1x1_intrawave_v1,166.91,1363.68,0.0
gfx950,256,4413,2048,1024,ck,2,0,28.9131,a8w8_blockscale_1x128x128_256x64x128x128_16x16_32x32_1x2_8x32x1_8x32x1_1x32x1x8_8_1x1_intrawave_v3,640.18,854.0,0.0
gfx950,256,4498,2048,2048,ck,0,0,45.7773,a8w8_blockscale_1x128x128_256x128x128x128_16x16_32x32_2x2_8x32x1_8x32x1_1x32x1x8_8_1x1_intrawave_v3,824.25,695.32,0.0
gfx950,256,4585,2048,2048,ck,0,0,45.7113,a8w8_blockscale_1x128x128_256x128x128x128_16x16_32x32_2x2_8x32x1_8x32x1_1x32x1x8_8_1x1_intrawave_v3,841.41,708.02,0.0
gfx950,256,4586,2048,2048,ck,0,0,45.5909,a8w8_blockscale_1x128x128_256x128x128x128_16x16_32x32_2x2_8x32x1_8x32x1_1x32x1x8_8_1x1_intrawave_v3,843.81,710.03,0.0
gfx950,256,4723,2048,2048,ck,0,0,46.0463,a8w8_blockscale_1x128x128_256x128x128x128_16x16_32x32_2x2_8x32x1_8x32x1_1x32x1x8_8_1x1_intrawave_v3,860.43,721.28,0.0
gfx950,256,4743,2048,2048,ck,0,0,45.8663,a8w8_blockscale_1x128x128_256x128x128x128_16x16_32x32_2x2_8x32x1_8x32x1_1x32x1x8_8_1x1_intrawave_v3,867.46,726.79,0.0
gfx950,256,4822,2048,2048,ck,0,0,45.609,a8w8_blockscale_1x128x128_256x128x128x128_16x16_32x32_2x2_8x32x1_8x32x1_1x32x1x8_8_1x1_intrawave_v3,886.88,741.54,0.0
gfx950,256,4898,2048,2048,ck,0,0,46.552,a8w8_blockscale_1x128x128_256x128x128x128_16x16_32x32_2x2_8x32x1_8x32x1_1x32x1x8_8_1x1_intrawave_v3,882.61,736.54,0.0
gfx950,256,4936,2048,2048,ck,0,0,46.5533,a8w8_blockscale_1x128x128_256x128x128x128_16x16_32x32_2x2_8x32x1_8x32x1_1x32x1x8_8_1x1_intrawave_v3,889.44,741.54,0.0
gfx950,256,4992,2048,2048,ck,0,0,45.2337,a8w8_blockscale_1x128x128_256x128x128x128_16x16_32x32_2x2_8x32x1_8x32x1_1x32x1x8_8_1x1_intrawave_v3,925.77,770.78,0.0
gfx950,256,5000,2048,2048,ck,0,0,46.5622,a8w8_blockscale_1x128x128_256x128x128x128_16x16_32x32_2x2_8x32x1_8x32x1_1x32x1x8_8_1x1_intrawave_v3,900.8,749.84,0.0
gfx950,256,5001,2048,2048,ck,0,0,46.2208,a8w8_blockscale_1x128x128_256x128x128x128_16x16_32x32_2x2_8x32x1_8x32x1_1x32x1x8_8_1x1_intrawave_v3,907.63,755.51,0.0
gfx950,256,5002,2048,2048,ck,0,0,46.8198,a8w8_blockscale_1x128x128_256x128x128x128_16x16_32x32_2x2_8x32x1_8x32x1_1x32x1x8_8_1x1_intrawave_v3,896.2,745.98,0.0
gfx950,256,5003,2048,2048,ck,0,0,46.0838,a8w8_blockscale_1x128x128_256x128x128x128_16x16_32x32_2x2_8x32x1_8x32x1_1x32x1x8_8_1x1_intrawave_v3,910.69,758.03,0.0
gfx950,256,5004,2048,2048,ck,0,0,46.3917,a8w8_blockscale_1x128x128_256x128x128x128_16x16_32x32_2x2_8x32x1_8x32x1_1x32x1x8_8_1x1_intrawave_v3,904.83,753.13,0.0
gfx950,256,5005,2048,2048,ck,0,0,46.5562,a8w8_blockscale_1x128x128_256x128x128x128_16x16_32x32_2x2_8x32x1_8x32x1_1x32x1x8_8_1x1_intrawave_v3,901.81,750.6,0.0
gfx950,256,5006,2048,2048,ck,0,0,46.4377,a8w8_blockscale_1x128x128_256x128x128x128_16x16_32x32_2x2_8x32x1_8x32x1_1x32x1x8_8_1x1_intrawave_v3,904.29,752.65,0.0
gfx950,256,5010,2048,2048,ck,0,0,46.2834,a8w8_blockscale_1x128x128_256x128x128x128_16x16_32x32_2x2_8x32x1_8x32x1_1x32x1x8_8_1x1_intrawave_v3,908.03,755.69,0.0
gfx950,256,5011,2048,2048,ck,0,0,46.5906,a8w8_blockscale_1x128x128_256x128x128x128_16x16_32x32_2x2_8x32x1_8x32x1_1x32x1x8_8_1x1_intrawave_v3,902.23,750.84,0.0
gfx950,256,5012,2048,2048,ck,0,0,46.3189,a8w8_blockscale_1x128x128_256x128x128x128_16x16_32x32_2x2_8x32x1_8x32x1_1x32x1x8_8_1x1_intrawave_v3,907.7,755.37,0.0
gfx950,256,5026,2048,2048,ck,0,0,46.3602,a8w8_blockscale_1x128x128_256x128x128x128_16x16_32x32_2x2_8x32x1_8x32x1_1x32x1x8_8_1x1_intrawave_v3,909.43,756.56,0.0
gfx950,256,5028,2048,2048,ck,0,0,46.2761,a8w8_blockscale_1x128x128_256x128x128x128_16x16_32x32_2x2_8x32x1_8x32x1_1x32x1x8_8_1x1_intrawave_v3,911.44,758.2,0.0
gfx950,256,5030,2048,2048,ck,0,0,46.2103,a8w8_blockscale_1x128x128_256x128x128x128_16x16_32x32_2x2_8x32x1_8x32x1_1x32x1x8_8_1x1_intrawave_v3,913.1,759.54,0.0
gfx950,256,5031,2048,2048,ck,0,0,46.5798,a8w8_blockscale_1x128x128_256x128x128x128_16x16_32x32_2x2_8x32x1_8x32x1_1x32x1x8_8_1x1_intrawave_v3,906.04,753.65,0.0
gfx950,256,5060,2048,2048,ck,0,0,46.4798,a8w8_blockscale_1x128x128_256x128x128x128_16x16_32x32_2x2_8x32x1_8x32x1_1x32x1x8_8_1x1_intrawave_v3,913.22,759.1,0.0
gfx950,256,5062,2048,2048,ck,0,0,46.2652,a8w8_blockscale_1x128x128_256x128x128x128_16x16_32x32_2x2_8x32x1_8x32x1_1x32x1x8_8_1x1_intrawave_v3,917.82,762.89,0.0
gfx950,256,5063,2048,2048,ck,0,0,46.3901,a8w8_blockscale_1x128x128_256x128x128x128_16x16_32x32_2x2_8x32x1_8x32x1_1x32x1x8_8_1x1_intrawave_v3,915.53,760.97,0.0
gfx950,256,5091,2048,2048,ck,0,0,47.317,a8w8_blockscale_1x128x128_256x128x128x128_16x16_32x32_2x2_8x32x1_8x32x1_1x32x1x8_8_1x1_intrawave_v3,902.56,749.7,0.0
gfx950,256,5105,2048,512,ck,18,0,20.3075,a8w8_blockscale_1x128x128_256x64x64x256_16x16_32x32_1x1_16x16x1_16x16x1_1x32x1x8_8_1x1_intrawave_v1,527.19,1210.02,0.0
gfx950,256,5105,2048,2048,ck,0,0,47.0353,a8w8_blockscale_1x128x128_256x128x128x128_16x16_32x32_2x2_8x32x1_8x32x1_1x32x1x8_8_1x1_intrawave_v3,910.46,756.02,0.0
gfx950,256,5105,2048,4096,ck,0,0,80.9192,a8w8_blockscale_1x128x128_256x128x128x128_16x16_32x32_2x2_8x32x1_8x32x1_1x32x1x8_8_1x1_intrawave_v3,1058.43,620.48,0.0
gfx950,256,5120,2048,2048,ck,0,0,44.9536,a8w8_blockscale_1x128x128_256x128x128x128_16x16_32x32_2x2_8x32x1_8x32x1_1x32x1x8_8_1x1_intrawave_v3,955.42,793.08,0.0
gfx950,256,5121,2048,128,ck,16,0,15.8257,a8w8_blockscale_1x128x128_256x64x64x128_16x16_32x32_1x1_8x32x1_8x32x1_1x32x1x8_8_1x1_intrawave_v1,169.65,1383.4,0.0
gfx950,256,5121,2048,512,ck,18,0,21.8845,a8w8_blockscale_1x128x128_256x64x64x256_16x16_32x32_1x1_16x16x1_16x16x1_1x32x1x8_8_1x1_intrawave_v1,490.74,1126.19,0.0
gfx950,256,5121,2048,1024,ck,0,0,30.9625,a8w8_blockscale_1x128x128_256x128x128x128_16x16_32x32_2x2_8x32x1_8x32x1_1x32x1x8_8_1x1_intrawave_v3,693.71,914.55,0.0
gfx950,256,5121,2048,4096,ck,0,0,81.6016,a8w8_blockscale_1x128x128_256x128x128x128_16x16_32x32_2x2_8x32x1_8x32x1_1x32x1x8_8_1x1_intrawave_v3,1052.87,616.9,0.0
gfx950,256,5122,2048,2048,ck,0,0,46.8214,a8w8_blockscale_1x128x128_256x128x128x128_16x16_32x32_2x2_8x32x1_8x32x1_1x32x1x8_8_1x1_intrawave_v3,917.67,761.7,0.0
gfx950,256,5123,2048,128,ck,16,0,15.7061,a8w8_blockscale_1x128x128_256x64x64x128_16x16_32x32_1x1_8x32x1_8x32x1_1x32x1x8_8_1x1_intrawave_v1,171.01,1394.47,0.0
gfx950,256,5123,2048,512,ck,18,0,21.7224,a8w8_blockscale_1x128x128_256x64x64x256_16x16_32x32_1x1_16x16x1_16x16x1_1x32x1x8_8_1x1_intrawave_v1,494.59,1135.02,0.0
gfx950,256,5123,2048,1024,ck,0,0,30.7001,a8w8_blockscale_1x128x128_256x128x128x128_16x16_32x32_2x2_8x32x1_8x32x1_1x32x1x8_8_1x1_intrawave_v3,699.91,922.7,0.0
gfx950,256,5123,2048,2048,ck,0,0,46.8139,a8w8_blockscale_1x128x128_256x128x128x128_16x16_32x32_2x2_8x32x1_8x32x1_1x32x1x8_8_1x1_intrawave_v3,917.99,761.95,0.0
gfx950,256,5123,2048,4096,ck,0,0,80.5632,a8w8_blockscale_1x128x128_256x128x128x128_16x16_32x32_2x2_8x32x1_8x32x1_1x32x1x8_8_1x1_intrawave_v3,1066.86,625.05,0.0
gfx950,256,5124,2048,2048,ck,0,0,46.6774,a8w8_blockscale_1x128x128_256x128x128x128_16x16_32x32_2x2_8x32x1_8x32x1_1x32x1x8_8_1x1_intrawave_v3,920.86,764.31,0.0
gfx950,256,5127,2048,2048,ck,0,0,46.8786,a8w8_blockscale_1x128x128_256x128x128x128_16x16_32x32_2x2_8x32x1_8x32x1_1x32x1x8_8_1x1_intrawave_v3,917.44,761.43,0.0
gfx950,256,5131,2048,512,ck,18,0,21.7608,a8w8_blockscale_1x128x128_256x64x64x256_16x16_32x32_1x1_16x16x1_16x16x1_1x32x1x8_8_1x1_intrawave_v1,494.49,1134.71,0.0
gfx950,256,5131,2048,4096,ck,0,0,81.7428,a8w8_blockscale_1x128x128_256x128x128x128_16x16_32x32_2x2_8x32x1_8x32x1_1x32x1x8_8_1x1_intrawave_v3,1053.11,616.83,0.0
gfx950,256,5133,2048,128,ck,16,0,15.7626,a8w8_blockscale_1x128x128_256x64x64x128_16x16_32x32_1x1_8x32x1_8x32x1_1x32x1x8_8_1x1_intrawave_v1,170.73,1392.15,0.0
gfx950,256,5133,2048,1024,ck,0,0,30.8565,a8w8_blockscale_1x128x128_256x128x128x128_16x16_32x32_2x2_8x32x1_8x32x1_1x32x1x8_8_1x1_intrawave_v3,697.73,919.68,0.0
gfx950,256,5177,2048,2048,ck,0,0,47.0378,a8w8_blockscale_1x128x128_256x128x128x128_16x16_32x32_2x2_8x32x1_8x32x1_1x32x1x8_8_1x1_intrawave_v3,923.25,765.38,0.0
gfx950,256,5183,2048,2048,ck,0,0,46.7111,a8w8_blockscale_1x128x128_256x128x128x128_16x16_32x32_2x2_8x32x1_8x32x1_1x32x1x8_8_1x1_intrawave_v3,930.79,771.52,0.0
gfx950,256,5185,2048,128,ck,16,0,15.8324,a8w8_blockscale_1x128x128_256x64x64x128_16x16_32x32_1x1_8x32x1_8x32x1_1x32x1x8_8_1x1_intrawave_v1,171.7,1399.89,0.0
gfx950,256,5185,2048,1024,ck,0,0,30.6885,a8w8_blockscale_1x128x128_256x128x128x128_16x16_32x32_2x2_8x32x1_8x32x1_1x32x1x8_8_1x1_intrawave_v3,708.65,933.39,0.0
gfx950,256,5191,2048,128,ck,16,0,15.8738,a8w8_blockscale_1x128x128_256x64x64x128_16x16_32x32_1x1_8x32x1_8x32x1_1x32x1x8_8_1x1_intrawave_v1,171.45,1397.83,0.0
gfx950,256,5191,2048,1024,ck,0,0,30.9459,a8w8_blockscale_1x128x128_256x128x128x128_16x16_32x32_2x2_8x32x1_8x32x1_1x32x1x8_8_1x1_intrawave_v3,703.57,926.62,0.0
gfx950,256,5252,2048,2048,ck,0,0,47.3718,a8w8_blockscale_1x128x128_256x128x128x128_16x16_32x32_2x2_8x32x1_8x32x1_1x32x1x8_8_1x1_intrawave_v3,930.03,769.71,0.0
gfx950,256,5255,2048,2048,ck,0,0,47.3747,a8w8_blockscale_1x128x128_256x128x128x128_16x16_32x32_2x2_8x32x1_8x32x1_1x32x1x8_8_1x1_intrawave_v3,930.5,770.05,0.0
gfx950,256,5361,2048,2048,ck,0,0,46.9198,a8w8_blockscale_1x128x128_256x128x128x128_16x16_32x32_2x2_8x32x1_8x32x1_1x32x1x8_8_1x1_intrawave_v3,958.47,791.4,0.0
gfx950,256,5427,2048,512,ck,18,0,22.1091,a8w8_blockscale_1x128x128_256x64x64x256_16x16_32x32_1x1_16x16x1_16x16x1_1x32x1x8_8_1x1_intrawave_v1,514.78,1178.53,0.0
gfx950,256,5427,2048,2048,ck,0,0,47.4594,a8w8_blockscale_1x128x128_256x128x128x128_16x16_32x32_2x2_8x32x1_8x32x1_1x32x1x8_8_1x1_intrawave_v3,959.24,790.95,0.0
gfx950,256,5427,2048,4096,ck,0,0,82.3272,a8w8_blockscale_1x128x128_256x128x128x128_16x16_32x32_2x2_8x32x1_8x32x1_1x32x1x8_8_1x1_intrawave_v3,1105.95,641.91,0.0
gfx950,256,5471,2048,2048,ck,0,0,47.5893,a8w8_blockscale_1x128x128_256x128x128x128_16x16_32x32_2x2_8x32x1_8x32x1_1x32x1x8_8_1x1_intrawave_v3,964.38,794.47,0.0
gfx950,256,5534,2048,2048,ck,0,0,48.1118,a8w8_blockscale_1x128x128_256x128x128x128_16x16_32x32_2x2_8x32x1_8x32x1_1x32x1x8_8_1x1_intrawave_v3,964.89,793.88,0.0
gfx950,256,5564,2048,2048,ck,0,0,48.0938,a8w8_blockscale_1x128x128_256x128x128x128_16x16_32x32_2x2_8x32x1_8x32x1_1x32x1x8_8_1x1_intrawave_v3,970.48,798.01,0.0
gfx950,256,5671,2048,2048,ck,0,0,48.6074,a8w8_blockscale_1x128x128_256x128x128x128_16x16_32x32_2x2_8x32x1_8x32x1_1x32x1x8_8_1x1_intrawave_v3,978.69,803.11,0.0
gfx950,256,5927,2048,2048,ck,0,0,49.7118,a8w8_blockscale_1x128x128_256x128x128x128_16x16_32x32_2x2_8x32x1_8x32x1_1x32x1x8_8_1x1_intrawave_v3,1000.15,816.9,0.0
gfx950,256,5954,2048,2048,ck,0,0,49.1842,a8w8_blockscale_1x128x128_256x128x128x128_16x16_32x32_2x2_8x32x1_8x32x1_1x32x1x8_8_1x1_intrawave_v3,1015.48,829.04,0.0
gfx950,256,6000,2048,2048,ck,0,0,49.0602,a8w8_blockscale_1x128x128_256x128x128x128_16x16_32x32_2x2_8x32x1_8x32x1_1x32x1x8_8_1x1_intrawave_v3,1025.92,836.9,0.0
gfx950,256,6002,2048,2048,ck,0,0,49.5842,a8w8_blockscale_1x128x128_256x128x128x128_16x16_32x32_2x2_8x32x1_8x32x1_1x32x1x8_8_1x1_intrawave_v3,1015.41,828.3,0.0
gfx950,256,6113,2048,512,ck,0,0,22.9431,a8w8_blockscale_1x128x128_256x128x128x128_16x16_32x32_2x2_8x32x1_8x32x1_1x32x1x8_8_1x1_intrawave_v3,558.77,1273.47,0.0
gfx950,256,6113,2048,4096,ck,0,0,89.2181,a8w8_blockscale_1x128x128_256x128x128x128_16x16_32x32_2x2_8x32x1_8x32x1_1x32x1x8_8_1x1_intrawave_v3,1149.53,655.32,0.0
gfx950,256,6146,2048,128,ck,16,0,17.9521,a8w8_blockscale_1x128x128_256x64x64x128_16x16_32x32_1x1_8x32x1_8x32x1_1x32x1x8_8_1x1_intrawave_v1,179.49,1460.71,0.0
gfx950,256,6146,2048,1024,ck,0,0,37.8743,a8w8_blockscale_1x128x128_256x128x128x128_16x16_32x32_2x2_8x32x1_8x32x1_1x32x1x8_8_1x1_intrawave_v3,680.62,886.21,0.0
gfx950,256,6146,2048,2048,ck,0,0,58.2645,a8w8_blockscale_1x128x128_256x128x128x128_16x16_32x32_2x2_8x32x1_8x32x1_1x32x1x8_8_1x1_intrawave_v3,884.87,720.08,0.0
gfx950,256,6147,2048,128,ck,16,0,18.0147,a8w8_blockscale_1x128x128_256x64x64x128_16x16_32x32_1x1_8x32x1_8x32x1_1x32x1x8_8_1x1_intrawave_v1,178.9,1455.87,0.0
gfx950,256,6147,2048,1024,ck,0,0,38.0605,a8w8_blockscale_1x128x128_256x128x128x128_16x16_32x32_2x2_8x32x1_8x32x1_1x32x1x8_8_1x1_intrawave_v3,677.41,882.01,0.0
gfx950,256,6155,2048,128,ck,16,0,18.0318,a8w8_blockscale_1x128x128_256x64x64x128_16x16_32x32_1x1_8x32x1_8x32x1_1x32x1x8_8_1x1_intrawave_v1,178.96,1456.36,0.0
gfx950,256,6155,2048,1024,ck,0,0,37.8031,a8w8_blockscale_1x128x128_256x128x128x128_16x16_32x32_2x2_8x32x1_8x32x1_1x32x1x8_8_1x1_intrawave_v3,682.91,889.1,0.0
gfx950,256,6194,2048,2048,ck,0,0,57.7142,a8w8_blockscale_1x128x128_256x128x128x128_16x16_32x32_2x2_8x32x1_8x32x1_1x32x1x8_8_1x1_intrawave_v3,900.28,732.06,0.0
gfx950,256,6197,2048,512,ck,18,0,24.8345,a8w8_blockscale_1x128x128_256x64x64x256_16x16_32x32_1x1_16x16x1_16x16x1_1x32x1x8_8_1x1_intrawave_v1,523.31,1192.07,0.0
gfx950,256,6197,2048,4096,ck,0,0,100.5382,a8w8_blockscale_1x128x128_256x128x128x128_16x16_32x32_2x2_8x32x1_8x32x1_1x32x1x8_8_1x1_intrawave_v3,1034.12,588.38,0.0
gfx950,256,6227,2048,2048,ck,0,0,57.8691,a8w8_blockscale_1x128x128_256x128x128x128_16x16_32x32_2x2_8x32x1_8x32x1_1x32x1x8_8_1x1_intrawave_v3,902.66,733.6,0.0
gfx950,256,6229,2048,2048,ck,0,0,57.8787,a8w8_blockscale_1x128x128_256x128x128x128_16x16_32x32_2x2_8x32x1_8x32x1_1x32x1x8_8_1x1_intrawave_v3,902.8,733.69,0.0
gfx950,256,6234,2048,2048,ck,0,0,57.6811,a8w8_blockscale_1x128x128_256x128x128x128_16x16_32x32_2x2_8x32x1_8x32x1_1x32x1x8_8_1x1_intrawave_v3,906.62,736.74,0.0
gfx950,256,6246,2048,2048,ck,0,0,58.057,a8w8_blockscale_1x128x128_256x128x128x128_16x16_32x32_2x2_8x32x1_8x32x1_1x32x1x8_8_1x1_intrawave_v3,902.48,733.24,0.0
gfx950,256,6304,2048,2048,ck,0,0,57.9219,a8w8_blockscale_1x128x128_256x128x128x128_16x16_32x32_2x2_8x32x1_8x32x1_1x32x1x8_8_1x1_intrawave_v3,912.98,741.1,0.0
gfx950,256,6314,2048,2048,ck,0,0,57.7602,a8w8_blockscale_1x128x128_256x128x128x128_16x16_32x32_2x2_8x32x1_8x32x1_1x32x1x8_8_1x1_intrawave_v3,916.99,744.24,0.0
gfx950,256,6318,2048,2048,ck,0,0,57.8083,a8w8_blockscale_1x128x128_256x128x128x128_16x16_32x32_2x2_8x32x1_8x32x1_1x32x1x8_8_1x1_intrawave_v3,916.81,744.05,0.0
gfx950,256,6341,2048,2048,ck,0,0,58.4239,a8w8_blockscale_1x128x128_256x128x128x128_16x16_32x32_2x2_8x32x1_8x32x1_1x32x1x8_8_1x1_intrawave_v3,910.45,738.63,0.0
gfx950,256,6377,2048,128,ck,16,0,18.1309,a8w8_blockscale_1x128x128_256x64x64x128_16x16_32x32_1x1_8x32x1_8x32x1_1x32x1x8_8_1x1_intrawave_v1,184.4,1500.12,0.0
gfx950,256,6377,2048,1024,ck,0,0,37.857,a8w8_blockscale_1x128x128_256x128x128x128_16x16_32x32_2x2_8x32x1_8x32x1_1x32x1x8_8_1x1_intrawave_v3,706.53,917.86,0.0
gfx950,256,6377,2048,2048,ck,0,0,58.5939,a8w8_blockscale_1x128x128_256x128x128x128_16x16_32x32_2x2_8x32x1_8x32x1_1x32x1x8_8_1x1_intrawave_v3,912.96,740.26,0.0
gfx950,256,6401,2048,128,ck,16,0,18.0512,a8w8_blockscale_1x128x128_256x64x64x128_16x16_32x32_1x1_8x32x1_8x32x1_1x32x1x8_8_1x1_intrawave_v1,185.91,1512.36,0.0
gfx950,256,6401,2048,1024,ck,0,0,37.9026,a8w8_blockscale_1x128x128_256x128x128x128_16x16_32x32_2x2_8x32x1_8x32x1_1x32x1x8_8_1x1_intrawave_v3,708.34,920.0,0.0
gfx950,256,6409,2048,512,ck,18,0,25.4109,a8w8_blockscale_1x128x128_256x64x64x256_16x16_32x32_1x1_16x16x1_16x16x1_1x32x1x8_8_1x1_intrawave_v1,528.93,1203.47,0.0
gfx950,256,6409,2048,4096,ck,0,0,100.6362,a8w8_blockscale_1x128x128_256x128x128x128_16x16_32x32_2x2_8x32x1_8x32x1_1x32x1x8_8_1x1_intrawave_v3,1068.45,605.06,0.0
gfx950,256,6476,2048,2048,ck,0,0,57.8088,a8w8_blockscale_1x128x128_256x128x128x128_16x16_32x32_2x2_8x32x1_8x32x1_1x32x1x8_8_1x1_intrawave_v3,939.73,760.83,0.0
gfx950,256,6483,2048,2048,ck,0,0,58.7306,a8w8_blockscale_1x128x128_256x128x128x128_16x16_32x32_2x2_8x32x1_8x32x1_1x32x1x8_8_1x1_intrawave_v3,925.98,749.62,0.0
gfx950,256,6492,2048,2048,ck,0,0,57.9234,a8w8_blockscale_1x128x128_256x128x128x128_16x16_32x32_2x2_8x32x1_8x32x1_1x32x1x8_8_1x1_intrawave_v3,940.19,761.02,0.0
gfx950,256,6519,2048,2048,ck,0,0,58.3263,a8w8_blockscale_1x128x128_256x128x128x128_16x16_32x32_2x2_8x32x1_8x32x1_1x32x1x8_8_1x1_intrawave_v3,937.58,758.61,0.0
gfx950,256,6609,2048,2048,ck,0,0,58.3331,a8w8_blockscale_1x128x128_256x128x128x128_16x16_32x32_2x2_8x32x1_8x32x1_1x32x1x8_8_1x1_intrawave_v3,950.41,768.0,0.0
gfx950,256,6811,2048,2048,ck,0,0,59.0707,a8w8_blockscale_1x128x128_256x128x128x128_16x16_32x32_2x2_8x32x1_8x32x1_1x32x1x8_8_1x1_intrawave_v3,967.23,779.42,0.0
gfx950,256,6813,2048,2048,ck,0,0,59.3063,a8w8_blockscale_1x128x128_256x128x128x128_16x16_32x32_2x2_8x32x1_8x32x1_1x32x1x8_8_1x1_intrawave_v3,963.67,776.53,0.0
gfx950,256,6818,2048,2048,ck,0,0,59.5711,a8w8_blockscale_1x128x128_256x128x128x128_16x16_32x32_2x2_8x32x1_8x32x1_1x32x1x8_8_1x1_intrawave_v3,960.09,773.6,0.0
gfx950,256,6830,2048,2048,ck,0,0,59.0803,a8w8_blockscale_1x128x128_256x128x128x128_16x16_32x32_2x2_8x32x1_8x32x1_1x32x1x8_8_1x1_intrawave_v3,969.77,781.27,0.0
gfx950,256,7001,2048,2048,ck,0,0,59.2707,a8w8_blockscale_1x128x128_256x128x128x128_16x16_32x32_2x2_8x32x1_8x32x1_1x32x1x8_8_1x1_intrawave_v3,990.85,796.49,0.0
gfx950,256,7025,2048,2048,ck,0,0,59.5843,a8w8_blockscale_1x128x128_256x128x128x128_16x16_32x32_2x2_8x32x1_8x32x1_1x32x1x8_8_1x1_intrawave_v3,989.02,794.77,0.0
gfx950,256,7121,2048,128,ck,16,0,19.3383,a8w8_blockscale_1x128x128_256x64x64x128_16x16_32x32_1x1_8x32x1_8x32x1_1x32x1x8_8_1x1_intrawave_v1,193.06,1568.97,0.0
gfx950,256,7121,2048,512,ck,18,0,27.1316,a8w8_blockscale_1x128x128_256x64x64x256_16x16_32x32_1x1_16x16x1_16x16x1_1x32x1x8_8_1x1_intrawave_v1,550.42,1248.07,0.0
gfx950,256,7121,2048,1024,ck,0,0,38.643,a8w8_blockscale_1x128x128_256x128x128x128_16x16_32x32_2x2_8x32x1_8x32x1_1x32x1x8_8_1x1_intrawave_v3,772.91,997.77,0.0
gfx950,256,7121,2048,2048,ck,0,0,59.9094,a8w8_blockscale_1x128x128_256x128x128x128_16x16_32x32_2x2_8x32x1_8x32x1_1x32x1x8_8_1x1_intrawave_v3,997.09,800.3,0.0
gfx950,256,7121,2048,4096,ck,0,0,103.785,a8w8_blockscale_1x128x128_256x128x128x128_16x16_32x32_2x2_8x32x1_8x32x1_1x32x1x8_8_1x1_intrawave_v3,1151.14,642.9,0.0
gfx950,256,7168,2048,512,ck,18,0,26.6449,a8w8_blockscale_1x128x128_256x64x64x256_16x16_32x32_1x1_16x16x1_16x16x1_1x32x1x8_8_1x1_intrawave_v1,564.17,1279.0,0.0
gfx950,256,7168,2048,4096,ck,0,0,102.047,a8w8_blockscale_1x128x128_256x128x128x128_16x16_32x32_2x2_8x32x1_8x32x1_1x32x1x8_8_1x1_intrawave_v3,1178.47,657.63,0.0
gfx950,256,7169,2048,128,ck,16,0,20.0371,a8w8_blockscale_1x128x128_256x64x64x128_16x16_32x32_1x1_8x32x1_8x32x1_1x32x1x8_8_1x1_intrawave_v1,187.58,1524.37,0.0
gfx950,256,7169,2048,512,ck,0,0,28.0929,a8w8_blockscale_1x128x128_256x128x128x128_16x16_32x32_2x2_8x32x1_8x32x1_1x32x1x8_8_1x1_intrawave_v3,535.17,1213.24,0.0
gfx950,256,7169,2048,1024,ck,0,0,38.6283,a8w8_blockscale_1x128x128_256x128x128x128_16x16_32x32_2x2_8x32x1_8x32x1_1x32x1x8_8_1x1_intrawave_v3,778.42,1004.51,0.0
gfx950,256,7169,2048,2048,ck,0,0,60.1803,a8w8_blockscale_1x128x128_256x128x128x128_16x16_32x32_2x2_8x32x1_8x32x1_1x32x1x8_8_1x1_intrawave_v3,999.3,801.6,0.0
gfx950,256,7169,2048,4096,ck,0,0,103.5863,a8w8_blockscale_1x128x128_256x128x128x128_16x16_32x32_2x2_8x32x1_8x32x1_1x32x1x8_8_1x1_intrawave_v3,1161.12,647.93,0.0
gfx950,256,7170,2048,128,ck,16,0,20.0511,a8w8_blockscale_1x128x128_256x64x64x128_16x16_32x32_1x1_8x32x1_8x32x1_1x32x1x8_8_1x1_intrawave_v1,187.48,1523.52,0.0
gfx950,256,7170,2048,1024,ck,0,0,39.1367,a8w8_blockscale_1x128x128_256x128x128x128_16x16_32x32_2x2_8x32x1_8x32x1_1x32x1x8_8_1x1_intrawave_v3,768.41,991.59,0.0
gfx950,256,7172,2048,512,ck,0,0,28.0331,a8w8_blockscale_1x128x128_256x128x128x128_16x16_32x32_2x2_8x32x1_8x32x1_1x32x1x8_8_1x1_intrawave_v3,536.54,1216.32,0.0
gfx950,256,7172,2048,4096,ck,0,0,104.0251,a8w8_blockscale_1x128x128_256x128x128x128_16x16_32x32_2x2_8x32x1_8x32x1_1x32x1x8_8_1x1_intrawave_v3,1156.7,645.44,0.0
gfx950,256,7176,2048,128,ck,16,0,19.9919,a8w8_blockscale_1x128x128_256x64x64x128_16x16_32x32_1x1_8x32x1_8x32x1_1x32x1x8_8_1x1_intrawave_v1,188.19,1529.3,0.0
gfx950,256,7176,2048,512,ck,0,0,27.9048,a8w8_blockscale_1x128x128_256x128x128x128_16x16_32x32_2x2_8x32x1_8x32x1_1x32x1x8_8_1x1_intrawave_v3,539.3,1222.57,0.0
gfx950,256,7176,2048,1024,ck,0,0,38.7214,a8w8_blockscale_1x128x128_256x128x128x128_16x16_32x32_2x2_8x32x1_8x32x1_1x32x1x8_8_1x1_intrawave_v3,777.3,1003.02,0.0
gfx950,256,7176,2048,4096,ck,0,0,104.6379,a8w8_blockscale_1x128x128_256x128x128x128_16x16_32x32_2x2_8x32x1_8x32x1_1x32x1x8_8_1x1_intrawave_v3,1150.57,641.97,0.0
gfx950,256,7177,2048,128,ck,16,0,20.0347,a8w8_blockscale_1x128x128_256x64x64x128_16x16_32x32_1x1_8x32x1_8x32x1_1x32x1x8_8_1x1_intrawave_v1,187.81,1526.24,0.0
gfx950,256,7177,2048,512,ck,18,0,27.9246,a8w8_blockscale_1x128x128_256x64x64x256_16x16_32x32_1x1_16x16x1_16x16x1_1x32x1x8_8_1x1_intrawave_v1,539.0,1221.87,0.0
gfx950,256,7177,2048,1024,ck,0,0,39.1444,a8w8_blockscale_1x128x128_256x128x128x128_16x16_32x32_2x2_8x32x1_8x32x1_1x32x1x8_8_1x1_intrawave_v3,769.01,992.31,0.0
gfx950,256,7177,2048,2048,ck,0,0,60.5047,a8w8_blockscale_1x128x128_256x128x128x128_16x16_32x32_2x2_8x32x1_8x32x1_1x32x1x8_8_1x1_intrawave_v3,995.05,798.12,0.0
gfx950,256,7177,2048,4096,ck,0,0,105.806,a8w8_blockscale_1x128x128_256x128x128x128_16x16_32x32_2x2_8x32x1_8x32x1_1x32x1x8_8_1x1_intrawave_v3,1138.03,634.96,0.0
gfx950,256,7178,2048,512,ck,0,0,28.1638,a8w8_blockscale_1x128x128_256x128x128x128_16x16_32x32_2x2_8x32x1_8x32x1_1x32x1x8_8_1x1_intrawave_v3,534.49,1211.65,0.0
gfx950,256,7178,2048,4096,ck,0,0,104.7527,a8w8_blockscale_1x128x128_256x128x128x128_16x16_32x32_2x2_8x32x1_8x32x1_1x32x1x8_8_1x1_intrawave_v3,1149.63,641.42,0.0
gfx950,256,7179,2048,512,ck,0,0,28.0743,a8w8_blockscale_1x128x128_256x128x128x128_16x16_32x32_2x2_8x32x1_8x32x1_1x32x1x8_8_1x1_intrawave_v3,536.27,1215.68,0.0
gfx950,256,7179,2048,4096,ck,0,0,105.3775,a8w8_blockscale_1x128x128_256x128x128x128_16x16_32x32_2x2_8x32x1_8x32x1_1x32x1x8_8_1x1_intrawave_v3,1142.97,637.7,0.0
gfx950,256,7183,2048,512,ck,18,0,27.8948,a8w8_blockscale_1x128x128_256x64x64x256_16x16_32x32_1x1_16x16x1_16x16x1_1x32x1x8_8_1x1_intrawave_v1,540.02,1224.17,0.0
gfx950,256,7183,2048,4096,ck,0,0,104.4495,a8w8_blockscale_1x128x128_256x128x128x128_16x16_32x32_2x2_8x32x1_8x32x1_1x32x1x8_8_1x1_intrawave_v3,1153.77,643.68,0.0
gfx950,256,7184,2048,512,ck,18,0,27.7835,a8w8_blockscale_1x128x128_256x64x64x256_16x16_32x32_1x1_16x16x1_16x16x1_1x32x1x8_8_1x1_intrawave_v1,542.26,1229.23,0.0
gfx950,256,7184,2048,4096,ck,0,0,104.8883,a8w8_blockscale_1x128x128_256x128x128x128_16x16_32x32_2x2_8x32x1_8x32x1_1x32x1x8_8_1x1_intrawave_v3,1149.1,641.06,0.0
gfx950,256,7185,2048,128,ck,16,0,20.2172,a8w8_blockscale_1x128x128_256x64x64x128_16x16_32x32_1x1_8x32x1_8x32x1_1x32x1x8_8_1x1_intrawave_v1,186.33,1514.14,0.0
gfx950,256,7185,2048,1024,ck,0,0,38.8233,a8w8_blockscale_1x128x128_256x128x128x128_16x16_32x32_2x2_8x32x1_8x32x1_1x32x1x8_8_1x1_intrawave_v3,776.24,1001.57,0.0
gfx950,256,7206,2048,128,ck,16,0,20.0696,a8w8_blockscale_1x128x128_256x64x64x128_16x16_32x32_1x1_8x32x1_8x32x1_1x32x1x8_8_1x1_intrawave_v1,188.25,1529.69,0.0
gfx950,256,7206,2048,1024,ck,0,0,38.9026,a8w8_blockscale_1x128x128_256x128x128x128_16x16_32x32_2x2_8x32x1_8x32x1_1x32x1x8_8_1x1_intrawave_v3,776.92,1002.29,0.0
gfx950,256,7209,2048,512,ck,0,0,28.2376,a8w8_blockscale_1x128x128_256x128x128x128_16x16_32x32_2x2_8x32x1_8x32x1_1x32x1x8_8_1x1_intrawave_v3,535.4,1213.55,0.0
gfx950,256,7209,2048,4096,ck,0,0,104.7259,a8w8_blockscale_1x128x128_256x128x128x128_16x16_32x32_2x2_8x32x1_8x32x1_1x32x1x8_8_1x1_intrawave_v3,1154.89,644.01,0.0
gfx950,256,7210,2048,512,ck,18,0,27.98,a8w8_blockscale_1x128x128_256x64x64x256_16x16_32x32_1x1_16x16x1_16x16x1_1x32x1x8_8_1x1_intrawave_v1,540.4,1224.88,0.0
gfx950,256,7210,2048,4096,ck,0,0,103.5843,a8w8_blockscale_1x128x128_256x128x128x128_16x16_32x32_2x2_8x32x1_8x32x1_1x32x1x8_8_1x1_intrawave_v3,1167.78,651.19,0.0
gfx950,256,7211,2048,512,ck,0,0,28.2295,a8w8_blockscale_1x128x128_256x128x128x128_16x16_32x32_2x2_8x32x1_8x32x1_1x32x1x8_8_1x1_intrawave_v3,535.7,1214.22,0.0
gfx950,256,7211,2048,4096,ck,0,0,104.8223,a8w8_blockscale_1x128x128_256x128x128x128_16x16_32x32_2x2_8x32x1_8x32x1_1x32x1x8_8_1x1_intrawave_v3,1154.15,643.58,0.0
gfx950,256,7217,2048,128,ck,16,0,20.0441,a8w8_blockscale_1x128x128_256x64x64x128_16x16_32x32_1x1_8x32x1_8x32x1_1x32x1x8_8_1x1_intrawave_v1,188.77,1533.96,0.0
gfx950,256,7217,2048,512,ck,0,0,27.9254,a8w8_blockscale_1x128x128_256x128x128x128_16x16_32x32_2x2_8x32x1_8x32x1_1x32x1x8_8_1x1_intrawave_v3,541.98,1228.43,0.0
gfx950,256,7217,2048,1024,ck,0,0,38.7581,a8w8_blockscale_1x128x128_256x128x128x128_16x16_32x32_2x2_8x32x1_8x32x1_1x32x1x8_8_1x1_intrawave_v3,781.01,1007.48,0.0
gfx950,256,7217,2048,2048,ck,0,0,59.9707,a8w8_blockscale_1x128x128_256x128x128x128_16x16_32x32_2x2_8x32x1_8x32x1_1x32x1x8_8_1x1_intrawave_v3,1009.5,809.32,0.0
gfx950,256,7217,2048,4096,ck,0,0,105.2839,a8w8_blockscale_1x128x128_256x128x128x128_16x16_32x32_2x2_8x32x1_8x32x1_1x32x1x8_8_1x1_intrawave_v3,1150.04,641.22,0.0
gfx950,256,7223,2048,2048,ck,0,0,59.9519,a8w8_blockscale_1x128x128_256x128x128x128_16x16_32x32_2x2_8x32x1_8x32x1_1x32x1x8_8_1x1_intrawave_v3,1010.66,810.19,0.0
gfx950,256,7238,2048,2048,ck,0,0,59.5823,a8w8_blockscale_1x128x128_256x128x128x128_16x16_32x32_2x2_8x32x1_8x32x1_1x32x1x8_8_1x1_intrawave_v3,1019.04,816.76,0.0
gfx950,256,7246,2048,2048,ck,0,0,60.0211,a8w8_blockscale_1x128x128_256x128x128x128_16x16_32x32_2x2_8x32x1_8x32x1_1x32x1x8_8_1x1_intrawave_v3,1012.71,811.61,0.0
gfx950,256,7249,2048,2048,ck,0,0,60.6215,a8w8_blockscale_1x128x128_256x128x128x128_16x16_32x32_2x2_8x32x1_8x32x1_1x32x1x8_8_1x1_intrawave_v3,1003.09,803.88,0.0
gfx950,256,7257,2048,128,ck,16,0,20.1233,a8w8_blockscale_1x128x128_256x64x64x128_16x16_32x32_1x1_8x32x1_8x32x1_1x32x1x8_8_1x1_intrawave_v1,189.07,1536.31,0.0
gfx950,256,7257,2048,1024,ck,0,0,38.9768,a8w8_blockscale_1x128x128_256x128x128x128_16x16_32x32_2x2_8x32x1_8x32x1_1x32x1x8_8_1x1_intrawave_v3,780.93,1007.09,0.0
gfx950,256,7265,2048,128,ck,16,0,20.0911,a8w8_blockscale_1x128x128_256x64x64x128_16x16_32x32_1x1_8x32x1_8x32x1_1x32x1x8_8_1x1_intrawave_v1,189.58,1540.46,0.0
gfx950,256,7265,2048,1024,ck,0,0,39.0931,a8w8_blockscale_1x128x128_256x128x128x128_16x16_32x32_2x2_8x32x1_8x32x1_1x32x1x8_8_1x1_intrawave_v3,779.46,1005.14,0.0
gfx950,256,7273,2048,512,ck,18,0,28.1532,a8w8_blockscale_1x128x128_256x64x64x256_16x16_32x32_1x1_16x16x1_16x16x1_1x32x1x8_8_1x1_intrawave_v1,541.77,1227.66,0.0
gfx950,256,7273,2048,4096,ck,0,0,105.0491,a8w8_blockscale_1x128x128_256x128x128x128_16x16_32x32_2x2_8x32x1_8x32x1_1x32x1x8_8_1x1_intrawave_v3,1161.56,647.02,0.0
gfx950,256,7274,2048,512,ck,0,0,28.1988,a8w8_blockscale_1x128x128_256x128x128x128_16x16_32x32_2x2_8x32x1_8x32x1_1x32x1x8_8_1x1_intrawave_v3,540.97,1225.84,0.0
gfx950,256,7274,2048,4096,ck,0,0,105.6319,a8w8_blockscale_1x128x128_256x128x128x128_16x16_32x32_2x2_8x32x1_8x32x1_1x32x1x8_8_1x1_intrawave_v3,1155.31,643.53,0.0
gfx950,256,7316,2048,2048,ck,0,0,60.3279,a8w8_blockscale_1x128x128_256x128x128x128_16x16_32x32_2x2_8x32x1_8x32x1_1x32x1x8_8_1x1_intrawave_v3,1017.29,814.61,0.0
gfx950,256,7391,2048,512,ck,0,0,28.3235,a8w8_blockscale_1x128x128_256x128x128x128_16x16_32x32_2x2_8x32x1_8x32x1_1x32x1x8_8_1x1_intrawave_v3,547.25,1239.48,0.0
gfx950,256,7391,2048,4096,ck,0,0,105.9087,a8w8_blockscale_1x128x128_256x128x128x128_16x16_32x32_2x2_8x32x1_8x32x1_1x32x1x8_8_1x1_intrawave_v3,1170.82,650.9,0.0
gfx950,256,7393,2048,128,ck,16,0,20.1979,a8w8_blockscale_1x128x128_256x64x64x128_16x16_32x32_1x1_8x32x1_8x32x1_1x32x1x8_8_1x1_intrawave_v1,191.9,1559.08,0.0
gfx950,256,7393,2048,512,ck,0,0,28.297,a8w8_blockscale_1x128x128_256x128x128x128_16x16_32x32_2x2_8x32x1_8x32x1_1x32x1x8_8_1x1_intrawave_v3,547.91,1240.96,0.0
gfx950,256,7393,2048,1024,ck,0,0,39.5461,a8w8_blockscale_1x128x128_256x128x128x128_16x16_32x32_2x2_8x32x1_8x32x1_1x32x1x8_8_1x1_intrawave_v3,784.11,1010.2,0.0
gfx950,256,7393,2048,2048,ck,0,0,60.5515,a8w8_blockscale_1x128x128_256x128x128x128_16x16_32x32_2x2_8x32x1_8x32x1_1x32x1x8_8_1x1_intrawave_v3,1024.2,819.42,0.0
gfx950,256,7393,2048,4096,ck,0,0,106.0627,a8w8_blockscale_1x128x128_256x128x128x128_16x16_32x32_2x2_8x32x1_8x32x1_1x32x1x8_8_1x1_intrawave_v3,1169.44,650.11,0.0
gfx950,256,7461,2048,128,ck,16,0,20.1852,a8w8_blockscale_1x128x128_256x64x64x128_16x16_32x32_1x1_8x32x1_8x32x1_1x32x1x8_8_1x1_intrawave_v1,193.79,1574.29,0.0
gfx950,256,7461,2048,1024,ck,0,0,39.389,a8w8_blockscale_1x128x128_256x128x128x128_16x16_32x32_2x2_8x32x1_8x32x1_1x32x1x8_8_1x1_intrawave_v3,794.48,1023.06,0.0
gfx950,256,7491,2048,2048,ck,0,0,61.1591,a8w8_blockscale_1x128x128_256x128x128x128_16x16_32x32_2x2_8x32x1_8x32x1_1x32x1x8_8_1x1_intrawave_v3,1027.47,821.12,0.0
gfx950,256,7558,2048,2048,ck,0,0,61.6223,a8w8_blockscale_1x128x128_256x128x128x128_16x16_32x32_2x2_8x32x1_8x32x1_1x32x1x8_8_1x1_intrawave_v3,1028.87,821.63,0.0
gfx950,256,7634,2048,128,ck,16,0,20.12,a8w8_blockscale_1x128x128_256x64x64x128_16x16_32x32_1x1_8x32x1_8x32x1_1x32x1x8_8_1x1_intrawave_v1,198.93,1615.71,0.0
gfx950,256,7634,2048,1024,ck,0,0,39.9658,a8w8_blockscale_1x128x128_256x128x128x128_16x16_32x32_2x2_8x32x1_8x32x1_1x32x1x8_8_1x1_intrawave_v3,801.17,1030.46,0.0
gfx950,256,7650,2048,2048,ck,0,0,61.1327,a8w8_blockscale_1x128x128_256x128x128x128_16x16_32x32_2x2_8x32x1_8x32x1_1x32x1x8_8_1x1_intrawave_v3,1049.73,837.46,0.0
gfx950,256,7715,2048,512,ck,0,0,28.5921,a8w8_blockscale_1x128x128_256x128x128x128_16x16_32x32_2x2_8x32x1_8x32x1_1x32x1x8_8_1x1_intrawave_v3,565.87,1280.05,0.0
gfx950,256,7715,2048,4096,ck,0,0,107.2099,a8w8_blockscale_1x128x128_256x128x128x128_16x16_32x32_2x2_8x32x1_8x32x1_1x32x1x8_8_1x1_intrawave_v3,1207.32,667.75,0.0
gfx950,256,7753,2048,512,ck,0,0,28.5448,a8w8_blockscale_1x128x128_256x128x128x128_16x16_32x32_2x2_8x32x1_8x32x1_1x32x1x8_8_1x1_intrawave_v3,569.6,1288.3,0.0
gfx950,256,7753,2048,2048,ck,0,0,61.2679,a8w8_blockscale_1x128x128_256x128x128x128_16x16_32x32_2x2_8x32x1_8x32x1_1x32x1x8_8_1x1_intrawave_v3,1061.52,845.94,0.0
gfx950,256,7753,2048,4096,ck,0,0,108.6739,a8w8_blockscale_1x128x128_256x128x128x128_16x16_32x32_2x2_8x32x1_8x32x1_1x32x1x8_8_1x1_intrawave_v3,1196.92,661.62,0.0
gfx950,256,7774,2048,2048,ck,0,0,61.6467,a8w8_blockscale_1x128x128_256x128x128x128_16x16_32x32_2x2_8x32x1_8x32x1_1x32x1x8_8_1x1_intrawave_v3,1057.85,842.83,0.0
gfx950,256,7815,2048,2048,ck,0,0,62.436,a8w8_blockscale_1x128x128_256x128x128x128_16x16_32x32_2x2_8x32x1_8x32x1_1x32x1x8_8_1x1_intrawave_v3,1049.99,836.21,0.0
gfx950,256,7819,2048,512,ck,0,0,28.4868,a8w8_blockscale_1x128x128_256x128x128x128_16x16_32x32_2x2_8x32x1_8x32x1_1x32x1x8_8_1x1_intrawave_v3,575.62,1301.6,0.0
gfx950,256,7819,2048,4096,ck,0,0,107.6939,a8w8_blockscale_1x128x128_256x128x128x128_16x16_32x32_2x2_8x32x1_8x32x1_1x32x1x8_8_1x1_intrawave_v3,1218.09,672.66,0.0
gfx950,256,7834,2048,2048,ck,0,0,61.5979,a8w8_blockscale_1x128x128_256x128x128x128_16x16_32x32_2x2_8x32x1_8x32x1_1x32x1x8_8_1x1_intrawave_v3,1066.86,849.48,0.0
gfx950,256,7836,2048,2048,ck,0,0,61.7739,a8w8_blockscale_1x128x128_256x128x128x128_16x16_32x32_2x2_8x32x1_8x32x1_1x32x1x8_8_1x1_intrawave_v3,1064.09,847.26,0.0
gfx950,256,7871,2048,2048,ck,0,0,62.2115,a8w8_blockscale_1x128x128_256x128x128x128_16x16_32x32_2x2_8x32x1_8x32x1_1x32x1x8_8_1x1_intrawave_v3,1061.33,844.76,0.0
gfx950,256,7899,2048,2048,ck,0,0,61.3275,a8w8_blockscale_1x128x128_256x128x128x128_16x16_32x32_2x2_8x32x1_8x32x1_1x32x1x8_8_1x1_intrawave_v3,1080.46,859.74,0.0
gfx950,256,7913,2048,2048,ck,0,0,61.1555,a8w8_blockscale_1x128x128_256x128x128x128_16x16_32x32_2x2_8x32x1_8x32x1_1x32x1x8_8_1x1_intrawave_v3,1085.41,863.57,0.0
gfx950,256,7930,2048,2048,ck,0,0,61.3887,a8w8_blockscale_1x128x128_256x128x128x128_16x16_32x32_2x2_8x32x1_8x32x1_1x32x1x8_8_1x1_intrawave_v3,1083.61,861.99,0.0
gfx950,256,7961,2048,2048,ck,0,0,62.3647,a8w8_blockscale_1x128x128_256x128x128x128_16x16_32x32_2x2_8x32x1_8x32x1_1x32x1x8_8_1x1_intrawave_v3,1070.83,851.55,0.0
gfx950,256,7963,2048,2048,ck,0,0,62.2799,a8w8_blockscale_1x128x128_256x128x128x128_16x16_32x32_2x2_8x32x1_8x32x1_1x32x1x8_8_1x1_intrawave_v3,1072.55,852.91,0.0
gfx950,256,7974,2048,2048,ck,0,0,62.5651,a8w8_blockscale_1x128x128_256x128x128x128_16x16_32x32_2x2_8x32x1_8x32x1_1x32x1x8_8_1x1_intrawave_v3,1069.14,850.1,0.0
gfx950,256,8016,2048,2048,ck,0,0,63.1271,a8w8_blockscale_1x128x128_256x128x128x128_16x16_32x32_2x2_8x32x1_8x32x1_1x32x1x8_8_1x1_intrawave_v3,1065.2,846.62,0.0
gfx950,256,8017,2048,2048,ck,0,0,63.0175,a8w8_blockscale_1x128x128_256x128x128x128_16x16_32x32_2x2_8x32x1_8x32x1_1x32x1x8_8_1x1_intrawave_v3,1067.19,848.19,0.0
gfx950,256,8099,2048,512,ck,0,0,29.6553,a8w8_blockscale_1x128x128_256x128x128x128_16x16_32x32_2x2_8x32x1_8x32x1_1x32x1x8_8_1x1_intrawave_v3,572.74,1293.82,0.0
gfx950,256,8099,2048,4096,ck,0,0,111.6048,a8w8_blockscale_1x128x128_256x128x128x128_16x16_32x32_2x2_8x32x1_8x32x1_1x32x1x8_8_1x1_intrawave_v3,1217.5,669.65,0.0
gfx950,256,8103,2048,2048,ck,0,0,63.4859,a8w8_blockscale_1x128x128_256x128x128x128_16x16_32x32_2x2_8x32x1_8x32x1_1x32x1x8_8_1x1_intrawave_v3,1070.68,850.25,0.0
gfx950,256,8128,2048,2048,ck,0,0,64.0435,a8w8_blockscale_1x128x128_256x128x128x128_16x16_32x32_2x2_8x32x1_8x32x1_1x32x1x8_8_1x1_intrawave_v3,1064.63,845.25,0.0
gfx950,256,8129,2048,128,ck,16,0,21.2537,a8w8_blockscale_1x128x128_256x64x64x128_16x16_32x32_1x1_8x32x1_8x32x1_1x32x1x8_8_1x1_intrawave_v1,200.53,1627.91,0.0
gfx950,256,8129,2048,512,ck,0,0,29.7448,a8w8_blockscale_1x128x128_256x128x128x128_16x16_32x32_2x2_8x32x1_8x32x1_1x32x1x8_8_1x1_intrawave_v3,573.13,1294.58,0.0
gfx950,256,8129,2048,1024,ck,0,0,41.3265,a8w8_blockscale_1x128x128_256x128x128x128_16x16_32x32_2x2_8x32x1_8x32x1_1x32x1x8_8_1x1_intrawave_v3,825.03,1057.86,0.0
gfx950,256,8129,2048,2048,ck,0,0,64.7892,a8w8_blockscale_1x128x128_256x128x128x128_16x16_32x32_2x2_8x32x1_8x32x1_1x32x1x8_8_1x1_intrawave_v3,1052.51,835.62,0.0
gfx950,256,8129,2048,4096,ck,0,0,111.2516,a8w8_blockscale_1x128x128_256x128x128x128_16x16_32x32_2x2_8x32x1_8x32x1_1x32x1x8_8_1x1_intrawave_v3,1225.89,673.98,0.0
gfx950,256,8150,2048,2048,ck,0,0,63.7752,a8w8_blockscale_1x128x128_256x128x128x128_16x16_32x32_2x2_8x32x1_8x32x1_1x32x1x8_8_1x1_intrawave_v3,1072.0,850.92,0.0
gfx950,256,8184,2048,2048,ck,0,0,63.9807,a8w8_blockscale_1x128x128_256x128x128x128_16x16_32x32_2x2_8x32x1_8x32x1_1x32x1x8_8_1x1_intrawave_v3,1073.02,851.46,0.0
gfx950,256,8185,2048,2048,ck,0,0,63.6856,a8w8_blockscale_1x128x128_256x128x128x128_16x16_32x32_2x2_8x32x1_8x32x1_1x32x1x8_8_1x1_intrawave_v3,1078.12,855.5,0.0
gfx950,256,8188,2048,512,ck,0,0,29.9348,a8w8_blockscale_1x128x128_256x128x128x128_16x16_32x32_2x2_8x32x1_8x32x1_1x32x1x8_8_1x1_intrawave_v3,573.63,1295.44,0.0
gfx950,256,8188,2048,4096,ck,0,0,111.9327,a8w8_blockscale_1x128x128_256x128x128x128_16x16_32x32_2x2_8x32x1_8x32x1_1x32x1x8_8_1x1_intrawave_v3,1227.27,674.2,0.0
gfx950,256,8192,2048,128,ck,16,0,21.1823,a8w8_blockscale_1x128x128_256x64x64x128_16x16_32x32_1x1_8x32x1_8x32x1_1x32x1x8_8_1x1_intrawave_v1,202.76,1645.96,0.0
gfx950,256,8192,2048,512,ck,0,0,29.0461,a8w8_blockscale_1x128x128_256x128x128x128_16x16_32x32_2x2_8x32x1_8x32x1_1x32x1x8_8_1x1_intrawave_v3,591.47,1335.72,0.0
gfx950,256,8192,2048,1024,ck,0,0,40.7422,a8w8_blockscale_1x128x128_256x128x128x128_16x16_32x32_2x2_8x32x1_8x32x1_1x32x1x8_8_1x1_intrawave_v3,843.35,1080.95,0.0
gfx950,256,8192,2048,2048,ck,0,0,62.6215,a8w8_blockscale_1x128x128_256x128x128x128_16x16_32x32_2x2_8x32x1_8x32x1_1x32x1x8_8_1x1_intrawave_v3,1097.38,870.72,0.0
gfx950,256,8192,2048,4096,ck,0,0,108.2551,a8w8_blockscale_1x128x128_256x128x128x128_16x16_32x32_2x2_8x32x1_8x32x1_1x32x1x8_8_1x1_intrawave_v3,1269.58,697.4,0.0
gfx950,256,1,2560,2048,ck,8,0,7.9051,a8w8_blockscale_1x128x128_256x16x64x256_16x16_16x16_1x1_16x16x1_16x16x1_1x16x1x16_4_1x1_intrawave_v1,1.33,664.13,0.0
gfx950,256,2,2560,2048,ck,8,0,7.9606,a8w8_blockscale_1x128x128_256x16x64x256_16x16_16x16_1x1_16x16x1_16x16x1_1x16x1x16_4_1x1_intrawave_v1,2.63,660.4,0.0
gfx950,256,4,2560,2048,ck,8,0,7.9549,a8w8_blockscale_1x128x128_256x16x64x256_16x16_16x16_1x1_16x16x1_16x16x1_1x16x1x16_4_1x1_intrawave_v1,5.27,662.68,0.0
gfx950,256,8,2560,2048,ck,8,0,8.0044,a8w8_blockscale_1x128x128_256x16x64x256_16x16_16x16_1x1_16x16x1_16x16x1_1x16x1x16_4_1x1_intrawave_v1,10.48,662.16,0.0
gfx950,256,16,2560,2048,ck,8,0,7.8608,a8w8_blockscale_1x128x128_256x16x64x256_16x16_16x16_1x1_16x16x1_16x16x1_1x16x1x16_4_1x1_intrawave_v1,21.34,681.56,0.0
gfx950,256,32,2560,2048,ck,8,0,8.0533,a8w8_blockscale_1x128x128_256x16x64x256_16x16_16x16_1x1_16x16x1_16x16x1_1x16x1x16_4_1x1_intrawave_v1,41.67,679.5,0.0
gfx950,256,48,2560,2048,ck,8,0,8.0819,a8w8_blockscale_1x128x128_256x16x64x256_16x16_16x16_1x1_16x16x1_16x16x1_1x16x1x16_4_1x1_intrawave_v1,62.28,691.29,0.0
gfx950,256,64,2560,2048,ck,8,0,8.0507,a8w8_blockscale_1x128x128_256x16x64x256_16x16_16x16_1x1_16x16x1_16x16x1_1x16x1x16_4_1x1_intrawave_v1,83.36,708.22,0.0
gfx950,256,80,2560,2048,ck,8,0,8.0378,a8w8_blockscale_1x128x128_256x16x64x256_16x16_16x16_1x1_16x16x1_16x16x1_1x16x1x16_4_1x1_intrawave_v1,104.36,723.62,0.0
gfx950,256,96,2560,2048,ck,8,0,8.0051,a8w8_blockscale_1x128x128_256x16x64x256_16x16_16x16_1x1_16x16x1_16x16x1_1x16x1x16_4_1x1_intrawave_v1,125.75,740.9,0.0
gfx950,256,112,2560,2048,ck,7,0,9.3276,a8w8_blockscale_1x128x128_256x16x128x256_16x16_16x16_1x2_16x16x1_16x16x1_1x16x1x16_8_1x2_intrawave_v1,125.91,648.15,0.0
gfx950,256,128,2560,2048,ck,7,0,9.3678,a8w8_blockscale_1x128x128_256x16x128x256_16x16_16x16_1x2_16x16x1_16x16x1_1x16x1x16_8_1x2_intrawave_v1,143.28,657.61,0.0
gfx950,256,256,2560,2048,ck,18,0,9.5092,a8w8_blockscale_1x128x128_256x64x64x256_16x16_32x32_1x1_16x16x1_16x16x1_1x32x1x8_8_1x1_intrawave_v1,282.29,744.32,0.0
gfx950,256,512,2560,2048,ck,2,0,15.1707,a8w8_blockscale_1x128x128_256x64x128x128_16x16_32x32_1x2_8x32x1_8x32x1_1x32x1x8_8_1x1_intrawave_v3,353.89,587.51,0.0
gfx950,256,588,2560,2048,ck,2,0,15.5126,a8w8_blockscale_1x128x128_256x64x128x128_16x16_32x32_1x2_8x32x1_8x32x1_1x32x1x8_8_1x1_intrawave_v3,397.46,609.68,0.0
gfx950,256,773,2560,2048,ck,3,0,18.7566,a8w8_blockscale_1x128x128_256x64x64x128_16x16_32x32_1x1_8x32x1_8x32x1_1x32x1x8_8_1x1_intrawave_v3,432.14,574.93,0.0
gfx950,256,822,2560,2048,ck,3,0,18.8055,a8w8_blockscale_1x128x128_256x64x64x128_16x16_32x32_1x1_8x32x1_8x32x1_1x32x1x8_8_1x1_intrawave_v3,458.34,592.11,0.0
gfx950,256,1024,2560,2048,ck,0,0,19.3495,a8w8_blockscale_1x128x128_256x128x128x128_16x16_32x32_2x2_8x32x1_8x32x1_1x32x1x8_8_1x1_intrawave_v3,554.92,650.3,0.0
gfx950,256,1025,2560,2048,ck,0,0,19.98,a8w8_blockscale_1x128x128_256x128x128x128_16x16_32x32_2x2_8x32x1_8x32x1_1x32x1x8_8_1x1_intrawave_v3,537.93,630.13,0.0
gfx950,256,1027,2560,2048,ck,0,0,20.1065,a8w8_blockscale_1x128x128_256x128x128x128_16x16_32x32_2x2_8x32x1_8x32x1_1x32x1x8_8_1x1_intrawave_v3,535.59,626.88,0.0
gfx950,256,1042,2560,2048,ck,0,0,20.2251,a8w8_blockscale_1x128x128_256x128x128x128_16x16_32x32_2x2_8x32x1_8x32x1_1x32x1x8_8_1x1_intrawave_v3,540.23,628.52,0.0
gfx950,256,1051,2560,2048,ck,0,0,20.0899,a8w8_blockscale_1x128x128_256x128x128x128_16x16_32x32_2x2_8x32x1_8x32x1_1x32x1x8_8_1x1_intrawave_v3,548.56,635.96,0.0
gfx950,256,1055,2560,2048,ck,0,0,20.1429,a8w8_blockscale_1x128x128_256x128x128x128_16x16_32x32_2x2_8x32x1_8x32x1_1x32x1x8_8_1x1_intrawave_v3,549.2,635.71,0.0
gfx950,256,1057,2560,2048,ck,0,0,20.2337,a8w8_blockscale_1x128x128_256x128x128x128_16x16_32x32_2x2_8x32x1_8x32x1_1x32x1x8_8_1x1_intrawave_v3,547.77,633.57,0.0
gfx950,256,1069,2560,2048,ck,3,0,20.163,a8w8_blockscale_1x128x128_256x64x64x128_16x16_32x32_1x1_8x32x1_8x32x1_1x32x1x8_8_1x1_intrawave_v3,555.93,640.06,0.0
gfx950,256,1072,2560,2048,ck,0,0,20.3138,a8w8_blockscale_1x128x128_256x128x128x128_16x16_32x32_2x2_8x32x1_8x32x1_1x32x1x8_8_1x1_intrawave_v3,553.35,636.36,0.0
gfx950,256,1074,2560,2048,ck,0,0,20.2529,a8w8_blockscale_1x128x128_256x128x128x128_16x16_32x32_2x2_8x32x1_8x32x1_1x32x1x8_8_1x1_intrawave_v3,556.05,638.99,0.0
gfx950,256,1091,2560,2048,ck,3,0,20.3796,a8w8_blockscale_1x128x128_256x64x64x128_16x16_32x32_1x1_8x32x1_8x32x1_1x32x1x8_8_1x1_intrawave_v3,561.34,640.99,0.0
gfx950,256,1128,2560,2048,ck,2,0,20.3252,a8w8_blockscale_1x128x128_256x64x128x128_16x16_32x32_1x2_8x32x1_8x32x1_1x32x1x8_8_1x1_intrawave_v3,581.93,655.76,0.0
gfx950,256,1136,2560,2048,ck,0,0,20.3679,a8w8_blockscale_1x128x128_256x128x128x128_16x16_32x32_2x2_8x32x1_8x32x1_1x32x1x8_8_1x1_intrawave_v3,584.83,657.2,0.0
gfx950,256,1514,2560,2048,ck,0,0,20.9377,a8w8_blockscale_1x128x128_256x128x128x128_16x16_32x32_2x2_8x32x1_8x32x1_1x32x1x8_8_1x1_intrawave_v3,758.22,768.72,0.0
gfx950,256,2017,2560,2048,ck,2,0,29.5447,a8w8_blockscale_1x128x128_256x64x128x128_16x16_32x32_1x2_8x32x1_8x32x1_1x32x1x8_8_1x1_intrawave_v3,715.86,666.81,0.0
gfx950,256,2048,2560,2048,ck,2,0,29.7673,a8w8_blockscale_1x128x128_256x64x128x128_16x16_32x32_1x2_8x32x1_8x32x1_1x32x1x8_8_1x1_intrawave_v3,721.42,669.29,0.0
gfx950,256,2151,2560,2048,ck,2,0,29.5471,a8w8_blockscale_1x128x128_256x64x128x128_16x16_32x32_1x2_8x32x1_8x32x1_1x32x1x8_8_1x1_intrawave_v3,763.35,699.26,0.0
gfx950,256,2332,2560,2048,ck,2,0,30.6028,a8w8_blockscale_1x128x128_256x64x128x128_16x16_32x32_1x2_8x32x1_8x32x1_1x32x1x8_8_1x1_intrawave_v3,799.04,717.54,0.0
gfx950,256,2341,2560,2048,ck,2,0,30.4868,a8w8_blockscale_1x128x128_256x64x128x128_16x16_32x32_1x2_8x32x1_8x32x1_1x32x1x8_8_1x1_intrawave_v3,805.17,722.38,0.0
gfx950,256,3072,2560,2048,ck,0,0,33.0134,a8w8_blockscale_1x128x128_256x128x128x128_16x16_32x32_2x2_8x32x1_8x32x1_1x32x1x8_8_1x1_intrawave_v3,975.73,825.82,0.0
gfx950,256,3073,2560,2048,ck,0,0,33.9861,a8w8_blockscale_1x128x128_256x128x128x128_16x16_32x32_2x2_8x32x1_8x32x1_1x32x1x8_8_1x1_intrawave_v3,948.12,802.39,0.0
gfx950,256,3089,2560,2048,ck,0,0,34.3867,a8w8_blockscale_1x128x128_256x128x128x128_16x16_32x32_2x2_8x32x1_8x32x1_1x32x1x8_8_1x1_intrawave_v3,941.95,796.38,0.0
gfx950,256,3110,2560,2048,ck,0,0,33.7901,a8w8_blockscale_1x128x128_256x128x128x128_16x16_32x32_2x2_8x32x1_8x32x1_1x32x1x8_8_1x1_intrawave_v3,965.1,814.89,0.0
gfx950,256,3137,2560,2048,ck,0,0,33.8788,a8w8_blockscale_1x128x128_256x128x128x128_16x16_32x32_2x2_8x32x1_8x32x1_1x32x1x8_8_1x1_intrawave_v3,970.93,818.47,0.0
gfx950,256,3613,2560,2048,ck,0,0,45.7128,a8w8_blockscale_1x128x128_256x128x128x128_16x16_32x32_2x2_8x32x1_8x32x1_1x32x1x8_8_1x1_intrawave_v3,828.76,681.23,0.0
gfx950,256,4096,2560,2048,ck,0,0,46.3749,a8w8_blockscale_1x128x128_256x128x128x128_16x16_32x32_2x2_8x32x1_8x32x1_1x32x1x8_8_1x1_intrawave_v3,926.14,746.16,0.0
gfx950,256,4097,2560,2048,ck,0,0,47.4938,a8w8_blockscale_1x128x128_256x128x128x128_16x16_32x32_2x2_8x32x1_8x32x1_1x32x1x8_8_1x1_intrawave_v3,904.54,728.73,0.0
gfx950,256,4109,2560,2048,ck,0,0,47.0163,a8w8_blockscale_1x128x128_256x128x128x128_16x16_32x32_2x2_8x32x1_8x32x1_1x32x1x8_8_1x1_intrawave_v3,916.41,737.96,0.0
gfx950,256,4143,2560,2048,ck,0,0,46.8204,a8w8_blockscale_1x128x128_256x128x128x128_16x16_32x32_2x2_8x32x1_8x32x1_1x32x1x8_8_1x1_intrawave_v3,927.85,746.25,0.0
gfx950,256,4345,2560,2048,ck,0,0,46.7606,a8w8_blockscale_1x128x128_256x128x128x128_16x16_32x32_2x2_8x32x1_8x32x1_1x32x1x8_8_1x1_intrawave_v3,974.34,778.17,0.0
gfx950,256,4413,2560,2048,ck,0,0,47.881,a8w8_blockscale_1x128x128_256x128x128x128_16x16_32x32_2x2_8x32x1_8x32x1_1x32x1x8_8_1x1_intrawave_v3,966.43,770.14,0.0
gfx950,256,5121,2560,2048,ck,0,0,57.9082,a8w8_blockscale_1x128x128_256x128x128x128_16x16_32x32_2x2_8x32x1_8x32x1_1x32x1x8_8_1x1_intrawave_v3,927.29,724.43,0.0
gfx950,256,5123,2560,2048,ck,0,0,58.0586,a8w8_blockscale_1x128x128_256x128x128x128_16x16_32x32_2x2_8x32x1_8x32x1_1x32x1x8_8_1x1_intrawave_v3,925.25,722.8,0.0
gfx950,256,5133,2560,2048,ck,0,0,58.163,a8w8_blockscale_1x128x128_256x128x128x128_16x16_32x32_2x2_8x32x1_8x32x1_1x32x1x8_8_1x1_intrawave_v3,925.39,722.73,0.0
gfx950,256,5185,2560,2048,ck,0,0,58.1534,a8w8_blockscale_1x128x128_256x128x128x128_16x16_32x32_2x2_8x32x1_8x32x1_1x32x1x8_8_1x1_intrawave_v3,934.92,729.26,0.0
gfx950,256,5191,2560,2048,ck,0,0,58.3599,a8w8_blockscale_1x128x128_256x128x128x128_16x16_32x32_2x2_8x32x1_8x32x1_1x32x1x8_8_1x1_intrawave_v3,932.69,727.42,0.0
gfx950,256,6146,2560,2048,ck,0,0,62.2755,a8w8_blockscale_1x128x128_256x128x128x128_16x16_32x32_2x2_8x32x1_8x32x1_1x32x1x8_8_1x1_intrawave_v3,1034.84,791.6,0.0
gfx950,256,6147,2560,2048,ck,0,0,61.3071,a8w8_blockscale_1x128x128_256x128x128x128_16x16_32x32_2x2_8x32x1_8x32x1_1x32x1x8_8_1x1_intrawave_v3,1051.36,804.22,0.0
gfx950,256,6155,2560,2048,ck,0,0,61.6643,a8w8_blockscale_1x128x128_256x128x128x128_16x16_32x32_2x2_8x32x1_8x32x1_1x32x1x8_8_1x1_intrawave_v3,1046.63,800.49,0.0
gfx950,256,6377,2560,2048,ck,0,0,61.8099,a8w8_blockscale_1x128x128_256x128x128x128_16x16_32x32_2x2_8x32x1_8x32x1_1x32x1x8_8_1x1_intrawave_v3,1081.83,824.35,0.0
gfx950,256,6401,2560,2048,ck,0,0,63.8243,a8w8_blockscale_1x128x128_256x128x128x128_16x16_32x32_2x2_8x32x1_8x32x1_1x32x1x8_8_1x1_intrawave_v3,1051.63,801.03,0.0
gfx950,256,7121,2560,2048,ck,0,0,71.8763,a8w8_blockscale_1x128x128_256x128x128x128_16x16_32x32_2x2_8x32x1_8x32x1_1x32x1x8_8_1x1_intrawave_v3,1038.86,783.1,0.0
gfx950,256,7169,2560,2048,ck,0,0,73.5189,a8w8_blockscale_1x128x128_256x128x128x128_16x16_32x32_2x2_8x32x1_8x32x1_1x32x1x8_8_1x1_intrawave_v3,1022.49,770.28,0.0
gfx950,256,7170,2560,2048,ck,0,0,73.4797,a8w8_blockscale_1x128x128_256x128x128x128_16x16_32x32_2x2_8x32x1_8x32x1_1x32x1x8_8_1x1_intrawave_v3,1023.18,770.79,0.0
gfx950,256,7176,2560,2048,ck,0,0,72.9512,a8w8_blockscale_1x128x128_256x128x128x128_16x16_32x32_2x2_8x32x1_8x32x1_1x32x1x8_8_1x1_intrawave_v3,1031.45,776.96,0.0
gfx950,256,7177,2560,2048,ck,0,0,73.526,a8w8_blockscale_1x128x128_256x128x128x128_16x16_32x32_2x2_8x32x1_8x32x1_1x32x1x8_8_1x1_intrawave_v3,1023.53,770.99,0.0
gfx950,256,7185,2560,2048,ck,0,0,72.9424,a8w8_blockscale_1x128x128_256x128x128x128_16x16_32x32_2x2_8x32x1_8x32x1_1x32x1x8_8_1x1_intrawave_v3,1032.87,777.94,0.0
gfx950,256,7206,2560,2048,ck,0,0,72.8484,a8w8_blockscale_1x128x128_256x128x128x128_16x16_32x32_2x2_8x32x1_8x32x1_1x32x1x8_8_1x1_intrawave_v3,1037.23,781.01,0.0
gfx950,256,7217,2560,2048,ck,0,0,72.5248,a8w8_blockscale_1x128x128_256x128x128x128_16x16_32x32_2x2_8x32x1_8x32x1_1x32x1x8_8_1x1_intrawave_v3,1043.45,785.58,0.0
gfx950,256,7257,2560,2048,ck,0,0,73.2232,a8w8_blockscale_1x128x128_256x128x128x128_16x16_32x32_2x2_8x32x1_8x32x1_1x32x1x8_8_1x1_intrawave_v3,1039.22,782.01,0.0
gfx950,256,7265,2560,2048,ck,0,0,73.0437,a8w8_blockscale_1x128x128_256x128x128x128_16x16_32x32_2x2_8x32x1_8x32x1_1x32x1x8_8_1x1_intrawave_v3,1042.92,784.71,0.0
gfx950,256,7393,2560,2048,ck,0,0,73.924,a8w8_blockscale_1x128x128_256x128x128x128_16x16_32x32_2x2_8x32x1_8x32x1_1x32x1x8_8_1x1_intrawave_v3,1048.66,787.78,0.0
gfx950,256,7461,2560,2048,ck,0,0,73.7449,a8w8_blockscale_1x128x128_256x128x128x128_16x16_32x32_2x2_8x32x1_8x32x1_1x32x1x8_8_1x1_intrawave_v3,1060.88,796.3,0.0
gfx950,256,7634,2560,2048,ck,0,0,75.2341,a8w8_blockscale_1x128x128_256x128x128x128_16x16_32x32_2x2_8x32x1_8x32x1_1x32x1x8_8_1x1_intrawave_v3,1063.99,797.02,0.0
gfx950,256,8129,2560,2048,ck,0,0,78.2105,a8w8_blockscale_1x128x128_256x128x128x128_16x16_32x32_2x2_8x32x1_8x32x1_1x32x1x8_8_1x1_intrawave_v3,1089.86,812.06,0.0
gfx950,256,8192,2560,2048,ck,0,0,75.2696,a8w8_blockscale_1x128x128_256x128x128x128_16x16_32x32_2x2_8x32x1_8x32x1_1x32x1x8_8_1x1_intrawave_v3,1141.22,849.79,0.0
gfx950,256,1,3072,2048,ck,8,0,8.019,a8w8_blockscale_1x128x128_256x16x64x256_16x16_16x16_1x1_16x16x1_16x16x1_1x16x1x16_4_1x1_intrawave_v1,1.57,785.59,0.0
gfx950,256,2,3072,2048,ck,8,0,8.0637,a8w8_blockscale_1x128x128_256x16x64x256_16x16_16x16_1x1_16x16x1_16x16x1_1x16x1x16_4_1x1_intrawave_v1,3.12,782.25,0.0
gfx950,256,4,3072,2048,ck,8,0,8.0294,a8w8_blockscale_1x128x128_256x16x64x256_16x16_16x16_1x1_16x16x1_16x16x1_1x16x1x16_4_1x1_intrawave_v1,6.27,787.63,0.0
gfx950,256,8,3072,2048,ck,8,0,8.0871,a8w8_blockscale_1x128x128_256x16x64x256_16x16_16x16_1x1_16x16x1_16x16x1_1x16x1x16_4_1x1_intrawave_v1,12.45,786.07,0.0
gfx950,256,16,3072,2048,ck,8,0,7.9191,a8w8_blockscale_1x128x128_256x16x64x256_16x16_16x16_1x1_16x16x1_16x16x1_1x16x1x16_4_1x1_intrawave_v1,25.42,811.02,0.0
gfx950,256,32,3072,2048,ck,8,0,8.0996,a8w8_blockscale_1x128x128_256x16x64x256_16x16_16x16_1x1_16x16x1_16x16x1_1x16x1x16_4_1x1_intrawave_v1,49.71,809.13,0.0
gfx950,256,48,3072,2048,ck,8,0,8.1219,a8w8_blockscale_1x128x128_256x16x64x256_16x16_16x16_1x1_16x16x1_16x16x1_1x16x1x16_4_1x1_intrawave_v1,74.36,823.04,0.0
gfx950,256,64,3072,2048,ck,8,0,8.1558,a8w8_blockscale_1x128x128_256x16x64x256_16x16_16x16_1x1_16x16x1_16x16x1_1x16x1x16_4_1x1_intrawave_v1,98.74,835.69,0.0
gfx950,256,80,3072,2048,ck,8,0,8.2116,a8w8_blockscale_1x128x128_256x16x64x256_16x16_16x16_1x1_16x16x1_16x16x1_1x16x1x16_4_1x1_intrawave_v1,122.59,845.98,0.0
gfx950,256,96,3072,2048,ck,7,0,9.6028,a8w8_blockscale_1x128x128_256x16x128x256_16x16_16x16_1x2_16x16x1_16x16x1_1x16x1x16_8_1x2_intrawave_v1,125.79,737.07,0.0
gfx950,256,112,3072,2048,ck,7,0,9.324,a8w8_blockscale_1x128x128_256x16x128x256_16x16_16x16_1x2_16x16x1_16x16x1_1x16x1x16_8_1x2_intrawave_v1,151.15,773.16,0.0
gfx950,256,128,3072,2048,ck,7,0,9.6039,a8w8_blockscale_1x128x128_256x16x128x256_16x16_16x16_1x2_16x16x1_16x16x1_1x16x1x16_8_1x2_intrawave_v1,167.7,764.28,0.0
gfx950,256,256,3072,2048,ck,18,0,9.9694,a8w8_blockscale_1x128x128_256x64x64x256_16x16_32x32_1x1_16x16x1_16x16x1_1x32x1x8_8_1x1_intrawave_v1,323.11,841.44,0.0
gfx950,256,512,3072,2048,ck,2,0,15.1764,a8w8_blockscale_1x128x128_256x64x128x128_16x16_32x32_1x2_8x32x1_8x32x1_1x32x1x8_8_1x1_intrawave_v3,424.5,690.93,0.0
gfx950,256,588,3072,2048,ck,2,0,15.8331,a8w8_blockscale_1x128x128_256x64x128x128_16x16_32x32_1x2_8x32x1_8x32x1_1x32x1x8_8_1x1_intrawave_v3,467.3,701.59,0.0
gfx950,256,773,3072,2048,ck,0,0,19.8779,a8w8_blockscale_1x128x128_256x128x128x128_16x16_32x32_2x2_8x32x1_8x32x1_1x32x1x8_8_1x1_intrawave_v3,489.32,635.07,0.0
gfx950,256,822,3072,2048,ck,2,0,20.1208,a8w8_blockscale_1x128x128_256x64x128x128_16x16_32x32_1x2_8x32x1_8x32x1_1x32x1x8_8_1x1_intrawave_v3,514.05,647.35,0.0
gfx950,256,1024,3072,2048,ck,0,0,19.7254,a8w8_blockscale_1x128x128_256x128x128x128_16x16_32x32_2x2_8x32x1_8x32x1_1x32x1x8_8_1x1_intrawave_v3,653.21,744.22,0.0
gfx950,256,1025,3072,2048,ck,0,0,20.5013,a8w8_blockscale_1x128x128_256x128x128x128_16x16_32x32_2x2_8x32x1_8x32x1_1x32x1x8_8_1x1_intrawave_v3,629.11,716.45,0.0
gfx950,256,1027,3072,2048,ck,0,0,20.5163,a8w8_blockscale_1x128x128_256x128x128x128_16x16_32x32_2x2_8x32x1_8x32x1_1x32x1x8_8_1x1_intrawave_v3,629.87,716.73,0.0
gfx950,256,1042,3072,2048,ck,0,0,20.5342,a8w8_blockscale_1x128x128_256x128x128x128_16x16_32x32_2x2_8x32x1_8x32x1_1x32x1x8_8_1x1_intrawave_v3,638.51,722.09,0.0
gfx950,256,1051,3072,2048,ck,0,0,20.6082,a8w8_blockscale_1x128x128_256x128x128x128_16x16_32x32_2x2_8x32x1_8x32x1_1x32x1x8_8_1x1_intrawave_v3,641.72,723.07,0.0
gfx950,256,1055,3072,2048,ck,0,0,20.608,a8w8_blockscale_1x128x128_256x128x128x128_16x16_32x32_2x2_8x32x1_8x32x1_1x32x1x8_8_1x1_intrawave_v3,644.17,724.67,0.0
gfx950,256,1057,3072,2048,ck,0,0,20.5643,a8w8_blockscale_1x128x128_256x128x128x128_16x16_32x32_2x2_8x32x1_8x32x1_1x32x1x8_8_1x1_intrawave_v3,646.76,727.01,0.0
gfx950,256,1069,3072,2048,ck,0,0,20.6533,a8w8_blockscale_1x128x128_256x128x128x128_16x16_32x32_2x2_8x32x1_8x32x1_1x32x1x8_8_1x1_intrawave_v3,651.28,728.63,0.0
gfx950,256,1072,3072,2048,ck,0,0,20.7612,a8w8_blockscale_1x128x128_256x128x128x128_16x16_32x32_2x2_8x32x1_8x32x1_1x32x1x8_8_1x1_intrawave_v3,649.72,726.03,0.0
gfx950,256,1074,3072,2048,ck,0,0,20.7546,a8w8_blockscale_1x128x128_256x128x128x128_16x16_32x32_2x2_8x32x1_8x32x1_1x32x1x8_8_1x1_intrawave_v3,651.14,727.05,0.0
gfx950,256,1091,3072,2048,ck,0,0,20.6668,a8w8_blockscale_1x128x128_256x128x128x128_16x16_32x32_2x2_8x32x1_8x32x1_1x32x1x8_8_1x1_intrawave_v3,664.25,736.88,0.0
gfx950,256,1128,3072,2048,ck,0,0,20.7771,a8w8_blockscale_1x128x128_256x128x128x128_16x16_32x32_2x2_8x32x1_8x32x1_1x32x1x8_8_1x1_intrawave_v3,683.13,747.56,0.0
gfx950,256,1136,3072,2048,ck,0,0,20.6632,a8w8_blockscale_1x128x128_256x128x128x128_16x16_32x32_2x2_8x32x1_8x32x1_1x32x1x8_8_1x1_intrawave_v3,691.77,754.85,0.0
gfx950,256,1514,3072,2048,ck,2,0,28.7784,a8w8_blockscale_1x128x128_256x64x128x128_16x16_32x32_1x2_8x32x1_8x32x1_1x32x1x8_8_1x1_intrawave_v3,661.97,649.59,0.0
gfx950,256,2017,3072,2048,ck,2,0,31.162,a8w8_blockscale_1x128x128_256x64x128x128_16x16_32x32_1x2_8x32x1_8x32x1_1x32x1x8_8_1x1_intrawave_v3,814.44,732.13,0.0
gfx950,256,2048,3072,2048,ck,2,0,30.726,a8w8_blockscale_1x128x128_256x64x128x128_16x16_32x32_1x2_8x32x1_8x32x1_1x32x1x8_8_1x1_intrawave_v3,838.7,750.79,0.0
gfx950,256,2151,3072,2048,ck,0,0,31.9071,a8w8_blockscale_1x128x128_256x128x128x128_16x16_32x32_2x2_8x32x1_8x32x1_1x32x1x8_8_1x1_intrawave_v3,848.27,749.44,0.0
gfx950,256,2332,3072,2048,ck,0,0,32.7552,a8w8_blockscale_1x128x128_256x128x128x128_16x16_32x32_2x2_8x32x1_8x32x1_1x32x1x8_8_1x1_intrawave_v3,895.84,775.3,0.0
gfx950,256,2341,3072,2048,ck,0,0,32.5846,a8w8_blockscale_1x128x128_256x128x128x128_16x16_32x32_2x2_8x32x1_8x32x1_1x32x1x8_8_1x1_intrawave_v3,904.0,781.62,0.0
gfx950,256,3072,3072,2048,ck,0,0,44.8071,a8w8_blockscale_1x128x128_256x128x128x128_16x16_32x32_2x2_8x32x1_8x32x1_1x32x1x8_8_1x1_intrawave_v3,862.69,702.06,0.0
gfx950,256,3073,3072,2048,ck,0,0,45.6428,a8w8_blockscale_1x128x128_256x128x128x128_16x16_32x32_2x2_8x32x1_8x32x1_1x32x1x8_8_1x1_intrawave_v3,847.17,689.39,0.0
gfx950,256,3089,3072,2048,ck,0,0,45.9844,a8w8_blockscale_1x128x128_256x128x128x128_16x16_32x32_2x2_8x32x1_8x32x1_1x32x1x8_8_1x1_intrawave_v3,845.26,687.11,0.0
gfx950,256,3110,3072,2048,ck,0,0,45.2859,a8w8_blockscale_1x128x128_256x128x128x128_16x16_32x32_2x2_8x32x1_8x32x1_1x32x1x8_8_1x1_intrawave_v3,864.13,701.51,0.0
gfx950,256,3137,3072,2048,ck,0,0,45.7551,a8w8_blockscale_1x128x128_256x128x128x128_16x16_32x32_2x2_8x32x1_8x32x1_1x32x1x8_8_1x1_intrawave_v3,862.69,699.15,0.0
gfx950,256,3613,3072,2048,ck,0,0,47.4685,a8w8_blockscale_1x128x128_256x128x128x128_16x16_32x32_2x2_8x32x1_8x32x1_1x32x1x8_8_1x1_intrawave_v3,957.73,756.06,0.0
gfx950,256,4096,3072,2048,ck,0,0,49.8262,a8w8_blockscale_1x128x128_256x128x128x128_16x16_32x32_2x2_8x32x1_8x32x1_1x32x1x8_8_1x1_intrawave_v3,1034.39,799.7,0.0
gfx950,256,4097,3072,2048,ck,0,0,58.0057,a8w8_blockscale_1x128x128_256x128x128x128_16x16_32x32_2x2_8x32x1_8x32x1_1x32x1x8_8_1x1_intrawave_v3,888.74,687.07,0.0
gfx950,256,4109,3072,2048,ck,0,0,58.0494,a8w8_blockscale_1x128x128_256x128x128x128_16x16_32x32_2x2_8x32x1_8x32x1_1x32x1x8_8_1x1_intrawave_v3,890.68,688.25,0.0
gfx950,256,4143,3072,2048,ck,0,0,57.7316,a8w8_blockscale_1x128x128_256x128x128x128_16x16_32x32_2x2_8x32x1_8x32x1_1x32x1x8_8_1x1_intrawave_v3,902.99,696.86,0.0
gfx950,256,4345,3072,2048,ck,0,0,58.661,a8w8_blockscale_1x128x128_256x128x128x128_16x16_32x32_2x2_8x32x1_8x32x1_1x32x1x8_8_1x1_intrawave_v3,932.01,714.03,0.0
gfx950,256,4413,3072,2048,ck,0,0,58.4758,a8w8_blockscale_1x128x128_256x128x128x128_16x16_32x32_2x2_8x32x1_8x32x1_1x32x1x8_8_1x1_intrawave_v3,949.6,725.82,0.0
gfx950,256,5121,3072,2048,ck,0,0,62.3143,a8w8_blockscale_1x128x128_256x128x128x128_16x16_32x32_2x2_8x32x1_8x32x1_1x32x1x8_8_1x1_intrawave_v3,1034.07,774.18,0.0
gfx950,256,5123,3072,2048,ck,0,0,61.0615,a8w8_blockscale_1x128x128_256x128x128x128_16x16_32x32_2x2_8x32x1_8x32x1_1x32x1x8_8_1x1_intrawave_v3,1055.69,790.34,0.0
gfx950,256,5133,3072,2048,ck,0,0,61.9975,a8w8_blockscale_1x128x128_256x128x128x128_16x16_32x32_2x2_8x32x1_8x32x1_1x32x1x8_8_1x1_intrawave_v3,1041.79,779.72,0.0
gfx950,256,5185,3072,2048,ck,0,0,61.7883,a8w8_blockscale_1x128x128_256x128x128x128_16x16_32x32_2x2_8x32x1_8x32x1_1x32x1x8_8_1x1_intrawave_v3,1055.9,789.26,0.0
gfx950,256,5191,3072,2048,ck,0,0,61.2607,a8w8_blockscale_1x128x128_256x128x128x128_16x16_32x32_2x2_8x32x1_8x32x1_1x32x1x8_8_1x1_intrawave_v3,1066.23,796.86,0.0
gfx950,256,6146,3072,2048,ck,0,0,73.428,a8w8_blockscale_1x128x128_256x128x128x128_16x16_32x32_2x2_8x32x1_8x32x1_1x32x1x8_8_1x1_intrawave_v3,1053.2,771.36,0.0
gfx950,256,6147,3072,2048,ck,0,0,73.4744,a8w8_blockscale_1x128x128_256x128x128x128_16x16_32x32_2x2_8x32x1_8x32x1_1x32x1x8_8_1x1_intrawave_v3,1052.71,770.99,0.0
gfx950,256,6155,3072,2048,ck,0,0,74.752,a8w8_blockscale_1x128x128_256x128x128x128_16x16_32x32_2x2_8x32x1_8x32x1_1x32x1x8_8_1x1_intrawave_v3,1036.06,758.68,0.0
gfx950,256,6377,3072,2048,ck,0,0,73.9968,a8w8_blockscale_1x128x128_256x128x128x128_16x16_32x32_2x2_8x32x1_8x32x1_1x32x1x8_8_1x1_intrawave_v3,1084.39,791.01,0.0
gfx950,256,6401,3072,2048,ck,0,0,75.7116,a8w8_blockscale_1x128x128_256x128x128x128_16x16_32x32_2x2_8x32x1_8x32x1_1x32x1x8_8_1x1_intrawave_v3,1063.82,775.69,0.0
gfx950,256,7121,3072,2048,ck,0,0,85.5265,a8w8_blockscale_1x128x128_256x128x128x128_16x16_32x32_2x2_8x32x1_8x32x1_1x32x1x8_8_1x1_intrawave_v3,1047.66,755.63,0.0
gfx950,256,7169,3072,2048,ck,0,0,85.855,a8w8_blockscale_1x128x128_256x128x128x128_16x16_32x32_2x2_8x32x1_8x32x1_1x32x1x8_8_1x1_intrawave_v3,1050.69,757.32,0.0
gfx950,256,7170,3072,2048,ck,0,0,86.1658,a8w8_blockscale_1x128x128_256x128x128x128_16x16_32x32_2x2_8x32x1_8x32x1_1x32x1x8_8_1x1_intrawave_v3,1047.05,754.69,0.0
gfx950,256,7176,3072,2048,ck,0,0,85.927,a8w8_blockscale_1x128x128_256x128x128x128_16x16_32x32_2x2_8x32x1_8x32x1_1x32x1x8_8_1x1_intrawave_v3,1050.83,757.36,0.0
gfx950,256,7177,3072,2048,ck,0,0,86.8306,a8w8_blockscale_1x128x128_256x128x128x128_16x16_32x32_2x2_8x32x1_8x32x1_1x32x1x8_8_1x1_intrawave_v3,1040.04,749.57,0.0
gfx950,256,7185,3072,2048,ck,0,0,85.2734,a8w8_blockscale_1x128x128_256x128x128x128_16x16_32x32_2x2_8x32x1_8x32x1_1x32x1x8_8_1x1_intrawave_v3,1060.22,764.02,0.0
gfx950,256,7206,3072,2048,ck,0,0,86.171,a8w8_blockscale_1x128x128_256x128x128x128_16x16_32x32_2x2_8x32x1_8x32x1_1x32x1x8_8_1x1_intrawave_v3,1052.24,758.06,0.0
gfx950,256,7217,3072,2048,ck,0,0,85.8634,a8w8_blockscale_1x128x128_256x128x128x128_16x16_32x32_2x2_8x32x1_8x32x1_1x32x1x8_8_1x1_intrawave_v3,1057.62,761.83,0.0
gfx950,256,7257,3072,2048,ck,0,0,86.1554,a8w8_blockscale_1x128x128_256x128x128x128_16x16_32x32_2x2_8x32x1_8x32x1_1x32x1x8_8_1x1_intrawave_v3,1059.88,763.05,0.0
gfx950,256,7265,3072,2048,ck,0,0,86.343,a8w8_blockscale_1x128x128_256x128x128x128_16x16_32x32_2x2_8x32x1_8x32x1_1x32x1x8_8_1x1_intrawave_v3,1058.74,762.15,0.0
gfx950,256,7393,3072,2048,ck,0,0,86.7098,a8w8_blockscale_1x128x128_256x128x128x128_16x16_32x32_2x2_8x32x1_8x32x1_1x32x1x8_8_1x1_intrawave_v3,1072.84,771.02,0.0
gfx950,256,7461,3072,2048,ck,0,0,87.6434,a8w8_blockscale_1x128x128_256x128x128x128_16x16_32x32_2x2_8x32x1_8x32x1_1x32x1x8_8_1x1_intrawave_v3,1071.17,769.16,0.0
gfx950,256,7634,3072,2048,ck,0,0,87.5066,a8w8_blockscale_1x128x128_256x128x128x128_16x16_32x32_2x2_8x32x1_8x32x1_1x32x1x8_8_1x1_intrawave_v3,1097.72,786.56,0.0
gfx950,256,8129,3072,2048,ck,0,0,90.6706,a8w8_blockscale_1x128x128_256x128x128x128_16x16_32x32_2x2_8x32x1_8x32x1_1x32x1x8_8_1x1_intrawave_v3,1128.11,803.84,0.0
gfx950,256,8192,3072,2048,ck,0,0,89.351,a8w8_blockscale_1x128x128_256x128x128x128_16x16_32x32_2x2_8x32x1_8x32x1_1x32x1x8_8_1x1_intrawave_v3,1153.64,821.48,0.0
gfx950,256,1,4608,2048,ck,8,0,8.0959,a8w8_blockscale_1x128x128_256x16x64x256_16x16_16x16_1x1_16x16x1_16x16x1_1x16x1x16_4_1x1_intrawave_v1,2.33,1167.07,0.0
gfx950,256,2,4608,2048,ck,8,0,8.0539,a8w8_blockscale_1x128x128_256x16x64x256_16x16_16x16_1x1_16x16x1_16x16x1_1x16x1x16_4_1x1_intrawave_v1,4.69,1174.55,0.0
gfx950,256,4,4608,2048,ck,8,0,8.1186,a8w8_blockscale_1x128x128_256x16x64x256_16x16_16x16_1x1_16x16x1_16x16x1_1x16x1x16_4_1x1_intrawave_v1,9.3,1167.96,0.0
gfx950,256,8,4608,2048,ck,8,0,8.091,a8w8_blockscale_1x128x128_256x16x64x256_16x16_16x16_1x1_16x16x1_16x16x1_1x16x1x16_4_1x1_intrawave_v1,18.66,1177.52,0.0
gfx950,256,16,4608,2048,ck,8,0,7.9723,a8w8_blockscale_1x128x128_256x16x64x256_16x16_16x16_1x1_16x16x1_16x16x1_1x16x1x16_4_1x1_intrawave_v1,37.88,1206.35,0.0
gfx950,256,24,4608,2048,ck,8,0,8.3743,a8w8_blockscale_1x128x128_256x16x64x256_16x16_16x16_1x1_16x16x1_16x16x1_1x16x1x16_4_1x1_intrawave_v1,54.09,1159.2,0.0
gfx950,256,32,4608,2048,ck,8,0,8.2213,a8w8_blockscale_1x128x128_256x16x64x256_16x16_16x16_1x1_16x16x1_16x16x1_1x16x1x16_4_1x1_intrawave_v1,73.47,1191.74,0.0
gfx950,256,40,4608,2048,ck,8,0,8.2,a8w8_blockscale_1x128x128_256x16x64x256_16x16_16x16_1x1_16x16x1_16x16x1_1x16x1x16_4_1x1_intrawave_v1,92.07,1205.82,0.0
gfx950,256,48,4608,2048,ck,8,0,8.2626,a8w8_blockscale_1x128x128_256x16x64x256_16x16_16x16_1x1_16x16x1_16x16x1_1x16x1x16_4_1x1_intrawave_v1,109.65,1207.59,0.0
gfx950,256,56,4608,2048,ck,7,0,9.6699,a8w8_blockscale_1x128x128_256x16x128x256_16x16_16x16_1x2_16x16x1_16x16x1_1x16x1x16_8_1x2_intrawave_v1,109.3,1041.17,0.0
gfx950,256,64,4608,2048,ck,7,0,9.359,a8w8_blockscale_1x128x128_256x16x128x256_16x16_16x16_1x2_16x16x1_16x16x1_1x16x1x16_8_1x2_intrawave_v1,129.07,1085.38,0.0
gfx950,256,72,4608,2048,ck,7,0,9.7884,a8w8_blockscale_1x128x128_256x16x128x256_16x16_16x16_1x2_16x16x1_16x16x1_1x16x1x16_8_1x2_intrawave_v1,138.83,1046.97,0.0
gfx950,256,80,4608,2048,ck,7,0,9.5347,a8w8_blockscale_1x128x128_256x16x128x256_16x16_16x16_1x2_16x16x1_16x16x1_1x16x1x16_8_1x2_intrawave_v1,158.36,1084.28,0.0
gfx950,256,88,4608,2048,ck,7,0,9.8422,a8w8_blockscale_1x128x128_256x16x128x256_16x16_16x16_1x2_16x16x1_16x16x1_1x16x1x16_8_1x2_intrawave_v1,168.76,1059.56,0.0
gfx950,256,96,4608,2048,ck,7,0,9.6836,a8w8_blockscale_1x128x128_256x16x128x256_16x16_16x16_1x2_16x16x1_16x16x1_1x16x1x16_8_1x2_intrawave_v1,187.11,1086.22,0.0
gfx950,256,104,4608,2048,ck,7,0,9.3366,a8w8_blockscale_1x128x128_256x16x128x256_16x16_16x16_1x2_16x16x1_16x16x1_1x16x1x16_8_1x2_intrawave_v1,210.24,1136.24,0.0
gfx950,256,112,4608,2048,ck,7,0,9.5321,a8w8_blockscale_1x128x128_256x16x128x256_16x16_16x16_1x2_16x16x1_16x16x1_1x16x1x16_8_1x2_intrawave_v1,221.77,1122.39,0.0
gfx950,256,120,4608,2048,ck,18,0,10.6824,a8w8_blockscale_1x128x128_256x64x64x256_16x16_32x32_1x1_16x16x1_16x16x1_1x32x1x8_8_1x1_intrawave_v1,212.02,1009.97,0.0
gfx950,256,128,4608,2048,ck,18,0,9.5391,a8w8_blockscale_1x128x128_256x64x64x256_16x16_32x32_1x1_16x16x1_16x16x1_1x32x1x8_8_1x1_intrawave_v1,253.26,1140.46,0.0
gfx950,256,136,4608,2048,ck,18,0,11.1829,a8w8_blockscale_1x128x128_256x64x64x256_16x16_32x32_1x1_16x16x1_16x16x1_1x32x1x8_8_1x1_intrawave_v1,229.54,980.88,0.0
gfx950,256,144,4608,2048,ck,18,0,11.0742,a8w8_blockscale_1x128x128_256x64x64x256_16x16_32x32_1x1_16x16x1_16x16x1_1x32x1x8_8_1x1_intrawave_v1,245.43,998.65,0.0
gfx950,256,152,4608,2048,ck,18,0,11.2679,a8w8_blockscale_1x128x128_256x64x64x256_16x16_32x32_1x1_16x16x1_16x16x1_1x32x1x8_8_1x1_intrawave_v1,254.61,989.48,0.0
gfx950,256,160,4608,2048,ck,18,0,11.1264,a8w8_blockscale_1x128x128_256x64x64x256_16x16_32x32_1x1_16x16x1_16x16x1_1x32x1x8_8_1x1_intrawave_v1,271.42,1010.16,0.0
gfx950,256,168,4608,2048,ck,18,0,11.1983,a8w8_blockscale_1x128x128_256x64x64x256_16x16_32x32_1x1_16x16x1_16x16x1_1x32x1x8_8_1x1_intrawave_v1,283.16,1011.72,0.0
gfx950,256,176,4608,2048,ck,18,0,11.3288,a8w8_blockscale_1x128x128_256x64x64x256_16x16_32x32_1x1_16x16x1_16x16x1_1x32x1x8_8_1x1_intrawave_v1,293.23,1008.02,0.0
gfx950,256,184,4608,2048,ck,18,0,11.2686,a8w8_blockscale_1x128x128_256x64x64x256_16x16_32x32_1x1_16x16x1_16x16x1_1x32x1x8_8_1x1_intrawave_v1,308.19,1021.4,0.0
gfx950,256,192,4608,2048,ck,18,0,9.6584,a8w8_blockscale_1x128x128_256x64x64x256_16x16_32x32_1x1_16x16x1_16x16x1_1x32x1x8_8_1x1_intrawave_v1,375.2,1201.01,0.0
gfx950,256,200,4608,2048,ck,12,0,12.8055,a8w8_blockscale_1x128x128_256x32x128x256_16x16_32x32_1x1_16x16x1_16x16x1_1x32x1x8_8_1x1_intrawave_v1,294.79,912.89,0.0
gfx950,256,208,4608,2048,ck,12,0,12.8346,a8w8_blockscale_1x128x128_256x32x128x256_16x16_32x32_1x1_16x16x1_16x16x1_1x32x1x8_8_1x1_intrawave_v1,305.88,917.84,0.0
gfx950,256,216,4608,2048,ck,12,0,12.8339,a8w8_blockscale_1x128x128_256x32x128x256_16x16_32x32_1x1_16x16x1_16x16x1_1x32x1x8_8_1x1_intrawave_v1,317.66,924.91,0.0
gfx950,256,224,4608,2048,ck,12,0,11.9611,a8w8_blockscale_1x128x128_256x32x128x256_16x16_32x32_1x1_16x16x1_16x16x1_1x32x1x8_8_1x1_intrawave_v1,353.47,999.93,0.0
gfx950,256,232,4608,2048,ck,2,0,15.4336,a8w8_blockscale_1x128x128_256x64x128x128_16x16_32x32_1x2_8x32x1_8x32x1_1x32x1x8_8_1x1_intrawave_v3,283.72,780.79,0.0
gfx950,256,240,4608,2048,ck,2,0,15.3506,a8w8_blockscale_1x128x128_256x64x128x128_16x16_32x32_1x2_8x32x1_8x32x1_1x32x1x8_8_1x1_intrawave_v3,295.09,790.88,0.0
gfx950,256,248,4608,2048,ck,2,0,15.6634,a8w8_blockscale_1x128x128_256x64x128x128_16x16_32x32_1x2_8x32x1_8x32x1_1x32x1x8_8_1x1_intrawave_v3,298.84,780.84,0.0
gfx950,256,256,4608,2048,ck,2,0,15.3352,a8w8_blockscale_1x128x128_256x64x128x128_16x16_32x32_1x2_8x32x1_8x32x1_1x32x1x8_8_1x1_intrawave_v3,315.08,803.43,0.0
gfx950,256,272,4608,2048,ck,2,0,15.7007,a8w8_blockscale_1x128x128_256x64x128x128_16x16_32x32_1x2_8x32x1_8x32x1_1x32x1x8_8_1x1_intrawave_v3,326.98,796.21,0.0
gfx950,256,288,4608,2048,ck,2,0,15.456,a8w8_blockscale_1x128x128_256x64x128x128_16x16_32x32_1x2_8x32x1_8x32x1_1x32x1x8_8_1x1_intrawave_v3,351.7,820.47,0.0
gfx950,256,304,4608,2048,ck,2,0,15.7309,a8w8_blockscale_1x128x128_256x64x128x128_16x16_32x32_1x2_8x32x1_8x32x1_1x32x1x8_8_1x1_intrawave_v3,364.75,817.59,0.0
gfx950,256,320,4608,2048,ck,2,0,15.5983,a8w8_blockscale_1x128x128_256x64x128x128_16x16_32x32_1x2_8x32x1_8x32x1_1x32x1x8_8_1x1_intrawave_v3,387.21,836.1,0.0
gfx950,256,336,4608,2048,ck,2,0,15.8011,a8w8_blockscale_1x128x128_256x64x128x128_16x16_32x32_1x2_8x32x1_8x32x1_1x32x1x8_8_1x1_intrawave_v3,401.35,836.77,0.0
gfx950,256,352,4608,2048,ck,2,0,15.7179,a8w8_blockscale_1x128x128_256x64x128x128_16x16_32x32_1x2_8x32x1_8x32x1_1x32x1x8_8_1x1_intrawave_v3,422.69,852.67,0.0
gfx950,256,368,4608,2048,ck,2,0,15.8322,a8w8_blockscale_1x128x128_256x64x128x128_16x16_32x32_1x2_8x32x1_8x32x1_1x32x1x8_8_1x1_intrawave_v3,438.71,857.89,0.0
gfx950,256,384,4608,2048,ck,2,0,15.3252,a8w8_blockscale_1x128x128_256x64x128x128_16x16_32x32_1x2_8x32x1_8x32x1_1x32x1x8_8_1x1_intrawave_v3,472.93,898.03,0.0
gfx950,256,400,4608,2048,ck,2,0,15.729,a8w8_blockscale_1x128x128_256x64x128x128_16x16_32x32_1x2_8x32x1_8x32x1_1x32x1x8_8_1x1_intrawave_v3,479.99,886.44,0.0
gfx950,256,416,4608,2048,ck,2,0,15.831,a8w8_blockscale_1x128x128_256x64x128x128_16x16_32x32_1x2_8x32x1_8x32x1_1x32x1x8_8_1x1_intrawave_v3,495.97,892.11,0.0
gfx950,256,432,4608,2048,ck,2,0,15.6617,a8w8_blockscale_1x128x128_256x64x128x128_16x16_32x32_1x2_8x32x1_8x32x1_1x32x1x8_8_1x1_intrawave_v3,520.62,913.26,0.0
gfx950,256,448,4608,2048,ck,2,0,15.7233,a8w8_blockscale_1x128x128_256x64x128x128_16x16_32x32_1x2_8x32x1_8x32x1_1x32x1x8_8_1x1_intrawave_v3,537.78,921.15,0.0
gfx950,256,464,4608,2048,ck,3,0,19.5356,a8w8_blockscale_1x128x128_256x64x64x128_16x16_32x32_1x1_8x32x1_8x32x1_1x32x1x8_8_1x1_intrawave_v3,448.29,750.61,0.0
gfx950,256,480,4608,2048,ck,3,0,19.8072,a8w8_blockscale_1x128x128_256x64x64x128_16x16_32x32_1x1_8x32x1_8x32x1_1x32x1x8_8_1x1_intrawave_v3,457.39,749.42,0.0
gfx950,256,496,4608,2048,ck,0,0,20.1418,a8w8_blockscale_1x128x128_256x128x128x128_16x16_32x32_2x2_8x32x1_8x32x1_1x32x1x8_8_1x1_intrawave_v3,464.79,745.92,0.0
gfx950,256,512,4608,2048,ck,0,0,19.3941,a8w8_blockscale_1x128x128_256x128x128x128_16x16_32x32_2x2_8x32x1_8x32x1_1x32x1x8_8_1x1_intrawave_v3,498.28,783.97,0.0
gfx950,256,664,4608,2048,ck,0,0,20.3808,a8w8_blockscale_1x128x128_256x128x128x128_16x16_32x32_2x2_8x32x1_8x32x1_1x32x1x8_8_1x1_intrawave_v3,614.92,830.02,0.0
gfx950,256,762,4608,2048,ck,0,0,20.7468,a8w8_blockscale_1x128x128_256x128x128x128_16x16_32x32_2x2_8x32x1_8x32x1_1x32x1x8_8_1x1_intrawave_v3,693.23,868.58,0.0
gfx950,256,902,4608,2048,ck,2,0,28.8625,a8w8_blockscale_1x128x128_256x64x128x128_16x16_32x32_1x2_8x32x1_8x32x1_1x32x1x8_8_1x1_intrawave_v3,589.85,678.99,0.0
gfx950,256,961,4608,2048,ck,2,0,28.6298,a8w8_blockscale_1x128x128_256x64x128x128_16x16_32x32_1x2_8x32x1_8x32x1_1x32x1x8_8_1x1_intrawave_v3,633.55,707.72,0.0
gfx950,256,1000,4608,2048,ck,2,0,29.1574,a8w8_blockscale_1x128x128_256x64x128x128_16x16_32x32_1x2_8x32x1_8x32x1_1x32x1x8_8_1x1_intrawave_v3,647.33,709.98,0.0
gfx950,256,1001,4608,2048,ck,2,0,29.3681,a8w8_blockscale_1x128x128_256x64x128x128_16x16_32x32_1x2_8x32x1_8x32x1_1x32x1x8_8_1x1_intrawave_v3,643.33,705.27,0.0
gfx950,256,1002,4608,2048,ck,2,0,29.2555,a8w8_blockscale_1x128x128_256x64x128x128_16x16_32x32_1x2_8x32x1_8x32x1_1x32x1x8_8_1x1_intrawave_v3,646.45,708.37,0.0
gfx950,256,1003,4608,2048,ck,2,0,29.1979,a8w8_blockscale_1x128x128_256x64x128x128_16x16_32x32_1x2_8x32x1_8x32x1_1x32x1x8_8_1x1_intrawave_v3,648.37,710.15,0.0
gfx950,256,1015,4608,2048,ck,2,0,29.4809,a8w8_blockscale_1x128x128_256x64x128x128_16x16_32x32_1x2_8x32x1_8x32x1_1x32x1x8_8_1x1_intrawave_v3,649.83,707.92,0.0
gfx950,256,1023,4608,2048,ck,2,0,29.4303,a8w8_blockscale_1x128x128_256x64x128x128_16x16_32x32_1x2_8x32x1_8x32x1_1x32x1x8_8_1x1_intrawave_v3,656.07,712.2,0.0
gfx950,256,1024,4608,2048,ck,2,0,29.4234,a8w8_blockscale_1x128x128_256x64x128x128_16x16_32x32_1x2_8x32x1_8x32x1_1x32x1x8_8_1x1_intrawave_v3,656.87,712.75,0.0
gfx950,256,1025,4608,2048,ck,2,0,29.1188,a8w8_blockscale_1x128x128_256x64x128x128_16x16_32x32_1x2_8x32x1_8x32x1_1x32x1x8_8_1x1_intrawave_v3,664.39,720.59,0.0
gfx950,256,1032,4608,2048,ck,2,0,29.5313,a8w8_blockscale_1x128x128_256x64x128x128_16x16_32x32_1x2_8x32x1_8x32x1_1x32x1x8_8_1x1_intrawave_v3,659.58,713.2,0.0
gfx950,256,1038,4608,2048,ck,2,0,29.467,a8w8_blockscale_1x128x128_256x64x128x128_16x16_32x32_1x2_8x32x1_8x32x1_1x32x1x8_8_1x1_intrawave_v3,664.87,717.05,0.0
gfx950,256,1087,4608,2048,ck,2,0,29.1532,a8w8_blockscale_1x128x128_256x64x128x128_16x16_32x32_1x2_8x32x1_8x32x1_1x32x1x8_8_1x1_intrawave_v3,703.75,743.7,0.0
gfx950,256,1255,4608,2048,ck,2,0,30.7625,a8w8_blockscale_1x128x128_256x64x128x128_16x16_32x32_1x2_8x32x1_8x32x1_1x32x1x8_8_1x1_intrawave_v3,770.01,766.31,0.0
gfx950,256,1351,4608,2048,ck,0,0,31.5721,a8w8_blockscale_1x128x128_256x128x128x128_16x16_32x32_2x2_8x32x1_8x32x1_1x32x1x8_8_1x1_intrawave_v3,807.65,780.91,0.0
gfx950,256,1376,4608,2048,ck,0,0,31.583,a8w8_blockscale_1x128x128_256x128x128x128_16x16_32x32_2x2_8x32x1_8x32x1_1x32x1x8_8_1x1_intrawave_v3,822.31,789.55,0.0
gfx950,256,1380,4608,2048,ck,0,0,31.8603,a8w8_blockscale_1x128x128_256x128x128x128_16x16_32x32_2x2_8x32x1_8x32x1_1x32x1x8_8_1x1_intrawave_v3,817.53,784.1,0.0
gfx950,256,1391,4608,2048,ck,0,0,32.1356,a8w8_blockscale_1x128x128_256x128x128x128_16x16_32x32_2x2_8x32x1_8x32x1_1x32x1x8_8_1x1_intrawave_v3,816.98,781.23,0.0
gfx950,256,1710,4608,2048,ck,0,0,33.8468,a8w8_blockscale_1x128x128_256x128x128x128_16x16_32x32_2x2_8x32x1_8x32x1_1x32x1x8_8_1x1_intrawave_v3,953.57,847.9,0.0
gfx950,256,1808,4608,2048,ck,0,0,44.9961,a8w8_blockscale_1x128x128_256x128x128x128_16x16_32x32_2x2_8x32x1_8x32x1_1x32x1x8_8_1x1_intrawave_v3,758.4,662.34,0.0
gfx950,256,1809,4608,2048,ck,2,0,45.1769,a8w8_blockscale_1x128x128_256x64x128x128_16x16_32x32_1x2_8x32x1_8x32x1_1x32x1x8_8_1x1_intrawave_v3,755.78,659.93,0.0
gfx950,256,1870,4608,2048,ck,0,0,45.158,a8w8_blockscale_1x128x128_256x128x128x128_16x16_32x32_2x2_8x32x1_8x32x1_1x32x1x8_8_1x1_intrawave_v3,781.59,675.43,0.0
gfx950,256,1967,4608,2048,ck,0,0,46.2972,a8w8_blockscale_1x128x128_256x128x128x128_16x16_32x32_2x2_8x32x1_8x32x1_1x32x1x8_8_1x1_intrawave_v3,801.9,682.41,0.0
gfx950,256,1970,4608,2048,ck,0,0,46.389,a8w8_blockscale_1x128x128_256x128x128x128_16x16_32x32_2x2_8x32x1_8x32x1_1x32x1x8_8_1x1_intrawave_v3,801.54,681.78,0.0
gfx950,256,2000,4608,2048,ck,0,0,46.7585,a8w8_blockscale_1x128x128_256x128x128x128_16x16_32x32_2x2_8x32x1_8x32x1_1x32x1x8_8_1x1_intrawave_v3,807.31,683.62,0.0
gfx950,256,2001,4608,2048,ck,0,0,46.3245,a8w8_blockscale_1x128x128_256x128x128x128_16x16_32x32_2x2_8x32x1_8x32x1_1x32x1x8_8_1x1_intrawave_v3,815.28,690.27,0.0
gfx950,256,2016,4608,2048,ck,0,0,46.6973,a8w8_blockscale_1x128x128_256x128x128x128_16x16_32x32_2x2_8x32x1_8x32x1_1x32x1x8_8_1x1_intrawave_v3,814.84,688.38,0.0
gfx950,256,2017,4608,2048,ck,0,0,46.9606,a8w8_blockscale_1x128x128_256x128x128x128_16x16_32x32_2x2_8x32x1_8x32x1_1x32x1x8_8_1x1_intrawave_v3,810.67,684.76,0.0
gfx950,256,2046,4608,2048,ck,0,0,47.0268,a8w8_blockscale_1x128x128_256x128x128x128_16x16_32x32_2x2_8x32x1_8x32x1_1x32x1x8_8_1x1_intrawave_v3,821.17,690.74,0.0
gfx950,256,2048,4608,2048,ck,0,0,45.6497,a8w8_blockscale_1x128x128_256x128x128x128_16x16_32x32_2x2_8x32x1_8x32x1_1x32x1x8_8_1x1_intrawave_v3,846.77,712.07,0.0
gfx950,256,2050,4608,2048,ck,0,0,45.8965,a8w8_blockscale_1x128x128_256x128x128x128_16x16_32x32_2x2_8x32x1_8x32x1_1x32x1x8_8_1x1_intrawave_v3,843.04,708.73,0.0
gfx950,256,2081,4608,2048,ck,0,0,45.8245,a8w8_blockscale_1x128x128_256x128x128x128_16x16_32x32_2x2_8x32x1_8x32x1_1x32x1x8_8_1x1_intrawave_v3,857.13,717.47,0.0
gfx950,256,2095,4608,2048,ck,0,0,46.0749,a8w8_blockscale_1x128x128_256x128x128x128_16x16_32x32_2x2_8x32x1_8x32x1_1x32x1x8_8_1x1_intrawave_v3,858.21,716.99,0.0
gfx950,256,2154,4608,2048,ck,0,0,45.7964,a8w8_blockscale_1x128x128_256x128x128x128_16x16_32x32_2x2_8x32x1_8x32x1_1x32x1x8_8_1x1_intrawave_v3,887.74,735.86,0.0
gfx950,256,2159,4608,2048,ck,0,0,46.1585,a8w8_blockscale_1x128x128_256x128x128x128_16x16_32x32_2x2_8x32x1_8x32x1_1x32x1x8_8_1x1_intrawave_v3,882.82,731.31,0.0
gfx950,256,2162,4608,2048,ck,0,0,46.5658,a8w8_blockscale_1x128x128_256x128x128x128_16x16_32x32_2x2_8x32x1_8x32x1_1x32x1x8_8_1x1_intrawave_v3,876.32,725.64,0.0
gfx950,256,2165,4608,2048,ck,0,0,46.3719,a8w8_blockscale_1x128x128_256x128x128x128_16x16_32x32_2x2_8x32x1_8x32x1_1x32x1x8_8_1x1_intrawave_v3,881.2,729.4,0.0
gfx950,256,2251,4608,2048,ck,0,0,46.508,a8w8_blockscale_1x128x128_256x128x128x128_16x16_32x32_2x2_8x32x1_8x32x1_1x32x1x8_8_1x1_intrawave_v3,913.52,748.1,0.0
gfx950,256,2252,4608,2048,ck,0,0,46.8193,a8w8_blockscale_1x128x128_256x128x128x128_16x16_32x32_2x2_8x32x1_8x32x1_1x32x1x8_8_1x1_intrawave_v3,907.85,743.36,0.0
gfx950,256,2255,4608,2048,ck,0,0,46.6117,a8w8_blockscale_1x128x128_256x128x128x128_16x16_32x32_2x2_8x32x1_8x32x1_1x32x1x8_8_1x1_intrawave_v3,913.11,747.4,0.0
gfx950,256,2317,4608,2048,ck,0,0,47.0996,a8w8_blockscale_1x128x128_256x128x128x128_16x16_32x32_2x2_8x32x1_8x32x1_1x32x1x8_8_1x1_intrawave_v3,928.5,754.48,0.0
gfx950,256,2694,4608,2048,ck,0,0,57.7554,a8w8_blockscale_1x128x128_256x128x128x128_16x16_32x32_2x2_8x32x1_8x32x1_1x32x1x8_8_1x1_intrawave_v3,880.39,688.81,0.0
gfx950,256,2715,4608,2048,ck,0,0,57.4346,a8w8_blockscale_1x128x128_256x128x128x128_16x16_32x32_2x2_8x32x1_8x32x1_1x32x1x8_8_1x1_intrawave_v3,892.21,696.77,0.0
gfx950,256,2819,4608,2048,ck,0,0,58.1638,a8w8_blockscale_1x128x128_256x128x128x128_16x16_32x32_2x2_8x32x1_8x32x1_1x32x1x8_8_1x1_intrawave_v3,914.78,708.18,0.0
gfx950,256,2853,4608,2048,ck,0,0,58.033,a8w8_blockscale_1x128x128_256x128x128x128_16x16_32x32_2x2_8x32x1_8x32x1_1x32x1x8_8_1x1_intrawave_v3,927.9,716.37,0.0
gfx950,256,2914,4608,2048,ck,0,0,58.565,a8w8_blockscale_1x128x128_256x128x128x128_16x16_32x32_2x2_8x32x1_8x32x1_1x32x1x8_8_1x1_intrawave_v3,939.13,721.6,0.0
gfx950,256,2974,4608,2048,ck,0,0,58.9058,a8w8_blockscale_1x128x128_256x128x128x128_16x16_32x32_2x2_8x32x1_8x32x1_1x32x1x8_8_1x1_intrawave_v3,952.92,728.9,0.0
gfx950,256,3000,4608,2048,ck,0,0,58.5726,a8w8_blockscale_1x128x128_256x128x128x128_16x16_32x32_2x2_8x32x1_8x32x1_1x32x1x8_8_1x1_intrawave_v3,966.72,738.04,0.0
gfx950,256,3001,4608,2048,ck,0,0,58.9646,a8w8_blockscale_1x128x128_256x128x128x128_16x16_32x32_2x2_8x32x1_8x32x1_1x32x1x8_8_1x1_intrawave_v3,960.61,733.33,0.0
gfx950,256,3072,4608,2048,ck,0,0,57.7694,a8w8_blockscale_1x128x128_256x128x128x128_16x16_32x32_2x2_8x32x1_8x32x1_1x32x1x8_8_1x1_intrawave_v3,1003.68,762.34,0.0
gfx950,256,3073,4608,2048,ck,0,0,59.4898,a8w8_blockscale_1x128x128_256x128x128x128_16x16_32x32_2x2_8x32x1_8x32x1_1x32x1x8_8_1x1_intrawave_v3,974.97,740.49,0.0
gfx950,256,3077,4608,2048,ck,0,0,60.0394,a8w8_blockscale_1x128x128_256x128x128x128_16x16_32x32_2x2_8x32x1_8x32x1_1x32x1x8_8_1x1_intrawave_v3,967.31,734.46,0.0
gfx950,256,3078,4608,2048,ck,0,0,59.1706,a8w8_blockscale_1x128x128_256x128x128x128_16x16_32x32_2x2_8x32x1_8x32x1_1x32x1x8_8_1x1_intrawave_v3,981.83,745.43,0.0
gfx950,256,3086,4608,2048,ck,0,0,58.6512,a8w8_blockscale_1x128x128_256x128x128x128_16x16_32x32_2x2_8x32x1_8x32x1_1x32x1x8_8_1x1_intrawave_v3,993.1,753.57,0.0
gfx950,256,3089,4608,2048,ck,0,0,59.8383,a8w8_blockscale_1x128x128_256x128x128x128_16x16_32x32_2x2_8x32x1_8x32x1_1x32x1x8_8_1x1_intrawave_v3,974.34,739.19,0.0
gfx950,256,3118,4608,2048,ck,0,0,59.283,a8w8_blockscale_1x128x128_256x128x128x128_16x16_32x32_2x2_8x32x1_8x32x1_1x32x1x8_8_1x1_intrawave_v3,992.7,751.62,0.0
gfx950,256,3138,4608,2048,ck,0,0,59.174,a8w8_blockscale_1x128x128_256x128x128x128_16x16_32x32_2x2_8x32x1_8x32x1_1x32x1x8_8_1x1_intrawave_v3,1000.91,756.81,0.0
gfx950,256,3154,4608,2048,ck,0,0,59.8891,a8w8_blockscale_1x128x128_256x128x128x128_16x16_32x32_2x2_8x32x1_8x32x1_1x32x1x8_8_1x1_intrawave_v3,994.0,750.79,0.0
gfx950,256,3289,4608,2048,ck,0,0,60.2795,a8w8_blockscale_1x128x128_256x128x128x128_16x16_32x32_2x2_8x32x1_8x32x1_1x32x1x8_8_1x1_intrawave_v3,1029.83,771.15,0.0
gfx950,256,3437,4608,2048,ck,0,0,62.7643,a8w8_blockscale_1x128x128_256x128x128x128_16x16_32x32_2x2_8x32x1_8x32x1_1x32x1x8_8_1x1_intrawave_v3,1033.57,767.18,0.0
gfx950,256,3617,4608,2048,ck,0,0,71.776,a8w8_blockscale_1x128x128_256x128x128x128_16x16_32x32_2x2_8x32x1_8x32x1_1x32x1x8_8_1x1_intrawave_v3,951.13,699.11,0.0
gfx950,256,3620,4608,2048,ck,0,0,70.8487,a8w8_blockscale_1x128x128_256x128x128x128_16x16_32x32_2x2_8x32x1_8x32x1_1x32x1x8_8_1x1_intrawave_v3,964.38,708.73,0.0
gfx950,256,3669,4608,2048,ck,0,0,71.6259,a8w8_blockscale_1x128x128_256x128x128x128_16x16_32x32_2x2_8x32x1_8x32x1_1x32x1x8_8_1x1_intrawave_v3,966.83,708.75,0.0
gfx950,256,3824,4608,2048,ck,0,0,72.0359,a8w8_blockscale_1x128x128_256x128x128x128_16x16_32x32_2x2_8x32x1_8x32x1_1x32x1x8_8_1x1_intrawave_v3,1001.94,728.95,0.0
gfx950,256,3858,4608,2048,ck,0,0,72.8648,a8w8_blockscale_1x128x128_256x128x128x128_16x16_32x32_2x2_8x32x1_8x32x1_1x32x1x8_8_1x1_intrawave_v3,999.35,725.92,0.0
gfx950,256,3906,4608,2048,ck,0,0,73.2675,a8w8_blockscale_1x128x128_256x128x128x128_16x16_32x32_2x2_8x32x1_8x32x1_1x32x1x8_8_1x1_intrawave_v3,1006.22,729.31,0.0
gfx950,256,4000,4608,2048,ck,0,0,73.728,a8w8_blockscale_1x128x128_256x128x128x128_16x16_32x32_2x2_8x32x1_8x32x1_1x32x1x8_8_1x1_intrawave_v3,1024.0,739.11,0.0
gfx950,256,4004,4608,2048,ck,0,0,74.29,a8w8_blockscale_1x128x128_256x128x128x128_16x16_32x32_2x2_8x32x1_8x32x1_1x32x1x8_8_1x1_intrawave_v3,1017.27,734.13,0.0
gfx950,256,4100,4608,2048,ck,0,0,75.1172,a8w8_blockscale_1x128x128_256x128x128x128_16x16_32x32_2x2_8x32x1_8x32x1_1x32x1x8_8_1x1_intrawave_v3,1030.19,740.44,0.0
gfx950,256,4108,4608,2048,ck,0,0,75.0972,a8w8_blockscale_1x128x128_256x128x128x128_16x16_32x32_2x2_8x32x1_8x32x1_1x32x1x8_8_1x1_intrawave_v3,1032.47,741.83,0.0
gfx950,256,4121,4608,2048,ck,0,0,74.42,a8w8_blockscale_1x128x128_256x128x128x128_16x16_32x32_2x2_8x32x1_8x32x1_1x32x1x8_8_1x1_intrawave_v3,1045.17,750.55,0.0
gfx950,256,4123,4608,2048,ck,0,0,74.2864,a8w8_blockscale_1x128x128_256x128x128x128_16x16_32x32_2x2_8x32x1_8x32x1_1x32x1x8_8_1x1_intrawave_v3,1047.55,752.21,0.0
gfx950,256,4149,4608,2048,ck,0,0,74.8508,a8w8_blockscale_1x128x128_256x128x128x128_16x16_32x32_2x2_8x32x1_8x32x1_1x32x1x8_8_1x1_intrawave_v3,1046.21,750.45,0.0
gfx950,256,4204,4608,2048,ck,0,0,74.3992,a8w8_blockscale_1x128x128_256x128x128x128_16x16_32x32_2x2_8x32x1_8x32x1_1x32x1x8_8_1x1_intrawave_v3,1066.51,763.33,0.0
gfx950,256,4223,4608,2048,ck,0,0,74.8956,a8w8_blockscale_1x128x128_256x128x128x128_16x16_32x32_2x2_8x32x1_8x32x1_1x32x1x8_8_1x1_intrawave_v3,1064.23,761.13,0.0
gfx950,256,4229,4608,2048,ck,0,0,75.3688,a8w8_blockscale_1x128x128_256x128x128x128_16x16_32x32_2x2_8x32x1_8x32x1_1x32x1x8_8_1x1_intrawave_v3,1059.05,757.24,0.0
gfx950,256,4379,4608,2048,ck,0,0,75.4132,a8w8_blockscale_1x128x128_256x128x128x128_16x16_32x32_2x2_8x32x1_8x32x1_1x32x1x8_8_1x1_intrawave_v3,1095.97,779.2,0.0
gfx950,256,4410,4608,2048,ck,0,0,76.1268,a8w8_blockscale_1x128x128_256x128x128x128_16x16_32x32_2x2_8x32x1_8x32x1_1x32x1x8_8_1x1_intrawave_v3,1093.39,776.49,0.0
gfx950,256,4498,4608,2048,ck,0,0,83.9968,a8w8_blockscale_1x128x128_256x128x128x128_16x16_32x32_2x2_8x32x1_8x32x1_1x32x1x8_8_1x1_intrawave_v3,1010.72,715.54,0.0
gfx950,256,4585,4608,2048,ck,0,0,83.4884,a8w8_blockscale_1x128x128_256x128x128x128_16x16_32x32_2x2_8x32x1_8x32x1_1x32x1x8_8_1x1_intrawave_v3,1036.54,731.63,0.0
gfx950,256,4586,4608,2048,ck,0,0,84.4549,a8w8_blockscale_1x128x128_256x128x128x128_16x16_32x32_2x2_8x32x1_8x32x1_1x32x1x8_8_1x1_intrawave_v3,1024.9,723.39,0.0
gfx950,256,4723,4608,2048,ck,0,0,84.8317,a8w8_blockscale_1x128x128_256x128x128x128_16x16_32x32_2x2_8x32x1_8x32x1_1x32x1x8_8_1x1_intrawave_v3,1050.83,738.37,0.0
gfx950,256,4743,4608,2048,ck,0,0,85.1733,a8w8_blockscale_1x128x128_256x128x128x128_16x16_32x32_2x2_8x32x1_8x32x1_1x32x1x8_8_1x1_intrawave_v3,1051.05,738.05,0.0
gfx950,256,4822,4608,2048,ck,0,0,85.2104,a8w8_blockscale_1x128x128_256x128x128x128_16x16_32x32_2x2_8x32x1_8x32x1_1x32x1x8_8_1x1_intrawave_v3,1068.09,748.17,0.0
gfx950,256,4898,4608,2048,ck,0,0,86.1324,a8w8_blockscale_1x128x128_256x128x128x128_16x16_32x32_2x2_8x32x1_8x32x1_1x32x1x8_8_1x1_intrawave_v3,1073.31,750.1,0.0
gfx950,256,4936,4608,2048,ck,0,0,86.3401,a8w8_blockscale_1x128x128_256x128x128x128_16x16_32x32_2x2_8x32x1_8x32x1_1x32x1x8_8_1x1_intrawave_v3,1079.03,753.26,0.0
gfx950,256,4992,4608,2048,ck,0,0,84.6152,a8w8_blockscale_1x128x128_256x128x128x128_16x16_32x32_2x2_8x32x1_8x32x1_1x32x1x8_8_1x1_intrawave_v3,1113.52,776.07,0.0
gfx950,256,5000,4608,2048,ck,0,0,87.0805,a8w8_blockscale_1x128x128_256x128x128x128_16x16_32x32_2x2_8x32x1_8x32x1_1x32x1x8_8_1x1_intrawave_v3,1083.73,755.13,0.0
gfx950,256,5001,4608,2048,ck,0,0,86.4645,a8w8_blockscale_1x128x128_256x128x128x128_16x16_32x32_2x2_8x32x1_8x32x1_1x32x1x8_8_1x1_intrawave_v3,1091.67,760.64,0.0
gfx950,256,5002,4608,2048,ck,0,0,86.3577,a8w8_blockscale_1x128x128_256x128x128x128_16x16_32x32_2x2_8x32x1_8x32x1_1x32x1x8_8_1x1_intrawave_v3,1093.24,761.71,0.0
gfx950,256,5003,4608,2048,ck,0,0,87.6905,a8w8_blockscale_1x128x128_256x128x128x128_16x16_32x32_2x2_8x32x1_8x32x1_1x32x1x8_8_1x1_intrawave_v3,1076.84,750.26,0.0
gfx950,256,5004,4608,2048,ck,0,0,87.1857,a8w8_blockscale_1x128x128_256x128x128x128_16x16_32x32_2x2_8x32x1_8x32x1_1x32x1x8_8_1x1_intrawave_v3,1083.29,754.74,0.0
gfx950,256,5005,4608,2048,ck,0,0,85.7801,a8w8_blockscale_1x128x128_256x128x128x128_16x16_32x32_2x2_8x32x1_8x32x1_1x32x1x8_8_1x1_intrawave_v3,1101.26,767.24,0.0
gfx950,256,5006,4608,2048,ck,0,0,87.2349,a8w8_blockscale_1x128x128_256x128x128x128_16x16_32x32_2x2_8x32x1_8x32x1_1x32x1x8_8_1x1_intrawave_v3,1083.11,754.57,0.0
gfx950,256,5010,4608,2048,ck,0,0,86.4681,a8w8_blockscale_1x128x128_256x128x128x128_16x16_32x32_2x2_8x32x1_8x32x1_1x32x1x8_8_1x1_intrawave_v3,1093.59,761.78,0.0
gfx950,256,5011,4608,2048,ck,0,0,87.1509,a8w8_blockscale_1x128x128_256x128x128x128_16x16_32x32_2x2_8x32x1_8x32x1_1x32x1x8_8_1x1_intrawave_v3,1085.24,755.94,0.0
gfx950,256,5012,4608,2048,ck,0,0,86.0637,a8w8_blockscale_1x128x128_256x128x128x128_16x16_32x32_2x2_8x32x1_8x32x1_1x32x1x8_8_1x1_intrawave_v3,1099.17,765.62,0.0
gfx950,256,5026,4608,2048,ck,0,0,86.4485,a8w8_blockscale_1x128x128_256x128x128x128_16x16_32x32_2x2_8x32x1_8x32x1_1x32x1x8_8_1x1_intrawave_v3,1097.33,764.04,0.0
gfx950,256,5028,4608,2048,ck,0,0,85.9133,a8w8_blockscale_1x128x128_256x128x128x128_16x16_32x32_2x2_8x32x1_8x32x1_1x32x1x8_8_1x1_intrawave_v3,1104.61,769.06,0.0
gfx950,256,5030,4608,2048,ck,0,0,86.1449,a8w8_blockscale_1x128x128_256x128x128x128_16x16_32x32_2x2_8x32x1_8x32x1_1x32x1x8_8_1x1_intrawave_v3,1102.07,767.25,0.0
gfx950,256,5031,4608,2048,ck,0,0,86.8096,a8w8_blockscale_1x128x128_256x128x128x128_16x16_32x32_2x2_8x32x1_8x32x1_1x32x1x8_8_1x1_intrawave_v3,1093.85,761.51,0.0
gfx950,256,5060,4608,2048,ck,0,0,87.3265,a8w8_blockscale_1x128x128_256x128x128x128_16x16_32x32_2x2_8x32x1_8x32x1_1x32x1x8_8_1x1_intrawave_v3,1093.65,760.74,0.0
gfx950,256,5062,4608,2048,ck,0,0,88.1865,a8w8_blockscale_1x128x128_256x128x128x128_16x16_32x32_2x2_8x32x1_8x32x1_1x32x1x8_8_1x1_intrawave_v3,1083.41,753.58,0.0
gfx950,256,5063,4608,2048,ck,0,0,87.5837,a8w8_blockscale_1x128x128_256x128x128x128_16x16_32x32_2x2_8x32x1_8x32x1_1x32x1x8_8_1x1_intrawave_v3,1091.08,758.89,0.0
gfx950,256,5091,4608,2048,ck,0,0,86.5561,a8w8_blockscale_1x128x128_256x128x128x128_16x16_32x32_2x2_8x32x1_8x32x1_1x32x1x8_8_1x1_intrawave_v3,1110.14,771.55,0.0
gfx950,256,5105,4608,2048,ck,0,0,86.2269,a8w8_blockscale_1x128x128_256x128x128x128_16x16_32x32_2x2_8x32x1_8x32x1_1x32x1x8_8_1x1_intrawave_v3,1117.44,776.32,0.0
gfx950,256,5120,4608,2048,ck,0,0,86.4929,a8w8_blockscale_1x128x128_256x128x128x128_16x16_32x32_2x2_8x32x1_8x32x1_1x32x1x8_8_1x1_intrawave_v3,1117.28,775.89,0.0
gfx950,256,5122,4608,2048,ck,0,0,86.9949,a8w8_blockscale_1x128x128_256x128x128x128_16x16_32x32_2x2_8x32x1_8x32x1_1x32x1x8_8_1x1_intrawave_v3,1111.27,771.67,0.0
gfx950,256,5123,4608,2048,ck,0,0,86.2925,a8w8_blockscale_1x128x128_256x128x128x128_16x16_32x32_2x2_8x32x1_8x32x1_1x32x1x8_8_1x1_intrawave_v3,1120.53,778.08,0.0
gfx950,256,5124,4608,2048,ck,0,0,87.9561,a8w8_blockscale_1x128x128_256x128x128x128_16x16_32x32_2x2_8x32x1_8x32x1_1x32x1x8_8_1x1_intrawave_v3,1099.55,763.49,0.0
gfx950,256,5127,4608,2048,ck,0,0,88.1949,a8w8_blockscale_1x128x128_256x128x128x128_16x16_32x32_2x2_8x32x1_8x32x1_1x32x1x8_8_1x1_intrawave_v3,1097.22,761.81,0.0
gfx950,256,5177,4608,2048,ck,0,0,86.8705,a8w8_blockscale_1x128x128_256x128x128x128_16x16_32x32_2x2_8x32x1_8x32x1_1x32x1x8_8_1x1_intrawave_v3,1124.81,779.91,0.0
gfx950,256,5183,4608,2048,ck,0,0,87.5081,a8w8_blockscale_1x128x128_256x128x128x128_16x16_32x32_2x2_8x32x1_8x32x1_1x32x1x8_8_1x1_intrawave_v3,1117.91,775.0,0.0
gfx950,256,5252,4608,2048,ck,0,0,88.7429,a8w8_blockscale_1x128x128_256x128x128x128_16x16_32x32_2x2_8x32x1_8x32x1_1x32x1x8_8_1x1_intrawave_v3,1117.03,772.97,0.0
gfx950,256,5255,4608,2048,ck,0,0,89.2533,a8w8_blockscale_1x128x128_256x128x128x128_16x16_32x32_2x2_8x32x1_8x32x1_1x32x1x8_8_1x1_intrawave_v3,1111.27,768.93,0.0
gfx950,256,5361,4608,2048,ck,0,0,89.9565,a8w8_blockscale_1x128x128_256x128x128x128_16x16_32x32_2x2_8x32x1_8x32x1_1x32x1x8_8_1x1_intrawave_v3,1124.83,776.19,0.0
gfx950,256,5427,4608,2048,ck,0,0,96.7098,a8w8_blockscale_1x128x128_256x128x128x128_16x16_32x32_2x2_8x32x1_8x32x1_1x32x1x8_8_1x1_intrawave_v3,1059.16,729.68,0.0
gfx950,256,5471,4608,2048,ck,0,0,97.7377,a8w8_blockscale_1x128x128_256x128x128x128_16x16_32x32_2x2_8x32x1_8x32x1_1x32x1x8_8_1x1_intrawave_v3,1056.52,727.07,0.0
gfx950,256,5534,4608,2048,ck,0,0,97.5254,a8w8_blockscale_1x128x128_256x128x128x128_16x16_32x32_2x2_8x32x1_8x32x1_1x32x1x8_8_1x1_intrawave_v3,1071.01,735.93,0.0
gfx950,256,5564,4608,2048,ck,0,0,98.0173,a8w8_blockscale_1x128x128_256x128x128x128_16x16_32x32_2x2_8x32x1_8x32x1_1x32x1x8_8_1x1_intrawave_v3,1071.41,735.69,0.0
gfx950,256,5671,4608,2048,ck,0,0,98.2346,a8w8_blockscale_1x128x128_256x128x128x128_16x16_32x32_2x2_8x32x1_8x32x1_1x32x1x8_8_1x1_intrawave_v3,1089.6,746.33,0.0
gfx950,256,5927,4608,2048,ck,0,0,98.4998,a8w8_blockscale_1x128x128_256x128x128x128_16x16_32x32_2x2_8x32x1_8x32x1_1x32x1x8_8_1x1_intrawave_v3,1135.72,773.59,0.0
gfx950,256,5954,4608,2048,ck,0,0,100.1418,a8w8_blockscale_1x128x128_256x128x128x128_16x16_32x32_2x2_8x32x1_8x32x1_1x32x1x8_8_1x1_intrawave_v3,1122.19,763.95,0.0
gfx950,256,6000,4608,2048,ck,0,0,98.993,a8w8_blockscale_1x128x128_256x128x128x128_16x16_32x32_2x2_8x32x1_8x32x1_1x32x1x8_8_1x1_intrawave_v3,1143.98,778.05,0.0
gfx950,256,6002,4608,2048,ck,0,0,100.0978,a8w8_blockscale_1x128x128_256x128x128x128_16x16_32x32_2x2_8x32x1_8x32x1_1x32x1x8_8_1x1_intrawave_v3,1131.73,769.68,0.0
gfx950,256,6146,4608,2048,ck,0,0,102.1766,a8w8_blockscale_1x128x128_256x128x128x128_16x16_32x32_2x2_8x32x1_8x32x1_1x32x1x8_8_1x1_intrawave_v3,1135.31,769.9,0.0
gfx950,256,6194,4608,2048,ck,0,0,101.2194,a8w8_blockscale_1x128x128_256x128x128x128_16x16_32x32_2x2_8x32x1_8x32x1_1x32x1x8_8_1x1_intrawave_v3,1154.99,782.52,0.0
gfx950,256,6227,4608,2048,ck,0,0,102.2434,a8w8_blockscale_1x128x128_256x128x128x128_16x16_32x32_2x2_8x32x1_8x32x1_1x32x1x8_8_1x1_intrawave_v3,1149.52,778.32,0.0
gfx950,256,6229,4608,2048,ck,0,0,103.1046,a8w8_blockscale_1x128x128_256x128x128x128_16x16_32x32_2x2_8x32x1_8x32x1_1x32x1x8_8_1x1_intrawave_v3,1140.28,772.04,0.0
gfx950,256,6234,4608,2048,ck,0,0,102.5686,a8w8_blockscale_1x128x128_256x128x128x128_16x16_32x32_2x2_8x32x1_8x32x1_1x32x1x8_8_1x1_intrawave_v3,1147.16,776.62,0.0
gfx950,256,6246,4608,2048,ck,0,0,101.351,a8w8_blockscale_1x128x128_256x128x128x128_16x16_32x32_2x2_8x32x1_8x32x1_1x32x1x8_8_1x1_intrawave_v3,1163.18,787.29,0.0
gfx950,256,6304,4608,2048,ck,0,0,110.1695,a8w8_blockscale_1x128x128_256x128x128x128_16x16_32x32_2x2_8x32x1_8x32x1_1x32x1x8_8_1x1_intrawave_v3,1080.01,730.2,0.0
gfx950,256,6314,4608,2048,ck,0,0,110.2299,a8w8_blockscale_1x128x128_256x128x128x128_16x16_32x32_2x2_8x32x1_8x32x1_1x32x1x8_8_1x1_intrawave_v3,1081.13,730.82,0.0
gfx950,256,6318,4608,2048,ck,0,0,109.6858,a8w8_blockscale_1x128x128_256x128x128x128_16x16_32x32_2x2_8x32x1_8x32x1_1x32x1x8_8_1x1_intrawave_v3,1087.18,734.85,0.0
gfx950,256,6341,4608,2048,ck,0,0,110.2662,a8w8_blockscale_1x128x128_256x128x128x128_16x16_32x32_2x2_8x32x1_8x32x1_1x32x1x8_8_1x1_intrawave_v3,1085.39,733.34,0.0
gfx950,256,6377,4608,2048,ck,0,0,108.9034,a8w8_blockscale_1x128x128_256x128x128x128_16x16_32x32_2x2_8x32x1_8x32x1_1x32x1x8_8_1x1_intrawave_v3,1105.22,746.24,0.0
gfx950,256,6476,4608,2048,ck,0,0,110.4051,a8w8_blockscale_1x128x128_256x128x128x128_16x16_32x32_2x2_8x32x1_8x32x1_1x32x1x8_8_1x1_intrawave_v3,1107.11,746.19,0.0
gfx950,256,6483,4608,2048,ck,0,0,110.5079,a8w8_blockscale_1x128x128_256x128x128x128_16x16_32x32_2x2_8x32x1_8x32x1_1x32x1x8_8_1x1_intrawave_v3,1107.27,746.21,0.0
gfx950,256,6492,4608,2048,ck,0,0,109.9987,a8w8_blockscale_1x128x128_256x128x128x128_16x16_32x32_2x2_8x32x1_8x32x1_1x32x1x8_8_1x1_intrawave_v3,1113.94,750.58,0.0
gfx950,256,6519,4608,2048,ck,0,0,109.7327,a8w8_blockscale_1x128x128_256x128x128x128_16x16_32x32_2x2_8x32x1_8x32x1_1x32x1x8_8_1x1_intrawave_v3,1121.29,755.17,0.0
gfx950,256,6609,4608,2048,ck,0,0,109.959,a8w8_blockscale_1x128x128_256x128x128x128_16x16_32x32_2x2_8x32x1_8x32x1_1x32x1x8_8_1x1_intrawave_v3,1134.43,762.84,0.0
gfx950,256,6811,4608,2048,ck,0,0,112.6915,a8w8_blockscale_1x128x128_256x128x128x128_16x16_32x32_2x2_8x32x1_8x32x1_1x32x1x8_8_1x1_intrawave_v3,1140.75,764.53,0.0
gfx950,256,6813,4608,2048,ck,0,0,112.3167,a8w8_blockscale_1x128x128_256x128x128x128_16x16_32x32_2x2_8x32x1_8x32x1_1x32x1x8_8_1x1_intrawave_v3,1144.9,767.28,0.0
gfx950,256,6818,4608,2048,ck,0,0,112.6892,a8w8_blockscale_1x128x128_256x128x128x128_16x16_32x32_2x2_8x32x1_8x32x1_1x32x1x8_8_1x1_intrawave_v3,1141.95,765.25,0.0
gfx950,256,6830,4608,2048,ck,0,0,112.3267,a8w8_blockscale_1x128x128_256x128x128x128_16x16_32x32_2x2_8x32x1_8x32x1_1x32x1x8_8_1x1_intrawave_v3,1147.65,768.92,0.0
gfx950,256,7001,4608,2048,ck,0,0,113.6659,a8w8_blockscale_1x128x128_256x128x128x128_16x16_32x32_2x2_8x32x1_8x32x1_1x32x1x8_8_1x1_intrawave_v3,1162.52,776.81,0.0
gfx950,256,7025,4608,2048,ck,0,0,114.6367,a8w8_blockscale_1x128x128_256x128x128x128_16x16_32x32_2x2_8x32x1_8x32x1_1x32x1x8_8_1x1_intrawave_v3,1156.63,772.59,0.0
gfx950,256,7121,4608,2048,ck,0,0,114.9307,a8w8_blockscale_1x128x128_256x128x128x128_16x16_32x32_2x2_8x32x1_8x32x1_1x32x1x8_8_1x1_intrawave_v3,1169.44,780.02,0.0
gfx950,256,7169,4608,2048,ck,0,0,122.0037,a8w8_blockscale_1x128x128_256x128x128x128_16x16_32x32_2x2_8x32x1_8x32x1_1x32x1x8_8_1x1_intrawave_v3,1109.07,739.23,0.0
gfx950,256,7177,4608,2048,ck,0,0,121.9029,a8w8_blockscale_1x128x128_256x128x128x128_16x16_32x32_2x2_8x32x1_8x32x1_1x32x1x8_8_1x1_intrawave_v3,1111.22,740.58,0.0
gfx950,256,7217,4608,2048,ck,0,0,121.7929,a8w8_blockscale_1x128x128_256x128x128x128_16x16_32x32_2x2_8x32x1_8x32x1_1x32x1x8_8_1x1_intrawave_v3,1118.43,744.95,0.0
gfx950,256,7223,4608,2048,ck,0,0,123.4021,a8w8_blockscale_1x128x128_256x128x128x128_16x16_32x32_2x2_8x32x1_8x32x1_1x32x1x8_8_1x1_intrawave_v3,1104.76,735.78,0.0
gfx950,256,7238,4608,2048,ck,0,0,121.5945,a8w8_blockscale_1x128x128_256x128x128x128_16x16_32x32_2x2_8x32x1_8x32x1_1x32x1x8_8_1x1_intrawave_v3,1123.51,748.11,0.0
gfx950,256,7246,4608,2048,ck,0,0,122.0949,a8w8_blockscale_1x128x128_256x128x128x128_16x16_32x32_2x2_8x32x1_8x32x1_1x32x1x8_8_1x1_intrawave_v3,1120.14,745.78,0.0
gfx950,256,7249,4608,2048,ck,0,0,122.0413,a8w8_blockscale_1x128x128_256x128x128x128_16x16_32x32_2x2_8x32x1_8x32x1_1x32x1x8_8_1x1_intrawave_v3,1121.1,746.39,0.0
gfx950,256,7316,4608,2048,ck,0,0,121.5953,a8w8_blockscale_1x128x128_256x128x128x128_16x16_32x32_2x2_8x32x1_8x32x1_1x32x1x8_8_1x1_intrawave_v3,1135.61,755.33,0.0
gfx950,256,7393,4608,2048,ck,0,0,121.9193,a8w8_blockscale_1x128x128_256x128x128x128_16x16_32x32_2x2_8x32x1_8x32x1_1x32x1x8_8_1x1_intrawave_v3,1144.51,760.44,0.0
gfx950,256,7491,4608,2048,ck,0,0,122.7613,a8w8_blockscale_1x128x128_256x128x128x128_16x16_32x32_2x2_8x32x1_8x32x1_1x32x1x8_8_1x1_intrawave_v3,1151.73,764.21,0.0
gfx950,256,7558,4608,2048,ck,0,0,125.2193,a8w8_blockscale_1x128x128_256x128x128x128_16x16_32x32_2x2_8x32x1_8x32x1_1x32x1x8_8_1x1_intrawave_v3,1139.22,755.24,0.0
gfx950,256,7650,4608,2048,ck,0,0,122.8435,a8w8_blockscale_1x128x128_256x128x128x128_16x16_32x32_2x2_8x32x1_8x32x1_1x32x1x8_8_1x1_intrawave_v3,1175.39,778.28,0.0
gfx950,256,7753,4608,2048,ck,0,0,125.4601,a8w8_blockscale_1x128x128_256x128x128x128_16x16_32x32_2x2_8x32x1_8x32x1_1x32x1x8_8_1x1_intrawave_v3,1166.37,771.3,0.0
gfx950,256,7774,4608,2048,ck,0,0,124.8513,a8w8_blockscale_1x128x128_256x128x128x128_16x16_32x32_2x2_8x32x1_8x32x1_1x32x1x8_8_1x1_intrawave_v3,1175.23,776.95,0.0
gfx950,256,7815,4608,2048,ck,0,0,125.2413,a8w8_blockscale_1x128x128_256x128x128x128_16x16_32x32_2x2_8x32x1_8x32x1_1x32x1x8_8_1x1_intrawave_v3,1177.75,778.22,0.0
gfx950,256,7834,4608,2048,ck,0,0,125.8945,a8w8_blockscale_1x128x128_256x128x128x128_16x16_32x32_2x2_8x32x1_8x32x1_1x32x1x8_8_1x1_intrawave_v3,1174.49,775.88,0.0
gfx950,256,7836,4608,2048,ck,0,0,126.2949,a8w8_blockscale_1x128x128_256x128x128x128_16x16_32x32_2x2_8x32x1_8x32x1_1x32x1x8_8_1x1_intrawave_v3,1171.07,773.6,0.0
gfx950,256,7871,4608,2048,ck,0,0,125.1375,a8w8_blockscale_1x128x128_256x128x128x128_16x16_32x32_2x2_8x32x1_8x32x1_1x32x1x8_8_1x1_intrawave_v3,1187.18,783.91,0.0
gfx950,256,7899,4608,2048,ck,0,0,126.1261,a8w8_blockscale_1x128x128_256x128x128x128_16x16_32x32_2x2_8x32x1_8x32x1_1x32x1x8_8_1x1_intrawave_v3,1182.06,780.26,0.0
gfx950,256,7913,4608,2048,ck,0,0,127.1629,a8w8_blockscale_1x128x128_256x128x128x128_16x16_32x32_2x2_8x32x1_8x32x1_1x32x1x8_8_1x1_intrawave_v3,1174.5,775.14,0.0
gfx950,256,7930,4608,2048,ck,0,0,126.4529,a8w8_blockscale_1x128x128_256x128x128x128_16x16_32x32_2x2_8x32x1_8x32x1_1x32x1x8_8_1x1_intrawave_v3,1183.63,781.01,0.0
gfx950,256,7961,4608,2048,ck,0,0,127.1333,a8w8_blockscale_1x128x128_256x128x128x128_16x16_32x32_2x2_8x32x1_8x32x1_1x32x1x8_8_1x1_intrawave_v3,1181.9,779.57,0.0
gfx950,256,7963,4608,2048,ck,0,0,127.5277,a8w8_blockscale_1x128x128_256x128x128x128_16x16_32x32_2x2_8x32x1_8x32x1_1x32x1x8_8_1x1_intrawave_v3,1178.54,777.34,0.0
gfx950,256,7974,4608,2048,ck,0,0,127.2701,a8w8_blockscale_1x128x128_256x128x128x128_16x16_32x32_2x2_8x32x1_8x32x1_1x32x1x8_8_1x1_intrawave_v3,1182.56,779.89,0.0
gfx950,256,8016,4608,2048,ck,0,0,125.8328,a8w8_blockscale_1x128x128_256x128x128x128_16x16_32x32_2x2_8x32x1_8x32x1_1x32x1x8_8_1x1_intrawave_v3,1202.36,792.55,0.0
gfx950,256,8017,4608,2048,ck,0,0,125.4297,a8w8_blockscale_1x128x128_256x128x128x128_16x16_32x32_2x2_8x32x1_8x32x1_1x32x1x8_8_1x1_intrawave_v3,1206.38,795.19,0.0
gfx950,256,8103,4608,2048,ck,0,0,128.7309,a8w8_blockscale_1x128x128_256x128x128x128_16x16_32x32_2x2_8x32x1_8x32x1_1x32x1x8_8_1x1_intrawave_v3,1188.05,782.32,0.0
gfx950,256,8128,4608,2048,ck,0,0,128.5117,a8w8_blockscale_1x128x128_256x128x128x128_16x16_32x32_2x2_8x32x1_8x32x1_1x32x1x8_8_1x1_intrawave_v3,1193.75,785.85,0.0
gfx950,256,8129,4608,2048,ck,0,0,128.3125,a8w8_blockscale_1x128x128_256x128x128x128_16x16_32x32_2x2_8x32x1_8x32x1_1x32x1x8_8_1x1_intrawave_v3,1195.75,787.16,0.0
gfx950,256,8150,4608,2048,ck,0,0,129.1421,a8w8_blockscale_1x128x128_256x128x128x128_16x16_32x32_2x2_8x32x1_8x32x1_1x32x1x8_8_1x1_intrawave_v3,1191.14,783.93,0.0
gfx950,256,8184,4608,2048,ck,0,0,128.4933,a8w8_blockscale_1x128x128_256x128x128x128_16x16_32x32_2x2_8x32x1_8x32x1_1x32x1x8_8_1x1_intrawave_v3,1202.15,790.87,0.0
gfx950,256,8185,4608,2048,ck,0,0,128.9301,a8w8_blockscale_1x128x128_256x128x128x128_16x16_32x32_2x2_8x32x1_8x32x1_1x32x1x8_8_1x1_intrawave_v3,1198.22,788.28,0.0
gfx950,256,8192,4608,2048,ck,0,0,127.4037,a8w8_blockscale_1x128x128_256x128x128x128_16x16_32x32_2x2_8x32x1_8x32x1_1x32x1x8_8_1x1_intrawave_v3,1213.61,798.34,0.0
gfx950,256,1,6144,2048,ck,8,0,7.8311,a8w8_blockscale_1x128x128_256x16x64x256_16x16_16x16_1x1_16x16x1_16x16x1_1x16x1x16_4_1x1_intrawave_v1,3.21,1608.62,0.0
gfx950,256,2,6144,2048,ck,8,0,7.8993,a8w8_blockscale_1x128x128_256x16x64x256_16x16_16x16_1x1_16x16x1_16x16x1_1x16x1x16_4_1x1_intrawave_v1,6.37,1596.54,0.0
gfx950,256,4,6144,2048,ck,8,0,7.9088,a8w8_blockscale_1x128x128_256x16x64x256_16x16_16x16_1x1_16x16x1_16x16x1_1x16x1x16_4_1x1_intrawave_v1,12.73,1598.25,0.0
gfx950,256,8,6144,2048,ck,8,0,7.9859,a8w8_blockscale_1x128x128_256x16x64x256_16x16_16x16_1x1_16x16x1_16x16x1_1x16x1x16_4_1x1_intrawave_v1,25.21,1590.0,0.0
gfx950,256,16,6144,2048,ck,8,0,7.7518,a8w8_blockscale_1x128x128_256x16x64x256_16x16_16x16_1x1_16x16x1_16x16x1_1x16x1x16_4_1x1_intrawave_v1,51.94,1652.81,0.0
gfx950,256,24,6144,2048,ck,8,0,8.1442,a8w8_blockscale_1x128x128_256x16x64x256_16x16_16x16_1x1_16x16x1_16x16x1_1x16x1x16_4_1x1_intrawave_v1,74.16,1587.26,0.0
gfx950,256,32,6144,2048,ck,8,0,7.9893,a8w8_blockscale_1x128x128_256x16x64x256_16x16_16x16_1x1_16x16x1_16x16x1_1x16x1x16_4_1x1_intrawave_v1,100.8,1632.39,0.0
gfx950,256,40,6144,2048,ck,7,0,9.8341,a8w8_blockscale_1x128x128_256x16x128x256_16x16_16x16_1x2_16x16x1_16x16x1_1x16x1x16_8_1x2_intrawave_v1,102.36,1337.83,0.0
gfx950,256,48,6144,2048,ck,7,0,9.6391,a8w8_blockscale_1x128x128_256x16x128x256_16x16_16x16_1x2_16x16x1_16x16x1_1x16x1x16_8_1x2_intrawave_v1,125.32,1376.79,0.0
gfx950,256,56,6144,2048,ck,7,0,9.7039,a8w8_blockscale_1x128x128_256x16x128x256_16x16_16x16_1x2_16x16x1_16x16x1_1x16x1x16_8_1x2_intrawave_v1,145.23,1379.42,0.0
gfx950,256,64,6144,2048,ck,18,0,9.307,a8w8_blockscale_1x128x128_256x64x64x256_16x16_32x32_1x1_16x16x1_16x16x1_1x32x1x8_8_1x1_intrawave_v1,173.05,1450.57,0.0
gfx950,256,72,6144,2048,ck,7,0,9.8968,a8w8_blockscale_1x128x128_256x16x128x256_16x16_16x16_1x2_16x16x1_16x16x1_1x16x1x16_8_1x2_intrawave_v1,183.08,1375.71,0.0
gfx950,256,80,6144,2048,ck,7,0,9.6378,a8w8_blockscale_1x128x128_256x16x128x256_16x16_16x16_1x2_16x16x1_16x16x1_1x16x1x16_8_1x2_intrawave_v1,208.89,1424.58,0.0
gfx950,256,88,6144,2048,ck,18,0,11.1899,a8w8_blockscale_1x128x128_256x64x64x256_16x16_32x32_1x1_16x16x1_16x16x1_1x32x1x8_8_1x1_intrawave_v1,197.91,1237.23,0.0
gfx950,256,96,6144,2048,ck,18,0,11.1697,a8w8_blockscale_1x128x128_256x64x64x256_16x16_32x32_1x1_16x16x1_16x16x1_1x32x1x8_8_1x1_intrawave_v1,216.29,1249.74,0.0
gfx950,256,104,6144,2048,ck,18,0,11.2758,a8w8_blockscale_1x128x128_256x64x64x256_16x16_32x32_1x1_16x16x1_16x16x1_1x32x1x8_8_1x1_intrawave_v1,232.11,1248.15,0.0
gfx950,256,112,6144,2048,ck,18,0,11.2795,a8w8_blockscale_1x128x128_256x64x64x256_16x16_32x32_1x1_16x16x1_16x16x1_1x32x1x8_8_1x1_intrawave_v1,249.88,1257.91,0.0
gfx950,256,120,6144,2048,ck,18,0,11.3255,a8w8_blockscale_1x128x128_256x64x64x256_16x16_32x32_1x1_16x16x1_16x16x1_1x32x1x8_8_1x1_intrawave_v1,266.65,1262.92,0.0
gfx950,256,128,6144,2048,ck,18,0,10.0607,a8w8_blockscale_1x128x128_256x64x64x256_16x16_32x32_1x1_16x16x1_16x16x1_1x32x1x8_8_1x1_intrawave_v1,320.18,1433.09,0.0
gfx950,256,136,6144,2048,ck,12,0,12.9515,a8w8_blockscale_1x128x128_256x32x128x256_16x16_32x32_1x1_16x16x1_16x16x1_1x32x1x8_8_1x1_intrawave_v1,264.26,1122.08,0.0
gfx950,256,144,6144,2048,ck,12,0,12.9199,a8w8_blockscale_1x128x128_256x32x128x256_16x16_32x32_1x1_16x16x1_16x16x1_1x32x1x8_8_1x1_intrawave_v1,280.49,1133.7,0.0
gfx950,256,152,6144,2048,ck,12,0,12.9563,a8w8_blockscale_1x128x128_256x32x128x256_16x16_32x32_1x1_16x16x1_16x16x1_1x32x1x8_8_1x1_intrawave_v1,295.24,1139.37,0.0
gfx950,256,160,6144,2048,ck,12,0,11.6677,a8w8_blockscale_1x128x128_256x32x128x256_16x16_32x32_1x1_16x16x1_16x16x1_1x32x1x8_8_1x1_intrawave_v1,345.1,1275.03,0.0
gfx950,256,168,6144,2048,ck,2,0,15.343,a8w8_blockscale_1x128x128_256x64x128x128_16x16_32x32_1x2_8x32x1_8x32x1_1x32x1x8_8_1x1_intrawave_v3,275.56,977.08,0.0
gfx950,256,176,6144,2048,ck,2,0,15.3913,a8w8_blockscale_1x128x128_256x64x128x128_16x16_32x32_1x2_8x32x1_8x32x1_1x32x1x8_8_1x1_intrawave_v3,287.77,981.47,0.0
gfx950,256,184,6144,2048,ck,2,0,15.4243,a8w8_blockscale_1x128x128_256x64x128x128_16x16_32x32_1x2_8x32x1_8x32x1_1x32x1x8_8_1x1_intrawave_v3,300.21,986.8,0.0
gfx950,256,192,6144,2048,ck,2,0,15.2191,a8w8_blockscale_1x128x128_256x64x128x128_16x16_32x32_1x2_8x32x1_8x32x1_1x32x1x8_8_1x1_intrawave_v3,317.49,1007.64,0.0
gfx950,256,200,6144,2048,ck,2,0,15.3438,a8w8_blockscale_1x128x128_256x64x128x128_16x16_32x32_1x2_8x32x1_8x32x1_1x32x1x8_8_1x1_intrawave_v3,328.03,1006.93,0.0
gfx950,256,208,6144,2048,ck,2,0,15.4144,a8w8_blockscale_1x128x128_256x64x128x128_16x16_32x32_1x2_8x32x1_8x32x1_1x32x1x8_8_1x1_intrawave_v3,339.58,1009.76,0.0
gfx950,256,216,6144,2048,ck,2,0,15.374,a8w8_blockscale_1x128x128_256x64x128x128_16x16_32x32_1x2_8x32x1_8x32x1_1x32x1x8_8_1x1_intrawave_v3,353.57,1019.87,0.0
gfx950,256,224,6144,2048,ck,2,0,15.4815,a8w8_blockscale_1x128x128_256x64x128x128_16x16_32x32_1x2_8x32x1_8x32x1_1x32x1x8_8_1x1_intrawave_v3,364.12,1020.2,0.0
gfx950,256,232,6144,2048,ck,2,0,15.3951,a8w8_blockscale_1x128x128_256x64x128x128_16x16_32x32_1x2_8x32x1_8x32x1_1x32x1x8_8_1x1_intrawave_v3,379.24,1033.37,0.0
gfx950,256,240,6144,2048,ck,2,0,15.4909,a8w8_blockscale_1x128x128_256x64x128x128_16x16_32x32_1x2_8x32x1_8x32x1_1x32x1x8_8_1x1_intrawave_v3,389.89,1034.38,0.0
gfx950,256,248,6144,2048,ck,2,0,15.5856,a8w8_blockscale_1x128x128_256x64x128x128_16x16_32x32_1x2_8x32x1_8x32x1_1x32x1x8_8_1x1_intrawave_v3,400.44,1035.46,0.0
gfx950,256,256,6144,2048,ck,2,0,15.3429,a8w8_blockscale_1x128x128_256x64x128x128_16x16_32x32_1x2_8x32x1_8x32x1_1x32x1x8_8_1x1_intrawave_v3,419.9,1059.31,0.0
gfx950,256,272,6144,2048,ck,2,0,15.6864,a8w8_blockscale_1x128x128_256x64x128x128_16x16_32x32_1x2_8x32x1_8x32x1_1x32x1x8_8_1x1_intrawave_v3,436.37,1050.74,0.0
gfx950,256,288,6144,2048,ck,2,0,15.7533,a8w8_blockscale_1x128x128_256x64x128x128_16x16_32x32_1x2_8x32x1_8x32x1_1x32x1x8_8_1x1_intrawave_v3,460.08,1060.84,0.0
gfx950,256,304,6144,2048,ck,2,0,15.7768,a8w8_blockscale_1x128x128_256x64x128x128_16x16_32x32_1x2_8x32x1_8x32x1_1x32x1x8_8_1x1_intrawave_v3,484.92,1073.8,0.0
gfx950,256,320,6144,2048,ck,2,0,15.7167,a8w8_blockscale_1x128x128_256x64x128x128_16x16_32x32_1x2_8x32x1_8x32x1_1x32x1x8_8_1x1_intrawave_v3,512.39,1092.5,0.0
gfx950,256,336,6144,2048,ck,3,0,19.2526,a8w8_blockscale_1x128x128_256x64x64x128_16x16_32x32_1x1_8x32x1_8x32x1_1x32x1x8_8_1x1_intrawave_v3,439.2,903.76,0.0
gfx950,256,352,6144,2048,ck,3,0,19.15,a8w8_blockscale_1x128x128_256x64x64x128_16x16_32x32_1x1_8x32x1_8x32x1_1x32x1x8_8_1x1_intrawave_v3,462.58,920.58,0.0
gfx950,256,368,6144,2048,ck,3,0,19.3763,a8w8_blockscale_1x128x128_256x64x64x128_16x16_32x32_1x1_8x32x1_8x32x1_1x32x1x8_8_1x1_intrawave_v3,477.96,921.67,0.0
gfx950,256,384,6144,2048,ck,0,0,19.3125,a8w8_blockscale_1x128x128_256x128x128x128_16x16_32x32_2x2_8x32x1_8x32x1_1x32x1x8_8_1x1_intrawave_v3,500.38,936.59,0.0
gfx950,256,400,6144,2048,ck,0,0,19.8982,a8w8_blockscale_1x128x128_256x128x128x128_16x16_32x32_2x2_8x32x1_8x32x1_1x32x1x8_8_1x1_intrawave_v3,505.89,920.55,0.0
gfx950,256,416,6144,2048,ck,0,0,19.9591,a8w8_blockscale_1x128x128_256x128x128x128_16x16_32x32_2x2_8x32x1_8x32x1_1x32x1x8_8_1x1_intrawave_v3,524.52,929.23,0.0
gfx950,256,432,6144,2048,ck,0,0,20.1279,a8w8_blockscale_1x128x128_256x128x128x128_16x16_32x32_2x2_8x32x1_8x32x1_1x32x1x8_8_1x1_intrawave_v3,540.13,932.84,0.0
gfx950,256,448,6144,2048,ck,0,0,20.1874,a8w8_blockscale_1x128x128_256x128x128x128_16x16_32x32_2x2_8x32x1_8x32x1_1x32x1x8_8_1x1_intrawave_v3,558.48,941.45,0.0
gfx950,256,464,6144,2048,ck,0,0,20.4534,a8w8_blockscale_1x128x128_256x128x128x128_16x16_32x32_2x2_8x32x1_8x32x1_1x32x1x8_8_1x1_intrawave_v3,570.9,940.42,0.0
gfx950,256,480,6144,2048,ck,0,0,20.4159,a8w8_blockscale_1x128x128_256x128x128x128_16x16_32x32_2x2_8x32x1_8x32x1_1x32x1x8_8_1x1_intrawave_v3,591.68,953.38,0.0
gfx950,256,496,6144,2048,ck,0,0,20.6954,a8w8_blockscale_1x128x128_256x128x128x128_16x16_32x32_2x2_8x32x1_8x32x1_1x32x1x8_8_1x1_intrawave_v3,603.14,951.59,0.0
gfx950,256,512,6144,2048,ck,0,0,19.6591,a8w8_blockscale_1x128x128_256x128x128x128_16x16_32x32_2x2_8x32x1_8x32x1_1x32x1x8_8_1x1_intrawave_v3,655.42,1013.42,0.0
gfx950,256,664,6144,2048,ck,2,0,28.9398,a8w8_blockscale_1x128x128_256x64x128x128_16x16_32x32_1x2_8x32x1_8x32x1_1x32x1x8_8_1x1_intrawave_v3,577.41,763.72,0.0
gfx950,256,762,6144,2048,ck,2,0,28.3854,a8w8_blockscale_1x128x128_256x64x128x128_16x16_32x32_1x2_8x32x1_8x32x1_1x32x1x8_8_1x1_intrawave_v3,675.57,828.14,0.0
gfx950,256,902,6144,2048,ck,2,0,30.4649,a8w8_blockscale_1x128x128_256x64x128x128_16x16_32x32_1x2_8x32x1_8x32x1_1x32x1x8_8_1x1_intrawave_v3,745.11,837.49,0.0
gfx950,256,961,6144,2048,ck,2,0,30.2868,a8w8_blockscale_1x128x128_256x64x128x128_16x16_32x32_1x2_8x32x1_8x32x1_1x32x1x8_8_1x1_intrawave_v3,798.51,870.34,0.0
gfx950,256,1000,6144,2048,ck,2,0,31.1092,a8w8_blockscale_1x128x128_256x64x128x128_16x16_32x32_1x2_8x32x1_8x32x1_1x32x1x8_8_1x1_intrawave_v3,808.95,865.3,0.0
gfx950,256,1001,6144,2048,ck,2,0,30.7637,a8w8_blockscale_1x128x128_256x64x128x128_16x16_32x32_1x2_8x32x1_8x32x1_1x32x1x8_8_1x1_intrawave_v3,818.85,875.49,0.0
gfx950,256,1002,6144,2048,ck,2,0,30.9528,a8w8_blockscale_1x128x128_256x64x128x128_16x16_32x32_1x2_8x32x1_8x32x1_1x32x1x8_8_1x1_intrawave_v3,814.66,870.6,0.0
gfx950,256,1003,6144,2048,ck,2,0,30.8683,a8w8_blockscale_1x128x128_256x64x128x128_16x16_32x32_1x2_8x32x1_8x32x1_1x32x1x8_8_1x1_intrawave_v3,817.71,873.45,0.0
gfx950,256,1015,6144,2048,ck,2,0,31.41,a8w8_blockscale_1x128x128_256x64x128x128_16x16_32x32_1x2_8x32x1_8x32x1_1x32x1x8_8_1x1_intrawave_v3,813.22,863.86,0.0
gfx950,256,1023,6144,2048,ck,2,0,31.3952,a8w8_blockscale_1x128x128_256x64x128x128_16x16_32x32_1x2_8x32x1_8x32x1_1x32x1x8_8_1x1_intrawave_v3,820.02,867.92,0.0
gfx950,256,1024,6144,2048,ck,2,0,30.6072,a8w8_blockscale_1x128x128_256x64x128x128_16x16_32x32_1x2_8x32x1_8x32x1_1x32x1x8_8_1x1_intrawave_v3,841.95,890.74,0.0
gfx950,256,1025,6144,2048,ck,0,0,32.3081,a8w8_blockscale_1x128x128_256x128x128x128_16x16_32x32_2x2_8x32x1_8x32x1_1x32x1x8_8_1x1_intrawave_v3,798.41,844.29,0.0
gfx950,256,1032,6144,2048,ck,0,0,32.3992,a8w8_blockscale_1x128x128_256x128x128x128_16x16_32x32_2x2_8x32x1_8x32x1_1x32x1x8_8_1x1_intrawave_v3,801.6,845.01,0.0
gfx950,256,1038,6144,2048,ck,0,0,32.0526,a8w8_blockscale_1x128x128_256x128x128x128_16x16_32x32_2x2_8x32x1_8x32x1_1x32x1x8_8_1x1_intrawave_v3,814.98,856.83,0.0
gfx950,256,1087,6144,2048,ck,0,0,32.0611,a8w8_blockscale_1x128x128_256x128x128x128_16x16_32x32_2x2_8x32x1_8x32x1_1x32x1x8_8_1x1_intrawave_v3,853.22,878.51,0.0
gfx950,256,1255,6144,2048,ck,0,0,33.6964,a8w8_blockscale_1x128x128_256x128x128x128_16x16_32x32_2x2_8x32x1_8x32x1_1x32x1x8_8_1x1_intrawave_v3,937.28,907.35,0.0
gfx950,256,1351,6144,2048,ck,0,0,44.9972,a8w8_blockscale_1x128x128_256x128x128x128_16x16_32x32_2x2_8x32x1_8x32x1_1x32x1x8_8_1x1_intrawave_v3,755.58,710.06,0.0
gfx950,256,1376,6144,2048,ck,2,0,45.1369,a8w8_blockscale_1x128x128_256x64x128x128_16x16_32x32_1x2_8x32x1_8x32x1_1x32x1x8_8_1x1_intrawave_v3,767.18,715.81,0.0
gfx950,256,1380,6144,2048,ck,0,0,45.4635,a8w8_blockscale_1x128x128_256x128x128x128_16x16_32x32_2x2_8x32x1_8x32x1_1x32x1x8_8_1x1_intrawave_v3,763.88,711.92,0.0
gfx950,256,1391,6144,2048,ck,2,0,45.5553,a8w8_blockscale_1x128x128_256x64x128x128_16x16_32x32_1x2_8x32x1_8x32x1_1x32x1x8_8_1x1_intrawave_v3,768.42,713.95,0.0
gfx950,256,1710,6144,2048,ck,0,0,46.6531,a8w8_blockscale_1x128x128_256x128x128x128_16x16_32x32_2x2_8x32x1_8x32x1_1x32x1x8_8_1x1_intrawave_v3,922.42,795.18,0.0
gfx950,256,1808,6144,2048,ck,0,0,48.0658,a8w8_blockscale_1x128x128_256x128x128x128_16x16_32x32_2x2_8x32x1_8x32x1_1x32x1x8_8_1x1_intrawave_v3,946.62,801.04,0.0
gfx950,256,1809,6144,2048,ck,0,0,48.6518,a8w8_blockscale_1x128x128_256x128x128x128_16x16_32x32_2x2_8x32x1_8x32x1_1x32x1x8_8_1x1_intrawave_v3,935.73,791.68,0.0
gfx950,256,1870,6144,2048,ck,0,0,49.431,a8w8_blockscale_1x128x128_256x128x128x128_16x16_32x32_2x2_8x32x1_8x32x1_1x32x1x8_8_1x1_intrawave_v3,952.04,796.89,0.0
gfx950,256,1967,6144,2048,ck,0,0,50.0866,a8w8_blockscale_1x128x128_256x128x128x128_16x16_32x32_2x2_8x32x1_8x32x1_1x32x1x8_8_1x1_intrawave_v3,988.31,814.23,0.0
gfx950,256,1970,6144,2048,ck,0,0,49.3755,a8w8_blockscale_1x128x128_256x128x128x128_16x16_32x32_2x2_8x32x1_8x32x1_1x32x1x8_8_1x1_intrawave_v3,1004.07,826.82,0.0
gfx950,256,2000,6144,2048,ck,0,0,49.923,a8w8_blockscale_1x128x128_256x128x128x128_16x16_32x32_2x2_8x32x1_8x32x1_1x32x1x8_8_1x1_intrawave_v3,1008.19,826.37,0.0
gfx950,256,2001,6144,2048,ck,0,0,49.6918,a8w8_blockscale_1x128x128_256x128x128x128_16x16_32x32_2x2_8x32x1_8x32x1_1x32x1x8_8_1x1_intrawave_v3,1013.38,830.5,0.0
gfx950,256,2016,6144,2048,ck,0,0,50.6818,a8w8_blockscale_1x128x128_256x128x128x128_16x16_32x32_2x2_8x32x1_8x32x1_1x32x1x8_8_1x1_intrawave_v3,1001.04,818.52,0.0
gfx950,256,2017,6144,2048,ck,0,0,50.4204,a8w8_blockscale_1x128x128_256x128x128x128_16x16_32x32_2x2_8x32x1_8x32x1_1x32x1x8_8_1x1_intrawave_v3,1006.72,823.05,0.0
gfx950,256,2046,6144,2048,ck,0,0,50.3392,a8w8_blockscale_1x128x128_256x128x128x128_16x16_32x32_2x2_8x32x1_8x32x1_1x32x1x8_8_1x1_intrawave_v3,1022.85,832.64,0.0
gfx950,256,2048,6144,2048,ck,0,0,49.9938,a8w8_blockscale_1x128x128_256x128x128x128_16x16_32x32_2x2_8x32x1_8x32x1_1x32x1x8_8_1x1_intrawave_v3,1030.92,838.96,0.0
gfx950,256,2050,6144,2048,ck,0,0,58.0071,a8w8_blockscale_1x128x128_256x128x128x128_16x16_32x32_2x2_8x32x1_8x32x1_1x32x1x8_8_1x1_intrawave_v3,889.37,723.56,0.0
gfx950,256,2081,6144,2048,ck,0,0,57.715,a8w8_blockscale_1x128x128_256x128x128x128_16x16_32x32_2x2_8x32x1_8x32x1_1x32x1x8_8_1x1_intrawave_v3,907.39,734.92,0.0
gfx950,256,2095,6144,2048,ck,0,0,57.7606,a8w8_blockscale_1x128x128_256x128x128x128_16x16_32x32_2x2_8x32x1_8x32x1_1x32x1x8_8_1x1_intrawave_v3,912.77,737.82,0.0
gfx950,256,2154,6144,2048,ck,0,0,58.1162,a8w8_blockscale_1x128x128_256x128x128x128_16x16_32x32_2x2_8x32x1_8x32x1_1x32x1x8_8_1x1_intrawave_v3,932.74,747.86,0.0
gfx950,256,2159,6144,2048,ck,0,0,58.2122,a8w8_blockscale_1x128x128_256x128x128x128_16x16_32x32_2x2_8x32x1_8x32x1_1x32x1x8_8_1x1_intrawave_v3,933.36,747.86,0.0
gfx950,256,2162,6144,2048,ck,0,0,58.1998,a8w8_blockscale_1x128x128_256x128x128x128_16x16_32x32_2x2_8x32x1_8x32x1_1x32x1x8_8_1x1_intrawave_v3,934.86,748.75,0.0
gfx950,256,2165,6144,2048,ck,0,0,58.1546,a8w8_blockscale_1x128x128_256x128x128x128_16x16_32x32_2x2_8x32x1_8x32x1_1x32x1x8_8_1x1_intrawave_v3,936.88,750.08,0.0
gfx950,256,2251,6144,2048,ck,0,0,58.5406,a8w8_blockscale_1x128x128_256x128x128x128_16x16_32x32_2x2_8x32x1_8x32x1_1x32x1x8_8_1x1_intrawave_v3,967.67,766.19,0.0
gfx950,256,2252,6144,2048,ck,0,0,58.9934,a8w8_blockscale_1x128x128_256x128x128x128_16x16_32x32_2x2_8x32x1_8x32x1_1x32x1x8_8_1x1_intrawave_v3,960.67,760.55,0.0
gfx950,256,2255,6144,2048,ck,0,0,58.4042,a8w8_blockscale_1x128x128_256x128x128x128_16x16_32x32_2x2_8x32x1_8x32x1_1x32x1x8_8_1x1_intrawave_v3,971.66,768.96,0.0
gfx950,256,2317,6144,2048,ck,0,0,59.5323,a8w8_blockscale_1x128x128_256x128x128x128_16x16_32x32_2x2_8x32x1_8x32x1_1x32x1x8_8_1x1_intrawave_v3,979.46,769.32,0.0
gfx950,256,2694,6144,2048,ck,0,0,72.2131,a8w8_blockscale_1x128x128_256x128x128x128_16x16_32x32_2x2_8x32x1_8x32x1_1x32x1x8_8_1x1_intrawave_v3,938.84,709.07,0.0
gfx950,256,2715,6144,2048,ck,0,0,71.6619,a8w8_blockscale_1x128x128_256x128x128x128_16x16_32x32_2x2_8x32x1_8x32x1_1x32x1x8_8_1x1_intrawave_v3,953.44,718.72,0.0
gfx950,256,2819,6144,2048,ck,0,0,72.2011,a8w8_blockscale_1x128x128_256x128x128x128_16x16_32x32_2x2_8x32x1_8x32x1_1x32x1x8_8_1x1_intrawave_v3,982.57,734.01,0.0
gfx950,256,2853,6144,2048,ck,0,0,72.3931,a8w8_blockscale_1x128x128_256x128x128x128_16x16_32x32_2x2_8x32x1_8x32x1_1x32x1x8_8_1x1_intrawave_v3,991.78,738.79,0.0
gfx950,256,2914,6144,2048,ck,0,0,72.6267,a8w8_blockscale_1x128x128_256x128x128x128_16x16_32x32_2x2_8x32x1_8x32x1_1x32x1x8_8_1x1_intrawave_v3,1009.73,748.46,0.0
gfx950,256,2974,6144,2048,ck,0,0,73.0916,a8w8_blockscale_1x128x128_256x128x128x128_16x16_32x32_2x2_8x32x1_8x32x1_1x32x1x8_8_1x1_intrawave_v3,1023.96,755.47,0.0
gfx950,256,3000,6144,2048,ck,0,0,72.8035,a8w8_blockscale_1x128x128_256x128x128x128_16x16_32x32_2x2_8x32x1_8x32x1_1x32x1x8_8_1x1_intrawave_v3,1037.0,763.57,0.0
gfx950,256,3001,6144,2048,ck,0,0,73.6408,a8w8_blockscale_1x128x128_256x128x128x128_16x16_32x32_2x2_8x32x1_8x32x1_1x32x1x8_8_1x1_intrawave_v3,1025.55,755.09,0.0
gfx950,256,3072,6144,2048,ck,0,0,70.8896,a8w8_blockscale_1x128x128_256x128x128x128_16x16_32x32_2x2_8x32x1_8x32x1_1x32x1x8_8_1x1_intrawave_v3,1090.56,798.75,0.0
gfx950,256,3073,6144,2048,ck,0,0,75.4008,a8w8_blockscale_1x128x128_256x128x128x128_16x16_32x32_2x2_8x32x1_8x32x1_1x32x1x8_8_1x1_intrawave_v3,1025.65,751.15,0.0
gfx950,256,3077,6144,2048,ck,0,0,74.9928,a8w8_blockscale_1x128x128_256x128x128x128_16x16_32x32_2x2_8x32x1_8x32x1_1x32x1x8_8_1x1_intrawave_v3,1032.57,756.0,0.0
gfx950,256,3078,6144,2048,ck,0,0,75.2372,a8w8_blockscale_1x128x128_256x128x128x128_16x16_32x32_2x2_8x32x1_8x32x1_1x32x1x8_8_1x1_intrawave_v3,1029.55,753.74,0.0
gfx950,256,3086,6144,2048,ck,0,0,73.2324,a8w8_blockscale_1x128x128_256x128x128x128_16x16_32x32_2x2_8x32x1_8x32x1_1x32x1x8_8_1x1_intrawave_v3,1060.48,775.94,0.0
gfx950,256,3089,6144,2048,ck,0,0,74.4928,a8w8_blockscale_1x128x128_256x128x128x128_16x16_32x32_2x2_8x32x1_8x32x1_1x32x1x8_8_1x1_intrawave_v3,1043.55,763.39,0.0
gfx950,256,3118,6144,2048,ck,0,0,75.1388,a8w8_blockscale_1x128x128_256x128x128x128_16x16_32x32_2x2_8x32x1_8x32x1_1x32x1x8_8_1x1_intrawave_v3,1044.29,762.36,0.0
gfx950,256,3138,6144,2048,ck,0,0,74.1432,a8w8_blockscale_1x128x128_256x128x128x128_16x16_32x32_2x2_8x32x1_8x32x1_1x32x1x8_8_1x1_intrawave_v3,1065.11,776.46,0.0
gfx950,256,3154,6144,2048,ck,0,0,73.5571,a8w8_blockscale_1x128x128_256x128x128x128_16x16_32x32_2x2_8x32x1_8x32x1_1x32x1x8_8_1x1_intrawave_v3,1079.07,785.77,0.0
gfx950,256,3289,6144,2048,ck,0,0,75.7008,a8w8_blockscale_1x128x128_256x128x128x128_16x16_32x32_2x2_8x32x1_8x32x1_1x32x1x8_8_1x1_intrawave_v3,1093.39,789.08,0.0
gfx950,256,3437,6144,2048,ck,0,0,85.2324,a8w8_blockscale_1x128x128_256x128x128x128_16x16_32x32_2x2_8x32x1_8x32x1_1x32x1x8_8_1x1_intrawave_v3,1014.81,725.73,0.0
gfx950,256,3617,6144,2048,ck,0,0,84.9045,a8w8_blockscale_1x128x128_256x128x128x128_16x16_32x32_2x2_8x32x1_8x32x1_1x32x1x8_8_1x1_intrawave_v3,1072.08,758.93,0.0
gfx950,256,3620,6144,2048,ck,0,0,84.4296,a8w8_blockscale_1x128x128_256x128x128x128_16x16_32x32_2x2_8x32x1_8x32x1_1x32x1x8_8_1x1_intrawave_v3,1079.01,763.7,0.0
gfx950,256,3669,6144,2048,ck,0,0,85.6936,a8w8_blockscale_1x128x128_256x128x128x128_16x16_32x32_2x2_8x32x1_8x32x1_1x32x1x8_8_1x1_intrawave_v3,1077.48,760.64,0.0
gfx950,256,3824,6144,2048,ck,0,0,87.1597,a8w8_blockscale_1x128x128_256x128x128x128_16x16_32x32_2x2_8x32x1_8x32x1_1x32x1x8_8_1x1_intrawave_v3,1104.11,773.34,0.0
gfx950,256,3858,6144,2048,ck,0,0,87.6921,a8w8_blockscale_1x128x128_256x128x128x128_16x16_32x32_2x2_8x32x1_8x32x1_1x32x1x8_8_1x1_intrawave_v3,1107.17,774.2,0.0
gfx950,256,3906,6144,2048,ck,0,0,89.3529,a8w8_blockscale_1x128x128_256x128x128x128_16x16_32x32_2x2_8x32x1_8x32x1_1x32x1x8_8_1x1_intrawave_v3,1100.11,767.51,0.0
gfx950,256,4000,6144,2048,ck,0,0,89.7309,a8w8_blockscale_1x128x128_256x128x128x128_16x16_32x32_2x2_8x32x1_8x32x1_1x32x1x8_8_1x1_intrawave_v3,1121.84,779.3,0.0
gfx950,256,4004,6144,2048,ck,0,0,91.0017,a8w8_blockscale_1x128x128_256x128x128x128_16x16_32x32_2x2_8x32x1_8x32x1_1x32x1x8_8_1x1_intrawave_v3,1107.28,769.04,0.0
gfx950,256,4100,6144,2048,ck,0,0,98.5722,a8w8_blockscale_1x128x128_256x128x128x128_16x16_32x32_2x2_8x32x1_8x32x1_1x32x1x8_8_1x1_intrawave_v3,1046.74,723.94,0.0
gfx950,256,4108,6144,2048,ck,0,0,98.2822,a8w8_blockscale_1x128x128_256x128x128x128_16x16_32x32_2x2_8x32x1_8x32x1_1x32x1x8_8_1x1_intrawave_v3,1051.88,727.24,0.0
gfx950,256,4121,6144,2048,ck,0,0,97.9025,a8w8_blockscale_1x128x128_256x128x128x128_16x16_32x32_2x2_8x32x1_8x32x1_1x32x1x8_8_1x1_intrawave_v3,1059.3,731.97,0.0
gfx950,256,4123,6144,2048,ck,0,0,97.9858,a8w8_blockscale_1x128x128_256x128x128x128_16x16_32x32_2x2_8x32x1_8x32x1_1x32x1x8_8_1x1_intrawave_v3,1058.92,731.64,0.0
gfx950,256,4149,6144,2048,ck,0,0,97.6761,a8w8_blockscale_1x128x128_256x128x128x128_16x16_32x32_2x2_8x32x1_8x32x1_1x32x1x8_8_1x1_intrawave_v3,1068.97,737.77,0.0
gfx950,256,4204,6144,2048,ck,0,0,99.2261,a8w8_blockscale_1x128x128_256x128x128x128_16x16_32x32_2x2_8x32x1_8x32x1_1x32x1x8_8_1x1_intrawave_v3,1066.22,734.2,0.0
gfx950,256,4223,6144,2048,ck,0,0,99.0826,a8w8_blockscale_1x128x128_256x128x128x128_16x16_32x32_2x2_8x32x1_8x32x1_1x32x1x8_8_1x1_intrawave_v3,1072.59,738.01,0.0
gfx950,256,4229,6144,2048,ck,0,0,99.0189,a8w8_blockscale_1x128x128_256x128x128x128_16x16_32x32_2x2_8x32x1_8x32x1_1x32x1x8_8_1x1_intrawave_v3,1074.81,739.35,0.0
gfx950,256,4379,6144,2048,ck,0,0,98.1746,a8w8_blockscale_1x128x128_256x128x128x128_16x16_32x32_2x2_8x32x1_8x32x1_1x32x1x8_8_1x1_intrawave_v3,1122.5,767.61,0.0
gfx950,256,4410,6144,2048,ck,0,0,98.1393,a8w8_blockscale_1x128x128_256x128x128x128_16x16_32x32_2x2_8x32x1_8x32x1_1x32x1x8_8_1x1_intrawave_v3,1130.85,772.42,0.0
gfx950,256,4498,6144,2048,ck,0,0,99.6585,a8w8_blockscale_1x128x128_256x128x128x128_16x16_32x32_2x2_8x32x1_8x32x1_1x32x1x8_8_1x1_intrawave_v3,1135.84,773.3,0.0
gfx950,256,4585,6144,2048,ck,0,0,99.0537,a8w8_blockscale_1x128x128_256x128x128x128_16x16_32x32_2x2_8x32x1_8x32x1_1x32x1x8_8_1x1_intrawave_v3,1164.88,790.62,0.0
gfx950,256,4586,6144,2048,ck,0,0,101.3578,a8w8_blockscale_1x128x128_256x128x128x128_16x16_32x32_2x2_8x32x1_8x32x1_1x32x1x8_8_1x1_intrawave_v3,1138.64,772.79,0.0
gfx950,256,4723,6144,2048,ck,0,0,101.1178,a8w8_blockscale_1x128x128_256x128x128x128_16x16_32x32_2x2_8x32x1_8x32x1_1x32x1x8_8_1x1_intrawave_v3,1175.44,794.04,0.0
gfx950,256,4743,6144,2048,ck,0,0,110.547,a8w8_blockscale_1x128x128_256x128x128x128_16x16_32x32_2x2_8x32x1_8x32x1_1x32x1x8_8_1x1_intrawave_v3,1079.74,728.91,0.0
gfx950,256,4822,6144,2048,ck,0,0,110.7434,a8w8_blockscale_1x128x128_256x128x128x128_16x16_32x32_2x2_8x32x1_8x32x1_1x32x1x8_8_1x1_intrawave_v3,1095.77,737.84,0.0
gfx950,256,4898,6144,2048,ck,0,0,110.7654,a8w8_blockscale_1x128x128_256x128x128x128_16x16_32x32_2x2_8x32x1_8x32x1_1x32x1x8_8_1x1_intrawave_v3,1112.82,747.53,0.0
gfx950,256,4936,6144,2048,ck,0,0,110.3354,a8w8_blockscale_1x128x128_256x128x128x128_16x16_32x32_2x2_8x32x1_8x32x1_1x32x1x8_8_1x1_intrawave_v3,1125.83,755.38,0.0
gfx950,256,4992,6144,2048,ck,0,0,108.4646,a8w8_blockscale_1x128x128_256x128x128x128_16x16_32x32_2x2_8x32x1_8x32x1_1x32x1x8_8_1x1_intrawave_v3,1158.24,775.81,0.0
gfx950,256,5000,6144,2048,ck,0,0,111.2458,a8w8_blockscale_1x128x128_256x128x128x128_16x16_32x32_2x2_8x32x1_8x32x1_1x32x1x8_8_1x1_intrawave_v3,1131.09,757.45,0.0
gfx950,256,5001,6144,2048,ck,0,0,111.715,a8w8_blockscale_1x128x128_256x128x128x128_16x16_32x32_2x2_8x32x1_8x32x1_1x32x1x8_8_1x1_intrawave_v3,1126.57,754.4,0.0
gfx950,256,5002,6144,2048,ck,0,0,110.1766,a8w8_blockscale_1x128x128_256x128x128x128_16x16_32x32_2x2_8x32x1_8x32x1_1x32x1x8_8_1x1_intrawave_v3,1142.52,765.06,0.0
gfx950,256,5003,6144,2048,ck,0,0,109.9835,a8w8_blockscale_1x128x128_256x128x128x128_16x16_32x32_2x2_8x32x1_8x32x1_1x32x1x8_8_1x1_intrawave_v3,1144.76,766.53,0.0
gfx950,256,5004,6144,2048,ck,0,0,109.7966,a8w8_blockscale_1x128x128_256x128x128x128_16x16_32x32_2x2_8x32x1_8x32x1_1x32x1x8_8_1x1_intrawave_v3,1146.94,767.97,0.0
gfx950,256,5005,6144,2048,ck,0,0,111.563,a8w8_blockscale_1x128x128_256x128x128x128_16x16_32x32_2x2_8x32x1_8x32x1_1x32x1x8_8_1x1_intrawave_v3,1129.0,755.94,0.0
gfx950,256,5006,6144,2048,ck,0,0,109.6467,a8w8_blockscale_1x128x128_256x128x128x128_16x16_32x32_2x2_8x32x1_8x32x1_1x32x1x8_8_1x1_intrawave_v3,1148.96,769.28,0.0
gfx950,256,5010,6144,2048,ck,0,0,110.4122,a8w8_blockscale_1x128x128_256x128x128x128_16x16_32x32_2x2_8x32x1_8x32x1_1x32x1x8_8_1x1_intrawave_v3,1141.91,764.47,0.0
gfx950,256,5011,6144,2048,ck,0,0,110.3482,a8w8_blockscale_1x128x128_256x128x128x128_16x16_32x32_2x2_8x32x1_8x32x1_1x32x1x8_8_1x1_intrawave_v3,1142.8,765.04,0.0
gfx950,256,5012,6144,2048,ck,0,0,110.7502,a8w8_blockscale_1x128x128_256x128x128x128_16x16_32x32_2x2_8x32x1_8x32x1_1x32x1x8_8_1x1_intrawave_v3,1138.88,762.39,0.0
gfx950,256,5026,6144,2048,ck,0,0,110.2254,a8w8_blockscale_1x128x128_256x128x128x128_16x16_32x32_2x2_8x32x1_8x32x1_1x32x1x8_8_1x1_intrawave_v3,1147.5,767.84,0.0
gfx950,256,5028,6144,2048,ck,0,0,110.9758,a8w8_blockscale_1x128x128_256x128x128x128_16x16_32x32_2x2_8x32x1_8x32x1_1x32x1x8_8_1x1_intrawave_v3,1140.19,762.91,0.0
gfx950,256,5030,6144,2048,ck,0,0,111.0959,a8w8_blockscale_1x128x128_256x128x128x128_16x16_32x32_2x2_8x32x1_8x32x1_1x32x1x8_8_1x1_intrawave_v3,1139.41,762.34,0.0
gfx950,256,5031,6144,2048,ck,0,0,110.959,a8w8_blockscale_1x128x128_256x128x128x128_16x16_32x32_2x2_8x32x1_8x32x1_1x32x1x8_8_1x1_intrawave_v3,1141.05,763.41,0.0
gfx950,256,5060,6144,2048,ck,0,0,110.8394,a8w8_blockscale_1x128x128_256x128x128x128_16x16_32x32_2x2_8x32x1_8x32x1_1x32x1x8_8_1x1_intrawave_v3,1148.86,767.99,0.0
gfx950,256,5062,6144,2048,ck,0,0,110.5686,a8w8_blockscale_1x128x128_256x128x128x128_16x16_32x32_2x2_8x32x1_8x32x1_1x32x1x8_8_1x1_intrawave_v3,1152.13,770.13,0.0
gfx950,256,5063,6144,2048,ck,0,0,111.2076,a8w8_blockscale_1x128x128_256x128x128x128_16x16_32x32_2x2_8x32x1_8x32x1_1x32x1x8_8_1x1_intrawave_v3,1145.74,765.83,0.0
gfx950,256,5091,6144,2048,ck,0,0,111.0455,a8w8_blockscale_1x128x128_256x128x128x128_16x16_32x32_2x2_8x32x1_8x32x1_1x32x1x8_8_1x1_intrawave_v3,1153.75,770.56,0.0
gfx950,256,5105,6144,2048,ck,0,0,110.1762,a8w8_blockscale_1x128x128_256x128x128x128_16x16_32x32_2x2_8x32x1_8x32x1_1x32x1x8_8_1x1_intrawave_v3,1166.06,778.46,0.0
gfx950,256,5120,6144,2048,ck,0,0,109.2386,a8w8_blockscale_1x128x128_256x128x128x128_16x16_32x32_2x2_8x32x1_8x32x1_1x32x1x8_8_1x1_intrawave_v3,1179.52,787.11,0.0
gfx950,256,5122,6144,2048,ck,0,0,113.2943,a8w8_blockscale_1x128x128_256x128x128x128_16x16_32x32_2x2_8x32x1_8x32x1_1x32x1x8_8_1x1_intrawave_v3,1137.74,759.19,0.0
gfx950,256,5123,6144,2048,ck,0,0,113.9423,a8w8_blockscale_1x128x128_256x128x128x128_16x16_32x32_2x2_8x32x1_8x32x1_1x32x1x8_8_1x1_intrawave_v3,1131.49,755.0,0.0
gfx950,256,5124,6144,2048,ck,0,0,113.071,a8w8_blockscale_1x128x128_256x128x128x128_16x16_32x32_2x2_8x32x1_8x32x1_1x32x1x8_8_1x1_intrawave_v3,1140.43,760.94,0.0
gfx950,256,5127,6144,2048,ck,0,0,112.5235,a8w8_blockscale_1x128x128_256x128x128x128_16x16_32x32_2x2_8x32x1_8x32x1_1x32x1x8_8_1x1_intrawave_v3,1146.65,765.03,0.0
gfx950,256,5177,6144,2048,ck,0,0,113.0211,a8w8_blockscale_1x128x128_256x128x128x128_16x16_32x32_2x2_8x32x1_8x32x1_1x32x1x8_8_1x1_intrawave_v3,1152.74,768.0,0.0
gfx950,256,5183,6144,2048,ck,0,0,111.4827,a8w8_blockscale_1x128x128_256x128x128x128_16x16_32x32_2x2_8x32x1_8x32x1_1x32x1x8_8_1x1_intrawave_v3,1170.0,779.37,0.0
gfx950,256,5252,6144,2048,ck,0,0,113.6687,a8w8_blockscale_1x128x128_256x128x128x128_16x16_32x32_2x2_8x32x1_8x32x1_1x32x1x8_8_1x1_intrawave_v3,1162.77,773.09,0.0
gfx950,256,5255,6144,2048,ck,0,0,112.5015,a8w8_blockscale_1x128x128_256x128x128x128_16x16_32x32_2x2_8x32x1_8x32x1_1x32x1x8_8_1x1_intrawave_v3,1175.51,781.49,0.0
gfx950,256,5361,6144,2048,ck,0,0,113.0523,a8w8_blockscale_1x128x128_256x128x128x128_16x16_32x32_2x2_8x32x1_8x32x1_1x32x1x8_8_1x1_intrawave_v3,1193.38,791.12,0.0
gfx950,256,5427,6144,2048,ck,0,0,121.9315,a8w8_blockscale_1x128x128_256x128x128x128_16x16_32x32_2x2_8x32x1_8x32x1_1x32x1x8_8_1x1_intrawave_v3,1120.1,741.27,0.0
gfx950,256,5471,6144,2048,ck,0,0,122.0636,a8w8_blockscale_1x128x128_256x128x128x128_16x16_32x32_2x2_8x32x1_8x32x1_1x32x1x8_8_1x1_intrawave_v3,1127.95,745.64,0.0
gfx950,256,5534,6144,2048,ck,0,0,122.2659,a8w8_blockscale_1x128x128_256x128x128x128_16x16_32x32_2x2_8x32x1_8x32x1_1x32x1x8_8_1x1_intrawave_v3,1139.06,751.79,0.0
gfx950,256,5564,6144,2048,ck,0,0,122.1,a8w8_blockscale_1x128x128_256x128x128x128_16x16_32x32_2x2_8x32x1_8x32x1_1x32x1x8_8_1x1_intrawave_v3,1146.79,756.33,0.0
gfx950,256,5671,6144,2048,ck,0,0,123.8624,a8w8_blockscale_1x128x128_256x128x128x128_16x16_32x32_2x2_8x32x1_8x32x1_1x32x1x8_8_1x1_intrawave_v3,1152.21,757.96,0.0
gfx950,256,5927,6144,2048,ck,0,0,124.916,a8w8_blockscale_1x128x128_256x128x128x128_16x16_32x32_2x2_8x32x1_8x32x1_1x32x1x8_8_1x1_intrawave_v3,1194.07,780.94,0.0
gfx950,256,5954,6144,2048,ck,0,0,123.9288,a8w8_blockscale_1x128x128_256x128x128x128_16x16_32x32_2x2_8x32x1_8x32x1_1x32x1x8_8_1x1_intrawave_v3,1209.06,790.29,0.0
gfx950,256,6000,6144,2048,ck,0,0,127.766,a8w8_blockscale_1x128x128_256x128x128x128_16x16_32x32_2x2_8x32x1_8x32x1_1x32x1x8_8_1x1_intrawave_v3,1181.81,771.71,0.0
gfx950,256,6002,6144,2048,ck,0,0,125.9072,a8w8_blockscale_1x128x128_256x128x128x128_16x16_32x32_2x2_8x32x1_8x32x1_1x32x1x8_8_1x1_intrawave_v3,1199.66,783.34,0.0
gfx950,256,6146,6144,2048,ck,0,0,135.1012,a8w8_blockscale_1x128x128_256x128x128x128_16x16_32x32_2x2_8x32x1_8x32x1_1x32x1x8_8_1x1_intrawave_v3,1144.84,745.31,0.0
gfx950,256,6194,6144,2048,ck,0,0,134.4036,a8w8_blockscale_1x128x128_256x128x128x128_16x16_32x32_2x2_8x32x1_8x32x1_1x32x1x8_8_1x1_intrawave_v3,1159.77,754.3,0.0
gfx950,256,6227,6144,2048,ck,0,0,134.1316,a8w8_blockscale_1x128x128_256x128x128x128_16x16_32x32_2x2_8x32x1_8x32x1_1x32x1x8_8_1x1_intrawave_v3,1168.31,759.35,0.0
gfx950,256,6229,6144,2048,ck,0,0,134.0062,a8w8_blockscale_1x128x128_256x128x128x128_16x16_32x32_2x2_8x32x1_8x32x1_1x32x1x8_8_1x1_intrawave_v3,1169.78,760.28,0.0
gfx950,256,6234,6144,2048,ck,0,0,134.9572,a8w8_blockscale_1x128x128_256x128x128x128_16x16_32x32_2x2_8x32x1_8x32x1_1x32x1x8_8_1x1_intrawave_v3,1162.47,755.45,0.0
gfx950,256,6246,6144,2048,ck,0,0,133.9424,a8w8_blockscale_1x128x128_256x128x128x128_16x16_32x32_2x2_8x32x1_8x32x1_1x32x1x8_8_1x1_intrawave_v3,1173.53,762.46,0.0
gfx950,256,6304,6144,2048,ck,0,0,134.9481,a8w8_blockscale_1x128x128_256x128x128x128_16x16_32x32_2x2_8x32x1_8x32x1_1x32x1x8_8_1x1_intrawave_v3,1175.6,762.94,0.0
gfx950,256,6314,6144,2048,ck,0,0,134.8932,a8w8_blockscale_1x128x128_256x128x128x128_16x16_32x32_2x2_8x32x1_8x32x1_1x32x1x8_8_1x1_intrawave_v3,1177.95,764.31,0.0
gfx950,256,6318,6144,2048,ck,0,0,136.2785,a8w8_blockscale_1x128x128_256x128x128x128_16x16_32x32_2x2_8x32x1_8x32x1_1x32x1x8_8_1x1_intrawave_v3,1166.71,756.96,0.0
gfx950,256,6341,6144,2048,ck,0,0,134.0005,a8w8_blockscale_1x128x128_256x128x128x128_16x16_32x32_2x2_8x32x1_8x32x1_1x32x1x8_8_1x1_intrawave_v3,1190.86,772.29,0.0
gfx950,256,6377,6144,2048,ck,0,0,134.4116,a8w8_blockscale_1x128x128_256x128x128x128_16x16_32x32_2x2_8x32x1_8x32x1_1x32x1x8_8_1x1_intrawave_v3,1193.96,773.77,0.0
gfx950,256,6476,6144,2048,ck,0,0,136.7553,a8w8_blockscale_1x128x128_256x128x128x128_16x16_32x32_2x2_8x32x1_8x32x1_1x32x1x8_8_1x1_intrawave_v3,1191.72,770.89,0.0
gfx950,256,6483,6144,2048,ck,0,0,136.4917,a8w8_blockscale_1x128x128_256x128x128x128_16x16_32x32_2x2_8x32x1_8x32x1_1x32x1x8_8_1x1_intrawave_v3,1195.31,773.11,0.0
gfx950,256,6492,6144,2048,ck,0,0,136.9561,a8w8_blockscale_1x128x128_256x128x128x128_16x16_32x32_2x2_8x32x1_8x32x1_1x32x1x8_8_1x1_intrawave_v3,1192.91,771.43,0.0
gfx950,256,6519,6144,2048,ck,0,0,136.2097,a8w8_blockscale_1x128x128_256x128x128x128_16x16_32x32_2x2_8x32x1_8x32x1_1x32x1x8_8_1x1_intrawave_v3,1204.44,778.5,0.0
gfx950,256,6609,6144,2048,ck,0,0,136.8697,a8w8_blockscale_1x128x128_256x128x128x128_16x16_32x32_2x2_8x32x1_8x32x1_1x32x1x8_8_1x1_intrawave_v3,1215.18,784.17,0.0
gfx950,256,6811,6144,2048,ck,0,0,146.3853,a8w8_blockscale_1x128x128_256x128x128x128_16x16_32x32_2x2_8x32x1_8x32x1_1x32x1x8_8_1x1_intrawave_v3,1170.91,752.98,0.0
gfx950,256,6813,6144,2048,ck,0,0,146.5737,a8w8_blockscale_1x128x128_256x128x128x128_16x16_32x32_2x2_8x32x1_8x32x1_1x32x1x8_8_1x1_intrawave_v3,1169.75,752.21,0.0
gfx950,256,6818,6144,2048,ck,0,0,145.4594,a8w8_blockscale_1x128x128_256x128x128x128_16x16_32x32_2x2_8x32x1_8x32x1_1x32x1x8_8_1x1_intrawave_v3,1179.58,758.46,0.0
gfx950,256,6830,6144,2048,ck,0,0,146.1486,a8w8_blockscale_1x128x128_256x128x128x128_16x16_32x32_2x2_8x32x1_8x32x1_1x32x1x8_8_1x1_intrawave_v3,1176.08,756.06,0.0
gfx950,256,7001,6144,2048,ck,0,0,147.1894,a8w8_blockscale_1x128x128_256x128x128x128_16x16_32x32_2x2_8x32x1_8x32x1_1x32x1x8_8_1x1_intrawave_v3,1197.0,767.37,0.0
gfx950,256,7025,6144,2048,ck,0,0,146.949,a8w8_blockscale_1x128x128_256x128x128x128_16x16_32x32_2x2_8x32x1_8x32x1_1x32x1x8_8_1x1_intrawave_v3,1203.07,770.97,0.0
gfx950,256,7121,6144,2048,ck,0,0,147.8442,a8w8_blockscale_1x128x128_256x128x128x128_16x16_32x32_2x2_8x32x1_8x32x1_1x32x1x8_8_1x1_intrawave_v3,1212.13,775.61,0.0
gfx950,256,7169,6144,2048,ck,0,0,149.4763,a8w8_blockscale_1x128x128_256x128x128x128_16x16_32x32_2x2_8x32x1_8x32x1_1x32x1x8_8_1x1_intrawave_v3,1206.97,771.75,0.0
gfx950,256,7177,6144,2048,ck,0,0,148.5943,a8w8_blockscale_1x128x128_256x128x128x128_16x16_32x32_2x2_8x32x1_8x32x1_1x32x1x8_8_1x1_intrawave_v3,1215.49,777.1,0.0
gfx950,256,7217,6144,2048,ck,0,0,149.4679,a8w8_blockscale_1x128x128_256x128x128x128_16x16_32x32_2x2_8x32x1_8x32x1_1x32x1x8_8_1x1_intrawave_v3,1215.12,776.39,0.0
gfx950,256,7223,6144,2048,ck,0,0,148.1148,a8w8_blockscale_1x128x128_256x128x128x128_16x16_32x32_2x2_8x32x1_8x32x1_1x32x1x8_8_1x1_intrawave_v3,1227.24,784.07,0.0
gfx950,256,7238,6144,2048,ck,0,0,148.6807,a8w8_blockscale_1x128x128_256x128x128x128_16x16_32x32_2x2_8x32x1_8x32x1_1x32x1x8_8_1x1_intrawave_v3,1225.11,782.53,0.0
gfx950,256,7246,6144,2048,ck,0,0,149.6971,a8w8_blockscale_1x128x128_256x128x128x128_16x16_32x32_2x2_8x32x1_8x32x1_1x32x1x8_8_1x1_intrawave_v3,1218.14,777.98,0.0
gfx950,256,7249,6144,2048,ck,0,0,149.7771,a8w8_blockscale_1x128x128_256x128x128x128_16x16_32x32_2x2_8x32x1_8x32x1_1x32x1x8_8_1x1_intrawave_v3,1217.99,777.85,0.0
gfx950,256,7316,6144,2048,ck,0,0,150.2627,a8w8_blockscale_1x128x128_256x128x128x128_16x16_32x32_2x2_8x32x1_8x32x1_1x32x1x8_8_1x1_intrawave_v3,1225.28,781.73,0.0
gfx950,256,7393,6144,2048,ck,0,0,151.2991,a8w8_blockscale_1x128x128_256x128x128x128_16x16_32x32_2x2_8x32x1_8x32x1_1x32x1x8_8_1x1_intrawave_v3,1229.69,783.67,0.0
gfx950,256,7491,6144,2048,ck,0,0,157.738,a8w8_blockscale_1x128x128_256x128x128x128_16x16_32x32_2x2_8x32x1_8x32x1_1x32x1x8_8_1x1_intrawave_v3,1195.13,760.59,0.0
gfx950,256,7558,6144,2048,ck,0,0,159.3924,a8w8_blockscale_1x128x128_256x128x128x128_16x16_32x32_2x2_8x32x1_8x32x1_1x32x1x8_8_1x1_intrawave_v3,1193.3,758.72,0.0
gfx950,256,7650,6144,2048,ck,0,0,158.48,a8w8_blockscale_1x128x128_256x128x128x128_16x16_32x32_2x2_8x32x1_8x32x1_1x32x1x8_8_1x1_intrawave_v3,1214.78,771.41,0.0
gfx950,256,7753,6144,2048,ck,0,0,161.448,a8w8_blockscale_1x128x128_256x128x128x128_16x16_32x32_2x2_8x32x1_8x32x1_1x32x1x8_8_1x1_intrawave_v3,1208.5,766.38,0.0
gfx950,256,7774,6144,2048,ck,0,0,160.3564,a8w8_blockscale_1x128x128_256x128x128x128_16x16_32x32_2x2_8x32x1_8x32x1_1x32x1x8_8_1x1_intrawave_v3,1220.03,773.47,0.0
gfx950,256,7815,6144,2048,ck,0,0,161.022,a8w8_blockscale_1x128x128_256x128x128x128_16x16_32x32_2x2_8x32x1_8x32x1_1x32x1x8_8_1x1_intrawave_v3,1221.39,773.92,0.0
gfx950,256,7834,6144,2048,ck,0,0,164.4212,a8w8_blockscale_1x128x128_256x128x128x128_16x16_32x32_2x2_8x32x1_8x32x1_1x32x1x8_8_1x1_intrawave_v3,1199.05,759.58,0.0
gfx950,256,7836,6144,2048,ck,0,0,160.7744,a8w8_blockscale_1x128x128_256x128x128x128_16x16_32x32_2x2_8x32x1_8x32x1_1x32x1x8_8_1x1_intrawave_v3,1226.56,776.99,0.0
gfx950,256,7871,6144,2048,ck,0,0,160.4072,a8w8_blockscale_1x128x128_256x128x128x128_16x16_32x32_2x2_8x32x1_8x32x1_1x32x1x8_8_1x1_intrawave_v3,1234.86,781.89,0.0
gfx950,256,7899,6144,2048,ck,0,0,160.0268,a8w8_blockscale_1x128x128_256x128x128x128_16x16_32x32_2x2_8x32x1_8x32x1_1x32x1x8_8_1x1_intrawave_v3,1242.2,786.26,0.0
gfx950,256,7913,6144,2048,ck,0,0,160.7476,a8w8_blockscale_1x128x128_256x128x128x128_16x16_32x32_2x2_8x32x1_8x32x1_1x32x1x8_8_1x1_intrawave_v3,1238.82,783.98,0.0
gfx950,256,7930,6144,2048,ck,0,0,161.1948,a8w8_blockscale_1x128x128_256x128x128x128_16x16_32x32_2x2_8x32x1_8x32x1_1x32x1x8_8_1x1_intrawave_v3,1238.04,783.32,0.0
gfx950,256,7961,6144,2048,ck,0,0,161.9212,a8w8_blockscale_1x128x128_256x128x128x128_16x16_32x32_2x2_8x32x1_8x32x1_1x32x1x8_8_1x1_intrawave_v3,1237.3,782.55,0.0
gfx950,256,7963,6144,2048,ck,0,0,164.9916,a8w8_blockscale_1x128x128_256x128x128x128_16x16_32x32_2x2_8x32x1_8x32x1_1x32x1x8_8_1x1_intrawave_v3,1214.58,768.16,0.0
gfx950,256,7974,6144,2048,ck,0,0,163.6472,a8w8_blockscale_1x128x128_256x128x128x128_16x16_32x32_2x2_8x32x1_8x32x1_1x32x1x8_8_1x1_intrawave_v3,1226.25,775.44,0.0
gfx950,256,8016,6144,2048,ck,0,0,162.6156,a8w8_blockscale_1x128x128_256x128x128x128_16x16_32x32_2x2_8x32x1_8x32x1_1x32x1x8_8_1x1_intrawave_v3,1240.53,784.06,0.0
gfx950,256,8017,6144,2048,ck,0,0,162.0472,a8w8_blockscale_1x128x128_256x128x128x128_16x16_32x32_2x2_8x32x1_8x32x1_1x32x1x8_8_1x1_intrawave_v3,1245.03,786.9,0.0
gfx950,256,8103,6144,2048,ck,0,0,165.3564,a8w8_blockscale_1x128x128_256x128x128x128_16x16_32x32_2x2_8x32x1_8x32x1_1x32x1x8_8_1x1_intrawave_v3,1233.21,778.61,0.0
gfx950,256,8128,6144,2048,ck,0,0,165.6156,a8w8_blockscale_1x128x128_256x128x128x128_16x16_32x32_2x2_8x32x1_8x32x1_1x32x1x8_8_1x1_intrawave_v3,1235.08,779.55,0.0
gfx950,256,8129,6144,2048,ck,0,0,165.5428,a8w8_blockscale_1x128x128_256x128x128x128_16x16_32x32_2x2_8x32x1_8x32x1_1x32x1x8_8_1x1_intrawave_v3,1235.77,779.98,0.0
gfx950,256,8150,6144,2048,ck,0,0,165.9728,a8w8_blockscale_1x128x128_256x128x128x128_16x16_32x32_2x2_8x32x1_8x32x1_1x32x1x8_8_1x1_intrawave_v3,1235.75,779.77,0.0
gfx950,256,8184,6144,2048,ck,0,0,166.4992,a8w8_blockscale_1x128x128_256x128x128x128_16x16_32x32_2x2_8x32x1_8x32x1_1x32x1x8_8_1x1_intrawave_v3,1236.99,780.24,0.0
gfx950,256,8185,6144,2048,ck,0,0,165.7468,a8w8_blockscale_1x128x128_256x128x128x128_16x16_32x32_2x2_8x32x1_8x32x1_1x32x1x8_8_1x1_intrawave_v3,1242.75,783.86,0.0
gfx950,256,8192,6144,2048,ck,0,0,162.5452,a8w8_blockscale_1x128x128_256x128x128x128_16x16_32x32_2x2_8x32x1_8x32x1_1x32x1x8_8_1x1_intrawave_v3,1268.31,799.92,0.0
gfx950,256,1,9216,2048,ck,8,0,8.0972,a8w8_blockscale_1x128x128_256x16x64x256_16x16_16x16_1x1_16x16x1_16x16x1_1x16x1x16_4_1x1_intrawave_v1,4.66,2333.5,0.0
gfx950,256,2,9216,2048,ck,8,0,8.1121,a8w8_blockscale_1x128x128_256x16x64x256_16x16_16x16_1x1_16x16x1_16x16x1_1x16x1x16_4_1x1_intrawave_v1,9.31,2331.74,0.0
gfx950,256,4,9216,2048,ck,8,0,8.0981,a8w8_blockscale_1x128x128_256x16x64x256_16x16_16x16_1x1_16x16x1_16x16x1_1x16x1x16_4_1x1_intrawave_v1,18.65,2340.83,0.0
gfx950,256,8,9216,2048,ck,8,0,8.1548,a8w8_blockscale_1x128x128_256x16x64x256_16x16_16x16_1x1_16x16x1_16x16x1_1x16x1x16_4_1x1_intrawave_v1,37.03,2334.6,0.0
gfx950,256,16,9216,2048,ck,8,0,7.9958,a8w8_blockscale_1x128x128_256x16x64x256_16x16_16x16_1x1_16x16x1_16x16x1_1x16x1x16_4_1x1_intrawave_v1,75.54,2401.52,0.0
gfx950,256,32,9216,2048,ck,7,0,9.6679,a8w8_blockscale_1x128x128_256x16x128x256_16x16_16x16_1x2_16x16x1_16x16x1_1x16x1x16_8_1x2_intrawave_v1,124.95,2020.06,0.0
gfx950,256,48,9216,2048,ck,7,0,9.8651,a8w8_blockscale_1x128x128_256x16x128x256_16x16_16x16_1x2_16x16x1_16x16x1_1x16x1x16_8_1x2_intrawave_v1,183.67,2012.89,0.0
gfx950,256,64,9216,2048,ck,18,0,9.5017,a8w8_blockscale_1x128x128_256x64x64x256_16x16_32x32_1x1_16x16x1_16x16x1_1x32x1x8_8_1x1_intrawave_v1,254.26,2124.37,0.0
gfx950,256,80,9216,2048,ck,12,0,12.6107,a8w8_blockscale_1x128x128_256x32x128x256_16x16_32x32_1x1_16x16x1_16x16x1_1x32x1x8_8_1x1_intrawave_v1,239.47,1626.62,0.0
gfx950,256,96,9216,2048,ck,12,0,11.7841,a8w8_blockscale_1x128x128_256x32x128x256_16x16_32x32_1x1_16x16x1_16x16x1_1x32x1x8_8_1x1_intrawave_v1,307.52,1768.52,0.0
gfx950,256,112,9216,2048,ck,5,0,15.0507,a8w8_blockscale_1x128x128_256x16x128x128_8x16_16x16_1x2_16x16x1_8x32x1_1x16x1x16_8_1x2_intrawave_v1,280.91,1406.45,0.0
gfx950,256,128,9216,2048,ck,2,0,15.5558,a8w8_blockscale_1x128x128_256x64x128x128_16x16_32x32_1x2_8x32x1_8x32x1_1x32x1x8_8_1x1_intrawave_v3,310.61,1381.85,0.0
gfx950,256,256,9216,2048,ck,0,0,19.4969,a8w8_blockscale_1x128x128_256x128x128x128_16x16_32x32_2x2_8x32x1_8x32x1_1x32x1x8_8_1x1_intrawave_v3,495.65,1236.98,0.0
gfx950,256,512,9216,2048,ck,2,0,29.7556,a8w8_blockscale_1x128x128_256x64x128x128_16x16_32x32_1x2_8x32x1_8x32x1_1x32x1x8_8_1x1_intrawave_v3,649.54,986.71,0.0
gfx950,256,667,9216,2048,ck,0,0,33.0243,a8w8_blockscale_1x128x128_256x128x128x128_16x16_32x32_2x2_8x32x1_8x32x1_1x32x1x8_8_1x1_intrawave_v3,762.42,985.17,0.0
gfx950,256,671,9216,2048,ck,0,0,33.3423,a8w8_blockscale_1x128x128_256x128x128x128_16x16_32x32_2x2_8x32x1_8x32x1_1x32x1x8_8_1x1_intrawave_v3,759.68,978.23,0.0
gfx950,256,931,9216,2048,ck,0,0,45.9085,a8w8_blockscale_1x128x128_256x128x128x128_16x16_32x32_2x2_8x32x1_8x32x1_1x32x1x8_8_1x1_intrawave_v3,765.52,826.45,0.0
gfx950,256,1024,9216,2048,ck,0,0,45.9959,a8w8_blockscale_1x128x128_256x128x128x128_16x16_32x32_2x2_8x32x1_8x32x1_1x32x1x8_8_1x1_intrawave_v3,840.39,866.29,0.0
gfx950,256,1025,9216,2048,ck,0,0,46.7014,a8w8_blockscale_1x128x128_256x128x128x128_16x16_32x32_2x2_8x32x1_8x32x1_1x32x1x8_8_1x1_intrawave_v3,828.51,853.64,0.0
gfx950,256,1027,9216,2048,ck,0,0,47.1012,a8w8_blockscale_1x128x128_256x128x128x128_16x16_32x32_2x2_8x32x1_8x32x1_1x32x1x8_8_1x1_intrawave_v3,823.08,847.27,0.0
gfx950,256,1031,9216,2048,ck,0,0,46.4381,a8w8_blockscale_1x128x128_256x128x128x128_16x16_32x32_2x2_8x32x1_8x32x1_1x32x1x8_8_1x1_intrawave_v3,838.08,861.13,0.0
gfx950,256,1039,9216,2048,ck,0,0,47.1953,a8w8_blockscale_1x128x128_256x128x128x128_16x16_32x32_2x2_8x32x1_8x32x1_1x32x1x8_8_1x1_intrawave_v3,831.03,850.79,0.0
gfx950,256,1040,9216,2048,ck,0,0,47.0648,a8w8_blockscale_1x128x128_256x128x128x128_16x16_32x32_2x2_8x32x1_8x32x1_1x32x1x8_8_1x1_intrawave_v3,834.14,853.58,0.0
gfx950,256,1041,9216,2048,ck,0,0,46.6259,a8w8_blockscale_1x128x128_256x128x128x128_16x16_32x32_2x2_8x32x1_8x32x1_1x32x1x8_8_1x1_intrawave_v3,842.8,862.05,0.0
gfx950,256,1072,9216,2048,ck,0,0,46.3897,a8w8_blockscale_1x128x128_256x128x128x128_16x16_32x32_2x2_8x32x1_8x32x1_1x32x1x8_8_1x1_intrawave_v3,872.32,880.13,0.0
gfx950,256,1073,9216,2048,ck,0,0,46.7416,a8w8_blockscale_1x128x128_256x128x128x128_16x16_32x32_2x2_8x32x1_8x32x1_1x32x1x8_8_1x1_intrawave_v3,866.56,873.94,0.0
gfx950,256,1077,9216,2048,ck,0,0,46.9273,a8w8_blockscale_1x128x128_256x128x128x128_16x16_32x32_2x2_8x32x1_8x32x1_1x32x1x8_8_1x1_intrawave_v3,866.35,872.23,0.0
gfx950,256,1091,9216,2048,ck,0,0,47.2793,a8w8_blockscale_1x128x128_256x128x128x128_16x16_32x32_2x2_8x32x1_8x32x1_1x32x1x8_8_1x1_intrawave_v3,871.08,871.8,0.0
gfx950,256,1343,9216,2048,ck,2,0,57.4046,a8w8_blockscale_1x128x128_256x64x128x128_16x16_32x32_1x2_8x32x1_8x32x1_1x32x1x8_8_1x1_intrawave_v3,883.14,807.93,0.0
gfx950,256,1688,9216,2048,ck,0,0,63.2027,a8w8_blockscale_1x128x128_256x128x128x128_16x16_32x32_2x2_8x32x1_8x32x1_1x32x1x8_8_1x1_intrawave_v3,1008.18,845.61,0.0
gfx950,256,2017,9216,2048,ck,0,0,75.3971,a8w8_blockscale_1x128x128_256x128x128x128_16x16_32x32_2x2_8x32x1_8x32x1_1x32x1x8_8_1x1_intrawave_v3,1009.84,798.21,0.0
gfx950,256,2048,9216,2048,ck,0,0,73.8028,a8w8_blockscale_1x128x128_256x128x128x128_16x16_32x32_2x2_8x32x1_8x32x1_1x32x1x8_8_1x1_intrawave_v3,1047.51,824.05,0.0
gfx950,256,2050,9216,2048,ck,0,0,75.6888,a8w8_blockscale_1x128x128_256x128x128x128_16x16_32x32_2x2_8x32x1_8x32x1_1x32x1x8_8_1x1_intrawave_v3,1022.41,804.06,0.0
gfx950,256,2063,9216,2048,ck,0,0,75.5659,a8w8_blockscale_1x128x128_256x128x128x128_16x16_32x32_2x2_8x32x1_8x32x1_1x32x1x8_8_1x1_intrawave_v3,1030.57,808.89,0.0
gfx950,256,2064,9216,2048,ck,0,0,76.3768,a8w8_blockscale_1x128x128_256x128x128x128_16x16_32x32_2x2_8x32x1_8x32x1_1x32x1x8_8_1x1_intrawave_v3,1020.12,800.57,0.0
gfx950,256,2099,9216,2048,ck,0,0,76.5628,a8w8_blockscale_1x128x128_256x128x128x128_16x16_32x32_2x2_8x32x1_8x32x1_1x32x1x8_8_1x1_intrawave_v3,1034.9,807.99,0.0
gfx950,256,2159,9216,2048,ck,0,0,75.412,a8w8_blockscale_1x128x128_256x128x128x128_16x16_32x32_2x2_8x32x1_8x32x1_1x32x1x8_8_1x1_intrawave_v3,1080.72,836.61,0.0
gfx950,256,2160,9216,2048,ck,0,0,75.8212,a8w8_blockscale_1x128x128_256x128x128x128_16x16_32x32_2x2_8x32x1_8x32x1_1x32x1x8_8_1x1_intrawave_v3,1075.39,832.37,0.0
gfx950,256,2313,9216,2048,ck,0,0,87.5497,a8w8_blockscale_1x128x128_256x128x128x128_16x16_32x32_2x2_8x32x1_8x32x1_1x32x1x8_8_1x1_intrawave_v3,997.29,756.65,0.0
gfx950,256,2325,9216,2048,ck,0,0,85.1204,a8w8_blockscale_1x128x128_256x128x128x128_16x16_32x32_2x2_8x32x1_8x32x1_1x32x1x8_8_1x1_intrawave_v3,1031.08,781.13,0.0
gfx950,256,3072,9216,2048,ck,0,0,99.1165,a8w8_blockscale_1x128x128_256x128x128x128_16x16_32x32_2x2_8x32x1_8x32x1_1x32x1x8_8_1x1_intrawave_v3,1169.98,825.18,0.0
gfx950,256,3073,9216,2048,ck,0,0,108.7498,a8w8_blockscale_1x128x128_256x128x128x128_16x16_32x32_2x2_8x32x1_8x32x1_1x32x1x8_8_1x1_intrawave_v3,1066.69,752.27,0.0
gfx950,256,3182,9216,2048,ck,0,0,109.151,a8w8_blockscale_1x128x128_256x128x128x128_16x16_32x32_2x2_8x32x1_8x32x1_1x32x1x8_8_1x1_intrawave_v3,1100.46,769.96,0.0
gfx950,256,3183,9216,2048,ck,0,0,109.967,a8w8_blockscale_1x128x128_256x128x128x128_16x16_32x32_2x2_8x32x1_8x32x1_1x32x1x8_8_1x1_intrawave_v3,1092.64,764.43,0.0
gfx950,256,3847,9216,2048,ck,0,0,126.7344,a8w8_blockscale_1x128x128_256x128x128x128_16x16_32x32_2x2_8x32x1_8x32x1_1x32x1x8_8_1x1_intrawave_v3,1145.86,770.6,0.0
gfx950,256,4096,9216,2048,ck,0,0,127.766,a8w8_blockscale_1x128x128_256x128x128x128_16x16_32x32_2x2_8x32x1_8x32x1_1x32x1x8_8_1x1_intrawave_v3,1210.17,804.29,0.0
gfx950,256,4111,9216,2048,ck,0,0,136.0656,a8w8_blockscale_1x128x128_256x128x128x128_16x16_32x32_2x2_8x32x1_8x32x1_1x32x1x8_8_1x1_intrawave_v3,1140.52,757.48,0.0
gfx950,256,4141,9216,2048,ck,0,0,137.6592,a8w8_blockscale_1x128x128_256x128x128x128_16x16_32x32_2x2_8x32x1_8x32x1_1x32x1x8_8_1x1_intrawave_v3,1135.54,753.18,0.0
gfx950,256,4142,9216,2048,ck,0,0,135.1508,a8w8_blockscale_1x128x128_256x128x128x128_16x16_32x32_2x2_8x32x1_8x32x1_1x32x1x8_8_1x1_intrawave_v3,1156.89,767.31,0.0
gfx950,256,4345,9216,2048,ck,0,0,138.3754,a8w8_blockscale_1x128x128_256x128x128x128_16x16_32x32_2x2_8x32x1_8x32x1_1x32x1x8_8_1x1_intrawave_v3,1185.31,779.47,0.0
gfx950,256,5105,9216,2048,ck,0,0,159.0798,a8w8_blockscale_1x128x128_256x128x128x128_16x16_32x32_2x2_8x32x1_8x32x1_1x32x1x8_8_1x1_intrawave_v3,1211.39,775.87,0.0
gfx950,256,5121,9216,2048,ck,0,0,160.339,a8w8_blockscale_1x128x128_256x128x128x128_16x16_32x32_2x2_8x32x1_8x32x1_1x32x1x8_8_1x1_intrawave_v3,1205.64,771.82,0.0
gfx950,256,5123,9216,2048,ck,0,0,159.3074,a8w8_blockscale_1x128x128_256x128x128x128_16x16_32x32_2x2_8x32x1_8x32x1_1x32x1x8_8_1x1_intrawave_v3,1213.92,777.07,0.0
gfx950,256,5131,9216,2048,ck,0,0,160.3578,a8w8_blockscale_1x128x128_256x128x128x128_16x16_32x32_2x2_8x32x1_8x32x1_1x32x1x8_8_1x1_intrawave_v3,1207.85,773.0,0.0
gfx950,256,5427,9216,2048,ck,0,0,171.0051,a8w8_blockscale_1x128x128_256x128x128x128_16x16_32x32_2x2_8x32x1_8x32x1_1x32x1x8_8_1x1_intrawave_v3,1197.99,760.32,0.0
gfx950,256,6113,9216,2048,ck,0,0,185.1636,a8w8_blockscale_1x128x128_256x128x128x128_16x16_32x32_2x2_8x32x1_8x32x1_1x32x1x8_8_1x1_intrawave_v3,1246.24,778.06,0.0
gfx950,256,6197,9216,2048,ck,0,0,185.7196,a8w8_blockscale_1x128x128_256x128x128x128_16x16_32x32_2x2_8x32x1_8x32x1_1x32x1x8_8_1x1_intrawave_v3,1259.58,784.99,0.0
gfx950,256,6409,9216,2048,ck,0,0,193.3001,a8w8_blockscale_1x128x128_256x128x128x128_16x16_32x32_2x2_8x32x1_8x32x1_1x32x1x8_8_1x1_intrawave_v3,1251.59,776.67,0.0
gfx950,256,7121,9216,2048,ck,0,0,208.5691,a8w8_blockscale_1x128x128_256x128x128x128_16x16_32x32_2x2_8x32x1_8x32x1_1x32x1x8_8_1x1_intrawave_v3,1288.82,789.73,0.0
gfx950,256,7168,9216,2048,ck,0,0,204.8323,a8w8_blockscale_1x128x128_256x128x128x128_16x16_32x32_2x2_8x32x1_8x32x1_1x32x1x8_8_1x1_intrawave_v3,1321.0,808.83,0.0
gfx950,256,7169,9216,2048,ck,0,0,216.3797,a8w8_blockscale_1x128x128_256x128x128x128_16x16_32x32_2x2_8x32x1_8x32x1_1x32x1x8_8_1x1_intrawave_v3,1250.68,765.76,0.0
gfx950,256,7172,9216,2048,ck,0,0,216.7126,a8w8_blockscale_1x128x128_256x128x128x128_16x16_32x32_2x2_8x32x1_8x32x1_1x32x1x8_8_1x1_intrawave_v3,1249.28,764.87,0.0
gfx950,256,7176,9216,2048,ck,0,0,217.515,a8w8_blockscale_1x128x128_256x128x128x128_16x16_32x32_2x2_8x32x1_8x32x1_1x32x1x8_8_1x1_intrawave_v3,1245.36,762.42,0.0
gfx950,256,7177,9216,2048,ck,0,0,215.3397,a8w8_blockscale_1x128x128_256x128x128x128_16x16_32x32_2x2_8x32x1_8x32x1_1x32x1x8_8_1x1_intrawave_v3,1258.12,770.22,0.0
gfx950,256,7178,9216,2048,ck,0,0,215.5769,a8w8_blockscale_1x128x128_256x128x128x128_16x16_32x32_2x2_8x32x1_8x32x1_1x32x1x8_8_1x1_intrawave_v3,1256.91,769.47,0.0
gfx950,256,7179,9216,2048,ck,0,0,216.5853,a8w8_blockscale_1x128x128_256x128x128x128_16x16_32x32_2x2_8x32x1_8x32x1_1x32x1x8_8_1x1_intrawave_v3,1251.23,765.98,0.0
gfx950,256,7183,9216,2048,ck,0,0,216.6526,a8w8_blockscale_1x128x128_256x128x128x128_16x16_32x32_2x2_8x32x1_8x32x1_1x32x1x8_8_1x1_intrawave_v3,1251.54,766.12,0.0
gfx950,256,7184,9216,2048,ck,0,0,217.2934,a8w8_blockscale_1x128x128_256x128x128x128_16x16_32x32_2x2_8x32x1_8x32x1_1x32x1x8_8_1x1_intrawave_v3,1248.02,763.96,0.0
gfx950,256,7209,9216,2048,ck,0,0,217.7753,a8w8_blockscale_1x128x128_256x128x128x128_16x16_32x32_2x2_8x32x1_8x32x1_1x32x1x8_8_1x1_intrawave_v3,1249.59,764.62,0.0
gfx950,256,7210,9216,2048,ck,0,0,215.6277,a8w8_blockscale_1x128x128_256x128x128x128_16x16_32x32_2x2_8x32x1_8x32x1_1x32x1x8_8_1x1_intrawave_v3,1262.21,772.33,0.0
gfx950,256,7211,9216,2048,ck,0,0,215.5929,a8w8_blockscale_1x128x128_256x128x128x128_16x16_32x32_2x2_8x32x1_8x32x1_1x32x1x8_8_1x1_intrawave_v3,1262.59,772.55,0.0
gfx950,256,7217,9216,2048,ck,0,0,218.2997,a8w8_blockscale_1x128x128_256x128x128x128_16x16_32x32_2x2_8x32x1_8x32x1_1x32x1x8_8_1x1_intrawave_v3,1247.98,763.53,0.0
gfx950,256,7273,9216,2048,ck,0,0,215.6637,a8w8_blockscale_1x128x128_256x128x128x128_16x16_32x32_2x2_8x32x1_8x32x1_1x32x1x8_8_1x1_intrawave_v3,1273.03,778.18,0.0
gfx950,256,7274,9216,2048,ck,0,0,216.2029,a8w8_blockscale_1x128x128_256x128x128x128_16x16_32x32_2x2_8x32x1_8x32x1_1x32x1x8_8_1x1_intrawave_v3,1270.03,776.34,0.0
gfx950,256,7391,9216,2048,ck,0,0,218.2541,a8w8_blockscale_1x128x128_256x128x128x128_16x16_32x32_2x2_8x32x1_8x32x1_1x32x1x8_8_1x1_intrawave_v3,1278.33,780.02,0.0
gfx950,256,7393,9216,2048,ck,0,0,218.3113,a8w8_blockscale_1x128x128_256x128x128x128_16x16_32x32_2x2_8x32x1_8x32x1_1x32x1x8_8_1x1_intrawave_v3,1278.34,780.0,0.0
gfx950,256,7715,9216,2048,ck,0,0,228.7924,a8w8_blockscale_1x128x128_256x128x128x128_16x16_32x32_2x2_8x32x1_8x32x1_1x32x1x8_8_1x1_intrawave_v3,1272.91,773.09,0.0
gfx950,256,7753,9216,2048,ck,0,0,230.243,a8w8_blockscale_1x128x128_256x128x128x128_16x16_32x32_2x2_8x32x1_8x32x1_1x32x1x8_8_1x1_intrawave_v3,1271.12,771.6,0.0
gfx950,256,7819,9216,2048,ck,0,0,230.3066,a8w8_blockscale_1x128x128_256x128x128x128_16x16_32x32_2x2_8x32x1_8x32x1_1x32x1x8_8_1x1_intrawave_v3,1281.58,777.26,0.0
gfx950,256,8099,9216,2048,ck,0,0,237.5371,a8w8_blockscale_1x128x128_256x128x128x128_16x16_32x32_2x2_8x32x1_8x32x1_1x32x1x8_8_1x1_intrawave_v3,1287.07,777.74,0.0
gfx950,256,8129,9216,2048,ck,0,0,237.5914,a8w8_blockscale_1x128x128_256x128x128x128_16x16_32x32_2x2_8x32x1_8x32x1_1x32x1x8_8_1x1_intrawave_v3,1291.54,780.15,0.0
gfx950,256,8188,9216,2048,ck,0,0,238.1498,a8w8_blockscale_1x128x128_256x128x128x128_16x16_32x32_2x2_8x32x1_8x32x1_1x32x1x8_8_1x1_intrawave_v3,1297.87,783.39,0.0
gfx950,256,8192,9216,2048,ck,0,0,233.4534,a8w8_blockscale_1x128x128_256x128x128x128_16x16_32x32_2x2_8x32x1_8x32x1_1x32x1x8_8_1x1_intrawave_v3,1324.62,799.5,0.0
gfx950,256,1,12288,2048,ck,8,0,8.3342,a8w8_blockscale_1x128x128_256x16x64x256_16x16_16x16_1x1_16x16x1_16x16x1_1x16x1x16_4_1x1_intrawave_v1,6.04,3022.78,0.0
gfx950,256,2,12288,2048,ck,8,0,8.4093,a8w8_blockscale_1x128x128_256x16x64x256_16x16_16x16_1x1_16x16x1_16x16x1_1x16x1x16_4_1x1_intrawave_v1,11.97,2998.95,0.0
gfx950,256,4,12288,2048,ck,8,0,8.4632,a8w8_blockscale_1x128x128_256x16x64x256_16x16_16x16_1x1_16x16x1_16x16x1_1x16x1x16_4_1x1_intrawave_v1,23.79,2986.14,0.0
gfx950,256,8,12288,2048,ck,8,0,8.436,a8w8_blockscale_1x128x128_256x16x64x256_16x16_16x16_1x1_16x16x1_16x16x1_1x16x1x16_4_1x1_intrawave_v1,47.73,3008.39,0.0
gfx950,256,16,12288,2048,ck,8,0,8.3293,a8w8_blockscale_1x128x128_256x16x64x256_16x16_16x16_1x1_16x16x1_16x16x1_1x16x1x16_4_1x1_intrawave_v1,96.68,3072.5,0.0
gfx950,256,32,12288,2048,ck,7,0,10.1718,a8w8_blockscale_1x128x128_256x16x128x256_16x16_16x16_1x2_16x16x1_16x16x1_1x16x1x16_8_1x2_intrawave_v1,158.34,2557.84,0.0
gfx950,256,48,12288,2048,ck,18,0,11.3212,a8w8_blockscale_1x128x128_256x64x64x256_16x16_32x32_1x1_16x16x1_16x16x1_1x32x1x8_8_1x1_intrawave_v1,213.4,2335.78,0.0
gfx950,256,64,12288,2048,ck,18,0,10.236,a8w8_blockscale_1x128x128_256x64x64x256_16x16_32x32_1x1_16x16x1_16x16x1_1x32x1x8_8_1x1_intrawave_v1,314.7,2625.03,0.0
gfx950,256,80,12288,2048,ck,5,0,15.6019,a8w8_blockscale_1x128x128_256x16x128x128_8x16_16x16_1x2_16x16x1_8x32x1_1x16x1x16_8_1x2_intrawave_v1,258.08,1749.51,0.0
gfx950,256,96,12288,2048,ck,2,0,15.7637,a8w8_blockscale_1x128x128_256x64x128x128_16x16_32x32_1x2_8x32x1_8x32x1_1x32x1x8_8_1x1_intrawave_v3,306.52,1758.58,0.0
gfx950,256,112,12288,2048,ck,2,0,15.9709,a8w8_blockscale_1x128x128_256x64x128x128_16x16_32x32_1x2_8x32x1_8x32x1_1x32x1x8_8_1x1_intrawave_v3,352.96,1762.44,0.0
gfx950,256,128,12288,2048,ck,2,0,15.8547,a8w8_blockscale_1x128x128_256x64x128x128_16x16_32x32_1x2_8x32x1_8x32x1_1x32x1x8_8_1x1_intrawave_v3,406.34,1802.22,0.0
gfx950,256,256,12288,2048,ck,0,0,20.0756,a8w8_blockscale_1x128x128_256x128x128x128_16x16_32x32_2x2_8x32x1_8x32x1_1x32x1x8_8_1x1_intrawave_v3,641.82,1593.06,0.0
gfx950,256,512,12288,2048,ck,2,0,31.3372,a8w8_blockscale_1x128x128_256x64x128x128_16x16_32x32_1x2_8x32x1_8x32x1_1x32x1x8_8_1x1_intrawave_v3,822.34,1238.06,0.0
gfx950,256,667,12288,2048,ck,0,0,45.3087,a8w8_blockscale_1x128x128_256x128x128x128_16x16_32x32_2x2_8x32x1_8x32x1_1x32x1x8_8_1x1_intrawave_v3,740.94,947.37,0.0
gfx950,256,671,12288,2048,ck,0,0,44.8919,a8w8_blockscale_1x128x128_256x128x128x128_16x16_32x32_2x2_8x32x1_8x32x1_1x32x1x8_8_1x1_intrawave_v3,752.31,958.54,0.0
gfx950,256,931,12288,2048,ck,0,0,49.081,a8w8_blockscale_1x128x128_256x128x128x128_16x16_32x32_2x2_8x32x1_8x32x1_1x32x1x8_8_1x1_intrawave_v3,954.72,1017.76,0.0
gfx950,256,1024,12288,2048,ck,0,0,49.9526,a8w8_blockscale_1x128x128_256x128x128x128_16x16_32x32_2x2_8x32x1_8x32x1_1x32x1x8_8_1x1_intrawave_v3,1031.77,1049.57,0.0
gfx950,256,1025,12288,2048,ck,0,0,59.3774,a8w8_blockscale_1x128x128_256x128x128x128_16x16_32x32_2x2_8x32x1_8x32x1_1x32x1x8_8_1x1_intrawave_v3,868.85,883.42,0.0
gfx950,256,1027,12288,2048,ck,0,0,59.3618,a8w8_blockscale_1x128x128_256x128x128x128_16x16_32x32_2x2_8x32x1_8x32x1_1x32x1x8_8_1x1_intrawave_v3,870.77,884.55,0.0
gfx950,256,1031,12288,2048,ck,0,0,58.6186,a8w8_blockscale_1x128x128_256x128x128x128_16x16_32x32_2x2_8x32x1_8x32x1_1x32x1x8_8_1x1_intrawave_v3,885.25,897.58,0.0
gfx950,256,1039,12288,2048,ck,0,0,59.5742,a8w8_blockscale_1x128x128_256x128x128x128_16x16_32x32_2x2_8x32x1_8x32x1_1x32x1x8_8_1x1_intrawave_v3,877.81,886.76,0.0
gfx950,256,1040,12288,2048,ck,0,0,59.0079,a8w8_blockscale_1x128x128_256x128x128x128_16x16_32x32_2x2_8x32x1_8x32x1_1x32x1x8_8_1x1_intrawave_v3,887.08,895.72,0.0
gfx950,256,1041,12288,2048,ck,0,0,58.4982,a8w8_blockscale_1x128x128_256x128x128x128_16x16_32x32_2x2_8x32x1_8x32x1_1x32x1x8_8_1x1_intrawave_v3,895.67,903.98,0.0
gfx950,256,1072,12288,2048,ck,0,0,58.8546,a8w8_blockscale_1x128x128_256x128x128x128_16x16_32x32_2x2_8x32x1_8x32x1_1x32x1x8_8_1x1_intrawave_v3,916.76,912.53,0.0
gfx950,256,1073,12288,2048,ck,0,0,59.5434,a8w8_blockscale_1x128x128_256x128x128x128_16x16_32x32_2x2_8x32x1_8x32x1_1x32x1x8_8_1x1_intrawave_v3,907.0,902.42,0.0
gfx950,256,1077,12288,2048,ck,0,0,58.7728,a8w8_blockscale_1x128x128_256x128x128x128_16x16_32x32_2x2_8x32x1_8x32x1_1x32x1x8_8_1x1_intrawave_v3,922.32,916.07,0.0
gfx950,256,1091,12288,2048,ck,0,0,58.7958,a8w8_blockscale_1x128x128_256x128x128x128_16x16_32x32_2x2_8x32x1_8x32x1_1x32x1x8_8_1x1_intrawave_v3,933.94,922.05,0.0
gfx950,256,1343,12288,2048,ck,0,0,72.0217,a8w8_blockscale_1x128x128_256x128x128x128_16x16_32x32_2x2_8x32x1_8x32x1_1x32x1x8_8_1x1_intrawave_v3,938.54,845.88,0.0
gfx950,256,1688,12288,2048,ck,0,0,84.6532,a8w8_blockscale_1x128x128_256x128x128x128_16x16_32x32_2x2_8x32x1_8x32x1_1x32x1x8_8_1x1_intrawave_v3,1003.62,828.17,0.0
gfx950,256,2017,12288,2048,ck,0,0,91.4645,a8w8_blockscale_1x128x128_256x128x128x128_16x16_32x32_2x2_8x32x1_8x32x1_1x32x1x8_8_1x1_intrawave_v3,1109.93,862.26,0.0
gfx950,256,2048,12288,2048,ck,0,0,89.5085,a8w8_blockscale_1x128x128_256x128x128x128_16x16_32x32_2x2_8x32x1_8x32x1_1x32x1x8_8_1x1_intrawave_v3,1151.61,890.33,0.0
gfx950,256,2050,12288,2048,ck,0,0,99.0973,a8w8_blockscale_1x128x128_256x128x128x128_16x16_32x32_2x2_8x32x1_8x32x1_1x32x1x8_8_1x1_intrawave_v3,1041.2,804.71,0.0
gfx950,256,2063,12288,2048,ck,0,0,100.2977,a8w8_blockscale_1x128x128_256x128x128x128_16x16_32x32_2x2_8x32x1_8x32x1_1x32x1x8_8_1x1_intrawave_v3,1035.26,798.53,0.0
gfx950,256,2064,12288,2048,ck,0,0,99.0549,a8w8_blockscale_1x128x128_256x128x128x128_16x16_32x32_2x2_8x32x1_8x32x1_1x32x1x8_8_1x1_intrawave_v3,1048.76,808.82,0.0
gfx950,256,2099,12288,2048,ck,0,0,99.3747,a8w8_blockscale_1x128x128_256x128x128x128_16x16_32x32_2x2_8x32x1_8x32x1_1x32x1x8_8_1x1_intrawave_v3,1063.11,815.6,0.0
gfx950,256,2159,12288,2048,ck,0,0,100.6337,a8w8_blockscale_1x128x128_256x128x128x128_16x16_32x32_2x2_8x32x1_8x32x1_1x32x1x8_8_1x1_intrawave_v3,1079.82,821.27,0.0
gfx950,256,2160,12288,2048,ck,0,0,100.0469,a8w8_blockscale_1x128x128_256x128x128x128_16x16_32x32_2x2_8x32x1_8x32x1_1x32x1x8_8_1x1_intrawave_v3,1086.65,826.35,0.0
gfx950,256,2313,12288,2048,ck,0,0,108.2774,a8w8_blockscale_1x128x128_256x128x128x128_16x16_32x32_2x2_8x32x1_8x32x1_1x32x1x8_8_1x1_intrawave_v3,1075.17,801.16,0.0
gfx950,256,2325,12288,2048,ck,0,0,109.7826,a8w8_blockscale_1x128x128_256x128x128x128_16x16_32x32_2x2_8x32x1_8x32x1_1x32x1x8_8_1x1_intrawave_v3,1065.93,793.08,0.0
gfx950,256,3072,12288,2048,ck,0,0,125.9196,a8w8_blockscale_1x128x128_256x128x128x128_16x16_32x32_2x2_8x32x1_8x32x1_1x32x1x8_8_1x1_intrawave_v3,1227.92,849.39,0.0
gfx950,256,3073,12288,2048,ck,0,0,134.8104,a8w8_blockscale_1x128x128_256x128x128x128_16x16_32x32_2x2_8x32x1_8x32x1_1x32x1x8_8_1x1_intrawave_v3,1147.31,793.57,0.0
gfx950,256,3182,12288,2048,ck,0,0,134.8572,a8w8_blockscale_1x128x128_256x128x128x128_16x16_32x32_2x2_8x32x1_8x32x1_1x32x1x8_8_1x1_intrawave_v3,1187.59,814.81,0.0
gfx950,256,3183,12288,2048,ck,0,0,135.3124,a8w8_blockscale_1x128x128_256x128x128x128_16x16_32x32_2x2_8x32x1_8x32x1_1x32x1x8_8_1x1_intrawave_v3,1183.97,812.27,0.0
gfx950,256,3847,12288,2048,ck,0,0,164.7438,a8w8_blockscale_1x128x128_256x128x128x128_16x16_32x32_2x2_8x32x1_8x32x1_1x32x1x8_8_1x1_intrawave_v3,1175.31,774.47,0.0
gfx950,256,4096,12288,2048,ck,0,0,165.5794,a8w8_blockscale_1x128x128_256x128x128x128_16x16_32x32_2x2_8x32x1_8x32x1_1x32x1x8_8_1x1_intrawave_v3,1245.07,810.59,0.0
gfx950,256,4111,12288,2048,ck,0,0,174.8183,a8w8_blockscale_1x128x128_256x128x128x128_16x16_32x32_2x2_8x32x1_8x32x1_1x32x1x8_8_1x1_intrawave_v3,1183.59,770.04,0.0
gfx950,256,4141,12288,2048,ck,0,0,175.9918,a8w8_blockscale_1x128x128_256x128x128x128_16x16_32x32_2x2_8x32x1_8x32x1_1x32x1x8_8_1x1_intrawave_v3,1184.28,769.44,0.0
gfx950,256,4142,12288,2048,ck,0,0,176.0492,a8w8_blockscale_1x128x128_256x128x128x128_16x16_32x32_2x2_8x32x1_8x32x1_1x32x1x8_8_1x1_intrawave_v3,1184.18,769.34,0.0
gfx950,256,4345,12288,2048,ck,0,0,178.6404,a8w8_blockscale_1x128x128_256x128x128x128_16x16_32x32_2x2_8x32x1_8x32x1_1x32x1x8_8_1x1_intrawave_v3,1224.2,788.44,0.0
gfx950,256,5105,12288,2048,ck,0,0,198.3469,a8w8_blockscale_1x128x128_256x128x128x128_16x16_32x32_2x2_8x32x1_8x32x1_1x32x1x8_8_1x1_intrawave_v3,1295.42,812.12,0.0
gfx950,256,5121,12288,2048,ck,0,0,205.7142,a8w8_blockscale_1x128x128_256x128x128x128_16x16_32x32_2x2_8x32x1_8x32x1_1x32x1x8_8_1x1_intrawave_v3,1252.94,785.11,0.0
gfx950,256,5123,12288,2048,ck,0,0,207.7914,a8w8_blockscale_1x128x128_256x128x128x128_16x16_32x32_2x2_8x32x1_8x32x1_1x32x1x8_8_1x1_intrawave_v3,1240.9,777.51,0.0
gfx950,256,5131,12288,2048,ck,0,0,205.5874,a8w8_blockscale_1x128x128_256x128x128x128_16x16_32x32_2x2_8x32x1_8x32x1_1x32x1x8_8_1x1_intrawave_v3,1256.16,786.88,0.0
gfx950,256,5427,12288,2048,ck,0,0,217.7807,a8w8_blockscale_1x128x128_256x128x128x128_16x16_32x32_2x2_8x32x1_8x32x1_1x32x1x8_8_1x1_intrawave_v3,1254.24,779.01,0.0
gfx950,256,6113,12288,2048,ck,0,0,236.8268,a8w8_blockscale_1x128x128_256x128x128x128_16x16_32x32_2x2_8x32x1_8x32x1_1x32x1x8_8_1x1_intrawave_v3,1299.17,793.48,0.0
gfx950,256,6197,12288,2048,ck,0,0,249.0549,a8w8_blockscale_1x128x128_256x128x128x128_16x16_32x32_2x2_8x32x1_8x32x1_1x32x1x8_8_1x1_intrawave_v3,1252.36,763.51,0.0
gfx950,256,6409,12288,2048,ck,0,0,252.1594,a8w8_blockscale_1x128x128_256x128x128x128_16x16_32x32_2x2_8x32x1_8x32x1_1x32x1x8_8_1x1_intrawave_v3,1279.25,776.49,0.0
gfx950,256,7121,12288,2048,ck,0,0,270.7273,a8w8_blockscale_1x128x128_256x128x128x128_16x16_32x32_2x2_8x32x1_8x32x1_1x32x1x8_8_1x1_intrawave_v3,1323.88,793.25,0.0
gfx950,256,7168,12288,2048,ck,0,0,263.7712,a8w8_blockscale_1x128x128_256x128x128x128_16x16_32x32_2x2_8x32x1_8x32x1_1x32x1x8_8_1x1_intrawave_v3,1367.77,818.92,0.0
gfx950,256,7169,12288,2048,ck,0,0,276.6067,a8w8_blockscale_1x128x128_256x128x128x128_16x16_32x32_2x2_8x32x1_8x32x1_1x32x1x8_8_1x1_intrawave_v3,1304.48,781.01,0.0
gfx950,256,7172,12288,2048,ck,0,0,276.4855,a8w8_blockscale_1x128x128_256x128x128x128_16x16_32x32_2x2_8x32x1_8x32x1_1x32x1x8_8_1x1_intrawave_v3,1305.6,781.64,0.0
gfx950,256,7176,12288,2048,ck,0,0,276.9045,a8w8_blockscale_1x128x128_256x128x128x128_16x16_32x32_2x2_8x32x1_8x32x1_1x32x1x8_8_1x1_intrawave_v3,1304.35,780.85,0.0
gfx950,256,7177,12288,2048,ck,0,0,276.3145,a8w8_blockscale_1x128x128_256x128x128x128_16x16_32x32_2x2_8x32x1_8x32x1_1x32x1x8_8_1x1_intrawave_v3,1307.32,782.61,0.0
gfx950,256,7178,12288,2048,ck,0,0,274.9284,a8w8_blockscale_1x128x128_256x128x128x128_16x16_32x32_2x2_8x32x1_8x32x1_1x32x1x8_8_1x1_intrawave_v3,1314.09,786.65,0.0
gfx950,256,7179,12288,2048,ck,0,0,275.0112,a8w8_blockscale_1x128x128_256x128x128x128_16x16_32x32_2x2_8x32x1_8x32x1_1x32x1x8_8_1x1_intrawave_v3,1313.88,786.51,0.0
gfx950,256,7183,12288,2048,ck,0,0,276.8555,a8w8_blockscale_1x128x128_256x128x128x128_16x16_32x32_2x2_8x32x1_8x32x1_1x32x1x8_8_1x1_intrawave_v3,1305.85,781.66,0.0
gfx950,256,7184,12288,2048,ck,0,0,276.9199,a8w8_blockscale_1x128x128_256x128x128x128_16x16_32x32_2x2_8x32x1_8x32x1_1x32x1x8_8_1x1_intrawave_v3,1305.73,781.57,0.0
gfx950,256,7209,12288,2048,ck,0,0,276.5888,a8w8_blockscale_1x128x128_256x128x128x128_16x16_32x32_2x2_8x32x1_8x32x1_1x32x1x8_8_1x1_intrawave_v3,1311.84,784.91,0.0
gfx950,256,7210,12288,2048,ck,0,0,277.3151,a8w8_blockscale_1x128x128_256x128x128x128_16x16_32x32_2x2_8x32x1_8x32x1_1x32x1x8_8_1x1_intrawave_v3,1308.59,782.95,0.0
gfx950,256,7211,12288,2048,ck,0,0,276.6991,a8w8_blockscale_1x128x128_256x128x128x128_16x16_32x32_2x2_8x32x1_8x32x1_1x32x1x8_8_1x1_intrawave_v3,1311.68,784.79,0.0
gfx950,256,7217,12288,2048,ck,0,0,276.2414,a8w8_blockscale_1x128x128_256x128x128x128_16x16_32x32_2x2_8x32x1_8x32x1_1x32x1x8_8_1x1_intrawave_v3,1314.95,786.67,0.0
gfx950,256,7273,12288,2048,ck,0,0,276.2505,a8w8_blockscale_1x128x128_256x128x128x128_16x16_32x32_2x2_8x32x1_8x32x1_1x32x1x8_8_1x1_intrawave_v3,1325.11,792.04,0.0
gfx950,256,7274,12288,2048,ck,0,0,276.5982,a8w8_blockscale_1x128x128_256x128x128x128_16x16_32x32_2x2_8x32x1_8x32x1_1x32x1x8_8_1x1_intrawave_v3,1323.63,791.14,0.0
gfx950,256,7391,12288,2048,ck,0,0,280.3303,a8w8_blockscale_1x128x128_256x128x128x128_16x16_32x32_2x2_8x32x1_8x32x1_1x32x1x8_8_1x1_intrawave_v3,1327.01,791.72,0.0
gfx950,256,7393,12288,2048,ck,0,0,277.2731,a8w8_blockscale_1x128x128_256x128x128x128_16x16_32x32_2x2_8x32x1_8x32x1_1x32x1x8_8_1x1_intrawave_v3,1342.0,800.64,0.0
gfx950,256,7715,12288,2048,ck,0,0,292.356,a8w8_blockscale_1x128x128_256x128x128x128_16x16_32x32_2x2_8x32x1_8x32x1_1x32x1x8_8_1x1_intrawave_v3,1328.2,788.66,0.0
gfx950,256,7753,12288,2048,ck,0,0,292.3895,a8w8_blockscale_1x128x128_256x128x128x128_16x16_32x32_2x2_8x32x1_8x32x1_1x32x1x8_8_1x1_intrawave_v3,1334.59,792.03,0.0
gfx950,256,7819,12288,2048,ck,0,0,301.8163,a8w8_blockscale_1x128x128_256x128x128x128_16x16_32x32_2x2_8x32x1_8x32x1_1x32x1x8_8_1x1_intrawave_v3,1303.92,773.12,0.0
gfx950,256,8099,12288,2048,ck,0,0,310.0403,a8w8_blockscale_1x128x128_256x128x128x128_16x16_32x32_2x2_8x32x1_8x32x1_1x32x1x8_8_1x1_intrawave_v3,1314.78,776.65,0.0
gfx950,256,8129,12288,2048,ck,0,0,311.0504,a8w8_blockscale_1x128x128_256x128x128x128_16x16_32x32_2x2_8x32x1_8x32x1_1x32x1x8_8_1x1_intrawave_v3,1315.37,776.7,0.0
gfx950,256,8188,12288,2048,ck,0,0,312.3673,a8w8_blockscale_1x128x128_256x128x128x128_16x16_32x32_2x2_8x32x1_8x32x1_1x32x1x8_8_1x1_intrawave_v3,1319.33,778.45,0.0
gfx950,256,8192,12288,2048,ck,0,0,306.442,a8w8_blockscale_1x128x128_256x128x128x128_16x16_32x32_2x2_8x32x1_8x32x1_1x32x1x8_8_1x1_intrawave_v3,1345.5,793.85,0.0
