aiter/configs/a8w8_blockscale_tuned_gemm.csv
cu_num,M,N,K,libtype,kernelId,splitK,us,kernelName,tflops,bw,errRatio
256,1,256,2048,ck,8,3,4.042,a8w8_blockscale_1x128x128_256x16x64x256_16x16_16x16_1x1_16x16x1_16x16x1_1x16x1x16_4_1x1_intrawave_v1,0.26,130.34,0.0
256,2,256,2048,ck,8,3,4.0853,a8w8_blockscale_1x128x128_256x16x64x256_16x16_16x16_1x1_16x16x1_16x16x1_1x16x1x16_4_1x1_intrawave_v1,0.51,129.59,0.0
256,4,256,2048,ck,8,3,4.172,a8w8_blockscale_1x128x128_256x16x64x256_16x16_16x16_1x1_16x16x1_16x16x1_1x16x1x16_4_1x1_intrawave_v1,1.01,128.12,0.0
256,8,256,2048,ck,8,3,4.1682,a8w8_blockscale_1x128x128_256x16x64x256_16x16_16x16_1x1_16x16x1_16x16x1_1x16x1x16_4_1x1_intrawave_v1,2.01,130.7,0.0
256,16,256,2048,ck,8,3,4.3588,a8w8_blockscale_1x128x128_256x16x64x256_16x16_16x16_1x1_16x16x1_16x16x1_1x16x1x16_4_1x1_intrawave_v1,3.85,129.68,0.0
256,32,256,2048,ck,8,3,4.6603,a8w8_blockscale_1x128x128_256x16x64x256_16x16_16x16_1x1_16x16x1_16x16x1_1x16x1x16_4_1x1_intrawave_v1,7.2,130.08,0.0
256,48,256,2048,ck,8,3,4.6065,a8w8_blockscale_1x128x128_256x16x64x256_16x16_16x16_1x1_16x16x1_16x16x1_1x16x1x16_4_1x1_intrawave_v1,10.93,140.49,0.0
256,64,256,2048,ck,8,2,4.7193,a8w8_blockscale_1x128x128_256x16x64x256_16x16_16x16_1x1_16x16x1_16x16x1_1x16x1x16_4_1x1_intrawave_v1,14.22,145.81,0.0
256,80,256,2048,ck,8,3,4.6899,a8w8_blockscale_1x128x128_256x16x64x256_16x16_16x16_1x1_16x16x1_16x16x1_1x16x1x16_4_1x1_intrawave_v1,17.89,155.46,0.0
256,96,256,2048,ck,8,2,4.8393,a8w8_blockscale_1x128x128_256x16x64x256_16x16_16x16_1x1_16x16x1_16x16x1_1x16x1x16_4_1x1_intrawave_v1,20.8,159.12,0.0
256,112,256,2048,ck,6,3,4.7333,a8w8_blockscale_1x128x128_256x16x64x128_8x16_16x16_1x1_16x16x1_8x32x1_1x16x1x16_4_1x1_intrawave_v1,24.81,171.34,0.0
256,128,256,2048,ck,8,3,4.8856,a8w8_blockscale_1x128x128_256x16x64x256_16x16_16x16_1x1_16x16x1_16x16x1_1x16x1x16_4_1x1_intrawave_v1,27.47,174.38,0.0
256,256,256,2048,ck,8,2,5.0506,a8w8_blockscale_1x128x128_256x16x64x256_16x16_16x16_1x1_16x16x1_16x16x1_1x16x1x16_4_1x1_intrawave_v1,53.15,233.57,0.0
256,512,256,2048,ck,8,2,6.0026,a8w8_blockscale_1x128x128_256x16x64x256_16x16_16x16_1x1_16x16x1_16x16x1_1x16x1x16_4_1x1_intrawave_v1,89.44,305.7,0.0
256,588,256,2048,ck,8,2,6.6872,a8w8_blockscale_1x128x128_256x16x64x256_16x16_16x16_1x1_16x16x1_16x16x1_1x16x1x16_4_1x1_intrawave_v1,92.2,303.5,0.0
256,773,256,2048,ck,8,2,7.496,a8w8_blockscale_1x128x128_256x16x64x256_16x16_16x16_1x1_16x16x1_16x16x1_1x16x1x16_4_1x1_intrawave_v1,108.13,333.93,0.0
256,822,256,2048,ck,8,0,7.8287,a8w8_blockscale_1x128x128_256x16x64x256_16x16_16x16_1x1_16x16x1_16x16x1_1x16x1x16_4_1x1_intrawave_v1,110.1,335.77,0.0
256,1024,256,2048,ck,8,0,7.7417,a8w8_blockscale_1x128x128_256x16x64x256_16x16_16x16_1x1_16x16x1_16x16x1_1x16x1x16_4_1x1_intrawave_v1,138.7,406.34,0.0
256,1025,256,2048,ck,8,2,8.5354,a8w8_blockscale_1x128x128_256x16x64x256_16x16_16x16_1x1_16x16x1_16x16x1_1x16x1x16_4_1x1_intrawave_v1,125.92,368.85,0.0
256,1027,256,2048,ck,8,2,8.5781,a8w8_blockscale_1x128x128_256x16x64x256_16x16_16x16_1x1_16x16x1_16x16x1_1x16x1x16_4_1x1_intrawave_v1,125.54,367.61,0.0
256,1042,256,2048,ck,8,2,8.6565,a8w8_blockscale_1x128x128_256x16x64x256_16x16_16x16_1x1_16x16x1_16x16x1_1x16x1x16_4_1x1_intrawave_v1,126.22,368.72,0.0
256,1051,256,2048,ck,8,2,8.6506,a8w8_blockscale_1x128x128_256x16x64x256_16x16_16x16_1x1_16x16x1_16x16x1_1x16x1x16_4_1x1_intrawave_v1,127.4,371.63,0.0
256,1055,256,2048,ck,8,2,8.6112,a8w8_blockscale_1x128x128_256x16x64x256_16x16_16x16_1x1_16x16x1_16x16x1_1x16x1x16_4_1x1_intrawave_v1,128.47,374.52,0.0
256,1057,256,2048,ck,8,2,8.7165,a8w8_blockscale_1x128x128_256x16x64x256_16x16_16x16_1x1_16x16x1_16x16x1_1x16x1x16_4_1x1_intrawave_v1,127.15,370.59,0.0
256,1069,256,2048,ck,8,2,8.7145,a8w8_blockscale_1x128x128_256x16x64x256_16x16_16x16_1x1_16x16x1_16x16x1_1x16x1x16_4_1x1_intrawave_v1,128.63,374.2,0.0
256,1072,256,2048,ck,8,2,8.5936,a8w8_blockscale_1x128x128_256x16x64x256_16x16_16x16_1x1_16x16x1_16x16x1_1x16x1x16_4_1x1_intrawave_v1,130.8,380.35,0.0
256,1074,256,2048,ck,8,2,8.7989,a8w8_blockscale_1x128x128_256x16x64x256_16x16_16x16_1x1_16x16x1_16x16x1_1x16x1x16_4_1x1_intrawave_v1,127.99,372.06,0.0
256,1091,256,2048,ck,8,2,8.8033,a8w8_blockscale_1x128x128_256x16x64x256_16x16_16x16_1x1_16x16x1_16x16x1_1x16x1x16_4_1x1_intrawave_v1,129.95,376.82,0.0
256,1128,256,2048,ck,8,2,9.0147,a8w8_blockscale_1x128x128_256x16x64x256_16x16_16x16_1x1_16x16x1_16x16x1_1x16x1x16_4_1x1_intrawave_v1,131.21,378.49,0.0
256,1136,256,2048,ck,8,2,9.0029,a8w8_blockscale_1x128x128_256x16x64x256_16x16_16x16_1x1_16x16x1_16x16x1_1x16x1x16_4_1x1_intrawave_v1,132.31,381.26,0.0
256,1514,256,2048,ck,7,0,9.3316,a8w8_blockscale_1x128x128_256x16x128x256_16x16_16x16_1x2_16x16x1_16x16x1_1x16x1x16_8_1x2_intrawave_v1,170.13,471.53,0.0
256,2017,256,2048,ck,7,0,9.3599,a8w8_blockscale_1x128x128_256x16x128x256_16x16_16x16_1x2_16x16x1_16x16x1_1x16x1x16_8_1x2_intrawave_v1,225.96,607.68,0.0
256,2048,256,2048,ck,7,0,9.4887,a8w8_blockscale_1x128x128_256x16x128x256_16x16_16x16_1x2_16x16x1_16x16x1_1x16x1x16_8_1x2_intrawave_v1,226.32,607.79,0.0
256,2151,256,2048,ck,18,0,11.2999,a8w8_blockscale_1x128x128_256x64x64x256_16x16_32x32_1x1_16x16x1_16x16x1_1x32x1x8_8_1x1_intrawave_v1,199.6,533.71,0.0
256,2332,256,2048,ck,18,0,11.3922,a8w8_blockscale_1x128x128_256x64x64x256_16x16_32x32_1x1_16x16x1_16x16x1_1x32x1x8_8_1x1_intrawave_v1,214.65,570.06,0.0
256,2341,256,2048,ck,18,0,11.0575,a8w8_blockscale_1x128x128_256x64x64x256_16x16_32x32_1x1_16x16x1_16x16x1_1x32x1x8_8_1x1_intrawave_v1,222.0,589.4,0.0
256,3072,256,2048,ck,18,0,10.4651,a8w8_blockscale_1x128x128_256x64x64x256_16x16_32x32_1x1_16x16x1_16x16x1_1x32x1x8_8_1x1_intrawave_v1,307.81,801.58,0.0
256,3073,256,2048,ck,18,0,11.6847,a8w8_blockscale_1x128x128_256x64x64x256_16x16_32x32_1x1_16x16x1_16x16x1_1x32x1x8_8_1x1_intrawave_v1,275.77,718.13,0.0
256,3089,256,2048,ck,18,0,11.7731,a8w8_blockscale_1x128x128_256x64x64x256_16x16_32x32_1x1_16x16x1_16x16x1_1x32x1x8_8_1x1_intrawave_v1,275.12,716.22,0.0
256,3110,256,2048,ck,18,0,11.3219,a8w8_blockscale_1x128x128_256x64x64x256_16x16_32x32_1x1_16x16x1_16x16x1_1x32x1x8_8_1x1_intrawave_v1,288.03,749.51,0.0
256,3137,256,2048,ck,18,0,11.3661,a8w8_blockscale_1x128x128_256x64x64x256_16x16_32x32_1x1_16x16x1_16x16x1_1x32x1x8_8_1x1_intrawave_v1,289.4,752.68,0.0
256,3613,256,2048,ck,18,0,11.6911,a8w8_blockscale_1x128x128_256x64x64x256_16x16_32x32_1x1_16x16x1_16x16x1_1x32x1x8_8_1x1_intrawave_v1,324.05,835.98,0.0
256,4096,256,2048,ck,18,0,10.0369,a8w8_blockscale_1x128x128_256x64x64x256_16x16_32x32_1x1_16x16x1_16x16x1_1x32x1x8_8_1x1_intrawave_v1,427.92,1096.96,0.0
256,4097,256,2048,ck,2,0,15.3583,a8w8_blockscale_1x128x128_256x64x128x128_16x16_32x32_1x2_8x32x1_8x32x1_1x32x1x8_8_1x1_intrawave_v3,279.72,717.05,0.0
256,4109,256,2048,ck,3,0,15.4069,a8w8_blockscale_1x128x128_256x64x64x128_16x16_32x32_1x1_8x32x1_8x32x1_1x32x1x8_8_1x1_intrawave_v3,279.65,716.78,0.0
256,4143,256,2048,ck,3,0,15.7207,a8w8_blockscale_1x128x128_256x64x64x128_16x16_32x32_1x1_8x32x1_8x32x1_1x32x1x8_8_1x1_intrawave_v3,276.34,708.01,0.0
256,4345,256,2048,ck,3,0,16.0543,a8w8_blockscale_1x128x128_256x64x64x128_16x16_32x32_1x1_8x32x1_8x32x1_1x32x1x8_8_1x1_intrawave_v3,283.79,725.51,0.0
256,4413,256,2048,ck,2,0,15.4838,a8w8_blockscale_1x128x128_256x64x128x128_16x16_32x32_1x2_8x32x1_8x32x1_1x32x1x8_8_1x1_intrawave_v3,298.85,763.48,0.0
256,5121,256,2048,ck,2,0,15.3629,a8w8_blockscale_1x128x128_256x64x128x128_16x16_32x32_1x2_8x32x1_8x32x1_1x32x1x8_8_1x1_intrawave_v3,349.53,887.47,0.0
256,5123,256,2048,ck,2,0,15.3394,a8w8_blockscale_1x128x128_256x64x128x128_16x16_32x32_1x2_8x32x1_8x32x1_1x32x1x8_8_1x1_intrawave_v3,350.2,889.16,0.0
256,5133,256,2048,ck,2,0,15.4125,a8w8_blockscale_1x128x128_256x64x128x128_16x16_32x32_1x2_8x32x1_8x32x1_1x32x1x8_8_1x1_intrawave_v3,349.22,886.6,0.0
256,5185,256,2048,ck,2,0,15.3921,a8w8_blockscale_1x128x128_256x64x128x128_16x16_32x32_1x2_8x32x1_8x32x1_1x32x1x8_8_1x1_intrawave_v3,353.22,896.43,0.0
256,5191,256,2048,ck,2,0,15.3133,a8w8_blockscale_1x128x128_256x64x128x128_16x16_32x32_1x2_8x32x1_8x32x1_1x32x1x8_8_1x1_intrawave_v3,355.45,902.04,0.0
256,6146,256,2048,ck,2,0,15.4666,a8w8_blockscale_1x128x128_256x64x128x128_16x16_32x32_1x2_8x32x1_8x32x1_1x32x1x8_8_1x1_intrawave_v3,416.68,1051.17,0.0
256,6147,256,2048,ck,2,0,15.4897,a8w8_blockscale_1x128x128_256x64x128x128_16x16_32x32_1x2_8x32x1_8x32x1_1x32x1x8_8_1x1_intrawave_v3,416.12,1049.77,0.0
256,6155,256,2048,ck,2,0,16.195,a8w8_blockscale_1x128x128_256x64x128x128_16x16_32x32_1x2_8x32x1_8x32x1_1x32x1x8_8_1x1_intrawave_v3,398.52,1005.32,0.0
256,6377,256,2048,ck,2,0,15.4772,a8w8_blockscale_1x128x128_256x64x128x128_16x16_32x32_1x2_8x32x1_8x32x1_1x32x1x8_8_1x1_intrawave_v3,432.04,1088.66,0.0
256,6401,256,2048,ck,2,0,15.594,a8w8_blockscale_1x128x128_256x64x128x128_16x16_32x32_1x2_8x32x1_8x32x1_1x32x1x8_8_1x1_intrawave_v3,430.42,1084.45,0.0
256,7121,256,2048,ck,2,0,15.6154,a8w8_blockscale_1x128x128_256x64x128x128_16x16_32x32_1x2_8x32x1_8x32x1_1x32x1x8_8_1x1_intrawave_v3,478.18,1201.0,0.0
256,7169,256,2048,ck,2,0,15.7111,a8w8_blockscale_1x128x128_256x64x128x128_16x16_32x32_1x2_8x32x1_8x32x1_1x32x1x8_8_1x1_intrawave_v3,478.47,1201.5,0.0
256,7170,256,2048,ck,2,0,15.6452,a8w8_blockscale_1x128x128_256x64x128x128_16x16_32x32_1x2_8x32x1_8x32x1_1x32x1x8_8_1x1_intrawave_v3,480.55,1206.73,0.0
256,7176,256,2048,ck,2,0,15.6791,a8w8_blockscale_1x128x128_256x64x128x128_16x16_32x32_1x2_8x32x1_8x32x1_1x32x1x8_8_1x1_intrawave_v3,479.91,1205.1,0.0
256,7177,256,2048,ck,2,0,15.6606,a8w8_blockscale_1x128x128_256x64x128x128_16x16_32x32_1x2_8x32x1_8x32x1_1x32x1x8_8_1x1_intrawave_v3,480.55,1206.68,0.0
256,7185,256,2048,ck,2,0,15.7413,a8w8_blockscale_1x128x128_256x64x128x128_16x16_32x32_1x2_8x32x1_8x32x1_1x32x1x8_8_1x1_intrawave_v3,478.61,1201.8,0.0
256,7206,256,2048,ck,2,0,15.6705,a8w8_blockscale_1x128x128_256x64x128x128_16x16_32x32_1x2_8x32x1_8x32x1_1x32x1x8_8_1x1_intrawave_v3,482.18,1210.66,0.0
256,7217,256,2048,ck,2,0,15.6474,a8w8_blockscale_1x128x128_256x64x128x128_16x16_32x32_1x2_8x32x1_8x32x1_1x32x1x8_8_1x1_intrawave_v3,483.63,1214.25,0.0
256,7257,256,2048,ck,2,0,15.7177,a8w8_blockscale_1x128x128_256x64x128x128_16x16_32x32_1x2_8x32x1_8x32x1_1x32x1x8_8_1x1_intrawave_v3,484.14,1215.33,0.0
256,7265,256,2048,ck,2,0,15.7101,a8w8_blockscale_1x128x128_256x64x128x128_16x16_32x32_1x2_8x32x1_8x32x1_1x32x1x8_8_1x1_intrawave_v3,484.9,1217.22,0.0
256,7393,256,2048,ck,2,0,15.782,a8w8_blockscale_1x128x128_256x64x128x128_16x16_32x32_1x2_8x32x1_8x32x1_1x32x1x8_8_1x1_intrawave_v3,491.2,1232.44,0.0
256,7461,256,2048,ck,2,0,15.6824,a8w8_blockscale_1x128x128_256x64x128x128_16x16_32x32_1x2_8x32x1_8x32x1_1x32x1x8_8_1x1_intrawave_v3,498.87,1251.37,0.0
256,7634,256,2048,ck,2,0,15.7945,a8w8_blockscale_1x128x128_256x64x128x128_16x16_32x32_1x2_8x32x1_8x32x1_1x32x1x8_8_1x1_intrawave_v3,506.81,1270.53,0.0
256,8129,256,2048,ck,2,0,15.8929,a8w8_blockscale_1x128x128_256x64x128x128_16x16_32x32_1x2_8x32x1_8x32x1_1x32x1x8_8_1x1_intrawave_v3,536.33,1342.39,0.0
256,8192,256,2048,ck,2,0,15.4117,a8w8_blockscale_1x128x128_256x64x128x128_16x16_32x32_1x2_8x32x1_8x32x1_1x32x1x8_8_1x1_intrawave_v3,557.36,1394.77,0.0
256,16384,256,2048,ck,0,0,20.9204,a8w8_blockscale_1x128x128_256x128x128x128_16x16_32x32_2x2_8x32x1_8x32x1_1x32x1x8_8_1x1_intrawave_v3,821.2,2029.95,0.0
256,32768,256,2048,ck,0,0,36.0124,a8w8_blockscale_1x128x128_256x128x128x128_16x16_32x32_2x2_8x32x1_8x32x1_1x32x1x8_8_1x1_intrawave_v3,954.11,2343.93,0.0
256,1,512,7168,ck,6,3,7.9253,a8w8_blockscale_1x128x128_256x16x64x128_8x16_16x16_1x1_16x16x1_8x32x1_1x16x1x16_4_1x1_intrawave_v1,0.93,464.11,0.0
256,2,512,7168,ck,6,3,7.8639,a8w8_blockscale_1x128x128_256x16x64x128_8x16_16x16_1x1_16x16x1_8x32x1_1x16x1x16_4_1x1_intrawave_v1,1.87,468.78,0.002
256,4,512,7168,ck,6,3,7.9401,a8w8_blockscale_1x128x128_256x16x64x128_8x16_16x16_1x1_16x16x1_8x32x1_1x16x1x16_4_1x1_intrawave_v1,3.7,466.34,0.0
256,8,512,7168,ck,6,3,7.994,a8w8_blockscale_1x128x128_256x16x64x128_8x16_16x16_1x1_16x16x1_8x32x1_1x16x1x16_4_1x1_intrawave_v1,7.35,467.29,0.002
256,16,512,7168,ck,6,3,8.3266,a8w8_blockscale_1x128x128_256x16x64x128_8x16_16x16_1x1_16x16x1_8x32x1_1x16x1x16_4_1x1_intrawave_v1,14.1,456.5,0.0005
256,32,512,7168,ck,6,3,8.8201,a8w8_blockscale_1x128x128_256x16x64x128_8x16_16x16_1x1_16x16x1_8x32x1_1x16x1x16_4_1x1_intrawave_v1,26.63,445.82,0.0008
256,64,512,7168,ck,6,3,8.7132,a8w8_blockscale_1x128x128_256x16x64x128_8x16_16x16_1x1_16x16x1_8x32x1_1x16x1x16_4_1x1_intrawave_v1,53.91,481.37,0.0009
256,128,512,7168,ck,8,2,9.5116,a8w8_blockscale_1x128x128_256x16x64x256_16x16_16x16_1x1_16x16x1_16x16x1_1x16x1x16_4_1x1_intrawave_v1,98.78,496.09,0.0
256,256,512,7168,ck,6,3,12.2737,a8w8_blockscale_1x128x128_256x16x64x128_8x16_16x16_1x1_16x16x1_8x32x1_1x16x1x16_4_1x1_intrawave_v1,153.1,469.88,0.0005
256,512,512,7168,ck,18,2,19.9887,a8w8_blockscale_1x128x128_256x64x64x256_16x16_32x32_1x1_16x16x1_16x16x1_1x32x1x8_8_1x1_intrawave_v1,188.01,393.44,0.0
256,1024,512,7168,ck,18,0,25.5008,a8w8_blockscale_1x128x128_256x64x64x256_16x16_32x32_1x1_16x16x1_16x16x1_1x32x1x8_8_1x1_intrawave_v1,294.74,472.87,0.0
256,1536,512,7168,ck,18,0,26.1831,a8w8_blockscale_1x128x128_256x64x64x256_16x16_32x32_1x1_16x16x1_16x16x1_1x32x1x8_8_1x1_intrawave_v1,430.59,620.74,0.0
256,2048,512,7168,ck,18,0,26.9192,a8w8_blockscale_1x128x128_256x64x64x256_16x16_32x32_1x1_16x16x1_16x16x1_1x32x1x8_8_1x1_intrawave_v1,558.43,759.58,0.0
256,4096,512,7168,ck,2,0,42.1664,a8w8_blockscale_1x128x128_256x64x128x128_16x16_32x32_1x2_8x32x1_8x32x1_1x32x1x8_8_1x1_intrawave_v3,713.0,882.8,0.0
256,8192,512,7168,ck,0,0,57.0242,a8w8_blockscale_1x128x128_256x128x128x128_16x16_32x32_2x2_8x32x1_8x32x1_1x32x1x8_8_1x1_intrawave_v3,1054.46,1241.21,0.0
256,16384,512,7168,ck,0,0,98.1646,a8w8_blockscale_1x128x128_256x128x128x128_16x16_32x32_2x2_8x32x1_8x32x1_1x32x1x8_8_1x1_intrawave_v3,1225.08,1404.66,0.0
256,20480,512,7168,cktile,27,0,105.1093,a8w8_blockscale_cktile_192x256x128_4x2x1_16x16x128_intrawave_0x1x0_2,1430.17,1631.08,0.0
256,32768,512,7168,ck,0,0,183.817,a8w8_blockscale_1x128x128_256x128x128x128_16x16_32x32_2x2_8x32x1_8x32x1_1x32x1x8_8_1x1_intrawave_v3,1308.47,1480.31,0.0
256,1,576,7168,ck,6,3,7.9453,a8w8_blockscale_1x128x128_256x16x64x128_8x16_16x16_1x1_16x16x1_8x32x1_1x16x1x16_4_1x1_intrawave_v1,1.04,520.7,0.0
256,2,576,7168,ck,6,3,7.9535,a8w8_blockscale_1x128x128_256x16x64x128_8x16_16x16_1x1_16x16x1_8x32x1_1x16x1x16_4_1x1_intrawave_v1,2.08,521.21,0.0
256,4,576,7168,ck,6,3,7.9276,a8w8_blockscale_1x128x128_256x16x64x128_8x16_16x16_1x1_16x16x1_8x32x1_1x16x1x16_4_1x1_intrawave_v1,4.17,525.01,0.0
256,8,576,7168,ck,6,3,8.0546,a8w8_blockscale_1x128x128_256x16x64x128_8x16_16x16_1x1_16x16x1_8x32x1_1x16x1x16_4_1x1_intrawave_v1,8.2,520.86,0.0002
256,16,576,7168,ck,6,3,8.8117,a8w8_blockscale_1x128x128_256x16x64x128_8x16_16x16_1x1_16x16x1_8x32x1_1x16x1x16_4_1x1_intrawave_v1,14.99,483.66,0.0002
256,32,576,7168,ck,6,3,8.9405,a8w8_blockscale_1x128x128_256x16x64x128_8x16_16x16_1x1_16x16x1_8x32x1_1x16x1x16_4_1x1_intrawave_v1,29.56,491.58,0.0007
256,64,576,7168,ck,6,3,9.0985,a8w8_blockscale_1x128x128_256x16x64x128_8x16_16x16_1x1_16x16x1_8x32x1_1x16x1x16_4_1x1_intrawave_v1,58.08,512.31,0.0007
256,128,576,7168,ck,6,3,10.3234,a8w8_blockscale_1x128x128_256x16x64x128_8x16_16x16_1x1_16x16x1_8x32x1_1x16x1x16_4_1x1_intrawave_v1,102.39,503.1,0.0009
256,256,576,7168,ck,18,2,13.3336,a8w8_blockscale_1x128x128_256x64x64x256_16x16_32x32_1x1_16x16x1_16x16x1_1x32x1x8_8_1x1_intrawave_v1,158.54,469.39,0.0
256,512,576,7168,ck,18,1,22.7353,a8w8_blockscale_1x128x128_256x64x64x256_16x16_32x32_1x1_16x16x1_16x16x1_1x32x1x8_8_1x1_intrawave_v1,185.96,368.97,0.0
256,1024,576,7168,ck,18,0,25.6383,a8w8_blockscale_1x128x128_256x64x64x256_16x16_32x32_1x1_16x16x1_16x16x1_1x32x1x8_8_1x1_intrawave_v1,329.81,493.34,0.0
256,1536,576,7168,ck,18,0,26.5039,a8w8_blockscale_1x128x128_256x64x64x256_16x16_32x32_1x1_16x16x1_16x16x1_1x32x1x8_8_1x1_intrawave_v1,478.56,637.95,0.0
256,2048,576,7168,ck,18,0,44.7311,a8w8_blockscale_1x128x128_256x64x64x256_16x16_32x32_1x1_16x16x1_16x16x1_1x32x1x8_8_1x1_intrawave_v1,378.07,473.23,0.0
256,4096,576,7168,ck,0,0,52.7099,a8w8_blockscale_1x128x128_256x128x128x128_16x16_32x32_2x2_8x32x1_8x32x1_1x32x1x8_8_1x1_intrawave_v3,641.68,724.86,0.0
256,8192,576,7168,ck,0,0,78.2665,a8w8_blockscale_1x128x128_256x128x128x128_16x16_32x32_2x2_8x32x1_8x32x1_1x32x1x8_8_1x1_intrawave_v3,864.3,923.59,0.0
256,16384,576,7168,ck,0,0,131.7904,a8w8_blockscale_1x128x128_256x128x128x128_16x16_32x32_2x2_8x32x1_8x32x1_1x32x1x8_8_1x1_intrawave_v3,1026.57,1065.66,0.0
256,20480,576,7168,ck,0,0,164.9048,a8w8_blockscale_1x128x128_256x128x128x128_16x16_32x32_2x2_8x32x1_8x32x1_1x32x1x8_8_1x1_intrawave_v3,1025.53,1058.32,0.0
256,32768,576,7168,cktile,28,0,236.4724,a8w8_blockscale_cktile_192x256x128_4x2x1_16x16x128_intrawave_0x1x0_3,1144.25,1170.36,0.0
256,1,1024,2048,ck,8,2,4.4324,a8w8_blockscale_1x128x128_256x16x64x256_16x16_16x16_1x1_16x16x1_16x16x1_1x16x1x16_4_1x1_intrawave_v1,0.95,474.07,0.0
256,1,1024,4096,ck,8,3,4.9743,a8w8_blockscale_1x128x128_256x16x64x256_16x16_16x16_1x1_16x16x1_16x16x1_1x16x1x16_4_1x1_intrawave_v1,1.69,844.43,0.0
256,2,1024,2048,ck,8,2,4.3489,a8w8_blockscale_1x128x128_256x16x64x256_16x16_16x16_1x1_16x16x1_16x16x1_1x16x1x16_4_1x1_intrawave_v1,1.93,484.11,0.0
256,2,1024,4096,ck,8,3,5.0646,a8w8_blockscale_1x128x128_256x16x64x256_16x16_16x16_1x1_16x16x1_16x16x1_1x16x1x16_4_1x1_intrawave_v1,3.31,830.59,0.0
256,4,1024,2048,ck,8,2,4.406,a8w8_blockscale_1x128x128_256x16x64x256_16x16_16x16_1x1_16x16x1_16x16x1_1x16x1x16_4_1x1_intrawave_v1,3.81,479.69,0.0
256,4,1024,4096,ck,8,3,5.0128,a8w8_blockscale_1x128x128_256x16x64x256_16x16_16x16_1x1_16x16x1_16x16x1_1x16x1x16_4_1x1_intrawave_v1,6.69,841.62,0.0
256,8,1024,2048,ck,8,3,4.3176,a8w8_blockscale_1x128x128_256x16x64x256_16x16_16x16_1x1_16x16x1_16x16x1_1x16x1x16_4_1x1_intrawave_v1,7.77,493.31,0.0
256,8,1024,4096,ck,8,3,5.1272,a8w8_blockscale_1x128x128_256x16x64x256_16x16_16x16_1x1_16x16x1_16x16x1_1x16x1x16_4_1x1_intrawave_v1,13.09,827.64,0.0
256,16,1024,2048,ck,8,3,4.4246,a8w8_blockscale_1x128x128_256x16x64x256_16x16_16x16_1x1_16x16x1_16x16x1_1x16x1x16_4_1x1_intrawave_v1,15.17,488.79,0.0
256,16,1024,4096,ck,8,3,5.4584,a8w8_blockscale_1x128x128_256x16x64x256_16x16_16x16_1x1_16x16x1_16x16x1_1x16x1x16_4_1x1_intrawave_v1,24.59,786.42,0.0
256,32,1024,2048,ck,8,3,5.0217,a8w8_blockscale_1x128x128_256x16x64x256_16x16_16x16_1x1_16x16x1_16x16x1_1x16x1x16_4_1x1_intrawave_v1,26.73,443.72,0.0
256,32,1024,4096,ck,8,3,5.8528,a8w8_blockscale_1x128x128_256x16x64x256_16x16_16x16_1x1_16x16x1_16x16x1_1x16x1x16_4_1x1_intrawave_v1,45.86,750.22,0.0
256,48,1024,2048,ck,8,2,5.0878,a8w8_blockscale_1x128x128_256x16x64x256_16x16_16x16_1x1_16x16x1_16x16x1_1x16x1x16_4_1x1_intrawave_v1,39.57,450.84,0.0
256,64,1024,2048,ck,8,2,5.314,a8w8_blockscale_1x128x128_256x16x64x256_16x16_16x16_1x1_16x16x1_16x16x1_1x16x1x16_4_1x1_intrawave_v1,50.51,443.98,0.0
256,64,1024,4096,ck,8,3,6.4631,a8w8_blockscale_1x128x128_256x16x64x256_16x16_16x16_1x1_16x16x1_16x16x1_1x16x1x16_4_1x1_intrawave_v1,83.07,709.8,0.0
256,80,1024,2048,ck,8,2,5.5964,a8w8_blockscale_1x128x128_256x16x64x256_16x16_16x16_1x1_16x16x1_16x16x1_1x16x1x16_4_1x1_intrawave_v1,59.96,433.28,0.0
256,96,1024,2048,ck,8,2,5.7042,a8w8_blockscale_1x128x128_256x16x64x256_16x16_16x16_1x1_16x16x1_16x16x1_1x16x1x16_4_1x1_intrawave_v1,70.59,436.58,0.0
256,112,1024,2048,ck,8,2,5.92,a8w8_blockscale_1x128x128_256x16x64x256_16x16_16x16_1x1_16x16x1_16x16x1_1x16x1x16_4_1x1_intrawave_v1,79.35,431.74,0.0
256,128,1024,2048,ck,8,2,5.9545,a8w8_blockscale_1x128x128_256x16x64x256_16x16_16x16_1x1_16x16x1_16x16x1_1x16x1x16_4_1x1_intrawave_v1,90.16,440.25,0.0
256,128,1024,4096,ck,8,3,8.3407,a8w8_blockscale_1x128x128_256x16x64x256_16x16_16x16_1x1_16x16x1_16x16x1_1x16x1x16_4_1x1_intrawave_v1,128.74,597.16,0.0
256,256,1024,2048,ck,8,0,7.6088,a8w8_blockscale_1x128x128_256x16x64x256_16x16_16x16_1x1_16x16x1_16x16x1_1x16x1x16_4_1x1_intrawave_v1,141.12,413.43,0.0
256,256,1024,4096,ck,8,3,11.9477,a8w8_blockscale_1x128x128_256x16x64x256_16x16_16x16_1x1_16x16x1_16x16x1_1x16x1x16_4_1x1_intrawave_v1,179.74,482.7,0.0
256,512,1024,2048,ck,7,0,9.4219,a8w8_blockscale_1x128x128_256x16x128x256_16x16_16x16_1x2_16x16x1_16x16x1_1x16x1x16_8_1x2_intrawave_v1,227.92,445.17,0.0
256,512,1024,4096,ck,18,0,15.9469,a8w8_blockscale_1x128x128_256x64x64x256_16x16_32x32_1x1_16x16x1_16x16x1_1x32x1x8_8_1x1_intrawave_v1,269.33,460.28,0.0
256,667,1024,2048,ck,18,0,10.8322,a8w8_blockscale_1x128x128_256x64x64x256_16x16_32x32_1x1_16x16x1_16x16x1_1x32x1x8_8_1x1_intrawave_v1,258.27,445.82,0.0
256,671,1024,2048,ck,18,0,10.6362,a8w8_blockscale_1x128x128_256x64x64x256_16x16_32x32_1x1_16x16x1_16x16x1_1x32x1x8_8_1x1_intrawave_v1,264.6,455.57,0.0
256,931,1024,2048,ck,18,0,11.6124,a8w8_blockscale_1x128x128_256x64x64x256_16x16_32x32_1x1_16x16x1_16x16x1_1x32x1x8_8_1x1_intrawave_v1,336.27,508.98,0.0
256,1024,1024,2048,ck,18,0,9.9506,a8w8_blockscale_1x128x128_256x64x64x256_16x16_32x32_1x1_16x16x1_16x16x1_1x32x1x8_8_1x1_intrawave_v1,431.63,632.27,0.0
256,1024,1024,4096,ck,18,0,16.8696,a8w8_blockscale_1x128x128_256x64x64x256_16x16_32x32_1x1_16x16x1_16x16x1_1x32x1x8_8_1x1_intrawave_v1,509.2,621.58,0.0
256,1025,1024,2048,ck,2,0,14.9274,a8w8_blockscale_1x128x128_256x64x128x128_16x16_32x32_1x2_8x32x1_8x32x1_1x32x1x8_8_1x1_intrawave_v3,288.0,421.74,0.0
256,1027,1024,2048,ck,2,0,14.9802,a8w8_blockscale_1x128x128_256x64x128x128_16x16_32x32_1x2_8x32x1_8x32x1_1x32x1x8_8_1x1_intrawave_v3,287.55,420.81,0.0
256,1031,1024,2048,ck,2,0,15.1248,a8w8_blockscale_1x128x128_256x64x128x128_16x16_32x32_1x2_8x32x1_8x32x1_1x32x1x8_8_1x1_intrawave_v3,285.91,417.87,0.0
256,1039,1024,2048,ck,2,0,15.1579,a8w8_blockscale_1x128x128_256x64x128x128_16x16_32x32_1x2_8x32x1_8x32x1_1x32x1x8_8_1x1_intrawave_v3,287.5,419.11,0.0
256,1040,1024,2048,ck,2,0,15.0177,a8w8_blockscale_1x128x128_256x64x128x128_16x16_32x32_1x2_8x32x1_8x32x1_1x32x1x8_8_1x1_intrawave_v3,290.46,423.3,0.0
256,1041,1024,2048,ck,2,0,15.1406,a8w8_blockscale_1x128x128_256x64x128x128_16x16_32x32_1x2_8x32x1_8x32x1_1x32x1x8_8_1x1_intrawave_v3,288.38,420.13,0.0
256,1072,1024,2048,ck,2,0,15.1073,a8w8_blockscale_1x128x128_256x64x128x128_16x16_32x32_1x2_8x32x1_8x32x1_1x32x1x8_8_1x1_intrawave_v3,297.62,429.47,0.0
256,1073,1024,2048,ck,2,0,15.1485,a8w8_blockscale_1x128x128_256x64x128x128_16x16_32x32_1x2_8x32x1_8x32x1_1x32x1x8_8_1x1_intrawave_v3,297.09,428.57,0.0
256,1077,1024,2048,ck,2,0,15.2087,a8w8_blockscale_1x128x128_256x64x128x128_16x16_32x32_1x2_8x32x1_8x32x1_1x32x1x8_8_1x1_intrawave_v3,297.02,427.95,0.0
256,1091,1024,2048,ck,2,0,15.0233,a8w8_blockscale_1x128x128_256x64x128x128_16x16_32x32_1x2_8x32x1_8x32x1_1x32x1x8_8_1x1_intrawave_v3,304.59,437.05,0.0
256,1343,1024,2048,ck,2,0,15.3229,a8w8_blockscale_1x128x128_256x64x128x128_16x16_32x32_1x2_8x32x1_8x32x1_1x32x1x8_8_1x1_intrawave_v3,367.62,495.86,0.0
256,1688,1024,2048,ck,2,0,15.6286,a8w8_blockscale_1x128x128_256x64x128x128_16x16_32x32_1x2_8x32x1_8x32x1_1x32x1x8_8_1x1_intrawave_v3,453.01,576.58,0.0
256,2017,1024,2048,ck,2,0,15.7158,a8w8_blockscale_1x128x128_256x64x128x128_16x16_32x32_1x2_8x32x1_8x32x1_1x32x1x8_8_1x1_intrawave_v3,538.31,659.13,0.0
256,2048,1024,2048,ck,2,0,15.5315,a8w8_blockscale_1x128x128_256x64x128x128_16x16_32x32_1x2_8x32x1_8x32x1_1x32x1x8_8_1x1_intrawave_v3,553.07,675.13,0.0
256,2048,1024,4096,ck,2,0,25.9352,a8w8_blockscale_1x128x128_256x64x128x128_16x16_32x32_1x2_8x32x1_8x32x1_1x32x1x8_8_1x1_intrawave_v3,662.42,646.89,0.0
256,2050,1024,2048,ck,3,0,19.0637,a8w8_blockscale_1x128x128_256x64x64x128_16x16_32x32_1x1_8x32x1_8x32x1_1x32x1x8_8_1x1_intrawave_v3,451.03,550.47,0.0
256,2063,1024,2048,ck,3,0,19.0279,a8w8_blockscale_1x128x128_256x64x64x128_16x16_32x32_1x1_8x32x1_8x32x1_1x32x1x8_8_1x1_intrawave_v3,454.75,554.3,0.0
256,2064,1024,2048,ck,3,0,18.9983,a8w8_blockscale_1x128x128_256x64x64x128_16x16_32x32_1x1_8x32x1_8x32x1_1x32x1x8_8_1x1_intrawave_v3,455.67,555.38,0.0
256,2099,1024,2048,ck,3,0,19.0367,a8w8_blockscale_1x128x128_256x64x64x128_16x16_32x32_1x1_8x32x1_8x32x1_1x32x1x8_8_1x1_intrawave_v3,462.47,561.79,0.0
256,2159,1024,2048,ck,3,0,19.2937,a8w8_blockscale_1x128x128_256x64x64x128_16x16_32x32_1x1_8x32x1_8x32x1_1x32x1x8_8_1x1_intrawave_v3,469.35,567.05,0.0
256,2160,1024,2048,ck,3,0,19.1869,a8w8_blockscale_1x128x128_256x64x64x128_16x16_32x32_1x1_8x32x1_8x32x1_1x32x1x8_8_1x1_intrawave_v3,472.18,570.42,0.0
256,2313,1024,2048,ck,3,0,19.3579,a8w8_blockscale_1x128x128_256x64x64x128_16x16_32x32_1x1_8x32x1_8x32x1_1x32x1x8_8_1x1_intrawave_v3,501.16,597.75,0.0
256,2325,1024,2048,ck,3,0,19.4186,a8w8_blockscale_1x128x128_256x64x64x128_16x16_32x32_1x1_8x32x1_8x32x1_1x32x1x8_8_1x1_intrawave_v3,502.19,598.41,0.0
256,3072,1024,2048,ck,0,0,19.6918,a8w8_blockscale_1x128x128_256x128x128x128_16x16_32x32_2x2_8x32x1_8x32x1_1x32x1x8_8_1x1_intrawave_v3,654.33,745.49,0.0
256,3073,1024,2048,ck,0,0,20.4533,a8w8_blockscale_1x128x128_256x128x128x128_16x16_32x32_2x2_8x32x1_8x32x1_1x32x1x8_8_1x1_intrawave_v3,630.17,717.94,0.0
256,3182,1024,2048,ck,0,0,20.6753,a8w8_blockscale_1x128x128_256x128x128x128_16x16_32x32_2x2_8x32x1_8x32x1_1x32x1x8_8_1x1_intrawave_v3,645.52,731.82,0.0
256,3183,1024,2048,ck,0,0,20.7099,a8w8_blockscale_1x128x128_256x128x128x128_16x16_32x32_2x2_8x32x1_8x32x1_1x32x1x8_8_1x1_intrawave_v3,644.64,730.8,0.0
256,3847,1024,2048,ck,0,0,21.2729,a8w8_blockscale_1x128x128_256x128x128x128_16x16_32x32_2x2_8x32x1_8x32x1_1x32x1x8_8_1x1_intrawave_v3,758.5,839.31,0.0
256,4096,1024,2048,ck,0,0,20.6028,a8w8_blockscale_1x128x128_256x128x128x128_16x16_32x32_2x2_8x32x1_8x32x1_1x32x1x8_8_1x1_intrawave_v3,833.86,916.11,0.0
256,4096,1024,4096,ck,0,0,34.7142,a8w8_blockscale_1x128x128_256x128x128x128_16x16_32x32_2x2_8x32x1_8x32x1_1x32x1x8_8_1x1_intrawave_v3,989.79,845.77,0.0
256,4111,1024,2048,ck,2,0,28.0858,a8w8_blockscale_1x128x128_256x64x128x128_16x16_32x32_1x2_8x32x1_8x32x1_1x32x1x8_8_1x1_intrawave_v3,613.93,674.21,0.0
256,4141,1024,2048,ck,2,0,28.1853,a8w8_blockscale_1x128x128_256x64x128x128_16x16_32x32_1x2_8x32x1_8x32x1_1x32x1x8_8_1x1_intrawave_v3,616.23,676.19,0.0
256,4142,1024,2048,ck,2,0,28.1906,a8w8_blockscale_1x128x128_256x64x128x128_16x16_32x32_1x2_8x32x1_8x32x1_1x32x1x8_8_1x1_intrawave_v3,616.26,676.21,0.0
256,4345,1024,2048,ck,2,0,28.5622,a8w8_blockscale_1x128x128_256x64x128x128_16x16_32x32_1x2_8x32x1_8x32x1_1x32x1x8_8_1x1_intrawave_v3,638.05,696.52,0.0
256,5105,1024,2048,ck,2,0,29.3601,a8w8_blockscale_1x128x128_256x64x128x128_16x16_32x32_1x2_8x32x1_8x32x1_1x32x1x8_8_1x1_intrawave_v3,729.29,783.62,0.0
256,5121,1024,2048,ck,2,0,29.4301,a8w8_blockscale_1x128x128_256x64x128x128_16x16_32x32_1x2_8x32x1_8x32x1_1x32x1x8_8_1x1_intrawave_v3,729.83,783.99,0.0
256,5123,1024,2048,ck,2,0,29.6736,a8w8_blockscale_1x128x128_256x64x128x128_16x16_32x32_1x2_8x32x1_8x32x1_1x32x1x8_8_1x1_intrawave_v3,724.13,777.83,0.0
256,5131,1024,2048,ck,2,0,29.7657,a8w8_blockscale_1x128x128_256x64x128x128_16x16_32x32_1x2_8x32x1_8x32x1_1x32x1x8_8_1x1_intrawave_v3,723.01,776.52,0.0
256,5427,1024,2048,ck,2,0,29.5751,a8w8_blockscale_1x128x128_256x64x128x128_16x16_32x32_1x2_8x32x1_8x32x1_1x32x1x8_8_1x1_intrawave_v3,769.65,822.52,0.0
256,6113,1024,2048,ck,2,0,31.6245,a8w8_blockscale_1x128x128_256x64x128x128_16x16_32x32_1x2_8x32x1_8x32x1_1x32x1x8_8_1x1_intrawave_v3,810.76,858.07,0.0
256,6197,1024,2048,ck,0,0,31.6078,a8w8_blockscale_1x128x128_256x128x128x128_16x16_32x32_2x2_8x32x1_8x32x1_1x32x1x8_8_1x1_intrawave_v3,822.33,869.41,0.0
256,6409,1024,2048,ck,0,0,32.2134,a8w8_blockscale_1x128x128_256x128x128x128_16x16_32x32_2x2_8x32x1_8x32x1_1x32x1x8_8_1x1_intrawave_v3,834.48,880.02,0.0
256,7121,1024,2048,ck,0,0,33.029,a8w8_blockscale_1x128x128_256x128x128x128_16x16_32x32_2x2_8x32x1_8x32x1_1x32x1x8_8_1x1_intrawave_v3,904.29,946.59,0.0
256,7168,1024,2048,ck,0,0,32.9501,a8w8_blockscale_1x128x128_256x128x128x128_16x16_32x32_2x2_8x32x1_8x32x1_1x32x1x8_8_1x1_intrawave_v3,912.43,954.69,0.0
256,7169,1024,2048,ck,0,0,33.7453,a8w8_blockscale_1x128x128_256x128x128x128_16x16_32x32_2x2_8x32x1_8x32x1_1x32x1x8_8_1x1_intrawave_v3,891.06,932.32,0.0
256,7172,1024,2048,ck,0,0,33.6057,a8w8_blockscale_1x128x128_256x128x128x128_16x16_32x32_2x2_8x32x1_8x32x1_1x32x1x8_8_1x1_intrawave_v3,895.13,936.56,0.0
256,7176,1024,2048,ck,0,0,33.7093,a8w8_blockscale_1x128x128_256x128x128x128_16x16_32x32_2x2_8x32x1_8x32x1_1x32x1x8_8_1x1_intrawave_v3,892.88,934.16,0.0
256,7177,1024,2048,ck,0,0,33.3601,a8w8_blockscale_1x128x128_256x128x128x128_16x16_32x32_2x2_8x32x1_8x32x1_1x32x1x8_8_1x1_intrawave_v3,902.35,944.07,0.0
256,7178,1024,2048,ck,0,0,33.2066,a8w8_blockscale_1x128x128_256x128x128x128_16x16_32x32_2x2_8x32x1_8x32x1_1x32x1x8_8_1x1_intrawave_v3,906.65,948.55,0.0
256,7179,1024,2048,ck,0,0,33.1897,a8w8_blockscale_1x128x128_256x128x128x128_16x16_32x32_2x2_8x32x1_8x32x1_1x32x1x8_8_1x1_intrawave_v3,907.24,949.16,0.0
256,7183,1024,2048,ck,0,0,33.6189,a8w8_blockscale_1x128x128_256x128x128x128_16x16_32x32_2x2_8x32x1_8x32x1_1x32x1x8_8_1x1_intrawave_v3,896.15,937.53,0.0
256,7184,1024,2048,ck,0,0,33.2409,a8w8_blockscale_1x128x128_256x128x128x128_16x16_32x32_2x2_8x32x1_8x32x1_1x32x1x8_8_1x1_intrawave_v3,906.47,948.31,0.0
256,7209,1024,2048,ck,0,0,33.2873,a8w8_blockscale_1x128x128_256x128x128x128_16x16_32x32_2x2_8x32x1_8x32x1_1x32x1x8_8_1x1_intrawave_v3,908.36,950.07,0.0
256,7210,1024,2048,ck,0,0,32.9968,a8w8_blockscale_1x128x128_256x128x128x128_16x16_32x32_2x2_8x32x1_8x32x1_1x32x1x8_8_1x1_intrawave_v3,916.48,958.56,0.0
256,7211,1024,2048,ck,0,0,33.2553,a8w8_blockscale_1x128x128_256x128x128x128_16x16_32x32_2x2_8x32x1_8x32x1_1x32x1x8_8_1x1_intrawave_v3,909.48,951.23,0.0
256,7217,1024,2048,ck,0,0,33.5306,a8w8_blockscale_1x128x128_256x128x128x128_16x16_32x32_2x2_8x32x1_8x32x1_1x32x1x8_8_1x1_intrawave_v3,902.77,944.15,0.0
256,7273,1024,2048,ck,0,0,33.5765,a8w8_blockscale_1x128x128_256x128x128x128_16x16_32x32_2x2_8x32x1_8x32x1_1x32x1x8_8_1x1_intrawave_v3,908.53,949.69,0.0
256,7274,1024,2048,ck,0,0,33.0073,a8w8_blockscale_1x128x128_256x128x128x128_16x16_32x32_2x2_8x32x1_8x32x1_1x32x1x8_8_1x1_intrawave_v3,924.32,966.19,0.0
256,7391,1024,2048,ck,0,0,33.7548,a8w8_blockscale_1x128x128_256x128x128x128_16x16_32x32_2x2_8x32x1_8x32x1_1x32x1x8_8_1x1_intrawave_v3,918.39,959.0,0.0
256,7393,1024,2048,ck,0,0,33.6413,a8w8_blockscale_1x128x128_256x128x128x128_16x16_32x32_2x2_8x32x1_8x32x1_1x32x1x8_8_1x1_intrawave_v3,921.74,962.47,0.0
256,7715,1024,2048,ck,0,0,34.8329,a8w8_blockscale_1x128x128_256x128x128x128_16x16_32x32_2x2_8x32x1_8x32x1_1x32x1x8_8_1x1_intrawave_v3,928.98,967.41,0.0
256,7753,1024,2048,ck,0,0,34.3805,a8w8_blockscale_1x128x128_256x128x128x128_16x16_32x32_2x2_8x32x1_8x32x1_1x32x1x8_8_1x1_intrawave_v3,945.84,984.67,0.0
256,7819,1024,2048,ck,0,0,34.3553,a8w8_blockscale_1x128x128_256x128x128x128_16x16_32x32_2x2_8x32x1_8x32x1_1x32x1x8_8_1x1_intrawave_v3,954.59,993.26,0.0
256,8099,1024,2048,ck,0,0,34.4537,a8w8_blockscale_1x128x128_256x128x128x128_16x16_32x32_2x2_8x32x1_8x32x1_1x32x1x8_8_1x1_intrawave_v3,985.95,1023.71,0.0
256,8129,1024,2048,ck,0,0,34.6009,a8w8_blockscale_1x128x128_256x128x128x128_16x16_32x32_2x2_8x32x1_8x32x1_1x32x1x8_8_1x1_intrawave_v3,985.39,1022.91,0.0
256,8188,1024,2048,ck,0,0,34.2959,a8w8_blockscale_1x128x128_256x128x128x128_16x16_32x32_2x2_8x32x1_8x32x1_1x32x1x8_8_1x1_intrawave_v3,1001.37,1039.05,0.0
256,8192,1024,2048,ck,0,0,34.0037,a8w8_blockscale_1x128x128_256x128x128x128_16x16_32x32_2x2_8x32x1_8x32x1_1x32x1x8_8_1x1_intrawave_v3,1010.47,1048.46,0.0
256,8192,1024,4096,ck,0,0,59.7171,a8w8_blockscale_1x128x128_256x128x128x128_16x16_32x32_2x2_8x32x1_8x32x1_1x32x1x8_8_1x1_intrawave_v3,1150.75,913.07,0.0
256,16384,1024,2048,ck,0,0,63.7499,a8w8_blockscale_1x128x128_256x128x128x128_16x16_32x32_2x2_8x32x1_8x32x1_1x32x1x8_8_1x1_intrawave_v3,1077.95,1085.59,0.0
256,16384,1024,4096,ck,0,0,111.2258,a8w8_blockscale_1x128x128_256x128x128x128_16x16_32x32_2x2_8x32x1_8x32x1_1x32x1x8_8_1x1_intrawave_v3,1235.68,942.75,0.0
256,32768,1024,2048,cktile,29,0,116.3275,a8w8_blockscale_cktile_192x256x128_4x2x1_16x16x128_intrawave_0x1x0_4,1181.48,1171.82,0.0
256,32768,1024,4096,cktile,11,0,185.7064,a8w8_blockscale_cktile_192x256x128_4x2x1_16x16x128_intrawave_0x1x0_1,1480.17,1106.7,0.0
256,1,1536,7168,ck,6,3,8.2115,a8w8_blockscale_1x128x128_256x16x64x128_8x16_16x16_1x1_16x16x1_8x32x1_1x16x1x16_4_1x1_intrawave_v1,2.68,1342.06,0.0007
256,2,1536,7168,ck,6,3,8.2925,a8w8_blockscale_1x128x128_256x16x64x128_8x16_16x16_1x1_16x16x1_8x32x1_1x16x1x16_4_1x1_intrawave_v1,5.31,1330.18,0.0003
256,4,1536,7168,ck,6,3,8.3543,a8w8_blockscale_1x128x128_256x16x64x128_8x16_16x16_1x1_16x16x1_8x32x1_1x16x1x16_4_1x1_intrawave_v1,10.54,1322.79,0.0002
256,8,1536,7168,ck,6,3,8.8216,a8w8_blockscale_1x128x128_256x16x64x128_8x16_16x16_1x1_16x16x1_8x32x1_1x16x1x16_4_1x1_intrawave_v1,19.97,1257.36,0.0011
256,16,1536,7168,ck,6,3,8.8952,a8w8_blockscale_1x128x128_256x16x64x128_8x16_16x16_1x1_16x16x1_8x32x1_1x16x1x16_4_1x1_intrawave_v1,39.61,1256.17,0.0006
256,32,1536,7168,ck,8,2,9.4675,a8w8_blockscale_1x128x128_256x16x64x256_16x16_16x16_1x1_16x16x1_16x16x1_1x16x1x16_4_1x1_intrawave_v1,74.43,1197.54,0.0
256,64,1536,7168,ck,6,3,11.3543,a8w8_blockscale_1x128x128_256x16x64x128_8x16_16x16_1x1_16x16x1_8x32x1_1x16x1x16_4_1x1_intrawave_v1,124.12,1027.4,0.0007
256,128,1536,7168,ck,18,2,17.1249,a8w8_blockscale_1x128x128_256x64x64x256_16x16_32x32_1x1_16x16x1_16x16x1_1x32x1x8_8_1x1_intrawave_v1,164.59,719.47,0.0
256,256,1536,7168,ck,18,1,24.0777,a8w8_blockscale_1x128x128_256x64x64x256_16x16_32x32_1x1_16x16x1_16x16x1_1x32x1x8_8_1x1_intrawave_v1,234.12,566.15,0.0
256,512,1536,7168,ck,18,0,26.1863,a8w8_blockscale_1x128x128_256x64x64x256_16x16_32x32_1x1_16x16x1_16x16x1_1x32x1x8_8_1x1_intrawave_v1,430.54,620.67,0.0
256,1024,1536,7168,ck,2,0,41.02,a8w8_blockscale_1x128x128_256x64x128x128_16x16_32x32_1x2_8x32x1_8x32x1_1x32x1x8_8_1x1_intrawave_v3,549.7,524.03,0.0
256,1536,1536,7168,ck,2,0,51.8268,a8w8_blockscale_1x128x128_256x64x128x128_16x16_32x32_1x2_8x32x1_8x32x1_1x32x1x8_8_1x1_intrawave_v3,652.61,515.92,0.0
256,2048,1536,7168,ck,0,0,53.6435,a8w8_blockscale_1x128x128_256x128x128x128_16x16_32x32_2x2_8x32x1_8x32x1_1x32x1x8_8_1x1_intrawave_v3,840.68,596.19,0.0
256,4096,1536,7168,ck,0,0,86.5461,a8w8_blockscale_1x128x128_256x128x128x128_16x16_32x32_2x2_8x32x1_8x32x1_1x32x1x8_8_1x1_intrawave_v3,1042.15,611.85,0.0
256,8192,1536,7168,ck,0,0,138.0358,a8w8_blockscale_1x128x128_256x128x128x128_16x16_32x32_2x2_8x32x1_8x32x1_1x32x1x8_8_1x1_intrawave_v3,1306.82,687.47,0.0
256,16384,1536,7168,cktile,11,0,247.0771,a8w8_blockscale_cktile_192x256x128_4x2x1_16x16x128_intrawave_0x1x0_1,1460.18,723.59,0.0
256,20480,1536,7168,cktile,29,0,274.2878,a8w8_blockscale_cktile_192x256x128_4x2x1_16x16x128_intrawave_0x1x0_4,1644.15,804.72,0.0
256,32768,1536,7168,cktile,28,0,401.4743,a8w8_blockscale_cktile_192x256x128_4x2x1_16x16x128_intrawave_0x1x0_3,1797.26,863.2,0.0
256,1,2048,128,ck,6,0,2.6798,a8w8_blockscale_1x128x128_256x16x64x128_8x16_16x16_1x1_16x16x1_8x32x1_1x16x1x16_4_1x1_intrawave_v1,0.2,99.4,0.0
256,1,2048,512,ck,8,0,3.2702,a8w8_blockscale_1x128x128_256x16x64x256_16x16_16x16_1x1_16x16x1_16x16x1_1x16x1x16_4_1x1_intrawave_v1,0.64,322.05,0.0
256,1,2048,1024,ck,6,2,4.3078,a8w8_blockscale_1x128x128_256x16x64x128_8x16_16x16_1x1_16x16x1_8x32x1_1x16x1x16_4_1x1_intrawave_v1,0.97,488.02,0.0
256,1,2048,4096,ck,8,3,5.7181,a8w8_blockscale_1x128x128_256x16x64x256_16x16_16x16_1x1_16x16x1_16x16x1_1x16x1x16_4_1x1_intrawave_v1,2.93,1468.46,0.0
256,2,2048,128,ck,6,0,2.7086,a8w8_blockscale_1x128x128_256x16x64x128_8x16_16x16_1x1_16x16x1_8x32x1_1x16x1x16_4_1x1_intrawave_v1,0.39,99.9,0.0
256,2,2048,512,ck,8,0,3.2736,a8w8_blockscale_1x128x128_256x16x64x256_16x16_16x16_1x1_16x16x1_16x16x1_1x16x1x16_4_1x1_intrawave_v1,1.28,323.13,0.0
256,2,2048,1024,ck,8,2,4.2663,a8w8_blockscale_1x128x128_256x16x64x256_16x16_16x16_1x1_16x16x1_16x16x1_1x16x1x16_4_1x1_intrawave_v1,1.97,493.96,0.0
256,2,2048,4096,ck,8,3,5.8373,a8w8_blockscale_1x128x128_256x16x64x256_16x16_16x16_1x1_16x16x1_16x16x1_1x16x1x16_4_1x1_intrawave_v1,5.75,1439.88,0.0
256,4,2048,128,ck,6,0,2.7329,a8w8_blockscale_1x128x128_256x16x64x128_8x16_16x16_1x1_16x16x1_8x32x1_1x16x1x16_4_1x1_intrawave_v1,0.77,102.1,0.0
256,4,2048,512,ck,8,0,3.3061,a8w8_blockscale_1x128x128_256x16x64x256_16x16_16x16_1x1_16x16x1_16x16x1_1x16x1x16_4_1x1_intrawave_v1,2.54,322.74,0.0
256,4,2048,1024,ck,8,2,4.3988,a8w8_blockscale_1x128x128_256x16x64x256_16x16_16x16_1x1_16x16x1_16x16x1_1x16x1x16_4_1x1_intrawave_v1,3.81,481.41,0.0
256,4,2048,4096,ck,8,3,5.8848,a8w8_blockscale_1x128x128_256x16x64x256_16x16_16x16_1x1_16x16x1_16x16x1_1x16x1x16_4_1x1_intrawave_v1,11.4,1431.04,0.0
256,8,2048,128,ck,6,0,2.7537,a8w8_blockscale_1x128x128_256x16x64x128_8x16_16x16_1x1_16x16x1_8x32x1_1x16x1x16_4_1x1_intrawave_v1,1.52,107.47,0.0
256,8,2048,512,ck,8,0,3.3357,a8w8_blockscale_1x128x128_256x16x64x256_16x16_16x16_1x1_16x16x1_16x16x1_1x16x1x16_4_1x1_intrawave_v1,5.03,325.4,0.0
256,8,2048,1024,ck,6,3,4.4587,a8w8_blockscale_1x128x128_256x16x64x128_8x16_16x16_1x1_16x16x1_8x32x1_1x16x1x16_4_1x1_intrawave_v1,7.53,479.54,0.0
256,8,2048,4096,ck,8,3,6.0065,a8w8_blockscale_1x128x128_256x16x64x256_16x16_16x16_1x1_16x16x1_16x16x1_1x16x1x16_4_1x1_intrawave_v1,22.35,1407.5,0.0
256,16,2048,128,ck,6,0,2.8133,a8w8_blockscale_1x128x128_256x16x64x128_8x16_16x16_1x1_16x16x1_8x32x1_1x16x1x16_4_1x1_intrawave_v1,2.98,117.2,0.0
256,16,2048,512,ck,8,0,3.3283,a8w8_blockscale_1x128x128_256x16x64x256_16x16_16x16_1x1_16x16x1_16x16x1_1x16x1x16_4_1x1_intrawave_v1,10.08,337.2,0.0
256,16,2048,1024,ck,8,0,4.4726,a8w8_blockscale_1x128x128_256x16x64x256_16x16_16x16_1x1_16x16x1_16x16x1_1x16x1x16_4_1x1_intrawave_v1,15.0,487.2,0.0
256,16,2048,4096,ck,8,3,6.2141,a8w8_blockscale_1x128x128_256x16x64x256_16x16_16x16_1x1_16x16x1_16x16x1_1x16x1x16_4_1x1_intrawave_v1,43.2,1371.02,0.0
256,32,2048,128,ck,11,0,2.9854,a8w8_blockscale_1x128x128_256x32x64x128_16x16_16x16_2x1_8x32x1_8x32x1_1x32x1x8_8_2x1_intrawave_v1,5.62,133.09,0.0
256,32,2048,512,ck,8,0,3.5466,a8w8_blockscale_1x128x128_256x16x64x256_16x16_16x16_1x1_16x16x1_16x16x1_1x16x1x16_4_1x1_intrawave_v1,18.92,337.23,0.0
256,32,2048,1024,ck,8,0,4.7578,a8w8_blockscale_1x128x128_256x16x64x256_16x16_16x16_1x1_16x16x1_16x16x1_1x16x1x16_4_1x1_intrawave_v1,28.21,475.22,0.0
256,32,2048,4096,ck,8,3,7.1057,a8w8_blockscale_1x128x128_256x16x64x256_16x16_16x16_1x1_16x16x1_16x16x1_1x16x1x16_4_1x1_intrawave_v1,75.55,1217.44,0.0
256,48,2048,128,ck,6,0,2.9674,a8w8_blockscale_1x128x128_256x16x64x128_8x16_16x16_1x1_16x16x1_8x32x1_1x16x1x16_4_1x1_intrawave_v1,8.48,156.67,0.0
256,48,2048,512,ck,8,0,3.5356,a8w8_blockscale_1x128x128_256x16x64x256_16x16_16x16_1x1_16x16x1_16x16x1_1x16x1x16_4_1x1_intrawave_v1,28.47,359.14,0.0
256,48,2048,1024,ck,8,0,4.7437,a8w8_blockscale_1x128x128_256x16x64x256_16x16_16x16_1x1_16x16x1_16x16x1_1x16x1x16_4_1x1_intrawave_v1,42.44,493.9,0.0
256,48,2048,4096,ck,8,3,7.8215,a8w8_blockscale_1x128x128_256x16x64x256_16x16_16x16_1x1_16x16x1_16x16x1_1x16x1x16_4_1x1_intrawave_v1,102.96,1122.78,0.0
256,64,2048,128,ck,6,0,2.999,a8w8_blockscale_1x128x128_256x16x64x128_8x16_16x16_1x1_16x16x1_8x32x1_1x16x1x16_4_1x1_intrawave_v1,11.19,177.55,0.0
256,64,2048,512,ck,8,0,3.595,a8w8_blockscale_1x128x128_256x16x64x256_16x16_16x16_1x1_16x16x1_16x16x1_1x16x1x16_4_1x1_intrawave_v1,37.33,373.71,0.0
256,64,2048,1024,ck,8,0,4.7978,a8w8_blockscale_1x128x128_256x16x64x256_16x16_16x16_1x1_16x16x1_16x16x1_1x16x1x16_4_1x1_intrawave_v1,55.95,505.4,0.0
256,64,2048,4096,ck,8,3,8.8477,a8w8_blockscale_1x128x128_256x16x64x256_16x16_16x16_1x1_16x16x1_16x16x1_1x16x1x16_4_1x1_intrawave_v1,121.36,1007.37,0.0
256,80,2048,128,ck,6,0,3.02,a8w8_blockscale_1x128x128_256x16x64x128_8x16_16x16_1x1_16x16x1_8x32x1_1x16x1x16_4_1x1_intrawave_v1,13.89,198.7,0.0
256,80,2048,512,ck,8,0,3.6228,a8w8_blockscale_1x128x128_256x16x64x256_16x16_16x16_1x1_16x16x1_16x16x1_1x16x1x16_4_1x1_intrawave_v1,46.31,391.19,0.0
256,80,2048,1024,ck,8,0,4.8484,a8w8_blockscale_1x128x128_256x16x64x256_16x16_16x16_1x1_16x16x1_16x16x1_1x16x1x16_4_1x1_intrawave_v1,69.21,517.03,0.0
256,80,2048,4096,ck,8,3,9.8869,a8w8_blockscale_1x128x128_256x16x64x256_16x16_16x16_1x1_16x16x1_16x16x1_1x16x1x16_4_1x1_intrawave_v1,135.75,914.74,0.0
256,96,2048,128,ck,6,0,3.0623,a8w8_blockscale_1x128x128_256x16x64x128_8x16_16x16_1x1_16x16x1_8x32x1_1x16x1x16_4_1x1_intrawave_v1,16.44,218.02,0.0
256,96,2048,512,ck,8,0,3.6288,a8w8_blockscale_1x128x128_256x16x64x256_16x16_16x16_1x1_16x16x1_16x16x1_1x16x1x16_4_1x1_intrawave_v1,55.48,410.86,0.0
256,96,2048,1024,ck,8,0,4.9186,a8w8_blockscale_1x128x128_256x16x64x256_16x16_16x16_1x1_16x16x1_16x16x1_1x16x1x16_4_1x1_intrawave_v1,81.86,526.3,0.0
256,96,2048,4096,ck,8,3,10.2566,a8w8_blockscale_1x128x128_256x16x64x256_16x16_16x16_1x1_16x16x1_16x16x1_1x16x1x16_4_1x1_intrawave_v1,157.03,894.55,0.0
256,112,2048,128,ck,6,0,3.099,a8w8_blockscale_1x128x128_256x16x64x128_8x16_16x16_1x1_16x16x1_8x32x1_1x16x1x16_4_1x1_intrawave_v1,18.95,237.25,0.0
256,112,2048,512,ck,8,0,3.7071,a8w8_blockscale_1x128x128_256x16x64x256_16x16_16x16_1x1_16x16x1_16x16x1_1x16x1x16_4_1x1_intrawave_v1,63.36,422.07,0.0
256,112,2048,1024,ck,8,0,4.959,a8w8_blockscale_1x128x128_256x16x64x256_16x16_16x16_1x1_16x16x1_16x16x1_1x16x1x16_4_1x1_intrawave_v1,94.73,538.53,0.0
256,112,2048,4096,ck,8,3,11.1484,a8w8_blockscale_1x128x128_256x16x64x256_16x16_16x16_1x1_16x16x1_16x16x1_1x16x1x16_4_1x1_intrawave_v1,168.55,834.75,0.0
256,128,2048,128,ck,6,0,3.0844,a8w8_blockscale_1x128x128_256x16x64x128_8x16_16x16_1x1_16x16x1_8x32x1_1x16x1x16_4_1x1_intrawave_v1,21.76,260.28,0.0
256,128,2048,512,ck,8,0,3.6988,a8w8_blockscale_1x128x128_256x16x64x256_16x16_16x16_1x1_16x16x1_16x16x1_1x16x1x16_4_1x1_intrawave_v1,72.57,442.95,0.0
256,128,2048,1024,ck,8,0,4.9648,a8w8_blockscale_1x128x128_256x16x64x256_16x16_16x16_1x1_16x16x1_16x16x1_1x16x1x16_4_1x1_intrawave_v1,108.14,554.41,0.0
256,128,2048,4096,ck,8,3,11.8813,a8w8_blockscale_1x128x128_256x16x64x256_16x16_16x16_1x1_16x16x1_16x16x1_1x16x1x16_4_1x1_intrawave_v1,180.74,794.29,0.0
256,256,2048,128,ck,11,0,3.3582,a8w8_blockscale_1x128x128_256x32x64x128_16x16_16x16_2x1_8x32x1_8x32x1_1x32x1x8_8_2x1_intrawave_v1,39.97,400.06,0.0
256,256,2048,512,ck,13,0,3.9826,a8w8_blockscale_1x128x128_256x32x64x256_16x16_16x16_2x1_16x16x1_16x16x1_1x32x1x8_8_2x1_intrawave_v1,134.8,559.49,0.0
256,256,2048,1024,ck,13,0,5.9863,a8w8_blockscale_1x128x128_256x32x64x256_16x16_16x16_2x1_16x16x1_16x16x1_1x32x1x8_8_2x1_intrawave_v1,179.37,569.28,0.0
256,256,2048,4096,ck,18,0,16.0227,a8w8_blockscale_1x128x128_256x64x64x256_16x16_32x32_1x1_16x16x1_16x16x1_1x32x1x8_8_1x1_intrawave_v1,268.06,654.43,0.0
256,512,2048,128,ck,16,0,3.9729,a8w8_blockscale_1x128x128_256x64x64x128_16x16_32x32_1x1_8x32x1_8x32x1_1x32x1x8_8_1x1_intrawave_v1,67.57,610.34,0.0
256,512,2048,512,ck,18,0,5.1347,a8w8_blockscale_1x128x128_256x64x64x256_16x16_32x32_1x1_16x16x1_16x16x1_1x32x1x8_8_1x1_intrawave_v1,209.11,663.69,0.0
256,512,2048,1024,ck,18,0,6.9154,a8w8_blockscale_1x128x128_256x64x64x256_16x16_32x32_1x1_16x16x1_16x16x1_1x32x1x8_8_1x1_intrawave_v1,310.54,682.33,0.0
256,512,2048,4096,ck,18,0,16.7714,a8w8_blockscale_1x128x128_256x64x64x256_16x16_32x32_1x1_16x16x1_16x16x1_1x32x1x8_8_1x1_intrawave_v1,512.18,750.26,0.0
256,588,2048,128,ck,6,0,4.616,a8w8_blockscale_1x128x128_256x16x64x128_8x16_16x16_1x1_16x16x1_8x32x1_1x16x1x16_4_1x1_intrawave_v1,66.79,594.86,0.0
256,588,2048,1024,ck,2,0,9.482,a8w8_blockscale_1x128x128_256x64x128x128_16x16_32x32_1x2_8x32x1_8x32x1_1x32x1x8_8_1x1_intrawave_v3,260.1,538.67,0.0
256,667,2048,512,ck,13,0,6.4872,a8w8_blockscale_1x128x128_256x32x64x256_16x16_16x16_2x1_16x16x1_16x16x1_1x32x1x8_8_2x1_intrawave_v1,215.62,635.42,0.0
256,667,2048,4096,ck,2,0,25.4057,a8w8_blockscale_1x128x128_256x64x128x128_16x16_32x32_1x2_8x32x1_8x32x1_1x32x1x8_8_1x1_intrawave_v3,440.47,545.26,0.0
256,671,2048,512,ck,13,0,6.4481,a8w8_blockscale_1x128x128_256x32x64x256_16x16_16x16_2x1_16x16x1_16x16x1_1x32x1x8_8_2x1_intrawave_v1,218.23,642.13,0.0
256,671,2048,4096,ck,2,0,25.4567,a8w8_blockscale_1x128x128_256x64x128x128_16x16_32x32_1x2_8x32x1_8x32x1_1x32x1x8_8_1x1_intrawave_v3,442.22,545.45,0.0
256,773,2048,128,cktile,19,0,5.1054,a8w8_blockscale_cktile_32x128x128_1x4x1_16x16x64_intrawave_0x1x0_3,79.38,690.9,0.0
256,773,2048,1024,ck,2,0,9.7926,a8w8_blockscale_1x128x128_256x64x128x128_16x16_32x32_1x2_8x32x1_8x32x1_1x32x1x8_8_1x1_intrawave_v3,331.09,618.32,0.0
256,822,2048,128,cktile,20,0,5.2175,a8w8_blockscale_cktile_32x128x128_1x4x1_16x16x64_intrawave_0x1x0_4,82.6,715.72,0.0
256,822,2048,1024,ck,3,0,9.7779,a8w8_blockscale_1x128x128_256x64x64x128_16x16_32x32_1x1_8x32x1_8x32x1_1x32x1x8_8_1x1_intrawave_v3,352.6,644.9,0.0
256,931,2048,512,ck,18,0,7.1591,a8w8_blockscale_1x128x128_256x64x64x256_16x16_32x32_1x1_16x16x1_16x16x1_1x32x1x8_8_1x1_intrawave_v1,272.72,745.71,0.0
256,931,2048,4096,ck,2,0,26.1844,a8w8_blockscale_1x128x128_256x64x128x128_16x16_32x32_1x2_8x32x1_8x32x1_1x32x1x8_8_1x1_intrawave_v3,596.52,611.64,0.0
256,1024,2048,128,cktile,20,0,5.3457,a8w8_blockscale_cktile_32x128x128_1x4x1_16x16x64_intrawave_0x1x0_4,100.43,858.17,0.0
256,1024,2048,512,ck,18,0,7.1553,a8w8_blockscale_1x128x128_256x64x64x256_16x16_32x32_1x1_16x16x1_16x16x1_1x32x1x8_8_1x1_intrawave_v1,300.12,806.0,0.0
256,1024,2048,1024,ck,2,0,9.7308,a8w8_blockscale_1x128x128_256x64x128x128_16x16_32x32_1x2_8x32x1_8x32x1_1x32x1x8_8_1x1_intrawave_v3,441.38,754.31,0.0
256,1024,2048,4096,ck,2,0,25.8507,a8w8_blockscale_1x128x128_256x64x128x128_16x16_32x32_1x2_8x32x1_8x32x1_1x32x1x8_8_1x1_intrawave_v3,664.58,649.0,0.0
256,1025,2048,128,cktile,7,0,5.9652,a8w8_blockscale_cktile_32x128x128_1x4x1_16x16x64_intrawave_0x1x0_2,90.09,769.76,0.0
256,1025,2048,512,ck,13,0,8.4688,a8w8_blockscale_1x128x128_256x32x64x256_16x16_16x16_2x1_16x16x1_16x16x1_1x32x1x8_8_2x1_intrawave_v1,253.82,681.53,0.0
256,1025,2048,1024,ck,3,0,12.6319,a8w8_blockscale_1x128x128_256x64x64x128_16x16_32x32_1x1_8x32x1_8x32x1_1x32x1x8_8_1x1_intrawave_v3,340.34,581.48,0.0
256,1025,2048,4096,ck,2,0,32.231,a8w8_blockscale_1x128x128_256x64x128x128_16x16_32x32_1x2_8x32x1_8x32x1_1x32x1x8_8_1x1_intrawave_v3,533.54,520.78,0.0
256,1027,2048,128,cktile,19,0,5.964,a8w8_blockscale_cktile_32x128x128_1x4x1_16x16x64_intrawave_0x1x0_3,90.28,771.33,0.0
256,1027,2048,512,ck,13,0,8.4907,a8w8_blockscale_1x128x128_256x32x64x256_16x16_16x16_2x1_16x16x1_16x16x1_1x32x1x8_8_2x1_intrawave_v1,253.66,680.86,0.0
256,1027,2048,1024,ck,3,0,12.6063,a8w8_blockscale_1x128x128_256x64x64x128_16x16_32x32_1x1_8x32x1_8x32x1_1x32x1x8_8_1x1_intrawave_v3,341.7,583.47,0.0
256,1027,2048,4096,ck,0,0,32.3495,a8w8_blockscale_1x128x128_256x128x128x128_16x16_32x32_2x2_8x32x1_8x32x1_1x32x1x8_8_1x1_intrawave_v3,532.63,519.38,0.0
256,1031,2048,512,ck,13,0,8.4387,a8w8_blockscale_1x128x128_256x32x64x256_16x16_16x16_2x1_16x16x1_16x16x1_1x32x1x8_8_2x1_intrawave_v1,256.22,687.24,0.0
256,1031,2048,4096,ck,0,0,32.3309,a8w8_blockscale_1x128x128_256x128x128x128_16x16_32x32_2x2_8x32x1_8x32x1_1x32x1x8_8_1x1_intrawave_v3,535.01,520.7,0.0
256,1039,2048,512,ck,13,0,8.4391,a8w8_blockscale_1x128x128_256x32x64x256_16x16_16x16_2x1_16x16x1_16x16x1_1x32x1x8_8_2x1_intrawave_v1,258.2,691.58,0.0
256,1039,2048,4096,ck,0,0,32.2688,a8w8_blockscale_1x128x128_256x128x128x128_16x16_32x32_2x2_8x32x1_8x32x1_1x32x1x8_8_1x1_intrawave_v3,540.2,523.73,0.0
256,1040,2048,512,ck,13,0,8.386,a8w8_blockscale_1x128x128_256x32x64x256_16x16_16x16_2x1_16x16x1_16x16x1_1x32x1x8_8_2x1_intrawave_v1,260.08,696.51,0.0
256,1040,2048,4096,ck,0,0,32.091,a8w8_blockscale_1x128x128_256x128x128x128_16x16_32x32_2x2_8x32x1_8x32x1_1x32x1x8_8_1x1_intrawave_v3,543.71,526.89,0.0
256,1041,2048,512,ck,13,0,8.417,a8w8_blockscale_1x128x128_256x32x64x256_16x16_16x16_2x1_16x16x1_16x16x1_1x32x1x8_8_2x1_intrawave_v1,259.37,694.49,0.0
256,1041,2048,4096,ck,2,0,32.2298,a8w8_blockscale_1x128x128_256x64x128x128_16x16_32x32_1x2_8x32x1_8x32x1_1x32x1x8_8_1x1_intrawave_v3,541.89,524.87,0.0
256,1042,2048,128,cktile,19,0,5.9691,a8w8_blockscale_cktile_32x128x128_1x4x1_16x16x64_intrawave_0x1x0_3,91.52,781.28,0.0
256,1042,2048,1024,ck,3,0,12.7944,a8w8_blockscale_1x128x128_256x64x64x128_16x16_32x32_1x1_8x32x1_8x32x1_1x32x1x8_8_1x1_intrawave_v3,341.59,580.89,0.0
256,1051,2048,128,cktile,19,0,5.979,a8w8_blockscale_cktile_32x128x128_1x4x1_16x16x64_intrawave_0x1x0_3,92.16,786.35,0.0
256,1051,2048,1024,ck,3,0,12.7831,a8w8_blockscale_1x128x128_256x64x64x128_16x16_32x32_1x1_8x32x1_8x32x1_1x32x1x8_8_1x1_intrawave_v3,344.85,585.01,0.0
256,1055,2048,128,cktile,20,0,5.9978,a8w8_blockscale_cktile_32x128x128_1x4x1_16x16x64_intrawave_0x1x0_4,92.22,786.7,0.0
256,1055,2048,1024,ck,3,0,12.8107,a8w8_blockscale_1x128x128_256x64x64x128_16x16_32x32_1x1_8x32x1_8x32x1_1x32x1x8_8_1x1_intrawave_v3,345.41,585.35,0.0
256,1057,2048,128,cktile,7,0,6.0049,a8w8_blockscale_cktile_32x128x128_1x4x1_16x16x64_intrawave_0x1x0_2,92.29,787.18,0.0
256,1057,2048,1024,ck,3,0,12.7564,a8w8_blockscale_1x128x128_256x64x64x128_16x16_32x32_1x1_8x32x1_8x32x1_1x32x1x8_8_1x1_intrawave_v3,347.54,588.65,0.0
256,1069,2048,128,cktile,7,0,6.0146,a8w8_blockscale_cktile_32x128x128_1x4x1_16x16x64_intrawave_0x1x0_2,93.18,794.33,0.0
256,1069,2048,1024,ck,3,0,12.8108,a8w8_blockscale_1x128x128_256x64x64x128_16x16_32x32_1x1_8x32x1_8x32x1_1x32x1x8_8_1x1_intrawave_v3,349.99,590.94,0.0
256,1072,2048,128,cktile,19,0,6.0153,a8w8_blockscale_cktile_32x128x128_1x4x1_16x16x64_intrawave_0x1x0_3,93.43,796.35,0.0
256,1072,2048,512,ck,13,0,8.5275,a8w8_blockscale_1x128x128_256x32x64x256_16x16_16x16_2x1_16x16x1_16x16x1_1x32x1x8_8_2x1_intrawave_v1,263.63,702.24,0.0
256,1072,2048,1024,ck,3,0,12.8947,a8w8_blockscale_1x128x128_256x64x64x128_16x16_32x32_1x1_8x32x1_8x32x1_1x32x1x8_8_1x1_intrawave_v3,348.69,588.29,0.0
256,1072,2048,4096,ck,2,0,32.5617,a8w8_blockscale_1x128x128_256x64x128x128_16x16_32x32_1x2_8x32x1_8x32x1_1x32x1x8_8_1x1_intrawave_v3,552.34,527.32,0.0
256,1073,2048,512,ck,13,0,8.5074,a8w8_blockscale_1x128x128_256x32x64x256_16x16_16x16_2x1_16x16x1_16x16x1_1x32x1x8_8_2x1_intrawave_v1,264.5,704.44,0.0
256,1073,2048,4096,ck,0,0,32.4865,a8w8_blockscale_1x128x128_256x128x128x128_16x16_32x32_2x2_8x32x1_8x32x1_1x32x1x8_8_1x1_intrawave_v3,554.14,528.79,0.0
256,1074,2048,128,cktile,20,0,6.0324,a8w8_blockscale_cktile_32x128x128_1x4x1_16x16x64_intrawave_0x1x0_4,93.34,795.49,0.0
256,1074,2048,1024,ck,3,0,12.7377,a8w8_blockscale_1x128x128_256x64x64x128_16x16_32x32_1x1_8x32x1_8x32x1_1x32x1x8_8_1x1_intrawave_v3,353.65,596.34,0.0
256,1077,2048,512,ck,13,0,8.5178,a8w8_blockscale_1x128x128_256x32x64x256_16x16_16x16_2x1_16x16x1_16x16x1_1x32x1x8_8_2x1_intrawave_v1,265.17,705.74,0.0
256,1077,2048,4096,ck,2,0,32.3571,a8w8_blockscale_1x128x128_256x64x128x128_16x16_32x32_1x2_8x32x1_8x32x1_1x32x1x8_8_1x1_intrawave_v3,558.43,531.92,0.0
256,1091,2048,128,cktile,19,0,6.0459,a8w8_blockscale_cktile_32x128x128_1x4x1_16x16x64_intrawave_0x1x0_3,94.61,805.59,0.0
256,1091,2048,512,ck,13,0,8.5513,a8w8_blockscale_1x128x128_256x32x64x256_16x16_16x16_2x1_16x16x1_16x16x1_1x32x1x8_8_2x1_intrawave_v1,267.56,710.52,0.0
256,1091,2048,1024,ck,3,0,12.684,a8w8_blockscale_1x128x128_256x64x64x128_16x16_32x32_1x1_8x32x1_8x32x1_1x32x1x8_8_1x1_intrawave_v3,360.77,605.73,0.0
256,1091,2048,4096,ck,2,0,32.5546,a8w8_blockscale_1x128x128_256x64x128x128_16x16_32x32_1x2_8x32x1_8x32x1_1x32x1x8_8_1x1_intrawave_v3,562.25,532.22,0.0
256,1128,2048,128,cktile,19,0,6.0787,a8w8_blockscale_cktile_32x128x128_1x4x1_16x16x64_intrawave_0x1x0_3,97.29,826.96,0.0
256,1128,2048,1024,ck,3,0,12.9216,a8w8_blockscale_1x128x128_256x64x64x128_16x16_32x32_1x1_8x32x1_8x32x1_1x32x1x8_8_1x1_intrawave_v3,366.14,609.25,0.0
256,1136,2048,128,cktile,7,0,6.0917,a8w8_blockscale_cktile_32x128x128_1x4x1_16x16x64_intrawave_0x1x0_2,97.77,830.74,0.0
256,1136,2048,1024,ck,3,0,12.7793,a8w8_blockscale_1x128x128_256x64x64x128_16x16_32x32_1x1_8x32x1_8x32x1_1x32x1x8_8_1x1_intrawave_v3,372.85,619.24,0.0
256,1343,2048,512,ck,18,0,8.7991,a8w8_blockscale_1x128x128_256x64x64x256_16x16_32x32_1x1_16x16x1_16x16x1_1x32x1x8_8_1x1_intrawave_v1,320.09,822.48,0.0
256,1343,2048,4096,ck,0,0,33.1907,a8w8_blockscale_1x128x128_256x128x128x128_16x16_32x32_2x2_8x32x1_8x32x1_1x32x1x8_8_1x1_intrawave_v3,678.86,584.21,0.0
256,1514,2048,128,cktile,19,0,6.3826,a8w8_blockscale_cktile_32x128x128_1x4x1_16x16x64_intrawave_0x1x0_3,124.36,1043.04,0.0
256,1514,2048,1024,ck,3,0,13.1917,a8w8_blockscale_1x128x128_256x64x64x128_16x16_32x32_1x1_8x32x1_8x32x1_1x32x1x8_8_1x1_intrawave_v3,481.38,746.59,0.0
256,1688,2048,512,ck,0,0,9.9211,a8w8_blockscale_1x128x128_256x128x128x128_16x16_32x32_2x2_8x32x1_8x32x1_1x32x1x8_8_1x1_intrawave_v3,356.81,889.71,0.0
256,1688,2048,4096,ck,0,0,34.2486,a8w8_blockscale_1x128x128_256x128x128x128_16x16_32x32_2x2_8x32x1_8x32x1_1x32x1x8_8_1x1_intrawave_v3,826.89,648.69,0.0
256,2017,2048,128,cktile,4,0,6.974,a8w8_blockscale_cktile_32x128x128_1x4x1_16x16x128_intrawave_0x1x0_1,151.63,1259.24,0.0
256,2017,2048,512,ck,0,0,10.433,a8w8_blockscale_1x128x128_256x128x128x128_16x16_32x32_2x2_8x32x1_8x32x1_1x32x1x8_8_1x1_intrawave_v3,405.44,991.37,0.0
256,2017,2048,1024,ck,0,0,14.1882,a8w8_blockscale_1x128x128_256x128x128x128_16x16_32x32_2x2_8x32x1_8x32x1_1x32x1x8_8_1x1_intrawave_v3,596.26,875.67,0.0
256,2017,2048,4096,ck,0,0,35.809,a8w8_blockscale_1x128x128_256x128x128x128_16x16_32x32_2x2_8x32x1_8x32x1_1x32x1x8_8_1x1_intrawave_v3,945.0,695.69,0.0
256,2048,2048,128,cktile,6,0,7.1635,a8w8_blockscale_cktile_32x128x128_1x4x1_16x16x64_intrawave_0x1x0_1,149.89,1244.21,0.0
256,2048,2048,512,ck,0,0,9.9879,a8w8_blockscale_1x128x128_256x128x128x128_16x16_32x32_2x2_8x32x1_8x32x1_1x32x1x8_8_1x1_intrawave_v3,430.02,1049.85,0.0
256,2048,2048,1024,ck,0,0,13.8329,a8w8_blockscale_1x128x128_256x128x128x128_16x16_32x32_2x2_8x32x1_8x32x1_1x32x1x8_8_1x1_intrawave_v3,620.98,909.64,0.0
256,2048,2048,4096,ck,0,0,34.9477,a8w8_blockscale_1x128x128_256x128x128x128_16x16_32x32_2x2_8x32x1_8x32x1_1x32x1x8_8_1x1_intrawave_v3,983.18,720.1,0.0
256,2050,2048,512,ck,18,0,12.5347,a8w8_blockscale_1x128x128_256x64x64x256_16x16_32x32_1x1_16x16x1_16x16x1_1x32x1x8_8_1x1_intrawave_v1,342.98,837.27,0.0
256,2050,2048,4096,ck,2,0,48.7442,a8w8_blockscale_1x128x128_256x64x128x128_16x16_32x32_1x2_8x32x1_8x32x1_1x32x1x8_8_1x1_intrawave_v3,705.59,516.62,0.0
256,2063,2048,512,ck,18,0,12.5587,a8w8_blockscale_1x128x128_256x64x64x256_16x16_32x32_1x1_16x16x1_16x16x1_1x32x1x8_8_1x1_intrawave_v1,344.5,840.44,0.0
256,2063,2048,4096,ck,2,0,49.003,a8w8_blockscale_1x128x128_256x64x128x128_16x16_32x32_1x2_8x32x1_8x32x1_1x32x1x8_8_1x1_intrawave_v3,706.31,516.06,0.0
256,2064,2048,512,ck,18,0,12.5019,a8w8_blockscale_1x128x128_256x64x64x256_16x16_32x32_1x1_16x16x1_16x16x1_1x32x1x8_8_1x1_intrawave_v1,346.23,844.63,0.0
256,2064,2048,4096,ck,2,0,49.1349,a8w8_blockscale_1x128x128_256x64x128x128_16x16_32x32_1x2_8x32x1_8x32x1_1x32x1x8_8_1x1_intrawave_v3,704.76,514.85,0.0
256,2099,2048,512,ck,18,0,12.6323,a8w8_blockscale_1x128x128_256x64x64x256_16x16_32x32_1x1_16x16x1_16x16x1_1x32x1x8_8_1x1_intrawave_v1,348.47,848.68,0.0
256,2099,2048,4096,ck,2,0,49.0499,a8w8_blockscale_1x128x128_256x64x128x128_16x16_32x32_1x2_8x32x1_8x32x1_1x32x1x8_8_1x1_intrawave_v3,717.95,521.58,0.0
256,2151,2048,128,cktile,6,0,7.8601,a8w8_blockscale_cktile_32x128x128_1x4x1_16x16x64_intrawave_0x1x0_1,143.48,1189.29,0.0
256,2151,2048,1024,ck,2,0,18.7107,a8w8_blockscale_1x128x128_256x64x128x128_16x16_32x32_1x2_8x32x1_8x32x1_1x32x1x8_8_1x1_intrawave_v3,482.18,700.68,0.0
256,2159,2048,512,ck,18,0,12.5276,a8w8_blockscale_1x128x128_256x64x64x256_16x16_32x32_1x1_16x16x1_16x16x1_1x32x1x8_8_1x1_intrawave_v1,361.42,877.84,0.0
256,2159,2048,4096,ck,0,0,49.8601,a8w8_blockscale_1x128x128_256x128x128x128_16x16_32x32_2x2_8x32x1_8x32x1_1x32x1x8_8_1x1_intrawave_v3,726.47,522.97,0.0
256,2160,2048,512,ck,18,0,12.5743,a8w8_blockscale_1x128x128_256x64x64x256_16x16_32x32_1x1_16x16x1_16x16x1_1x32x1x8_8_1x1_intrawave_v1,360.25,874.95,0.0
256,2160,2048,4096,ck,0,0,49.8823,a8w8_blockscale_1x128x128_256x128x128x128_16x16_32x32_2x2_8x32x1_8x32x1_1x32x1x8_8_1x1_intrawave_v3,726.49,522.9,0.0
256,2313,2048,512,ck,18,0,12.8279,a8w8_blockscale_1x128x128_256x64x64x256_16x16_32x32_1x1_16x16x1_16x16x1_1x32x1x8_8_1x1_intrawave_v1,378.14,912.61,0.0
256,2313,2048,4096,ck,2,0,49.1889,a8w8_blockscale_1x128x128_256x64x128x128_16x16_32x32_1x2_8x32x1_8x32x1_1x32x1x8_8_1x1_intrawave_v3,788.91,555.75,0.0
256,2325,2048,512,ck,18,0,12.5571,a8w8_blockscale_1x128x128_256x64x64x256_16x16_32x32_1x1_16x16x1_16x16x1_1x32x1x8_8_1x1_intrawave_v1,388.3,936.7,0.0
256,2325,2048,4096,ck,2,0,49.2305,a8w8_blockscale_1x128x128_256x64x128x128_16x16_32x32_1x2_8x32x1_8x32x1_1x32x1x8_8_1x1_intrawave_v3,792.33,557.28,0.0
256,2332,2048,128,cktile,20,0,7.9334,a8w8_blockscale_cktile_32x128x128_1x4x1_16x16x64_intrawave_0x1x0_4,154.11,1274.68,0.0
256,2332,2048,1024,ck,2,0,18.8453,a8w8_blockscale_1x128x128_256x64x128x128_16x16_32x32_1x2_8x32x1_8x32x1_1x32x1x8_8_1x1_intrawave_v3,519.02,744.85,0.0
256,2341,2048,128,cktile,7,0,7.9307,a8w8_blockscale_cktile_32x128x128_1x4x1_16x16x64_intrawave_0x1x0_2,154.76,1279.9,0.0
256,2341,2048,1024,ck,2,0,18.7415,a8w8_blockscale_1x128x128_256x64x128x128_16x16_32x32_1x2_8x32x1_8x32x1_1x32x1x8_8_1x1_intrawave_v3,523.91,751.44,0.0
256,3072,2048,128,ck,16,0,10.0936,a8w8_blockscale_1x128x128_256x64x64x128_16x16_32x32_1x1_8x32x1_8x32x1_1x32x1x8_8_1x1_intrawave_v1,159.57,1311.55,0.0
256,3072,2048,512,ck,18,0,13.7384,a8w8_blockscale_1x128x128_256x64x64x256_16x16_32x32_1x1_16x16x1_16x16x1_1x32x1x8_8_1x1_intrawave_v1,468.94,1106.7,0.0
256,3072,2048,1024,ck,2,0,19.7822,a8w8_blockscale_1x128x128_256x64x128x128_16x16_32x32_1x2_8x32x1_8x32x1_1x32x1x8_8_1x1_intrawave_v3,651.34,901.1,0.0
256,3072,2048,4096,ck,0,0,51.7235,a8w8_blockscale_1x128x128_256x128x128x128_16x16_32x32_2x2_8x32x1_8x32x1_1x32x1x8_8_1x1_intrawave_v3,996.44,648.73,0.0
256,3073,2048,128,cktile,20,0,10.8475,a8w8_blockscale_cktile_32x128x128_1x4x1_16x16x64_intrawave_0x1x0_4,148.53,1220.79,0.0
256,3073,2048,512,ck,18,0,15.2508,a8w8_blockscale_1x128x128_256x64x64x256_16x16_32x32_1x1_16x16x1_16x16x1_1x32x1x8_8_1x1_intrawave_v1,422.57,997.26,0.0
256,3073,2048,1024,ck,0,0,21.3873,a8w8_blockscale_1x128x128_256x128x128x128_16x16_32x32_2x2_8x32x1_8x32x1_1x32x1x8_8_1x1_intrawave_v3,602.65,833.71,0.0
256,3073,2048,4096,ck,0,0,52.9243,a8w8_blockscale_1x128x128_256x128x128x128_16x16_32x32_2x2_8x32x1_8x32x1_1x32x1x8_8_1x1_intrawave_v3,974.15,634.16,0.0
256,3089,2048,128,cktile,6,0,10.8981,a8w8_blockscale_cktile_32x128x128_1x4x1_16x16x64_intrawave_0x1x0_1,148.61,1221.32,0.0
256,3089,2048,1024,ck,0,0,21.2758,a8w8_blockscale_1x128x128_256x128x128x128_16x16_32x32_2x2_8x32x1_8x32x1_1x32x1x8_8_1x1_intrawave_v3,608.96,841.93,0.0
256,3110,2048,128,cktile,17,0,10.8491,a8w8_blockscale_cktile_32x128x128_1x4x1_16x16x128_intrawave_0x1x0_3,150.29,1235.01,0.0
256,3110,2048,1024,ck,0,0,21.4278,a8w8_blockscale_1x128x128_256x128x128x128_16x16_32x32_2x2_8x32x1_8x32x1_1x32x1x8_8_1x1_intrawave_v3,608.76,840.98,0.0
256,3137,2048,128,cktile,4,0,10.8488,a8w8_blockscale_cktile_32x128x128_1x4x1_16x16x128_intrawave_0x1x0_1,151.6,1245.56,0.0
256,3137,2048,1024,ck,0,0,21.3212,a8w8_blockscale_1x128x128_256x128x128x128_16x16_32x32_2x2_8x32x1_8x32x1_1x32x1x8_8_1x1_intrawave_v3,617.11,851.67,0.0
256,3182,2048,512,ck,18,0,15.3454,a8w8_blockscale_1x128x128_256x64x64x256_16x16_32x32_1x1_16x16x1_16x16x1_1x32x1x8_8_1x1_intrawave_v1,434.86,1023.84,0.0
256,3182,2048,4096,ck,0,0,53.9511,a8w8_blockscale_1x128x128_256x128x128x128_16x16_32x32_2x2_8x32x1_8x32x1_1x32x1x8_8_1x1_intrawave_v3,989.51,638.64,0.0
256,3183,2048,512,ck,18,0,15.3436,a8w8_blockscale_1x128x128_256x64x64x256_16x16_32x32_1x1_16x16x1_16x16x1_1x32x1x8_8_1x1_intrawave_v1,435.05,1024.26,0.0
256,3183,2048,4096,ck,0,0,54.3727,a8w8_blockscale_1x128x128_256x128x128x128_16x16_32x32_2x2_8x32x1_8x32x1_1x32x1x8_8_1x1_intrawave_v3,982.15,633.84,0.0
256,3613,2048,128,cktile,10,0,11.3016,a8w8_blockscale_cktile_128x128x128_2x2x1_16x16x128_intrawave_0x1x0_2,167.61,1373.56,0.0
256,3613,2048,1024,ck,0,0,21.9305,a8w8_blockscale_1x128x128_256x128x128x128_16x16_32x32_2x2_8x32x1_8x32x1_1x32x1x8_8_1x1_intrawave_v3,691.0,939.14,0.0
256,3847,2048,512,ck,0,0,16.8112,a8w8_blockscale_1x128x128_256x128x128x128_16x16_32x32_2x2_8x32x1_8x32x1_1x32x1x8_8_1x1_intrawave_v3,479.9,1116.85,0.0
256,3847,2048,4096,ck,0,0,59.7991,a8w8_blockscale_1x128x128_256x128x128x128_16x16_32x32_2x2_8x32x1_8x32x1_1x32x1x8_8_1x1_intrawave_v3,1079.31,667.29,0.0
256,4096,2048,128,cktile,25,0,11.6779,a8w8_blockscale_cktile_128x128x128_2x2x1_16x16x128_intrawave_0x1x0_3,183.89,1504.01,0.0
256,4096,2048,512,ck,0,0,16.9983,a8w8_blockscale_1x128x128_256x128x128x128_16x16_32x32_2x2_8x32x1_8x32x1_1x32x1x8_8_1x1_intrawave_v3,505.34,1172.06,0.0
256,4096,2048,1024,ck,0,0,22.7286,a8w8_blockscale_1x128x128_256x128x128x128_16x16_32x32_2x2_8x32x1_8x32x1_1x32x1x8_8_1x1_intrawave_v3,755.87,1014.96,0.0
256,4096,2048,4096,ck,0,0,59.3967,a8w8_blockscale_1x128x128_256x128x128x128_16x16_32x32_2x2_8x32x1_8x32x1_1x32x1x8_8_1x1_intrawave_v3,1156.96,706.15,0.0
256,4097,2048,128,cktile,20,0,12.3293,a8w8_blockscale_cktile_32x128x128_1x4x1_16x16x64_intrawave_0x1x0_4,174.22,1424.89,0.0
256,4097,2048,1024,cktile,30,0,27.6518,a8w8_blockscale_cktile_192x256x128_4x2x1_16x16x128_intrawave_0x1x0_2_aqrm,621.44,834.44,0.0
256,4109,2048,128,cktile,7,0,12.3054,a8w8_blockscale_cktile_32x128x128_1x4x1_16x16x64_intrawave_0x1x0_2,175.07,1431.77,0.0
256,4109,2048,1024,cktile,31,0,27.8495,a8w8_blockscale_cktile_192x256x128_4x2x1_16x16x128_intrawave_0x1x0_3_aqrm,618.84,830.72,0.0
256,4111,2048,512,ck,18,0,18.2963,a8w8_blockscale_1x128x128_256x64x64x256_16x16_32x32_1x1_16x16x1_16x16x1_1x32x1x8_8_1x1_intrawave_v1,471.21,1092.68,0.0
256,4111,2048,4096,cktile,11,0,63.0045,a8w8_blockscale_cktile_192x256x128_4x2x1_16x16x128_intrawave_0x1x0_1,1094.7,667.67,0.0
256,4141,2048,512,ck,18,0,18.2331,a8w8_blockscale_1x128x128_256x64x64x256_16x16_32x32_1x1_16x16x1_16x16x1_1x32x1x8_8_1x1_intrawave_v1,476.29,1104.05,0.0
256,4141,2048,4096,cktile,29,0,63.2299,a8w8_blockscale_cktile_192x256x128_4x2x1_16x16x128_intrawave_0x1x0_4,1098.76,669.17,0.0
256,4142,2048,512,ck,18,0,18.3469,a8w8_blockscale_1x128x128_256x64x64x256_16x16_32x32_1x1_16x16x1_16x16x1_1x32x1x8_8_1x1_intrawave_v1,473.45,1097.46,0.0
256,4142,2048,4096,cktile,11,0,63.0134,a8w8_blockscale_cktile_192x256x128_4x2x1_16x16x128_intrawave_0x1x0_1,1102.8,671.6,0.0
256,4143,2048,128,cktile,7,0,12.39,a8w8_blockscale_cktile_32x128x128_1x4x1_16x16x64_intrawave_0x1x0_2,175.31,1433.59,0.0
256,4143,2048,1024,cktile,30,0,27.7323,a8w8_blockscale_cktile_192x256x128_4x2x1_16x16x128_intrawave_0x1x0_2_aqrm,626.6,840.51,0.0
256,4345,2048,128,cktile,19,0,13.2938,a8w8_blockscale_cktile_32x128x128_1x4x1_16x16x64_intrawave_0x1x0_3,171.36,1400.31,0.0
256,4345,2048,512,ck,18,0,18.7428,a8w8_blockscale_1x128x128_256x64x64x256_16x16_32x32_1x1_16x16x1_16x16x1_1x32x1x8_8_1x1_intrawave_v1,486.17,1124.18,0.0
256,4345,2048,1024,cktile,30,0,27.9997,a8w8_blockscale_cktile_192x256x128_4x2x1_16x16x128_intrawave_0x1x0_2_aqrm,650.87,869.42,0.0
256,4345,2048,4096,cktile,29,0,63.5585,a8w8_blockscale_cktile_192x256x128_4x2x1_16x16x128_intrawave_0x1x0_4,1146.93,692.01,0.0
256,4413,2048,128,cktile,6,0,12.5362,a8w8_blockscale_cktile_32x128x128_1x4x1_16x16x64_intrawave_0x1x0_1,184.56,1507.85,0.0
256,4413,2048,1024,cktile,30,0,27.9655,a8w8_blockscale_cktile_192x256x128_4x2x1_16x16x128_intrawave_0x1x0_2_aqrm,661.87,882.93,0.0
256,5105,2048,512,ck,18,0,20.6001,a8w8_blockscale_1x128x128_256x64x64x256_16x16_32x32_1x1_16x16x1_16x16x1_1x32x1x8_8_1x1_intrawave_v1,519.7,1192.83,0.0
256,5105,2048,4096,cktile,11,0,65.2871,a8w8_blockscale_cktile_192x256x128_4x2x1_16x16x128_intrawave_0x1x0_1,1311.86,769.05,0.0
256,5121,2048,128,cktile,6,0,14.2424,a8w8_blockscale_cktile_32x128x128_1x4x1_16x16x64_intrawave_0x1x0_1,188.51,1537.19,0.0
256,5121,2048,512,cktile,32,0,21.7212,a8w8_blockscale_cktile_192x256x128_4x2x1_16x16x128_intrawave_0x1x0_4_aqrm,494.43,1134.66,0.0
256,5121,2048,1024,cktile,32,0,28.4455,a8w8_blockscale_cktile_192x256x128_4x2x1_16x16x128_intrawave_0x1x0_4_aqrm,755.09,995.47,0.0
256,5121,2048,4096,cktile,29,0,65.2218,a8w8_blockscale_cktile_192x256x128_4x2x1_16x16x128_intrawave_0x1x0_4,1317.29,771.83,0.0
256,5123,2048,128,cktile,7,0,14.2968,a8w8_blockscale_cktile_32x128x128_1x4x1_16x16x64_intrawave_0x1x0_2,187.87,1531.93,0.0
256,5123,2048,512,cktile,30,0,21.7233,a8w8_blockscale_cktile_192x256x128_4x2x1_16x16x128_intrawave_0x1x0_2_aqrm,494.57,1134.97,0.0
256,5123,2048,1024,cktile,31,0,28.5237,a8w8_blockscale_cktile_192x256x128_4x2x1_16x16x128_intrawave_0x1x0_3_aqrm,753.32,993.1,0.0
256,5123,2048,4096,cktile,11,0,65.3621,a8w8_blockscale_cktile_192x256x128_4x2x1_16x16x128_intrawave_0x1x0_1,1314.98,770.42,0.0
256,5131,2048,512,cktile,32,0,21.7567,a8w8_blockscale_cktile_192x256x128_4x2x1_16x16x128_intrawave_0x1x0_4_aqrm,494.58,1134.93,0.0
256,5131,2048,4096,cktile,29,0,64.7766,a8w8_blockscale_cktile_192x256x128_4x2x1_16x16x128_intrawave_0x1x0_4,1328.94,778.39,0.0
256,5133,2048,128,cktile,20,0,14.1624,a8w8_blockscale_cktile_32x128x128_1x4x1_16x16x64_intrawave_0x1x0_4,190.02,1549.45,0.0
256,5133,2048,1024,cktile,30,0,28.4542,a8w8_blockscale_cktile_192x256x128_4x2x1_16x16x128_intrawave_0x1x0_2_aqrm,756.63,997.33,0.0
256,5185,2048,128,cktile,7,0,14.4041,a8w8_blockscale_cktile_32x128x128_1x4x1_16x16x64_intrawave_0x1x0_2,188.73,1538.7,0.0
256,5185,2048,1024,cktile,12,0,28.5349,a8w8_blockscale_cktile_192x256x128_4x2x1_16x16x128_intrawave_0x1x0_1_aqrm,762.14,1003.84,0.0
256,5191,2048,128,cktile,20,0,14.3767,a8w8_blockscale_cktile_32x128x128_1x4x1_16x16x64_intrawave_0x1x0_4,189.3,1543.4,0.0
256,5191,2048,1024,cktile,12,0,28.4742,a8w8_blockscale_cktile_192x256x128_4x2x1_16x16x128_intrawave_0x1x0_1_aqrm,764.64,1007.05,0.0
256,5427,2048,512,cktile,30,0,21.8276,a8w8_blockscale_cktile_192x256x128_4x2x1_16x16x128_intrawave_0x1x0_2_aqrm,521.42,1193.73,0.0
256,5427,2048,4096,cktile,29,0,66.0624,a8w8_blockscale_cktile_192x256x128_4x2x1_16x16x128_intrawave_0x1x0_4,1378.24,799.95,0.0
256,6113,2048,512,cktile,30,0,22.0667,a8w8_blockscale_cktile_192x256x128_4x2x1_16x16x128_intrawave_0x1x0_2_aqrm,580.96,1324.04,0.0
256,6113,2048,4096,cktile,29,0,68.3594,a8w8_blockscale_cktile_192x256x128_4x2x1_16x16x128_intrawave_0x1x0_4,1500.29,855.28,0.0
256,6146,2048,128,cktile,6,0,16.2383,a8w8_blockscale_cktile_32x128x128_1x4x1_16x16x64_intrawave_0x1x0_1,198.44,1614.88,0.0
256,6146,2048,1024,ck,0,0,37.6983,a8w8_blockscale_1x128x128_256x128x128x128_16x16_32x32_2x2_8x32x1_8x32x1_1x32x1x8_8_1x1_intrawave_v3,683.8,890.35,0.0
256,6147,2048,128,cktile,7,0,16.1542,a8w8_blockscale_cktile_32x128x128_1x4x1_16x16x64_intrawave_0x1x0_2,199.5,1623.55,0.0
256,6147,2048,1024,ck,0,0,37.5201,a8w8_blockscale_1x128x128_256x128x128x128_16x16_32x32_2x2_8x32x1_8x32x1_1x32x1x8_8_1x1_intrawave_v3,687.16,894.71,0.0
256,6155,2048,128,cktile,6,0,16.2043,a8w8_blockscale_cktile_32x128x128_1x4x1_16x16x64_intrawave_0x1x0_1,199.14,1620.61,0.0
256,6155,2048,1024,ck,0,0,37.7128,a8w8_blockscale_1x128x128_256x128x128x128_16x16_32x32_2x2_8x32x1_8x32x1_1x32x1x8_8_1x1_intrawave_v3,684.54,891.23,0.0
256,6197,2048,512,ck,18,0,25.1928,a8w8_blockscale_1x128x128_256x64x64x256_16x16_32x32_1x1_16x16x1_16x16x1_1x32x1x8_8_1x1_intrawave_v1,515.86,1175.11,0.0
256,6197,2048,4096,ck,0,0,100.1086,a8w8_blockscale_1x128x128_256x128x128x128_16x16_32x32_2x2_8x32x1_8x32x1_1x32x1x8_8_1x1_intrawave_v3,1038.56,590.9,0.0
256,6377,2048,128,cktile,6,0,16.3913,a8w8_blockscale_cktile_32x128x128_1x4x1_16x16x64_intrawave_0x1x0_1,203.97,1659.33,0.0
256,6377,2048,1024,ck,0,0,38.0472,a8w8_blockscale_1x128x128_256x128x128x128_16x16_32x32_2x2_8x32x1_8x32x1_1x32x1x8_8_1x1_intrawave_v3,703.0,913.27,0.0
256,6401,2048,128,cktile,7,0,16.4208,a8w8_blockscale_cktile_32x128x128_1x4x1_16x16x64_intrawave_0x1x0_2,204.37,1662.52,0.0
256,6401,2048,1024,ck,0,0,37.8966,a8w8_blockscale_1x128x128_256x128x128x128_16x16_32x32_2x2_8x32x1_8x32x1_1x32x1x8_8_1x1_intrawave_v3,708.45,920.14,0.0
256,6409,2048,512,ck,18,0,25.2288,a8w8_blockscale_1x128x128_256x64x64x256_16x16_32x32_1x1_16x16x1_16x16x1_1x32x1x8_8_1x1_intrawave_v1,532.75,1212.16,0.0
256,6409,2048,4096,ck,0,0,101.6594,a8w8_blockscale_1x128x128_256x128x128x128_16x16_32x32_2x2_8x32x1_8x32x1_1x32x1x8_8_1x1_intrawave_v3,1057.7,598.97,0.0
256,7121,2048,128,cktile,6,0,17.6941,a8w8_blockscale_cktile_32x128x128_1x4x1_16x16x64_intrawave_0x1x0_1,211.0,1714.77,0.0
256,7121,2048,512,ck,18,0,26.9009,a8w8_blockscale_1x128x128_256x64x64x256_16x16_32x32_1x1_16x16x1_16x16x1_1x32x1x8_8_1x1_intrawave_v1,555.14,1258.77,0.0
256,7121,2048,1024,ck,0,0,38.9261,a8w8_blockscale_1x128x128_256x128x128x128_16x16_32x32_2x2_8x32x1_8x32x1_1x32x1x8_8_1x1_intrawave_v3,767.29,990.51,0.0
256,7121,2048,4096,ck,0,0,103.9087,a8w8_blockscale_1x128x128_256x128x128x128_16x16_32x32_2x2_8x32x1_8x32x1_1x32x1x8_8_1x1_intrawave_v3,1149.76,642.14,0.0
256,7168,2048,512,ck,18,0,26.598,a8w8_blockscale_1x128x128_256x64x64x256_16x16_32x32_1x1_16x16x1_16x16x1_1x32x1x8_8_1x1_intrawave_v1,565.17,1281.25,0.0
256,7168,2048,4096,ck,0,0,101.3346,a8w8_blockscale_1x128x128_256x128x128x128_16x16_32x32_2x2_8x32x1_8x32x1_1x32x1x8_8_1x1_intrawave_v3,1186.75,662.25,0.0
256,7169,2048,128,cktile,19,0,18.0882,a8w8_blockscale_cktile_32x128x128_1x4x1_16x16x64_intrawave_0x1x0_3,207.79,1688.61,0.0
256,7169,2048,512,ck,0,0,27.9678,a8w8_blockscale_1x128x128_256x128x128x128_16x16_32x32_2x2_8x32x1_8x32x1_1x32x1x8_8_1x1_intrawave_v3,537.56,1218.66,0.0
256,7169,2048,1024,ck,0,0,38.6193,a8w8_blockscale_1x128x128_256x128x128x128_16x16_32x32_2x2_8x32x1_8x32x1_1x32x1x8_8_1x1_intrawave_v3,778.6,1004.74,0.0
256,7169,2048,4096,ck,0,0,105.9394,a8w8_blockscale_1x128x128_256x128x128x128_16x16_32x32_2x2_8x32x1_8x32x1_1x32x1x8_8_1x1_intrawave_v3,1135.33,633.54,0.0
256,7170,2048,128,cktile,7,0,18.0632,a8w8_blockscale_cktile_32x128x128_1x4x1_16x16x64_intrawave_0x1x0_2,208.11,1691.19,0.0
256,7170,2048,1024,ck,0,0,38.6817,a8w8_blockscale_1x128x128_256x128x128x128_16x16_32x32_2x2_8x32x1_8x32x1_1x32x1x8_8_1x1_intrawave_v3,777.45,1003.25,0.0
256,7172,2048,512,ck,18,0,27.9904,a8w8_blockscale_1x128x128_256x64x64x256_16x16_32x32_1x1_16x16x1_16x16x1_1x32x1x8_8_1x1_intrawave_v1,537.35,1218.17,0.0
256,7172,2048,4096,ck,0,0,105.8087,a8w8_blockscale_1x128x128_256x128x128x128_16x16_32x32_2x2_8x32x1_8x32x1_1x32x1x8_8_1x1_intrawave_v3,1137.21,634.56,0.0
256,7176,2048,128,cktile,19,0,18.0763,a8w8_blockscale_cktile_32x128x128_1x4x1_16x16x64_intrawave_0x1x0_3,208.13,1691.36,0.0
256,7176,2048,512,ck,18,0,27.8994,a8w8_blockscale_1x128x128_256x64x64x256_16x16_32x32_1x1_16x16x1_16x16x1_1x32x1x8_8_1x1_intrawave_v1,539.41,1222.81,0.0
256,7176,2048,1024,ck,0,0,38.9561,a8w8_blockscale_1x128x128_256x128x128x128_16x16_32x32_2x2_8x32x1_8x32x1_1x32x1x8_8_1x1_intrawave_v3,772.62,996.98,0.0
256,7176,2048,4096,ck,0,0,104.6715,a8w8_blockscale_1x128x128_256x128x128x128_16x16_32x32_2x2_8x32x1_8x32x1_1x32x1x8_8_1x1_intrawave_v3,1150.2,641.76,0.0
256,7177,2048,128,cktile,6,0,17.9641,a8w8_blockscale_cktile_32x128x128_1x4x1_16x16x64_intrawave_0x1x0_1,209.46,1702.16,0.0
256,7177,2048,512,ck,18,0,27.8475,a8w8_blockscale_1x128x128_256x64x64x256_16x16_32x32_1x1_16x16x1_16x16x1_1x32x1x8_8_1x1_intrawave_v1,540.49,1225.25,0.0
256,7177,2048,1024,ck,0,0,39.0544,a8w8_blockscale_1x128x128_256x128x128x128_16x16_32x32_2x2_8x32x1_8x32x1_1x32x1x8_8_1x1_intrawave_v3,770.78,994.6,0.0
256,7177,2048,4096,ck,0,0,104.3667,a8w8_blockscale_1x128x128_256x128x128x128_16x16_32x32_2x2_8x32x1_8x32x1_1x32x1x8_8_1x1_intrawave_v3,1153.72,643.72,0.0
256,7178,2048,512,ck,18,0,27.5447,a8w8_blockscale_1x128x128_256x64x64x256_16x16_32x32_1x1_16x16x1_16x16x1_1x32x1x8_8_1x1_intrawave_v1,546.51,1238.89,0.0
256,7178,2048,4096,ck,0,0,105.5387,a8w8_blockscale_1x128x128_256x128x128x128_16x16_32x32_2x2_8x32x1_8x32x1_1x32x1x8_8_1x1_intrawave_v3,1141.07,636.65,0.0
256,7179,2048,512,ck,18,0,27.8772,a8w8_blockscale_1x128x128_256x64x64x256_16x16_32x32_1x1_16x16x1_16x16x1_1x32x1x8_8_1x1_intrawave_v1,540.06,1224.28,0.0
256,7179,2048,4096,ck,0,0,105.1843,a8w8_blockscale_1x128x128_256x128x128x128_16x16_32x32_2x2_8x32x1_8x32x1_1x32x1x8_8_1x1_intrawave_v3,1145.07,638.87,0.0
256,7183,2048,512,ck,18,0,27.9136,a8w8_blockscale_1x128x128_256x64x64x256_16x16_32x32_1x1_16x16x1_16x16x1_1x32x1x8_8_1x1_intrawave_v1,539.66,1223.34,0.0
256,7183,2048,4096,ck,0,0,106.0887,a8w8_blockscale_1x128x128_256x128x128x128_16x16_32x32_2x2_8x32x1_8x32x1_1x32x1x8_8_1x1_intrawave_v3,1135.94,633.73,0.0
256,7184,2048,512,ck,18,0,27.9669,a8w8_blockscale_1x128x128_256x64x64x256_16x16_32x32_1x1_16x16x1_16x16x1_1x32x1x8_8_1x1_intrawave_v1,538.71,1221.17,0.0
256,7184,2048,4096,ck,0,0,106.2571,a8w8_blockscale_1x128x128_256x128x128x128_16x16_32x32_2x2_8x32x1_8x32x1_1x32x1x8_8_1x1_intrawave_v3,1134.3,632.8,0.0
256,7185,2048,128,cktile,19,0,18.066,a8w8_blockscale_cktile_32x128x128_1x4x1_16x16x64_intrawave_0x1x0_3,208.51,1694.43,0.0
256,7185,2048,1024,ck,0,0,38.6839,a8w8_blockscale_1x128x128_256x128x128x128_16x16_32x32_2x2_8x32x1_8x32x1_1x32x1x8_8_1x1_intrawave_v3,779.03,1005.18,0.0
256,7206,2048,128,cktile,19,0,18.0796,a8w8_blockscale_cktile_32x128x128_1x4x1_16x16x64_intrawave_0x1x0_3,208.97,1698.06,0.0
256,7206,2048,1024,ck,0,0,39.2181,a8w8_blockscale_1x128x128_256x128x128x128_16x16_32x32_2x2_8x32x1_8x32x1_1x32x1x8_8_1x1_intrawave_v3,770.67,994.23,0.0
256,7209,2048,512,ck,18,0,27.6287,a8w8_blockscale_1x128x128_256x64x64x256_16x16_32x32_1x1_16x16x1_16x16x1_1x32x1x8_8_1x1_intrawave_v1,547.2,1240.29,0.0
256,7209,2048,4096,ck,0,0,104.7827,a8w8_blockscale_1x128x128_256x128x128x128_16x16_32x32_2x2_8x32x1_8x32x1_1x32x1x8_8_1x1_intrawave_v3,1154.26,643.66,0.0
256,7210,2048,512,ck,18,0,27.9896,a8w8_blockscale_1x128x128_256x64x64x256_16x16_32x32_1x1_16x16x1_16x16x1_1x32x1x8_8_1x1_intrawave_v1,540.22,1224.46,0.0
256,7210,2048,4096,ck,0,0,105.6759,a8w8_blockscale_1x128x128_256x128x128x128_16x16_32x32_2x2_8x32x1_8x32x1_1x32x1x8_8_1x1_intrawave_v3,1144.67,638.3,0.0
256,7211,2048,512,ck,0,0,28.0479,a8w8_blockscale_1x128x128_256x128x128x128_16x16_32x32_2x2_8x32x1_8x32x1_1x32x1x8_8_1x1_intrawave_v3,539.17,1222.08,0.0
256,7211,2048,4096,ck,0,0,105.7403,a8w8_blockscale_1x128x128_256x128x128x128_16x16_32x32_2x2_8x32x1_8x32x1_1x32x1x8_8_1x1_intrawave_v3,1144.13,637.99,0.0
256,7217,2048,128,cktile,7,0,18.0905,a8w8_blockscale_cktile_32x128x128_1x4x1_16x16x64_intrawave_0x1x0_2,209.16,1699.61,0.0
256,7217,2048,512,ck,0,0,28.0797,a8w8_blockscale_1x128x128_256x128x128x128_16x16_32x32_2x2_8x32x1_8x32x1_1x32x1x8_8_1x1_intrawave_v3,539.01,1221.68,0.0
256,7217,2048,1024,ck,0,0,38.8667,a8w8_blockscale_1x128x128_256x128x128x128_16x16_32x32_2x2_8x32x1_8x32x1_1x32x1x8_8_1x1_intrawave_v3,778.82,1004.67,0.0
256,7217,2048,4096,ck,0,0,105.1679,a8w8_blockscale_1x128x128_256x128x128x128_16x16_32x32_2x2_8x32x1_8x32x1_1x32x1x8_8_1x1_intrawave_v3,1151.31,641.93,0.0
256,7257,2048,128,cktile,19,0,18.1083,a8w8_blockscale_cktile_32x128x128_1x4x1_16x16x64_intrawave_0x1x0_3,210.11,1707.27,0.0
256,7257,2048,1024,ck,0,0,39.3201,a8w8_blockscale_1x128x128_256x128x128x128_16x16_32x32_2x2_8x32x1_8x32x1_1x32x1x8_8_1x1_intrawave_v3,774.11,998.29,0.0
256,7265,2048,128,cktile,7,0,18.1127,a8w8_blockscale_cktile_32x128x128_1x4x1_16x16x64_intrawave_0x1x0_2,210.29,1708.72,0.0
256,7265,2048,1024,ck,0,0,39.4389,a8w8_blockscale_1x128x128_256x128x128x128_16x16_32x32_2x2_8x32x1_8x32x1_1x32x1x8_8_1x1_intrawave_v3,772.63,996.32,0.0
256,7273,2048,512,ck,18,0,28.318,a8w8_blockscale_1x128x128_256x64x64x256_16x16_32x32_1x1_16x16x1_16x16x1_1x32x1x8_8_1x1_intrawave_v1,538.62,1220.52,0.0
256,7273,2048,4096,ck,0,0,106.6882,a8w8_blockscale_1x128x128_256x128x128x128_16x16_32x32_2x2_8x32x1_8x32x1_1x32x1x8_8_1x1_intrawave_v3,1143.71,637.08,0.0
256,7274,2048,512,ck,18,0,28.2954,a8w8_blockscale_1x128x128_256x64x64x256_16x16_32x32_1x1_16x16x1_16x16x1_1x32x1x8_8_1x1_intrawave_v1,539.12,1221.65,0.0
256,7274,2048,4096,ck,0,0,106.5983,a8w8_blockscale_1x128x128_256x128x128x128_16x16_32x32_2x2_8x32x1_8x32x1_1x32x1x8_8_1x1_intrawave_v3,1144.84,637.7,0.0
256,7391,2048,512,ck,18,0,28.4672,a8w8_blockscale_1x128x128_256x64x64x256_16x16_32x32_1x1_16x16x1_16x16x1_1x32x1x8_8_1x1_intrawave_v1,544.49,1233.22,0.0
256,7391,2048,4096,ck,0,0,106.3483,a8w8_blockscale_1x128x128_256x128x128x128_16x16_32x32_2x2_8x32x1_8x32x1_1x32x1x8_8_1x1_intrawave_v3,1165.98,648.21,0.0
256,7393,2048,128,cktile,19,0,18.2478,a8w8_blockscale_cktile_32x128x128_1x4x1_16x16x64_intrawave_0x1x0_3,212.41,1725.7,0.0
256,7393,2048,512,ck,18,0,27.9657,a8w8_blockscale_1x128x128_256x64x64x256_16x16_32x32_1x1_16x16x1_16x16x1_1x32x1x8_8_1x1_intrawave_v1,554.4,1255.66,0.0
256,7393,2048,1024,ck,0,0,39.1436,a8w8_blockscale_1x128x128_256x128x128x128_16x16_32x32_2x2_8x32x1_8x32x1_1x32x1x8_8_1x1_intrawave_v3,792.17,1020.58,0.0
256,7393,2048,4096,ck,0,0,105.6671,a8w8_blockscale_1x128x128_256x128x128x128_16x16_32x32_2x2_8x32x1_8x32x1_1x32x1x8_8_1x1_intrawave_v3,1173.82,652.54,0.0
256,7461,2048,128,cktile,7,0,18.304,a8w8_blockscale_cktile_32x128x128_1x4x1_16x16x64_intrawave_0x1x0_2,213.71,1736.09,0.0
256,7461,2048,1024,ck,0,0,39.8069,a8w8_blockscale_1x128x128_256x128x128x128_16x16_32x32_2x2_8x32x1_8x32x1_1x32x1x8_8_1x1_intrawave_v3,786.14,1012.32,0.0
256,7634,2048,128,cktile,19,0,18.8477,a8w8_blockscale_cktile_32x128x128_1x4x1_16x16x64_intrawave_0x1x0_3,212.36,1724.78,0.0
256,7634,2048,1024,ck,0,0,39.5297,a8w8_blockscale_1x128x128_256x128x128x128_16x16_32x32_2x2_8x32x1_8x32x1_1x32x1x8_8_1x1_intrawave_v3,810.01,1041.83,0.0
256,7715,2048,512,ck,0,0,28.4037,a8w8_blockscale_1x128x128_256x128x128x128_16x16_32x32_2x2_8x32x1_8x32x1_1x32x1x8_8_1x1_intrawave_v3,569.63,1288.54,0.0
256,7715,2048,4096,ck,0,0,108.5347,a8w8_blockscale_1x128x128_256x128x128x128_16x16_32x32_2x2_8x32x1_8x32x1_1x32x1x8_8_1x1_intrawave_v3,1192.58,659.6,0.0
256,7753,2048,512,ck,0,0,28.6889,a8w8_blockscale_1x128x128_256x128x128x128_16x16_32x32_2x2_8x32x1_8x32x1_1x32x1x8_8_1x1_intrawave_v3,566.74,1281.83,0.0
256,7753,2048,4096,ck,0,0,109.0219,a8w8_blockscale_1x128x128_256x128x128x128_16x16_32x32_2x2_8x32x1_8x32x1_1x32x1x8_8_1x1_intrawave_v3,1193.1,659.51,0.0
256,7819,2048,512,ck,0,0,28.5764,a8w8_blockscale_1x128x128_256x128x128x128_16x16_32x32_2x2_8x32x1_8x32x1_1x32x1x8_8_1x1_intrawave_v3,573.82,1297.52,0.0
256,7819,2048,4096,ck,0,0,109.2675,a8w8_blockscale_1x128x128_256x128x128x128_16x16_32x32_2x2_8x32x1_8x32x1_1x32x1x8_8_1x1_intrawave_v3,1200.55,662.98,0.0
256,8099,2048,512,ck,0,0,29.3241,a8w8_blockscale_1x128x128_256x128x128x128_16x16_32x32_2x2_8x32x1_8x32x1_1x32x1x8_8_1x1_intrawave_v3,579.21,1308.44,0.0
256,8099,2048,4096,ck,0,0,112.362,a8w8_blockscale_1x128x128_256x128x128x128_16x16_32x32_2x2_8x32x1_8x32x1_1x32x1x8_8_1x1_intrawave_v3,1209.29,665.13,0.0
256,8129,2048,128,cktile,26,0,19.3476,a8w8_blockscale_cktile_128x128x128_2x2x1_16x16x128_intrawave_0x1x0_4,220.28,1788.29,0.0
256,8129,2048,512,ck,0,0,29.5322,a8w8_blockscale_1x128x128_256x128x128x128_16x16_32x32_2x2_8x32x1_8x32x1_1x32x1x8_8_1x1_intrawave_v3,577.26,1303.9,0.0
256,8129,2048,1024,ck,0,0,41.5068,a8w8_blockscale_1x128x128_256x128x128x128_16x16_32x32_2x2_8x32x1_8x32x1_1x32x1x8_8_1x1_intrawave_v3,821.44,1053.26,0.0
256,8129,2048,4096,ck,0,0,112.1028,a8w8_blockscale_1x128x128_256x128x128x128_16x16_32x32_2x2_8x32x1_8x32x1_1x32x1x8_8_1x1_intrawave_v3,1216.58,668.86,0.0
256,8188,2048,512,ck,0,0,29.6776,a8w8_blockscale_1x128x128_256x128x128x128_16x16_32x32_2x2_8x32x1_8x32x1_1x32x1x8_8_1x1_intrawave_v3,578.6,1306.67,0.0
256,8188,2048,4096,ck,0,0,111.4607,a8w8_blockscale_1x128x128_256x128x128x128_16x16_32x32_2x2_8x32x1_8x32x1_1x32x1x8_8_1x1_intrawave_v3,1232.47,677.05,0.0
256,8192,2048,128,cktile,26,0,19.5328,a8w8_blockscale_cktile_128x128x128_2x2x1_16x16x128_intrawave_0x1x0_4,219.88,1784.95,0.0
256,8192,2048,512,ck,0,0,29.3122,a8w8_blockscale_1x128x128_256x128x128x128_16x16_32x32_2x2_8x32x1_8x32x1_1x32x1x8_8_1x1_intrawave_v3,586.1,1323.59,0.0
256,8192,2048,1024,ck,0,0,40.7881,a8w8_blockscale_1x128x128_256x128x128x128_16x16_32x32_2x2_8x32x1_8x32x1_1x32x1x8_8_1x1_intrawave_v3,842.4,1079.73,0.0
256,8192,2048,4096,ck,0,0,108.8823,a8w8_blockscale_1x128x128_256x128x128x128_16x16_32x32_2x2_8x32x1_8x32x1_1x32x1x8_8_1x1_intrawave_v3,1262.27,693.39,0.0
256,16384,2048,128,cktile,7,0,33.5161,a8w8_blockscale_cktile_32x128x128_1x4x1_16x16x64_intrawave_0x1x0_2,256.29,2072.68,0.0
256,16384,2048,512,ck,0,0,51.9295,a8w8_blockscale_1x128x128_256x128x128x128_16x16_32x32_2x2_8x32x1_8x32x1_1x32x1x8_8_1x1_intrawave_v3,661.66,1474.04,0.0
256,16384,2048,1024,ck,0,0,74.4976,a8w8_blockscale_1x128x128_256x128x128x128_16x16_32x32_2x2_8x32x1_8x32x1_1x32x1x8_8_1x1_intrawave_v3,922.44,1154.17,0.0
256,16384,2048,4096,cktile,27,0,179.219,a8w8_blockscale_cktile_192x256x128_4x2x1_16x16x128_intrawave_0x1x0_2,1533.75,795.71,0.0
256,32768,2048,128,cktile,7,0,61.8355,a8w8_blockscale_cktile_32x128x128_1x4x1_16x16x64_intrawave_0x1x0_2,277.83,2242.63,0.0
256,32768,2048,512,ck,0,0,96.2887,a8w8_blockscale_1x128x128_256x128x128x128_16x16_32x32_2x2_8x32x1_8x32x1_1x32x1x8_8_1x1_intrawave_v3,713.68,1579.04,0.0
256,32768,2048,1024,ck,0,0,142.5435,a8w8_blockscale_1x128x128_256x128x128x128_16x16_32x32_2x2_8x32x1_8x32x1_1x32x1x8_8_1x1_intrawave_v3,964.19,1191.7,0.0
256,32768,2048,4096,cktile,11,0,346.1169,a8w8_blockscale_cktile_192x256x128_4x2x1_16x16x128_intrawave_0x1x0_1,1588.35,799.8,0.0
256,1,2560,2048,ck,8,3,5.1851,a8w8_blockscale_1x128x128_256x16x64x256_16x16_16x16_1x1_16x16x1_16x16x1_1x16x1x16_4_1x1_intrawave_v1,2.02,1012.53,0.0
256,2,2560,2048,ck,8,2,5.2397,a8w8_blockscale_1x128x128_256x16x64x256_16x16_16x16_1x1_16x16x1_16x16x1_1x16x1x16_4_1x1_intrawave_v1,4.0,1003.34,0.0
256,4,2560,2048,ck,8,2,5.4396,a8w8_blockscale_1x128x128_256x16x64x256_16x16_16x16_1x1_16x16x1_16x16x1_1x16x1x16_4_1x1_intrawave_v1,7.71,969.11,0.0
256,8,2560,2048,ck,8,2,5.4595,a8w8_blockscale_1x128x128_256x16x64x256_16x16_16x16_1x1_16x16x1_16x16x1_1x16x1x16_4_1x1_intrawave_v1,15.37,970.83,0.0
256,16,2560,2048,ck,6,3,5.5408,a8w8_blockscale_1x128x128_256x16x64x128_8x16_16x16_1x1_16x16x1_8x32x1_1x16x1x16_4_1x1_intrawave_v1,30.28,966.93,0.0
256,32,2560,2048,ck,8,2,6.3301,a8w8_blockscale_1x128x128_256x16x64x256_16x16_16x16_1x1_16x16x1_16x16x1_1x16x1x16_4_1x1_intrawave_v1,53.01,864.48,0.0
256,48,2560,2048,ck,8,2,6.6005,a8w8_blockscale_1x128x128_256x16x64x256_16x16_16x16_1x1_16x16x1_16x16x1_1x16x1x16_4_1x1_intrawave_v1,76.25,846.44,0.0
256,64,2560,2048,ck,8,2,7.4708,a8w8_blockscale_1x128x128_256x16x64x256_16x16_16x16_1x1_16x16x1_16x16x1_1x16x1x16_4_1x1_intrawave_v1,89.83,763.19,0.0
256,80,2560,2048,ck,8,0,7.9879,a8w8_blockscale_1x128x128_256x16x64x256_16x16_16x16_1x1_16x16x1_16x16x1_1x16x1x16_4_1x1_intrawave_v1,105.02,728.14,0.0
256,96,2560,2048,ck,8,0,7.9825,a8w8_blockscale_1x128x128_256x16x64x256_16x16_16x16_1x1_16x16x1_16x16x1_1x16x1x16_4_1x1_intrawave_v1,126.1,743.0,0.0
256,112,2560,2048,ck,8,2,9.0915,a8w8_blockscale_1x128x128_256x16x64x256_16x16_16x16_1x1_16x16x1_16x16x1_1x16x1x16_4_1x1_intrawave_v1,129.18,664.98,0.0
256,128,2560,2048,ck,7,0,9.1413,a8w8_blockscale_1x128x128_256x16x128x256_16x16_16x16_1x2_16x16x1_16x16x1_1x16x1x16_8_1x2_intrawave_v1,146.83,673.91,0.0
256,256,2560,2048,ck,18,0,9.5244,a8w8_blockscale_1x128x128_256x64x64x256_16x16_32x32_1x1_16x16x1_16x16x1_1x32x1x8_8_1x1_intrawave_v1,281.84,743.13,0.0
256,512,2560,2048,ck,2,0,15.0221,a8w8_blockscale_1x128x128_256x64x128x128_16x16_32x32_1x2_8x32x1_8x32x1_1x32x1x8_8_1x1_intrawave_v3,357.39,593.32,0.0
256,588,2560,2048,ck,2,0,15.3486,a8w8_blockscale_1x128x128_256x64x128x128_16x16_32x32_1x2_8x32x1_8x32x1_1x32x1x8_8_1x1_intrawave_v3,401.71,616.19,0.0
256,773,2560,2048,ck,3,0,18.7042,a8w8_blockscale_1x128x128_256x64x64x128_16x16_32x32_1x1_8x32x1_8x32x1_1x32x1x8_8_1x1_intrawave_v3,433.35,576.54,0.0
256,822,2560,2048,ck,3,0,18.7922,a8w8_blockscale_1x128x128_256x64x64x128_16x16_32x32_1x1_8x32x1_8x32x1_1x32x1x8_8_1x1_intrawave_v3,458.66,592.53,0.0
256,1024,2560,2048,ck,0,0,19.3107,a8w8_blockscale_1x128x128_256x128x128x128_16x16_32x32_2x2_8x32x1_8x32x1_1x32x1x8_8_1x1_intrawave_v3,556.03,651.6,0.0
256,1025,2560,2048,ck,0,0,20.1257,a8w8_blockscale_1x128x128_256x128x128x128_16x16_32x32_2x2_8x32x1_8x32x1_1x32x1x8_8_1x1_intrawave_v3,534.04,625.57,0.0
256,1027,2560,2048,ck,0,0,20.0977,a8w8_blockscale_1x128x128_256x128x128x128_16x16_32x32_2x2_8x32x1_8x32x1_1x32x1x8_8_1x1_intrawave_v3,535.83,627.16,0.0
256,1042,2560,2048,ck,0,0,20.1017,a8w8_blockscale_1x128x128_256x128x128x128_16x16_32x32_2x2_8x32x1_8x32x1_1x32x1x8_8_1x1_intrawave_v3,543.54,632.38,0.0
256,1051,2560,2048,ck,0,0,20.0784,a8w8_blockscale_1x128x128_256x128x128x128_16x16_32x32_2x2_8x32x1_8x32x1_1x32x1x8_8_1x1_intrawave_v3,548.88,636.33,0.0
256,1055,2560,2048,ck,0,0,20.0099,a8w8_blockscale_1x128x128_256x128x128x128_16x16_32x32_2x2_8x32x1_8x32x1_1x32x1x8_8_1x1_intrawave_v3,552.85,639.94,0.0
256,1057,2560,2048,ck,0,0,20.112,a8w8_blockscale_1x128x128_256x128x128x128_16x16_32x32_2x2_8x32x1_8x32x1_1x32x1x8_8_1x1_intrawave_v3,551.09,637.4,0.0
256,1069,2560,2048,ck,0,0,20.2287,a8w8_blockscale_1x128x128_256x128x128x128_16x16_32x32_2x2_8x32x1_8x32x1_1x32x1x8_8_1x1_intrawave_v3,554.13,637.98,0.0
256,1072,2560,2048,ck,0,0,20.1638,a8w8_blockscale_1x128x128_256x128x128x128_16x16_32x32_2x2_8x32x1_8x32x1_1x32x1x8_8_1x1_intrawave_v3,557.47,641.1,0.0
256,1074,2560,2048,ck,0,0,20.1596,a8w8_blockscale_1x128x128_256x128x128x128_16x16_32x32_2x2_8x32x1_8x32x1_1x32x1x8_8_1x1_intrawave_v3,558.63,641.94,0.0
256,1091,2560,2048,ck,0,0,20.2823,a8w8_blockscale_1x128x128_256x128x128x128_16x16_32x32_2x2_8x32x1_8x32x1_1x32x1x8_8_1x1_intrawave_v3,564.04,644.07,0.0
256,1128,2560,2048,ck,0,0,20.1584,a8w8_blockscale_1x128x128_256x128x128x128_16x16_32x32_2x2_8x32x1_8x32x1_1x32x1x8_8_1x1_intrawave_v3,586.75,661.18,0.0
256,1136,2560,2048,ck,3,0,20.3971,a8w8_blockscale_1x128x128_256x64x64x128_16x16_32x32_1x1_8x32x1_8x32x1_1x32x1x8_8_1x1_intrawave_v3,584.0,656.26,0.0
256,1514,2560,2048,ck,0,0,21.0572,a8w8_blockscale_1x128x128_256x128x128x128_16x16_32x32_2x2_8x32x1_8x32x1_1x32x1x8_8_1x1_intrawave_v3,753.92,764.36,0.0
256,2017,2560,2048,ck,2,0,29.5912,a8w8_blockscale_1x128x128_256x64x128x128_16x16_32x32_1x2_8x32x1_8x32x1_1x32x1x8_8_1x1_intrawave_v3,714.73,665.76,0.0
256,2048,2560,2048,ck,2,0,29.733,a8w8_blockscale_1x128x128_256x64x128x128_16x16_32x32_1x2_8x32x1_8x32x1_1x32x1x8_8_1x1_intrawave_v3,722.26,670.06,0.0
256,2151,2560,2048,ck,2,0,29.5552,a8w8_blockscale_1x128x128_256x64x128x128_16x16_32x32_1x2_8x32x1_8x32x1_1x32x1x8_8_1x1_intrawave_v3,763.14,699.07,0.0
256,2332,2560,2048,ck,2,0,30.6141,a8w8_blockscale_1x128x128_256x64x128x128_16x16_32x32_1x2_8x32x1_8x32x1_1x32x1x8_8_1x1_intrawave_v3,798.74,717.27,0.0
256,2341,2560,2048,ck,2,0,30.4793,a8w8_blockscale_1x128x128_256x64x128x128_16x16_32x32_1x2_8x32x1_8x32x1_1x32x1x8_8_1x1_intrawave_v3,805.37,722.56,0.0
256,3072,2560,2048,ck,0,0,32.6549,a8w8_blockscale_1x128x128_256x128x128x128_16x16_32x32_2x2_8x32x1_8x32x1_1x32x1x8_8_1x1_intrawave_v3,986.44,834.88,0.0
256,3073,2560,2048,ck,0,0,33.5481,a8w8_blockscale_1x128x128_256x128x128x128_16x16_32x32_2x2_8x32x1_8x32x1_1x32x1x8_8_1x1_intrawave_v3,960.49,812.87,0.0
256,3089,2560,2048,ck,0,0,34.1161,a8w8_blockscale_1x128x128_256x128x128x128_16x16_32x32_2x2_8x32x1_8x32x1_1x32x1x8_8_1x1_intrawave_v3,949.42,802.7,0.0
256,3110,2560,2048,ck,0,0,33.6906,a8w8_blockscale_1x128x128_256x128x128x128_16x16_32x32_2x2_8x32x1_8x32x1_1x32x1x8_8_1x1_intrawave_v3,967.95,817.3,0.0
256,3137,2560,2048,ck,0,0,33.6237,a8w8_blockscale_1x128x128_256x128x128x128_16x16_32x32_2x2_8x32x1_8x32x1_1x32x1x8_8_1x1_intrawave_v3,978.29,824.68,0.0
256,3613,2560,2048,cktile,12,0,40.5289,a8w8_blockscale_cktile_192x256x128_4x2x1_16x16x128_intrawave_0x1x0_1_aqrm,934.77,768.36,0.0
256,4096,2560,2048,cktile,12,0,41.0557,a8w8_blockscale_cktile_192x256x128_4x2x1_16x16x128_intrawave_0x1x0_1_aqrm,1046.13,842.83,0.0
256,4097,2560,2048,cktile,30,0,41.3734,a8w8_blockscale_cktile_192x256x128_4x2x1_16x16x128_intrawave_0x1x0_2_aqrm,1038.35,836.53,0.0
256,4109,2560,2048,cktile,30,0,41.0798,a8w8_blockscale_cktile_192x256x128_4x2x1_16x16x128_intrawave_0x1x0_2_aqrm,1048.84,844.6,0.0
256,4143,2560,2048,cktile,31,0,41.4955,a8w8_blockscale_cktile_192x256x128_4x2x1_16x16x128_intrawave_0x1x0_3_aqrm,1046.92,842.02,0.0
256,4345,2560,2048,cktile,12,0,41.4745,a8w8_blockscale_cktile_192x256x128_4x2x1_16x16x128_intrawave_0x1x0_1_aqrm,1098.52,877.35,0.0
256,4413,2560,2048,cktile,32,0,41.9169,a8w8_blockscale_cktile_192x256x128_4x2x1_16x16x128_intrawave_0x1x0_4_aqrm,1103.94,879.72,0.0
256,5121,2560,2048,ck,0,0,58.6139,a8w8_blockscale_1x128x128_256x128x128x128_16x16_32x32_2x2_8x32x1_8x32x1_1x32x1x8_8_1x1_intrawave_v3,916.12,715.7,0.0
256,5123,2560,2048,ck,0,0,58.8979,a8w8_blockscale_1x128x128_256x128x128x128_16x16_32x32_2x2_8x32x1_8x32x1_1x32x1x8_8_1x1_intrawave_v3,912.06,712.5,0.0
256,5133,2560,2048,ck,0,0,58.4899,a8w8_blockscale_1x128x128_256x128x128x128_16x16_32x32_2x2_8x32x1_8x32x1_1x32x1x8_8_1x1_intrawave_v3,920.22,718.69,0.0
256,5185,2560,2048,ck,0,0,58.3839,a8w8_blockscale_1x128x128_256x128x128x128_16x16_32x32_2x2_8x32x1_8x32x1_1x32x1x8_8_1x1_intrawave_v3,931.23,726.38,0.0
256,5191,2560,2048,ck,0,0,58.6547,a8w8_blockscale_1x128x128_256x128x128x128_16x16_32x32_2x2_8x32x1_8x32x1_1x32x1x8_8_1x1_intrawave_v3,928.0,723.76,0.0
256,6146,2560,2048,ck,0,0,61.8603,a8w8_blockscale_1x128x128_256x128x128x128_16x16_32x32_2x2_8x32x1_8x32x1_1x32x1x8_8_1x1_intrawave_v3,1041.79,796.92,0.0
256,6147,2560,2048,ck,0,0,63.0667,a8w8_blockscale_1x128x128_256x128x128x128_16x16_32x32_2x2_8x32x1_8x32x1_1x32x1x8_8_1x1_intrawave_v3,1022.03,781.78,0.0
256,6155,2560,2048,ck,0,0,62.7695,a8w8_blockscale_1x128x128_256x128x128x128_16x16_32x32_2x2_8x32x1_8x32x1_1x32x1x8_8_1x1_intrawave_v3,1028.2,786.4,0.0
256,6377,2560,2048,ck,0,0,63.7907,a8w8_blockscale_1x128x128_256x128x128x128_16x16_32x32_2x2_8x32x1_8x32x1_1x32x1x8_8_1x1_intrawave_v3,1048.24,798.76,0.0
256,6401,2560,2048,ck,0,0,63.1255,a8w8_blockscale_1x128x128_256x128x128x128_16x16_32x32_2x2_8x32x1_8x32x1_1x32x1x8_8_1x1_intrawave_v3,1063.27,809.9,0.0
256,7121,2560,2048,ck,0,0,73.2816,a8w8_blockscale_1x128x128_256x128x128x128_16x16_32x32_2x2_8x32x1_8x32x1_1x32x1x8_8_1x1_intrawave_v3,1018.93,768.08,0.0
256,7169,2560,2048,ck,0,0,74.0796,a8w8_blockscale_1x128x128_256x128x128x128_16x16_32x32_2x2_8x32x1_8x32x1_1x32x1x8_8_1x1_intrawave_v3,1014.75,764.45,0.0
256,7170,2560,2048,ck,0,0,72.4768,a8w8_blockscale_1x128x128_256x128x128x128_16x16_32x32_2x2_8x32x1_8x32x1_1x32x1x8_8_1x1_intrawave_v3,1037.34,781.46,0.0
256,7176,2560,2048,ck,0,0,73.8008,a8w8_blockscale_1x128x128_256x128x128x128_16x16_32x32_2x2_8x32x1_8x32x1_1x32x1x8_8_1x1_intrawave_v3,1019.58,768.02,0.0
256,7177,2560,2048,ck,0,0,74.3264,a8w8_blockscale_1x128x128_256x128x128x128_16x16_32x32_2x2_8x32x1_8x32x1_1x32x1x8_8_1x1_intrawave_v3,1012.51,762.68,0.0
256,7185,2560,2048,ck,0,0,74.112,a8w8_blockscale_1x128x128_256x128x128x128_16x16_32x32_2x2_8x32x1_8x32x1_1x32x1x8_8_1x1_intrawave_v3,1016.57,765.66,0.0
256,7206,2560,2048,ck,0,0,74.4608,a8w8_blockscale_1x128x128_256x128x128x128_16x16_32x32_2x2_8x32x1_8x32x1_1x32x1x8_8_1x1_intrawave_v3,1014.77,764.1,0.0
256,7217,2560,2048,ck,0,0,73.742,a8w8_blockscale_1x128x128_256x128x128x128_16x16_32x32_2x2_8x32x1_8x32x1_1x32x1x8_8_1x1_intrawave_v3,1026.22,772.62,0.0
256,7257,2560,2048,ck,0,0,73.4244,a8w8_blockscale_1x128x128_256x128x128x128_16x16_32x32_2x2_8x32x1_8x32x1_1x32x1x8_8_1x1_intrawave_v3,1036.37,779.86,0.0
256,7265,2560,2048,ck,0,0,73.6176,a8w8_blockscale_1x128x128_256x128x128x128_16x16_32x32_2x2_8x32x1_8x32x1_1x32x1x8_8_1x1_intrawave_v3,1034.79,778.6,0.0
256,7393,2560,2048,ck,0,0,75.1552,a8w8_blockscale_1x128x128_256x128x128x128_16x16_32x32_2x2_8x32x1_8x32x1_1x32x1x8_8_1x1_intrawave_v3,1031.48,774.88,0.0
256,7461,2560,2048,ck,0,0,75.8072,a8w8_blockscale_1x128x128_256x128x128x128_16x16_32x32_2x2_8x32x1_8x32x1_1x32x1x8_8_1x1_intrawave_v3,1032.02,774.64,0.0
256,7634,2560,2048,ck,0,0,76.7457,a8w8_blockscale_1x128x128_256x128x128x128_16x16_32x32_2x2_8x32x1_8x32x1_1x32x1x8_8_1x1_intrawave_v3,1043.03,781.33,0.0
256,8129,2560,2048,cktile,27,0,78.4055,a8w8_blockscale_cktile_192x256x128_4x2x1_16x16x128_intrawave_0x1x0_2,1087.15,810.04,0.0
256,8192,2560,2048,cktile,11,0,77.0231,a8w8_blockscale_cktile_192x256x128_4x2x1_16x16x128_intrawave_0x1x0_1,1115.24,830.44,0.0
256,16384,2560,2048,ck,0,0,143.0345,a8w8_blockscale_1x128x128_256x128x128x128_16x16_32x32_2x2_8x32x1_8x32x1_1x32x1x8_8_1x1_intrawave_v3,1201.1,857.72,0.0
256,32768,2560,2048,cktile,29,0,251.4564,a8w8_blockscale_cktile_192x256x128_4x2x1_16x16x128_intrawave_0x1x0_4,1366.43,954.93,0.0
256,1,3072,2048,ck,8,2,5.3736,a8w8_blockscale_1x128x128_256x16x64x256_16x16_16x16_1x1_16x16x1_16x16x1_1x16x1x16_4_1x1_intrawave_v1,2.34,1172.33,0.0
256,2,3072,2048,ck,8,2,5.4238,a8w8_blockscale_1x128x128_256x16x64x256_16x16_16x16_1x1_16x16x1_16x16x1_1x16x1x16_4_1x1_intrawave_v1,4.64,1162.99,0.0
256,4,3072,2048,ck,8,3,5.5084,a8w8_blockscale_1x128x128_256x16x64x256_16x16_16x16_1x1_16x16x1_16x16x1_1x16x1x16_4_1x1_intrawave_v1,9.14,1148.11,0.0
256,8,3072,2048,ck,8,3,5.6114,a8w8_blockscale_1x128x128_256x16x64x256_16x16_16x16_1x1_16x16x1_16x16x1_1x16x1x16_4_1x1_intrawave_v1,17.94,1132.87,0.0
256,16,3072,2048,ck,8,2,5.6242,a8w8_blockscale_1x128x128_256x16x64x256_16x16_16x16_1x1_16x16x1_16x16x1_1x16x1x16_4_1x1_intrawave_v1,35.8,1141.95,0.0
256,32,3072,2048,ck,8,2,6.402,a8w8_blockscale_1x128x128_256x16x64x256_16x16_16x16_1x1_16x16x1_16x16x1_1x16x1x16_4_1x1_intrawave_v1,62.89,1023.68,0.0
256,48,3072,2048,ck,8,2,7.456,a8w8_blockscale_1x128x128_256x16x64x256_16x16_16x16_1x1_16x16x1_16x16x1_1x16x1x16_4_1x1_intrawave_v1,81.01,896.55,0.0
256,64,3072,2048,ck,8,2,7.695,a8w8_blockscale_1x128x128_256x16x64x256_16x16_16x16_1x1_16x16x1_16x16x1_1x16x1x16_4_1x1_intrawave_v1,104.65,885.74,0.0
256,80,3072,2048,ck,8,0,8.168,a8w8_blockscale_1x128x128_256x16x64x256_16x16_16x16_1x1_16x16x1_16x16x1_1x16x1x16_4_1x1_intrawave_v1,123.24,850.49,0.0
256,96,3072,2048,ck,8,2,9.1816,a8w8_blockscale_1x128x128_256x16x64x256_16x16_16x16_1x1_16x16x1_16x16x1_1x16x1x16_4_1x1_intrawave_v1,131.56,770.88,0.0
256,112,3072,2048,ck,7,0,9.4242,a8w8_blockscale_1x128x128_256x16x128x256_16x16_16x16_1x2_16x16x1_16x16x1_1x16x1x16_8_1x2_intrawave_v1,149.54,764.94,0.0
256,128,3072,2048,ck,7,0,9.1599,a8w8_blockscale_1x128x128_256x16x128x256_16x16_16x16_1x2_16x16x1_16x16x1_1x16x1x16_8_1x2_intrawave_v1,175.83,801.32,0.0
256,256,3072,2048,ck,18,0,9.7699,a8w8_blockscale_1x128x128_256x64x64x256_16x16_32x32_1x1_16x16x1_16x16x1_1x32x1x8_8_1x1_intrawave_v1,329.71,858.62,0.0
256,512,3072,2048,ck,2,0,15.1241,a8w8_blockscale_1x128x128_256x64x128x128_16x16_32x32_1x2_8x32x1_8x32x1_1x32x1x8_8_1x1_intrawave_v3,425.97,693.31,0.0
256,588,3072,2048,ck,2,0,15.569,a8w8_blockscale_1x128x128_256x64x128x128_16x16_32x32_1x2_8x32x1_8x32x1_1x32x1x8_8_1x1_intrawave_v3,475.22,713.49,0.0
256,773,3072,2048,ck,0,0,19.8311,a8w8_blockscale_1x128x128_256x128x128x128_16x16_32x32_2x2_8x32x1_8x32x1_1x32x1x8_8_1x1_intrawave_v3,490.47,636.57,0.0
256,822,3072,2048,ck,0,0,19.913,a8w8_blockscale_1x128x128_256x128x128x128_16x16_32x32_2x2_8x32x1_8x32x1_1x32x1x8_8_1x1_intrawave_v3,519.42,654.11,0.0
256,1024,3072,2048,ck,0,0,19.6751,a8w8_blockscale_1x128x128_256x128x128x128_16x16_32x32_2x2_8x32x1_8x32x1_1x32x1x8_8_1x1_intrawave_v3,654.88,746.12,0.0
256,1025,3072,2048,ck,0,0,20.4939,a8w8_blockscale_1x128x128_256x128x128x128_16x16_32x32_2x2_8x32x1_8x32x1_1x32x1x8_8_1x1_intrawave_v3,629.33,716.71,0.0
256,1027,3072,2048,ck,0,0,20.4503,a8w8_blockscale_1x128x128_256x128x128x128_16x16_32x32_2x2_8x32x1_8x32x1_1x32x1x8_8_1x1_intrawave_v3,631.91,719.04,0.0
256,1042,3072,2048,ck,0,0,20.4963,a8w8_blockscale_1x128x128_256x128x128x128_16x16_32x32_2x2_8x32x1_8x32x1_1x32x1x8_8_1x1_intrawave_v3,639.7,723.42,0.0
256,1051,3072,2048,ck,0,0,20.5601,a8w8_blockscale_1x128x128_256x128x128x128_16x16_32x32_2x2_8x32x1_8x32x1_1x32x1x8_8_1x1_intrawave_v3,643.22,724.77,0.0
256,1055,3072,2048,ck,0,0,20.4972,a8w8_blockscale_1x128x128_256x128x128x128_16x16_32x32_2x2_8x32x1_8x32x1_1x32x1x8_8_1x1_intrawave_v3,647.65,728.59,0.0
256,1057,3072,2048,ck,0,0,20.5017,a8w8_blockscale_1x128x128_256x128x128x128_16x16_32x32_2x2_8x32x1_8x32x1_1x32x1x8_8_1x1_intrawave_v3,648.73,729.23,0.0
256,1069,3072,2048,ck,0,0,20.5197,a8w8_blockscale_1x128x128_256x128x128x128_16x16_32x32_2x2_8x32x1_8x32x1_1x32x1x8_8_1x1_intrawave_v3,655.52,733.38,0.0
256,1072,3072,2048,ck,0,0,20.6659,a8w8_blockscale_1x128x128_256x128x128x128_16x16_32x32_2x2_8x32x1_8x32x1_1x32x1x8_8_1x1_intrawave_v3,652.71,729.38,0.0
256,1074,3072,2048,ck,0,0,20.7649,a8w8_blockscale_1x128x128_256x128x128x128_16x16_32x32_2x2_8x32x1_8x32x1_1x32x1x8_8_1x1_intrawave_v3,650.81,726.69,0.0
256,1091,3072,2048,ck,0,0,20.7386,a8w8_blockscale_1x128x128_256x128x128x128_16x16_32x32_2x2_8x32x1_8x32x1_1x32x1x8_8_1x1_intrawave_v3,661.95,734.33,0.0
256,1128,3072,2048,ck,0,0,20.8767,a8w8_blockscale_1x128x128_256x128x128x128_16x16_32x32_2x2_8x32x1_8x32x1_1x32x1x8_8_1x1_intrawave_v3,679.87,743.99,0.0
256,1136,3072,2048,ck,0,0,20.7664,a8w8_blockscale_1x128x128_256x128x128x128_16x16_32x32_2x2_8x32x1_8x32x1_1x32x1x8_8_1x1_intrawave_v3,688.33,751.1,0.0
256,1514,3072,2048,ck,2,0,28.3442,a8w8_blockscale_1x128x128_256x64x128x128_16x16_32x32_1x2_8x32x1_8x32x1_1x32x1x8_8_1x1_intrawave_v3,672.11,659.54,0.0
256,2017,3072,2048,ck,2,0,31.0552,a8w8_blockscale_1x128x128_256x64x128x128_16x16_32x32_1x2_8x32x1_8x32x1_1x32x1x8_8_1x1_intrawave_v3,817.25,734.65,0.0
256,2048,3072,2048,ck,2,0,31.2969,a8w8_blockscale_1x128x128_256x64x128x128_16x16_32x32_1x2_8x32x1_8x32x1_1x32x1x8_8_1x1_intrawave_v3,823.4,737.09,0.0
256,2151,3072,2048,ck,0,0,31.8069,a8w8_blockscale_1x128x128_256x128x128x128_16x16_32x32_2x2_8x32x1_8x32x1_1x32x1x8_8_1x1_intrawave_v3,850.94,751.8,0.0
256,2332,3072,2048,ck,0,0,32.7981,a8w8_blockscale_1x128x128_256x128x128x128_16x16_32x32_2x2_8x32x1_8x32x1_1x32x1x8_8_1x1_intrawave_v3,894.67,774.29,0.0
256,2341,3072,2048,ck,0,0,32.5325,a8w8_blockscale_1x128x128_256x128x128x128_16x16_32x32_2x2_8x32x1_8x32x1_1x32x1x8_8_1x1_intrawave_v3,905.45,782.88,0.0
256,3072,3072,2048,cktile,31,0,40.2284,a8w8_blockscale_cktile_192x256x128_4x2x1_16x16x128_intrawave_0x1x0_3_aqrm,960.88,781.97,0.0
256,3073,3072,2048,cktile,30,0,40.3804,a8w8_blockscale_cktile_192x256x128_4x2x1_16x16x128_intrawave_0x1x0_2_aqrm,957.58,779.23,0.0
256,3089,3072,2048,cktile,31,0,40.1503,a8w8_blockscale_cktile_192x256x128_4x2x1_16x16x128_intrawave_0x1x0_3_aqrm,968.08,786.96,0.0
256,3110,3072,2048,cktile,30,0,40.4398,a8w8_blockscale_cktile_192x256x128_4x2x1_16x16x128_intrawave_0x1x0_2_aqrm,967.68,785.58,0.0
256,3137,3072,2048,cktile,30,0,40.3476,a8w8_blockscale_cktile_192x256x128_4x2x1_16x16x128_intrawave_0x1x0_2_aqrm,978.31,792.85,0.0
256,3613,3072,2048,cktile,31,0,41.4415,a8w8_blockscale_cktile_192x256x128_4x2x1_16x16x128_intrawave_0x1x0_3_aqrm,1097.02,866.02,0.0
256,4096,3072,2048,ck,0,0,49.9698,a8w8_blockscale_1x128x128_256x128x128x128_16x16_32x32_2x2_8x32x1_8x32x1_1x32x1x8_8_1x1_intrawave_v3,1031.42,797.4,0.0
256,4097,3072,2048,ck,0,0,58.3831,a8w8_blockscale_1x128x128_256x128x128x128_16x16_32x32_2x2_8x32x1_8x32x1_1x32x1x8_8_1x1_intrawave_v3,883.0,682.63,0.0
256,4109,3072,2048,ck,0,0,58.3735,a8w8_blockscale_1x128x128_256x128x128x128_16x16_32x32_2x2_8x32x1_8x32x1_1x32x1x8_8_1x1_intrawave_v3,885.73,684.43,0.0
256,4143,3072,2048,ck,0,0,58.0536,a8w8_blockscale_1x128x128_256x128x128x128_16x16_32x32_2x2_8x32x1_8x32x1_1x32x1x8_8_1x1_intrawave_v3,897.98,693.0,0.0
256,4345,3072,2048,ck,0,0,58.3151,a8w8_blockscale_1x128x128_256x128x128x128_16x16_32x32_2x2_8x32x1_8x32x1_1x32x1x8_8_1x1_intrawave_v3,937.54,718.27,0.0
256,4413,3072,2048,ck,0,0,58.8791,a8w8_blockscale_1x128x128_256x128x128x128_16x16_32x32_2x2_8x32x1_8x32x1_1x32x1x8_8_1x1_intrawave_v3,943.09,720.85,0.0
256,5121,3072,2048,ck,0,0,62.8803,a8w8_blockscale_1x128x128_256x128x128x128_16x16_32x32_2x2_8x32x1_8x32x1_1x32x1x8_8_1x1_intrawave_v3,1024.76,767.21,0.0
256,5123,3072,2048,ck,0,0,62.1707,a8w8_blockscale_1x128x128_256x128x128x128_16x16_32x32_2x2_8x32x1_8x32x1_1x32x1x8_8_1x1_intrawave_v3,1036.86,776.23,0.0
256,5133,3072,2048,ck,0,0,62.7395,a8w8_blockscale_1x128x128_256x128x128x128_16x16_32x32_2x2_8x32x1_8x32x1_1x32x1x8_8_1x1_intrawave_v3,1029.46,770.5,0.0
256,5185,3072,2048,ck,0,0,63.0303,a8w8_blockscale_1x128x128_256x128x128x128_16x16_32x32_2x2_8x32x1_8x32x1_1x32x1x8_8_1x1_intrawave_v3,1035.1,773.71,0.0
256,5191,3072,2048,ck,0,0,63.6875,a8w8_blockscale_1x128x128_256x128x128x128_16x16_32x32_2x2_8x32x1_8x32x1_1x32x1x8_8_1x1_intrawave_v3,1025.6,766.49,0.0
256,6146,3072,2048,ck,0,0,74.6668,a8w8_blockscale_1x128x128_256x128x128x128_16x16_32x32_2x2_8x32x1_8x32x1_1x32x1x8_8_1x1_intrawave_v3,1035.73,758.56,0.0
256,6147,3072,2048,ck,0,0,74.732,a8w8_blockscale_1x128x128_256x128x128x128_16x16_32x32_2x2_8x32x1_8x32x1_1x32x1x8_8_1x1_intrawave_v3,1034.99,758.01,0.0
256,6155,3072,2048,ck,0,0,75.5068,a8w8_blockscale_1x128x128_256x128x128x128_16x16_32x32_2x2_8x32x1_8x32x1_1x32x1x8_8_1x1_intrawave_v3,1025.71,751.1,0.0
256,6377,3072,2048,ck,0,0,75.8664,a8w8_blockscale_1x128x128_256x128x128x128_16x16_32x32_2x2_8x32x1_8x32x1_1x32x1x8_8_1x1_intrawave_v3,1057.66,771.51,0.0
256,6401,3072,2048,ck,0,0,76.4048,a8w8_blockscale_1x128x128_256x128x128x128_16x16_32x32_2x2_8x32x1_8x32x1_1x32x1x8_8_1x1_intrawave_v3,1054.16,768.65,0.0
256,7121,3072,2048,cktile,27,0,77.7946,a8w8_blockscale_cktile_192x256x128_4x2x1_16x16x128_intrawave_0x1x0_2,1151.79,830.73,0.0
256,7169,3072,2048,cktile,29,0,78.2878,a8w8_blockscale_cktile_192x256x128_4x2x1_16x16x128_intrawave_0x1x0_4,1152.25,830.52,0.0
256,7170,3072,2048,cktile,28,0,78.4746,a8w8_blockscale_cktile_192x256x128_4x2x1_16x16x128_intrawave_0x1x0_3,1149.66,828.65,0.0
256,7176,3072,2048,cktile,29,0,78.3466,a8w8_blockscale_cktile_192x256x128_4x2x1_16x16x128_intrawave_0x1x0_4,1152.51,830.63,0.0
256,7177,3072,2048,cktile,28,0,78.3023,a8w8_blockscale_cktile_192x256x128_4x2x1_16x16x128_intrawave_0x1x0_3,1153.32,831.21,0.0
256,7185,3072,2048,cktile,28,0,77.7878,a8w8_blockscale_cktile_192x256x128_4x2x1_16x16x128_intrawave_0x1x0_3,1162.24,837.55,0.0
256,7206,3072,2048,cktile,29,0,78.155,a8w8_blockscale_cktile_192x256x128_4x2x1_16x16x128_intrawave_0x1x0_4,1160.16,835.81,0.0
256,7217,3072,2048,cktile,28,0,77.9958,a8w8_blockscale_cktile_192x256x128_4x2x1_16x16x128_intrawave_0x1x0_3,1164.3,838.67,0.0
256,7257,3072,2048,cktile,11,0,77.8994,a8w8_blockscale_cktile_192x256x128_4x2x1_16x16x128_intrawave_0x1x0_1,1172.21,843.92,0.0
256,7265,3072,2048,cktile,11,0,78.1121,a8w8_blockscale_cktile_192x256x128_4x2x1_16x16x128_intrawave_0x1x0_1,1170.3,842.46,0.0
256,7393,3072,2048,cktile,28,0,78.2247,a8w8_blockscale_cktile_192x256x128_4x2x1_16x16x128_intrawave_0x1x0_3,1189.21,854.65,0.0
256,7461,3072,2048,cktile,11,0,78.637,a8w8_blockscale_cktile_192x256x128_4x2x1_16x16x128_intrawave_0x1x0_1,1193.85,857.26,0.0
256,7634,3072,2048,cktile,11,0,78.8903,a8w8_blockscale_cktile_192x256x128_4x2x1_16x16x128_intrawave_0x1x0_1,1217.61,872.47,0.0
256,8129,3072,2048,ck,0,0,92.9778,a8w8_blockscale_1x128x128_256x128x128x128_16x16_32x32_2x2_8x32x1_8x32x1_1x32x1x8_8_1x1_intrawave_v3,1100.12,783.89,0.0
256,8192,3072,2048,ck,0,0,89.301,a8w8_blockscale_1x128x128_256x128x128x128_16x16_32x32_2x2_8x32x1_8x32x1_1x32x1x8_8_1x1_intrawave_v3,1154.29,821.94,0.0
256,16384,3072,2048,ck,0,0,164.3819,a8w8_blockscale_1x128x128_256x128x128x128_16x16_32x32_2x2_8x32x1_8x32x1_1x32x1x8_8_1x1_intrawave_v3,1254.14,854.77,0.0
256,32768,3072,2048,cktile,11,0,285.3358,a8w8_blockscale_cktile_192x256x128_4x2x1_16x16x128_intrawave_0x1x0_1,1445.02,962.82,0.0
256,1,4096,1280,ck,8,0,5.8799,a8w8_blockscale_1x128x128_256x16x64x256_16x16_16x16_1x1_16x16x1_16x16x1_1x16x1x16_4_1x1_intrawave_v1,1.78,893.27,0.0
256,2,4096,1280,ck,8,0,5.9023,a8w8_blockscale_1x128x128_256x16x64x256_16x16_16x16_1x1_16x16x1_16x16x1_1x16x1x16_4_1x1_intrawave_v1,3.55,891.49,0.0
256,4,4096,1280,ck,8,0,5.9215,a8w8_blockscale_1x128x128_256x16x64x256_16x16_16x16_1x1_16x16x1_16x16x1_1x16x1x16_4_1x1_intrawave_v1,7.08,891.8,0.0
256,8,4096,1280,ck,8,0,5.9227,a8w8_blockscale_1x128x128_256x16x64x256_16x16_16x16_1x1_16x16x1_16x16x1_1x16x1x16_4_1x1_intrawave_v1,14.16,898.01,0.0
256,16,4096,1280,ck,8,0,5.8783,a8w8_blockscale_1x128x128_256x16x64x256_16x16_16x16_1x1_16x16x1_16x16x1_1x16x1x16_4_1x1_intrawave_v1,28.54,917.69,0.0
256,32,4096,1280,ck,8,0,6.0527,a8w8_blockscale_1x128x128_256x16x64x256_16x16_16x16_1x1_16x16x1_16x16x1_1x16x1x16_4_1x1_intrawave_v1,55.44,916.28,0.0
256,64,4096,1280,ck,8,0,6.1413,a8w8_blockscale_1x128x128_256x16x64x256_16x16_16x16_1x1_16x16x1_16x16x1_1x16x1x16_4_1x1_intrawave_v1,109.27,952.42,0.0
256,128,4096,1280,ck,7,0,7.1998,a8w8_blockscale_1x128x128_256x16x128x256_16x16_16x16_1x2_16x16x1_16x16x1_1x16x1x16_8_1x2_intrawave_v1,186.42,896.59,0.0
256,256,4096,1280,ck,18,0,8.0378,a8w8_blockscale_1x128x128_256x64x64x256_16x16_32x32_1x1_16x16x1_16x16x1_1x32x1x8_8_1x1_intrawave_v1,333.97,953.96,0.0
256,512,4096,1280,ck,2,0,11.3727,a8w8_blockscale_1x128x128_256x64x128x128_16x16_32x32_1x2_8x32x1_8x32x1_1x32x1x8_8_1x1_intrawave_v3,472.07,887.44,0.0
256,1024,4096,1280,ck,0,0,15.1816,a8w8_blockscale_1x128x128_256x128x128x128_16x16_32x32_2x2_8x32x1_8x32x1_1x32x1x8_8_1x1_intrawave_v3,707.27,984.23,0.0
256,2048,4096,1280,ck,0,0,24.9357,a8w8_blockscale_1x128x128_256x128x128x128_16x16_32x32_2x2_8x32x1_8x32x1_1x32x1x8_8_1x1_intrawave_v3,861.21,988.2,0.0
256,4096,4096,1280,ck,0,0,45.8386,a8w8_blockscale_1x128x128_256x128x128x128_16x16_32x32_2x2_8x32x1_8x32x1_1x32x1x8_8_1x1_intrawave_v3,936.98,960.77,0.0
256,8192,4096,1280,ck,0,0,84.6901,a8w8_blockscale_1x128x128_256x128x128x128_16x16_32x32_2x2_8x32x1_8x32x1_1x32x1x8_8_1x1_intrawave_v3,1014.28,978.12,0.0
256,16384,4096,1280,ck,0,0,157.4202,a8w8_blockscale_1x128x128_256x128x128x128_16x16_32x32_2x2_8x32x1_8x32x1_1x32x1x8_8_1x1_intrawave_v3,1091.34,1019.13,0.0
256,32768,4096,1280,ck,0,0,292.1735,a8w8_blockscale_1x128x128_256x128x128x128_16x16_32x32_2x2_8x32x1_8x32x1_1x32x1x8_8_1x1_intrawave_v3,1176.0,1080.25,0.0
256,1,4608,7168,ck,6,3,10.2209,a8w8_blockscale_1x128x128_256x16x64x128_8x16_16x16_1x1_16x16x1_8x32x1_1x16x1x16_4_1x1_intrawave_v1,6.46,3233.23,0.0002
256,2,4608,7168,ck,6,3,10.6377,a8w8_blockscale_1x128x128_256x16x64x128_8x16_16x16_1x1_16x16x1_8x32x1_1x16x1x16_4_1x1_intrawave_v1,12.42,3108.09,0.0014
256,4,4608,7168,ck,6,3,10.6372,a8w8_blockscale_1x128x128_256x16x64x128_8x16_16x16_1x1_16x16x1_8x32x1_1x16x1x16_4_1x1_intrawave_v1,24.84,3111.32,0.0008
256,8,4608,7168,ck,6,3,10.6496,a8w8_blockscale_1x128x128_256x16x64x128_8x16_16x16_1x1_16x16x1_8x32x1_1x16x1x16_4_1x1_intrawave_v1,49.62,3113.85,0.0006
256,16,4608,7168,ck,6,3,11.1519,a8w8_blockscale_1x128x128_256x16x64x128_8x16_16x16_1x1_16x16x1_8x32x1_1x16x1x16_4_1x1_intrawave_v1,94.78,2985.35,0.0007
256,32,4608,7168,ck,6,3,17.6977,a8w8_blockscale_1x128x128_256x16x64x128_8x16_16x16_1x1_16x16x1_8x32x1_1x16x1x16_4_1x1_intrawave_v1,119.45,1895.98,0.0006
256,64,4608,7168,ck,18,1,23.0073,a8w8_blockscale_1x128x128_256x64x64x256_16x16_32x32_1x1_16x16x1_16x16x1_1x32x1x8_8_1x1_intrawave_v1,183.76,1481.21,0.0
256,128,4608,7168,ck,18,0,25.7631,a8w8_blockscale_1x128x128_256x64x64x256_16x16_32x32_1x1_16x16x1_16x16x1_1x32x1x8_8_1x1_intrawave_v1,328.21,1363.47,0.0
256,256,4608,7168,ck,2,0,41.8145,a8w8_blockscale_1x128x128_256x64x128x128_16x16_32x32_1x2_8x32x1_8x32x1_1x32x1x8_8_1x1_intrawave_v3,404.44,890.23,0.0
256,512,4608,7168,ck,0,0,52.7444,a8w8_blockscale_1x128x128_256x128x128x128_16x16_32x32_2x2_8x32x1_8x32x1_1x32x1x8_8_1x1_intrawave_v3,641.26,785.27,0.0
256,1024,4608,7168,ck,2,0,84.1889,a8w8_blockscale_1x128x128_256x64x128x128_16x16_32x32_1x2_8x32x1_8x32x1_1x32x1x8_8_1x1_intrawave_v3,803.5,591.61,0.0
256,1536,4608,7168,ck,0,0,89.0528,a8w8_blockscale_1x128x128_256x128x128x128_16x16_32x32_2x2_8x32x1_8x32x1_1x32x1x8_8_1x1_intrawave_v3,1139.42,653.5,0.0
256,2048,4608,7168,cktile,28,0,94.5524,a8w8_blockscale_cktile_192x256x128_4x2x1_16x16x128_intrawave_0x1x0_3,1430.86,704.21,0.0
256,4096,4608,7168,cktile,11,0,177.5435,a8w8_blockscale_cktile_192x256x128_4x2x1_16x16x128_intrawave_0x1x0_1,1524.04,564.03,0.0
256,8192,4608,7168,cktile,29,0,300.3739,a8w8_blockscale_cktile_192x256x128_4x2x1_16x16x128_intrawave_0x1x0_4,1801.64,556.8,0.0
256,16384,4608,7168,cktile,11,0,535.1425,a8w8_blockscale_cktile_192x256x128_4x2x1_16x16x128_intrawave_0x1x0_1,2022.51,563.34,0.0
256,20480,4608,7168,cktile,11,0,691.5024,a8w8_blockscale_cktile_192x256x128_4x2x1_16x16x128_intrawave_0x1x0_1,1956.49,533.01,0.0
256,32768,4608,7168,cktile,11,0,1045.7488,a8w8_blockscale_cktile_192x256x128_4x2x1_16x16x128_intrawave_0x1x0_1,2069.97,544.97,0.0
256,1,7168,256,ck,8,0,2.8676,a8w8_blockscale_1x128x128_256x16x64x256_16x16_16x16_1x1_16x16x1_16x16x1_1x16x1x16_4_1x1_intrawave_v1,1.28,645.0,0.0
256,1,7168,2304,ck,8,0,8.6995,a8w8_blockscale_1x128x128_256x16x64x256_16x16_16x16_1x1_16x16x1_16x16x1_1x16x1x16_4_1x1_intrawave_v1,3.8,1900.31,0.0
256,2,7168,256,ck,8,0,2.8766,a8w8_blockscale_1x128x128_256x16x64x256_16x16_16x16_1x1_16x16x1_16x16x1_1x16x1x16_4_1x1_intrawave_v1,2.55,648.05,0.0
256,2,7168,2304,ck,8,0,8.6872,a8w8_blockscale_1x128x128_256x16x64x256_16x16_16x16_1x1_16x16x1_16x16x1_1x16x1x16_4_1x1_intrawave_v1,7.6,1904.91,0.0
256,4,7168,256,ck,8,0,2.8861,a8w8_blockscale_1x128x128_256x16x64x256_16x16_16x16_1x1_16x16x1_16x16x1_1x16x1x16_4_1x1_intrawave_v1,5.09,656.03,0.0
256,4,7168,2304,ck,8,0,8.6607,a8w8_blockscale_1x128x128_256x16x64x256_16x16_16x16_1x1_16x16x1_16x16x1_1x16x1x16_4_1x1_intrawave_v1,15.26,1914.58,0.0
256,8,7168,256,ck,8,0,2.8848,a8w8_blockscale_1x128x128_256x16x64x256_16x16_16x16_1x1_16x16x1_16x16x1_1x16x1x16_4_1x1_intrawave_v1,10.18,676.56,0.0
256,8,7168,2304,ck,8,0,8.7527,a8w8_blockscale_1x128x128_256x16x64x256_16x16_16x16_1x1_16x16x1_16x16x1_1x16x1x16_4_1x1_intrawave_v1,30.19,1902.06,0.0
256,16,7168,256,ck,8,0,2.9338,a8w8_blockscale_1x128x128_256x16x64x256_16x16_16x16_1x1_16x16x1_16x16x1_1x16x1x16_4_1x1_intrawave_v1,20.02,705.05,0.0
256,16,7168,2304,ck,8,0,8.5233,a8w8_blockscale_1x128x128_256x16x64x256_16x16_16x16_1x1_16x16x1_16x16x1_1x16x1x16_4_1x1_intrawave_v1,62.0,1968.87,0.0
256,32,7168,256,ck,8,0,3.2434,a8w8_blockscale_1x128x128_256x16x64x256_16x16_16x16_1x1_16x16x1_16x16x1_1x16x1x16_4_1x1_intrawave_v1,36.21,709.73,0.0
256,32,7168,2304,ck,8,0,8.7551,a8w8_blockscale_1x128x128_256x16x64x256_16x16_16x16_1x1_16x16x1_16x16x1_1x16x1x16_4_1x1_intrawave_v1,120.73,1947.16,0.0
256,64,7168,256,ck,13,0,3.7754,a8w8_blockscale_1x128x128_256x32x64x256_16x16_16x16_2x1_16x16x1_16x16x1_1x32x1x8_8_2x1_intrawave_v1,62.21,733.4,0.0
256,64,7168,2304,ck,18,0,10.1151,a8w8_blockscale_1x128x128_256x64x64x256_16x16_32x32_1x1_16x16x1_16x16x1_1x32x1x8_8_1x1_intrawave_v1,208.99,1738.0,0.0
256,128,7168,256,ck,8,0,4.472,a8w8_blockscale_1x128x128_256x16x64x256_16x16_16x16_1x1_16x16x1_16x16x1_1x16x1x16_4_1x1_intrawave_v1,105.05,827.99,0.0
256,128,7168,2304,ck,18,0,11.3885,a8w8_blockscale_1x128x128_256x64x64x256_16x16_32x32_1x1_16x16x1_16x16x1_1x32x1x8_8_1x1_intrawave_v1,371.24,1637.18,0.0
256,256,7168,256,ck,8,0,5.8433,a8w8_blockscale_1x128x128_256x16x64x256_16x16_16x16_1x1_16x16x1_16x16x1_1x16x1x16_4_1x1_intrawave_v1,160.79,953.32,0.0
256,256,7168,2304,ck,2,0,16.4961,a8w8_blockscale_1x128x128_256x64x128x128_16x16_32x32_1x2_8x32x1_8x32x1_1x32x1x8_8_1x1_intrawave_v3,512.59,1259.38,0.0
256,512,7168,256,ck,18,0,8.5057,a8w8_blockscale_1x128x128_256x64x64x256_16x16_32x32_1x1_16x16x1_16x16x1_1x32x1x8_8_1x1_intrawave_v1,220.92,1094.1,0.0
256,512,7168,2304,ck,0,0,20.7991,a8w8_blockscale_1x128x128_256x128x128x128_16x16_32x32_2x2_8x32x1_8x32x1_1x32x1x8_8_1x1_intrawave_v3,813.08,1203.65,0.0
256,1024,7168,256,ck,18,0,12.8905,a8w8_blockscale_1x128x128_256x64x64x256_16x16_32x32_1x1_16x16x1_16x16x1_1x32x1x8_8_1x1_intrawave_v1,291.54,1301.52,0.0
256,1024,7168,2304,ck,0,0,33.6708,a8w8_blockscale_1x128x128_256x128x128x128_16x16_32x32_2x2_8x32x1_8x32x1_1x32x1x8_8_1x1_intrawave_v3,1004.52,996.54,0.0
256,1536,7168,256,ck,18,0,17.0646,a8w8_blockscale_1x128x128_256x64x64x256_16x16_32x32_1x1_16x16x1_16x16x1_1x32x1x8_8_1x1_intrawave_v1,330.34,1420.97,0.0
256,1536,7168,2304,cktile,12,0,42.0925,a8w8_blockscale_cktile_192x256x128_4x2x1_16x16x128_intrawave_0x1x0_1_aqrm,1205.31,999.56,0.0
256,2048,7168,256,ck,18,0,21.1856,a8w8_blockscale_1x128x128_256x64x64x256_16x16_32x32_1x1_16x16x1_16x16x1_1x32x1x8_8_1x1_intrawave_v1,354.78,1497.22,0.0
256,2048,7168,2304,ck,0,0,63.4227,a8w8_blockscale_1x128x128_256x128x128x128_16x16_32x32_2x2_8x32x1_8x32x1_1x32x1x8_8_1x1_intrawave_v3,1066.59,797.72,0.0
256,4096,7168,256,cktile,25,0,35.2731,a8w8_blockscale_cktile_128x128x128_2x2x1_16x16x128_intrawave_0x1x0_3,426.17,1746.48,0.0
256,4096,7168,2304,ck,0,0,109.6323,a8w8_blockscale_1x128x128_256x128x128x128_16x16_32x32_2x2_8x32x1_8x32x1_1x32x1x8_8_1x1_intrawave_v3,1234.05,772.33,0.0
256,8192,7168,256,cktile,10,0,61.9923,a8w8_blockscale_cktile_128x128x128_2x2x1_16x16x128_intrawave_0x1x0_2,484.98,1957.87,0.0
256,8192,7168,2304,cktile,12,0,192.0314,a8w8_blockscale_cktile_192x256x128_4x2x1_16x16x128_intrawave_0x1x0_1_aqrm,1409.06,795.86,0.0
256,16384,7168,256,cktile,25,0,115.2847,a8w8_blockscale_cktile_128x128x128_2x2x1_16x16x128_intrawave_0x1x0_3,521.57,2089.7,0.0
256,16384,7168,2304,cktile,28,0,349.4106,a8w8_blockscale_cktile_192x256x128_4x2x1_16x16x128_intrawave_0x1x0_3,1548.8,827.52,0.0
256,20480,7168,256,cktile,25,0,141.2222,a8w8_blockscale_cktile_128x128x128_2x2x1_16x16x128_intrawave_0x1x0_3,532.22,2129.12,0.0
256,20480,7168,2304,cktile,29,0,433.2408,a8w8_blockscale_cktile_192x256x128_4x2x1_16x16x128_intrawave_0x1x0_4,1561.39,824.72,0.0
256,32768,7168,256,cktile,25,0,218.244,a8w8_blockscale_cktile_128x128x128_2x2x1_16x16x128_intrawave_0x1x0_3,551.03,2199.31,0.0
256,32768,7168,2304,cktile,11,0,667.5502,a8w8_blockscale_cktile_192x256x128_4x2x1_16x16x128_intrawave_0x1x0_1,1621.35,841.55,0.0
256,1,9216,2048,ck,8,3,7.4999,a8w8_blockscale_1x128x128_256x16x64x256_16x16_16x16_1x1_16x16x1_16x16x1_1x16x1x16_4_1x1_intrawave_v1,5.03,2519.35,0.0
256,2,9216,2048,ck,8,3,7.3731,a8w8_blockscale_1x128x128_256x16x64x256_16x16_16x16_1x1_16x16x1_16x16x1_1x16x1x16_4_1x1_intrawave_v1,10.24,2565.45,0.0
256,4,9216,2048,ck,8,3,7.4496,a8w8_blockscale_1x128x128_256x16x64x256_16x16_16x16_1x1_16x16x1_16x16x1_1x16x1x16_4_1x1_intrawave_v1,20.27,2544.6,0.0
256,8,9216,2048,ck,8,2,7.6677,a8w8_blockscale_1x128x128_256x16x64x256_16x16_16x16_1x1_16x16x1_16x16x1_1x16x1x16_4_1x1_intrawave_v1,39.38,2482.91,0.0
256,16,9216,2048,ck,8,0,8.0847,a8w8_blockscale_1x128x128_256x16x64x256_16x16_16x16_1x1_16x16x1_16x16x1_1x16x1x16_4_1x1_intrawave_v1,74.71,2375.11,0.0
256,32,9216,2048,ck,7,0,9.4182,a8w8_blockscale_1x128x128_256x16x128x256_16x16_16x16_1x2_16x16x1_16x16x1_1x16x1x16_8_1x2_intrawave_v1,128.26,2073.62,0.0
256,48,9216,2048,ck,7,0,9.4182,a8w8_blockscale_1x128x128_256x16x128x256_16x16_16x16_1x2_16x16x1_16x16x1_1x16x1x16_8_1x2_intrawave_v1,192.39,2108.41,0.0
256,64,9216,2048,ck,18,0,9.6191,a8w8_blockscale_1x128x128_256x64x64x256_16x16_32x32_1x1_16x16x1_16x16x1_1x32x1x8_8_1x1_intrawave_v1,251.16,2098.44,0.0
256,80,9216,2048,ck,12,0,12.8247,a8w8_blockscale_1x128x128_256x32x128x256_16x16_32x32_1x1_16x16x1_16x16x1_1x32x1x8_8_1x1_intrawave_v1,235.48,1599.47,0.0
256,96,9216,2048,ck,12,0,11.5763,a8w8_blockscale_1x128x128_256x32x128x256_16x16_32x32_1x1_16x16x1_16x16x1_1x32x1x8_8_1x1_intrawave_v1,313.04,1800.27,0.0
256,112,9216,2048,ck,5,0,15.0791,a8w8_blockscale_1x128x128_256x16x128x128_8x16_16x16_1x2_16x16x1_8x32x1_1x16x1x16_8_1x2_intrawave_v1,280.38,1403.81,0.0
256,128,9216,2048,ck,2,0,15.5407,a8w8_blockscale_1x128x128_256x64x128x128_16x16_32x32_1x2_8x32x1_8x32x1_1x32x1x8_8_1x1_intrawave_v3,310.92,1383.19,0.0
256,256,9216,2048,ck,0,0,19.4722,a8w8_blockscale_1x128x128_256x128x128x128_16x16_32x32_2x2_8x32x1_8x32x1_1x32x1x8_8_1x1_intrawave_v3,496.28,1238.55,0.0
256,512,9216,2048,ck,2,0,29.5552,a8w8_blockscale_1x128x128_256x64x128x128_16x16_32x32_1x2_8x32x1_8x32x1_1x32x1x8_8_1x1_intrawave_v3,653.94,993.4,0.0
256,667,9216,2048,ck,0,0,32.4966,a8w8_blockscale_1x128x128_256x128x128x128_16x16_32x32_2x2_8x32x1_8x32x1_1x32x1x8_8_1x1_intrawave_v3,774.8,1001.17,0.0
256,671,9216,2048,ck,0,0,33.0856,a8w8_blockscale_1x128x128_256x128x128x128_16x16_32x32_2x2_8x32x1_8x32x1_1x32x1x8_8_1x1_intrawave_v3,765.57,985.82,0.0
256,931,9216,2048,cktile,31,0,39.1206,a8w8_blockscale_cktile_192x256x128_4x2x1_16x16x128_intrawave_0x1x0_3_aqrm,898.35,969.85,0.0
256,1024,9216,2048,cktile,12,0,39.9606,a8w8_blockscale_cktile_192x256x128_4x2x1_16x16x128_intrawave_0x1x0_1_aqrm,967.32,997.13,0.0
256,1025,9216,2048,cktile,12,0,40.0296,a8w8_blockscale_cktile_192x256x128_4x2x1_16x16x128_intrawave_0x1x0_1_aqrm,966.6,995.92,0.0
256,1027,9216,2048,cktile,12,0,40.0176,a8w8_blockscale_cktile_192x256x128_4x2x1_16x16x128_intrawave_0x1x0_1_aqrm,968.77,997.24,0.0
256,1031,9216,2048,cktile,31,0,40.1061,a8w8_blockscale_cktile_192x256x128_4x2x1_16x16x128_intrawave_0x1x0_3_aqrm,970.4,997.09,0.0
256,1039,9216,2048,cktile,30,0,40.0625,a8w8_blockscale_cktile_192x256x128_4x2x1_16x16x128_intrawave_0x1x0_2_aqrm,978.99,1002.26,0.0
256,1040,9216,2048,cktile,32,0,40.0643,a8w8_blockscale_cktile_192x256x128_4x2x1_16x16x128_intrawave_0x1x0_4_aqrm,979.89,1002.73,0.0
256,1041,9216,2048,cktile,30,0,40.0399,a8w8_blockscale_cktile_192x256x128_4x2x1_16x16x128_intrawave_0x1x0_2_aqrm,981.43,1003.85,0.0
256,1072,9216,2048,cktile,30,0,39.7331,a8w8_blockscale_cktile_192x256x128_4x2x1_16x16x128_intrawave_0x1x0_2_aqrm,1018.46,1027.58,0.0
256,1073,9216,2048,cktile,12,0,40.1691,a8w8_blockscale_cktile_192x256x128_4x2x1_16x16x128_intrawave_0x1x0_1_aqrm,1008.35,1016.94,0.0
256,1077,9216,2048,cktile,12,0,40.3195,a8w8_blockscale_cktile_192x256x128_4x2x1_16x16x128_intrawave_0x1x0_1_aqrm,1008.33,1015.17,0.0
256,1091,9216,2048,cktile,32,0,40.236,a8w8_blockscale_cktile_192x256x128_4x2x1_16x16x128_intrawave_0x1x0_4_aqrm,1023.56,1024.41,0.0
256,1343,9216,2048,cktile,30,0,41.4762,a8w8_blockscale_cktile_192x256x128_4x2x1_16x16x128_intrawave_0x1x0_2_aqrm,1222.3,1118.21,0.0
256,1688,9216,2048,ck,0,0,63.4265,a8w8_blockscale_1x128x128_256x128x128x128_16x16_32x32_2x2_8x32x1_8x32x1_1x32x1x8_8_1x1_intrawave_v3,1004.63,842.62,0.0
256,2017,9216,2048,ck,0,0,74.9333,a8w8_blockscale_1x128x128_256x128x128x128_16x16_32x32_2x2_8x32x1_8x32x1_1x32x1x8_8_1x1_intrawave_v3,1016.09,803.15,0.0
256,2048,9216,2048,ck,0,0,75.462,a8w8_blockscale_1x128x128_256x128x128x128_16x16_32x32_2x2_8x32x1_8x32x1_1x32x1x8_8_1x1_intrawave_v3,1024.48,805.93,0.0
256,2050,9216,2048,cktile,28,0,75.6095,a8w8_blockscale_cktile_192x256x128_4x2x1_16x16x128_intrawave_0x1x0_3,1023.48,804.9,0.0
256,2063,9216,2048,cktile,29,0,75.6823,a8w8_blockscale_cktile_192x256x128_4x2x1_16x16x128_intrawave_0x1x0_4,1028.98,807.65,0.0
256,2064,9216,2048,cktile,11,0,75.5751,a8w8_blockscale_cktile_192x256x128_4x2x1_16x16x128_intrawave_0x1x0_1,1030.94,809.06,0.0
256,2099,9216,2048,cktile,29,0,75.6905,a8w8_blockscale_cktile_192x256x128_4x2x1_16x16x128_intrawave_0x1x0_4,1046.82,817.3,0.0
256,2159,9216,2048,cktile,29,0,76.0189,a8w8_blockscale_cktile_192x256x128_4x2x1_16x16x128_intrawave_0x1x0_4,1072.1,829.93,0.0
256,2160,9216,2048,ck,0,0,76.014,a8w8_blockscale_1x128x128_256x128x128x128_16x16_32x32_2x2_8x32x1_8x32x1_1x32x1x8_8_1x1_intrawave_v3,1072.66,830.26,0.0
256,2313,9216,2048,cktile,28,0,76.8424,a8w8_blockscale_cktile_192x256x128_4x2x1_16x16x128_intrawave_0x1x0_3,1136.26,862.08,0.0
256,2325,9216,2048,cktile,11,0,76.9855,a8w8_blockscale_cktile_192x256x128_4x2x1_16x16x128_intrawave_0x1x0_1,1140.03,863.67,0.0
256,3072,9216,2048,ck,0,0,100.8879,a8w8_blockscale_1x128x128_256x128x128x128_16x16_32x32_2x2_8x32x1_8x32x1_1x32x1x8_8_1x1_intrawave_v3,1149.44,810.69,0.0
256,3073,9216,2048,cktile,27,0,105.5815,a8w8_blockscale_cktile_192x256x128_4x2x1_16x16x128_intrawave_0x1x0_2,1098.69,774.85,0.0
256,3182,9216,2048,cktile,11,0,108.3109,a8w8_blockscale_cktile_192x256x128_4x2x1_16x16x128_intrawave_0x1x0_1,1109.0,775.93,0.0
256,3183,9216,2048,cktile,29,0,107.5221,a8w8_blockscale_cktile_192x256x128_4x2x1_16x16x128_intrawave_0x1x0_4,1117.48,781.81,0.0
256,3847,9216,2048,cktile,27,0,112.6309,a8w8_blockscale_cktile_192x256x128_4x2x1_16x16x128_intrawave_0x1x0_2,1289.34,867.09,0.0
256,4096,9216,2048,cktile,11,0,126.3018,a8w8_blockscale_cktile_192x256x128_4x2x1_16x16x128_intrawave_0x1x0_1,1224.2,813.61,0.0
256,4111,9216,2048,cktile,27,0,126.8579,a8w8_blockscale_cktile_192x256x128_4x2x1_16x16x128_intrawave_0x1x0_2,1223.3,812.47,0.0
256,4141,9216,2048,cktile,28,0,127.1123,a8w8_blockscale_cktile_192x256x128_4x2x1_16x16x128_intrawave_0x1x0_3,1229.76,815.67,0.0
256,4142,9216,2048,cktile,27,0,126.4299,a8w8_blockscale_cktile_192x256x128_4x2x1_16x16x128_intrawave_0x1x0_2,1236.7,820.24,0.0
256,4345,9216,2048,cktile,28,0,133.5951,a8w8_blockscale_cktile_192x256x128_4x2x1_16x16x128_intrawave_0x1x0_3,1227.73,807.36,0.0
256,5105,9216,2048,cktile,11,0,146.0477,a8w8_blockscale_cktile_192x256x128_4x2x1_16x16x128_intrawave_0x1x0_1,1319.48,845.1,0.0
256,5121,9216,2048,cktile,27,0,145.5152,a8w8_blockscale_cktile_192x256x128_4x2x1_16x16x128_intrawave_0x1x0_2,1328.46,850.44,0.0
256,5123,9216,2048,cktile,28,0,146.2768,a8w8_blockscale_cktile_192x256x128_4x2x1_16x16x128_intrawave_0x1x0_3,1322.06,846.3,0.0
256,5131,9216,2048,cktile,29,0,146.5468,a8w8_blockscale_cktile_192x256x128_4x2x1_16x16x128_intrawave_0x1x0_4,1321.69,845.85,0.0
256,5427,9216,2048,cktile,27,0,154.2364,a8w8_blockscale_cktile_192x256x128_4x2x1_16x16x128_intrawave_0x1x0_2,1328.24,842.99,0.0
256,6113,9216,2048,cktile,11,0,175.9954,a8w8_blockscale_cktile_192x256x128_4x2x1_16x16x128_intrawave_0x1x0_1,1311.16,818.59,0.0
256,6197,9216,2048,cktile,11,0,176.9065,a8w8_blockscale_cktile_192x256x128_4x2x1_16x16x128_intrawave_0x1x0_1,1322.33,824.1,0.0
256,6409,9216,2048,cktile,29,0,179.0828,a8w8_blockscale_cktile_192x256x128_4x2x1_16x16x128_intrawave_0x1x0_4,1350.95,838.33,0.0
256,7121,9216,2048,cktile,11,0,198.43,a8w8_blockscale_cktile_192x256x128_4x2x1_16x16x128_intrawave_0x1x0_1,1354.68,830.08,0.0
256,7168,9216,2048,cktile,29,0,199.1988,a8w8_blockscale_cktile_192x256x128_4x2x1_16x16x128_intrawave_0x1x0_4,1358.36,831.71,0.0
256,7169,9216,2048,cktile,28,0,199.496,a8w8_blockscale_cktile_192x256x128_4x2x1_16x16x128_intrawave_0x1x0_3,1356.52,830.57,0.0
256,7172,9216,2048,cktile,11,0,196.604,a8w8_blockscale_cktile_192x256x128_4x2x1_16x16x128_intrawave_0x1x0_1,1377.05,843.1,0.0
256,7176,9216,2048,cktile,27,0,198.0669,a8w8_blockscale_cktile_192x256x128_4x2x1_16x16x128_intrawave_0x1x0_2,1367.64,837.29,0.0
256,7177,9216,2048,cktile,29,0,197.5173,a8w8_blockscale_cktile_192x256x128_4x2x1_16x16x128_intrawave_0x1x0_4,1371.64,839.72,0.0
256,7178,9216,2048,cktile,11,0,198.2329,a8w8_blockscale_cktile_192x256x128_4x2x1_16x16x128_intrawave_0x1x0_1,1366.88,836.79,0.0
256,7179,9216,2048,cktile,11,0,198.1165,a8w8_blockscale_cktile_192x256x128_4x2x1_16x16x128_intrawave_0x1x0_1,1367.87,837.39,0.0
256,7183,9216,2048,cktile,28,0,197.6629,a8w8_blockscale_cktile_192x256x128_4x2x1_16x16x128_intrawave_0x1x0_3,1371.78,839.72,0.0
256,7184,9216,2048,cktile,11,0,198.1105,a8w8_blockscale_cktile_192x256x128_4x2x1_16x16x128_intrawave_0x1x0_1,1368.87,837.93,0.0
256,7209,9216,2048,cktile,28,0,198.1537,a8w8_blockscale_cktile_192x256x128_4x2x1_16x16x128_intrawave_0x1x0_3,1373.33,840.33,0.0
256,7210,9216,2048,cktile,28,0,197.9973,a8w8_blockscale_cktile_192x256x128_4x2x1_16x16x128_intrawave_0x1x0_3,1374.61,841.1,0.0
256,7211,9216,2048,cktile,29,0,197.4693,a8w8_blockscale_cktile_192x256x128_4x2x1_16x16x128_intrawave_0x1x0_4,1378.47,843.45,0.0
256,7217,9216,2048,cktile,11,0,198.2597,a8w8_blockscale_cktile_192x256x128_4x2x1_16x16x128_intrawave_0x1x0_1,1374.12,840.71,0.0
256,7273,9216,2048,cktile,11,0,199.4808,a8w8_blockscale_cktile_192x256x128_4x2x1_16x16x128_intrawave_0x1x0_1,1376.31,841.31,0.0
256,7274,9216,2048,cktile,28,0,198.9556,a8w8_blockscale_cktile_192x256x128_4x2x1_16x16x128_intrawave_0x1x0_3,1380.13,843.63,0.0
256,7391,9216,2048,cktile,29,0,205.9121,a8w8_blockscale_cktile_192x256x128_4x2x1_16x16x128_intrawave_0x1x0_4,1354.95,826.77,0.0
256,7393,9216,2048,cktile,29,0,204.5395,a8w8_blockscale_cktile_192x256x128_4x2x1_16x16x128_intrawave_0x1x0_4,1364.41,832.52,0.0
256,7715,9216,2048,cktile,28,0,211.0254,a8w8_blockscale_cktile_192x256x128_4x2x1_16x16x128_intrawave_0x1x0_3,1380.08,838.18,0.0
256,7753,9216,2048,cktile,28,0,210.875,a8w8_blockscale_cktile_192x256x128_4x2x1_16x16x128_intrawave_0x1x0_3,1387.86,842.47,0.0
256,7819,9216,2048,cktile,11,0,211.8735,a8w8_blockscale_cktile_192x256x128_4x2x1_16x16x128_intrawave_0x1x0_1,1393.08,844.88,0.0
256,8099,9216,2048,cktile,28,0,214.5854,a8w8_blockscale_cktile_192x256x128_4x2x1_16x16x128_intrawave_0x1x0_3,1424.73,860.92,0.0
256,8129,9216,2048,cktile,11,0,213.7806,a8w8_blockscale_cktile_192x256x128_4x2x1_16x16x128_intrawave_0x1x0_1,1435.39,867.04,0.0
256,8188,9216,2048,cktile,29,0,215.4633,a8w8_blockscale_cktile_192x256x128_4x2x1_16x16x128_intrawave_0x1x0_4,1434.52,865.88,0.0
256,8192,9216,2048,cktile,11,0,214.9206,a8w8_blockscale_cktile_192x256x128_4x2x1_16x16x128_intrawave_0x1x0_1,1438.85,868.44,0.0
256,16384,9216,2048,cktile,28,0,411.5135,a8w8_blockscale_cktile_192x256x128_4x2x1_16x16x128_intrawave_0x1x0_3,1502.93,861.26,0.0
256,32768,9216,2048,cktile,27,0,777.2874,a8w8_blockscale_cktile_192x256x128_4x2x1_16x16x128_intrawave_0x1x0_2,1591.37,887.65,0.0
256,1,12288,2048,ck,8,2,8.27,a8w8_blockscale_1x128x128_256x16x64x256_16x16_16x16_1x1_16x16x1_16x16x1_1x16x1x16_4_1x1_intrawave_v1,6.09,3046.25,0.0
256,2,12288,2048,ck,8,2,8.1255,a8w8_blockscale_1x128x128_256x16x64x256_16x16_16x16_1x1_16x16x1_16x16x1_1x16x1x16_4_1x1_intrawave_v1,12.39,3103.69,0.0
256,4,12288,2048,ck,8,2,8.1269,a8w8_blockscale_1x128x128_256x16x64x256_16x16_16x16_1x1_16x16x1_16x16x1_1x16x1x16_4_1x1_intrawave_v1,24.77,3109.71,0.0
256,8,12288,2048,ck,8,2,8.3572,a8w8_blockscale_1x128x128_256x16x64x256_16x16_16x16_1x1_16x16x1_16x16x1_1x16x1x16_4_1x1_intrawave_v1,48.18,3036.76,0.0
256,16,12288,2048,ck,8,0,8.4455,a8w8_blockscale_1x128x128_256x16x64x256_16x16_16x16_1x1_16x16x1_16x16x1_1x16x1x16_4_1x1_intrawave_v1,95.35,3030.23,0.0
256,32,12288,2048,ck,7,0,9.5763,a8w8_blockscale_1x128x128_256x16x128x256_16x16_16x16_1x2_16x16x1_16x16x1_1x16x1x16_8_1x2_intrawave_v1,168.19,2716.89,0.0
256,48,12288,2048,ck,18,0,11.3624,a8w8_blockscale_1x128x128_256x64x64x256_16x16_32x32_1x1_16x16x1_16x16x1_1x32x1x8_8_1x1_intrawave_v1,212.62,2327.31,0.0
256,64,12288,2048,ck,18,0,9.9298,a8w8_blockscale_1x128x128_256x64x64x256_16x16_32x32_1x1_16x16x1_16x16x1_1x32x1x8_8_1x1_intrawave_v1,324.4,2705.97,0.0
256,80,12288,2048,ck,5,0,15.6155,a8w8_blockscale_1x128x128_256x16x128x128_8x16_16x16_1x2_16x16x1_8x32x1_1x16x1x16_8_1x2_intrawave_v1,257.85,1747.99,0.0
256,96,12288,2048,ck,2,0,15.8404,a8w8_blockscale_1x128x128_256x64x128x128_16x16_32x32_1x2_8x32x1_8x32x1_1x32x1x8_8_1x1_intrawave_v3,305.03,1750.06,0.0
256,112,12288,2048,ck,2,0,16.0117,a8w8_blockscale_1x128x128_256x64x128x128_16x16_32x32_1x2_8x32x1_8x32x1_1x32x1x8_8_1x1_intrawave_v3,352.06,1757.95,0.0
256,128,12288,2048,ck,2,0,15.9159,a8w8_blockscale_1x128x128_256x64x128x128_16x16_32x32_1x2_8x32x1_8x32x1_1x32x1x8_8_1x1_intrawave_v3,404.78,1795.29,0.0
256,256,12288,2048,ck,0,0,20.0205,a8w8_blockscale_1x128x128_256x128x128x128_16x16_32x32_2x2_8x32x1_8x32x1_1x32x1x8_8_1x1_intrawave_v3,643.59,1597.44,0.0
256,512,12288,2048,ck,2,0,31.5128,a8w8_blockscale_1x128x128_256x64x128x128_16x16_32x32_1x2_8x32x1_8x32x1_1x32x1x8_8_1x1_intrawave_v3,817.76,1231.16,0.0
256,667,12288,2048,cktile,30,0,39.069,a8w8_blockscale_cktile_192x256x128_4x2x1_16x16x128_intrawave_0x1x0_2_aqrm,859.28,1098.67,0.0
256,671,12288,2048,cktile,30,0,39.258,a8w8_blockscale_cktile_192x256x128_4x2x1_16x16x128_intrawave_0x1x0_2_aqrm,860.27,1096.1,0.0
256,931,12288,2048,cktile,12,0,40.2886,a8w8_blockscale_cktile_192x256x128_4x2x1_16x16x128_intrawave_0x1x0_1_aqrm,1163.08,1239.87,0.0
256,1024,12288,2048,ck,0,0,50.7874,a8w8_blockscale_1x128x128_256x128x128x128_16x16_32x32_2x2_8x32x1_8x32x1_1x32x1x8_8_1x1_intrawave_v3,1014.81,1032.32,0.0
256,1025,12288,2048,ck,0,0,58.8654,a8w8_blockscale_1x128x128_256x128x128x128_16x16_32x32_2x2_8x32x1_8x32x1_1x32x1x8_8_1x1_intrawave_v3,876.41,891.11,0.0
256,1027,12288,2048,ck,0,0,58.725,a8w8_blockscale_1x128x128_256x128x128x128_16x16_32x32_2x2_8x32x1_8x32x1_1x32x1x8_8_1x1_intrawave_v3,880.21,894.15,0.0
256,1031,12288,2048,ck,0,0,59.6379,a8w8_blockscale_1x128x128_256x128x128x128_16x16_32x32_2x2_8x32x1_8x32x1_1x32x1x8_8_1x1_intrawave_v3,870.12,882.24,0.0
256,1039,12288,2048,ck,0,0,59.1971,a8w8_blockscale_1x128x128_256x128x128x128_16x16_32x32_2x2_8x32x1_8x32x1_1x32x1x8_8_1x1_intrawave_v3,883.4,892.41,0.0
256,1040,12288,2048,ck,0,0,58.9444,a8w8_blockscale_1x128x128_256x128x128x128_16x16_32x32_2x2_8x32x1_8x32x1_1x32x1x8_8_1x1_intrawave_v3,888.04,896.69,0.0
256,1041,12288,2048,ck,0,0,58.8761,a8w8_blockscale_1x128x128_256x128x128x128_16x16_32x32_2x2_8x32x1_8x32x1_1x32x1x8_8_1x1_intrawave_v3,889.92,898.18,0.0
256,1072,12288,2048,ck,0,0,58.8025,a8w8_blockscale_1x128x128_256x128x128x128_16x16_32x32_2x2_8x32x1_8x32x1_1x32x1x8_8_1x1_intrawave_v3,917.57,913.34,0.0
256,1073,12288,2048,ck,0,0,59.9965,a8w8_blockscale_1x128x128_256x128x128x128_16x16_32x32_2x2_8x32x1_8x32x1_1x32x1x8_8_1x1_intrawave_v3,900.15,895.61,0.0
256,1077,12288,2048,ck,0,0,60.0389,a8w8_blockscale_1x128x128_256x128x128x128_16x16_32x32_2x2_8x32x1_8x32x1_1x32x1x8_8_1x1_intrawave_v3,902.87,896.75,0.0
256,1091,12288,2048,ck,0,0,58.9441,a8w8_blockscale_1x128x128_256x128x128x128_16x16_32x32_2x2_8x32x1_8x32x1_1x32x1x8_8_1x1_intrawave_v3,931.59,919.73,0.0
256,1343,12288,2048,ck,0,0,73.0022,a8w8_blockscale_1x128x128_256x128x128x128_16x16_32x32_2x2_8x32x1_8x32x1_1x32x1x8_8_1x1_intrawave_v3,925.94,834.52,0.0
256,1688,12288,2048,cktile,29,0,76.2584,a8w8_blockscale_cktile_192x256x128_4x2x1_16x16x128_intrawave_0x1x0_4,1114.1,919.34,0.0
256,2017,12288,2048,ck,0,0,92.913,a8w8_blockscale_1x128x128_256x128x128x128_16x16_32x32_2x2_8x32x1_8x32x1_1x32x1x8_8_1x1_intrawave_v3,1092.62,848.82,0.0
256,2048,12288,2048,ck,0,0,90.9194,a8w8_blockscale_1x128x128_256x128x128x128_16x16_32x32_2x2_8x32x1_8x32x1_1x32x1x8_8_1x1_intrawave_v3,1133.74,876.51,0.0
256,2050,12288,2048,cktile,29,0,96.3684,a8w8_blockscale_cktile_192x256x128_4x2x1_16x16x128_intrawave_0x1x0_4,1070.68,827.5,0.0
256,2063,12288,2048,cktile,29,0,96.4948,a8w8_blockscale_cktile_192x256x128_4x2x1_16x16x128_intrawave_0x1x0_4,1076.06,830.0,0.0
256,2064,12288,2048,cktile,11,0,96.678,a8w8_blockscale_cktile_192x256x128_4x2x1_16x16x128_intrawave_0x1x0_1,1074.54,828.71,0.0
256,2099,12288,2048,cktile,28,0,96.8404,a8w8_blockscale_cktile_192x256x128_4x2x1_16x16x128_intrawave_0x1x0_3,1090.93,836.94,0.0
256,2159,12288,2048,ck,0,0,100.4266,a8w8_blockscale_1x128x128_256x128x128x128_16x16_32x32_2x2_8x32x1_8x32x1_1x32x1x8_8_1x1_intrawave_v3,1082.04,822.96,0.0
256,2160,12288,2048,ck,0,0,100.3623,a8w8_blockscale_1x128x128_256x128x128x128_16x16_32x32_2x2_8x32x1_8x32x1_1x32x1x8_8_1x1_intrawave_v3,1083.24,823.75,0.0
256,2313,12288,2048,cktile,11,0,103.6707,a8w8_blockscale_cktile_192x256x128_4x2x1_16x16x128_intrawave_0x1x0_1,1122.95,836.76,0.0
256,2325,12288,2048,cktile,29,0,104.5261,a8w8_blockscale_cktile_192x256x128_4x2x1_16x16x128_intrawave_0x1x0_4,1119.54,832.97,0.0
256,3072,12288,2048,cktile,11,0,111.9868,a8w8_blockscale_cktile_192x256x128_4x2x1_16x16x128_intrawave_0x1x0_1,1380.69,955.07,0.0
256,3073,12288,2048,cktile,29,0,132.0519,a8w8_blockscale_cktile_192x256x128_4x2x1_16x16x128_intrawave_0x1x0_4,1171.28,810.15,0.0
256,3182,12288,2048,cktile,29,0,133.0951,a8w8_blockscale_cktile_192x256x128_4x2x1_16x16x128_intrawave_0x1x0_4,1203.31,825.6,0.0
256,3183,12288,2048,cktile,29,0,132.515,a8w8_blockscale_cktile_192x256x128_4x2x1_16x16x128_intrawave_0x1x0_4,1208.96,829.42,0.0
256,3847,12288,2048,cktile,27,0,146.2836,a8w8_blockscale_cktile_192x256x128_4x2x1_16x16x128_intrawave_0x1x0_2,1323.63,872.2,0.0
256,4096,12288,2048,cktile,29,0,162.1122,a8w8_blockscale_cktile_192x256x128_4x2x1_16x16x128_intrawave_0x1x0_4,1271.7,827.93,0.0
256,4111,12288,2048,cktile,29,0,162.3505,a8w8_blockscale_cktile_192x256x128_4x2x1_16x16x128_intrawave_0x1x0_4,1274.49,829.18,0.0
256,4141,12288,2048,cktile,11,0,160.6729,a8w8_blockscale_cktile_192x256x128_4x2x1_16x16x128_intrawave_0x1x0_1,1297.19,842.8,0.0
256,4142,12288,2048,cktile,29,0,161.6298,a8w8_blockscale_cktile_192x256x128_4x2x1_16x16x128_intrawave_0x1x0_4,1289.82,837.98,0.0
256,4345,12288,2048,cktile,11,0,169.4618,a8w8_blockscale_cktile_192x256x128_4x2x1_16x16x128_intrawave_0x1x0_1,1290.5,831.14,0.0
256,5105,12288,2048,cktile,11,0,188.7216,a8w8_blockscale_cktile_192x256x128_4x2x1_16x16x128_intrawave_0x1x0_1,1361.49,853.54,0.0
256,5121,12288,2048,cktile,11,0,190.0292,a8w8_blockscale_cktile_192x256x128_4x2x1_16x16x128_intrawave_0x1x0_1,1356.36,849.91,0.0
256,5123,12288,2048,cktile,11,0,189.1243,a8w8_blockscale_cktile_192x256x128_4x2x1_16x16x128_intrawave_0x1x0_1,1363.38,854.26,0.0
256,5131,12288,2048,cktile,29,0,190.2539,a8w8_blockscale_cktile_192x256x128_4x2x1_16x16x128_intrawave_0x1x0_4,1357.41,850.3,0.0
256,5427,12288,2048,cktile,11,0,201.5124,a8w8_blockscale_cktile_192x256x128_4x2x1_16x16x128_intrawave_0x1x0_1,1355.5,841.9,0.0
256,6113,12288,2048,cktile,11,0,211.3293,a8w8_blockscale_cktile_192x256x128_4x2x1_16x16x128_intrawave_0x1x0_1,1455.91,889.22,0.0
256,6197,12288,2048,cktile,11,0,224.6906,a8w8_blockscale_cktile_192x256x128_4x2x1_16x16x128_intrawave_0x1x0_1,1388.15,846.3,0.0
256,6409,12288,2048,cktile,11,0,232.1231,a8w8_blockscale_cktile_192x256x128_4x2x1_16x16x128_intrawave_0x1x0_1,1389.67,843.51,0.0
256,7121,12288,2048,cktile,11,0,252.8049,a8w8_blockscale_cktile_192x256x128_4x2x1_16x16x128_intrawave_0x1x0_1,1417.74,849.49,0.0
256,7168,12288,2048,cktile,28,0,252.6628,a8w8_blockscale_cktile_192x256x128_4x2x1_16x16x128_intrawave_0x1x0_3,1427.9,854.92,0.0
256,7169,12288,2048,cktile,28,0,252.3576,a8w8_blockscale_cktile_192x256x128_4x2x1_16x16x128_intrawave_0x1x0_3,1429.83,856.06,0.0
256,7172,12288,2048,cktile,29,0,250.8985,a8w8_blockscale_cktile_192x256x128_4x2x1_16x16x128_intrawave_0x1x0_4,1438.74,861.36,0.0
256,7176,12288,2048,cktile,28,0,252.6929,a8w8_blockscale_cktile_192x256x128_4x2x1_16x16x128_intrawave_0x1x0_3,1429.32,855.66,0.0
256,7177,12288,2048,cktile,11,0,251.9285,a8w8_blockscale_cktile_192x256x128_4x2x1_16x16x128_intrawave_0x1x0_1,1433.86,858.36,0.0
256,7178,12288,2048,cktile,11,0,253.1921,a8w8_blockscale_cktile_192x256x128_4x2x1_16x16x128_intrawave_0x1x0_1,1426.9,854.19,0.0
256,7179,12288,2048,cktile,27,0,250.3703,a8w8_blockscale_cktile_192x256x128_4x2x1_16x16x128_intrawave_0x1x0_2,1443.19,863.92,0.0
256,7183,12288,2048,cktile,29,0,251.6218,a8w8_blockscale_cktile_192x256x128_4x2x1_16x16x128_intrawave_0x1x0_4,1436.81,860.04,0.0
256,7184,12288,2048,cktile,29,0,251.7808,a8w8_blockscale_cktile_192x256x128_4x2x1_16x16x128_intrawave_0x1x0_4,1436.1,859.61,0.0
256,7209,12288,2048,cktile,11,0,252.0606,a8w8_blockscale_cktile_192x256x128_4x2x1_16x16x128_intrawave_0x1x0_1,1439.5,861.29,0.0
256,7210,12288,2048,cktile,27,0,251.79,a8w8_blockscale_cktile_192x256x128_4x2x1_16x16x128_intrawave_0x1x0_2,1441.25,862.33,0.0
256,7211,12288,2048,cktile,27,0,250.4521,a8w8_blockscale_cktile_192x256x128_4x2x1_16x16x128_intrawave_0x1x0_2,1449.15,867.04,0.0
256,7217,12288,2048,cktile,28,0,251.6374,a8w8_blockscale_cktile_192x256x128_4x2x1_16x16x128_intrawave_0x1x0_3,1443.52,863.59,0.0
256,7273,12288,2048,cktile,27,0,252.2588,a8w8_blockscale_cktile_192x256x128_4x2x1_16x16x128_intrawave_0x1x0_2,1451.14,867.37,0.0
256,7274,12288,2048,cktile,29,0,251.8004,a8w8_blockscale_cktile_192x256x128_4x2x1_16x16x128_intrawave_0x1x0_4,1453.98,869.06,0.0
256,7391,12288,2048,cktile,29,0,259.9153,a8w8_blockscale_cktile_192x256x128_4x2x1_16x16x128_intrawave_0x1x0_4,1431.24,853.91,0.0
256,7393,12288,2048,cktile,11,0,259.4018,a8w8_blockscale_cktile_192x256x128_4x2x1_16x16x128_intrawave_0x1x0_1,1434.46,855.8,0.0
256,7715,12288,2048,cktile,29,0,269.8273,a8w8_blockscale_cktile_192x256x128_4x2x1_16x16x128_intrawave_0x1x0_4,1439.1,854.51,0.0
256,7753,12288,2048,cktile,11,0,272.6451,a8w8_blockscale_cktile_192x256x128_4x2x1_16x16x128_intrawave_0x1x0_1,1431.24,849.39,0.0
256,7819,12288,2048,cktile,28,0,273.0515,a8w8_blockscale_cktile_192x256x128_4x2x1_16x16x128_intrawave_0x1x0_3,1441.28,854.56,0.0
256,8099,12288,2048,cktile,27,0,278.5057,a8w8_blockscale_cktile_192x256x128_4x2x1_16x16x128_intrawave_0x1x0_2,1463.65,864.59,0.0
256,8129,12288,2048,cktile,27,0,281.1276,a8w8_blockscale_cktile_192x256x128_4x2x1_16x16x128_intrawave_0x1x0_2,1455.37,859.37,0.0
256,8188,12288,2048,cktile,28,0,279.4195,a8w8_blockscale_cktile_192x256x128_4x2x1_16x16x128_intrawave_0x1x0_3,1474.9,870.24,0.0
256,8192,12288,2048,cktile,11,0,279.146,a8w8_blockscale_cktile_192x256x128_4x2x1_16x16x128_intrawave_0x1x0_1,1477.07,871.48,0.0
256,16384,12288,2048,cktile,29,0,535.3331,a8w8_blockscale_cktile_192x256x128_4x2x1_16x16x128_intrawave_0x1x0_4,1540.41,861.84,0.0
256,32768,12288,2048,cktile,27,0,1007.4081,a8w8_blockscale_cktile_192x256x128_4x2x1_16x16x128_intrawave_0x1x0_2,1637.14,890.98,0.0
