aiter/configs/profile_fmoe_tp2.csv
cu_num,token,model_dim,inter_dim,expert,topk,act_type,dtype,q_dtype_a,q_dtype_w,q_type,use_g1u1,doweight_stage1,block_m,ksplit,us1,kernelName1,err1,us2,kernelName2,err2,us,run_1stage,tflops,bw
256,1,2048,256,512,10,ActivationType.Silu,torch.bfloat16,torch.float8_e4m3fn,torch.float8_e4m3fn,QuantType.per_1x128,1,0,16,0,17.0153,moe_ck2stages_gemm1_256x16x128x256_1x4_MulABScaleExpertWeightA8W8blkscale_v1_Nswizzle0_Quant4_MulRoutedWeight0_silu_F8_F8_B16,0.6%,6.0229,moe_ck2stages_gemm2_256x16x128x256_1x4_MulABScaleExpertWeightA8W8blkscale_v1_Nswizzle0_Quant4_MulRoutedWeight1_F8_F8_B16,19.1%,23.0382,0,1.37,34955.53
256,1,2048,256,512,10,ActivationType.Silu,torch.bfloat16,torch.float8_e4m3fn,torch.float8_e4m3fn,QuantType.per_1x128,1,0,32,0,22.0794,moe_ck2stages_gemm1_256x32x128x128_1x4_MulABScaleExpertWeightA8W8blkscale_v1_Nswizzle0_Quant4_MulRoutedWeight0_silu_F8_F8_B16,0.6%,6.8257,moe_ck2stages_gemm2_256x32x128x128_1x4_MulABScaleExpertWeightA8W8blkscale_v1_Nswizzle0_Quant4_MulRoutedWeight1_F8_F8_B16,17.6%,28.9051,0,1.09,27860.57
256,1,2048,256,512,10,ActivationType.Silu,torch.bfloat16,torch.float8_e4m3fn,torch.float8_e4m3fn,QuantType.per_1x128,1,0,64,0,36.5053,moe_ck2stages_gemm1_256x64x128x128_1x4_MulABScaleExpertWeightA8W8blkscale_v3_Nswizzle0_Quant4_MulRoutedWeight0_silu_F8_F8_B16,0.6%,8.1797,moe_ck2stages_gemm2_256x64x128x128_1x4_MulABScaleExpertWeightA8W8blkscale_v3_Nswizzle0_Quant4_MulRoutedWeight1_F8_F8_B16,19.1%,44.685,0,0.7,18021.99
256,1,2048,256,512,10,ActivationType.Silu,torch.bfloat16,torch.float8_e4m3fn,torch.float8_e4m3fn,QuantType.per_1x128,1,0,32,0,25.9498,_ZN5aiter44fmoe_bf16_blockscaleBf16_g1u1_ps_silu_32x128E,0.0%,0.0,,0.0%,25.9498,1,1.21,31033.48
256,1,2048,256,512,10,ActivationType.Silu,torch.bfloat16,torch.float8_e4m3fn,torch.float8_e4m3fn,QuantType.per_1x128,1,0,64,0,35.7656,_ZN5aiter40fmoe_bf16_blockscaleFp8_g1u1_silu_64x128E,0.0%,0.0,,0.0%,35.7656,1,0.88,22516.4
256,2,2048,256,512,10,ActivationType.Silu,torch.bfloat16,torch.float8_e4m3fn,torch.float8_e4m3fn,QuantType.per_1x128,1,0,16,0,17.0718,moe_ck2stages_gemm1_256x16x128x256_1x4_MulABScaleExpertWeightA8W8blkscale_v1_Nswizzle0_Quant4_MulRoutedWeight0_silu_F8_F8_B16,0.4%,7.3349,moe_ck2stages_gemm2_256x16x128x256_1x4_MulABScaleExpertWeightA8W8blkscale_v1_Nswizzle0_Quant4_MulRoutedWeight1_F8_F8_B16,18.6%,24.4067,0,2.58,32995.8
256,2,2048,256,512,10,ActivationType.Silu,torch.bfloat16,torch.float8_e4m3fn,torch.float8_e4m3fn,QuantType.per_1x128,1,0,32,0,24.1294,moe_ck2stages_gemm1_256x32x128x128_1x4_MulABScaleExpertWeightA8W8blkscale_v1_Nswizzle0_Quant4_MulRoutedWeight0_silu_F8_F8_B16,0.4%,8.2968,moe_ck2stages_gemm2_256x32x128x128_1x4_MulABScaleExpertWeightA8W8blkscale_v1_Nswizzle0_Quant4_MulRoutedWeight1_F8_F8_B16,18.5%,32.4262,0,1.94,24835.43
256,2,2048,256,512,10,ActivationType.Silu,torch.bfloat16,torch.float8_e4m3fn,torch.float8_e4m3fn,QuantType.per_1x128,1,0,64,0,36.9931,moe_ck2stages_gemm1_256x64x128x128_1x4_MulABScaleExpertWeightA8W8blkscale_v3_Nswizzle0_Quant4_MulRoutedWeight0_silu_F8_F8_B16,0.4%,9.9353,moe_ck2stages_gemm2_256x64x128x128_1x4_MulABScaleExpertWeightA8W8blkscale_v3_Nswizzle0_Quant4_MulRoutedWeight1_F8_F8_B16,18.2%,46.9284,0,1.34,17160.58
256,2,2048,256,512,10,ActivationType.Silu,torch.bfloat16,torch.float8_e4m3fn,torch.float8_e4m3fn,QuantType.per_1x128,1,0,32,0,26.8526,_ZN5aiter44fmoe_bf16_blockscaleBf16_g1u1_ps_silu_32x128E,0.0%,0.0,,0.0%,26.8526,1,2.34,29990.34
256,2,2048,256,512,10,ActivationType.Silu,torch.bfloat16,torch.float8_e4m3fn,torch.float8_e4m3fn,QuantType.per_1x128,1,0,64,0,36.9542,_ZN5aiter40fmoe_bf16_blockscaleFp8_g1u1_silu_64x128E,0.0%,0.0,,0.0%,36.9542,1,1.7,21792.34
256,4,2048,256,512,10,ActivationType.Silu,torch.bfloat16,torch.float8_e4m3fn,torch.float8_e4m3fn,QuantType.per_1x128,1,0,16,0,19.3485,moe_ck2stages_gemm1_256x16x128x256_1x4_MulABScaleExpertWeightA8W8blkscale_v1_Nswizzle0_Quant4_MulRoutedWeight0_silu_F8_F8_B16,0.3%,8.7731,moe_ck2stages_gemm2_256x16x128x256_1x4_MulABScaleExpertWeightA8W8blkscale_v1_Nswizzle0_Quant4_MulRoutedWeight1_F8_F8_B16,17.2%,28.1216,0,4.47,28637.45
256,4,2048,256,512,10,ActivationType.Silu,torch.bfloat16,torch.float8_e4m3fn,torch.float8_e4m3fn,QuantType.per_1x128,1,0,32,0,25.145,moe_ck2stages_gemm1_256x32x128x128_1x4_MulABScaleExpertWeightA8W8blkscale_v1_Nswizzle0_Quant4_MulRoutedWeight0_silu_F8_F8_B16,0.3%,12.5737,moe_ck2stages_gemm2_256x32x128x128_1x4_MulABScaleExpertWeightA8W8blkscale_v1_Nswizzle0_Quant4_MulRoutedWeight1_F8_F8_B16,18.4%,37.7187,0,3.34,21350.97
256,4,2048,256,512,10,ActivationType.Silu,torch.bfloat16,torch.float8_e4m3fn,torch.float8_e4m3fn,QuantType.per_1x128,1,0,64,0,37.82,moe_ck2stages_gemm1_256x64x128x128_1x4_MulABScaleExpertWeightA8W8blkscale_v3_Nswizzle0_Quant4_MulRoutedWeight0_silu_F8_F8_B16,0.3%,16.453,moe_ck2stages_gemm2_256x64x128x128_1x4_MulABScaleExpertWeightA8W8blkscale_v3_Nswizzle0_Quant4_MulRoutedWeight1_F8_F8_B16,17.5%,54.273,0,2.32,14838.52
256,4,2048,256,512,10,ActivationType.Silu,torch.bfloat16,torch.float8_e4m3fn,torch.float8_e4m3fn,QuantType.per_1x128,1,0,32,0,28.8893,_ZN5aiter44fmoe_bf16_blockscaleBf16_g1u1_ps_silu_32x128E,0.0%,0.0,,0.0%,28.8893,1,4.36,27876.44
256,4,2048,256,512,10,ActivationType.Silu,torch.bfloat16,torch.float8_e4m3fn,torch.float8_e4m3fn,QuantType.per_1x128,1,0,64,0,38.3512,_ZN5aiter40fmoe_bf16_blockscaleFp8_g1u1_silu_64x128E,0.0%,0.0,,0.0%,38.3512,1,3.28,20998.85
256,8,2048,256,512,10,ActivationType.Silu,torch.bfloat16,torch.float8_e4m3fn,torch.float8_e4m3fn,QuantType.per_1x128,1,0,16,0,25.557,moe_ck2stages_gemm1_256x16x128x256_1x4_MulABScaleExpertWeightA8W8blkscale_v1_Nswizzle0_Quant4_MulRoutedWeight0_silu_F8_F8_B16,0.2%,15.3335,moe_ck2stages_gemm2_256x16x128x256_1x4_MulABScaleExpertWeightA8W8blkscale_v1_Nswizzle0_Quant4_MulRoutedWeight1_F8_F8_B16,17.6%,40.8905,0,6.15,19695.42
256,8,2048,256,512,10,ActivationType.Silu,torch.bfloat16,torch.float8_e4m3fn,torch.float8_e4m3fn,QuantType.per_1x128,1,0,32,0,27.757,moe_ck2stages_gemm1_256x32x128x128_1x4_MulABScaleExpertWeightA8W8blkscale_v1_Nswizzle0_Quant4_MulRoutedWeight0_silu_F8_F8_B16,0.2%,16.3101,moe_ck2stages_gemm2_256x32x128x128_1x4_MulABScaleExpertWeightA8W8blkscale_v1_Nswizzle0_Quant4_MulRoutedWeight1_F8_F8_B16,17.8%,44.0671,0,5.71,18275.66
256,8,2048,256,512,10,ActivationType.Silu,torch.bfloat16,torch.float8_e4m3fn,torch.float8_e4m3fn,QuantType.per_1x128,1,0,64,0,40.1678,moe_ck2stages_gemm1_256x64x128x128_1x4_MulABScaleExpertWeightA8W8blkscale_v3_Nswizzle0_Quant4_MulRoutedWeight0_silu_F8_F8_B16,0.2%,22.1297,moe_ck2stages_gemm2_256x64x128x128_1x4_MulABScaleExpertWeightA8W8blkscale_v3_Nswizzle0_Quant4_MulRoutedWeight1_F8_F8_B16,17.6%,62.2975,0,4.04,12927.57
256,8,2048,256,512,10,ActivationType.Silu,torch.bfloat16,torch.float8_e4m3fn,torch.float8_e4m3fn,QuantType.per_1x128,1,0,32,0,35.7708,_ZN5aiter44fmoe_bf16_blockscaleBf16_g1u1_ps_silu_32x128E,0.0%,0.0,,0.0%,35.7708,1,7.04,22514.33
256,8,2048,256,512,10,ActivationType.Silu,torch.bfloat16,torch.float8_e4m3fn,torch.float8_e4m3fn,QuantType.per_1x128,1,0,64,0,45.3728,_ZN5aiter40fmoe_bf16_blockscaleFp8_g1u1_silu_64x128E,0.0%,0.0,,0.0%,45.3728,1,5.55,17749.74
256,16,2048,256,512,10,ActivationType.Silu,torch.bfloat16,torch.float8_e4m3fn,torch.float8_e4m3fn,QuantType.per_1x128,1,0,16,0,39.1423,moe_ck2stages_gemm1_128x16x128x128_1x2_MulABScaleExpertWeightA8W8blkscale_v1_Nswizzle0_Quant4_MulRoutedWeight0_silu_F8_F8_B16,0.2%,19.8639,moe_ck2stages_gemm2_256x16x128x256_1x4_MulABScaleExpertWeightA8W8blkscale_v1_Nswizzle0_Quant4_MulRoutedWeight1_F8_F8_B16,17.5%,59.0062,0,8.53,13649.49
256,16,2048,256,512,10,ActivationType.Silu,torch.bfloat16,torch.float8_e4m3fn,torch.float8_e4m3fn,QuantType.per_1x128,1,0,32,0,42.2312,moe_ck2stages_gemm1_256x32x128x128_1x4_MulABScaleExpertWeightA8W8blkscale_v1_Nswizzle0_Quant4_MulRoutedWeight0_silu_F8_F8_B16,0.2%,21.3081,moe_ck2stages_gemm2_256x32x128x128_1x4_MulABScaleExpertWeightA8W8blkscale_v1_Nswizzle0_Quant4_MulRoutedWeight1_F8_F8_B16,17.4%,63.5393,0,7.92,12675.69
256,16,2048,256,512,10,ActivationType.Silu,torch.bfloat16,torch.float8_e4m3fn,torch.float8_e4m3fn,QuantType.per_1x128,1,0,64,0,57.4641,moe_ck2stages_gemm1_256x64x128x128_1x4_MulABScaleExpertWeightA8W8blkscale_v3_Nswizzle0_Quant4_MulRoutedWeight0_silu_F8_F8_B16,0.2%,32.0474,moe_ck2stages_gemm2_256x64x128x128_1x4_MulABScaleExpertWeightA8W8blkscale_v3_Nswizzle0_Quant4_MulRoutedWeight1_F8_F8_B16,17.6%,89.5115,0,5.62,8997.78
256,16,2048,256,512,10,ActivationType.Silu,torch.bfloat16,torch.float8_e4m3fn,torch.float8_e4m3fn,QuantType.per_1x128,1,0,32,0,53.175,_ZN5aiter47fmoe_bf16_blockscaleFp8_g1u1_vs_silu_1tg_32x256E,0.0%,0.0,,0.0%,53.175,1,9.47,15146.3
256,16,2048,256,512,10,ActivationType.Silu,torch.bfloat16,torch.float8_e4m3fn,torch.float8_e4m3fn,QuantType.per_1x128,1,0,64,0,72.0825,_ZN5aiter40fmoe_bf16_blockscaleFp8_g1u1_silu_64x256E,0.0%,0.0,,0.0%,72.0825,1,6.98,11173.37
256,32,2048,256,512,10,ActivationType.Silu,torch.bfloat16,torch.float8_e4m3fn,torch.float8_e4m3fn,QuantType.per_1x128,1,0,16,0,50.6566,moe_ck2stages_gemm1_256x16x128x256_1x4_MulABScaleExpertWeightA8W8blkscale_v1_Nswizzle0_Quant4_MulRoutedWeight0_silu_F8_F8_B16,0.1%,27.7687,moe_ck2stages_gemm2_256x16x128x256_1x4_MulABScaleExpertWeightA8W8blkscale_v1_Nswizzle0_Quant4_MulRoutedWeight1_F8_F8_B16,17.6%,78.4253,0,12.84,10270.96
256,32,2048,256,512,10,ActivationType.Silu,torch.bfloat16,torch.float8_e4m3fn,torch.float8_e4m3fn,QuantType.per_1x128,1,0,32,0,54.1868,moe_ck2stages_gemm1_256x32x128x128_1x4_MulABScaleExpertWeightA8W8blkscale_v1_Nswizzle0_Quant4_MulRoutedWeight0_silu_F8_F8_B16,0.1%,29.7659,moe_ck2stages_gemm2_256x32x128x128_1x4_MulABScaleExpertWeightA8W8blkscale_v1_Nswizzle0_Quant4_MulRoutedWeight1_F8_F8_B16,17.5%,83.9527,0,11.99,9594.72
256,32,2048,256,512,10,ActivationType.Silu,torch.bfloat16,torch.float8_e4m3fn,torch.float8_e4m3fn,QuantType.per_1x128,1,0,64,0,66.7783,moe_ck2stages_gemm1_256x64x128x128_1x4_MulABScaleExpertWeightA8W8blkscale_v3_Nswizzle0_Quant4_MulRoutedWeight0_silu_F8_F8_B16,0.1%,46.7405,moe_ck2stages_gemm2_256x64x128x128_1x4_MulABScaleExpertWeightA8W8blkscale_v3_Nswizzle0_Quant4_MulRoutedWeight1_F8_F8_B16,17.6%,113.5188,0,8.87,7095.77
256,32,2048,256,512,10,ActivationType.Silu,torch.bfloat16,torch.float8_e4m3fn,torch.float8_e4m3fn,QuantType.per_1x128,1,0,32,0,76.9247,_ZN5aiter47fmoe_bf16_blockscaleFp8_g1u1_vs_silu_1tg_32x256E,0.0%,0.0,,0.0%,76.9247,1,13.09,10471.32
256,32,2048,256,512,10,ActivationType.Silu,torch.bfloat16,torch.float8_e4m3fn,torch.float8_e4m3fn,QuantType.per_1x128,1,0,64,0,83.8175,_ZN5aiter40fmoe_bf16_blockscaleFp8_g1u1_silu_64x256E,0.0%,0.0,,0.0%,83.8175,1,12.01,9610.2
256,64,2048,256,512,10,ActivationType.Silu,torch.bfloat16,torch.float8_e4m3fn,torch.float8_e4m3fn,QuantType.per_1x128,1,0,16,0,72.9834,moe_ck2stages_gemm1_256x16x128x256_1x4_MulABScaleExpertWeightA8W8blkscale_v1_Nswizzle0_Quant4_MulRoutedWeight0_silu_F8_F8_B16,0.1%,39.8503,moe_ck2stages_gemm2_256x16x128x256_1x4_MulABScaleExpertWeightA8W8blkscale_v1_Nswizzle0_Quant4_MulRoutedWeight1_F8_F8_B16,17.5%,112.8337,0,17.84,7140.59
256,64,2048,256,512,10,ActivationType.Silu,torch.bfloat16,torch.float8_e4m3fn,torch.float8_e4m3fn,QuantType.per_1x128,1,0,32,0,76.4832,moe_ck2stages_gemm1_256x32x128x128_1x4_MulABScaleExpertWeightA8W8blkscale_v1_Nswizzle0_Quant4_MulRoutedWeight0_silu_F8_F8_B16,0.1%,39.6597,moe_ck2stages_gemm2_256x32x128x128_1x4_MulABScaleExpertWeightA8W8blkscale_v1_Nswizzle0_Quant4_MulRoutedWeight1_F8_F8_B16,17.6%,116.1429,0,17.33,6937.14
256,64,2048,256,512,10,ActivationType.Silu,torch.bfloat16,torch.float8_e4m3fn,torch.float8_e4m3fn,QuantType.per_1x128,1,0,64,0,107.4281,moe_ck2stages_gemm1_256x64x128x128_1x4_MulABScaleExpertWeightA8W8blkscale_v3_Nswizzle0_Quant4_MulRoutedWeight0_silu_F8_F8_B16,0.1%,67.6285,moe_ck2stages_gemm2_256x64x128x128_1x4_MulABScaleExpertWeightA8W8blkscale_v3_Nswizzle0_Quant4_MulRoutedWeight1_F8_F8_B16,17.5%,175.0566,0,11.5,4602.51
256,64,2048,256,512,10,ActivationType.Silu,torch.bfloat16,torch.float8_e4m3fn,torch.float8_e4m3fn,QuantType.per_1x128,1,0,32,0,115.7359,_ZN5aiter47fmoe_bf16_blockscaleFp8_g1u1_vs_silu_1tg_32x256E,0.0%,0.0,,0.0%,115.7359,1,17.4,6961.54
256,64,2048,256,512,10,ActivationType.Silu,torch.bfloat16,torch.float8_e4m3fn,torch.float8_e4m3fn,QuantType.per_1x128,1,0,64,0,123.2231,_ZN5aiter40fmoe_bf16_blockscaleFp8_g1u1_silu_64x128E,0.0%,0.0,,0.0%,123.2231,1,16.34,6538.54
256,128,2048,256,512,10,ActivationType.Silu,torch.bfloat16,torch.float8_e4m3fn,torch.float8_e4m3fn,QuantType.per_1x128,1,0,16,0,93.3692,moe_ck2stages_gemm1_256x16x128x256_1x4_MulABScaleExpertWeightA8W8blkscale_v1_Nswizzle0_Quant4_MulRoutedWeight0_silu_F8_F8_B16,0.1%,48.657,moe_ck2stages_gemm2_256x16x128x256_1x4_MulABScaleExpertWeightA8W8blkscale_v1_Nswizzle0_Quant4_MulRoutedWeight1_F8_F8_B16,17.5%,142.0262,0,28.35,5675.66
256,128,2048,256,512,10,ActivationType.Silu,torch.bfloat16,torch.float8_e4m3fn,torch.float8_e4m3fn,QuantType.per_1x128,1,0,32,0,102.1908,moe_ck2stages_gemm1_256x32x128x128_1x4_MulABScaleExpertWeightA8W8blkscale_v1_Nswizzle0_Quant4_MulRoutedWeight0_silu_F8_F8_B16,0.1%,49.7844,moe_ck2stages_gemm2_256x32x128x128_1x4_MulABScaleExpertWeightA8W8blkscale_v1_Nswizzle0_Quant4_MulRoutedWeight1_F8_F8_B16,17.5%,151.9752,0,26.49,5304.11
256,128,2048,256,512,10,ActivationType.Silu,torch.bfloat16,torch.float8_e4m3fn,torch.float8_e4m3fn,QuantType.per_1x128,1,0,64,0,118.2302,moe_ck2stages_gemm1_256x64x128x128_1x4_MulABScaleExpertWeightA8W8blkscale_v3_Nswizzle0_Quant4_MulRoutedWeight0_silu_F8_F8_B16,0.1%,85.7575,moe_ck2stages_gemm2_256x64x128x128_1x4_MulABScaleExpertWeightA8W8blkscale_v3_Nswizzle0_Quant4_MulRoutedWeight1_F8_F8_B16,17.4%,203.9877,0,19.74,3951.67
256,128,2048,256,512,10,ActivationType.Silu,torch.bfloat16,torch.float8_e4m3fn,torch.float8_e4m3fn,QuantType.per_1x128,1,0,32,0,142.7216,_ZN5aiter47fmoe_bf16_blockscaleFp8_g1u1_vs_silu_1tg_32x256E,0.0%,0.0,,0.0%,142.7216,1,28.21,5648.01
256,128,2048,256,512,10,ActivationType.Silu,torch.bfloat16,torch.float8_e4m3fn,torch.float8_e4m3fn,QuantType.per_1x128,1,0,64,0,143.4739,_ZN5aiter40fmoe_bf16_blockscaleFp8_g1u1_silu_64x256E,0.0%,0.0,,0.0%,143.4739,1,28.06,5618.39
256,256,2048,256,512,10,ActivationType.Silu,torch.bfloat16,torch.float8_e4m3fn,torch.float8_e4m3fn,QuantType.per_1x128,1,0,16,0,105.3525,moe_ck2stages_gemm1_128x16x128x128_1x2_MulABScaleExpertWeightA8W8blkscale_v1_Nswizzle0_Quant4_MulRoutedWeight0_silu_F8_F8_B16,0.1%,53.1531,moe_ck2stages_gemm2_256x16x128x256_1x4_MulABScaleExpertWeightA8W8blkscale_v1_Nswizzle0_Quant4_MulRoutedWeight1_F8_F8_B16,17.5%,158.5056,0,50.81,5090.54
256,256,2048,256,512,10,ActivationType.Silu,torch.bfloat16,torch.float8_e4m3fn,torch.float8_e4m3fn,QuantType.per_1x128,1,0,32,0,122.8539,moe_ck2stages_gemm1_256x32x128x128_1x4_MulABScaleExpertWeightA8W8blkscale_v1_Nswizzle0_Quant4_MulRoutedWeight0_silu_F8_F8_B16,0.1%,53.4668,moe_ck2stages_gemm2_256x32x128x128_1x4_MulABScaleExpertWeightA8W8blkscale_v1_Nswizzle0_Quant4_MulRoutedWeight1_F8_F8_B16,17.5%,176.3207,0,45.67,4576.2
256,256,2048,256,512,10,ActivationType.Silu,torch.bfloat16,torch.float8_e4m3fn,torch.float8_e4m3fn,QuantType.per_1x128,1,0,64,0,140.7966,moe_ck2stages_gemm1_256x64x128x128_1x4_MulABScaleExpertWeightA8W8blkscale_v3_Nswizzle0_Quant4_MulRoutedWeight0_silu_F8_F8_B16,0.1%,93.7738,moe_ck2stages_gemm2_256x64x128x128_1x4_MulABScaleExpertWeightA8W8blkscale_v3_Nswizzle0_Quant4_MulRoutedWeight1_F8_F8_B16,17.5%,234.5704,0,34.33,3439.82
256,256,2048,256,512,10,ActivationType.Silu,torch.bfloat16,torch.float8_e4m3fn,torch.float8_e4m3fn,QuantType.per_1x128,1,0,64,0,151.4855,_ZN5aiter40fmoe_bf16_blockscaleFp8_g1u1_silu_64x256E,0.0%,0.0,,0.0%,151.4855,1,53.16,5326.45
256,256,2048,256,512,10,ActivationType.Silu,torch.bfloat16,torch.float8_e4m3fn,torch.float8_e4m3fn,QuantType.per_1x128,1,0,32,0,152.7445,_ZN5aiter50fmoe_bf16_blockscaleFp8_g1u1_vs_silu_1tg_ps_32x256E,0.0%,0.0,,0.0%,152.7445,1,52.72,5282.54
256,512,2048,256,512,10,ActivationType.Silu,torch.bfloat16,torch.float8_e4m3fn,torch.float8_e4m3fn,QuantType.per_1x128,1,0,16,0,111.3585,moe_ck2stages_gemm1_256x16x128x256_1x4_MulABScaleExpertWeightA8W8blkscale_v1_Nswizzle0_Quant4_MulRoutedWeight0_silu_F8_F8_B16,0.1%,54.7168,moe_ck2stages_gemm2_256x16x128x256_1x4_MulABScaleExpertWeightA8W8blkscale_v1_Nswizzle0_Quant4_MulRoutedWeight1_F8_F8_B16,17.7%,166.0753,0,96.98,4867.99
256,512,2048,256,512,10,ActivationType.Silu,torch.bfloat16,torch.float8_e4m3fn,torch.float8_e4m3fn,QuantType.per_1x128,1,0,32,0,125.1901,moe_ck2stages_gemm1_256x32x128x128_1x4_MulABScaleExpertWeightA8W8blkscale_v1_Nswizzle0_Quant4_MulRoutedWeight0_silu_F8_F8_B16,0.1%,54.69,moe_ck2stages_gemm2_256x32x128x128_1x4_MulABScaleExpertWeightA8W8blkscale_v1_Nswizzle0_Quant4_MulRoutedWeight1_F8_F8_B16,17.7%,179.8801,0,89.54,4494.39
256,512,2048,256,512,10,ActivationType.Silu,torch.bfloat16,torch.float8_e4m3fn,torch.float8_e4m3fn,QuantType.per_1x128,1,0,64,0,141.2955,moe_ck2stages_gemm1_256x64x128x128_1x4_MulABScaleExpertWeightA8W8blkscale_v3_Nswizzle0_Quant4_MulRoutedWeight0_silu_F8_F8_B16,0.1%,97.8851,moe_ck2stages_gemm2_256x64x128x128_1x4_MulABScaleExpertWeightA8W8blkscale_v3_Nswizzle0_Quant4_MulRoutedWeight1_F8_F8_B16,17.7%,239.1806,0,67.34,3380.09
256,512,2048,256,512,10,ActivationType.Silu,torch.bfloat16,torch.float8_e4m3fn,torch.float8_e4m3fn,QuantType.per_1x128,1,0,64,0,153.8102,_ZN5aiter40fmoe_bf16_blockscaleFp8_g1u1_silu_64x256E,0.0%,0.0,,0.0%,153.8102,1,104.71,5256.17
256,512,2048,256,512,10,ActivationType.Silu,torch.bfloat16,torch.float8_e4m3fn,torch.float8_e4m3fn,QuantType.per_1x128,1,0,32,0,155.6377,_ZN5aiter50fmoe_bf16_blockscaleFp8_g1u1_vs_silu_1tg_ps_32x256E,0.0%,0.0,,0.0%,155.6377,1,103.48,5194.45
256,1024,2048,256,512,10,ActivationType.Silu,torch.bfloat16,torch.float8_e4m3fn,torch.float8_e4m3fn,QuantType.per_1x128,1,0,32,0,122.7142,moe_ck2stages_gemm1_256x32x128x128_1x4_MulABScaleExpertWeightA8W8blkscale_v1_Nswizzle0_Quant4_MulRoutedWeight0_silu_F8_F8_B16,0.1%,60.2417,moe_ck2stages_gemm2_256x32x128x128_1x4_MulABScaleExpertWeightA8W8blkscale_v1_Nswizzle0_Quant4_MulRoutedWeight1_F8_F8_B16,17.7%,182.9559,0,176.07,4436.03
256,1024,2048,256,512,10,ActivationType.Silu,torch.bfloat16,torch.float8_e4m3fn,torch.float8_e4m3fn,QuantType.per_1x128,1,0,64,0,144.4718,moe_ck2stages_gemm1_256x64x128x128_1x4_MulABScaleExpertWeightA8W8blkscale_v3_Nswizzle0_Quant4_MulRoutedWeight0_silu_F8_F8_B16,0.1%,105.2642,moe_ck2stages_gemm2_256x64x128x128_1x4_MulABScaleExpertWeightA8W8blkscale_v3_Nswizzle0_Quant4_MulRoutedWeight1_F8_F8_B16,17.7%,249.736,0,128.99,3249.82
256,1024,2048,256,512,10,ActivationType.Silu,torch.bfloat16,torch.float8_e4m3fn,torch.float8_e4m3fn,QuantType.per_1x128,1,0,16,0,155.1475,moe_ck2stages_gemm1_256x16x128x256_1x4_MulABScaleExpertWeightA8W8blkscale_v1_Nswizzle0_Quant4_MulRoutedWeight0_silu_F8_F8_B16,0.1%,63.3765,moe_ck2stages_gemm2_256x16x128x256_1x4_MulABScaleExpertWeightA8W8blkscale_v1_Nswizzle0_Quant4_MulRoutedWeight1_F8_F8_B16,17.7%,218.524,0,147.41,3714.0
256,1024,2048,256,512,10,ActivationType.Silu,torch.bfloat16,torch.float8_e4m3fn,torch.float8_e4m3fn,QuantType.per_1x128,1,0,64,0,160.3725,_ZN5aiter40fmoe_bf16_blockscaleFp8_g1u1_silu_64x256E,0.0%,0.0,,0.0%,160.3725,1,200.86,5060.7
256,1024,2048,256,512,10,ActivationType.Silu,torch.bfloat16,torch.float8_e4m3fn,torch.float8_e4m3fn,QuantType.per_1x128,1,0,32,0,184.9351,_ZN5aiter50fmoe_bf16_blockscaleFp8_g1u1_vs_silu_1tg_ps_32x256E,0.0%,0.0,,0.0%,184.9351,1,174.18,4388.55
256,2048,2048,256,512,10,ActivationType.Silu,torch.bfloat16,torch.float8_e4m3fn,torch.float8_e4m3fn,QuantType.per_1x128,1,0,64,0,149.1924,moe_ck2stages_gemm1_256x64x128x128_1x4_MulABScaleExpertWeightA8W8blkscale_v3_Nswizzle0_Quant4_MulRoutedWeight0_silu_F8_F8_B16,0.1%,113.3924,moe_ck2stages_gemm2_256x64x128x128_1x4_MulABScaleExpertWeightA8W8blkscale_v3_Nswizzle0_Quant4_MulRoutedWeight1_F8_F8_B16,17.7%,262.5848,0,245.35,3114.76
256,2048,2048,256,512,10,ActivationType.Silu,torch.bfloat16,torch.float8_e4m3fn,torch.float8_e4m3fn,QuantType.per_1x128,1,0,32,0,176.5179,moe_ck2stages_gemm1_256x32x128x128_1x4_MulABScaleExpertWeightA8W8blkscale_v1_Nswizzle0_Quant4_MulRoutedWeight0_silu_F8_F8_B16,0.1%,86.9683,moe_ck2stages_gemm2_256x32x128x128_1x4_MulABScaleExpertWeightA8W8blkscale_v1_Nswizzle0_Quant4_MulRoutedWeight1_F8_F8_B16,17.7%,263.4862,0,244.51,3104.11
256,2048,2048,256,512,10,ActivationType.Silu,torch.bfloat16,torch.float8_e4m3fn,torch.float8_e4m3fn,QuantType.per_1x128,1,0,16,0,247.0886,moe_ck2stages_gemm1_256x16x128x256_1x4_MulABScaleExpertWeightA8W8blkscale_v1_Nswizzle0_Quant4_MulRoutedWeight0_silu_F8_F8_B16,0.1%,90.3406,moe_ck2stages_gemm2_256x16x128x256_1x4_MulABScaleExpertWeightA8W8blkscale_v1_Nswizzle0_Quant4_MulRoutedWeight1_F8_F8_B16,17.7%,337.4292,0,190.93,2423.88
256,2048,2048,256,512,10,ActivationType.Silu,torch.bfloat16,torch.float8_e4m3fn,torch.float8_e4m3fn,QuantType.per_1x128,1,0,64,0,176.0307,_ZN5aiter40fmoe_bf16_blockscaleFp8_g1u1_silu_64x256E,0.0%,0.0,,0.0%,176.0307,1,365.98,4646.29
256,2048,2048,256,512,10,ActivationType.Silu,torch.bfloat16,torch.float8_e4m3fn,torch.float8_e4m3fn,QuantType.per_1x128,1,0,32,0,275.1871,_ZN5aiter50fmoe_bf16_blockscaleFp8_g1u1_vs_silu_1tg_ps_32x256E,0.0%,0.0,,0.0%,275.1871,1,234.11,2972.12
256,4096,2048,256,512,10,ActivationType.Silu,torch.bfloat16,torch.float8_e4m3fn,torch.float8_e4m3fn,QuantType.per_1x128,1,0,64,0,259.6357,moe_ck2stages_gemm1_256x64x128x128_1x4_MulABScaleExpertWeightA8W8blkscale_v3_Nswizzle0_Quant4_MulRoutedWeight0_silu_F8_F8_B16,0.1%,209.9115,moe_ck2stages_gemm2_256x64x128x128_1x4_MulABScaleExpertWeightA8W8blkscale_v3_Nswizzle0_Quant4_MulRoutedWeight1_F8_F8_B16,17.7%,469.5472,0,274.41,1768.67
256,4096,2048,256,512,10,ActivationType.Silu,torch.bfloat16,torch.float8_e4m3fn,torch.float8_e4m3fn,QuantType.per_1x128,1,0,32,0,274.5743,moe_ck2stages_gemm1_256x32x128x128_1x4_MulABScaleExpertWeightA8W8blkscale_v1_Nswizzle0_Quant4_MulRoutedWeight0_silu_F8_F8_B16,0.1%,147.0338,moe_ck2stages_gemm2_256x32x128x128_1x4_MulABScaleExpertWeightA8W8blkscale_v1_Nswizzle0_Quant4_MulRoutedWeight1_F8_F8_B16,17.7%,421.6081,0,305.61,1969.77
256,4096,2048,256,512,10,ActivationType.Silu,torch.bfloat16,torch.float8_e4m3fn,torch.float8_e4m3fn,QuantType.per_1x128,1,0,16,0,328.4228,moe_ck2stages_gemm1_256x16x128x256_1x4_MulABScaleExpertWeightA8W8blkscale_v1_Nswizzle0_Quant4_MulRoutedWeight0_silu_F8_F8_B16,0.1%,154.7557,moe_ck2stages_gemm2_256x16x128x256_1x4_MulABScaleExpertWeightA8W8blkscale_v1_Nswizzle0_Quant4_MulRoutedWeight1_F8_F8_B16,17.7%,483.1785,0,266.67,1718.77
256,4096,2048,256,512,10,ActivationType.Silu,torch.bfloat16,torch.float8_e4m3fn,torch.float8_e4m3fn,QuantType.per_1x128,1,0,64,0,250.1452,_ZN5aiter40fmoe_bf16_blockscaleFp8_g1u1_silu_64x256E,0.0%,0.0,,0.0%,250.1452,1,515.1,3319.96
256,4096,2048,256,512,10,ActivationType.Silu,torch.bfloat16,torch.float8_e4m3fn,torch.float8_e4m3fn,QuantType.per_1x128,1,0,32,0,419.2913,_ZN5aiter47fmoe_bf16_blockscaleFp8_g1u1_vs_silu_1tg_32x256E,0.0%,0.0,,0.0%,419.2913,1,307.3,1980.66
256,8192,2048,256,512,10,ActivationType.Silu,torch.bfloat16,torch.float8_e4m3fn,torch.float8_e4m3fn,QuantType.per_1x128,1,0,64,0,386.8544,moe_ck2stages_gemm1_256x64x128x128_1x4_MulABScaleExpertWeightA8W8blkscale_v3_Nswizzle0_Quant4_MulRoutedWeight0_silu_F8_F8_B16,0.1%,330.0282,moe_ck2stages_gemm2_256x64x128x128_1x4_MulABScaleExpertWeightA8W8blkscale_v3_Nswizzle0_Quant4_MulRoutedWeight1_F8_F8_B16,17.7%,716.8826,0,359.47,1193.55
256,8192,2048,256,512,10,ActivationType.Silu,torch.bfloat16,torch.float8_e4m3fn,torch.float8_e4m3fn,QuantType.per_1x128,1,0,16,0,386.9744,moe_ck2stages_gemm1_256x16x128x256_1x4_MulABScaleExpertWeightA8W8blkscale_v1_Nswizzle0_Quant4_MulRoutedWeight0_silu_F8_F8_B16,0.1%,291.8219,moe_ck2stages_gemm2_256x16x128x256_1x4_MulABScaleExpertWeightA8W8blkscale_v1_Nswizzle0_Quant4_MulRoutedWeight1_F8_F8_B16,17.7%,678.7963,0,379.64,1260.52
256,8192,2048,256,512,10,ActivationType.Silu,torch.bfloat16,torch.float8_e4m3fn,torch.float8_e4m3fn,QuantType.per_1x128,1,0,32,0,388.5521,moe_ck2stages_gemm1_256x32x128x128_1x4_MulABScaleExpertWeightA8W8blkscale_v1_Nswizzle0_Quant4_MulRoutedWeight0_silu_F8_F8_B16,0.1%,277.7292,moe_ck2stages_gemm2_256x32x128x128_1x4_MulABScaleExpertWeightA8W8blkscale_v1_Nswizzle0_Quant4_MulRoutedWeight1_F8_F8_B16,17.7%,666.2813,0,386.77,1284.2
256,8192,2048,256,512,10,ActivationType.Silu,torch.bfloat16,torch.float8_e4m3fn,torch.float8_e4m3fn,QuantType.per_1x128,1,0,64,0,398.5123,_ZN5aiter40fmoe_bf16_blockscaleFp8_g1u1_silu_64x256E,0.0%,0.0,,0.0%,398.5123,1,646.65,2147.08
256,8192,2048,256,512,10,ActivationType.Silu,torch.bfloat16,torch.float8_e4m3fn,torch.float8_e4m3fn,QuantType.per_1x128,1,0,32,0,756.2962,_ZN5aiter47fmoe_bf16_blockscaleFp8_g1u1_vs_silu_1tg_32x256E,0.0%,0.0,,0.0%,756.2962,1,340.74,1131.35
256,16384,2048,256,512,10,ActivationType.Silu,torch.bfloat16,torch.float8_e4m3fn,torch.float8_e4m3fn,QuantType.per_1x128,1,0,32,0,493.9168,moe_ck2stages_gemm1_256x32x128x128_1x4_MulABScaleExpertWeightA8W8blkscale_v1_Nswizzle0_Quant4_MulRoutedWeight0_silu_F8_F8_B16,0.1%,545.9982,moe_ck2stages_gemm2_256x32x128x128_1x4_MulABScaleExpertWeightA8W8blkscale_v1_Nswizzle0_Quant4_MulRoutedWeight1_F8_F8_B16,17.7%,1039.915,0,495.61,871.2
256,16384,2048,256,512,10,ActivationType.Silu,torch.bfloat16,torch.float8_e4m3fn,torch.float8_e4m3fn,QuantType.per_1x128,1,0,64,0,589.345,moe_ck2stages_gemm1_256x64x128x128_1x4_MulABScaleExpertWeightA8W8blkscale_v3_Nswizzle0_Quant4_MulRoutedWeight0_silu_F8_F8_B16,0.1%,606.9218,moe_ck2stages_gemm2_256x64x128x128_1x4_MulABScaleExpertWeightA8W8blkscale_v3_Nswizzle0_Quant4_MulRoutedWeight1_F8_F8_B16,17.7%,1196.2668,0,430.84,757.33
256,16384,2048,256,512,10,ActivationType.Silu,torch.bfloat16,torch.float8_e4m3fn,torch.float8_e4m3fn,QuantType.per_1x128,1,0,16,0,609.3078,moe_ck2stages_gemm1_128x16x128x128_1x2_MulABScaleExpertWeightA8W8blkscale_v1_Nswizzle0_Quant4_MulRoutedWeight0_silu_F8_F8_B16,0.1%,564.5033,moe_ck2stages_gemm2_256x16x128x256_1x4_MulABScaleExpertWeightA8W8blkscale_v1_Nswizzle0_Quant4_MulRoutedWeight1_F8_F8_B16,17.7%,1173.8111,0,439.08,771.82
256,16384,2048,256,512,10,ActivationType.Silu,torch.bfloat16,torch.float8_e4m3fn,torch.float8_e4m3fn,QuantType.per_1x128,1,0,64,0,708.5588,_ZN5aiter40fmoe_bf16_blockscaleFp8_g1u1_silu_64x256E,0.0%,0.0,,0.0%,708.5588,1,727.39,1278.61
256,16384,2048,256,512,10,ActivationType.Silu,torch.bfloat16,torch.float8_e4m3fn,torch.float8_e4m3fn,QuantType.per_1x128,1,0,32,0,1170.1093,_ZN5aiter47fmoe_bf16_blockscaleFp8_g1u1_vs_silu_1tg_32x256E,0.0%,0.0,,0.0%,1170.1093,1,440.47,774.26
256,32768,2048,256,512,10,ActivationType.Silu,torch.bfloat16,torch.float8_e4m3fn,torch.float8_e4m3fn,QuantType.per_1x128,1,0,32,0,839.5024,moe_ck2stages_gemm1_256x32x128x128_1x4_MulABScaleExpertWeightA8W8blkscale_v1_Nswizzle0_Quant4_MulRoutedWeight0_silu_F8_F8_B16,0.1%,1075.9943,moe_ck2stages_gemm2_256x32x128x128_1x4_MulABScaleExpertWeightA8W8blkscale_v1_Nswizzle0_Quant4_MulRoutedWeight1_F8_F8_B16,17.7%,1915.4967,0,538.13,525.52
256,32768,2048,256,512,10,ActivationType.Silu,torch.bfloat16,torch.float8_e4m3fn,torch.float8_e4m3fn,QuantType.per_1x128,1,0,64,0,1005.9428,moe_ck2stages_gemm1_256x64x128x128_1x4_MulABScaleExpertWeightA8W8blkscale_v3_Nswizzle0_Quant4_MulRoutedWeight0_silu_F8_F8_B16,0.1%,1157.5273,moe_ck2stages_gemm2_256x64x128x128_1x4_MulABScaleExpertWeightA8W8blkscale_v3_Nswizzle0_Quant4_MulRoutedWeight1_F8_F8_B16,17.7%,2163.4701,0,476.45,465.29
256,32768,2048,256,512,10,ActivationType.Silu,torch.bfloat16,torch.float8_e4m3fn,torch.float8_e4m3fn,QuantType.per_1x128,1,0,16,0,1104.2931,moe_ck2stages_gemm1_128x16x128x128_1x2_MulABScaleExpertWeightA8W8blkscale_v1_Nswizzle0_Quant4_MulRoutedWeight0_silu_F8_F8_B16,0.1%,1101.7858,moe_ck2stages_gemm2_256x16x128x256_1x4_MulABScaleExpertWeightA8W8blkscale_v1_Nswizzle0_Quant4_MulRoutedWeight1_F8_F8_B16,17.7%,2206.0789,0,467.25,456.3
256,32768,2048,256,512,10,ActivationType.Silu,torch.bfloat16,torch.float8_e4m3fn,torch.float8_e4m3fn,QuantType.per_1x128,1,0,64,0,1372.8719,_ZN5aiter40fmoe_bf16_blockscaleFp8_g1u1_silu_64x256E,0.0%,0.0,,0.0%,1372.8719,1,750.83,733.23
256,32768,2048,256,512,10,ActivationType.Silu,torch.bfloat16,torch.float8_e4m3fn,torch.float8_e4m3fn,QuantType.per_1x128,1,0,32,0,1901.1066,_ZN5aiter47fmoe_bf16_blockscaleFp8_g1u1_vs_silu_1tg_32x256E,0.0%,0.0,,0.0%,1901.1066,1,542.21,529.5
