aiter/configs/tuned_fmoe_tp4.csv
cu_num,token,model_dim,inter_dim,expert,topk,act_type,dtype,q_dtype_a,q_dtype_w,q_type,use_g1u1,doweight_stage1,block_m,ksplit,us1,kernelName1,err1,us2,kernelName2,err2,us,run_1stage,tflops,bw,_tag
256,1,2048,128,512,10,ActivationType.Silu,torch.bfloat16,torch.float8_e4m3fn,torch.float8_e4m3fn,QuantType.per_1x128,1,0,16,0,16.986,moe_ck2stages_gemm1_256x16x128x256_1x4_MulABScaleExpertWeightA8W8blkscale_v1_Nswizzle0_Quant4_MulRoutedWeight0_silu_F8_F8_B16,0.0%,5.6991,moe_ck2stages_gemm2_128x16x128x128_1x2_MulABScaleExpertWeightA8W8blkscale_v1_Nswizzle0_Quant4_MulRoutedWeight1_F8_F8_B16,16.3%,22.6851,0,0.69,17749.95,
256,2,2048,128,512,10,ActivationType.Silu,torch.bfloat16,torch.float8_e4m3fn,torch.float8_e4m3fn,QuantType.per_1x128,1,0,16,0,17.2764,moe_ck2stages_gemm1_256x16x128x256_1x4_MulABScaleExpertWeightA8W8blkscale_v1_Nswizzle0_Quant4_MulRoutedWeight0_silu_F8_F8_B16,0.0%,6.3932,moe_ck2stages_gemm2_128x16x128x128_1x2_MulABScaleExpertWeightA8W8blkscale_v1_Nswizzle0_Quant4_MulRoutedWeight1_F8_F8_B16,16.0%,23.6696,0,1.33,17011.93,
256,4,2048,128,512,10,ActivationType.Silu,torch.bfloat16,torch.float8_e4m3fn,torch.float8_e4m3fn,QuantType.per_1x128,1,0,16,0,17.3871,moe_ck2stages_gemm1_256x16x128x256_1x4_MulABScaleExpertWeightA8W8blkscale_v1_Nswizzle0_Quant4_MulRoutedWeight0_silu_F8_F8_B16,0.0%,7.5771,moe_ck2stages_gemm2_128x16x128x128_1x2_MulABScaleExpertWeightA8W8blkscale_v1_Nswizzle0_Quant4_MulRoutedWeight1_F8_F8_B16,17.0%,24.9642,0,2.52,16130.21,
256,8,2048,128,512,10,ActivationType.Silu,torch.bfloat16,torch.float8_e4m3fn,torch.float8_e4m3fn,QuantType.per_1x128,1,0,16,0,19.236,moe_ck2stages_gemm1_256x16x128x256_1x4_MulABScaleExpertWeightA8W8blkscale_v1_Nswizzle0_Quant4_MulRoutedWeight0_silu_F8_F8_B16,0.0%,9.6012,moe_ck2stages_gemm2_128x16x128x128_1x2_MulABScaleExpertWeightA8W8blkscale_v1_Nswizzle0_Quant4_MulRoutedWeight1_F8_F8_B16,17.0%,28.8372,0,4.36,13964.68,
256,16,2048,128,512,10,ActivationType.Silu,torch.bfloat16,torch.float8_e4m3fn,torch.float8_e4m3fn,QuantType.per_1x128,1,0,32,0,33.7915,_ZN5aiter44fmoe_bf16_blockscaleBf16_g1u1_ps_silu_32x128E,0.0%,0.0,,0.0%,33.7915,1,7.45,11918.72,
256,32,2048,128,512,10,ActivationType.Silu,torch.bfloat16,torch.float8_e4m3fn,torch.float8_e4m3fn,QuantType.per_1x128,1,0,32,0,42.4388,_ZN5aiter44fmoe_bf16_blockscaleBf16_g1u1_ps_silu_32x128E,0.0%,0.0,,0.0%,42.4388,1,11.86,9492.49,
256,64,2048,128,512,10,ActivationType.Silu,torch.bfloat16,torch.float8_e4m3fn,torch.float8_e4m3fn,QuantType.per_1x128,1,0,32,0,62.8301,_ZN5aiter44fmoe_bf16_blockscaleBf16_g1u1_ps_silu_32x128E,0.0%,0.0,,0.0%,62.8301,1,16.02,6414.86,
256,128,2048,128,512,10,ActivationType.Silu,torch.bfloat16,torch.float8_e4m3fn,torch.float8_e4m3fn,QuantType.per_1x128,1,0,32,0,72.5893,_ZN5aiter44fmoe_bf16_blockscaleBf16_g1u1_ps_silu_32x128E,0.0%,0.0,,0.0%,72.5893,1,27.74,5557.84,
256,256,2048,128,512,10,ActivationType.Silu,torch.bfloat16,torch.float8_e4m3fn,torch.float8_e4m3fn,QuantType.per_1x128,1,0,64,0,86.033,_ZN5aiter40fmoe_bf16_blockscaleFp8_g1u1_silu_64x128E,0.0%,0.0,,0.0%,86.033,1,46.8,4698.5,
256,512,2048,128,512,10,ActivationType.Silu,torch.bfloat16,torch.float8_e4m3fn,torch.float8_e4m3fn,QuantType.per_1x128,1,0,64,0,88.6127,_ZN5aiter40fmoe_bf16_blockscaleFp8_g1u1_silu_64x128E,0.0%,0.0,,0.0%,88.6127,1,90.88,4579.47,
256,1024,2048,128,512,10,ActivationType.Silu,torch.bfloat16,torch.float8_e4m3fn,torch.float8_e4m3fn,QuantType.per_1x128,1,0,64,0,94.0901,_ZN5aiter40fmoe_bf16_blockscaleFp8_g1u1_silu_64x128E,0.0%,0.0,,0.0%,94.0901,1,171.18,4346.31,
256,2048,2048,128,512,10,ActivationType.Silu,torch.bfloat16,torch.float8_e4m3fn,torch.float8_e4m3fn,QuantType.per_1x128,1,0,64,0,123.9071,_ZN5aiter40fmoe_bf16_blockscaleFp8_g1u1_silu_64x128E,0.0%,0.0,,0.0%,123.9071,1,259.97,3351.19,
256,4096,2048,128,512,10,ActivationType.Silu,torch.bfloat16,torch.float8_e4m3fn,torch.float8_e4m3fn,QuantType.per_1x128,1,0,64,0,202.3177,_ZN5aiter40fmoe_bf16_blockscaleFp8_g1u1_silu_64x128E,0.0%,0.0,,0.0%,202.3177,1,318.43,2114.59,
256,8192,2048,128,512,10,ActivationType.Silu,torch.bfloat16,torch.float8_e4m3fn,torch.float8_e4m3fn,QuantType.per_1x128,1,0,64,0,345.479,_ZN5aiter40fmoe_bf16_blockscaleFp8_g1u1_silu_64x128E,0.0%,0.0,,0.0%,345.479,1,372.96,1311.18,
256,16384,2048,128,512,10,ActivationType.Silu,torch.bfloat16,torch.float8_e4m3fn,torch.float8_e4m3fn,QuantType.per_1x128,1,0,64,0,629.352,_ZN5aiter40fmoe_bf16_blockscaleFp8_g1u1_silu_64x128E,0.0%,0.0,,0.0%,629.352,1,409.47,799.74,
256,32768,2048,128,512,10,ActivationType.Silu,torch.bfloat16,torch.float8_e4m3fn,torch.float8_e4m3fn,QuantType.per_1x128,1,0,64,0,1206.7059,_ZN5aiter40fmoe_bf16_blockscaleFp8_g1u1_silu_64x128E,0.0%,0.0,,0.0%,1206.7059,1,427.11,500.52,
