aiter/configs/model_configs/a8w8_blockscale_tuned_gemm_qwen3_next_80b_a3b.csv
gfx,cu_num,M,N,K,libtype,kernelId,splitK,us,kernelName,tflops,bw,errRatio
gfx950,256,1,256,2048,ck,8,3,5.3821,a8w8_blockscale_1x128x128_256x16x64x256_16x16_16x16_1x1_16x16x1_16x16x1_1x16x1x16_4_1x1_intrawave_v1,0.19,97.89,0.0
gfx950,256,2,256,2048,ck,8,3,5.3824,a8w8_blockscale_1x128x128_256x16x64x256_16x16_16x16_1x1_16x16x1_16x16x1_1x16x1x16_4_1x1_intrawave_v1,0.39,98.36,0.0
gfx950,256,4,256,2048,ck,8,3,5.3455,a8w8_blockscale_1x128x128_256x16x64x256_16x16_16x16_1x1_16x16x1_16x16x1_1x16x1x16_4_1x1_intrawave_v1,0.78,100.0,0.0
gfx950,256,8,256,2048,ck,8,3,5.4095,a8w8_blockscale_1x128x128_256x16x64x256_16x16_16x16_1x1_16x16x1_16x16x1_1x16x1x16_4_1x1_intrawave_v1,1.55,100.71,0.0
gfx950,256,16,256,2048,ck,8,3,5.4627,a8w8_blockscale_1x128x128_256x16x64x256_16x16_16x16_1x1_16x16x1_16x16x1_1x16x1x16_4_1x1_intrawave_v1,3.07,103.47,0.0
gfx950,256,32,256,2048,ck,8,3,6.116,a8w8_blockscale_1x128x128_256x16x64x256_16x16_16x16_1x1_16x16x1_16x16x1_1x16x1x16_4_1x1_intrawave_v1,5.49,99.12,0.0
gfx950,256,48,256,2048,ck,8,3,6.2752,a8w8_blockscale_1x128x128_256x16x64x256_16x16_16x16_1x1_16x16x1_16x16x1_1x16x1x16_4_1x1_intrawave_v1,8.02,103.13,0.0
gfx950,256,64,256,2048,ck,8,2,5.9001,a8w8_blockscale_1x128x128_256x16x64x256_16x16_16x16_1x1_16x16x1_16x16x1_1x16x1x16_4_1x1_intrawave_v1,11.37,116.63,0.0
gfx950,256,80,256,2048,ck,6,3,6.174,a8w8_blockscale_1x128x128_256x16x64x128_8x16_16x16_1x1_16x16x1_8x32x1_1x16x1x16_4_1x1_intrawave_v1,13.59,118.09,0.0
gfx950,256,96,256,2048,ck,8,2,6.0132,a8w8_blockscale_1x128x128_256x16x64x256_16x16_16x16_1x1_16x16x1_16x16x1_1x16x1x16_4_1x1_intrawave_v1,16.74,128.06,0.0
gfx950,256,112,256,2048,ck,8,3,6.4352,a8w8_blockscale_1x128x128_256x16x64x256_16x16_16x16_1x1_16x16x1_16x16x1_1x16x1x16_4_1x1_intrawave_v1,18.25,126.03,0.0
gfx950,256,128,256,2048,ck,8,3,6.6216,a8w8_blockscale_1x128x128_256x16x64x256_16x16_16x16_1x1_16x16x1_16x16x1_1x16x1x16_4_1x1_intrawave_v1,20.27,128.66,0.0
gfx950,256,256,256,2048,ck,8,2,5.9766,a8w8_blockscale_1x128x128_256x16x64x256_16x16_16x16_1x1_16x16x1_16x16x1_1x16x1x16_4_1x1_intrawave_v1,44.91,197.38,0.0
gfx950,256,512,256,2048,ck,8,2,6.5051,a8w8_blockscale_1x128x128_256x16x64x256_16x16_16x16_1x1_16x16x1_16x16x1_1x16x1x16_4_1x1_intrawave_v1,82.53,282.09,0.0
gfx950,256,588,256,2048,ck,8,2,7.3827,a8w8_blockscale_1x128x128_256x16x64x256_16x16_16x16_1x1_16x16x1_16x16x1_1x16x1x16_4_1x1_intrawave_v1,83.51,274.91,0.0
gfx950,256,773,256,2048,ck,8,0,8.2754,a8w8_blockscale_1x128x128_256x16x64x256_16x16_16x16_1x1_16x16x1_16x16x1_1x16x1x16_4_1x1_intrawave_v1,97.95,302.48,0.0
gfx950,256,822,256,2048,ck,8,0,8.386,a8w8_blockscale_1x128x128_256x16x64x256_16x16_16x16_1x1_16x16x1_16x16x1_1x16x1x16_4_1x1_intrawave_v1,102.78,313.45,0.0
gfx950,256,1024,256,2048,ck,8,0,8.3191,a8w8_blockscale_1x128x128_256x16x64x256_16x16_16x16_1x1_16x16x1_16x16x1_1x16x1x16_4_1x1_intrawave_v1,129.07,378.13,0.0
gfx950,256,1025,256,2048,ck,8,2,9.6064,a8w8_blockscale_1x128x128_256x16x64x256_16x16_16x16_1x1_16x16x1_16x16x1_1x16x1x16_4_1x1_intrawave_v1,111.88,327.73,0.0
gfx950,256,1027,256,2048,ck,8,2,9.5908,a8w8_blockscale_1x128x128_256x16x64x256_16x16_16x16_1x1_16x16x1_16x16x1_1x16x1x16_4_1x1_intrawave_v1,112.28,328.8,0.0
gfx950,256,1042,256,2048,ck,7,0,9.5431,a8w8_blockscale_1x128x128_256x16x128x256_16x16_16x16_1x2_16x16x1_16x16x1_1x16x1x16_8_1x2_intrawave_v1,114.49,334.46,0.0
gfx950,256,1051,256,2048,ck,8,2,9.6922,a8w8_blockscale_1x128x128_256x16x64x256_16x16_16x16_1x1_16x16x1_16x16x1_1x16x1x16_4_1x1_intrawave_v1,113.71,331.69,0.0
gfx950,256,1055,256,2048,ck,8,2,9.4241,a8w8_blockscale_1x128x128_256x16x64x256_16x16_16x16_1x1_16x16x1_16x16x1_1x16x1x16_4_1x1_intrawave_v1,117.38,342.22,0.0
gfx950,256,1057,256,2048,ck,7,0,9.6419,a8w8_blockscale_1x128x128_256x16x128x256_16x16_16x16_1x2_16x16x1_16x16x1_1x16x1x16_8_1x2_intrawave_v1,114.95,335.02,0.0
gfx950,256,1069,256,2048,ck,8,2,9.0751,a8w8_blockscale_1x128x128_256x16x64x256_16x16_16x16_1x1_16x16x1_16x16x1_1x16x1x16_4_1x1_intrawave_v1,123.52,359.33,0.0
gfx950,256,1072,256,2048,ck,8,2,8.8589,a8w8_blockscale_1x128x128_256x16x64x256_16x16_16x16_1x1_16x16x1_16x16x1_1x16x1x16_4_1x1_intrawave_v1,126.89,368.96,0.0
gfx950,256,1074,256,2048,ck,8,2,9.6548,a8w8_blockscale_1x128x128_256x16x64x256_16x16_16x16_1x1_16x16x1_16x16x1_1x16x1x16_4_1x1_intrawave_v1,116.64,339.08,0.0
gfx950,256,1091,256,2048,ck,13,0,9.7891,a8w8_blockscale_1x128x128_256x32x64x256_16x16_16x16_2x1_16x16x1_16x16x1_1x32x1x8_8_2x1_intrawave_v1,116.86,338.87,0.0
gfx950,256,1128,256,2048,ck,8,2,9.7553,a8w8_blockscale_1x128x128_256x16x64x256_16x16_16x16_1x1_16x16x1_16x16x1_1x16x1x16_4_1x1_intrawave_v1,121.25,349.76,0.0
gfx950,256,1136,256,2048,ck,8,2,9.9427,a8w8_blockscale_1x128x128_256x16x64x256_16x16_16x16_1x1_16x16x1_16x16x1_1x16x1x16_4_1x1_intrawave_v1,119.8,345.22,0.0
gfx950,256,1514,256,2048,ck,7,0,10.1961,a8w8_blockscale_1x128x128_256x16x128x256_16x16_16x16_1x2_16x16x1_16x16x1_1x16x1x16_8_1x2_intrawave_v1,155.7,431.55,0.0
gfx950,256,2017,256,2048,ck,7,0,9.9017,a8w8_blockscale_1x128x128_256x16x128x256_16x16_16x16_1x2_16x16x1_16x16x1_1x16x1x16_8_1x2_intrawave_v1,213.6,574.43,0.0
gfx950,256,2048,256,2048,ck,7,0,9.9236,a8w8_blockscale_1x128x128_256x16x128x256_16x16_16x16_1x2_16x16x1_16x16x1_1x16x1x16_8_1x2_intrawave_v1,216.4,581.16,0.0
gfx950,256,2151,256,2048,ck,18,0,11.5669,a8w8_blockscale_1x128x128_256x64x64x256_16x16_32x32_1x1_16x16x1_16x16x1_1x32x1x8_8_1x1_intrawave_v1,194.99,521.39,0.0
gfx950,256,2332,256,2048,ck,18,0,10.9901,a8w8_blockscale_1x128x128_256x64x64x256_16x16_32x32_1x1_16x16x1_16x16x1_1x32x1x8_8_1x1_intrawave_v1,222.5,590.91,0.0
gfx950,256,2341,256,2048,ck,18,0,11.7789,a8w8_blockscale_1x128x128_256x64x64x256_16x16_32x32_1x1_16x16x1_16x16x1_1x32x1x8_8_1x1_intrawave_v1,208.4,553.3,0.0
gfx950,256,3072,256,2048,ck,18,0,10.4911,a8w8_blockscale_1x128x128_256x64x64x256_16x16_32x32_1x1_16x16x1_16x16x1_1x32x1x8_8_1x1_intrawave_v1,307.04,799.59,0.0
gfx950,256,3073,256,2048,ck,18,0,12.5746,a8w8_blockscale_1x128x128_256x64x64x256_16x16_32x32_1x1_16x16x1_16x16x1_1x32x1x8_8_1x1_intrawave_v1,256.25,667.31,0.0
gfx950,256,3089,256,2048,ck,18,0,12.4563,a8w8_blockscale_1x128x128_256x64x64x256_16x16_32x32_1x1_16x16x1_16x16x1_1x32x1x8_8_1x1_intrawave_v1,260.03,676.94,0.0
gfx950,256,3110,256,2048,ck,18,0,12.4643,a8w8_blockscale_1x128x128_256x64x64x256_16x16_32x32_1x1_16x16x1_16x16x1_1x32x1x8_8_1x1_intrawave_v1,261.63,680.82,0.0
gfx950,256,3137,256,2048,ck,18,0,12.2899,a8w8_blockscale_1x128x128_256x64x64x256_16x16_32x32_1x1_16x16x1_16x16x1_1x32x1x8_8_1x1_intrawave_v1,267.65,696.1,0.0
gfx950,256,3613,256,2048,ck,18,0,12.4583,a8w8_blockscale_1x128x128_256x64x64x256_16x16_32x32_1x1_16x16x1_16x16x1_1x32x1x8_8_1x1_intrawave_v1,304.09,784.5,0.0
gfx950,256,4096,256,2048,ck,18,0,10.7697,a8w8_blockscale_1x128x128_256x64x64x256_16x16_32x32_1x1_16x16x1_16x16x1_1x32x1x8_8_1x1_intrawave_v1,398.8,1022.32,0.0
gfx950,256,4097,256,2048,ck,2,0,15.3295,a8w8_blockscale_1x128x128_256x64x128x128_16x16_32x32_1x2_8x32x1_8x32x1_1x32x1x8_8_1x1_intrawave_v3,280.25,718.39,0.0
gfx950,256,4109,256,2048,ck,2,0,15.4991,a8w8_blockscale_1x128x128_256x64x128x128_16x16_32x32_1x2_8x32x1_8x32x1_1x32x1x8_8_1x1_intrawave_v3,277.99,712.51,0.0
gfx950,256,4143,256,2048,ck,2,0,15.4969,a8w8_blockscale_1x128x128_256x64x128x128_16x16_32x32_1x2_8x32x1_8x32x1_1x32x1x8_8_1x1_intrawave_v3,280.33,718.23,0.0
gfx950,256,4345,256,2048,ck,3,0,15.3931,a8w8_blockscale_1x128x128_256x64x64x128_16x16_32x32_1x1_8x32x1_8x32x1_1x32x1x8_8_1x1_intrawave_v3,295.98,756.67,0.0
gfx950,256,4413,256,2048,ck,2,0,15.2946,a8w8_blockscale_1x128x128_256x64x128x128_16x16_32x32_1x2_8x32x1_8x32x1_1x32x1x8_8_1x1_intrawave_v3,302.55,772.92,0.0
gfx950,256,5121,256,2048,ck,2,0,15.4833,a8w8_blockscale_1x128x128_256x64x128x128_16x16_32x32_1x2_8x32x1_8x32x1_1x32x1x8_8_1x1_intrawave_v3,346.81,880.56,0.0
gfx950,256,5123,256,2048,ck,2,0,15.9826,a8w8_blockscale_1x128x128_256x64x128x128_16x16_32x32_1x2_8x32x1_8x32x1_1x32x1x8_8_1x1_intrawave_v3,336.11,853.38,0.0
gfx950,256,5133,256,2048,ck,2,0,15.5043,a8w8_blockscale_1x128x128_256x64x128x128_16x16_32x32_1x2_8x32x1_8x32x1_1x32x1x8_8_1x1_intrawave_v3,347.15,881.35,0.0
gfx950,256,5185,256,2048,ck,2,0,15.4368,a8w8_blockscale_1x128x128_256x64x128x128_16x16_32x32_1x2_8x32x1_8x32x1_1x32x1x8_8_1x1_intrawave_v3,352.2,893.83,0.0
gfx950,256,5191,256,2048,ck,2,0,15.4253,a8w8_blockscale_1x128x128_256x64x128x128_16x16_32x32_1x2_8x32x1_8x32x1_1x32x1x8_8_1x1_intrawave_v3,352.87,895.49,0.0
gfx950,256,6146,256,2048,ck,2,0,16.0915,a8w8_blockscale_1x128x128_256x64x128x128_16x16_32x32_1x2_8x32x1_8x32x1_1x32x1x8_8_1x1_intrawave_v3,400.49,1010.35,0.0
gfx950,256,6147,256,2048,ck,2,0,15.9455,a8w8_blockscale_1x128x128_256x64x128x128_16x16_32x32_1x2_8x32x1_8x32x1_1x32x1x8_8_1x1_intrawave_v3,404.23,1019.76,0.0
gfx950,256,6155,256,2048,ck,2,0,16.1409,a8w8_blockscale_1x128x128_256x64x128x128_16x16_32x32_1x2_8x32x1_8x32x1_1x32x1x8_8_1x1_intrawave_v3,399.85,1008.69,0.0
gfx950,256,6377,256,2048,ck,2,0,16.0291,a8w8_blockscale_1x128x128_256x64x128x128_16x16_32x32_1x2_8x32x1_8x32x1_1x32x1x8_8_1x1_intrawave_v3,417.16,1051.18,0.0
gfx950,256,6401,256,2048,ck,2,0,16.1527,a8w8_blockscale_1x128x128_256x64x128x128_16x16_32x32_1x2_8x32x1_8x32x1_1x32x1x8_8_1x1_intrawave_v3,415.53,1046.94,0.0
gfx950,256,7121,256,2048,ck,2,0,16.0775,a8w8_blockscale_1x128x128_256x64x128x128_16x16_32x32_1x2_8x32x1_8x32x1_1x32x1x8_8_1x1_intrawave_v3,464.43,1166.48,0.0
gfx950,256,7169,256,2048,ck,2,0,16.3494,a8w8_blockscale_1x128x128_256x64x128x128_16x16_32x32_1x2_8x32x1_8x32x1_1x32x1x8_8_1x1_intrawave_v3,459.79,1154.59,0.0
gfx950,256,7170,256,2048,ck,2,0,15.6111,a8w8_blockscale_1x128x128_256x64x128x128_16x16_32x32_1x2_8x32x1_8x32x1_1x32x1x8_8_1x1_intrawave_v3,481.6,1209.36,0.0
gfx950,256,7176,256,2048,ck,2,0,15.7281,a8w8_blockscale_1x128x128_256x64x128x128_16x16_32x32_1x2_8x32x1_8x32x1_1x32x1x8_8_1x1_intrawave_v3,478.42,1201.34,0.0
gfx950,256,7177,256,2048,ck,2,0,15.7152,a8w8_blockscale_1x128x128_256x64x128x128_16x16_32x32_1x2_8x32x1_8x32x1_1x32x1x8_8_1x1_intrawave_v3,478.88,1202.49,0.0
gfx950,256,7185,256,2048,ck,2,0,15.608,a8w8_blockscale_1x128x128_256x64x128x128_16x16_32x32_1x2_8x32x1_8x32x1_1x32x1x8_8_1x1_intrawave_v3,482.7,1212.06,0.0
gfx950,256,7206,256,2048,ck,2,0,15.7361,a8w8_blockscale_1x128x128_256x64x128x128_16x16_32x32_1x2_8x32x1_8x32x1_1x32x1x8_8_1x1_intrawave_v3,480.17,1205.61,0.0
gfx950,256,7217,256,2048,ck,2,0,15.7324,a8w8_blockscale_1x128x128_256x64x128x128_16x16_32x32_1x2_8x32x1_8x32x1_1x32x1x8_8_1x1_intrawave_v3,481.02,1207.69,0.0
gfx950,256,7257,256,2048,ck,2,0,15.6396,a8w8_blockscale_1x128x128_256x64x128x128_16x16_32x32_1x2_8x32x1_8x32x1_1x32x1x8_8_1x1_intrawave_v3,486.55,1221.4,0.0
gfx950,256,7265,256,2048,ck,2,0,15.7144,a8w8_blockscale_1x128x128_256x64x128x128_16x16_32x32_1x2_8x32x1_8x32x1_1x32x1x8_8_1x1_intrawave_v3,484.77,1216.89,0.0
gfx950,256,7393,256,2048,ck,2,0,15.7346,a8w8_blockscale_1x128x128_256x64x128x128_16x16_32x32_1x2_8x32x1_8x32x1_1x32x1x8_8_1x1_intrawave_v3,492.68,1236.15,0.0
gfx950,256,7461,256,2048,ck,2,0,16.3523,a8w8_blockscale_1x128x128_256x64x128x128_16x16_32x32_1x2_8x32x1_8x32x1_1x32x1x8_8_1x1_intrawave_v3,478.43,1200.1,0.0
gfx950,256,7634,256,2048,ck,2,0,15.8494,a8w8_blockscale_1x128x128_256x64x128x128_16x16_32x32_1x2_8x32x1_8x32x1_1x32x1x8_8_1x1_intrawave_v3,505.06,1266.13,0.0
gfx950,256,8129,256,2048,ck,2,0,15.8496,a8w8_blockscale_1x128x128_256x64x128x128_16x16_32x32_1x2_8x32x1_8x32x1_1x32x1x8_8_1x1_intrawave_v3,537.8,1346.06,0.0
gfx950,256,8192,256,2048,ck,2,0,15.4491,a8w8_blockscale_1x128x128_256x64x128x128_16x16_32x32_1x2_8x32x1_8x32x1_1x32x1x8_8_1x1_intrawave_v3,556.02,1391.4,0.0
gfx950,256,1,1024,2048,ck,8,3,5.5699,a8w8_blockscale_1x128x128_256x16x64x256_16x16_16x16_1x1_16x16x1_16x16x1_1x16x1x16_4_1x1_intrawave_v1,0.75,377.25,0.0
gfx950,256,2,1024,2048,ck,8,3,5.5539,a8w8_blockscale_1x128x128_256x16x64x256_16x16_16x16_1x1_16x16x1_16x16x1_1x16x1x16_4_1x1_intrawave_v1,1.51,379.07,0.0
gfx950,256,4,1024,2048,ck,8,3,5.5885,a8w8_blockscale_1x128x128_256x16x64x256_16x16_16x16_1x1_16x16x1_16x16x1_1x16x1x16_4_1x1_intrawave_v1,3.0,378.19,0.0
gfx950,256,8,1024,2048,ck,8,3,5.6826,a8w8_blockscale_1x128x128_256x16x64x256_16x16_16x16_1x1_16x16x1_16x16x1_1x16x1x16_4_1x1_intrawave_v1,5.9,374.81,0.0
gfx950,256,16,1024,2048,ck,8,3,6.0772,a8w8_blockscale_1x128x128_256x16x64x256_16x16_16x16_1x1_16x16x1_16x16x1_1x16x1x16_4_1x1_intrawave_v1,11.04,355.87,0.0
gfx950,256,32,1024,2048,ck,8,2,6.8076,a8w8_blockscale_1x128x128_256x16x64x256_16x16_16x16_1x1_16x16x1_16x16x1_1x16x1x16_4_1x1_intrawave_v1,19.72,327.31,0.0
gfx950,256,48,1024,2048,ck,8,2,6.7293,a8w8_blockscale_1x128x128_256x16x64x256_16x16_16x16_1x1_16x16x1_16x16x1_1x16x1x16_4_1x1_intrawave_v1,29.92,340.86,0.0
gfx950,256,64,1024,2048,ck,8,2,6.535,a8w8_blockscale_1x128x128_256x16x64x256_16x16_16x16_1x1_16x16x1_16x16x1_1x16x1x16_4_1x1_intrawave_v1,41.08,361.02,0.0
gfx950,256,80,1024,2048,ck,8,2,7.2538,a8w8_blockscale_1x128x128_256x16x64x256_16x16_16x16_1x1_16x16x1_16x16x1_1x16x1x16_4_1x1_intrawave_v1,46.26,334.28,0.0
gfx950,256,96,1024,2048,ck,8,2,7.0457,a8w8_blockscale_1x128x128_256x16x64x256_16x16_16x16_1x1_16x16x1_16x16x1_1x16x1x16_4_1x1_intrawave_v1,57.15,353.46,0.0
gfx950,256,112,1024,2048,ck,8,2,7.4564,a8w8_blockscale_1x128x128_256x16x64x256_16x16_16x16_1x1_16x16x1_16x16x1_1x16x1x16_4_1x1_intrawave_v1,63.0,342.78,0.0
gfx950,256,128,1024,2048,ck,8,2,7.5121,a8w8_blockscale_1x128x128_256x16x64x256_16x16_16x16_1x1_16x16x1_16x16x1_1x16x1x16_4_1x1_intrawave_v1,71.47,348.96,0.0
gfx950,256,256,1024,2048,ck,8,0,8.1467,a8w8_blockscale_1x128x128_256x16x64x256_16x16_16x16_1x1_16x16x1_16x16x1_1x16x1x16_4_1x1_intrawave_v1,131.8,386.14,0.0
gfx950,256,512,1024,2048,ck,18,0,9.6948,a8w8_blockscale_1x128x128_256x64x64x256_16x16_32x32_1x1_16x16x1_16x16x1_1x32x1x8_8_1x1_intrawave_v1,221.51,432.63,0.0
gfx950,256,667,1024,2048,ck,18,0,11.3223,a8w8_blockscale_1x128x128_256x64x64x256_16x16_32x32_1x1_16x16x1_16x16x1_1x32x1x8_8_1x1_intrawave_v1,247.09,426.52,0.0
gfx950,256,671,1024,2048,ck,18,0,11.1567,a8w8_blockscale_1x128x128_256x64x64x256_16x16_32x32_1x1_16x16x1_16x16x1_1x32x1x8_8_1x1_intrawave_v1,252.26,434.32,0.0
gfx950,256,931,1024,2048,ck,18,0,11.4872,a8w8_blockscale_1x128x128_256x64x64x256_16x16_32x32_1x1_16x16x1_16x16x1_1x32x1x8_8_1x1_intrawave_v1,339.93,514.53,0.0
gfx950,256,1024,1024,2048,ck,18,0,10.5216,a8w8_blockscale_1x128x128_256x64x64x256_16x16_32x32_1x1_16x16x1_16x16x1_1x32x1x8_8_1x1_intrawave_v1,408.2,597.96,0.0
gfx950,256,1025,1024,2048,ck,2,0,14.903,a8w8_blockscale_1x128x128_256x64x128x128_16x16_32x32_1x2_8x32x1_8x32x1_1x32x1x8_8_1x1_intrawave_v3,288.48,422.44,0.0
gfx950,256,1027,1024,2048,ck,2,0,14.9158,a8w8_blockscale_1x128x128_256x64x128x128_16x16_32x32_1x2_8x32x1_8x32x1_1x32x1x8_8_1x1_intrawave_v3,288.79,422.62,0.0
gfx950,256,1031,1024,2048,ck,2,0,15.0035,a8w8_blockscale_1x128x128_256x64x128x128_16x16_32x32_1x2_8x32x1_8x32x1_1x32x1x8_8_1x1_intrawave_v3,288.22,421.24,0.0
gfx950,256,1039,1024,2048,ck,3,0,15.2155,a8w8_blockscale_1x128x128_256x64x64x128_16x16_32x32_1x1_8x32x1_8x32x1_1x32x1x8_8_1x1_intrawave_v3,286.41,417.53,0.0
gfx950,256,1040,1024,2048,ck,2,0,15.0975,a8w8_blockscale_1x128x128_256x64x128x128_16x16_32x32_1x2_8x32x1_8x32x1_1x32x1x8_8_1x1_intrawave_v3,288.93,421.06,0.0
gfx950,256,1041,1024,2048,ck,2,0,14.9686,a8w8_blockscale_1x128x128_256x64x128x128_16x16_32x32_1x2_8x32x1_8x32x1_1x32x1x8_8_1x1_intrawave_v3,291.7,424.96,0.0
gfx950,256,1072,1024,2048,ck,2,0,15.4859,a8w8_blockscale_1x128x128_256x64x128x128_16x16_32x32_1x2_8x32x1_8x32x1_1x32x1x8_8_1x1_intrawave_v3,290.35,418.97,0.0
gfx950,256,1073,1024,2048,ck,2,0,15.5038,a8w8_blockscale_1x128x128_256x64x128x128_16x16_32x32_1x2_8x32x1_8x32x1_1x32x1x8_8_1x1_intrawave_v3,290.28,418.75,0.0
gfx950,256,1077,1024,2048,ck,2,0,15.0568,a8w8_blockscale_1x128x128_256x64x128x128_16x16_32x32_1x2_8x32x1_8x32x1_1x32x1x8_8_1x1_intrawave_v3,300.01,432.27,0.0
gfx950,256,1091,1024,2048,ck,2,0,14.9712,a8w8_blockscale_1x128x128_256x64x128x128_16x16_32x32_1x2_8x32x1_8x32x1_1x32x1x8_8_1x1_intrawave_v3,305.65,438.57,0.0
gfx950,256,1343,1024,2048,ck,2,0,15.2254,a8w8_blockscale_1x128x128_256x64x128x128_16x16_32x32_1x2_8x32x1_8x32x1_1x32x1x8_8_1x1_intrawave_v3,369.97,499.04,0.0
gfx950,256,1688,1024,2048,ck,2,0,15.5828,a8w8_blockscale_1x128x128_256x64x128x128_16x16_32x32_1x2_8x32x1_8x32x1_1x32x1x8_8_1x1_intrawave_v3,454.35,578.28,0.0
gfx950,256,2017,1024,2048,ck,2,0,15.7146,a8w8_blockscale_1x128x128_256x64x128x128_16x16_32x32_1x2_8x32x1_8x32x1_1x32x1x8_8_1x1_intrawave_v3,538.35,659.18,0.0
gfx950,256,2048,1024,2048,ck,2,0,15.6905,a8w8_blockscale_1x128x128_256x64x128x128_16x16_32x32_1x2_8x32x1_8x32x1_1x32x1x8_8_1x1_intrawave_v3,547.46,668.29,0.0
gfx950,256,2050,1024,2048,ck,3,0,18.9571,a8w8_blockscale_1x128x128_256x64x64x128_16x16_32x32_1x1_8x32x1_8x32x1_1x32x1x8_8_1x1_intrawave_v3,453.57,553.56,0.0
gfx950,256,2063,1024,2048,ck,3,0,19.0224,a8w8_blockscale_1x128x128_256x64x64x128_16x16_32x32_1x1_8x32x1_8x32x1_1x32x1x8_8_1x1_intrawave_v3,454.88,554.46,0.0
gfx950,256,2064,1024,2048,ck,3,0,19.048,a8w8_blockscale_1x128x128_256x64x64x128_16x16_32x32_1x1_8x32x1_8x32x1_1x32x1x8_8_1x1_intrawave_v3,454.49,553.93,0.0
gfx950,256,2099,1024,2048,ck,3,0,19.0723,a8w8_blockscale_1x128x128_256x64x64x128_16x16_32x32_1x1_8x32x1_8x32x1_1x32x1x8_8_1x1_intrawave_v3,461.6,560.74,0.0
gfx950,256,2159,1024,2048,ck,3,0,19.2061,a8w8_blockscale_1x128x128_256x64x64x128_16x16_32x32_1x1_8x32x1_8x32x1_1x32x1x8_8_1x1_intrawave_v3,471.49,569.63,0.0
gfx950,256,2160,1024,2048,ck,3,0,19.248,a8w8_blockscale_1x128x128_256x64x64x128_16x16_32x32_1x1_8x32x1_8x32x1_1x32x1x8_8_1x1_intrawave_v3,470.68,568.61,0.0
gfx950,256,2313,1024,2048,ck,3,0,19.3877,a8w8_blockscale_1x128x128_256x64x64x128_16x16_32x32_1x1_8x32x1_8x32x1_1x32x1x8_8_1x1_intrawave_v3,500.39,596.83,0.0
gfx950,256,2325,1024,2048,ck,3,0,19.2542,a8w8_blockscale_1x128x128_256x64x64x128_16x16_32x32_1x1_8x32x1_8x32x1_1x32x1x8_8_1x1_intrawave_v3,506.47,603.52,0.0
gfx950,256,3072,1024,2048,ck,0,0,19.6534,a8w8_blockscale_1x128x128_256x128x128x128_16x16_32x32_2x2_8x32x1_8x32x1_1x32x1x8_8_1x1_intrawave_v3,655.61,746.95,0.0
gfx950,256,3073,1024,2048,ck,0,0,20.4847,a8w8_blockscale_1x128x128_256x128x128x128_16x16_32x32_2x2_8x32x1_8x32x1_1x32x1x8_8_1x1_intrawave_v3,629.21,716.84,0.0
gfx950,256,3182,1024,2048,ck,0,0,20.6063,a8w8_blockscale_1x128x128_256x128x128x128_16x16_32x32_2x2_8x32x1_8x32x1_1x32x1x8_8_1x1_intrawave_v3,647.68,734.27,0.0
gfx950,256,3183,1024,2048,ck,0,0,20.7299,a8w8_blockscale_1x128x128_256x128x128x128_16x16_32x32_2x2_8x32x1_8x32x1_1x32x1x8_8_1x1_intrawave_v3,644.02,730.09,0.0
gfx950,256,3847,1024,2048,ck,0,0,21.2034,a8w8_blockscale_1x128x128_256x128x128x128_16x16_32x32_2x2_8x32x1_8x32x1_1x32x1x8_8_1x1_intrawave_v3,760.99,842.06,0.0
gfx950,256,4096,1024,2048,ck,0,0,20.451,a8w8_blockscale_1x128x128_256x128x128x128_16x16_32x32_2x2_8x32x1_8x32x1_1x32x1x8_8_1x1_intrawave_v3,840.05,922.91,0.0
gfx950,256,4111,1024,2048,ck,2,0,27.8924,a8w8_blockscale_1x128x128_256x64x128x128_16x16_32x32_1x2_8x32x1_8x32x1_1x32x1x8_8_1x1_intrawave_v3,618.19,678.89,0.0
gfx950,256,4141,1024,2048,ck,2,0,28.1871,a8w8_blockscale_1x128x128_256x64x128x128_16x16_32x32_1x2_8x32x1_8x32x1_1x32x1x8_8_1x1_intrawave_v3,616.19,676.15,0.0
gfx950,256,4142,1024,2048,ck,2,0,28.1318,a8w8_blockscale_1x128x128_256x64x128x128_16x16_32x32_1x2_8x32x1_8x32x1_1x32x1x8_8_1x1_intrawave_v3,617.55,677.62,0.0
gfx950,256,4345,1024,2048,ck,2,0,28.6182,a8w8_blockscale_1x128x128_256x64x128x128_16x16_32x32_1x2_8x32x1_8x32x1_1x32x1x8_8_1x1_intrawave_v3,636.81,695.16,0.0
gfx950,256,5105,1024,2048,ck,2,0,29.6312,a8w8_blockscale_1x128x128_256x64x128x128_16x16_32x32_1x2_8x32x1_8x32x1_1x32x1x8_8_1x1_intrawave_v3,722.61,776.45,0.0
gfx950,256,5121,1024,2048,ck,2,0,29.6364,a8w8_blockscale_1x128x128_256x64x128x128_16x16_32x32_1x2_8x32x1_8x32x1_1x32x1x8_8_1x1_intrawave_v3,724.75,778.53,0.0
gfx950,256,5123,1024,2048,ck,2,0,28.7739,a8w8_blockscale_1x128x128_256x64x128x128_16x16_32x32_1x2_8x32x1_8x32x1_1x32x1x8_8_1x1_intrawave_v3,746.77,802.15,0.0
gfx950,256,5131,1024,2048,ck,2,0,29.259,a8w8_blockscale_1x128x128_256x64x128x128_16x16_32x32_1x2_8x32x1_8x32x1_1x32x1x8_8_1x1_intrawave_v3,735.53,789.97,0.0
gfx950,256,5427,1024,2048,ck,2,0,29.7766,a8w8_blockscale_1x128x128_256x64x128x128_16x16_32x32_1x2_8x32x1_8x32x1_1x32x1x8_8_1x1_intrawave_v3,764.44,816.96,0.0
gfx950,256,6113,1024,2048,ck,2,0,31.1336,a8w8_blockscale_1x128x128_256x64x128x128_16x16_32x32_1x2_8x32x1_8x32x1_1x32x1x8_8_1x1_intrawave_v3,823.54,871.6,0.0
gfx950,256,6197,1024,2048,ck,0,0,32.0735,a8w8_blockscale_1x128x128_256x128x128x128_16x16_32x32_2x2_8x32x1_8x32x1_1x32x1x8_8_1x1_intrawave_v3,810.39,856.78,0.0
gfx950,256,6409,1024,2048,ck,0,0,31.7421,a8w8_blockscale_1x128x128_256x128x128x128_16x16_32x32_2x2_8x32x1_8x32x1_1x32x1x8_8_1x1_intrawave_v3,846.87,893.09,0.0
gfx950,256,7121,1024,2048,ck,0,0,33.4641,a8w8_blockscale_1x128x128_256x128x128x128_16x16_32x32_2x2_8x32x1_8x32x1_1x32x1x8_8_1x1_intrawave_v3,892.53,934.28,0.0
gfx950,256,7168,1024,2048,ck,0,0,32.2561,a8w8_blockscale_1x128x128_256x128x128x128_16x16_32x32_2x2_8x32x1_8x32x1_1x32x1x8_8_1x1_intrawave_v3,932.06,975.24,0.0
gfx950,256,7169,1024,2048,ck,0,0,33.1753,a8w8_blockscale_1x128x128_256x128x128x128_16x16_32x32_2x2_8x32x1_8x32x1_1x32x1x8_8_1x1_intrawave_v3,906.37,948.34,0.0
gfx950,256,7172,1024,2048,ck,0,0,33.5396,a8w8_blockscale_1x128x128_256x128x128x128_16x16_32x32_2x2_8x32x1_8x32x1_1x32x1x8_8_1x1_intrawave_v3,896.9,938.4,0.0
gfx950,256,7176,1024,2048,ck,0,0,33.4608,a8w8_blockscale_1x128x128_256x128x128x128_16x16_32x32_2x2_8x32x1_8x32x1_1x32x1x8_8_1x1_intrawave_v3,899.51,941.1,0.0
gfx950,256,7177,1024,2048,ck,0,0,33.5128,a8w8_blockscale_1x128x128_256x128x128x128_16x16_32x32_2x2_8x32x1_8x32x1_1x32x1x8_8_1x1_intrawave_v3,898.24,939.76,0.0
gfx950,256,7178,1024,2048,ck,0,0,33.6505,a8w8_blockscale_1x128x128_256x128x128x128_16x16_32x32_2x2_8x32x1_8x32x1_1x32x1x8_8_1x1_intrawave_v3,894.69,936.04,0.0
gfx950,256,7179,1024,2048,ck,0,0,33.8196,a8w8_blockscale_1x128x128_256x128x128x128_16x16_32x32_2x2_8x32x1_8x32x1_1x32x1x8_8_1x1_intrawave_v3,890.34,931.48,0.0
gfx950,256,7183,1024,2048,ck,0,0,33.1444,a8w8_blockscale_1x128x128_256x128x128x128_16x16_32x32_2x2_8x32x1_8x32x1_1x32x1x8_8_1x1_intrawave_v3,908.98,950.95,0.0
gfx950,256,7184,1024,2048,ck,0,0,32.9884,a8w8_blockscale_1x128x128_256x128x128x128_16x16_32x32_2x2_8x32x1_8x32x1_1x32x1x8_8_1x1_intrawave_v3,913.41,955.57,0.0
gfx950,256,7209,1024,2048,ck,0,0,33.3848,a8w8_blockscale_1x128x128_256x128x128x128_16x16_32x32_2x2_8x32x1_8x32x1_1x32x1x8_8_1x1_intrawave_v3,905.7,947.29,0.0
gfx950,256,7210,1024,2048,ck,0,0,32.9932,a8w8_blockscale_1x128x128_256x128x128x128_16x16_32x32_2x2_8x32x1_8x32x1_1x32x1x8_8_1x1_intrawave_v3,916.58,958.66,0.0
gfx950,256,7211,1024,2048,ck,0,0,32.9871,a8w8_blockscale_1x128x128_256x128x128x128_16x16_32x32_2x2_8x32x1_8x32x1_1x32x1x8_8_1x1_intrawave_v3,916.88,958.96,0.0
gfx950,256,7217,1024,2048,ck,0,0,33.4568,a8w8_blockscale_1x128x128_256x128x128x128_16x16_32x32_2x2_8x32x1_8x32x1_1x32x1x8_8_1x1_intrawave_v3,904.76,946.23,0.0
gfx950,256,7273,1024,2048,ck,0,0,33.0212,a8w8_blockscale_1x128x128_256x128x128x128_16x16_32x32_2x2_8x32x1_8x32x1_1x32x1x8_8_1x1_intrawave_v3,923.81,965.66,0.0
gfx950,256,7274,1024,2048,ck,0,0,33.3125,a8w8_blockscale_1x128x128_256x128x128x128_16x16_32x32_2x2_8x32x1_8x32x1_1x32x1x8_8_1x1_intrawave_v3,915.85,957.34,0.0
gfx950,256,7391,1024,2048,ck,0,0,34.0889,a8w8_blockscale_1x128x128_256x128x128x128_16x16_32x32_2x2_8x32x1_8x32x1_1x32x1x8_8_1x1_intrawave_v3,909.39,949.6,0.0
gfx950,256,7393,1024,2048,ck,0,0,33.6873,a8w8_blockscale_1x128x128_256x128x128x128_16x16_32x32_2x2_8x32x1_8x32x1_1x32x1x8_8_1x1_intrawave_v3,920.48,961.16,0.0
gfx950,256,7715,1024,2048,ck,0,0,34.5112,a8w8_blockscale_1x128x128_256x128x128x128_16x16_32x32_2x2_8x32x1_8x32x1_1x32x1x8_8_1x1_intrawave_v3,937.64,976.43,0.0
gfx950,256,7753,1024,2048,ck,0,0,34.0489,a8w8_blockscale_1x128x128_256x128x128x128_16x16_32x32_2x2_8x32x1_8x32x1_1x32x1x8_8_1x1_intrawave_v3,955.05,994.26,0.0
gfx950,256,7819,1024,2048,ck,0,0,34.428,a8w8_blockscale_1x128x128_256x128x128x128_16x16_32x32_2x2_8x32x1_8x32x1_1x32x1x8_8_1x1_intrawave_v3,952.58,991.16,0.0
gfx950,256,8099,1024,2048,ck,0,0,34.8149,a8w8_blockscale_1x128x128_256x128x128x128_16x16_32x32_2x2_8x32x1_8x32x1_1x32x1x8_8_1x1_intrawave_v3,975.72,1013.09,0.0
gfx950,256,8129,1024,2048,ck,0,0,34.7801,a8w8_blockscale_1x128x128_256x128x128x128_16x16_32x32_2x2_8x32x1_8x32x1_1x32x1x8_8_1x1_intrawave_v3,980.32,1017.64,0.0
gfx950,256,8188,1024,2048,ck,0,0,34.4069,a8w8_blockscale_1x128x128_256x128x128x128_16x16_32x32_2x2_8x32x1_8x32x1_1x32x1x8_8_1x1_intrawave_v3,998.14,1035.7,0.0
gfx950,256,8192,1024,2048,ck,0,0,34.2033,a8w8_blockscale_1x128x128_256x128x128x128_16x16_32x32_2x2_8x32x1_8x32x1_1x32x1x8_8_1x1_intrawave_v3,1004.57,1042.34,0.0
gfx950,256,1,2048,128,ck,6,0,3.4051,a8w8_blockscale_1x128x128_256x16x64x128_8x16_16x16_1x1_16x16x1_8x32x1_1x16x1x16_4_1x1_intrawave_v1,0.15,78.23,0.0
gfx950,256,1,2048,512,ck,8,0,4.0125,a8w8_blockscale_1x128x128_256x16x64x256_16x16_16x16_1x1_16x16x1_16x16x1_1x16x1x16_4_1x1_intrawave_v1,0.52,262.48,0.0
gfx950,256,1,2048,1024,ck,8,0,5.1914,a8w8_blockscale_1x128x128_256x16x64x256_16x16_16x16_1x1_16x16x1_16x16x1_1x16x1x16_4_1x1_intrawave_v1,0.81,404.95,0.0
gfx950,256,1,2048,2048,ck,8,3,5.988,a8w8_blockscale_1x128x128_256x16x64x256_16x16_16x16_1x1_16x16x1_16x16x1_1x16x1x16_4_1x1_intrawave_v1,1.4,701.48,0.0
gfx950,256,1,2048,4096,ck,8,3,6.7023,a8w8_blockscale_1x128x128_256x16x64x256_16x16_16x16_1x1_16x16x1_16x16x1_1x16x1x16_4_1x1_intrawave_v1,2.5,1252.82,0.0
gfx950,256,2,2048,128,ck,6,0,3.4162,a8w8_blockscale_1x128x128_256x16x64x128_8x16_16x16_1x1_16x16x1_8x32x1_1x16x1x16_4_1x1_intrawave_v1,0.31,79.21,0.0
gfx950,256,2,2048,512,ck,8,0,4.0472,a8w8_blockscale_1x128x128_256x16x64x256_16x16_16x16_1x1_16x16x1_16x16x1_1x16x1x16_4_1x1_intrawave_v1,1.04,261.36,0.0
gfx950,256,2,2048,1024,ck,8,0,5.2099,a8w8_blockscale_1x128x128_256x16x64x256_16x16_16x16_1x1_16x16x1_16x16x1_1x16x1x16_4_1x1_intrawave_v1,1.61,404.5,0.0
gfx950,256,2,2048,2048,ck,8,3,6.0141,a8w8_blockscale_1x128x128_256x16x64x256_16x16_16x16_1x1_16x16x1_16x16x1_1x16x1x16_4_1x1_intrawave_v1,2.79,699.45,0.0
gfx950,256,2,2048,4096,ck,8,3,6.731,a8w8_blockscale_1x128x128_256x16x64x256_16x16_16x16_1x1_16x16x1_16x16x1_1x16x1x16_4_1x1_intrawave_v1,4.99,1248.7,0.0
gfx950,256,4,2048,128,ck,6,0,3.4658,a8w8_blockscale_1x128x128_256x16x64x128_8x16_16x16_1x1_16x16x1_8x32x1_1x16x1x16_4_1x1_intrawave_v1,0.61,80.51,0.0
gfx950,256,4,2048,512,ck,8,0,4.0338,a8w8_blockscale_1x128x128_256x16x64x256_16x16_16x16_1x1_16x16x1_16x16x1_1x16x1x16_4_1x1_intrawave_v1,2.08,264.52,0.0
gfx950,256,4,2048,1024,ck,8,0,5.2488,a8w8_blockscale_1x128x128_256x16x64x256_16x16_16x16_1x1_16x16x1_16x16x1_1x16x1x16_4_1x1_intrawave_v1,3.2,403.45,0.0
gfx950,256,4,2048,2048,ck,8,3,6.0972,a8w8_blockscale_1x128x128_256x16x64x256_16x16_16x16_1x1_16x16x1_16x16x1_1x16x1x16_4_1x1_intrawave_v1,5.5,691.94,0.0
gfx950,256,4,2048,4096,ck,8,3,6.8665,a8w8_blockscale_1x128x128_256x16x64x256_16x16_16x16_1x1_16x16x1_16x16x1_1x16x1x16_4_1x1_intrawave_v1,9.77,1226.44,0.0
gfx950,256,8,2048,128,ck,6,0,3.4811,a8w8_blockscale_1x128x128_256x16x64x128_8x16_16x16_1x1_16x16x1_8x32x1_1x16x1x16_4_1x1_intrawave_v1,1.2,85.01,0.0
gfx950,256,8,2048,512,ck,8,0,4.0618,a8w8_blockscale_1x128x128_256x16x64x256_16x16_16x16_1x1_16x16x1_16x16x1_1x16x1x16_4_1x1_intrawave_v1,4.13,267.23,0.0
gfx950,256,8,2048,1024,ck,8,0,5.2043,a8w8_blockscale_1x128x128_256x16x64x256_16x16_16x16_1x1_16x16x1_16x16x1_1x16x1x16_4_1x1_intrawave_v1,6.45,410.84,0.0
gfx950,256,8,2048,2048,ck,8,3,6.5345,a8w8_blockscale_1x128x128_256x16x64x256_16x16_16x16_1x1_16x16x1_16x16x1_1x16x1x16_4_1x1_intrawave_v1,10.27,649.39,0.0
gfx950,256,8,2048,4096,ck,8,3,7.2892,a8w8_blockscale_1x128x128_256x16x64x256_16x16_16x16_1x1_16x16x1_16x16x1_1x16x1x16_4_1x1_intrawave_v1,18.41,1159.82,0.0
gfx950,256,16,2048,128,ck,6,0,3.477,a8w8_blockscale_1x128x128_256x16x64x128_8x16_16x16_1x1_16x16x1_8x32x1_1x16x1x16_4_1x1_intrawave_v1,2.41,94.83,0.0
gfx950,256,16,2048,512,ck,8,0,4.0034,a8w8_blockscale_1x128x128_256x16x64x256_16x16_16x16_1x1_16x16x1_16x16x1_1x16x1x16_4_1x1_intrawave_v1,8.38,280.34,0.0
gfx950,256,16,2048,1024,ck,8,0,5.1105,a8w8_blockscale_1x128x128_256x16x64x256_16x16_16x16_1x1_16x16x1_16x16x1_1x16x1x16_4_1x1_intrawave_v1,13.13,426.39,0.0
gfx950,256,16,2048,2048,ck,8,3,6.7454,a8w8_blockscale_1x128x128_256x16x64x256_16x16_16x16_1x1_16x16x1_16x16x1_1x16x1x16_4_1x1_intrawave_v1,19.9,636.38,0.0
gfx950,256,16,2048,4096,ck,8,3,7.5896,a8w8_blockscale_1x128x128_256x16x64x256_16x16_16x16_1x1_16x16x1_16x16x1_1x16x1x16_4_1x1_intrawave_v1,35.37,1122.55,0.0
gfx950,256,24,2048,2048,ck,8,2,7.1413,a8w8_blockscale_1x128x128_256x16x64x256_16x16_16x16_1x1_16x16x1_16x16x1_1x16x1x16_4_1x1_intrawave_v1,28.19,607.98,0.0
gfx950,256,32,2048,128,ck,11,0,3.6966,a8w8_blockscale_1x128x128_256x32x64x128_16x16_16x16_2x1_8x32x1_8x32x1_1x32x1x8_8_2x1_intrawave_v1,4.54,107.48,0.0
gfx950,256,32,2048,512,ck,8,0,4.2461,a8w8_blockscale_1x128x128_256x16x64x256_16x16_16x16_1x1_16x16x1_16x16x1_1x16x1x16_4_1x1_intrawave_v1,15.8,281.68,0.0
gfx950,256,32,2048,1024,ck,8,0,5.3628,a8w8_blockscale_1x128x128_256x16x64x256_16x16_16x16_1x1_16x16x1_16x16x1_1x16x1x16_4_1x1_intrawave_v1,25.03,421.61,0.0
gfx950,256,32,2048,2048,ck,8,2,7.3617,a8w8_blockscale_1x128x128_256x16x64x256_16x16_16x16_1x1_16x16x1_16x16x1_1x16x1x16_4_1x1_intrawave_v1,36.46,596.45,0.0
gfx950,256,32,2048,4096,ck,8,3,8.4293,a8w8_blockscale_1x128x128_256x16x64x256_16x16_16x16_1x1_16x16x1_16x16x1_1x16x1x16_4_1x1_intrawave_v1,63.69,1026.27,0.0
gfx950,256,40,2048,2048,ck,8,2,7.8372,a8w8_blockscale_1x128x128_256x16x64x256_16x16_16x16_1x1_16x16x1_16x16x1_1x16x1x16_4_1x1_intrawave_v1,42.81,566.54,0.0
gfx950,256,48,2048,128,ck,6,0,3.7178,a8w8_blockscale_1x128x128_256x16x64x128_8x16_16x16_1x1_16x16x1_8x32x1_1x16x1x16_4_1x1_intrawave_v1,6.77,125.05,0.0
gfx950,256,48,2048,512,ck,8,0,4.2755,a8w8_blockscale_1x128x128_256x16x64x256_16x16_16x16_1x1_16x16x1_16x16x1_1x16x1x16_4_1x1_intrawave_v1,23.54,296.99,0.0
gfx950,256,48,2048,1024,ck,8,0,5.4089,a8w8_blockscale_1x128x128_256x16x64x256_16x16_16x16_1x1_16x16x1_16x16x1_1x16x1x16_4_1x1_intrawave_v1,37.22,433.16,0.0
gfx950,256,48,2048,2048,ck,8,2,7.8546,a8w8_blockscale_1x128x128_256x16x64x256_16x16_16x16_1x1_16x16x1_16x16x1_1x16x1x16_4_1x1_intrawave_v1,51.26,571.54,0.0
gfx950,256,48,2048,4096,ck,8,3,9.1141,a8w8_blockscale_1x128x128_256x16x64x256_16x16_16x16_1x1_16x16x1_16x16x1_1x16x1x16_4_1x1_intrawave_v1,88.36,963.54,0.0
gfx950,256,56,2048,2048,ck,8,2,7.9912,a8w8_blockscale_1x128x128_256x16x64x256_16x16_16x16_1x1_16x16x1_16x16x1_1x16x1x16_4_1x1_intrawave_v1,58.78,567.92,0.0
gfx950,256,64,2048,128,ck,6,0,3.601,a8w8_blockscale_1x128x128_256x16x64x128_8x16_16x16_1x1_16x16x1_8x32x1_1x16x1x16_4_1x1_intrawave_v1,9.32,147.87,0.0
gfx950,256,64,2048,512,ck,8,0,4.1633,a8w8_blockscale_1x128x128_256x16x64x256_16x16_16x16_1x1_16x16x1_16x16x1_1x16x1x16_4_1x1_intrawave_v1,32.24,322.7,0.0
gfx950,256,64,2048,1024,ck,8,0,5.3642,a8w8_blockscale_1x128x128_256x16x64x256_16x16_16x16_1x1_16x16x1_16x16x1_1x16x1x16_4_1x1_intrawave_v1,50.04,452.04,0.0
gfx950,256,64,2048,2048,ck,8,2,7.5921,a8w8_blockscale_1x128x128_256x16x64x256_16x16_16x16_1x1_16x16x1_16x16x1_1x16x1x16_4_1x1_intrawave_v1,70.71,604.25,0.0
gfx950,256,64,2048,4096,ck,8,3,10.0486,a8w8_blockscale_1x128x128_256x16x64x256_16x16_16x16_1x1_16x16x1_16x16x1_1x16x1x16_4_1x1_intrawave_v1,106.85,886.98,0.0
gfx950,256,72,2048,2048,ck,8,2,8.356,a8w8_blockscale_1x128x128_256x16x64x256_16x16_16x16_1x1_16x16x1_16x16x1_1x16x1x16_4_1x1_intrawave_v1,72.28,554.89,0.0
gfx950,256,80,2048,128,ck,6,0,3.6346,a8w8_blockscale_1x128x128_256x16x64x128_8x16_16x16_1x1_16x16x1_8x32x1_1x16x1x16_4_1x1_intrawave_v1,11.54,165.1,0.0
gfx950,256,80,2048,512,ck,8,0,4.2018,a8w8_blockscale_1x128x128_256x16x64x256_16x16_16x16_1x1_16x16x1_16x16x1_1x16x1x16_4_1x1_intrawave_v1,39.93,337.29,0.0
gfx950,256,80,2048,1024,ck,8,0,5.417,a8w8_blockscale_1x128x128_256x16x64x256_16x16_16x16_1x1_16x16x1_16x16x1_1x16x1x16_4_1x1_intrawave_v1,61.94,462.76,0.0
gfx950,256,80,2048,2048,ck,8,0,8.1754,a8w8_blockscale_1x128x128_256x16x64x256_16x16_16x16_1x1_16x16x1_16x16x1_1x16x1x16_4_1x1_intrawave_v1,82.09,573.16,0.0
gfx950,256,80,2048,4096,ck,8,3,10.8228,a8w8_blockscale_1x128x128_256x16x64x256_16x16_16x16_1x1_16x16x1_16x16x1_1x16x1x16_4_1x1_intrawave_v1,124.01,835.64,0.0
gfx950,256,88,2048,2048,ck,8,2,8.0804,a8w8_blockscale_1x128x128_256x16x64x256_16x16_16x16_1x1_16x16x1_16x16x1_1x16x1x16_4_1x1_intrawave_v1,91.36,585.98,0.0
gfx950,256,96,2048,128,ck,6,0,3.6695,a8w8_blockscale_1x128x128_256x16x64x128_8x16_16x16_1x1_16x16x1_8x32x1_1x16x1x16_4_1x1_intrawave_v1,13.72,181.95,0.0
gfx950,256,96,2048,512,ck,8,0,4.2287,a8w8_blockscale_1x128x128_256x16x64x256_16x16_16x16_1x1_16x16x1_16x16x1_1x16x1x16_4_1x1_intrawave_v1,47.61,352.58,0.0
gfx950,256,96,2048,1024,ck,8,0,5.4506,a8w8_blockscale_1x128x128_256x16x64x256_16x16_16x16_1x1_16x16x1_16x16x1_1x16x1x16_4_1x1_intrawave_v1,73.87,474.93,0.0
gfx950,256,96,2048,2048,ck,8,0,8.1093,a8w8_blockscale_1x128x128_256x16x64x256_16x16_16x16_1x1_16x16x1_16x16x1_1x16x1x16_4_1x1_intrawave_v1,99.31,589.96,0.0
gfx950,256,96,2048,4096,ck,8,3,11.2319,a8w8_blockscale_1x128x128_256x16x64x256_16x16_16x16_1x1_16x16x1_16x16x1_1x16x1x16_4_1x1_intrawave_v1,143.4,816.87,0.0
gfx950,256,104,2048,2048,ck,8,0,8.4246,a8w8_blockscale_1x128x128_256x16x64x256_16x16_16x16_1x1_16x16x1_16x16x1_1x16x1x16_4_1x1_intrawave_v1,103.56,573.71,0.0
gfx950,256,112,2048,128,ck,6,0,3.8023,a8w8_blockscale_1x128x128_256x16x64x128_8x16_16x16_1x1_16x16x1_8x32x1_1x16x1x16_4_1x1_intrawave_v1,15.44,193.37,0.0
gfx950,256,112,2048,512,ck,8,0,4.427,a8w8_blockscale_1x128x128_256x16x64x256_16x16_16x16_1x1_16x16x1_16x16x1_1x16x1x16_4_1x1_intrawave_v1,53.06,353.44,0.0
gfx950,256,112,2048,1024,ck,8,0,5.5917,a8w8_blockscale_1x128x128_256x16x64x256_16x16_16x16_1x1_16x16x1_16x16x1_1x16x1x16_4_1x1_intrawave_v1,84.01,477.6,0.0
gfx950,256,112,2048,2048,ck,8,0,8.175,a8w8_blockscale_1x128x128_256x16x64x256_16x16_16x16_1x1_16x16x1_16x16x1_1x16x1x16_4_1x1_intrawave_v1,114.93,597.24,0.0
gfx950,256,112,2048,4096,ck,8,3,12.371,a8w8_blockscale_1x128x128_256x16x64x256_16x16_16x16_1x1_16x16x1_16x16x1_1x16x1x16_4_1x1_intrawave_v1,151.89,752.25,0.0
gfx950,256,120,2048,2048,ck,8,0,8.4214,a8w8_blockscale_1x128x128_256x16x64x256_16x16_16x16_1x1_16x16x1_16x16x1_1x16x1x16_4_1x1_intrawave_v1,119.53,585.6,0.0
gfx950,256,128,2048,128,ck,6,0,3.8449,a8w8_blockscale_1x128x128_256x16x64x128_8x16_16x16_1x1_16x16x1_8x32x1_1x16x1x16_4_1x1_intrawave_v1,17.45,208.8,0.0
gfx950,256,128,2048,512,ck,8,0,4.4313,a8w8_blockscale_1x128x128_256x16x64x256_16x16_16x16_1x1_16x16x1_16x16x1_1x16x1x16_4_1x1_intrawave_v1,60.58,369.73,0.0
gfx950,256,128,2048,1024,ck,8,0,5.6674,a8w8_blockscale_1x128x128_256x16x64x256_16x16_16x16_1x1_16x16x1_16x16x1_1x16x1x16_4_1x1_intrawave_v1,94.73,485.67,0.0
gfx950,256,128,2048,2048,ck,8,0,8.2927,a8w8_blockscale_1x128x128_256x16x64x256_16x16_16x16_1x1_16x16x1_16x16x1_1x16x1x16_4_1x1_intrawave_v1,129.48,600.62,0.0
gfx950,256,128,2048,4096,ck,8,3,13.1897,a8w8_blockscale_1x128x128_256x16x64x256_16x16_16x16_1x1_16x16x1_16x16x1_1x16x1x16_4_1x1_intrawave_v1,162.82,715.5,0.0
gfx950,256,136,2048,2048,ck,7,0,9.9875,a8w8_blockscale_1x128x128_256x16x128x256_16x16_16x16_1x2_16x16x1_16x16x1_1x16x1x16_8_1x2_intrawave_v1,114.23,503.62,0.0
gfx950,256,144,2048,2048,ck,7,0,9.9009,a8w8_blockscale_1x128x128_256x16x128x256_16x16_16x16_1x2_16x16x1_16x16x1_1x16x1x16_8_1x2_intrawave_v1,122.01,512.99,0.0
gfx950,256,152,2048,2048,ck,7,0,10.0404,a8w8_blockscale_1x128x128_256x16x128x256_16x16_16x16_1x2_16x16x1_16x16x1_1x16x1x16_8_1x2_intrawave_v1,126.99,510.76,0.0
gfx950,256,160,2048,2048,ck,7,0,9.9491,a8w8_blockscale_1x128x128_256x16x128x256_16x16_16x16_1x2_16x16x1_16x16x1_1x16x1x16_8_1x2_intrawave_v1,134.9,520.38,0.0
gfx950,256,168,2048,2048,ck,7,0,10.0554,a8w8_blockscale_1x128x128_256x16x128x256_16x16_16x16_1x2_16x16x1_16x16x1_1x16x1x16_8_1x2_intrawave_v1,140.15,519.77,0.0
gfx950,256,176,2048,2048,ck,7,0,9.9808,a8w8_blockscale_1x128x128_256x16x128x256_16x16_16x16_1x2_16x16x1_16x16x1_1x16x1x16_8_1x2_intrawave_v1,147.92,528.58,0.0
gfx950,256,184,2048,2048,ck,7,0,10.1608,a8w8_blockscale_1x128x128_256x16x128x256_16x16_16x16_1x2_16x16x1_16x16x1_1x16x1x16_8_1x2_intrawave_v1,151.91,524.05,0.0
gfx950,256,192,2048,2048,ck,7,0,10.0305,a8w8_blockscale_1x128x128_256x16x128x256_16x16_16x16_1x2_16x16x1_16x16x1_1x16x1x16_8_1x2_intrawave_v1,160.57,535.76,0.0
gfx950,256,200,2048,2048,ck,7,0,9.8391,a8w8_blockscale_1x128x128_256x16x128x256_16x16_16x16_1x2_16x16x1_16x16x1_1x16x1x16_8_1x2_intrawave_v1,170.52,551.18,0.0
gfx950,256,208,2048,2048,ck,7,0,9.7873,a8w8_blockscale_1x128x128_256x16x128x256_16x16_16x16_1x2_16x16x1_16x16x1_1x16x1x16_8_1x2_intrawave_v1,178.27,559.12,0.0
gfx950,256,216,2048,2048,ck,7,0,9.6605,a8w8_blockscale_1x128x128_256x16x128x256_16x16_16x16_1x2_16x16x1_16x16x1_1x16x1x16_8_1x2_intrawave_v1,187.56,571.54,0.0
gfx950,256,224,2048,2048,ck,13,0,9.7631,a8w8_blockscale_1x128x128_256x32x64x256_16x16_16x16_2x1_16x16x1_16x16x1_1x32x1x8_8_2x1_intrawave_v1,192.46,570.57,0.0
gfx950,256,232,2048,2048,ck,7,0,9.4965,a8w8_blockscale_1x128x128_256x16x128x256_16x16_16x16_1x2_16x16x1_16x16x1_1x16x1x16_8_1x2_intrawave_v1,204.93,591.77,0.0
gfx950,256,240,2048,2048,ck,8,2,12.0741,a8w8_blockscale_1x128x128_256x16x64x256_16x16_16x16_1x1_16x16x1_16x16x1_1x16x1x16_4_1x1_intrawave_v1,166.74,469.51,0.0
gfx950,256,248,2048,2048,ck,7,0,9.6314,a8w8_blockscale_1x128x128_256x16x128x256_16x16_16x16_1x2_16x16x1_16x16x1_1x16x1x16_8_1x2_intrawave_v1,216.0,593.68,0.0
gfx950,256,256,2048,128,cktile,7,0,4.7272,a8w8_blockscale_cktile_32x128x128_1x4x1_16x16x64_intrawave_0x1x0_2,28.39,284.2,0.0
gfx950,256,256,2048,512,ck,13,0,4.5643,a8w8_blockscale_1x128x128_256x32x64x256_16x16_16x16_2x1_16x16x1_16x16x1_1x32x1x8_8_2x1_intrawave_v1,117.62,488.19,0.0
gfx950,256,256,2048,1024,ck,13,0,6.379,a8w8_blockscale_1x128x128_256x32x64x256_16x16_16x16_2x1_16x16x1_16x16x1_1x32x1x8_8_2x1_intrawave_v1,168.32,534.23,0.0
gfx950,256,256,2048,2048,ck,7,0,9.6979,a8w8_blockscale_1x128x128_256x16x128x256_16x16_16x16_1x2_16x16x1_16x16x1_1x16x1x16_8_1x2_intrawave_v1,221.44,594.68,0.0
gfx950,256,256,2048,4096,ck,18,0,16.1668,a8w8_blockscale_1x128x128_256x64x64x256_16x16_32x32_1x1_16x16x1_16x16x1_1x32x1x8_8_1x1_intrawave_v1,265.67,648.6,0.0
gfx950,256,272,2048,2048,ck,18,0,10.8286,a8w8_blockscale_1x128x128_256x64x64x256_16x16_32x32_1x1_16x16x1_16x16x1_1x32x1x8_8_1x1_intrawave_v1,210.71,541.66,0.0
gfx950,256,288,2048,2048,ck,18,0,10.9014,a8w8_blockscale_1x128x128_256x64x64x256_16x16_32x32_1x1_16x16x1_16x16x1_1x32x1x8_8_1x1_intrawave_v1,221.62,547.07,0.0
gfx950,256,304,2048,2048,ck,18,0,11.1628,a8w8_blockscale_1x128x128_256x64x64x256_16x16_32x32_1x1_16x16x1_16x16x1_1x32x1x8_8_1x1_intrawave_v1,228.45,543.06,0.0
gfx950,256,320,2048,2048,ck,18,0,10.0339,a8w8_blockscale_1x128x128_256x64x64x256_16x16_32x32_1x1_16x16x1_16x16x1_1x32x1x8_8_1x1_intrawave_v1,267.53,613.96,0.0
gfx950,256,336,2048,2048,ck,18,0,11.3481,a8w8_blockscale_1x128x128_256x64x64x256_16x16_32x32_1x1_16x16x1_16x16x1_1x32x1x8_8_1x1_intrawave_v1,248.37,551.52,0.0
gfx950,256,352,2048,2048,ck,12,0,11.1248,a8w8_blockscale_1x128x128_256x32x128x256_16x16_32x32_1x1_16x16x1_16x16x1_1x32x1x8_8_1x1_intrawave_v1,265.42,571.43,0.0
gfx950,256,368,2048,2048,ck,18,0,11.1734,a8w8_blockscale_1x128x128_256x64x64x256_16x16_32x32_1x1_16x16x1_16x16x1_1x32x1x8_8_1x1_intrawave_v1,276.28,577.74,0.0
gfx950,256,384,2048,2048,ck,12,0,11.4778,a8w8_blockscale_1x128x128_256x32x128x256_16x16_32x32_1x1_16x16x1_16x16x1_1x32x1x8_8_1x1_intrawave_v1,280.65,570.98,0.0
gfx950,256,400,2048,2048,ck,18,0,10.9292,a8w8_blockscale_1x128x128_256x64x64x256_16x16_32x32_1x1_16x16x1_16x16x1_1x32x1x8_8_1x1_intrawave_v1,307.02,608.64,0.0
gfx950,256,416,2048,2048,ck,18,0,11.2714,a8w8_blockscale_1x128x128_256x64x64x256_16x16_32x32_1x1_16x16x1_16x16x1_1x32x1x8_8_1x1_intrawave_v1,309.6,598.88,0.0
gfx950,256,432,2048,2048,ck,18,0,11.4322,a8w8_blockscale_1x128x128_256x64x64x256_16x16_32x32_1x1_16x16x1_16x16x1_1x32x1x8_8_1x1_intrawave_v1,316.99,599.05,0.0
gfx950,256,448,2048,2048,ck,18,0,10.382,a8w8_blockscale_1x128x128_256x64x64x256_16x16_32x32_1x1_16x16x1_16x16x1_1x32x1x8_8_1x1_intrawave_v1,361.98,669.12,0.0
gfx950,256,464,2048,2048,ck,18,0,11.7079,a8w8_blockscale_1x128x128_256x64x64x256_16x16_32x32_1x1_16x16x1_16x16x1_1x32x1x8_8_1x1_intrawave_v1,332.45,601.74,0.0
gfx950,256,480,2048,2048,ck,18,0,11.4589,a8w8_blockscale_1x128x128_256x64x64x256_16x16_32x32_1x1_16x16x1_16x16x1_1x32x1x8_8_1x1_intrawave_v1,351.39,623.4,0.0
gfx950,256,496,2048,2048,ck,18,0,11.6726,a8w8_blockscale_1x128x128_256x64x64x256_16x16_32x32_1x1_16x16x1_16x16x1_1x32x1x8_8_1x1_intrawave_v1,356.45,620.4,0.0
gfx950,256,512,2048,128,ck,16,0,4.5921,a8w8_blockscale_1x128x128_256x64x64x128_16x16_32x32_1x1_8x32x1_8x32x1_1x32x1x8_8_1x1_intrawave_v1,58.46,528.04,0.0
gfx950,256,512,2048,512,ck,18,0,5.479,a8w8_blockscale_1x128x128_256x64x64x256_16x16_32x32_1x1_16x16x1_16x16x1_1x32x1x8_8_1x1_intrawave_v1,195.97,621.99,0.0
gfx950,256,512,2048,1024,ck,18,0,7.307,a8w8_blockscale_1x128x128_256x64x64x256_16x16_32x32_1x1_16x16x1_16x16x1_1x32x1x8_8_1x1_intrawave_v1,293.89,645.76,0.0
gfx950,256,512,2048,2048,ck,18,0,10.1647,a8w8_blockscale_1x128x128_256x64x64x256_16x16_32x32_1x1_16x16x1_16x16x1_1x32x1x8_8_1x1_intrawave_v1,422.54,722.11,0.0
gfx950,256,512,2048,4096,ck,18,0,16.8136,a8w8_blockscale_1x128x128_256x64x64x256_16x16_32x32_1x1_16x16x1_16x16x1_1x32x1x8_8_1x1_intrawave_v1,510.89,748.38,0.0
gfx950,256,588,2048,128,ck,6,0,5.2126,a8w8_blockscale_1x128x128_256x16x64x128_8x16_16x16_1x1_16x16x1_8x32x1_1x16x1x16_4_1x1_intrawave_v1,59.14,526.77,0.0
gfx950,256,588,2048,1024,ck,3,0,9.9379,a8w8_blockscale_1x128x128_256x64x64x128_16x16_32x32_1x1_8x32x1_8x32x1_1x32x1x8_8_1x1_intrawave_v3,248.17,513.96,0.0
gfx950,256,664,2048,2048,ck,3,0,15.8233,a8w8_blockscale_1x128x128_256x64x64x128_16x16_32x32_1x1_8x32x1_8x32x1_1x32x1x8_8_1x1_intrawave_v3,352.01,522.89,0.0
gfx950,256,667,2048,512,ck,13,0,6.8242,a8w8_blockscale_1x128x128_256x32x64x256_16x16_16x16_2x1_16x16x1_16x16x1_1x32x1x8_8_2x1_intrawave_v1,204.98,604.04,0.0
gfx950,256,667,2048,4096,ck,2,0,25.4018,a8w8_blockscale_1x128x128_256x64x128x128_16x16_32x32_1x2_8x32x1_8x32x1_1x32x1x8_8_1x1_intrawave_v3,440.54,545.34,0.0
gfx950,256,671,2048,512,ck,13,0,6.7793,a8w8_blockscale_1x128x128_256x32x64x256_16x16_16x16_2x1_16x16x1_16x16x1_1x32x1x8_8_2x1_intrawave_v1,207.57,610.76,0.0
gfx950,256,671,2048,4096,ck,2,0,25.4122,a8w8_blockscale_1x128x128_256x64x128x128_16x16_32x32_1x2_8x32x1_8x32x1_1x32x1x8_8_1x1_intrawave_v3,443.0,546.41,0.0
gfx950,256,762,2048,2048,ck,2,0,15.2017,a8w8_blockscale_1x128x128_256x64x128x128_16x16_32x32_1x2_8x32x1_8x32x1_1x32x1x8_8_1x1_intrawave_v3,420.49,583.88,0.0
gfx950,256,773,2048,128,ck,16,0,5.7653,a8w8_blockscale_1x128x128_256x64x64x128_16x16_32x32_1x1_8x32x1_8x32x1_1x32x1x8_8_1x1_intrawave_v1,70.3,611.81,0.0
gfx950,256,773,2048,1024,ck,3,0,9.9334,a8w8_blockscale_1x128x128_256x64x64x128_16x16_32x32_1x1_8x32x1_8x32x1_1x32x1x8_8_1x1_intrawave_v3,326.39,609.55,0.0
gfx950,256,822,2048,128,ck,6,0,5.8617,a8w8_blockscale_1x128x128_256x16x64x128_8x16_16x16_1x1_16x16x1_8x32x1_1x16x1x16_4_1x1_intrawave_v1,73.52,637.06,0.0
gfx950,256,822,2048,1024,ck,18,0,10.3628,a8w8_blockscale_1x128x128_256x64x64x256_16x16_32x32_1x1_16x16x1_16x16x1_1x32x1x8_8_1x1_intrawave_v1,332.7,608.5,0.0
gfx950,256,902,2048,2048,ck,2,0,15.4979,a8w8_blockscale_1x128x128_256x64x128x128_16x16_32x32_1x2_8x32x1_8x32x1_1x32x1x8_8_1x1_intrawave_v3,488.23,628.23,0.0
gfx950,256,931,2048,512,ck,18,0,7.4235,a8w8_blockscale_1x128x128_256x64x64x256_16x16_32x32_1x1_16x16x1_16x16x1_1x32x1x8_8_1x1_intrawave_v1,263.01,719.15,0.0
gfx950,256,931,2048,4096,ck,2,0,26.0911,a8w8_blockscale_1x128x128_256x64x128x128_16x16_32x32_1x2_8x32x1_8x32x1_1x32x1x8_8_1x1_intrawave_v3,598.66,613.82,0.0
gfx950,256,961,2048,2048,ck,2,0,15.6255,a8w8_blockscale_1x128x128_256x64x128x128_16x16_32x32_1x2_8x32x1_8x32x1_1x32x1x8_8_1x1_intrawave_v3,515.92,646.3,0.0
gfx950,256,1000,2048,2048,ck,2,0,15.7485,a8w8_blockscale_1x128x128_256x64x128x128_16x16_32x32_1x2_8x32x1_8x32x1_1x32x1x8_8_1x1_intrawave_v3,532.66,656.46,0.0
gfx950,256,1001,2048,2048,ck,2,0,15.6989,a8w8_blockscale_1x128x128_256x64x128x128_16x16_32x32_1x2_8x32x1_8x32x1_1x32x1x8_8_1x1_intrawave_v3,534.88,658.93,0.0
gfx950,256,1002,2048,2048,ck,2,0,15.8391,a8w8_blockscale_1x128x128_256x64x128x128_16x16_32x32_1x2_8x32x1_8x32x1_1x32x1x8_8_1x1_intrawave_v3,530.67,653.48,0.0
gfx950,256,1003,2048,2048,ck,2,0,15.7897,a8w8_blockscale_1x128x128_256x64x128x128_16x16_32x32_1x2_8x32x1_8x32x1_1x32x1x8_8_1x1_intrawave_v3,532.86,655.92,0.0
gfx950,256,1015,2048,2048,ck,3,0,16.9587,a8w8_blockscale_1x128x128_256x64x64x128_16x16_32x32_1x1_8x32x1_8x32x1_1x32x1x8_8_1x1_intrawave_v3,502.07,615.05,0.0
gfx950,256,1023,2048,2048,ck,2,0,15.7482,a8w8_blockscale_1x128x128_256x64x128x128_16x16_32x32_1x2_8x32x1_8x32x1_1x32x1x8_8_1x1_intrawave_v3,544.92,665.45,0.0
gfx950,256,1024,2048,128,ck,16,0,5.8407,a8w8_blockscale_1x128x128_256x64x64x128_16x16_32x32_1x1_8x32x1_8x32x1_1x32x1x8_8_1x1_intrawave_v1,91.92,785.44,0.0
gfx950,256,1024,2048,512,ck,18,0,7.4642,a8w8_blockscale_1x128x128_256x64x64x256_16x16_32x32_1x1_16x16x1_16x16x1_1x32x1x8_8_1x1_intrawave_v1,287.7,772.64,0.0
gfx950,256,1024,2048,1024,ck,3,0,9.9579,a8w8_blockscale_1x128x128_256x64x64x128_16x16_32x32_1x1_8x32x1_8x32x1_1x32x1x8_8_1x1_intrawave_v3,431.31,737.11,0.0
gfx950,256,1024,2048,2048,ck,2,0,15.3319,a8w8_blockscale_1x128x128_256x64x128x128_16x16_32x32_1x2_8x32x1_8x32x1_1x32x1x8_8_1x1_intrawave_v3,560.27,683.92,0.0
gfx950,256,1024,2048,4096,ck,2,0,25.7958,a8w8_blockscale_1x128x128_256x64x128x128_16x16_32x32_1x2_8x32x1_8x32x1_1x32x1x8_8_1x1_intrawave_v3,665.99,650.39,0.0
gfx950,256,1025,2048,128,cktile,19,0,6.597,a8w8_blockscale_cktile_32x128x128_1x4x1_16x16x64_intrawave_0x1x0_3,81.46,696.04,0.0
gfx950,256,1025,2048,512,ck,13,0,8.9525,a8w8_blockscale_1x128x128_256x32x64x256_16x16_16x16_2x1_16x16x1_16x16x1_1x32x1x8_8_2x1_intrawave_v1,240.11,644.71,0.0
gfx950,256,1025,2048,1024,ck,3,0,12.4335,a8w8_blockscale_1x128x128_256x64x64x128_16x16_32x32_1x1_8x32x1_8x32x1_1x32x1x8_8_1x1_intrawave_v3,345.77,590.75,0.0
gfx950,256,1025,2048,2048,ck,3,0,19.0577,a8w8_blockscale_1x128x128_256x64x64x128_16x16_32x32_1x1_8x32x1_8x32x1_1x32x1x8_8_1x1_intrawave_v3,451.17,550.53,0.0
gfx950,256,1025,2048,4096,ck,0,0,32.2845,a8w8_blockscale_1x128x128_256x128x128x128_16x16_32x32_2x2_8x32x1_8x32x1_1x32x1x8_8_1x1_intrawave_v3,532.66,519.92,0.0
gfx950,256,1027,2048,128,ck,6,0,6.5456,a8w8_blockscale_1x128x128_256x16x64x128_8x16_16x16_1x1_16x16x1_8x32x1_1x16x1x16_4_1x1_intrawave_v1,82.26,702.79,0.0
gfx950,256,1027,2048,512,ck,18,0,8.9521,a8w8_blockscale_1x128x128_256x64x64x256_16x16_32x32_1x1_16x16x1_16x16x1_1x32x1x8_8_1x1_intrawave_v1,240.59,645.77,0.0
gfx950,256,1027,2048,1024,ck,3,0,12.6237,a8w8_blockscale_1x128x128_256x64x64x128_16x16_32x32_1x1_8x32x1_8x32x1_1x32x1x8_8_1x1_intrawave_v3,341.23,582.67,0.0
gfx950,256,1027,2048,4096,ck,0,0,32.1312,a8w8_blockscale_1x128x128_256x128x128x128_16x16_32x32_2x2_8x32x1_8x32x1_1x32x1x8_8_1x1_intrawave_v3,536.25,522.91,0.0
gfx950,256,1031,2048,512,ck,13,0,8.9537,a8w8_blockscale_1x128x128_256x32x64x256_16x16_16x16_2x1_16x16x1_16x16x1_1x32x1x8_8_2x1_intrawave_v1,241.48,647.71,0.0
gfx950,256,1031,2048,4096,ck,0,0,32.1357,a8w8_blockscale_1x128x128_256x128x128x128_16x16_32x32_2x2_8x32x1_8x32x1_1x32x1x8_8_1x1_intrawave_v3,538.26,523.86,0.0
gfx950,256,1032,2048,2048,ck,3,0,19.0775,a8w8_blockscale_1x128x128_256x64x64x128_16x16_32x32_1x1_8x32x1_8x32x1_1x32x1x8_8_1x1_intrawave_v3,453.78,552.22,0.0
gfx950,256,1038,2048,2048,ck,3,0,19.0491,a8w8_blockscale_1x128x128_256x64x64x128_16x16_32x32_1x1_8x32x1_8x32x1_1x32x1x8_8_1x1_intrawave_v3,457.1,554.98,0.0
gfx950,256,1039,2048,512,ck,13,0,8.8885,a8w8_blockscale_1x128x128_256x32x64x256_16x16_16x16_2x1_16x16x1_16x16x1_1x32x1x8_8_2x1_intrawave_v1,245.14,656.61,0.0
gfx950,256,1039,2048,4096,ck,0,0,32.2929,a8w8_blockscale_1x128x128_256x128x128x128_16x16_32x32_2x2_8x32x1_8x32x1_1x32x1x8_8_1x1_intrawave_v3,539.79,523.34,0.0
gfx950,256,1040,2048,512,ck,13,0,8.9441,a8w8_blockscale_1x128x128_256x32x64x256_16x16_16x16_2x1_16x16x1_16x16x1_1x32x1x8_8_2x1_intrawave_v1,243.85,653.04,0.0
gfx950,256,1040,2048,4096,ck,0,0,32.1598,a8w8_blockscale_1x128x128_256x128x128x128_16x16_32x32_2x2_8x32x1_8x32x1_1x32x1x8_8_1x1_intrawave_v3,542.55,525.76,0.0
gfx950,256,1041,2048,512,ck,13,0,8.9623,a8w8_blockscale_1x128x128_256x32x64x256_16x16_16x16_2x1_16x16x1_16x16x1_1x32x1x8_8_2x1_intrawave_v1,243.59,652.23,0.0
gfx950,256,1041,2048,4096,ck,0,0,32.3151,a8w8_blockscale_1x128x128_256x128x128x128_16x16_32x32_2x2_8x32x1_8x32x1_1x32x1x8_8_1x1_intrawave_v3,540.46,523.49,0.0
gfx950,256,1042,2048,128,ck,6,0,6.6291,a8w8_blockscale_1x128x128_256x16x64x128_8x16_16x16_1x1_16x16x1_8x32x1_1x16x1x16_4_1x1_intrawave_v1,82.41,703.5,0.0
gfx950,256,1042,2048,1024,ck,3,0,12.5106,a8w8_blockscale_1x128x128_256x64x64x128_16x16_32x32_1x1_8x32x1_8x32x1_1x32x1x8_8_1x1_intrawave_v3,349.34,594.07,0.0
gfx950,256,1051,2048,128,ck,6,0,6.6272,a8w8_blockscale_1x128x128_256x16x64x128_8x16_16x16_1x1_16x16x1_8x32x1_1x16x1x16_4_1x1_intrawave_v1,83.15,709.44,0.0
gfx950,256,1051,2048,1024,ck,3,0,13.0515,a8w8_blockscale_1x128x128_256x64x64x128_16x16_32x32_1x1_8x32x1_8x32x1_1x32x1x8_8_1x1_intrawave_v3,337.76,572.98,0.0
gfx950,256,1055,2048,128,ck,6,0,6.6338,a8w8_blockscale_1x128x128_256x16x64x128_8x16_16x16_1x1_16x16x1_8x32x1_1x16x1x16_4_1x1_intrawave_v1,83.38,711.28,0.0
gfx950,256,1055,2048,1024,ck,3,0,13.1067,a8w8_blockscale_1x128x128_256x64x64x128_16x16_32x32_1x1_8x32x1_8x32x1_1x32x1x8_8_1x1_intrawave_v3,337.61,572.13,0.0
gfx950,256,1057,2048,128,ck,6,0,6.6191,a8w8_blockscale_1x128x128_256x16x64x128_8x16_16x16_1x1_16x16x1_8x32x1_1x16x1x16_4_1x1_intrawave_v1,83.72,714.13,0.0
gfx950,256,1057,2048,1024,ck,3,0,12.6695,a8w8_blockscale_1x128x128_256x64x64x128_16x16_32x32_1x1_8x32x1_8x32x1_1x32x1x8_8_1x1_intrawave_v3,349.93,592.68,0.0
gfx950,256,1069,2048,128,ck,6,0,6.2065,a8w8_blockscale_1x128x128_256x16x64x128_8x16_16x16_1x1_16x16x1_8x32x1_1x16x1x16_4_1x1_intrawave_v1,90.3,769.77,0.0
gfx950,256,1069,2048,1024,ck,3,0,12.6679,a8w8_blockscale_1x128x128_256x64x64x128_16x16_32x32_1x1_8x32x1_8x32x1_1x32x1x8_8_1x1_intrawave_v3,353.94,597.61,0.0
gfx950,256,1072,2048,128,ck,6,0,6.168,a8w8_blockscale_1x128x128_256x16x64x128_8x16_16x16_1x1_16x16x1_8x32x1_1x16x1x16_4_1x1_intrawave_v1,91.12,776.63,0.0
gfx950,256,1072,2048,512,ck,13,0,8.6539,a8w8_blockscale_1x128x128_256x32x64x256_16x16_16x16_2x1_16x16x1_16x16x1_1x32x1x8_8_2x1_intrawave_v1,259.78,691.98,0.0
gfx950,256,1072,2048,1024,ck,3,0,12.1687,a8w8_blockscale_1x128x128_256x64x64x128_16x16_32x32_1x1_8x32x1_8x32x1_1x32x1x8_8_1x1_intrawave_v3,369.5,623.39,0.0
gfx950,256,1072,2048,4096,ck,2,0,32.5769,a8w8_blockscale_1x128x128_256x64x128x128_16x16_32x32_1x2_8x32x1_8x32x1_1x32x1x8_8_1x1_intrawave_v3,552.08,527.07,0.0
gfx950,256,1073,2048,512,ck,18,0,8.623,a8w8_blockscale_1x128x128_256x64x64x256_16x16_32x32_1x1_16x16x1_16x16x1_1x32x1x8_8_1x1_intrawave_v1,260.96,695.0,0.0
gfx950,256,1073,2048,4096,ck,0,0,32.5998,a8w8_blockscale_1x128x128_256x128x128x128_16x16_32x32_2x2_8x32x1_8x32x1_1x32x1x8_8_1x1_intrawave_v3,552.21,526.95,0.0
gfx950,256,1074,2048,128,ck,6,0,6.6566,a8w8_blockscale_1x128x128_256x16x64x128_8x16_16x16_1x1_16x16x1_8x32x1_1x16x1x16_4_1x1_intrawave_v1,84.59,720.9,0.0
gfx950,256,1074,2048,1024,ck,3,0,12.3787,a8w8_blockscale_1x128x128_256x64x64x128_16x16_32x32_1x1_8x32x1_8x32x1_1x32x1x8_8_1x1_intrawave_v3,363.91,613.64,0.0
gfx950,256,1077,2048,512,ck,13,0,9.0109,a8w8_blockscale_1x128x128_256x32x64x256_16x16_16x16_2x1_16x16x1_16x16x1_1x32x1x8_8_2x1_intrawave_v1,250.66,667.12,0.0
gfx950,256,1077,2048,4096,ck,0,0,32.5662,a8w8_blockscale_1x128x128_256x128x128x128_16x16_32x32_2x2_8x32x1_8x32x1_1x32x1x8_8_1x1_intrawave_v3,554.84,528.5,0.0
gfx950,256,1087,2048,2048,ck,2,0,19.7274,a8w8_blockscale_1x128x128_256x64x128x128_16x16_32x32_1x2_8x32x1_8x32x1_1x32x1x8_8_1x1_intrawave_v3,462.22,551.15,0.0
gfx950,256,1091,2048,128,cktile,4,0,6.5966,a8w8_blockscale_cktile_32x128x128_1x4x1_16x16x128_intrawave_0x1x0_1,86.71,738.34,0.0
gfx950,256,1091,2048,512,ck,18,0,8.9521,a8w8_blockscale_1x128x128_256x64x64x256_16x16_32x32_1x1_16x16x1_16x16x1_1x32x1x8_8_1x1_intrawave_v1,255.58,678.71,0.0
gfx950,256,1091,2048,1024,ck,3,0,13.1565,a8w8_blockscale_1x128x128_256x64x64x128_16x16_32x32_1x1_8x32x1_8x32x1_1x32x1x8_8_1x1_intrawave_v3,347.81,583.98,0.0
gfx950,256,1091,2048,4096,ck,0,0,32.6295,a8w8_blockscale_1x128x128_256x128x128x128_16x16_32x32_2x2_8x32x1_8x32x1_1x32x1x8_8_1x1_intrawave_v3,560.96,530.99,0.0
gfx950,256,1128,2048,128,ck,11,0,6.6147,a8w8_blockscale_1x128x128_256x32x64x128_16x16_16x16_2x1_8x32x1_8x32x1_1x32x1x8_8_2x1_intrawave_v1,89.41,759.95,0.0
gfx950,256,1128,2048,1024,ck,3,0,13.1877,a8w8_blockscale_1x128x128_256x64x64x128_16x16_32x32_1x1_8x32x1_8x32x1_1x32x1x8_8_1x1_intrawave_v3,358.76,596.96,0.0
gfx950,256,1136,2048,128,ck,11,0,6.6779,a8w8_blockscale_1x128x128_256x32x64x128_16x16_16x16_2x1_8x32x1_8x32x1_1x32x1x8_8_2x1_intrawave_v1,89.19,757.81,0.0
gfx950,256,1136,2048,1024,ck,3,0,12.4973,a8w8_blockscale_1x128x128_256x64x64x128_16x16_32x32_1x1_8x32x1_8x32x1_1x32x1x8_8_1x1_intrawave_v3,381.26,633.21,0.0
gfx950,256,1255,2048,2048,ck,3,0,19.3804,a8w8_blockscale_1x128x128_256x64x64x128_16x16_32x32_1x1_8x32x1_8x32x1_1x32x1x8_8_1x1_intrawave_v3,543.21,614.28,0.0
gfx950,256,1343,2048,512,ck,18,0,9.3665,a8w8_blockscale_1x128x128_256x64x64x256_16x16_32x32_1x1_16x16x1_16x16x1_1x32x1x8_8_1x1_intrawave_v1,300.7,772.66,0.0
gfx950,256,1343,2048,4096,ck,0,0,32.9063,a8w8_blockscale_1x128x128_256x128x128x128_16x16_32x32_2x2_8x32x1_8x32x1_1x32x1x8_8_1x1_intrawave_v3,684.73,589.26,0.0
gfx950,256,1351,2048,2048,ck,0,0,20.1533,a8w8_blockscale_1x128x128_256x128x128x128_16x16_32x32_2x2_8x32x1_8x32x1_1x32x1x8_8_1x1_intrawave_v3,562.34,619.99,0.0
gfx950,256,1376,2048,2048,ck,0,0,20.2049,a8w8_blockscale_1x128x128_256x128x128x128_16x16_32x32_2x2_8x32x1_8x32x1_1x32x1x8_8_1x1_intrawave_v3,571.28,626.01,0.0
gfx950,256,1380,2048,2048,ck,3,0,20.1807,a8w8_blockscale_1x128x128_256x64x64x128_16x16_32x32_1x1_8x32x1_8x32x1_1x32x1x8_8_1x1_intrawave_v3,573.63,627.98,0.0
gfx950,256,1391,2048,2048,ck,0,0,20.3413,a8w8_blockscale_1x128x128_256x128x128x128_16x16_32x32_2x2_8x32x1_8x32x1_1x32x1x8_8_1x1_intrawave_v3,573.64,626.34,0.0
gfx950,256,1514,2048,128,cktile,19,0,6.97,a8w8_blockscale_cktile_32x128x128_1x4x1_16x16x64_intrawave_0x1x0_3,113.88,955.13,0.0
gfx950,256,1514,2048,1024,ck,2,0,13.8,a8w8_blockscale_1x128x128_256x64x128x128_16x16_32x32_1x2_8x32x1_8x32x1_1x32x1x8_8_1x1_intrawave_v3,460.16,713.68,0.0
gfx950,256,1688,2048,512,ck,2,0,10.1007,a8w8_blockscale_1x128x128_256x64x128x128_16x16_32x32_1x2_8x32x1_8x32x1_1x32x1x8_8_1x1_intrawave_v3,350.47,873.89,0.0
gfx950,256,1688,2048,4096,ck,0,0,34.0748,a8w8_blockscale_1x128x128_256x128x128x128_16x16_32x32_2x2_8x32x1_8x32x1_1x32x1x8_8_1x1_intrawave_v3,831.11,652.0,0.0
gfx950,256,1710,2048,2048,ck,0,0,20.6478,a8w8_blockscale_1x128x128_256x128x128x128_16x16_32x32_2x2_8x32x1_8x32x1_1x32x1x8_8_1x1_intrawave_v3,694.72,711.97,0.0
gfx950,256,1808,2048,2048,ck,0,0,20.68,a8w8_blockscale_1x128x128_256x128x128x128_16x16_32x32_2x2_8x32x1_8x32x1_1x32x1x8_8_1x1_intrawave_v3,733.39,739.97,0.0
gfx950,256,1809,2048,2048,ck,0,0,20.9096,a8w8_blockscale_1x128x128_256x128x128x128_16x16_32x32_2x2_8x32x1_8x32x1_1x32x1x8_8_1x1_intrawave_v3,725.74,732.14,0.0
gfx950,256,1870,2048,2048,ck,0,0,21.1971,a8w8_blockscale_1x128x128_256x128x128x128_16x16_32x32_2x2_8x32x1_8x32x1_1x32x1x8_8_1x1_intrawave_v3,740.04,739.89,0.0
gfx950,256,1967,2048,2048,ck,0,0,21.1886,a8w8_blockscale_1x128x128_256x128x128x128_16x16_32x32_2x2_8x32x1_8x32x1_1x32x1x8_8_1x1_intrawave_v3,778.74,768.32,0.0
gfx950,256,1970,2048,2048,ck,2,0,22.7399,a8w8_blockscale_1x128x128_256x64x128x128_16x16_32x32_1x2_8x32x1_8x32x1_1x32x1x8_8_1x1_intrawave_v3,726.72,716.71,0.0
gfx950,256,2000,2048,2048,ck,0,0,21.2252,a8w8_blockscale_1x128x128_256x128x128x128_16x16_32x32_2x2_8x32x1_8x32x1_1x32x1x8_8_1x1_intrawave_v3,790.44,776.54,0.0
gfx950,256,2001,2048,2048,ck,0,0,21.1689,a8w8_blockscale_1x128x128_256x128x128x128_16x16_32x32_2x2_8x32x1_8x32x1_1x32x1x8_8_1x1_intrawave_v3,792.94,778.9,0.0
gfx950,256,2016,2048,2048,ck,0,0,21.2743,a8w8_blockscale_1x128x128_256x128x128x128_16x16_32x32_2x2_8x32x1_8x32x1_1x32x1x8_8_1x1_intrawave_v3,794.92,779.37,0.0
gfx950,256,2017,2048,128,cktile,6,0,7.3466,a8w8_blockscale_cktile_32x128x128_1x4x1_16x16x64_intrawave_0x1x0_1,143.94,1195.38,0.0
gfx950,256,2017,2048,512,ck,0,0,10.3246,a8w8_blockscale_1x128x128_256x128x128x128_16x16_32x32_2x2_8x32x1_8x32x1_1x32x1x8_8_1x1_intrawave_v3,409.7,1001.77,0.0
gfx950,256,2017,2048,1024,ck,0,0,14.1869,a8w8_blockscale_1x128x128_256x128x128x128_16x16_32x32_2x2_8x32x1_8x32x1_1x32x1x8_8_1x1_intrawave_v3,596.32,875.75,0.0
gfx950,256,2017,2048,2048,ck,2,0,22.7796,a8w8_blockscale_1x128x128_256x64x128x128_16x16_32x32_1x2_8x32x1_8x32x1_1x32x1x8_8_1x1_intrawave_v3,742.76,728.14,0.0
gfx950,256,2017,2048,4096,ck,0,0,35.5629,a8w8_blockscale_1x128x128_256x128x128x128_16x16_32x32_2x2_8x32x1_8x32x1_1x32x1x8_8_1x1_intrawave_v3,951.54,700.5,0.0
gfx950,256,2046,2048,2048,ck,0,0,21.2836,a8w8_blockscale_1x128x128_256x128x128x128_16x16_32x32_2x2_8x32x1_8x32x1_1x32x1x8_8_1x1_intrawave_v3,806.4,787.69,0.0
gfx950,256,2048,2048,128,cktile,7,0,7.7402,a8w8_blockscale_cktile_32x128x128_1x4x1_16x16x64_intrawave_0x1x0_2,138.72,1151.51,0.0
gfx950,256,2048,2048,512,ck,0,0,10.8642,a8w8_blockscale_1x128x128_256x128x128x128_16x16_32x32_2x2_8x32x1_8x32x1_1x32x1x8_8_1x1_intrawave_v3,395.33,965.17,0.0
gfx950,256,2048,2048,1024,ck,0,0,14.0791,a8w8_blockscale_1x128x128_256x128x128x128_16x16_32x32_2x2_8x32x1_8x32x1_1x32x1x8_8_1x1_intrawave_v3,610.12,893.73,0.0
gfx950,256,2048,2048,2048,ck,0,0,20.4767,a8w8_blockscale_1x128x128_256x128x128x128_16x16_32x32_2x2_8x32x1_8x32x1_1x32x1x8_8_1x1_intrawave_v3,839.0,819.33,0.0
gfx950,256,2048,2048,4096,ck,0,0,34.6324,a8w8_blockscale_1x128x128_256x128x128x128_16x16_32x32_2x2_8x32x1_8x32x1_1x32x1x8_8_1x1_intrawave_v3,992.13,726.66,0.0
gfx950,256,2050,2048,512,ck,18,0,11.8257,a8w8_blockscale_1x128x128_256x64x64x256_16x16_32x32_1x1_16x16x1_16x16x1_1x32x1x8_8_1x1_intrawave_v1,363.54,887.47,0.0
gfx950,256,2050,2048,2048,ck,2,0,28.1498,a8w8_blockscale_1x128x128_256x64x128x128_16x16_32x32_1x2_8x32x1_8x32x1_1x32x1x8_8_1x1_intrawave_v3,610.9,596.43,0.0
gfx950,256,2050,2048,4096,ck,2,0,48.0883,a8w8_blockscale_1x128x128_256x64x128x128_16x16_32x32_1x2_8x32x1_8x32x1_1x32x1x8_8_1x1_intrawave_v3,715.21,523.67,0.0
gfx950,256,2063,2048,512,ck,18,0,11.9421,a8w8_blockscale_1x128x128_256x64x64x256_16x16_32x32_1x1_16x16x1_16x16x1_1x32x1x8_8_1x1_intrawave_v1,362.28,883.84,0.0
gfx950,256,2063,2048,4096,ck,2,0,48.5755,a8w8_blockscale_1x128x128_256x64x128x128_16x16_32x32_1x2_8x32x1_8x32x1_1x32x1x8_8_1x1_intrawave_v3,712.53,520.61,0.0
gfx950,256,2064,2048,512,ck,18,0,12.0187,a8w8_blockscale_1x128x128_256x64x64x256_16x16_32x32_1x1_16x16x1_16x16x1_1x32x1x8_8_1x1_intrawave_v1,360.15,878.59,0.0
gfx950,256,2064,2048,4096,ck,2,0,48.4741,a8w8_blockscale_1x128x128_256x64x128x128_16x16_32x32_1x2_8x32x1_8x32x1_1x32x1x8_8_1x1_intrawave_v3,714.36,521.86,0.0
gfx950,256,2081,2048,2048,ck,2,0,28.3279,a8w8_blockscale_1x128x128_256x64x128x128_16x16_32x32_1x2_8x32x1_8x32x1_1x32x1x8_8_1x1_intrawave_v3,616.24,599.41,0.0
gfx950,256,2095,2048,2048,ck,2,0,28.2054,a8w8_blockscale_1x128x128_256x64x128x128_16x16_32x32_1x2_8x32x1_8x32x1_1x32x1x8_8_1x1_intrawave_v3,623.08,605.06,0.0
gfx950,256,2099,2048,512,ck,18,0,11.8188,a8w8_blockscale_1x128x128_256x64x64x256_16x16_32x32_1x1_16x16x1_16x16x1_1x32x1x8_8_1x1_intrawave_v1,372.45,907.09,0.0
gfx950,256,2099,2048,4096,ck,2,0,48.504,a8w8_blockscale_1x128x128_256x64x128x128_16x16_32x32_1x2_8x32x1_8x32x1_1x32x1x8_8_1x1_intrawave_v3,726.03,527.45,0.0
gfx950,256,2151,2048,128,cktile,6,0,8.0136,a8w8_blockscale_cktile_32x128x128_1x4x1_16x16x64_intrawave_0x1x0_1,140.73,1166.51,0.0
gfx950,256,2151,2048,1024,ck,2,0,18.6453,a8w8_blockscale_1x128x128_256x64x128x128_16x16_32x32_1x2_8x32x1_8x32x1_1x32x1x8_8_1x1_intrawave_v3,483.87,703.14,0.0
gfx950,256,2154,2048,2048,ck,2,0,28.868,a8w8_blockscale_1x128x128_256x64x128x128_16x16_32x32_1x2_8x32x1_8x32x1_1x32x1x8_8_1x1_intrawave_v3,625.92,603.73,0.0
gfx950,256,2159,2048,512,ck,18,0,13.0787,a8w8_blockscale_1x128x128_256x64x64x256_16x16_32x32_1x1_16x16x1_16x16x1_1x32x1x8_8_1x1_intrawave_v1,346.19,840.85,0.0
gfx950,256,2159,2048,2048,ck,2,0,28.6449,a8w8_blockscale_1x128x128_256x64x128x128_16x16_32x32_1x2_8x32x1_8x32x1_1x32x1x8_8_1x1_intrawave_v3,632.26,609.5,0.0
gfx950,256,2159,2048,4096,ck,0,0,49.7859,a8w8_blockscale_1x128x128_256x128x128x128_16x16_32x32_2x2_8x32x1_8x32x1_1x32x1x8_8_1x1_intrawave_v3,727.56,523.75,0.0
gfx950,256,2160,2048,512,ck,18,0,12.9748,a8w8_blockscale_1x128x128_256x64x64x256_16x16_32x32_1x1_16x16x1_16x16x1_1x32x1x8_8_1x1_intrawave_v1,349.13,847.94,0.0
gfx950,256,2160,2048,4096,ck,0,0,49.4639,a8w8_blockscale_1x128x128_256x128x128x128_16x16_32x32_2x2_8x32x1_8x32x1_1x32x1x8_8_1x1_intrawave_v3,732.63,527.32,0.0
gfx950,256,2162,2048,2048,ck,2,0,28.8572,a8w8_blockscale_1x128x128_256x64x128x128_16x16_32x32_1x2_8x32x1_8x32x1_1x32x1x8_8_1x1_intrawave_v3,628.48,605.66,0.0
gfx950,256,2165,2048,2048,ck,2,0,28.6466,a8w8_blockscale_1x128x128_256x64x128x128_16x16_32x32_1x2_8x32x1_8x32x1_1x32x1x8_8_1x1_intrawave_v3,633.98,610.76,0.0
gfx950,256,2251,2048,2048,ck,2,0,28.4053,a8w8_blockscale_1x128x128_256x64x128x128_16x16_32x32_1x2_8x32x1_8x32x1_1x32x1x8_8_1x1_intrawave_v3,664.76,634.55,0.0
gfx950,256,2252,2048,2048,ck,2,0,28.4735,a8w8_blockscale_1x128x128_256x64x128x128_16x16_32x32_1x2_8x32x1_8x32x1_1x32x1x8_8_1x1_intrawave_v3,663.46,633.24,0.0
gfx950,256,2255,2048,2048,ck,2,0,28.5118,a8w8_blockscale_1x128x128_256x64x128x128_16x16_32x32_1x2_8x32x1_8x32x1_1x32x1x8_8_1x1_intrawave_v3,663.46,633.04,0.0
gfx950,256,2313,2048,512,ck,18,0,13.4024,a8w8_blockscale_1x128x128_256x64x64x256_16x16_32x32_1x1_16x16x1_16x16x1_1x32x1x8_8_1x1_intrawave_v1,361.93,873.49,0.0
gfx950,256,2313,2048,4096,ck,2,0,49.4187,a8w8_blockscale_1x128x128_256x64x128x128_16x16_32x32_1x2_8x32x1_8x32x1_1x32x1x8_8_1x1_intrawave_v3,785.24,553.17,0.0
gfx950,256,2317,2048,2048,ck,2,0,28.6792,a8w8_blockscale_1x128x128_256x64x128x128_16x16_32x32_1x2_8x32x1_8x32x1_1x32x1x8_8_1x1_intrawave_v3,677.72,642.62,0.0
gfx950,256,2325,2048,512,ck,13,0,13.3168,a8w8_blockscale_1x128x128_256x32x64x256_16x16_16x16_2x1_16x16x1_16x16x1_1x32x1x8_8_2x1_intrawave_v1,366.14,883.26,0.0
gfx950,256,2325,2048,4096,ck,2,0,49.1754,a8w8_blockscale_1x128x128_256x64x128x128_16x16_32x32_1x2_8x32x1_8x32x1_1x32x1x8_8_1x1_intrawave_v3,793.22,557.9,0.0
gfx950,256,2332,2048,128,cktile,6,0,8.9983,a8w8_blockscale_cktile_32x128x128_1x4x1_16x16x64_intrawave_0x1x0_1,135.87,1123.82,0.0
gfx950,256,2332,2048,1024,ck,2,0,18.7106,a8w8_blockscale_1x128x128_256x64x128x128_16x16_32x32_1x2_8x32x1_8x32x1_1x32x1x8_8_1x1_intrawave_v3,522.76,750.22,0.0
gfx950,256,2341,2048,128,cktile,6,0,8.7391,a8w8_blockscale_cktile_32x128x128_1x4x1_16x16x64_intrawave_0x1x0_1,140.44,1161.51,0.0
gfx950,256,2341,2048,1024,ck,2,0,18.662,a8w8_blockscale_1x128x128_256x64x128x128_16x16_32x32_1x2_8x32x1_8x32x1_1x32x1x8_8_1x1_intrawave_v3,526.14,754.64,0.0
gfx950,256,2694,2048,2048,ck,2,0,29.9208,a8w8_blockscale_1x128x128_256x64x128x128_16x16_32x32_1x2_8x32x1_8x32x1_1x32x1x8_8_1x1_intrawave_v3,755.29,693.37,0.0
gfx950,256,2715,2048,2048,ck,2,0,29.4004,a8w8_blockscale_1x128x128_256x64x128x128_16x16_32x32_1x2_8x32x1_8x32x1_1x32x1x8_8_1x1_intrawave_v3,774.65,710.03,0.0
gfx950,256,2819,2048,2048,ck,2,0,29.8864,a8w8_blockscale_1x128x128_256x64x128x128_16x16_32x32_1x2_8x32x1_8x32x1_1x32x1x8_8_1x1_intrawave_v3,791.25,719.87,0.0
gfx950,256,2853,2048,2048,ck,2,0,29.996,a8w8_blockscale_1x128x128_256x64x128x128_16x16_32x32_1x2_8x32x1_8x32x1_1x32x1x8_8_1x1_intrawave_v3,797.86,724.2,0.0
gfx950,256,2914,2048,2048,ck,2,0,30.0008,a8w8_blockscale_1x128x128_256x64x128x128_16x16_32x32_1x2_8x32x1_8x32x1_1x32x1x8_8_1x1_intrawave_v3,814.79,736.58,0.0
gfx950,256,2974,2048,2048,ck,2,0,30.4312,a8w8_blockscale_1x128x128_256x64x128x128_16x16_32x32_1x2_8x32x1_8x32x1_1x32x1x8_8_1x1_intrawave_v3,819.81,738.27,0.0
gfx950,256,3000,2048,2048,ck,2,0,30.7612,a8w8_blockscale_1x128x128_256x64x128x128_16x16_32x32_1x2_8x32x1_8x32x1_1x32x1x8_8_1x1_intrawave_v3,818.1,735.55,0.0
gfx950,256,3001,2048,2048,ck,2,0,30.688,a8w8_blockscale_1x128x128_256x64x128x128_16x16_32x32_1x2_8x32x1_8x32x1_1x32x1x8_8_1x1_intrawave_v3,820.33,737.5,0.0
gfx950,256,3072,2048,128,cktile,20,0,9.7999,a8w8_blockscale_cktile_32x128x128_1x4x1_16x16x64_intrawave_0x1x0_4,164.35,1350.86,0.0
gfx950,256,3072,2048,512,ck,18,0,13.8348,a8w8_blockscale_1x128x128_256x64x64x256_16x16_32x32_1x1_16x16x1_16x16x1_1x32x1x8_8_1x1_intrawave_v1,465.67,1098.99,0.0
gfx950,256,3072,2048,1024,ck,2,0,20.586,a8w8_blockscale_1x128x128_256x64x128x128_16x16_32x32_1x2_8x32x1_8x32x1_1x32x1x8_8_1x1_intrawave_v3,625.91,865.92,0.0
gfx950,256,3072,2048,2048,ck,0,0,30.2228,a8w8_blockscale_1x128x128_256x128x128x128_16x16_32x32_2x2_8x32x1_8x32x1_1x32x1x8_8_1x1_intrawave_v3,852.66,763.29,0.0
gfx950,256,3072,2048,4096,ck,0,0,50.8509,a8w8_blockscale_1x128x128_256x128x128x128_16x16_32x32_2x2_8x32x1_8x32x1_1x32x1x8_8_1x1_intrawave_v3,1013.54,659.86,0.0
gfx950,256,3073,2048,128,cktile,24,0,11.1396,a8w8_blockscale_cktile_128x128x128_2x2x1_16x16x128_intrawave_0x1x0_1,144.63,1188.78,0.0
gfx950,256,3073,2048,512,ck,18,0,15.1309,a8w8_blockscale_1x128x128_256x64x64x256_16x16_32x32_1x1_16x16x1_16x16x1_1x32x1x8_8_1x1_intrawave_v1,425.92,1005.16,0.0
gfx950,256,3073,2048,1024,ck,0,0,21.2594,a8w8_blockscale_1x128x128_256x128x128x128_16x16_32x32_2x2_8x32x1_8x32x1_1x32x1x8_8_1x1_intrawave_v3,606.28,838.73,0.0
gfx950,256,3073,2048,2048,ck,0,0,30.994,a8w8_blockscale_1x128x128_256x128x128x128_16x16_32x32_2x2_8x32x1_8x32x1_1x32x1x8_8_1x1_intrawave_v3,831.72,744.49,0.0
gfx950,256,3073,2048,4096,ck,0,0,52.3318,a8w8_blockscale_1x128x128_256x128x128x128_16x16_32x32_2x2_8x32x1_8x32x1_1x32x1x8_8_1x1_intrawave_v3,985.18,641.34,0.0
gfx950,256,3077,2048,2048,ck,0,0,31.1621,a8w8_blockscale_1x128x128_256x128x128x128_16x16_32x32_2x2_8x32x1_8x32x1_1x32x1x8_8_1x1_intrawave_v3,828.31,741.27,0.0
gfx950,256,3078,2048,2048,ck,0,0,31.1404,a8w8_blockscale_1x128x128_256x128x128x128_16x16_32x32_2x2_8x32x1_8x32x1_1x32x1x8_8_1x1_intrawave_v3,829.15,741.98,0.0
gfx950,256,3086,2048,2048,ck,0,0,31.4711,a8w8_blockscale_1x128x128_256x128x128x128_16x16_32x32_2x2_8x32x1_8x32x1_1x32x1x8_8_1x1_intrawave_v3,822.57,735.74,0.0
gfx950,256,3089,2048,128,cktile,25,0,11.0796,a8w8_blockscale_cktile_128x128x128_2x2x1_16x16x128_intrawave_0x1x0_3,146.17,1201.31,0.0
gfx950,256,3089,2048,1024,ck,0,0,21.3608,a8w8_blockscale_1x128x128_256x128x128x128_16x16_32x32_2x2_8x32x1_8x32x1_1x32x1x8_8_1x1_intrawave_v3,606.54,838.58,0.0
gfx950,256,3089,2048,2048,ck,0,0,31.3852,a8w8_blockscale_1x128x128_256x128x128x128_16x16_32x32_2x2_8x32x1_8x32x1_1x32x1x8_8_1x1_intrawave_v3,825.63,738.35,0.0
gfx950,256,3110,2048,128,ck,16,0,11.3975,a8w8_blockscale_1x128x128_256x64x64x128_16x16_32x32_1x1_8x32x1_8x32x1_1x32x1x8_8_1x1_intrawave_v1,143.06,1175.59,0.0
gfx950,256,3110,2048,1024,ck,0,0,21.2176,a8w8_blockscale_1x128x128_256x128x128x128_16x16_32x32_2x2_8x32x1_8x32x1_1x32x1x8_8_1x1_intrawave_v3,614.79,849.31,0.0
gfx950,256,3118,2048,2048,ck,0,0,30.8005,a8w8_blockscale_1x128x128_256x128x128x128_16x16_32x32_2x2_8x32x1_8x32x1_1x32x1x8_8_1x1_intrawave_v3,849.2,758.15,0.0
gfx950,256,3137,2048,128,cktile,24,0,11.2193,a8w8_blockscale_cktile_128x128x128_2x2x1_16x16x128_intrawave_0x1x0_1,146.59,1204.43,0.0
gfx950,256,3137,2048,1024,ck,0,0,21.2686,a8w8_blockscale_1x128x128_256x128x128x128_16x16_32x32_2x2_8x32x1_8x32x1_1x32x1x8_8_1x1_intrawave_v3,618.64,853.77,0.0
gfx950,256,3138,2048,2048,ck,0,0,31.2392,a8w8_blockscale_1x128x128_256x128x128x128_16x16_32x32_2x2_8x32x1_8x32x1_1x32x1x8_8_1x1_intrawave_v3,842.64,751.43,0.0
gfx950,256,3154,2048,2048,ck,0,0,31.6203,a8w8_blockscale_1x128x128_256x128x128x128_16x16_32x32_2x2_8x32x1_8x32x1_1x32x1x8_8_1x1_intrawave_v3,836.73,745.49,0.0
gfx950,256,3182,2048,512,ck,18,0,15.3991,a8w8_blockscale_1x128x128_256x64x64x256_16x16_32x32_1x1_16x16x1_16x16x1_1x32x1x8_8_1x1_intrawave_v1,433.35,1020.27,0.0
gfx950,256,3182,2048,4096,ck,0,0,53.919,a8w8_blockscale_1x128x128_256x128x128x128_16x16_32x32_2x2_8x32x1_8x32x1_1x32x1x8_8_1x1_intrawave_v3,990.1,639.02,0.0
gfx950,256,3183,2048,512,ck,18,0,15.3379,a8w8_blockscale_1x128x128_256x64x64x256_16x16_32x32_1x1_16x16x1_16x16x1_1x32x1x8_8_1x1_intrawave_v1,435.21,1024.64,0.0
gfx950,256,3183,2048,4096,ck,0,0,53.421,a8w8_blockscale_1x128x128_256x128x128x128_16x16_32x32_2x2_8x32x1_8x32x1_1x32x1x8_8_1x1_intrawave_v3,999.64,645.13,0.0
gfx950,256,3289,2048,2048,ck,0,0,31.8535,a8w8_blockscale_1x128x128_256x128x128x128_16x16_32x32_2x2_8x32x1_8x32x1_1x32x1x8_8_1x1_intrawave_v3,866.16,766.07,0.0
gfx950,256,3437,2048,2048,ck,0,0,32.1421,a8w8_blockscale_1x128x128_256x128x128x128_16x16_32x32_2x2_8x32x1_8x32x1_1x32x1x8_8_1x1_intrawave_v3,897.01,787.48,0.0
gfx950,256,3613,2048,128,cktile,10,0,11.4416,a8w8_blockscale_cktile_128x128x128_2x2x1_16x16x128_intrawave_0x1x0_2,165.56,1356.76,0.0
gfx950,256,3613,2048,1024,ck,0,0,21.9031,a8w8_blockscale_1x128x128_256x128x128x128_16x16_32x32_2x2_8x32x1_8x32x1_1x32x1x8_8_1x1_intrawave_v3,691.87,940.31,0.0
gfx950,256,3617,2048,2048,ck,0,0,32.7869,a8w8_blockscale_1x128x128_256x128x128x128_16x16_32x32_2x2_8x32x1_8x32x1_1x32x1x8_8_1x1_intrawave_v3,925.42,805.72,0.0
gfx950,256,3620,2048,2048,ck,0,0,32.8325,a8w8_blockscale_1x128x128_256x128x128x128_16x16_32x32_2x2_8x32x1_8x32x1_1x32x1x8_8_1x1_intrawave_v3,924.9,805.17,0.0
gfx950,256,3669,2048,2048,ck,0,0,32.7057,a8w8_blockscale_1x128x128_256x128x128x128_16x16_32x32_2x2_8x32x1_8x32x1_1x32x1x8_8_1x1_intrawave_v3,941.05,817.49,0.0
gfx950,256,3824,2048,2048,ck,0,0,33.6353,a8w8_blockscale_1x128x128_256x128x128x128_16x16_32x32_2x2_8x32x1_8x32x1_1x32x1x8_8_1x1_intrawave_v3,953.7,823.21,0.0
gfx950,256,3847,2048,512,ck,18,0,17.0623,a8w8_blockscale_1x128x128_256x64x64x256_16x16_32x32_1x1_16x16x1_16x16x1_1x32x1x8_8_1x1_intrawave_v1,472.84,1100.41,0.0
gfx950,256,3847,2048,4096,ck,0,0,59.3735,a8w8_blockscale_1x128x128_256x128x128x128_16x16_32x32_2x2_8x32x1_8x32x1_1x32x1x8_8_1x1_intrawave_v3,1087.05,672.07,0.0
gfx950,256,3858,2048,2048,ck,0,0,34.2865,a8w8_blockscale_1x128x128_256x128x128x128_16x16_32x32_2x2_8x32x1_8x32x1_1x32x1x8_8_1x1_intrawave_v3,943.91,813.67,0.0
gfx950,256,3906,2048,2048,ck,0,0,34.2813,a8w8_blockscale_1x128x128_256x128x128x128_16x16_32x32_2x2_8x32x1_8x32x1_1x32x1x8_8_1x1_intrawave_v3,955.8,822.39,0.0
gfx950,256,4000,2048,2048,ck,0,0,34.2409,a8w8_blockscale_1x128x128_256x128x128x128_16x16_32x32_2x2_8x32x1_8x32x1_1x32x1x8_8_1x1_intrawave_v3,979.95,840.23,0.0
gfx950,256,4004,2048,2048,ck,0,0,34.6357,a8w8_blockscale_1x128x128_256x128x128x128_16x16_32x32_2x2_8x32x1_8x32x1_1x32x1x8_8_1x1_intrawave_v3,969.75,831.36,0.0
gfx950,256,4096,2048,128,cktile,25,0,11.7529,a8w8_blockscale_cktile_128x128x128_2x2x1_16x16x128_intrawave_0x1x0_3,182.72,1494.41,0.0
gfx950,256,4096,2048,512,ck,18,0,17.0446,a8w8_blockscale_1x128x128_256x64x64x256_16x16_32x32_1x1_16x16x1_16x16x1_1x32x1x8_8_1x1_intrawave_v1,503.97,1168.87,0.0
gfx950,256,4096,2048,1024,ck,0,0,22.5872,a8w8_blockscale_1x128x128_256x128x128x128_16x16_32x32_2x2_8x32x1_8x32x1_1x32x1x8_8_1x1_intrawave_v3,760.6,1021.32,0.0
gfx950,256,4096,2048,4096,ck,0,0,58.1923,a8w8_blockscale_1x128x128_256x128x128x128_16x16_32x32_2x2_8x32x1_8x32x1_1x32x1x8_8_1x1_intrawave_v3,1180.9,720.77,0.0
gfx950,256,4097,2048,128,cktile,6,0,12.4091,a8w8_blockscale_cktile_32x128x128_1x4x1_16x16x64_intrawave_0x1x0_1,173.1,1415.72,0.0
gfx950,256,4097,2048,1024,cktile,30,0,27.7613,a8w8_blockscale_cktile_192x256x128_4x2x1_16x16x128_intrawave_0x1x0_2_aqrm,618.99,831.15,0.0
gfx950,256,4100,2048,2048,cktile,32,0,40.2915,a8w8_blockscale_cktile_192x256x128_4x2x1_16x16x128_intrawave_0x1x0_4_aqrm,853.61,729.3,0.0
gfx950,256,4108,2048,2048,cktile,12,0,40.3457,a8w8_blockscale_cktile_192x256x128_4x2x1_16x16x128_intrawave_0x1x0_1_aqrm,854.13,729.54,0.0
gfx950,256,4109,2048,128,cktile,7,0,12.3771,a8w8_blockscale_cktile_32x128x128_1x4x1_16x16x64_intrawave_0x1x0_2,174.06,1423.48,0.0
gfx950,256,4109,2048,1024,cktile,31,0,27.8044,a8w8_blockscale_cktile_192x256x128_4x2x1_16x16x128_intrawave_0x1x0_3_aqrm,619.84,832.07,0.0
gfx950,256,4111,2048,512,ck,18,0,18.3569,a8w8_blockscale_1x128x128_256x64x64x256_16x16_32x32_1x1_16x16x1_16x16x1_1x32x1x8_8_1x1_intrawave_v1,469.65,1089.08,0.0
gfx950,256,4111,2048,4096,cktile,29,0,62.8737,a8w8_blockscale_cktile_192x256x128_4x2x1_16x16x128_intrawave_0x1x0_4,1096.98,669.05,0.0
gfx950,256,4121,2048,2048,cktile,12,0,41.1442,a8w8_blockscale_cktile_192x256x128_4x2x1_16x16x128_intrawave_0x1x0_1_aqrm,840.2,717.32,0.0
gfx950,256,4123,2048,2048,cktile,32,0,40.5906,a8w8_blockscale_cktile_192x256x128_4x2x1_16x16x128_intrawave_0x1x0_4_aqrm,852.07,727.41,0.0
gfx950,256,4141,2048,512,ck,18,0,18.4379,a8w8_blockscale_1x128x128_256x64x64x256_16x16_32x32_1x1_16x16x1_16x16x1_1x32x1x8_8_1x1_intrawave_v1,471.0,1091.79,0.0
gfx950,256,4141,2048,4096,cktile,29,0,63.1994,a8w8_blockscale_cktile_192x256x128_4x2x1_16x16x128_intrawave_0x1x0_4,1099.29,669.49,0.0
gfx950,256,4142,2048,512,ck,18,0,18.4741,a8w8_blockscale_1x128x128_256x64x64x256_16x16_32x32_1x1_16x16x1_16x16x1_1x32x1x8_8_1x1_intrawave_v1,470.19,1089.9,0.0
gfx950,256,4142,2048,4096,cktile,27,0,63.0746,a8w8_blockscale_cktile_192x256x128_4x2x1_16x16x128_intrawave_0x1x0_2,1101.73,670.95,0.0
gfx950,256,4143,2048,128,cktile,20,0,12.4497,a8w8_blockscale_cktile_32x128x128_1x4x1_16x16x64_intrawave_0x1x0_4,174.47,1426.72,0.0
gfx950,256,4143,2048,1024,cktile,30,0,27.8358,a8w8_blockscale_cktile_192x256x128_4x2x1_16x16x128_intrawave_0x1x0_2_aqrm,624.27,837.39,0.0
gfx950,256,4149,2048,2048,cktile,31,0,40.8706,a8w8_blockscale_cktile_192x256x128_4x2x1_16x16x128_intrawave_0x1x0_3_aqrm,851.57,726.34,0.0
gfx950,256,4204,2048,2048,cktile,30,0,40.5177,a8w8_blockscale_cktile_192x256x128_4x2x1_16x16x128_intrawave_0x1x0_2_aqrm,870.38,741.0,0.0
gfx950,256,4223,2048,2048,cktile,31,0,40.9247,a8w8_blockscale_cktile_192x256x128_4x2x1_16x16x128_intrawave_0x1x0_3_aqrm,865.62,736.48,0.0
gfx950,256,4229,2048,2048,cktile,12,0,40.7843,a8w8_blockscale_cktile_192x256x128_4x2x1_16x16x128_intrawave_0x1x0_1_aqrm,869.83,739.92,0.0
gfx950,256,4345,2048,128,cktile,19,0,12.8748,a8w8_blockscale_cktile_32x128x128_1x4x1_16x16x64_intrawave_0x1x0_3,176.94,1445.88,0.0
gfx950,256,4345,2048,512,ck,18,0,18.7036,a8w8_blockscale_1x128x128_256x64x64x256_16x16_32x32_1x1_16x16x1_16x16x1_1x32x1x8_8_1x1_intrawave_v1,487.19,1126.54,0.0
gfx950,256,4345,2048,1024,ck,2,0,28.7828,a8w8_blockscale_1x128x128_256x64x128x128_16x16_32x32_1x2_8x32x1_8x32x1_1x32x1x8_8_1x1_intrawave_v3,633.16,845.77,0.0
gfx950,256,4345,2048,4096,cktile,11,0,63.5458,a8w8_blockscale_cktile_192x256x128_4x2x1_16x16x128_intrawave_0x1x0_1,1147.16,692.14,0.0
gfx950,256,4379,2048,2048,cktile,12,0,41.0321,a8w8_blockscale_cktile_192x256x128_4x2x1_16x16x128_intrawave_0x1x0_1_aqrm,895.24,757.92,0.0
gfx950,256,4410,2048,2048,cktile,12,0,41.1746,a8w8_blockscale_cktile_192x256x128_4x2x1_16x16x128_intrawave_0x1x0_1_aqrm,898.46,759.92,0.0
gfx950,256,4413,2048,128,cktile,7,0,12.6383,a8w8_blockscale_cktile_32x128x128_1x4x1_16x16x64_intrawave_0x1x0_2,183.07,1495.66,0.0
gfx950,256,4413,2048,1024,cktile,31,0,28.0829,a8w8_blockscale_cktile_192x256x128_4x2x1_16x16x128_intrawave_0x1x0_3_aqrm,659.1,879.24,0.0
gfx950,256,4498,2048,2048,cktile,12,0,40.8558,a8w8_blockscale_cktile_192x256x128_4x2x1_16x16x128_intrawave_0x1x0_1_aqrm,923.54,779.08,0.0
gfx950,256,4585,2048,2048,cktile,30,0,41.2823,a8w8_blockscale_cktile_192x256x128_4x2x1_16x16x128_intrawave_0x1x0_2_aqrm,931.68,783.98,0.0
gfx950,256,4586,2048,2048,cktile,31,0,41.3619,a8w8_blockscale_cktile_192x256x128_4x2x1_16x16x128_intrawave_0x1x0_3_aqrm,930.09,782.62,0.0
gfx950,256,4723,2048,2048,cktile,12,0,41.3863,a8w8_blockscale_cktile_192x256x128_4x2x1_16x16x128_intrawave_0x1x0_1_aqrm,957.31,802.5,0.0
gfx950,256,4743,2048,2048,cktile,12,0,41.3044,a8w8_blockscale_cktile_192x256x128_4x2x1_16x16x128_intrawave_0x1x0_1_aqrm,963.27,807.06,0.0
gfx950,256,4822,2048,2048,cktile,32,0,41.6608,a8w8_blockscale_cktile_192x256x128_4x2x1_16x16x128_intrawave_0x1x0_4_aqrm,970.93,811.81,0.0
gfx950,256,4898,2048,2048,cktile,31,0,41.5369,a8w8_blockscale_cktile_192x256x128_4x2x1_16x16x128_intrawave_0x1x0_3_aqrm,989.18,825.47,0.0
gfx950,256,4936,2048,2048,cktile,12,0,41.429,a8w8_blockscale_cktile_192x256x128_4x2x1_16x16x128_intrawave_0x1x0_1_aqrm,999.45,833.26,0.0
gfx950,256,4992,2048,2048,cktile,30,0,41.3855,a8w8_blockscale_cktile_192x256x128_4x2x1_16x16x128_intrawave_0x1x0_2_aqrm,1011.85,842.45,0.0
gfx950,256,5000,2048,2048,cktile,32,0,41.4236,a8w8_blockscale_cktile_192x256x128_4x2x1_16x16x128_intrawave_0x1x0_4_aqrm,1012.54,842.86,0.0
gfx950,256,5001,2048,2048,cktile,30,0,41.6517,a8w8_blockscale_cktile_192x256x128_4x2x1_16x16x128_intrawave_0x1x0_2_aqrm,1007.2,838.39,0.0
gfx950,256,5002,2048,2048,cktile,31,0,41.6954,a8w8_blockscale_cktile_192x256x128_4x2x1_16x16x128_intrawave_0x1x0_3_aqrm,1006.34,837.66,0.0
gfx950,256,5003,2048,2048,cktile,31,0,41.6567,a8w8_blockscale_cktile_192x256x128_4x2x1_16x16x128_intrawave_0x1x0_3_aqrm,1007.48,838.59,0.0
gfx950,256,5004,2048,2048,cktile,30,0,41.5666,a8w8_blockscale_cktile_192x256x128_4x2x1_16x16x128_intrawave_0x1x0_2_aqrm,1009.86,840.55,0.0
gfx950,256,5005,2048,2048,cktile,31,0,41.7385,a8w8_blockscale_cktile_192x256x128_4x2x1_16x16x128_intrawave_0x1x0_3_aqrm,1005.91,837.24,0.0
gfx950,256,5006,2048,2048,cktile,12,0,41.6095,a8w8_blockscale_cktile_192x256x128_4x2x1_16x16x128_intrawave_0x1x0_1_aqrm,1009.23,839.98,0.0
gfx950,256,5010,2048,2048,cktile,12,0,41.8076,a8w8_blockscale_cktile_192x256x128_4x2x1_16x16x128_intrawave_0x1x0_1_aqrm,1005.25,836.59,0.0
gfx950,256,5011,2048,2048,cktile,12,0,41.8406,a8w8_blockscale_cktile_192x256x128_4x2x1_16x16x128_intrawave_0x1x0_1_aqrm,1004.65,836.08,0.0
gfx950,256,5012,2048,2048,cktile,32,0,41.5702,a8w8_blockscale_cktile_192x256x128_4x2x1_16x16x128_intrawave_0x1x0_4_aqrm,1011.39,841.66,0.0
gfx950,256,5026,2048,2048,cktile,30,0,41.8113,a8w8_blockscale_cktile_192x256x128_4x2x1_16x16x128_intrawave_0x1x0_2_aqrm,1008.37,838.87,0.0
gfx950,256,5028,2048,2048,cktile,12,0,41.6495,a8w8_blockscale_cktile_192x256x128_4x2x1_16x16x128_intrawave_0x1x0_1_aqrm,1012.69,842.42,0.0
gfx950,256,5030,2048,2048,cktile,32,0,41.8802,a8w8_blockscale_cktile_192x256x128_4x2x1_16x16x128_intrawave_0x1x0_4_aqrm,1007.51,838.07,0.0
gfx950,256,5031,2048,2048,cktile,12,0,41.7855,a8w8_blockscale_cktile_192x256x128_4x2x1_16x16x128_intrawave_0x1x0_1_aqrm,1009.99,840.12,0.0
gfx950,256,5060,2048,2048,cktile,31,0,41.5787,a8w8_blockscale_cktile_192x256x128_4x2x1_16x16x128_intrawave_0x1x0_3_aqrm,1020.87,848.58,0.0
gfx950,256,5062,2048,2048,cktile,31,0,41.9044,a8w8_blockscale_cktile_192x256x128_4x2x1_16x16x128_intrawave_0x1x0_3_aqrm,1013.33,842.28,0.0
gfx950,256,5063,2048,2048,cktile,32,0,41.6206,a8w8_blockscale_cktile_192x256x128_4x2x1_16x16x128_intrawave_0x1x0_4_aqrm,1020.44,848.17,0.0
gfx950,256,5091,2048,2048,cktile,30,0,41.608,a8w8_blockscale_cktile_192x256x128_4x2x1_16x16x128_intrawave_0x1x0_2_aqrm,1026.4,852.56,0.0
gfx950,256,5105,2048,512,ck,18,0,20.6958,a8w8_blockscale_1x128x128_256x64x64x256_16x16_32x32_1x1_16x16x1_16x16x1_1x32x1x8_8_1x1_intrawave_v1,517.3,1187.31,0.0
gfx950,256,5105,2048,2048,cktile,32,0,41.7753,a8w8_blockscale_cktile_192x256x128_4x2x1_16x16x128_intrawave_0x1x0_4_aqrm,1025.1,851.21,0.0
gfx950,256,5105,2048,4096,cktile,27,0,65.0105,a8w8_blockscale_cktile_192x256x128_4x2x1_16x16x128_intrawave_0x1x0_2,1317.44,772.32,0.0
gfx950,256,5120,2048,2048,cktile,30,0,41.7457,a8w8_blockscale_cktile_192x256x128_4x2x1_16x16x128_intrawave_0x1x0_2_aqrm,1028.84,854.02,0.0
gfx950,256,5121,2048,128,cktile,20,0,14.224,a8w8_blockscale_cktile_32x128x128_1x4x1_16x16x64_intrawave_0x1x0_4,188.76,1539.18,0.0
gfx950,256,5121,2048,512,ck,18,0,21.7571,a8w8_blockscale_1x128x128_256x64x64x256_16x16_32x32_1x1_16x16x1_16x16x1_1x32x1x8_8_1x1_intrawave_v1,493.61,1132.79,0.0
gfx950,256,5121,2048,1024,cktile,31,0,28.4627,a8w8_blockscale_cktile_192x256x128_4x2x1_16x16x128_intrawave_0x1x0_3_aqrm,754.64,994.87,0.0
gfx950,256,5121,2048,4096,cktile,29,0,65.012,a8w8_blockscale_cktile_192x256x128_4x2x1_16x16x128_intrawave_0x1x0_4,1321.54,774.32,0.0
gfx950,256,5122,2048,2048,cktile,31,0,41.9704,a8w8_blockscale_cktile_192x256x128_4x2x1_16x16x128_intrawave_0x1x0_3_aqrm,1023.73,849.74,0.0
gfx950,256,5123,2048,128,cktile,20,0,14.2715,a8w8_blockscale_cktile_32x128x128_1x4x1_16x16x64_intrawave_0x1x0_4,188.2,1534.65,0.0
gfx950,256,5123,2048,512,ck,18,0,21.6433,a8w8_blockscale_1x128x128_256x64x64x256_16x16_32x32_1x1_16x16x1_16x16x1_1x32x1x8_8_1x1_intrawave_v1,496.4,1139.17,0.0
gfx950,256,5123,2048,1024,cktile,32,0,28.386,a8w8_blockscale_cktile_192x256x128_4x2x1_16x16x128_intrawave_0x1x0_4_aqrm,756.97,997.92,0.0
gfx950,256,5123,2048,2048,cktile,12,0,41.8478,a8w8_blockscale_cktile_192x256x128_4x2x1_16x16x128_intrawave_0x1x0_1_aqrm,1026.93,852.37,0.0
gfx950,256,5123,2048,4096,cktile,28,0,65.0928,a8w8_blockscale_cktile_192x256x128_4x2x1_16x16x128_intrawave_0x1x0_3,1320.42,773.61,0.0
gfx950,256,5124,2048,2048,cktile,32,0,41.5034,a8w8_blockscale_cktile_192x256x128_4x2x1_16x16x128_intrawave_0x1x0_4_aqrm,1035.66,859.6,0.0
gfx950,256,5127,2048,2048,cktile,31,0,41.6749,a8w8_blockscale_cktile_192x256x128_4x2x1_16x16x128_intrawave_0x1x0_3_aqrm,1032.0,856.5,0.0
gfx950,256,5131,2048,512,ck,18,0,21.5867,a8w8_blockscale_1x128x128_256x64x64x256_16x16_32x32_1x1_16x16x1_16x16x1_1x32x1x8_8_1x1_intrawave_v1,498.48,1143.86,0.0
gfx950,256,5131,2048,4096,cktile,29,0,65.3686,a8w8_blockscale_cktile_192x256x128_4x2x1_16x16x128_intrawave_0x1x0_4,1316.9,771.35,0.0
gfx950,256,5133,2048,128,cktile,7,0,14.3216,a8w8_blockscale_cktile_32x128x128_1x4x1_16x16x64_intrawave_0x1x0_2,187.91,1532.23,0.0
gfx950,256,5133,2048,1024,cktile,12,0,28.5403,a8w8_blockscale_cktile_192x256x128_4x2x1_16x16x128_intrawave_0x1x0_1_aqrm,754.35,994.32,0.0
gfx950,256,5177,2048,2048,cktile,12,0,42.1067,a8w8_blockscale_cktile_192x256x128_4x2x1_16x16x128_intrawave_0x1x0_1_aqrm,1031.38,855.01,0.0
gfx950,256,5183,2048,2048,cktile,31,0,42.1044,a8w8_blockscale_cktile_192x256x128_4x2x1_16x16x128_intrawave_0x1x0_3_aqrm,1032.63,855.94,0.0
gfx950,256,5185,2048,128,cktile,7,0,14.4713,a8w8_blockscale_cktile_32x128x128_1x4x1_16x16x64_intrawave_0x1x0_2,187.85,1531.55,0.0
gfx950,256,5185,2048,1024,cktile,32,0,28.5217,a8w8_blockscale_cktile_192x256x128_4x2x1_16x16x128_intrawave_0x1x0_4_aqrm,762.49,1004.3,0.0
gfx950,256,5191,2048,128,cktile,20,0,14.3689,a8w8_blockscale_cktile_32x128x128_1x4x1_16x16x64_intrawave_0x1x0_4,189.41,1544.23,0.0
gfx950,256,5191,2048,1024,cktile,31,0,28.5546,a8w8_blockscale_cktile_192x256x128_4x2x1_16x16x128_intrawave_0x1x0_3_aqrm,762.49,1004.22,0.0
gfx950,256,5252,2048,2048,cktile,12,0,41.8846,a8w8_blockscale_cktile_192x256x128_4x2x1_16x16x128_intrawave_0x1x0_1_aqrm,1051.87,870.55,0.0
gfx950,256,5255,2048,2048,cktile,31,0,42.3697,a8w8_blockscale_cktile_192x256x128_4x2x1_16x16x128_intrawave_0x1x0_3_aqrm,1040.42,861.02,0.0
gfx950,256,5361,2048,2048,cktile,12,0,42.2586,a8w8_blockscale_cktile_192x256x128_4x2x1_16x16x128_intrawave_0x1x0_1_aqrm,1064.19,878.69,0.0
gfx950,256,5427,2048,512,ck,18,0,21.6172,a8w8_blockscale_1x128x128_256x64x64x256_16x16_32x32_1x1_16x16x1_16x16x1_1x32x1x8_8_1x1_intrawave_v1,526.49,1205.35,0.0
gfx950,256,5427,2048,2048,cktile,31,0,42.5345,a8w8_blockscale_cktile_192x256x128_4x2x1_16x16x128_intrawave_0x1x0_3_aqrm,1070.31,882.53,0.0
gfx950,256,5427,2048,4096,cktile,28,0,66.0641,a8w8_blockscale_cktile_192x256x128_4x2x1_16x16x128_intrawave_0x1x0_3,1378.21,799.93,0.0
gfx950,256,5471,2048,2048,cktile,31,0,42.3016,a8w8_blockscale_cktile_192x256x128_4x2x1_16x16x128_intrawave_0x1x0_3_aqrm,1084.93,893.78,0.0
gfx950,256,5534,2048,2048,cktile,12,0,42.3209,a8w8_blockscale_cktile_192x256x128_4x2x1_16x16x128_intrawave_0x1x0_1_aqrm,1096.92,902.51,0.0
gfx950,256,5564,2048,2048,cktile,31,0,42.1818,a8w8_blockscale_cktile_192x256x128_4x2x1_16x16x128_intrawave_0x1x0_3_aqrm,1106.5,909.86,0.0
gfx950,256,5671,2048,2048,cktile,32,0,42.4883,a8w8_blockscale_cktile_192x256x128_4x2x1_16x16x128_intrawave_0x1x0_4_aqrm,1119.64,918.77,0.0
gfx950,256,5927,2048,2048,cktile,31,0,42.9201,a8w8_blockscale_cktile_192x256x128_4x2x1_16x16x128_intrawave_0x1x0_3_aqrm,1158.41,946.17,0.0
gfx950,256,5954,2048,2048,cktile,31,0,42.9165,a8w8_blockscale_cktile_192x256x128_4x2x1_16x16x128_intrawave_0x1x0_3_aqrm,1163.79,950.12,0.0
gfx950,256,6000,2048,2048,cktile,12,0,42.8017,a8w8_blockscale_cktile_192x256x128_4x2x1_16x16x128_intrawave_0x1x0_1_aqrm,1175.93,959.27,0.0
gfx950,256,6002,2048,2048,cktile,30,0,43.2385,a8w8_blockscale_cktile_192x256x128_4x2x1_16x16x128_intrawave_0x1x0_2_aqrm,1164.44,949.86,0.0
gfx950,256,6113,2048,512,cktile,30,0,22.3656,a8w8_blockscale_cktile_192x256x128_4x2x1_16x16x128_intrawave_0x1x0_2_aqrm,573.2,1306.35,0.0
gfx950,256,6113,2048,4096,cktile,29,0,67.9741,a8w8_blockscale_cktile_192x256x128_4x2x1_16x16x128_intrawave_0x1x0_4,1508.8,860.13,0.0
gfx950,256,6146,2048,128,cktile,6,0,16.2615,a8w8_blockscale_cktile_32x128x128_1x4x1_16x16x64_intrawave_0x1x0_1,198.15,1612.57,0.0
gfx950,256,6146,2048,1024,ck,0,0,37.9007,a8w8_blockscale_1x128x128_256x128x128x128_16x16_32x32_2x2_8x32x1_8x32x1_1x32x1x8_8_1x1_intrawave_v3,680.15,885.6,0.0
gfx950,256,6146,2048,2048,ck,0,0,58.3038,a8w8_blockscale_1x128x128_256x128x128x128_16x16_32x32_2x2_8x32x1_8x32x1_1x32x1x8_8_1x1_intrawave_v3,884.27,719.6,0.0
gfx950,256,6147,2048,128,cktile,20,0,16.2358,a8w8_blockscale_cktile_32x128x128_1x4x1_16x16x64_intrawave_0x1x0_4,198.5,1615.39,0.0
gfx950,256,6147,2048,1024,ck,0,0,37.7839,a8w8_blockscale_1x128x128_256x128x128x128_16x16_32x32_2x2_8x32x1_8x32x1_1x32x1x8_8_1x1_intrawave_v3,682.36,888.47,0.0
gfx950,256,6155,2048,128,cktile,19,0,16.2266,a8w8_blockscale_cktile_32x128x128_1x4x1_16x16x64_intrawave_0x1x0_3,198.87,1618.38,0.0
gfx950,256,6155,2048,1024,ck,0,0,37.8511,a8w8_blockscale_1x128x128_256x128x128x128_16x16_32x32_2x2_8x32x1_8x32x1_1x32x1x8_8_1x1_intrawave_v3,682.04,887.97,0.0
gfx950,256,6194,2048,2048,ck,0,0,58.327,a8w8_blockscale_1x128x128_256x128x128x128_16x16_32x32_2x2_8x32x1_8x32x1_1x32x1x8_8_1x1_intrawave_v3,890.82,724.37,0.0
gfx950,256,6197,2048,512,ck,18,0,24.7318,a8w8_blockscale_1x128x128_256x64x64x256_16x16_32x32_1x1_16x16x1_16x16x1_1x32x1x8_8_1x1_intrawave_v1,525.48,1197.02,0.0
gfx950,256,6197,2048,4096,ck,0,0,99.9766,a8w8_blockscale_1x128x128_256x128x128x128_16x16_32x32_2x2_8x32x1_8x32x1_1x32x1x8_8_1x1_intrawave_v3,1039.93,591.68,0.0
gfx950,256,6227,2048,2048,ck,0,0,58.0378,a8w8_blockscale_1x128x128_256x128x128x128_16x16_32x32_2x2_8x32x1_8x32x1_1x32x1x8_8_1x1_intrawave_v3,900.03,731.47,0.0
gfx950,256,6229,2048,2048,ck,0,0,57.9478,a8w8_blockscale_1x128x128_256x128x128x128_16x16_32x32_2x2_8x32x1_8x32x1_1x32x1x8_8_1x1_intrawave_v3,901.72,732.82,0.0
gfx950,256,6234,2048,2048,ck,0,0,57.4538,a8w8_blockscale_1x128x128_256x128x128x128_16x16_32x32_2x2_8x32x1_8x32x1_1x32x1x8_8_1x1_intrawave_v3,910.2,739.66,0.0
gfx950,256,6246,2048,2048,ck,0,0,58.2189,a8w8_blockscale_1x128x128_256x128x128x128_16x16_32x32_2x2_8x32x1_8x32x1_1x32x1x8_8_1x1_intrawave_v3,899.97,731.2,0.0
gfx950,256,6304,2048,2048,ck,0,0,58.3983,a8w8_blockscale_1x128x128_256x128x128x128_16x16_32x32_2x2_8x32x1_8x32x1_1x32x1x8_8_1x1_intrawave_v3,905.54,735.06,0.0
gfx950,256,6314,2048,2048,ck,0,0,58.6431,a8w8_blockscale_1x128x128_256x128x128x128_16x16_32x32_2x2_8x32x1_8x32x1_1x32x1x8_8_1x1_intrawave_v3,903.19,733.04,0.0
gfx950,256,6318,2048,2048,ck,0,0,57.9474,a8w8_blockscale_1x128x128_256x128x128x128_16x16_32x32_2x2_8x32x1_8x32x1_1x32x1x8_8_1x1_intrawave_v3,914.61,742.26,0.0
gfx950,256,6341,2048,2048,ck,0,0,58.4499,a8w8_blockscale_1x128x128_256x128x128x128_16x16_32x32_2x2_8x32x1_8x32x1_1x32x1x8_8_1x1_intrawave_v3,910.05,738.3,0.0
gfx950,256,6377,2048,128,cktile,20,0,16.4216,a8w8_blockscale_cktile_32x128x128_1x4x1_16x16x64_intrawave_0x1x0_4,203.6,1656.27,0.0
gfx950,256,6377,2048,1024,ck,0,0,38.2626,a8w8_blockscale_1x128x128_256x128x128x128_16x16_32x32_2x2_8x32x1_8x32x1_1x32x1x8_8_1x1_intrawave_v3,699.04,908.13,0.0
gfx950,256,6377,2048,2048,ck,0,0,58.4111,a8w8_blockscale_1x128x128_256x128x128x128_16x16_32x32_2x2_8x32x1_8x32x1_1x32x1x8_8_1x1_intrawave_v3,915.82,742.57,0.0
gfx950,256,6401,2048,128,cktile,6,0,16.4272,a8w8_blockscale_cktile_32x128x128_1x4x1_16x16x64_intrawave_0x1x0_1,204.29,1661.88,0.0
gfx950,256,6401,2048,1024,ck,0,0,38.0151,a8w8_blockscale_1x128x128_256x128x128x128_16x16_32x32_2x2_8x32x1_8x32x1_1x32x1x8_8_1x1_intrawave_v3,706.24,917.27,0.0
gfx950,256,6409,2048,512,ck,18,0,25.3228,a8w8_blockscale_1x128x128_256x64x64x256_16x16_32x32_1x1_16x16x1_16x16x1_1x32x1x8_8_1x1_intrawave_v1,530.77,1207.66,0.0
gfx950,256,6409,2048,4096,ck,0,0,101.1523,a8w8_blockscale_1x128x128_256x128x128x128_16x16_32x32_2x2_8x32x1_8x32x1_1x32x1x8_8_1x1_intrawave_v3,1063.0,601.97,0.0
gfx950,256,6476,2048,2048,ck,0,0,58.5015,a8w8_blockscale_1x128x128_256x128x128x128_16x16_32x32_2x2_8x32x1_8x32x1_1x32x1x8_8_1x1_intrawave_v3,928.6,751.82,0.0
gfx950,256,6483,2048,2048,ck,0,0,58.0731,a8w8_blockscale_1x128x128_256x128x128x128_16x16_32x32_2x2_8x32x1_8x32x1_1x32x1x8_8_1x1_intrawave_v3,936.46,758.11,0.0
gfx950,256,6492,2048,2048,ck,0,0,58.1539,a8w8_blockscale_1x128x128_256x128x128x128_16x16_32x32_2x2_8x32x1_8x32x1_1x32x1x8_8_1x1_intrawave_v3,936.46,758.01,0.0
gfx950,256,6519,2048,2048,ck,0,0,57.9027,a8w8_blockscale_1x128x128_256x128x128x128_16x16_32x32_2x2_8x32x1_8x32x1_1x32x1x8_8_1x1_intrawave_v3,944.43,764.16,0.0
gfx950,256,6609,2048,2048,ck,0,0,58.5668,a8w8_blockscale_1x128x128_256x128x128x128_16x16_32x32_2x2_8x32x1_8x32x1_1x32x1x8_8_1x1_intrawave_v3,946.62,764.94,0.0
gfx950,256,6811,2048,2048,ck,0,0,59.3478,a8w8_blockscale_1x128x128_256x128x128x128_16x16_32x32_2x2_8x32x1_8x32x1_1x32x1x8_8_1x1_intrawave_v3,962.71,775.78,0.0
gfx950,256,6813,2048,2048,ck,0,0,58.7865,a8w8_blockscale_1x128x128_256x128x128x128_16x16_32x32_2x2_8x32x1_8x32x1_1x32x1x8_8_1x1_intrawave_v3,972.19,783.4,0.0
gfx950,256,6818,2048,2048,ck,0,0,60.0023,a8w8_blockscale_1x128x128_256x128x128x128_16x16_32x32_2x2_8x32x1_8x32x1_1x32x1x8_8_1x1_intrawave_v3,953.19,768.04,0.0
gfx950,256,6830,2048,2048,ck,0,0,59.3815,a8w8_blockscale_1x128x128_256x128x128x128_16x16_32x32_2x2_8x32x1_8x32x1_1x32x1x8_8_1x1_intrawave_v3,964.85,777.31,0.0
gfx950,256,7001,2048,2048,ck,0,0,59.8127,a8w8_blockscale_1x128x128_256x128x128x128_16x16_32x32_2x2_8x32x1_8x32x1_1x32x1x8_8_1x1_intrawave_v3,981.88,789.27,0.0
gfx950,256,7025,2048,2048,ck,0,0,59.4919,a8w8_blockscale_1x128x128_256x128x128x128_16x16_32x32_2x2_8x32x1_8x32x1_1x32x1x8_8_1x1_intrawave_v3,990.55,796.01,0.0
gfx950,256,7121,2048,128,cktile,7,0,18.0812,a8w8_blockscale_cktile_32x128x128_1x4x1_16x16x64_intrawave_0x1x0_2,206.48,1678.05,0.0
gfx950,256,7121,2048,512,ck,18,0,26.7927,a8w8_blockscale_1x128x128_256x64x64x256_16x16_32x32_1x1_16x16x1_16x16x1_1x32x1x8_8_1x1_intrawave_v1,557.38,1263.86,0.0
gfx950,256,7121,2048,1024,ck,0,0,39.3557,a8w8_blockscale_1x128x128_256x128x128x128_16x16_32x32_2x2_8x32x1_8x32x1_1x32x1x8_8_1x1_intrawave_v3,758.92,979.7,0.0
gfx950,256,7121,2048,2048,ck,0,0,60.2027,a8w8_blockscale_1x128x128_256x128x128x128_16x16_32x32_2x2_8x32x1_8x32x1_1x32x1x8_8_1x1_intrawave_v3,992.24,796.4,0.0
gfx950,256,7121,2048,4096,ck,0,0,104.6095,a8w8_blockscale_1x128x128_256x128x128x128_16x16_32x32_2x2_8x32x1_8x32x1_1x32x1x8_8_1x1_intrawave_v3,1142.06,637.84,0.0
gfx950,256,7168,2048,512,ck,18,0,26.7376,a8w8_blockscale_1x128x128_256x64x64x256_16x16_32x32_1x1_16x16x1_16x16x1_1x32x1x8_8_1x1_intrawave_v1,562.22,1274.56,0.0
gfx950,256,7168,2048,4096,ck,0,0,102.2687,a8w8_blockscale_1x128x128_256x128x128x128_16x16_32x32_2x2_8x32x1_8x32x1_1x32x1x8_8_1x1_intrawave_v3,1175.91,656.2,0.0
gfx950,256,7169,2048,128,cktile,6,0,18.2248,a8w8_blockscale_cktile_32x128x128_1x4x1_16x16x64_intrawave_0x1x0_1,206.24,1675.96,0.0
gfx950,256,7169,2048,512,ck,18,0,28.1128,a8w8_blockscale_1x128x128_256x64x64x256_16x16_32x32_1x1_16x16x1_16x16x1_1x32x1x8_8_1x1_intrawave_v1,534.79,1212.38,0.0
gfx950,256,7169,2048,1024,ck,0,0,39.2656,a8w8_blockscale_1x128x128_256x128x128x128_16x16_32x32_2x2_8x32x1_8x32x1_1x32x1x8_8_1x1_intrawave_v3,765.78,988.2,0.0
gfx950,256,7169,2048,2048,ck,0,0,60.3125,a8w8_blockscale_1x128x128_256x128x128x128_16x16_32x32_2x2_8x32x1_8x32x1_1x32x1x8_8_1x1_intrawave_v3,997.11,799.84,0.0
gfx950,256,7169,2048,4096,ck,0,0,105.5216,a8w8_blockscale_1x128x128_256x128x128x128_16x16_32x32_2x2_8x32x1_8x32x1_1x32x1x8_8_1x1_intrawave_v3,1139.82,636.05,0.0
gfx950,256,7170,2048,128,cktile,19,0,18.1554,a8w8_blockscale_cktile_32x128x128_1x4x1_16x16x64_intrawave_0x1x0_3,207.05,1682.6,0.0
gfx950,256,7170,2048,1024,ck,0,0,39.4278,a8w8_blockscale_1x128x128_256x128x128x128_16x16_32x32_2x2_8x32x1_8x32x1_1x32x1x8_8_1x1_intrawave_v3,762.74,984.27,0.0
gfx950,256,7172,2048,512,ck,18,0,28.072,a8w8_blockscale_1x128x128_256x64x64x256_16x16_32x32_1x1_16x16x1_16x16x1_1x32x1x8_8_1x1_intrawave_v1,535.79,1214.63,0.0
gfx950,256,7172,2048,4096,ck,0,0,104.2444,a8w8_blockscale_1x128x128_256x128x128x128_16x16_32x32_2x2_8x32x1_8x32x1_1x32x1x8_8_1x1_intrawave_v3,1154.27,644.08,0.0
gfx950,256,7176,2048,128,cktile,19,0,18.1987,a8w8_blockscale_cktile_32x128x128_1x4x1_16x16x64_intrawave_0x1x0_3,206.73,1679.99,0.0
gfx950,256,7176,2048,512,ck,18,0,27.9024,a8w8_blockscale_1x128x128_256x64x64x256_16x16_32x32_1x1_16x16x1_16x16x1_1x32x1x8_8_1x1_intrawave_v1,539.35,1222.68,0.0
gfx950,256,7176,2048,1024,ck,0,0,39.1867,a8w8_blockscale_1x128x128_256x128x128x128_16x16_32x32_2x2_8x32x1_8x32x1_1x32x1x8_8_1x1_intrawave_v3,768.08,991.11,0.0
gfx950,256,7176,2048,4096,ck,0,0,105.6936,a8w8_blockscale_1x128x128_256x128x128x128_16x16_32x32_2x2_8x32x1_8x32x1_1x32x1x8_8_1x1_intrawave_v3,1139.08,635.56,0.0
gfx950,256,7177,2048,128,cktile,20,0,18.1774,a8w8_blockscale_cktile_32x128x128_1x4x1_16x16x64_intrawave_0x1x0_4,207.01,1682.19,0.0
gfx950,256,7177,2048,512,ck,0,0,28.1975,a8w8_blockscale_1x128x128_256x128x128x128_16x16_32x32_2x2_8x32x1_8x32x1_1x32x1x8_8_1x1_intrawave_v3,533.78,1210.04,0.0
gfx950,256,7177,2048,1024,ck,0,0,38.9082,a8w8_blockscale_1x128x128_256x128x128x128_16x16_32x32_2x2_8x32x1_8x32x1_1x32x1x8_8_1x1_intrawave_v3,773.68,998.33,0.0
gfx950,256,7177,2048,2048,ck,0,0,60.8254,a8w8_blockscale_1x128x128_256x128x128x128_16x16_32x32_2x2_8x32x1_8x32x1_1x32x1x8_8_1x1_intrawave_v3,989.8,793.91,0.0
gfx950,256,7177,2048,4096,ck,0,0,105.9604,a8w8_blockscale_1x128x128_256x128x128x128_16x16_32x32_2x2_8x32x1_8x32x1_1x32x1x8_8_1x1_intrawave_v3,1136.37,634.03,0.0
gfx950,256,7178,2048,512,ck,18,0,27.8668,a8w8_blockscale_1x128x128_256x64x64x256_16x16_32x32_1x1_16x16x1_16x16x1_1x32x1x8_8_1x1_intrawave_v1,540.19,1224.57,0.0
gfx950,256,7178,2048,4096,ck,0,0,105.9377,a8w8_blockscale_1x128x128_256x128x128x128_16x16_32x32_2x2_8x32x1_8x32x1_1x32x1x8_8_1x1_intrawave_v3,1136.77,634.25,0.0
gfx950,256,7179,2048,512,ck,18,0,28.004,a8w8_blockscale_1x128x128_256x64x64x256_16x16_32x32_1x1_16x16x1_16x16x1_1x32x1x8_8_1x1_intrawave_v1,537.62,1218.73,0.0
gfx950,256,7179,2048,4096,ck,0,0,104.8177,a8w8_blockscale_1x128x128_256x128x128x128_16x16_32x32_2x2_8x32x1_8x32x1_1x32x1x8_8_1x1_intrawave_v3,1149.08,641.1,0.0
gfx950,256,7183,2048,512,ck,0,0,27.8558,a8w8_blockscale_1x128x128_256x128x128x128_16x16_32x32_2x2_8x32x1_8x32x1_1x32x1x8_8_1x1_intrawave_v3,540.78,1225.88,0.0
gfx950,256,7183,2048,4096,ck,0,0,105.5697,a8w8_blockscale_1x128x128_256x128x128x128_16x16_32x32_2x2_8x32x1_8x32x1_1x32x1x8_8_1x1_intrawave_v3,1141.53,636.85,0.0
gfx950,256,7184,2048,512,ck,18,0,27.9688,a8w8_blockscale_1x128x128_256x64x64x256_16x16_32x32_1x1_16x16x1_16x16x1_1x32x1x8_8_1x1_intrawave_v1,538.67,1221.09,0.0
gfx950,256,7184,2048,4096,ck,0,0,104.8921,a8w8_blockscale_1x128x128_256x128x128x128_16x16_32x32_2x2_8x32x1_8x32x1_1x32x1x8_8_1x1_intrawave_v3,1149.06,641.04,0.0
gfx950,256,7185,2048,128,cktile,7,0,18.2539,a8w8_blockscale_cktile_32x128x128_1x4x1_16x16x64_intrawave_0x1x0_2,206.37,1676.99,0.0
gfx950,256,7185,2048,1024,ck,0,0,39.1134,a8w8_blockscale_1x128x128_256x128x128x128_16x16_32x32_2x2_8x32x1_8x32x1_1x32x1x8_8_1x1_intrawave_v3,770.48,994.14,0.0
gfx950,256,7206,2048,128,cktile,7,0,18.2282,a8w8_blockscale_cktile_32x128x128_1x4x1_16x16x64_intrawave_0x1x0_2,207.26,1684.22,0.0
gfx950,256,7206,2048,1024,ck,0,0,39.4453,a8w8_blockscale_1x128x128_256x128x128x128_16x16_32x32_2x2_8x32x1_8x32x1_1x32x1x8_8_1x1_intrawave_v3,766.23,988.5,0.0
gfx950,256,7209,2048,512,ck,18,0,27.7406,a8w8_blockscale_1x128x128_256x64x64x256_16x16_32x32_1x1_16x16x1_16x16x1_1x32x1x8_8_1x1_intrawave_v1,544.99,1235.29,0.0
gfx950,256,7209,2048,4096,ck,0,0,105.7793,a8w8_blockscale_1x128x128_256x128x128x128_16x16_32x32_2x2_8x32x1_8x32x1_1x32x1x8_8_1x1_intrawave_v3,1143.39,637.6,0.0
gfx950,256,7210,2048,512,ck,18,0,28.1672,a8w8_blockscale_1x128x128_256x64x64x256_16x16_32x32_1x1_16x16x1_16x16x1_1x32x1x8_8_1x1_intrawave_v1,536.81,1216.74,0.0
gfx950,256,7210,2048,4096,ck,0,0,105.4765,a8w8_blockscale_1x128x128_256x128x128x128_16x16_32x32_2x2_8x32x1_8x32x1_1x32x1x8_8_1x1_intrawave_v3,1146.83,639.51,0.0
gfx950,256,7211,2048,512,ck,18,0,28.0061,a8w8_blockscale_1x128x128_256x64x64x256_16x16_32x32_1x1_16x16x1_16x16x1_1x32x1x8_8_1x1_intrawave_v1,539.97,1223.91,0.0
gfx950,256,7211,2048,4096,ck,0,0,105.6689,a8w8_blockscale_1x128x128_256x128x128x128_16x16_32x32_2x2_8x32x1_8x32x1_1x32x1x8_8_1x1_intrawave_v3,1144.9,638.42,0.0
gfx950,256,7217,2048,128,cktile,7,0,18.2628,a8w8_blockscale_cktile_32x128x128_1x4x1_16x16x64_intrawave_0x1x0_2,207.19,1683.57,0.0
gfx950,256,7217,2048,512,ck,0,0,28.1953,a8w8_blockscale_1x128x128_256x128x128x128_16x16_32x32_2x2_8x32x1_8x32x1_1x32x1x8_8_1x1_intrawave_v3,536.8,1216.67,0.0
gfx950,256,7217,2048,1024,ck,0,0,39.0005,a8w8_blockscale_1x128x128_256x128x128x128_16x16_32x32_2x2_8x32x1_8x32x1_1x32x1x8_8_1x1_intrawave_v3,776.15,1001.22,0.0
gfx950,256,7217,2048,2048,ck,0,0,61.2926,a8w8_blockscale_1x128x128_256x128x128x128_16x16_32x32_2x2_8x32x1_8x32x1_1x32x1x8_8_1x1_intrawave_v3,987.73,791.87,0.0
gfx950,256,7217,2048,4096,ck,0,0,104.3465,a8w8_blockscale_1x128x128_256x128x128x128_16x16_32x32_2x2_8x32x1_8x32x1_1x32x1x8_8_1x1_intrawave_v3,1160.38,646.98,0.0
gfx950,256,7223,2048,2048,ck,0,0,60.8107,a8w8_blockscale_1x128x128_256x128x128x128_16x16_32x32_2x2_8x32x1_8x32x1_1x32x1x8_8_1x1_intrawave_v3,996.39,798.75,0.0
gfx950,256,7238,2048,2048,ck,0,0,60.4754,a8w8_blockscale_1x128x128_256x128x128x128_16x16_32x32_2x2_8x32x1_8x32x1_1x32x1x8_8_1x1_intrawave_v3,1003.99,804.7,0.0
gfx950,256,7246,2048,2048,ck,0,0,60.2239,a8w8_blockscale_1x128x128_256x128x128x128_16x16_32x32_2x2_8x32x1_8x32x1_1x32x1x8_8_1x1_intrawave_v3,1009.3,808.88,0.0
gfx950,256,7249,2048,2048,ck,0,0,60.7059,a8w8_blockscale_1x128x128_256x128x128x128_16x16_32x32_2x2_8x32x1_8x32x1_1x32x1x8_8_1x1_intrawave_v3,1001.7,802.76,0.0
gfx950,256,7257,2048,128,cktile,7,0,18.2852,a8w8_blockscale_cktile_32x128x128_1x4x1_16x16x64_intrawave_0x1x0_2,208.08,1690.75,0.0
gfx950,256,7257,2048,1024,ck,0,0,39.2481,a8w8_blockscale_1x128x128_256x128x128x128_16x16_32x32_2x2_8x32x1_8x32x1_1x32x1x8_8_1x1_intrawave_v3,775.53,1000.12,0.0
gfx950,256,7265,2048,128,cktile,6,0,18.2351,a8w8_blockscale_cktile_32x128x128_1x4x1_16x16x64_intrawave_0x1x0_1,208.88,1697.25,0.0
gfx950,256,7265,2048,1024,ck,0,0,39.0553,a8w8_blockscale_1x128x128_256x128x128x128_16x16_32x32_2x2_8x32x1_8x32x1_1x32x1x8_8_1x1_intrawave_v3,780.22,1006.11,0.0
gfx950,256,7273,2048,512,ck,18,0,27.9923,a8w8_blockscale_1x128x128_256x64x64x256_16x16_32x32_1x1_16x16x1_16x16x1_1x32x1x8_8_1x1_intrawave_v1,544.89,1234.72,0.0
gfx950,256,7273,2048,4096,ck,0,0,107.5254,a8w8_blockscale_1x128x128_256x128x128x128_16x16_32x32_2x2_8x32x1_8x32x1_1x32x1x8_8_1x1_intrawave_v3,1134.81,632.12,0.0
gfx950,256,7274,2048,512,ck,18,0,28.1412,a8w8_blockscale_1x128x128_256x64x64x256_16x16_32x32_1x1_16x16x1_16x16x1_1x32x1x8_8_1x1_intrawave_v1,542.08,1228.35,0.0
gfx950,256,7274,2048,4096,ck,0,0,104.947,a8w8_blockscale_1x128x128_256x128x128x128_16x16_32x32_2x2_8x32x1_8x32x1_1x32x1x8_8_1x1_intrawave_v3,1162.85,647.73,0.0
gfx950,256,7316,2048,2048,ck,0,0,60.3891,a8w8_blockscale_1x128x128_256x128x128x128_16x16_32x32_2x2_8x32x1_8x32x1_1x32x1x8_8_1x1_intrawave_v3,1016.26,813.79,0.0
gfx950,256,7391,2048,512,ck,0,0,28.3506,a8w8_blockscale_1x128x128_256x128x128x128_16x16_32x32_2x2_8x32x1_8x32x1_1x32x1x8_8_1x1_intrawave_v3,546.73,1238.29,0.0
gfx950,256,7391,2048,4096,ck,0,0,106.275,a8w8_blockscale_1x128x128_256x128x128x128_16x16_32x32_2x2_8x32x1_8x32x1_1x32x1x8_8_1x1_intrawave_v3,1166.79,648.65,0.0
gfx950,256,7393,2048,128,cktile,20,0,18.3695,a8w8_blockscale_cktile_32x128x128_1x4x1_16x16x64_intrawave_0x1x0_4,211.01,1714.26,0.0
gfx950,256,7393,2048,512,ck,18,0,28.6184,a8w8_blockscale_1x128x128_256x64x64x256_16x16_32x32_1x1_16x16x1_16x16x1_1x32x1x8_8_1x1_intrawave_v1,541.76,1227.03,0.0
gfx950,256,7393,2048,1024,ck,0,0,39.5241,a8w8_blockscale_1x128x128_256x128x128x128_16x16_32x32_2x2_8x32x1_8x32x1_1x32x1x8_8_1x1_intrawave_v3,784.55,1010.76,0.0
gfx950,256,7393,2048,2048,ck,0,0,61.4671,a8w8_blockscale_1x128x128_256x128x128x128_16x16_32x32_2x2_8x32x1_8x32x1_1x32x1x8_8_1x1_intrawave_v3,1008.95,807.21,0.0
gfx950,256,7393,2048,4096,ck,0,0,104.2778,a8w8_blockscale_1x128x128_256x128x128x128_16x16_32x32_2x2_8x32x1_8x32x1_1x32x1x8_8_1x1_intrawave_v3,1189.46,661.23,0.0
gfx950,256,7461,2048,128,cktile,19,0,18.4218,a8w8_blockscale_cktile_32x128x128_1x4x1_16x16x64_intrawave_0x1x0_3,212.34,1724.99,0.0
gfx950,256,7461,2048,1024,ck,0,0,39.6618,a8w8_blockscale_1x128x128_256x128x128x128_16x16_32x32_2x2_8x32x1_8x32x1_1x32x1x8_8_1x1_intrawave_v3,789.01,1016.03,0.0
gfx950,256,7491,2048,2048,ck,0,0,60.7595,a8w8_blockscale_1x128x128_256x128x128x128_16x16_32x32_2x2_8x32x1_8x32x1_1x32x1x8_8_1x1_intrawave_v3,1034.23,826.52,0.0
gfx950,256,7558,2048,2048,ck,0,0,62.0659,a8w8_blockscale_1x128x128_256x128x128x128_16x16_32x32_2x2_8x32x1_8x32x1_1x32x1x8_8_1x1_intrawave_v3,1021.51,815.76,0.0
gfx950,256,7634,2048,128,cktile,10,0,18.4442,a8w8_blockscale_cktile_128x128x128_2x2x1_16x16x128_intrawave_0x1x0_2,217.0,1762.51,0.0
gfx950,256,7634,2048,1024,ck,0,0,39.4317,a8w8_blockscale_1x128x128_256x128x128x128_16x16_32x32_2x2_8x32x1_8x32x1_1x32x1x8_8_1x1_intrawave_v3,812.02,1044.42,0.0
gfx950,256,7650,2048,2048,ck,0,0,61.1251,a8w8_blockscale_1x128x128_256x128x128x128_16x16_32x32_2x2_8x32x1_8x32x1_1x32x1x8_8_1x1_intrawave_v3,1049.86,837.56,0.0
gfx950,256,7715,2048,512,ck,0,0,28.6077,a8w8_blockscale_1x128x128_256x128x128x128_16x16_32x32_2x2_8x32x1_8x32x1_1x32x1x8_8_1x1_intrawave_v3,565.57,1279.35,0.0
gfx950,256,7715,2048,4096,ck,0,0,108.6967,a8w8_blockscale_1x128x128_256x128x128x128_16x16_32x32_2x2_8x32x1_8x32x1_1x32x1x8_8_1x1_intrawave_v3,1190.8,658.62,0.0
gfx950,256,7753,2048,512,ck,0,0,28.6716,a8w8_blockscale_1x128x128_256x128x128x128_16x16_32x32_2x2_8x32x1_8x32x1_1x32x1x8_8_1x1_intrawave_v3,567.08,1282.61,0.0
gfx950,256,7753,2048,2048,ck,0,0,62.4976,a8w8_blockscale_1x128x128_256x128x128x128_16x16_32x32_2x2_8x32x1_8x32x1_1x32x1x8_8_1x1_intrawave_v3,1040.63,829.29,0.0
gfx950,256,7753,2048,4096,ck,0,0,109.1364,a8w8_blockscale_1x128x128_256x128x128x128_16x16_32x32_2x2_8x32x1_8x32x1_1x32x1x8_8_1x1_intrawave_v3,1191.85,658.82,0.0
gfx950,256,7774,2048,2048,ck,0,0,61.9552,a8w8_blockscale_1x128x128_256x128x128x128_16x16_32x32_2x2_8x32x1_8x32x1_1x32x1x8_8_1x1_intrawave_v3,1052.58,838.63,0.0
gfx950,256,7815,2048,2048,ck,0,0,61.7436,a8w8_blockscale_1x128x128_256x128x128x128_16x16_32x32_2x2_8x32x1_8x32x1_1x32x1x8_8_1x1_intrawave_v3,1061.76,845.59,0.0
gfx950,256,7819,2048,512,ck,0,0,28.5876,a8w8_blockscale_1x128x128_256x128x128x128_16x16_32x32_2x2_8x32x1_8x32x1_1x32x1x8_8_1x1_intrawave_v3,573.59,1297.01,0.0
gfx950,256,7819,2048,4096,ck,0,0,108.7384,a8w8_blockscale_1x128x128_256x128x128x128_16x16_32x32_2x2_8x32x1_8x32x1_1x32x1x8_8_1x1_intrawave_v3,1206.39,666.2,0.0
gfx950,256,7834,2048,2048,ck,0,0,62.4948,a8w8_blockscale_1x128x128_256x128x128x128_16x16_32x32_2x2_8x32x1_8x32x1_1x32x1x8_8_1x1_intrawave_v3,1051.55,837.29,0.0
gfx950,256,7836,2048,2048,ck,0,0,61.7956,a8w8_blockscale_1x128x128_256x128x128x128_16x16_32x32_2x2_8x32x1_8x32x1_1x32x1x8_8_1x1_intrawave_v3,1063.72,846.96,0.0
gfx950,256,7871,2048,2048,ck,0,0,61.688,a8w8_blockscale_1x128x128_256x128x128x128_16x16_32x32_2x2_8x32x1_8x32x1_1x32x1x8_8_1x1_intrawave_v3,1070.33,851.93,0.0
gfx950,256,7899,2048,2048,ck,0,0,62.48,a8w8_blockscale_1x128x128_256x128x128x128_16x16_32x32_2x2_8x32x1_8x32x1_1x32x1x8_8_1x1_intrawave_v3,1060.53,843.88,0.0
gfx950,256,7913,2048,2048,ck,0,0,61.7108,a8w8_blockscale_1x128x128_256x128x128x128_16x16_32x32_2x2_8x32x1_8x32x1_1x32x1x8_8_1x1_intrawave_v3,1075.65,855.79,0.0
gfx950,256,7930,2048,2048,ck,0,0,62.4132,a8w8_blockscale_1x128x128_256x128x128x128_16x16_32x32_2x2_8x32x1_8x32x1_1x32x1x8_8_1x1_intrawave_v3,1065.83,847.84,0.0
gfx950,256,7961,2048,2048,ck,0,0,63.2516,a8w8_blockscale_1x128x128_256x128x128x128_16x16_32x32_2x2_8x32x1_8x32x1_1x32x1x8_8_1x1_intrawave_v3,1055.81,839.61,0.0
gfx950,256,7963,2048,2048,ck,0,0,63.3724,a8w8_blockscale_1x128x128_256x128x128x128_16x16_32x32_2x2_8x32x1_8x32x1_1x32x1x8_8_1x1_intrawave_v3,1054.06,838.2,0.0
gfx950,256,7974,2048,2048,ck,0,0,63.9584,a8w8_blockscale_1x128x128_256x128x128x128_16x16_32x32_2x2_8x32x1_8x32x1_1x32x1x8_8_1x1_intrawave_v3,1045.85,831.58,0.0
gfx950,256,8016,2048,2048,ck,0,0,63.1496,a8w8_blockscale_1x128x128_256x128x128x128_16x16_32x32_2x2_8x32x1_8x32x1_1x32x1x8_8_1x1_intrawave_v3,1064.82,846.32,0.0
gfx950,256,8017,2048,2048,ck,0,0,63.5772,a8w8_blockscale_1x128x128_256x128x128x128_16x16_32x32_2x2_8x32x1_8x32x1_1x32x1x8_8_1x1_intrawave_v3,1057.79,840.72,0.0
gfx950,256,8099,2048,512,ck,0,0,29.6522,a8w8_blockscale_1x128x128_256x128x128x128_16x16_32x32_2x2_8x32x1_8x32x1_1x32x1x8_8_1x1_intrawave_v3,572.8,1293.96,0.0
gfx950,256,8099,2048,4096,ck,0,0,110.7685,a8w8_blockscale_1x128x128_256x128x128x128_16x16_32x32_2x2_8x32x1_8x32x1_1x32x1x8_8_1x1_intrawave_v3,1226.69,674.7,0.0
gfx950,256,8103,2048,2048,ck,0,0,64.9912,a8w8_blockscale_1x128x128_256x128x128x128_16x16_32x32_2x2_8x32x1_8x32x1_1x32x1x8_8_1x1_intrawave_v3,1045.88,830.56,0.0
gfx950,256,8128,2048,2048,ck,0,0,63.7684,a8w8_blockscale_1x128x128_256x128x128x128_16x16_32x32_2x2_8x32x1_8x32x1_1x32x1x8_8_1x1_intrawave_v3,1069.22,848.9,0.0
gfx950,256,8129,2048,128,cktile,26,0,18.6432,a8w8_blockscale_cktile_128x128x128_2x2x1_16x16x128_intrawave_0x1x0_4,228.61,1855.85,0.0
gfx950,256,8129,2048,512,ck,0,0,29.7984,a8w8_blockscale_1x128x128_256x128x128x128_16x16_32x32_2x2_8x32x1_8x32x1_1x32x1x8_8_1x1_intrawave_v3,572.1,1292.25,0.0
gfx950,256,8129,2048,1024,ck,0,0,41.547,a8w8_blockscale_1x128x128_256x128x128x128_16x16_32x32_2x2_8x32x1_8x32x1_1x32x1x8_8_1x1_intrawave_v3,820.65,1052.25,0.0
gfx950,256,8129,2048,2048,ck,0,0,64.2288,a8w8_blockscale_1x128x128_256x128x128x128_16x16_32x32_2x2_8x32x1_8x32x1_1x32x1x8_8_1x1_intrawave_v3,1061.69,842.91,0.0
gfx950,256,8129,2048,4096,ck,0,0,111.2916,a8w8_blockscale_1x128x128_256x128x128x128_16x16_32x32_2x2_8x32x1_8x32x1_1x32x1x8_8_1x1_intrawave_v3,1225.45,673.74,0.0
gfx950,256,8150,2048,2048,ck,0,0,64.47,a8w8_blockscale_1x128x128_256x128x128x128_16x16_32x32_2x2_8x32x1_8x32x1_1x32x1x8_8_1x1_intrawave_v3,1060.45,841.75,0.0
gfx950,256,8184,2048,2048,ck,0,0,63.8003,a8w8_blockscale_1x128x128_256x128x128x128_16x16_32x32_2x2_8x32x1_8x32x1_1x32x1x8_8_1x1_intrawave_v3,1076.05,853.86,0.0
gfx950,256,8185,2048,2048,ck,0,0,64.74,a8w8_blockscale_1x128x128_256x128x128x128_16x16_32x32_2x2_8x32x1_8x32x1_1x32x1x8_8_1x1_intrawave_v3,1060.56,841.57,0.0
gfx950,256,8188,2048,512,ck,0,0,29.7506,a8w8_blockscale_1x128x128_256x128x128x128_16x16_32x32_2x2_8x32x1_8x32x1_1x32x1x8_8_1x1_intrawave_v3,577.18,1303.47,0.0
gfx950,256,8188,2048,4096,ck,0,0,111.9031,a8w8_blockscale_1x128x128_256x128x128x128_16x16_32x32_2x2_8x32x1_8x32x1_1x32x1x8_8_1x1_intrawave_v3,1227.6,674.38,0.0
gfx950,256,8192,2048,128,cktile,25,0,18.6204,a8w8_blockscale_cktile_128x128x128_2x2x1_16x16x128_intrawave_0x1x0_3,230.66,1872.42,0.0
gfx950,256,8192,2048,512,ck,0,0,29.4494,a8w8_blockscale_1x128x128_256x128x128x128_16x16_32x32_2x2_8x32x1_8x32x1_1x32x1x8_8_1x1_intrawave_v3,583.37,1317.42,0.0
gfx950,256,8192,2048,1024,ck,0,0,40.6381,a8w8_blockscale_1x128x128_256x128x128x128_16x16_32x32_2x2_8x32x1_8x32x1_1x32x1x8_8_1x1_intrawave_v3,845.51,1083.72,0.0
gfx950,256,8192,2048,2048,ck,0,0,63.3251,a8w8_blockscale_1x128x128_256x128x128x128_16x16_32x32_2x2_8x32x1_8x32x1_1x32x1x8_8_1x1_intrawave_v3,1085.19,861.05,0.0
gfx950,256,8192,2048,4096,ck,0,0,108.3607,a8w8_blockscale_1x128x128_256x128x128x128_16x16_32x32_2x2_8x32x1_8x32x1_1x32x1x8_8_1x1_intrawave_v3,1268.35,696.72,0.0
gfx950,256,1,2560,2048,ck,8,2,6.2595,a8w8_blockscale_1x128x128_256x16x64x256_16x16_16x16_1x1_16x16x1_16x16x1_1x16x1x16_4_1x1_intrawave_v1,1.68,838.73,0.0
gfx950,256,2,2560,2048,ck,8,3,6.2748,a8w8_blockscale_1x128x128_256x16x64x256_16x16_16x16_1x1_16x16x1_16x16x1_1x16x1x16_4_1x1_intrawave_v1,3.34,837.83,0.0
gfx950,256,4,2560,2048,ck,8,3,6.6483,a8w8_blockscale_1x128x128_256x16x64x256_16x16_16x16_1x1_16x16x1_16x16x1_1x16x1x16_4_1x1_intrawave_v1,6.31,792.92,0.0
gfx950,256,8,2560,2048,ck,8,2,6.8899,a8w8_blockscale_1x128x128_256x16x64x256_16x16_16x16_1x1_16x16x1_16x16x1_1x16x1x16_4_1x1_intrawave_v1,12.18,769.27,0.0
gfx950,256,16,2560,2048,ck,8,2,7.0825,a8w8_blockscale_1x128x128_256x16x64x256_16x16_16x16_1x1_16x16x1_16x16x1_1x16x1x16_4_1x1_intrawave_v1,23.69,756.45,0.0
gfx950,256,32,2560,2048,ck,8,3,7.7553,a8w8_blockscale_1x128x128_256x16x64x256_16x16_16x16_1x1_16x16x1_16x16x1_1x16x1x16_4_1x1_intrawave_v1,43.27,705.61,0.0
gfx950,256,48,2560,2048,ck,8,2,8.0392,a8w8_blockscale_1x128x128_256x16x64x256_16x16_16x16_1x1_16x16x1_16x16x1_1x16x1x16_4_1x1_intrawave_v1,62.61,694.96,0.0
gfx950,256,64,2560,2048,ck,8,0,8.5954,a8w8_blockscale_1x128x128_256x16x64x256_16x16_16x16_1x1_16x16x1_16x16x1_1x16x1x16_4_1x1_intrawave_v1,78.08,663.34,0.0
gfx950,256,80,2560,2048,ck,8,0,8.5765,a8w8_blockscale_1x128x128_256x16x64x256_16x16_16x16_1x1_16x16x1_16x16x1_1x16x1x16_4_1x1_intrawave_v1,97.81,678.17,0.0
gfx950,256,96,2560,2048,ck,8,0,8.2734,a8w8_blockscale_1x128x128_256x16x64x256_16x16_16x16_1x1_16x16x1_16x16x1_1x16x1x16_4_1x1_intrawave_v1,121.67,716.88,0.0
gfx950,256,112,2560,2048,ck,7,0,9.9327,a8w8_blockscale_1x128x128_256x16x128x256_16x16_16x16_1x2_16x16x1_16x16x1_1x16x1x16_8_1x2_intrawave_v1,118.24,608.67,0.0
gfx950,256,128,2560,2048,ck,7,0,9.919,a8w8_blockscale_1x128x128_256x16x128x256_16x16_16x16_1x2_16x16x1_16x16x1_1x16x1x16_8_1x2_intrawave_v1,135.31,621.07,0.0
gfx950,256,256,2560,2048,ck,18,0,9.8047,a8w8_blockscale_1x128x128_256x64x64x256_16x16_32x32_1x1_16x16x1_16x16x1_1x32x1x8_8_1x1_intrawave_v1,273.78,721.89,0.0
gfx950,256,512,2560,2048,ck,2,0,14.9962,a8w8_blockscale_1x128x128_256x64x128x128_16x16_32x32_1x2_8x32x1_8x32x1_1x32x1x8_8_1x1_intrawave_v3,358.0,594.34,0.0
gfx950,256,588,2560,2048,ck,2,0,15.2743,a8w8_blockscale_1x128x128_256x64x128x128_16x16_32x32_1x2_8x32x1_8x32x1_1x32x1x8_8_1x1_intrawave_v3,403.66,619.19,0.0
gfx950,256,773,2560,2048,ck,3,0,18.6898,a8w8_blockscale_1x128x128_256x64x64x128_16x16_32x32_1x1_8x32x1_8x32x1_1x32x1x8_8_1x1_intrawave_v3,433.69,576.99,0.0
gfx950,256,822,2560,2048,ck,3,0,18.6571,a8w8_blockscale_1x128x128_256x64x64x128_16x16_32x32_1x1_8x32x1_8x32x1_1x32x1x8_8_1x1_intrawave_v3,461.98,596.82,0.0
gfx950,256,1024,2560,2048,ck,0,0,19.2318,a8w8_blockscale_1x128x128_256x128x128x128_16x16_32x32_2x2_8x32x1_8x32x1_1x32x1x8_8_1x1_intrawave_v3,558.32,654.28,0.0
gfx950,256,1025,2560,2048,ck,0,0,20.1839,a8w8_blockscale_1x128x128_256x128x128x128_16x16_32x32_2x2_8x32x1_8x32x1_1x32x1x8_8_1x1_intrawave_v3,532.5,623.77,0.0
gfx950,256,1027,2560,2048,ck,0,0,20.0204,a8w8_blockscale_1x128x128_256x128x128x128_16x16_32x32_2x2_8x32x1_8x32x1_1x32x1x8_8_1x1_intrawave_v3,537.9,629.58,0.0
gfx950,256,1042,2560,2048,ck,0,0,20.1333,a8w8_blockscale_1x128x128_256x128x128x128_16x16_32x32_2x2_8x32x1_8x32x1_1x32x1x8_8_1x1_intrawave_v3,542.69,631.39,0.0
gfx950,256,1051,2560,2048,ck,0,0,20.0161,a8w8_blockscale_1x128x128_256x128x128x128_16x16_32x32_2x2_8x32x1_8x32x1_1x32x1x8_8_1x1_intrawave_v3,550.58,638.31,0.0
gfx950,256,1055,2560,2048,ck,0,0,20.1406,a8w8_blockscale_1x128x128_256x128x128x128_16x16_32x32_2x2_8x32x1_8x32x1_1x32x1x8_8_1x1_intrawave_v3,549.26,635.79,0.0
gfx950,256,1057,2560,2048,ck,0,0,20.1916,a8w8_blockscale_1x128x128_256x128x128x128_16x16_32x32_2x2_8x32x1_8x32x1_1x32x1x8_8_1x1_intrawave_v3,548.91,634.89,0.0
gfx950,256,1069,2560,2048,ck,0,0,20.2273,a8w8_blockscale_1x128x128_256x128x128x128_16x16_32x32_2x2_8x32x1_8x32x1_1x32x1x8_8_1x1_intrawave_v3,554.17,638.02,0.0
gfx950,256,1072,2560,2048,ck,0,0,20.1992,a8w8_blockscale_1x128x128_256x128x128x128_16x16_32x32_2x2_8x32x1_8x32x1_1x32x1x8_8_1x1_intrawave_v3,556.49,639.97,0.0
gfx950,256,1074,2560,2048,ck,0,0,20.2086,a8w8_blockscale_1x128x128_256x128x128x128_16x16_32x32_2x2_8x32x1_8x32x1_1x32x1x8_8_1x1_intrawave_v3,557.27,640.39,0.0
gfx950,256,1091,2560,2048,ck,0,0,20.1834,a8w8_blockscale_1x128x128_256x128x128x128_16x16_32x32_2x2_8x32x1_8x32x1_1x32x1x8_8_1x1_intrawave_v3,566.8,647.22,0.0
gfx950,256,1128,2560,2048,ck,2,0,20.3205,a8w8_blockscale_1x128x128_256x64x128x128_16x16_32x32_1x2_8x32x1_8x32x1_1x32x1x8_8_1x1_intrawave_v3,582.07,655.91,0.0
gfx950,256,1136,2560,2048,ck,3,0,20.36,a8w8_blockscale_1x128x128_256x64x64x128_16x16_32x32_1x1_8x32x1_8x32x1_1x32x1x8_8_1x1_intrawave_v3,585.06,657.45,0.0
gfx950,256,1514,2560,2048,ck,0,0,21.0928,a8w8_blockscale_1x128x128_256x128x128x128_16x16_32x32_2x2_8x32x1_8x32x1_1x32x1x8_8_1x1_intrawave_v3,752.65,763.07,0.0
gfx950,256,2017,2560,2048,ck,2,0,30.0164,a8w8_blockscale_1x128x128_256x64x128x128_16x16_32x32_1x2_8x32x1_8x32x1_1x32x1x8_8_1x1_intrawave_v3,704.61,656.33,0.0
gfx950,256,2048,2560,2048,ck,2,0,29.6162,a8w8_blockscale_1x128x128_256x64x128x128_16x16_32x32_1x2_8x32x1_8x32x1_1x32x1x8_8_1x1_intrawave_v3,725.1,672.7,0.0
gfx950,256,2151,2560,2048,ck,2,0,29.944,a8w8_blockscale_1x128x128_256x64x128x128_16x16_32x32_1x2_8x32x1_8x32x1_1x32x1x8_8_1x1_intrawave_v3,753.24,690.0,0.0
gfx950,256,2332,2560,2048,ck,2,0,30.174,a8w8_blockscale_1x128x128_256x64x128x128_16x16_32x32_1x2_8x32x1_8x32x1_1x32x1x8_8_1x1_intrawave_v3,810.39,727.73,0.0
gfx950,256,2341,2560,2048,ck,2,0,30.5484,a8w8_blockscale_1x128x128_256x64x128x128_16x16_32x32_1x2_8x32x1_8x32x1_1x32x1x8_8_1x1_intrawave_v3,803.55,720.93,0.0
gfx950,256,3072,2560,2048,ck,0,0,32.915,a8w8_blockscale_1x128x128_256x128x128x128_16x16_32x32_2x2_8x32x1_8x32x1_1x32x1x8_8_1x1_intrawave_v3,978.65,828.28,0.0
gfx950,256,3073,2560,2048,ck,0,0,34.9774,a8w8_blockscale_1x128x128_256x128x128x128_16x16_32x32_2x2_8x32x1_8x32x1_1x32x1x8_8_1x1_intrawave_v3,921.24,779.65,0.0
gfx950,256,3089,2560,2048,ck,0,0,33.4773,a8w8_blockscale_1x128x128_256x128x128x128_16x16_32x32_2x2_8x32x1_8x32x1_1x32x1x8_8_1x1_intrawave_v3,967.54,818.01,0.0
gfx950,256,3110,2560,2048,ck,0,0,34.3253,a8w8_blockscale_1x128x128_256x128x128x128_16x16_32x32_2x2_8x32x1_8x32x1_1x32x1x8_8_1x1_intrawave_v3,950.05,802.19,0.0
gfx950,256,3137,2560,2048,ck,0,0,33.8313,a8w8_blockscale_1x128x128_256x128x128x128_16x16_32x32_2x2_8x32x1_8x32x1_1x32x1x8_8_1x1_intrawave_v3,972.29,819.62,0.0
gfx950,256,3613,2560,2048,cktile,32,0,40.624,a8w8_blockscale_cktile_192x256x128_4x2x1_16x16x128_intrawave_0x1x0_4_aqrm,932.58,766.56,0.0
gfx950,256,4096,2560,2048,cktile,30,0,41.2557,a8w8_blockscale_cktile_192x256x128_4x2x1_16x16x128_intrawave_0x1x0_2_aqrm,1041.06,838.74,0.0
gfx950,256,4097,2560,2048,cktile,30,0,41.3552,a8w8_blockscale_cktile_192x256x128_4x2x1_16x16x128_intrawave_0x1x0_2_aqrm,1038.81,836.9,0.0
gfx950,256,4109,2560,2048,cktile,31,0,41.2896,a8w8_blockscale_cktile_192x256x128_4x2x1_16x16x128_intrawave_0x1x0_3_aqrm,1043.51,840.31,0.0
gfx950,256,4143,2560,2048,cktile,12,0,41.389,a8w8_blockscale_cktile_192x256x128_4x2x1_16x16x128_intrawave_0x1x0_1_aqrm,1049.61,844.18,0.0
gfx950,256,4345,2560,2048,cktile,32,0,41.6851,a8w8_blockscale_cktile_192x256x128_4x2x1_16x16x128_intrawave_0x1x0_4_aqrm,1092.97,872.92,0.0
gfx950,256,4413,2560,2048,cktile,32,0,41.812,a8w8_blockscale_cktile_192x256x128_4x2x1_16x16x128_intrawave_0x1x0_4_aqrm,1106.71,881.93,0.0
gfx950,256,5121,2560,2048,ck,0,0,58.3907,a8w8_blockscale_1x128x128_256x128x128x128_16x16_32x32_2x2_8x32x1_8x32x1_1x32x1x8_8_1x1_intrawave_v3,919.63,718.44,0.0
gfx950,256,5123,2560,2048,ck,0,0,58.0935,a8w8_blockscale_1x128x128_256x128x128x128_16x16_32x32_2x2_8x32x1_8x32x1_1x32x1x8_8_1x1_intrawave_v3,924.69,722.36,0.0
gfx950,256,5133,2560,2048,ck,0,0,58.2587,a8w8_blockscale_1x128x128_256x128x128x128_16x16_32x32_2x2_8x32x1_8x32x1_1x32x1x8_8_1x1_intrawave_v3,923.87,721.54,0.0
gfx950,256,5185,2560,2048,ck,0,0,58.7822,a8w8_blockscale_1x128x128_256x128x128x128_16x16_32x32_2x2_8x32x1_8x32x1_1x32x1x8_8_1x1_intrawave_v3,924.92,721.46,0.0
gfx950,256,5191,2560,2048,ck,0,0,59.1186,a8w8_blockscale_1x128x128_256x128x128x128_16x16_32x32_2x2_8x32x1_8x32x1_1x32x1x8_8_1x1_intrawave_v3,920.72,718.08,0.0
gfx950,256,6146,2560,2048,ck,0,0,62.689,a8w8_blockscale_1x128x128_256x128x128x128_16x16_32x32_2x2_8x32x1_8x32x1_1x32x1x8_8_1x1_intrawave_v3,1028.02,786.38,0.0
gfx950,256,6147,2560,2048,ck,0,0,62.801,a8w8_blockscale_1x128x128_256x128x128x128_16x16_32x32_2x2_8x32x1_8x32x1_1x32x1x8_8_1x1_intrawave_v3,1026.35,785.09,0.0
gfx950,256,6155,2560,2048,ck,0,0,62.6518,a8w8_blockscale_1x128x128_256x128x128x128_16x16_32x32_2x2_8x32x1_8x32x1_1x32x1x8_8_1x1_intrawave_v3,1030.14,787.88,0.0
gfx950,256,6377,2560,2048,ck,0,0,62.432,a8w8_blockscale_1x128x128_256x128x128x128_16x16_32x32_2x2_8x32x1_8x32x1_1x32x1x8_8_1x1_intrawave_v3,1071.05,816.14,0.0
gfx950,256,6401,2560,2048,ck,0,0,63.784,a8w8_blockscale_1x128x128_256x128x128x128_16x16_32x32_2x2_8x32x1_8x32x1_1x32x1x8_8_1x1_intrawave_v3,1052.29,801.54,0.0
gfx950,256,7121,2560,2048,ck,0,0,72.64,a8w8_blockscale_1x128x128_256x128x128x128_16x16_32x32_2x2_8x32x1_8x32x1_1x32x1x8_8_1x1_intrawave_v3,1027.93,774.87,0.0
gfx950,256,7169,2560,2048,ck,0,0,72.847,a8w8_blockscale_1x128x128_256x128x128x128_16x16_32x32_2x2_8x32x1_8x32x1_1x32x1x8_8_1x1_intrawave_v3,1031.92,777.39,0.0
gfx950,256,7170,2560,2048,ck,0,0,73.3338,a8w8_blockscale_1x128x128_256x128x128x128_16x16_32x32_2x2_8x32x1_8x32x1_1x32x1x8_8_1x1_intrawave_v3,1025.21,772.32,0.0
gfx950,256,7176,2560,2048,ck,0,0,73.699,a8w8_blockscale_1x128x128_256x128x128x128_16x16_32x32_2x2_8x32x1_8x32x1_1x32x1x8_8_1x1_intrawave_v3,1020.99,769.08,0.0
gfx950,256,7177,2560,2048,ck,0,0,73.1647,a8w8_blockscale_1x128x128_256x128x128x128_16x16_32x32_2x2_8x32x1_8x32x1_1x32x1x8_8_1x1_intrawave_v3,1028.59,774.79,0.0
gfx950,256,7185,2560,2048,ck,0,0,73.2875,a8w8_blockscale_1x128x128_256x128x128x128_16x16_32x32_2x2_8x32x1_8x32x1_1x32x1x8_8_1x1_intrawave_v3,1028.01,774.28,0.0
gfx950,256,7206,2560,2048,ck,0,0,74.4999,a8w8_blockscale_1x128x128_256x128x128x128_16x16_32x32_2x2_8x32x1_8x32x1_1x32x1x8_8_1x1_intrawave_v3,1014.23,763.7,0.0
gfx950,256,7217,2560,2048,ck,0,0,73.4183,a8w8_blockscale_1x128x128_256x128x128x128_16x16_32x32_2x2_8x32x1_8x32x1_1x32x1x8_8_1x1_intrawave_v3,1030.75,776.02,0.0
gfx950,256,7257,2560,2048,ck,0,0,74.6868,a8w8_blockscale_1x128x128_256x128x128x128_16x16_32x32_2x2_8x32x1_8x32x1_1x32x1x8_8_1x1_intrawave_v3,1018.86,766.68,0.0
gfx950,256,7265,2560,2048,ck,0,0,73.5272,a8w8_blockscale_1x128x128_256x128x128x128_16x16_32x32_2x2_8x32x1_8x32x1_1x32x1x8_8_1x1_intrawave_v3,1036.07,779.55,0.0
gfx950,256,7393,2560,2048,ck,0,0,74.1444,a8w8_blockscale_1x128x128_256x128x128x128_16x16_32x32_2x2_8x32x1_8x32x1_1x32x1x8_8_1x1_intrawave_v3,1045.54,785.44,0.0
gfx950,256,7461,2560,2048,ck,0,0,74.2744,a8w8_blockscale_1x128x128_256x128x128x128_16x16_32x32_2x2_8x32x1_8x32x1_1x32x1x8_8_1x1_intrawave_v3,1053.31,790.63,0.0
gfx950,256,7634,2560,2048,ck,0,0,75.2188,a8w8_blockscale_1x128x128_256x128x128x128_16x16_32x32_2x2_8x32x1_8x32x1_1x32x1x8_8_1x1_intrawave_v3,1064.21,797.19,0.0
gfx950,256,8129,2560,2048,cktile,27,0,78.0657,a8w8_blockscale_cktile_192x256x128_4x2x1_16x16x128_intrawave_0x1x0_2,1091.88,813.57,0.0
gfx950,256,8192,2560,2048,ck,0,0,77.0048,a8w8_blockscale_1x128x128_256x128x128x128_16x16_32x32_2x2_8x32x1_8x32x1_1x32x1x8_8_1x1_intrawave_v3,1115.51,830.64,0.0
gfx950,256,1,3072,2048,ck,8,2,6.3471,a8w8_blockscale_1x128x128_256x16x64x256_16x16_16x16_1x1_16x16x1_16x16x1_1x16x1x16_4_1x1_intrawave_v1,1.98,992.52,0.0
gfx950,256,2,3072,2048,ck,8,2,6.3948,a8w8_blockscale_1x128x128_256x16x64x256_16x16_16x16_1x1_16x16x1_16x16x1_1x16x1x16_4_1x1_intrawave_v1,3.94,986.4,0.0
gfx950,256,4,3072,2048,ck,8,2,6.9834,a8w8_blockscale_1x128x128_256x16x64x256_16x16_16x16_1x1_16x16x1_16x16x1_1x16x1x16_4_1x1_intrawave_v1,7.21,905.61,0.0
gfx950,256,8,3072,2048,ck,8,2,6.9724,a8w8_blockscale_1x128x128_256x16x64x256_16x16_16x16_1x1_16x16x1_16x16x1_1x16x1x16_4_1x1_intrawave_v1,14.44,911.74,0.0
gfx950,256,16,3072,2048,ck,8,2,7.184,a8w8_blockscale_1x128x128_256x16x64x256_16x16_16x16_1x1_16x16x1_16x16x1_1x16x1x16_4_1x1_intrawave_v1,28.02,894.0,0.0
gfx950,256,32,3072,2048,ck,8,2,8.1303,a8w8_blockscale_1x128x128_256x16x64x256_16x16_16x16_1x1_16x16x1_16x16x1_1x16x1x16_4_1x1_intrawave_v1,49.53,806.07,0.0
gfx950,256,48,3072,2048,ck,8,0,8.692,a8w8_blockscale_1x128x128_256x16x64x256_16x16_16x16_1x1_16x16x1_16x16x1_1x16x1x16_4_1x1_intrawave_v1,69.49,769.06,0.0
gfx950,256,64,3072,2048,ck,8,0,8.6738,a8w8_blockscale_1x128x128_256x16x64x256_16x16_16x16_1x1_16x16x1_16x16x1_1x16x1x16_4_1x1_intrawave_v1,92.84,785.79,0.0
gfx950,256,80,3072,2048,ck,8,0,8.7579,a8w8_blockscale_1x128x128_256x16x64x256_16x16_16x16_1x1_16x16x1_16x16x1_1x16x1x16_4_1x1_intrawave_v1,114.94,793.21,0.0
gfx950,256,96,3072,2048,ck,7,0,9.6452,a8w8_blockscale_1x128x128_256x16x128x256_16x16_16x16_1x2_16x16x1_16x16x1_1x16x1x16_8_1x2_intrawave_v1,125.24,733.82,0.0
gfx950,256,112,3072,2048,ck,7,0,10.1215,a8w8_blockscale_1x128x128_256x16x128x256_16x16_16x16_1x2_16x16x1_16x16x1_1x16x1x16_8_1x2_intrawave_v1,139.24,712.24,0.0
gfx950,256,128,3072,2048,ck,7,0,10.082,a8w8_blockscale_1x128x128_256x16x128x256_16x16_16x16_1x2_16x16x1_16x16x1_1x16x1x16_8_1x2_intrawave_v1,159.75,728.03,0.0
gfx950,256,256,3072,2048,ck,18,0,9.9081,a8w8_blockscale_1x128x128_256x64x64x256_16x16_32x32_1x1_16x16x1_16x16x1_1x32x1x8_8_1x1_intrawave_v1,325.11,846.64,0.0
gfx950,256,512,3072,2048,ck,2,0,15.1008,a8w8_blockscale_1x128x128_256x64x128x128_16x16_32x32_1x2_8x32x1_8x32x1_1x32x1x8_8_1x1_intrawave_v3,426.63,694.38,0.0
gfx950,256,588,3072,2048,ck,2,0,15.6185,a8w8_blockscale_1x128x128_256x64x128x128_16x16_32x32_1x2_8x32x1_8x32x1_1x32x1x8_8_1x1_intrawave_v3,473.72,711.23,0.0
gfx950,256,773,3072,2048,ck,0,0,19.7657,a8w8_blockscale_1x128x128_256x128x128x128_16x16_32x32_2x2_8x32x1_8x32x1_1x32x1x8_8_1x1_intrawave_v3,492.09,638.68,0.0
gfx950,256,822,3072,2048,ck,0,0,19.8751,a8w8_blockscale_1x128x128_256x128x128x128_16x16_32x32_2x2_8x32x1_8x32x1_1x32x1x8_8_1x1_intrawave_v3,520.41,655.36,0.0
gfx950,256,1024,3072,2048,ck,0,0,19.6821,a8w8_blockscale_1x128x128_256x128x128x128_16x16_32x32_2x2_8x32x1_8x32x1_1x32x1x8_8_1x1_intrawave_v3,654.65,745.86,0.0
gfx950,256,1025,3072,2048,ck,0,0,20.4709,a8w8_blockscale_1x128x128_256x128x128x128_16x16_32x32_2x2_8x32x1_8x32x1_1x32x1x8_8_1x1_intrawave_v3,630.04,717.52,0.0
gfx950,256,1027,3072,2048,ck,0,0,20.4713,a8w8_blockscale_1x128x128_256x128x128x128_16x16_32x32_2x2_8x32x1_8x32x1_1x32x1x8_8_1x1_intrawave_v3,631.26,718.31,0.0
gfx950,256,1042,3072,2048,ck,0,0,20.5331,a8w8_blockscale_1x128x128_256x128x128x128_16x16_32x32_2x2_8x32x1_8x32x1_1x32x1x8_8_1x1_intrawave_v3,638.55,722.13,0.0
gfx950,256,1051,3072,2048,ck,0,0,20.4252,a8w8_blockscale_1x128x128_256x128x128x128_16x16_32x32_2x2_8x32x1_8x32x1_1x32x1x8_8_1x1_intrawave_v3,647.47,729.55,0.0
gfx950,256,1055,3072,2048,ck,0,0,20.454,a8w8_blockscale_1x128x128_256x128x128x128_16x16_32x32_2x2_8x32x1_8x32x1_1x32x1x8_8_1x1_intrawave_v3,649.02,730.13,0.0
gfx950,256,1057,3072,2048,ck,0,0,20.4731,a8w8_blockscale_1x128x128_256x128x128x128_16x16_32x32_2x2_8x32x1_8x32x1_1x32x1x8_8_1x1_intrawave_v3,649.64,730.25,0.0
gfx950,256,1069,3072,2048,ck,0,0,21.1471,a8w8_blockscale_1x128x128_256x128x128x128_16x16_32x32_2x2_8x32x1_8x32x1_1x32x1x8_8_1x1_intrawave_v3,636.07,711.62,0.0
gfx950,256,1072,3072,2048,ck,0,0,20.9624,a8w8_blockscale_1x128x128_256x128x128x128_16x16_32x32_2x2_8x32x1_8x32x1_1x32x1x8_8_1x1_intrawave_v3,643.48,719.06,0.0
gfx950,256,1074,3072,2048,ck,0,0,20.6796,a8w8_blockscale_1x128x128_256x128x128x128_16x16_32x32_2x2_8x32x1_8x32x1_1x32x1x8_8_1x1_intrawave_v3,653.5,729.69,0.0
gfx950,256,1091,3072,2048,ck,0,0,20.6417,a8w8_blockscale_1x128x128_256x128x128x128_16x16_32x32_2x2_8x32x1_8x32x1_1x32x1x8_8_1x1_intrawave_v3,665.06,737.77,0.0
gfx950,256,1128,3072,2048,ck,0,0,20.8009,a8w8_blockscale_1x128x128_256x128x128x128_16x16_32x32_2x2_8x32x1_8x32x1_1x32x1x8_8_1x1_intrawave_v3,682.35,746.7,0.0
gfx950,256,1136,3072,2048,ck,0,0,20.7475,a8w8_blockscale_1x128x128_256x128x128x128_16x16_32x32_2x2_8x32x1_8x32x1_1x32x1x8_8_1x1_intrawave_v3,688.96,751.78,0.0
gfx950,256,1514,3072,2048,ck,2,0,28.6114,a8w8_blockscale_1x128x128_256x64x128x128_16x16_32x32_1x2_8x32x1_8x32x1_1x32x1x8_8_1x1_intrawave_v3,665.84,653.38,0.0
gfx950,256,2017,3072,2048,ck,2,0,30.7636,a8w8_blockscale_1x128x128_256x64x128x128_16x16_32x32_1x2_8x32x1_8x32x1_1x32x1x8_8_1x1_intrawave_v3,824.99,741.61,0.0
gfx950,256,2048,3072,2048,ck,2,0,30.8132,a8w8_blockscale_1x128x128_256x64x128x128_16x16_32x32_1x2_8x32x1_8x32x1_1x32x1x8_8_1x1_intrawave_v3,836.32,748.66,0.0
gfx950,256,2151,3072,2048,ck,0,0,31.9397,a8w8_blockscale_1x128x128_256x128x128x128_16x16_32x32_2x2_8x32x1_8x32x1_1x32x1x8_8_1x1_intrawave_v3,847.4,748.67,0.0
gfx950,256,2332,3072,2048,cktile,31,0,39.2603,a8w8_blockscale_cktile_192x256x128_4x2x1_16x16x128_intrawave_0x1x0_3_aqrm,747.41,646.84,0.0
gfx950,256,2341,3072,2048,ck,0,0,32.8012,a8w8_blockscale_1x128x128_256x128x128x128_16x16_32x32_2x2_8x32x1_8x32x1_1x32x1x8_8_1x1_intrawave_v3,898.03,776.46,0.0
gfx950,256,3072,3072,2048,cktile,31,0,40.5402,a8w8_blockscale_cktile_192x256x128_4x2x1_16x16x128_intrawave_0x1x0_3_aqrm,953.49,775.95,0.0
gfx950,256,3073,3072,2048,cktile,30,0,40.5715,a8w8_blockscale_cktile_192x256x128_4x2x1_16x16x128_intrawave_0x1x0_2_aqrm,953.07,775.56,0.0
gfx950,256,3089,3072,2048,cktile,12,0,40.5284,a8w8_blockscale_cktile_192x256x128_4x2x1_16x16x128_intrawave_0x1x0_1_aqrm,959.05,779.61,0.0
gfx950,256,3110,3072,2048,cktile,12,0,40.3175,a8w8_blockscale_cktile_192x256x128_4x2x1_16x16x128_intrawave_0x1x0_1_aqrm,970.62,787.96,0.0
gfx950,256,3137,3072,2048,cktile,32,0,40.4759,a8w8_blockscale_cktile_192x256x128_4x2x1_16x16x128_intrawave_0x1x0_4_aqrm,975.21,790.34,0.0
gfx950,256,3613,3072,2048,cktile,32,0,41.4789,a8w8_blockscale_cktile_192x256x128_4x2x1_16x16x128_intrawave_0x1x0_4_aqrm,1096.03,865.24,0.0
gfx950,256,4096,3072,2048,ck,0,0,49.9202,a8w8_blockscale_1x128x128_256x128x128x128_16x16_32x32_2x2_8x32x1_8x32x1_1x32x1x8_8_1x1_intrawave_v3,1032.44,798.19,0.0
gfx950,256,4097,3072,2048,ck,0,0,57.9139,a8w8_blockscale_1x128x128_256x128x128x128_16x16_32x32_2x2_8x32x1_8x32x1_1x32x1x8_8_1x1_intrawave_v3,890.15,688.16,0.0
gfx950,256,4109,3072,2048,ck,0,0,58.2443,a8w8_blockscale_1x128x128_256x128x128x128_16x16_32x32_2x2_8x32x1_8x32x1_1x32x1x8_8_1x1_intrawave_v3,887.7,685.94,0.0
gfx950,256,4143,3072,2048,ck,0,0,58.1091,a8w8_blockscale_1x128x128_256x128x128x128_16x16_32x32_2x2_8x32x1_8x32x1_1x32x1x8_8_1x1_intrawave_v3,897.12,692.33,0.0
gfx950,256,4345,3072,2048,ck,0,0,58.2375,a8w8_blockscale_1x128x128_256x128x128x128_16x16_32x32_2x2_8x32x1_8x32x1_1x32x1x8_8_1x1_intrawave_v3,938.79,719.22,0.0
gfx950,256,4413,3072,2048,ck,0,0,58.9427,a8w8_blockscale_1x128x128_256x128x128x128_16x16_32x32_2x2_8x32x1_8x32x1_1x32x1x8_8_1x1_intrawave_v3,942.07,720.07,0.0
gfx950,256,5121,3072,2048,ck,0,0,62.3415,a8w8_blockscale_1x128x128_256x128x128x128_16x16_32x32_2x2_8x32x1_8x32x1_1x32x1x8_8_1x1_intrawave_v3,1033.61,773.85,0.0
gfx950,256,5123,3072,2048,ck,0,0,62.5323,a8w8_blockscale_1x128x128_256x128x128x128_16x16_32x32_2x2_8x32x1_8x32x1_1x32x1x8_8_1x1_intrawave_v3,1030.86,771.75,0.0
gfx950,256,5133,3072,2048,ck,0,0,61.7291,a8w8_blockscale_1x128x128_256x128x128x128_16x16_32x32_2x2_8x32x1_8x32x1_1x32x1x8_8_1x1_intrawave_v3,1046.32,783.12,0.0
gfx950,256,5185,3072,2048,ck,0,0,62.049,a8w8_blockscale_1x128x128_256x128x128x128_16x16_32x32_2x2_8x32x1_8x32x1_1x32x1x8_8_1x1_intrawave_v3,1051.47,785.94,0.0
gfx950,256,5191,3072,2048,ck,0,0,62.1118,a8w8_blockscale_1x128x128_256x128x128x128_16x16_32x32_2x2_8x32x1_8x32x1_1x32x1x8_8_1x1_intrawave_v3,1051.62,785.94,0.0
gfx950,256,6146,3072,2048,ck,0,0,74.8339,a8w8_blockscale_1x128x128_256x128x128x128_16x16_32x32_2x2_8x32x1_8x32x1_1x32x1x8_8_1x1_intrawave_v3,1033.42,756.87,0.0
gfx950,256,6147,3072,2048,ck,0,0,73.5639,a8w8_blockscale_1x128x128_256x128x128x128_16x16_32x32_2x2_8x32x1_8x32x1_1x32x1x8_8_1x1_intrawave_v3,1051.43,770.05,0.0
gfx950,256,6155,3072,2048,ck,0,0,74.7039,a8w8_blockscale_1x128x128_256x128x128x128_16x16_32x32_2x2_8x32x1_8x32x1_1x32x1x8_8_1x1_intrawave_v3,1036.73,759.17,0.0
gfx950,256,6377,3072,2048,ck,0,0,74.9421,a8w8_blockscale_1x128x128_256x128x128x128_16x16_32x32_2x2_8x32x1_8x32x1_1x32x1x8_8_1x1_intrawave_v3,1070.71,781.03,0.0
gfx950,256,6401,3072,2048,ck,0,0,74.9441,a8w8_blockscale_1x128x128_256x128x128x128_16x16_32x32_2x2_8x32x1_8x32x1_1x32x1x8_8_1x1_intrawave_v3,1074.71,783.63,0.0
gfx950,256,7121,3072,2048,cktile,27,0,78.6607,a8w8_blockscale_cktile_192x256x128_4x2x1_16x16x128_intrawave_0x1x0_2,1139.11,821.59,0.0
gfx950,256,7169,3072,2048,cktile,11,0,78.9205,a8w8_blockscale_cktile_192x256x128_4x2x1_16x16x128_intrawave_0x1x0_1,1143.01,823.87,0.0
gfx950,256,7170,3072,2048,cktile,29,0,78.5676,a8w8_blockscale_cktile_192x256x128_4x2x1_16x16x128_intrawave_0x1x0_4,1148.3,827.67,0.0
gfx950,256,7176,3072,2048,cktile,28,0,79.1621,a8w8_blockscale_cktile_192x256x128_4x2x1_16x16x128_intrawave_0x1x0_3,1140.63,822.08,0.0
gfx950,256,7177,3072,2048,cktile,27,0,78.834,a8w8_blockscale_cktile_192x256x128_4x2x1_16x16x128_intrawave_0x1x0_2,1145.54,825.6,0.0
gfx950,256,7185,3072,2048,cktile,11,0,78.4149,a8w8_blockscale_cktile_192x256x128_4x2x1_16x16x128_intrawave_0x1x0_1,1152.95,830.85,0.0
gfx950,256,7206,3072,2048,cktile,29,0,78.6531,a8w8_blockscale_cktile_192x256x128_4x2x1_16x16x128_intrawave_0x1x0_4,1152.81,830.52,0.0
gfx950,256,7217,3072,2048,cktile,27,0,78.5173,a8w8_blockscale_cktile_192x256x128_4x2x1_16x16x128_intrawave_0x1x0_2,1156.57,833.1,0.0
gfx950,256,7257,3072,2048,cktile,11,0,78.9258,a8w8_blockscale_cktile_192x256x128_4x2x1_16x16x128_intrawave_0x1x0_1,1156.96,832.94,0.0
gfx950,256,7265,3072,2048,cktile,11,0,78.9425,a8w8_blockscale_cktile_192x256x128_4x2x1_16x16x128_intrawave_0x1x0_1,1157.99,833.6,0.0
gfx950,256,7393,3072,2048,cktile,11,0,79.0694,a8w8_blockscale_cktile_192x256x128_4x2x1_16x16x128_intrawave_0x1x0_1,1176.5,845.52,0.0
gfx950,256,7461,3072,2048,cktile,11,0,78.7755,a8w8_blockscale_cktile_192x256x128_4x2x1_16x16x128_intrawave_0x1x0_1,1191.76,855.75,0.0
gfx950,256,7634,3072,2048,cktile,28,0,79.33,a8w8_blockscale_cktile_192x256x128_4x2x1_16x16x128_intrawave_0x1x0_3,1210.87,867.63,0.0
gfx950,256,8129,3072,2048,ck,0,0,91.3298,a8w8_blockscale_1x128x128_256x128x128x128_16x16_32x32_2x2_8x32x1_8x32x1_1x32x1x8_8_1x1_intrawave_v3,1119.97,798.03,0.0
gfx950,256,8192,3072,2048,ck,0,0,89.6202,a8w8_blockscale_1x128x128_256x128x128x128_16x16_32x32_2x2_8x32x1_8x32x1_1x32x1x8_8_1x1_intrawave_v3,1150.18,819.02,0.0
gfx950,256,1,4608,2048,ck,8,3,7.0728,a8w8_blockscale_1x128x128_256x16x64x256_16x16_16x16_1x1_16x16x1_16x16x1_1x16x1x16_4_1x1_intrawave_v1,2.67,1335.89,0.0
gfx950,256,2,4608,2048,ck,8,3,7.6647,a8w8_blockscale_1x128x128_256x16x64x256_16x16_16x16_1x1_16x16x1_16x16x1_1x16x1x16_4_1x1_intrawave_v1,4.93,1234.19,0.0
gfx950,256,4,4608,2048,ck,8,3,7.67,a8w8_blockscale_1x128x128_256x16x64x256_16x16_16x16_1x1_16x16x1_16x16x1_1x16x1x16_4_1x1_intrawave_v1,9.84,1236.28,0.0
gfx950,256,8,4608,2048,ck,8,3,7.9937,a8w8_blockscale_1x128x128_256x16x64x256_16x16_16x16_1x1_16x16x1_16x16x1_1x16x1x16_4_1x1_intrawave_v1,18.89,1191.85,0.0
gfx950,256,16,4608,2048,ck,8,3,8.1216,a8w8_blockscale_1x128x128_256x16x64x256_16x16_16x16_1x1_16x16x1_16x16x1_1x16x1x16_4_1x1_intrawave_v1,37.18,1184.18,0.0
gfx950,256,24,4608,2048,ck,8,2,8.9204,a8w8_blockscale_1x128x128_256x16x64x256_16x16_16x16_1x1_16x16x1_16x16x1_1x16x1x16_4_1x1_intrawave_v1,50.78,1088.24,0.0
gfx950,256,32,4608,2048,ck,8,0,8.8527,a8w8_blockscale_1x128x128_256x16x64x256_16x16_16x16_1x1_16x16x1_16x16x1_1x16x1x16_4_1x1_intrawave_v1,68.23,1106.74,0.0
gfx950,256,40,4608,2048,ck,8,0,9.0193,a8w8_blockscale_1x128x128_256x16x64x256_16x16_16x16_1x1_16x16x1_16x16x1_1x16x1x16_4_1x1_intrawave_v1,83.71,1096.29,0.0
gfx950,256,48,4608,2048,ck,8,0,8.8855,a8w8_blockscale_1x128x128_256x16x64x256_16x16_16x16_1x1_16x16x1_16x16x1_1x16x1x16_4_1x1_intrawave_v1,101.96,1122.94,0.0
gfx950,256,56,4608,2048,ck,7,0,10.3639,a8w8_blockscale_1x128x128_256x16x128x256_16x16_16x16_1x2_16x16x1_16x16x1_1x16x1x16_8_1x2_intrawave_v1,101.99,971.45,0.0
gfx950,256,64,4608,2048,ck,7,0,10.0451,a8w8_blockscale_1x128x128_256x16x128x256_16x16_16x16_1x2_16x16x1_16x16x1_1x16x1x16_8_1x2_intrawave_v1,120.25,1011.25,0.0
gfx950,256,72,4608,2048,ck,7,0,10.1234,a8w8_blockscale_1x128x128_256x16x128x256_16x16_16x16_1x2_16x16x1_16x16x1_1x16x1x16_8_1x2_intrawave_v1,134.24,1012.33,0.0
gfx950,256,80,4608,2048,ck,7,0,10.2445,a8w8_blockscale_1x128x128_256x16x128x256_16x16_16x16_1x2_16x16x1_16x16x1_1x16x1x16_8_1x2_intrawave_v1,147.39,1009.16,0.0
gfx950,256,88,4608,2048,ck,7,0,9.9238,a8w8_blockscale_1x128x128_256x16x128x256_16x16_16x16_1x2_16x16x1_16x16x1_1x16x1x16_8_1x2_intrawave_v1,167.37,1050.85,0.0
gfx950,256,96,4608,2048,ck,7,0,9.8503,a8w8_blockscale_1x128x128_256x16x128x256_16x16_16x16_1x2_16x16x1_16x16x1_1x16x1x16_8_1x2_intrawave_v1,183.95,1067.84,0.0
gfx950,256,104,4608,2048,ck,7,0,10.4673,a8w8_blockscale_1x128x128_256x16x128x256_16x16_16x16_1x2_16x16x1_16x16x1_1x16x1x16_8_1x2_intrawave_v1,187.53,1013.5,0.0
gfx950,256,112,4608,2048,ck,7,0,10.3101,a8w8_blockscale_1x128x128_256x16x128x256_16x16_16x16_1x2_16x16x1_16x16x1_1x16x1x16_8_1x2_intrawave_v1,205.03,1037.7,0.0
gfx950,256,120,4608,2048,ck,18,0,11.7484,a8w8_blockscale_1x128x128_256x64x64x256_16x16_32x32_1x1_16x16x1_16x16x1_1x32x1x8_8_1x1_intrawave_v1,192.79,918.33,0.0
gfx950,256,128,4608,2048,ck,18,0,10.6713,a8w8_blockscale_1x128x128_256x64x64x256_16x16_32x32_1x1_16x16x1_16x16x1_1x32x1x8_8_1x1_intrawave_v1,226.39,1019.46,0.0
gfx950,256,136,4608,2048,ck,18,0,11.8387,a8w8_blockscale_1x128x128_256x64x64x256_16x16_32x32_1x1_16x16x1_16x16x1_1x32x1x8_8_1x1_intrawave_v1,216.82,926.54,0.0
gfx950,256,144,4608,2048,ck,18,0,11.8608,a8w8_blockscale_1x128x128_256x64x64x256_16x16_32x32_1x1_16x16x1_16x16x1_1x32x1x8_8_1x1_intrawave_v1,229.15,932.42,0.0
gfx950,256,152,4608,2048,ck,18,0,12.0878,a8w8_blockscale_1x128x128_256x64x64x256_16x16_32x32_1x1_16x16x1_16x16x1_1x32x1x8_8_1x1_intrawave_v1,237.34,922.36,0.0
gfx950,256,160,4608,2048,ck,12,0,11.9427,a8w8_blockscale_1x128x128_256x32x128x256_16x16_32x32_1x1_16x16x1_16x16x1_1x32x1x8_8_1x1_intrawave_v1,252.87,941.11,0.0
gfx950,256,168,4608,2048,ck,18,0,11.9934,a8w8_blockscale_1x128x128_256x64x64x256_16x16_32x32_1x1_16x16x1_16x16x1_1x32x1x8_8_1x1_intrawave_v1,264.39,944.65,0.0
gfx950,256,176,4608,2048,ck,18,0,12.1793,a8w8_blockscale_1x128x128_256x64x64x256_16x16_32x32_1x1_16x16x1_16x16x1_1x32x1x8_8_1x1_intrawave_v1,272.75,937.63,0.0
gfx950,256,184,4608,2048,ck,18,0,12.2004,a8w8_blockscale_1x128x128_256x64x64x256_16x16_32x32_1x1_16x16x1_16x16x1_1x32x1x8_8_1x1_intrawave_v1,284.65,943.39,0.0
gfx950,256,192,4608,2048,ck,18,0,11.0097,a8w8_blockscale_1x128x128_256x64x64x256_16x16_32x32_1x1_16x16x1_16x16x1_1x32x1x8_8_1x1_intrawave_v1,329.15,1053.6,0.0
gfx950,256,200,4608,2048,ck,12,0,13.0279,a8w8_blockscale_1x128x128_256x32x128x256_16x16_32x32_1x1_16x16x1_16x16x1_1x32x1x8_8_1x1_intrawave_v1,289.75,897.3,0.0
gfx950,256,208,4608,2048,ck,12,0,13.3715,a8w8_blockscale_1x128x128_256x32x128x256_16x16_32x32_1x1_16x16x1_16x16x1_1x32x1x8_8_1x1_intrawave_v1,293.6,880.99,0.0
gfx950,256,216,4608,2048,ck,12,0,13.3337,a8w8_blockscale_1x128x128_256x32x128x256_16x16_32x32_1x1_16x16x1_16x16x1_1x32x1x8_8_1x1_intrawave_v1,305.76,890.24,0.0
gfx950,256,224,4608,2048,ck,12,0,12.3659,a8w8_blockscale_1x128x128_256x32x128x256_16x16_32x32_1x1_16x16x1_16x16x1_1x32x1x8_8_1x1_intrawave_v1,341.9,967.2,0.0
gfx950,256,232,4608,2048,ck,2,0,15.4901,a8w8_blockscale_1x128x128_256x64x128x128_16x16_32x32_1x2_8x32x1_8x32x1_1x32x1x8_8_1x1_intrawave_v3,282.69,777.94,0.0
gfx950,256,240,4608,2048,ck,2,0,15.6054,a8w8_blockscale_1x128x128_256x64x128x128_16x16_32x32_1x2_8x32x1_8x32x1_1x32x1x8_8_1x1_intrawave_v3,290.27,777.97,0.0
gfx950,256,248,4608,2048,ck,2,0,15.4976,a8w8_blockscale_1x128x128_256x64x128x128_16x16_32x32_1x2_8x32x1_8x32x1_1x32x1x8_8_1x1_intrawave_v3,302.04,789.2,0.0
gfx950,256,256,4608,2048,ck,2,0,15.5872,a8w8_blockscale_1x128x128_256x64x128x128_16x16_32x32_1x2_8x32x1_8x32x1_1x32x1x8_8_1x1_intrawave_v3,309.99,790.44,0.0
gfx950,256,272,4608,2048,ck,2,0,15.3263,a8w8_blockscale_1x128x128_256x64x128x128_16x16_32x32_1x2_8x32x1_8x32x1_1x32x1x8_8_1x1_intrawave_v3,334.97,815.66,0.0
gfx950,256,288,4608,2048,ck,2,0,15.6133,a8w8_blockscale_1x128x128_256x64x128x128_16x16_32x32_1x2_8x32x1_8x32x1_1x32x1x8_8_1x1_intrawave_v3,348.15,812.21,0.0
gfx950,256,304,4608,2048,ck,2,0,15.6136,a8w8_blockscale_1x128x128_256x64x128x128_16x16_32x32_1x2_8x32x1_8x32x1_1x32x1x8_8_1x1_intrawave_v3,367.49,823.73,0.0
gfx950,256,320,4608,2048,ck,2,0,15.3248,a8w8_blockscale_1x128x128_256x64x128x128_16x16_32x32_1x2_8x32x1_8x32x1_1x32x1x8_8_1x1_intrawave_v3,394.12,851.02,0.0
gfx950,256,336,4608,2048,ck,2,0,15.4,a8w8_blockscale_1x128x128_256x64x128x128_16x16_32x32_1x2_8x32x1_8x32x1_1x32x1x8_8_1x1_intrawave_v3,411.8,858.56,0.0
gfx950,256,352,4608,2048,ck,2,0,15.3083,a8w8_blockscale_1x128x128_256x64x128x128_16x16_32x32_1x2_8x32x1_8x32x1_1x32x1x8_8_1x1_intrawave_v3,434.0,875.48,0.0
gfx950,256,368,4608,2048,ck,2,0,15.4759,a8w8_blockscale_1x128x128_256x64x128x128_16x16_32x32_1x2_8x32x1_8x32x1_1x32x1x8_8_1x1_intrawave_v3,448.81,877.64,0.0
gfx950,256,384,4608,2048,ck,2,0,15.2474,a8w8_blockscale_1x128x128_256x64x128x128_16x16_32x32_1x2_8x32x1_8x32x1_1x32x1x8_8_1x1_intrawave_v3,475.34,902.62,0.0
gfx950,256,400,4608,2048,ck,2,0,15.4888,a8w8_blockscale_1x128x128_256x64x128x128_16x16_32x32_1x2_8x32x1_8x32x1_1x32x1x8_8_1x1_intrawave_v3,487.43,900.18,0.0
gfx950,256,416,4608,2048,ck,2,0,15.4917,a8w8_blockscale_1x128x128_256x64x128x128_16x16_32x32_1x2_8x32x1_8x32x1_1x32x1x8_8_1x1_intrawave_v3,506.84,911.65,0.0
gfx950,256,432,4608,2048,ck,2,0,15.5778,a8w8_blockscale_1x128x128_256x64x128x128_16x16_32x32_1x2_8x32x1_8x32x1_1x32x1x8_8_1x1_intrawave_v3,523.42,918.18,0.0
gfx950,256,448,4608,2048,ck,2,0,15.3938,a8w8_blockscale_1x128x128_256x64x128x128_16x16_32x32_1x2_8x32x1_8x32x1_1x32x1x8_8_1x1_intrawave_v3,549.29,940.86,0.0
gfx950,256,464,4608,2048,ck,3,0,19.5124,a8w8_blockscale_1x128x128_256x64x64x128_16x16_32x32_1x1_8x32x1_8x32x1_1x32x1x8_8_1x1_intrawave_v3,448.83,751.51,0.0
gfx950,256,480,4608,2048,ck,3,0,19.689,a8w8_blockscale_1x128x128_256x64x64x128_16x16_32x32_1x1_8x32x1_8x32x1_1x32x1x8_8_1x1_intrawave_v3,460.14,753.92,0.0
gfx950,256,496,4608,2048,ck,0,0,20.0754,a8w8_blockscale_1x128x128_256x128x128x128_16x16_32x32_2x2_8x32x1_8x32x1_1x32x1x8_8_1x1_intrawave_v3,466.33,748.38,0.0
gfx950,256,512,4608,2048,ck,0,0,19.2945,a8w8_blockscale_1x128x128_256x128x128x128_16x16_32x32_2x2_8x32x1_8x32x1_1x32x1x8_8_1x1_intrawave_v3,500.85,788.01,0.0
gfx950,256,664,4608,2048,ck,0,0,20.321,a8w8_blockscale_1x128x128_256x128x128x128_16x16_32x32_2x2_8x32x1_8x32x1_1x32x1x8_8_1x1_intrawave_v3,616.73,832.46,0.0
gfx950,256,762,4608,2048,ck,0,0,20.8438,a8w8_blockscale_1x128x128_256x128x128x128_16x16_32x32_2x2_8x32x1_8x32x1_1x32x1x8_8_1x1_intrawave_v3,690.0,864.54,0.0
gfx950,256,902,4608,2048,ck,2,0,29.1331,a8w8_blockscale_1x128x128_256x64x128x128_16x16_32x32_1x2_8x32x1_8x32x1_1x32x1x8_8_1x1_intrawave_v3,584.38,672.68,0.0
gfx950,256,961,4608,2048,ck,2,0,28.73,a8w8_blockscale_1x128x128_256x64x128x128_16x16_32x32_1x2_8x32x1_8x32x1_1x32x1x8_8_1x1_intrawave_v3,631.34,705.25,0.0
gfx950,256,1000,4608,2048,ck,2,0,29.536,a8w8_blockscale_1x128x128_256x64x128x128_16x16_32x32_1x2_8x32x1_8x32x1_1x32x1x8_8_1x1_intrawave_v3,639.03,700.88,0.0
gfx950,256,1001,4608,2048,ck,2,0,29.4826,a8w8_blockscale_1x128x128_256x64x128x128_16x16_32x32_1x2_8x32x1_8x32x1_1x32x1x8_8_1x1_intrawave_v3,640.83,702.53,0.0
gfx950,256,1002,4608,2048,ck,2,0,29.2697,a8w8_blockscale_1x128x128_256x64x128x128_16x16_32x32_1x2_8x32x1_8x32x1_1x32x1x8_8_1x1_intrawave_v3,646.13,708.03,0.0
gfx950,256,1003,4608,2048,ck,2,0,29.2259,a8w8_blockscale_1x128x128_256x64x128x128_16x16_32x32_1x2_8x32x1_8x32x1_1x32x1x8_8_1x1_intrawave_v3,647.75,709.47,0.0
gfx950,256,1015,4608,2048,ck,2,0,29.538,a8w8_blockscale_1x128x128_256x64x128x128_16x16_32x32_1x2_8x32x1_8x32x1_1x32x1x8_8_1x1_intrawave_v3,648.57,706.55,0.0
gfx950,256,1023,4608,2048,ck,2,0,29.4426,a8w8_blockscale_1x128x128_256x64x128x128_16x16_32x32_1x2_8x32x1_8x32x1_1x32x1x8_8_1x1_intrawave_v3,655.8,711.9,0.0
gfx950,256,1024,4608,2048,ck,2,0,29.5315,a8w8_blockscale_1x128x128_256x64x128x128_16x16_32x32_1x2_8x32x1_8x32x1_1x32x1x8_8_1x1_intrawave_v3,654.47,710.14,0.0
gfx950,256,1025,4608,2048,ck,2,0,29.1625,a8w8_blockscale_1x128x128_256x64x128x128_16x16_32x32_1x2_8x32x1_8x32x1_1x32x1x8_8_1x1_intrawave_v3,663.39,719.51,0.0
gfx950,256,1032,4608,2048,ck,2,0,29.5521,a8w8_blockscale_1x128x128_256x64x128x128_16x16_32x32_1x2_8x32x1_8x32x1_1x32x1x8_8_1x1_intrawave_v3,659.12,712.69,0.0
gfx950,256,1038,4608,2048,ck,2,0,29.192,a8w8_blockscale_1x128x128_256x64x128x128_16x16_32x32_1x2_8x32x1_8x32x1_1x32x1x8_8_1x1_intrawave_v3,671.13,723.8,0.0
gfx950,256,1087,4608,2048,ck,2,0,29.8669,a8w8_blockscale_1x128x128_256x64x128x128_16x16_32x32_1x2_8x32x1_8x32x1_1x32x1x8_8_1x1_intrawave_v3,686.93,725.93,0.0
gfx950,256,1255,4608,2048,ck,2,0,30.7197,a8w8_blockscale_1x128x128_256x64x128x128_16x16_32x32_1x2_8x32x1_8x32x1_1x32x1x8_8_1x1_intrawave_v3,771.08,767.37,0.0
gfx950,256,1351,4608,2048,ck,0,0,31.8336,a8w8_blockscale_1x128x128_256x128x128x128_16x16_32x32_2x2_8x32x1_8x32x1_1x32x1x8_8_1x1_intrawave_v3,801.02,774.49,0.0
gfx950,256,1376,4608,2048,ck,0,0,32.044,a8w8_blockscale_1x128x128_256x128x128x128_16x16_32x32_2x2_8x32x1_8x32x1_1x32x1x8_8_1x1_intrawave_v3,810.48,778.19,0.0
gfx950,256,1380,4608,2048,ck,0,0,31.8647,a8w8_blockscale_1x128x128_256x128x128x128_16x16_32x32_2x2_8x32x1_8x32x1_1x32x1x8_8_1x1_intrawave_v3,817.41,783.99,0.0
gfx950,256,1391,4608,2048,ck,0,0,32.3276,a8w8_blockscale_1x128x128_256x128x128x128_16x16_32x32_2x2_8x32x1_8x32x1_1x32x1x8_8_1x1_intrawave_v3,812.13,776.59,0.0
gfx950,256,1710,4608,2048,ck,0,0,34.3904,a8w8_blockscale_1x128x128_256x128x128x128_16x16_32x32_2x2_8x32x1_8x32x1_1x32x1x8_8_1x1_intrawave_v3,938.49,834.5,0.0
gfx950,256,1808,4608,2048,cktile,12,0,39.6031,a8w8_blockscale_cktile_192x256x128_4x2x1_16x16x128_intrawave_0x1x0_1_aqrm,861.67,752.53,0.0
gfx950,256,1809,4608,2048,cktile,30,0,39.9584,a8w8_blockscale_cktile_192x256x128_4x2x1_16x16x128_intrawave_0x1x0_2_aqrm,854.48,746.12,0.0
gfx950,256,1870,4608,2048,cktile,30,0,39.7596,a8w8_blockscale_cktile_192x256x128_4x2x1_16x16x128_intrawave_0x1x0_2_aqrm,887.71,767.13,0.0
gfx950,256,1967,4608,2048,cktile,30,0,40.1129,a8w8_blockscale_cktile_192x256x128_4x2x1_16x16x128_intrawave_0x1x0_2_aqrm,925.53,787.61,0.0
gfx950,256,1970,4608,2048,cktile,12,0,40.1093,a8w8_blockscale_cktile_192x256x128_4x2x1_16x16x128_intrawave_0x1x0_1_aqrm,927.03,788.53,0.0
gfx950,256,2000,4608,2048,cktile,12,0,40.0509,a8w8_blockscale_cktile_192x256x128_4x2x1_16x16x128_intrawave_0x1x0_1_aqrm,942.52,798.11,0.0
gfx950,256,2001,4608,2048,cktile,30,0,39.9799,a8w8_blockscale_cktile_192x256x128_4x2x1_16x16x128_intrawave_0x1x0_2_aqrm,944.66,799.81,0.0
gfx950,256,2016,4608,2048,cktile,30,0,40.0965,a8w8_blockscale_cktile_192x256x128_4x2x1_16x16x128_intrawave_0x1x0_2_aqrm,948.98,801.7,0.0
gfx950,256,2017,4608,2048,cktile,30,0,40.1514,a8w8_blockscale_cktile_192x256x128_4x2x1_16x16x128_intrawave_0x1x0_2_aqrm,948.15,800.89,0.0
gfx950,256,2046,4608,2048,cktile,12,0,40.4009,a8w8_blockscale_cktile_192x256x128_4x2x1_16x16x128_intrawave_0x1x0_1_aqrm,955.84,804.02,0.0
gfx950,256,2048,4608,2048,cktile,31,0,40.2325,a8w8_blockscale_cktile_192x256x128_4x2x1_16x16x128_intrawave_0x1x0_3_aqrm,960.78,807.95,0.0
gfx950,256,2050,4608,2048,cktile,31,0,40.0684,a8w8_blockscale_cktile_192x256x128_4x2x1_16x16x128_intrawave_0x1x0_3_aqrm,965.66,811.82,0.0
gfx950,256,2081,4608,2048,cktile,12,0,40.509,a8w8_blockscale_cktile_192x256x128_4x2x1_16x16x128_intrawave_0x1x0_1_aqrm,969.6,811.61,0.0
gfx950,256,2095,4608,2048,cktile,32,0,40.1622,a8w8_blockscale_cktile_192x256x128_4x2x1_16x16x128_intrawave_0x1x0_4_aqrm,984.55,822.55,0.0
gfx950,256,2154,4608,2048,cktile,32,0,40.7532,a8w8_blockscale_cktile_192x256x128_4x2x1_16x16x128_intrawave_0x1x0_4_aqrm,997.6,826.93,0.0
gfx950,256,2159,4608,2048,cktile,32,0,40.5418,a8w8_blockscale_cktile_192x256x128_4x2x1_16x16x128_intrawave_0x1x0_4_aqrm,1005.13,832.63,0.0
gfx950,256,2162,4608,2048,cktile,32,0,40.6522,a8w8_blockscale_cktile_192x256x128_4x2x1_16x16x128_intrawave_0x1x0_4_aqrm,1003.79,831.2,0.0
gfx950,256,2165,4608,2048,cktile,31,0,40.6721,a8w8_blockscale_cktile_192x256x128_4x2x1_16x16x128_intrawave_0x1x0_3_aqrm,1004.69,831.62,0.0
gfx950,256,2251,4608,2048,cktile,32,0,40.5101,a8w8_blockscale_cktile_192x256x128_4x2x1_16x16x128_intrawave_0x1x0_4_aqrm,1048.78,858.86,0.0
gfx950,256,2252,4608,2048,cktile,30,0,40.6519,a8w8_blockscale_cktile_192x256x128_4x2x1_16x16x128_intrawave_0x1x0_2_aqrm,1045.59,856.14,0.0
gfx950,256,2255,4608,2048,cktile,32,0,40.7828,a8w8_blockscale_cktile_192x256x128_4x2x1_16x16x128_intrawave_0x1x0_4_aqrm,1043.62,854.22,0.0
gfx950,256,2317,4608,2048,cktile,31,0,41.1717,a8w8_blockscale_cktile_192x256x128_4x2x1_16x16x128_intrawave_0x1x0_3_aqrm,1062.18,863.11,0.0
gfx950,256,2694,4608,2048,ck,0,0,57.8566,a8w8_blockscale_1x128x128_256x128x128x128_16x16_32x32_2x2_8x32x1_8x32x1_1x32x1x8_8_1x1_intrawave_v3,878.85,687.6,0.0
gfx950,256,2715,4608,2048,ck,0,0,58.3055,a8w8_blockscale_1x128x128_256x128x128x128_16x16_32x32_2x2_8x32x1_8x32x1_1x32x1x8_8_1x1_intrawave_v3,878.89,686.37,0.0
gfx950,256,2819,4608,2048,ck,0,0,58.717,a8w8_blockscale_1x128x128_256x128x128x128_16x16_32x32_2x2_8x32x1_8x32x1_1x32x1x8_8_1x1_intrawave_v3,906.16,701.51,0.0
gfx950,256,2853,4608,2048,ck,0,0,57.987,a8w8_blockscale_1x128x128_256x128x128x128_16x16_32x32_2x2_8x32x1_8x32x1_1x32x1x8_8_1x1_intrawave_v3,928.63,716.94,0.0
gfx950,256,2914,4608,2048,ck,0,0,58.6074,a8w8_blockscale_1x128x128_256x128x128x128_16x16_32x32_2x2_8x32x1_8x32x1_1x32x1x8_8_1x1_intrawave_v3,938.45,721.08,0.0
gfx950,256,2974,4608,2048,ck,0,0,59.1986,a8w8_blockscale_1x128x128_256x128x128x128_16x16_32x32_2x2_8x32x1_8x32x1_1x32x1x8_8_1x1_intrawave_v3,948.2,725.29,0.0
gfx950,256,3000,4608,2048,ck,0,0,58.883,a8w8_blockscale_1x128x128_256x128x128x128_16x16_32x32_2x2_8x32x1_8x32x1_1x32x1x8_8_1x1_intrawave_v3,961.62,734.15,0.0
gfx950,256,3001,4608,2048,ck,0,0,59.1954,a8w8_blockscale_1x128x128_256x128x128x128_16x16_32x32_2x2_8x32x1_8x32x1_1x32x1x8_8_1x1_intrawave_v3,956.86,730.47,0.0
gfx950,256,3072,4608,2048,ck,0,0,58.5167,a8w8_blockscale_1x128x128_256x128x128x128_16x16_32x32_2x2_8x32x1_8x32x1_1x32x1x8_8_1x1_intrawave_v3,990.86,752.61,0.0
gfx950,256,3073,4608,2048,ck,0,0,59.4195,a8w8_blockscale_1x128x128_256x128x128x128_16x16_32x32_2x2_8x32x1_8x32x1_1x32x1x8_8_1x1_intrawave_v3,976.13,741.36,0.0
gfx950,256,3077,4608,2048,ck,0,0,60.6998,a8w8_blockscale_1x128x128_256x128x128x128_16x16_32x32_2x2_8x32x1_8x32x1_1x32x1x8_8_1x1_intrawave_v3,956.78,726.47,0.0
gfx950,256,3078,4608,2048,ck,0,0,60.0995,a8w8_blockscale_1x128x128_256x128x128x128_16x16_32x32_2x2_8x32x1_8x32x1_1x32x1x8_8_1x1_intrawave_v3,966.65,733.91,0.0
gfx950,256,3086,4608,2048,ck,2,0,66.0495,a8w8_blockscale_1x128x128_256x64x128x128_16x16_32x32_1x2_8x32x1_8x32x1_1x32x1x8_8_1x1_intrawave_v3,881.86,669.16,0.0
gfx950,256,3089,4608,2048,ck,0,0,59.6379,a8w8_blockscale_1x128x128_256x128x128x128_16x16_32x32_2x2_8x32x1_8x32x1_1x32x1x8_8_1x1_intrawave_v3,977.62,741.67,0.0
gfx950,256,3118,4608,2048,ck,0,0,59.8175,a8w8_blockscale_1x128x128_256x128x128x128_16x16_32x32_2x2_8x32x1_8x32x1_1x32x1x8_8_1x1_intrawave_v3,983.83,744.9,0.0
gfx950,256,3138,4608,2048,ck,0,0,59.4051,a8w8_blockscale_1x128x128_256x128x128x128_16x16_32x32_2x2_8x32x1_8x32x1_1x32x1x8_8_1x1_intrawave_v3,997.01,753.87,0.0
gfx950,256,3154,4608,2048,ck,0,0,59.7235,a8w8_blockscale_1x128x128_256x128x128x128_16x16_32x32_2x2_8x32x1_8x32x1_1x32x1x8_8_1x1_intrawave_v3,996.76,752.87,0.0
gfx950,256,3289,4608,2048,ck,0,0,61.3967,a8w8_blockscale_1x128x128_256x128x128x128_16x16_32x32_2x2_8x32x1_8x32x1_1x32x1x8_8_1x1_intrawave_v3,1011.09,757.12,0.0
gfx950,256,3437,4608,2048,ck,0,0,61.5567,a8w8_blockscale_1x128x128_256x128x128x128_16x16_32x32_2x2_8x32x1_8x32x1_1x32x1x8_8_1x1_intrawave_v3,1053.84,782.23,0.0
gfx950,256,3617,4608,2048,ck,0,0,72.074,a8w8_blockscale_1x128x128_256x128x128x128_16x16_32x32_2x2_8x32x1_8x32x1_1x32x1x8_8_1x1_intrawave_v3,947.2,696.22,0.0
gfx950,256,3620,4608,2048,ck,0,0,71.4732,a8w8_blockscale_1x128x128_256x128x128x128_16x16_32x32_2x2_8x32x1_8x32x1_1x32x1x8_8_1x1_intrawave_v3,955.96,702.54,0.0
gfx950,256,3669,4608,2048,ck,0,0,72.6692,a8w8_blockscale_1x128x128_256x128x128x128_16x16_32x32_2x2_8x32x1_8x32x1_1x32x1x8_8_1x1_intrawave_v3,952.95,698.57,0.0
gfx950,256,3824,4608,2048,ck,0,0,72.8476,a8w8_blockscale_1x128x128_256x128x128x128_16x16_32x32_2x2_8x32x1_8x32x1_1x32x1x8_8_1x1_intrawave_v3,990.78,720.83,0.0
gfx950,256,3858,4608,2048,ck,0,0,73.9592,a8w8_blockscale_1x128x128_256x128x128x128_16x16_32x32_2x2_8x32x1_8x32x1_1x32x1x8_8_1x1_intrawave_v3,984.56,715.17,0.0
gfx950,256,3906,4608,2048,ck,0,0,73.6152,a8w8_blockscale_1x128x128_256x128x128x128_16x16_32x32_2x2_8x32x1_8x32x1_1x32x1x8_8_1x1_intrawave_v3,1001.47,725.86,0.0
gfx950,256,4000,4608,2048,cktile,11,0,77.4818,a8w8_blockscale_cktile_192x256x128_4x2x1_16x16x128_intrawave_0x1x0_1,974.39,703.3,0.0
gfx950,256,4004,4608,2048,ck,0,0,74.1832,a8w8_blockscale_1x128x128_256x128x128x128_16x16_32x32_2x2_8x32x1_8x32x1_1x32x1x8_8_1x1_intrawave_v3,1018.73,735.18,0.0
gfx950,256,4100,4608,2048,ck,0,0,74.4308,a8w8_blockscale_1x128x128_256x128x128x128_16x16_32x32_2x2_8x32x1_8x32x1_1x32x1x8_8_1x1_intrawave_v3,1039.69,747.27,0.0
gfx950,256,4108,4608,2048,ck,0,0,74.8572,a8w8_blockscale_1x128x128_256x128x128x128_16x16_32x32_2x2_8x32x1_8x32x1_1x32x1x8_8_1x1_intrawave_v3,1035.78,744.21,0.0
gfx950,256,4121,4608,2048,ck,0,0,75.9184,a8w8_blockscale_1x128x128_256x128x128x128_16x16_32x32_2x2_8x32x1_8x32x1_1x32x1x8_8_1x1_intrawave_v3,1024.54,735.74,0.0
gfx950,256,4123,4608,2048,ck,0,0,74.898,a8w8_blockscale_1x128x128_256x128x128x128_16x16_32x32_2x2_8x32x1_8x32x1_1x32x1x8_8_1x1_intrawave_v3,1039.0,746.06,0.0
gfx950,256,4149,4608,2048,ck,0,0,75.1612,a8w8_blockscale_1x128x128_256x128x128x128_16x16_32x32_2x2_8x32x1_8x32x1_1x32x1x8_8_1x1_intrawave_v3,1041.89,747.35,0.0
gfx950,256,4204,4608,2048,ck,0,0,75.528,a8w8_blockscale_1x128x128_256x128x128x128_16x16_32x32_2x2_8x32x1_8x32x1_1x32x1x8_8_1x1_intrawave_v3,1050.58,751.92,0.0
gfx950,256,4223,4608,2048,ck,0,0,74.8364,a8w8_blockscale_1x128x128_256x128x128x128_16x16_32x32_2x2_8x32x1_8x32x1_1x32x1x8_8_1x1_intrawave_v3,1065.08,761.73,0.0
gfx950,256,4229,4608,2048,ck,0,0,76.6516,a8w8_blockscale_1x128x128_256x128x128x128_16x16_32x32_2x2_8x32x1_8x32x1_1x32x1x8_8_1x1_intrawave_v3,1041.33,744.57,0.0
gfx950,256,4379,4608,2048,ck,0,0,76.8308,a8w8_blockscale_1x128x128_256x128x128x128_16x16_32x32_2x2_8x32x1_8x32x1_1x32x1x8_8_1x1_intrawave_v3,1075.75,764.83,0.0
gfx950,256,4410,4608,2048,ck,0,0,76.3492,a8w8_blockscale_1x128x128_256x128x128x128_16x16_32x32_2x2_8x32x1_8x32x1_1x32x1x8_8_1x1_intrawave_v3,1090.2,774.22,0.0
gfx950,256,4498,4608,2048,cktile,29,0,78.4003,a8w8_blockscale_cktile_192x256x128_4x2x1_16x16x128_intrawave_0x1x0_4,1082.86,766.61,0.0
gfx950,256,4585,4608,2048,cktile,11,0,77.9639,a8w8_blockscale_cktile_192x256x128_4x2x1_16x16x128_intrawave_0x1x0_1,1109.99,783.47,0.0
gfx950,256,4586,4608,2048,cktile,29,0,78.2003,a8w8_blockscale_cktile_192x256x128_4x2x1_16x16x128_intrawave_0x1x0_4,1106.87,781.25,0.0
gfx950,256,4723,4608,2048,cktile,29,0,78.6625,a8w8_blockscale_cktile_192x256x128_4x2x1_16x16x128_intrawave_0x1x0_4,1133.24,796.28,0.0
gfx950,256,4743,4608,2048,cktile,28,0,79.0142,a8w8_blockscale_cktile_192x256x128_4x2x1_16x16x128_intrawave_0x1x0_3,1132.98,795.58,0.0
gfx950,256,4822,4608,2048,cktile,29,0,78.7063,a8w8_blockscale_cktile_192x256x128_4x2x1_16x16x128_intrawave_0x1x0_4,1156.35,810.0,0.0
gfx950,256,4898,4608,2048,cktile,29,0,79.2713,a8w8_blockscale_cktile_192x256x128_4x2x1_16x16x128_intrawave_0x1x0_4,1166.21,815.03,0.0
gfx950,256,4936,4608,2048,cktile,11,0,79.191,a8w8_blockscale_cktile_192x256x128_4x2x1_16x16x128_intrawave_0x1x0_1,1176.45,821.26,0.0
gfx950,256,4992,4608,2048,cktile,11,0,78.9187,a8w8_blockscale_cktile_192x256x128_4x2x1_16x16x128_intrawave_0x1x0_1,1193.9,832.09,0.0
gfx950,256,5000,4608,2048,cktile,11,0,79.1708,a8w8_blockscale_cktile_192x256x128_4x2x1_16x16x128_intrawave_0x1x0_1,1192.0,830.57,0.0
gfx950,256,5001,4608,2048,cktile,11,0,79.3032,a8w8_blockscale_cktile_192x256x128_4x2x1_16x16x128_intrawave_0x1x0_1,1190.25,829.33,0.0
gfx950,256,5002,4608,2048,cktile,29,0,79.4845,a8w8_blockscale_cktile_192x256x128_4x2x1_16x16x128_intrawave_0x1x0_4,1187.77,827.58,0.0
gfx950,256,5003,4608,2048,cktile,28,0,78.7704,a8w8_blockscale_cktile_192x256x128_4x2x1_16x16x128_intrawave_0x1x0_3,1198.78,835.22,0.0
gfx950,256,5004,4608,2048,cktile,11,0,79.5979,a8w8_blockscale_cktile_192x256x128_4x2x1_16x16x128_intrawave_0x1x0_1,1186.56,826.68,0.0
gfx950,256,5005,4608,2048,cktile,29,0,79.4023,a8w8_blockscale_cktile_192x256x128_4x2x1_16x16x128_intrawave_0x1x0_4,1189.72,828.86,0.0
gfx950,256,5006,4608,2048,cktile,27,0,79.421,a8w8_blockscale_cktile_192x256x128_4x2x1_16x16x128_intrawave_0x1x0_2,1189.67,828.81,0.0
gfx950,256,5010,4608,2048,cktile,11,0,79.1324,a8w8_blockscale_cktile_192x256x128_4x2x1_16x16x128_intrawave_0x1x0_1,1194.97,832.4,0.0
gfx950,256,5011,4608,2048,cktile,11,0,79.7033,a8w8_blockscale_cktile_192x256x128_4x2x1_16x16x128_intrawave_0x1x0_1,1186.64,826.58,0.0
gfx950,256,5012,4608,2048,cktile,29,0,79.3943,a8w8_blockscale_cktile_192x256x128_4x2x1_16x16x128_intrawave_0x1x0_4,1191.5,829.94,0.0
gfx950,256,5026,4608,2048,cktile,29,0,79.2291,a8w8_blockscale_cktile_192x256x128_4x2x1_16x16x128_intrawave_0x1x0_4,1197.32,833.66,0.0
gfx950,256,5028,4608,2048,cktile,29,0,79.3918,a8w8_blockscale_cktile_192x256x128_4x2x1_16x16x128_intrawave_0x1x0_4,1195.34,832.23,0.0
gfx950,256,5030,4608,2048,cktile,28,0,79.5507,a8w8_blockscale_cktile_192x256x128_4x2x1_16x16x128_intrawave_0x1x0_3,1193.43,830.86,0.0
gfx950,256,5031,4608,2048,cktile,27,0,79.6919,a8w8_blockscale_cktile_192x256x128_4x2x1_16x16x128_intrawave_0x1x0_2,1191.55,829.52,0.0
gfx950,256,5060,4608,2048,cktile,28,0,79.6297,a8w8_blockscale_cktile_192x256x128_4x2x1_16x16x128_intrawave_0x1x0_3,1199.36,834.27,0.0
gfx950,256,5062,4608,2048,cktile,11,0,79.6787,a8w8_blockscale_cktile_192x256x128_4x2x1_16x16x128_intrawave_0x1x0_1,1199.09,834.04,0.0
gfx950,256,5063,4608,2048,cktile,28,0,79.7771,a8w8_blockscale_cktile_192x256x128_4x2x1_16x16x128_intrawave_0x1x0_3,1197.85,833.16,0.0
gfx950,256,5091,4608,2048,cktile,11,0,79.7431,a8w8_blockscale_cktile_192x256x128_4x2x1_16x16x128_intrawave_0x1x0_1,1204.99,837.47,0.0
gfx950,256,5105,4608,2048,cktile,11,0,78.5308,a8w8_blockscale_cktile_192x256x128_4x2x1_16x16x128_intrawave_0x1x0_1,1226.95,852.4,0.0
gfx950,256,5120,4608,2048,cktile,11,0,79.2362,a8w8_blockscale_cktile_192x256x128_4x2x1_16x16x128_intrawave_0x1x0_1,1219.6,846.95,0.0
gfx950,256,5122,4608,2048,cktile,28,0,79.3724,a8w8_blockscale_cktile_192x256x128_4x2x1_16x16x128_intrawave_0x1x0_3,1217.99,845.78,0.0
gfx950,256,5123,4608,2048,cktile,28,0,79.5084,a8w8_blockscale_cktile_192x256x128_4x2x1_16x16x128_intrawave_0x1x0_3,1216.14,844.47,0.0
gfx950,256,5124,4608,2048,cktile,11,0,79.9187,a8w8_blockscale_cktile_192x256x128_4x2x1_16x16x128_intrawave_0x1x0_1,1210.13,840.28,0.0
gfx950,256,5127,4608,2048,cktile,11,0,79.5839,a8w8_blockscale_cktile_192x256x128_4x2x1_16x16x128_intrawave_0x1x0_1,1215.94,844.24,0.0
gfx950,256,5177,4608,2048,cktile,11,0,79.1778,a8w8_blockscale_cktile_192x256x128_4x2x1_16x16x128_intrawave_0x1x0_1,1234.09,855.68,0.0
gfx950,256,5183,4608,2048,cktile,27,0,79.3254,a8w8_blockscale_cktile_192x256x128_4x2x1_16x16x128_intrawave_0x1x0_2,1233.22,854.94,0.0
gfx950,256,5252,4608,2048,cktile,27,0,79.4265,a8w8_blockscale_cktile_192x256x128_4x2x1_16x16x128_intrawave_0x1x0_2,1248.05,863.64,0.0
gfx950,256,5255,4608,2048,cktile,11,0,79.4402,a8w8_blockscale_cktile_192x256x128_4x2x1_16x16x128_intrawave_0x1x0_1,1248.55,863.91,0.0
gfx950,256,5361,4608,2048,cktile,27,0,79.8713,a8w8_blockscale_cktile_192x256x128_4x2x1_16x16x128_intrawave_0x1x0_2,1266.86,874.2,0.0
gfx950,256,5427,4608,2048,ck,0,0,97.3792,a8w8_blockscale_1x128x128_256x128x128x128_16x16_32x32_2x2_8x32x1_8x32x1_1x32x1x8_8_1x1_intrawave_v3,1051.88,724.66,0.0
gfx950,256,5471,4608,2048,ck,0,0,98.3201,a8w8_blockscale_1x128x128_256x128x128x128_16x16_32x32_2x2_8x32x1_8x32x1_1x32x1x8_8_1x1_intrawave_v3,1050.26,722.77,0.0
gfx950,256,5534,4608,2048,ck,0,0,98.2565,a8w8_blockscale_1x128x128_256x128x128x128_16x16_32x32_2x2_8x32x1_8x32x1_1x32x1x8_8_1x1_intrawave_v3,1063.04,730.46,0.0
gfx950,256,5564,4608,2048,ck,0,0,98.2236,a8w8_blockscale_1x128x128_256x128x128x128_16x16_32x32_2x2_8x32x1_8x32x1_1x32x1x8_8_1x1_intrawave_v3,1069.16,734.14,0.0
gfx950,256,5671,4608,2048,ck,0,0,98.8205,a8w8_blockscale_1x128x128_256x128x128x128_16x16_32x32_2x2_8x32x1_8x32x1_1x32x1x8_8_1x1_intrawave_v3,1083.14,741.9,0.0
gfx950,256,5927,4608,2048,ck,0,0,101.3921,a8w8_blockscale_1x128x128_256x128x128x128_16x16_32x32_2x2_8x32x1_8x32x1_1x32x1x8_8_1x1_intrawave_v3,1103.32,751.53,0.0
gfx950,256,5954,4608,2048,ck,0,0,100.7081,a8w8_blockscale_1x128x128_256x128x128x128_16x16_32x32_2x2_8x32x1_8x32x1_1x32x1x8_8_1x1_intrawave_v3,1115.88,759.65,0.0
gfx950,256,6000,4608,2048,ck,0,0,102.2433,a8w8_blockscale_1x128x128_256x128x128x128_16x16_32x32_2x2_8x32x1_8x32x1_1x32x1x8_8_1x1_intrawave_v3,1107.61,753.31,0.0
gfx950,256,6002,4608,2048,ck,0,0,101.4225,a8w8_blockscale_1x128x128_256x128x128x128_16x16_32x32_2x2_8x32x1_8x32x1_1x32x1x8_8_1x1_intrawave_v3,1116.95,759.63,0.0
gfx950,256,6146,4608,2048,ck,0,0,103.0053,a8w8_blockscale_1x128x128_256x128x128x128_16x16_32x32_2x2_8x32x1_8x32x1_1x32x1x8_8_1x1_intrawave_v3,1126.17,763.71,0.0
gfx950,256,6194,4608,2048,ck,0,0,102.3617,a8w8_blockscale_1x128x128_256x128x128x128_16x16_32x32_2x2_8x32x1_8x32x1_1x32x1x8_8_1x1_intrawave_v3,1142.11,773.79,0.0
gfx950,256,6227,4608,2048,ck,0,0,102.6182,a8w8_blockscale_1x128x128_256x128x128x128_16x16_32x32_2x2_8x32x1_8x32x1_1x32x1x8_8_1x1_intrawave_v3,1145.32,775.48,0.0
gfx950,256,6229,4608,2048,ck,0,0,102.3702,a8w8_blockscale_1x128x128_256x128x128x128_16x16_32x32_2x2_8x32x1_8x32x1_1x32x1x8_8_1x1_intrawave_v3,1148.46,777.58,0.0
gfx950,256,6234,4608,2048,ck,0,0,102.635,a8w8_blockscale_1x128x128_256x128x128x128_16x16_32x32_2x2_8x32x1_8x32x1_1x32x1x8_8_1x1_intrawave_v3,1146.42,776.12,0.0
gfx950,256,6246,4608,2048,ck,0,0,102.7539,a8w8_blockscale_1x128x128_256x128x128x128_16x16_32x32_2x2_8x32x1_8x32x1_1x32x1x8_8_1x1_intrawave_v3,1147.3,776.54,0.0
gfx950,256,6304,4608,2048,ck,0,0,110.412,a8w8_blockscale_1x128x128_256x128x128x128_16x16_32x32_2x2_8x32x1_8x32x1_1x32x1x8_8_1x1_intrawave_v3,1077.64,728.59,0.0
gfx950,256,6314,4608,2048,cktile,27,0,110.8873,a8w8_blockscale_cktile_192x256x128_4x2x1_16x16x128_intrawave_0x1x0_2,1074.72,726.49,0.0
gfx950,256,6318,4608,2048,cktile,28,0,111.027,a8w8_blockscale_cktile_192x256x128_4x2x1_16x16x128_intrawave_0x1x0_3,1074.05,725.98,0.0
gfx950,256,6341,4608,2048,ck,0,0,110.6076,a8w8_blockscale_1x128x128_256x128x128x128_16x16_32x32_2x2_8x32x1_8x32x1_1x32x1x8_8_1x1_intrawave_v3,1082.04,731.07,0.0
gfx950,256,6377,4608,2048,ck,0,0,109.8924,a8w8_blockscale_1x128x128_256x128x128x128_16x16_32x32_2x2_8x32x1_8x32x1_1x32x1x8_8_1x1_intrawave_v3,1095.27,739.52,0.0
gfx950,256,6476,4608,2048,ck,0,0,110.0884,a8w8_blockscale_1x128x128_256x128x128x128_16x16_32x32_2x2_8x32x1_8x32x1_1x32x1x8_8_1x1_intrawave_v3,1110.29,748.33,0.0
gfx950,256,6483,4608,2048,ck,0,0,111.5896,a8w8_blockscale_1x128x128_256x128x128x128_16x16_32x32_2x2_8x32x1_8x32x1_1x32x1x8_8_1x1_intrawave_v3,1096.54,738.97,0.0
gfx950,256,6492,4608,2048,ck,0,0,109.8748,a8w8_blockscale_1x128x128_256x128x128x128_16x16_32x32_2x2_8x32x1_8x32x1_1x32x1x8_8_1x1_intrawave_v3,1115.2,751.43,0.0
gfx950,256,6519,4608,2048,ck,0,0,110.534,a8w8_blockscale_1x128x128_256x128x128x128_16x16_32x32_2x2_8x32x1_8x32x1_1x32x1x8_8_1x1_intrawave_v3,1113.16,749.7,0.0
gfx950,256,6609,4608,2048,ck,0,0,110.982,a8w8_blockscale_1x128x128_256x128x128x128_16x16_32x32_2x2_8x32x1_8x32x1_1x32x1x8_8_1x1_intrawave_v3,1123.97,755.81,0.0
gfx950,256,6811,4608,2048,cktile,11,0,112.7618,a8w8_blockscale_cktile_192x256x128_4x2x1_16x16x128_intrawave_0x1x0_1,1140.04,764.06,0.0
gfx950,256,6813,4608,2048,cktile,29,0,112.5162,a8w8_blockscale_cktile_192x256x128_4x2x1_16x16x128_intrawave_0x1x0_4,1142.87,765.92,0.0
gfx950,256,6818,4608,2048,cktile,27,0,112.977,a8w8_blockscale_cktile_192x256x128_4x2x1_16x16x128_intrawave_0x1x0_2,1139.04,763.3,0.0
gfx950,256,6830,4608,2048,cktile,11,0,112.9106,a8w8_blockscale_cktile_192x256x128_4x2x1_16x16x128_intrawave_0x1x0_1,1141.72,764.94,0.0
gfx950,256,7001,4608,2048,cktile,27,0,112.2277,a8w8_blockscale_cktile_192x256x128_4x2x1_16x16x128_intrawave_0x1x0_2,1177.42,786.76,0.0
gfx950,256,7025,4608,2048,cktile,11,0,112.9981,a8w8_blockscale_cktile_192x256x128_4x2x1_16x16x128_intrawave_0x1x0_1,1173.4,783.79,0.0
gfx950,256,7121,4608,2048,cktile,11,0,112.2616,a8w8_blockscale_cktile_192x256x128_4x2x1_16x16x128_intrawave_0x1x0_1,1197.24,798.56,0.0
gfx950,256,7169,4608,2048,cktile,11,0,112.568,a8w8_blockscale_cktile_192x256x128_4x2x1_16x16x128_intrawave_0x1x0_1,1202.03,801.19,0.0
gfx950,256,7177,4608,2048,cktile,11,0,113.0119,a8w8_blockscale_cktile_192x256x128_4x2x1_16x16x128_intrawave_0x1x0_1,1198.65,798.84,0.0
gfx950,256,7217,4608,2048,cktile,29,0,112.4295,a8w8_blockscale_cktile_192x256x128_4x2x1_16x16x128_intrawave_0x1x0_4,1211.57,806.99,0.0
gfx950,256,7223,4608,2048,cktile,28,0,112.97,a8w8_blockscale_cktile_192x256x128_4x2x1_16x16x128_intrawave_0x1x0_3,1206.78,803.73,0.0
gfx950,256,7238,4608,2048,cktile,11,0,112.8224,a8w8_blockscale_cktile_192x256x128_4x2x1_16x16x128_intrawave_0x1x0_1,1210.86,806.28,0.0
gfx950,256,7246,4608,2048,cktile,29,0,112.6329,a8w8_blockscale_cktile_192x256x128_4x2x1_16x16x128_intrawave_0x1x0_4,1214.24,808.43,0.0
gfx950,256,7249,4608,2048,cktile,11,0,112.8662,a8w8_blockscale_cktile_192x256x128_4x2x1_16x16x128_intrawave_0x1x0_1,1212.23,807.06,0.0
gfx950,256,7316,4608,2048,cktile,29,0,113.7013,a8w8_blockscale_cktile_192x256x128_4x2x1_16x16x128_intrawave_0x1x0_4,1214.45,807.77,0.0
gfx950,256,7393,4608,2048,cktile,11,0,113.5041,a8w8_blockscale_cktile_192x256x128_4x2x1_16x16x128_intrawave_0x1x0_1,1229.37,816.82,0.0
gfx950,256,7491,4608,2048,cktile,28,0,113.8772,a8w8_blockscale_cktile_192x256x128_4x2x1_16x16x128_intrawave_0x1x0_3,1241.58,823.83,0.0
gfx950,256,7558,4608,2048,cktile,28,0,113.9509,a8w8_blockscale_cktile_192x256x128_4x2x1_16x16x128_intrawave_0x1x0_3,1251.88,829.92,0.0
gfx950,256,7650,4608,2048,cktile,29,0,113.9294,a8w8_blockscale_cktile_192x256x128_4x2x1_16x16x128_intrawave_0x1x0_4,1267.35,839.18,0.0
gfx950,256,7753,4608,2048,cktile,11,0,113.6156,a8w8_blockscale_cktile_192x256x128_4x2x1_16x16x128_intrawave_0x1x0_1,1287.97,851.71,0.0
gfx950,256,7774,4608,2048,cktile,28,0,113.7991,a8w8_blockscale_cktile_192x256x128_4x2x1_16x16x128_intrawave_0x1x0_3,1289.37,852.41,0.0
gfx950,256,7815,4608,2048,cktile,28,0,113.3843,a8w8_blockscale_cktile_192x256x128_4x2x1_16x16x128_intrawave_0x1x0_3,1300.91,859.6,0.0
gfx950,256,7834,4608,2048,cktile,28,0,113.5747,a8w8_blockscale_cktile_192x256x128_4x2x1_16x16x128_intrawave_0x1x0_3,1301.89,860.05,0.0
gfx950,256,7836,4608,2048,cktile,27,0,113.8783,a8w8_blockscale_cktile_192x256x128_4x2x1_16x16x128_intrawave_0x1x0_2,1298.75,857.95,0.0
gfx950,256,7871,4608,2048,cktile,29,0,114.0979,a8w8_blockscale_cktile_192x256x128_4x2x1_16x16x128_intrawave_0x1x0_4,1302.04,859.75,0.0
gfx950,256,7899,4608,2048,cktile,29,0,113.9587,a8w8_blockscale_cktile_192x256x128_4x2x1_16x16x128_intrawave_0x1x0_4,1308.27,863.57,0.0
gfx950,256,7913,4608,2048,cktile,27,0,114.1395,a8w8_blockscale_cktile_192x256x128_4x2x1_16x16x128_intrawave_0x1x0_2,1308.51,863.59,0.0
gfx950,256,7930,4608,2048,cktile,11,0,113.6046,a8w8_blockscale_cktile_192x256x128_4x2x1_16x16x128_intrawave_0x1x0_1,1317.5,869.34,0.0
gfx950,256,7961,4608,2048,cktile,28,0,113.3604,a8w8_blockscale_cktile_192x256x128_4x2x1_16x16x128_intrawave_0x1x0_3,1325.5,874.29,0.0
gfx950,256,7963,4608,2048,cktile,11,0,114.2922,a8w8_blockscale_cktile_192x256x128_4x2x1_16x16x128_intrawave_0x1x0_1,1315.02,867.36,0.0
gfx950,256,7974,4608,2048,cktile,28,0,114.2869,a8w8_blockscale_cktile_192x256x128_4x2x1_16x16x128_intrawave_0x1x0_3,1316.9,868.48,0.0
gfx950,256,8016,4608,2048,cktile,28,0,114.472,a8w8_blockscale_cktile_192x256x128_4x2x1_16x16x128_intrawave_0x1x0_3,1321.69,871.21,0.0
gfx950,256,8017,4608,2048,cktile,29,0,114.2498,a8w8_blockscale_cktile_192x256x128_4x2x1_16x16x128_intrawave_0x1x0_4,1324.43,873.01,0.0
gfx950,256,8103,4608,2048,cktile,27,0,128.9244,a8w8_blockscale_cktile_192x256x128_4x2x1_16x16x128_intrawave_0x1x0_2,1186.27,781.15,0.0
gfx950,256,8128,4608,2048,cktile,11,0,129.314,a8w8_blockscale_cktile_192x256x128_4x2x1_16x16x128_intrawave_0x1x0_1,1186.34,780.97,0.0
gfx950,256,8129,4608,2048,cktile,28,0,128.2055,a8w8_blockscale_cktile_192x256x128_4x2x1_16x16x128_intrawave_0x1x0_3,1196.75,787.82,0.0
gfx950,256,8150,4608,2048,cktile,28,0,129.0731,a8w8_blockscale_cktile_192x256x128_4x2x1_16x16x128_intrawave_0x1x0_3,1191.78,784.35,0.0
gfx950,256,8184,4608,2048,cktile,28,0,128.7103,a8w8_blockscale_cktile_192x256x128_4x2x1_16x16x128_intrawave_0x1x0_3,1200.12,789.54,0.0
gfx950,256,8185,4608,2048,cktile,29,0,129.3407,a8w8_blockscale_cktile_192x256x128_4x2x1_16x16x128_intrawave_0x1x0_4,1194.42,785.78,0.0
gfx950,256,8192,4608,2048,ck,0,0,126.9213,a8w8_blockscale_1x128x128_256x128x128x128_16x16_32x32_2x2_8x32x1_8x32x1_1x32x1x8_8_1x1_intrawave_v3,1218.23,801.38,0.0
gfx950,256,1,6144,2048,ck,8,3,7.1462,a8w8_blockscale_1x128x128_256x16x64x256_16x16_16x16_1x1_16x16x1_16x16x1_1x16x1x16_4_1x1_intrawave_v1,3.52,1762.79,0.0
gfx950,256,2,6144,2048,ck,8,3,7.7343,a8w8_blockscale_1x128x128_256x16x64x256_16x16_16x16_1x1_16x16x1_16x16x1_1x16x1x16_4_1x1_intrawave_v1,6.51,1630.6,0.0
gfx950,256,4,6144,2048,ck,8,3,7.7739,a8w8_blockscale_1x128x128_256x16x64x256_16x16_16x16_1x1_16x16x1_16x16x1_1x16x1x16_4_1x1_intrawave_v1,12.95,1625.99,0.0
gfx950,256,8,6144,2048,ck,8,2,8.0312,a8w8_blockscale_1x128x128_256x16x64x256_16x16_16x16_1x1_16x16x1_16x16x1_1x16x1x16_4_1x1_intrawave_v1,25.07,1581.03,0.0
gfx950,256,16,6144,2048,ck,8,2,8.3729,a8w8_blockscale_1x128x128_256x16x64x256_16x16_16x16_1x1_16x16x1_16x16x1_1x16x1x16_4_1x1_intrawave_v1,48.09,1530.21,0.0
gfx950,256,24,6144,2048,ck,8,2,9.0915,a8w8_blockscale_1x128x128_256x16x64x256_16x16_16x16_1x1_16x16x1_16x16x1_1x16x1x16_4_1x1_intrawave_v1,66.43,1421.87,0.0
gfx950,256,32,6144,2048,ck,6,0,14.3518,a8w8_blockscale_1x128x128_256x16x64x128_8x16_16x16_1x1_16x16x1_8x32x1_1x16x1x16_4_1x1_intrawave_v1,56.11,908.71,0.0
gfx950,256,40,6144,2048,ck,7,0,10.4014,a8w8_blockscale_1x128x128_256x16x128x256_16x16_16x16_1x2_16x16x1_16x16x1_1x16x1x16_8_1x2_intrawave_v1,96.78,1264.86,0.0
gfx950,256,48,6144,2048,ck,7,0,10.305,a8w8_blockscale_1x128x128_256x16x128x256_16x16_16x16_1x2_16x16x1_16x16x1_1x16x1x16_8_1x2_intrawave_v1,117.22,1287.83,0.0
gfx950,256,56,6144,2048,ck,7,0,10.5349,a8w8_blockscale_1x128x128_256x16x128x256_16x16_16x16_1x2_16x16x1_16x16x1_1x16x1x16_8_1x2_intrawave_v1,133.77,1270.61,0.0
gfx950,256,64,6144,2048,ck,7,0,10.235,a8w8_blockscale_1x128x128_256x16x128x256_16x16_16x16_1x2_16x16x1_16x16x1_1x16x1x16_8_1x2_intrawave_v1,157.36,1319.04,0.0
gfx950,256,72,6144,2048,ck,7,0,10.2488,a8w8_blockscale_1x128x128_256x16x128x256_16x16_16x16_1x2_16x16x1_16x16x1_1x16x1x16_8_1x2_intrawave_v1,176.8,1328.46,0.0
gfx950,256,80,6144,2048,ck,7,0,10.2564,a8w8_blockscale_1x128x128_256x16x128x256_16x16_16x16_1x2_16x16x1_16x16x1_1x16x1x16_8_1x2_intrawave_v1,196.29,1338.66,0.0
gfx950,256,88,6144,2048,ck,18,0,11.4901,a8w8_blockscale_1x128x128_256x64x64x256_16x16_32x32_1x1_16x16x1_16x16x1_1x32x1x8_8_1x1_intrawave_v1,192.74,1204.91,0.0
gfx950,256,96,6144,2048,ck,18,0,11.4203,a8w8_blockscale_1x128x128_256x64x64x256_16x16_32x32_1x1_16x16x1_16x16x1_1x32x1x8_8_1x1_intrawave_v1,211.55,1222.31,0.0
gfx950,256,104,6144,2048,ck,18,0,11.8589,a8w8_blockscale_1x128x128_256x64x64x256_16x16_32x32_1x1_16x16x1_16x16x1_1x32x1x8_8_1x1_intrawave_v1,220.7,1186.78,0.0
gfx950,256,112,6144,2048,ck,18,0,11.9214,a8w8_blockscale_1x128x128_256x64x64x256_16x16_32x32_1x1_16x16x1_16x16x1_1x32x1x8_8_1x1_intrawave_v1,236.43,1190.17,0.0
gfx950,256,120,6144,2048,ck,18,0,11.8618,a8w8_blockscale_1x128x128_256x64x64x256_16x16_32x32_1x1_16x16x1_16x16x1_1x32x1x8_8_1x1_intrawave_v1,254.59,1205.82,0.0
gfx950,256,128,6144,2048,ck,18,0,10.8745,a8w8_blockscale_1x128x128_256x64x64x256_16x16_32x32_1x1_16x16x1_16x16x1_1x32x1x8_8_1x1_intrawave_v1,296.22,1325.85,0.0
gfx950,256,136,6144,2048,ck,12,0,13.0632,a8w8_blockscale_1x128x128_256x32x128x256_16x16_32x32_1x1_16x16x1_16x16x1_1x32x1x8_8_1x1_intrawave_v1,262.0,1112.48,0.0
gfx950,256,144,6144,2048,ck,12,0,12.9269,a8w8_blockscale_1x128x128_256x32x128x256_16x16_32x32_1x1_16x16x1_16x16x1_1x32x1x8_8_1x1_intrawave_v1,280.34,1133.09,0.0
gfx950,256,152,6144,2048,ck,12,0,12.8599,a8w8_blockscale_1x128x128_256x32x128x256_16x16_32x32_1x1_16x16x1_16x16x1_1x32x1x8_8_1x1_intrawave_v1,297.45,1147.91,0.0
gfx950,256,160,6144,2048,ck,12,0,12.3341,a8w8_blockscale_1x128x128_256x32x128x256_16x16_32x32_1x1_16x16x1_16x16x1_1x32x1x8_8_1x1_intrawave_v1,326.46,1206.14,0.0
gfx950,256,168,6144,2048,ck,3,0,16.1668,a8w8_blockscale_1x128x128_256x64x64x128_16x16_32x32_1x1_8x32x1_8x32x1_1x32x1x8_8_1x1_intrawave_v3,261.51,927.29,0.0
gfx950,256,176,6144,2048,ck,2,0,16.564,a8w8_blockscale_1x128x128_256x64x128x128_16x16_32x32_1x2_8x32x1_8x32x1_1x32x1x8_8_1x1_intrawave_v3,267.4,911.98,0.0
gfx950,256,184,6144,2048,ck,2,0,16.42,a8w8_blockscale_1x128x128_256x64x128x128_16x16_32x32_1x2_8x32x1_8x32x1_1x32x1x8_8_1x1_intrawave_v3,282.0,926.96,0.0
gfx950,256,192,6144,2048,ck,2,0,15.2464,a8w8_blockscale_1x128x128_256x64x128x128_16x16_32x32_1x2_8x32x1_8x32x1_1x32x1x8_8_1x1_intrawave_v3,316.92,1005.84,0.0
gfx950,256,200,6144,2048,ck,2,0,15.3004,a8w8_blockscale_1x128x128_256x64x128x128_16x16_32x32_1x2_8x32x1_8x32x1_1x32x1x8_8_1x1_intrawave_v3,328.96,1009.78,0.0
gfx950,256,208,6144,2048,ck,2,0,15.3587,a8w8_blockscale_1x128x128_256x64x128x128_16x16_32x32_1x2_8x32x1_8x32x1_1x32x1x8_8_1x1_intrawave_v3,340.82,1013.42,0.0
gfx950,256,216,6144,2048,ck,2,0,15.3538,a8w8_blockscale_1x128x128_256x64x128x128_16x16_32x32_1x2_8x32x1_8x32x1_1x32x1x8_8_1x1_intrawave_v3,354.04,1021.21,0.0
gfx950,256,224,6144,2048,ck,2,0,15.4829,a8w8_blockscale_1x128x128_256x64x128x128_16x16_32x32_1x2_8x32x1_8x32x1_1x32x1x8_8_1x1_intrawave_v3,364.09,1020.1,0.0
gfx950,256,232,6144,2048,ck,2,0,15.4377,a8w8_blockscale_1x128x128_256x64x128x128_16x16_32x32_1x2_8x32x1_8x32x1_1x32x1x8_8_1x1_intrawave_v3,378.2,1030.52,0.0
gfx950,256,240,6144,2048,ck,2,0,15.5234,a8w8_blockscale_1x128x128_256x64x128x128_16x16_32x32_1x2_8x32x1_8x32x1_1x32x1x8_8_1x1_intrawave_v3,389.08,1032.22,0.0
gfx950,256,248,6144,2048,ck,2,0,15.492,a8w8_blockscale_1x128x128_256x64x128x128_16x16_32x32_1x2_8x32x1_8x32x1_1x32x1x8_8_1x1_intrawave_v3,402.86,1041.71,0.0
gfx950,256,256,6144,2048,ck,2,0,15.2952,a8w8_blockscale_1x128x128_256x64x128x128_16x16_32x32_1x2_8x32x1_8x32x1_1x32x1x8_8_1x1_intrawave_v3,421.21,1062.62,0.0
gfx950,256,272,6144,2048,ck,2,0,15.4594,a8w8_blockscale_1x128x128_256x64x128x128_16x16_32x32_1x2_8x32x1_8x32x1_1x32x1x8_8_1x1_intrawave_v3,442.78,1066.17,0.0
gfx950,256,288,6144,2048,ck,2,0,15.7035,a8w8_blockscale_1x128x128_256x64x128x128_16x16_32x32_1x2_8x32x1_8x32x1_1x32x1x8_8_1x1_intrawave_v3,461.54,1064.2,0.0
gfx950,256,304,6144,2048,ck,2,0,16.57,a8w8_blockscale_1x128x128_256x64x128x128_16x16_32x32_1x2_8x32x1_8x32x1_1x32x1x8_8_1x1_intrawave_v3,461.7,1022.39,0.0
gfx950,256,320,6144,2048,ck,2,0,15.6725,a8w8_blockscale_1x128x128_256x64x128x128_16x16_32x32_1x2_8x32x1_8x32x1_1x32x1x8_8_1x1_intrawave_v3,513.83,1095.58,0.0
gfx950,256,336,6144,2048,ck,3,0,19.087,a8w8_blockscale_1x128x128_256x64x64x128_16x16_32x32_1x1_8x32x1_8x32x1_1x32x1x8_8_1x1_intrawave_v3,443.01,911.61,0.0
gfx950,256,352,6144,2048,ck,3,0,19.2438,a8w8_blockscale_1x128x128_256x64x64x128_16x16_32x32_1x1_8x32x1_8x32x1_1x32x1x8_8_1x1_intrawave_v3,460.32,916.1,0.0
gfx950,256,368,6144,2048,ck,3,0,19.4599,a8w8_blockscale_1x128x128_256x64x64x128_16x16_32x32_1x1_8x32x1_8x32x1_1x32x1x8_8_1x1_intrawave_v3,475.9,917.71,0.0
gfx950,256,384,6144,2048,ck,0,0,19.2787,a8w8_blockscale_1x128x128_256x128x128x128_16x16_32x32_2x2_8x32x1_8x32x1_1x32x1x8_8_1x1_intrawave_v3,501.26,938.23,0.0
gfx950,256,400,6144,2048,ck,0,0,19.7987,a8w8_blockscale_1x128x128_256x128x128x128_16x16_32x32_2x2_8x32x1_8x32x1_1x32x1x8_8_1x1_intrawave_v3,508.43,925.18,0.0
gfx950,256,416,6144,2048,ck,0,0,19.9708,a8w8_blockscale_1x128x128_256x128x128x128_16x16_32x32_2x2_8x32x1_8x32x1_1x32x1x8_8_1x1_intrawave_v3,524.21,928.69,0.0
gfx950,256,432,6144,2048,ck,0,0,20.1293,a8w8_blockscale_1x128x128_256x128x128x128_16x16_32x32_2x2_8x32x1_8x32x1_1x32x1x8_8_1x1_intrawave_v3,540.09,932.77,0.0
gfx950,256,448,6144,2048,ck,0,0,20.2676,a8w8_blockscale_1x128x128_256x128x128x128_16x16_32x32_2x2_8x32x1_8x32x1_1x32x1x8_8_1x1_intrawave_v3,556.27,937.73,0.0
gfx950,256,464,6144,2048,ck,0,0,20.2733,a8w8_blockscale_1x128x128_256x128x128x128_16x16_32x32_2x2_8x32x1_8x32x1_1x32x1x8_8_1x1_intrawave_v3,575.98,948.78,0.0
gfx950,256,480,6144,2048,ck,0,0,20.4057,a8w8_blockscale_1x128x128_256x128x128x128_16x16_32x32_2x2_8x32x1_8x32x1_1x32x1x8_8_1x1_intrawave_v3,591.97,953.86,0.0
gfx950,256,496,6144,2048,ck,0,0,20.5701,a8w8_blockscale_1x128x128_256x128x128x128_16x16_32x32_2x2_8x32x1_8x32x1_1x32x1x8_8_1x1_intrawave_v3,606.82,957.39,0.0
gfx950,256,512,6144,2048,ck,0,0,19.6396,a8w8_blockscale_1x128x128_256x128x128x128_16x16_32x32_2x2_8x32x1_8x32x1_1x32x1x8_8_1x1_intrawave_v3,656.07,1014.43,0.0
gfx950,256,664,6144,2048,ck,2,0,28.4642,a8w8_blockscale_1x128x128_256x64x128x128_16x16_32x32_1x2_8x32x1_8x32x1_1x32x1x8_8_1x1_intrawave_v3,587.06,776.48,0.0
gfx950,256,762,6144,2048,ck,2,0,28.8483,a8w8_blockscale_1x128x128_256x64x128x128_16x16_32x32_1x2_8x32x1_8x32x1_1x32x1x8_8_1x1_intrawave_v3,664.73,814.85,0.0
gfx950,256,902,6144,2048,ck,2,0,30.3879,a8w8_blockscale_1x128x128_256x64x128x128_16x16_32x32_1x2_8x32x1_8x32x1_1x32x1x8_8_1x1_intrawave_v3,746.99,839.61,0.0
gfx950,256,961,6144,2048,ck,2,0,30.3457,a8w8_blockscale_1x128x128_256x64x128x128_16x16_32x32_1x2_8x32x1_8x32x1_1x32x1x8_8_1x1_intrawave_v3,796.96,868.65,0.0
gfx950,256,1000,6144,2048,ck,2,0,31.3273,a8w8_blockscale_1x128x128_256x64x128x128_16x16_32x32_1x2_8x32x1_8x32x1_1x32x1x8_8_1x1_intrawave_v3,803.32,859.28,0.0
gfx950,256,1001,6144,2048,ck,2,0,31.2785,a8w8_blockscale_1x128x128_256x64x128x128_16x16_32x32_1x2_8x32x1_8x32x1_1x32x1x8_8_1x1_intrawave_v3,805.38,861.08,0.0
gfx950,256,1002,6144,2048,ck,2,0,30.7465,a8w8_blockscale_1x128x128_256x64x128x128_16x16_32x32_1x2_8x32x1_8x32x1_1x32x1x8_8_1x1_intrawave_v3,820.13,876.44,0.0
gfx950,256,1003,6144,2048,ck,2,0,31.5633,a8w8_blockscale_1x128x128_256x64x128x128_16x16_32x32_1x2_8x32x1_8x32x1_1x32x1x8_8_1x1_intrawave_v3,799.7,854.22,0.0
gfx950,256,1015,6144,2048,ck,2,0,31.7344,a8w8_blockscale_1x128x128_256x64x128x128_16x16_32x32_1x2_8x32x1_8x32x1_1x32x1x8_8_1x1_intrawave_v3,804.91,855.03,0.0
gfx950,256,1023,6144,2048,ck,2,0,31.3041,a8w8_blockscale_1x128x128_256x64x128x128_16x16_32x32_1x2_8x32x1_8x32x1_1x32x1x8_8_1x1_intrawave_v3,822.4,870.45,0.0
gfx950,256,1024,6144,2048,ck,0,0,31.7313,a8w8_blockscale_1x128x128_256x128x128x128_16x16_32x32_2x2_8x32x1_8x32x1_1x32x1x8_8_1x1_intrawave_v3,812.13,859.18,0.0
gfx950,256,1025,6144,2048,ck,0,0,32.9492,a8w8_blockscale_1x128x128_256x128x128x128_16x16_32x32_2x2_8x32x1_8x32x1_1x32x1x8_8_1x1_intrawave_v3,782.87,827.86,0.0
gfx950,256,1032,6144,2048,ck,0,0,32.7757,a8w8_blockscale_1x128x128_256x128x128x128_16x16_32x32_2x2_8x32x1_8x32x1_1x32x1x8_8_1x1_intrawave_v3,792.39,835.3,0.0
gfx950,256,1038,6144,2048,ck,0,0,32.5666,a8w8_blockscale_1x128x128_256x128x128x128_16x16_32x32_2x2_8x32x1_8x32x1_1x32x1x8_8_1x1_intrawave_v3,802.11,843.31,0.0
gfx950,256,1087,6144,2048,ck,0,0,32.3185,a8w8_blockscale_1x128x128_256x128x128x128_16x16_32x32_2x2_8x32x1_8x32x1_1x32x1x8_8_1x1_intrawave_v3,846.43,871.52,0.0
gfx950,256,1255,6144,2048,ck,0,0,34.4389,a8w8_blockscale_1x128x128_256x128x128x128_16x16_32x32_2x2_8x32x1_8x32x1_1x32x1x8_8_1x1_intrawave_v3,917.08,887.79,0.0
gfx950,256,1351,6144,2048,cktile,12,0,39.731,a8w8_blockscale_cktile_192x256x128_4x2x1_16x16x128_intrawave_0x1x0_1_aqrm,855.73,804.18,0.0
gfx950,256,1376,6144,2048,cktile,31,0,39.6114,a8w8_blockscale_cktile_192x256x128_4x2x1_16x16x128_intrawave_0x1x0_3_aqrm,874.2,815.66,0.0
gfx950,256,1380,6144,2048,cktile,31,0,39.68,a8w8_blockscale_cktile_192x256x128_4x2x1_16x16x128_intrawave_0x1x0_3_aqrm,875.22,815.69,0.0
gfx950,256,1391,6144,2048,cktile,32,0,39.7942,a8w8_blockscale_cktile_192x256x128_4x2x1_16x16x128_intrawave_0x1x0_4_aqrm,879.67,817.31,0.0
gfx950,256,1710,6144,2048,cktile,32,0,40.1807,a8w8_blockscale_cktile_192x256x128_4x2x1_16x16x128_intrawave_0x1x0_4_aqrm,1071.0,923.27,0.0
gfx950,256,1808,6144,2048,cktile,32,0,40.9486,a8w8_blockscale_cktile_192x256x128_4x2x1_16x16x128_intrawave_0x1x0_4_aqrm,1111.14,940.26,0.0
gfx950,256,1809,6144,2048,cktile,12,0,41.4541,a8w8_blockscale_cktile_192x256x128_4x2x1_16x16x128_intrawave_0x1x0_1_aqrm,1098.2,929.14,0.0
gfx950,256,1870,6144,2048,cktile,30,0,41.2348,a8w8_blockscale_cktile_192x256x128_4x2x1_16x16x128_intrawave_0x1x0_2_aqrm,1141.27,955.29,0.0
gfx950,256,1967,6144,2048,ck,0,0,50.2701,a8w8_blockscale_1x128x128_256x128x128x128_16x16_32x32_2x2_8x32x1_8x32x1_1x32x1x8_8_1x1_intrawave_v3,984.7,811.25,0.0
gfx950,256,1970,6144,2048,ck,0,0,49.7949,a8w8_blockscale_1x128x128_256x128x128x128_16x16_32x32_2x2_8x32x1_8x32x1_1x32x1x8_8_1x1_intrawave_v3,995.62,819.86,0.0
gfx950,256,2000,6144,2048,ck,0,0,49.6955,a8w8_blockscale_1x128x128_256x128x128x128_16x16_32x32_2x2_8x32x1_8x32x1_1x32x1x8_8_1x1_intrawave_v3,1012.8,830.15,0.0
gfx950,256,2001,6144,2048,ck,0,0,50.4797,a8w8_blockscale_1x128x128_256x128x128x128_16x16_32x32_2x2_8x32x1_8x32x1_1x32x1x8_8_1x1_intrawave_v3,997.57,817.54,0.0
gfx950,256,2016,6144,2048,ck,0,0,50.6721,a8w8_blockscale_1x128x128_256x128x128x128_16x16_32x32_2x2_8x32x1_8x32x1_1x32x1x8_8_1x1_intrawave_v3,1001.23,818.68,0.0
gfx950,256,2017,6144,2048,ck,0,0,50.3885,a8w8_blockscale_1x128x128_256x128x128x128_16x16_32x32_2x2_8x32x1_8x32x1_1x32x1x8_8_1x1_intrawave_v3,1007.36,823.57,0.0
gfx950,256,2046,6144,2048,ck,0,0,51.2889,a8w8_blockscale_1x128x128_256x128x128x128_16x16_32x32_2x2_8x32x1_8x32x1_1x32x1x8_8_1x1_intrawave_v3,1003.91,817.22,0.0
gfx950,256,2048,6144,2048,ck,0,0,49.792,a8w8_blockscale_1x128x128_256x128x128x128_16x16_32x32_2x2_8x32x1_8x32x1_1x32x1x8_8_1x1_intrawave_v3,1035.1,842.37,0.0
gfx950,256,2050,6144,2048,ck,0,0,57.7804,a8w8_blockscale_1x128x128_256x128x128x128_16x16_32x32_2x2_8x32x1_8x32x1_1x32x1x8_8_1x1_intrawave_v3,892.86,726.4,0.0
gfx950,256,2081,6144,2048,ck,0,0,58.4126,a8w8_blockscale_1x128x128_256x128x128x128_16x16_32x32_2x2_8x32x1_8x32x1_1x32x1x8_8_1x1_intrawave_v3,896.55,726.15,0.0
gfx950,256,2095,6144,2048,ck,0,0,58.295,a8w8_blockscale_1x128x128_256x128x128x128_16x16_32x32_2x2_8x32x1_8x32x1_1x32x1x8_8_1x1_intrawave_v3,904.41,731.05,0.0
gfx950,256,2154,6144,2048,ck,0,0,58.3395,a8w8_blockscale_1x128x128_256x128x128x128_16x16_32x32_2x2_8x32x1_8x32x1_1x32x1x8_8_1x1_intrawave_v3,929.17,745.0,0.0
gfx950,256,2159,6144,2048,ck,0,0,58.6267,a8w8_blockscale_1x128x128_256x128x128x128_16x16_32x32_2x2_8x32x1_8x32x1_1x32x1x8_8_1x1_intrawave_v3,926.76,742.57,0.0
gfx950,256,2162,6144,2048,ck,0,0,58.8944,a8w8_blockscale_1x128x128_256x128x128x128_16x16_32x32_2x2_8x32x1_8x32x1_1x32x1x8_8_1x1_intrawave_v3,923.83,739.92,0.0
gfx950,256,2165,6144,2048,ck,0,0,58.5918,a8w8_blockscale_1x128x128_256x128x128x128_16x16_32x32_2x2_8x32x1_8x32x1_1x32x1x8_8_1x1_intrawave_v3,929.89,744.48,0.0
gfx950,256,2251,6144,2048,ck,0,0,59.0894,a8w8_blockscale_1x128x128_256x128x128x128_16x16_32x32_2x2_8x32x1_8x32x1_1x32x1x8_8_1x1_intrawave_v3,958.69,759.07,0.0
gfx950,256,2252,6144,2048,ck,0,0,58.9366,a8w8_blockscale_1x128x128_256x128x128x128_16x16_32x32_2x2_8x32x1_8x32x1_1x32x1x8_8_1x1_intrawave_v3,961.6,761.29,0.0
gfx950,256,2255,6144,2048,ck,0,0,59.1658,a8w8_blockscale_1x128x128_256x128x128x128_16x16_32x32_2x2_8x32x1_8x32x1_1x32x1x8_8_1x1_intrawave_v3,959.15,759.06,0.0
gfx950,256,2317,6144,2048,ck,0,0,59.2654,a8w8_blockscale_1x128x128_256x128x128x128_16x16_32x32_2x2_8x32x1_8x32x1_1x32x1x8_8_1x1_intrawave_v3,983.87,772.79,0.0
gfx950,256,2694,6144,2048,ck,0,0,72.5039,a8w8_blockscale_1x128x128_256x128x128x128_16x16_32x32_2x2_8x32x1_8x32x1_1x32x1x8_8_1x1_intrawave_v3,935.08,706.23,0.0
gfx950,256,2715,6144,2048,ck,0,0,72.3971,a8w8_blockscale_1x128x128_256x128x128x128_16x16_32x32_2x2_8x32x1_8x32x1_1x32x1x8_8_1x1_intrawave_v3,943.76,711.43,0.0
gfx950,256,2819,6144,2048,ck,0,0,72.3223,a8w8_blockscale_1x128x128_256x128x128x128_16x16_32x32_2x2_8x32x1_8x32x1_1x32x1x8_8_1x1_intrawave_v3,980.92,732.78,0.0
gfx950,256,2853,6144,2048,ck,0,0,73.1979,a8w8_blockscale_1x128x128_256x128x128x128_16x16_32x32_2x2_8x32x1_8x32x1_1x32x1x8_8_1x1_intrawave_v3,980.88,730.67,0.0
gfx950,256,2914,6144,2048,ck,0,0,72.9171,a8w8_blockscale_1x128x128_256x128x128x128_16x16_32x32_2x2_8x32x1_8x32x1_1x32x1x8_8_1x1_intrawave_v3,1005.71,745.48,0.0
gfx950,256,2974,6144,2048,ck,0,0,73.6987,a8w8_blockscale_1x128x128_256x128x128x128_16x16_32x32_2x2_8x32x1_8x32x1_1x32x1x8_8_1x1_intrawave_v3,1015.53,749.24,0.0
gfx950,256,3000,6144,2048,ck,0,0,73.8311,a8w8_blockscale_1x128x128_256x128x128x128_16x16_32x32_2x2_8x32x1_8x32x1_1x32x1x8_8_1x1_intrawave_v3,1022.57,752.95,0.0
gfx950,256,3001,6144,2048,ck,0,0,73.8287,a8w8_blockscale_1x128x128_256x128x128x128_16x16_32x32_2x2_8x32x1_8x32x1_1x32x1x8_8_1x1_intrawave_v3,1022.94,753.17,0.0
gfx950,256,3072,6144,2048,ck,0,0,72.5024,a8w8_blockscale_1x128x128_256x128x128x128_16x16_32x32_2x2_8x32x1_8x32x1_1x32x1x8_8_1x1_intrawave_v3,1066.3,780.98,0.0
gfx950,256,3073,6144,2048,ck,0,0,75.2756,a8w8_blockscale_1x128x128_256x128x128x128_16x16_32x32_2x2_8x32x1_8x32x1_1x32x1x8_8_1x1_intrawave_v3,1027.35,752.4,0.0
gfx950,256,3077,6144,2048,ck,0,0,74.8732,a8w8_blockscale_1x128x128_256x128x128x128_16x16_32x32_2x2_8x32x1_8x32x1_1x32x1x8_8_1x1_intrawave_v3,1034.22,757.21,0.0
gfx950,256,3078,6144,2048,ck,0,0,74.68,a8w8_blockscale_1x128x128_256x128x128x128_16x16_32x32_2x2_8x32x1_8x32x1_1x32x1x8_8_1x1_intrawave_v3,1037.23,759.36,0.0
gfx950,256,3086,6144,2048,cktile,28,0,77.0254,a8w8_blockscale_cktile_192x256x128_4x2x1_16x16x128_intrawave_0x1x0_3,1008.26,737.73,0.0
gfx950,256,3089,6144,2048,ck,0,0,74.2548,a8w8_blockscale_1x128x128_256x128x128x128_16x16_32x32_2x2_8x32x1_8x32x1_1x32x1x8_8_1x1_intrawave_v3,1046.9,765.83,0.0
gfx950,256,3118,6144,2048,ck,0,0,76.3388,a8w8_blockscale_1x128x128_256x128x128x128_16x16_32x32_2x2_8x32x1_8x32x1_1x32x1x8_8_1x1_intrawave_v3,1027.88,750.37,0.0
gfx950,256,3138,6144,2048,ck,0,0,74.7804,a8w8_blockscale_1x128x128_256x128x128x128_16x16_32x32_2x2_8x32x1_8x32x1_1x32x1x8_8_1x1_intrawave_v3,1056.03,769.84,0.0
gfx950,256,3154,6144,2048,ck,0,0,75.1908,a8w8_blockscale_1x128x128_256x128x128x128_16x16_32x32_2x2_8x32x1_8x32x1_1x32x1x8_8_1x1_intrawave_v3,1055.62,768.69,0.0
gfx950,256,3289,6144,2048,ck,0,0,75.0748,a8w8_blockscale_1x128x128_256x128x128x128_16x16_32x32_2x2_8x32x1_8x32x1_1x32x1x8_8_1x1_intrawave_v3,1102.51,795.66,0.0
gfx950,256,3437,6144,2048,cktile,27,0,78.0738,a8w8_blockscale_cktile_192x256x128_4x2x1_16x16x128_intrawave_0x1x0_2,1107.86,792.27,0.0
gfx950,256,3617,6144,2048,cktile,28,0,78.1166,a8w8_blockscale_cktile_192x256x128_4x2x1_16x16x128_intrawave_0x1x0_3,1165.24,824.87,0.0
gfx950,256,3620,6144,2048,cktile,28,0,78.1755,a8w8_blockscale_cktile_192x256x128_4x2x1_16x16x128_intrawave_0x1x0_3,1165.33,824.8,0.0
gfx950,256,3669,6144,2048,cktile,28,0,78.4939,a8w8_blockscale_cktile_192x256x128_4x2x1_16x16x128_intrawave_0x1x0_3,1176.31,830.4,0.0
gfx950,256,3824,6144,2048,cktile,28,0,78.7606,a8w8_blockscale_cktile_192x256x128_4x2x1_16x16x128_intrawave_0x1x0_3,1221.86,855.81,0.0
gfx950,256,3858,6144,2048,cktile,28,0,79.3294,a8w8_blockscale_cktile_192x256x128_4x2x1_16x16x128_intrawave_0x1x0_3,1223.88,855.81,0.0
gfx950,256,3906,6144,2048,cktile,28,0,79.5219,a8w8_blockscale_cktile_192x256x128_4x2x1_16x16x128_intrawave_0x1x0_3,1236.11,862.4,0.0
gfx950,256,4000,6144,2048,cktile,29,0,80.0798,a8w8_blockscale_cktile_192x256x128_4x2x1_16x16x128_intrawave_0x1x0_4,1257.04,873.22,0.0
gfx950,256,4004,6144,2048,cktile,28,0,80.2699,a8w8_blockscale_cktile_192x256x128_4x2x1_16x16x128_intrawave_0x1x0_3,1255.31,871.86,0.0
gfx950,256,4100,6144,2048,ck,0,0,98.819,a8w8_blockscale_1x128x128_256x128x128x128_16x16_32x32_2x2_8x32x1_8x32x1_1x32x1x8_8_1x1_intrawave_v3,1044.13,722.13,0.0
gfx950,256,4108,6144,2048,ck,0,0,98.483,a8w8_blockscale_1x128x128_256x128x128x128_16x16_32x32_2x2_8x32x1_8x32x1_1x32x1x8_8_1x1_intrawave_v3,1049.74,725.76,0.0
gfx950,256,4121,6144,2048,ck,0,0,99.291,a8w8_blockscale_1x128x128_256x128x128x128_16x16_32x32_2x2_8x32x1_8x32x1_1x32x1x8_8_1x1_intrawave_v3,1044.49,721.73,0.0
gfx950,256,4123,6144,2048,ck,0,0,97.3962,a8w8_blockscale_1x128x128_256x128x128x128_16x16_32x32_2x2_8x32x1_8x32x1_1x32x1x8_8_1x1_intrawave_v3,1065.33,736.07,0.0
gfx950,256,4149,6144,2048,ck,0,0,99.053,a8w8_blockscale_1x128x128_256x128x128x128_16x16_32x32_2x2_8x32x1_8x32x1_1x32x1x8_8_1x1_intrawave_v3,1054.11,727.52,0.0
gfx950,256,4204,6144,2048,ck,0,0,98.9506,a8w8_blockscale_1x128x128_256x128x128x128_16x16_32x32_2x2_8x32x1_8x32x1_1x32x1x8_8_1x1_intrawave_v3,1069.19,736.24,0.0
gfx950,256,4223,6144,2048,ck,0,0,99.9354,a8w8_blockscale_1x128x128_256x128x128x128_16x16_32x32_2x2_8x32x1_8x32x1_1x32x1x8_8_1x1_intrawave_v3,1063.44,731.71,0.0
gfx950,256,4229,6144,2048,ck,0,0,100.7742,a8w8_blockscale_1x128x128_256x128x128x128_16x16_32x32_2x2_8x32x1_8x32x1_1x32x1x8_8_1x1_intrawave_v3,1056.09,726.47,0.0
gfx950,256,4379,6144,2048,ck,0,0,99.201,a8w8_blockscale_1x128x128_256x128x128x128_16x16_32x32_2x2_8x32x1_8x32x1_1x32x1x8_8_1x1_intrawave_v3,1110.89,759.67,0.0
gfx950,256,4410,6144,2048,ck,0,0,99.5754,a8w8_blockscale_1x128x128_256x128x128x128_16x16_32x32_2x2_8x32x1_8x32x1_1x32x1x8_8_1x1_intrawave_v3,1114.55,761.28,0.0
gfx950,256,4498,6144,2048,ck,0,0,100.3558,a8w8_blockscale_1x128x128_256x128x128x128_16x16_32x32_2x2_8x32x1_8x32x1_1x32x1x8_8_1x1_intrawave_v3,1127.95,767.93,0.0
gfx950,256,4585,6144,2048,ck,0,0,100.5363,a8w8_blockscale_1x128x128_256x128x128x128_16x16_32x32_2x2_8x32x1_8x32x1_1x32x1x8_8_1x1_intrawave_v3,1147.7,778.96,0.0
gfx950,256,4586,6144,2048,cktile,11,0,111.5145,a8w8_blockscale_cktile_192x256x128_4x2x1_16x16x128_intrawave_0x1x0_1,1034.94,702.4,0.0
gfx950,256,4723,6144,2048,ck,0,0,101.9207,a8w8_blockscale_1x128x128_256x128x128x128_16x16_32x32_2x2_8x32x1_8x32x1_1x32x1x8_8_1x1_intrawave_v3,1166.18,787.79,0.0
gfx950,256,4743,6144,2048,ck,0,0,109.9695,a8w8_blockscale_1x128x128_256x128x128x128_16x16_32x32_2x2_8x32x1_8x32x1_1x32x1x8_8_1x1_intrawave_v3,1085.41,732.74,0.0
gfx950,256,4822,6144,2048,ck,0,0,111.2368,a8w8_blockscale_1x128x128_256x128x128x128_16x16_32x32_2x2_8x32x1_8x32x1_1x32x1x8_8_1x1_intrawave_v3,1090.91,734.57,0.0
gfx950,256,4898,6144,2048,ck,0,0,110.6756,a8w8_blockscale_1x128x128_256x128x128x128_16x16_32x32_2x2_8x32x1_8x32x1_1x32x1x8_8_1x1_intrawave_v3,1113.73,748.14,0.0
gfx950,256,4936,6144,2048,ck,0,0,110.6856,a8w8_blockscale_1x128x128_256x128x128x128_16x16_32x32_2x2_8x32x1_8x32x1_1x32x1x8_8_1x1_intrawave_v3,1122.26,752.99,0.0
gfx950,256,4992,6144,2048,ck,0,0,108.5943,a8w8_blockscale_1x128x128_256x128x128x128_16x16_32x32_2x2_8x32x1_8x32x1_1x32x1x8_8_1x1_intrawave_v3,1156.85,774.89,0.0
gfx950,256,5000,6144,2048,ck,0,0,112.1236,a8w8_blockscale_1x128x128_256x128x128x128_16x16_32x32_2x2_8x32x1_8x32x1_1x32x1x8_8_1x1_intrawave_v3,1122.24,751.52,0.0
gfx950,256,5001,6144,2048,ck,0,0,112.8696,a8w8_blockscale_1x128x128_256x128x128x128_16x16_32x32_2x2_8x32x1_8x32x1_1x32x1x8_8_1x1_intrawave_v3,1115.04,746.68,0.0
gfx950,256,5002,6144,2048,ck,0,0,111.3312,a8w8_blockscale_1x128x128_256x128x128x128_16x16_32x32_2x2_8x32x1_8x32x1_1x32x1x8_8_1x1_intrawave_v3,1130.68,757.12,0.0
gfx950,256,5003,6144,2048,ck,0,0,111.4484,a8w8_blockscale_1x128x128_256x128x128x128_16x16_32x32_2x2_8x32x1_8x32x1_1x32x1x8_8_1x1_intrawave_v3,1129.71,756.46,0.0
gfx950,256,5004,6144,2048,cktile,11,0,112.8586,a8w8_blockscale_cktile_192x256x128_4x2x1_16x16x128_intrawave_0x1x0_1,1115.82,747.13,0.0
gfx950,256,5005,6144,2048,ck,0,0,110.9815,a8w8_blockscale_1x128x128_256x128x128x128_16x16_32x32_2x2_8x32x1_8x32x1_1x32x1x8_8_1x1_intrawave_v3,1134.92,759.9,0.0
gfx950,256,5006,6144,2048,ck,0,0,111.4596,a8w8_blockscale_1x128x128_256x128x128x128_16x16_32x32_2x2_8x32x1_8x32x1_1x32x1x8_8_1x1_intrawave_v3,1130.28,756.77,0.0
gfx950,256,5010,6144,2048,ck,0,0,111.3228,a8w8_blockscale_1x128x128_256x128x128x128_16x16_32x32_2x2_8x32x1_8x32x1_1x32x1x8_8_1x1_intrawave_v3,1132.57,758.21,0.0
gfx950,256,5011,6144,2048,ck,0,0,112.1708,a8w8_blockscale_1x128x128_256x128x128x128_16x16_32x32_2x2_8x32x1_8x32x1_1x32x1x8_8_1x1_intrawave_v3,1124.23,752.61,0.0
gfx950,256,5012,6144,2048,cktile,28,0,112.5118,a8w8_blockscale_cktile_192x256x128_4x2x1_16x16x128_intrawave_0x1x0_3,1121.05,750.45,0.0
gfx950,256,5026,6144,2048,ck,0,0,111.2624,a8w8_blockscale_1x128x128_256x128x128x128_16x16_32x32_2x2_8x32x1_8x32x1_1x32x1x8_8_1x1_intrawave_v3,1136.8,760.69,0.0
gfx950,256,5028,6144,2048,ck,0,0,111.1032,a8w8_blockscale_1x128x128_256x128x128x128_16x16_32x32_2x2_8x32x1_8x32x1_1x32x1x8_8_1x1_intrawave_v3,1138.88,762.03,0.0
gfx950,256,5030,6144,2048,ck,0,0,111.6172,a8w8_blockscale_1x128x128_256x128x128x128_16x16_32x32_2x2_8x32x1_8x32x1_1x32x1x8_8_1x1_intrawave_v3,1134.09,758.78,0.0
gfx950,256,5031,6144,2048,ck,0,0,111.3288,a8w8_blockscale_1x128x128_256x128x128x128_16x16_32x32_2x2_8x32x1_8x32x1_1x32x1x8_8_1x1_intrawave_v3,1137.26,760.88,0.0
gfx950,256,5060,6144,2048,ck,0,0,111.0543,a8w8_blockscale_1x128x128_256x128x128x128_16x16_32x32_2x2_8x32x1_8x32x1_1x32x1x8_8_1x1_intrawave_v3,1146.64,766.5,0.0
gfx950,256,5062,6144,2048,ck,0,0,111.8047,a8w8_blockscale_1x128x128_256x128x128x128_16x16_32x32_2x2_8x32x1_8x32x1_1x32x1x8_8_1x1_intrawave_v3,1139.39,761.61,0.0
gfx950,256,5063,6144,2048,ck,0,0,111.5107,a8w8_blockscale_1x128x128_256x128x128x128_16x16_32x32_2x2_8x32x1_8x32x1_1x32x1x8_8_1x1_intrawave_v3,1142.62,763.75,0.0
gfx950,256,5091,6144,2048,ck,0,0,111.5855,a8w8_blockscale_1x128x128_256x128x128x128_16x16_32x32_2x2_8x32x1_8x32x1_1x32x1x8_8_1x1_intrawave_v3,1148.17,766.83,0.0
gfx950,256,5105,6144,2048,ck,0,0,111.5887,a8w8_blockscale_1x128x128_256x128x128x128_16x16_32x32_2x2_8x32x1_8x32x1_1x32x1x8_8_1x1_intrawave_v3,1151.3,768.61,0.0
gfx950,256,5120,6144,2048,ck,0,0,109.8307,a8w8_blockscale_1x128x128_256x128x128x128_16x16_32x32_2x2_8x32x1_8x32x1_1x32x1x8_8_1x1_intrawave_v3,1173.16,782.87,0.0
gfx950,256,5122,6144,2048,ck,0,0,112.0267,a8w8_blockscale_1x128x128_256x128x128x128_16x16_32x32_2x2_8x32x1_8x32x1_1x32x1x8_8_1x1_intrawave_v3,1150.61,767.78,0.0
gfx950,256,5123,6144,2048,ck,0,0,111.7391,a8w8_blockscale_1x128x128_256x128x128x128_16x16_32x32_2x2_8x32x1_8x32x1_1x32x1x8_8_1x1_intrawave_v3,1153.8,769.88,0.0
gfx950,256,5124,6144,2048,ck,0,0,112.4679,a8w8_blockscale_1x128x128_256x128x128x128_16x16_32x32_2x2_8x32x1_8x32x1_1x32x1x8_8_1x1_intrawave_v3,1146.55,765.02,0.0
gfx950,256,5127,6144,2048,ck,0,0,113.2751,a8w8_blockscale_1x128x128_256x128x128x128_16x16_32x32_2x2_8x32x1_8x32x1_1x32x1x8_8_1x1_intrawave_v3,1139.04,759.95,0.0
gfx950,256,5177,6144,2048,cktile,11,0,112.7762,a8w8_blockscale_cktile_192x256x128_4x2x1_16x16x128_intrawave_0x1x0_1,1155.24,769.67,0.0
gfx950,256,5183,6144,2048,cktile,29,0,114.0848,a8w8_blockscale_cktile_192x256x128_4x2x1_16x16x128_intrawave_0x1x0_4,1143.31,761.59,0.0
gfx950,256,5252,6144,2048,cktile,29,0,112.7518,a8w8_blockscale_cktile_192x256x128_4x2x1_16x16x128_intrawave_0x1x0_4,1172.23,779.37,0.0
gfx950,256,5255,6144,2048,cktile,27,0,113.3791,a8w8_blockscale_cktile_192x256x128_4x2x1_16x16x128_intrawave_0x1x0_2,1166.41,775.44,0.0
gfx950,256,5361,6144,2048,cktile,28,0,113.1696,a8w8_blockscale_cktile_192x256x128_4x2x1_16x16x128_intrawave_0x1x0_3,1192.14,790.3,0.0
gfx950,256,5427,6144,2048,cktile,28,0,112.3191,a8w8_blockscale_cktile_192x256x128_4x2x1_16x16x128_intrawave_0x1x0_3,1215.95,804.71,0.0
gfx950,256,5471,6144,2048,cktile,29,0,113.1175,a8w8_blockscale_cktile_192x256x128_4x2x1_16x16x128_intrawave_0x1x0_4,1217.16,804.61,0.0
gfx950,256,5534,6144,2048,cktile,27,0,113.088,a8w8_blockscale_cktile_192x256x128_4x2x1_16x16x128_intrawave_0x1x0_2,1231.5,812.8,0.0
gfx950,256,5564,6144,2048,cktile,29,0,113.2764,a8w8_blockscale_cktile_192x256x128_4x2x1_16x16x128_intrawave_0x1x0_4,1236.11,815.25,0.0
gfx950,256,5671,6144,2048,cktile,27,0,112.9223,a8w8_blockscale_cktile_192x256x128_4x2x1_16x16x128_intrawave_0x1x0_2,1263.84,831.39,0.0
gfx950,256,5927,6144,2048,cktile,28,0,114.1084,a8w8_blockscale_cktile_192x256x128_4x2x1_16x16x128_intrawave_0x1x0_3,1307.16,854.91,0.0
gfx950,256,5954,6144,2048,cktile,28,0,114.7564,a8w8_blockscale_cktile_192x256x128_4x2x1_16x16x128_intrawave_0x1x0_3,1305.7,853.46,0.0
gfx950,256,6000,6144,2048,cktile,28,0,114.3886,a8w8_blockscale_cktile_192x256x128_4x2x1_16x16x128_intrawave_0x1x0_3,1320.02,861.96,0.0
gfx950,256,6002,6144,2048,cktile,28,0,114.3359,a8w8_blockscale_cktile_192x256x128_4x2x1_16x16x128_intrawave_0x1x0_3,1321.07,862.61,0.0
gfx950,256,6146,6144,2048,ck,0,0,136.0023,a8w8_blockscale_1x128x128_256x128x128x128_16x16_32x32_2x2_8x32x1_8x32x1_1x32x1x8_8_1x1_intrawave_v3,1137.25,740.37,0.0
gfx950,256,6194,6144,2048,ck,0,0,135.7784,a8w8_blockscale_1x128x128_256x128x128x128_16x16_32x32_2x2_8x32x1_8x32x1_1x32x1x8_8_1x1_intrawave_v3,1148.03,746.66,0.0
gfx950,256,6227,6144,2048,ck,0,0,135.2668,a8w8_blockscale_1x128x128_256x128x128x128_16x16_32x32_2x2_8x32x1_8x32x1_1x32x1x8_8_1x1_intrawave_v3,1158.51,752.98,0.0
gfx950,256,6229,6144,2048,ck,0,0,136.6913,a8w8_blockscale_1x128x128_256x128x128x128_16x16_32x32_2x2_8x32x1_8x32x1_1x32x1x8_8_1x1_intrawave_v3,1146.8,745.34,0.0
gfx950,256,6234,6144,2048,ck,0,0,135.9465,a8w8_blockscale_1x128x128_256x128x128x128_16x16_32x32_2x2_8x32x1_8x32x1_1x32x1x8_8_1x1_intrawave_v3,1154.01,749.95,0.0
gfx950,256,6246,6144,2048,ck,0,0,136.1362,a8w8_blockscale_1x128x128_256x128x128x128_16x16_32x32_2x2_8x32x1_8x32x1_1x32x1x8_8_1x1_intrawave_v3,1154.62,750.17,0.0
gfx950,256,6304,6144,2048,ck,0,0,136.1042,a8w8_blockscale_1x128x128_256x128x128x128_16x16_32x32_2x2_8x32x1_8x32x1_1x32x1x8_8_1x1_intrawave_v3,1165.62,756.46,0.0
gfx950,256,6314,6144,2048,ck,0,0,136.4754,a8w8_blockscale_1x128x128_256x128x128x128_16x16_32x32_2x2_8x32x1_8x32x1_1x32x1x8_8_1x1_intrawave_v3,1164.29,755.45,0.0
gfx950,256,6318,6144,2048,ck,0,0,135.0606,a8w8_blockscale_1x128x128_256x128x128x128_16x16_32x32_2x2_8x32x1_8x32x1_1x32x1x8_8_1x1_intrawave_v3,1177.23,763.79,0.0
gfx950,256,6341,6144,2048,ck,0,0,136.7254,a8w8_blockscale_1x128x128_256x128x128x128_16x16_32x32_2x2_8x32x1_8x32x1_1x32x1x8_8_1x1_intrawave_v3,1167.13,756.9,0.0
gfx950,256,6377,6144,2048,ck,0,0,135.7821,a8w8_blockscale_1x128x128_256x128x128x128_16x16_32x32_2x2_8x32x1_8x32x1_1x32x1x8_8_1x1_intrawave_v3,1181.91,765.96,0.0
gfx950,256,6476,6144,2048,ck,0,0,137.4454,a8w8_blockscale_1x128x128_256x128x128x128_16x16_32x32_2x2_8x32x1_8x32x1_1x32x1x8_8_1x1_intrawave_v3,1185.74,767.02,0.0
gfx950,256,6483,6144,2048,ck,0,0,137.1714,a8w8_blockscale_1x128x128_256x128x128x128_16x16_32x32_2x2_8x32x1_8x32x1_1x32x1x8_8_1x1_intrawave_v3,1189.39,769.28,0.0
gfx950,256,6492,6144,2048,ck,0,0,137.1706,a8w8_blockscale_1x128x128_256x128x128x128_16x16_32x32_2x2_8x32x1_8x32x1_1x32x1x8_8_1x1_intrawave_v3,1191.05,770.22,0.0
gfx950,256,6519,6144,2048,ck,0,0,138.9126,a8w8_blockscale_1x128x128_256x128x128x128_16x16_32x32_2x2_8x32x1_8x32x1_1x32x1x8_8_1x1_intrawave_v3,1181.0,763.35,0.0
gfx950,256,6609,6144,2048,ck,0,0,138.2234,a8w8_blockscale_1x128x128_256x128x128x128_16x16_32x32_2x2_8x32x1_8x32x1_1x32x1x8_8_1x1_intrawave_v3,1203.28,776.49,0.0
gfx950,256,6811,6144,2048,cktile,29,0,146.8029,a8w8_blockscale_cktile_192x256x128_4x2x1_16x16x128_intrawave_0x1x0_4,1167.58,750.84,0.0
gfx950,256,6813,6144,2048,ck,0,0,146.7747,a8w8_blockscale_1x128x128_256x128x128x128_16x16_32x32_2x2_8x32x1_8x32x1_1x32x1x8_8_1x1_intrawave_v3,1168.15,751.18,0.0
gfx950,256,6818,6144,2048,ck,0,0,145.8932,a8w8_blockscale_1x128x128_256x128x128x128_16x16_32x32_2x2_8x32x1_8x32x1_1x32x1x8_8_1x1_intrawave_v3,1176.07,756.21,0.0
gfx950,256,6830,6144,2048,cktile,27,0,146.5697,a8w8_blockscale_cktile_192x256x128_4x2x1_16x16x128_intrawave_0x1x0_2,1172.7,753.89,0.0
gfx950,256,7001,6144,2048,cktile,27,0,146.4497,a8w8_blockscale_cktile_192x256x128_4x2x1_16x16x128_intrawave_0x1x0_2,1203.05,771.25,0.0
gfx950,256,7025,6144,2048,cktile,11,0,146.0693,a8w8_blockscale_cktile_192x256x128_4x2x1_16x16x128_intrawave_0x1x0_1,1210.32,775.61,0.0
gfx950,256,7121,6144,2048,cktile,27,0,147.2171,a8w8_blockscale_cktile_192x256x128_4x2x1_16x16x128_intrawave_0x1x0_2,1217.29,778.91,0.0
gfx950,256,7169,6144,2048,cktile,11,0,147.1764,a8w8_blockscale_cktile_192x256x128_4x2x1_16x16x128_intrawave_0x1x0_1,1225.83,783.81,0.0
gfx950,256,7177,6144,2048,cktile,27,0,146.8906,a8w8_blockscale_cktile_192x256x128_4x2x1_16x16x128_intrawave_0x1x0_2,1229.59,786.11,0.0
gfx950,256,7217,6144,2048,cktile,11,0,147.4378,a8w8_blockscale_cktile_192x256x128_4x2x1_16x16x128_intrawave_0x1x0_1,1231.85,787.08,0.0
gfx950,256,7223,6144,2048,cktile,11,0,146.5161,a8w8_blockscale_cktile_192x256x128_4x2x1_16x16x128_intrawave_0x1x0_1,1240.63,792.62,0.0
gfx950,256,7238,6144,2048,cktile,28,0,146.2391,a8w8_blockscale_cktile_192x256x128_4x2x1_16x16x128_intrawave_0x1x0_3,1245.56,795.59,0.0
gfx950,256,7246,6144,2048,cktile,28,0,146.4743,a8w8_blockscale_cktile_192x256x128_4x2x1_16x16x128_intrawave_0x1x0_3,1244.94,795.1,0.0
gfx950,256,7249,6144,2048,cktile,27,0,146.332,a8w8_blockscale_cktile_192x256x128_4x2x1_16x16x128_intrawave_0x1x0_2,1246.67,796.17,0.0
gfx950,256,7316,6144,2048,cktile,28,0,148.0019,a8w8_blockscale_cktile_192x256x128_4x2x1_16x16x128_intrawave_0x1x0_3,1243.99,793.67,0.0
gfx950,256,7393,6144,2048,cktile,11,0,148.1505,a8w8_blockscale_cktile_192x256x128_4x2x1_16x16x128_intrawave_0x1x0_1,1255.82,800.33,0.0
gfx950,256,7491,6144,2048,cktile,27,0,148.6239,a8w8_blockscale_cktile_192x256x128_4x2x1_16x16x128_intrawave_0x1x0_2,1268.42,807.23,0.0
gfx950,256,7558,6144,2048,cktile,28,0,148.3728,a8w8_blockscale_cktile_192x256x128_4x2x1_16x16x128_intrawave_0x1x0_3,1281.93,815.07,0.0
gfx950,256,7650,6144,2048,cktile,29,0,149.0133,a8w8_blockscale_cktile_192x256x128_4x2x1_16x16x128_intrawave_0x1x0_4,1291.96,820.42,0.0
gfx950,256,7753,6144,2048,cktile,11,0,148.1962,a8w8_blockscale_cktile_192x256x128_4x2x1_16x16x128_intrawave_0x1x0_1,1316.57,834.91,0.0
gfx950,256,7774,6144,2048,cktile,11,0,148.3358,a8w8_blockscale_cktile_192x256x128_4x2x1_16x16x128_intrawave_0x1x0_1,1318.89,836.15,0.0
gfx950,256,7815,6144,2048,cktile,28,0,148.4638,a8w8_blockscale_cktile_192x256x128_4x2x1_16x16x128_intrawave_0x1x0_3,1324.71,839.39,0.0
gfx950,256,7834,6144,2048,cktile,29,0,148.1223,a8w8_blockscale_cktile_192x256x128_4x2x1_16x16x128_intrawave_0x1x0_4,1330.99,843.16,0.0
gfx950,256,7836,6144,2048,cktile,11,0,148.1999,a8w8_blockscale_cktile_192x256x128_4x2x1_16x16x128_intrawave_0x1x0_1,1330.63,842.91,0.0
gfx950,256,7871,6144,2048,cktile,29,0,147.6947,a8w8_blockscale_cktile_192x256x128_4x2x1_16x16x128_intrawave_0x1x0_4,1341.15,849.19,0.0
gfx950,256,7899,6144,2048,cktile,28,0,148.6611,a8w8_blockscale_cktile_192x256x128_4x2x1_16x16x128_intrawave_0x1x0_3,1337.17,846.37,0.0
gfx950,256,7913,6144,2048,cktile,28,0,147.9143,a8w8_blockscale_cktile_192x256x128_4x2x1_16x16x128_intrawave_0x1x0_3,1346.3,852.0,0.0
gfx950,256,7930,6144,2048,cktile,11,0,148.5611,a8w8_blockscale_cktile_192x256x128_4x2x1_16x16x128_intrawave_0x1x0_1,1343.32,849.94,0.0
gfx950,256,7961,6144,2048,cktile,27,0,147.9914,a8w8_blockscale_cktile_192x256x128_4x2x1_16x16x128_intrawave_0x1x0_2,1353.76,856.21,0.0
gfx950,256,7963,6144,2048,cktile,28,0,148.879,a8w8_blockscale_cktile_192x256x128_4x2x1_16x16x128_intrawave_0x1x0_3,1346.03,851.3,0.0
gfx950,256,7974,6144,2048,cktile,29,0,148.4726,a8w8_blockscale_cktile_192x256x128_4x2x1_16x16x128_intrawave_0x1x0_4,1351.58,854.69,0.0
gfx950,256,8016,6144,2048,cktile,27,0,148.7386,a8w8_blockscale_cktile_192x256x128_4x2x1_16x16x128_intrawave_0x1x0_2,1356.27,857.21,0.0
gfx950,256,8017,6144,2048,cktile,11,0,148.2054,a8w8_blockscale_cktile_192x256x128_4x2x1_16x16x128_intrawave_0x1x0_1,1361.32,860.39,0.0
gfx950,256,8103,6144,2048,cktile,29,0,164.6707,a8w8_blockscale_cktile_192x256x128_4x2x1_16x16x128_intrawave_0x1x0_4,1238.34,781.85,0.0
gfx950,256,8128,6144,2048,cktile,29,0,164.3651,a8w8_blockscale_cktile_192x256x128_4x2x1_16x16x128_intrawave_0x1x0_4,1244.47,785.48,0.0
gfx950,256,8129,6144,2048,cktile,28,0,164.0366,a8w8_blockscale_cktile_192x256x128_4x2x1_16x16x128_intrawave_0x1x0_3,1247.12,787.14,0.0
gfx950,256,8150,6144,2048,cktile,11,0,163.9558,a8w8_blockscale_cktile_192x256x128_4x2x1_16x16x128_intrawave_0x1x0_1,1250.96,789.37,0.0
gfx950,256,8184,6144,2048,cktile,27,0,163.8378,a8w8_blockscale_cktile_192x256x128_4x2x1_16x16x128_intrawave_0x1x0_2,1257.08,792.91,0.0
gfx950,256,8185,6144,2048,cktile,29,0,164.7786,a8w8_blockscale_cktile_192x256x128_4x2x1_16x16x128_intrawave_0x1x0_4,1250.05,788.47,0.0
gfx950,256,8192,6144,2048,cktile,27,0,162.1342,a8w8_blockscale_cktile_192x256x128_4x2x1_16x16x128_intrawave_0x1x0_2,1271.53,801.95,0.0
gfx950,256,1,9216,2048,ck,8,3,8.8431,a8w8_blockscale_1x128x128_256x16x64x256_16x16_16x16_1x1_16x16x1_16x16x1_1x16x1x16_4_1x1_intrawave_v1,4.27,2136.68,0.0
gfx950,256,2,9216,2048,ck,8,0,8.8707,a8w8_blockscale_1x128x128_256x16x64x256_16x16_16x16_1x1_16x16x1_16x16x1_1x16x1x16_4_1x1_intrawave_v1,8.51,2132.34,0.0
gfx950,256,4,9216,2048,ck,8,0,8.8727,a8w8_blockscale_1x128x128_256x16x64x256_16x16_16x16_1x1_16x16x1_16x16x1_1x16x1x16_4_1x1_intrawave_v1,17.02,2136.47,0.0
gfx950,256,8,9216,2048,ck,8,0,8.934,a8w8_blockscale_1x128x128_256x16x64x256_16x16_16x16_1x1_16x16x1_16x16x1_1x16x1x16_4_1x1_intrawave_v1,33.8,2130.98,0.0
gfx950,256,16,9216,2048,ck,8,0,8.7072,a8w8_blockscale_1x128x128_256x16x64x256_16x16_16x16_1x1_16x16x1_16x16x1_1x16x1x16_4_1x1_intrawave_v1,69.37,2205.31,0.0
gfx950,256,32,9216,2048,ck,7,0,10.4857,a8w8_blockscale_1x128x128_256x16x128x256_16x16_16x16_1x2_16x16x1_16x16x1_1x16x1x16_8_1x2_intrawave_v1,115.2,1862.51,0.0
gfx950,256,48,9216,2048,ck,7,0,10.5927,a8w8_blockscale_1x128x128_256x16x128x256_16x16_16x16_1x2_16x16x1_16x16x1_1x16x1x16_8_1x2_intrawave_v1,171.06,1874.63,0.0
gfx950,256,64,9216,2048,ck,18,0,10.3626,a8w8_blockscale_1x128x128_256x64x64x256_16x16_32x32_1x1_16x16x1_16x16x1_1x32x1x8_8_1x1_intrawave_v1,233.14,1947.88,0.0
gfx950,256,80,9216,2048,ck,12,0,13.1732,a8w8_blockscale_1x128x128_256x32x128x256_16x16_32x32_1x1_16x16x1_16x16x1_1x32x1x8_8_1x1_intrawave_v1,229.25,1557.16,0.0
gfx950,256,96,9216,2048,ck,12,0,12.2582,a8w8_blockscale_1x128x128_256x32x128x256_16x16_32x32_1x1_16x16x1_16x16x1_1x32x1x8_8_1x1_intrawave_v1,295.63,1700.12,0.0
gfx950,256,112,9216,2048,ck,5,0,15.2864,a8w8_blockscale_1x128x128_256x16x128x128_8x16_16x16_1x2_16x16x1_8x32x1_1x16x1x16_8_1x2_intrawave_v1,276.58,1384.77,0.0
gfx950,256,128,9216,2048,ck,2,0,15.5977,a8w8_blockscale_1x128x128_256x64x128x128_16x16_32x32_1x2_8x32x1_8x32x1_1x32x1x8_8_1x1_intrawave_v3,309.78,1378.14,0.0
gfx950,256,256,9216,2048,ck,0,0,19.5869,a8w8_blockscale_1x128x128_256x128x128x128_16x16_32x32_2x2_8x32x1_8x32x1_1x32x1x8_8_1x1_intrawave_v3,493.37,1231.29,0.0
gfx950,256,512,9216,2048,ck,2,0,29.5011,a8w8_blockscale_1x128x128_256x64x128x128_16x16_32x32_1x2_8x32x1_8x32x1_1x32x1x8_8_1x1_intrawave_v3,655.14,995.22,0.0
gfx950,256,667,9216,2048,ck,0,0,32.4893,a8w8_blockscale_1x128x128_256x128x128x128_16x16_32x32_2x2_8x32x1_8x32x1_1x32x1x8_8_1x1_intrawave_v3,774.98,1001.39,0.0
gfx950,256,671,9216,2048,ck,0,0,32.471,a8w8_blockscale_1x128x128_256x128x128x128_16x16_32x32_2x2_8x32x1_8x32x1_1x32x1x8_8_1x1_intrawave_v3,780.06,1004.48,0.0
gfx950,256,931,9216,2048,cktile,32,0,39.2748,a8w8_blockscale_cktile_192x256x128_4x2x1_16x16x128_intrawave_0x1x0_4_aqrm,894.83,966.05,0.0
gfx950,256,1024,9216,2048,cktile,30,0,39.7171,a8w8_blockscale_cktile_192x256x128_4x2x1_16x16x128_intrawave_0x1x0_2_aqrm,973.25,1003.24,0.0
gfx950,256,1025,9216,2048,cktile,12,0,40.0882,a8w8_blockscale_cktile_192x256x128_4x2x1_16x16x128_intrawave_0x1x0_1_aqrm,965.18,994.47,0.0
gfx950,256,1027,9216,2048,cktile,12,0,39.8563,a8w8_blockscale_cktile_192x256x128_4x2x1_16x16x128_intrawave_0x1x0_1_aqrm,972.69,1001.28,0.0
gfx950,256,1031,9216,2048,cktile,30,0,39.9577,a8w8_blockscale_cktile_192x256x128_4x2x1_16x16x128_intrawave_0x1x0_2_aqrm,974.0,1000.79,0.0
gfx950,256,1039,9216,2048,cktile,32,0,39.9331,a8w8_blockscale_cktile_192x256x128_4x2x1_16x16x128_intrawave_0x1x0_4_aqrm,982.17,1005.51,0.0
gfx950,256,1040,9216,2048,cktile,12,0,39.9746,a8w8_blockscale_cktile_192x256x128_4x2x1_16x16x128_intrawave_0x1x0_1_aqrm,982.09,1004.98,0.0
gfx950,256,1041,9216,2048,cktile,31,0,39.8433,a8w8_blockscale_cktile_192x256x128_4x2x1_16x16x128_intrawave_0x1x0_3_aqrm,986.27,1008.8,0.0
gfx950,256,1072,9216,2048,cktile,12,0,39.8667,a8w8_blockscale_cktile_192x256x128_4x2x1_16x16x128_intrawave_0x1x0_1_aqrm,1015.05,1024.14,0.0
gfx950,256,1073,9216,2048,cktile,12,0,40.2558,a8w8_blockscale_cktile_192x256x128_4x2x1_16x16x128_intrawave_0x1x0_1_aqrm,1006.18,1014.75,0.0
gfx950,256,1077,9216,2048,cktile,32,0,40.1581,a8w8_blockscale_cktile_192x256x128_4x2x1_16x16x128_intrawave_0x1x0_4_aqrm,1012.38,1019.25,0.0
gfx950,256,1091,9216,2048,cktile,31,0,40.3859,a8w8_blockscale_cktile_192x256x128_4x2x1_16x16x128_intrawave_0x1x0_3_aqrm,1019.76,1020.6,0.0
gfx950,256,1343,9216,2048,cktile,32,0,41.5051,a8w8_blockscale_cktile_192x256x128_4x2x1_16x16x128_intrawave_0x1x0_4_aqrm,1221.45,1117.43,0.0
gfx950,256,1688,9216,2048,ck,0,0,62.2297,a8w8_blockscale_1x128x128_256x128x128x128_16x16_32x32_2x2_8x32x1_8x32x1_1x32x1x8_8_1x1_intrawave_v3,1023.95,858.83,0.0
gfx950,256,2017,9216,2048,ck,0,0,75.1043,a8w8_blockscale_1x128x128_256x128x128x128_16x16_32x32_2x2_8x32x1_8x32x1_1x32x1x8_8_1x1_intrawave_v3,1013.78,801.32,0.0
gfx950,256,2048,9216,2048,ck,0,0,73.9583,a8w8_blockscale_1x128x128_256x128x128x128_16x16_32x32_2x2_8x32x1_8x32x1_1x32x1x8_8_1x1_intrawave_v3,1045.31,822.32,0.0
gfx950,256,2050,9216,2048,ck,0,0,75.5639,a8w8_blockscale_1x128x128_256x128x128x128_16x16_32x32_2x2_8x32x1_8x32x1_1x32x1x8_8_1x1_intrawave_v3,1024.1,805.39,0.0
gfx950,256,2063,9216,2048,ck,0,0,75.6899,a8w8_blockscale_1x128x128_256x128x128x128_16x16_32x32_2x2_8x32x1_8x32x1_1x32x1x8_8_1x1_intrawave_v3,1028.88,807.57,0.0
gfx950,256,2064,9216,2048,ck,0,0,75.4343,a8w8_blockscale_1x128x128_256x128x128x128_16x16_32x32_2x2_8x32x1_8x32x1_1x32x1x8_8_1x1_intrawave_v3,1032.86,810.57,0.0
gfx950,256,2099,9216,2048,ck,0,0,76.1664,a8w8_blockscale_1x128x128_256x128x128x128_16x16_32x32_2x2_8x32x1_8x32x1_1x32x1x8_8_1x1_intrawave_v3,1040.28,812.19,0.0
gfx950,256,2159,9216,2048,cktile,29,0,76.834,a8w8_blockscale_cktile_192x256x128_4x2x1_16x16x128_intrawave_0x1x0_4,1060.72,821.13,0.0
gfx950,256,2160,9216,2048,cktile,11,0,77.0103,a8w8_blockscale_cktile_192x256x128_4x2x1_16x16x128_intrawave_0x1x0_1,1058.78,819.52,0.0
gfx950,256,2313,9216,2048,cktile,11,0,77.532,a8w8_blockscale_cktile_192x256x128_4x2x1_16x16x128_intrawave_0x1x0_1,1126.15,854.42,0.0
gfx950,256,2325,9216,2048,cktile,27,0,77.937,a8w8_blockscale_cktile_192x256x128_4x2x1_16x16x128_intrawave_0x1x0_2,1126.11,853.13,0.0
gfx950,256,3072,9216,2048,ck,0,0,103.019,a8w8_blockscale_1x128x128_256x128x128x128_16x16_32x32_2x2_8x32x1_8x32x1_1x32x1x8_8_1x1_intrawave_v3,1125.66,793.92,0.0
gfx950,256,3073,9216,2048,cktile,11,0,106.1026,a8w8_blockscale_cktile_192x256x128_4x2x1_16x16x128_intrawave_0x1x0_1,1093.3,771.04,0.0
gfx950,256,3182,9216,2048,cktile,27,0,108.1019,a8w8_blockscale_cktile_192x256x128_4x2x1_16x16x128_intrawave_0x1x0_2,1111.14,777.43,0.0
gfx950,256,3183,9216,2048,cktile,11,0,108.3665,a8w8_blockscale_cktile_192x256x128_4x2x1_16x16x128_intrawave_0x1x0_1,1108.78,775.72,0.0
gfx950,256,3847,9216,2048,cktile,29,0,112.7557,a8w8_blockscale_cktile_192x256x128_4x2x1_16x16x128_intrawave_0x1x0_4,1287.91,866.13,0.0
gfx950,256,4096,9216,2048,ck,0,0,129.1944,a8w8_blockscale_1x128x128_256x128x128x128_16x16_32x32_2x2_8x32x1_8x32x1_1x32x1x8_8_1x1_intrawave_v3,1196.79,795.39,0.0
gfx950,256,4111,9216,2048,cktile,28,0,126.8622,a8w8_blockscale_cktile_192x256x128_4x2x1_16x16x128_intrawave_0x1x0_3,1223.26,812.44,0.0
gfx950,256,4141,9216,2048,cktile,29,0,127.4174,a8w8_blockscale_cktile_192x256x128_4x2x1_16x16x128_intrawave_0x1x0_4,1226.81,813.72,0.0
gfx950,256,4142,9216,2048,cktile,11,0,125.9118,a8w8_blockscale_cktile_192x256x128_4x2x1_16x16x128_intrawave_0x1x0_1,1241.78,823.61,0.0
gfx950,256,4345,9216,2048,cktile,27,0,133.6991,a8w8_blockscale_cktile_192x256x128_4x2x1_16x16x128_intrawave_0x1x0_2,1226.77,806.74,0.0
gfx950,256,5105,9216,2048,cktile,27,0,145.3818,a8w8_blockscale_cktile_192x256x128_4x2x1_16x16x128_intrawave_0x1x0_2,1325.53,848.97,0.0
gfx950,256,5121,9216,2048,cktile,27,0,146.038,a8w8_blockscale_cktile_192x256x128_4x2x1_16x16x128_intrawave_0x1x0_2,1323.71,847.4,0.0
gfx950,256,5123,9216,2048,cktile,11,0,145.8598,a8w8_blockscale_cktile_192x256x128_4x2x1_16x16x128_intrawave_0x1x0_1,1325.84,848.72,0.0
gfx950,256,5131,9216,2048,cktile,28,0,145.75,a8w8_blockscale_cktile_192x256x128_4x2x1_16x16x128_intrawave_0x1x0_3,1328.91,850.48,0.0
gfx950,256,5427,9216,2048,cktile,28,0,155.1798,a8w8_blockscale_cktile_192x256x128_4x2x1_16x16x128_intrawave_0x1x0_3,1320.16,837.86,0.0
gfx950,256,6113,9216,2048,cktile,27,0,176.2697,a8w8_blockscale_cktile_192x256x128_4x2x1_16x16x128_intrawave_0x1x0_2,1309.12,817.32,0.0
gfx950,256,6197,9216,2048,cktile,11,0,178.8734,a8w8_blockscale_cktile_192x256x128_4x2x1_16x16x128_intrawave_0x1x0_1,1307.79,815.04,0.0
gfx950,256,6409,9216,2048,cktile,28,0,179.6276,a8w8_blockscale_cktile_192x256x128_4x2x1_16x16x128_intrawave_0x1x0_3,1346.85,835.79,0.0
gfx950,256,7121,9216,2048,cktile,11,0,199.0209,a8w8_blockscale_cktile_192x256x128_4x2x1_16x16x128_intrawave_0x1x0_1,1350.66,827.61,0.0
gfx950,256,7168,9216,2048,cktile,29,0,200.9921,a8w8_blockscale_cktile_192x256x128_4x2x1_16x16x128_intrawave_0x1x0_4,1346.24,824.29,0.0
gfx950,256,7169,9216,2048,cktile,11,0,197.9219,a8w8_blockscale_cktile_192x256x128_4x2x1_16x16x128_intrawave_0x1x0_1,1367.31,837.18,0.0
gfx950,256,7172,9216,2048,cktile,11,0,199.0792,a8w8_blockscale_cktile_192x256x128_4x2x1_16x16x128_intrawave_0x1x0_1,1359.93,832.62,0.0
gfx950,256,7176,9216,2048,cktile,28,0,199.3176,a8w8_blockscale_cktile_192x256x128_4x2x1_16x16x128_intrawave_0x1x0_3,1359.06,832.03,0.0
gfx950,256,7177,9216,2048,cktile,11,0,197.8645,a8w8_blockscale_cktile_192x256x128_4x2x1_16x16x128_intrawave_0x1x0_1,1369.23,838.25,0.0
gfx950,256,7178,9216,2048,cktile,29,0,198.4669,a8w8_blockscale_cktile_192x256x128_4x2x1_16x16x128_intrawave_0x1x0_4,1365.27,835.81,0.0
gfx950,256,7179,9216,2048,cktile,27,0,198.1989,a8w8_blockscale_cktile_192x256x128_4x2x1_16x16x128_intrawave_0x1x0_2,1367.3,837.04,0.0
gfx950,256,7183,9216,2048,cktile,29,0,198.8009,a8w8_blockscale_cktile_192x256x128_4x2x1_16x16x128_intrawave_0x1x0_4,1363.92,834.92,0.0
gfx950,256,7184,9216,2048,cktile,29,0,198.9317,a8w8_blockscale_cktile_192x256x128_4x2x1_16x16x128_intrawave_0x1x0_4,1363.22,834.47,0.0
gfx950,256,7209,9216,2048,cktile,11,0,198.5542,a8w8_blockscale_cktile_192x256x128_4x2x1_16x16x128_intrawave_0x1x0_1,1370.56,838.64,0.0
gfx950,256,7210,9216,2048,cktile,27,0,199.1638,a8w8_blockscale_cktile_192x256x128_4x2x1_16x16x128_intrawave_0x1x0_2,1366.56,836.17,0.0
gfx950,256,7211,9216,2048,cktile,11,0,198.5734,a8w8_blockscale_cktile_192x256x128_4x2x1_16x16x128_intrawave_0x1x0_1,1370.81,838.76,0.0
gfx950,256,7217,9216,2048,cktile,11,0,199.0679,a8w8_blockscale_cktile_192x256x128_4x2x1_16x16x128_intrawave_0x1x0_1,1368.54,837.29,0.0
gfx950,256,7273,9216,2048,cktile,11,0,198.6939,a8w8_blockscale_cktile_192x256x128_4x2x1_16x16x128_intrawave_0x1x0_1,1381.76,844.64,0.0
gfx950,256,7274,9216,2048,cktile,11,0,198.0307,a8w8_blockscale_cktile_192x256x128_4x2x1_16x16x128_intrawave_0x1x0_1,1386.57,847.58,0.0
gfx950,256,7391,9216,2048,cktile,11,0,205.4884,a8w8_blockscale_cktile_192x256x128_4x2x1_16x16x128_intrawave_0x1x0_1,1357.75,828.48,0.0
gfx950,256,7393,9216,2048,cktile,11,0,206.0379,a8w8_blockscale_cktile_192x256x128_4x2x1_16x16x128_intrawave_0x1x0_1,1354.49,826.46,0.0
gfx950,256,7715,9216,2048,cktile,11,0,211.9611,a8w8_blockscale_cktile_192x256x128_4x2x1_16x16x128_intrawave_0x1x0_1,1373.99,834.48,0.0
gfx950,256,7753,9216,2048,cktile,27,0,211.5014,a8w8_blockscale_cktile_192x256x128_4x2x1_16x16x128_intrawave_0x1x0_2,1383.75,839.97,0.0
gfx950,256,7819,9216,2048,cktile,29,0,211.8379,a8w8_blockscale_cktile_192x256x128_4x2x1_16x16x128_intrawave_0x1x0_4,1393.32,845.02,0.0
gfx950,256,8099,9216,2048,cktile,28,0,214.8028,a8w8_blockscale_cktile_192x256x128_4x2x1_16x16x128_intrawave_0x1x0_3,1423.29,860.05,0.0
gfx950,256,8129,9216,2048,cktile,29,0,214.6299,a8w8_blockscale_cktile_192x256x128_4x2x1_16x16x128_intrawave_0x1x0_4,1429.71,863.61,0.0
gfx950,256,8188,9216,2048,cktile,11,0,213.3814,a8w8_blockscale_cktile_192x256x128_4x2x1_16x16x128_intrawave_0x1x0_1,1448.52,874.32,0.0
gfx950,256,8192,9216,2048,cktile,29,0,214.5798,a8w8_blockscale_cktile_192x256x128_4x2x1_16x16x128_intrawave_0x1x0_4,1441.13,869.82,0.0
gfx950,256,1,12288,2048,ck,8,0,9.1068,a8w8_blockscale_1x128x128_256x16x64x256_16x16_16x16_1x1_16x16x1_16x16x1_1x16x1x16_4_1x1_intrawave_v1,5.53,2766.33,0.0
gfx950,256,2,12288,2048,ck,8,0,9.0708,a8w8_blockscale_1x128x128_256x16x64x256_16x16_16x16_1x1_16x16x1_16x16x1_1x16x1x16_4_1x1_intrawave_v1,11.1,2780.25,0.0
gfx950,256,4,12288,2048,ck,8,0,9.0952,a8w8_blockscale_1x128x128_256x16x64x256_16x16_16x16_1x1_16x16x1_16x16x1_1x16x1x16_4_1x1_intrawave_v1,22.14,2778.64,0.0
gfx950,256,8,12288,2048,ck,8,0,9.1177,a8w8_blockscale_1x128x128_256x16x64x256_16x16_16x16_1x1_16x16x1_16x16x1_1x16x1x16_4_1x1_intrawave_v1,44.16,2783.47,0.0
gfx950,256,16,12288,2048,ck,8,0,9.0887,a8w8_blockscale_1x128x128_256x16x64x256_16x16_16x16_1x1_16x16x1_16x16x1_1x16x1x16_4_1x1_intrawave_v1,88.61,2815.78,0.0
gfx950,256,32,12288,2048,ck,7,0,10.928,a8w8_blockscale_1x128x128_256x16x128x256_16x16_16x16_1x2_16x16x1_16x16x1_1x16x1x16_8_1x2_intrawave_v1,147.38,2380.84,0.0
gfx950,256,48,12288,2048,ck,18,0,11.9568,a8w8_blockscale_1x128x128_256x64x64x256_16x16_32x32_1x1_16x16x1_16x16x1_1x32x1x8_8_1x1_intrawave_v1,202.05,2211.61,0.0
gfx950,256,64,12288,2048,ck,18,0,10.7205,a8w8_blockscale_1x128x128_256x64x64x256_16x16_32x32_1x1_16x16x1_16x16x1_1x32x1x8_8_1x1_intrawave_v1,300.47,2506.39,0.0
gfx950,256,80,12288,2048,ck,2,0,15.6057,a8w8_blockscale_1x128x128_256x64x128x128_16x16_32x32_1x2_8x32x1_8x32x1_1x32x1x8_8_1x1_intrawave_v3,258.02,1749.09,0.0
gfx950,256,96,12288,2048,ck,2,0,16.4739,a8w8_blockscale_1x128x128_256x64x128x128_16x16_32x32_1x2_8x32x1_8x32x1_1x32x1x8_8_1x1_intrawave_v3,293.3,1682.77,0.0
gfx950,256,112,12288,2048,ck,18,0,17.0832,a8w8_blockscale_1x128x128_256x64x64x256_16x16_32x32_1x1_16x16x1_16x16x1_1x32x1x8_8_1x1_intrawave_v1,329.98,1647.68,0.0
gfx950,256,128,12288,2048,ck,2,0,16.9352,a8w8_blockscale_1x128x128_256x64x128x128_16x16_32x32_1x2_8x32x1_8x32x1_1x32x1x8_8_1x1_intrawave_v3,380.42,1687.24,0.0
gfx950,256,256,12288,2048,ck,0,0,19.9282,a8w8_blockscale_1x128x128_256x128x128x128_16x16_32x32_2x2_8x32x1_8x32x1_1x32x1x8_8_1x1_intrawave_v3,646.57,1604.84,0.0
gfx950,256,512,12288,2048,ck,2,0,32.0846,a8w8_blockscale_1x128x128_256x64x128x128_16x16_32x32_1x2_8x32x1_8x32x1_1x32x1x8_8_1x1_intrawave_v3,803.18,1209.22,0.0
gfx950,256,667,12288,2048,cktile,30,0,39.1959,a8w8_blockscale_cktile_192x256x128_4x2x1_16x16x128_intrawave_0x1x0_2_aqrm,856.5,1095.12,0.0
gfx950,256,671,12288,2048,cktile,30,0,39.3043,a8w8_blockscale_cktile_192x256x128_4x2x1_16x16x128_intrawave_0x1x0_2_aqrm,859.26,1094.8,0.0
gfx950,256,931,12288,2048,cktile,30,0,40.8482,a8w8_blockscale_cktile_192x256x128_4x2x1_16x16x128_intrawave_0x1x0_2_aqrm,1147.14,1222.89,0.0
gfx950,256,1024,12288,2048,ck,0,0,50.111,a8w8_blockscale_1x128x128_256x128x128x128_16x16_32x32_2x2_8x32x1_8x32x1_1x32x1x8_8_1x1_intrawave_v3,1028.51,1046.25,0.0
gfx950,256,1025,12288,2048,ck,0,0,58.9775,a8w8_blockscale_1x128x128_256x128x128x128_16x16_32x32_2x2_8x32x1_8x32x1_1x32x1x8_8_1x1_intrawave_v3,874.74,889.41,0.0
gfx950,256,1027,12288,2048,ck,0,0,59.1855,a8w8_blockscale_1x128x128_256x128x128x128_16x16_32x32_2x2_8x32x1_8x32x1_1x32x1x8_8_1x1_intrawave_v3,873.37,887.19,0.0
gfx950,256,1031,12288,2048,ck,0,0,59.0863,a8w8_blockscale_1x128x128_256x128x128x128_16x16_32x32_2x2_8x32x1_8x32x1_1x32x1x8_8_1x1_intrawave_v3,878.24,890.48,0.0
gfx950,256,1039,12288,2048,ck,0,0,59.3603,a8w8_blockscale_1x128x128_256x128x128x128_16x16_32x32_2x2_8x32x1_8x32x1_1x32x1x8_8_1x1_intrawave_v3,880.97,889.96,0.0
gfx950,256,1040,12288,2048,ck,0,0,59.5499,a8w8_blockscale_1x128x128_256x128x128x128_16x16_32x32_2x2_8x32x1_8x32x1_1x32x1x8_8_1x1_intrawave_v3,879.01,887.57,0.0
gfx950,256,1041,12288,2048,ck,0,0,58.8407,a8w8_blockscale_1x128x128_256x128x128x128_16x16_32x32_2x2_8x32x1_8x32x1_1x32x1x8_8_1x1_intrawave_v3,890.46,898.72,0.0
gfx950,256,1072,12288,2048,ck,0,0,59.7447,a8w8_blockscale_1x128x128_256x128x128x128_16x16_32x32_2x2_8x32x1_8x32x1_1x32x1x8_8_1x1_intrawave_v3,903.1,898.94,0.0
gfx950,256,1073,12288,2048,ck,0,0,59.8571,a8w8_blockscale_1x128x128_256x128x128x128_16x16_32x32_2x2_8x32x1_8x32x1_1x32x1x8_8_1x1_intrawave_v3,902.25,897.69,0.0
gfx950,256,1077,12288,2048,ck,0,0,59.3015,a8w8_blockscale_1x128x128_256x128x128x128_16x16_32x32_2x2_8x32x1_8x32x1_1x32x1x8_8_1x1_intrawave_v3,914.09,907.9,0.0
gfx950,256,1091,12288,2048,ck,0,0,59.7151,a8w8_blockscale_1x128x128_256x128x128x128_16x16_32x32_2x2_8x32x1_8x32x1_1x32x1x8_8_1x1_intrawave_v3,919.56,907.85,0.0
gfx950,256,1343,12288,2048,ck,0,0,72.2876,a8w8_blockscale_1x128x128_256x128x128x128_16x16_32x32_2x2_8x32x1_8x32x1_1x32x1x8_8_1x1_intrawave_v3,935.09,842.77,0.0
gfx950,256,1688,12288,2048,cktile,11,0,77.0801,a8w8_blockscale_cktile_192x256x128_4x2x1_16x16x128_intrawave_0x1x0_1,1102.23,909.54,0.0
gfx950,256,2017,12288,2048,ck,0,0,91.2692,a8w8_blockscale_1x128x128_256x128x128x128_16x16_32x32_2x2_8x32x1_8x32x1_1x32x1x8_8_1x1_intrawave_v3,1112.3,864.11,0.0
gfx950,256,2048,12288,2048,ck,0,0,90.6604,a8w8_blockscale_1x128x128_256x128x128x128_16x16_32x32_2x2_8x32x1_8x32x1_1x32x1x8_8_1x1_intrawave_v3,1136.98,879.01,0.0
gfx950,256,2050,12288,2048,cktile,29,0,97.9354,a8w8_blockscale_cktile_192x256x128_4x2x1_16x16x128_intrawave_0x1x0_4,1053.55,814.26,0.0
gfx950,256,2063,12288,2048,cktile,11,0,98.3354,a8w8_blockscale_cktile_192x256x128_4x2x1_16x16x128_intrawave_0x1x0_1,1055.92,814.47,0.0
gfx950,256,2064,12288,2048,cktile,27,0,97.7764,a8w8_blockscale_cktile_192x256x128_4x2x1_16x16x128_intrawave_0x1x0_2,1062.47,819.4,0.0
gfx950,256,2099,12288,2048,cktile,29,0,98.2888,a8w8_blockscale_cktile_192x256x128_4x2x1_16x16x128_intrawave_0x1x0_4,1074.85,824.61,0.0
gfx950,256,2159,12288,2048,ck,0,0,99.6122,a8w8_blockscale_1x128x128_256x128x128x128_16x16_32x32_2x2_8x32x1_8x32x1_1x32x1x8_8_1x1_intrawave_v3,1090.89,829.69,0.0
gfx950,256,2160,12288,2048,ck,0,0,99.9066,a8w8_blockscale_1x128x128_256x128x128x128_16x16_32x32_2x2_8x32x1_8x32x1_1x32x1x8_8_1x1_intrawave_v3,1088.18,827.51,0.0
gfx950,256,2313,12288,2048,cktile,11,0,104.9035,a8w8_blockscale_cktile_192x256x128_4x2x1_16x16x128_intrawave_0x1x0_1,1109.75,826.92,0.0
gfx950,256,2325,12288,2048,cktile,11,0,104.9753,a8w8_blockscale_cktile_192x256x128_4x2x1_16x16x128_intrawave_0x1x0_1,1114.75,829.4,0.0
gfx950,256,3072,12288,2048,cktile,27,0,118.4377,a8w8_blockscale_cktile_192x256x128_4x2x1_16x16x128_intrawave_0x1x0_2,1305.49,903.05,0.0
gfx950,256,3073,12288,2048,cktile,28,0,132.4202,a8w8_blockscale_cktile_192x256x128_4x2x1_16x16x128_intrawave_0x1x0_3,1168.02,807.89,0.0
gfx950,256,3182,12288,2048,cktile,27,0,131.7296,a8w8_blockscale_cktile_192x256x128_4x2x1_16x16x128_intrawave_0x1x0_2,1215.79,834.16,0.0
gfx950,256,3183,12288,2048,cktile,11,0,132.6358,a8w8_blockscale_cktile_192x256x128_4x2x1_16x16x128_intrawave_0x1x0_1,1207.86,828.66,0.0
gfx950,256,3847,12288,2048,cktile,28,0,146.4536,a8w8_blockscale_cktile_192x256x128_4x2x1_16x16x128_intrawave_0x1x0_3,1322.1,871.19,0.0
gfx950,256,4096,12288,2048,cktile,29,0,162.4369,a8w8_blockscale_cktile_192x256x128_4x2x1_16x16x128_intrawave_0x1x0_4,1269.16,826.28,0.0
gfx950,256,4111,12288,2048,cktile,29,0,162.1653,a8w8_blockscale_cktile_192x256x128_4x2x1_16x16x128_intrawave_0x1x0_4,1275.94,830.12,0.0
gfx950,256,4141,12288,2048,cktile,27,0,161.4237,a8w8_blockscale_cktile_192x256x128_4x2x1_16x16x128_intrawave_0x1x0_2,1291.16,838.88,0.0
gfx950,256,4142,12288,2048,cktile,11,0,161.4537,a8w8_blockscale_cktile_192x256x128_4x2x1_16x16x128_intrawave_0x1x0_1,1291.23,838.89,0.0
gfx950,256,4345,12288,2048,cktile,11,0,169.2982,a8w8_blockscale_cktile_192x256x128_4x2x1_16x16x128_intrawave_0x1x0_1,1291.75,831.95,0.0
gfx950,256,5105,12288,2048,cktile,27,0,189.4564,a8w8_blockscale_cktile_192x256x128_4x2x1_16x16x128_intrawave_0x1x0_2,1356.21,850.23,0.0
gfx950,256,5121,12288,2048,cktile,11,0,191.5732,a8w8_blockscale_cktile_192x256x128_4x2x1_16x16x128_intrawave_0x1x0_1,1345.43,843.06,0.0
gfx950,256,5123,12288,2048,cktile,27,0,189.8892,a8w8_blockscale_cktile_192x256x128_4x2x1_16x16x128_intrawave_0x1x0_2,1357.89,850.81,0.0
gfx950,256,5131,12288,2048,cktile,11,0,190.8192,a8w8_blockscale_cktile_192x256x128_4x2x1_16x16x128_intrawave_0x1x0_1,1353.38,847.78,0.0
gfx950,256,5427,12288,2048,cktile,11,0,202.8021,a8w8_blockscale_cktile_192x256x128_4x2x1_16x16x128_intrawave_0x1x0_1,1346.88,836.55,0.0
gfx950,256,6113,12288,2048,cktile,11,0,212.1395,a8w8_blockscale_cktile_192x256x128_4x2x1_16x16x128_intrawave_0x1x0_1,1450.35,885.82,0.0
gfx950,256,6197,12288,2048,cktile,27,0,226.2389,a8w8_blockscale_cktile_192x256x128_4x2x1_16x16x128_intrawave_0x1x0_2,1378.65,840.5,0.0
gfx950,256,6409,12288,2048,cktile,28,0,233.4953,a8w8_blockscale_cktile_192x256x128_4x2x1_16x16x128_intrawave_0x1x0_3,1381.51,838.56,0.0
gfx950,256,7121,12288,2048,cktile,11,0,253.8566,a8w8_blockscale_cktile_192x256x128_4x2x1_16x16x128_intrawave_0x1x0_1,1411.87,845.97,0.0
gfx950,256,7168,12288,2048,cktile,28,0,253.9465,a8w8_blockscale_cktile_192x256x128_4x2x1_16x16x128_intrawave_0x1x0_3,1420.68,850.6,0.0
gfx950,256,7169,12288,2048,cktile,28,0,252.2434,a8w8_blockscale_cktile_192x256x128_4x2x1_16x16x128_intrawave_0x1x0_3,1430.47,856.45,0.0
gfx950,256,7172,12288,2048,cktile,28,0,254.1843,a8w8_blockscale_cktile_192x256x128_4x2x1_16x16x128_intrawave_0x1x0_3,1420.15,850.22,0.0
gfx950,256,7176,12288,2048,cktile,11,0,253.372,a8w8_blockscale_cktile_192x256x128_4x2x1_16x16x128_intrawave_0x1x0_1,1425.49,853.37,0.0
gfx950,256,7177,12288,2048,cktile,29,0,253.8972,a8w8_blockscale_cktile_192x256x128_4x2x1_16x16x128_intrawave_0x1x0_4,1422.74,851.71,0.0
gfx950,256,7178,12288,2048,cktile,28,0,252.5689,a8w8_blockscale_cktile_192x256x128_4x2x1_16x16x128_intrawave_0x1x0_3,1430.42,856.29,0.0
gfx950,256,7179,12288,2048,cktile,29,0,252.1941,a8w8_blockscale_cktile_192x256x128_4x2x1_16x16x128_intrawave_0x1x0_4,1432.75,857.67,0.0
gfx950,256,7183,12288,2048,cktile,28,0,252.3101,a8w8_blockscale_cktile_192x256x128_4x2x1_16x16x128_intrawave_0x1x0_3,1432.89,857.7,0.0
gfx950,256,7184,12288,2048,cktile,11,0,253.0413,a8w8_blockscale_cktile_192x256x128_4x2x1_16x16x128_intrawave_0x1x0_1,1428.95,855.33,0.0
gfx950,256,7209,12288,2048,cktile,29,0,253.213,a8w8_blockscale_cktile_192x256x128_4x2x1_16x16x128_intrawave_0x1x0_4,1432.95,857.37,0.0
gfx950,256,7210,12288,2048,cktile,29,0,252.0357,a8w8_blockscale_cktile_192x256x128_4x2x1_16x16x128_intrawave_0x1x0_4,1439.84,861.48,0.0
gfx950,256,7211,12288,2048,cktile,11,0,252.141,a8w8_blockscale_cktile_192x256x128_4x2x1_16x16x128_intrawave_0x1x0_1,1439.44,861.23,0.0
gfx950,256,7217,12288,2048,cktile,27,0,253.1175,a8w8_blockscale_cktile_192x256x128_4x2x1_16x16x128_intrawave_0x1x0_2,1435.08,858.54,0.0
gfx950,256,7273,12288,2048,cktile,11,0,252.4367,a8w8_blockscale_cktile_192x256x128_4x2x1_16x16x128_intrawave_0x1x0_1,1450.11,866.76,0.0
gfx950,256,7274,12288,2048,cktile,28,0,252.8247,a8w8_blockscale_cktile_192x256x128_4x2x1_16x16x128_intrawave_0x1x0_3,1448.09,865.54,0.0
gfx950,256,7391,12288,2048,cktile,28,0,260.2428,a8w8_blockscale_cktile_192x256x128_4x2x1_16x16x128_intrawave_0x1x0_3,1429.44,852.83,0.0
gfx950,256,7393,12288,2048,cktile,28,0,261.2632,a8w8_blockscale_cktile_192x256x128_4x2x1_16x16x128_intrawave_0x1x0_3,1424.24,849.71,0.0
gfx950,256,7715,12288,2048,cktile,27,0,270.2448,a8w8_blockscale_cktile_192x256x128_4x2x1_16x16x128_intrawave_0x1x0_2,1436.88,853.19,0.0
gfx950,256,7753,12288,2048,cktile,11,0,273.9581,a8w8_blockscale_cktile_192x256x128_4x2x1_16x16x128_intrawave_0x1x0_1,1424.38,845.32,0.0
gfx950,256,7819,12288,2048,cktile,28,0,273.5002,a8w8_blockscale_cktile_192x256x128_4x2x1_16x16x128_intrawave_0x1x0_3,1438.91,853.16,0.0
gfx950,256,8099,12288,2048,cktile,11,0,282.4879,a8w8_blockscale_cktile_192x256x128_4x2x1_16x16x128_intrawave_0x1x0_1,1443.02,852.4,0.0
gfx950,256,8129,12288,2048,cktile,11,0,281.2092,a8w8_blockscale_cktile_192x256x128_4x2x1_16x16x128_intrawave_0x1x0_1,1454.95,859.12,0.0
gfx950,256,8188,12288,2048,cktile,11,0,280.3084,a8w8_blockscale_cktile_192x256x128_4x2x1_16x16x128_intrawave_0x1x0_1,1470.22,867.48,0.0
gfx950,256,8192,12288,2048,cktile,28,0,281.7916,a8w8_blockscale_cktile_192x256x128_4x2x1_16x16x128_intrawave_0x1x0_3,1463.2,863.3,0.0
