aiter/configs/model_configs/a8w8_blockscale_tuned_gemm_qwen3_next_80b_a3b.csv
gfx,cu_num,M,N,K,libtype,kernelId,splitK,us,kernelName,tflops,bw,errRatio
gfx950,256,1,256,2048,ck,8,3,4.2127,a8w8_blockscale_1x128x128_256x16x64x256_16x16_16x16_1x1_16x16x1_16x16x1_1x16x1x16_4_1x1_intrawave_v1,0.25,125.06,0.0
gfx950,256,2,256,2048,ck,8,3,4.2568,a8w8_blockscale_1x128x128_256x16x64x256_16x16_16x16_1x1_16x16x1_16x16x1_1x16x1x16_4_1x1_intrawave_v1,0.49,124.37,0.0
gfx950,256,4,256,2048,ck,8,3,4.2631,a8w8_blockscale_1x128x128_256x16x64x256_16x16_16x16_1x1_16x16x1_16x16x1_1x16x1x16_4_1x1_intrawave_v1,0.98,125.38,0.0
gfx950,256,8,256,2048,ck,8,3,4.2761,a8w8_blockscale_1x128x128_256x16x64x256_16x16_16x16_1x1_16x16x1_16x16x1_1x16x1x16_4_1x1_intrawave_v1,1.96,127.4,0.0
gfx950,256,16,256,2048,ck,8,3,4.4817,a8w8_blockscale_1x128x128_256x16x64x256_16x16_16x16_1x1_16x16x1_16x16x1_1x16x1x16_4_1x1_intrawave_v1,3.74,126.12,0.0
gfx950,256,32,256,2048,ck,8,3,5.017,a8w8_blockscale_1x128x128_256x16x64x256_16x16_16x16_1x1_16x16x1_16x16x1_1x16x1x16_4_1x1_intrawave_v1,6.69,120.83,0.0
gfx950,256,48,256,2048,ck,8,3,5.1912,a8w8_blockscale_1x128x128_256x16x64x256_16x16_16x16_1x1_16x16x1_16x16x1_1x16x1x16_4_1x1_intrawave_v1,9.7,124.67,0.0
gfx950,256,64,256,2048,ck,8,3,4.7288,a8w8_blockscale_1x128x128_256x16x64x256_16x16_16x16_1x1_16x16x1_16x16x1_1x16x1x16_4_1x1_intrawave_v1,14.19,145.52,0.0
gfx950,256,80,256,2048,ck,8,3,4.8372,a8w8_blockscale_1x128x128_256x16x64x256_16x16_16x16_1x1_16x16x1_16x16x1_1x16x1x16_4_1x1_intrawave_v1,17.34,150.73,0.0
gfx950,256,96,256,2048,ck,8,3,5.0559,a8w8_blockscale_1x128x128_256x16x64x256_16x16_16x16_1x1_16x16x1_16x16x1_1x16x1x16_4_1x1_intrawave_v1,19.91,152.31,0.0
gfx950,256,112,256,2048,ck,8,3,4.9189,a8w8_blockscale_1x128x128_256x16x64x256_16x16_16x16_1x1_16x16x1_16x16x1_1x16x1x16_4_1x1_intrawave_v1,23.88,164.88,0.0
gfx950,256,128,256,2048,ck,8,2,4.9209,a8w8_blockscale_1x128x128_256x16x64x256_16x16_16x16_1x1_16x16x1_16x16x1_1x16x1x16_4_1x1_intrawave_v1,27.28,173.13,0.0
gfx950,256,256,256,2048,ck,8,2,5.318,a8w8_blockscale_1x128x128_256x16x64x256_16x16_16x16_1x1_16x16x1_16x16x1_1x16x1x16_4_1x1_intrawave_v1,50.48,221.82,0.0
gfx950,256,512,256,2048,ck,8,2,6.4772,a8w8_blockscale_1x128x128_256x16x64x256_16x16_16x16_1x1_16x16x1_16x16x1_1x16x1x16_4_1x1_intrawave_v1,82.89,283.3,0.0
gfx950,256,588,256,2048,ck,8,2,7.0021,a8w8_blockscale_1x128x128_256x16x64x256_16x16_16x16_1x1_16x16x1_16x16x1_1x16x1x16_4_1x1_intrawave_v1,88.05,289.85,0.0
gfx950,256,773,256,2048,ck,8,2,7.5095,a8w8_blockscale_1x128x128_256x16x64x256_16x16_16x16_1x1_16x16x1_16x16x1_1x16x1x16_4_1x1_intrawave_v1,107.94,333.33,0.0
gfx950,256,822,256,2048,ck,8,0,7.8371,a8w8_blockscale_1x128x128_256x16x64x256_16x16_16x16_1x1_16x16x1_16x16x1_1x16x1x16_4_1x1_intrawave_v1,109.98,335.41,0.0
gfx950,256,1024,256,2048,ck,8,2,7.7023,a8w8_blockscale_1x128x128_256x16x64x256_16x16_16x16_1x1_16x16x1_16x16x1_1x16x1x16_4_1x1_intrawave_v1,127.44,373.34,0.0
gfx950,256,1025,256,2048,ck,8,2,9.895,a8w8_blockscale_1x128x128_256x16x64x256_16x16_16x16_1x1_16x16x1_16x16x1_1x16x1x16_4_1x1_intrawave_v1,108.62,318.17,0.0
gfx950,256,1027,256,2048,ck,8,2,9.8954,a8w8_blockscale_1x128x128_256x16x64x256_16x16_16x16_1x1_16x16x1_16x16x1_1x16x1x16_4_1x1_intrawave_v1,108.83,318.67,0.0
gfx950,256,1042,256,2048,ck,8,2,8.6299,a8w8_blockscale_1x128x128_256x16x64x256_16x16_16x16_1x1_16x16x1_16x16x1_1x16x1x16_4_1x1_intrawave_v1,126.61,369.85,0.0
gfx950,256,1051,256,2048,ck,8,2,8.6672,a8w8_blockscale_1x128x128_256x16x64x256_16x16_16x16_1x1_16x16x1_16x16x1_1x16x1x16_4_1x1_intrawave_v1,127.15,370.92,0.0
gfx950,256,1055,256,2048,ck,8,2,8.6581,a8w8_blockscale_1x128x128_256x16x64x256_16x16_16x16_1x1_16x16x1_16x16x1_1x16x1x16_4_1x1_intrawave_v1,127.77,372.49,0.0
gfx950,256,1057,256,2048,ck,8,2,8.747,a8w8_blockscale_1x128x128_256x16x64x256_16x16_16x16_1x1_16x16x1_16x16x1_1x16x1x16_4_1x1_intrawave_v1,126.71,369.29,0.0
gfx950,256,1069,256,2048,ck,8,2,8.7464,a8w8_blockscale_1x128x128_256x16x64x256_16x16_16x16_1x1_16x16x1_16x16x1_1x16x1x16_4_1x1_intrawave_v1,128.16,372.83,0.0
gfx950,256,1072,256,2048,ck,7,1,9.3489,a8w8_blockscale_1x128x128_256x16x128x256_16x16_16x16_1x2_16x16x1_16x16x1_1x16x1x16_8_1x2_intrawave_v1,112.55,327.27,0.0
gfx950,256,1074,256,2048,ck,7,3,9.4504,a8w8_blockscale_1x128x128_256x16x128x256_16x16_16x16_1x2_16x16x1_16x16x1_1x16x1x16_8_1x2_intrawave_v1,111.66,324.6,0.0
gfx950,256,1091,256,2048,ck,7,2,9.4695,a8w8_blockscale_1x128x128_256x16x128x256_16x16_16x16_1x2_16x16x1_16x16x1_1x16x1x16_8_1x2_intrawave_v1,113.32,328.59,0.0
gfx950,256,1128,256,2048,ck,7,1,9.5164,a8w8_blockscale_1x128x128_256x16x128x256_16x16_16x16_1x2_16x16x1_16x16x1_1x16x1x16_8_1x2_intrawave_v1,115.99,334.59,0.0
gfx950,256,1136,256,2048,ck,7,2,9.404,a8w8_blockscale_1x128x128_256x16x128x256_16x16_16x16_1x2_16x16x1_16x16x1_1x16x1x16_8_1x2_intrawave_v1,118.51,341.49,0.0
gfx950,256,1514,256,2048,ck,7,3,9.4504,a8w8_blockscale_1x128x128_256x16x128x256_16x16_16x16_1x2_16x16x1_16x16x1_1x16x1x16_8_1x2_intrawave_v1,153.61,425.76,0.0
gfx950,256,2017,256,2048,ck,7,3,9.2803,a8w8_blockscale_1x128x128_256x16x128x256_16x16_16x16_1x2_16x16x1_16x16x1_1x16x1x16_8_1x2_intrawave_v1,201.06,540.71,0.0
gfx950,256,2048,256,2048,ck,7,0,9.3131,a8w8_blockscale_1x128x128_256x16x128x256_16x16_16x16_1x2_16x16x1_16x16x1_1x16x1x16_8_1x2_intrawave_v1,204.22,548.45,0.0
gfx950,256,2151,256,2048,ck,18,3,10.8919,a8w8_blockscale_1x128x128_256x64x64x256_16x16_32x32_1x1_16x16x1_16x16x1_1x32x1x8_8_1x1_intrawave_v1,201.38,538.47,0.0
gfx950,256,2332,256,2048,ck,18,0,11.0399,a8w8_blockscale_1x128x128_256x64x64x256_16x16_32x32_1x1_16x16x1_16x16x1_1x32x1x8_8_1x1_intrawave_v1,221.49,588.25,0.0
gfx950,256,2341,256,2048,ck,18,0,11.0591,a8w8_blockscale_1x128x128_256x64x64x256_16x16_32x32_1x1_16x16x1_16x16x1_1x32x1x8_8_1x1_intrawave_v1,221.96,589.31,0.0
gfx950,256,3072,256,2048,ck,18,1,9.6576,a8w8_blockscale_1x128x128_256x64x64x256_16x16_32x32_1x1_16x16x1_16x16x1_1x32x1x8_8_1x1_intrawave_v1,323.54,842.55,0.0
gfx950,256,3073,256,2048,ck,18,0,11.5183,a8w8_blockscale_1x128x128_256x64x64x256_16x16_32x32_1x1_16x16x1_16x16x1_1x32x1x8_8_1x1_intrawave_v1,270.99,705.7,0.0
gfx950,256,3089,256,2048,ck,18,3,11.2841,a8w8_blockscale_1x128x128_256x64x64x256_16x16_32x32_1x1_16x16x1_16x16x1_1x32x1x8_8_1x1_intrawave_v1,281.14,731.88,0.0
gfx950,256,3110,256,2048,ck,18,0,11.5787,a8w8_blockscale_1x128x128_256x64x64x256_16x16_32x32_1x1_16x16x1_16x16x1_1x32x1x8_8_1x1_intrawave_v1,281.64,732.89,0.0
gfx950,256,3137,256,2048,ck,18,3,11.2573,a8w8_blockscale_1x128x128_256x64x64x256_16x16_32x32_1x1_16x16x1_16x16x1_1x32x1x8_8_1x1_intrawave_v1,282.7,735.26,0.0
gfx950,256,3613,256,2048,ck,18,2,11.3787,a8w8_blockscale_1x128x128_256x64x64x256_16x16_32x32_1x1_16x16x1_16x16x1_1x32x1x8_8_1x1_intrawave_v1,327.42,844.68,0.0
gfx950,256,4096,256,2048,ck,18,0,9.9926,a8w8_blockscale_1x128x128_256x64x64x256_16x16_32x32_1x1_16x16x1_16x16x1_1x32x1x8_8_1x1_intrawave_v1,384.17,984.81,0.0
gfx950,256,4097,256,2048,ck,3,1,15.4189,a8w8_blockscale_1x128x128_256x64x64x128_16x16_32x32_1x1_8x32x1_8x32x1_1x32x1x8_8_1x1_intrawave_v3,271.87,696.91,0.0
gfx950,256,4109,256,2048,ck,2,0,15.3109,a8w8_blockscale_1x128x128_256x64x128x128_16x16_32x32_1x2_8x32x1_8x32x1_1x32x1x8_8_1x1_intrawave_v3,277.43,711.07,0.0
gfx950,256,4143,256,2048,ck,3,2,15.2777,a8w8_blockscale_1x128x128_256x64x64x128_16x16_32x32_1x1_8x32x1_8x32x1_1x32x1x8_8_1x1_intrawave_v3,281.0,719.95,0.0
gfx950,256,4345,256,2048,ck,2,3,15.2141,a8w8_blockscale_1x128x128_256x64x128x128_16x16_32x32_1x2_8x32x1_8x32x1_1x32x1x8_8_1x1_intrawave_v3,293.25,749.68,0.0
gfx950,256,4413,256,2048,ck,2,0,15.2163,a8w8_blockscale_1x128x128_256x64x128x128_16x16_32x32_1x2_8x32x1_8x32x1_1x32x1x8_8_1x1_intrawave_v3,299.9,766.15,0.0
gfx950,256,5121,256,2048,ck,2,2,15.2971,a8w8_blockscale_1x128x128_256x64x128x128_16x16_32x32_1x2_8x32x1_8x32x1_1x32x1x8_8_1x1_intrawave_v3,344.29,874.17,0.0
gfx950,256,5123,256,2048,ck,2,1,15.3471,a8w8_blockscale_1x128x128_256x64x128x128_16x16_32x32_1x2_8x32x1_8x32x1_1x32x1x8_8_1x1_intrawave_v3,340.35,864.14,0.0
gfx950,256,5133,256,2048,ck,2,3,15.3927,a8w8_blockscale_1x128x128_256x64x128x128_16x16_32x32_1x2_8x32x1_8x32x1_1x32x1x8_8_1x1_intrawave_v3,336.8,855.08,0.0
gfx950,256,5185,256,2048,ck,2,2,15.3321,a8w8_blockscale_1x128x128_256x64x128x128_16x16_32x32_1x2_8x32x1_8x32x1_1x32x1x8_8_1x1_intrawave_v3,330.24,838.08,0.0
gfx950,256,5191,256,2048,ck,2,1,15.3097,a8w8_blockscale_1x128x128_256x64x128x128_16x16_32x32_1x2_8x32x1_8x32x1_1x32x1x8_8_1x1_intrawave_v3,332.2,843.02,0.0
gfx950,256,6146,256,2048,ck,2,1,15.4401,a8w8_blockscale_1x128x128_256x64x128x128_16x16_32x32_1x2_8x32x1_8x32x1_1x32x1x8_8_1x1_intrawave_v3,415.6,1048.46,0.0
gfx950,256,6147,256,2048,ck,2,0,15.4701,a8w8_blockscale_1x128x128_256x64x128x128_16x16_32x32_1x2_8x32x1_8x32x1_1x32x1x8_8_1x1_intrawave_v3,416.65,1051.1,0.0
gfx950,256,6155,256,2048,ck,2,1,15.3663,a8w8_blockscale_1x128x128_256x64x128x128_16x16_32x32_1x2_8x32x1_8x32x1_1x32x1x8_8_1x1_intrawave_v3,404.94,1021.51,0.0
gfx950,256,6377,256,2048,ck,2,3,15.4752,a8w8_blockscale_1x128x128_256x64x128x128_16x16_32x32_1x2_8x32x1_8x32x1_1x32x1x8_8_1x1_intrawave_v3,409.56,1032.01,0.0
gfx950,256,6401,256,2048,ck,2,2,15.5153,a8w8_blockscale_1x128x128_256x64x128x128_16x16_32x32_1x2_8x32x1_8x32x1_1x32x1x8_8_1x1_intrawave_v3,417.83,1052.73,0.0
gfx950,256,7121,256,2048,ck,2,0,15.6292,a8w8_blockscale_1x128x128_256x64x128x128_16x16_32x32_1x2_8x32x1_8x32x1_1x32x1x8_8_1x1_intrawave_v3,463.23,1163.47,0.0
gfx950,256,7169,256,2048,ck,2,3,15.697,a8w8_blockscale_1x128x128_256x64x128x128_16x16_32x32_1x2_8x32x1_8x32x1_1x32x1x8_8_1x1_intrawave_v3,468.42,1176.28,0.0
gfx950,256,7170,256,2048,ck,2,3,15.6682,a8w8_blockscale_1x128x128_256x64x128x128_16x16_32x32_1x2_8x32x1_8x32x1_1x32x1x8_8_1x1_intrawave_v3,476.24,1195.91,0.0
gfx950,256,7176,256,2048,ck,2,2,15.721,a8w8_blockscale_1x128x128_256x64x128x128_16x16_32x32_1x2_8x32x1_8x32x1_1x32x1x8_8_1x1_intrawave_v3,477.99,1200.27,0.0
gfx950,256,7177,256,2048,ck,2,2,15.6834,a8w8_blockscale_1x128x128_256x64x128x128_16x16_32x32_1x2_8x32x1_8x32x1_1x32x1x8_8_1x1_intrawave_v3,478.92,1202.59,0.0
gfx950,256,7185,256,2048,ck,2,3,15.6717,a8w8_blockscale_1x128x128_256x64x128x128_16x16_32x32_1x2_8x32x1_8x32x1_1x32x1x8_8_1x1_intrawave_v3,477.43,1198.83,0.0
gfx950,256,7206,256,2048,ck,2,0,15.6713,a8w8_blockscale_1x128x128_256x64x128x128_16x16_32x32_1x2_8x32x1_8x32x1_1x32x1x8_8_1x1_intrawave_v3,482.16,1210.6,0.0
gfx950,256,7217,256,2048,ck,2,3,15.7056,a8w8_blockscale_1x128x128_256x64x128x128_16x16_32x32_1x2_8x32x1_8x32x1_1x32x1x8_8_1x1_intrawave_v3,478.5,1201.37,0.0
gfx950,256,7257,256,2048,ck,2,0,15.665,a8w8_blockscale_1x128x128_256x64x128x128_16x16_32x32_1x2_8x32x1_8x32x1_1x32x1x8_8_1x1_intrawave_v3,485.01,1217.52,0.0
gfx950,256,7265,256,2048,ck,2,3,15.6636,a8w8_blockscale_1x128x128_256x64x128x128_16x16_32x32_1x2_8x32x1_8x32x1_1x32x1x8_8_1x1_intrawave_v3,484.49,1216.19,0.0
gfx950,256,7393,256,2048,ck,2,3,15.6791,a8w8_blockscale_1x128x128_256x64x128x128_16x16_32x32_1x2_8x32x1_8x32x1_1x32x1x8_8_1x1_intrawave_v3,488.47,1225.58,0.0
gfx950,256,7461,256,2048,ck,2,3,15.714,a8w8_blockscale_1x128x128_256x64x128x128_16x16_32x32_1x2_8x32x1_8x32x1_1x32x1x8_8_1x1_intrawave_v3,480.57,1205.47,0.0
gfx950,256,7634,256,2048,ck,2,2,15.7267,a8w8_blockscale_1x128x128_256x64x128x128_16x16_32x32_1x2_8x32x1_8x32x1_1x32x1x8_8_1x1_intrawave_v3,485.54,1217.2,0.0
gfx950,256,8129,256,2048,ck,2,0,15.7214,a8w8_blockscale_1x128x128_256x64x128x128_16x16_32x32_1x2_8x32x1_8x32x1_1x32x1x8_8_1x1_intrawave_v3,540.39,1352.55,0.0
gfx950,256,8192,256,2048,ck,2,1,15.4001,a8w8_blockscale_1x128x128_256x64x128x128_16x16_32x32_1x2_8x32x1_8x32x1_1x32x1x8_8_1x1_intrawave_v3,545.8,1365.83,0.0
gfx950,256,1,1024,2048,ck,8,3,4.5556,a8w8_blockscale_1x128x128_256x16x64x256_16x16_16x16_1x1_16x16x1_16x16x1_1x16x1x16_4_1x1_intrawave_v1,0.92,461.25,0.0
gfx950,256,2,1024,2048,ck,8,3,4.5296,a8w8_blockscale_1x128x128_256x16x64x256_16x16_16x16_1x1_16x16x1_16x16x1_1x16x1x16_4_1x1_intrawave_v1,1.85,464.8,0.0
gfx950,256,4,1024,2048,ck,8,3,4.7019,a8w8_blockscale_1x128x128_256x16x64x256_16x16_16x16_1x1_16x16x1_16x16x1_1x16x1x16_4_1x1_intrawave_v1,3.57,449.51,0.0
gfx950,256,8,1024,2048,ck,8,3,4.8882,a8w8_blockscale_1x128x128_256x16x64x256_16x16_16x16_1x1_16x16x1_16x16x1_1x16x1x16_4_1x1_intrawave_v1,6.86,435.73,0.0
gfx950,256,16,1024,2048,ck,8,3,5.1727,a8w8_blockscale_1x128x128_256x16x64x256_16x16_16x16_1x1_16x16x1_16x16x1_1x16x1x16_4_1x1_intrawave_v1,12.97,418.1,0.0
gfx950,256,32,1024,2048,ck,8,2,5.5805,a8w8_blockscale_1x128x128_256x16x64x256_16x16_16x16_1x1_16x16x1_16x16x1_1x16x1x16_4_1x1_intrawave_v1,24.05,399.29,0.0
gfx950,256,48,1024,2048,ck,8,2,5.7375,a8w8_blockscale_1x128x128_256x16x64x256_16x16_16x16_1x1_16x16x1_16x16x1_1x16x1x16_4_1x1_intrawave_v1,35.09,399.78,0.0
gfx950,256,64,1024,2048,ck,8,2,5.6199,a8w8_blockscale_1x128x128_256x16x64x256_16x16_16x16_1x1_16x16x1_16x16x1_1x16x1x16_4_1x1_intrawave_v1,47.77,419.81,0.0
gfx950,256,80,1024,2048,ck,8,2,5.8645,a8w8_blockscale_1x128x128_256x16x64x256_16x16_16x16_1x1_16x16x1_16x16x1_1x16x1x16_4_1x1_intrawave_v1,57.22,413.48,0.0
gfx950,256,96,1024,2048,ck,8,2,6.0428,a8w8_blockscale_1x128x128_256x16x64x256_16x16_16x16_1x1_16x16x1_16x16x1_1x16x1x16_4_1x1_intrawave_v1,66.63,412.12,0.0
gfx950,256,112,1024,2048,ck,8,2,6.0732,a8w8_blockscale_1x128x128_256x16x64x256_16x16_16x16_1x1_16x16x1_16x16x1_1x16x1x16_4_1x1_intrawave_v1,77.35,420.85,0.0
gfx950,256,128,1024,2048,ck,8,2,6.3473,a8w8_blockscale_1x128x128_256x16x64x256_16x16_16x16_1x1_16x16x1_16x16x1_1x16x1x16_4_1x1_intrawave_v1,84.58,413.0,0.0
gfx950,256,256,1024,2048,ck,8,3,7.6205,a8w8_blockscale_1x128x128_256x16x64x256_16x16_16x16_1x1_16x16x1_16x16x1_1x16x1x16_4_1x1_intrawave_v1,140.84,412.63,0.0
gfx950,256,512,1024,2048,ck,7,0,9.8126,a8w8_blockscale_1x128x128_256x16x128x256_16x16_16x16_1x2_16x16x1_16x16x1_1x16x1x16_8_1x2_intrawave_v1,218.85,427.44,0.0
gfx950,256,667,1024,2048,ck,18,0,10.9139,a8w8_blockscale_1x128x128_256x64x64x256_16x16_32x32_1x1_16x16x1_16x16x1_1x32x1x8_8_1x1_intrawave_v1,256.33,442.48,0.0
gfx950,256,671,1024,2048,ck,18,2,10.5727,a8w8_blockscale_1x128x128_256x64x64x256_16x16_32x32_1x1_16x16x1_16x16x1_1x32x1x8_8_1x1_intrawave_v1,258.73,445.47,0.0
gfx950,256,931,1024,2048,ck,18,2,10.9903,a8w8_blockscale_1x128x128_256x64x64x256_16x16_32x32_1x1_16x16x1_16x16x1_1x32x1x8_8_1x1_intrawave_v1,325.66,492.93,0.0
gfx950,256,1024,1024,2048,ck,18,1,9.8299,a8w8_blockscale_1x128x128_256x64x64x256_16x16_32x32_1x1_16x16x1_16x16x1_1x32x1x8_8_1x1_intrawave_v1,391.82,573.95,0.0
gfx950,256,1025,1024,2048,ck,2,0,14.8874,a8w8_blockscale_1x128x128_256x64x128x128_16x16_32x32_1x2_8x32x1_8x32x1_1x32x1x8_8_1x1_intrawave_v3,273.79,400.92,0.0
gfx950,256,1027,1024,2048,ck,2,0,15.0571,a8w8_blockscale_1x128x128_256x64x128x128_16x16_32x32_1x2_8x32x1_8x32x1_1x32x1x8_8_1x1_intrawave_v3,286.08,418.66,0.0
gfx950,256,1031,1024,2048,ck,2,3,15.0511,a8w8_blockscale_1x128x128_256x64x128x128_16x16_32x32_1x2_8x32x1_8x32x1_1x32x1x8_8_1x1_intrawave_v3,283.27,414.01,0.0
gfx950,256,1039,1024,2048,ck,2,0,15.0825,a8w8_blockscale_1x128x128_256x64x128x128_16x16_32x32_1x2_8x32x1_8x32x1_1x32x1x8_8_1x1_intrawave_v3,288.94,421.21,0.0
gfx950,256,1040,1024,2048,ck,2,0,15.0975,a8w8_blockscale_1x128x128_256x64x128x128_16x16_32x32_1x2_8x32x1_8x32x1_1x32x1x8_8_1x1_intrawave_v3,288.93,421.06,0.0
gfx950,256,1041,1024,2048,ck,2,0,15.1375,a8w8_blockscale_1x128x128_256x64x128x128_16x16_32x32_1x2_8x32x1_8x32x1_1x32x1x8_8_1x1_intrawave_v3,288.44,420.22,0.0
gfx950,256,1072,1024,2048,ck,2,0,15.167,a8w8_blockscale_1x128x128_256x64x128x128_16x16_32x32_1x2_8x32x1_8x32x1_1x32x1x8_8_1x1_intrawave_v3,293.85,424.03,0.0
gfx950,256,1073,1024,2048,ck,2,2,15.1958,a8w8_blockscale_1x128x128_256x64x128x128_16x16_32x32_1x2_8x32x1_8x32x1_1x32x1x8_8_1x1_intrawave_v3,285.94,412.48,0.0
gfx950,256,1077,1024,2048,ck,2,0,15.0506,a8w8_blockscale_1x128x128_256x64x128x128_16x16_32x32_1x2_8x32x1_8x32x1_1x32x1x8_8_1x1_intrawave_v3,300.14,432.44,0.0
gfx950,256,1091,1024,2048,ck,2,1,15.1889,a8w8_blockscale_1x128x128_256x64x128x128_16x16_32x32_1x2_8x32x1_8x32x1_1x32x1x8_8_1x1_intrawave_v3,289.23,415.01,0.0
gfx950,256,1343,1024,2048,ck,2,0,15.3926,a8w8_blockscale_1x128x128_256x64x128x128_16x16_32x32_1x2_8x32x1_8x32x1_1x32x1x8_8_1x1_intrawave_v3,356.5,480.87,0.0
gfx950,256,1688,1024,2048,ck,2,1,15.6757,a8w8_blockscale_1x128x128_256x64x128x128_16x16_32x32_1x2_8x32x1_8x32x1_1x32x1x8_8_1x1_intrawave_v3,449.23,571.76,0.0
gfx950,256,2017,1024,2048,ck,2,1,15.7715,a8w8_blockscale_1x128x128_256x64x128x128_16x16_32x32_1x2_8x32x1_8x32x1_1x32x1x8_8_1x1_intrawave_v3,536.13,656.47,0.0
gfx950,256,2048,1024,2048,ck,2,1,15.589,a8w8_blockscale_1x128x128_256x64x128x128_16x16_32x32_1x2_8x32x1_8x32x1_1x32x1x8_8_1x1_intrawave_v3,541.17,660.61,0.0
gfx950,256,2050,1024,2048,ck,3,0,18.9536,a8w8_blockscale_1x128x128_256x64x64x128_16x16_32x32_1x1_8x32x1_8x32x1_1x32x1x8_8_1x1_intrawave_v3,453.3,553.24,0.0
gfx950,256,2063,1024,2048,ck,3,0,18.9449,a8w8_blockscale_1x128x128_256x64x64x128_16x16_32x32_1x1_8x32x1_8x32x1_1x32x1x8_8_1x1_intrawave_v3,456.74,556.73,0.0
gfx950,256,2064,1024,2048,ck,3,2,18.8824,a8w8_blockscale_1x128x128_256x64x64x128_16x16_32x32_1x1_8x32x1_8x32x1_1x32x1x8_8_1x1_intrawave_v3,458.4,558.7,0.0
gfx950,256,2099,1024,2048,ck,3,1,19.0119,a8w8_blockscale_1x128x128_256x64x64x128_16x16_32x32_1x1_8x32x1_8x32x1_1x32x1x8_8_1x1_intrawave_v3,462.92,562.35,0.0
gfx950,256,2159,1024,2048,ck,3,3,19.153,a8w8_blockscale_1x128x128_256x64x64x128_16x16_32x32_1x1_8x32x1_8x32x1_1x32x1x8_8_1x1_intrawave_v3,471.9,570.13,0.0
gfx950,256,2160,1024,2048,ck,3,1,19.1344,a8w8_blockscale_1x128x128_256x64x64x128_16x16_32x32_1x1_8x32x1_8x32x1_1x32x1x8_8_1x1_intrawave_v3,468.17,565.56,0.0
gfx950,256,2313,1024,2048,ck,3,3,19.3325,a8w8_blockscale_1x128x128_256x64x64x128_16x16_32x32_1x1_8x32x1_8x32x1_1x32x1x8_8_1x1_intrawave_v3,498.81,594.94,0.0
gfx950,256,2325,1024,2048,ck,3,2,19.4087,a8w8_blockscale_1x128x128_256x64x64x128_16x16_32x32_1x1_8x32x1_8x32x1_1x32x1x8_8_1x1_intrawave_v3,500.94,596.92,0.0
gfx950,256,3072,1024,2048,ck,0,3,19.7086,a8w8_blockscale_1x128x128_256x128x128x128_16x16_32x32_2x2_8x32x1_8x32x1_1x32x1x8_8_1x1_intrawave_v3,651.04,741.74,0.0
gfx950,256,3073,1024,2048,ck,0,0,20.3271,a8w8_blockscale_1x128x128_256x128x128x128_16x16_32x32_2x2_8x32x1_8x32x1_1x32x1x8_8_1x1_intrawave_v3,634.08,722.39,0.0
gfx950,256,3182,1024,2048,ck,0,3,20.7571,a8w8_blockscale_1x128x128_256x128x128x128_16x16_32x32_2x2_8x32x1_8x32x1_1x32x1x8_8_1x1_intrawave_v3,641.15,726.87,0.0
gfx950,256,3183,1024,2048,ck,0,0,20.6264,a8w8_blockscale_1x128x128_256x128x128x128_16x16_32x32_2x2_8x32x1_8x32x1_1x32x1x8_8_1x1_intrawave_v3,647.25,733.75,0.0
gfx950,256,3847,1024,2048,ck,0,0,21.0326,a8w8_blockscale_1x128x128_256x128x128x128_16x16_32x32_2x2_8x32x1_8x32x1_1x32x1x8_8_1x1_intrawave_v3,756.98,837.63,0.0
gfx950,256,4096,1024,2048,ck,0,3,20.3588,a8w8_blockscale_1x128x128_256x128x128x128_16x16_32x32_2x2_8x32x1_8x32x1_1x32x1x8_8_1x1_intrawave_v3,832.77,914.91,0.0
gfx950,256,4111,1024,2048,ck,2,1,27.9237,a8w8_blockscale_1x128x128_256x64x128x128_16x16_32x32_1x2_8x32x1_8x32x1_1x32x1x8_8_1x1_intrawave_v3,613.36,673.58,0.0
gfx950,256,4141,1024,2048,ck,2,0,27.8867,a8w8_blockscale_1x128x128_256x64x128x128_16x16_32x32_1x2_8x32x1_8x32x1_1x32x1x8_8_1x1_intrawave_v3,617.37,677.44,0.0
gfx950,256,4142,1024,2048,ck,2,3,28.0681,a8w8_blockscale_1x128x128_256x64x128x128_16x16_32x32_1x2_8x32x1_8x32x1_1x32x1x8_8_1x1_intrawave_v3,615.53,675.4,0.0
gfx950,256,4345,1024,2048,ck,2,2,28.3698,a8w8_blockscale_1x128x128_256x64x128x128_16x16_32x32_1x2_8x32x1_8x32x1_1x32x1x8_8_1x1_intrawave_v3,640.08,698.73,0.0
gfx950,256,5105,1024,2048,ck,2,1,29.2376,a8w8_blockscale_1x128x128_256x64x128x128_16x16_32x32_1x2_8x32x1_8x32x1_1x32x1x8_8_1x1_intrawave_v3,722.26,776.08,0.0
gfx950,256,5121,1024,2048,ck,2,2,28.996,a8w8_blockscale_1x128x128_256x64x128x128_16x16_32x32_1x2_8x32x1_8x32x1_1x32x1x8_8_1x1_intrawave_v3,732.03,786.35,0.0
gfx950,256,5123,1024,2048,ck,2,3,29.2289,a8w8_blockscale_1x128x128_256x64x128x128_16x16_32x32_1x2_8x32x1_8x32x1_1x32x1x8_8_1x1_intrawave_v3,722.19,775.74,0.0
gfx950,256,5131,1024,2048,ck,2,2,29.0946,a8w8_blockscale_1x128x128_256x64x128x128_16x16_32x32_1x2_8x32x1_8x32x1_1x32x1x8_8_1x1_intrawave_v3,731.83,786.0,0.0
gfx950,256,5427,1024,2048,ck,2,1,29.6876,a8w8_blockscale_1x128x128_256x64x128x128_16x16_32x32_1x2_8x32x1_8x32x1_1x32x1x8_8_1x1_intrawave_v3,757.97,810.04,0.0
gfx950,256,6113,1024,2048,ck,2,0,30.9091,a8w8_blockscale_1x128x128_256x64x128x128_16x16_32x32_1x2_8x32x1_8x32x1_1x32x1x8_8_1x1_intrawave_v3,819.77,867.61,0.0
gfx950,256,6197,1024,2048,ck,0,2,31.4566,a8w8_blockscale_1x128x128_256x128x128x128_16x16_32x32_2x2_8x32x1_8x32x1_1x32x1x8_8_1x1_intrawave_v3,804.12,850.15,0.0
gfx950,256,6409,1024,2048,ck,0,2,31.9954,a8w8_blockscale_1x128x128_256x128x128x128_16x16_32x32_2x2_8x32x1_8x32x1_1x32x1x8_8_1x1_intrawave_v3,835.44,881.03,0.0
gfx950,256,7121,1024,2048,ck,0,1,33.1424,a8w8_blockscale_1x128x128_256x128x128x128_16x16_32x32_2x2_8x32x1_8x32x1_1x32x1x8_8_1x1_intrawave_v3,896.94,938.9,0.0
gfx950,256,7168,1024,2048,ck,0,0,32.1957,a8w8_blockscale_1x128x128_256x128x128x128_16x16_32x32_2x2_8x32x1_8x32x1_1x32x1x8_8_1x1_intrawave_v3,933.81,977.06,0.0
gfx950,256,7169,1024,2048,ck,0,2,33.3051,a8w8_blockscale_1x128x128_256x128x128x128_16x16_32x32_2x2_8x32x1_8x32x1_1x32x1x8_8_1x1_intrawave_v3,897.21,938.75,0.0
gfx950,256,7172,1024,2048,ck,0,1,33.4113,a8w8_blockscale_1x128x128_256x128x128x128_16x16_32x32_2x2_8x32x1_8x32x1_1x32x1x8_8_1x1_intrawave_v3,893.74,935.1,0.0
gfx950,256,7176,1024,2048,ck,0,0,33.2926,a8w8_blockscale_1x128x128_256x128x128x128_16x16_32x32_2x2_8x32x1_8x32x1_1x32x1x8_8_1x1_intrawave_v3,884.86,925.77,0.0
gfx950,256,7177,1024,2048,ck,0,0,33.1742,a8w8_blockscale_1x128x128_256x128x128x128_16x16_32x32_2x2_8x32x1_8x32x1_1x32x1x8_8_1x1_intrawave_v3,897.33,938.82,0.0
gfx950,256,7178,1024,2048,ck,0,0,32.9875,a8w8_blockscale_1x128x128_256x128x128x128_16x16_32x32_2x2_8x32x1_8x32x1_1x32x1x8_8_1x1_intrawave_v3,912.67,954.85,0.0
gfx950,256,7179,1024,2048,ck,0,0,33.3029,a8w8_blockscale_1x128x128_256x128x128x128_16x16_32x32_2x2_8x32x1_8x32x1_1x32x1x8_8_1x1_intrawave_v3,904.15,945.93,0.0
gfx950,256,7183,1024,2048,ck,0,0,33.1872,a8w8_blockscale_1x128x128_256x128x128x128_16x16_32x32_2x2_8x32x1_8x32x1_1x32x1x8_8_1x1_intrawave_v3,907.81,949.73,0.0
gfx950,256,7184,1024,2048,ck,0,0,33.2252,a8w8_blockscale_1x128x128_256x128x128x128_16x16_32x32_2x2_8x32x1_8x32x1_1x32x1x8_8_1x1_intrawave_v3,902.53,944.19,0.0
gfx950,256,7209,1024,2048,ck,0,1,33.3253,a8w8_blockscale_1x128x128_256x128x128x128_16x16_32x32_2x2_8x32x1_8x32x1_1x32x1x8_8_1x1_intrawave_v3,901.44,942.84,0.0
gfx950,256,7210,1024,2048,ck,0,0,33.1735,a8w8_blockscale_1x128x128_256x128x128x128_16x16_32x32_2x2_8x32x1_8x32x1_1x32x1x8_8_1x1_intrawave_v3,911.6,953.45,0.0
gfx950,256,7211,1024,2048,ck,0,3,33.5876,a8w8_blockscale_1x128x128_256x128x128x128_16x16_32x32_2x2_8x32x1_8x32x1_1x32x1x8_8_1x1_intrawave_v3,897.49,938.69,0.0
gfx950,256,7217,1024,2048,ck,0,2,33.1621,a8w8_blockscale_1x128x128_256x128x128x128_16x16_32x32_2x2_8x32x1_8x32x1_1x32x1x8_8_1x1_intrawave_v3,894.74,935.76,0.0
gfx950,256,7273,1024,2048,ck,0,0,33.0869,a8w8_blockscale_1x128x128_256x128x128x128_16x16_32x32_2x2_8x32x1_8x32x1_1x32x1x8_8_1x1_intrawave_v3,906.14,947.2,0.0
gfx950,256,7274,1024,2048,ck,0,2,33.2843,a8w8_blockscale_1x128x128_256x128x128x128_16x16_32x32_2x2_8x32x1_8x32x1_1x32x1x8_8_1x1_intrawave_v3,909.55,950.75,0.0
gfx950,256,7391,1024,2048,ck,0,1,33.7176,a8w8_blockscale_1x128x128_256x128x128x128_16x16_32x32_2x2_8x32x1_8x32x1_1x32x1x8_8_1x1_intrawave_v3,915.48,955.95,0.0
gfx950,256,7393,1024,2048,ck,0,1,33.3143,a8w8_blockscale_1x128x128_256x128x128x128_16x16_32x32_2x2_8x32x1_8x32x1_1x32x1x8_8_1x1_intrawave_v3,921.95,962.7,0.0
gfx950,256,7715,1024,2048,ck,0,0,34.1533,a8w8_blockscale_1x128x128_256x128x128x128_16x16_32x32_2x2_8x32x1_8x32x1_1x32x1x8_8_1x1_intrawave_v3,933.17,971.78,0.0
gfx950,256,7753,1024,2048,ck,0,0,33.7965,a8w8_blockscale_1x128x128_256x128x128x128_16x16_32x32_2x2_8x32x1_8x32x1_1x32x1x8_8_1x1_intrawave_v3,948.65,987.59,0.0
gfx950,256,7819,1024,2048,ck,0,2,34.3673,a8w8_blockscale_1x128x128_256x128x128x128_16x16_32x32_2x2_8x32x1_8x32x1_1x32x1x8_8_1x1_intrawave_v3,940.95,979.07,0.0
gfx950,256,8099,1024,2048,ck,0,0,34.3613,a8w8_blockscale_1x128x128_256x128x128x128_16x16_32x32_2x2_8x32x1_8x32x1_1x32x1x8_8_1x1_intrawave_v3,988.6,1026.46,0.0
gfx950,256,8129,1024,2048,ck,0,3,34.4825,a8w8_blockscale_1x128x128_256x128x128x128_16x16_32x32_2x2_8x32x1_8x32x1_1x32x1x8_8_1x1_intrawave_v3,984.13,1021.6,0.0
gfx950,256,8188,1024,2048,ck,0,0,34.8797,a8w8_blockscale_1x128x128_256x128x128x128_16x16_32x32_2x2_8x32x1_8x32x1_1x32x1x8_8_1x1_intrawave_v3,984.61,1021.66,0.0
gfx950,256,8192,1024,2048,ck,0,2,33.7791,a8w8_blockscale_1x128x128_256x128x128x128_16x16_32x32_2x2_8x32x1_8x32x1_1x32x1x8_8_1x1_intrawave_v3,1006.98,1044.84,0.0
gfx950,256,1,2048,128,ck,6,0,2.6178,a8w8_blockscale_1x128x128_256x16x64x128_8x16_16x16_1x1_16x16x1_8x32x1_1x16x1x16_4_1x1_intrawave_v1,0.19,94.0,0.0
gfx950,256,1,2048,512,ck,8,1,3.2164,a8w8_blockscale_1x128x128_256x16x64x256_16x16_16x16_1x1_16x16x1_16x16x1_1x16x1x16_4_1x1_intrawave_v1,0.61,305.07,0.0
gfx950,256,1,2048,1024,ck,8,2,4.419,a8w8_blockscale_1x128x128_256x16x64x256_16x16_16x16_1x1_16x16x1_16x16x1_1x16x1x16_4_1x1_intrawave_v1,0.95,475.73,0.0
gfx950,256,1,2048,2048,ck,8,3,5.0033,a8w8_blockscale_1x128x128_256x16x64x256_16x16_16x16_1x1_16x16x1_16x16x1_1x16x1x16_4_1x1_intrawave_v1,1.68,839.54,0.0
gfx950,256,1,2048,4096,ck,8,3,5.8908,a8w8_blockscale_1x128x128_256x16x64x256_16x16_16x16_1x1_16x16x1_16x16x1_1x16x1x16_4_1x1_intrawave_v1,2.85,1425.41,0.0
gfx950,256,2,2048,128,ck,6,0,2.8747,a8w8_blockscale_1x128x128_256x16x64x128_8x16_16x16_1x1_16x16x1_8x32x1_1x16x1x16_4_1x1_intrawave_v1,0.36,94.13,0.0
gfx950,256,2,2048,512,ck,8,0,3.4766,a8w8_blockscale_1x128x128_256x16x64x256_16x16_16x16_1x1_16x16x1_16x16x1_1x16x1x16_4_1x1_intrawave_v1,1.21,304.26,0.0
gfx950,256,2,2048,1024,ck,8,2,4.6071,a8w8_blockscale_1x128x128_256x16x64x256_16x16_16x16_1x1_16x16x1_16x16x1_1x16x1x16_4_1x1_intrawave_v1,1.82,457.42,0.0
gfx950,256,2,2048,2048,ck,8,3,5.1759,a8w8_blockscale_1x128x128_256x16x64x256_16x16_16x16_1x1_16x16x1_16x16x1_1x16x1x16_4_1x1_intrawave_v1,3.24,812.73,0.0
gfx950,256,2,2048,4096,ck,8,3,6.0329,a8w8_blockscale_1x128x128_256x16x64x256_16x16_16x16_1x1_16x16x1_16x16x1_1x16x1x16_4_1x1_intrawave_v1,5.56,1393.19,0.0
gfx950,256,4,2048,128,ck,6,0,2.8862,a8w8_blockscale_1x128x128_256x16x64x128_8x16_16x16_1x1_16x16x1_8x32x1_1x16x1x16_4_1x1_intrawave_v1,0.73,96.68,0.0
gfx950,256,4,2048,512,ck,8,0,3.452,a8w8_blockscale_1x128x128_256x16x64x256_16x16_16x16_1x1_16x16x1_16x16x1_1x16x1x16_4_1x1_intrawave_v1,2.43,309.1,0.0
gfx950,256,4,2048,1024,ck,8,0,4.6467,a8w8_blockscale_1x128x128_256x16x64x256_16x16_16x16_1x1_16x16x1_16x16x1_1x16x1x16_4_1x1_intrawave_v1,3.61,455.73,0.0
gfx950,256,4,2048,2048,ck,8,3,5.3428,a8w8_blockscale_1x128x128_256x16x64x256_16x16_16x16_1x1_16x16x1_16x16x1_1x16x1x16_4_1x1_intrawave_v1,6.28,789.64,0.0
gfx950,256,4,2048,4096,ck,8,3,6.2344,a8w8_blockscale_1x128x128_256x16x64x256_16x16_16x16_1x1_16x16x1_16x16x1_1x16x1x16_4_1x1_intrawave_v1,10.76,1350.79,0.0001
gfx950,256,8,2048,128,ck,6,0,2.8923,a8w8_blockscale_1x128x128_256x16x64x128_8x16_16x16_1x1_16x16x1_8x32x1_1x16x1x16_4_1x1_intrawave_v1,1.45,102.32,0.0
gfx950,256,8,2048,512,ck,8,0,3.4537,a8w8_blockscale_1x128x128_256x16x64x256_16x16_16x16_1x1_16x16x1_16x16x1_1x16x1x16_4_1x1_intrawave_v1,4.86,314.28,0.0
gfx950,256,8,2048,1024,ck,8,0,4.6132,a8w8_blockscale_1x128x128_256x16x64x256_16x16_16x16_1x1_16x16x1_16x16x1_1x16x1x16_4_1x1_intrawave_v1,7.27,463.48,0.0
gfx950,256,8,2048,2048,ck,8,3,5.6544,a8w8_blockscale_1x128x128_256x16x64x256_16x16_16x16_1x1_16x16x1_16x16x1_1x16x1x16_4_1x1_intrawave_v1,11.87,750.47,0.0
gfx950,256,8,2048,4096,ck,8,3,6.5649,a8w8_blockscale_1x128x128_256x16x64x256_16x16_16x16_1x1_16x16x1_16x16x1_1x16x1x16_4_1x1_intrawave_v1,20.44,1287.78,0.0
gfx950,256,16,2048,128,ck,6,0,2.8978,a8w8_blockscale_1x128x128_256x16x64x128_8x16_16x16_1x1_16x16x1_8x32x1_1x16x1x16_4_1x1_intrawave_v1,2.89,113.79,0.0
gfx950,256,16,2048,512,ck,8,0,3.4143,a8w8_blockscale_1x128x128_256x16x64x256_16x16_16x16_1x1_16x16x1_16x16x1_1x16x1x16_4_1x1_intrawave_v1,9.83,328.71,0.0
gfx950,256,16,2048,1024,ck,8,0,4.5464,a8w8_blockscale_1x128x128_256x16x64x256_16x16_16x16_1x1_16x16x1_16x16x1_1x16x1x16_4_1x1_intrawave_v1,14.76,479.3,0.0
gfx950,256,16,2048,2048,ck,8,2,5.9015,a8w8_blockscale_1x128x128_256x16x64x256_16x16_16x16_1x1_16x16x1_16x16x1_1x16x1x16_4_1x1_intrawave_v1,22.74,727.38,0.0
gfx950,256,16,2048,4096,ck,8,3,6.7777,a8w8_blockscale_1x128x128_256x16x64x256_16x16_16x16_1x1_16x16x1_16x16x1_1x16x1x16_4_1x1_intrawave_v1,39.61,1257.02,0.0
gfx950,256,24,2048,2048,ck,8,2,6.217,a8w8_blockscale_1x128x128_256x16x64x256_16x16_16x16_1x1_16x16x1_16x16x1_1x16x1x16_4_1x1_intrawave_v1,32.38,698.37,0.0
gfx950,256,32,2048,128,ck,6,0,3.1178,a8w8_blockscale_1x128x128_256x16x64x128_8x16_16x16_1x1_16x16x1_8x32x1_1x16x1x16_4_1x1_intrawave_v1,5.38,127.43,0.0
gfx950,256,32,2048,512,ck,8,0,3.6592,a8w8_blockscale_1x128x128_256x16x64x256_16x16_16x16_1x1_16x16x1_16x16x1_1x16x1x16_4_1x1_intrawave_v1,18.34,326.86,0.0
gfx950,256,32,2048,1024,ck,8,0,4.8034,a8w8_blockscale_1x128x128_256x16x64x256_16x16_16x16_1x1_16x16x1_16x16x1_1x16x1x16_4_1x1_intrawave_v1,27.94,470.71,0.0
gfx950,256,32,2048,2048,ck,8,2,6.3691,a8w8_blockscale_1x128x128_256x16x64x256_16x16_16x16_1x1_16x16x1_16x16x1_1x16x1x16_4_1x1_intrawave_v1,42.15,689.41,0.0
gfx950,256,32,2048,4096,ck,8,3,7.5085,a8w8_blockscale_1x128x128_256x16x64x256_16x16_16x16_1x1_16x16x1_16x16x1_1x16x1x16_4_1x1_intrawave_v1,71.5,1152.13,0.0
gfx950,256,40,2048,2048,ck,8,2,6.7294,a8w8_blockscale_1x128x128_256x16x64x256_16x16_16x16_1x1_16x16x1_16x16x1_1x16x1x16_4_1x1_intrawave_v1,49.86,659.8,0.0
gfx950,256,48,2048,128,ck,6,0,3.1223,a8w8_blockscale_1x128x128_256x16x64x128_8x16_16x16_1x1_16x16x1_8x32x1_1x16x1x16_4_1x1_intrawave_v1,8.06,148.9,0.0
gfx950,256,48,2048,512,ck,8,0,3.6608,a8w8_blockscale_1x128x128_256x16x64x256_16x16_16x16_1x1_16x16x1_16x16x1_1x16x1x16_4_1x1_intrawave_v1,27.5,346.85,0.0
gfx950,256,48,2048,1024,ck,8,0,4.8554,a8w8_blockscale_1x128x128_256x16x64x256_16x16_16x16_1x1_16x16x1_16x16x1_1x16x1x16_4_1x1_intrawave_v1,41.46,482.54,0.0
gfx950,256,48,2048,2048,ck,8,2,6.8337,a8w8_blockscale_1x128x128_256x16x64x256_16x16_16x16_1x1_16x16x1_16x16x1_1x16x1x16_4_1x1_intrawave_v1,58.92,656.92,0.0
gfx950,256,48,2048,4096,ck,8,3,8.1825,a8w8_blockscale_1x128x128_256x16x64x256_16x16_16x16_1x1_16x16x1_16x16x1_1x16x1x16_4_1x1_intrawave_v1,98.42,1073.24,0.0
gfx950,256,56,2048,2048,ck,8,2,6.8882,a8w8_blockscale_1x128x128_256x16x64x256_16x16_16x16_1x1_16x16x1_16x16x1_1x16x1x16_4_1x1_intrawave_v1,68.2,658.86,0.0
gfx950,256,64,2048,128,ck,6,3,2.9681,a8w8_blockscale_1x128x128_256x16x64x128_8x16_16x16_1x1_16x16x1_8x32x1_1x16x1x16_4_1x1_intrawave_v1,11.26,178.74,0.0
gfx950,256,64,2048,512,ck,8,0,3.5341,a8w8_blockscale_1x128x128_256x16x64x256_16x16_16x16_1x1_16x16x1_16x16x1_1x16x1x16_4_1x1_intrawave_v1,37.98,380.15,0.0
gfx950,256,64,2048,1024,ck,8,0,4.765,a8w8_blockscale_1x128x128_256x16x64x256_16x16_16x16_1x1_16x16x1_16x16x1_1x16x1x16_4_1x1_intrawave_v1,56.29,508.46,0.0
gfx950,256,64,2048,2048,ck,8,2,6.6516,a8w8_blockscale_1x128x128_256x16x64x256_16x16_16x16_1x1_16x16x1_16x16x1_1x16x1x16_4_1x1_intrawave_v1,80.71,689.69,0.0
gfx950,256,64,2048,4096,ck,8,3,8.8961,a8w8_blockscale_1x128x128_256x16x64x256_16x16_16x16_1x1_16x16x1_16x16x1_1x16x1x16_4_1x1_intrawave_v1,120.7,1001.89,0.0
gfx950,256,72,2048,2048,ck,8,2,7.2983,a8w8_blockscale_1x128x128_256x16x64x256_16x16_16x16_1x1_16x16x1_16x16x1_1x16x1x16_4_1x1_intrawave_v1,82.76,635.31,0.0
gfx950,256,80,2048,128,ck,6,2,2.9921,a8w8_blockscale_1x128x128_256x16x64x128_8x16_16x16_1x1_16x16x1_8x32x1_1x16x1x16_4_1x1_intrawave_v1,13.95,199.6,0.0
gfx950,256,80,2048,512,ck,8,0,3.5883,a8w8_blockscale_1x128x128_256x16x64x256_16x16_16x16_1x1_16x16x1_16x16x1_1x16x1x16_4_1x1_intrawave_v1,46.76,394.95,0.0
gfx950,256,80,2048,1024,ck,8,2,4.8243,a8w8_blockscale_1x128x128_256x16x64x256_16x16_16x16_1x1_16x16x1_16x16x1_1x16x1x16_4_1x1_intrawave_v1,69.2,516.99,0.0
gfx950,256,80,2048,2048,ck,8,2,7.4401,a8w8_blockscale_1x128x128_256x16x64x256_16x16_16x16_1x1_16x16x1_16x16x1_1x16x1x16_4_1x1_intrawave_v1,90.2,629.81,0.0
gfx950,256,80,2048,4096,ck,8,3,9.9053,a8w8_blockscale_1x128x128_256x16x64x256_16x16_16x16_1x1_16x16x1_16x16x1_1x16x1x16_4_1x1_intrawave_v1,135.5,913.04,0.0
gfx950,256,88,2048,2048,ck,8,2,7.4864,a8w8_blockscale_1x128x128_256x16x64x256_16x16_16x16_1x1_16x16x1_16x16x1_1x16x1x16_4_1x1_intrawave_v1,98.61,632.48,0.0
gfx950,256,96,2048,128,ck,6,3,3.0613,a8w8_blockscale_1x128x128_256x16x64x128_8x16_16x16_1x1_16x16x1_8x32x1_1x16x1x16_4_1x1_intrawave_v1,16.41,217.7,0.0
gfx950,256,96,2048,512,ck,8,0,3.6245,a8w8_blockscale_1x128x128_256x16x64x256_16x16_16x16_1x1_16x16x1_16x16x1_1x16x1x16_4_1x1_intrawave_v1,55.55,411.35,0.0
gfx950,256,96,2048,1024,ck,8,1,4.8847,a8w8_blockscale_1x128x128_256x16x64x256_16x16_16x16_1x1_16x16x1_16x16x1_1x16x1x16_4_1x1_intrawave_v1,81.23,522.23,0.0
gfx950,256,96,2048,2048,ck,8,2,7.6521,a8w8_blockscale_1x128x128_256x16x64x256_16x16_16x16_1x1_16x16x1_16x16x1_1x16x1x16_4_1x1_intrawave_v1,105.24,625.2,0.0
gfx950,256,96,2048,4096,ck,8,3,10.4597,a8w8_blockscale_1x128x128_256x16x64x256_16x16_16x16_1x1_16x16x1_16x16x1_1x16x1x16_4_1x1_intrawave_v1,153.98,877.18,0.0
gfx950,256,104,2048,2048,ck,8,2,7.9132,a8w8_blockscale_1x128x128_256x16x64x256_16x16_16x16_1x1_16x16x1_16x16x1_1x16x1x16_4_1x1_intrawave_v1,110.25,610.79,0.0
gfx950,256,112,2048,128,ck,6,0,3.0643,a8w8_blockscale_1x128x128_256x16x64x128_8x16_16x16_1x1_16x16x1_8x32x1_1x16x1x16_4_1x1_intrawave_v1,19.16,239.93,0.0
gfx950,256,112,2048,512,ck,8,0,3.7007,a8w8_blockscale_1x128x128_256x16x64x256_16x16_16x16_1x1_16x16x1_16x16x1_1x16x1x16_4_1x1_intrawave_v1,63.47,422.8,0.0
gfx950,256,112,2048,1024,ck,8,1,4.982,a8w8_blockscale_1x128x128_256x16x64x256_16x16_16x16_1x1_16x16x1_16x16x1_1x16x1x16_4_1x1_intrawave_v1,94.16,535.29,0.0
gfx950,256,112,2048,2048,ck,8,0,7.7447,a8w8_blockscale_1x128x128_256x16x64x256_16x16_16x16_1x1_16x16x1_16x16x1_1x16x1x16_4_1x1_intrawave_v1,121.31,630.42,0.0
gfx950,256,112,2048,4096,ck,8,3,11.1044,a8w8_blockscale_1x128x128_256x16x64x256_16x16_16x16_1x1_16x16x1_16x16x1_1x16x1x16_4_1x1_intrawave_v1,169.22,838.06,0.0
gfx950,256,120,2048,2048,ck,8,0,7.935,a8w8_blockscale_1x128x128_256x16x64x256_16x16_16x16_1x1_16x16x1_16x16x1_1x16x1x16_4_1x1_intrawave_v1,126.86,621.5,0.0
gfx950,256,128,2048,128,ck,6,0,3.0688,a8w8_blockscale_1x128x128_256x16x64x128_8x16_16x16_1x1_16x16x1_8x32x1_1x16x1x16_4_1x1_intrawave_v1,21.87,261.61,0.0
gfx950,256,128,2048,512,ck,8,0,3.7071,a8w8_blockscale_1x128x128_256x16x64x256_16x16_16x16_1x1_16x16x1_16x16x1_1x16x1x16_4_1x1_intrawave_v1,72.41,441.96,0.0
gfx950,256,128,2048,1024,ck,8,0,5.0117,a8w8_blockscale_1x128x128_256x16x64x256_16x16_16x16_1x1_16x16x1_16x16x1_1x16x1x16_4_1x1_intrawave_v1,107.12,549.22,0.0
gfx950,256,128,2048,2048,ck,8,0,7.7126,a8w8_blockscale_1x128x128_256x16x64x256_16x16_16x16_1x1_16x16x1_16x16x1_1x16x1x16_4_1x1_intrawave_v1,139.22,645.79,0.0
gfx950,256,128,2048,4096,ck,8,3,12.0874,a8w8_blockscale_1x128x128_256x16x64x256_16x16_16x16_1x1_16x16x1_16x16x1_1x16x1x16_4_1x1_intrawave_v1,177.66,780.75,0.0
gfx950,256,136,2048,2048,ck,8,2,8.8985,a8w8_blockscale_1x128x128_256x16x64x256_16x16_16x16_1x1_16x16x1_16x16x1_1x16x1x16_4_1x1_intrawave_v1,128.21,565.25,0.0
gfx950,256,144,2048,2048,ck,8,2,9.0242,a8w8_blockscale_1x128x128_256x16x64x256_16x16_16x16_1x1_16x16x1_16x16x1_1x16x1x16_4_1x1_intrawave_v1,133.86,562.82,0.0
gfx950,256,152,2048,2048,ck,8,2,9.1904,a8w8_blockscale_1x128x128_256x16x64x256_16x16_16x16_1x1_16x16x1_16x16x1_1x16x1x16_4_1x1_intrawave_v1,138.74,557.99,0.0
gfx950,256,160,2048,2048,ck,7,0,9.274,a8w8_blockscale_1x128x128_256x16x128x256_16x16_16x16_1x2_16x16x1_16x16x1_1x16x1x16_8_1x2_intrawave_v1,144.31,556.67,0.0
gfx950,256,168,2048,2048,ck,7,3,9.3078,a8w8_blockscale_1x128x128_256x16x128x256_16x16_16x16_1x2_16x16x1_16x16x1_1x16x1x16_8_1x2_intrawave_v1,148.04,549.03,0.0
gfx950,256,176,2048,2048,ck,7,0,9.2735,a8w8_blockscale_1x128x128_256x16x128x256_16x16_16x16_1x2_16x16x1_16x16x1_1x16x1x16_8_1x2_intrawave_v1,159.21,568.9,0.0
gfx950,256,184,2048,2048,ck,7,0,9.3373,a8w8_blockscale_1x128x128_256x16x128x256_16x16_16x16_1x2_16x16x1_16x16x1_1x16x1x16_8_1x2_intrawave_v1,163.59,564.34,0.0
gfx950,256,192,2048,2048,ck,7,0,9.2683,a8w8_blockscale_1x128x128_256x16x128x256_16x16_16x16_1x2_16x16x1_16x16x1_1x16x1x16_8_1x2_intrawave_v1,171.08,570.83,0.0
gfx950,256,200,2048,2048,ck,7,1,9.4205,a8w8_blockscale_1x128x128_256x16x128x256_16x16_16x16_1x2_16x16x1_16x16x1_1x16x1x16_8_1x2_intrawave_v1,177.98,575.29,0.0
gfx950,256,208,2048,2048,ck,7,0,9.2128,a8w8_blockscale_1x128x128_256x16x128x256_16x16_16x16_1x2_16x16x1_16x16x1_1x16x1x16_8_1x2_intrawave_v1,189.39,593.98,0.0
gfx950,256,216,2048,2048,ck,7,0,9.3607,a8w8_blockscale_1x128x128_256x16x128x256_16x16_16x16_1x2_16x16x1_16x16x1_1x16x1x16_8_1x2_intrawave_v1,193.57,589.85,0.0
gfx950,256,224,2048,2048,ck,13,0,9.4043,a8w8_blockscale_1x128x128_256x32x64x256_16x16_16x16_2x1_16x16x1_16x16x1_1x32x1x8_8_2x1_intrawave_v1,199.81,592.34,0.0
gfx950,256,232,2048,2048,ck,7,0,9.4092,a8w8_blockscale_1x128x128_256x16x128x256_16x16_16x16_1x2_16x16x1_16x16x1_1x16x1x16_8_1x2_intrawave_v1,206.84,597.26,0.0
gfx950,256,240,2048,2048,ck,7,0,9.4134,a8w8_blockscale_1x128x128_256x16x128x256_16x16_16x16_1x2_16x16x1_16x16x1_1x16x1x16_8_1x2_intrawave_v1,213.87,602.21,0.0
gfx950,256,248,2048,2048,ck,7,2,9.4997,a8w8_blockscale_1x128x128_256x16x128x256_16x16_16x16_1x2_16x16x1_16x16x1_1x16x1x16_8_1x2_intrawave_v1,217.41,597.58,0.0
gfx950,256,256,2048,128,ck,11,0,3.348,a8w8_blockscale_1x128x128_256x32x64x128_16x16_16x16_2x1_8x32x1_8x32x1_1x32x1x8_8_2x1_intrawave_v1,40.09,401.28,0.0
gfx950,256,256,2048,512,ck,13,1,3.9574,a8w8_blockscale_1x128x128_256x32x64x256_16x16_16x16_2x1_16x16x1_16x16x1_1x32x1x8_8_2x1_intrawave_v1,135.29,561.52,0.0
gfx950,256,256,2048,1024,ck,13,0,5.9965,a8w8_blockscale_1x128x128_256x32x64x256_16x16_16x16_2x1_16x16x1_16x16x1_1x32x1x8_8_2x1_intrawave_v1,179.06,568.31,0.0
gfx950,256,256,2048,2048,ck,7,0,9.4407,a8w8_blockscale_1x128x128_256x16x128x256_16x16_16x16_1x2_16x16x1_16x16x1_1x16x1x16_8_1x2_intrawave_v1,227.47,610.88,0.0
gfx950,256,256,2048,4096,ck,18,1,15.9378,a8w8_blockscale_1x128x128_256x64x64x256_16x16_32x32_1x1_16x16x1_16x16x1_1x32x1x8_8_1x1_intrawave_v1,266.49,650.61,0.0
gfx950,256,272,2048,2048,ck,18,0,10.6175,a8w8_blockscale_1x128x128_256x64x64x256_16x16_32x32_1x1_16x16x1_16x16x1_1x32x1x8_8_1x1_intrawave_v1,214.9,552.43,0.0
gfx950,256,288,2048,2048,ck,12,2,10.4635,a8w8_blockscale_1x128x128_256x32x128x256_16x16_32x32_1x1_16x16x1_16x16x1_1x32x1x8_8_1x1_intrawave_v1,222.56,549.4,0.0
gfx950,256,304,2048,2048,ck,18,1,10.4905,a8w8_blockscale_1x128x128_256x64x64x256_16x16_32x32_1x1_16x16x1_16x16x1_1x32x1x8_8_1x1_intrawave_v1,235.76,560.44,0.0
gfx950,256,320,2048,2048,ck,18,3,9.6443,a8w8_blockscale_1x128x128_256x64x64x256_16x16_32x32_1x1_16x16x1_16x16x1_1x32x1x8_8_1x1_intrawave_v1,269.38,618.21,0.0
gfx950,256,336,2048,2048,ck,18,0,10.6238,a8w8_blockscale_1x128x128_256x64x64x256_16x16_32x32_1x1_16x16x1_16x16x1_1x32x1x8_8_1x1_intrawave_v1,254.34,564.77,0.0
gfx950,256,352,2048,2048,ck,18,2,10.5962,a8w8_blockscale_1x128x128_256x64x64x256_16x16_32x32_1x1_16x16x1_16x16x1_1x32x1x8_8_1x1_intrawave_v1,270.74,582.87,0.0
gfx950,256,368,2048,2048,ck,18,0,10.7171,a8w8_blockscale_1x128x128_256x64x64x256_16x16_32x32_1x1_16x16x1_16x16x1_1x32x1x8_8_1x1_intrawave_v1,278.27,581.9,0.0
gfx950,256,384,2048,2048,ck,18,0,9.6196,a8w8_blockscale_1x128x128_256x64x64x256_16x16_32x32_1x1_16x16x1_16x16x1_1x32x1x8_8_1x1_intrawave_v1,334.86,681.28,0.0
gfx950,256,400,2048,2048,ck,18,0,11.4867,a8w8_blockscale_1x128x128_256x64x64x256_16x16_32x32_1x1_16x16x1_16x16x1_1x32x1x8_8_1x1_intrawave_v1,292.12,579.1,0.0
gfx950,256,416,2048,2048,ck,12,0,11.3464,a8w8_blockscale_1x128x128_256x32x128x256_16x16_32x32_1x1_16x16x1_16x16x1_1x32x1x8_8_1x1_intrawave_v1,307.56,594.92,0.0
gfx950,256,432,2048,2048,ck,18,0,10.8619,a8w8_blockscale_1x128x128_256x64x64x256_16x16_32x32_1x1_16x16x1_16x16x1_1x32x1x8_8_1x1_intrawave_v1,333.63,630.51,0.0
gfx950,256,448,2048,2048,ck,18,0,9.7191,a8w8_blockscale_1x128x128_256x64x64x256_16x16_32x32_1x1_16x16x1_16x16x1_1x32x1x8_8_1x1_intrawave_v1,386.67,714.76,0.0
gfx950,256,464,2048,2048,ck,18,0,11.5007,a8w8_blockscale_1x128x128_256x64x64x256_16x16_32x32_1x1_16x16x1_16x16x1_1x32x1x8_8_1x1_intrawave_v1,338.44,612.58,0.0
gfx950,256,480,2048,2048,ck,18,0,11.1308,a8w8_blockscale_1x128x128_256x64x64x256_16x16_32x32_1x1_16x16x1_16x16x1_1x32x1x8_8_1x1_intrawave_v1,361.75,641.77,0.0
gfx950,256,496,2048,2048,ck,18,0,11.0895,a8w8_blockscale_1x128x128_256x64x64x256_16x16_32x32_1x1_16x16x1_16x16x1_1x32x1x8_8_1x1_intrawave_v1,375.2,653.03,0.0
gfx950,256,512,2048,128,ck,16,0,4.1087,a8w8_blockscale_1x128x128_256x64x64x128_16x16_32x32_1x1_8x32x1_8x32x1_1x32x1x8_8_1x1_intrawave_v1,65.33,590.17,0.0
gfx950,256,512,2048,512,ck,18,0,5.2023,a8w8_blockscale_1x128x128_256x64x64x256_16x16_32x32_1x1_16x16x1_16x16x1_1x32x1x8_8_1x1_intrawave_v1,206.4,655.07,0.0
gfx950,256,512,2048,1024,ck,18,0,7.0246,a8w8_blockscale_1x128x128_256x64x64x256_16x16_32x32_1x1_16x16x1_16x16x1_1x32x1x8_8_1x1_intrawave_v1,305.71,671.72,0.0
gfx950,256,512,2048,2048,ck,18,0,10.5175,a8w8_blockscale_1x128x128_256x64x64x256_16x16_32x32_1x1_16x16x1_16x16x1_1x32x1x8_8_1x1_intrawave_v1,408.36,697.89,0.0
gfx950,256,512,2048,4096,ck,18,3,16.7237,a8w8_blockscale_1x128x128_256x64x64x256_16x16_32x32_1x1_16x16x1_16x16x1_1x32x1x8_8_1x1_intrawave_v1,512.55,750.81,0.0
gfx950,256,588,2048,128,ck,6,0,4.7095,a8w8_blockscale_1x128x128_256x16x64x128_8x16_16x16_1x1_16x16x1_8x32x1_1x16x1x16_4_1x1_intrawave_v1,65.46,583.05,0.0
gfx950,256,588,2048,1024,ck,2,0,9.9441,a8w8_blockscale_1x128x128_256x64x128x128_16x16_32x32_1x2_8x32x1_8x32x1_1x32x1x8_8_1x1_intrawave_v3,248.01,513.64,0.0
gfx950,256,664,2048,2048,ck,2,2,15.3169,a8w8_blockscale_1x128x128_256x64x128x128_16x16_32x32_1x2_8x32x1_8x32x1_1x32x1x8_8_1x1_intrawave_v3,359.77,534.42,0.0
gfx950,256,667,2048,512,ck,13,1,6.4044,a8w8_blockscale_1x128x128_256x32x64x256_16x16_16x16_2x1_16x16x1_16x16x1_1x32x1x8_8_2x1_intrawave_v1,215.48,634.98,0.0
gfx950,256,667,2048,4096,ck,2,3,25.4935,a8w8_blockscale_1x128x128_256x64x128x128_16x16_32x32_1x2_8x32x1_8x32x1_1x32x1x8_8_1x1_intrawave_v3,438.6,542.94,0.0
gfx950,256,671,2048,512,ck,13,0,6.4827,a8w8_blockscale_1x128x128_256x32x64x256_16x16_16x16_2x1_16x16x1_16x16x1_1x32x1x8_8_2x1_intrawave_v1,217.07,638.71,0.0
gfx950,256,671,2048,4096,ck,2,0,25.4312,a8w8_blockscale_1x128x128_256x64x128x128_16x16_32x32_1x2_8x32x1_8x32x1_1x32x1x8_8_1x1_intrawave_v3,442.67,546.0,0.0
gfx950,256,762,2048,2048,ck,2,3,15.4415,a8w8_blockscale_1x128x128_256x64x128x128_16x16_32x32_1x2_8x32x1_8x32x1_1x32x1x8_8_1x1_intrawave_v3,411.94,572.02,0.0
gfx950,256,773,2048,128,cktile,20,0,5.0172,a8w8_blockscale_cktile_32x128x128_1x4x1_16x16x64_intrawave_0x1x0_4,80.78,703.04,0.0
gfx950,256,773,2048,1024,ck,3,0,9.4354,a8w8_blockscale_1x128x128_256x64x64x128_16x16_32x32_1x1_8x32x1_8x32x1_1x32x1x8_8_1x1_intrawave_v3,343.62,641.72,0.0
gfx950,256,822,2048,128,cktile,5,0,5.1079,a8w8_blockscale_cktile_32x128x128_1x4x1_16x16x128_intrawave_0x1x0_2,84.37,731.08,0.0
gfx950,256,822,2048,1024,ck,3,0,9.6015,a8w8_blockscale_1x128x128_256x64x64x128_16x16_32x32_1x1_8x32x1_8x32x1_1x32x1x8_8_1x1_intrawave_v3,359.08,656.75,0.0
gfx950,256,902,2048,2048,ck,2,0,15.6949,a8w8_blockscale_1x128x128_256x64x128x128_16x16_32x32_1x2_8x32x1_8x32x1_1x32x1x8_8_1x1_intrawave_v3,482.1,620.34,0.0
gfx950,256,931,2048,512,ck,18,0,7.1875,a8w8_blockscale_1x128x128_256x64x64x256_16x16_32x32_1x1_16x16x1_16x16x1_1x32x1x8_8_1x1_intrawave_v1,271.65,742.77,0.0
gfx950,256,931,2048,4096,ck,2,0,26.1794,a8w8_blockscale_1x128x128_256x64x128x128_16x16_32x32_1x2_8x32x1_8x32x1_1x32x1x8_8_1x1_intrawave_v3,596.64,611.75,0.0
gfx950,256,961,2048,2048,ck,2,0,15.6428,a8w8_blockscale_1x128x128_256x64x128x128_16x16_32x32_1x2_8x32x1_8x32x1_1x32x1x8_8_1x1_intrawave_v3,515.35,645.58,0.0
gfx950,256,1000,2048,2048,ck,2,3,15.7529,a8w8_blockscale_1x128x128_256x64x128x128_16x16_32x32_1x2_8x32x1_8x32x1_1x32x1x8_8_1x1_intrawave_v3,527.27,649.82,0.0
gfx950,256,1001,2048,2048,ck,2,1,15.702,a8w8_blockscale_1x128x128_256x64x128x128_16x16_32x32_1x2_8x32x1_8x32x1_1x32x1x8_8_1x1_intrawave_v3,531.01,654.16,0.0
gfx950,256,1002,2048,2048,ck,2,3,15.7321,a8w8_blockscale_1x128x128_256x64x128x128_16x16_32x32_1x2_8x32x1_8x32x1_1x32x1x8_8_1x1_intrawave_v3,532.15,655.3,0.0
gfx950,256,1003,2048,2048,ck,2,0,15.693,a8w8_blockscale_1x128x128_256x64x128x128_16x16_32x32_1x2_8x32x1_8x32x1_1x32x1x8_8_1x1_intrawave_v3,533.46,656.64,0.0
gfx950,256,1015,2048,2048,ck,2,3,15.7467,a8w8_blockscale_1x128x128_256x64x128x128_16x16_32x32_1x2_8x32x1_8x32x1_1x32x1x8_8_1x1_intrawave_v3,531.34,650.91,0.0
gfx950,256,1023,2048,2048,ck,2,3,15.7171,a8w8_blockscale_1x128x128_256x64x128x128_16x16_32x32_1x2_8x32x1_8x32x1_1x32x1x8_8_1x1_intrawave_v3,536.96,655.73,0.0
gfx950,256,1024,2048,128,cktile,7,0,5.9122,a8w8_blockscale_cktile_32x128x128_1x4x1_16x16x64_intrawave_0x1x0_2,90.81,775.94,0.0
gfx950,256,1024,2048,512,ck,18,3,7.213,a8w8_blockscale_1x128x128_256x64x64x256_16x16_32x32_1x1_16x16x1_16x16x1_1x32x1x8_8_1x1_intrawave_v1,279.07,749.45,0.0
gfx950,256,1024,2048,1024,ck,2,0,9.6329,a8w8_blockscale_1x128x128_256x64x128x128_16x16_32x32_1x2_8x32x1_8x32x1_1x32x1x8_8_1x1_intrawave_v3,397.86,679.94,0.0
gfx950,256,1024,2048,2048,ck,2,3,15.5356,a8w8_blockscale_1x128x128_256x64x128x128_16x16_32x32_1x2_8x32x1_8x32x1_1x32x1x8_8_1x1_intrawave_v3,541.61,661.15,0.0
gfx950,256,1024,2048,4096,ck,2,2,25.7397,a8w8_blockscale_1x128x128_256x64x128x128_16x16_32x32_1x2_8x32x1_8x32x1_1x32x1x8_8_1x1_intrawave_v3,661.28,645.78,0.0
gfx950,256,1025,2048,128,cktile,19,0,6.5509,a8w8_blockscale_cktile_32x128x128_1x4x1_16x16x64_intrawave_0x1x0_3,82.03,700.93,0.0
gfx950,256,1025,2048,512,ck,13,0,9.0582,a8w8_blockscale_1x128x128_256x32x64x256_16x16_16x16_2x1_16x16x1_16x16x1_1x32x1x8_8_2x1_intrawave_v1,237.31,637.19,0.0
gfx950,256,1025,2048,1024,ck,3,0,12.2997,a8w8_blockscale_1x128x128_256x64x64x128_16x16_32x32_1x1_8x32x1_8x32x1_1x32x1x8_8_1x1_intrawave_v3,349.53,597.18,0.0
gfx950,256,1025,2048,2048,ck,3,0,19.1277,a8w8_blockscale_1x128x128_256x64x64x128_16x16_32x32_1x1_8x32x1_8x32x1_1x32x1x8_8_1x1_intrawave_v3,449.52,548.52,0.0
gfx950,256,1025,2048,4096,ck,0,1,32.1268,a8w8_blockscale_1x128x128_256x128x128x128_16x16_32x32_2x2_8x32x1_8x32x1_1x32x1x8_8_1x1_intrawave_v3,530.62,517.93,0.0
gfx950,256,1027,2048,128,cktile,20,0,6.5525,a8w8_blockscale_cktile_32x128x128_1x4x1_16x16x64_intrawave_0x1x0_4,82.17,702.05,0.0
gfx950,256,1027,2048,512,ck,13,0,9.026,a8w8_blockscale_1x128x128_256x32x64x256_16x16_16x16_2x1_16x16x1_16x16x1_1x32x1x8_8_2x1_intrawave_v1,238.62,640.48,0.0
gfx950,256,1027,2048,1024,ck,3,0,12.4127,a8w8_blockscale_1x128x128_256x64x64x128_16x16_32x32_1x1_8x32x1_8x32x1_1x32x1x8_8_1x1_intrawave_v3,347.03,592.57,0.0
gfx950,256,1027,2048,4096,ck,0,2,32.1561,a8w8_blockscale_1x128x128_256x128x128x128_16x16_32x32_2x2_8x32x1_8x32x1_1x32x1x8_8_1x1_intrawave_v3,532.11,518.88,0.0
gfx950,256,1031,2048,512,ck,13,3,9.0711,a8w8_blockscale_1x128x128_256x32x64x256_16x16_16x16_2x1_16x16x1_16x16x1_1x32x1x8_8_2x1_intrawave_v1,237.81,637.87,0.0
gfx950,256,1031,2048,4096,ck,0,0,32.1982,a8w8_blockscale_1x128x128_256x128x128x128_16x16_32x32_2x2_8x32x1_8x32x1_1x32x1x8_8_1x1_intrawave_v3,534.09,519.8,0.0
gfx950,256,1032,2048,2048,ck,3,3,19.0421,a8w8_blockscale_1x128x128_256x64x64x128_16x16_32x32_1x1_8x32x1_8x32x1_1x32x1x8_8_1x1_intrawave_v3,450.98,548.81,0.0
gfx950,256,1038,2048,2048,ck,3,0,19.0456,a8w8_blockscale_1x128x128_256x64x64x128_16x16_32x32_1x1_8x32x1_8x32x1_1x32x1x8_8_1x1_intrawave_v3,457.19,555.08,0.0
gfx950,256,1039,2048,512,ck,13,0,8.4493,a8w8_blockscale_1x128x128_256x32x64x256_16x16_16x16_2x1_16x16x1_16x16x1_1x32x1x8_8_2x1_intrawave_v1,257.88,690.74,0.0
gfx950,256,1039,2048,4096,ck,0,1,31.9992,a8w8_blockscale_1x128x128_256x128x128x128_16x16_32x32_2x2_8x32x1_8x32x1_1x32x1x8_8_1x1_intrawave_v3,538.08,521.68,0.0
gfx950,256,1040,2048,512,ck,13,2,8.4502,a8w8_blockscale_1x128x128_256x32x64x256_16x16_16x16_2x1_16x16x1_16x16x1_1x32x1x8_8_2x1_intrawave_v1,257.72,690.18,0.0
gfx950,256,1040,2048,4096,ck,0,0,32.0773,a8w8_blockscale_1x128x128_256x128x128x128_16x16_32x32_2x2_8x32x1_8x32x1_1x32x1x8_8_1x1_intrawave_v3,541.06,524.31,0.0
gfx950,256,1041,2048,512,ck,13,0,8.4334,a8w8_blockscale_1x128x128_256x32x64x256_16x16_16x16_2x1_16x16x1_16x16x1_1x32x1x8_8_2x1_intrawave_v1,258.87,693.14,0.0
gfx950,256,1041,2048,4096,ck,0,2,32.2402,a8w8_blockscale_1x128x128_256x128x128x128_16x16_32x32_2x2_8x32x1_8x32x1_1x32x1x8_8_1x1_intrawave_v3,538.97,522.04,0.0
gfx950,256,1042,2048,128,cktile,19,0,5.9868,a8w8_blockscale_cktile_32x128x128_1x4x1_16x16x64_intrawave_0x1x0_3,91.25,778.97,0.0
gfx950,256,1042,2048,1024,ck,3,0,12.1134,a8w8_blockscale_1x128x128_256x64x64x128_16x16_32x32_1x1_8x32x1_8x32x1_1x32x1x8_8_1x1_intrawave_v3,360.8,613.55,0.0
gfx950,256,1051,2048,128,cktile,7,0,6.0021,a8w8_blockscale_cktile_32x128x128_1x4x1_16x16x64_intrawave_0x1x0_2,91.81,783.32,0.0
gfx950,256,1051,2048,1024,ck,3,1,11.8023,a8w8_blockscale_1x128x128_256x64x64x128_16x16_32x32_1x1_8x32x1_8x32x1_1x32x1x8_8_1x1_intrawave_v3,353.51,599.71,0.0
gfx950,256,1055,2048,128,cktile,20,0,6.0149,a8w8_blockscale_cktile_32x128x128_1x4x1_16x16x64_intrawave_0x1x0_4,91.96,784.46,0.0
gfx950,256,1055,2048,1024,ck,3,2,11.9395,a8w8_blockscale_1x128x128_256x64x64x128_16x16_32x32_1x1_8x32x1_8x32x1_1x32x1x8_8_1x1_intrawave_v3,351.18,595.12,0.0
gfx950,256,1057,2048,128,cktile,7,0,6.0349,a8w8_blockscale_cktile_32x128x128_1x4x1_16x16x64_intrawave_0x1x0_2,91.83,783.26,0.0
gfx950,256,1057,2048,1024,ck,3,0,12.1875,a8w8_blockscale_1x128x128_256x64x64x128_16x16_32x32_1x1_8x32x1_8x32x1_1x32x1x8_8_1x1_intrawave_v3,351.0,594.5,0.0
gfx950,256,1069,2048,128,cktile,19,0,6.6145,a8w8_blockscale_cktile_32x128x128_1x4x1_16x16x64_intrawave_0x1x0_3,84.73,722.29,0.0
gfx950,256,1069,2048,1024,ck,3,2,12.1934,a8w8_blockscale_1x128x128_256x64x64x128_16x16_32x32_1x1_8x32x1_8x32x1_1x32x1x8_8_1x1_intrawave_v3,361.3,610.02,0.0
gfx950,256,1072,2048,128,cktile,19,0,6.6199,a8w8_blockscale_cktile_32x128x128_1x4x1_16x16x64_intrawave_0x1x0_3,84.9,723.62,0.0
gfx950,256,1072,2048,512,ck,13,0,8.5517,a8w8_blockscale_1x128x128_256x32x64x256_16x16_16x16_2x1_16x16x1_16x16x1_1x32x1x8_8_2x1_intrawave_v1,246.67,657.04,0.0
gfx950,256,1072,2048,1024,ck,3,2,11.949,a8w8_blockscale_1x128x128_256x64x64x128_16x16_32x32_1x1_8x32x1_8x32x1_1x32x1x8_8_1x1_intrawave_v3,354.33,597.81,0.0
gfx950,256,1072,2048,4096,ck,0,1,32.3737,a8w8_blockscale_1x128x128_256x128x128x128_16x16_32x32_2x2_8x32x1_8x32x1_1x32x1x8_8_1x1_intrawave_v3,553.32,528.25,0.0
gfx950,256,1073,2048,512,ck,13,2,8.5619,a8w8_blockscale_1x128x128_256x32x64x256_16x16_16x16_2x1_16x16x1_16x16x1_1x32x1x8_8_2x1_intrawave_v1,247.99,660.45,0.0
gfx950,256,1073,2048,4096,ck,0,3,32.3536,a8w8_blockscale_1x128x128_256x128x128x128_16x16_32x32_2x2_8x32x1_8x32x1_1x32x1x8_8_1x1_intrawave_v3,555.66,530.25,0.0
gfx950,256,1074,2048,128,cktile,7,0,6.6584,a8w8_blockscale_cktile_32x128x128_1x4x1_16x16x64_intrawave_0x1x0_2,84.57,720.7,0.0
gfx950,256,1074,2048,1024,ck,3,3,11.7139,a8w8_blockscale_1x128x128_256x64x64x128_16x16_32x32_1x1_8x32x1_8x32x1_1x32x1x8_8_1x1_intrawave_v3,362.86,611.88,0.0
gfx950,256,1077,2048,512,ck,13,1,8.5639,a8w8_blockscale_1x128x128_256x32x64x256_16x16_16x16_2x1_16x16x1_16x16x1_1x32x1x8_8_2x1_intrawave_v1,248.8,662.18,0.0
gfx950,256,1077,2048,4096,ck,0,3,32.4359,a8w8_blockscale_1x128x128_256x128x128x128_16x16_32x32_2x2_8x32x1_8x32x1_1x32x1x8_8_1x1_intrawave_v3,555.64,529.27,0.0
gfx950,256,1087,2048,2048,ck,3,1,19.0767,a8w8_blockscale_1x128x128_256x64x64x128_16x16_32x32_1x1_8x32x1_8x32x1_1x32x1x8_8_1x1_intrawave_v3,474.19,565.42,0.0
gfx950,256,1091,2048,128,cktile,20,0,6.6518,a8w8_blockscale_cktile_32x128x128_1x4x1_16x16x64_intrawave_0x1x0_4,85.99,732.21,0.0
gfx950,256,1091,2048,512,ck,13,0,8.6391,a8w8_blockscale_1x128x128_256x32x64x256_16x16_16x16_2x1_16x16x1_16x16x1_1x32x1x8_8_2x1_intrawave_v1,249.92,663.67,0.0
gfx950,256,1091,2048,1024,ck,3,3,11.749,a8w8_blockscale_1x128x128_256x64x64x128_16x16_32x32_1x1_8x32x1_8x32x1_1x32x1x8_8_1x1_intrawave_v3,372.72,625.79,0.0
gfx950,256,1091,2048,4096,ck,0,0,32.5009,a8w8_blockscale_1x128x128_256x128x128x128_16x16_32x32_2x2_8x32x1_8x32x1_1x32x1x8_8_1x1_intrawave_v3,563.18,533.1,0.0
gfx950,256,1128,2048,128,cktile,19,0,6.7015,a8w8_blockscale_cktile_32x128x128_1x4x1_16x16x64_intrawave_0x1x0_3,88.25,750.1,0.0
gfx950,256,1128,2048,1024,ck,3,1,12.2419,a8w8_blockscale_1x128x128_256x64x64x128_16x16_32x32_1x1_8x32x1_8x32x1_1x32x1x8_8_1x1_intrawave_v3,364.1,605.86,0.0
gfx950,256,1136,2048,128,cktile,7,0,6.7005,a8w8_blockscale_cktile_32x128x128_1x4x1_16x16x64_intrawave_0x1x0_2,88.89,755.26,0.0
gfx950,256,1136,2048,1024,ck,3,3,12.1859,a8w8_blockscale_1x128x128_256x64x64x128_16x16_32x32_1x1_8x32x1_8x32x1_1x32x1x8_8_1x1_intrawave_v3,384.23,638.15,0.0
gfx950,256,1255,2048,2048,ck,3,0,19.3756,a8w8_blockscale_1x128x128_256x64x64x128_16x16_32x32_1x1_8x32x1_8x32x1_1x32x1x8_8_1x1_intrawave_v3,534.12,604.0,0.0
gfx950,256,1343,2048,512,ck,18,0,8.8853,a8w8_blockscale_1x128x128_256x64x64x256_16x16_32x32_1x1_16x16x1_16x16x1_1x32x1x8_8_1x1_intrawave_v1,299.07,768.48,0.0
gfx950,256,1343,2048,4096,ck,0,0,32.9505,a8w8_blockscale_1x128x128_256x128x128x128_16x16_32x32_2x2_8x32x1_8x32x1_1x32x1x8_8_1x1_intrawave_v3,683.81,588.47,0.0
gfx950,256,1351,2048,2048,ck,0,3,19.9983,a8w8_blockscale_1x128x128_256x128x128x128_16x16_32x32_2x2_8x32x1_8x32x1_1x32x1x8_8_1x1_intrawave_v3,560.15,617.57,0.0
gfx950,256,1376,2048,2048,ck,0,2,20.0787,a8w8_blockscale_1x128x128_256x128x128x128_16x16_32x32_2x2_8x32x1_8x32x1_1x32x1x8_8_1x1_intrawave_v3,571.88,626.66,0.0
gfx950,256,1380,2048,2048,ck,0,2,20.2101,a8w8_blockscale_1x128x128_256x128x128x128_16x16_32x32_2x2_8x32x1_8x32x1_1x32x1x8_8_1x1_intrawave_v3,566.27,619.91,0.0
gfx950,256,1391,2048,2048,ck,0,0,20.1587,a8w8_blockscale_1x128x128_256x128x128x128_16x16_32x32_2x2_8x32x1_8x32x1_1x32x1x8_8_1x1_intrawave_v3,573.99,626.73,0.0
gfx950,256,1514,2048,128,cktile,7,0,6.9317,a8w8_blockscale_cktile_32x128x128_1x4x1_16x16x64_intrawave_0x1x0_2,114.51,960.41,0.0
gfx950,256,1514,2048,1024,ck,3,1,13.4476,a8w8_blockscale_1x128x128_256x64x64x128_16x16_32x32_1x1_8x32x1_8x32x1_1x32x1x8_8_1x1_intrawave_v3,468.64,726.83,0.0
gfx950,256,1688,2048,512,ck,2,1,9.7354,a8w8_blockscale_1x128x128_256x64x128x128_16x16_32x32_1x2_8x32x1_8x32x1_1x32x1x8_8_1x1_intrawave_v3,314.21,783.46,0.0
gfx950,256,1688,2048,4096,ck,0,0,33.739,a8w8_blockscale_1x128x128_256x128x128x128_16x16_32x32_2x2_8x32x1_8x32x1_1x32x1x8_8_1x1_intrawave_v3,835.7,655.6,0.0
gfx950,256,1710,2048,2048,ck,0,2,20.502,a8w8_blockscale_1x128x128_256x128x128x128_16x16_32x32_2x2_8x32x1_8x32x1_1x32x1x8_8_1x1_intrawave_v3,695.1,712.35,0.0
gfx950,256,1808,2048,2048,ck,0,2,20.6983,a8w8_blockscale_1x128x128_256x128x128x128_16x16_32x32_2x2_8x32x1_8x32x1_1x32x1x8_8_1x1_intrawave_v3,731.86,738.42,0.0
gfx950,256,1809,2048,2048,ck,0,0,20.725,a8w8_blockscale_1x128x128_256x128x128x128_16x16_32x32_2x2_8x32x1_8x32x1_1x32x1x8_8_1x1_intrawave_v3,732.21,738.66,0.0
gfx950,256,1870,2048,2048,ck,0,0,20.9289,a8w8_blockscale_1x128x128_256x128x128x128_16x16_32x32_2x2_8x32x1_8x32x1_1x32x1x8_8_1x1_intrawave_v3,749.52,749.37,0.0
gfx950,256,1967,2048,2048,ck,0,0,21.075,a8w8_blockscale_1x128x128_256x128x128x128_16x16_32x32_2x2_8x32x1_8x32x1_1x32x1x8_8_1x1_intrawave_v3,782.88,772.41,0.0
gfx950,256,1970,2048,2048,ck,0,0,21.0566,a8w8_blockscale_1x128x128_256x128x128x128_16x16_32x32_2x2_8x32x1_8x32x1_1x32x1x8_8_1x1_intrawave_v3,784.82,774.01,0.0
gfx950,256,2000,2048,2048,ck,0,2,21.1474,a8w8_blockscale_1x128x128_256x128x128x128_16x16_32x32_2x2_8x32x1_8x32x1_1x32x1x8_8_1x1_intrawave_v3,792.95,779.01,0.0
gfx950,256,2001,2048,2048,ck,0,0,21.0044,a8w8_blockscale_1x128x128_256x128x128x128_16x16_32x32_2x2_8x32x1_8x32x1_1x32x1x8_8_1x1_intrawave_v3,799.15,785.0,0.0
gfx950,256,2016,2048,2048,ck,0,0,21.1101,a8w8_blockscale_1x128x128_256x128x128x128_16x16_32x32_2x2_8x32x1_8x32x1_1x32x1x8_8_1x1_intrawave_v3,798.79,783.16,0.0
gfx950,256,2017,2048,128,cktile,7,0,8.095,a8w8_blockscale_cktile_32x128x128_1x4x1_16x16x64_intrawave_0x1x0_2,130.63,1084.86,0.0
gfx950,256,2017,2048,512,ck,0,3,10.0641,a8w8_blockscale_1x128x128_256x128x128x128_16x16_32x32_2x2_8x32x1_8x32x1_1x32x1x8_8_1x1_intrawave_v3,367.71,899.1,0.0
gfx950,256,2017,2048,1024,ck,0,2,14.2155,a8w8_blockscale_1x128x128_256x128x128x128_16x16_32x32_2x2_8x32x1_8x32x1_1x32x1x8_8_1x1_intrawave_v3,558.96,820.89,0.0
gfx950,256,2017,2048,2048,ck,0,2,21.1275,a8w8_blockscale_1x128x128_256x128x128x128_16x16_32x32_2x2_8x32x1_8x32x1_1x32x1x8_8_1x1_intrawave_v3,800.47,784.71,0.0
gfx950,256,2017,2048,4096,ck,0,1,35.0287,a8w8_blockscale_1x128x128_256x128x128x128_16x16_32x32_2x2_8x32x1_8x32x1_1x32x1x8_8_1x1_intrawave_v3,955.18,703.18,0.0
gfx950,256,2046,2048,2048,ck,0,2,21.0492,a8w8_blockscale_1x128x128_256x128x128x128_16x16_32x32_2x2_8x32x1_8x32x1_1x32x1x8_8_1x1_intrawave_v3,812.75,793.89,0.0
gfx950,256,2048,2048,128,cktile,20,0,8.1497,a8w8_blockscale_cktile_32x128x128_1x4x1_16x16x64_intrawave_0x1x0_4,131.75,1093.65,0.0
gfx950,256,2048,2048,512,ck,18,0,9.9115,a8w8_blockscale_1x128x128_256x64x64x256_16x16_32x32_1x1_16x16x1_16x16x1_1x32x1x8_8_1x1_intrawave_v1,378.83,924.87,0.0
gfx950,256,2048,2048,1024,ck,0,0,13.8472,a8w8_blockscale_1x128x128_256x128x128x128_16x16_32x32_2x2_8x32x1_8x32x1_1x32x1x8_8_1x1_intrawave_v3,604.72,885.81,0.0
gfx950,256,2048,2048,2048,ck,0,0,20.3196,a8w8_blockscale_1x128x128_256x128x128x128_16x16_32x32_2x2_8x32x1_8x32x1_1x32x1x8_8_1x1_intrawave_v3,845.48,825.67,0.0
gfx950,256,2048,2048,4096,ck,0,2,34.2957,a8w8_blockscale_1x128x128_256x128x128x128_16x16_32x32_2x2_8x32x1_8x32x1_1x32x1x8_8_1x1_intrawave_v3,986.58,722.59,0.0
gfx950,256,2050,2048,512,ck,18,1,12.1611,a8w8_blockscale_1x128x128_256x64x64x256_16x16_32x32_1x1_16x16x1_16x16x1_1x32x1x8_8_1x1_intrawave_v1,349.34,852.79,0.0
gfx950,256,2050,2048,2048,ck,2,2,28.2176,a8w8_blockscale_1x128x128_256x64x128x128_16x16_32x32_1x2_8x32x1_8x32x1_1x32x1x8_8_1x1_intrawave_v3,608.67,594.26,0.0
gfx950,256,2050,2048,4096,ck,2,1,48.0532,a8w8_blockscale_1x128x128_256x64x128x128_16x16_32x32_1x2_8x32x1_8x32x1_1x32x1x8_8_1x1_intrawave_v3,702.56,514.4,0.0
gfx950,256,2063,2048,512,ck,18,0,12.0491,a8w8_blockscale_1x128x128_256x64x64x256_16x16_32x32_1x1_16x16x1_16x16x1_1x32x1x8_8_1x1_intrawave_v1,358.44,874.47,0.0
gfx950,256,2063,2048,4096,ck,2,1,48.3414,a8w8_blockscale_1x128x128_256x64x128x128_16x16_32x32_1x2_8x32x1_8x32x1_1x32x1x8_8_1x1_intrawave_v3,712.98,520.93,0.0
gfx950,256,2064,2048,512,ck,18,0,12.0629,a8w8_blockscale_1x128x128_256x64x64x256_16x16_32x32_1x1_16x16x1_16x16x1_1x32x1x8_8_1x1_intrawave_v1,349.94,853.67,0.0
gfx950,256,2064,2048,4096,ck,2,0,47.9935,a8w8_blockscale_1x128x128_256x64x128x128_16x16_32x32_1x2_8x32x1_8x32x1_1x32x1x8_8_1x1_intrawave_v3,721.52,527.09,0.0
gfx950,256,2081,2048,2048,ck,2,3,28.1268,a8w8_blockscale_1x128x128_256x64x128x128_16x16_32x32_1x2_8x32x1_8x32x1_1x32x1x8_8_1x1_intrawave_v3,618.48,601.59,0.0
gfx950,256,2095,2048,2048,ck,2,3,28.0899,a8w8_blockscale_1x128x128_256x64x128x128_16x16_32x32_1x2_8x32x1_8x32x1_1x32x1x8_8_1x1_intrawave_v3,622.57,604.57,0.0
gfx950,256,2099,2048,512,ck,18,3,12.0003,a8w8_blockscale_1x128x128_256x64x64x256_16x16_32x32_1x1_16x16x1_16x16x1_1x32x1x8_8_1x1_intrawave_v1,357.11,869.74,0.0
gfx950,256,2099,2048,4096,ck,2,2,47.9764,a8w8_blockscale_1x128x128_256x64x128x128_16x16_32x32_1x2_8x32x1_8x32x1_1x32x1x8_8_1x1_intrawave_v3,720.93,523.75,0.0
gfx950,256,2151,2048,128,cktile,6,0,7.7566,a8w8_blockscale_cktile_32x128x128_1x4x1_16x16x64_intrawave_0x1x0_1,145.39,1205.16,0.0
gfx950,256,2151,2048,1024,ck,2,0,18.6449,a8w8_blockscale_1x128x128_256x64x128x128_16x16_32x32_1x2_8x32x1_8x32x1_1x32x1x8_8_1x1_intrawave_v3,481.53,699.74,0.0
gfx950,256,2154,2048,2048,ck,2,1,28.4804,a8w8_blockscale_1x128x128_256x64x128x128_16x16_32x32_1x2_8x32x1_8x32x1_1x32x1x8_8_1x1_intrawave_v3,628.97,606.67,0.0
gfx950,256,2159,2048,512,ck,18,1,12.3753,a8w8_blockscale_1x128x128_256x64x64x256_16x16_32x32_1x1_16x16x1_16x16x1_1x32x1x8_8_1x1_intrawave_v1,360.41,875.39,0.0
gfx950,256,2159,2048,2048,ck,2,1,28.4994,a8w8_blockscale_1x128x128_256x64x128x128_16x16_32x32_1x2_8x32x1_8x32x1_1x32x1x8_8_1x1_intrawave_v3,631.39,608.66,0.0
gfx950,256,2159,2048,4096,ck,2,0,49.3908,a8w8_blockscale_1x128x128_256x64x128x128_16x16_32x32_1x2_8x32x1_8x32x1_1x32x1x8_8_1x1_intrawave_v3,733.38,527.94,0.0
gfx950,256,2160,2048,512,ck,18,3,12.1291,a8w8_blockscale_1x128x128_256x64x64x256_16x16_32x32_1x1_16x16x1_16x16x1_1x32x1x8_8_1x1_intrawave_v1,358.21,869.99,0.0
gfx950,256,2160,2048,4096,ck,2,0,49.3139,a8w8_blockscale_1x128x128_256x64x128x128_16x16_32x32_1x2_8x32x1_8x32x1_1x32x1x8_8_1x1_intrawave_v3,733.49,527.94,0.0
gfx950,256,2162,2048,2048,ck,2,0,28.6029,a8w8_blockscale_1x128x128_256x64x128x128_16x16_32x32_1x2_8x32x1_8x32x1_1x32x1x8_8_1x1_intrawave_v3,634.07,611.04,0.0
gfx950,256,2165,2048,2048,ck,2,0,28.6566,a8w8_blockscale_1x128x128_256x64x128x128_16x16_32x32_1x2_8x32x1_8x32x1_1x32x1x8_8_1x1_intrawave_v3,633.76,610.54,0.0
gfx950,256,2251,2048,2048,ck,2,3,28.2934,a8w8_blockscale_1x128x128_256x64x128x128_16x16_32x32_1x2_8x32x1_8x32x1_1x32x1x8_8_1x1_intrawave_v3,662.86,632.73,0.0
gfx950,256,2252,2048,2048,ck,2,1,28.3229,a8w8_blockscale_1x128x128_256x64x128x128_16x16_32x32_1x2_8x32x1_8x32x1_1x32x1x8_8_1x1_intrawave_v3,661.25,631.13,0.0
gfx950,256,2255,2048,2048,ck,2,1,28.2279,a8w8_blockscale_1x128x128_256x64x128x128_16x16_32x32_1x2_8x32x1_8x32x1_1x32x1x8_8_1x1_intrawave_v3,662.26,631.9,0.0
gfx950,256,2313,2048,512,ck,18,2,12.4435,a8w8_blockscale_1x128x128_256x64x64x256_16x16_32x32_1x1_16x16x1_16x16x1_1x32x1x8_8_1x1_intrawave_v1,377.22,910.4,0.0
gfx950,256,2313,2048,4096,ck,2,0,49.0431,a8w8_blockscale_1x128x128_256x64x128x128_16x16_32x32_1x2_8x32x1_8x32x1_1x32x1x8_8_1x1_intrawave_v3,777.12,547.44,0.0
gfx950,256,2317,2048,2048,ck,2,3,28.3746,a8w8_blockscale_1x128x128_256x64x128x128_16x16_32x32_1x2_8x32x1_8x32x1_1x32x1x8_8_1x1_intrawave_v3,677.52,642.43,0.0
gfx950,256,2325,2048,512,ck,18,2,12.6607,a8w8_blockscale_1x128x128_256x64x64x256_16x16_32x32_1x1_16x16x1_16x16x1_1x32x1x8_8_1x1_intrawave_v1,374.51,903.43,0.0
gfx950,256,2325,2048,4096,ck,2,3,49.0158,a8w8_blockscale_1x128x128_256x64x128x128_16x16_32x32_1x2_8x32x1_8x32x1_1x32x1x8_8_1x1_intrawave_v3,783.72,551.22,0.0
gfx950,256,2332,2048,128,cktile,7,0,8.077,a8w8_blockscale_cktile_32x128x128_1x4x1_16x16x64_intrawave_0x1x0_2,151.37,1252.01,0.0
gfx950,256,2332,2048,1024,ck,2,0,18.7268,a8w8_blockscale_1x128x128_256x64x128x128_16x16_32x32_1x2_8x32x1_8x32x1_1x32x1x8_8_1x1_intrawave_v3,522.31,749.57,0.0
gfx950,256,2341,2048,128,cktile,19,0,8.2531,a8w8_blockscale_cktile_32x128x128_1x4x1_16x16x64_intrawave_0x1x0_3,148.71,1229.9,0.0
gfx950,256,2341,2048,1024,ck,2,1,18.7,a8w8_blockscale_1x128x128_256x64x128x128_16x16_32x32_1x2_8x32x1_8x32x1_1x32x1x8_8_1x1_intrawave_v3,521.73,748.3,0.0
gfx950,256,2694,2048,2048,ck,2,2,29.4215,a8w8_blockscale_1x128x128_256x64x128x128_16x16_32x32_1x2_8x32x1_8x32x1_1x32x1x8_8_1x1_intrawave_v3,757.12,695.05,0.0
gfx950,256,2715,2048,2048,ck,2,1,29.2404,a8w8_blockscale_1x128x128_256x64x128x128_16x16_32x32_1x2_8x32x1_8x32x1_1x32x1x8_8_1x1_intrawave_v3,770.89,706.58,0.0
gfx950,256,2819,2048,2048,ck,2,0,29.7059,a8w8_blockscale_1x128x128_256x64x128x128_16x16_32x32_1x2_8x32x1_8x32x1_1x32x1x8_8_1x1_intrawave_v3,779.32,709.02,0.0
gfx950,256,2853,2048,2048,ck,2,3,29.7696,a8w8_blockscale_1x128x128_256x64x128x128_16x16_32x32_1x2_8x32x1_8x32x1_1x32x1x8_8_1x1_intrawave_v3,792.83,719.63,0.0
gfx950,256,2914,2048,2048,ck,2,2,29.7288,a8w8_blockscale_1x128x128_256x64x128x128_16x16_32x32_1x2_8x32x1_8x32x1_1x32x1x8_8_1x1_intrawave_v3,792.16,716.12,0.0
gfx950,256,2974,2048,2048,ck,2,1,30.4832,a8w8_blockscale_1x128x128_256x64x128x128_16x16_32x32_1x2_8x32x1_8x32x1_1x32x1x8_8_1x1_intrawave_v3,815.97,734.82,0.0
gfx950,256,3000,2048,2048,ck,2,0,30.1633,a8w8_blockscale_1x128x128_256x64x128x128_16x16_32x32_1x2_8x32x1_8x32x1_1x32x1x8_8_1x1_intrawave_v3,834.32,750.13,0.0
gfx950,256,3001,2048,2048,ck,2,0,30.4508,a8w8_blockscale_1x128x128_256x64x128x128_16x16_32x32_1x2_8x32x1_8x32x1_1x32x1x8_8_1x1_intrawave_v3,815.47,733.13,0.0
gfx950,256,3072,2048,128,ck,16,0,9.6967,a8w8_blockscale_1x128x128_256x64x64x128_16x16_32x32_1x1_8x32x1_8x32x1_1x32x1x8_8_1x1_intrawave_v1,163.78,1346.13,0.0
gfx950,256,3072,2048,512,ck,18,1,13.7566,a8w8_blockscale_1x128x128_256x64x64x256_16x16_32x32_1x1_16x16x1_16x16x1_1x32x1x8_8_1x1_intrawave_v1,465.65,1098.95,0.0
gfx950,256,3072,2048,1024,ck,2,0,19.5893,a8w8_blockscale_1x128x128_256x64x128x128_16x16_32x32_1x2_8x32x1_8x32x1_1x32x1x8_8_1x1_intrawave_v3,657.75,909.98,0.0
gfx950,256,3072,2048,2048,ck,0,1,30.0355,a8w8_blockscale_1x128x128_256x128x128x128_16x16_32x32_2x2_8x32x1_8x32x1_1x32x1x8_8_1x1_intrawave_v3,850.42,761.28,0.0
gfx950,256,3072,2048,4096,ck,0,2,49.7954,a8w8_blockscale_1x128x128_256x128x128x128_16x16_32x32_2x2_8x32x1_8x32x1_1x32x1x8_8_1x1_intrawave_v3,1010.47,657.86,0.0
gfx950,256,3073,2048,128,cktile,6,0,11.0458,a8w8_blockscale_cktile_32x128x128_1x4x1_16x16x64_intrawave_0x1x0_1,145.86,1198.87,0.0
gfx950,256,3073,2048,512,ck,18,0,15.1144,a8w8_blockscale_1x128x128_256x64x64x256_16x16_32x32_1x1_16x16x1_16x16x1_1x32x1x8_8_1x1_intrawave_v1,426.38,1006.26,0.0
gfx950,256,3073,2048,1024,ck,0,0,21.2514,a8w8_blockscale_1x128x128_256x128x128x128_16x16_32x32_2x2_8x32x1_8x32x1_1x32x1x8_8_1x1_intrawave_v3,606.51,839.05,0.0
gfx950,256,3073,2048,2048,ck,0,1,31.0776,a8w8_blockscale_1x128x128_256x128x128x128_16x16_32x32_2x2_8x32x1_8x32x1_1x32x1x8_8_1x1_intrawave_v3,825.11,738.58,0.0
gfx950,256,3073,2048,4096,ck,0,0,52.5748,a8w8_blockscale_1x128x128_256x128x128x128_16x16_32x32_2x2_8x32x1_8x32x1_1x32x1x8_8_1x1_intrawave_v3,974.08,634.12,0.0
gfx950,256,3077,2048,2048,ck,0,0,30.8116,a8w8_blockscale_1x128x128_256x128x128x128_16x16_32x32_2x2_8x32x1_8x32x1_1x32x1x8_8_1x1_intrawave_v3,820.4,734.19,0.0
gfx950,256,3078,2048,2048,ck,0,0,31.0157,a8w8_blockscale_1x128x128_256x128x128x128_16x16_32x32_2x2_8x32x1_8x32x1_1x32x1x8_8_1x1_intrawave_v3,832.49,744.96,0.0
gfx950,256,3086,2048,2048,ck,0,0,30.93,a8w8_blockscale_1x128x128_256x128x128x128_16x16_32x32_2x2_8x32x1_8x32x1_1x32x1x8_8_1x1_intrawave_v3,824.65,737.6,0.0
gfx950,256,3089,2048,128,ck,11,1,10.8516,a8w8_blockscale_1x128x128_256x32x64x128_16x16_16x16_2x1_8x32x1_8x32x1_1x32x1x8_8_2x1_intrawave_v1,142.01,1167.07,0.0
gfx950,256,3089,2048,1024,ck,0,1,21.1816,a8w8_blockscale_1x128x128_256x128x128x128_16x16_32x32_2x2_8x32x1_8x32x1_1x32x1x8_8_1x1_intrawave_v3,609.61,842.83,0.0
gfx950,256,3089,2048,2048,ck,0,1,31.2195,a8w8_blockscale_1x128x128_256x128x128x128_16x16_32x32_2x2_8x32x1_8x32x1_1x32x1x8_8_1x1_intrawave_v3,824.55,737.39,0.0
gfx950,256,3110,2048,128,ck,16,0,10.8139,a8w8_blockscale_1x128x128_256x64x64x128_16x16_32x32_1x1_8x32x1_8x32x1_1x32x1x8_8_1x1_intrawave_v1,144.96,1191.18,0.0
gfx950,256,3110,2048,1024,ck,0,1,21.2771,a8w8_blockscale_1x128x128_256x128x128x128_16x16_32x32_2x2_8x32x1_8x32x1_1x32x1x8_8_1x1_intrawave_v3,610.42,843.28,0.0
gfx950,256,3118,2048,2048,ck,0,1,30.9092,a8w8_blockscale_1x128x128_256x128x128x128_16x16_32x32_2x2_8x32x1_8x32x1_1x32x1x8_8_1x1_intrawave_v3,835.72,746.11,0.0
gfx950,256,3137,2048,128,ck,16,0,10.8523,a8w8_blockscale_1x128x128_256x64x64x128_16x16_32x32_1x1_8x32x1_8x32x1_1x32x1x8_8_1x1_intrawave_v1,147.81,1214.45,0.0
gfx950,256,3137,2048,1024,ck,0,1,21.2723,a8w8_blockscale_1x128x128_256x128x128x128_16x16_32x32_2x2_8x32x1_8x32x1_1x32x1x8_8_1x1_intrawave_v3,616.89,851.36,0.0
gfx950,256,3138,2048,2048,ck,0,0,30.9718,a8w8_blockscale_1x128x128_256x128x128x128_16x16_32x32_2x2_8x32x1_8x32x1_1x32x1x8_8_1x1_intrawave_v3,847.42,755.7,0.0
gfx950,256,3154,2048,2048,ck,0,0,31.2312,a8w8_blockscale_1x128x128_256x128x128x128_16x16_32x32_2x2_8x32x1_8x32x1_1x32x1x8_8_1x1_intrawave_v3,847.16,754.77,0.0
gfx950,256,3182,2048,512,ck,18,2,15.311,a8w8_blockscale_1x128x128_256x64x64x256_16x16_32x32_1x1_16x16x1_16x16x1_1x32x1x8_8_1x1_intrawave_v1,435.38,1025.07,0.0
gfx950,256,3182,2048,4096,ck,0,0,53.0653,a8w8_blockscale_1x128x128_256x128x128x128_16x16_32x32_2x2_8x32x1_8x32x1_1x32x1x8_8_1x1_intrawave_v3,1006.03,649.3,0.0
gfx950,256,3183,2048,512,ck,18,3,15.3311,a8w8_blockscale_1x128x128_256x64x64x256_16x16_32x32_1x1_16x16x1_16x16x1_1x32x1x8_8_1x1_intrawave_v1,435.39,1025.07,0.0
gfx950,256,3183,2048,4096,ck,0,3,53.2538,a8w8_blockscale_1x128x128_256x128x128x128_16x16_32x32_2x2_8x32x1_8x32x1_1x32x1x8_8_1x1_intrawave_v3,991.03,639.58,0.0
gfx950,256,3289,2048,2048,ck,0,0,31.3584,a8w8_blockscale_1x128x128_256x128x128x128_16x16_32x32_2x2_8x32x1_8x32x1_1x32x1x8_8_1x1_intrawave_v3,879.48,777.85,0.0
gfx950,256,3437,2048,2048,ck,0,3,31.5449,a8w8_blockscale_1x128x128_256x128x128x128_16x16_32x32_2x2_8x32x1_8x32x1_1x32x1x8_8_1x1_intrawave_v3,910.56,799.38,0.0
gfx950,256,3613,2048,128,cktile,18,0,11.6956,a8w8_blockscale_cktile_32x128x128_1x4x1_16x16x128_intrawave_0x1x0_4,161.96,1327.29,0.0
gfx950,256,3613,2048,1024,ck,0,2,21.7806,a8w8_blockscale_1x128x128_256x128x128x128_16x16_32x32_2x2_8x32x1_8x32x1_1x32x1x8_8_1x1_intrawave_v3,693.92,943.1,0.0
gfx950,256,3617,2048,2048,ck,0,0,32.1475,a8w8_blockscale_1x128x128_256x128x128x128_16x16_32x32_2x2_8x32x1_8x32x1_1x32x1x8_8_1x1_intrawave_v3,939.6,818.07,0.0
gfx950,256,3620,2048,2048,ck,0,0,32.2357,a8w8_blockscale_1x128x128_256x128x128x128_16x16_32x32_2x2_8x32x1_8x32x1_1x32x1x8_8_1x1_intrawave_v3,942.02,820.07,0.0
gfx950,256,3669,2048,2048,ck,0,0,32.5001,a8w8_blockscale_1x128x128_256x128x128x128_16x16_32x32_2x2_8x32x1_8x32x1_1x32x1x8_8_1x1_intrawave_v3,944.88,820.81,0.0
gfx950,256,3824,2048,2048,ck,0,0,33.31,a8w8_blockscale_1x128x128_256x128x128x128_16x16_32x32_2x2_8x32x1_8x32x1_1x32x1x8_8_1x1_intrawave_v3,963.02,831.25,0.0
gfx950,256,3847,2048,512,ck,0,1,16.7925,a8w8_blockscale_1x128x128_256x128x128x128_16x16_32x32_2x2_8x32x1_8x32x1_1x32x1x8_8_1x1_intrawave_v3,478.01,1112.43,0.0
gfx950,256,3847,2048,4096,ck,0,3,58.0639,a8w8_blockscale_1x128x128_256x128x128x128_16x16_32x32_2x2_8x32x1_8x32x1_1x32x1x8_8_1x1_intrawave_v3,1092.49,675.44,0.0
gfx950,256,3858,2048,2048,ck,0,3,33.8037,a8w8_blockscale_1x128x128_256x128x128x128_16x16_32x32_2x2_8x32x1_8x32x1_1x32x1x8_8_1x1_intrawave_v3,945.59,815.12,0.0
gfx950,256,3906,2048,2048,ck,0,1,33.9088,a8w8_blockscale_1x128x128_256x128x128x128_16x16_32x32_2x2_8x32x1_8x32x1_1x32x1x8_8_1x1_intrawave_v3,963.35,828.89,0.0
gfx950,256,4000,2048,2048,ck,0,0,33.8045,a8w8_blockscale_1x128x128_256x128x128x128_16x16_32x32_2x2_8x32x1_8x32x1_1x32x1x8_8_1x1_intrawave_v3,966.43,828.64,0.0
gfx950,256,4004,2048,2048,ck,0,0,34.0069,a8w8_blockscale_1x128x128_256x128x128x128_16x16_32x32_2x2_8x32x1_8x32x1_1x32x1x8_8_1x1_intrawave_v3,975.67,836.44,0.0
gfx950,256,4096,2048,128,cktile,19,0,11.7547,a8w8_blockscale_cktile_32x128x128_1x4x1_16x16x64_intrawave_0x1x0_3,182.69,1494.18,0.0
gfx950,256,4096,2048,512,ck,18,1,16.8942,a8w8_blockscale_1x128x128_256x64x64x256_16x16_32x32_1x1_16x16x1_16x16x1_1x32x1x8_8_1x1_intrawave_v1,504.36,1169.78,0.0
gfx950,256,4096,2048,1024,ck,0,0,22.3904,a8w8_blockscale_1x128x128_256x128x128x128_16x16_32x32_2x2_8x32x1_8x32x1_1x32x1x8_8_1x1_intrawave_v3,761.4,1022.38,0.0
gfx950,256,4096,2048,4096,ck,0,0,57.8087,a8w8_blockscale_1x128x128_256x128x128x128_16x16_32x32_2x2_8x32x1_8x32x1_1x32x1x8_8_1x1_intrawave_v3,1188.74,725.55,0.0
gfx950,256,4097,2048,128,cktile,6,0,13.3623,a8w8_blockscale_cktile_32x128x128_1x4x1_16x16x64_intrawave_0x1x0_1,160.75,1314.73,0.0
gfx950,256,4097,2048,1024,cktile,32,0,27.6884,a8w8_blockscale_cktile_192x256x128_4x2x1_16x16x128_intrawave_0x1x0_4_aqrm,620.62,833.34,0.0
gfx950,256,4100,2048,2048,cktile,30,0,40.4228,a8w8_blockscale_cktile_192x256x128_4x2x1_16x16x128_intrawave_0x1x0_2_aqrm,850.84,726.93,0.0
gfx950,256,4108,2048,2048,cktile,12,0,40.3927,a8w8_blockscale_cktile_192x256x128_4x2x1_16x16x128_intrawave_0x1x0_1_aqrm,853.13,728.69,0.0
gfx950,256,4109,2048,128,cktile,6,0,12.3746,a8w8_blockscale_cktile_32x128x128_1x4x1_16x16x64_intrawave_0x1x0_1,174.09,1423.77,0.0
gfx950,256,4109,2048,1024,cktile,32,0,27.8134,a8w8_blockscale_cktile_192x256x128_4x2x1_16x16x128_intrawave_0x1x0_4_aqrm,619.64,831.8,0.0
gfx950,256,4111,2048,512,ck,18,0,18.2978,a8w8_blockscale_1x128x128_256x64x64x256_16x16_32x32_1x1_16x16x1_16x16x1_1x32x1x8_8_1x1_intrawave_v1,471.17,1092.59,0.0
gfx950,256,4111,2048,4096,cktile,28,0,63.0877,a8w8_blockscale_cktile_192x256x128_4x2x1_16x16x128_intrawave_0x1x0_3,1093.26,666.78,0.0
gfx950,256,4121,2048,2048,cktile,31,0,40.8112,a8w8_blockscale_cktile_192x256x128_4x2x1_16x16x128_intrawave_0x1x0_3_aqrm,847.06,723.18,0.0
gfx950,256,4123,2048,2048,cktile,32,0,40.7406,a8w8_blockscale_cktile_192x256x128_4x2x1_16x16x128_intrawave_0x1x0_4_aqrm,848.94,724.73,0.0
gfx950,256,4141,2048,512,ck,18,1,18.2114,a8w8_blockscale_1x128x128_256x64x64x256_16x16_32x32_1x1_16x16x1_16x16x1_1x32x1x8_8_1x1_intrawave_v1,470.01,1089.48,0.0
gfx950,256,4141,2048,4096,cktile,29,0,63.231,a8w8_blockscale_cktile_192x256x128_4x2x1_16x16x128_intrawave_0x1x0_4,1098.74,669.16,0.0
gfx950,256,4142,2048,512,ck,18,0,18.2896,a8w8_blockscale_1x128x128_256x64x64x256_16x16_32x32_1x1_16x16x1_16x16x1_1x32x1x8_8_1x1_intrawave_v1,474.94,1100.89,0.0
gfx950,256,4142,2048,4096,cktile,28,0,62.7276,a8w8_blockscale_cktile_192x256x128_4x2x1_16x16x128_intrawave_0x1x0_3,1107.83,674.66,0.0
gfx950,256,4143,2048,128,cktile,19,0,12.3924,a8w8_blockscale_cktile_32x128x128_1x4x1_16x16x64_intrawave_0x1x0_3,175.28,1433.31,0.0
gfx950,256,4143,2048,1024,cktile,31,0,27.7405,a8w8_blockscale_cktile_192x256x128_4x2x1_16x16x128_intrawave_0x1x0_3_aqrm,626.41,840.26,0.0
gfx950,256,4149,2048,2048,cktile,12,0,40.8268,a8w8_blockscale_cktile_192x256x128_4x2x1_16x16x128_intrawave_0x1x0_1_aqrm,852.49,727.11,0.0
gfx950,256,4204,2048,2048,cktile,32,0,40.4626,a8w8_blockscale_cktile_192x256x128_4x2x1_16x16x128_intrawave_0x1x0_4_aqrm,871.56,742.01,0.0
gfx950,256,4223,2048,2048,cktile,31,0,40.7229,a8w8_blockscale_cktile_192x256x128_4x2x1_16x16x128_intrawave_0x1x0_3_aqrm,869.91,740.13,0.0
gfx950,256,4229,2048,2048,cktile,30,0,40.8754,a8w8_blockscale_cktile_192x256x128_4x2x1_16x16x128_intrawave_0x1x0_2_aqrm,867.89,738.27,0.0
gfx950,256,4345,2048,128,cktile,7,0,12.4699,a8w8_blockscale_cktile_32x128x128_1x4x1_16x16x64_intrawave_0x1x0_2,182.68,1492.83,0.0
gfx950,256,4345,2048,512,ck,18,0,18.6703,a8w8_blockscale_1x128x128_256x64x64x256_16x16_32x32_1x1_16x16x1_16x16x1_1x32x1x8_8_1x1_intrawave_v1,488.05,1128.55,0.0
gfx950,256,4345,2048,1024,cktile,12,0,27.8581,a8w8_blockscale_cktile_192x256x128_4x2x1_16x16x128_intrawave_0x1x0_1_aqrm,654.18,873.84,0.0
gfx950,256,4345,2048,4096,cktile,27,0,63.4296,a8w8_blockscale_cktile_192x256x128_4x2x1_16x16x128_intrawave_0x1x0_2,1149.26,693.41,0.0
gfx950,256,4379,2048,2048,cktile,12,0,41.0491,a8w8_blockscale_cktile_192x256x128_4x2x1_16x16x128_intrawave_0x1x0_1_aqrm,894.87,757.6,0.0
gfx950,256,4410,2048,2048,cktile,31,0,41.0784,a8w8_blockscale_cktile_192x256x128_4x2x1_16x16x128_intrawave_0x1x0_3_aqrm,900.56,761.7,0.0
gfx950,256,4413,2048,128,cktile,20,0,12.436,a8w8_blockscale_cktile_32x128x128_1x4x1_16x16x64_intrawave_0x1x0_4,186.05,1519.99,0.0
gfx950,256,4413,2048,1024,cktile,30,0,27.9554,a8w8_blockscale_cktile_192x256x128_4x2x1_16x16x128_intrawave_0x1x0_2_aqrm,662.11,883.25,0.0
gfx950,256,4498,2048,2048,cktile,12,0,41.1004,a8w8_blockscale_cktile_192x256x128_4x2x1_16x16x128_intrawave_0x1x0_1_aqrm,918.04,774.45,0.0
gfx950,256,4585,2048,2048,cktile,30,0,41.0611,a8w8_blockscale_cktile_192x256x128_4x2x1_16x16x128_intrawave_0x1x0_2_aqrm,936.7,788.2,0.0
gfx950,256,4586,2048,2048,cktile,30,0,41.2397,a8w8_blockscale_cktile_192x256x128_4x2x1_16x16x128_intrawave_0x1x0_2_aqrm,932.84,784.94,0.0
gfx950,256,4723,2048,2048,cktile,31,0,41.3198,a8w8_blockscale_cktile_192x256x128_4x2x1_16x16x128_intrawave_0x1x0_3_aqrm,958.85,803.79,0.0
gfx950,256,4743,2048,2048,cktile,31,0,41.0951,a8w8_blockscale_cktile_192x256x128_4x2x1_16x16x128_intrawave_0x1x0_3_aqrm,968.17,811.17,0.0
gfx950,256,4822,2048,2048,cktile,12,0,41.5811,a8w8_blockscale_cktile_192x256x128_4x2x1_16x16x128_intrawave_0x1x0_1_aqrm,972.79,813.37,0.0
gfx950,256,4898,2048,2048,cktile,31,0,41.2913,a8w8_blockscale_cktile_192x256x128_4x2x1_16x16x128_intrawave_0x1x0_3_aqrm,995.06,830.38,0.0
gfx950,256,4936,2048,2048,cktile,30,0,41.2952,a8w8_blockscale_cktile_192x256x128_4x2x1_16x16x128_intrawave_0x1x0_2_aqrm,1002.69,835.96,0.0
gfx950,256,4992,2048,2048,cktile,30,0,41.2677,a8w8_blockscale_cktile_192x256x128_4x2x1_16x16x128_intrawave_0x1x0_2_aqrm,1014.74,844.85,0.0
gfx950,256,5000,2048,2048,cktile,32,0,41.3952,a8w8_blockscale_cktile_192x256x128_4x2x1_16x16x128_intrawave_0x1x0_4_aqrm,1013.23,843.44,0.0
gfx950,256,5001,2048,2048,cktile,12,0,41.3882,a8w8_blockscale_cktile_192x256x128_4x2x1_16x16x128_intrawave_0x1x0_1_aqrm,1013.61,843.73,0.0
gfx950,256,5002,2048,2048,cktile,31,0,41.5791,a8w8_blockscale_cktile_192x256x128_4x2x1_16x16x128_intrawave_0x1x0_3_aqrm,1009.16,840.0,0.0
gfx950,256,5003,2048,2048,cktile,30,0,41.4506,a8w8_blockscale_cktile_192x256x128_4x2x1_16x16x128_intrawave_0x1x0_2_aqrm,1012.49,842.76,0.0
gfx950,256,5004,2048,2048,cktile,30,0,41.3002,a8w8_blockscale_cktile_192x256x128_4x2x1_16x16x128_intrawave_0x1x0_2_aqrm,1016.38,845.97,0.0
gfx950,256,5005,2048,2048,cktile,32,0,41.338,a8w8_blockscale_cktile_192x256x128_4x2x1_16x16x128_intrawave_0x1x0_4_aqrm,1015.65,845.35,0.0
gfx950,256,5006,2048,2048,cktile,32,0,41.5607,a8w8_blockscale_cktile_192x256x128_4x2x1_16x16x128_intrawave_0x1x0_4_aqrm,1010.41,840.97,0.0
gfx950,256,5010,2048,2048,cktile,32,0,41.4776,a8w8_blockscale_cktile_192x256x128_4x2x1_16x16x128_intrawave_0x1x0_4_aqrm,1013.24,843.24,0.0
gfx950,256,5011,2048,2048,cktile,12,0,41.4139,a8w8_blockscale_cktile_192x256x128_4x2x1_16x16x128_intrawave_0x1x0_1_aqrm,1015.0,844.69,0.0
gfx950,256,5012,2048,2048,cktile,30,0,41.297,a8w8_blockscale_cktile_192x256x128_4x2x1_16x16x128_intrawave_0x1x0_2_aqrm,1018.08,847.23,0.0
gfx950,256,5026,2048,2048,cktile,12,0,41.343,a8w8_blockscale_cktile_192x256x128_4x2x1_16x16x128_intrawave_0x1x0_1_aqrm,1019.79,848.37,0.0
gfx950,256,5028,2048,2048,cktile,12,0,41.4594,a8w8_blockscale_cktile_192x256x128_4x2x1_16x16x128_intrawave_0x1x0_1_aqrm,1017.33,846.28,0.0
gfx950,256,5030,2048,2048,cktile,12,0,41.4901,a8w8_blockscale_cktile_192x256x128_4x2x1_16x16x128_intrawave_0x1x0_1_aqrm,1016.98,845.95,0.0
gfx950,256,5031,2048,2048,cktile,32,0,41.681,a8w8_blockscale_cktile_192x256x128_4x2x1_16x16x128_intrawave_0x1x0_4_aqrm,1012.53,842.22,0.0
gfx950,256,5060,2048,2048,cktile,32,0,41.4731,a8w8_blockscale_cktile_192x256x128_4x2x1_16x16x128_intrawave_0x1x0_4_aqrm,1023.47,850.74,0.0
gfx950,256,5062,2048,2048,cktile,31,0,41.6604,a8w8_blockscale_cktile_192x256x128_4x2x1_16x16x128_intrawave_0x1x0_3_aqrm,1019.27,847.21,0.0
gfx950,256,5063,2048,2048,cktile,12,0,41.678,a8w8_blockscale_cktile_192x256x128_4x2x1_16x16x128_intrawave_0x1x0_1_aqrm,1019.04,847.0,0.0
gfx950,256,5091,2048,2048,cktile,12,0,41.546,a8w8_blockscale_cktile_192x256x128_4x2x1_16x16x128_intrawave_0x1x0_1_aqrm,1027.93,853.83,0.0
gfx950,256,5105,2048,512,ck,18,2,20.5441,a8w8_blockscale_1x128x128_256x64x64x256_16x16_32x32_1x1_16x16x1_16x16x1_1x32x1x8_8_1x1_intrawave_v1,520.66,1195.02,0.0
gfx950,256,5105,2048,2048,cktile,31,0,41.6271,a8w8_blockscale_cktile_192x256x128_4x2x1_16x16x128_intrawave_0x1x0_3_aqrm,1028.75,854.24,0.0
gfx950,256,5105,2048,4096,cktile,27,0,64.9911,a8w8_blockscale_cktile_192x256x128_4x2x1_16x16x128_intrawave_0x1x0_2,1317.84,772.55,0.0
gfx950,256,5120,2048,2048,cktile,32,0,41.4707,a8w8_blockscale_cktile_192x256x128_4x2x1_16x16x128_intrawave_0x1x0_4_aqrm,1035.66,859.68,0.0
gfx950,256,5121,2048,128,cktile,6,0,14.1319,a8w8_blockscale_cktile_32x128x128_1x4x1_16x16x64_intrawave_0x1x0_1,189.99,1549.21,0.0
gfx950,256,5121,2048,512,cktile,31,0,21.4942,a8w8_blockscale_cktile_192x256x128_4x2x1_16x16x128_intrawave_0x1x0_3_aqrm,499.65,1146.64,0.0
gfx950,256,5121,2048,1024,cktile,12,0,28.263,a8w8_blockscale_cktile_192x256x128_4x2x1_16x16x128_intrawave_0x1x0_1_aqrm,759.97,1001.9,0.0
gfx950,256,5121,2048,4096,cktile,29,0,64.7812,a8w8_blockscale_cktile_192x256x128_4x2x1_16x16x128_intrawave_0x1x0_4,1326.25,777.07,0.0
gfx950,256,5122,2048,2048,cktile,32,0,41.8419,a8w8_blockscale_cktile_192x256x128_4x2x1_16x16x128_intrawave_0x1x0_4_aqrm,1026.88,852.35,0.0
gfx950,256,5123,2048,128,cktile,6,0,14.1041,a8w8_blockscale_cktile_32x128x128_1x4x1_16x16x64_intrawave_0x1x0_1,190.44,1552.86,0.0
gfx950,256,5123,2048,512,ck,18,0,21.5125,a8w8_blockscale_1x128x128_256x64x64x256_16x16_32x32_1x1_16x16x1_16x16x1_1x32x1x8_8_1x1_intrawave_v1,499.42,1146.09,0.0
gfx950,256,5123,2048,1024,cktile,32,0,28.3265,a8w8_blockscale_cktile_192x256x128_4x2x1_16x16x128_intrawave_0x1x0_4_aqrm,758.56,1000.01,0.0
gfx950,256,5123,2048,2048,cktile,12,0,41.7514,a8w8_blockscale_cktile_192x256x128_4x2x1_16x16x128_intrawave_0x1x0_1_aqrm,1029.3,854.34,0.0
gfx950,256,5123,2048,4096,cktile,11,0,64.9965,a8w8_blockscale_cktile_192x256x128_4x2x1_16x16x128_intrawave_0x1x0_1,1322.37,774.75,0.0
gfx950,256,5124,2048,2048,cktile,32,0,41.5431,a8w8_blockscale_cktile_192x256x128_4x2x1_16x16x128_intrawave_0x1x0_4_aqrm,1034.67,858.77,0.0
gfx950,256,5127,2048,2048,cktile,30,0,41.7002,a8w8_blockscale_cktile_192x256x128_4x2x1_16x16x128_intrawave_0x1x0_2_aqrm,1031.37,855.98,0.0
gfx950,256,5131,2048,512,cktile,31,0,21.6066,a8w8_blockscale_cktile_192x256x128_4x2x1_16x16x128_intrawave_0x1x0_3_aqrm,498.02,1142.81,0.0
gfx950,256,5131,2048,4096,cktile,28,0,65.0199,a8w8_blockscale_cktile_192x256x128_4x2x1_16x16x128_intrawave_0x1x0_3,1323.96,775.48,0.0
gfx950,256,5133,2048,128,cktile,19,0,14.1456,a8w8_blockscale_cktile_32x128x128_1x4x1_16x16x64_intrawave_0x1x0_3,190.25,1551.29,0.0
gfx950,256,5133,2048,1024,cktile,32,0,28.3507,a8w8_blockscale_cktile_192x256x128_4x2x1_16x16x128_intrawave_0x1x0_4_aqrm,759.39,1000.97,0.0
gfx950,256,5177,2048,2048,cktile,31,0,41.7121,a8w8_blockscale_cktile_192x256x128_4x2x1_16x16x128_intrawave_0x1x0_3_aqrm,1041.13,863.1,0.0
gfx950,256,5183,2048,2048,cktile,32,0,41.9392,a8w8_blockscale_cktile_192x256x128_4x2x1_16x16x128_intrawave_0x1x0_4_aqrm,1036.69,859.31,0.0
gfx950,256,5185,2048,128,cktile,6,0,14.2102,a8w8_blockscale_cktile_32x128x128_1x4x1_16x16x64_intrawave_0x1x0_1,191.3,1559.7,0.0
gfx950,256,5185,2048,1024,cktile,32,0,28.5102,a8w8_blockscale_cktile_192x256x128_4x2x1_16x16x128_intrawave_0x1x0_4_aqrm,762.8,1004.71,0.0
gfx950,256,5191,2048,128,cktile,6,0,14.2177,a8w8_blockscale_cktile_32x128x128_1x4x1_16x16x64_intrawave_0x1x0_1,191.42,1560.66,0.0
gfx950,256,5191,2048,1024,cktile,30,0,28.3644,a8w8_blockscale_cktile_192x256x128_4x2x1_16x16x128_intrawave_0x1x0_2_aqrm,767.6,1010.95,0.0
gfx950,256,5252,2048,2048,cktile,30,0,41.8102,a8w8_blockscale_cktile_192x256x128_4x2x1_16x16x128_intrawave_0x1x0_2_aqrm,1053.74,872.1,0.0
gfx950,256,5255,2048,2048,cktile,30,0,41.919,a8w8_blockscale_cktile_192x256x128_4x2x1_16x16x128_intrawave_0x1x0_2_aqrm,1051.6,870.27,0.0
gfx950,256,5361,2048,2048,cktile,32,0,42.2357,a8w8_blockscale_cktile_192x256x128_4x2x1_16x16x128_intrawave_0x1x0_4_aqrm,1064.77,879.17,0.0
gfx950,256,5427,2048,512,cktile,12,0,21.7285,a8w8_blockscale_cktile_192x256x128_4x2x1_16x16x128_intrawave_0x1x0_1_aqrm,523.79,1199.17,0.0
gfx950,256,5427,2048,2048,cktile,32,0,42.1019,a8w8_blockscale_cktile_192x256x128_4x2x1_16x16x128_intrawave_0x1x0_4_aqrm,1081.3,891.59,0.0
gfx950,256,5427,2048,4096,cktile,27,0,65.7702,a8w8_blockscale_cktile_192x256x128_4x2x1_16x16x128_intrawave_0x1x0_2,1384.36,803.5,0.0
gfx950,256,5471,2048,2048,cktile,32,0,42.1194,a8w8_blockscale_cktile_192x256x128_4x2x1_16x16x128_intrawave_0x1x0_4_aqrm,1089.62,897.64,0.0
gfx950,256,5534,2048,2048,cktile,12,0,42.5643,a8w8_blockscale_cktile_192x256x128_4x2x1_16x16x128_intrawave_0x1x0_1_aqrm,1090.65,897.35,0.0
gfx950,256,5564,2048,2048,cktile,31,0,42.0213,a8w8_blockscale_cktile_192x256x128_4x2x1_16x16x128_intrawave_0x1x0_3_aqrm,1110.73,913.33,0.0
gfx950,256,5671,2048,2048,cktile,32,0,42.6531,a8w8_blockscale_cktile_192x256x128_4x2x1_16x16x128_intrawave_0x1x0_4_aqrm,1115.32,915.22,0.0
gfx950,256,5927,2048,2048,cktile,31,0,42.7718,a8w8_blockscale_cktile_192x256x128_4x2x1_16x16x128_intrawave_0x1x0_3_aqrm,1162.43,949.45,0.0
gfx950,256,5954,2048,2048,cktile,31,0,43.1642,a8w8_blockscale_cktile_192x256x128_4x2x1_16x16x128_intrawave_0x1x0_3_aqrm,1157.11,944.66,0.0
gfx950,256,6000,2048,2048,cktile,30,0,42.667,a8w8_blockscale_cktile_192x256x128_4x2x1_16x16x128_intrawave_0x1x0_2_aqrm,1179.64,962.3,0.0
gfx950,256,6002,2048,2048,cktile,31,0,43.0398,a8w8_blockscale_cktile_192x256x128_4x2x1_16x16x128_intrawave_0x1x0_3_aqrm,1169.81,954.25,0.0
gfx950,256,6113,2048,512,cktile,31,0,22.1192,a8w8_blockscale_cktile_192x256x128_4x2x1_16x16x128_intrawave_0x1x0_3_aqrm,579.58,1320.9,0.0
gfx950,256,6113,2048,4096,cktile,28,0,67.346,a8w8_blockscale_cktile_192x256x128_4x2x1_16x16x128_intrawave_0x1x0_3,1522.87,868.15,0.0
gfx950,256,6146,2048,128,cktile,7,0,16.2004,a8w8_blockscale_cktile_32x128x128_1x4x1_16x16x64_intrawave_0x1x0_2,198.9,1618.65,0.0
gfx950,256,6146,2048,1024,ck,0,0,37.6647,a8w8_blockscale_1x128x128_256x128x128x128_16x16_32x32_2x2_8x32x1_8x32x1_1x32x1x8_8_1x1_intrawave_v3,684.41,891.14,0.0
gfx950,256,6146,2048,2048,ck,0,2,57.9479,a8w8_blockscale_1x128x128_256x128x128x128_16x16_32x32_2x2_8x32x1_8x32x1_1x32x1x8_8_1x1_intrawave_v3,883.78,719.2,0.0
gfx950,256,6147,2048,128,cktile,7,0,16.122,a8w8_blockscale_cktile_32x128x128_1x4x1_16x16x64_intrawave_0x1x0_2,199.9,1626.79,0.0
gfx950,256,6147,2048,1024,ck,0,0,37.5356,a8w8_blockscale_1x128x128_256x128x128x128_16x16_32x32_2x2_8x32x1_8x32x1_1x32x1x8_8_1x1_intrawave_v3,680.95,886.63,0.0
gfx950,256,6155,2048,128,cktile,19,0,16.1092,a8w8_blockscale_cktile_32x128x128_1x4x1_16x16x64_intrawave_0x1x0_3,200.32,1630.18,0.0
gfx950,256,6155,2048,1024,ck,0,3,37.652,a8w8_blockscale_1x128x128_256x128x128x128_16x16_32x32_2x2_8x32x1_8x32x1_1x32x1x8_8_1x1_intrawave_v3,680.88,886.47,0.0
gfx950,256,6194,2048,2048,ck,0,3,57.5057,a8w8_blockscale_1x128x128_256x128x128x128_16x16_32x32_2x2_8x32x1_8x32x1_1x32x1x8_8_1x1_intrawave_v3,896.35,728.86,0.0
gfx950,256,6197,2048,512,ck,18,1,24.6292,a8w8_blockscale_1x128x128_256x64x64x256_16x16_32x32_1x1_16x16x1_16x16x1_1x32x1x8_8_1x1_intrawave_v1,522.99,1191.35,0.0
gfx950,256,6197,2048,4096,ck,0,3,98.515,a8w8_blockscale_1x128x128_256x128x128x128_16x16_32x32_2x2_8x32x1_8x32x1_1x32x1x8_8_1x1_intrawave_v3,1039.32,591.34,0.0
gfx950,256,6227,2048,2048,ck,0,2,57.5789,a8w8_blockscale_1x128x128_256x128x128x128_16x16_32x32_2x2_8x32x1_8x32x1_1x32x1x8_8_1x1_intrawave_v3,898.49,730.22,0.0
gfx950,256,6229,2048,2048,ck,0,2,57.6891,a8w8_blockscale_1x128x128_256x128x128x128_16x16_32x32_2x2_8x32x1_8x32x1_1x32x1x8_8_1x1_intrawave_v3,902.23,733.24,0.0
gfx950,256,6234,2048,2048,ck,0,0,57.8547,a8w8_blockscale_1x128x128_256x128x128x128_16x16_32x32_2x2_8x32x1_8x32x1_1x32x1x8_8_1x1_intrawave_v3,898.32,730.0,0.0
gfx950,256,6246,2048,2048,ck,0,0,57.5841,a8w8_blockscale_1x128x128_256x128x128x128_16x16_32x32_2x2_8x32x1_8x32x1_1x32x1x8_8_1x1_intrawave_v3,907.01,736.92,0.0
gfx950,256,6304,2048,2048,ck,0,3,57.8247,a8w8_blockscale_1x128x128_256x128x128x128_16x16_32x32_2x2_8x32x1_8x32x1_1x32x1x8_8_1x1_intrawave_v3,912.2,740.46,0.0
gfx950,256,6314,2048,2048,ck,0,0,57.4326,a8w8_blockscale_1x128x128_256x128x128x128_16x16_32x32_2x2_8x32x1_8x32x1_1x32x1x8_8_1x1_intrawave_v3,922.22,748.49,0.0
gfx950,256,6318,2048,2048,ck,0,0,57.8375,a8w8_blockscale_1x128x128_256x128x128x128_16x16_32x32_2x2_8x32x1_8x32x1_1x32x1x8_8_1x1_intrawave_v3,916.35,743.67,0.0
gfx950,256,6341,2048,2048,ck,0,1,57.9778,a8w8_blockscale_1x128x128_256x128x128x128_16x16_32x32_2x2_8x32x1_8x32x1_1x32x1x8_8_1x1_intrawave_v3,915.45,742.68,0.0
gfx950,256,6377,2048,128,cktile,6,0,16.3224,a8w8_blockscale_cktile_32x128x128_1x4x1_16x16x64_intrawave_0x1x0_1,204.83,1666.34,0.0
gfx950,256,6377,2048,1024,ck,0,0,37.7977,a8w8_blockscale_1x128x128_256x128x128x128_16x16_32x32_2x2_8x32x1_8x32x1_1x32x1x8_8_1x1_intrawave_v3,701.85,911.78,0.0
gfx950,256,6377,2048,2048,ck,0,2,57.7391,a8w8_blockscale_1x128x128_256x128x128x128_16x16_32x32_2x2_8x32x1_8x32x1_1x32x1x8_8_1x1_intrawave_v3,913.61,740.78,0.0
gfx950,256,6401,2048,128,cktile,19,0,16.3306,a8w8_blockscale_cktile_32x128x128_1x4x1_16x16x64_intrawave_0x1x0_3,205.5,1671.71,0.0
gfx950,256,6401,2048,1024,ck,0,0,37.6288,a8w8_blockscale_1x128x128_256x128x128x128_16x16_32x32_2x2_8x32x1_8x32x1_1x32x1x8_8_1x1_intrawave_v3,709.9,922.03,0.0
gfx950,256,6409,2048,512,ck,18,2,24.9786,a8w8_blockscale_1x128x128_256x64x64x256_16x16_32x32_1x1_16x16x1_16x16x1_1x32x1x8_8_1x1_intrawave_v1,534.23,1215.53,0.0
gfx950,256,6409,2048,4096,ck,0,3,99.9658,a8w8_blockscale_1x128x128_256x128x128x128_16x16_32x32_2x2_8x32x1_8x32x1_1x32x1x8_8_1x1_intrawave_v3,1071.89,607.01,0.0
gfx950,256,6476,2048,2048,ck,0,0,57.8603,a8w8_blockscale_1x128x128_256x128x128x128_16x16_32x32_2x2_8x32x1_8x32x1_1x32x1x8_8_1x1_intrawave_v3,938.89,760.16,0.0
gfx950,256,6483,2048,2048,ck,0,0,57.4079,a8w8_blockscale_1x128x128_256x128x128x128_16x16_32x32_2x2_8x32x1_8x32x1_1x32x1x8_8_1x1_intrawave_v3,947.31,766.9,0.0
gfx950,256,6492,2048,2048,ck,0,0,57.8363,a8w8_blockscale_1x128x128_256x128x128x128_16x16_32x32_2x2_8x32x1_8x32x1_1x32x1x8_8_1x1_intrawave_v3,941.6,762.17,0.0
gfx950,256,6519,2048,2048,ck,0,0,57.7731,a8w8_blockscale_1x128x128_256x128x128x128_16x16_32x32_2x2_8x32x1_8x32x1_1x32x1x8_8_1x1_intrawave_v3,938.97,759.74,0.0
gfx950,256,6609,2048,2048,ck,0,0,58.2654,a8w8_blockscale_1x128x128_256x128x128x128_16x16_32x32_2x2_8x32x1_8x32x1_1x32x1x8_8_1x1_intrawave_v3,951.51,768.9,0.0
gfx950,256,6811,2048,2048,ck,0,0,58.9207,a8w8_blockscale_1x128x128_256x128x128x128_16x16_32x32_2x2_8x32x1_8x32x1_1x32x1x8_8_1x1_intrawave_v3,966.87,779.14,0.0
gfx950,256,6813,2048,2048,ck,0,0,58.8507,a8w8_blockscale_1x128x128_256x128x128x128_16x16_32x32_2x2_8x32x1_8x32x1_1x32x1x8_8_1x1_intrawave_v3,965.95,778.37,0.0
gfx950,256,6818,2048,2048,ck,0,0,58.8783,a8w8_blockscale_1x128x128_256x128x128x128_16x16_32x32_2x2_8x32x1_8x32x1_1x32x1x8_8_1x1_intrawave_v3,971.39,782.7,0.0
gfx950,256,6830,2048,2048,ck,0,0,58.8395,a8w8_blockscale_1x128x128_256x128x128x128_16x16_32x32_2x2_8x32x1_8x32x1_1x32x1x8_8_1x1_intrawave_v3,962.63,775.52,0.0
gfx950,256,7001,2048,2048,ck,0,1,58.6611,a8w8_blockscale_1x128x128_256x128x128x128_16x16_32x32_2x2_8x32x1_8x32x1_1x32x1x8_8_1x1_intrawave_v3,986.27,792.8,0.0
gfx950,256,7025,2048,2048,ck,0,0,59.2887,a8w8_blockscale_1x128x128_256x128x128x128_16x16_32x32_2x2_8x32x1_8x32x1_1x32x1x8_8_1x1_intrawave_v3,993.95,798.73,0.0
gfx950,256,7121,2048,128,cktile,20,0,17.6662,a8w8_blockscale_cktile_32x128x128_1x4x1_16x16x64_intrawave_0x1x0_4,211.33,1717.47,0.0
gfx950,256,7121,2048,512,ck,18,0,26.9001,a8w8_blockscale_1x128x128_256x64x64x256_16x16_32x32_1x1_16x16x1_16x16x1_1x32x1x8_8_1x1_intrawave_v1,555.16,1258.81,0.0
gfx950,256,7121,2048,1024,ck,0,2,38.4591,a8w8_blockscale_1x128x128_256x128x128x128_16x16_32x32_2x2_8x32x1_8x32x1_1x32x1x8_8_1x1_intrawave_v3,772.69,997.48,0.0
gfx950,256,7121,2048,2048,ck,0,3,59.7583,a8w8_blockscale_1x128x128_256x128x128x128_16x16_32x32_2x2_8x32x1_8x32x1_1x32x1x8_8_1x1_intrawave_v3,993.6,797.5,0.0
gfx950,256,7121,2048,4096,ck,0,3,102.261,a8w8_blockscale_1x128x128_256x128x128x128_16x16_32x32_2x2_8x32x1_8x32x1_1x32x1x8_8_1x1_intrawave_v3,1147.38,640.81,0.0
gfx950,256,7168,2048,512,ck,18,2,26.489,a8w8_blockscale_1x128x128_256x64x64x256_16x16_32x32_1x1_16x16x1_16x16x1_1x32x1x8_8_1x1_intrawave_v1,566.64,1284.59,0.0
gfx950,256,7168,2048,4096,ck,0,2,100.583,a8w8_blockscale_1x128x128_256x128x128x128_16x16_32x32_2x2_8x32x1_8x32x1_1x32x1x8_8_1x1_intrawave_v3,1187.45,662.64,0.0
gfx950,256,7169,2048,128,cktile,6,0,17.9709,a8w8_blockscale_cktile_32x128x128_1x4x1_16x16x64_intrawave_0x1x0_1,209.15,1699.64,0.0
gfx950,256,7169,2048,512,ck,0,2,27.9175,a8w8_blockscale_1x128x128_256x128x128x128_16x16_32x32_2x2_8x32x1_8x32x1_1x32x1x8_8_1x1_intrawave_v3,535.96,1215.02,0.0
gfx950,256,7169,2048,1024,ck,0,3,38.4468,a8w8_blockscale_1x128x128_256x128x128x128_16x16_32x32_2x2_8x32x1_8x32x1_1x32x1x8_8_1x1_intrawave_v3,772.05,996.29,0.0
gfx950,256,7169,2048,2048,ck,0,2,59.8218,a8w8_blockscale_1x128x128_256x128x128x128_16x16_32x32_2x2_8x32x1_8x32x1_1x32x1x8_8_1x1_intrawave_v3,993.24,796.74,0.0
gfx950,256,7169,2048,4096,ck,0,3,103.0473,a8w8_blockscale_1x128x128_256x128x128x128_16x16_32x32_2x2_8x32x1_8x32x1_1x32x1x8_8_1x1_intrawave_v3,1161.72,648.27,0.0
gfx950,256,7170,2048,128,cktile,7,0,18.0241,a8w8_blockscale_cktile_32x128x128_1x4x1_16x16x64_intrawave_0x1x0_2,208.56,1694.85,0.0
gfx950,256,7170,2048,1024,ck,0,1,38.4273,a8w8_blockscale_1x128x128_256x128x128x128_16x16_32x32_2x2_8x32x1_8x32x1_1x32x1x8_8_1x1_intrawave_v3,772.94,997.44,0.0
gfx950,256,7172,2048,512,ck,18,1,27.9117,a8w8_blockscale_1x128x128_256x64x64x256_16x16_32x32_1x1_16x16x1_16x16x1_1x32x1x8_8_1x1_intrawave_v1,536.12,1215.37,0.0
gfx950,256,7172,2048,4096,ck,0,0,103.6525,a8w8_blockscale_1x128x128_256x128x128x128_16x16_32x32_2x2_8x32x1_8x32x1_1x32x1x8_8_1x1_intrawave_v3,1156.82,645.5,0.0
gfx950,256,7176,2048,128,cktile,6,0,18.0089,a8w8_blockscale_cktile_32x128x128_1x4x1_16x16x64_intrawave_0x1x0_1,208.91,1697.69,0.0
gfx950,256,7176,2048,512,ck,18,0,28.098,a8w8_blockscale_1x128x128_256x64x64x256_16x16_32x32_1x1_16x16x1_16x16x1_1x32x1x8_8_1x1_intrawave_v1,534.59,1211.89,0.0
gfx950,256,7176,2048,1024,ck,0,0,38.631,a8w8_blockscale_1x128x128_256x128x128x128_16x16_32x32_2x2_8x32x1_8x32x1_1x32x1x8_8_1x1_intrawave_v3,779.12,1005.37,0.0
gfx950,256,7176,2048,4096,ck,0,0,102.4969,a8w8_blockscale_1x128x128_256x128x128x128_16x16_32x32_2x2_8x32x1_8x32x1_1x32x1x8_8_1x1_intrawave_v3,1138.07,634.99,0.0
gfx950,256,7177,2048,128,cktile,6,0,17.9764,a8w8_blockscale_cktile_32x128x128_1x4x1_16x16x64_intrawave_0x1x0_1,209.32,1701.0,0.0
gfx950,256,7177,2048,512,ck,18,1,27.6229,a8w8_blockscale_1x128x128_256x64x64x256_16x16_32x32_1x1_16x16x1_16x16x1_1x32x1x8_8_1x1_intrawave_v1,536.18,1215.49,0.0
gfx950,256,7177,2048,1024,ck,0,3,38.5764,a8w8_blockscale_1x128x128_256x128x128x128_16x16_32x32_2x2_8x32x1_8x32x1_1x32x1x8_8_1x1_intrawave_v3,771.49,995.51,0.0
gfx950,256,7177,2048,2048,ck,0,3,59.4362,a8w8_blockscale_1x128x128_256x128x128x128_16x16_32x32_2x2_8x32x1_8x32x1_1x32x1x8_8_1x1_intrawave_v3,1004.07,805.36,0.0
gfx950,256,7177,2048,4096,ck,0,2,103.545,a8w8_blockscale_1x128x128_256x128x128x128_16x16_32x32_2x2_8x32x1_8x32x1_1x32x1x8_8_1x1_intrawave_v3,1147.48,640.24,0.0
gfx950,256,7178,2048,512,ck,18,2,28.1392,a8w8_blockscale_1x128x128_256x64x64x256_16x16_32x32_1x1_16x16x1_16x16x1_1x32x1x8_8_1x1_intrawave_v1,532.27,1206.62,0.0
gfx950,256,7178,2048,4096,ck,0,2,103.0058,a8w8_blockscale_1x128x128_256x128x128x128_16x16_32x32_2x2_8x32x1_8x32x1_1x32x1x8_8_1x1_intrawave_v3,1141.53,636.9,0.0
gfx950,256,7179,2048,512,ck,18,0,27.9815,a8w8_blockscale_1x128x128_256x64x64x256_16x16_32x32_1x1_16x16x1_16x16x1_1x32x1x8_8_1x1_intrawave_v1,538.05,1219.71,0.0
gfx950,256,7179,2048,4096,ck,0,3,103.725,a8w8_blockscale_1x128x128_256x128x128x128_16x16_32x32_2x2_8x32x1_8x32x1_1x32x1x8_8_1x1_intrawave_v3,1146.46,639.64,0.0
gfx950,256,7183,2048,512,ck,18,2,27.8388,a8w8_blockscale_1x128x128_256x64x64x256_16x16_32x32_1x1_16x16x1_16x16x1_1x32x1x8_8_1x1_intrawave_v1,534.34,1211.28,0.0
gfx950,256,7183,2048,4096,ck,0,2,102.8801,a8w8_blockscale_1x128x128_256x128x128x128_16x16_32x32_2x2_8x32x1_8x32x1_1x32x1x8_8_1x1_intrawave_v3,1166.08,650.54,0.0
gfx950,256,7184,2048,512,ck,18,0,27.8279,a8w8_blockscale_1x128x128_256x64x64x256_16x16_32x32_1x1_16x16x1_16x16x1_1x32x1x8_8_1x1_intrawave_v1,541.4,1227.27,0.0
gfx950,256,7184,2048,4096,ck,0,1,102.2501,a8w8_blockscale_1x128x128_256x128x128x128_16x16_32x32_2x2_8x32x1_8x32x1_1x32x1x8_8_1x1_intrawave_v3,1148.06,640.48,0.0
gfx950,256,7185,2048,128,cktile,20,0,17.9942,a8w8_blockscale_cktile_32x128x128_1x4x1_16x16x64_intrawave_0x1x0_4,209.35,1701.19,0.0
gfx950,256,7185,2048,1024,ck,0,1,38.7226,a8w8_blockscale_1x128x128_256x128x128x128_16x16_32x32_2x2_8x32x1_8x32x1_1x32x1x8_8_1x1_intrawave_v3,777.02,1002.58,0.0
gfx950,256,7206,2048,128,cktile,19,0,18.0973,a8w8_blockscale_cktile_32x128x128_1x4x1_16x16x64_intrawave_0x1x0_3,208.76,1696.4,0.0
gfx950,256,7206,2048,1024,ck,0,0,39.0171,a8w8_blockscale_1x128x128_256x128x128x128_16x16_32x32_2x2_8x32x1_8x32x1_1x32x1x8_8_1x1_intrawave_v3,771.99,995.94,0.0
gfx950,256,7209,2048,512,ck,0,1,28.1138,a8w8_blockscale_1x128x128_256x128x128x128_16x16_32x32_2x2_8x32x1_8x32x1_1x32x1x8_8_1x1_intrawave_v3,535.34,1213.4,0.0
gfx950,256,7209,2048,4096,ck,0,2,104.7874,a8w8_blockscale_1x128x128_256x128x128x128_16x16_32x32_2x2_8x32x1_8x32x1_1x32x1x8_8_1x1_intrawave_v3,1152.5,642.68,0.0
gfx950,256,7210,2048,512,ck,18,0,28.0229,a8w8_blockscale_1x128x128_256x64x64x256_16x16_32x32_1x1_16x16x1_16x16x1_1x32x1x8_8_1x1_intrawave_v1,539.58,1223.01,0.0
gfx950,256,7210,2048,4096,ck,0,3,103.2398,a8w8_blockscale_1x128x128_256x128x128x128_16x16_32x32_2x2_8x32x1_8x32x1_1x32x1x8_8_1x1_intrawave_v3,1149.91,641.22,0.0
gfx950,256,7211,2048,512,ck,18,0,27.8913,a8w8_blockscale_1x128x128_256x64x64x256_16x16_32x32_1x1_16x16x1_16x16x1_1x32x1x8_8_1x1_intrawave_v1,542.2,1228.94,0.0
gfx950,256,7211,2048,4096,ck,0,0,103.0876,a8w8_blockscale_1x128x128_256x128x128x128_16x16_32x32_2x2_8x32x1_8x32x1_1x32x1x8_8_1x1_intrawave_v3,1173.57,654.41,0.0
gfx950,256,7217,2048,128,cktile,20,0,18.2053,a8w8_blockscale_cktile_32x128x128_1x4x1_16x16x64_intrawave_0x1x0_4,207.84,1688.89,0.0
gfx950,256,7217,2048,512,ck,18,0,27.7059,a8w8_blockscale_1x128x128_256x64x64x256_16x16_32x32_1x1_16x16x1_16x16x1_1x32x1x8_8_1x1_intrawave_v1,540.43,1224.9,0.0
gfx950,256,7217,2048,1024,ck,0,3,38.7948,a8w8_blockscale_1x128x128_256x128x128x128_16x16_32x32_2x2_8x32x1_8x32x1_1x32x1x8_8_1x1_intrawave_v3,773.35,997.6,0.0
gfx950,256,7217,2048,2048,ck,0,3,60.1242,a8w8_blockscale_1x128x128_256x128x128x128_16x16_32x32_2x2_8x32x1_8x32x1_1x32x1x8_8_1x1_intrawave_v3,1006.53,806.94,0.0
gfx950,256,7217,2048,4096,ck,0,2,103.8778,a8w8_blockscale_1x128x128_256x128x128x128_16x16_32x32_2x2_8x32x1_8x32x1_1x32x1x8_8_1x1_intrawave_v3,1155.77,644.41,0.0
gfx950,256,7223,2048,2048,ck,0,0,59.689,a8w8_blockscale_1x128x128_256x128x128x128_16x16_32x32_2x2_8x32x1_8x32x1_1x32x1x8_8_1x1_intrawave_v3,1014.5,813.27,0.0
gfx950,256,7238,2048,2048,ck,0,0,59.9543,a8w8_blockscale_1x128x128_256x128x128x128_16x16_32x32_2x2_8x32x1_8x32x1_1x32x1x8_8_1x1_intrawave_v3,1012.72,811.69,0.0
gfx950,256,7246,2048,2048,ck,0,1,59.9739,a8w8_blockscale_1x128x128_256x128x128x128_16x16_32x32_2x2_8x32x1_8x32x1_1x32x1x8_8_1x1_intrawave_v3,1010.07,809.5,0.0
gfx950,256,7249,2048,2048,ck,0,1,60.1495,a8w8_blockscale_1x128x128_256x128x128x128_16x16_32x32_2x2_8x32x1_8x32x1_1x32x1x8_8_1x1_intrawave_v3,1004.35,804.88,0.0
gfx950,256,7257,2048,128,cktile,7,0,18.1373,a8w8_blockscale_cktile_32x128x128_1x4x1_16x16x64_intrawave_0x1x0_2,209.78,1704.54,0.0
gfx950,256,7257,2048,1024,ck,0,0,38.7029,a8w8_blockscale_1x128x128_256x128x128x128_16x16_32x32_2x2_8x32x1_8x32x1_1x32x1x8_8_1x1_intrawave_v3,780.34,1006.32,0.0
gfx950,256,7265,2048,128,cktile,6,0,18.1468,a8w8_blockscale_cktile_32x128x128_1x4x1_16x16x64_intrawave_0x1x0_1,209.9,1705.51,0.0
gfx950,256,7265,2048,1024,ck,0,2,38.7456,a8w8_blockscale_1x128x128_256x128x128x128_16x16_32x32_2x2_8x32x1_8x32x1_1x32x1x8_8_1x1_intrawave_v3,775.82,1000.44,0.0
gfx950,256,7273,2048,512,ck,18,3,28.0784,a8w8_blockscale_1x128x128_256x64x64x256_16x16_32x32_1x1_16x16x1_16x16x1_1x32x1x8_8_1x1_intrawave_v1,538.8,1220.92,0.0
gfx950,256,7273,2048,4096,ck,0,2,104.1382,a8w8_blockscale_1x128x128_256x128x128x128_16x16_32x32_2x2_8x32x1_8x32x1_1x32x1x8_8_1x1_intrawave_v3,1157.62,644.83,0.0
gfx950,256,7274,2048,512,ck,18,0,28.019,a8w8_blockscale_1x128x128_256x64x64x256_16x16_32x32_1x1_16x16x1_16x16x1_1x32x1x8_8_1x1_intrawave_v1,544.44,1233.7,0.0
gfx950,256,7274,2048,4096,ck,0,2,103.4866,a8w8_blockscale_1x128x128_256x128x128x128_16x16_32x32_2x2_8x32x1_8x32x1_1x32x1x8_8_1x1_intrawave_v3,1154.44,643.05,0.0
gfx950,256,7316,2048,2048,ck,0,0,59.8163,a8w8_blockscale_1x128x128_256x128x128x128_16x16_32x32_2x2_8x32x1_8x32x1_1x32x1x8_8_1x1_intrawave_v3,1014.71,812.55,0.0
gfx950,256,7391,2048,512,ck,18,2,28.1176,a8w8_blockscale_1x128x128_256x64x64x256_16x16_32x32_1x1_16x16x1_16x16x1_1x32x1x8_8_1x1_intrawave_v1,546.87,1238.61,0.0
gfx950,256,7391,2048,4096,ck,0,2,103.8954,a8w8_blockscale_1x128x128_256x128x128x128_16x16_32x32_2x2_8x32x1_8x32x1_1x32x1x8_8_1x1_intrawave_v3,1174.61,653.0,0.0
gfx950,256,7393,2048,128,cktile,20,0,18.1686,a8w8_blockscale_cktile_32x128x128_1x4x1_16x16x64_intrawave_0x1x0_4,213.34,1733.22,0.0
gfx950,256,7393,2048,512,ck,0,3,28.0881,a8w8_blockscale_1x128x128_256x128x128x128_16x16_32x32_2x2_8x32x1_8x32x1_1x32x1x8_8_1x1_intrawave_v3,547.44,1239.9,0.0
gfx950,256,7393,2048,1024,ck,0,2,39.2679,a8w8_blockscale_1x128x128_256x128x128x128_16x16_32x32_2x2_8x32x1_8x32x1_1x32x1x8_8_1x1_intrawave_v3,788.1,1015.33,0.0
gfx950,256,7393,2048,2048,ck,0,0,60.3999,a8w8_blockscale_1x128x128_256x128x128x128_16x16_32x32_2x2_8x32x1_8x32x1_1x32x1x8_8_1x1_intrawave_v3,1015.48,812.44,0.0
gfx950,256,7393,2048,4096,ck,0,0,103.655,a8w8_blockscale_1x128x128_256x128x128x128_16x16_32x32_2x2_8x32x1_8x32x1_1x32x1x8_8_1x1_intrawave_v3,1174.63,652.99,0.0
gfx950,256,7461,2048,128,cktile,20,0,18.3019,a8w8_blockscale_cktile_32x128x128_1x4x1_16x16x64_intrawave_0x1x0_4,213.73,1736.29,0.0
gfx950,256,7461,2048,1024,ck,0,3,39.1226,a8w8_blockscale_1x128x128_256x128x128x128_16x16_32x32_2x2_8x32x1_8x32x1_1x32x1x8_8_1x1_intrawave_v3,792.92,1021.06,0.0
gfx950,256,7491,2048,2048,ck,0,1,60.9575,a8w8_blockscale_1x128x128_256x128x128x128_16x16_32x32_2x2_8x32x1_8x32x1_1x32x1x8_8_1x1_intrawave_v3,1021.13,816.06,0.0
gfx950,256,7558,2048,2048,ck,0,1,60.7599,a8w8_blockscale_1x128x128_256x128x128x128_16x16_32x32_2x2_8x32x1_8x32x1_1x32x1x8_8_1x1_intrawave_v3,1039.24,829.91,0.0
gfx950,256,7634,2048,128,cktile,20,0,18.7695,a8w8_blockscale_cktile_32x128x128_1x4x1_16x16x64_intrawave_0x1x0_4,213.24,1731.97,0.0
gfx950,256,7634,2048,1024,ck,0,2,39.3181,a8w8_blockscale_1x128x128_256x128x128x128_16x16_32x32_2x2_8x32x1_8x32x1_1x32x1x8_8_1x1_intrawave_v3,804.12,1034.26,0.0
gfx950,256,7650,2048,2048,ck,0,0,61.0894,a8w8_blockscale_1x128x128_256x128x128x128_16x16_32x32_2x2_8x32x1_8x32x1_1x32x1x8_8_1x1_intrawave_v3,1050.47,838.05,0.0
gfx950,256,7715,2048,512,ck,0,3,28.307,a8w8_blockscale_1x128x128_256x128x128x128_16x16_32x32_2x2_8x32x1_8x32x1_1x32x1x8_8_1x1_intrawave_v3,569.31,1287.83,0.0
gfx950,256,7715,2048,4096,ck,0,1,106.8286,a8w8_blockscale_1x128x128_256x128x128x128_16x16_32x32_2x2_8x32x1_8x32x1_1x32x1x8_8_1x1_intrawave_v3,1200.43,663.95,0.0
gfx950,256,7753,2048,512,ck,0,1,28.2566,a8w8_blockscale_1x128x128_256x128x128x128_16x16_32x32_2x2_8x32x1_8x32x1_1x32x1x8_8_1x1_intrawave_v3,572.67,1295.23,0.0
gfx950,256,7753,2048,2048,ck,0,3,61.2687,a8w8_blockscale_1x128x128_256x128x128x128_16x16_32x32_2x2_8x32x1_8x32x1_1x32x1x8_8_1x1_intrawave_v3,1044.0,831.98,0.0
gfx950,256,7753,2048,4096,ck,0,2,106.6394,a8w8_blockscale_1x128x128_256x128x128x128_16x16_32x32_2x2_8x32x1_8x32x1_1x32x1x8_8_1x1_intrawave_v3,1206.07,666.68,0.0
gfx950,256,7774,2048,2048,ck,0,0,61.5006,a8w8_blockscale_1x128x128_256x128x128x128_16x16_32x32_2x2_8x32x1_8x32x1_1x32x1x8_8_1x1_intrawave_v3,1060.36,844.83,0.0
gfx950,256,7815,2048,2048,ck,0,0,61.3275,a8w8_blockscale_1x128x128_256x128x128x128_16x16_32x32_2x2_8x32x1_8x32x1_1x32x1x8_8_1x1_intrawave_v3,1042.96,830.61,0.0
gfx950,256,7819,2048,512,ck,0,3,28.577,a8w8_blockscale_1x128x128_256x128x128x128_16x16_32x32_2x2_8x32x1_8x32x1_1x32x1x8_8_1x1_intrawave_v3,568.55,1285.61,0.0
gfx950,256,7819,2048,4096,ck,0,2,108.0714,a8w8_blockscale_1x128x128_256x128x128x128_16x16_32x32_2x2_8x32x1_8x32x1_1x32x1x8_8_1x1_intrawave_v3,1204.63,665.23,0.0
gfx950,256,7834,2048,2048,ck,0,3,62.2267,a8w8_blockscale_1x128x128_256x128x128x128_16x16_32x32_2x2_8x32x1_8x32x1_1x32x1x8_8_1x1_intrawave_v3,1053.96,839.21,0.0
gfx950,256,7836,2048,2048,ck,0,3,61.1419,a8w8_blockscale_1x128x128_256x128x128x128_16x16_32x32_2x2_8x32x1_8x32x1_1x32x1x8_8_1x1_intrawave_v3,1046.58,833.32,0.0
gfx950,256,7871,2048,2048,ck,0,0,61.1983,a8w8_blockscale_1x128x128_256x128x128x128_16x16_32x32_2x2_8x32x1_8x32x1_1x32x1x8_8_1x1_intrawave_v3,1078.9,858.74,0.0
gfx950,256,7899,2048,2048,ck,0,3,61.3335,a8w8_blockscale_1x128x128_256x128x128x128_16x16_32x32_2x2_8x32x1_8x32x1_1x32x1x8_8_1x1_intrawave_v3,1074.8,855.24,0.0
gfx950,256,7913,2048,2048,ck,0,1,61.1819,a8w8_blockscale_1x128x128_256x128x128x128_16x16_32x32_2x2_8x32x1_8x32x1_1x32x1x8_8_1x1_intrawave_v3,1082.87,861.54,0.0
gfx950,256,7930,2048,2048,ck,0,0,61.5891,a8w8_blockscale_1x128x128_256x128x128x128_16x16_32x32_2x2_8x32x1_8x32x1_1x32x1x8_8_1x1_intrawave_v3,1080.09,859.18,0.0
gfx950,256,7961,2048,2048,ck,0,1,62.3099,a8w8_blockscale_1x128x128_256x128x128x128_16x16_32x32_2x2_8x32x1_8x32x1_1x32x1x8_8_1x1_intrawave_v3,1065.48,847.3,0.0
gfx950,256,7963,2048,2048,ck,0,0,62.2935,a8w8_blockscale_1x128x128_256x128x128x128_16x16_32x32_2x2_8x32x1_8x32x1_1x32x1x8_8_1x1_intrawave_v3,1072.32,852.72,0.0
gfx950,256,7974,2048,2048,ck,0,3,62.4791,a8w8_blockscale_1x128x128_256x128x128x128_16x16_32x32_2x2_8x32x1_8x32x1_1x32x1x8_8_1x1_intrawave_v3,1062.68,844.97,0.0
gfx950,256,8016,2048,2048,ck,0,3,62.2099,a8w8_blockscale_1x128x128_256x128x128x128_16x16_32x32_2x2_8x32x1_8x32x1_1x32x1x8_8_1x1_intrawave_v3,1062.36,844.36,0.0
gfx950,256,8017,2048,2048,ck,0,2,62.8331,a8w8_blockscale_1x128x128_256x128x128x128_16x16_32x32_2x2_8x32x1_8x32x1_1x32x1x8_8_1x1_intrawave_v3,1067.68,848.58,0.0
gfx950,256,8099,2048,512,ck,0,2,29.3869,a8w8_blockscale_1x128x128_256x128x128x128_16x16_32x32_2x2_8x32x1_8x32x1_1x32x1x8_8_1x1_intrawave_v3,570.63,1289.05,0.0
gfx950,256,8099,2048,4096,ck,0,1,110.4923,a8w8_blockscale_1x128x128_256x128x128x128_16x16_32x32_2x2_8x32x1_8x32x1_1x32x1x8_8_1x1_intrawave_v3,1225.9,674.27,0.0
gfx950,256,8103,2048,2048,ck,0,0,63.5939,a8w8_blockscale_1x128x128_256x128x128x128_16x16_32x32_2x2_8x32x1_8x32x1_1x32x1x8_8_1x1_intrawave_v3,1066.28,846.76,0.0
gfx950,256,8128,2048,2048,ck,0,0,63.2531,a8w8_blockscale_1x128x128_256x128x128x128_16x16_32x32_2x2_8x32x1_8x32x1_1x32x1x8_8_1x1_intrawave_v3,1069.54,849.15,0.0
gfx950,256,8129,2048,128,cktile,26,0,19.5022,a8w8_blockscale_cktile_128x128x128_2x2x1_16x16x128_intrawave_0x1x0_4,218.54,1774.11,0.0
gfx950,256,8129,2048,512,ck,0,0,29.5413,a8w8_blockscale_1x128x128_256x128x128x128_16x16_32x32_2x2_8x32x1_8x32x1_1x32x1x8_8_1x1_intrawave_v3,574.95,1298.68,0.0
gfx950,256,8129,2048,1024,ck,0,3,41.4467,a8w8_blockscale_1x128x128_256x128x128x128_16x16_32x32_2x2_8x32x1_8x32x1_1x32x1x8_8_1x1_intrawave_v3,816.91,1047.45,0.0
gfx950,256,8129,2048,2048,ck,0,1,63.8055,a8w8_blockscale_1x128x128_256x128x128x128_16x16_32x32_2x2_8x32x1_8x32x1_1x32x1x8_8_1x1_intrawave_v3,1045.81,830.3,0.0
gfx950,256,8129,2048,4096,ck,0,0,109.5259,a8w8_blockscale_1x128x128_256x128x128x128_16x16_32x32_2x2_8x32x1_8x32x1_1x32x1x8_8_1x1_intrawave_v3,1245.2,684.6,0.0
gfx950,256,8150,2048,2048,ck,0,0,63.4975,a8w8_blockscale_1x128x128_256x128x128x128_16x16_32x32_2x2_8x32x1_8x32x1_1x32x1x8_8_1x1_intrawave_v3,1076.69,854.65,0.0
gfx950,256,8184,2048,2048,ck,0,0,63.4715,a8w8_blockscale_1x128x128_256x128x128x128_16x16_32x32_2x2_8x32x1_8x32x1_1x32x1x8_8_1x1_intrawave_v3,1081.63,858.29,0.0
gfx950,256,8185,2048,2048,ck,0,0,63.2631,a8w8_blockscale_1x128x128_256x128x128x128_16x16_32x32_2x2_8x32x1_8x32x1_1x32x1x8_8_1x1_intrawave_v3,1085.32,861.21,0.0
gfx950,256,8188,2048,512,ck,0,1,29.7338,a8w8_blockscale_1x128x128_256x128x128x128_16x16_32x32_2x2_8x32x1_8x32x1_1x32x1x8_8_1x1_intrawave_v3,576.26,1301.37,0.0
gfx950,256,8188,2048,4096,ck,0,1,110.6123,a8w8_blockscale_1x128x128_256x128x128x128_16x16_32x32_2x2_8x32x1_8x32x1_1x32x1x8_8_1x1_intrawave_v3,1228.58,674.92,0.0
gfx950,256,8192,2048,128,cktile,26,0,19.4446,a8w8_blockscale_cktile_128x128x128_2x2x1_16x16x128_intrawave_0x1x0_4,220.88,1793.05,0.0
gfx950,256,8192,2048,512,ck,0,2,29.1172,a8w8_blockscale_1x128x128_256x128x128x128_16x16_32x32_2x2_8x32x1_8x32x1_1x32x1x8_8_1x1_intrawave_v3,587.21,1326.1,0.0
gfx950,256,8192,2048,1024,ck,0,0,40.5383,a8w8_blockscale_1x128x128_256x128x128x128_16x16_32x32_2x2_8x32x1_8x32x1_1x32x1x8_8_1x1_intrawave_v3,840.54,1077.35,0.0
gfx950,256,8192,2048,2048,ck,0,0,62.5075,a8w8_blockscale_1x128x128_256x128x128x128_16x16_32x32_2x2_8x32x1_8x32x1_1x32x1x8_8_1x1_intrawave_v3,1083.07,859.37,0.0
gfx950,256,8192,2048,4096,ck,0,0,106.8055,a8w8_blockscale_1x128x128_256x128x128x128_16x16_32x32_2x2_8x32x1_8x32x1_1x32x1x8_8_1x1_intrawave_v3,1286.82,706.87,0.0
gfx950,256,1,2560,2048,ck,8,2,5.4152,a8w8_blockscale_1x128x128_256x16x64x256_16x16_16x16_1x1_16x16x1_16x16x1_1x16x1x16_4_1x1_intrawave_v1,1.94,969.5,0.0
gfx950,256,2,2560,2048,ck,8,2,5.507,a8w8_blockscale_1x128x128_256x16x64x256_16x16_16x16_1x1_16x16x1_16x16x1_1x16x1x16_4_1x1_intrawave_v1,3.81,954.64,0.0
gfx950,256,4,2560,2048,ck,8,2,5.9581,a8w8_blockscale_1x128x128_256x16x64x256_16x16_16x16_1x1_16x16x1_16x16x1_1x16x1x16_4_1x1_intrawave_v1,7.04,884.77,0.0
gfx950,256,8,2560,2048,ck,8,2,5.9969,a8w8_blockscale_1x128x128_256x16x64x256_16x16_16x16_1x1_16x16x1_16x16x1_1x16x1x16_4_1x1_intrawave_v1,13.99,883.83,0.0
gfx950,256,16,2560,2048,ck,8,2,6.0408,a8w8_blockscale_1x128x128_256x16x64x256_16x16_16x16_1x1_16x16x1_16x16x1_1x16x1x16_4_1x1_intrawave_v1,27.77,886.9,0.0
gfx950,256,32,2560,2048,ck,8,2,7.0088,a8w8_blockscale_1x128x128_256x16x64x256_16x16_16x16_1x1_16x16x1_16x16x1_1x16x1x16_4_1x1_intrawave_v1,47.87,780.77,0.0
gfx950,256,48,2560,2048,ck,8,2,7.0405,a8w8_blockscale_1x128x128_256x16x64x256_16x16_16x16_1x1_16x16x1_16x16x1_1x16x1x16_4_1x1_intrawave_v1,71.49,793.54,0.0
gfx950,256,64,2560,2048,ck,8,2,7.6061,a8w8_blockscale_1x128x128_256x16x64x256_16x16_16x16_1x1_16x16x1_16x16x1_1x16x1x16_4_1x1_intrawave_v1,88.23,749.61,0.0
gfx950,256,80,2560,2048,ck,8,0,8.0583,a8w8_blockscale_1x128x128_256x16x64x256_16x16_16x16_1x1_16x16x1_16x16x1_1x16x1x16_4_1x1_intrawave_v1,104.1,721.78,0.0
gfx950,256,96,2560,2048,ck,8,2,8.0059,a8w8_blockscale_1x128x128_256x16x64x256_16x16_16x16_1x1_16x16x1_16x16x1_1x16x1x16_4_1x1_intrawave_v1,125.59,739.98,0.0
gfx950,256,112,2560,2048,ck,8,2,9.0798,a8w8_blockscale_1x128x128_256x16x64x256_16x16_16x16_1x1_16x16x1_16x16x1_1x16x1x16_4_1x1_intrawave_v1,129.34,665.84,0.0
gfx950,256,128,2560,2048,ck,7,0,9.4439,a8w8_blockscale_1x128x128_256x16x128x256_16x16_16x16_1x2_16x16x1_16x16x1_1x16x1x16_8_1x2_intrawave_v1,142.12,652.31,0.0
gfx950,256,256,2560,2048,ck,18,0,9.5171,a8w8_blockscale_1x128x128_256x64x64x256_16x16_32x32_1x1_16x16x1_16x16x1_1x32x1x8_8_1x1_intrawave_v1,282.06,743.7,0.0
gfx950,256,512,2560,2048,ck,2,3,15.27,a8w8_blockscale_1x128x128_256x64x128x128_16x16_32x32_1x2_8x32x1_8x32x1_1x32x1x8_8_1x1_intrawave_v3,351.47,583.5,0.0
gfx950,256,588,2560,2048,ck,2,0,15.5279,a8w8_blockscale_1x128x128_256x64x128x128_16x16_32x32_1x2_8x32x1_8x32x1_1x32x1x8_8_1x1_intrawave_v3,397.07,609.08,0.0
gfx950,256,773,2560,2048,ck,3,0,18.7183,a8w8_blockscale_1x128x128_256x64x64x128_16x16_32x32_1x1_8x32x1_8x32x1_1x32x1x8_8_1x1_intrawave_v3,433.03,576.11,0.0
gfx950,256,822,2560,2048,ck,3,0,18.7656,a8w8_blockscale_1x128x128_256x64x64x128_16x16_32x32_1x1_8x32x1_8x32x1_1x32x1x8_8_1x1_intrawave_v3,457.18,590.62,0.0
gfx950,256,1024,2560,2048,ck,0,0,19.2636,a8w8_blockscale_1x128x128_256x128x128x128_16x16_32x32_2x2_8x32x1_8x32x1_1x32x1x8_8_1x1_intrawave_v3,557.39,653.2,0.0
gfx950,256,1025,2560,2048,ck,0,0,20.0057,a8w8_blockscale_1x128x128_256x128x128x128_16x16_32x32_2x2_8x32x1_8x32x1_1x32x1x8_8_1x1_intrawave_v3,537.24,629.32,0.0
gfx950,256,1027,2560,2048,ck,0,0,19.9868,a8w8_blockscale_1x128x128_256x128x128x128_16x16_32x32_2x2_8x32x1_8x32x1_1x32x1x8_8_1x1_intrawave_v3,536.91,628.42,0.0
gfx950,256,1042,2560,2048,ck,0,2,20.0228,a8w8_blockscale_1x128x128_256x128x128x128_16x16_32x32_2x2_8x32x1_8x32x1_1x32x1x8_8_1x1_intrawave_v3,543.11,631.87,0.0
gfx950,256,1051,2560,2048,ck,0,3,20.1838,a8w8_blockscale_1x128x128_256x128x128x128_16x16_32x32_2x2_8x32x1_8x32x1_1x32x1x8_8_1x1_intrawave_v3,545.17,632.03,0.0
gfx950,256,1055,2560,2048,ck,0,3,20.1379,a8w8_blockscale_1x128x128_256x128x128x128_16x16_32x32_2x2_8x32x1_8x32x1_1x32x1x8_8_1x1_intrawave_v3,545.49,631.42,0.0
gfx950,256,1057,2560,2048,ck,3,3,20.0736,a8w8_blockscale_1x128x128_256x64x64x128_16x16_32x32_1x1_8x32x1_8x32x1_1x32x1x8_8_1x1_intrawave_v3,549.9,636.03,0.0
gfx950,256,1069,2560,2048,ck,3,3,20.1749,a8w8_blockscale_1x128x128_256x64x64x128_16x16_32x32_1x1_8x32x1_8x32x1_1x32x1x8_8_1x1_intrawave_v3,554.07,637.91,0.0
gfx950,256,1072,2560,2048,ck,3,1,20.1526,a8w8_blockscale_1x128x128_256x64x64x128_16x16_32x32_1x1_8x32x1_8x32x1_1x32x1x8_8_1x1_intrawave_v3,556.69,640.2,0.0
gfx950,256,1074,2560,2048,ck,0,1,20.0972,a8w8_blockscale_1x128x128_256x128x128x128_16x16_32x32_2x2_8x32x1_8x32x1_1x32x1x8_8_1x1_intrawave_v3,556.76,639.79,0.0
gfx950,256,1091,2560,2048,ck,0,2,20.2518,a8w8_blockscale_1x128x128_256x128x128x128_16x16_32x32_2x2_8x32x1_8x32x1_1x32x1x8_8_1x1_intrawave_v3,562.99,642.87,0.0
gfx950,256,1128,2560,2048,ck,2,0,20.3394,a8w8_blockscale_1x128x128_256x64x128x128_16x16_32x32_1x2_8x32x1_8x32x1_1x32x1x8_8_1x1_intrawave_v3,581.06,654.77,0.0
gfx950,256,1136,2560,2048,ck,0,1,20.3139,a8w8_blockscale_1x128x128_256x128x128x128_16x16_32x32_2x2_8x32x1_8x32x1_1x32x1x8_8_1x1_intrawave_v3,584.09,656.36,0.0
gfx950,256,1514,2560,2048,ck,0,0,20.9583,a8w8_blockscale_1x128x128_256x128x128x128_16x16_32x32_2x2_8x32x1_8x32x1_1x32x1x8_8_1x1_intrawave_v3,757.48,767.96,0.0
gfx950,256,2017,2560,2048,ck,2,0,29.5362,a8w8_blockscale_1x128x128_256x64x128x128_16x16_32x32_1x2_8x32x1_8x32x1_1x32x1x8_8_1x1_intrawave_v3,715.91,666.86,0.0
gfx950,256,2048,2560,2048,ck,2,3,29.3699,a8w8_blockscale_1x128x128_256x64x128x128_16x16_32x32_1x2_8x32x1_8x32x1_1x32x1x8_8_1x1_intrawave_v3,728.12,675.51,0.0
gfx950,256,2151,2560,2048,ck,2,0,29.7989,a8w8_blockscale_1x128x128_256x64x128x128_16x16_32x32_1x2_8x32x1_8x32x1_1x32x1x8_8_1x1_intrawave_v3,756.9,693.36,0.0
gfx950,256,2332,2560,2048,ck,2,1,30.168,a8w8_blockscale_1x128x128_256x64x128x128_16x16_32x32_1x2_8x32x1_8x32x1_1x32x1x8_8_1x1_intrawave_v3,797.24,715.92,0.0
gfx950,256,2341,2560,2048,ck,2,0,30.392,a8w8_blockscale_1x128x128_256x64x128x128_16x16_32x32_1x2_8x32x1_8x32x1_1x32x1x8_8_1x1_intrawave_v3,803.53,720.91,0.0
gfx950,256,3072,2560,2048,ck,0,0,32.7057,a8w8_blockscale_1x128x128_256x128x128x128_16x16_32x32_2x2_8x32x1_8x32x1_1x32x1x8_8_1x1_intrawave_v3,975.02,825.21,0.0
gfx950,256,3073,2560,2048,ck,0,3,33.2368,a8w8_blockscale_1x128x128_256x128x128x128_16x16_32x32_2x2_8x32x1_8x32x1_1x32x1x8_8_1x1_intrawave_v3,947.4,801.79,0.0
gfx950,256,3089,2560,2048,ck,0,1,33.6207,a8w8_blockscale_1x128x128_256x128x128x128_16x16_32x32_2x2_8x32x1_8x32x1_1x32x1x8_8_1x1_intrawave_v3,956.89,809.01,0.0
gfx950,256,3110,2560,2048,ck,0,0,33.8101,a8w8_blockscale_1x128x128_256x128x128x128_16x16_32x32_2x2_8x32x1_8x32x1_1x32x1x8_8_1x1_intrawave_v3,964.53,814.41,0.0
gfx950,256,3137,2560,2048,ck,0,3,33.6377,a8w8_blockscale_1x128x128_256x128x128x128_16x16_32x32_2x2_8x32x1_8x32x1_1x32x1x8_8_1x1_intrawave_v3,974.44,821.43,0.0
gfx950,256,3613,2560,2048,cktile,32,0,40.4167,a8w8_blockscale_cktile_192x256x128_4x2x1_16x16x128_intrawave_0x1x0_4_aqrm,937.36,770.49,0.0
gfx950,256,4096,2560,2048,cktile,32,0,41.0679,a8w8_blockscale_cktile_192x256x128_4x2x1_16x16x128_intrawave_0x1x0_4_aqrm,1045.82,842.58,0.0
gfx950,256,4097,2560,2048,cktile,31,0,41.1376,a8w8_blockscale_cktile_192x256x128_4x2x1_16x16x128_intrawave_0x1x0_3_aqrm,1044.3,841.33,0.0
gfx950,256,4109,2560,2048,cktile,30,0,41.0376,a8w8_blockscale_cktile_192x256x128_4x2x1_16x16x128_intrawave_0x1x0_2_aqrm,1049.91,845.47,0.0
gfx950,256,4143,2560,2048,cktile,12,0,41.0423,a8w8_blockscale_cktile_192x256x128_4x2x1_16x16x128_intrawave_0x1x0_1_aqrm,1058.48,851.31,0.0
gfx950,256,4345,2560,2048,cktile,32,0,41.5937,a8w8_blockscale_cktile_192x256x128_4x2x1_16x16x128_intrawave_0x1x0_4_aqrm,1095.37,874.84,0.0
gfx950,256,4413,2560,2048,cktile,31,0,41.7845,a8w8_blockscale_cktile_192x256x128_4x2x1_16x16x128_intrawave_0x1x0_3_aqrm,1107.44,882.51,0.0
gfx950,256,5121,2560,2048,ck,0,0,57.8499,a8w8_blockscale_1x128x128_256x128x128x128_16x16_32x32_2x2_8x32x1_8x32x1_1x32x1x8_8_1x1_intrawave_v3,924.48,722.23,0.0
gfx950,256,5123,2560,2048,ck,0,2,57.8631,a8w8_blockscale_1x128x128_256x128x128x128_16x16_32x32_2x2_8x32x1_8x32x1_1x32x1x8_8_1x1_intrawave_v3,926.09,723.46,0.0
gfx950,256,5133,2560,2048,ck,0,0,57.9244,a8w8_blockscale_1x128x128_256x128x128x128_16x16_32x32_2x2_8x32x1_8x32x1_1x32x1x8_8_1x1_intrawave_v3,929.2,725.71,0.0
gfx950,256,5185,2560,2048,ck,0,1,58.1543,a8w8_blockscale_1x128x128_256x128x128x128_16x16_32x32_2x2_8x32x1_8x32x1_1x32x1x8_8_1x1_intrawave_v3,932.27,727.2,0.0
gfx950,256,5191,2560,2048,ck,0,0,58.1763,a8w8_blockscale_1x128x128_256x128x128x128_16x16_32x32_2x2_8x32x1_8x32x1_1x32x1x8_8_1x1_intrawave_v3,935.63,729.71,0.0
gfx950,256,6146,2560,2048,ck,0,0,61.2836,a8w8_blockscale_1x128x128_256x128x128x128_16x16_32x32_2x2_8x32x1_8x32x1_1x32x1x8_8_1x1_intrawave_v3,1051.59,804.41,0.0
gfx950,256,6147,2560,2048,ck,0,0,61.5916,a8w8_blockscale_1x128x128_256x128x128x128_16x16_32x32_2x2_8x32x1_8x32x1_1x32x1x8_8_1x1_intrawave_v3,1046.51,800.51,0.0
gfx950,256,6155,2560,2048,ck,0,0,60.8175,a8w8_blockscale_1x128x128_256x128x128x128_16x16_32x32_2x2_8x32x1_8x32x1_1x32x1x8_8_1x1_intrawave_v3,1045.27,799.45,0.0
gfx950,256,6377,2560,2048,ck,0,0,62.0855,a8w8_blockscale_1x128x128_256x128x128x128_16x16_32x32_2x2_8x32x1_8x32x1_1x32x1x8_8_1x1_intrawave_v3,1069.82,815.2,0.0
gfx950,256,6401,2560,2048,ck,0,3,63.1899,a8w8_blockscale_1x128x128_256x128x128x128_16x16_32x32_2x2_8x32x1_8x32x1_1x32x1x8_8_1x1_intrawave_v3,1053.49,802.45,0.0
gfx950,256,7121,2560,2048,ck,0,0,72.3604,a8w8_blockscale_1x128x128_256x128x128x128_16x16_32x32_2x2_8x32x1_8x32x1_1x32x1x8_8_1x1_intrawave_v3,1030.54,776.83,0.0
gfx950,256,7169,2560,2048,ck,0,0,72.3875,a8w8_blockscale_1x128x128_256x128x128x128_16x16_32x32_2x2_8x32x1_8x32x1_1x32x1x8_8_1x1_intrawave_v3,1034.63,779.43,0.0
gfx950,256,7170,2560,2048,ck,0,0,72.9064,a8w8_blockscale_1x128x128_256x128x128x128_16x16_32x32_2x2_8x32x1_8x32x1_1x32x1x8_8_1x1_intrawave_v3,1031.22,776.85,0.0
gfx950,256,7176,2560,2048,ck,0,0,72.1339,a8w8_blockscale_1x128x128_256x128x128x128_16x16_32x32_2x2_8x32x1_8x32x1_1x32x1x8_8_1x1_intrawave_v3,1028.68,774.87,0.0
gfx950,256,7177,2560,2048,ck,0,0,72.609,a8w8_blockscale_1x128x128_256x128x128x128_16x16_32x32_2x2_8x32x1_8x32x1_1x32x1x8_8_1x1_intrawave_v3,1036.16,780.5,0.0
gfx950,256,7185,2560,2048,ck,0,2,72.5867,a8w8_blockscale_1x128x128_256x128x128x128_16x16_32x32_2x2_8x32x1_8x32x1_1x32x1x8_8_1x1_intrawave_v3,1036.67,780.8,0.0
gfx950,256,7206,2560,2048,ck,0,2,72.0531,a8w8_blockscale_1x128x128_256x128x128x128_16x16_32x32_2x2_8x32x1_8x32x1_1x32x1x8_8_1x1_intrawave_v3,1035.15,779.44,0.0
gfx950,256,7217,2560,2048,ck,0,0,72.5669,a8w8_blockscale_1x128x128_256x128x128x128_16x16_32x32_2x2_8x32x1_8x32x1_1x32x1x8_8_1x1_intrawave_v3,1042.84,785.13,0.0
gfx950,256,7257,2560,2048,ck,0,0,72.7508,a8w8_blockscale_1x128x128_256x128x128x128_16x16_32x32_2x2_8x32x1_8x32x1_1x32x1x8_8_1x1_intrawave_v3,1036.2,779.73,0.0
gfx950,256,7265,2560,2048,ck,0,3,73.0204,a8w8_blockscale_1x128x128_256x128x128x128_16x16_32x32_2x2_8x32x1_8x32x1_1x32x1x8_8_1x1_intrawave_v3,1025.93,771.93,0.0
gfx950,256,7393,2560,2048,ck,0,1,73.7844,a8w8_blockscale_1x128x128_256x128x128x128_16x16_32x32_2x2_8x32x1_8x32x1_1x32x1x8_8_1x1_intrawave_v3,1027.79,772.1,0.0
gfx950,256,7461,2560,2048,ck,0,2,73.8716,a8w8_blockscale_1x128x128_256x128x128x128_16x16_32x32_2x2_8x32x1_8x32x1_1x32x1x8_8_1x1_intrawave_v3,1048.53,787.03,0.0
gfx950,256,7634,2560,2048,ck,0,3,74.2968,a8w8_blockscale_1x128x128_256x128x128x128_16x16_32x32_2x2_8x32x1_8x32x1_1x32x1x8_8_1x1_intrawave_v3,1057.52,792.18,0.0
gfx950,256,8129,2560,2048,cktile,27,0,78.2652,a8w8_blockscale_cktile_192x256x128_4x2x1_16x16x128_intrawave_0x1x0_2,1089.1,811.49,0.0
gfx950,256,8192,2560,2048,ck,0,2,75.4964,a8w8_blockscale_1x128x128_256x128x128x128_16x16_32x32_2x2_8x32x1_8x32x1_1x32x1x8_8_1x1_intrawave_v3,1130.11,841.51,0.0
gfx950,256,1,3072,2048,ck,8,2,5.5803,a8w8_blockscale_1x128x128_256x16x64x256_16x16_16x16_1x1_16x16x1_16x16x1_1x16x1x16_4_1x1_intrawave_v1,2.25,1128.91,0.0
gfx950,256,2,3072,2048,ck,8,2,5.6662,a8w8_blockscale_1x128x128_256x16x64x256_16x16_16x16_1x1_16x16x1_16x16x1_1x16x1x16_4_1x1_intrawave_v1,4.44,1113.24,0.0
gfx950,256,4,3072,2048,ck,8,2,6.1588,a8w8_blockscale_1x128x128_256x16x64x256_16x16_16x16_1x1_16x16x1_16x16x1_1x16x1x16_4_1x1_intrawave_v1,8.17,1026.86,0.0
gfx950,256,8,3072,2048,ck,8,2,6.2159,a8w8_blockscale_1x128x128_256x16x64x256_16x16_16x16_1x1_16x16x1_16x16x1_1x16x1x16_4_1x1_intrawave_v1,16.19,1022.7,0.0
gfx950,256,16,3072,2048,ck,8,2,6.2641,a8w8_blockscale_1x128x128_256x16x64x256_16x16_16x16_1x1_16x16x1_16x16x1_1x16x1x16_4_1x1_intrawave_v1,32.14,1025.29,0.0
gfx950,256,32,3072,2048,ck,8,2,7.1585,a8w8_blockscale_1x128x128_256x16x64x256_16x16_16x16_1x1_16x16x1_16x16x1_1x16x1x16_4_1x1_intrawave_v1,56.25,915.5,0.0
gfx950,256,48,3072,2048,ck,8,2,7.8295,a8w8_blockscale_1x128x128_256x16x64x256_16x16_16x16_1x1_16x16x1_16x16x1_1x16x1x16_4_1x1_intrawave_v1,77.14,853.78,0.0
gfx950,256,64,3072,2048,ck,8,2,7.8506,a8w8_blockscale_1x128x128_256x16x64x256_16x16_16x16_1x1_16x16x1_16x16x1_1x16x1x16_4_1x1_intrawave_v1,102.58,868.18,0.0
gfx950,256,80,3072,2048,ck,8,2,8.1667,a8w8_blockscale_1x128x128_256x16x64x256_16x16_16x16_1x1_16x16x1_16x16x1_1x16x1x16_4_1x1_intrawave_v1,123.25,850.53,0.0
gfx950,256,96,3072,2048,ck,8,2,9.2223,a8w8_blockscale_1x128x128_256x16x64x256_16x16_16x16_1x1_16x16x1_16x16x1_1x16x1x16_4_1x1_intrawave_v1,130.98,767.48,0.0
gfx950,256,112,3072,2048,ck,7,0,9.458,a8w8_blockscale_1x128x128_256x16x128x256_16x16_16x16_1x2_16x16x1_16x16x1_1x16x1x16_8_1x2_intrawave_v1,148.86,761.48,0.0
gfx950,256,128,3072,2048,ck,7,0,9.4357,a8w8_blockscale_1x128x128_256x16x128x256_16x16_16x16_1x2_16x16x1_16x16x1_1x16x1x16_8_1x2_intrawave_v1,170.69,777.9,0.0
gfx950,256,256,3072,2048,ck,18,0,9.4334,a8w8_blockscale_1x128x128_256x64x64x256_16x16_32x32_1x1_16x16x1_16x16x1_1x32x1x8_8_1x1_intrawave_v1,341.47,889.25,0.0
gfx950,256,512,3072,2048,ck,2,0,15.5979,a8w8_blockscale_1x128x128_256x64x128x128_16x16_32x32_1x2_8x32x1_8x32x1_1x32x1x8_8_1x1_intrawave_v3,413.03,672.25,0.0
gfx950,256,588,3072,2048,ck,2,2,15.8606,a8w8_blockscale_1x128x128_256x64x128x128_16x16_32x32_1x2_8x32x1_8x32x1_1x32x1x8_8_1x1_intrawave_v3,465.6,699.05,0.0
gfx950,256,773,3072,2048,ck,0,3,19.764,a8w8_blockscale_1x128x128_256x128x128x128_16x16_32x32_2x2_8x32x1_8x32x1_1x32x1x8_8_1x1_intrawave_v3,489.56,635.38,0.0
gfx950,256,822,3072,2048,ck,0,0,19.9419,a8w8_blockscale_1x128x128_256x128x128x128_16x16_32x32_2x2_8x32x1_8x32x1_1x32x1x8_8_1x1_intrawave_v3,518.66,653.16,0.0
gfx950,256,1024,3072,2048,ck,0,0,19.7347,a8w8_blockscale_1x128x128_256x128x128x128_16x16_32x32_2x2_8x32x1_8x32x1_1x32x1x8_8_1x1_intrawave_v3,652.91,743.87,0.0
gfx950,256,1025,3072,2048,ck,0,0,20.3996,a8w8_blockscale_1x128x128_256x128x128x128_16x16_32x32_2x2_8x32x1_8x32x1_1x32x1x8_8_1x1_intrawave_v3,632.24,720.03,0.0
gfx950,256,1027,3072,2048,ck,0,0,20.3571,a8w8_blockscale_1x128x128_256x128x128x128_16x16_32x32_2x2_8x32x1_8x32x1_1x32x1x8_8_1x1_intrawave_v3,630.74,717.72,0.0
gfx950,256,1042,3072,2048,ck,0,3,20.4604,a8w8_blockscale_1x128x128_256x128x128x128_16x16_32x32_2x2_8x32x1_8x32x1_1x32x1x8_8_1x1_intrawave_v3,634.89,717.99,0.0
gfx950,256,1051,3072,2048,ck,0,0,20.5684,a8w8_blockscale_1x128x128_256x128x128x128_16x16_32x32_2x2_8x32x1_8x32x1_1x32x1x8_8_1x1_intrawave_v3,642.81,724.3,0.0
gfx950,256,1055,3072,2048,ck,0,0,20.5767,a8w8_blockscale_1x128x128_256x128x128x128_16x16_32x32_2x2_8x32x1_8x32x1_1x32x1x8_8_1x1_intrawave_v3,645.15,725.77,0.0
gfx950,256,1057,3072,2048,ck,0,2,20.5116,a8w8_blockscale_1x128x128_256x128x128x128_16x16_32x32_2x2_8x32x1_8x32x1_1x32x1x8_8_1x1_intrawave_v3,643.12,722.91,0.0
gfx950,256,1069,3072,2048,ck,0,0,20.6396,a8w8_blockscale_1x128x128_256x128x128x128_16x16_32x32_2x2_8x32x1_8x32x1_1x32x1x8_8_1x1_intrawave_v3,651.71,729.12,0.0
gfx950,256,1072,3072,2048,ck,0,0,20.5507,a8w8_blockscale_1x128x128_256x128x128x128_16x16_32x32_2x2_8x32x1_8x32x1_1x32x1x8_8_1x1_intrawave_v3,651.8,728.36,0.0
gfx950,256,1074,3072,2048,ck,0,3,20.5583,a8w8_blockscale_1x128x128_256x128x128x128_16x16_32x32_2x2_8x32x1_8x32x1_1x32x1x8_8_1x1_intrawave_v3,655.17,731.55,0.0
gfx950,256,1091,3072,2048,ck,0,0,20.6035,a8w8_blockscale_1x128x128_256x128x128x128_16x16_32x32_2x2_8x32x1_8x32x1_1x32x1x8_8_1x1_intrawave_v3,660.53,732.75,0.0
gfx950,256,1128,3072,2048,ck,0,0,20.7632,a8w8_blockscale_1x128x128_256x128x128x128_16x16_32x32_2x2_8x32x1_8x32x1_1x32x1x8_8_1x1_intrawave_v3,683.59,748.06,0.0
gfx950,256,1136,3072,2048,ck,0,2,20.7306,a8w8_blockscale_1x128x128_256x128x128x128_16x16_32x32_2x2_8x32x1_8x32x1_1x32x1x8_8_1x1_intrawave_v3,685.28,747.76,0.0
gfx950,256,1514,3072,2048,ck,2,0,28.3733,a8w8_blockscale_1x128x128_256x64x128x128_16x16_32x32_1x2_8x32x1_8x32x1_1x32x1x8_8_1x1_intrawave_v3,663.28,650.87,0.0
gfx950,256,2017,3072,2048,ck,2,0,30.7829,a8w8_blockscale_1x128x128_256x64x128x128_16x16_32x32_1x2_8x32x1_8x32x1_1x32x1x8_8_1x1_intrawave_v3,824.48,741.15,0.0
gfx950,256,2048,3072,2048,ck,2,0,30.6389,a8w8_blockscale_1x128x128_256x64x128x128_16x16_32x32_1x2_8x32x1_8x32x1_1x32x1x8_8_1x1_intrawave_v3,841.08,752.92,0.0
gfx950,256,2151,3072,2048,ck,0,3,31.9128,a8w8_blockscale_1x128x128_256x128x128x128_16x16_32x32_2x2_8x32x1_8x32x1_1x32x1x8_8_1x1_intrawave_v3,838.01,740.38,0.0
gfx950,256,2332,3072,2048,ck,0,2,32.7746,a8w8_blockscale_1x128x128_256x128x128x128_16x16_32x32_2x2_8x32x1_8x32x1_1x32x1x8_8_1x1_intrawave_v3,889.34,769.68,0.0
gfx950,256,2341,3072,2048,ck,0,0,32.8609,a8w8_blockscale_1x128x128_256x128x128x128_16x16_32x32_2x2_8x32x1_8x32x1_1x32x1x8_8_1x1_intrawave_v3,895.79,774.52,0.0
gfx950,256,3072,3072,2048,cktile,31,0,40.1955,a8w8_blockscale_cktile_192x256x128_4x2x1_16x16x128_intrawave_0x1x0_3_aqrm,961.67,782.61,0.0
gfx950,256,3073,3072,2048,cktile,30,0,40.4203,a8w8_blockscale_cktile_192x256x128_4x2x1_16x16x128_intrawave_0x1x0_2_aqrm,956.63,778.46,0.0
gfx950,256,3089,3072,2048,cktile,30,0,40.3201,a8w8_blockscale_cktile_192x256x128_4x2x1_16x16x128_intrawave_0x1x0_2_aqrm,964.0,783.64,0.0
gfx950,256,3110,3072,2048,cktile,12,0,40.5743,a8w8_blockscale_cktile_192x256x128_4x2x1_16x16x128_intrawave_0x1x0_1_aqrm,964.47,782.97,0.0
gfx950,256,3137,3072,2048,cktile,32,0,40.4789,a8w8_blockscale_cktile_192x256x128_4x2x1_16x16x128_intrawave_0x1x0_4_aqrm,975.14,790.28,0.0
gfx950,256,3613,3072,2048,cktile,12,0,41.2202,a8w8_blockscale_cktile_192x256x128_4x2x1_16x16x128_intrawave_0x1x0_1_aqrm,1102.91,870.67,0.0
gfx950,256,4096,3072,2048,ck,0,0,49.1462,a8w8_blockscale_1x128x128_256x128x128x128_16x16_32x32_2x2_8x32x1_8x32x1_1x32x1x8_8_1x1_intrawave_v3,1047.57,809.89,0.0
gfx950,256,4097,3072,2048,ck,0,0,57.6018,a8w8_blockscale_1x128x128_256x128x128x128_16x16_32x32_2x2_8x32x1_8x32x1_1x32x1x8_8_1x1_intrawave_v3,894.98,691.89,0.0
gfx950,256,4109,3072,2048,ck,0,0,57.6144,a8w8_blockscale_1x128x128_256x128x128x128_16x16_32x32_2x2_8x32x1_8x32x1_1x32x1x8_8_1x1_intrawave_v3,895.21,691.75,0.0
gfx950,256,4143,3072,2048,ck,0,0,57.2904,a8w8_blockscale_1x128x128_256x128x128x128_16x16_32x32_2x2_8x32x1_8x32x1_1x32x1x8_8_1x1_intrawave_v3,895.75,691.27,0.0
gfx950,256,4345,3072,2048,ck,0,0,57.9367,a8w8_blockscale_1x128x128_256x128x128x128_16x16_32x32_2x2_8x32x1_8x32x1_1x32x1x8_8_1x1_intrawave_v3,934.41,715.87,0.0
gfx950,256,4413,3072,2048,ck,0,2,58.0843,a8w8_blockscale_1x128x128_256x128x128x128_16x16_32x32_2x2_8x32x1_8x32x1_1x32x1x8_8_1x1_intrawave_v3,955.16,730.07,0.0
gfx950,256,5121,3072,2048,ck,0,0,61.0055,a8w8_blockscale_1x128x128_256x128x128x128_16x16_32x32_2x2_8x32x1_8x32x1_1x32x1x8_8_1x1_intrawave_v3,1056.25,790.79,0.0
gfx950,256,5123,3072,2048,ck,0,0,61.4492,a8w8_blockscale_1x128x128_256x128x128x128_16x16_32x32_2x2_8x32x1_8x32x1_1x32x1x8_8_1x1_intrawave_v3,1049.03,785.35,0.0
gfx950,256,5133,3072,2048,ck,0,0,60.8059,a8w8_blockscale_1x128x128_256x128x128x128_16x16_32x32_2x2_8x32x1_8x32x1_1x32x1x8_8_1x1_intrawave_v3,1038.35,777.15,0.0
gfx950,256,5185,3072,2048,ck,0,0,61.044,a8w8_blockscale_1x128x128_256x128x128x128_16x16_32x32_2x2_8x32x1_8x32x1_1x32x1x8_8_1x1_intrawave_v3,1068.78,798.88,0.0
gfx950,256,5191,3072,2048,ck,0,2,60.9563,a8w8_blockscale_1x128x128_256x128x128x128_16x16_32x32_2x2_8x32x1_8x32x1_1x32x1x8_8_1x1_intrawave_v3,1056.58,789.64,0.0
gfx950,256,6146,3072,2048,ck,0,2,73.3608,a8w8_blockscale_1x128x128_256x128x128x128_16x16_32x32_2x2_8x32x1_8x32x1_1x32x1x8_8_1x1_intrawave_v3,1047.19,766.96,0.0
gfx950,256,6147,3072,2048,ck,0,1,73.3156,a8w8_blockscale_1x128x128_256x128x128x128_16x16_32x32_2x2_8x32x1_8x32x1_1x32x1x8_8_1x1_intrawave_v3,1040.02,761.7,0.0
gfx950,256,6155,3072,2048,ck,0,0,73.4474,a8w8_blockscale_1x128x128_256x128x128x128_16x16_32x32_2x2_8x32x1_8x32x1_1x32x1x8_8_1x1_intrawave_v3,1054.47,772.16,0.0
gfx950,256,6377,3072,2048,ck,0,0,74.0364,a8w8_blockscale_1x128x128_256x128x128x128_16x16_32x32_2x2_8x32x1_8x32x1_1x32x1x8_8_1x1_intrawave_v3,1060.96,773.91,0.0
gfx950,256,6401,3072,2048,ck,0,2,74.6004,a8w8_blockscale_1x128x128_256x128x128x128_16x16_32x32_2x2_8x32x1_8x32x1_1x32x1x8_8_1x1_intrawave_v3,1064.56,776.23,0.0
gfx950,256,7121,3072,2048,cktile,27,0,78.3094,a8w8_blockscale_cktile_192x256x128_4x2x1_16x16x128_intrawave_0x1x0_2,1144.22,825.27,0.0
gfx950,256,7169,3072,2048,cktile,27,0,78.4633,a8w8_blockscale_cktile_192x256x128_4x2x1_16x16x128_intrawave_0x1x0_2,1149.67,828.67,0.0
gfx950,256,7170,3072,2048,cktile,29,0,79.025,a8w8_blockscale_cktile_192x256x128_4x2x1_16x16x128_intrawave_0x1x0_4,1141.66,822.88,0.0
gfx950,256,7176,3072,2048,cktile,29,0,78.677,a8w8_blockscale_cktile_192x256x128_4x2x1_16x16x128_intrawave_0x1x0_4,1147.67,827.14,0.0
gfx950,256,7177,3072,2048,cktile,11,0,78.3698,a8w8_blockscale_cktile_192x256x128_4x2x1_16x16x128_intrawave_0x1x0_1,1152.33,830.49,0.0
gfx950,256,7185,3072,2048,cktile,11,0,78.5513,a8w8_blockscale_cktile_192x256x128_4x2x1_16x16x128_intrawave_0x1x0_1,1150.94,829.41,0.0
gfx950,256,7206,3072,2048,cktile,29,0,78.6219,a8w8_blockscale_cktile_192x256x128_4x2x1_16x16x128_intrawave_0x1x0_4,1153.27,830.85,0.0
gfx950,256,7217,3072,2048,cktile,27,0,78.0248,a8w8_blockscale_cktile_192x256x128_4x2x1_16x16x128_intrawave_0x1x0_2,1163.87,838.36,0.0
gfx950,256,7257,3072,2048,cktile,27,0,78.2906,a8w8_blockscale_cktile_192x256x128_4x2x1_16x16x128_intrawave_0x1x0_2,1166.35,839.7,0.0
gfx950,256,7265,3072,2048,cktile,27,0,78.2828,a8w8_blockscale_cktile_192x256x128_4x2x1_16x16x128_intrawave_0x1x0_2,1167.75,840.62,0.0
gfx950,256,7393,3072,2048,cktile,11,0,78.5482,a8w8_blockscale_cktile_192x256x128_4x2x1_16x16x128_intrawave_0x1x0_1,1184.31,851.13,0.0
gfx950,256,7461,3072,2048,cktile,27,0,78.7745,a8w8_blockscale_cktile_192x256x128_4x2x1_16x16x128_intrawave_0x1x0_2,1191.77,855.76,0.0
gfx950,256,7634,3072,2048,cktile,27,0,79.0953,a8w8_blockscale_cktile_192x256x128_4x2x1_16x16x128_intrawave_0x1x0_2,1214.46,870.21,0.0
gfx950,256,8129,3072,2048,ck,0,3,89.8209,a8w8_blockscale_1x128x128_256x128x128x128_16x16_32x32_2x2_8x32x1_8x32x1_1x32x1x8_8_1x1_intrawave_v3,1123.11,800.27,0.0
gfx950,256,8192,3072,2048,ck,0,0,87.8777,a8w8_blockscale_1x128x128_256x128x128x128_16x16_32x32_2x2_8x32x1_8x32x1_1x32x1x8_8_1x1_intrawave_v3,1172.98,835.26,0.0
gfx950,256,1,4608,2048,ck,8,3,6.3553,a8w8_blockscale_1x128x128_256x16x64x256_16x16_16x16_1x1_16x16x1_16x16x1_1x16x1x16_4_1x1_intrawave_v1,2.97,1486.7,0.0
gfx950,256,2,4608,2048,ck,8,3,6.8349,a8w8_blockscale_1x128x128_256x16x64x256_16x16_16x16_1x1_16x16x1_16x16x1_1x16x1x16_4_1x1_intrawave_v1,5.52,1384.03,0.0
gfx950,256,4,4608,2048,ck,8,3,6.9301,a8w8_blockscale_1x128x128_256x16x64x256_16x16_16x16_1x1_16x16x1_16x16x1_1x16x1x16_4_1x1_intrawave_v1,10.89,1368.27,0.0
gfx950,256,8,4608,2048,ck,8,3,6.9649,a8w8_blockscale_1x128x128_256x16x64x256_16x16_16x16_1x1_16x16x1_16x16x1_1x16x1x16_4_1x1_intrawave_v1,21.68,1367.9,0.0
gfx950,256,16,4608,2048,ck,8,3,7.276,a8w8_blockscale_1x128x128_256x16x64x256_16x16_16x16_1x1_16x16x1_16x16x1_1x16x1x16_4_1x1_intrawave_v1,41.5,1321.8,0.0
gfx950,256,24,4608,2048,ck,8,2,7.8193,a8w8_blockscale_1x128x128_256x16x64x256_16x16_16x16_1x1_16x16x1_16x16x1_1x16x1x16_4_1x1_intrawave_v1,57.93,1241.48,0.0
gfx950,256,32,4608,2048,ck,8,2,8.0506,a8w8_blockscale_1x128x128_256x16x64x256_16x16_16x16_1x1_16x16x1_16x16x1_1x16x1x16_4_1x1_intrawave_v1,75.02,1217.01,0.0
gfx950,256,40,4608,2048,ck,8,2,8.4593,a8w8_blockscale_1x128x128_256x16x64x256_16x16_16x16_1x1_16x16x1_16x16x1_1x16x1x16_4_1x1_intrawave_v1,89.25,1168.86,0.0
gfx950,256,48,4608,2048,ck,8,0,8.2538,a8w8_blockscale_1x128x128_256x16x64x256_16x16_16x16_1x1_16x16x1_16x16x1_1x16x1x16_4_1x1_intrawave_v1,109.76,1208.88,0.0
gfx950,256,56,4608,2048,ck,8,2,9.3776,a8w8_blockscale_1x128x128_256x16x64x256_16x16_16x16_1x1_16x16x1_16x16x1_1x16x1x16_4_1x1_intrawave_v1,112.71,1073.62,0.0
gfx950,256,64,4608,2048,ck,18,2,9.4721,a8w8_blockscale_1x128x128_256x64x64x256_16x16_32x32_1x1_16x16x1_16x16x1_1x32x1x8_8_1x1_intrawave_v1,127.22,1069.86,0.0
gfx950,256,72,4608,2048,ck,7,0,9.6826,a8w8_blockscale_1x128x128_256x16x128x256_16x16_16x16_1x2_16x16x1_16x16x1_1x16x1x16_8_1x2_intrawave_v1,140.35,1058.41,0.0
gfx950,256,80,4608,2048,ck,7,0,9.6589,a8w8_blockscale_1x128x128_256x16x128x256_16x16_16x16_1x2_16x16x1_16x16x1_1x16x1x16_8_1x2_intrawave_v1,154.78,1059.72,0.0
gfx950,256,88,4608,2048,ck,7,0,9.5949,a8w8_blockscale_1x128x128_256x16x128x256_16x16_16x16_1x2_16x16x1_16x16x1_1x16x1x16_8_1x2_intrawave_v1,173.11,1086.87,0.0
gfx950,256,96,4608,2048,ck,7,0,9.3953,a8w8_blockscale_1x128x128_256x16x128x256_16x16_16x16_1x2_16x16x1_16x16x1_1x16x1x16_8_1x2_intrawave_v1,192.86,1119.55,0.0
gfx950,256,104,4608,2048,ck,7,0,9.5418,a8w8_blockscale_1x128x128_256x16x128x256_16x16_16x16_1x2_16x16x1_16x16x1_1x16x1x16_8_1x2_intrawave_v1,205.72,1111.81,0.0
gfx950,256,112,4608,2048,ck,7,0,9.5734,a8w8_blockscale_1x128x128_256x16x128x256_16x16_16x16_1x2_16x16x1_16x16x1_1x16x1x16_8_1x2_intrawave_v1,220.81,1117.55,0.0
gfx950,256,120,4608,2048,ck,18,3,10.682,a8w8_blockscale_1x128x128_256x64x64x256_16x16_32x32_1x1_16x16x1_16x16x1_1x32x1x8_8_1x1_intrawave_v1,210.77,1003.98,0.0
gfx950,256,128,4608,2048,ck,18,0,9.6152,a8w8_blockscale_1x128x128_256x64x64x256_16x16_32x32_1x1_16x16x1_16x16x1_1x32x1x8_8_1x1_intrawave_v1,251.26,1131.44,0.0
gfx950,256,136,4608,2048,ck,18,3,10.833,a8w8_blockscale_1x128x128_256x64x64x256_16x16_32x32_1x1_16x16x1_16x16x1_1x32x1x8_8_1x1_intrawave_v1,228.2,975.17,0.0
gfx950,256,144,4608,2048,ck,18,0,10.9265,a8w8_blockscale_1x128x128_256x64x64x256_16x16_32x32_1x1_16x16x1_16x16x1_1x32x1x8_8_1x1_intrawave_v1,248.74,1012.14,0.0
gfx950,256,152,4608,2048,ck,18,2,10.966,a8w8_blockscale_1x128x128_256x64x64x256_16x16_32x32_1x1_16x16x1_16x16x1_1x32x1x8_8_1x1_intrawave_v1,253.83,986.45,0.0
gfx950,256,160,4608,2048,ck,12,1,11.012,a8w8_blockscale_1x128x128_256x32x128x256_16x16_32x32_1x1_16x16x1_16x16x1_1x32x1x8_8_1x1_intrawave_v1,265.28,987.31,0.0
gfx950,256,168,4608,2048,ck,18,1,11.0462,a8w8_blockscale_1x128x128_256x64x64x256_16x16_32x32_1x1_16x16x1_16x16x1_1x32x1x8_8_1x1_intrawave_v1,281.14,1004.51,0.0
gfx950,256,176,4608,2048,ck,18,2,11.1051,a8w8_blockscale_1x128x128_256x64x64x256_16x16_32x32_1x1_16x16x1_16x16x1_1x32x1x8_8_1x1_intrawave_v1,295.24,1014.94,0.0
gfx950,256,184,4608,2048,ck,18,3,11.0915,a8w8_blockscale_1x128x128_256x64x64x256_16x16_32x32_1x1_16x16x1_16x16x1_1x32x1x8_8_1x1_intrawave_v1,302.23,1001.65,0.0
gfx950,256,192,4608,2048,ck,18,0,9.7025,a8w8_blockscale_1x128x128_256x64x64x256_16x16_32x32_1x1_16x16x1_16x16x1_1x32x1x8_8_1x1_intrawave_v1,359.01,1149.17,0.0
gfx950,256,200,4608,2048,ck,12,0,12.6931,a8w8_blockscale_1x128x128_256x32x128x256_16x16_32x32_1x1_16x16x1_16x16x1_1x32x1x8_8_1x1_intrawave_v1,297.4,920.97,0.0
gfx950,256,208,4608,2048,ck,12,3,12.4787,a8w8_blockscale_1x128x128_256x32x128x256_16x16_32x32_1x1_16x16x1_16x16x1_1x32x1x8_8_1x1_intrawave_v1,306.7,920.3,0.0
gfx950,256,216,4608,2048,ck,12,0,12.6807,a8w8_blockscale_1x128x128_256x32x128x256_16x16_32x32_1x1_16x16x1_16x16x1_1x32x1x8_8_1x1_intrawave_v1,313.75,913.52,0.0
gfx950,256,224,4608,2048,ck,12,0,11.3387,a8w8_blockscale_1x128x128_256x32x128x256_16x16_32x32_1x1_16x16x1_16x16x1_1x32x1x8_8_1x1_intrawave_v1,360.12,1018.74,0.0
gfx950,256,232,4608,2048,ck,2,0,15.2336,a8w8_blockscale_1x128x128_256x64x128x128_16x16_32x32_1x2_8x32x1_8x32x1_1x32x1x8_8_1x1_intrawave_v3,287.45,791.04,0.0
gfx950,256,240,4608,2048,ck,2,1,15.2812,a8w8_blockscale_1x128x128_256x64x128x128_16x16_32x32_1x2_8x32x1_8x32x1_1x32x1x8_8_1x1_intrawave_v3,293.77,787.35,0.0
gfx950,256,248,4608,2048,ck,2,2,15.3306,a8w8_blockscale_1x128x128_256x64x128x128_16x16_32x32_1x2_8x32x1_8x32x1_1x32x1x8_8_1x1_intrawave_v3,304.64,796.01,0.0
gfx950,256,256,4608,2048,ck,2,0,15.124,a8w8_blockscale_1x128x128_256x64x128x128_16x16_32x32_1x2_8x32x1_8x32x1_1x32x1x8_8_1x1_intrawave_v3,318.49,812.13,0.0
gfx950,256,272,4608,2048,ck,2,3,15.326,a8w8_blockscale_1x128x128_256x64x128x128_16x16_32x32_1x2_8x32x1_8x32x1_1x32x1x8_8_1x1_intrawave_v3,330.83,805.57,0.0
gfx950,256,288,4608,2048,ck,2,2,15.6029,a8w8_blockscale_1x128x128_256x64x128x128_16x16_32x32_1x2_8x32x1_8x32x1_1x32x1x8_8_1x1_intrawave_v3,347.19,809.95,0.0
gfx950,256,304,4608,2048,ck,2,0,15.5062,a8w8_blockscale_1x128x128_256x64x128x128_16x16_32x32_1x2_8x32x1_8x32x1_1x32x1x8_8_1x1_intrawave_v3,370.03,829.44,0.0
gfx950,256,320,4608,2048,ck,2,3,15.3105,a8w8_blockscale_1x128x128_256x64x128x128_16x16_32x32_1x2_8x32x1_8x32x1_1x32x1x8_8_1x1_intrawave_v3,388.92,839.8,0.0
gfx950,256,336,4608,2048,ck,2,0,15.5759,a8w8_blockscale_1x128x128_256x64x128x128_16x16_32x32_1x2_8x32x1_8x32x1_1x32x1x8_8_1x1_intrawave_v3,407.15,848.87,0.0
gfx950,256,352,4608,2048,ck,2,0,15.5381,a8w8_blockscale_1x128x128_256x64x128x128_16x16_32x32_1x2_8x32x1_8x32x1_1x32x1x8_8_1x1_intrawave_v3,427.58,862.53,0.0
gfx950,256,368,4608,2048,ck,2,2,15.5717,a8w8_blockscale_1x128x128_256x64x128x128_16x16_32x32_1x2_8x32x1_8x32x1_1x32x1x8_8_1x1_intrawave_v3,443.86,867.96,0.0
gfx950,256,384,4608,2048,ck,2,1,15.4267,a8w8_blockscale_1x128x128_256x64x128x128_16x16_32x32_1x2_8x32x1_8x32x1_1x32x1x8_8_1x1_intrawave_v3,467.18,887.11,0.0
gfx950,256,400,4608,2048,ck,2,0,15.5191,a8w8_blockscale_1x128x128_256x64x128x128_16x16_32x32_1x2_8x32x1_8x32x1_1x32x1x8_8_1x1_intrawave_v3,486.48,898.43,0.0
gfx950,256,416,4608,2048,ck,2,0,15.7919,a8w8_blockscale_1x128x128_256x64x128x128_16x16_32x32_1x2_8x32x1_8x32x1_1x32x1x8_8_1x1_intrawave_v3,497.2,894.32,0.0
gfx950,256,432,4608,2048,ck,2,0,15.7696,a8w8_blockscale_1x128x128_256x64x128x128_16x16_32x32_1x2_8x32x1_8x32x1_1x32x1x8_8_1x1_intrawave_v3,517.05,907.01,0.0
gfx950,256,448,4608,2048,ck,2,0,15.5744,a8w8_blockscale_1x128x128_256x64x128x128_16x16_32x32_1x2_8x32x1_8x32x1_1x32x1x8_8_1x1_intrawave_v3,542.92,929.95,0.0
gfx950,256,464,4608,2048,ck,3,3,19.2612,a8w8_blockscale_1x128x128_256x64x64x128_16x16_32x32_1x1_8x32x1_8x32x1_1x32x1x8_8_1x1_intrawave_v3,450.16,753.73,0.0
gfx950,256,480,4608,2048,ck,3,1,19.609,a8w8_blockscale_1x128x128_256x64x64x128_16x16_32x32_1x1_8x32x1_8x32x1_1x32x1x8_8_1x1_intrawave_v3,459.98,753.65,0.0
gfx950,256,496,4608,2048,ck,3,1,19.8807,a8w8_blockscale_1x128x128_256x64x64x128_16x16_32x32_1x1_8x32x1_8x32x1_1x32x1x8_8_1x1_intrawave_v3,466.32,748.38,0.0
gfx950,256,512,4608,2048,ck,0,0,19.2189,a8w8_blockscale_1x128x128_256x128x128x128_16x16_32x32_2x2_8x32x1_8x32x1_1x32x1x8_8_1x1_intrawave_v3,502.82,791.11,0.0
gfx950,256,664,4608,2048,ck,0,3,20.1662,a8w8_blockscale_1x128x128_256x128x128x128_16x16_32x32_2x2_8x32x1_8x32x1_1x32x1x8_8_1x1_intrawave_v3,616.07,831.57,0.0
gfx950,256,762,4608,2048,ck,0,0,20.8808,a8w8_blockscale_1x128x128_256x128x128x128_16x16_32x32_2x2_8x32x1_8x32x1_1x32x1x8_8_1x1_intrawave_v3,688.78,863.01,0.0
gfx950,256,902,4608,2048,ck,2,3,28.8761,a8w8_blockscale_1x128x128_256x64x128x128_16x16_32x32_1x2_8x32x1_8x32x1_1x32x1x8_8_1x1_intrawave_v3,585.89,674.43,0.0
gfx950,256,961,4608,2048,ck,2,0,28.5866,a8w8_blockscale_1x128x128_256x64x128x128_16x16_32x32_1x2_8x32x1_8x32x1_1x32x1x8_8_1x1_intrawave_v3,634.5,708.79,0.0
gfx950,256,1000,4608,2048,ck,2,1,29.2289,a8w8_blockscale_1x128x128_256x64x128x128_16x16_32x32_1x2_8x32x1_8x32x1_1x32x1x8_8_1x1_intrawave_v3,641.37,703.45,0.0
gfx950,256,1001,4608,2048,ck,2,1,29.1919,a8w8_blockscale_1x128x128_256x64x128x128_16x16_32x32_1x2_8x32x1_8x32x1_1x32x1x8_8_1x1_intrawave_v3,647.03,709.33,0.0
gfx950,256,1002,4608,2048,ck,2,2,29.0219,a8w8_blockscale_1x128x128_256x64x128x128_16x16_32x32_1x2_8x32x1_8x32x1_1x32x1x8_8_1x1_intrawave_v3,644.1,705.8,0.0
gfx950,256,1003,4608,2048,ck,2,0,29.1992,a8w8_blockscale_1x128x128_256x64x128x128_16x16_32x32_1x2_8x32x1_8x32x1_1x32x1x8_8_1x1_intrawave_v3,648.34,710.12,0.0
gfx950,256,1015,4608,2048,ck,2,3,29.3925,a8w8_blockscale_1x128x128_256x64x128x128_16x16_32x32_1x2_8x32x1_8x32x1_1x32x1x8_8_1x1_intrawave_v3,644.16,701.75,0.0
gfx950,256,1023,4608,2048,ck,2,3,29.4318,a8w8_blockscale_1x128x128_256x64x128x128_16x16_32x32_1x2_8x32x1_8x32x1_1x32x1x8_8_1x1_intrawave_v3,650.75,706.42,0.0
gfx950,256,1024,4608,2048,ck,2,0,29.1878,a8w8_blockscale_1x128x128_256x64x128x128_16x16_32x32_1x2_8x32x1_8x32x1_1x32x1x8_8_1x1_intrawave_v3,658.58,714.61,0.0
gfx950,256,1025,4608,2048,ck,2,0,29.3852,a8w8_blockscale_1x128x128_256x64x128x128_16x16_32x32_1x2_8x32x1_8x32x1_1x32x1x8_8_1x1_intrawave_v3,657.07,712.65,0.0
gfx950,256,1032,4608,2048,ck,2,3,29.2909,a8w8_blockscale_1x128x128_256x64x128x128_16x16_32x32_1x2_8x32x1_8x32x1_1x32x1x8_8_1x1_intrawave_v3,662.83,716.71,0.0
gfx950,256,1038,4608,2048,ck,2,3,29.1473,a8w8_blockscale_1x128x128_256x64x128x128_16x16_32x32_1x2_8x32x1_8x32x1_1x32x1x8_8_1x1_intrawave_v3,658.52,710.2,0.0
gfx950,256,1087,4608,2048,ck,2,1,29.0962,a8w8_blockscale_1x128x128_256x64x128x128_16x16_32x32_1x2_8x32x1_8x32x1_1x32x1x8_8_1x1_intrawave_v3,688.79,727.9,0.0
gfx950,256,1255,4608,2048,ck,2,2,30.0889,a8w8_blockscale_1x128x128_256x64x128x128_16x16_32x32_1x2_8x32x1_8x32x1_1x32x1x8_8_1x1_intrawave_v3,785.05,781.28,0.0
gfx950,256,1351,4608,2048,ck,0,2,31.8172,a8w8_blockscale_1x128x128_256x128x128x128_16x16_32x32_2x2_8x32x1_8x32x1_1x32x1x8_8_1x1_intrawave_v3,797.13,770.73,0.0
gfx950,256,1376,4608,2048,ck,0,2,31.7469,a8w8_blockscale_1x128x128_256x128x128x128_16x16_32x32_2x2_8x32x1_8x32x1_1x32x1x8_8_1x1_intrawave_v3,812.43,780.06,0.0
gfx950,256,1380,4608,2048,ck,0,0,31.8452,a8w8_blockscale_1x128x128_256x128x128x128_16x16_32x32_2x2_8x32x1_8x32x1_1x32x1x8_8_1x1_intrawave_v3,817.91,784.47,0.0
gfx950,256,1391,4608,2048,ck,0,0,31.7637,a8w8_blockscale_1x128x128_256x128x128x128_16x16_32x32_2x2_8x32x1_8x32x1_1x32x1x8_8_1x1_intrawave_v3,821.26,785.32,0.0
gfx950,256,1710,4608,2048,ck,0,0,33.5089,a8w8_blockscale_1x128x128_256x128x128x128_16x16_32x32_2x2_8x32x1_8x32x1_1x32x1x8_8_1x1_intrawave_v3,963.18,856.45,0.0
gfx950,256,1808,4608,2048,cktile,32,0,39.5284,a8w8_blockscale_cktile_192x256x128_4x2x1_16x16x128_intrawave_0x1x0_4_aqrm,863.3,753.95,0.0
gfx950,256,1809,4608,2048,cktile,12,0,39.7855,a8w8_blockscale_cktile_192x256x128_4x2x1_16x16x128_intrawave_0x1x0_1_aqrm,858.2,749.36,0.0
gfx950,256,1870,4608,2048,cktile,30,0,39.7532,a8w8_blockscale_cktile_192x256x128_4x2x1_16x16x128_intrawave_0x1x0_2_aqrm,887.85,767.26,0.0
gfx950,256,1967,4608,2048,cktile,30,0,39.9817,a8w8_blockscale_cktile_192x256x128_4x2x1_16x16x128_intrawave_0x1x0_2_aqrm,928.57,790.2,0.0
gfx950,256,1970,4608,2048,cktile,32,0,40.1421,a8w8_blockscale_cktile_192x256x128_4x2x1_16x16x128_intrawave_0x1x0_4_aqrm,926.27,787.88,0.0
gfx950,256,2000,4608,2048,cktile,32,0,39.9867,a8w8_blockscale_cktile_192x256x128_4x2x1_16x16x128_intrawave_0x1x0_4_aqrm,944.03,799.4,0.0
gfx950,256,2001,4608,2048,cktile,30,0,39.9111,a8w8_blockscale_cktile_192x256x128_4x2x1_16x16x128_intrawave_0x1x0_2_aqrm,946.29,801.19,0.0
gfx950,256,2016,4608,2048,cktile,12,0,39.964,a8w8_blockscale_cktile_192x256x128_4x2x1_16x16x128_intrawave_0x1x0_1_aqrm,952.13,804.36,0.0
gfx950,256,2017,4608,2048,cktile,32,0,40.0623,a8w8_blockscale_cktile_192x256x128_4x2x1_16x16x128_intrawave_0x1x0_4_aqrm,950.26,802.67,0.0
gfx950,256,2046,4608,2048,cktile,32,0,40.0914,a8w8_blockscale_cktile_192x256x128_4x2x1_16x16x128_intrawave_0x1x0_4_aqrm,963.22,810.23,0.0
gfx950,256,2048,4608,2048,cktile,32,0,39.776,a8w8_blockscale_cktile_192x256x128_4x2x1_16x16x128_intrawave_0x1x0_4_aqrm,971.81,817.22,0.0
gfx950,256,2050,4608,2048,cktile,31,0,40.1895,a8w8_blockscale_cktile_192x256x128_4x2x1_16x16x128_intrawave_0x1x0_3_aqrm,962.75,809.38,0.0
gfx950,256,2081,4608,2048,cktile,31,0,40.2504,a8w8_blockscale_cktile_192x256x128_4x2x1_16x16x128_intrawave_0x1x0_3_aqrm,975.83,816.83,0.0
gfx950,256,2095,4608,2048,cktile,31,0,40.0983,a8w8_blockscale_cktile_192x256x128_4x2x1_16x16x128_intrawave_0x1x0_3_aqrm,986.12,823.86,0.0
gfx950,256,2154,4608,2048,cktile,12,0,40.5494,a8w8_blockscale_cktile_192x256x128_4x2x1_16x16x128_intrawave_0x1x0_1_aqrm,1002.61,831.08,0.0
gfx950,256,2159,4608,2048,cktile,31,0,40.3224,a8w8_blockscale_cktile_192x256x128_4x2x1_16x16x128_intrawave_0x1x0_3_aqrm,1010.6,837.16,0.0
gfx950,256,2162,4608,2048,cktile,32,0,40.457,a8w8_blockscale_cktile_192x256x128_4x2x1_16x16x128_intrawave_0x1x0_4_aqrm,1008.64,835.21,0.0
gfx950,256,2165,4608,2048,cktile,30,0,40.4729,a8w8_blockscale_cktile_192x256x128_4x2x1_16x16x128_intrawave_0x1x0_2_aqrm,1009.64,835.71,0.0
gfx950,256,2251,4608,2048,cktile,31,0,40.5658,a8w8_blockscale_cktile_192x256x128_4x2x1_16x16x128_intrawave_0x1x0_3_aqrm,1047.34,857.68,0.0
gfx950,256,2252,4608,2048,cktile,30,0,40.6061,a8w8_blockscale_cktile_192x256x128_4x2x1_16x16x128_intrawave_0x1x0_2_aqrm,1046.77,857.11,0.0
gfx950,256,2255,4608,2048,cktile,32,0,40.5164,a8w8_blockscale_cktile_192x256x128_4x2x1_16x16x128_intrawave_0x1x0_4_aqrm,1050.48,859.84,0.0
gfx950,256,2317,4608,2048,cktile,31,0,41.0107,a8w8_blockscale_cktile_192x256x128_4x2x1_16x16x128_intrawave_0x1x0_3_aqrm,1066.35,866.5,0.0
gfx950,256,2694,4608,2048,ck,0,0,57.5386,a8w8_blockscale_1x128x128_256x128x128x128_16x16_32x32_2x2_8x32x1_8x32x1_1x32x1x8_8_1x1_intrawave_v3,881.73,689.85,0.0
gfx950,256,2715,4608,2048,ck,0,0,57.209,a8w8_blockscale_1x128x128_256x128x128x128_16x16_32x32_2x2_8x32x1_8x32x1_1x32x1x8_8_1x1_intrawave_v3,895.73,699.52,0.0
gfx950,256,2819,4608,2048,ck,0,3,57.7727,a8w8_blockscale_1x128x128_256x128x128x128_16x16_32x32_2x2_8x32x1_8x32x1_1x32x1x8_8_1x1_intrawave_v3,912.5,706.42,0.0
gfx950,256,2853,4608,2048,ck,0,0,57.6038,a8w8_blockscale_1x128x128_256x128x128x128_16x16_32x32_2x2_8x32x1_8x32x1_1x32x1x8_8_1x1_intrawave_v3,934.81,721.71,0.0
gfx950,256,2914,4608,2048,ck,0,3,57.7799,a8w8_blockscale_1x128x128_256x128x128x128_16x16_32x32_2x2_8x32x1_8x32x1_1x32x1x8_8_1x1_intrawave_v3,948.84,729.06,0.0
gfx950,256,2974,4608,2048,ck,0,0,58.4507,a8w8_blockscale_1x128x128_256x128x128x128_16x16_32x32_2x2_8x32x1_8x32x1_1x32x1x8_8_1x1_intrawave_v3,954.38,730.01,0.0
gfx950,256,3000,4608,2048,ck,0,0,58.3851,a8w8_blockscale_1x128x128_256x128x128x128_16x16_32x32_2x2_8x32x1_8x32x1_1x32x1x8_8_1x1_intrawave_v3,963.61,735.67,0.0
gfx950,256,3001,4608,2048,ck,0,1,58.1671,a8w8_blockscale_1x128x128_256x128x128x128_16x16_32x32_2x2_8x32x1_8x32x1_1x32x1x8_8_1x1_intrawave_v3,968.92,739.68,0.0
gfx950,256,3072,4608,2048,ck,0,3,57.7222,a8w8_blockscale_1x128x128_256x128x128x128_16x16_32x32_2x2_8x32x1_8x32x1_1x32x1x8_8_1x1_intrawave_v3,996.65,757.0,0.0
gfx950,256,3073,4608,2048,ck,0,3,59.3327,a8w8_blockscale_1x128x128_256x128x128x128_16x16_32x32_2x2_8x32x1_8x32x1_1x32x1x8_8_1x1_intrawave_v3,973.64,739.47,0.0
gfx950,256,3077,4608,2048,ck,0,0,59.3279,a8w8_blockscale_1x128x128_256x128x128x128_16x16_32x32_2x2_8x32x1_8x32x1_1x32x1x8_8_1x1_intrawave_v3,974.93,740.25,0.0
gfx950,256,3078,4608,2048,ck,0,0,59.261,a8w8_blockscale_1x128x128_256x128x128x128_16x16_32x32_2x2_8x32x1_8x32x1_1x32x1x8_8_1x1_intrawave_v3,980.33,744.3,0.0
gfx950,256,3086,4608,2048,ck,0,3,58.6999,a8w8_blockscale_1x128x128_256x128x128x128_16x16_32x32_2x2_8x32x1_8x32x1_1x32x1x8_8_1x1_intrawave_v3,987.62,749.42,0.0
gfx950,256,3089,4608,2048,ck,0,0,58.8946,a8w8_blockscale_1x128x128_256x128x128x128_16x16_32x32_2x2_8x32x1_8x32x1_1x32x1x8_8_1x1_intrawave_v3,989.95,751.03,0.0
gfx950,256,3118,4608,2048,ck,0,1,59.1651,a8w8_blockscale_1x128x128_256x128x128x128_16x16_32x32_2x2_8x32x1_8x32x1_1x32x1x8_8_1x1_intrawave_v3,977.95,740.45,0.0
gfx950,256,3138,4608,2048,ck,0,0,59.0531,a8w8_blockscale_1x128x128_256x128x128x128_16x16_32x32_2x2_8x32x1_8x32x1_1x32x1x8_8_1x1_intrawave_v3,991.44,749.65,0.0
gfx950,256,3154,4608,2048,ck,0,0,59.4547,a8w8_blockscale_1x128x128_256x128x128x128_16x16_32x32_2x2_8x32x1_8x32x1_1x32x1x8_8_1x1_intrawave_v3,988.95,746.97,0.0
gfx950,256,3289,4608,2048,ck,0,2,60.0495,a8w8_blockscale_1x128x128_256x128x128x128_16x16_32x32_2x2_8x32x1_8x32x1_1x32x1x8_8_1x1_intrawave_v3,1020.7,764.31,0.0
gfx950,256,3437,4608,2048,ck,0,3,60.4919,a8w8_blockscale_1x128x128_256x128x128x128_16x16_32x32_2x2_8x32x1_8x32x1_1x32x1x8_8_1x1_intrawave_v3,1056.85,784.46,0.0
gfx950,256,3617,4608,2048,ck,0,2,71.0956,a8w8_blockscale_1x128x128_256x128x128x128_16x16_32x32_2x2_8x32x1_8x32x1_1x32x1x8_8_1x1_intrawave_v3,948.11,696.89,0.0
gfx950,256,3620,4608,2048,ck,0,2,71.592,a8w8_blockscale_1x128x128_256x128x128x128_16x16_32x32_2x2_8x32x1_8x32x1_1x32x1x8_8_1x1_intrawave_v3,947.53,696.35,0.0
gfx950,256,3669,4608,2048,ck,0,3,70.7028,a8w8_blockscale_1x128x128_256x128x128x128_16x16_32x32_2x2_8x32x1_8x32x1_1x32x1x8_8_1x1_intrawave_v3,961.38,704.75,0.0
gfx950,256,3824,4608,2048,ck,0,1,72.33,a8w8_blockscale_1x128x128_256x128x128x128_16x16_32x32_2x2_8x32x1_8x32x1_1x32x1x8_8_1x1_intrawave_v3,994.47,723.52,0.0
gfx950,256,3858,4608,2048,ck,0,0,72.6622,a8w8_blockscale_1x128x128_256x128x128x128_16x16_32x32_2x2_8x32x1_8x32x1_1x32x1x8_8_1x1_intrawave_v3,992.62,721.03,0.0
gfx950,256,3906,4608,2048,ck,0,3,72.6564,a8w8_blockscale_1x128x128_256x128x128x128_16x16_32x32_2x2_8x32x1_8x32x1_1x32x1x8_8_1x1_intrawave_v3,1004.74,728.23,0.0
gfx950,256,4000,4608,2048,ck,0,3,73.6616,a8w8_blockscale_1x128x128_256x128x128x128_16x16_32x32_2x2_8x32x1_8x32x1_1x32x1x8_8_1x1_intrawave_v3,1018.59,735.21,0.0
gfx950,256,4004,4608,2048,ck,0,2,73.382,a8w8_blockscale_1x128x128_256x128x128x128_16x16_32x32_2x2_8x32x1_8x32x1_1x32x1x8_8_1x1_intrawave_v3,1016.72,733.73,0.0
gfx950,256,4100,4608,2048,ck,0,2,74.4,a8w8_blockscale_1x128x128_256x128x128x128_16x16_32x32_2x2_8x32x1_8x32x1_1x32x1x8_8_1x1_intrawave_v3,1038.62,746.5,0.0
gfx950,256,4108,4608,2048,ck,0,0,74.0868,a8w8_blockscale_1x128x128_256x128x128x128_16x16_32x32_2x2_8x32x1_8x32x1_1x32x1x8_8_1x1_intrawave_v3,1039.61,746.96,0.0
gfx950,256,4121,4608,2048,ck,0,1,74.088,a8w8_blockscale_1x128x128_256x128x128x128_16x16_32x32_2x2_8x32x1_8x32x1_1x32x1x8_8_1x1_intrawave_v3,1046.45,751.48,0.0
gfx950,256,4123,4608,2048,ck,0,0,74.1304,a8w8_blockscale_1x128x128_256x128x128x128_16x16_32x32_2x2_8x32x1_8x32x1_1x32x1x8_8_1x1_intrawave_v3,1046.45,751.41,0.0
gfx950,256,4149,4608,2048,ck,0,1,74.2008,a8w8_blockscale_1x128x128_256x128x128x128_16x16_32x32_2x2_8x32x1_8x32x1_1x32x1x8_8_1x1_intrawave_v3,1049.81,753.03,0.0
gfx950,256,4204,4608,2048,ck,0,0,74.9044,a8w8_blockscale_1x128x128_256x128x128x128_16x16_32x32_2x2_8x32x1_8x32x1_1x32x1x8_8_1x1_intrawave_v3,1056.46,756.13,0.0
gfx950,256,4223,4608,2048,ck,0,2,74.1532,a8w8_blockscale_1x128x128_256x128x128x128_16x16_32x32_2x2_8x32x1_8x32x1_1x32x1x8_8_1x1_intrawave_v3,1069.24,764.71,0.0
gfx950,256,4229,4608,2048,ck,0,3,75.0872,a8w8_blockscale_1x128x128_256x128x128x128_16x16_32x32_2x2_8x32x1_8x32x1_1x32x1x8_8_1x1_intrawave_v3,1058.69,756.98,0.0
gfx950,256,4379,4608,2048,ck,0,0,74.9964,a8w8_blockscale_1x128x128_256x128x128x128_16x16_32x32_2x2_8x32x1_8x32x1_1x32x1x8_8_1x1_intrawave_v3,1102.06,783.53,0.0
gfx950,256,4410,4608,2048,ck,0,2,74.5204,a8w8_blockscale_1x128x128_256x128x128x128_16x16_32x32_2x2_8x32x1_8x32x1_1x32x1x8_8_1x1_intrawave_v3,1088.79,773.22,0.0
gfx950,256,4498,4608,2048,cktile,29,0,78.3772,a8w8_blockscale_cktile_192x256x128_4x2x1_16x16x128_intrawave_0x1x0_4,1083.18,766.84,0.0
gfx950,256,4585,4608,2048,cktile,11,0,78.3401,a8w8_blockscale_cktile_192x256x128_4x2x1_16x16x128_intrawave_0x1x0_1,1104.66,779.71,0.0
gfx950,256,4586,4608,2048,cktile,11,0,78.5904,a8w8_blockscale_cktile_192x256x128_4x2x1_16x16x128_intrawave_0x1x0_1,1101.38,777.37,0.0
gfx950,256,4723,4608,2048,cktile,27,0,78.6932,a8w8_blockscale_cktile_192x256x128_4x2x1_16x16x128_intrawave_0x1x0_2,1132.8,795.97,0.0
gfx950,256,4743,4608,2048,cktile,29,0,78.2656,a8w8_blockscale_cktile_192x256x128_4x2x1_16x16x128_intrawave_0x1x0_4,1143.81,803.19,0.0
gfx950,256,4822,4608,2048,cktile,29,0,78.612,a8w8_blockscale_cktile_192x256x128_4x2x1_16x16x128_intrawave_0x1x0_4,1157.74,810.97,0.0
gfx950,256,4898,4608,2048,cktile,28,0,78.4055,a8w8_blockscale_cktile_192x256x128_4x2x1_16x16x128_intrawave_0x1x0_3,1179.08,824.03,0.0
gfx950,256,4936,4608,2048,cktile,11,0,79.0807,a8w8_blockscale_cktile_192x256x128_4x2x1_16x16x128_intrawave_0x1x0_1,1178.09,822.4,0.0
gfx950,256,4992,4608,2048,cktile,29,0,79.4023,a8w8_blockscale_cktile_192x256x128_4x2x1_16x16x128_intrawave_0x1x0_4,1186.63,827.02,0.0
gfx950,256,5000,4608,2048,cktile,29,0,79.3036,a8w8_blockscale_cktile_192x256x128_4x2x1_16x16x128_intrawave_0x1x0_4,1190.01,829.18,0.0
gfx950,256,5001,4608,2048,cktile,27,0,79.2738,a8w8_blockscale_cktile_192x256x128_4x2x1_16x16x128_intrawave_0x1x0_2,1190.69,829.64,0.0
gfx950,256,5002,4608,2048,cktile,27,0,79.6354,a8w8_blockscale_cktile_192x256x128_4x2x1_16x16x128_intrawave_0x1x0_2,1185.52,826.01,0.0
gfx950,256,5003,4608,2048,cktile,28,0,79.1482,a8w8_blockscale_cktile_192x256x128_4x2x1_16x16x128_intrawave_0x1x0_3,1193.06,831.24,0.0
gfx950,256,5004,4608,2048,cktile,29,0,79.5955,a8w8_blockscale_cktile_192x256x128_4x2x1_16x16x128_intrawave_0x1x0_4,1186.59,826.71,0.0
gfx950,256,5005,4608,2048,cktile,27,0,79.4359,a8w8_blockscale_cktile_192x256x128_4x2x1_16x16x128_intrawave_0x1x0_2,1189.21,828.51,0.0
gfx950,256,5006,4608,2048,cktile,29,0,79.6159,a8w8_blockscale_cktile_192x256x128_4x2x1_16x16x128_intrawave_0x1x0_4,1186.76,826.78,0.0
gfx950,256,5010,4608,2048,cktile,28,0,79.4047,a8w8_blockscale_cktile_192x256x128_4x2x1_16x16x128_intrawave_0x1x0_3,1190.87,829.55,0.0
gfx950,256,5011,4608,2048,cktile,27,0,79.3574,a8w8_blockscale_cktile_192x256x128_4x2x1_16x16x128_intrawave_0x1x0_2,1191.82,830.18,0.0
gfx950,256,5012,4608,2048,cktile,28,0,79.5319,a8w8_blockscale_cktile_192x256x128_4x2x1_16x16x128_intrawave_0x1x0_3,1189.44,828.5,0.0
gfx950,256,5026,4608,2048,cktile,11,0,79.6139,a8w8_blockscale_cktile_192x256x128_4x2x1_16x16x128_intrawave_0x1x0_1,1191.53,829.63,0.0
gfx950,256,5028,4608,2048,cktile,28,0,79.3801,a8w8_blockscale_cktile_192x256x128_4x2x1_16x16x128_intrawave_0x1x0_3,1195.52,832.36,0.0
gfx950,256,5030,4608,2048,cktile,27,0,79.5042,a8w8_blockscale_cktile_192x256x128_4x2x1_16x16x128_intrawave_0x1x0_2,1194.13,831.34,0.0
gfx950,256,5031,4608,2048,cktile,27,0,79.5134,a8w8_blockscale_cktile_192x256x128_4x2x1_16x16x128_intrawave_0x1x0_2,1194.23,831.39,0.0
gfx950,256,5060,4608,2048,cktile,27,0,79.6019,a8w8_blockscale_cktile_192x256x128_4x2x1_16x16x128_intrawave_0x1x0_2,1199.77,834.57,0.0
gfx950,256,5062,4608,2048,cktile,28,0,79.0722,a8w8_blockscale_cktile_192x256x128_4x2x1_16x16x128_intrawave_0x1x0_3,1208.29,840.44,0.0
gfx950,256,5063,4608,2048,cktile,28,0,79.5051,a8w8_blockscale_cktile_192x256x128_4x2x1_16x16x128_intrawave_0x1x0_3,1201.95,836.01,0.0
gfx950,256,5091,4608,2048,cktile,28,0,79.1522,a8w8_blockscale_cktile_192x256x128_4x2x1_16x16x128_intrawave_0x1x0_3,1213.98,843.72,0.0
gfx950,256,5105,4608,2048,cktile,11,0,78.6499,a8w8_blockscale_cktile_192x256x128_4x2x1_16x16x128_intrawave_0x1x0_1,1225.1,851.11,0.0
gfx950,256,5120,4608,2048,cktile,11,0,79.5963,a8w8_blockscale_cktile_192x256x128_4x2x1_16x16x128_intrawave_0x1x0_1,1214.09,843.12,0.0
gfx950,256,5122,4608,2048,cktile,27,0,79.1025,a8w8_blockscale_cktile_192x256x128_4x2x1_16x16x128_intrawave_0x1x0_2,1222.14,848.66,0.0
gfx950,256,5123,4608,2048,cktile,28,0,79.3277,a8w8_blockscale_cktile_192x256x128_4x2x1_16x16x128_intrawave_0x1x0_3,1218.91,846.4,0.0
gfx950,256,5124,4608,2048,cktile,29,0,79.1984,a8w8_blockscale_cktile_192x256x128_4x2x1_16x16x128_intrawave_0x1x0_4,1221.14,847.92,0.0
gfx950,256,5127,4608,2048,cktile,27,0,79.2514,a8w8_blockscale_cktile_192x256x128_4x2x1_16x16x128_intrawave_0x1x0_2,1221.04,847.78,0.0
gfx950,256,5177,4608,2048,cktile,28,0,78.4813,a8w8_blockscale_cktile_192x256x128_4x2x1_16x16x128_intrawave_0x1x0_3,1245.04,863.27,0.0
gfx950,256,5183,4608,2048,cktile,27,0,79.0705,a8w8_blockscale_cktile_192x256x128_4x2x1_16x16x128_intrawave_0x1x0_2,1237.2,857.7,0.0
gfx950,256,5252,4608,2048,cktile,28,0,78.8596,a8w8_blockscale_cktile_192x256x128_4x2x1_16x16x128_intrawave_0x1x0_3,1257.02,869.85,0.0
gfx950,256,5255,4608,2048,cktile,29,0,79.1791,a8w8_blockscale_cktile_192x256x128_4x2x1_16x16x128_intrawave_0x1x0_4,1252.66,866.76,0.0
gfx950,256,5361,4608,2048,cktile,27,0,78.8469,a8w8_blockscale_cktile_192x256x128_4x2x1_16x16x128_intrawave_0x1x0_2,1283.32,885.56,0.0
gfx950,256,5427,4608,2048,ck,0,1,96.541,a8w8_blockscale_1x128x128_256x128x128x128_16x16_32x32_2x2_8x32x1_8x32x1_1x32x1x8_8_1x1_intrawave_v3,1058.76,729.4,0.0
gfx950,256,5471,4608,2048,ck,0,0,96.7707,a8w8_blockscale_1x128x128_256x128x128x128_16x16_32x32_2x2_8x32x1_8x32x1_1x32x1x8_8_1x1_intrawave_v3,1067.08,734.34,0.0
gfx950,256,5534,4608,2048,ck,0,0,96.857,a8w8_blockscale_1x128x128_256x128x128x128_16x16_32x32_2x2_8x32x1_8x32x1_1x32x1x8_8_1x1_intrawave_v3,1078.4,741.01,0.0
gfx950,256,5564,4608,2048,ck,0,0,97.0718,a8w8_blockscale_1x128x128_256x128x128x128_16x16_32x32_2x2_8x32x1_8x32x1_1x32x1x8_8_1x1_intrawave_v3,1079.84,741.47,0.0
gfx950,256,5671,4608,2048,ck,0,3,97.3522,a8w8_blockscale_1x128x128_256x128x128x128_16x16_32x32_2x2_8x32x1_8x32x1_1x32x1x8_8_1x1_intrawave_v3,1093.25,748.83,0.0
gfx950,256,5927,4608,2048,ck,0,3,98.7002,a8w8_blockscale_1x128x128_256x128x128x128_16x16_32x32_2x2_8x32x1_8x32x1_1x32x1x8_8_1x1_intrawave_v3,1126.59,767.37,0.0
gfx950,256,5954,4608,2048,ck,0,0,99.4391,a8w8_blockscale_1x128x128_256x128x128x128_16x16_32x32_2x2_8x32x1_8x32x1_1x32x1x8_8_1x1_intrawave_v3,1130.12,769.35,0.0
gfx950,256,6000,4608,2048,ck,0,0,99.0227,a8w8_blockscale_1x128x128_256x128x128x128_16x16_32x32_2x2_8x32x1_8x32x1_1x32x1x8_8_1x1_intrawave_v3,1143.64,777.81,0.0
gfx950,256,6002,4608,2048,ck,0,1,99.3462,a8w8_blockscale_1x128x128_256x128x128x128_16x16_32x32_2x2_8x32x1_8x32x1_1x32x1x8_8_1x1_intrawave_v3,1136.32,772.8,0.0
gfx950,256,6146,4608,2048,ck,0,0,101.1402,a8w8_blockscale_1x128x128_256x128x128x128_16x16_32x32_2x2_8x32x1_8x32x1_1x32x1x8_8_1x1_intrawave_v3,1121.4,760.47,0.0
gfx950,256,6194,4608,2048,ck,0,2,100.391,a8w8_blockscale_1x128x128_256x128x128x128_16x16_32x32_2x2_8x32x1_8x32x1_1x32x1x8_8_1x1_intrawave_v3,1144.33,775.3,0.0
gfx950,256,6227,4608,2048,ck,0,0,101.4274,a8w8_blockscale_1x128x128_256x128x128x128_16x16_32x32_2x2_8x32x1_8x32x1_1x32x1x8_8_1x1_intrawave_v3,1133.79,767.67,0.0
gfx950,256,6229,4608,2048,ck,0,2,101.1814,a8w8_blockscale_1x128x128_256x128x128x128_16x16_32x32_2x2_8x32x1_8x32x1_1x32x1x8_8_1x1_intrawave_v3,1141.89,773.13,0.0
gfx950,256,6234,4608,2048,ck,0,3,101.4214,a8w8_blockscale_1x128x128_256x128x128x128_16x16_32x32_2x2_8x32x1_8x32x1_1x32x1x8_8_1x1_intrawave_v3,1134.06,767.75,0.0
gfx950,256,6246,4608,2048,ck,0,3,101.2994,a8w8_blockscale_1x128x128_256x128x128x128_16x16_32x32_2x2_8x32x1_8x32x1_1x32x1x8_8_1x1_intrawave_v3,1156.51,782.77,0.0
gfx950,256,6304,4608,2048,ck,0,3,109.0467,a8w8_blockscale_1x128x128_256x128x128x128_16x16_32x32_2x2_8x32x1_8x32x1_1x32x1x8_8_1x1_intrawave_v3,1088.03,735.62,0.0
gfx950,256,6314,4608,2048,ck,0,2,109.4151,a8w8_blockscale_1x128x128_256x128x128x128_16x16_32x32_2x2_8x32x1_8x32x1_1x32x1x8_8_1x1_intrawave_v3,1076.75,727.86,0.0
gfx950,256,6318,4608,2048,ck,0,2,108.8651,a8w8_blockscale_1x128x128_256x128x128x128_16x16_32x32_2x2_8x32x1_8x32x1_1x32x1x8_8_1x1_intrawave_v3,1088.25,735.58,0.0
gfx950,256,6341,4608,2048,ck,0,1,109.5527,a8w8_blockscale_1x128x128_256x128x128x128_16x16_32x32_2x2_8x32x1_8x32x1_1x32x1x8_8_1x1_intrawave_v3,1091.98,737.79,0.0
gfx950,256,6377,4608,2048,ck,0,0,109.0695,a8w8_blockscale_1x128x128_256x128x128x128_16x16_32x32_2x2_8x32x1_8x32x1_1x32x1x8_8_1x1_intrawave_v3,1092.32,737.53,0.0
gfx950,256,6476,4608,2048,ck,0,3,109.5611,a8w8_blockscale_1x128x128_256x128x128x128_16x16_32x32_2x2_8x32x1_8x32x1_1x32x1x8_8_1x1_intrawave_v3,1114.0,750.84,0.0
gfx950,256,6483,4608,2048,ck,0,0,109.2852,a8w8_blockscale_1x128x128_256x128x128x128_16x16_32x32_2x2_8x32x1_8x32x1_1x32x1x8_8_1x1_intrawave_v3,1119.66,754.56,0.0
gfx950,256,6492,4608,2048,ck,0,1,109.0515,a8w8_blockscale_1x128x128_256x128x128x128_16x16_32x32_2x2_8x32x1_8x32x1_1x32x1x8_8_1x1_intrawave_v3,1117.35,752.88,0.0
gfx950,256,6519,4608,2048,ck,0,2,109.6687,a8w8_blockscale_1x128x128_256x128x128x128_16x16_32x32_2x2_8x32x1_8x32x1_1x32x1x8_8_1x1_intrawave_v3,1118.19,753.09,0.0
gfx950,256,6609,4608,2048,ck,0,3,110.2567,a8w8_blockscale_1x128x128_256x128x128x128_16x16_32x32_2x2_8x32x1_8x32x1_1x32x1x8_8_1x1_intrawave_v3,1127.92,758.46,0.0
gfx950,256,6811,4608,2048,cktile,11,0,111.6843,a8w8_blockscale_cktile_192x256x128_4x2x1_16x16x128_intrawave_0x1x0_1,1151.04,771.43,0.0
gfx950,256,6813,4608,2048,cktile,28,0,111.538,a8w8_blockscale_cktile_192x256x128_4x2x1_16x16x128_intrawave_0x1x0_3,1152.89,772.64,0.0
gfx950,256,6818,4608,2048,cktile,11,0,112.1537,a8w8_blockscale_cktile_192x256x128_4x2x1_16x16x128_intrawave_0x1x0_1,1147.4,768.9,0.0
gfx950,256,6830,4608,2048,ck,0,3,111.8979,a8w8_blockscale_1x128x128_256x128x128x128_16x16_32x32_2x2_8x32x1_8x32x1_1x32x1x8_8_1x1_intrawave_v3,1150.26,770.67,0.0
gfx950,256,7001,4608,2048,cktile,27,0,111.9956,a8w8_blockscale_cktile_192x256x128_4x2x1_16x16x128_intrawave_0x1x0_2,1179.86,788.39,0.0
gfx950,256,7025,4608,2048,cktile,11,0,112.7244,a8w8_blockscale_cktile_192x256x128_4x2x1_16x16x128_intrawave_0x1x0_1,1176.25,785.69,0.0
gfx950,256,7121,4608,2048,cktile,11,0,112.4897,a8w8_blockscale_cktile_192x256x128_4x2x1_16x16x128_intrawave_0x1x0_1,1194.81,796.95,0.0
gfx950,256,7169,4608,2048,cktile,27,0,112.8451,a8w8_blockscale_cktile_192x256x128_4x2x1_16x16x128_intrawave_0x1x0_2,1199.08,799.23,0.0
gfx950,256,7177,4608,2048,cktile,27,0,112.3245,a8w8_blockscale_cktile_192x256x128_4x2x1_16x16x128_intrawave_0x1x0_2,1205.98,803.73,0.0
gfx950,256,7217,4608,2048,cktile,29,0,112.3994,a8w8_blockscale_cktile_192x256x128_4x2x1_16x16x128_intrawave_0x1x0_4,1211.9,807.21,0.0
gfx950,256,7223,4608,2048,cktile,27,0,113.4204,a8w8_blockscale_cktile_192x256x128_4x2x1_16x16x128_intrawave_0x1x0_2,1201.98,800.54,0.0
gfx950,256,7238,4608,2048,cktile,27,0,113.0512,a8w8_blockscale_cktile_192x256x128_4x2x1_16x16x128_intrawave_0x1x0_2,1208.41,804.64,0.0
gfx950,256,7246,4608,2048,cktile,29,0,112.9273,a8w8_blockscale_cktile_192x256x128_4x2x1_16x16x128_intrawave_0x1x0_4,1211.08,806.33,0.0
gfx950,256,7249,4608,2048,cktile,27,0,113.1125,a8w8_blockscale_cktile_192x256x128_4x2x1_16x16x128_intrawave_0x1x0_2,1209.59,805.3,0.0
gfx950,256,7316,4608,2048,cktile,11,0,112.5792,a8w8_blockscale_cktile_192x256x128_4x2x1_16x16x128_intrawave_0x1x0_1,1226.56,815.82,0.0
gfx950,256,7393,4608,2048,cktile,27,0,112.4477,a8w8_blockscale_cktile_192x256x128_4x2x1_16x16x128_intrawave_0x1x0_2,1240.92,824.49,0.0
gfx950,256,7491,4608,2048,cktile,27,0,113.4616,a8w8_blockscale_cktile_192x256x128_4x2x1_16x16x128_intrawave_0x1x0_2,1246.13,826.85,0.0
gfx950,256,7558,4608,2048,cktile,27,0,114.1136,a8w8_blockscale_cktile_192x256x128_4x2x1_16x16x128_intrawave_0x1x0_2,1250.09,828.74,0.0
gfx950,256,7650,4608,2048,cktile,29,0,113.2211,a8w8_blockscale_cktile_192x256x128_4x2x1_16x16x128_intrawave_0x1x0_4,1275.28,844.43,0.0
gfx950,256,7753,4608,2048,cktile,27,0,114.0065,a8w8_blockscale_cktile_192x256x128_4x2x1_16x16x128_intrawave_0x1x0_2,1283.55,848.78,0.0
gfx950,256,7774,4608,2048,cktile,27,0,113.6497,a8w8_blockscale_cktile_192x256x128_4x2x1_16x16x128_intrawave_0x1x0_2,1291.07,853.53,0.0
gfx950,256,7815,4608,2048,cktile,29,0,113.5621,a8w8_blockscale_cktile_192x256x128_4x2x1_16x16x128_intrawave_0x1x0_4,1298.88,858.26,0.0
gfx950,256,7834,4608,2048,cktile,29,0,113.4997,a8w8_blockscale_cktile_192x256x128_4x2x1_16x16x128_intrawave_0x1x0_4,1302.75,860.61,0.0
gfx950,256,7836,4608,2048,cktile,11,0,113.5941,a8w8_blockscale_cktile_192x256x128_4x2x1_16x16x128_intrawave_0x1x0_1,1302.0,860.1,0.0
gfx950,256,7871,4608,2048,cktile,28,0,113.5134,a8w8_blockscale_cktile_192x256x128_4x2x1_16x16x128_intrawave_0x1x0_3,1308.75,864.18,0.0
gfx950,256,7899,4608,2048,cktile,11,0,114.5408,a8w8_blockscale_cktile_192x256x128_4x2x1_16x16x128_intrawave_0x1x0_1,1301.62,859.18,0.0
gfx950,256,7913,4608,2048,cktile,28,0,113.5302,a8w8_blockscale_cktile_192x256x128_4x2x1_16x16x128_intrawave_0x1x0_3,1315.53,868.22,0.0
gfx950,256,7930,4608,2048,cktile,29,0,114.0882,a8w8_blockscale_cktile_192x256x128_4x2x1_16x16x128_intrawave_0x1x0_4,1311.91,865.65,0.0
gfx950,256,7961,4608,2048,cktile,28,0,113.4794,a8w8_blockscale_cktile_192x256x128_4x2x1_16x16x128_intrawave_0x1x0_3,1324.11,873.37,0.0
gfx950,256,7963,4608,2048,cktile,11,0,114.0626,a8w8_blockscale_cktile_192x256x128_4x2x1_16x16x128_intrawave_0x1x0_1,1317.67,869.11,0.0
gfx950,256,7974,4608,2048,cktile,28,0,113.8046,a8w8_blockscale_cktile_192x256x128_4x2x1_16x16x128_intrawave_0x1x0_3,1322.48,872.16,0.0
gfx950,256,8016,4608,2048,cktile,28,0,114.4046,a8w8_blockscale_cktile_192x256x128_4x2x1_16x16x128_intrawave_0x1x0_3,1322.47,871.73,0.0
gfx950,256,8017,4608,2048,cktile,11,0,114.1246,a8w8_blockscale_cktile_192x256x128_4x2x1_16x16x128_intrawave_0x1x0_1,1325.88,873.96,0.0
gfx950,256,8103,4608,2048,ck,0,0,128.2281,a8w8_blockscale_1x128x128_256x128x128x128_16x16_32x32_2x2_8x32x1_8x32x1_1x32x1x8_8_1x1_intrawave_v3,1192.71,785.39,0.0
gfx950,256,8128,4608,2048,cktile,11,0,128.0644,a8w8_blockscale_cktile_192x256x128_4x2x1_16x16x128_intrawave_0x1x0_1,1197.92,788.6,0.0
gfx950,256,8129,4608,2048,ck,0,2,127.9,a8w8_blockscale_1x128x128_256x128x128x128_16x16_32x32_2x2_8x32x1_8x32x1_1x32x1x8_8_1x1_intrawave_v3,1195.26,786.84,0.0
gfx950,256,8150,4608,2048,cktile,28,0,128.5159,a8w8_blockscale_cktile_192x256x128_4x2x1_16x16x128_intrawave_0x1x0_3,1196.94,787.75,0.0
gfx950,256,8184,4608,2048,ck,0,0,128.1345,a8w8_blockscale_1x128x128_256x128x128x128_16x16_32x32_2x2_8x32x1_8x32x1_1x32x1x8_8_1x1_intrawave_v3,1205.51,793.09,0.0
gfx950,256,8185,4608,2048,cktile,11,0,128.5215,a8w8_blockscale_cktile_192x256x128_4x2x1_16x16x128_intrawave_0x1x0_1,1202.03,790.79,0.0
gfx950,256,8192,4608,2048,ck,0,3,125.5036,a8w8_blockscale_1x128x128_256x128x128x128_16x16_32x32_2x2_8x32x1_8x32x1_1x32x1x8_8_1x1_intrawave_v3,1225.46,806.14,0.0
gfx950,256,1,6144,2048,ck,8,3,6.347,a8w8_blockscale_1x128x128_256x16x64x256_16x16_16x16_1x1_16x16x1_16x16x1_1x16x1x16_4_1x1_intrawave_v1,3.96,1984.76,0.0
gfx950,256,2,6144,2048,ck,8,3,6.7895,a8w8_blockscale_1x128x128_256x16x64x256_16x16_16x16_1x1_16x16x1_16x16x1_1x16x1x16_4_1x1_intrawave_v1,7.41,1857.51,0.0
gfx950,256,4,6144,2048,ck,8,3,6.8726,a8w8_blockscale_1x128x128_256x16x64x256_16x16_16x16_1x1_16x16x1_16x16x1_1x16x1x16_4_1x1_intrawave_v1,14.65,1839.22,0.0
gfx950,256,8,6144,2048,ck,8,2,7.0198,a8w8_blockscale_1x128x128_256x16x64x256_16x16_16x16_1x1_16x16x1_16x16x1_1x16x1x16_4_1x1_intrawave_v1,28.68,1808.83,0.0
gfx950,256,16,6144,2048,ck,8,2,7.293,a8w8_blockscale_1x128x128_256x16x64x256_16x16_16x16_1x1_16x16x1_16x16x1_1x16x1x16_4_1x1_intrawave_v1,55.21,1756.79,0.0
gfx950,256,24,6144,2048,ck,8,2,7.8497,a8w8_blockscale_1x128x128_256x16x64x256_16x16_16x16_1x1_16x16x1_16x16x1_1x16x1x16_4_1x1_intrawave_v1,76.94,1646.81,0.0
gfx950,256,32,6144,2048,ck,8,0,8.1024,a8w8_blockscale_1x128x128_256x16x64x256_16x16_16x16_1x1_16x16x1_16x16x1_1x16x1x16_4_1x1_intrawave_v1,99.39,1609.61,0.0
gfx950,256,40,6144,2048,ck,8,2,9.2239,a8w8_blockscale_1x128x128_256x16x64x256_16x16_16x16_1x1_16x16x1_16x16x1_1x16x1x16_4_1x1_intrawave_v1,109.13,1426.33,0.0
gfx950,256,48,6144,2048,ck,8,2,9.5749,a8w8_blockscale_1x128x128_256x16x64x256_16x16_16x16_1x1_16x16x1_16x16x1_1x16x1x16_4_1x1_intrawave_v1,126.16,1386.02,0.0
gfx950,256,56,6144,2048,ck,7,0,9.8943,a8w8_blockscale_1x128x128_256x16x128x256_16x16_16x16_1x2_16x16x1_16x16x1_1x16x1x16_8_1x2_intrawave_v1,142.43,1352.87,0.0
gfx950,256,64,6144,2048,ck,18,0,9.5804,a8w8_blockscale_1x128x128_256x64x64x256_16x16_32x32_1x1_16x16x1_16x16x1_1x32x1x8_8_1x1_intrawave_v1,166.66,1396.94,0.0
gfx950,256,72,6144,2048,ck,7,2,9.7252,a8w8_blockscale_1x128x128_256x16x128x256_16x16_16x16_1x2_16x16x1_16x16x1_1x16x1x16_8_1x2_intrawave_v1,185.66,1395.06,0.0
gfx950,256,80,6144,2048,ck,7,2,9.763,a8w8_blockscale_1x128x128_256x16x128x256_16x16_16x16_1x2_16x16x1_16x16x1_1x16x1x16_8_1x2_intrawave_v1,204.8,1396.68,0.0
gfx950,256,88,6144,2048,ck,18,0,10.6638,a8w8_blockscale_1x128x128_256x64x64x256_16x16_32x32_1x1_16x16x1_16x16x1_1x32x1x8_8_1x1_intrawave_v1,207.67,1298.27,0.0
gfx950,256,96,6144,2048,ck,18,3,10.6319,a8w8_blockscale_1x128x128_256x64x64x256_16x16_32x32_1x1_16x16x1_16x16x1_1x32x1x8_8_1x1_intrawave_v1,221.06,1277.28,0.0
gfx950,256,104,6144,2048,ck,18,3,10.6749,a8w8_blockscale_1x128x128_256x64x64x256_16x16_32x32_1x1_16x16x1_16x16x1_1x32x1x8_8_1x1_intrawave_v1,239.11,1285.75,0.0
gfx950,256,112,6144,2048,ck,18,3,10.8609,a8w8_blockscale_1x128x128_256x64x64x256_16x16_32x32_1x1_16x16x1_16x16x1_1x32x1x8_8_1x1_intrawave_v1,254.79,1282.6,0.0
gfx950,256,120,6144,2048,ck,18,1,10.8228,a8w8_blockscale_1x128x128_256x64x64x256_16x16_32x32_1x1_16x16x1_16x16x1_1x32x1x8_8_1x1_intrawave_v1,275.29,1303.86,0.0
gfx950,256,128,6144,2048,ck,18,3,9.7481,a8w8_blockscale_1x128x128_256x64x64x256_16x16_32x32_1x1_16x16x1_16x16x1_1x32x1x8_8_1x1_intrawave_v1,318.1,1423.81,0.0
gfx950,256,136,6144,2048,ck,12,3,12.5743,a8w8_blockscale_1x128x128_256x32x128x256_16x16_32x32_1x1_16x16x1_16x16x1_1x32x1x8_8_1x1_intrawave_v1,264.86,1124.65,0.0
gfx950,256,144,6144,2048,ck,12,2,12.5129,a8w8_blockscale_1x128x128_256x32x128x256_16x16_32x32_1x1_16x16x1_16x16x1_1x32x1x8_8_1x1_intrawave_v1,282.75,1142.83,0.0
gfx950,256,152,6144,2048,ck,12,0,12.9303,a8w8_blockscale_1x128x128_256x32x128x256_16x16_32x32_1x1_16x16x1_16x16x1_1x32x1x8_8_1x1_intrawave_v1,295.83,1141.66,0.0
gfx950,256,160,6144,2048,ck,12,0,11.3121,a8w8_blockscale_1x128x128_256x32x128x256_16x16_32x32_1x1_16x16x1_16x16x1_1x32x1x8_8_1x1_intrawave_v1,333.19,1231.03,0.0
gfx950,256,168,6144,2048,ck,2,2,15.2934,a8w8_blockscale_1x128x128_256x64x128x128_16x16_32x32_1x2_8x32x1_8x32x1_1x32x1x8_8_1x1_intrawave_v3,276.09,978.98,0.0
gfx950,256,176,6144,2048,ck,2,1,15.3889,a8w8_blockscale_1x128x128_256x64x128x128_16x16_32x32_1x2_8x32x1_8x32x1_1x32x1x8_8_1x1_intrawave_v3,286.26,976.32,0.0
gfx950,256,184,6144,2048,ck,2,0,15.3815,a8w8_blockscale_1x128x128_256x64x128x128_16x16_32x32_1x2_8x32x1_8x32x1_1x32x1x8_8_1x1_intrawave_v3,301.04,989.55,0.0
gfx950,256,192,6144,2048,ck,2,0,15.144,a8w8_blockscale_1x128x128_256x64x128x128_16x16_32x32_1x2_8x32x1_8x32x1_1x32x1x8_8_1x1_intrawave_v3,318.1,1009.6,0.0
gfx950,256,200,6144,2048,ck,2,0,15.2591,a8w8_blockscale_1x128x128_256x64x128x128_16x16_32x32_1x2_8x32x1_8x32x1_1x32x1x8_8_1x1_intrawave_v3,329.85,1012.52,0.0
gfx950,256,208,6144,2048,ck,2,2,15.3153,a8w8_blockscale_1x128x128_256x64x128x128_16x16_32x32_1x2_8x32x1_8x32x1_1x32x1x8_8_1x1_intrawave_v3,341.19,1014.52,0.0
gfx950,256,216,6144,2048,ck,2,1,15.343,a8w8_blockscale_1x128x128_256x64x128x128_16x16_32x32_1x2_8x32x1_8x32x1_1x32x1x8_8_1x1_intrawave_v3,352.98,1018.18,0.0
gfx950,256,224,6144,2048,ck,2,0,15.308,a8w8_blockscale_1x128x128_256x64x128x128_16x16_32x32_1x2_8x32x1_8x32x1_1x32x1x8_8_1x1_intrawave_v3,365.03,1022.75,0.0
gfx950,256,232,6144,2048,ck,2,3,15.4067,a8w8_blockscale_1x128x128_256x64x128x128_16x16_32x32_1x2_8x32x1_8x32x1_1x32x1x8_8_1x1_intrawave_v3,378.25,1030.68,0.0
gfx950,256,240,6144,2048,ck,2,1,15.4401,a8w8_blockscale_1x128x128_256x64x128x128_16x16_32x32_1x2_8x32x1_8x32x1_1x32x1x8_8_1x1_intrawave_v3,389.37,1033.0,0.0
gfx950,256,248,6144,2048,ck,2,0,15.4546,a8w8_blockscale_1x128x128_256x64x128x128_16x16_32x32_1x2_8x32x1_8x32x1_1x32x1x8_8_1x1_intrawave_v3,403.84,1044.24,0.0
gfx950,256,256,6144,2048,ck,2,3,15.341,a8w8_blockscale_1x128x128_256x64x128x128_16x16_32x32_1x2_8x32x1_8x32x1_1x32x1x8_8_1x1_intrawave_v3,417.9,1054.27,0.0
gfx950,256,272,6144,2048,ck,2,3,15.5912,a8w8_blockscale_1x128x128_256x64x128x128_16x16_32x32_1x2_8x32x1_8x32x1_1x32x1x8_8_1x1_intrawave_v3,435.57,1048.81,0.0
gfx950,256,288,6144,2048,ck,2,1,15.6974,a8w8_blockscale_1x128x128_256x64x128x128_16x16_32x32_1x2_8x32x1_8x32x1_1x32x1x8_8_1x1_intrawave_v3,459.29,1059.02,0.0
gfx950,256,304,6144,2048,ck,2,1,15.7901,a8w8_blockscale_1x128x128_256x64x128x128_16x16_32x32_1x2_8x32x1_8x32x1_1x32x1x8_8_1x1_intrawave_v3,481.78,1066.84,0.0
gfx950,256,320,6144,2048,ck,2,3,15.6623,a8w8_blockscale_1x128x128_256x64x128x128_16x16_32x32_1x2_8x32x1_8x32x1_1x32x1x8_8_1x1_intrawave_v3,513.03,1093.86,0.0
gfx950,256,336,6144,2048,ck,3,0,19.0875,a8w8_blockscale_1x128x128_256x64x64x128_16x16_32x32_1x1_8x32x1_8x32x1_1x32x1x8_8_1x1_intrawave_v3,440.78,907.01,0.0
gfx950,256,352,6144,2048,ck,3,0,19.2148,a8w8_blockscale_1x128x128_256x64x64x128_16x16_32x32_1x1_8x32x1_8x32x1_1x32x1x8_8_1x1_intrawave_v3,461.02,917.48,0.0
gfx950,256,368,6144,2048,ck,3,0,19.4876,a8w8_blockscale_1x128x128_256x64x64x128_16x16_32x32_1x1_8x32x1_8x32x1_1x32x1x8_8_1x1_intrawave_v3,474.04,914.12,0.0
gfx950,256,384,6144,2048,ck,0,0,19.2194,a8w8_blockscale_1x128x128_256x128x128x128_16x16_32x32_2x2_8x32x1_8x32x1_1x32x1x8_8_1x1_intrawave_v3,501.67,938.99,0.0
gfx950,256,400,6144,2048,ck,0,3,19.6511,a8w8_blockscale_1x128x128_256x128x128x128_16x16_32x32_2x2_8x32x1_8x32x1_1x32x1x8_8_1x1_intrawave_v3,510.05,928.11,0.0
gfx950,256,416,6144,2048,ck,0,0,19.8178,a8w8_blockscale_1x128x128_256x128x128x128_16x16_32x32_2x2_8x32x1_8x32x1_1x32x1x8_8_1x1_intrawave_v3,525.48,930.93,0.0
gfx950,256,432,6144,2048,ck,0,0,20.0016,a8w8_blockscale_1x128x128_256x128x128x128_16x16_32x32_2x2_8x32x1_8x32x1_1x32x1x8_8_1x1_intrawave_v3,542.65,937.2,0.0
gfx950,256,448,6144,2048,ck,0,0,20.1215,a8w8_blockscale_1x128x128_256x128x128x128_16x16_32x32_2x2_8x32x1_8x32x1_1x32x1x8_8_1x1_intrawave_v3,555.39,936.25,0.0
gfx950,256,464,6144,2048,ck,0,0,20.1931,a8w8_blockscale_1x128x128_256x128x128x128_16x16_32x32_2x2_8x32x1_8x32x1_1x32x1x8_8_1x1_intrawave_v3,575.97,948.77,0.0
gfx950,256,480,6144,2048,ck,0,3,20.265,a8w8_blockscale_1x128x128_256x128x128x128_16x16_32x32_2x2_8x32x1_8x32x1_1x32x1x8_8_1x1_intrawave_v3,591.4,952.94,0.0
gfx950,256,496,6144,2048,ck,0,0,20.4727,a8w8_blockscale_1x128x128_256x128x128x128_16x16_32x32_2x2_8x32x1_8x32x1_1x32x1x8_8_1x1_intrawave_v3,604.99,954.5,0.0
gfx950,256,512,6144,2048,ck,0,0,19.5536,a8w8_blockscale_1x128x128_256x128x128x128_16x16_32x32_2x2_8x32x1_8x32x1_1x32x1x8_8_1x1_intrawave_v3,658.29,1017.86,0.0
gfx950,256,664,6144,2048,ck,2,3,28.4898,a8w8_blockscale_1x128x128_256x64x128x128_16x16_32x32_1x2_8x32x1_8x32x1_1x32x1x8_8_1x1_intrawave_v3,584.87,773.59,0.0
gfx950,256,762,6144,2048,ck,2,1,28.3956,a8w8_blockscale_1x128x128_256x64x128x128_16x16_32x32_1x2_8x32x1_8x32x1_1x32x1x8_8_1x1_intrawave_v3,669.25,820.38,0.0
gfx950,256,902,6144,2048,ck,2,2,30.454,a8w8_blockscale_1x128x128_256x64x128x128_16x16_32x32_1x2_8x32x1_8x32x1_1x32x1x8_8_1x1_intrawave_v3,736.05,827.31,0.0
gfx950,256,961,6144,2048,ck,2,1,30.33,a8w8_blockscale_1x128x128_256x64x128x128_16x16_32x32_1x2_8x32x1_8x32x1_1x32x1x8_8_1x1_intrawave_v3,793.38,864.74,0.0
gfx950,256,1000,6144,2048,ck,2,1,30.992,a8w8_blockscale_1x128x128_256x64x128x128_16x16_32x32_1x2_8x32x1_8x32x1_1x32x1x8_8_1x1_intrawave_v3,811.98,868.54,0.0
gfx950,256,1001,6144,2048,ck,2,3,30.6992,a8w8_blockscale_1x128x128_256x64x128x128_16x16_32x32_1x2_8x32x1_8x32x1_1x32x1x8_8_1x1_intrawave_v3,810.14,866.17,0.0
gfx950,256,1002,6144,2048,ck,2,3,30.806,a8w8_blockscale_1x128x128_256x64x128x128_16x16_32x32_1x2_8x32x1_8x32x1_1x32x1x8_8_1x1_intrawave_v3,807.08,862.5,0.0
gfx950,256,1003,6144,2048,ck,2,1,30.7388,a8w8_blockscale_1x128x128_256x64x128x128_16x16_32x32_1x2_8x32x1_8x32x1_1x32x1x8_8_1x1_intrawave_v3,817.46,873.19,0.0
gfx950,256,1015,6144,2048,ck,2,1,31.0524,a8w8_blockscale_1x128x128_256x64x128x128_16x16_32x32_1x2_8x32x1_8x32x1_1x32x1x8_8_1x1_intrawave_v3,810.59,861.07,0.0
gfx950,256,1023,6144,2048,ck,2,3,30.9916,a8w8_blockscale_1x128x128_256x64x128x128_16x16_32x32_1x2_8x32x1_8x32x1_1x32x1x8_8_1x1_intrawave_v3,811.02,858.4,0.0
gfx950,256,1024,6144,2048,ck,2,2,30.6768,a8w8_blockscale_1x128x128_256x64x128x128_16x16_32x32_1x2_8x32x1_8x32x1_1x32x1x8_8_1x1_intrawave_v3,831.2,879.36,0.0
gfx950,256,1025,6144,2048,ck,0,3,32.2886,a8w8_blockscale_1x128x128_256x128x128x128_16x16_32x32_2x2_8x32x1_8x32x1_1x32x1x8_8_1x1_intrawave_v3,792.09,837.61,0.0
gfx950,256,1032,6144,2048,ck,0,2,32.0645,a8w8_blockscale_1x128x128_256x128x128x128_16x16_32x32_2x2_8x32x1_8x32x1_1x32x1x8_8_1x1_intrawave_v3,801.01,844.39,0.0
gfx950,256,1038,6144,2048,ck,0,1,32.1751,a8w8_blockscale_1x128x128_256x128x128x128_16x16_32x32_2x2_8x32x1_8x32x1_1x32x1x8_8_1x1_intrawave_v3,795.4,836.24,0.0
gfx950,256,1087,6144,2048,ck,0,3,32.6312,a8w8_blockscale_1x128x128_256x128x128x128_16x16_32x32_2x2_8x32x1_8x32x1_1x32x1x8_8_1x1_intrawave_v3,835.37,860.13,0.0
gfx950,256,1255,6144,2048,ck,0,0,33.3137,a8w8_blockscale_1x128x128_256x128x128x128_16x16_32x32_2x2_8x32x1_8x32x1_1x32x1x8_8_1x1_intrawave_v3,948.05,917.78,0.0
gfx950,256,1351,6144,2048,cktile,30,0,39.5413,a8w8_blockscale_cktile_192x256x128_4x2x1_16x16x128_intrawave_0x1x0_2_aqrm,859.84,808.04,0.0
gfx950,256,1376,6144,2048,cktile,12,0,39.6015,a8w8_blockscale_cktile_192x256x128_4x2x1_16x16x128_intrawave_0x1x0_1_aqrm,874.42,815.86,0.0
gfx950,256,1380,6144,2048,cktile,12,0,39.601,a8w8_blockscale_cktile_192x256x128_4x2x1_16x16x128_intrawave_0x1x0_1_aqrm,876.97,817.32,0.0
gfx950,256,1391,6144,2048,cktile,30,0,39.8736,a8w8_blockscale_cktile_192x256x128_4x2x1_16x16x128_intrawave_0x1x0_2_aqrm,877.92,815.68,0.0
gfx950,256,1710,6144,2048,cktile,31,0,40.14,a8w8_blockscale_cktile_192x256x128_4x2x1_16x16x128_intrawave_0x1x0_3_aqrm,1072.09,924.2,0.0
gfx950,256,1808,6144,2048,cktile,12,0,40.9107,a8w8_blockscale_cktile_192x256x128_4x2x1_16x16x128_intrawave_0x1x0_1_aqrm,1112.17,941.13,0.0
gfx950,256,1809,6144,2048,cktile,31,0,40.973,a8w8_blockscale_cktile_192x256x128_4x2x1_16x16x128_intrawave_0x1x0_3_aqrm,1111.1,940.05,0.0
gfx950,256,1870,6144,2048,cktile,30,0,41.3834,a8w8_blockscale_cktile_192x256x128_4x2x1_16x16x128_intrawave_0x1x0_2_aqrm,1137.17,951.86,0.0
gfx950,256,1967,6144,2048,ck,0,1,49.369,a8w8_blockscale_1x128x128_256x128x128x128_16x16_32x32_2x2_8x32x1_8x32x1_1x32x1x8_8_1x1_intrawave_v3,986.89,813.05,0.0
gfx950,256,1970,6144,2048,ck,0,0,49.6078,a8w8_blockscale_1x128x128_256x128x128x128_16x16_32x32_2x2_8x32x1_8x32x1_1x32x1x8_8_1x1_intrawave_v3,999.37,822.95,0.0
gfx950,256,2000,6144,2048,ck,0,1,49.8078,a8w8_blockscale_1x128x128_256x128x128x128_16x16_32x32_2x2_8x32x1_8x32x1_1x32x1x8_8_1x1_intrawave_v3,1006.81,825.25,0.0
gfx950,256,2001,6144,2048,ck,0,2,49.9498,a8w8_blockscale_1x128x128_256x128x128x128_16x16_32x32_2x2_8x32x1_8x32x1_1x32x1x8_8_1x1_intrawave_v3,999.0,818.72,0.0
gfx950,256,2016,6144,2048,ck,0,1,49.7786,a8w8_blockscale_1x128x128_256x128x128x128_16x16_32x32_2x2_8x32x1_8x32x1_1x32x1x8_8_1x1_intrawave_v3,1007.54,823.84,0.0
gfx950,256,2017,6144,2048,ck,0,1,49.6194,a8w8_blockscale_1x128x128_256x128x128x128_16x16_32x32_2x2_8x32x1_8x32x1_1x32x1x8_8_1x1_intrawave_v3,1010.89,826.46,0.0
gfx950,256,2046,6144,2048,ck,0,0,50.3894,a8w8_blockscale_1x128x128_256x128x128x128_16x16_32x32_2x2_8x32x1_8x32x1_1x32x1x8_8_1x1_intrawave_v3,1021.83,831.81,0.0
gfx950,256,2048,6144,2048,ck,0,1,49.451,a8w8_blockscale_1x128x128_256x128x128x128_16x16_32x32_2x2_8x32x1_8x32x1_1x32x1x8_8_1x1_intrawave_v3,1036.16,843.23,0.0
gfx950,256,2050,6144,2048,ck,0,0,57.593,a8w8_blockscale_1x128x128_256x128x128x128_16x16_32x32_2x2_8x32x1_8x32x1_1x32x1x8_8_1x1_intrawave_v3,892.07,725.75,0.0
gfx950,256,2081,6144,2048,ck,0,0,58.0914,a8w8_blockscale_1x128x128_256x128x128x128_16x16_32x32_2x2_8x32x1_8x32x1_1x32x1x8_8_1x1_intrawave_v3,900.51,729.35,0.0
gfx950,256,2095,6144,2048,ck,0,0,57.8506,a8w8_blockscale_1x128x128_256x128x128x128_16x16_32x32_2x2_8x32x1_8x32x1_1x32x1x8_8_1x1_intrawave_v3,907.94,733.91,0.0
gfx950,256,2154,6144,2048,ck,0,2,57.8543,a8w8_blockscale_1x128x128_256x128x128x128_16x16_32x32_2x2_8x32x1_8x32x1_1x32x1x8_8_1x1_intrawave_v3,931.42,746.8,0.0
gfx950,256,2159,6144,2048,ck,0,3,58.1308,a8w8_blockscale_1x128x128_256x128x128x128_16x16_32x32_2x2_8x32x1_8x32x1_1x32x1x8_8_1x1_intrawave_v3,931.22,746.14,0.0
gfx950,256,2162,6144,2048,ck,0,1,57.7089,a8w8_blockscale_1x128x128_256x128x128x128_16x16_32x32_2x2_8x32x1_8x32x1_1x32x1x8_8_1x1_intrawave_v3,930.68,745.4,0.0
gfx950,256,2165,6144,2048,ck,0,3,58.3311,a8w8_blockscale_1x128x128_256x128x128x128_16x16_32x32_2x2_8x32x1_8x32x1_1x32x1x8_8_1x1_intrawave_v3,927.34,742.44,0.0
gfx950,256,2251,6144,2048,ck,0,1,58.5291,a8w8_blockscale_1x128x128_256x128x128x128_16x16_32x32_2x2_8x32x1_8x32x1_1x32x1x8_8_1x1_intrawave_v3,965.57,764.52,0.0
gfx950,256,2252,6144,2048,ck,0,2,58.1595,a8w8_blockscale_1x128x128_256x128x128x128_16x16_32x32_2x2_8x32x1_8x32x1_1x32x1x8_8_1x1_intrawave_v3,969.55,767.58,0.0
gfx950,256,2255,6144,2048,ck,0,0,58.5579,a8w8_blockscale_1x128x128_256x128x128x128_16x16_32x32_2x2_8x32x1_8x32x1_1x32x1x8_8_1x1_intrawave_v3,965.95,764.44,0.0
gfx950,256,2317,6144,2048,ck,0,1,59.1579,a8w8_blockscale_1x128x128_256x128x128x128_16x16_32x32_2x2_8x32x1_8x32x1_1x32x1x8_8_1x1_intrawave_v3,979.56,769.4,0.0
gfx950,256,2694,6144,2048,ck,0,3,70.7464,a8w8_blockscale_1x128x128_256x128x128x128_16x16_32x32_2x2_8x32x1_8x32x1_1x32x1x8_8_1x1_intrawave_v3,947.59,715.67,0.0
gfx950,256,2715,6144,2048,ck,0,3,71.5388,a8w8_blockscale_1x128x128_256x128x128x128_16x16_32x32_2x2_8x32x1_8x32x1_1x32x1x8_8_1x1_intrawave_v3,944.33,711.86,0.0
gfx950,256,2819,6144,2048,ck,0,3,71.8784,a8w8_blockscale_1x128x128_256x128x128x128_16x16_32x32_2x2_8x32x1_8x32x1_1x32x1x8_8_1x1_intrawave_v3,984.64,735.56,0.0
gfx950,256,2853,6144,2048,ck,0,3,71.8964,a8w8_blockscale_1x128x128_256x128x128x128_16x16_32x32_2x2_8x32x1_8x32x1_1x32x1x8_8_1x1_intrawave_v3,993.81,740.3,0.0
gfx950,256,2914,6144,2048,ck,0,2,72.0408,a8w8_blockscale_1x128x128_256x128x128x128_16x16_32x32_2x2_8x32x1_8x32x1_1x32x1x8_8_1x1_intrawave_v3,1012.38,750.43,0.0
gfx950,256,2974,6144,2048,ck,0,1,72.2316,a8w8_blockscale_1x128x128_256x128x128x128_16x16_32x32_2x2_8x32x1_8x32x1_1x32x1x8_8_1x1_intrawave_v3,1024.36,755.76,0.0
gfx950,256,3000,6144,2048,ck,0,2,72.3952,a8w8_blockscale_1x128x128_256x128x128x128_16x16_32x32_2x2_8x32x1_8x32x1_1x32x1x8_8_1x1_intrawave_v3,1037.44,763.9,0.0
gfx950,256,3001,6144,2048,ck,0,0,72.1559,a8w8_blockscale_1x128x128_256x128x128x128_16x16_32x32_2x2_8x32x1_8x32x1_1x32x1x8_8_1x1_intrawave_v3,1046.66,770.63,0.0
gfx950,256,3072,6144,2048,ck,0,2,71.3808,a8w8_blockscale_1x128x128_256x128x128x128_16x16_32x32_2x2_8x32x1_8x32x1_1x32x1x8_8_1x1_intrawave_v3,1079.75,790.83,0.0
gfx950,256,3073,6144,2048,ck,0,3,73.454,a8w8_blockscale_1x128x128_256x128x128x128_16x16_32x32_2x2_8x32x1_8x32x1_1x32x1x8_8_1x1_intrawave_v3,1050.93,769.67,0.0
gfx950,256,3077,6144,2048,ck,0,0,73.6167,a8w8_blockscale_1x128x128_256x128x128x128_16x16_32x32_2x2_8x32x1_8x32x1_1x32x1x8_8_1x1_intrawave_v3,1051.87,770.13,0.0
gfx950,256,3078,6144,2048,ck,0,2,73.6804,a8w8_blockscale_1x128x128_256x128x128x128_16x16_32x32_2x2_8x32x1_8x32x1_1x32x1x8_8_1x1_intrawave_v3,1048.37,767.52,0.0
gfx950,256,3086,6144,2048,ck,0,2,73.5304,a8w8_blockscale_1x128x128_256x128x128x128_16x16_32x32_2x2_8x32x1_8x32x1_1x32x1x8_8_1x1_intrawave_v3,1044.49,764.23,0.0
gfx950,256,3089,6144,2048,ck,0,1,73.5824,a8w8_blockscale_1x128x128_256x128x128x128_16x16_32x32_2x2_8x32x1_8x32x1_1x32x1x8_8_1x1_intrawave_v3,1050.28,768.31,0.0
gfx950,256,3118,6144,2048,ck,0,0,73.5236,a8w8_blockscale_1x128x128_256x128x128x128_16x16_32x32_2x2_8x32x1_8x32x1_1x32x1x8_8_1x1_intrawave_v3,1059.47,773.43,0.0
gfx950,256,3138,6144,2048,ck,0,0,73.3812,a8w8_blockscale_1x128x128_256x128x128x128_16x16_32x32_2x2_8x32x1_8x32x1_1x32x1x8_8_1x1_intrawave_v3,1076.17,784.52,0.0
gfx950,256,3154,6144,2048,ck,0,0,73.8468,a8w8_blockscale_1x128x128_256x128x128x128_16x16_32x32_2x2_8x32x1_8x32x1_1x32x1x8_8_1x1_intrawave_v3,1059.61,771.6,0.0
gfx950,256,3289,6144,2048,ck,0,0,75.324,a8w8_blockscale_1x128x128_256x128x128x128_16x16_32x32_2x2_8x32x1_8x32x1_1x32x1x8_8_1x1_intrawave_v3,1089.8,786.49,0.0
gfx950,256,3437,6144,2048,cktile,29,0,78.2722,a8w8_blockscale_cktile_192x256x128_4x2x1_16x16x128_intrawave_0x1x0_4,1105.05,790.26,0.0
gfx950,256,3617,6144,2048,cktile,29,0,78.2732,a8w8_blockscale_cktile_192x256x128_4x2x1_16x16x128_intrawave_0x1x0_4,1162.91,823.22,0.0
gfx950,256,3620,6144,2048,cktile,27,0,78.6588,a8w8_blockscale_cktile_192x256x128_4x2x1_16x16x128_intrawave_0x1x0_2,1158.17,819.73,0.0
gfx950,256,3669,6144,2048,cktile,28,0,78.8115,a8w8_blockscale_cktile_192x256x128_4x2x1_16x16x128_intrawave_0x1x0_3,1171.57,827.06,0.0
gfx950,256,3824,6144,2048,cktile,11,0,78.6686,a8w8_blockscale_cktile_192x256x128_4x2x1_16x16x128_intrawave_0x1x0_1,1223.28,856.81,0.0
gfx950,256,3858,6144,2048,cktile,28,0,79.0699,a8w8_blockscale_cktile_192x256x128_4x2x1_16x16x128_intrawave_0x1x0_3,1227.9,858.62,0.0
gfx950,256,3906,6144,2048,cktile,28,0,79.0369,a8w8_blockscale_cktile_192x256x128_4x2x1_16x16x128_intrawave_0x1x0_3,1243.69,867.69,0.0
gfx950,256,4000,6144,2048,cktile,27,0,79.0639,a8w8_blockscale_cktile_192x256x128_4x2x1_16x16x128_intrawave_0x1x0_2,1273.19,884.44,0.0
gfx950,256,4004,6144,2048,cktile,27,0,79.1247,a8w8_blockscale_cktile_192x256x128_4x2x1_16x16x128_intrawave_0x1x0_2,1273.48,884.48,0.0
gfx950,256,4100,6144,2048,ck,0,2,97.0726,a8w8_blockscale_1x128x128_256x128x128x128_16x16_32x32_2x2_8x32x1_8x32x1_1x32x1x8_8_1x1_intrawave_v3,1045.65,723.19,0.0
gfx950,256,4108,6144,2048,ck,0,3,97.6754,a8w8_blockscale_1x128x128_256x128x128x128_16x16_32x32_2x2_8x32x1_8x32x1_1x32x1x8_8_1x1_intrawave_v3,1057.98,731.46,0.0
gfx950,256,4121,6144,2048,ck,0,2,97.0154,a8w8_blockscale_1x128x128_256x128x128x128_16x16_32x32_2x2_8x32x1_8x32x1_1x32x1x8_8_1x1_intrawave_v3,1054.29,728.5,0.0
gfx950,256,4123,6144,2048,ck,0,2,97.5558,a8w8_blockscale_1x128x128_256x128x128x128_16x16_32x32_2x2_8x32x1_8x32x1_1x32x1x8_8_1x1_intrawave_v3,1056.65,730.07,0.0
gfx950,256,4149,6144,2048,ck,0,0,97.701,a8w8_blockscale_1x128x128_256x128x128x128_16x16_32x32_2x2_8x32x1_8x32x1_1x32x1x8_8_1x1_intrawave_v3,1057.54,729.89,0.0
gfx950,256,4204,6144,2048,ck,0,2,98.2862,a8w8_blockscale_1x128x128_256x128x128x128_16x16_32x32_2x2_8x32x1_8x32x1_1x32x1x8_8_1x1_intrawave_v3,1066.19,734.18,0.0
gfx950,256,4223,6144,2048,ck,0,0,98.6922,a8w8_blockscale_1x128x128_256x128x128x128_16x16_32x32_2x2_8x32x1_8x32x1_1x32x1x8_8_1x1_intrawave_v3,1072.99,738.28,0.0
gfx950,256,4229,6144,2048,ck,0,2,98.0098,a8w8_blockscale_1x128x128_256x128x128x128_16x16_32x32_2x2_8x32x1_8x32x1_1x32x1x8_8_1x1_intrawave_v3,1073.22,738.26,0.0
gfx950,256,4379,6144,2048,ck,0,0,98.6554,a8w8_blockscale_1x128x128_256x128x128x128_16x16_32x32_2x2_8x32x1_8x32x1_1x32x1x8_8_1x1_intrawave_v3,1117.03,763.87,0.0
gfx950,256,4410,6144,2048,ck,0,0,98.2234,a8w8_blockscale_1x128x128_256x128x128x128_16x16_32x32_2x2_8x32x1_8x32x1_1x32x1x8_8_1x1_intrawave_v3,1125.11,768.49,0.0
gfx950,256,4498,6144,2048,ck,0,3,99.0478,a8w8_blockscale_1x128x128_256x128x128x128_16x16_32x32_2x2_8x32x1_8x32x1_1x32x1x8_8_1x1_intrawave_v3,1127.29,767.48,0.0
gfx950,256,4585,6144,2048,ck,0,3,100.3746,a8w8_blockscale_1x128x128_256x128x128x128_16x16_32x32_2x2_8x32x1_8x32x1_1x32x1x8_8_1x1_intrawave_v3,1143.34,776.0,0.0
gfx950,256,4586,6144,2048,ck,0,0,98.9098,a8w8_blockscale_1x128x128_256x128x128x128_16x16_32x32_2x2_8x32x1_8x32x1_1x32x1x8_8_1x1_intrawave_v3,1148.92,779.76,0.0
gfx950,256,4723,6144,2048,ck,0,2,102.113,a8w8_blockscale_1x128x128_256x128x128x128_16x16_32x32_2x2_8x32x1_8x32x1_1x32x1x8_8_1x1_intrawave_v3,1152.06,778.25,0.0
gfx950,256,4743,6144,2048,ck,0,0,108.3703,a8w8_blockscale_1x128x128_256x128x128x128_16x16_32x32_2x2_8x32x1_8x32x1_1x32x1x8_8_1x1_intrawave_v3,1093.21,738.0,0.0
gfx950,256,4822,6144,2048,ck,0,1,109.1907,a8w8_blockscale_1x128x128_256x128x128x128_16x16_32x32_2x2_8x32x1_8x32x1_1x32x1x8_8_1x1_intrawave_v3,1091.14,734.72,0.0
gfx950,256,4898,6144,2048,ck,0,0,109.2735,a8w8_blockscale_1x128x128_256x128x128x128_16x16_32x32_2x2_8x32x1_8x32x1_1x32x1x8_8_1x1_intrawave_v3,1118.62,751.42,0.0
gfx950,256,4936,6144,2048,ck,0,0,109.6119,a8w8_blockscale_1x128x128_256x128x128x128_16x16_32x32_2x2_8x32x1_8x32x1_1x32x1x8_8_1x1_intrawave_v3,1133.26,760.37,0.0
gfx950,256,4992,6144,2048,ck,0,0,107.4375,a8w8_blockscale_1x128x128_256x128x128x128_16x16_32x32_2x2_8x32x1_8x32x1_1x32x1x8_8_1x1_intrawave_v3,1151.36,771.21,0.0
gfx950,256,5000,6144,2048,ck,0,2,110.8227,a8w8_blockscale_1x128x128_256x128x128x128_16x16_32x32_2x2_8x32x1_8x32x1_1x32x1x8_8_1x1_intrawave_v3,1134.52,759.75,0.0
gfx950,256,5001,6144,2048,ck,0,2,109.6063,a8w8_blockscale_1x128x128_256x128x128x128_16x16_32x32_2x2_8x32x1_8x32x1_1x32x1x8_8_1x1_intrawave_v3,1135.5,760.38,0.0
gfx950,256,5002,6144,2048,ck,0,1,110.4099,a8w8_blockscale_1x128x128_256x128x128x128_16x16_32x32_2x2_8x32x1_8x32x1_1x32x1x8_8_1x1_intrawave_v3,1134.71,759.83,0.0
gfx950,256,5003,6144,2048,ck,0,3,109.6995,a8w8_blockscale_1x128x128_256x128x128x128_16x16_32x32_2x2_8x32x1_8x32x1_1x32x1x8_8_1x1_intrawave_v3,1132.7,758.46,0.0
gfx950,256,5004,6144,2048,ck,0,3,110.1943,a8w8_blockscale_1x128x128_256x128x128x128_16x16_32x32_2x2_8x32x1_8x32x1_1x32x1x8_8_1x1_intrawave_v3,1138.52,762.33,0.0
gfx950,256,5005,6144,2048,ck,0,1,109.9615,a8w8_blockscale_1x128x128_256x128x128x128_16x16_32x32_2x2_8x32x1_8x32x1_1x32x1x8_8_1x1_intrawave_v3,1143.06,765.35,0.0
gfx950,256,5006,6144,2048,ck,0,0,109.4623,a8w8_blockscale_1x128x128_256x128x128x128_16x16_32x32_2x2_8x32x1_8x32x1_1x32x1x8_8_1x1_intrawave_v3,1150.9,770.58,0.0
gfx950,256,5010,6144,2048,ck,0,1,110.0019,a8w8_blockscale_1x128x128_256x128x128x128_16x16_32x32_2x2_8x32x1_8x32x1_1x32x1x8_8_1x1_intrawave_v3,1136.45,760.81,0.0
gfx950,256,5011,6144,2048,ck,0,0,110.1555,a8w8_blockscale_1x128x128_256x128x128x128_16x16_32x32_2x2_8x32x1_8x32x1_1x32x1x8_8_1x1_intrawave_v3,1144.8,766.38,0.0
gfx950,256,5012,6144,2048,ck,0,1,109.9991,a8w8_blockscale_1x128x128_256x128x128x128_16x16_32x32_2x2_8x32x1_8x32x1_1x32x1x8_8_1x1_intrawave_v3,1136.28,760.65,0.0
gfx950,256,5026,6144,2048,ck,0,0,110.3523,a8w8_blockscale_1x128x128_256x128x128x128_16x16_32x32_2x2_8x32x1_8x32x1_1x32x1x8_8_1x1_intrawave_v3,1144.32,765.71,0.0
gfx950,256,5028,6144,2048,ck,0,3,109.8383,a8w8_blockscale_1x128x128_256x128x128x128_16x16_32x32_2x2_8x32x1_8x32x1_1x32x1x8_8_1x1_intrawave_v3,1135.13,759.52,0.0
gfx950,256,5030,6144,2048,ck,0,3,110.2883,a8w8_blockscale_1x128x128_256x128x128x128_16x16_32x32_2x2_8x32x1_8x32x1_1x32x1x8_8_1x1_intrawave_v3,1141.18,763.53,0.0
gfx950,256,5031,6144,2048,ck,0,3,110.6215,a8w8_blockscale_1x128x128_256x128x128x128_16x16_32x32_2x2_8x32x1_8x32x1_1x32x1x8_8_1x1_intrawave_v3,1127.61,754.42,0.0
gfx950,256,5060,6144,2048,ck,0,3,110.1103,a8w8_blockscale_1x128x128_256x128x128x128_16x16_32x32_2x2_8x32x1_8x32x1_1x32x1x8_8_1x1_intrawave_v3,1148.88,768.0,0.0
gfx950,256,5062,6144,2048,ck,0,3,110.1595,a8w8_blockscale_1x128x128_256x128x128x128_16x16_32x32_2x2_8x32x1_8x32x1_1x32x1x8_8_1x1_intrawave_v3,1151.65,769.8,0.0
gfx950,256,5063,6144,2048,ck,0,2,109.8907,a8w8_blockscale_1x128x128_256x128x128x128_16x16_32x32_2x2_8x32x1_8x32x1_1x32x1x8_8_1x1_intrawave_v3,1145.21,765.48,0.0
gfx950,256,5091,6144,2048,ck,0,1,110.3927,a8w8_blockscale_1x128x128_256x128x128x128_16x16_32x32_2x2_8x32x1_8x32x1_1x32x1x8_8_1x1_intrawave_v3,1154.27,770.9,0.0
gfx950,256,5105,6144,2048,cktile,11,0,111.8947,a8w8_blockscale_cktile_192x256x128_4x2x1_16x16x128_intrawave_0x1x0_1,1148.15,766.51,0.0
gfx950,256,5120,6144,2048,ck,0,0,108.1999,a8w8_blockscale_1x128x128_256x128x128x128_16x16_32x32_2x2_8x32x1_8x32x1_1x32x1x8_8_1x1_intrawave_v3,1190.84,794.67,0.0
gfx950,256,5122,6144,2048,cktile,11,0,112.5158,a8w8_blockscale_cktile_192x256x128_4x2x1_16x16x128_intrawave_0x1x0_1,1145.61,764.44,0.0
gfx950,256,5123,6144,2048,ck,0,0,111.5808,a8w8_blockscale_1x128x128_256x128x128x128_16x16_32x32_2x2_8x32x1_8x32x1_1x32x1x8_8_1x1_intrawave_v3,1155.44,770.98,0.0
gfx950,256,5124,6144,2048,cktile,28,0,112.2733,a8w8_blockscale_cktile_192x256x128_4x2x1_16x16x128_intrawave_0x1x0_3,1148.53,766.35,0.0
gfx950,256,5127,6144,2048,ck,0,3,111.9887,a8w8_blockscale_1x128x128_256x128x128x128_16x16_32x32_2x2_8x32x1_8x32x1_1x32x1x8_8_1x1_intrawave_v3,1147.03,765.28,0.0
gfx950,256,5177,6144,2048,cktile,11,0,112.0164,a8w8_blockscale_cktile_192x256x128_4x2x1_16x16x128_intrawave_0x1x0_1,1163.07,774.89,0.0
gfx950,256,5183,6144,2048,cktile,11,0,112.6766,a8w8_blockscale_cktile_192x256x128_4x2x1_16x16x128_intrawave_0x1x0_1,1157.6,771.11,0.0
gfx950,256,5252,6144,2048,cktile,29,0,112.8129,a8w8_blockscale_cktile_192x256x128_4x2x1_16x16x128_intrawave_0x1x0_4,1171.59,778.95,0.0
gfx950,256,5255,6144,2048,cktile,28,0,112.6143,a8w8_blockscale_cktile_192x256x128_4x2x1_16x16x128_intrawave_0x1x0_3,1174.33,780.71,0.0
gfx950,256,5361,6144,2048,cktile,29,0,113.0738,a8w8_blockscale_cktile_192x256x128_4x2x1_16x16x128_intrawave_0x1x0_4,1193.15,790.97,0.0
gfx950,256,5427,6144,2048,cktile,27,0,113.7673,a8w8_blockscale_cktile_192x256x128_4x2x1_16x16x128_intrawave_0x1x0_2,1200.48,794.47,0.0
gfx950,256,5471,6144,2048,cktile,28,0,112.9142,a8w8_blockscale_cktile_192x256x128_4x2x1_16x16x128_intrawave_0x1x0_3,1219.35,806.06,0.0
gfx950,256,5534,6144,2048,cktile,27,0,113.6431,a8w8_blockscale_cktile_192x256x128_4x2x1_16x16x128_intrawave_0x1x0_2,1225.48,808.83,0.0
gfx950,256,5564,6144,2048,cktile,28,0,113.2151,a8w8_blockscale_cktile_192x256x128_4x2x1_16x16x128_intrawave_0x1x0_3,1236.78,815.69,0.0
gfx950,256,5671,6144,2048,cktile,28,0,113.1814,a8w8_blockscale_cktile_192x256x128_4x2x1_16x16x128_intrawave_0x1x0_3,1260.94,829.49,0.0
gfx950,256,5927,6144,2048,cktile,28,0,114.066,a8w8_blockscale_cktile_192x256x128_4x2x1_16x16x128_intrawave_0x1x0_3,1307.65,855.23,0.0
gfx950,256,5954,6144,2048,cktile,27,0,114.4133,a8w8_blockscale_cktile_192x256x128_4x2x1_16x16x128_intrawave_0x1x0_2,1309.61,856.01,0.0
gfx950,256,6000,6144,2048,cktile,27,0,114.1078,a8w8_blockscale_cktile_192x256x128_4x2x1_16x16x128_intrawave_0x1x0_2,1323.27,864.09,0.0
gfx950,256,6002,6144,2048,cktile,27,0,114.1455,a8w8_blockscale_cktile_192x256x128_4x2x1_16x16x128_intrawave_0x1x0_2,1323.27,864.05,0.0
gfx950,256,6146,6144,2048,ck,0,3,134.4025,a8w8_blockscale_1x128x128_256x128x128x128_16x16_32x32_2x2_8x32x1_8x32x1_1x32x1x8_8_1x1_intrawave_v3,1142.78,743.97,0.0
gfx950,256,6194,6144,2048,ck,0,2,134.2553,a8w8_blockscale_1x128x128_256x128x128x128_16x16_32x32_2x2_8x32x1_8x32x1_1x32x1x8_8_1x1_intrawave_v3,1149.89,747.87,0.0
gfx950,256,6227,6144,2048,ck,0,3,134.6005,a8w8_blockscale_1x128x128_256x128x128x128_16x16_32x32_2x2_8x32x1_8x32x1_1x32x1x8_8_1x1_intrawave_v3,1161.65,755.02,0.0
gfx950,256,6229,6144,2048,ck,0,3,133.6077,a8w8_blockscale_1x128x128_256x128x128x128_16x16_32x32_2x2_8x32x1_8x32x1_1x32x1x8_8_1x1_intrawave_v3,1153.66,749.8,0.0
gfx950,256,6234,6144,2048,ck,0,3,134.5785,a8w8_blockscale_1x128x128_256x128x128x128_16x16_32x32_2x2_8x32x1_8x32x1_1x32x1x8_8_1x1_intrawave_v3,1156.78,751.75,0.0
gfx950,256,6246,6144,2048,ck,0,0,133.8654,a8w8_blockscale_1x128x128_256x128x128x128_16x16_32x32_2x2_8x32x1_8x32x1_1x32x1x8_8_1x1_intrawave_v3,1174.21,762.9,0.0
gfx950,256,6304,6144,2048,ck,0,1,134.2976,a8w8_blockscale_1x128x128_256x128x128x128_16x16_32x32_2x2_8x32x1_8x32x1_1x32x1x8_8_1x1_intrawave_v3,1178.26,764.66,0.0
gfx950,256,6314,6144,2048,ck,0,2,133.8157,a8w8_blockscale_1x128x128_256x128x128x128_16x16_32x32_2x2_8x32x1_8x32x1_1x32x1x8_8_1x1_intrawave_v3,1178.42,764.62,0.0
gfx950,256,6318,6144,2048,ck,0,2,134.0302,a8w8_blockscale_1x128x128_256x128x128x128_16x16_32x32_2x2_8x32x1_8x32x1_1x32x1x8_8_1x1_intrawave_v3,1178.34,764.51,0.0
gfx950,256,6341,6144,2048,ck,0,0,134.7754,a8w8_blockscale_1x128x128_256x128x128x128_16x16_32x32_2x2_8x32x1_8x32x1_1x32x1x8_8_1x1_intrawave_v3,1184.02,767.85,0.0
gfx950,256,6377,6144,2048,ck,0,0,134.8713,a8w8_blockscale_1x128x128_256x128x128x128_16x16_32x32_2x2_8x32x1_8x32x1_1x32x1x8_8_1x1_intrawave_v3,1183.98,767.3,0.0
gfx950,256,6476,6144,2048,ck,0,0,135.8138,a8w8_blockscale_1x128x128_256x128x128x128_16x16_32x32_2x2_8x32x1_8x32x1_1x32x1x8_8_1x1_intrawave_v3,1199.98,776.23,0.0
gfx950,256,6483,6144,2048,ck,0,0,135.6721,a8w8_blockscale_1x128x128_256x128x128x128_16x16_32x32_2x2_8x32x1_8x32x1_1x32x1x8_8_1x1_intrawave_v3,1185.65,766.86,0.0
gfx950,256,6492,6144,2048,ck,0,3,136.3797,a8w8_blockscale_1x128x128_256x128x128x128_16x16_32x32_2x2_8x32x1_8x32x1_1x32x1x8_8_1x1_intrawave_v3,1190.62,769.95,0.0
gfx950,256,6519,6144,2048,ck,0,0,136.2801,a8w8_blockscale_1x128x128_256x128x128x128_16x16_32x32_2x2_8x32x1_8x32x1_1x32x1x8_8_1x1_intrawave_v3,1201.48,776.59,0.0
gfx950,256,6609,6144,2048,ck,0,2,136.8318,a8w8_blockscale_1x128x128_256x128x128x128_16x16_32x32_2x2_8x32x1_8x32x1_1x32x1x8_8_1x1_intrawave_v3,1212.01,782.13,0.0
gfx950,256,6811,6144,2048,cktile,11,0,146.4204,a8w8_blockscale_cktile_192x256x128_4x2x1_16x16x128_intrawave_0x1x0_1,1170.63,752.8,0.0
gfx950,256,6813,6144,2048,ck,0,3,144.6002,a8w8_blockscale_1x128x128_256x128x128x128_16x16_32x32_2x2_8x32x1_8x32x1_1x32x1x8_8_1x1_intrawave_v3,1183.49,761.04,0.0
gfx950,256,6818,6144,2048,cktile,11,0,146.4184,a8w8_blockscale_cktile_192x256x128_4x2x1_16x16x128_intrawave_0x1x0_1,1171.85,753.5,0.0
gfx950,256,6830,6144,2048,ck,0,1,145.7642,a8w8_blockscale_1x128x128_256x128x128x128_16x16_32x32_2x2_8x32x1_8x32x1_1x32x1x8_8_1x1_intrawave_v3,1170.44,752.44,0.0
gfx950,256,7001,6144,2048,ck,0,0,146.298,a8w8_blockscale_1x128x128_256x128x128x128_16x16_32x32_2x2_8x32x1_8x32x1_1x32x1x8_8_1x1_intrawave_v3,1204.29,772.05,0.0
gfx950,256,7025,6144,2048,ck,0,0,146.4858,a8w8_blockscale_1x128x128_256x128x128x128_16x16_32x32_2x2_8x32x1_8x32x1_1x32x1x8_8_1x1_intrawave_v3,1203.13,771.01,0.0
gfx950,256,7121,6144,2048,cktile,27,0,147.7124,a8w8_blockscale_cktile_192x256x128_4x2x1_16x16x128_intrawave_0x1x0_2,1213.21,776.3,0.0
gfx950,256,7169,6144,2048,cktile,27,0,146.9379,a8w8_blockscale_cktile_192x256x128_4x2x1_16x16x128_intrawave_0x1x0_2,1227.82,785.08,0.0
gfx950,256,7177,6144,2048,cktile,11,0,147.1424,a8w8_blockscale_cktile_192x256x128_4x2x1_16x16x128_intrawave_0x1x0_1,1227.49,784.77,0.0
gfx950,256,7217,6144,2048,cktile,11,0,146.2397,a8w8_blockscale_cktile_192x256x128_4x2x1_16x16x128_intrawave_0x1x0_1,1241.95,793.53,0.0
gfx950,256,7223,6144,2048,cktile,29,0,147.3683,a8w8_blockscale_cktile_192x256x128_4x2x1_16x16x128_intrawave_0x1x0_4,1233.46,788.04,0.0
gfx950,256,7238,6144,2048,cktile,29,0,147.4229,a8w8_blockscale_cktile_192x256x128_4x2x1_16x16x128_intrawave_0x1x0_4,1235.56,789.2,0.0
gfx950,256,7246,6144,2048,cktile,11,0,146.9109,a8w8_blockscale_cktile_192x256x128_4x2x1_16x16x128_intrawave_0x1x0_1,1241.24,792.74,0.0
gfx950,256,7249,6144,2048,cktile,28,0,147.4118,a8w8_blockscale_cktile_192x256x128_4x2x1_16x16x128_intrawave_0x1x0_3,1237.53,790.33,0.0
gfx950,256,7316,6144,2048,cktile,27,0,147.4463,a8w8_blockscale_cktile_192x256x128_4x2x1_16x16x128_intrawave_0x1x0_2,1248.68,796.66,0.0
gfx950,256,7393,6144,2048,cktile,27,0,146.4119,a8w8_blockscale_cktile_192x256x128_4x2x1_16x16x128_intrawave_0x1x0_2,1270.74,809.83,0.0
gfx950,256,7491,6144,2048,cktile,29,0,146.8597,a8w8_blockscale_cktile_192x256x128_4x2x1_16x16x128_intrawave_0x1x0_4,1283.65,816.93,0.0
gfx950,256,7558,6144,2048,cktile,11,0,147.8562,a8w8_blockscale_cktile_192x256x128_4x2x1_16x16x128_intrawave_0x1x0_1,1286.41,817.92,0.0
gfx950,256,7650,6144,2048,cktile,28,0,147.6646,a8w8_blockscale_cktile_192x256x128_4x2x1_16x16x128_intrawave_0x1x0_3,1303.76,827.91,0.0
gfx950,256,7753,6144,2048,cktile,11,0,147.8089,a8w8_blockscale_cktile_192x256x128_4x2x1_16x16x128_intrawave_0x1x0_1,1320.02,837.09,0.0
gfx950,256,7774,6144,2048,cktile,27,0,148.6655,a8w8_blockscale_cktile_192x256x128_4x2x1_16x16x128_intrawave_0x1x0_2,1315.97,834.3,0.0
gfx950,256,7815,6144,2048,cktile,28,0,148.6623,a8w8_blockscale_cktile_192x256x128_4x2x1_16x16x128_intrawave_0x1x0_3,1322.94,838.27,0.0
gfx950,256,7834,6144,2048,cktile,29,0,148.1552,a8w8_blockscale_cktile_192x256x128_4x2x1_16x16x128_intrawave_0x1x0_4,1330.69,842.98,0.0
gfx950,256,7836,6144,2048,cktile,28,0,147.9823,a8w8_blockscale_cktile_192x256x128_4x2x1_16x16x128_intrawave_0x1x0_3,1332.59,844.15,0.0
gfx950,256,7871,6144,2048,cktile,11,0,149.0929,a8w8_blockscale_cktile_192x256x128_4x2x1_16x16x128_intrawave_0x1x0_1,1328.57,841.23,0.0
gfx950,256,7899,6144,2048,cktile,28,0,148.5621,a8w8_blockscale_cktile_192x256x128_4x2x1_16x16x128_intrawave_0x1x0_3,1338.06,846.94,0.0
gfx950,256,7913,6144,2048,cktile,11,0,148.4861,a8w8_blockscale_cktile_192x256x128_4x2x1_16x16x128_intrawave_0x1x0_1,1341.12,848.72,0.0
gfx950,256,7930,6144,2048,cktile,28,0,148.2209,a8w8_blockscale_cktile_192x256x128_4x2x1_16x16x128_intrawave_0x1x0_3,1346.4,851.89,0.0
gfx950,256,7961,6144,2048,cktile,11,0,148.3865,a8w8_blockscale_cktile_192x256x128_4x2x1_16x16x128_intrawave_0x1x0_1,1350.16,853.93,0.0
gfx950,256,7963,6144,2048,cktile,11,0,148.3761,a8w8_blockscale_cktile_192x256x128_4x2x1_16x16x128_intrawave_0x1x0_1,1350.59,854.18,0.0
gfx950,256,7974,6144,2048,cktile,28,0,148.4085,a8w8_blockscale_cktile_192x256x128_4x2x1_16x16x128_intrawave_0x1x0_3,1352.16,855.06,0.0
gfx950,256,8016,6144,2048,cktile,11,0,148.9728,a8w8_blockscale_cktile_192x256x128_4x2x1_16x16x128_intrawave_0x1x0_1,1354.13,855.86,0.0
gfx950,256,8017,6144,2048,cktile,11,0,148.0608,a8w8_blockscale_cktile_192x256x128_4x2x1_16x16x128_intrawave_0x1x0_1,1362.65,861.23,0.0
gfx950,256,8103,6144,2048,cktile,29,0,163.155,a8w8_blockscale_cktile_192x256x128_4x2x1_16x16x128_intrawave_0x1x0_4,1249.85,789.11,0.0
gfx950,256,8128,6144,2048,cktile,28,0,163.9094,a8w8_blockscale_cktile_192x256x128_4x2x1_16x16x128_intrawave_0x1x0_3,1247.93,787.67,0.0
gfx950,256,8129,6144,2048,cktile,27,0,163.0906,a8w8_blockscale_cktile_192x256x128_4x2x1_16x16x128_intrawave_0x1x0_2,1254.35,791.71,0.0
gfx950,256,8150,6144,2048,cktile,11,0,163.6182,a8w8_blockscale_cktile_192x256x128_4x2x1_16x16x128_intrawave_0x1x0_1,1253.54,791.0,0.0
gfx950,256,8184,6144,2048,cktile,28,0,163.6366,a8w8_blockscale_cktile_192x256x128_4x2x1_16x16x128_intrawave_0x1x0_3,1258.62,793.89,0.0
gfx950,256,8185,6144,2048,cktile,11,0,163.6366,a8w8_blockscale_cktile_192x256x128_4x2x1_16x16x128_intrawave_0x1x0_1,1258.78,793.97,0.0
gfx950,256,8192,6144,2048,ck,0,2,162.0259,a8w8_blockscale_1x128x128_256x128x128x128_16x16_32x32_2x2_8x32x1_8x32x1_1x32x1x8_8_1x1_intrawave_v3,1271.98,802.23,0.0
gfx950,256,1,9216,2048,ck,8,3,8.038,a8w8_blockscale_1x128x128_256x16x64x256_16x16_16x16_1x1_16x16x1_16x16x1_1x16x1x16_4_1x1_intrawave_v1,4.7,2350.69,0.0
gfx950,256,2,9216,2048,ck,8,3,8.0399,a8w8_blockscale_1x128x128_256x16x64x256_16x16_16x16_1x1_16x16x1_16x16x1_1x16x1x16_4_1x1_intrawave_v1,9.39,2352.68,0.0
gfx950,256,4,9216,2048,ck,8,0,8.1623,a8w8_blockscale_1x128x128_256x16x64x256_16x16_16x16_1x1_16x16x1_16x16x1_1x16x1x16_4_1x1_intrawave_v1,18.5,2322.42,0.0
gfx950,256,8,9216,2048,ck,8,0,8.2115,a8w8_blockscale_1x128x128_256x16x64x256_16x16_16x16_1x1_16x16x1_16x16x1_1x16x1x16_4_1x1_intrawave_v1,36.78,2318.48,0.0
gfx950,256,16,9216,2048,ck,8,0,8.0348,a8w8_blockscale_1x128x128_256x16x64x256_16x16_16x16_1x1_16x16x1_16x16x1_1x16x1x16_4_1x1_intrawave_v1,75.17,2389.86,0.0
gfx950,256,32,9216,2048,ck,7,0,9.9114,a8w8_blockscale_1x128x128_256x16x128x256_16x16_16x16_1x2_16x16x1_16x16x1_1x16x1x16_8_1x2_intrawave_v1,121.88,1970.43,0.0
gfx950,256,48,9216,2048,ck,7,0,10.0777,a8w8_blockscale_1x128x128_256x16x128x256_16x16_16x16_1x2_16x16x1_16x16x1_1x16x1x16_8_1x2_intrawave_v1,179.8,1970.43,0.0
gfx950,256,64,9216,2048,ck,18,0,9.6725,a8w8_blockscale_1x128x128_256x64x64x256_16x16_32x32_1x1_16x16x1_16x16x1_1x32x1x8_8_1x1_intrawave_v1,246.93,2063.13,0.0
gfx950,256,80,9216,2048,ck,12,3,12.6019,a8w8_blockscale_1x128x128_256x32x128x256_16x16_32x32_1x1_16x16x1_16x16x1_1x32x1x8_8_1x1_intrawave_v1,234.05,1589.8,0.0
gfx950,256,96,9216,2048,ck,12,3,11.3158,a8w8_blockscale_1x128x128_256x32x128x256_16x16_32x32_1x1_16x16x1_16x16x1_1x32x1x8_8_1x1_intrawave_v1,298.29,1715.4,0.0
gfx950,256,112,9216,2048,ck,5,3,14.9567,a8w8_blockscale_1x128x128_256x16x128x128_8x16_16x16_1x2_16x16x1_8x32x1_1x16x1x16_8_1x2_intrawave_v1,280.04,1402.13,0.0
gfx950,256,128,9216,2048,ck,2,0,15.4867,a8w8_blockscale_1x128x128_256x64x128x128_16x16_32x32_1x2_8x32x1_8x32x1_1x32x1x8_8_1x1_intrawave_v3,310.03,1379.27,0.0
gfx950,256,256,9216,2048,ck,0,0,19.4213,a8w8_blockscale_1x128x128_256x128x128x128_16x16_32x32_2x2_8x32x1_8x32x1_1x32x1x8_8_1x1_intrawave_v3,497.58,1241.79,0.0
gfx950,256,512,9216,2048,ck,2,0,29.5703,a8w8_blockscale_1x128x128_256x64x128x128_16x16_32x32_1x2_8x32x1_8x32x1_1x32x1x8_8_1x1_intrawave_v3,653.61,992.89,0.0
gfx950,256,667,9216,2048,ck,0,0,32.7511,a8w8_blockscale_1x128x128_256x128x128x128_16x16_32x32_2x2_8x32x1_8x32x1_1x32x1x8_8_1x1_intrawave_v3,768.22,992.66,0.0
gfx950,256,671,9216,2048,ck,0,1,32.5928,a8w8_blockscale_1x128x128_256x128x128x128_16x16_32x32_2x2_8x32x1_8x32x1_1x32x1x8_8_1x1_intrawave_v3,775.64,998.79,0.0
gfx950,256,931,9216,2048,cktile,31,0,39.3263,a8w8_blockscale_cktile_192x256x128_4x2x1_16x16x128_intrawave_0x1x0_3_aqrm,893.65,964.78,0.0
gfx950,256,1024,9216,2048,cktile,30,0,39.5036,a8w8_blockscale_cktile_192x256x128_4x2x1_16x16x128_intrawave_0x1x0_2_aqrm,978.51,1008.66,0.0
gfx950,256,1025,9216,2048,cktile,31,0,39.8315,a8w8_blockscale_cktile_192x256x128_4x2x1_16x16x128_intrawave_0x1x0_3_aqrm,971.4,1000.88,0.0
gfx950,256,1027,9216,2048,cktile,32,0,39.7737,a8w8_blockscale_cktile_192x256x128_4x2x1_16x16x128_intrawave_0x1x0_4_aqrm,974.71,1003.36,0.0
gfx950,256,1031,9216,2048,cktile,30,0,39.8328,a8w8_blockscale_cktile_192x256x128_4x2x1_16x16x128_intrawave_0x1x0_2_aqrm,977.06,1003.93,0.0
gfx950,256,1039,9216,2048,cktile,31,0,39.8435,a8w8_blockscale_cktile_192x256x128_4x2x1_16x16x128_intrawave_0x1x0_3_aqrm,984.37,1007.77,0.0
gfx950,256,1040,9216,2048,cktile,32,0,39.7611,a8w8_blockscale_cktile_192x256x128_4x2x1_16x16x128_intrawave_0x1x0_4_aqrm,987.36,1010.37,0.0
gfx950,256,1041,9216,2048,cktile,12,0,39.6611,a8w8_blockscale_cktile_192x256x128_4x2x1_16x16x128_intrawave_0x1x0_1_aqrm,990.81,1013.44,0.0
gfx950,256,1072,9216,2048,cktile,32,0,39.8995,a8w8_blockscale_cktile_192x256x128_4x2x1_16x16x128_intrawave_0x1x0_4_aqrm,1014.21,1023.29,0.0
gfx950,256,1073,9216,2048,cktile,30,0,40.0064,a8w8_blockscale_cktile_192x256x128_4x2x1_16x16x128_intrawave_0x1x0_2_aqrm,1012.45,1021.07,0.0
gfx950,256,1077,9216,2048,cktile,12,0,40.1912,a8w8_blockscale_cktile_192x256x128_4x2x1_16x16x128_intrawave_0x1x0_1_aqrm,1011.55,1018.42,0.0
gfx950,256,1091,9216,2048,cktile,12,0,39.9941,a8w8_blockscale_cktile_192x256x128_4x2x1_16x16x128_intrawave_0x1x0_1_aqrm,1029.75,1030.6,0.0
gfx950,256,1343,9216,2048,cktile,30,0,41.2638,a8w8_blockscale_cktile_192x256x128_4x2x1_16x16x128_intrawave_0x1x0_2_aqrm,1228.6,1123.96,0.0
gfx950,256,1688,9216,2048,ck,0,1,61.6139,a8w8_blockscale_1x128x128_256x128x128x128_16x16_32x32_2x2_8x32x1_8x32x1_1x32x1x8_8_1x1_intrawave_v3,1026.56,861.02,0.0
gfx950,256,2017,9216,2048,ck,0,2,74.6208,a8w8_blockscale_1x128x128_256x128x128x128_16x16_32x32_2x2_8x32x1_8x32x1_1x32x1x8_8_1x1_intrawave_v3,1012.9,800.63,0.0
gfx950,256,2048,9216,2048,ck,0,3,73.1856,a8w8_blockscale_1x128x128_256x128x128x128_16x16_32x32_2x2_8x32x1_8x32x1_1x32x1x8_8_1x1_intrawave_v3,1048.18,824.58,0.0
gfx950,256,2050,9216,2048,ck,0,1,75.1216,a8w8_blockscale_1x128x128_256x128x128x128_16x16_32x32_2x2_8x32x1_8x32x1_1x32x1x8_8_1x1_intrawave_v3,1018.19,800.75,0.0
gfx950,256,2063,9216,2048,ck,0,0,74.6612,a8w8_blockscale_1x128x128_256x128x128x128_16x16_32x32_2x2_8x32x1_8x32x1_1x32x1x8_8_1x1_intrawave_v3,1024.96,804.49,0.0
gfx950,256,2064,9216,2048,ck,0,0,75.3512,a8w8_blockscale_1x128x128_256x128x128x128_16x16_32x32_2x2_8x32x1_8x32x1_1x32x1x8_8_1x1_intrawave_v3,1027.68,806.5,0.0
gfx950,256,2099,9216,2048,ck,0,2,75.112,a8w8_blockscale_1x128x128_256x128x128x128_16x16_32x32_2x2_8x32x1_8x32x1_1x32x1x8_8_1x1_intrawave_v3,1044.3,815.33,0.0
gfx950,256,2159,9216,2048,ck,0,3,75.616,a8w8_blockscale_1x128x128_256x128x128x128_16x16_32x32_2x2_8x32x1_8x32x1_1x32x1x8_8_1x1_intrawave_v3,1069.88,828.22,0.0
gfx950,256,2160,9216,2048,ck,0,0,75.2952,a8w8_blockscale_1x128x128_256x128x128x128_16x16_32x32_2x2_8x32x1_8x32x1_1x32x1x8_8_1x1_intrawave_v3,1082.9,838.18,0.0
gfx950,256,2313,9216,2048,cktile,27,0,77.0211,a8w8_blockscale_cktile_192x256x128_4x2x1_16x16x128_intrawave_0x1x0_2,1133.62,860.08,0.0
gfx950,256,2325,9216,2048,cktile,11,0,77.1464,a8w8_blockscale_cktile_192x256x128_4x2x1_16x16x128_intrawave_0x1x0_1,1137.65,861.87,0.0
gfx950,256,3072,9216,2048,ck,0,2,97.8146,a8w8_blockscale_1x128x128_256x128x128x128_16x16_32x32_2x2_8x32x1_8x32x1_1x32x1x8_8_1x1_intrawave_v3,1170.32,825.42,0.0
gfx950,256,3073,9216,2048,cktile,11,0,104.7332,a8w8_blockscale_cktile_192x256x128_4x2x1_16x16x128_intrawave_0x1x0_1,1107.59,781.12,0.0
gfx950,256,3182,9216,2048,cktile,27,0,108.776,a8w8_blockscale_cktile_192x256x128_4x2x1_16x16x128_intrawave_0x1x0_2,1104.26,772.61,0.0
gfx950,256,3183,9216,2048,cktile,29,0,108.9196,a8w8_blockscale_cktile_192x256x128_4x2x1_16x16x128_intrawave_0x1x0_4,1103.15,771.78,0.0
gfx950,256,3847,9216,2048,cktile,11,0,112.5881,a8w8_blockscale_cktile_192x256x128_4x2x1_16x16x128_intrawave_0x1x0_1,1289.83,867.42,0.0
gfx950,256,4096,9216,2048,cktile,11,0,126.415,a8w8_blockscale_cktile_192x256x128_4x2x1_16x16x128_intrawave_0x1x0_1,1223.11,812.88,0.0
gfx950,256,4111,9216,2048,cktile,11,0,126.2262,a8w8_blockscale_cktile_192x256x128_4x2x1_16x16x128_intrawave_0x1x0_1,1229.42,816.53,0.0
gfx950,256,4141,9216,2048,cktile,28,0,126.6152,a8w8_blockscale_cktile_192x256x128_4x2x1_16x16x128_intrawave_0x1x0_3,1234.59,818.88,0.0
gfx950,256,4142,9216,2048,cktile,28,0,125.5422,a8w8_blockscale_cktile_192x256x128_4x2x1_16x16x128_intrawave_0x1x0_3,1245.44,826.04,0.0
gfx950,256,4345,9216,2048,cktile,11,0,133.075,a8w8_blockscale_cktile_192x256x128_4x2x1_16x16x128_intrawave_0x1x0_1,1232.52,810.52,0.0
gfx950,256,5105,9216,2048,cktile,11,0,145.4712,a8w8_blockscale_cktile_192x256x128_4x2x1_16x16x128_intrawave_0x1x0_1,1324.71,848.45,0.0
gfx950,256,5121,9216,2048,cktile,11,0,144.8038,a8w8_blockscale_cktile_192x256x128_4x2x1_16x16x128_intrawave_0x1x0_1,1334.99,854.62,0.0
gfx950,256,5123,9216,2048,cktile,28,0,145.2381,a8w8_blockscale_cktile_192x256x128_4x2x1_16x16x128_intrawave_0x1x0_3,1331.52,852.35,0.0
gfx950,256,5131,9216,2048,cktile,11,0,145.2946,a8w8_blockscale_cktile_192x256x128_4x2x1_16x16x128_intrawave_0x1x0_1,1333.08,853.14,0.0
gfx950,256,5427,9216,2048,cktile,28,0,154.3282,a8w8_blockscale_cktile_192x256x128_4x2x1_16x16x128_intrawave_0x1x0_3,1327.45,842.49,0.0
gfx950,256,6113,9216,2048,cktile,11,0,175.6873,a8w8_blockscale_cktile_192x256x128_4x2x1_16x16x128_intrawave_0x1x0_1,1313.46,820.03,0.0
gfx950,256,6197,9216,2048,cktile,27,0,177.247,a8w8_blockscale_cktile_192x256x128_4x2x1_16x16x128_intrawave_0x1x0_2,1319.79,822.52,0.0
gfx950,256,6409,9216,2048,cktile,27,0,179.0092,a8w8_blockscale_cktile_192x256x128_4x2x1_16x16x128_intrawave_0x1x0_2,1351.5,838.68,0.0
gfx950,256,7121,9216,2048,cktile,28,0,198.9668,a8w8_blockscale_cktile_192x256x128_4x2x1_16x16x128_intrawave_0x1x0_3,1351.02,827.84,0.0
gfx950,256,7168,9216,2048,cktile,28,0,198.7568,a8w8_blockscale_cktile_192x256x128_4x2x1_16x16x128_intrawave_0x1x0_3,1361.38,833.56,0.0
gfx950,256,7169,9216,2048,cktile,27,0,198.5107,a8w8_blockscale_cktile_192x256x128_4x2x1_16x16x128_intrawave_0x1x0_2,1363.25,834.69,0.0
gfx950,256,7172,9216,2048,cktile,29,0,199.242,a8w8_blockscale_cktile_192x256x128_4x2x1_16x16x128_intrawave_0x1x0_4,1358.82,831.94,0.0
gfx950,256,7176,9216,2048,cktile,11,0,198.7588,a8w8_blockscale_cktile_192x256x128_4x2x1_16x16x128_intrawave_0x1x0_1,1362.88,834.37,0.0
gfx950,256,7177,9216,2048,cktile,28,0,198.5584,a8w8_blockscale_cktile_192x256x128_4x2x1_16x16x128_intrawave_0x1x0_3,1364.45,835.32,0.0
gfx950,256,7178,9216,2048,cktile,11,0,198.4165,a8w8_blockscale_cktile_192x256x128_4x2x1_16x16x128_intrawave_0x1x0_1,1365.61,836.02,0.0
gfx950,256,7179,9216,2048,cktile,11,0,198.9062,a8w8_blockscale_cktile_192x256x128_4x2x1_16x16x128_intrawave_0x1x0_1,1362.44,834.06,0.0
gfx950,256,7183,9216,2048,cktile,29,0,199.709,a8w8_blockscale_cktile_192x256x128_4x2x1_16x16x128_intrawave_0x1x0_4,1357.72,831.12,0.0
gfx950,256,7184,9216,2048,cktile,27,0,197.7689,a8w8_blockscale_cktile_192x256x128_4x2x1_16x16x128_intrawave_0x1x0_2,1371.23,839.38,0.0
gfx950,256,7209,9216,2048,cktile,11,0,199.2278,a8w8_blockscale_cktile_192x256x128_4x2x1_16x16x128_intrawave_0x1x0_1,1365.93,835.8,0.0
gfx950,256,7210,9216,2048,cktile,11,0,200.4924,a8w8_blockscale_cktile_192x256x128_4x2x1_16x16x128_intrawave_0x1x0_1,1357.5,830.63,0.0
gfx950,256,7211,9216,2048,cktile,27,0,199.6398,a8w8_blockscale_cktile_192x256x128_4x2x1_16x16x128_intrawave_0x1x0_2,1363.49,834.28,0.0
gfx950,256,7217,9216,2048,cktile,11,0,198.9213,a8w8_blockscale_cktile_192x256x128_4x2x1_16x16x128_intrawave_0x1x0_1,1369.55,837.91,0.0
gfx950,256,7273,9216,2048,cktile,27,0,199.7249,a8w8_blockscale_cktile_192x256x128_4x2x1_16x16x128_intrawave_0x1x0_2,1374.62,840.28,0.0
gfx950,256,7274,9216,2048,cktile,28,0,198.3769,a8w8_blockscale_cktile_192x256x128_4x2x1_16x16x128_intrawave_0x1x0_3,1384.15,846.1,0.0
gfx950,256,7391,9216,2048,cktile,28,0,206.9331,a8w8_blockscale_cktile_192x256x128_4x2x1_16x16x128_intrawave_0x1x0_3,1348.27,822.69,0.0
gfx950,256,7393,9216,2048,cktile,28,0,206.8511,a8w8_blockscale_cktile_192x256x128_4x2x1_16x16x128_intrawave_0x1x0_3,1349.17,823.22,0.0
gfx950,256,7715,9216,2048,cktile,28,0,213.3924,a8w8_blockscale_cktile_192x256x128_4x2x1_16x16x128_intrawave_0x1x0_3,1364.77,828.88,0.0
gfx950,256,7753,9216,2048,cktile,11,0,212.6696,a8w8_blockscale_cktile_192x256x128_4x2x1_16x16x128_intrawave_0x1x0_1,1376.15,835.36,0.0
gfx950,256,7819,9216,2048,cktile,27,0,213.9324,a8w8_blockscale_cktile_192x256x128_4x2x1_16x16x128_intrawave_0x1x0_2,1379.68,836.75,0.0
gfx950,256,8099,9216,2048,cktile,28,0,214.9806,a8w8_blockscale_cktile_192x256x128_4x2x1_16x16x128_intrawave_0x1x0_3,1422.11,859.34,0.0
gfx950,256,8129,9216,2048,cktile,27,0,215.6234,a8w8_blockscale_cktile_192x256x128_4x2x1_16x16x128_intrawave_0x1x0_2,1423.13,859.63,0.0
gfx950,256,8188,9216,2048,cktile,11,0,216.1778,a8w8_blockscale_cktile_192x256x128_4x2x1_16x16x128_intrawave_0x1x0_1,1429.78,863.01,0.0
gfx950,256,8192,9216,2048,cktile,27,0,216.203,a8w8_blockscale_cktile_192x256x128_4x2x1_16x16x128_intrawave_0x1x0_2,1430.31,863.29,0.0
gfx950,256,1,12288,2048,ck,8,0,8.4532,a8w8_blockscale_1x128x128_256x16x64x256_16x16_16x16_1x1_16x16x1_16x16x1_1x16x1x16_4_1x1_intrawave_v1,5.95,2980.23,0.0
gfx950,256,2,12288,2048,ck,8,0,8.488,a8w8_blockscale_1x128x128_256x16x64x256_16x16_16x16_1x1_16x16x1_16x16x1_1x16x1x16_4_1x1_intrawave_v1,11.86,2971.14,0.0
gfx950,256,4,12288,2048,ck,8,0,8.4883,a8w8_blockscale_1x128x128_256x16x64x256_16x16_16x16_1x1_16x16x1_16x16x1_1x16x1x16_4_1x1_intrawave_v1,23.72,2977.31,0.0
gfx950,256,8,12288,2048,ck,8,0,8.4658,a8w8_blockscale_1x128x128_256x16x64x256_16x16_16x16_1x1_16x16x1_16x16x1_1x16x1x16_4_1x1_intrawave_v1,47.56,2997.8,0.0
gfx950,256,16,12288,2048,ck,8,0,8.326,a8w8_blockscale_1x128x128_256x16x64x256_16x16_16x16_1x1_16x16x1_16x16x1_1x16x1x16_4_1x1_intrawave_v1,96.72,3073.72,0.0
gfx950,256,32,12288,2048,ck,7,0,10.1856,a8w8_blockscale_1x128x128_256x16x128x256_16x16_16x16_1x2_16x16x1_16x16x1_1x16x1x16_8_1x2_intrawave_v1,158.13,2554.37,0.0
gfx950,256,48,12288,2048,ck,18,1,11.2919,a8w8_blockscale_1x128x128_256x64x64x256_16x16_32x32_1x1_16x16x1_16x16x1_1x32x1x8_8_1x1_intrawave_v1,210.57,2304.79,0.0
gfx950,256,64,12288,2048,ck,18,0,9.9882,a8w8_blockscale_1x128x128_256x64x64x256_16x16_32x32_1x1_16x16x1_16x16x1_1x32x1x8_8_1x1_intrawave_v1,314.48,2623.23,0.0
gfx950,256,80,12288,2048,ck,5,0,15.5013,a8w8_blockscale_1x128x128_256x16x128x128_8x16_16x16_1x2_16x16x1_8x32x1_1x16x1x16_8_1x2_intrawave_v1,258.27,1750.79,0.0
gfx950,256,96,12288,2048,ck,2,3,15.7398,a8w8_blockscale_1x128x128_256x64x128x128_16x16_32x32_1x2_8x32x1_8x32x1_1x32x1x8_8_1x1_intrawave_v3,304.71,1748.23,0.0
gfx950,256,112,12288,2048,ck,2,1,15.9346,a8w8_blockscale_1x128x128_256x64x128x128_16x16_32x32_1x2_8x32x1_8x32x1_1x32x1x8_8_1x1_intrawave_v3,353.67,1765.98,0.0
gfx950,256,128,12288,2048,ck,2,0,15.77,a8w8_blockscale_1x128x128_256x64x128x128_16x16_32x32_1x2_8x32x1_8x32x1_1x32x1x8_8_1x1_intrawave_v3,405.98,1800.63,0.0
gfx950,256,256,12288,2048,ck,0,0,19.9396,a8w8_blockscale_1x128x128_256x128x128x128_16x16_32x32_2x2_8x32x1_8x32x1_1x32x1x8_8_1x1_intrawave_v3,643.55,1597.35,0.0
gfx950,256,512,12288,2048,ck,2,1,31.2412,a8w8_blockscale_1x128x128_256x64x128x128_16x16_32x32_1x2_8x32x1_8x32x1_1x32x1x8_8_1x1_intrawave_v3,813.86,1225.3,0.0
gfx950,256,667,12288,2048,cktile,32,0,39.0145,a8w8_blockscale_cktile_192x256x128_4x2x1_16x16x128_intrawave_0x1x0_4_aqrm,860.48,1100.21,0.0
gfx950,256,671,12288,2048,cktile,12,0,39.0955,a8w8_blockscale_cktile_192x256x128_4x2x1_16x16x128_intrawave_0x1x0_1_aqrm,863.85,1100.65,0.0
gfx950,256,931,12288,2048,cktile,30,0,40.1046,a8w8_blockscale_cktile_192x256x128_4x2x1_16x16x128_intrawave_0x1x0_2_aqrm,1168.41,1245.56,0.0
gfx950,256,1024,12288,2048,ck,0,0,49.6614,a8w8_blockscale_1x128x128_256x128x128x128_16x16_32x32_2x2_8x32x1_8x32x1_1x32x1x8_8_1x1_intrawave_v3,1022.02,1039.65,0.0
gfx950,256,1025,12288,2048,ck,0,3,58.5858,a8w8_blockscale_1x128x128_256x128x128x128_16x16_32x32_2x2_8x32x1_8x32x1_1x32x1x8_8_1x1_intrawave_v3,869.68,884.27,0.0
gfx950,256,1027,12288,2048,ck,0,0,58.5006,a8w8_blockscale_1x128x128_256x128x128x128_16x16_32x32_2x2_8x32x1_8x32x1_1x32x1x8_8_1x1_intrawave_v3,872.36,886.16,0.0
gfx950,256,1031,12288,2048,ck,0,3,58.5746,a8w8_blockscale_1x128x128_256x128x128x128_16x16_32x32_2x2_8x32x1_8x32x1_1x32x1x8_8_1x1_intrawave_v3,878.67,890.91,0.0
gfx950,256,1039,12288,2048,ck,0,3,58.1546,a8w8_blockscale_1x128x128_256x128x128x128_16x16_32x32_2x2_8x32x1_8x32x1_1x32x1x8_8_1x1_intrawave_v3,893.34,902.45,0.0
gfx950,256,1040,12288,2048,ck,0,3,58.3434,a8w8_blockscale_1x128x128_256x128x128x128_16x16_32x32_2x2_8x32x1_8x32x1_1x32x1x8_8_1x1_intrawave_v3,882.95,891.55,0.0
gfx950,256,1041,12288,2048,ck,0,2,58.5886,a8w8_blockscale_1x128x128_256x128x128x128_16x16_32x32_2x2_8x32x1_8x32x1_1x32x1x8_8_1x1_intrawave_v3,881.23,889.41,0.0
gfx950,256,1072,12288,2048,ck,0,3,58.199,a8w8_blockscale_1x128x128_256x128x128x128_16x16_32x32_2x2_8x32x1_8x32x1_1x32x1x8_8_1x1_intrawave_v3,916.78,912.55,0.0
gfx950,256,1073,12288,2048,ck,0,1,58.453,a8w8_blockscale_1x128x128_256x128x128x128_16x16_32x32_2x2_8x32x1_8x32x1_1x32x1x8_8_1x1_intrawave_v3,914.18,909.57,0.0
gfx950,256,1077,12288,2048,ck,0,2,58.507,a8w8_blockscale_1x128x128_256x128x128x128_16x16_32x32_2x2_8x32x1_8x32x1_1x32x1x8_8_1x1_intrawave_v3,913.07,906.89,0.0
gfx950,256,1091,12288,2048,ck,0,3,58.7482,a8w8_blockscale_1x128x128_256x128x128x128_16x16_32x32_2x2_8x32x1_8x32x1_1x32x1x8_8_1x1_intrawave_v3,931.18,919.32,0.0
gfx950,256,1343,12288,2048,ck,0,2,71.5239,a8w8_blockscale_1x128x128_256x128x128x128_16x16_32x32_2x2_8x32x1_8x32x1_1x32x1x8_8_1x1_intrawave_v3,928.45,836.79,0.0
gfx950,256,1688,12288,2048,cktile,11,0,76.7137,a8w8_blockscale_cktile_192x256x128_4x2x1_16x16x128_intrawave_0x1x0_1,1107.49,913.88,0.0
gfx950,256,2017,12288,2048,ck,0,2,90.2145,a8w8_blockscale_1x128x128_256x128x128x128_16x16_32x32_2x2_8x32x1_8x32x1_1x32x1x8_8_1x1_intrawave_v3,1112.1,863.95,0.0
gfx950,256,2048,12288,2048,ck,0,0,89.6117,a8w8_blockscale_1x128x128_256x128x128x128_16x16_32x32_2x2_8x32x1_8x32x1_1x32x1x8_8_1x1_intrawave_v3,1133.39,876.24,0.0
gfx950,256,2050,12288,2048,cktile,28,0,97.6256,a8w8_blockscale_cktile_192x256x128_4x2x1_16x16x128_intrawave_0x1x0_3,1056.89,816.85,0.0
gfx950,256,2063,12288,2048,cktile,27,0,97.256,a8w8_blockscale_cktile_192x256x128_4x2x1_16x16x128_intrawave_0x1x0_2,1067.64,823.51,0.0
gfx950,256,2064,12288,2048,cktile,28,0,96.996,a8w8_blockscale_cktile_192x256x128_4x2x1_16x16x128_intrawave_0x1x0_3,1071.02,825.99,0.0
gfx950,256,2099,12288,2048,cktile,28,0,97.8636,a8w8_blockscale_cktile_192x256x128_4x2x1_16x16x128_intrawave_0x1x0_3,1079.52,828.19,0.0
gfx950,256,2159,12288,2048,ck,0,3,99.6554,a8w8_blockscale_1x128x128_256x128x128x128_16x16_32x32_2x2_8x32x1_8x32x1_1x32x1x8_8_1x1_intrawave_v3,1085.71,825.75,0.0
gfx950,256,2160,12288,2048,ck,0,2,99.4094,a8w8_blockscale_1x128x128_256x128x128x128_16x16_32x32_2x2_8x32x1_8x32x1_1x32x1x8_8_1x1_intrawave_v3,1091.85,830.3,0.0
gfx950,256,2313,12288,2048,cktile,11,0,104.7862,a8w8_blockscale_cktile_192x256x128_4x2x1_16x16x128_intrawave_0x1x0_1,1111.0,827.85,0.0
gfx950,256,2325,12288,2048,cktile,29,0,104.7205,a8w8_blockscale_cktile_192x256x128_4x2x1_16x16x128_intrawave_0x1x0_4,1117.46,831.42,0.0
gfx950,256,3072,12288,2048,cktile,27,0,112.567,a8w8_blockscale_cktile_192x256x128_4x2x1_16x16x128_intrawave_0x1x0_2,1373.57,950.14,0.0
gfx950,256,3073,12288,2048,cktile,11,0,131.3315,a8w8_blockscale_cktile_192x256x128_4x2x1_16x16x128_intrawave_0x1x0_1,1177.7,814.59,0.0
gfx950,256,3182,12288,2048,cktile,11,0,132.4358,a8w8_blockscale_cktile_192x256x128_4x2x1_16x16x128_intrawave_0x1x0_1,1209.31,829.71,0.0
gfx950,256,3183,12288,2048,cktile,11,0,131.6378,a8w8_blockscale_cktile_192x256x128_4x2x1_16x16x128_intrawave_0x1x0_1,1217.02,834.94,0.0
gfx950,256,3847,12288,2048,cktile,29,0,145.4714,a8w8_blockscale_cktile_192x256x128_4x2x1_16x16x128_intrawave_0x1x0_4,1331.02,877.07,0.0
gfx950,256,4096,12288,2048,cktile,11,0,159.8421,a8w8_blockscale_cktile_192x256x128_4x2x1_16x16x128_intrawave_0x1x0_1,1289.76,839.69,0.0
gfx950,256,4111,12288,2048,cktile,11,0,160.8553,a8w8_blockscale_cktile_192x256x128_4x2x1_16x16x128_intrawave_0x1x0_1,1286.33,836.88,0.0
gfx950,256,4141,12288,2048,cktile,29,0,161.7817,a8w8_blockscale_cktile_192x256x128_4x2x1_16x16x128_intrawave_0x1x0_4,1288.3,837.03,0.0
gfx950,256,4142,12288,2048,cktile,28,0,160.9633,a8w8_blockscale_cktile_192x256x128_4x2x1_16x16x128_intrawave_0x1x0_3,1295.16,841.45,0.0
gfx950,256,4345,12288,2048,cktile,11,0,168.7433,a8w8_blockscale_cktile_192x256x128_4x2x1_16x16x128_intrawave_0x1x0_1,1296.0,834.68,0.0
gfx950,256,5105,12288,2048,cktile,27,0,189.8584,a8w8_blockscale_cktile_192x256x128_4x2x1_16x16x128_intrawave_0x1x0_2,1353.34,848.43,0.0
gfx950,256,5121,12288,2048,cktile,29,0,191.0685,a8w8_blockscale_cktile_192x256x128_4x2x1_16x16x128_intrawave_0x1x0_4,1348.98,845.28,0.0
gfx950,256,5123,12288,2048,cktile,27,0,190.9338,a8w8_blockscale_cktile_192x256x128_4x2x1_16x16x128_intrawave_0x1x0_2,1350.46,846.16,0.0
gfx950,256,5131,12288,2048,cktile,28,0,189.3778,a8w8_blockscale_cktile_192x256x128_4x2x1_16x16x128_intrawave_0x1x0_3,1363.69,854.24,0.0
gfx950,256,5427,12288,2048,cktile,11,0,203.9439,a8w8_blockscale_cktile_192x256x128_4x2x1_16x16x128_intrawave_0x1x0_1,1339.34,831.87,0.0
gfx950,256,6113,12288,2048,cktile,11,0,211.8852,a8w8_blockscale_cktile_192x256x128_4x2x1_16x16x128_intrawave_0x1x0_1,1452.09,886.89,0.0
gfx950,256,6197,12288,2048,cktile,11,0,226.5209,a8w8_blockscale_cktile_192x256x128_4x2x1_16x16x128_intrawave_0x1x0_1,1376.94,839.46,0.0
gfx950,256,6409,12288,2048,cktile,11,0,232.7665,a8w8_blockscale_cktile_192x256x128_4x2x1_16x16x128_intrawave_0x1x0_1,1385.83,841.18,0.0
gfx950,256,7121,12288,2048,cktile,11,0,252.856,a8w8_blockscale_cktile_192x256x128_4x2x1_16x16x128_intrawave_0x1x0_1,1417.45,849.32,0.0
gfx950,256,7168,12288,2048,cktile,11,0,252.9058,a8w8_blockscale_cktile_192x256x128_4x2x1_16x16x128_intrawave_0x1x0_1,1426.53,854.1,0.0
gfx950,256,7169,12288,2048,cktile,11,0,253.1184,a8w8_blockscale_cktile_192x256x128_4x2x1_16x16x128_intrawave_0x1x0_1,1425.53,853.49,0.0
gfx950,256,7172,12288,2048,cktile,27,0,253.7664,a8w8_blockscale_cktile_192x256x128_4x2x1_16x16x128_intrawave_0x1x0_2,1422.48,851.62,0.0
gfx950,256,7176,12288,2048,cktile,28,0,251.0477,a8w8_blockscale_cktile_192x256x128_4x2x1_16x16x128_intrawave_0x1x0_3,1438.69,861.27,0.0
gfx950,256,7177,12288,2048,cktile,28,0,252.8289,a8w8_blockscale_cktile_192x256x128_4x2x1_16x16x128_intrawave_0x1x0_3,1428.75,855.31,0.0
gfx950,256,7178,12288,2048,cktile,27,0,252.2273,a8w8_blockscale_cktile_192x256x128_4x2x1_16x16x128_intrawave_0x1x0_2,1432.36,857.45,0.0
gfx950,256,7179,12288,2048,cktile,29,0,252.9575,a8w8_blockscale_cktile_192x256x128_4x2x1_16x16x128_intrawave_0x1x0_4,1428.43,855.08,0.0
gfx950,256,7183,12288,2048,cktile,11,0,252.2839,a8w8_blockscale_cktile_192x256x128_4x2x1_16x16x128_intrawave_0x1x0_1,1433.04,857.79,0.0
gfx950,256,7184,12288,2048,cktile,11,0,253.1475,a8w8_blockscale_cktile_192x256x128_4x2x1_16x16x128_intrawave_0x1x0_1,1428.35,854.97,0.0
gfx950,256,7209,12288,2048,cktile,29,0,251.8247,a8w8_blockscale_cktile_192x256x128_4x2x1_16x16x128_intrawave_0x1x0_4,1440.85,862.1,0.0
gfx950,256,7210,12288,2048,cktile,27,0,252.4943,a8w8_blockscale_cktile_192x256x128_4x2x1_16x16x128_intrawave_0x1x0_2,1437.23,859.92,0.0
gfx950,256,7211,12288,2048,cktile,28,0,252.9623,a8w8_blockscale_cktile_192x256x128_4x2x1_16x16x128_intrawave_0x1x0_3,1434.77,858.43,0.0
gfx950,256,7217,12288,2048,cktile,28,0,253.9214,a8w8_blockscale_cktile_192x256x128_4x2x1_16x16x128_intrawave_0x1x0_3,1430.54,855.82,0.0
gfx950,256,7273,12288,2048,cktile,27,0,252.8329,a8w8_blockscale_cktile_192x256x128_4x2x1_16x16x128_intrawave_0x1x0_2,1447.84,865.4,0.0
gfx950,256,7274,12288,2048,cktile,28,0,254.0935,a8w8_blockscale_cktile_192x256x128_4x2x1_16x16x128_intrawave_0x1x0_3,1440.86,861.21,0.0
gfx950,256,7391,12288,2048,cktile,27,0,261.0915,a8w8_blockscale_cktile_192x256x128_4x2x1_16x16x128_intrawave_0x1x0_2,1424.79,850.06,0.0
gfx950,256,7393,12288,2048,cktile,11,0,261.0471,a8w8_blockscale_cktile_192x256x128_4x2x1_16x16x128_intrawave_0x1x0_1,1425.42,850.41,0.0
gfx950,256,7715,12288,2048,cktile,27,0,272.4755,a8w8_blockscale_cktile_192x256x128_4x2x1_16x16x128_intrawave_0x1x0_2,1425.11,846.2,0.0
gfx950,256,7753,12288,2048,cktile,11,0,272.4108,a8w8_blockscale_cktile_192x256x128_4x2x1_16x16x128_intrawave_0x1x0_1,1432.47,850.12,0.0
gfx950,256,7819,12288,2048,cktile,11,0,275.6582,a8w8_blockscale_cktile_192x256x128_4x2x1_16x16x128_intrawave_0x1x0_1,1427.65,846.48,0.0
gfx950,256,8099,12288,2048,cktile,27,0,279.7303,a8w8_blockscale_cktile_192x256x128_4x2x1_16x16x128_intrawave_0x1x0_2,1457.25,860.81,0.0
gfx950,256,8129,12288,2048,cktile,27,0,280.3767,a8w8_blockscale_cktile_192x256x128_4x2x1_16x16x128_intrawave_0x1x0_2,1459.27,861.67,0.0
gfx950,256,8188,12288,2048,cktile,11,0,282.1891,a8w8_blockscale_cktile_192x256x128_4x2x1_16x16x128_intrawave_0x1x0_1,1460.42,861.7,0.0
gfx950,256,8192,12288,2048,cktile,28,0,280.0591,a8w8_blockscale_cktile_192x256x128_4x2x1_16x16x128_intrawave_0x1x0_3,1472.25,868.64,0.0
