aiter/configs/model_configs/qwen3next_80b_fp8_tuned_fmoe.csv
cu_num,token,model_dim,inter_dim,expert,topk,act_type,dtype,q_dtype_a,q_dtype_w,q_type,use_g1u1,doweight_stage1,block_m,ksplit,us1,kernelName1,err1,us2,kernelName2,err2,us,run_1stage,tflops,bw
256,1,2048,512,512,10,ActivationType.Silu,torch.bfloat16,torch.float8_e4m3fn,torch.float8_e4m3fn,QuantType.per_1x128,1,0,16,0,0,_ZN5aiter48fmoe_bf16_blockscaleBf16_g1u1_vs_pf2_silu_16x128E,0,0,,0,33.338,True,0,0
256,2,2048,512,512,10,ActivationType.Silu,torch.bfloat16,torch.float8_e4m3fn,torch.float8_e4m3fn,QuantType.per_1x128,1,0,16,0,0,_ZN5aiter48fmoe_bf16_blockscaleBf16_g1u1_vs_pf2_silu_16x128E,0,0,,0,35.9082,True,0,0
256,4,2048,512,512,10,ActivationType.Silu,torch.bfloat16,torch.float8_e4m3fn,torch.float8_e4m3fn,QuantType.per_1x128,1,0,16,0,0,_ZN5aiter48fmoe_bf16_blockscaleBf16_g1u1_vs_pf2_silu_16x128E,0,0,,0,41.028,True,0,0
256,8,2048,512,512,10,ActivationType.Silu,torch.bfloat16,torch.float8_e4m3fn,torch.float8_e4m3fn,QuantType.per_1x128,1,0,16,0,0,_ZN5aiter48fmoe_bf16_blockscaleBf16_g1u1_vs_pf2_silu_16x256E,0,0,,0,62.518,True,0,0
256,16,2048,512,512,10,ActivationType.Silu,torch.bfloat16,torch.float8_e4m3fn,torch.float8_e4m3fn,QuantType.per_1x128,1,0,16,0,0,_ZN5aiter48fmoe_bf16_blockscaleBf16_g1u1_vs_pf2_silu_16x128E,0,0,,0,100.878,True,0,0
256,32,2048,512,512,10,ActivationType.Silu,torch.bfloat16,torch.float8_e4m3fn,torch.float8_e4m3fn,QuantType.per_1x128,1,0,32,0,0,_ZN5aiter47fmoe_bf16_blockscaleBf16_g1u1_vs_ps_silu_32x256E,0,0,,0,142.568,True,0,0
256,64,2048,512,512,10,ActivationType.Silu,torch.bfloat16,torch.float8_e4m3fn,torch.float8_e4m3fn,QuantType.per_1x128,1,0,16,0,0,_ZN5aiter48fmoe_bf16_blockscaleBf16_g1u1_vs_pf2_silu_16x128E,0,0,,0,216.709,True,0,0
256,128,2048,512,512,10,ActivationType.Silu,torch.bfloat16,torch.float8_e4m3fn,torch.float8_e4m3fn,QuantType.per_1x128,1,0,32,0,0,_ZN5aiter47fmoe_bf16_blockscaleBf16_g1u1_vs_ps_silu_32x256E,0,0,,0,278.569,True,0,0
256,256,2048,512,512,10,ActivationType.Silu,torch.bfloat16,torch.float8_e4m3fn,torch.float8_e4m3fn,QuantType.per_1x128,1,0,32,0,0,_ZN5aiter47fmoe_bf16_blockscaleBf16_g1u1_vs_ps_silu_32x256E,0,0,,0,311.919,True,0,0
256,512,2048,512,512,10,ActivationType.Silu,torch.bfloat16,torch.float8_e4m3fn,torch.float8_e4m3fn,QuantType.per_1x128,1,0,32,0,0,_ZN5aiter47fmoe_bf16_blockscaleBf16_g1u1_vs_ps_silu_32x256E,0,0,,0,323.629,True,0,0
256,1024,2048,512,512,10,ActivationType.Silu,torch.bfloat16,torch.float8_e4m3fn,torch.float8_e4m3fn,QuantType.per_1x128,1,0,64,0,0,_ZN5aiter46fmoe_bf16_blockscaleFp8_g1u1_vs_ps_silu_64x256E,0,0,,0,332.878,True,0,0
256,2048,2048,512,512,10,ActivationType.Silu,torch.bfloat16,torch.float8_e4m3fn,torch.float8_e4m3fn,QuantType.per_1x128,1,0,64,0,0,_ZN5aiter46fmoe_bf16_blockscaleFp8_g1u1_vs_ps_silu_64x256E,0,0,,0,370.947,True,0,0
256,4096,2048,512,512,10,ActivationType.Silu,torch.bfloat16,torch.float8_e4m3fn,torch.float8_e4m3fn,QuantType.per_1x128,1,0,64,0,0,_ZN5aiter46fmoe_bf16_blockscaleFp8_g1u1_vs_ps_silu_64x256E,0,0,,0,512.229,True,0,0
256,8192,2048,512,512,10,ActivationType.Silu,torch.bfloat16,torch.float8_e4m3fn,torch.float8_e4m3fn,QuantType.per_1x128,1,0,64,0,0,_ZN5aiter46fmoe_bf16_blockscaleFp8_g1u1_vs_ps_silu_64x256E,0,0,,0,791.341,True,0,0
256,16384,2048,512,512,10,ActivationType.Silu,torch.bfloat16,torch.float8_e4m3fn,torch.float8_e4m3fn,QuantType.per_1x128,1,0,64,0,0,_ZN5aiter46fmoe_bf16_blockscaleFp8_g1u1_vs_ps_silu_64x256E,0,0,,0,1428.96,True,0,0
256,32768,2048,512,512,10,ActivationType.Silu,torch.bfloat16,torch.float8_e4m3fn,torch.float8_e4m3fn,QuantType.per_1x128,1,0,64,0,0,_ZN5aiter46fmoe_bf16_blockscaleFp8_g1u1_vs_ps_silu_64x256E,0,0,,0,2805.44,True,0,0
256,1,2048,512,513,11,ActivationType.Silu,torch.bfloat16,torch.float8_e4m3fn,torch.float8_e4m3fn,QuantType.per_1x128,1,0,,0,0,_ZN5aiter48fmoe_bf16_blockscaleBf16_g1u1_vs_pf2_silu_16x128E,0,0,,0,34.4782,True,0,0
256,2,2048,512,513,11,ActivationType.Silu,torch.bfloat16,torch.float8_e4m3fn,torch.float8_e4m3fn,QuantType.per_1x128,1,0,,0,0,_ZN5aiter48fmoe_bf16_blockscaleBf16_g1u1_vs_pf2_silu_16x128E,0,0,,0,39.208,True,0,0
256,4,2048,512,513,11,ActivationType.Silu,torch.bfloat16,torch.float8_e4m3fn,torch.float8_e4m3fn,QuantType.per_1x128,1,0,,0,0,_ZN5aiter48fmoe_bf16_blockscaleBf16_g1u1_vs_pf2_silu_16x128E,0,0,,0,42.8482,True,0,0
256,8,2048,512,513,11,ActivationType.Silu,torch.bfloat16,torch.float8_e4m3fn,torch.float8_e4m3fn,QuantType.per_1x128,1,0,,0,0,_ZN5aiter47fmoe_bf16_blockscaleBf16_g1u1_vs_ps_silu_32x256E,0,0,,0,65.9985,True,0,0
256,16,2048,512,513,11,ActivationType.Silu,torch.bfloat16,torch.float8_e4m3fn,torch.float8_e4m3fn,QuantType.per_1x128,1,0,,0,0,_ZN5aiter48fmoe_bf16_blockscaleBf16_g1u1_vs_pf2_silu_16x128E,0,0,,0,100.338,True,0,0
256,32,2048,512,513,11,ActivationType.Silu,torch.bfloat16,torch.float8_e4m3fn,torch.float8_e4m3fn,QuantType.per_1x128,1,0,,0,0,_ZN5aiter48fmoe_bf16_blockscaleBf16_g1u1_vs_pf2_silu_16x128E,0,0,,0,147.428,True,0,0
256,64,2048,512,513,11,ActivationType.Silu,torch.bfloat16,torch.float8_e4m3fn,torch.float8_e4m3fn,QuantType.per_1x128,1,0,,0,0,_ZN5aiter47fmoe_bf16_blockscaleFp8_g1u1_vs_pf2_silu_16x128E,0,0,,0,231.268,True,0,0
256,128,2048,512,513,11,ActivationType.Silu,torch.bfloat16,torch.float8_e4m3fn,torch.float8_e4m3fn,QuantType.per_1x128,1,0,,0,0,_ZN5aiter47fmoe_bf16_blockscaleBf16_g1u1_vs_ps_silu_32x256E,0,0,,0,283.609,True,0,0
256,256,2048,512,513,11,ActivationType.Silu,torch.bfloat16,torch.float8_e4m3fn,torch.float8_e4m3fn,QuantType.per_1x128,1,0,,0,0,_ZN5aiter46fmoe_bf16_blockscaleFp8_g1u1_vs_ps_silu_64x256E,0,0,,0,319.948,True,0,0
256,512,2048,512,513,11,ActivationType.Silu,torch.bfloat16,torch.float8_e4m3fn,torch.float8_e4m3fn,QuantType.per_1x128,1,0,,0,0,_ZN5aiter46fmoe_bf16_blockscaleFp8_g1u1_vs_ps_silu_64x256E,0,0,,0,333.727,True,0,0
256,1024,2048,512,513,11,ActivationType.Silu,torch.bfloat16,torch.float8_e4m3fn,torch.float8_e4m3fn,QuantType.per_1x128,1,0,,0,0,_ZN5aiter46fmoe_bf16_blockscaleFp8_g1u1_vs_ps_silu_64x256E,0,0,,0,350.808,True,0,0
256,2048,2048,512,513,11,ActivationType.Silu,torch.bfloat16,torch.float8_e4m3fn,torch.float8_e4m3fn,QuantType.per_1x128,1,0,,0,0,_ZN5aiter46fmoe_bf16_blockscaleFp8_g1u1_vs_ps_silu_64x256E,0,0,,0,392.876,True,0,0
256,4096,2048,512,513,11,ActivationType.Silu,torch.bfloat16,torch.float8_e4m3fn,torch.float8_e4m3fn,QuantType.per_1x128,1,0,,0,0,_ZN5aiter46fmoe_bf16_blockscaleFp8_g1u1_vs_ps_silu_64x256E,0,0,,0,537.348,True,0,0
256,8192,2048,512,513,11,ActivationType.Silu,torch.bfloat16,torch.float8_e4m3fn,torch.float8_e4m3fn,QuantType.per_1x128,1,0,,0,0,_ZN5aiter46fmoe_bf16_blockscaleFp8_g1u1_vs_ps_silu_64x256E,0,0,,0,839.75,True,0,0
256,16384,2048,512,513,11,ActivationType.Silu,torch.bfloat16,torch.float8_e4m3fn,torch.float8_e4m3fn,QuantType.per_1x128,1,0,,0,0,_ZN5aiter46fmoe_bf16_blockscaleFp8_g1u1_vs_ps_silu_64x256E,0,0,,0,1565.37,True,0,0
256,32768,2048,512,513,11,ActivationType.Silu,torch.bfloat16,torch.float8_e4m3fn,torch.float8_e4m3fn,QuantType.per_1x128,1,0,,0,0,_ZN5aiter46fmoe_bf16_blockscaleFp8_g1u1_vs_ps_silu_64x256E,0,0,,0,3040.33,True,0,0
256,1,2048,256,512,10,ActivationType.Silu,torch.bfloat16,torch.float8_e4m3fn,torch.float8_e4m3fn,QuantType.per_1x128,1,0,16,0,0,_ZN5aiter48fmoe_bf16_blockscaleBf16_g1u1_vs_pf2_silu_16x128E,0,0,,0,32.078,True,0,0
256,2,2048,256,512,10,ActivationType.Silu,torch.bfloat16,torch.float8_e4m3fn,torch.float8_e4m3fn,QuantType.per_1x128,1,0,16,0,0,_ZN5aiter48fmoe_bf16_blockscaleBf16_g1u1_vs_pf2_silu_16x128E,0,0,,0,32.9485,True,0,0
256,4,2048,256,512,10,ActivationType.Silu,torch.bfloat16,torch.float8_e4m3fn,torch.float8_e4m3fn,QuantType.per_1x128,1,0,16,0,0,_ZN5aiter48fmoe_bf16_blockscaleBf16_g1u1_vs_pf2_silu_16x128E,0,0,,0,36.6985,True,0,0
256,8,2048,256,512,10,ActivationType.Silu,torch.bfloat16,torch.float8_e4m3fn,torch.float8_e4m3fn,QuantType.per_1x128,1,0,16,0,0,_ZN5aiter48fmoe_bf16_blockscaleBf16_g1u1_vs_pf2_silu_16x128E,0,0,,0,41.3085,True,0,0
256,16,2048,256,512,10,ActivationType.Silu,torch.bfloat16,torch.float8_e4m3fn,torch.float8_e4m3fn,QuantType.per_1x128,1,0,32,0,0,_ZN5aiter47fmoe_bf16_blockscaleBf16_g1u1_vs_ps_silu_32x256E,0,0,,0,54.237,True,0,0
256,32,2048,256,512,10,ActivationType.Silu,torch.bfloat16,torch.float8_e4m3fn,torch.float8_e4m3fn,QuantType.per_1x128,1,0,32,0,0,_ZN5aiter47fmoe_bf16_blockscaleBf16_g1u1_vs_ps_silu_32x256E,0,0,,0,79.007,True,0,0
256,64,2048,256,512,10,ActivationType.Silu,torch.bfloat16,torch.float8_e4m3fn,torch.float8_e4m3fn,QuantType.per_1x128,1,0,32,0,0,_ZN5aiter47fmoe_bf16_blockscaleBf16_g1u1_vs_ps_silu_32x128E,0,0,,0,115.888,True,0,0
256,128,2048,256,512,10,ActivationType.Silu,torch.bfloat16,torch.float8_e4m3fn,torch.float8_e4m3fn,QuantType.per_1x128,1,0,32,0,0,_ZN5aiter47fmoe_bf16_blockscaleBf16_g1u1_vs_ps_silu_32x256E,0,0,,0,143.008,True,0,0
256,256,2048,256,512,10,ActivationType.Silu,torch.bfloat16,torch.float8_e4m3fn,torch.float8_e4m3fn,QuantType.per_1x128,1,0,32,0,0,_ZN5aiter47fmoe_bf16_blockscaleBf16_g1u1_vs_ps_silu_32x256E,0,0,,0,161.078,True,0,0
256,512,2048,256,512,10,ActivationType.Silu,torch.bfloat16,torch.float8_e4m3fn,torch.float8_e4m3fn,QuantType.per_1x128,1,0,64,0,0,_ZN5aiter46fmoe_bf16_blockscaleFp8_g1u1_vs_ps_silu_64x256E,0,0,,0,166.167,True,0,0
256,1024,2048,256,512,10,ActivationType.Silu,torch.bfloat16,torch.float8_e4m3fn,torch.float8_e4m3fn,QuantType.per_1x128,1,0,64,0,0,_ZN5aiter46fmoe_bf16_blockscaleFp8_g1u1_vs_ps_silu_64x256E,0,0,,0,175.367,True,0,0
256,2048,2048,256,512,10,ActivationType.Silu,torch.bfloat16,torch.float8_e4m3fn,torch.float8_e4m3fn,QuantType.per_1x128,1,0,64,0,0,_ZN5aiter46fmoe_bf16_blockscaleFp8_g1u1_vs_ps_silu_64x256E,0,0,,0,202.256,True,0,0
256,4096,2048,256,512,10,ActivationType.Silu,torch.bfloat16,torch.float8_e4m3fn,torch.float8_e4m3fn,QuantType.per_1x128,1,0,64,0,0,_ZN5aiter46fmoe_bf16_blockscaleFp8_g1u1_vs_ps_silu_64x256E,0,0,,0,281.827,True,0,0
256,8192,2048,256,512,10,ActivationType.Silu,torch.bfloat16,torch.float8_e4m3fn,torch.float8_e4m3fn,QuantType.per_1x128,1,0,64,0,0,_ZN5aiter46fmoe_bf16_blockscaleFp8_g1u1_vs_ps_silu_64x256E,0,0,,0,436.287,True,0,0
256,16384,2048,256,512,10,ActivationType.Silu,torch.bfloat16,torch.float8_e4m3fn,torch.float8_e4m3fn,QuantType.per_1x128,1,0,64,0,0,_ZN5aiter46fmoe_bf16_blockscaleFp8_g1u1_vs_ps_silu_64x256E,0,0,,0,777.231,True,0,0
256,32768,2048,256,512,10,ActivationType.Silu,torch.bfloat16,torch.float8_e4m3fn,torch.float8_e4m3fn,QuantType.per_1x128,1,0,64,0,0,_ZN5aiter46fmoe_bf16_blockscaleFp8_g1u1_vs_ps_silu_64x256E,0,0,,0,1491.88,True,0,0
256,1,2048,256,513,11,ActivationType.Silu,torch.bfloat16,torch.float8_e4m3fn,torch.float8_e4m3fn,QuantType.per_1x128,1,0,,0,0,_ZN5aiter48fmoe_bf16_blockscaleBf16_g1u1_vs_pf2_silu_16x128E,0,0,,0,35.028,True,0,0
256,2,2048,256,513,11,ActivationType.Silu,torch.bfloat16,torch.float8_e4m3fn,torch.float8_e4m3fn,QuantType.per_1x128,1,0,,0,0,_ZN5aiter48fmoe_bf16_blockscaleBf16_g1u1_vs_pf2_silu_16x128E,0,0,,0,37.2487,True,0,0
256,4,2048,256,513,11,ActivationType.Silu,torch.bfloat16,torch.float8_e4m3fn,torch.float8_e4m3fn,QuantType.per_1x128,1,0,,0,0,_ZN5aiter47fmoe_bf16_blockscaleBf16_g1u1_vs_ps_silu_32x128E,0,0,,0,41.4282,True,0,0
256,8,2048,256,513,11,ActivationType.Silu,torch.bfloat16,torch.float8_e4m3fn,torch.float8_e4m3fn,QuantType.per_1x128,1,0,,0,0,_ZN5aiter47fmoe_bf16_blockscaleBf16_g1u1_vs_ps_silu_32x128E,0,0,,0,46.5287,True,0,0
256,16,2048,256,513,11,ActivationType.Silu,torch.bfloat16,torch.float8_e4m3fn,torch.float8_e4m3fn,QuantType.per_1x128,1,0,,0,0,_ZN5aiter47fmoe_bf16_blockscaleBf16_g1u1_vs_ps_silu_32x256E,0,0,,0,57.0973,True,0,0
256,32,2048,256,513,11,ActivationType.Silu,torch.bfloat16,torch.float8_e4m3fn,torch.float8_e4m3fn,QuantType.per_1x128,1,0,,0,0,_ZN5aiter48fmoe_bf16_blockscaleBf16_g1u1_vs_pf2_silu_16x256E,0,0,,0,85.778,True,0,0
256,64,2048,256,513,11,ActivationType.Silu,torch.bfloat16,torch.float8_e4m3fn,torch.float8_e4m3fn,QuantType.per_1x128,1,0,,0,0,_ZN5aiter47fmoe_bf16_blockscaleBf16_g1u1_vs_ps_silu_32x256E,0,0,,0,124.928,True,0,0
256,128,2048,256,513,11,ActivationType.Silu,torch.bfloat16,torch.float8_e4m3fn,torch.float8_e4m3fn,QuantType.per_1x128,1,0,,0,0,_ZN5aiter47fmoe_bf16_blockscaleBf16_g1u1_vs_ps_silu_32x256E,0,0,,0,152.738,True,0,0
256,256,2048,256,513,11,ActivationType.Silu,torch.bfloat16,torch.float8_e4m3fn,torch.float8_e4m3fn,QuantType.per_1x128,1,0,,0,0,_ZN5aiter47fmoe_bf16_blockscaleBf16_g1u1_vs_ps_silu_32x256E,0,0,,0,180.498,True,0,0
256,512,2048,256,513,11,ActivationType.Silu,torch.bfloat16,torch.float8_e4m3fn,torch.float8_e4m3fn,QuantType.per_1x128,1,0,,0,0,_ZN5aiter47fmoe_bf16_blockscaleBf16_g1u1_vs_ps_silu_32x256E,0,0,,0,184.378,True,0,0
256,1024,2048,256,513,11,ActivationType.Silu,torch.bfloat16,torch.float8_e4m3fn,torch.float8_e4m3fn,QuantType.per_1x128,1,0,,0,0,_ZN5aiter46fmoe_bf16_blockscaleFp8_g1u1_vs_ps_silu_64x256E,0,0,,0,205.368,True,0,0
256,2048,2048,256,513,11,ActivationType.Silu,torch.bfloat16,torch.float8_e4m3fn,torch.float8_e4m3fn,QuantType.per_1x128,1,0,,0,0,_ZN5aiter46fmoe_bf16_blockscaleFp8_g1u1_vs_ps_silu_64x256E,0,0,,0,236.956,True,0,0
256,4096,2048,256,513,11,ActivationType.Silu,torch.bfloat16,torch.float8_e4m3fn,torch.float8_e4m3fn,QuantType.per_1x128,1,0,,0,0,_ZN5aiter46fmoe_bf16_blockscaleFp8_g1u1_vs_ps_silu_64x256E,0,0,,0,282.756,True,0,0
256,8192,2048,256,513,11,ActivationType.Silu,torch.bfloat16,torch.float8_e4m3fn,torch.float8_e4m3fn,QuantType.per_1x128,1,0,,0,0,_ZN5aiter46fmoe_bf16_blockscaleFp8_g1u1_vs_ps_silu_64x256E,0,0,,0,491.908,True,0,0
256,16384,2048,256,513,11,ActivationType.Silu,torch.bfloat16,torch.float8_e4m3fn,torch.float8_e4m3fn,QuantType.per_1x128,1,0,,0,0,_ZN5aiter46fmoe_bf16_blockscaleFp8_g1u1_vs_ps_silu_64x256E,0,0,,0,854.931,True,0,0
256,32768,2048,256,513,11,ActivationType.Silu,torch.bfloat16,torch.float8_e4m3fn,torch.float8_e4m3fn,QuantType.per_1x128,1,0,,0,0,_ZN5aiter46fmoe_bf16_blockscaleFp8_g1u1_vs_ps_silu_64x256E,0,0,,0,1630.82,True,0,0
256,1,2048,128,512,10,ActivationType.Silu,torch.bfloat16,torch.float8_e4m3fn,torch.float8_e4m3fn,QuantType.per_1x128,1,0,16,0,0,_ZN5aiter48fmoe_bf16_blockscaleBf16_g1u1_vs_pf2_silu_16x128E,0,0,,0,30.5985,True,0,0
256,2,2048,128,512,10,ActivationType.Silu,torch.bfloat16,torch.float8_e4m3fn,torch.float8_e4m3fn,QuantType.per_1x128,1,0,16,0,0,_ZN5aiter48fmoe_bf16_blockscaleBf16_g1u1_vs_pf2_silu_16x128E,0,0,,0,31.7583,True,0,0
256,4,2048,128,512,10,ActivationType.Silu,torch.bfloat16,torch.float8_e4m3fn,torch.float8_e4m3fn,QuantType.per_1x128,1,0,16,0,0,_ZN5aiter48fmoe_bf16_blockscaleBf16_g1u1_vs_pf2_silu_16x128E,0,0,,0,33.5285,True,0,0
256,8,2048,128,512,10,ActivationType.Silu,torch.bfloat16,torch.float8_e4m3fn,torch.float8_e4m3fn,QuantType.per_1x128,1,0,16,0,0,_ZN5aiter48fmoe_bf16_blockscaleBf16_g1u1_vs_pf2_silu_16x128E,0,0,,0,36.3283,True,0,0
256,16,2048,128,512,10,ActivationType.Silu,torch.bfloat16,torch.float8_e4m3fn,torch.float8_e4m3fn,QuantType.per_1x128,1,0,16,0,0,_ZN5aiter48fmoe_bf16_blockscaleBf16_g1u1_vs_pf2_silu_16x128E,0,0,,0,35.6275,True,0,0
256,32,2048,128,512,10,ActivationType.Silu,torch.bfloat16,torch.float8_e4m3fn,torch.float8_e4m3fn,QuantType.per_1x128,1,0,16,0,0,_ZN5aiter48fmoe_bf16_blockscaleBf16_g1u1_vs_pf2_silu_16x128E,0,0,,0,45.0675,True,0,0
256,64,2048,128,512,10,ActivationType.Silu,torch.bfloat16,torch.float8_e4m3fn,torch.float8_e4m3fn,QuantType.per_1x128,1,0,32,0,0,_ZN5aiter47fmoe_bf16_blockscaleBf16_g1u1_vs_ps_silu_32x128E,0,0,,0,69.9578,True,0,0
256,128,2048,128,512,10,ActivationType.Silu,torch.bfloat16,torch.float8_e4m3fn,torch.float8_e4m3fn,QuantType.per_1x128,1,0,32,0,0,_ZN5aiter47fmoe_bf16_blockscaleBf16_g1u1_vs_ps_silu_32x128E,0,0,,0,81.7177,True,0,0
256,256,2048,128,512,10,ActivationType.Silu,torch.bfloat16,torch.float8_e4m3fn,torch.float8_e4m3fn,QuantType.per_1x128,1,0,64,0,0,_ZN5aiter46fmoe_bf16_blockscaleFp8_g1u1_vs_ps_silu_64x128E,0,0,,0,97.5868,True,0,0
256,512,2048,128,512,10,ActivationType.Silu,torch.bfloat16,torch.float8_e4m3fn,torch.float8_e4m3fn,QuantType.per_1x128,1,0,64,0,0,_ZN5aiter46fmoe_bf16_blockscaleFp8_g1u1_vs_ps_silu_64x128E,0,0,,0,101.327,True,0,0
256,1024,2048,128,512,10,ActivationType.Silu,torch.bfloat16,torch.float8_e4m3fn,torch.float8_e4m3fn,QuantType.per_1x128,1,0,64,0,0,_ZN5aiter46fmoe_bf16_blockscaleFp8_g1u1_vs_ps_silu_64x128E,0,0,,0,107.727,True,0,0
256,2048,2048,128,512,10,ActivationType.Silu,torch.bfloat16,torch.float8_e4m3fn,torch.float8_e4m3fn,QuantType.per_1x128,1,0,64,0,0,_ZN5aiter46fmoe_bf16_blockscaleFp8_g1u1_vs_ps_silu_64x128E,0,0,,0,145.285,True,0,0
256,4096,2048,128,512,10,ActivationType.Silu,torch.bfloat16,torch.float8_e4m3fn,torch.float8_e4m3fn,QuantType.per_1x128,1,0,64,0,0,_ZN5aiter46fmoe_bf16_blockscaleFp8_g1u1_vs_ps_silu_64x128E,0,0,,0,224.186,True,0,0
256,8192,2048,128,512,10,ActivationType.Silu,torch.bfloat16,torch.float8_e4m3fn,torch.float8_e4m3fn,QuantType.per_1x128,1,0,64,0,0,_ZN5aiter46fmoe_bf16_blockscaleFp8_g1u1_vs_ps_silu_64x128E,0,0,,0,367.827,True,0,0
256,16384,2048,128,512,10,ActivationType.Silu,torch.bfloat16,torch.float8_e4m3fn,torch.float8_e4m3fn,QuantType.per_1x128,1,0,64,0,0,_ZN5aiter46fmoe_bf16_blockscaleFp8_g1u1_vs_ps_silu_64x128E,0,0,,0,668.56,True,0,0
256,32768,2048,128,512,10,ActivationType.Silu,torch.bfloat16,torch.float8_e4m3fn,torch.float8_e4m3fn,QuantType.per_1x128,1,0,64,0,0,_ZN5aiter46fmoe_bf16_blockscaleFp8_g1u1_vs_ps_silu_64x128E,0,0,,0,1294.37,True,0,0
256,1,2048,128,513,11,ActivationType.Silu,torch.bfloat16,torch.float8_e4m3fn,torch.float8_e4m3fn,QuantType.per_1x128,1,0,,0,0,_ZN5aiter48fmoe_bf16_blockscaleBf16_g1u1_vs_pf2_silu_16x128E,0,0,,0,30.9183,True,0,0
256,2,2048,128,513,11,ActivationType.Silu,torch.bfloat16,torch.float8_e4m3fn,torch.float8_e4m3fn,QuantType.per_1x128,1,0,,0,0,_ZN5aiter48fmoe_bf16_blockscaleBf16_g1u1_vs_pf2_silu_16x128E,0,0,,0,31.9787,True,0,0
256,4,2048,128,513,11,ActivationType.Silu,torch.bfloat16,torch.float8_e4m3fn,torch.float8_e4m3fn,QuantType.per_1x128,1,0,,0,0,_ZN5aiter48fmoe_bf16_blockscaleBf16_g1u1_vs_pf2_silu_16x128E,0,0,,0,34.479,True,0,0
256,8,2048,128,513,11,ActivationType.Silu,torch.bfloat16,torch.float8_e4m3fn,torch.float8_e4m3fn,QuantType.per_1x128,1,0,,0,0,_ZN5aiter48fmoe_bf16_blockscaleBf16_g1u1_vs_pf2_silu_16x128E,0,0,,0,38.2583,True,0,0
256,16,2048,128,513,11,ActivationType.Silu,torch.bfloat16,torch.float8_e4m3fn,torch.float8_e4m3fn,QuantType.per_1x128,1,0,,0,0,_ZN5aiter48fmoe_bf16_blockscaleBf16_g1u1_vs_pf2_silu_16x128E,0,0,,0,36.8378,True,0,0
256,32,2048,128,513,11,ActivationType.Silu,torch.bfloat16,torch.float8_e4m3fn,torch.float8_e4m3fn,QuantType.per_1x128,1,0,,0,0,_ZN5aiter47fmoe_bf16_blockscaleBf16_g1u1_vs_ps_silu_32x128E,0,0,,0,50.3875,True,0,0
256,64,2048,128,513,11,ActivationType.Silu,torch.bfloat16,torch.float8_e4m3fn,torch.float8_e4m3fn,QuantType.per_1x128,1,0,,0,0,_ZN5aiter48fmoe_bf16_blockscaleBf16_g1u1_vs_pf2_silu_16x128E,0,0,,0,70.2078,True,0,0
256,128,2048,128,513,11,ActivationType.Silu,torch.bfloat16,torch.float8_e4m3fn,torch.float8_e4m3fn,QuantType.per_1x128,1,0,,0,0,_ZN5aiter48fmoe_bf16_blockscaleBf16_g1u1_vs_pf2_silu_16x128E,0,0,,0,82.3072,True,0,0
256,256,2048,128,513,11,ActivationType.Silu,torch.bfloat16,torch.float8_e4m3fn,torch.float8_e4m3fn,QuantType.per_1x128,1,0,,0,0,_ZN5aiter47fmoe_bf16_blockscaleBf16_g1u1_vs_ps_silu_32x128E,0,0,,0,95.5875,True,0,0
256,512,2048,128,513,11,ActivationType.Silu,torch.bfloat16,torch.float8_e4m3fn,torch.float8_e4m3fn,QuantType.per_1x128,1,0,,0,0,_ZN5aiter48fmoe_bf16_blockscaleBf16_g1u1_vs_pf2_silu_16x128E,0,0,,0,107.238,True,0,0
256,1024,2048,128,513,11,ActivationType.Silu,torch.bfloat16,torch.float8_e4m3fn,torch.float8_e4m3fn,QuantType.per_1x128,1,0,,0,0,_ZN5aiter46fmoe_bf16_blockscaleFp8_g1u1_vs_ps_silu_64x128E,0,0,,0,130.147,True,0,0
256,2048,2048,128,513,11,ActivationType.Silu,torch.bfloat16,torch.float8_e4m3fn,torch.float8_e4m3fn,QuantType.per_1x128,1,0,,0,0,_ZN5aiter46fmoe_bf16_blockscaleFp8_g1u1_vs_ps_silu_64x128E,0,0,,0,177.706,True,0,0
256,4096,2048,128,513,11,ActivationType.Silu,torch.bfloat16,torch.float8_e4m3fn,torch.float8_e4m3fn,QuantType.per_1x128,1,0,,0,0,_ZN5aiter46fmoe_bf16_blockscaleFp8_g1u1_vs_ps_silu_64x128E,0,0,,0,242.846,True,0,0
256,8192,2048,128,513,11,ActivationType.Silu,torch.bfloat16,torch.float8_e4m3fn,torch.float8_e4m3fn,QuantType.per_1x128,1,0,,0,0,_ZN5aiter46fmoe_bf16_blockscaleFp8_g1u1_vs_ps_silu_64x128E,0,0,,0,416.107,True,0,0
256,16384,2048,128,513,11,ActivationType.Silu,torch.bfloat16,torch.float8_e4m3fn,torch.float8_e4m3fn,QuantType.per_1x128,1,0,,0,0,_ZN5aiter46fmoe_bf16_blockscaleFp8_g1u1_vs_ps_silu_64x128E,0,0,,0,738.389,True,0,0
256,32768,2048,128,513,11,ActivationType.Silu,torch.bfloat16,torch.float8_e4m3fn,torch.float8_e4m3fn,QuantType.per_1x128,1,0,,0,0,_ZN5aiter46fmoe_bf16_blockscaleFp8_g1u1_vs_ps_silu_64x128E,0,0,,0,1413.57,True,0,0
