aiter/configs/model_configs/qwen3next_80b_fp8_tuned_fmoe.csv
cu_num,token,model_dim,inter_dim,expert,topk,act_type,dtype,q_dtype_a,q_dtype_w,q_type,use_g1u1,doweight_stage1,block_m,ksplit,us1,kernelName1,err1,us2,kernelName2,err2,us,run_1stage,xbf16,fused,tflops,bw,_tag
256,1,2048,512,512,10,ActivationType.Silu,torch.bfloat16,torch.float8_e4m3fn,torch.float8_e4m3fn,QuantType.per_1x128,1,0,1,0,27.4383,_ZN5aiter50fmoe_bf16_blockscaleFp8_g1u1_flat_vs_ps_silu_1x128E,0.0%,0.0,,0.0%,27.4383,1,1,1,2.29,58699.66,
256,2,2048,512,512,10,ActivationType.Silu,torch.bfloat16,torch.float8_e4m3fn,torch.float8_e4m3fn,QuantType.per_1x128,1,0,1,0,28.7441,_ZN5aiter50fmoe_bf16_blockscaleFp8_g1u1_flat_vs_ps_silu_1x128E,0.0%,0.0,,0.0%,28.7441,1,1,1,4.38,56033.24,
256,4,2048,512,512,10,ActivationType.Silu,torch.bfloat16,torch.float8_e4m3fn,torch.float8_e4m3fn,QuantType.per_1x128,1,0,1,0,33.3477,_ZN5aiter50fmoe_bf16_blockscaleFp8_g1u1_flat_vs_ps_silu_1x128E,0.0%,0.0,,0.0%,33.3477,1,1,1,7.55,48298.3,
256,8,2048,512,512,10,ActivationType.Silu,torch.bfloat16,torch.float8_e4m3fn,torch.float8_e4m3fn,QuantType.per_1x128,1,0,1,0,54.1632,_ZN5aiter50fmoe_bf16_blockscaleFp8_g1u1_flat_vs_ps_silu_1x256E,0.0%,0.0,,0.0%,54.1632,1,1,1,9.29,29737.2,
256,16,2048,512,512,10,ActivationType.Silu,torch.bfloat16,torch.float8_e4m3fn,torch.float8_e4m3fn,QuantType.per_1x128,1,0,1,0,93.4505,_ZN5aiter50fmoe_bf16_blockscaleFp8_g1u1_flat_vs_ps_silu_1x128E,0.0%,0.0,,0.0%,93.4505,1,1,1,10.77,17235.98,
256,32,2048,512,512,10,ActivationType.Silu,torch.bfloat16,torch.float8_e4m3fn,torch.float8_e4m3fn,QuantType.per_1x128,1,0,32,0,148.2115,_ZN5aiter47fmoe_bf16_blockscaleBf16_g1u1_vs_ps_silu_32x256E,0.0%,0.0,,0.0%,148.2115,1,1,0,13.58,10868.32,
256,64,2048,512,512,10,ActivationType.Silu,torch.bfloat16,torch.float8_e4m3fn,torch.float8_e4m3fn,QuantType.per_1x128,1,0,16,0,218.6945,_ZN5aiter48fmoe_bf16_blockscaleBf16_g1u1_vs_pf2_silu_16x128E,0.0%,0.0,,0.0%,218.6945,1,1,0,18.41,7366.47,
256,128,2048,512,512,10,ActivationType.Silu,torch.bfloat16,torch.float8_e4m3fn,torch.float8_e4m3fn,QuantType.per_1x128,1,0,32,0,278.3974,_ZN5aiter47fmoe_bf16_blockscaleBf16_g1u1_vs_ps_silu_32x256E,0.0%,0.0,,0.0%,278.3974,1,1,0,28.93,5788.13,
256,256,2048,512,512,10,ActivationType.Silu,torch.bfloat16,torch.float8_e4m3fn,torch.float8_e4m3fn,QuantType.per_1x128,1,0,32,0,315.1512,_ZN5aiter47fmoe_bf16_blockscaleBf16_g1u1_vs_ps_silu_32x256E,0.0%,0.0,,0.0%,315.1512,1,1,0,51.11,5115.59,
256,512,2048,512,512,10,ActivationType.Silu,torch.bfloat16,torch.float8_e4m3fn,torch.float8_e4m3fn,QuantType.per_1x128,1,0,32,0,326.3176,_ZN5aiter47fmoe_bf16_blockscaleBf16_g1u1_vs_ps_silu_32x256E,0.0%,0.0,,0.0%,326.3176,1,1,0,98.71,4945.36,
256,1024,2048,512,512,10,ActivationType.Silu,torch.bfloat16,torch.float8_e4m3fn,torch.float8_e4m3fn,QuantType.per_1x128,1,0,64,0,332.8045,_ZN5aiter46fmoe_bf16_blockscaleFp8_g1u1_vs_ps_silu_64x256E,0.0%,0.0,,0.0%,332.8045,1,0,0,193.58,4858.42,
256,2048,2048,512,512,10,ActivationType.Silu,torch.bfloat16,torch.float8_e4m3fn,torch.float8_e4m3fn,QuantType.per_1x128,1,0,64,0,372.4883,_ZN5aiter46fmoe_bf16_blockscaleFp8_g1u1_vs_ps_silu_64x256E,0.0%,0.0,,0.0%,372.4883,1,0,0,345.91,4357.71,
256,4096,2048,512,512,10,ActivationType.Silu,torch.bfloat16,torch.float8_e4m3fn,torch.float8_e4m3fn,QuantType.per_1x128,1,0,64,0,505.2102,_ZN5aiter46fmoe_bf16_blockscaleFp8_g1u1_vs_ps_silu_64x256E,0.0%,0.0,,0.0%,505.2102,1,0,0,510.08,3237.82,
256,8192,2048,512,512,10,ActivationType.Silu,torch.bfloat16,torch.float8_e4m3fn,torch.float8_e4m3fn,QuantType.per_1x128,1,0,64,0,805.5653,_ZN5aiter46fmoe_bf16_blockscaleFp8_g1u1_vs_ps_silu_64x256E,0.0%,0.0,,0.0%,805.5653,1,0,0,639.79,2061.84,
256,16384,2048,512,512,10,ActivationType.Silu,torch.bfloat16,torch.float8_e4m3fn,torch.float8_e4m3fn,QuantType.per_1x128,1,0,64,0,1413.1393999999998,_ZN5aiter46fmoe_bf16_blockscaleFp8_g1u1_vs_ps_silu_64x256E,0.0%,0.0,,0.0%,1413.1394,1,0,0,729.43,1210.97,
256,32768,2048,512,512,10,ActivationType.Silu,torch.bfloat16,torch.float8_e4m3fn,torch.float8_e4m3fn,QuantType.per_1x128,1,0,64,0,2838.5694000000003,_ZN5aiter46fmoe_bf16_blockscaleFp8_g1u1_vs_ps_silu_64x256E,0.0%,0.0,,0.0%,2838.5694,1,0,0,726.28,638.33,
256,1,2048,512,513,11,ActivationType.Silu,torch.bfloat16,torch.float8_e4m3fn,torch.float8_e4m3fn,QuantType.per_1x128,1,0,1,0,27.4921,_ZN5aiter50fmoe_bf16_blockscaleFp8_g1u1_flat_vs_ps_silu_1x128E,0.0%,0.0,,0.0%,27.4921,1,1,1,2.52,58699.21,
256,2,2048,512,513,11,ActivationType.Silu,torch.bfloat16,torch.float8_e4m3fn,torch.float8_e4m3fn,QuantType.per_1x128,1,0,1,0,28.9102,_ZN5aiter50fmoe_bf16_blockscaleFp8_g1u1_flat_vs_ps_silu_1x128E,0.0%,0.0,,0.0%,28.9102,1,1,1,4.79,55820.12,
256,4,2048,512,513,11,ActivationType.Silu,torch.bfloat16,torch.float8_e4m3fn,torch.float8_e4m3fn,QuantType.per_1x128,1,0,1,0,35.3982,_ZN5aiter50fmoe_bf16_blockscaleFp8_g1u1_flat_vs_ps_silu_1x128E,0.0%,0.0,,0.0%,35.3982,1,1,1,7.82,45589.41,
256,8,2048,512,513,11,ActivationType.Silu,torch.bfloat16,torch.float8_e4m3fn,torch.float8_e4m3fn,QuantType.per_1x128,1,0,1,0,61.1902,_ZN5aiter50fmoe_bf16_blockscaleFp8_g1u1_flat_vs_ps_silu_1x256E,0.0%,0.0,,0.0%,61.1902,1,1,1,9.05,26373.63,
256,16,2048,512,513,11,ActivationType.Silu,torch.bfloat16,torch.float8_e4m3fn,torch.float8_e4m3fn,QuantType.per_1x128,1,0,1,0,101.2311,_ZN5aiter50fmoe_bf16_blockscaleFp8_g1u1_flat_vs_ps_silu_1x128E,0.0%,0.0,,0.0%,101.2311,1,1,1,10.94,15942.3,
256,32,2048,512,513,11,ActivationType.Silu,torch.bfloat16,torch.float8_e4m3fn,torch.float8_e4m3fn,QuantType.per_1x128,1,0,16,0,154.5108,_ZN5aiter48fmoe_bf16_blockscaleBf16_g1u1_vs_pf2_silu_16x128E,0.0%,0.0,,0.0%,154.5108,1,1,0,14.33,10445.58,
256,64,2048,512,513,11,ActivationType.Silu,torch.bfloat16,torch.float8_e4m3fn,torch.float8_e4m3fn,QuantType.per_1x128,1,0,16,0,238.9452,_ZN5aiter48fmoe_bf16_blockscaleBf16_g1u1_vs_pf2_silu_16x128E,0.0%,0.0,,0.0%,238.9452,1,1,0,18.54,6755.32,
256,128,2048,512,513,11,ActivationType.Silu,torch.bfloat16,torch.float8_e4m3fn,torch.float8_e4m3fn,QuantType.per_1x128,1,0,32,0,289.1809,_ZN5aiter47fmoe_bf16_blockscaleBf16_g1u1_vs_ps_silu_32x256E,0.0%,0.0,,0.0%,289.1809,1,1,0,30.63,5583.17,
256,256,2048,512,513,11,ActivationType.Silu,torch.bfloat16,torch.float8_e4m3fn,torch.float8_e4m3fn,QuantType.per_1x128,1,0,32,0,311.9059,_ZN5aiter47fmoe_bf16_blockscaleBf16_g1u1_vs_ps_silu_32x256E,0.0%,0.0,,0.0%,311.9059,1,1,0,56.8,5178.91,
256,512,2048,512,513,11,ActivationType.Silu,torch.bfloat16,torch.float8_e4m3fn,torch.float8_e4m3fn,QuantType.per_1x128,1,0,64,0,335.03310000000005,_ZN5aiter46fmoe_bf16_blockscaleFp8_g1u1_vs_ps_silu_64x256E,0.0%,0.0,,0.0%,335.0331,1,0,0,105.76,4826.1,
256,1024,2048,512,513,11,ActivationType.Silu,torch.bfloat16,torch.float8_e4m3fn,torch.float8_e4m3fn,QuantType.per_1x128,1,0,32,0,237.0659,moe_ck2stages_gemm1_256x32x128x128_1x4_MulABScaleExpertWeightA8W8blkscale_v1_Nswizzle0_Quant4_MulRoutedWeight0_silu_F8_F8_B16,0.1%,114.5848,moe_ck2stages_gemm2_256x32x128x128_1x4_MulABScaleExpertWeightA8W8blkscale_v1_Nswizzle0_Quant4_MulRoutedWeight1_F8_F8_B16,18.6%,351.6507,0,0,0,201.53,4606.99,
256,2048,2048,512,513,11,ActivationType.Silu,torch.bfloat16,torch.float8_e4m3fn,torch.float8_e4m3fn,QuantType.per_1x128,1,0,64,0,391.577,_ZN5aiter46fmoe_bf16_blockscaleFp8_g1u1_vs_ps_silu_64x256E,0.0%,0.0,,0.0%,391.577,1,0,0,361.96,4153.31,
256,4096,2048,512,513,11,ActivationType.Silu,torch.bfloat16,torch.float8_e4m3fn,torch.float8_e4m3fn,QuantType.per_1x128,1,0,64,0,525.8252,_ZN5aiter46fmoe_bf16_blockscaleFp8_g1u1_vs_ps_silu_64x256E,0.0%,0.0,,0.0%,525.8252,1,0,0,539.09,3116.86,
256,8192,2048,512,513,11,ActivationType.Silu,torch.bfloat16,torch.float8_e4m3fn,torch.float8_e4m3fn,QuantType.per_1x128,1,0,64,0,841.7926,_ZN5aiter46fmoe_bf16_blockscaleFp8_g1u1_vs_ps_silu_64x256E,0.0%,0.0,,0.0%,841.7926,1,0,0,673.49,1976.84,
256,16384,2048,512,513,11,ActivationType.Silu,torch.bfloat16,torch.float8_e4m3fn,torch.float8_e4m3fn,QuantType.per_1x128,1,0,64,0,1560.9346,_ZN5aiter46fmoe_bf16_blockscaleFp8_g1u1_vs_ps_silu_64x256E,0.0%,0.0,,0.0%,1560.9346,1,0,0,726.41,1098.33,
256,32768,2048,512,513,11,ActivationType.Silu,torch.bfloat16,torch.float8_e4m3fn,torch.float8_e4m3fn,QuantType.per_1x128,1,0,64,0,3046.2769000000003,_ZN5aiter46fmoe_bf16_blockscaleFp8_g1u1_vs_ps_silu_64x256E,0.0%,0.0,,0.0%,3046.2769,1,0,0,744.43,595.84,
256,1,2048,256,512,10,ActivationType.Silu,torch.bfloat16,torch.float8_e4m3fn,torch.float8_e4m3fn,QuantType.per_1x128,1,0,1,0,26.62,_ZN5aiter50fmoe_bf16_blockscaleFp8_g1u1_flat_vs_ps_silu_1x128E,0.0%,0.0,,0.0%,26.62,1,1,1,1.18,30252.16,
256,2,2048,256,512,10,ActivationType.Silu,torch.bfloat16,torch.float8_e4m3fn,torch.float8_e4m3fn,QuantType.per_1x128,1,0,1,0,27.1586,_ZN5aiter50fmoe_bf16_blockscaleFp8_g1u1_flat_vs_ps_silu_1x128E,0.0%,0.0,,0.0%,27.1586,1,1,1,2.32,29652.44,
256,4,2048,256,512,10,ActivationType.Silu,torch.bfloat16,torch.float8_e4m3fn,torch.float8_e4m3fn,QuantType.per_1x128,1,0,1,0,28.8257,_ZN5aiter50fmoe_bf16_blockscaleFp8_g1u1_flat_vs_ps_silu_1x128E,0.0%,0.0,,0.0%,28.8257,1,1,1,4.37,27937.95,
256,8,2048,256,512,10,ActivationType.Silu,torch.bfloat16,torch.float8_e4m3fn,torch.float8_e4m3fn,QuantType.per_1x128,1,0,1,0,33.7141,_ZN5aiter50fmoe_bf16_blockscaleFp8_g1u1_flat_vs_ps_silu_1x128E,0.0%,0.0,,0.0%,33.7141,1,1,1,7.46,23887.8,
256,16,2048,256,512,10,ActivationType.Silu,torch.bfloat16,torch.float8_e4m3fn,torch.float8_e4m3fn,QuantType.per_1x128,1,0,1,0,56.1743,_ZN5aiter50fmoe_bf16_blockscaleFp8_g1u1_flat_vs_ps_silu_1x256E,0.0%,0.0,,0.0%,56.1743,1,1,1,8.96,14337.6,
256,32,2048,256,512,10,ActivationType.Silu,torch.bfloat16,torch.float8_e4m3fn,torch.float8_e4m3fn,QuantType.per_1x128,1,0,16,0,83.60409999999999,_ZN5aiter48fmoe_bf16_blockscaleBf16_g1u1_vs_pf2_silu_16x128E,0.0%,0.0,,0.0%,83.6041,1,1,0,12.04,9634.73,
256,64,2048,256,512,10,ActivationType.Silu,torch.bfloat16,torch.float8_e4m3fn,torch.float8_e4m3fn,QuantType.per_1x128,1,0,16,0,119.1587,_ZN5aiter48fmoe_bf16_blockscaleBf16_g1u1_vs_pf2_silu_16x128E,0.0%,0.0,,0.0%,119.1587,1,1,0,16.9,6761.57,
256,128,2048,256,512,10,ActivationType.Silu,torch.bfloat16,torch.float8_e4m3fn,torch.float8_e4m3fn,QuantType.per_1x128,1,0,32,0,151.8478,_ZN5aiter47fmoe_bf16_blockscaleBf16_g1u1_vs_ps_silu_32x256E,0.0%,0.0,,0.0%,151.8478,1,1,0,26.52,5308.56,
256,256,2048,256,512,10,ActivationType.Silu,torch.bfloat16,torch.float8_e4m3fn,torch.float8_e4m3fn,QuantType.per_1x128,1,0,32,0,162.7186,_ZN5aiter47fmoe_bf16_blockscaleBf16_g1u1_vs_ps_silu_32x256E,0.0%,0.0,,0.0%,162.7186,1,1,0,49.49,4958.74,
256,512,2048,256,512,10,ActivationType.Silu,torch.bfloat16,torch.float8_e4m3fn,torch.float8_e4m3fn,QuantType.per_1x128,1,0,32,0,168.5483,_ZN5aiter47fmoe_bf16_blockscaleBf16_g1u1_vs_ps_silu_32x256E,0.0%,0.0,,0.0%,168.5483,1,1,0,95.56,4796.56,
256,1024,2048,256,512,10,ActivationType.Silu,torch.bfloat16,torch.float8_e4m3fn,torch.float8_e4m3fn,QuantType.per_1x128,1,0,64,0,178.069,_ZN5aiter46fmoe_bf16_blockscaleFp8_g1u1_vs_ps_silu_64x256E,0.0%,0.0,,0.0%,178.069,1,0,0,180.9,4557.77,
256,2048,2048,256,512,10,ActivationType.Silu,torch.bfloat16,torch.float8_e4m3fn,torch.float8_e4m3fn,QuantType.per_1x128,1,0,64,0,203.9386,_ZN5aiter46fmoe_bf16_blockscaleFp8_g1u1_vs_ps_silu_64x256E,0.0%,0.0,,0.0%,203.9386,1,0,0,315.9,4010.47,
256,4096,2048,256,512,10,ActivationType.Silu,torch.bfloat16,torch.float8_e4m3fn,torch.float8_e4m3fn,QuantType.per_1x128,1,0,64,0,277.0538,_ZN5aiter46fmoe_bf16_blockscaleFp8_g1u1_vs_ps_silu_64x256E,0.0%,0.0,,0.0%,277.0538,1,0,0,465.07,2997.51,
256,8192,2048,256,512,10,ActivationType.Silu,torch.bfloat16,torch.float8_e4m3fn,torch.float8_e4m3fn,QuantType.per_1x128,1,0,64,0,441.5098,_ZN5aiter46fmoe_bf16_blockscaleFp8_g1u1_vs_ps_silu_64x256E,0.0%,0.0,,0.0%,441.5098,1,0,0,583.67,1937.98,
256,16384,2048,256,512,10,ActivationType.Silu,torch.bfloat16,torch.float8_e4m3fn,torch.float8_e4m3fn,QuantType.per_1x128,1,0,64,0,771.1184000000001,_ZN5aiter46fmoe_bf16_blockscaleFp8_g1u1_vs_ps_silu_64x256E,0.0%,0.0,,0.0%,771.1184,1,0,0,668.37,1174.88,
256,32768,2048,256,512,10,ActivationType.Silu,torch.bfloat16,torch.float8_e4m3fn,torch.float8_e4m3fn,QuantType.per_1x128,1,0,64,0,1485.6767,_ZN5aiter46fmoe_bf16_blockscaleFp8_g1u1_vs_ps_silu_64x256E,0.0%,0.0,,0.0%,1485.6767,1,0,0,693.82,677.56,
256,1,2048,256,513,11,ActivationType.Silu,torch.bfloat16,torch.float8_e4m3fn,torch.float8_e4m3fn,QuantType.per_1x128,1,0,1,0,26.6884,_ZN5aiter50fmoe_bf16_blockscaleFp8_g1u1_flat_vs_ps_silu_1x128E,0.0%,0.0,,0.0%,26.6884,1,1,1,1.3,30233.56,
256,2,2048,256,513,11,ActivationType.Silu,torch.bfloat16,torch.float8_e4m3fn,torch.float8_e4m3fn,QuantType.per_1x128,1,0,1,0,27.349,_ZN5aiter50fmoe_bf16_blockscaleFp8_g1u1_flat_vs_ps_silu_1x128E,0.0%,0.0,,0.0%,27.349,1,1,1,2.53,29503.51,
256,4,2048,256,513,11,ActivationType.Silu,torch.bfloat16,torch.float8_e4m3fn,torch.float8_e4m3fn,QuantType.per_1x128,1,0,1,0,30.4037,_ZN5aiter50fmoe_bf16_blockscaleFp8_g1u1_flat_vs_ps_silu_1x128E,0.0%,0.0,,0.0%,30.4037,1,1,1,4.55,26539.66,
256,8,2048,256,513,11,ActivationType.Silu,torch.bfloat16,torch.float8_e4m3fn,torch.float8_e4m3fn,QuantType.per_1x128,1,0,1,0,33.4465,_ZN5aiter50fmoe_bf16_blockscaleFp8_g1u1_flat_vs_ps_silu_1x128E,0.0%,0.0,,0.0%,33.4465,1,1,1,8.28,24125.94,
256,16,2048,256,513,11,ActivationType.Silu,torch.bfloat16,torch.float8_e4m3fn,torch.float8_e4m3fn,QuantType.per_1x128,1,0,1,0,56.0512,_ZN5aiter50fmoe_bf16_blockscaleFp8_g1u1_flat_vs_ps_silu_1x256E,0.0%,0.0,,0.0%,56.0512,1,1,1,9.88,14397.15,
256,32,2048,256,513,11,ActivationType.Silu,torch.bfloat16,torch.float8_e4m3fn,torch.float8_e4m3fn,QuantType.per_1x128,1,0,16,0,87.7993,_ZN5aiter48fmoe_bf16_blockscaleBf16_g1u1_vs_pf2_silu_16x128E,0.0%,0.0,,0.0%,87.7993,1,1,0,12.61,9192.28,
256,64,2048,256,513,11,ActivationType.Silu,torch.bfloat16,torch.float8_e4m3fn,torch.float8_e4m3fn,QuantType.per_1x128,1,0,16,0,123.2536,_ZN5aiter48fmoe_bf16_blockscaleBf16_g1u1_vs_pf2_silu_16x128E,0.0%,0.0,,0.0%,123.2536,1,1,0,17.97,6549.69,
256,128,2048,256,513,11,ActivationType.Silu,torch.bfloat16,torch.float8_e4m3fn,torch.float8_e4m3fn,QuantType.per_1x128,1,0,32,0,155.94299999999998,_ZN5aiter47fmoe_bf16_blockscaleBf16_g1u1_vs_ps_silu_32x256E,0.0%,0.0,,0.0%,155.943,1,1,0,28.4,5179.24,
256,256,2048,256,513,11,ActivationType.Silu,torch.bfloat16,torch.float8_e4m3fn,torch.float8_e4m3fn,QuantType.per_1x128,1,0,64,0,165.84929999999997,_ZN5aiter46fmoe_bf16_blockscaleFp8_g1u1_vs_ps_silu_64x256E,0.0%,0.0,,0.0%,165.8493,1,0,0,53.41,4874.62,
256,512,2048,256,513,11,ActivationType.Silu,torch.bfloat16,torch.float8_e4m3fn,torch.float8_e4m3fn,QuantType.per_1x128,1,0,32,0,185.5078,_ZN5aiter47fmoe_bf16_blockscaleBf16_g1u1_vs_ps_silu_32x256E,0.0%,0.0,,0.0%,185.5078,1,1,0,95.5,4366.53,
256,1024,2048,256,513,11,ActivationType.Silu,torch.bfloat16,torch.float8_e4m3fn,torch.float8_e4m3fn,QuantType.per_1x128,1,0,32,0,137.7959,moe_ck2stages_gemm1_256x32x128x128_1x4_MulABScaleExpertWeightA8W8blkscale_v1_Nswizzle0_Quant4_MulRoutedWeight0_silu_F8_F8_B16,0.1%,62.4797,moe_ck2stages_gemm2_256x32x128x128_1x4_MulABScaleExpertWeightA8W8blkscale_v1_Nswizzle0_Quant4_MulRoutedWeight1_F8_F8_B16,18.5%,200.2756,0,0,0,176.92,4060.26,
256,2048,2048,256,513,11,ActivationType.Silu,torch.bfloat16,torch.float8_e4m3fn,torch.float8_e4m3fn,QuantType.per_1x128,1,0,64,0,230.7001,_ZN5aiter46fmoe_bf16_blockscaleFp8_g1u1_vs_ps_silu_64x256E,0.0%,0.0,,0.0%,230.7001,1,0,0,307.18,3552.07,
256,4096,2048,256,513,11,ActivationType.Silu,torch.bfloat16,torch.float8_e4m3fn,torch.float8_e4m3fn,QuantType.per_1x128,1,0,64,0,285.9494,_ZN5aiter46fmoe_bf16_blockscaleFp8_g1u1_vs_ps_silu_64x256E,0.0%,0.0,,0.0%,285.9494,1,0,0,495.66,2909.76,
256,8192,2048,256,513,11,ActivationType.Silu,torch.bfloat16,torch.float8_e4m3fn,torch.float8_e4m3fn,QuantType.per_1x128,1,0,64,0,483.46359999999993,_ZN5aiter46fmoe_bf16_blockscaleFp8_g1u1_vs_ps_silu_64x256E,0.0%,0.0,,0.0%,483.4636,1,0,0,586.33,1773.06,
256,16384,2048,256,513,11,ActivationType.Silu,torch.bfloat16,torch.float8_e4m3fn,torch.float8_e4m3fn,QuantType.per_1x128,1,0,64,0,860.8629,_ZN5aiter46fmoe_bf16_blockscaleFp8_g1u1_vs_ps_silu_64x256E,0.0%,0.0,,0.0%,860.8629,1,0,0,658.57,1054.22,
256,32768,2048,256,513,11,ActivationType.Silu,torch.bfloat16,torch.float8_e4m3fn,torch.float8_e4m3fn,QuantType.per_1x128,1,0,64,0,1638.654,_ZN5aiter46fmoe_bf16_blockscaleFp8_g1u1_vs_ps_silu_64x256E,0.0%,0.0,,0.0%,1638.654,1,0,0,691.95,615.26,
256,1,2048,128,512,10,ActivationType.Silu,torch.bfloat16,torch.float8_e4m3fn,torch.float8_e4m3fn,QuantType.per_1x128,1,0,1,0,26.7075,_ZN5aiter50fmoe_bf16_blockscaleFp8_g1u1_flat_vs_ps_silu_1x128E,0.0%,0.0,,0.0%,26.7075,1,1,1,0.59,15076.64,
256,2,2048,128,512,10,ActivationType.Silu,torch.bfloat16,torch.float8_e4m3fn,torch.float8_e4m3fn,QuantType.per_1x128,1,0,1,0,26.5841,_ZN5aiter50fmoe_bf16_blockscaleFp8_g1u1_flat_vs_ps_silu_1x128E,0.0%,0.0,,0.0%,26.5841,1,1,1,1.18,15146.85,
256,4,2048,128,512,10,ActivationType.Silu,torch.bfloat16,torch.float8_e4m3fn,torch.float8_e4m3fn,QuantType.per_1x128,1,0,1,0,27.026,_ZN5aiter50fmoe_bf16_blockscaleFp8_g1u1_flat_vs_ps_silu_1x128E,0.0%,0.0,,0.0%,27.026,1,1,1,2.33,14899.64,
256,8,2048,128,512,10,ActivationType.Silu,torch.bfloat16,torch.float8_e4m3fn,torch.float8_e4m3fn,QuantType.per_1x128,1,0,1,0,28.717,_ZN5aiter50fmoe_bf16_blockscaleFp8_g1u1_flat_vs_ps_silu_1x128E,0.0%,0.0,,0.0%,28.717,1,1,1,4.38,14023.13,
256,16,2048,128,512,10,ActivationType.Silu,torch.bfloat16,torch.float8_e4m3fn,torch.float8_e4m3fn,QuantType.per_1x128,1,0,1,0,32.9797,_ZN5aiter50fmoe_bf16_blockscaleFp8_g1u1_flat_vs_ps_silu_1x128E,0.0%,0.0,,0.0%,32.9797,1,1,1,7.63,12212.1,
256,32,2048,128,512,10,ActivationType.Silu,torch.bfloat16,torch.float8_e4m3fn,torch.float8_e4m3fn,QuantType.per_1x128,1,0,16,0,50.1887,_ZN5aiter48fmoe_bf16_blockscaleBf16_g1u1_vs_pf2_silu_16x128E,0.0%,0.0,,0.0%,50.1887,1,1,0,10.03,8026.7,
256,64,2048,128,512,10,ActivationType.Silu,torch.bfloat16,torch.float8_e4m3fn,torch.float8_e4m3fn,QuantType.per_1x128,1,0,16,0,73.0696,_ZN5aiter48fmoe_bf16_blockscaleBf16_g1u1_vs_pf2_silu_16x128E,0.0%,0.0,,0.0%,73.0696,1,1,0,13.78,5515.92,
256,128,2048,128,512,10,ActivationType.Silu,torch.bfloat16,torch.float8_e4m3fn,torch.float8_e4m3fn,QuantType.per_1x128,1,0,16,0,82.04249999999999,_ZN5aiter48fmoe_bf16_blockscaleBf16_g1u1_vs_pf2_silu_16x128E,0.0%,0.0,,0.0%,82.0425,1,1,0,24.54,4917.45,
256,256,2048,128,512,10,ActivationType.Silu,torch.bfloat16,torch.float8_e4m3fn,torch.float8_e4m3fn,QuantType.per_1x128,1,0,64,0,100.4074,_ZN5aiter46fmoe_bf16_blockscaleFp8_g1u1_vs_ps_silu_64x128E,0.0%,0.0,,0.0%,100.4074,1,0,0,40.1,4025.86,
256,512,2048,128,512,10,ActivationType.Silu,torch.bfloat16,torch.float8_e4m3fn,torch.float8_e4m3fn,QuantType.per_1x128,1,0,64,0,103.65850000000002,_ZN5aiter46fmoe_bf16_blockscaleFp8_g1u1_vs_ps_silu_64x128E,0.0%,0.0,,0.0%,103.6585,1,0,0,77.69,3914.77,
256,1024,2048,128,512,10,ActivationType.Silu,torch.bfloat16,torch.float8_e4m3fn,torch.float8_e4m3fn,QuantType.per_1x128,1,0,64,0,111.659,_ZN5aiter46fmoe_bf16_blockscaleFp8_g1u1_vs_ps_silu_64x128E,0.0%,0.0,,0.0%,111.659,1,0,0,144.24,3662.44,
256,2048,2048,128,512,10,ActivationType.Silu,torch.bfloat16,torch.float8_e4m3fn,torch.float8_e4m3fn,QuantType.per_1x128,1,0,64,0,149.2051,_ZN5aiter46fmoe_bf16_blockscaleFp8_g1u1_vs_ps_silu_64x128E,0.0%,0.0,,0.0%,149.2051,1,0,0,215.89,2782.99,
256,4096,2048,128,512,10,ActivationType.Silu,torch.bfloat16,torch.float8_e4m3fn,torch.float8_e4m3fn,QuantType.per_1x128,1,0,64,0,229.594,_ZN5aiter46fmoe_bf16_blockscaleFp8_g1u1_vs_ps_silu_64x128E,0.0%,0.0,,0.0%,229.594,1,0,0,280.6,1863.37,
256,8192,2048,128,512,10,ActivationType.Silu,torch.bfloat16,torch.float8_e4m3fn,torch.float8_e4m3fn,QuantType.per_1x128,1,0,64,0,376.8393,_ZN5aiter46fmoe_bf16_blockscaleFp8_g1u1_vs_ps_silu_64x128E,0.0%,0.0,,0.0%,376.8393,1,0,0,341.92,1202.06,
256,16384,2048,128,512,10,ActivationType.Silu,torch.bfloat16,torch.float8_e4m3fn,torch.float8_e4m3fn,QuantType.per_1x128,1,0,64,0,672.8837,_ZN5aiter46fmoe_bf16_blockscaleFp8_g1u1_vs_ps_silu_64x128E,0.0%,0.0,,0.0%,672.8837,1,0,0,382.98,748.0,
256,32768,2048,128,512,10,ActivationType.Silu,torch.bfloat16,torch.float8_e4m3fn,torch.float8_e4m3fn,QuantType.per_1x128,1,0,64,0,1269.5914,_ZN5aiter46fmoe_bf16_blockscaleFp8_g1u1_vs_ps_silu_64x128E,0.0%,0.0,,0.0%,1269.5914,1,0,0,405.95,475.73,
256,1,2048,128,513,11,ActivationType.Silu,torch.bfloat16,torch.float8_e4m3fn,torch.float8_e4m3fn,QuantType.per_1x128,1,0,1,0,26.6511,_ZN5aiter50fmoe_bf16_blockscaleFp8_g1u1_flat_vs_ps_silu_1x128E,0.0%,0.0,,0.0%,26.6511,1,1,1,0.65,15138.05,
256,2,2048,128,513,11,ActivationType.Silu,torch.bfloat16,torch.float8_e4m3fn,torch.float8_e4m3fn,QuantType.per_1x128,1,0,1,0,26.8867,_ZN5aiter50fmoe_bf16_blockscaleFp8_g1u1_flat_vs_ps_silu_1x128E,0.0%,0.0,,0.0%,26.8867,1,1,1,1.29,15005.63,
256,4,2048,128,513,11,ActivationType.Silu,torch.bfloat16,torch.float8_e4m3fn,torch.float8_e4m3fn,QuantType.per_1x128,1,0,1,0,27.1986,_ZN5aiter50fmoe_bf16_blockscaleFp8_g1u1_flat_vs_ps_silu_1x128E,0.0%,0.0,,0.0%,27.1986,1,1,1,2.54,14834.01,
256,8,2048,128,513,11,ActivationType.Silu,torch.bfloat16,torch.float8_e4m3fn,torch.float8_e4m3fn,QuantType.per_1x128,1,0,1,0,29.0758,_ZN5aiter50fmoe_bf16_blockscaleFp8_g1u1_flat_vs_ps_silu_1x128E,0.0%,0.0,,0.0%,29.0758,1,1,1,4.76,13877.13,
256,16,2048,128,513,11,ActivationType.Silu,torch.bfloat16,torch.float8_e4m3fn,torch.float8_e4m3fn,QuantType.per_1x128,1,0,1,0,32.7991,_ZN5aiter50fmoe_bf16_blockscaleFp8_g1u1_flat_vs_ps_silu_1x128E,0.0%,0.0,,0.0%,32.7991,1,1,1,8.44,12303.32,
256,32,2048,128,513,11,ActivationType.Silu,torch.bfloat16,torch.float8_e4m3fn,torch.float8_e4m3fn,QuantType.per_1x128,1,0,16,0,53.3192,_ZN5aiter48fmoe_bf16_blockscaleBf16_g1u1_vs_pf2_silu_16x128E,0.0%,0.0,,0.0%,53.3192,1,1,0,10.38,7570.19,
256,64,2048,128,513,11,ActivationType.Silu,torch.bfloat16,torch.float8_e4m3fn,torch.float8_e4m3fn,QuantType.per_1x128,1,0,16,0,73.3323,_ZN5aiter48fmoe_bf16_blockscaleBf16_g1u1_vs_pf2_silu_16x128E,0.0%,0.0,,0.0%,73.3323,1,1,0,15.1,5506.89,
256,128,2048,128,513,11,ActivationType.Silu,torch.bfloat16,torch.float8_e4m3fn,torch.float8_e4m3fn,QuantType.per_1x128,1,0,32,0,86.07509999999999,_ZN5aiter47fmoe_bf16_blockscaleBf16_g1u1_vs_ps_silu_32x128E,0.0%,0.0,,0.0%,86.0751,1,1,0,25.73,4696.2,
256,256,2048,128,513,11,ActivationType.Silu,torch.bfloat16,torch.float8_e4m3fn,torch.float8_e4m3fn,QuantType.per_1x128,1,0,64,0,101.0339,_ZN5aiter46fmoe_bf16_blockscaleFp8_g1u1_vs_ps_silu_64x128E,0.0%,0.0,,0.0%,101.0339,1,0,0,43.84,4008.68,
256,512,2048,128,513,11,ActivationType.Silu,torch.bfloat16,torch.float8_e4m3fn,torch.float8_e4m3fn,QuantType.per_1x128,1,0,32,0,113.7043,_ZN5aiter47fmoe_bf16_blockscaleBf16_g1u1_vs_ps_silu_32x128E,0.0%,0.0,,0.0%,113.7043,1,1,0,77.91,3575.81,
256,1024,2048,128,513,11,ActivationType.Silu,torch.bfloat16,torch.float8_e4m3fn,torch.float8_e4m3fn,QuantType.per_1x128,1,0,64,0,136.0427,_ZN5aiter46fmoe_bf16_blockscaleFp8_g1u1_vs_ps_silu_64x128E,0.0%,0.0,,0.0%,136.0427,1,0,0,130.23,3011.78,
256,2048,2048,128,513,11,ActivationType.Silu,torch.bfloat16,torch.float8_e4m3fn,torch.float8_e4m3fn,QuantType.per_1x128,1,0,64,0,176.0458,_ZN5aiter46fmoe_bf16_blockscaleFp8_g1u1_vs_ps_silu_64x128E,0.0%,0.0,,0.0%,176.0458,1,0,0,201.27,2363.15,
256,4096,2048,128,513,11,ActivationType.Silu,torch.bfloat16,torch.float8_e4m3fn,torch.float8_e4m3fn,QuantType.per_1x128,1,0,64,0,235.976,_ZN5aiter46fmoe_bf16_blockscaleFp8_g1u1_vs_ps_silu_64x128E,0.0%,0.0,,0.0%,235.976,1,0,0,300.31,1816.31,
256,8192,2048,128,513,11,ActivationType.Silu,torch.bfloat16,torch.float8_e4m3fn,torch.float8_e4m3fn,QuantType.per_1x128,1,0,64,0,412.9404,_ZN5aiter46fmoe_bf16_blockscaleFp8_g1u1_vs_ps_silu_64x128E,0.0%,0.0,,0.0%,412.9404,1,0,0,343.23,1098.88,
256,16384,2048,128,513,11,ActivationType.Silu,torch.bfloat16,torch.float8_e4m3fn,torch.float8_e4m3fn,QuantType.per_1x128,1,0,64,0,751.4859000000001,_ZN5aiter46fmoe_bf16_blockscaleFp8_g1u1_vs_ps_silu_64x128E,0.0%,0.0,,0.0%,751.4859,1,0,0,377.21,670.81,
256,32768,2048,128,513,11,ActivationType.Silu,torch.bfloat16,torch.float8_e4m3fn,torch.float8_e4m3fn,QuantType.per_1x128,1,0,64,0,1411.4038,_ZN5aiter46fmoe_bf16_blockscaleFp8_g1u1_vs_ps_silu_64x128E,0.0%,0.0,,0.0%,1411.4038,1,0,0,401.68,428.49,
